title,date,main,section,url
'매우매우 신중한 검토중'이라는 삼성전자가 보는 메모리 반도체 시황 전망은 [MK위클리반도체],2021.10.30. 오전 11:02,"역대 최대 분기 매출에도..'메모리 고점론' 우려삼성 ""과거와 같은 메모리 사이클 변동 없을 것""



공장 천장에는 삼성 로고가 적힌 자동 반송기가 생산라인 전체를 훑으며 지나다니고 있다./사진 제공=삼성전자 [MK위클리반도체] 삼성전자가 3분기 실적 발표 컨퍼런스콜을 지난 28일 개최했습니다. 메모리 반도체 고점론이 이어지는 가운데 삼성전자가 어떤 메시지를 내놓을지 관심이 모아졌는데요. 삼성전자는 내년도 전망을 묻는 애널리스트들의 질문에 ""불확실성이 크다""면서도 시장의 우려가 과도하다는 입장을 조심스럽게 내비쳤습니다.삼성전자는 3분기 매출 73조9800억원, 영업이익 15조8200억원을 기록했습니다. 분기 기준 역대 최대 매출인 동시에 영업이익도 역대 두 번째로 높은 실적인데요. 영업이익률 역시 전분기 대비 1.6%포인트 개선된 21.4%를 기록했습니다.3분기에도 역시 메모리 반도체 사업이 삼성전자의 실적을 이끌었습니다. 특히 서버용 D램 반도체 수요가 크게 증가하면서 역대 최대 분기 D램 출하량을 기록했다고 삼성전자는 밝히기도 했습니다. 



 삼성전자가 3분기 반도체 부문에서 거둔 매출액은 26조4100억원에 달합니다. 영업이익은 10조600억원이었습니다. 이는 반도체 슈퍼사이클이 끝난 2018년 이후 최대 분기 매출이며 10조원 이상 영업이익을 기록한 것도 2018년 3분기 이후 처음입니다. 전 분기 대비로는 매출액과 영업이익이 각각 16.1%, 44.9% 증가한 수치입니다.최근 코로나19 사태로 호황을 맞았던 정보기술(IT) 제품에 대한 수요가 위축되는 가운데 전 세계적인 부품 공급망 이슈까지 발생하며 메모리 반도체 시장의 불확실성은 확대되고 있습니다. 이런 상황에서도 서버용 제품을 중심으로 삼성전자의 3분기 메모리반도체 사업은 성장을 이어간 것인데요. 삼성전자는 서버용 제품이 수요를 이끈 가운데, 부품 공급 이슈로 생산에 차질을 빚은 모바일용 D램 사업에선 주요 완성품 업체들이 신제품을 출시하며 수요가 회복됐다고 설명했습니다.그러나 이 같은 호실적에도 메모리 시장에 대한 시장의 불안감은 이어지는 상황입니다. 이날 실적 발표 후에도 삼성전자의 주가는 큰 변동 없이 7만원대 초반대를 이어갔습니다.이러한 우려의 원인은 주요국을 중심으로 '위드 코로나' 체제가 자리를 잡으면서 상반기 수요를 이끌었던 '펜트업 수요'가 약해지고 있다는 시각 때문인데요. 또 공급망 이슈에 따른 부품수급 불안과 이에 따른 완성품 제조 고객사들의 수요 불확실성도 사업 전망을 어둡게 하는 요인입니다.과거 메모리 반도체 시장은 가격 상승 주기가 약 2년간 이어지는 양상을 보였습니다. 그러나 올해 상반기까지 장밋빛이었던 메모리 반도체 시황 전망은 최근 들어 급격히 반전된 모양새입니다. 1년이 채 되지 않는 기간에 메모리 반도체 가격이 보합세로 돌아서면서 역대 최단기간 슈퍼사이클이 될 것이란 관측까지도 나오는 실정입니다.특히 일부 시장조사기관에서는 내년 D램 가격이 최대 20%까지 떨어질 것이란 전망까지 제기되는 분위기입니다. 트렌드포스는 최근 보고서를 통해 내년 D램 시장의 평균판매가격(ASP)이 올해보다 15%에서 많게는 20%까지 하락할 것이라고 전망하기도 했습니다.이날 삼성전자 역시 ""코로나19의 일상 회복 영향, 부품 수급 및 원자재 가격 상승 등 거시적 요인으로 내년 메모리 시황에 대한 불확실성이 아주 높다""며 ""부품 수급 차질과 이에 따른 세트 생산 차질이 예상보다 장기화하고 있다""고 밝혔습니다. 이어 ""고객사마다 메모리반도체 시황 전망에 시각차가 존재해 가격 협상 난도가 올라가고 있다""며 ""불확실성이 커 회사 차원의 내년 메모리반도체 시황 전망을 밝히지 않겠다""고도 덧붙였습니다.이처럼 삼성전자가 내년 반도체 사업 전망에 대해 다소 보수적인 입장을 취하자 애널리스트들의 추가 질의가 이어졌습니다. 이날 컨퍼런스콜의 질의응답 세션에서 국내외 증권사 애널리스트들은 반도체 시황에 대한 다양한 질문을 쏟아냈습니다. UBS는 메모리반도체의 최근 시황과 전망을 고려했을 때 내년 D램과 낸드플래시 분야에 대한 투자 계획을 조정할 계획이 있는지를 물었는데요. 이에 대해 삼성전자는 불확실성이 크다는 기존 입장을 되풀이하면서도 ""투자 규모나 방향에 대해선 내부적으로 '매우 매우' 신중한 검토를 바탕으로 결정할 예정""이라고 거듭 강조했습니다. 또 ""아직 내년 경영 계획도 확정되지 않은 상태라 내년 설비투자 관련해서는 방향성 제시 정도도 어려운 상태""라고 했습니다.다만 이날 삼성전자가 이처럼 소극적인 답변만을 내놓은 것은 아닙니다. 메모리반도체 시황에 대한 우려가 과도한 수준이라는 시각도 함께 드러냈는데요. 2018년 호황기 이후 업황이 급락했던 때보다 이번 하락 주기는 짧게 끝나 내년 하반기부터는 다시 회복세로 돌아설 것이라는 전망도 내놨습니다.내년 메모리반도체 수요의 위험과 기회 요인은 무엇이냐는 HSBC의 질의에 삼성전자는 ""과거 대비 메모리 사이클의 주기와 변동 폭이 줄어들었다""며 ""현재 재고 상황도 낮기 때문에 크게 우려할만한 시장 상황은 아니라고 본다""고 강조했습니다.이에 KB증권에서 메모리 사이클이 더 이상 과거와 같지 않을 것으로 보는 근거가 무엇이냐고 물었는데요. 이에 대해 삼성전자는 메모리 사이클의 변동 폭과 주기가 줄어든 3가지 원인을 제시하기도 했습니다. 먼저 과거 PC 중심이었던 메모리반도체 응용처가 다양한 분야로 확대되면서 포트폴리오가 다양해져 경기 변동 가능성도 줄어들었다는 것인데요. 이어 메모리반도체 공정 자체가 미세화하고 난이도가 올라가면서 과거와 달리 급격한 생산량 증가 달성이 어려워졌고, 반도체 공급 부족이 전망돼도 생산량을 끌어올리는 데 제약이 따른다는 설명입니다. 실제 현재 메모리반도체 공급업체들의 재고 수준은 지난 분기에 이어 낮은 수준으로 유지되고 있다는 점을 근거로 들었습니다. 이 밖에도 2018년 호황 이후 극심한 공급 과잉을 겪으면서 수요자와 공급자 모두 시장 전반의 건전성 확보 필요성을 학습했기 때문에 과거와 같은 급격한 시황 변동은 없을 것이란 분석도 덧붙였습니다.한편 삼성전자는 파운드리 등 비메모리 분야에 대한 적극적인 투자를 집행하겠다는 계획도 밝혔습니다. 삼성전자는 ""3나노 파운드리 공정 개발이 내년 상반기 목표로 정상 진행 중""이라며 ""2세대 GAA 공정에서 획기적 성능 개선을 통해 삼성의 리더십이 확대될 것으로 기대한다""고 설명했습니다. 이어 ""고객 수요를 최대한 충족하기 위해 전례 없는 투자를 계획 중""이라며 ""2017년 대비 올해 기준으로 생산능력이 약 1.8배 확대됐으며 오는 2026년까지 약 3배 가까이 생산능력을 확대할 것""이라고도 밝혔습니다.",105,https://n.news.naver.com/mnews/article/009/0004871995?sid=103
"""페이스북, 개인정보 유출 피해자에 30만원씩 지급하라""",2021.10.29. 오후 2:17,"[서울경제] 페이스북이 ‘메타’로 사명을 변경하자마자 개인정보 유출로 국내에서 5,000만 원 상당의 손해배상금을 물어내야 할 위기에 처했다.



29일 김일환 개인정보 분쟁조정위원회 위원장과 참석 위원들이 개인정보 분쟁조정위원회 제41차 전체회의를 진행하고 있다./사진 제공=개인정보보호위원회29일 개인정보보호위원회 산하 분쟁조정위원회는 제41차 전체회의를 열고 동의없이 회원정보를 제 3자에게 제공한 페이스북에 ▲신청인 181명에게 인당 30만 원의 손해배상금을 지급하고 ▲신청인들의 개인정보를 제공받은 제3자의 신상과 제공된 개인정보 유형 및 내역을 신청인들이 열람할 수 있도록 하라고 권고했다.이 조정안은 신청인들의 증빙자료와 개인정보위의 과거 결정례에 기반해 심의·의결한 것이다. 앞서 개인정보위는 지난해 11월 지난 6년간 최소 330만명의 개인정보를 당사자 동의없이 다른 사업자에게 넘긴 페이스북에 67억원의 과징금과 6,600만원의 과태료를 부과했다. 또 지난 8월에는 이용자 동의를 받지 않고 개인을 식별할 수 있는 얼굴인식 정보를 생성·이용한 행위에 대해 64억 4,000만원의 과징금을 부과했다.분쟁조정위는 페이스북이 1만 개 이상의 제3자 앱 개발자가 대한민국 페이스북 이용자 개인정보를 제공받을 수 있도록 서비스를 운영하면서 이런 사실을 페이스북 이용자에게 알리거나 동의를 받지 않은 것으로 판단했다. 특히 신청인의 개인정보 열람 청구 등을 메타 측이 거부하는 점 등을 미뤄볼 때 동의 없이 개인정보가 제3자에게 제공됐을 개연성이 크다고 봤다.분쟁위는 이날 의결된 조정안을 즉시 양 당사자에 통지할 예정이다. 양 당사자 모두 조정안을 수락하면 조정이 성립돼 개인정보 보호법 등 관련 규정에 따라 재판상 화해와 같은 효력이 발생하지만, 당사자 중 하나라도 조정안을 수락하지 않으면 ‘조정불성립’으로 종결된다.김일환 개인정보 분쟁조정위원장은 “거대 플랫폼 기업으로의 개인정보 편중이 심화되는 상황에서 상대적 약자인 정보주체의 권리를 보호하기 위해 도입된 집단분쟁조정 제도의 취지를 고려해 조정 결정을 내렸다”며 “글로벌 기업인 페이스북이 개인정보 보호에 대한 책무를 이행하기 위해서라도 조정안을 수락하기를 기대한다”고 했다.페이스북 관계자는 조정안 수락 여부에 대해 “답변할 수 없다”며 별다른 입장을 내놓지 않았다.",105,https://n.news.naver.com/mnews/article/011/0003979194?sid=103
[인사] 국가과학기술연구회,2021.10.30. 오전 9:11,◇국가과학기술연구회 △대외협력부장 석재진 △융합기획부장 강헌수 △연구행정혁신부장 최지현 △인재개발팀장 유민영 △사업관리팀장 조진규 △사업기획팀장 이창희 △연구단사업팀장 김진애 △기업지원팀장 박병호 △제도기획팀장 박현철 △재정전략팀장 구선모 △인사팀장 김소정 △총무회계팀장 김현태 △행정혁신팀장 이화정 △조직문화팀장 서영민,105,https://n.news.naver.com/mnews/article/584/0000016537?sid=103
"'코로나19 백신의 힘' SK바이오사이언스, 3Q 영업익 1,000억 돌파",2021.10.29. 오후 6:28,"SK바이오사이언스의 안동L하우스 백신 센터./사진 제공=SK바이오사이언스[서울경제] SK바이오사이언스(302440)가 창사 이래 처음으로 분기 영업이익 1,000억 원을 넘겼다. 해외 제약사의 코로나19 백신을 위탁생산하면서 3분기 연속 매출, 영업이익 신기록 행진을 지속 중이다.SK바이오사이언스는 3분기 영업이익이 1,004억 원으로 전년동기 대비 175.3% 늘었다고 29일 밝혔다. 매출액은 2,208억 원으로 전년보다 123.8% 증가했고 당기순이익은 764억원으로 137.3% 증가했다. 매출과 영업이익 모두 창사 이래 최대 규모다. 매출 대비 영업이익률은 45.5%에 달했다. SK바이오사이언스는 지난 2018년 7월 SK케미칼(285130)이 백신사업을 분할해 설립한 백신 전문 독립법인이다. 지난 3월 유가증권시장에 입성했다. SK케미칼이 최대주주로서 2분기 말 기준 지분 68.4%를 보유한다. SK바이오사이언스는 코로나19 백신의 위탁생산(CMO) 관련 매출이 본격적으로 반영되면서 3분기 연속 매출, 영업이익 신기록을 갈아치우고 있다. 이 회사의 3분기 누계 영업이익은 2,203억원으로 전년보다 722.0% 확대했다. 매출액은 4,781억 원으로 전년보다 201.5% 뛰었다. SK바이오사이언스는 작년 7월 해외 제약사 아스트라제네카와 CMO 계약을 체결했다. 경북 안동에 위치한 L하우스에서 아스트라제네카가 개발 중인 코로나19 백신 원액과 완제품을 생산하는 계약이다. 아스트라제네카의 코로나19 백신은 상업화를 완료하고 해외 각국에서 접종이 시작되면서 SK바이오사이언스의 주요 수익원으로 자리를 잡았다. SK바이오사이언스는 현재 아스트라제네카의 코로나19 백신 원액 및 완제품의 국내외 출하를 지속 중이다. SK바이오사이언스는 4분기까지 아스트라제네카 백신의 상업화 물량을 지속적으로 공급하면서 안정적 매출을 확보할 것으로 내다봤다. 작년 8월에는 보건복지부, 노바백스와도 코로나19 백신 공급 관련 3자계약을 체결하면서 생산에 착수했다. 올해 4월부터 국내 4,000만 도즈 공급에 대비한 시생산에 돌입하면서 3분기 매출에 일부 반영됐다. SK바이오사이언스는 현재 노바백스와 내년 공급 계약을 논의하고 있다. 노바백스의 코로나19 백신이 전 세계 각국 정부의 승인을 획득하면 SK바이오사이언스가 각국의 공급을 담당하면서 본격적으로 수익창출에 기여할 것이란 전망이다. SK바이오사이언스는 코로나19 백신의 자체 개발에도 박차를 가하고 있다. 식품의약품안전처로부터 코로나19 백신후보물질의 3상 임상 시험 계획을 승인받고 8월 말부터 피험자 투약을 시작했다. 내년 상반기 중간 결과를 발표하고, 허가신청에 돌입한다는 목표다. 변이 바이러스에 대응하기 위한 다가백신과 부스터샷 관련 연구개발도 진행하고 있다.",105,https://n.news.naver.com/mnews/article/011/0003979347?sid=103
중국 신규 게임 허가 100일째 중단,2021.10.30. 오전 11:57,"""2018년 이후 최장 기간""""중국 정부 청소년 게임 중독 막기 위한 차원""중국 당국이 신규 게임 허가를 중단한 지 100일이 지났고, 이는 2018년 이후 최장기간이라고 홍콩 사우스차이나모닝포스트(SCMP)가 30일 보도했다.중국 게임 부문을 총괄하는 국가신문출판서(NPPA)의 신규 게임 판호(版號·중국 내 게임 서비스 허가) 중단이 전날로 100일에 이르렀다. 이는 2018년 9개월간 중단된 이후 가장 긴 기간이라고 SCMP는 전했다.SCMP는 ""게임업계에서는 중국 정부가 청소년의 게임 중독을 막기 위해 나서면서 신규 게임 허가가 중단됐다고 말한다""며 ""일각에서는 이달 초 국경절 연휴 이후 게임 허가가 재개될 것이라고 관측했지만 이는 잘못된 것으로 밝혀졌다""고 보도했다.신문은 ""업계에서는 게임 허가가 재개돼도 허가를 받는 게임의 수가 적을 것으로 전망한다""며 ""3개월간 허가가 중단되면서 (경영이 어려워진) 일부 게임회사들은 회사 면허를 비슷한 게임을 만드는 다른 업체에 불법 매각하고 있다고 중국 매체가 보도했다""고 전하기도 했다.2019년 5월 이후 국가신문출판서가 매월 80∼100건의 새로운 게임을 허가했고, 지난 6월과 7월에는 각각 86개와 87개의 게임이 승인됐다.중국은 올해 들어 게임 규제를 강화하고 있다.관영 경제참고보는 지난 8월 '정신적 아편'이라는 극단적 표현까지 쓰며 텐센트 등 게임 관련 기업들을 비난하는 기사를 실어 파문을 일으켰고, 이후 당국은 미성년자의 게임 시간을 주말과 휴일에 한정해 주당 3시간으로 제한했다.지난달 중국 게임회사 213곳은 정치적으로 해롭거나 역사적 허무주의로 여겨지는 콘텐츠 등 당국이 못마땅해하는 콘텐츠를 자체적으로 금지하겠다는 서약에 서명하기도 했다.  



중국 베이징의 인터넷 카페에서 게임을 즐기는 사람들(연합뉴스)",105,https://n.news.naver.com/mnews/article/029/0002703545?sid=103
[5시 날씨] 내일 아침도 쌀쌀해요…낮에는 기온 올라가,2023.10.21. 오후 5:08,"오늘 아침은  올가을 들어 가장  쌀쌀했습니다. 설악산에는  첫눈이 내렸는데요. 한낮에도  예년 이맘때보다  서늘한 날씨가 이어졌습니다. 서울의 경우  낮 기온이 16.6도에  머물렀습니다. 내일 아침까지는  오늘과 비슷한 추위가 예상되지만, 낮에는 다시 기온이 오르겠습니다. 내일 새벽부터 아침 사이  중부지방과 호남 지역에서  짙은 안개를  조심해야겠고요. 밤사이 기온이 내려가  내륙 곳곳에 서리가 내리거나  물이 어는 곳이 있겠습니다. 현재 강원 동해안은  건조주의보가 내려졌습니다. 내일은 강원 영동과 경북 동부에서 바람도 강하게 불겠습니다. 내일 아침 기온은  서울과 대구가 6도, 대전은 4도 등  내륙 지역은 5도 안팎으로  오늘과 비슷하겠습니다. 낮 기온은  서울과 대전, 광주가 19도, 대구 20도로  오늘보다 1~3도 정도  높겠습니다. 바다의 물결은 동해 먼바다에서  최고 3m로 높겠습니다. 당분간  별다른 비 예보 없이  완연한 가을 날씨가  이어지겠습니다. 지금까지  날씨 정보 전해드렸습니다. 최현미 기상캐스터/그래픽:최다애/진행:정다은■ 제보하기▷ 전화 : 02-781-1234, 4444▷ 이메일 : kbs1234@kbs.co.kr▷ 카카오톡 : 'KBS제보' 검색, 채널 추가▷ 네이버, 유튜브에서 KBS뉴스를 구독해주세요!",105,https://n.news.naver.com/mnews/article/056/0011586502?sid=103
