title,date,main,section,url
원전·병원 배출 방사성 요오드 제거 효율 280배 높인 소재 개발,2022.05.26. 오후 12:01,"왼쪽은 원자력발전소 배기가스 속 다량의 수분과 방사성 메틸요오드화합물이 동시에 유출되는 것을 나타낸 그림이다. 이번 연구에서 개발한 극소수성 금속유기 골격체(MOF) 흡착제의 사용으로 수분 접근은 차단되고 메틸요오드화합물이 선택적으로 포획되어 배기가스가 정화됐다. 화학공학 저널 제공.   국내 연구진이 원자력발전소의 배기가스나 산업체, 병원 등에서 유출될 수 있는 방사성 요오드를 효과적으로 제거할 수 있는 기술을 개발했다.    한국화학연구원은 황영규 화학공정연구본부 본부장과 홍도영 책임연구원 연구팀이 현재 쓰이고 있는 탄소계 흡착제에 비해 방사성 요오드 제거 성능을 280배 높일 수 있는 화학소재의 표면처리 기술을 개발했다고 26일 밝혔다.    방사성 요오드가 호흡기로 침투하는 것을 효과적으로 막아주는 기술로 방사성 가스 배출을 통한 2차 환경오염을 줄이고 방사성 폐기물의 부피를 최소화하는 데 도움을 줄 것으로 기대된다.    방사성 폐기물은 원전뿐만 아니라 병원이나 산업체, 연구기관에서 방사성 물질을 이용하는 과정에서 나온다. 생성된 방사성 폐기물은 반드시 200리터 드럼 안에 포장해 폐기물 처분장으로 보내진다. 이 과정에서 드럼 당 1500만원의 처분 비용이 발생한다. 방사성 폐기물의 부피를 줄이고 처분 비용을 최대한 낮추는 것은 원자력 관련 산업의 주요 관심사다.    특히 원전에서 발생하는 기체 방사성 폐기물 중 방사성 요오드는 다량의 수분과 함께 극미량이 배출되지만 농도가 낮아도 인체에 축적돼 갑상선암 등을 유발한다. 최근 환경 규제가 강화되면서 방사성 요오드 제거 성능을 높인 흡착제가 요구되고 있지만 ppb(10억분율) 수준의 극미량의 요오드 화합물을 제거하는 데 기술적 한계가 있었다.    최근에는 차세대 다공성 소재로 가스 포획과 저장, 분리, 약물전달 등 광범위한 분야에 적용되는 ‘금속유기골격체(MOF)’를 독성 가스 제거용 소재로 활용하고 있지만 수분에 취약하고 외부에 습기가 많을 때 제거 성능이 급격히 감소한다는 한계가 있다.    연구팀은 MOF의 단점을 극복하기 위해 원전 필터 혹은 방독면 등에 사용 가능한 MOF 표면을 특정 화합물로 처리해 메틸요오드화합물에 대해 고습 환경에서도 매우 높은 제거율로 포획할 수 있는 화학소재를 개발했다. 메틸요오드화합물은 기체 방사성 물질 중 주요 누출 핵종이다.    연구팀은 메틸요오드화합물을 고습 환경에서 포획하기 위해 MOF 흡착제에 물을 싫어하는 성질을 부여해 수분 접근을 차단했다. 또 방사성 요오드와 상호작용하는 ‘은’을 활용해 메틸요오드화합물을 0.01ppb 이하로 포획했다. 후속 연구에서는 비싼 ‘은’을 대신해 활성물질인 아민류를 이용해 메틸요오드화합물을 더욱 강하게 포획, 99.999% 제거 성능을 약 11이 동안 유지한다는 사실을 확인했다. 이는 기존 상용 활성탄 흡착제 대비 280배 높은 제거량이다.    이미혜 화학연 원장은 “이번에 개발한 기술은 방사성 물질 유출에 대한 위험으로부터 국민의 안전을 지킬 수 있다는 의미가 있다”며 “소형모듈원자로(SMR) 등 차세대 원전 기술 보급에 안전핀 역할을 할 수 있을 것으로 기대된다”고 말했다.",105,https://n.news.naver.com/mnews/article/584/0000019113?sid=103
"삼성전자서비스, '가전서비스 콜센터 품질' 13년 연속 우수기업 선정",2022.05.26. 오전 7:55,"수어 상담 도입, 웹접근성 품질인증 획득… 고객 맞춤형 서비스 제공삼성전자서비스가 '2022년 한국산업의 서비스품질지수(KSQI)'에서 가전서비스 부문 13년 연속 우수콜센터로 선정됐다.한국능률협회컨설팅(KMAC)이 주관하는 KSQI는 54개 산업, 329개 기업의 콜센터에 대해 전문가 조사를 실시해 고객이 체감하는 서비스 품질 수준을 평가하는 제도다.삼성전자서비스는 올해 조사에서 가전서비스 부문 평가 기업 중 가장 높은 점수를 획득하며 13년 연속 우수콜센터에 선정됐다. 특히, 상담사 연결의 신속성, 정확하고 전문성 있는 안내 등에서 높은 점수를 받았다.이는 고객의 니즈를 면밀히 분석해 고객 맞춤형 특화서비스를 도입하고 비대면 상담 시스템을 지속 강화해온 결과다.



삼성전자서비스 KSQI 한국의 우수콜센터 선정 기념 촬영(사진=삼성전자)삼성전자서비스는 농아인(청각·언어 장애인) 고객이 편리하게 제품 상담을 받을 수 있도록 올해 3월 '수어 상담 서비스'를 도입했다. 전담 수어 통역사가 영상을 통해 수준 높은 수어 상담 서비스를 제공하며, 농아인 고객이 서비스센터를 방문하거나 출장서비스를 신청했을 때도 이용 가능하다.모든 고객이 홈페이지를 편리하게 이용할 수 있도록 '웹접근성 품질인증'도 획득해 운영 중이다. 시각장애 고객이 홈페이지에 접속하면 메뉴, 화면 내용 등을 음성으로 읽어주며, 색약 고객을 위한 색상 대비(고대비) 기능도 제공한다.고객이 엔지니어 출장서비스를 신청하지 않고도 편리하게 가전제품 상담을 받을 수 있도록 '비대면 상담'도 지속 강화하고 있다.삼성만의 차별화된 기술로 개발한 '생활가전 원격진단 시스템(HRM)'을 이용해 상담사가 고객이 사용하는 제품의 상태를 원격으로 점검 후 즉각 조치해 준다.제품의 상태를 비대면으로 신속·정확하게 확인하기 위해 '보이는 원격상담'도 운영 중이다. 상담사가 고객 휴대폰의 카메라로 제품을 보며 상담을 진행한다. 고객은 제품의 상태를 어렵게 설명하지 않고도 정확한 진단과 조치를 받을 수 있다.'인공지능 채팅 상담 챗봇'으로 서비스센터 위치, 예상 수리비 등 원하는 정보를 24시간 편리하게 확인할 수도 있다. AI 딥러닝 기술이 적용된 챗봇은 고객의 질문 의도까지 예측해 최적의 정보를 제공한다. 올해 월평균 이용자도 작년 동기 대비 약 50% 이상 증가했다.삼성전자서비스는 소비자상담사, 심리상담사 등 전문자격 취득도 지원하며 상담 품질 핵심요소인 상담사 기술역량 강화에도 힘쓰고 있다.삼성전자서비스 관계자는 ""최근 고객 상담 트렌드를 보면 단순 문의나 정보검색은 홈페이지, 챗봇 등 디지털 채널로 이동하고, 콜센터는 전문 기술 상담과 문제 해결에 집중하는 추세""라며 ""비대면 상담 시스템을 지속 강화하고 고객 맞춤형 특화서비스를 도입해 최상의 상담 서비스를 제공하겠다""고 말했다.",105,https://n.news.naver.com/mnews/article/092/0002257905?sid=103
,,,105,https://n.news.naver.com/mnews/article/236/0000224100?sid=103
[인터뷰] 멘로시큐리티 “보안에 ‘절대’란 없다? 우리는 절대 안 뚫린다”,2022.05.26. 오후 1:31,"왼쪽부터 김성래 멘로시큐리티 코리아 지사장, 라우 분 펭(Lau Boon Peng) APAC 기술총괄[디지털데일리 이종현기자] “흔히들 보안에는 100% 막는다는 것은 불가능하다고 말합니다. 하지만 멘로시큐리티는 100% 완벽한 보안 환경을 제공한다고 자신합니다. 만일 우리 보안 플랫폼이 뚫려 악성코드에 감염된다면 고객에게 100만달러를 지급하는 프로그램을 진행 중입니다.”(멘로시큐리티 지사장)   김성래 멘로시큐리티 지사장은 <디지털데일리>와의 인터뷰에서 ‘100% 보안’을 자신했다. 격리(Isolation) 기반의 보안 플랫폼을 통해 엔드포인트 및 원 서버의 악성코드 감염을 원천 차단한다는 설명이다.   김 지사장은 “업무 환경이 변화함에 따라 사이버 위협의 형태 역시 변하는 중이다. 과거에는 파일 기반으로 위협이 이뤄졌는데 최근에는 사용자 대부분이 웹브라우저를 통해 일하면서 웹브라우저나 이메일을 통한 공격이 전체의 90% 이상을 차지한다”고 말했다.   ◆전통적인 보안으로는 최근 위협 대응 불가··· 신기술 필요   전통적인 보안 솔루션의 경우 악성코드의 샘플을 수집해 패턴이나 시그니처를 만들고, 이후 유입되는 코드를 해당 패턴이나 시그니처와 대조하며 치료·차단한다. 일종의 블랙리스트 방식인데, 이를 기반으로 한 기존 백신, 방화벽, 엔드포인트 보안 등 솔루션은 최근 위협을 막기에는 적합하지 않다는 것이 그의 주장이다.   김 지사장은 “최근 공격은 기존 보안 방식을 우회하는 고회피성 지능형 위협(HEAT, Highly Evasive Adaptive Threat)의 사례가 늘고 있다. 제로데이 취약점이나 공급망을 이용하는 공격이 그 예다. 데이터가 수집된 이후 대응이 가능하기 때문에 최초 감염은 막기 어렵다”며 “설령 탐지에 성공하더라도 하루에도 수백, 수천개의 알람(Alert)에 일일이 대응하지 못하는 경우가 부지기수”라고 말했다.   이어서 “이와 같은 위협에 대응하기 위해서는 공격 당한 뒤 대응하는 탐지 기반의 보안이 아니라, 아예 처음부터 공격을 받지 않도록 하는 기술이 필요하다. 멘로 시큐리티가 제공하는 웹격리 솔루션이 대표적”이라고 부연했다.   멘로시큐리티가 무기로 내세운 것은 클라우드 보안웹게이트웨이(SWG) 기반의 원격 웹브라우저 격리(RBI) 솔루션이다. 모든 것을 신뢰하지 않는다는 제로 트러스트(Zero Trust) 원칙에 부합하는 기능을 제공한다.   작동 방식은 간단하다. 멘로시큐리티의 RBI 솔루션을 적용한 PC에서 웹브라우저를 켜면 자동으로 적용된다. 가령 사용자가 웹브라우저를 통해 특정 사이트에 접속하면, 멘로시큐리티의 클라우드에서 해당 사이트에 접속한 뒤 코든 콘텐츠를 실행한 후 렌더링한 소스코드를 사용자 PC로 전송하는 방식이다.    이는 백그라운드에서 운영되는 만큼 사용자는 별다른 조치 없이 안전한 환경에서 웹브라우저를 이용할 수 있게 된다. 100% 보안이 가능한 이유다. 



멘로시큐리티 솔루션의 작동 원리  ◆“웹격리 기술, 국내 망분리 완화 조치의 대안 될 것”   멘로시큐리티는 국내·외 레퍼런스를 쌓아가는 중이다. 정보기술(IT) 서비스 기업 비와이라이트(By Light)와 함께 미국 국방정보시스템국(DISA)의 5년 1억9890만달러의 클라우드 기반 인터넷 격리(CBII) 사업을 수주했다. 350만명에게 동시에 원격 웹격리 기술을 적용했다. 김 지사장은 보안의 최대 문제점으로 지적되는 편의성 저하도 없다고 강조했다.   기술에 대한 자신감을 바탕으로, 멘로시큐리티는 자사 솔루션이 파훼돼 악성코드에 감염된다면 100만달러를 지급하는 프로그램을 운영하고 있다. 김 지사장은 “아직까지 멘로시큐리티가 비용을 지불한 적은 없다. 100% 보안이 깨지지 않은 것”이라고 피력했다.   멘로시큐리티 코리아는 국내 금융권 망분리 완화 움직임에 발맞춰 금융권을 중심으로 국내 사업을 확대한다는 계획이다.   금융권은 2011년, 2013년 등 대규모 보안 사고 이후 내부망와 외부망용 PC를 각각 두는 물리적 망분리가 의무화됐다. 하지만 지난 4월 금융위원회가 물리적 망분리 완화를 골자로 하는 망분리 규제 개선을 발표함에 따라 대체 솔루션의 수요가 급증하는 중이다.    물리적 망분리가 축소되는 배경에는 업무 효율성 증가라는 요인도 있다. 김 지사장은 “요즘 세대 개발자들은 기업에 물리적 망분리가 적용돼 있어 사내에서 인터넷을 못 한다고 하면, 아예 입사를 안 한다. 우수 인재 확보가 어렵고, 이는 기업 경쟁력 저하로 이어진다”고 꼬집었다.   멘로시큐리티의 솔루션을 통해 이용자는 일반 인터넷을 사용하는 것과 같은 환경에서 보안에 대한 걱정 없이 업무를 수행할 수 있다. 물리적 망분리 대비 업무 편의성은 대폭 늘어난다.    또 물리적 망분리를 한 상태에서 망연계 솔루션을 사용하는 등, 완벽한 물리적 망분리가 이뤄지지 않는 IT 환경 대비 보안성 역시 강화할 수 있다고 전했다. 김 지사장이 “웹격리가 물리적 망분리 자체를 대체할 수는 없다”면서도 “그러나 보안성 강화라는 목적만 두고 본다면, 웹격리는 물리적 망분리 이상의 보안을 제공할 수 있다”고 말하는 배경이다.   이어서 “오늘날 보안은 샌드박스의 등장 전과 후로 나뉜다고 해도 과언이 아니다. 샌드박스라는 기술이 등장하기 전에는 시그니처 없이 위협을 분석한다는 개념이 없었다. 하지만 샌드박스가 등장함에 따라 200일은 걸리던 탐지가 70일로 줄었다”며 “격리(Isolation)는 샌드박스처럼 시장을 혁신할 새로운 기술이다. 금융권을 중심으로 국내 기업·기관에도 100% 보안을 제공하는 멘로시큐리티의 보안 솔루션을 제공하겠다”고 부연했다.",105,https://n.news.naver.com/mnews/article/138/0002125451?sid=103
네이버 증권에서 미국 증시 실시간으로 본다,2022.05.26. 오전 9:49,"네이버가 실시간 미국 증시를 조회할 수 있는 서비스를 시작했다고 26일 발표했다.이번 서비스는 나스닥과 라이선스 제휴 체결에 따른 것으로, 회원가입이나 앱 설치, 계좌 개설 등을 하지 않아도 누구나 사용할 수 있다. 네이버 모바일 검색창이나 네이버 증권 모바일 화면에서 미국 주요 거래소에 상장된 모든 종목의 실시간 시세를 볼 수 있다.미국 정규장이 열린 시간 외에 프리마켓과 애프터마켓에서 거래되는 주식의 실시간 시세도 확인할 수 있다. 미국 증시 정규장은 시차로 인해 국내에서는 늦은 밤에 열리는데, 사용자는 국내 낮에도 네이버 증권의 종목별 화면에서 미국 증시 정규장 외에서 거래되는 실시간 시세와 함께 관련 뉴스, 리서치 정보를 동시에 확인할 수 있다.네이버는 2020년 8월에 모바일에서 해외 주식 서비스를 시작한 이후 15분 지연된 시세 정보를 제공해왔다. 최근 나스닥과 라이선스 계약을 추가로 체결해 실시간 미국 증시 시세 서비스를 열게 됐다. 현재는 모바일에서만 이용할 수 있고, 추후 PC로 확대할 예정이다.최수연 네이버 대표는 “나스닥과의 협력으로 네이버 사용자 누구나 쉽게 실시간 미국 증시 정보에 접근할 수 있게 됐다”며 “네이버 증권은 월 1000만 명의 사용자들이 이용하는 증권 정보 플랫폼이자, 일간 약 15만 건의 토론 게시물이 활발히 생성되는 최대의 투자 커뮤니티인 만큼, 사용자들이 정확하고 유용한 투자 정보를 쉽게 접할 수 있는 서비스를 만들어가겠다”고 말했다.",105,https://n.news.naver.com/mnews/article/015/0004703867?sid=103
"박지웅 대표, 10년간 매년 회사 하나씩 세운 '창업의 달인'",2022.05.26. 오후 5:53,"Zoom In 박지웅 패스트트랙아시아 대표""30대 창업, 인생 최고의 결정""11개사 기업가치만 8000억 달해""특이하고 끈기 있는 창업자 성공거인과 맞짱 뜰 '또라이' 찾을 것""



“인생에서 가장 잘한 일이요? 30대 초반에 회사를 뛰쳐나와 창업한 겁니다.”박지웅 패스트트랙아시아 대표(사진)는 최근 한국경제신문과의 인터뷰에서 망설임 없이 답했다. 박 대표는 스톤브릿지캐피탈에서 심사역으로 일하다 2012년 노정석 비팩토리 대표, 신현성 차이코퍼레이션 대표와 의기투합해 패스트트랙아시아를 세웠다. 박 대표는 “만약 더 늦은 나이에 회사를 나왔다면 이렇게까지 열심히 일하지 못했을 것”이라며 “창업은 아주 흥미로운 인생 경험”이라고 했다.패스트트랙아시아는 사업 아이디어를 발굴한 뒤 회사를 직접 설립하고 운영하는 일명 ‘컴퍼니 빌더’다. 벤처투자사인 패스트벤처스를 비롯해 공유오피스 업체인 패스트파이브, 성인 교육기업 데이원컴퍼니 등을 자회사로 두고 있다. 박 대표가 창업 후 10년 동안 세운 회사만 11개다. 기업 가치를 다 합치면 8000억원에 달하는 것으로 평가된다.박 대표는 함께 성장할 신규 창업팀을 공개적으로 찾고 있다고 했다. 패스트벤처스의 액셀러레이팅 프로그램인 ‘FV START’를 통해서다. 박 대표는 “선발팀엔 파격적인 조건으로 돈, 공간, 사람을 제공한다”고 했다. 공유오피스인 패스트파이브의 사무공간을 제공하고, 경력직 개발자와 기획자 등 필요한 인력을 연결한다. 박 대표는 과거 우아한형제들(배달의민족)과 블루홀(현재 크래프톤), 티몬 등에 발 빠르게 투자한 경험이 있다.박 대표는 “‘또라이’ 같은 창업자를 찾는다”고 강조했다. 그는 “두루 잘하는 사람보다는 대단히 특이한 사람이 좋다”고 설명했다. 이어 “그동안 잘된 회사도, 안된 회사도 많이 봤는데 잘 안된 곳은 무색무취하면서 팔방미인 같은 창업자가 많았지만 크게 성공한 회사의 창업자는 굉장히 특이하다 싶은 분이었다”고 덧붙였다.창업자에게 가장 필요한 게 뭐냐는 질문에 그는 ‘끈기’라고 답했다. “포기만 안 하면 높은 확률로 성공한다”는 것이다.사업 아이템으론 ‘명백하게 큰 시장’을 노리는 것을 선호한다고 했다. 박 대표는 “정면 승부로 경쟁하는 걸 좋아한다”며 “소비 지출이 큰 시장이 있는데 자투리 시장을 목표로 하는 건 매력이 없다”고 말했다. 많은 창업자가 큰 시장은 이미 큰 기업이 있어서 못 들어가겠다고 하지만 큰 기업도 다 약점이 있다고 설명했다. 박 대표는 “그 약점을 후벼파서 거인과 그냥 맞짱을 뜨겠다고 도전하는 팀, 그런 큰 플레이어들을 쓰러뜨릴 만한 전략을 가진 팀을 높이 평가한다”고 강조했다.박 대표는 패스트벤처스를 한국에서 가장 큰 벤처캐피털(VC)로 키우고 싶다고 했다. 그는 “지난 10년간 벤처투자 시장은 가장 빠르게 성장했고 VC가 투자한 회사만 유니콘이 되는 게 아니라 VC도 유니콘이 될 수 있다”고 주장했다. 박 대표는 “한국에 VC가 200여 곳 있지만 이 중 ‘1등이 누구냐’는 질문에 대답하긴 어렵다”며 “차별화한 전략을 실행해 패스트벤처스를 압도적인 1등으로 만들겠다”고 말했다.",105,https://n.news.naver.com/mnews/article/015/0004704291?sid=103
"김영식 의원 ""'구글 인앱결제' 국회 청문회 열자…민주당에 제안""",2022.05.26. 오후 3:56,"""구글 인앱결제로 소비자·생태계 피해…과방위에 구글 소환계획 밝혀""김영식 의원(국민의힘)이 구글 인앱결제와 관련한 국회 청문회 개최를 제안했다.



김영식 의원이 구글 인앱결제와 관련해 국회 청문회 개최를 제안했다. 사진은 국회 과학기술정보방송통신위원회 소속 김영식 의원(국민의힘)[사진=김영식 의원실]26일 김영식 의원은 ""국회 후반기 원 구성 마무리 즉시 과학기술정보방송통신위원회(과방위) 상임위원회를 개최해 앱 마켓 생태계 관계자들을 소환해 문제 해결을 위한 청문회 자리를 마련""하고 ""국내법을 무시하고 독과점을 통해 수수료를 강제 징수하는 구글에 대한 강력한 대안을 마련하겠다""라고 밝혔다.앞서 구글은 내달 1일부터 자사의 수수료 최대 30% 상당의 인앱결제 시스템 혹은 수수료 최대 26%의 인앱결제 제3자 결제 방식을 도입하지 않는 앱에 대해 삭제 조치하겠다고 발표했다. 사실상 인앱결제 정책의 확대 적용이다.김영식 의원은 ""구글의 인앱결제 강제화로 증가한 수수료만큼 콘텐츠 요금 인상이 불가피한 상황에서, 방송통신위원회(방통위)의 단기적 조치와 함께 장기적 안목에서 국내 경쟁 앱 마켓을 육성하는 방안을 고민할 시점""라고 말했다.지난 4월 김영식 의원은 구글이 인앱결제 강제 정책으로 올 한해에만 최대 4천100억원의 수수료 수익을 추가로 가져갈 것으로 조사·발표한 바 있다.김 의원은 ""지난 4월, 구글의 인앱결제 강제에 따른 피해규모를 공개하면서 증가한 수수료만큼 국내 소비자와 콘텐츠사업자에게 전가될 것이라 예측한 대로 흘러가고 있다""라며, ""금번 원스토어 수수료 인하를 계기로 정부 및 국내 콘텐츠 업계, 앱마켓 업계 모두 거대 플랫폼의 횡포에 왜곡되어 가는 콘텐츠 생태계 정상화에 노력을 기울여야 한다""라고 말했다.국내 토종 원스토어는 지난 25일 온라인동영상서비스(OTT), 음원 스트리밍 등 미디어콘텐츠 앱에 기본 수수료 10%를 적용하고, 거래액 규모와 구독 비중에 따라 수수료를 최저 6%까지 적용한다고 밝혔다.한편 김영식 의원 측 관계자는 ""구글 행태에 민주당에 '구글 청문회'를 열자고 제안했다""라고 말했다.",105,https://n.news.naver.com/mnews/article/031/0000675050?sid=103
"구글 스트리트뷰, 출시 15년 맞아 과거로 시간여행 기능 선보여",2022.05.26. 오후 2:28,"2007년부터 같은 장소를 시간순으로 볼 수 있어



구글 스트리뷰를 통해 뉴욕의 관광명소인 허드슨 야드의 베슬 전망대 건설 과정을 한눈에 볼 수 있다 / 구글 홈페이지 캡처구글이 실제 거리 사진을 보여주는 앱 ‘스트리트뷰’ 출시 15년을 기념해 지난 15년간의 시간 여행을 할 수 있는 새로운 서비스를 선보였다. 스트리트뷰 앱을 통해 2007년 스트리뷰 출시 이후 기억하고 싶은 장소의 사진을 시간순으로 볼 수 있다. 사용자는 구글 맵에서 원하는 장소를 누른 후 ‘추가 날짜 보기’를 선택하면 그 위치의 과거 이미지를 모두 볼 수 있다. 과거 사진을 표시하는 기능은 PC 버전에서는 2014년부터 사용 가능했지만, 모바일 앱에서도 서비스를 제공하는 것은 이번이 처음이다.구글은 또 내년부터 새로운 카메라를 배치해 접근하기 어려운 장소에서 더 많은 고품질 이미지를 찍을 것이라고 밝혔다. 새로운 카메라는 무게가 6.8㎏에 그쳐 운반이 쉽고, 라이다와 같은 최첨단 부품을 장착할 수 있게 모듈식으로 설계했다.



구글이 새로 개발한 스트리트뷰 촬영 카메라 / 구글 홈페이지 캡처구글은 지난 15년간 2,200억 개 이상 스트리트뷰 이미지를 축적하고 지구를 400번 이상 도는 거리인 1,600만 ㎞의 거리를 지도화했으며, 지금도 계속 데이터를 축적하고 있다. 이런 투자를 통해 세계에서 가장 방대한 지도 데이터를 쌓고 있으며, 그 덕택에 구글어스, 구글 스트리트뷰를 이용하면 안방에서도 전 세계를 여행하는 것 같은 기분을 낼 수 있다. 여기에 스트리트뷰에 타임라인이 적용되면서 추억의 장소가 변화하는 모습을 확인하는 재미도 늘어났다. 하지만 우리나라에서는 정부가 지도 데이터의 해외 반출을 불허해 구글 맵이 제기능을  발휘하지 못하는 상황이다. 정영오 기자 young5@hankookilbo.com",105,https://n.news.naver.com/mnews/article/469/0000677254?sid=103
