title,date,main,section,url
“방송시장 급변하는데”…SKB-티브로드 합병도 ‘최장 심사’ 우려,2019.12.16. 오후 5:35,"유료방송 시장의 큰손으로 떠오른 이동통신사의 케이블TV 인수가 내년 본격화할 것으로 보인다. 정부가 LG유플러스의 CJ헬로 인수를 최종 승인하면서 신호탄을 쏘아 올린 만큼 이를 시작으로 방송 통신 융합을 놓고 치열한 경쟁이 벌어질 것으로 전망된다. 업계에서는 급변하는 방송 시장 상황에 맞춰 조속한 정부 심사가 이뤄져야 한다는 목소리가 높다.16일 업계에 따르면 LG유플러스의 CJ헬로 인수 심사를 완료한 과학기술정보통신부는 SK브로드밴드와 티브로드 합병 심사에 본격 돌입했다. 하지만 합병심사는 올해를 넘겨서나 가능할 것으로 보인다. 과기정통부 측은 “최대한 이른 시일 내 심사를 마무리할 예정이지만 방통위 사전동의, 위원회 소집 등 절차가 있고 연말 휴일이 다수 겹치는 만큼 연내 결론을 내기는 어렵다”는 입장이다.앞서 SK텔레콤은 자회사인 SK브로드밴드와 태광그룹이 보유한 케이블TV 사업자인 티브로드를 합병하기 위해 사업자 간 계약을 체결하고. 지난 3월 정부에 임의적 사전심사를 요청했다. 공정거래위원회는 지난달 8일 LG유플러스의 CJ헬로 인수 건과 SK브로드밴드와 티브로드의 합병을 승인해 주무 부처인 과기정통부로 넘겼다.지분 인수만 진행한 LG유플러스-CJ헬로 건과 달리, 합병의 경우 방송통신위원회의 사전동의를 받아야 하는 절차가 있다. 과기정통부는 이를 포함, 총 90일 내에서 SK브로드밴드-티브로드 합병 건을 심사하게 된다. 하지만 아직 방통위에 사전동의 신청 절차 일정조차 정하지 못해 심사 기간이 ‘역대 최장’으로 길어질 수 있다는 우려가 나온다.SK텔레콤은 심사가 예상보다 지연되자 합병기일을 4월 1일로 한 달간 연기한다고 지난 13일 공시했다. 정부의 심사가 속도를 내지 못하면서 내년도 사업전략 수립 등 합병과 관련한 준비 작업에 차질이 빚어질 수 있다는 목소리가 내부에서도 나오는 것으로 알려졌다.업계에선 해외 온라인동영상서비스(OTT)의 국내 시장 진출이 가속화되며 급변하는 시장 환경에 빠르게 대응할 수 있도록 정부가 조속히 심사를 마쳐야 한다고 지적한다. 넷플릭스가 국내 업체와 제휴를 통해 장악력을 강화하고 있고, 이르면 내년쯤 디즈니 플러스의 국내 상륙이 현실화할 가능성이 흘러나오는 등 시장 상황이 변화무쌍하게 흘러가고 있기 때문이다.업계 관계자는 “사업자는 한시라도 빨리 사업재편에 나서서 대응해야 할 필요성이 있는데도 심사가 늦어져 사업을 다시 구상해야 하는 처지”라며 “시간이 흐르면 시장이 또 다르게 변해있어 또 다시 사업 계획을 짜야 하는 어려움이 있다”고 토로했다.내년에는 이 외에도 KT의 케이블TV 인수합병(M&A) 추진 등 대규모 유료방송 시장 재편이 내년 이어질 것으로 전망된다. 유료방송 시장점유율 합산규제가 일몰된 지 1년 이상 지났고, 시장 환경도 변화하면서 규제 불확실성이 일부 해소될 것이란 기대가 나온다. 현재 진행 중인 KT 회장 선임 작업이 마무리되면 딜라이브 등 케이블TV 인수에 적극 나설 것이란 관측이다.김성훈 기자 hunhun@kmib.co.kr[국민일보 채널 구독하기][취향저격 뉴스는 여기] [의뢰하세요 취재대행소 왱]GoodNews paper ⓒ 국민일보(www.kmib.co.kr), 무단전재 및 재배포금지",105,https://n.news.naver.com/mnews/article/005/0001268995?sid=103
"IBS, 희귀 핵 연구와 양자컴퓨터 구현할 새 연구단 출범",2019.12.16. 오후 1:24,"한인식 이화여대 교수, 마츠케비치 싱가폴 국립대 교수 영입[아이뉴스24 최상국 기자] 기초과학연구원(IBS)에 '희귀 핵 연구단'과 '양자정보과학연구단' 이 새로 만들어졌다. 우주 원소의 기원을 규명하는 핵천체물리학과 꿈의 컴퓨터를 구현할 양자컴퓨터 연구가 IBS의 후속 연구주제로 낙점받았다.16일 기초과학연구원(원장 노도영)은 대전 본원에 2개의 신규 연구단을 출범한다고 밝혔다. 신설된 '희귀 핵 연구단'에는 한인식 이화여대 교수(57)가 단장으로 선정됐다. 여러 개의 연구그룹으로 구성되는 '양자정보과학연구단'에는 드미트리 마츠케비치 싱가포르 국립대 교수(47)가 연구단의 첫 번째 연구그룹인 이온트랩그룹을 이끌게 됐다.이로써 IBS는 29명의 연구단장과 4명의 CI(Chief Investigator, 연구책임자)가 이끄는 31개의 연구단을 구성하게 됐다.◆희귀 핵 연구단, ""우주 원소의 기원 규명""



한인식 IBS 희귀 핵 연구단장 [IBS]한인식 단장이 이끄는 희귀 핵 연구단은 16일 출범했다. 한 단장은 핵천체물리(Nuclear Astrophysics) 분야에서 뛰어난 연구 업적을 보유하고 있다. 미국 예일대, 캘리포니아공과대(Caltech), 일본 이화학연구소(RIKEN) 등 세계 선도급 연구기관에서 연구했으며, 지난 20년간 이화여대 교수로 핵물리 분야 연구에 매진해왔다.핵천체물리학은 가속기를 이용해 태양이나 초신성에서 무거운 원소가 생성되는 메커니즘 등 다양한 천체현상과 원소의 기원을 이해하기 위한 학문이다.최근에는 해외 대형 가속기를 활용하여 중성자 과잉 희귀 핵들의 새로운 마법수(magic number)를 발견한 연구, 미국 브룩헤이븐국립연구소(BNL)에 위치한 상대론적중이온가속기(RHIC)를 활용한 ‘쿼크-글루온 플라즈마’ 연구로 학계의 주목을 받았다.IBS는 ""현재 구축 중인 중이온가속기 라온(RAON)과 한 단장의 국제적인 연구경험이 만나 시너지 효과를 낼 것으로 기대한다""고 밝혔다. 평가위원회는 “희귀동위원소 가속기 연구를 수행하는 국내 9개 대학, 13개 연구그룹 간의 협력연구를 이끌 최적의 인물”이라며 “그의 가속기 활용 연구경험과 인적 네트워크는 한국에 구축될 거대 연구 인프라의 세계적 활용도를 높이고, 국가 과학기술수준을 높이는 데 기여할 것”이라고 추천 이유를 설명했다.한인식 단장은 “무거운 원소의 생성과정, 새로운 희귀 동위원소의 발견 등 우주 원소의 기원을 규명하는 연구를 진행할 계획”이라며 “비록 한국은 핵물리 분야의 후발주자이지만, 국내 희귀 핵물리 연구의 초석을 다지고, 세계적으로 인정받는 연구를 수행해갈 것”이라고 포부를 밝혔다.◆양자정보과학연구단, ""양자연구로 꿈의 컴퓨터 실현""



드미트리 마츠케비치 IBS 양자정보과학 연구단 이온트랩그룹 CI [IBS]여러 개의 연구그룹으로 구성되는 PRC(Pioneer Research Center) 연구단인 양자정보과학연구단은 이온트랩 분야에서 세계적으로 주목받고 있는 드미트리 마츠케비치 교수를 이온트랩그룹 연구책임자(CI)로 선정했다.마츠케비치 교수는 벨라루스 출신으로 미국 조지아공대에서 박사학위를 받은 양자물리학 전문가다. 현재 싱가포르 국립대 물리학과 조교수이며 양자기술센터 (Centre for Quantum Technologies) PI 로 일하고 있다.이온 트랩은 양자컴퓨터 구현 방식 중 하나로 물질의 원자를 전기적 성질을 가진 이온으로 만든 뒤, 빛과 자기장으로 조절하며 그 양자현상을 이용하는 학문이다. 이온트랩 방식의 양자컴퓨터는 다른 유형의 양자컴퓨터에 비해 오류가 적고(논리 성공률 99.9%), 안정적이라는 장점이 있다.IBS는 2012년 노벨 물리학상 수상자인 데이비드 와인랜드 미국 오레곤대 교수가 마츠케비치 교수를 IBS의 CI로 적극 추천하며 “기존 슈퍼컴퓨터의 능력을 수십 배 능가하는 ‘꿈의 컴퓨터’ 실현을 위한 혁신적 연구결과를 배출할 수 있을 것이라 생각한다”는 의견서를 보내오기도 했다고 소개했다.마츠케비치 CI는 “이온트랩 분야는 그 응용가능성과 잠재적 가치에도 불구하고 전 세계적으로 연구그룹이 5개 정도 불과할 정도로 아직 많은 연구가 수행되지 않았다”며 “IBS의 CI로서 도전적이고 창의적인 연구에 매진하다보면 지금껏 알려지지 않은 새로운 발견으로 인류의 삶을 변화시킬 수 있을 것이라고 기대한다”고 말했다.마츠케비치 CI가 이끄는 양자정보과학 연구단 이온트랩그룹은 2020년 7월 연구에 착수하며 연구단 내 추가 연구그룹 선정은 내년 상반기에 이루어질 예정이다.노도영 IBS 원장은 “거대시설기반 빅사이언스와 프런티어 양자과학 연구를 수행할 두 연구단의 설립으로 IBS는 연구영역을 더욱 확장하게 됐다”며 “두 연구단은 각각 중이온가속기 활용을 활성화하고, 세계적으로 경쟁이 치열한 양자정보과학 분야를 이끌어 나가는 역할을 수행할 것”이라고 말했다.최상국기자 skchoi@inews24.com▶네이버 채널에서 '아이뉴스24'를 구독해주세요.▶아이뉴스24 창간 20주년 인문기행 2020-바이칼 호수[ⓒ 아이뉴스24 무단전재 및 재배포 금지]",105,https://n.news.naver.com/mnews/article/031/0000518846?sid=103
"소울워커, 신규 캐릭터 ‘에프넬’ 티저 페이지 오픈",2019.12.16. 오후 2:44,"스마일게이트 메가포트(대표 장인아)가 서비스하고 라이언게임즈(대표 윤성준)가 개발한 온라인 액션 RPG ‘소울워커’가 신규 캐릭터 ‘에프넬(F.Nel)’을 공개하는 티저 페이지 오픈 했다고 16일 밝혔다. 



 여덟번째 소울워커로 합류할 예정인 ‘에프넬’은 ‘창’을 무기로 사용하며 체술을 기반으로 한 호쾌한 액션을 즐길 수 있는 소녀 캐릭터다. 게임 속에서는 네드컴퍼니의 인체 실험 프로젝트의 실패작으로 영구 폐기 되었으나 누군가의 도움으로 소울워커가 된 슬픈 스토리를 가지고 있다.티저 페이지 오픈과 함께 에프넬의 목소리를 담당하는 김현심 성우의 인터뷰 영상도 함께 공개되어 에프넬이라는 캐릭터와 연기 중에 벌어진 다양한 에피소드에 대한 이야기를 들어볼 수 있다.에프넬 티저 페이지 오픈을 기념한 이용자 혜택 이벤트도 진행한다. 먼저, 12월 16일부터 2020년1월 8일까지 게임에 접속한 모든 이용자에게 9단계로 강화된 최고 등급의 레이드 장비 세트를 지급한다. 또한, 12월 16일부터 22일 까지는 누적 접속 일수에 따라 이벤트 캐쉬와 각종 희귀 아이템을 선물로 지급하는 출석 이벤트도 진행된다. 스마일게이트 메가포트 강병철 팀장은 “에프넬은 창을 사용하는 캐릭터로 소울워커에는 처음으로 도입되는 형태의 무기인 만큼 기존 캐릭터와는 차별화된 에프넬만의 전투 액션을 느껴보실 수 있을 것”이라며 “정식 업데이트까지 다양한 혜택이 지급되는 이벤트도 진행되는 만큼 많은 기대 부탁 드린다.”고 소감을 전했다.[이창희기자 changhlee@mkinternet.com]▶매경이 에어팟프로 쏩니다! 'M코인'▶네이버 메인에서 '매일경제'를 받아보세요 ▶뉴스레터 '매콤달콤' 구독[ⓒ 매일경제 & mk.co.kr, 무단전재 및 재배포 금지]",105,https://n.news.naver.com/mnews/article/009/0004483159?sid=103
올해 인스타그램서 ‘#공스타그램’ 인기,2019.12.16. 오전 10:54,"국내 사용자들, 공감·감성 키워드에 주목(지디넷코리아=안희정  기자)인스타그램이 16일 올 한 해 이용자들로부터 가장 높은 관심과 지지를 받은 해시태그와 계정 분석을 바탕으로 2019년 대한민국 트렌드를 발표했다.인스타그램이 발표한 2019 대한민국 트렌드 자료에 따르면 올 한 해는 ‘공감’, ‘감성’ 등의 키워드로 요약된다. 이용자들이 가장 많이 팔로우 한 톱 50 해시태그 중 20개 이상을 관련 키워드가 차지하며 올해의 트렌드로 자리매김했다. 또한, 케이팝의 인기는 여전히 뜨거운 것으로 분석됐다.올해 한국에서 사용자들이 가장 많이 팔로우 한 해시태그는 ‘#공스타그램’으로 조사됐다.공책 필기나 공부 계획을 해시태그와 함께 올리고 자신의 학습 패턴을 기록하는 동시에 타인들과 공유하며 공부 의지를 확인하는 MZ세대(밀레니얼과 Z세대를 조합한 신조어)의 새로운 공부 방식을 볼 수 있는 대목이다. 뒤를 이어 2위부터 4위까지 ‘#글귀스타그램’, ‘#글귀’, ‘#영화명대사’가 차지해 바쁜 일상 속 공감을 불러일으키며 감성을 충전할 수 있는 콘텐츠가 많은 관심과 사랑을 받은 것으로 나타났다.



이외에도 그날 그날의 패션을 공유하는 ‘#데일리룩’도 상위권을 차지했으며 패션 스타일 중에는 ‘#아메카지룩’(편안하지만 스타일리시한 아메리칸 스타일 캐주얼 패션), ‘#스트릿패션’, ‘#미니멀룩’ 등이 15위 안에 올라, 올해의 패션 트렌드를 보여줬다. 또한 ‘#슬라임’, ‘#여행에미치다’, ‘#방꾸미기’ 등 취미여가 활동 관련 키워드도 인기를 끌었다.인스타그램 내 가장 인기가 높은 카테고리 중 하나인 케이팝(K-POP) 부문에서는 세계 무대에서 매년 새로운 역사를 쓰고 있는 ‘#방탄소년단’이 가장 많은 팔로워를 보유한 해시태그에 올랐으며, ‘#아이유’와 ‘#아이린’이 그 뒤를 이었다. 지난해 쇼미더머니에 출연해 화제를 일으킨 바 있는 ‘#키드밀리’도 가장 많은 팔로워를 보유한 해시태그 톱 30위 안에 들며 한국 힙합이 케이팝의 대세 장르 중 하나로 떠올랐음을 입증했다.아울러, 올해 가장 많은 팔로워를 보유한 계정 톱10 내 모든 순위를 아이돌 가수가 차지하며 케이팝의 위상을 다시 한번 체감케했다. 그 중에서도 블랙핑크의 약진이 두드러진 한 해였다. 블랙핑크 공식계정 및 4명의 멤버 개인 계정이 모두 10위 내에 이름을 올렸으며, 방탄소년단 공식계정, 엑소의 찬열, 세훈, 백현과 지드래곤이 톱 10에 포함됐다.인스타그램 관계자는 ""국내 이용자들은 한 게시물 당 해시태그를 글로벌 평균에 대비 2.9배 더 많이 사용하기 때문에 인기 해시태그 분석을 통해 보다 정확하게 인스타그램 커뮤니티의 관심사 파악이 가능하다""고 설명했다.안희정 기자(hjan@zdnet.co.kr) ▶ 지디넷코리아 '홈페이지' / ▶ 지디넷코리아 ‘이슈진단+’ ▶ 네이버 채널에서 ‘지디넷코리아’를 구독해주세요",105,https://n.news.naver.com/mnews/article/092/0002176900?sid=103
"종근당, 제약업계 최초로 에너지경영시스템 국제표준 ISO50001 인증받아",2019.12.16. 오전 9:36,"ISO 50001 인증서 수여식에서 종근당 이승희 생산본부장(가운데)과 한국품질재단 송지영 대표(오른쪽에서 두 번째)가 기념촬영을 하고 있다. [사진 제공 = 종근당] 종근당은 지난 13일 서울 금천구 한국품질재단에서 한국 제약업계 최초로 에너지경영시스템 국제표준인 'ISO 50001' 인증을 받았다고 16일 밝혔다.ISO 50001은 국제표준화기구(ISO)가 제정한 에너지 경영시스템 표준규격으로 에너지 소비 절감과 효율 향상계획 등 에너지 관리시스템과 지속가능성을 종합적으로 평가해 인증을 부여한다.종근당은 올해 에너지 경영방침을 수립하고 에너지관리위원회를 통해 에너지경영 책임자를 선임하며 ISO 50001 인증을 준비해왔다. 각 부서별로 에너지 효율 향상방안과 중요 설비의 에너지 절감계획을 마련하고 이를 평가하고 개선할 수 있는 프로세스를 갖추는 등 지속 가능한 에너지 경영시스템을 구축한 점을 높이 평가 받아 인증을 획득했다.종근당 관계자는 ""이번 ISO 50001 인증으로 종근당의 체계적인 에너지 경영시스템과 에너지 향상을 위한 노력을 입증받았다""며 ""ISO50001 인증 기업으로서 에너지 경영에 앞장서며 사회적 책임을 다하겠다""고 말했다.종근당은 지난해 환경경영시스템인 ISO 14001 인증을 획득한 바 있으며, 올해 11월에는 산업통상자원부와 한국에너지공단으로부터 에너지 절감 우수사업장(Energy Champion) 인증을 받는 등 친환경 저탄소 녹색성장 실천에 적극적으로 나서고 있다. [디지털뉴스국 한경우 기자]▶매경이 에어팟프로 쏩니다! 'M코인'▶네이버 메인에서 '매일경제'를 받아보세요 ▶뉴스레터 '매콤달콤' 구독[ⓒ 매일경제 & mk.co.kr, 무단전재 및 재배포 금지]",105,https://n.news.naver.com/mnews/article/009/0004482892?sid=103
(2)달리고 싶은 타다·살고 싶은 택시…‘면허나누기’로 해결될까 [키워드로 보는 2019 경제],2019.12.16. 오후 9:44,"ㆍ타다, 혁신의 딜레마ㆍ정부, 렌터카 수요·택시 피해 등 구체적 조사 없이 새 여객운수법 강행ㆍ기존 택시면허 사 영업하라는 새 법안, 신규 서비스 공급 제한 우려ㆍ“면허 기여금, 택시 보호인지 신규사업 경쟁력 향상인지 명확히 해야”



그래픽 | 성덕환 기자새로운 기술에 기반한 신산업과 기존 산업은 조화를 이룰 수 있을까. 연초 택시기사의 카풀 반대 분신, 현재 ‘타다’와 택시업계의 극단적 대립은 이에 대한 답이 쉽지 않음을 상징적으로 보여준다. 택시업계와 모빌리티 신규 업체들은 자신의 이익에 따라 한 치도 양보하지 않았고, 정부는 이들의 이익을 조정하는 수준에서 짠 새 법안을 강행한다. 올 한 해 벌어진 운송시장 논란을 통해 신산업과 기존 산업 조화에 필요한 방법을 모색해본다.■ 준비 없이 마련한 대책논의 과정부터 되짚자. 현재 전국 택시는 25만대다. 이들이 연간 8조원을 벌어들인다. 서울 법인택시기사 월급은 213만원에 그치는 등 택시업계는 열악하다. 반면 승객들은 불친절하며 승차거부를 밥 먹듯 하는 택시업계에 큰 불만이 있다. 지난해 말 카카오모빌리티가 ‘카풀’ 시범서비스를 시작하자 택시업계는 카풀에 시장을 빼앗길 것을 우려했다. 택시기사의 분신이 이어졌고 더불어민주당을 중심으로 한 ‘택시-카풀 태스크포스’는 지난 3월 동선이 같은 경우에 한해 오전·오후 각각 2시간씩 허용하는 제한적 형태의 카풀을 ‘사회적 대타협’이란 이름으로 합의했다. 그러자 카카오모빌리티는 사실상 영업을 중단했고 택시업계는 렌터카 호출서비스인 타다로 전선을 넓혔다. 지난 7월 국토교통부가 타다와 같은 플랫폼사업자가 택시면허를 구입해 영업하도록 하는 안을 담은 여객자동차운수사업법 개정안을 내놨다. 해당 법안의 국회 통과를 앞둔 지금 타다는 해당 법안에 극렬히 반대하고 있다. 지난 3월 카풀 대타협과 7월 발표된 국토부 법안의 치명적인 약점은 ‘데이터’가 없다는 점이다. 승용차(카풀) 혹은 렌터카(타다)에 대한 시장의 수요와 공급이 얼마나 될지에 대한 연구가 전혀 없었다. 자연히 택시업계가 입을 피해가 추산되지 못했다. 심지어 한국교통연구원 등 연구기관의 설문조사도, 소비자와 업계를 아우른 공청회도 없었다. 적어도 2015년 “자가용으로 영업하는 우버(Uber)는 불법”이라는 법원 판결 이후 정부가 이에 대한 연구를 진행했어야 한다는 지적이 나온다. 지난 7월 정부가 신규 사업자에게 택시면허를 구입해 영업하도록 하는 법안을 추진하면서, 공급량에 대한 기본값은 전체 택시면허 숫자인 25만대로 정해졌다. 신규 사업에 대한 수요가 얼마나 될지 모르니 우선 택시 공급량 안에서 단계적으로 신규 사업을 늘리겠다는 뜻이다. 해당 법안에 대해 “택시업계 이익에 기반해 신산업 확장 기회를 죽였다”고 신규 업체가 반발한 것도 이 때문이다.코리아스타트업포럼 관계자는 “향후 이와 비슷한 논란이 생길 경우를 대비해 신산업에 규제를 완화할 경우 기존 산업이 어떤 변화와 피해를 입는지에 대한 연구를 진행해야 한다”고 말했다. ■ 구 산업 보호비용, 누가 감당?향후 쟁점은 신규 사업자에게 허용하는 택시면허 숫자와 구입비용(기여금)이다. 이를 어떻게 정하느냐에 따라 택시업계에 유리할지, 신규 업체에 유리할지가 갈린다. 택시업계는 감차된 택시면허 가격(현재 1대당 7000만원 수준)을 고려해 기여금을 정해야 한다고 주장한다. 반면 신규 사업자는 “기존 산업의 보호비용을 왜 신규 업체가 감당해야 하느냐”고 반발한다. 국토부는 “기여금은 신규 사업자에게 부여하는 일종의 자격요건일 뿐 기존 산업 보호비용을 신규 업체에 전가하는 모델이 아니다”라는 입장이다. 하지만 신규 사업자에게 제공하는 택시면허의 수는 택시가 줄어드는 숫자에 비례해 정해진다. 여기에 정부 재정을 투입하지 않는다. 구조적으로 기여금으로 택시 감차비용을 충당해야 하는 셈이다. 업계 관계자는 “신규 업체에서 걷는 기여금의 성격이 택시 보호를 위한 것인지, 신규 업체의 경쟁력 향상을 위한 것인지, 아니면 소비자 편익을 위한 것인지 등을 명확히 해야 한다”고 말했다. 또 다른 업계 관계자는 “자신의 이익을 전혀 양보하지 않았던 업체들의 그간 모습으로 볼 때 향후 논의에서 정부가 묘안을 제공하지 못하면 양보 없는 줄다리기가 반복될 것”이라고 우려했다.곽희양 기자 huiyang@kyunghyang.com▶ 장도리 | 그림마당 보기▶ 경향신문 최신기사▶ 기사 제보하기©경향신문(www.khan.co.kr), 무단전재 및 재배포 금지",105,https://n.news.naver.com/mnews/article/032/0002980972?sid=103
"게임위, 2019 게임물 전문지도사 성과공유회 가져",2019.12.16. 오후 3:29,"게임물관리위원회(이하 게임위)는 게임위 대회의실에서 2019 게임물 전문지도사 성과공유회를 지난 12일 개최했다.성과공유회는 서울과 부산지역 게임물전문지도사 15명과 게임위 직원 등이 참석했다. 참석자들은 2019년도 게임물 전문지도사 교육 활동 성과와 우수 지도사례를 공유하고 2020년도 운영계획을 논의했다.게임물 전문지도사는 초·중학생들에게 적정등급 게임물 이용의 중요성을 알리고 불법 게임물 이용 예방 교육을 위해 게임위가 양성한 민간 강사이다. 게임위는 게임물 모니터링 경력자 등 등급분류 전문가 중심으로 대상자를 모집해 30시간의 실무교육과 적격심사 평가 등을 거쳐 지난 10월 최종 21명의 게임물 전문지도사를 선발했다.게임물 전문지도사들은 지난 10월부터 12월까지 서울, 경기, 인천, 부산지역 총 52개교 119개 학급 4778명을 대상으로 교육을 수행했다. 교육에 대한 만족도는 11월 30일 기준 평균 4.52점(90.39점)으로 매우 높은 것으로 나타났다. 또, 교육 전과 후에 대한 설문조사 결과, 게임물 등급분류 이해도는 84.36% 크게 향상됐고, 적정등급 게임물 이용에 대한 인식 변화율은 78.89% 상승한 것으로 나타났다.게임위는 2014년 건전 게임이용 문화 조성 시범 교육 이후 지속적으로 게임물 이용자 대상 교육을 수행해오고 있다. 2019년 한 해 동안 총 147회 6644명을 대상으로 교육을 수행했으며 이는 전년 3988명 대비 2,656명 증가한 수치다.최종배 기자 jovia@fomos.co.kr[게임&게이머, 문화를 전합니다. 포모스게임│무단 전재 및 재배포 금지]포모스",105,https://n.news.naver.com/mnews/article/236/0000197775?sid=103
