title,date,main,section,url
"컴투스 '낚시의 신', 신규 대륙 업데이트 및 9주년 기념 이벤트 진행",2023.03.24. 오후 3:24,"신규 맵 ‘무 대륙’ 추가하고 9주년 맞이 다양한 이벤트 전개컴투스(대표 송재준, 이주환)는 24일 글로벌 모바일 레포츠 게임 ‘낚시의 신’에 신규 대륙을 추가하고 출시 9주년을 기념하는 다채로운 이벤트를 실시한다고 밝혔다.3D 리얼 낚시 게임 낚시의 신 지난 2014년 출시 이후 많은 글로벌 게임팬들로부터 꾸준히 사랑받고 있다.이번 업데이트를 통해 13번째 맵인 ‘무 대륙’을 추가하고 새로운 지역에서의 플레이 재미를 더했다. 이용자들은 전설 속의 초고대문명인 ‘무 대륙’에서 한 층 강력한 방어력을 지닌 물고기들을 만나볼 수 있다.



컴투스, 낚시의 신 9주년 이벤트올해로 출시 9주년을 맞이한 낚시의 신을 위해 다양한 특별 이벤트도 마련했다.먼저, 다음 달 17일까지 ‘아홉 개의 꼬리를 찾아라!’ 이벤트를 전개해, 9개의 미션 달성을 통해 꼬리를 완성하면 다채로운 게임 재화를 제공한다. 또한 획득 시 다양한 선물이 지급되는 꼬리 달린 물고기 원 테일 피쉬와 나인 테일 피쉬를 적용했다.또한 낚시의 신의 인기 어종인 행운의 ‘황금 고래’도 더욱 자주 만나볼 수 있게 했다. 해당 기간 동안 ‘조개’를 강화할수록 다양한 아이템과 능력치가 부여되는 이벤트도 마련했다.낚시의 신은 오랜 기간 게임을 애용해준 전 세계 조사들을 위해 접속만 해도 추첨을 통해 최신 스마트폰과 구글 기프트 카드, 굿즈 등을 증정하는 감사 이벤트를 실시한다. 또한, 매일 미션을 달성하고 티켓을 획득해 응모하면 총 100여 종의 게임 아이템과 재화를 최대 19만9천999개까지 획득할 수 있는 선물 이벤트도 진행한다.컴투스는 이외에도 9주년을 기념해 산호 상점과 상점을 리뉴얼하고, 복귀 유저들을 위한 ‘웰컴백 휴면 복귀’ 이벤트도 전개하며 더욱 다양한 플레이의 재미와 보상을 제공할 계획이라고 밝혔다.",105,https://n.news.naver.com/mnews/article/092/0002286563?sid=103
"美하원 '틱톡청문회'…성난 의원들 ""中공산당의 미국 조종 도구""",2023.03.24. 오전 2:15,"상무위원장 ""틱톡, 상상할 수 있는 모든 정보 수집…통제·감시의 길 택해""추쇼우즈 CEO ""中기관원 아니다""…일부 사용자 자료 中 접근 가능 인정



미 하원 틱톡 청문회[워싱턴 AP=연합뉴스. 재판매 및 DB 금지](워싱턴=연합뉴스) 김경희 특파원 = 중국의 동영상 공유 플랫폼인 틱톡의 안보 위협을 논의하기 위한 미국 하원의 청문회가 23일(현지시간) 열렸다.    미국 내 틱톡 사용 금지를 놓고 초당적 합의를 이룬 의원들은 이날 청문회에서 여야를 가리지 않고 틱톡 미국 사용자 정보에 대한 중국 정부의 접근 가능성을 우려하며 틱톡 추쇼우즈 최고경영자(CEO)를 강하게 몰아붙였다.    미국 의회는 지난 연말 처리한 2023 회계연도(2022년 10월~2023년 9월) 예산법안에서 정부 내 기기에서 틱톡 사용 금지 조항을 포함시킨 바 있다.    미국 정치권에서는 틱톡 이용자에 대한 중국 정부의 정보 접근 및 감시 우려를 이유로 미국에서 틱톡을 아예 금지하도록 하는 방안을 진지하게 검토중이다.     공화당 소속인 캐시 맥모리스 로저스 위원장은 이날 청문회에서 ""미국인은 틱톡이 우리 국가와 개인의 안보에 취하는 위협에 대해 진실을 알아야 한다""며 ""틱톡은 반복적으로 통제와 감시와 조작을 강화하는 길을 택하고 있다""고 비판했다.    로저스 위원장은 ""틱톡은 사람들의 위치는 물론이고 그들이 무슨 말을 하는지를 비롯해 생물학적 정보 등 상상 가능한 거의 모든 자료를 수집한다""며 ""우리는 틱톡이 자유와 인권, 혁신이라는 미국의 가치를 포용한 적이 단 한 번이라도 있다고 보지 않는다""고 직격했다.    그는 ""중국 공산당이 미국 전체를 조종하는 데에 틱톡을 사용할 수 있다""고까지 주장하며 '틱톡 위협론'을 역설했다.    민주당 간사인 프랭크 펄론 의원도 ""틱톡은 자료 수집을 계속하고 있으며, 이를 판매하는 일도 지속할 것""이라며 ""중국 공산당의 비호 아래 있는 일도 이어갈 것""이라고 규탄했다. 



추쇼우즈 틱톡 CEO[워싱턴 AP=연합뉴스. 재판매 및 DB 금지]싱가포르 화교 출신인 추 CEO는 ""우리는 중국 정부의 요청에 따라 콘텐츠를 홍보하거나 삭제하지 않는다""면서 ""어느 정부의 조작으로부터도 틱톡을 자유롭게 지킬 것이라고 위원회와 우리의 모든 사용자에게 약속한다""고 말했다.    그는 ""(틱톡의 모회사인 중국의) 바이트댄스는 중국 혹은 다른 어떤 나라의 기관원이 아니다""라고도 항변했다.    또 그는 의원들의 정보 유출 및 안보위협 지적에 대한 답변에서 미국 이용자 관련 데이터는 미국 땅에 있고, 미국인 회사가 운영하는 서버에 저장되고 미국인 회사가 감독한다며 이를 불식시키기 위해 부심했다.      그는 ""우리는 안보 및 사생활 보호 조치를 통해 신뢰를 획득할 것이며, 조작 우려 자체는 우리 입장에서 특별한 것은 아니다""라며 ""소유권이 어디에 있느냐는 이 같은 우려에 대응하는 데 있어 핵심 사항이 아니다""라고 강조했다.    틱톡은 사용자 정보 유출 문제가 대두하자 모든 미국 사용자 정보를 미국 텍사스에 있는, 미국 회사 오라클 소유의 서버로 이전하는 15억달러 규모의 프로젝트를 진행중이다.     그러나 일부 정보는 여전히 중국에서 접근이 가능한 상태로 남아있는 것으로 확인됐다.    추 CEO는 중국으로부터의 접근이 모두 차단된 것이냐는 의원들의 추궁에 ""현재 기준으로 삭제해야 할 일부 자료가 남아 있다""면서 모든 미국 사용자의 자료는 중국 법의 영향력 밖으로 옮겨질 것이라고 거듭 강조했다.    일각에서는 젊은층을 중심으로 인기를 누리고 있는 틱톡을 금지할 경우 이미 이 플랫폼을 통해 20~30대 지지자를 흡수하고 있는 민주당에 정치적 손해가 불가피하다는 지적도 제기되고 있다.      실제 틱톡은 미국 의회의 퇴출 움직임에 청문회 전날 인플루언서들을 의회로 보내 퇴출 반대를 호소하는 로비를 벌이기도 했다.     그럼에도 공화당은 물론이고 민주당 내부 대다수 정치인들이 틱톡 금지에 힘을 싣고 있다.    이와 관련해 민주당 소속 마크 워너 상원의원은 전날 틱톡 금지를 위한 법안에 민주당과 공화당에서 각각 10명의 의원으로부터 지지를 확보했다고 발표했다.    전문가들은 틱톡의 행태가 다른 소셜미디어 업체와 크게 다르지 않다면서, 이들이 통상적인 수준의 사용자 자료를 수집한다고 지적했다.    틱톡 금지를 위해서는 애플과 구글 등 통신사를 설득해 틱톡을 앱스토어에서 퇴출시키고, 인터넷 사업자를 압박해 틱톡 데이터 트래픽을 걸러내도록 하는 방안이 제시됐다.     kyunghee@yna.co.kr



[그래픽] 주요 SNS 앱 미국 내 다운로드 현황(서울=연합뉴스) 김영은 기자 = 0eun@yna.co.kr    트위터 @yonhap_graphics  페이스북 tuney.kr/LeYN1",105,https://n.news.naver.com/mnews/article/001/0013834517?sid=103
AI 챗봇 '바드' 띄웠지만 잇단 혹평…갈 길 바쁜 구글,2023.03.24. 오전 11:17,"미국·영국서 시범 서비스 시작한 가운데, 경쟁자 빙보다 뒤처져 있다는 평가구글이 미국과 영국에서 인공지능(AI) 챗봇 바드(bard)를 시범적으로 선보인 가운데, 가혹한 평가가 이어지고 있다. 마이크로소프트(MS)가 자사 검색 서비스 빙(bing)에 챗GPT를 장착한 뒤 이용자를 빠르게 모으며 '검색 공룡' 구글의 아성을 위협하며 긴장감이 고조되고 있다.



구글 인공지능(AI) 챗봇 '바드' 서비스 화면 예시 [사진=구글]23일(현지시간) 미국 경제 전문매체 비즈니스인사이더에 따르면 기술 전문 유튜버와 교수 등 다양한 직군의 이용자가 '바드'에 대해 잇따라 냉정한 평가를 내놨다.에단 몰릭 펜실베이니아대 와튼스쿨 부교수는 예단일 수 있단 점을 덧붙이면서도 ""바드는 빙이나 GPT-4만큼 학습 도구로써 능력이 있어 보이지 않는다""고 평가했다고 비즈니스인사이더는 전했다. 특히 시를 짓는데 바드가 경쟁자인 빙보다 많이 뒤처져 있다고 분석했다.챗GPT의 등장과 이를 장착한 새로운 검색 서비스 빙이 빠르게 이용자를 모아가는 가운데, 구글도 대항마인 '바드'를 내놨지만 긍정적인 반응을 얻진 못한 모습이다. 구글이 '바드' 출시를 예고한 지 한 달 반 만에 시범 서비스를 내놓은 것인데 MS가 새로운 빙을 선보인 시점과 비교하면 한 달 가량 뒤처진 상황이다.야후파이낸스는 바드의 잠재력 부족은 구글의 검색 리더십과 최첨단 기술 기업으로서의 위상에 적잖은 영향을 주는 요인일 수 있다고 짚었다. 일부 국가에서 시범 서비스를 선보이기에 앞서 지난 2월엔 짧은 영상을 통해 공개한 바드가 잘못된 정보를 답하는 오류를 범하면서 체면을 구겼다. 여파로 구글 모회사 알파벳 주가는 전날보다 7%가량 급락한 바 있다.업계 관계자는 ""구글도 한 번 선점 시기를 놓치면 밀릴 수 있다는 위기감이 있을 것인 만큼 서두를 수밖에 없는 상황""이라며 ""기술력과 데이터는 구글과 같은 유수의 빅테크(대형 IT 기업)를 따라가기 힘들 수 있지만 AI가 답변을 잘할 수 있게 학습시키고 훈련하는 과정을 단기간에 소화하려다 보니 이런저런 부족한 모습이 나타나는 상황으로 보인다""고 분석했다.",105,https://n.news.naver.com/mnews/article/031/0000736325?sid=103
"이정헌 넥슨코리아 대표, 넥슨 일본법인 이사진 합류",2023.03.24. 오후 3:15,"3월 24일 주주총회 신규 이사 선임 안건통과이정헌 넥슨코리아 대표가 모회사 넥슨 일본법인의 신규 이사진에 합류했다.24일 게임 업계에 따르면 넥슨 일본법인은 정기 주주총회를 열고 이정헌 넥슨코리아 대표를 신규 이사진으로 선임하는 안건을 통과시켰다.이정헌 대표는 이번 이사 선임에 따라 넥슨 일본법인을 이끌고 있는 오웬 마호니 대표와 패트릭 쉐더룬드 엠바크스튜디오 대표, 우에무라 시로 CFO와 함께 넥슨 그룹을 이끌게 됐다. 넥슨 일본법인은 넥슨코리아 등을 자회사로 거느리고 있다.



이정헌 넥슨코리아 대표.이 대표는 지난 2003년 넥슨 입사 후 2018년 넥슨코리아 대표에 오른 인물로 다수의 신작과 체질개선을 통해 넥슨의 상승세를 이끈 인물이다. 넥슨은 넥슨코리아의 성과를 바탕으로 지난해 역대 최대인 연매출 3조3천946억 원을 기록한 바 있다.넥슨 측은 ""넥슨코리아의 최대 성과 경신을 견인한 이정헌 대표가 넥슨 이사진 합류했다""며 ""넥슨의 글로벌 경쟁력 확대와 최상의 사업적 시너지를 창출할 수 있을 것으로 기대한다""고 전했다.",105,https://n.news.naver.com/mnews/article/092/0002286562?sid=103
"블리자드, ‘디아블로4’ 주말 오픈베타",2023.03.24. 오후 2:43,"전직업 체험 기회…서버 안정성 집중 점검 예고



블리자드엔터테인먼트는 신작 액션 RPG ‘디아블로4’의 오픈베타 테스트를 한국시간 오는 25일 오전 1시부터 28일 오전 4시까지 실시한다. 블리자드는 이번 테스트를 통해 서버 안정성을 집중적으로 점검할 계획이다. 지난 주말 진행된 얼리액세스에서 접속 불안 및 오류 현상 등이 발생한바 있어 이번 오픈베타 환경이 주목된다.이번 테스트의 경우 얼리액세스와 동일하게 25레벨까지 캐릭터 육성이 가능하다. 게임 초반부 콘텐츠인 서막과 조각난 봉우리 지역을 탐험할 수 있다.특히 지난 얼리액세스와 달리 모든 이용자가 참여할 수 있다. 얼리액세스에서 공개된 원소술사와 야만용사, 도적에 이어 강령술사와 드루이드까지 다섯 개 직업을 모두 즐길 수 있는 것도 특징이다.블리자드는 이번 테스트에서 서버 안정성도 점검한다. 6월 출시 시점에 이용자들이 보다 원활한 플레이가 가능하도록 하기 위함이다. 이에 접속 및 대기 시간이 더 길어질 수 있다고 설명하기도 했다.또 오는 26일 오전 2시와 오전 4시, 오후 2시, 오후 4시에 걸쳐 야외 우두머리 아샤바 이벤트가 펼쳐진다.오픈베타 이벤트도 연다. 참여자 중 ‘키요바샤드’ 지역에 도달한 이용자에게는 ‘초기의 사상자(가칭)’ 칭호가 주어진다. 20레벨을 달성할 경우 ‘부지런한 항해자(가칭)’ 칭호와 ‘베타 늑대 가방 꾸미기 아이템’도 제공된다. 해당 보상은 6월 ‘디아블로4’ 정식 출시 시점에 배포될 예정이다.‘디아블로4’는 블리자드의 액션 RPG ‘디아블로’ 시리즈의 최신작이다. 흥행 성적과는 별개로 팬들의 비판이 많았던 ‘디아블로3’의 사례를 참고해 1편의 암울한 분위기를 재현하고 2편의 영웅 육성 요소를 담아냈다. 액션성은 최신작이었던 ‘디아블로3’의 역동성을 더했다. 여기에 시리즈 최초의 개방형 야외 세계를 구축하고 다수의 이용자가 교류할 수 있는 마을과 10여명 이상이 함께 공략하는 야외 우두머리 등도 마련하며 MMORPG의 게임성도 가미했다.",105,https://n.news.naver.com/mnews/article/009/0005106408?sid=103
"NHN클라우드, 초심자용 클라우드 활용 노하우 담은 학습서 출간",2023.03.24. 오후 4:49,"[디지털데일리 이종현기자] NHN클라우드는 자사 클라우드의 기본 개념 및 기술 활용법을 소개하는 학습서 ‘처음 배우는 NHN클라우드’를 출간한다고 24일 밝혔다.   4월3일 출간되는 책은 클라우드 이용 초심자가 서비스를 이용할 때 경험할 수 있는 궁금증과 이에 대한 해결책을 담았다. 스토리와 실습을 기반으로 알기 쉽게 설명했다는 것이 NHN클라우드의 설명이다.   NHN클라우드를 바탕으로 기본기를 익히려는 개발자나 시스템 엔지니어, 기술 영업사원 또는 정보기술(IT) 분야 전공자는 책에 담긴 여러 활용 사례를 바탕으로 역량을 쌓을 수 있다고도 부연했다.   책의 저자는 20여년간 마이크로소프트(MS) 공인 강사로 활동한 김도균 저자다. 그는 오는 28일 책 출간을 기념해 ‘NHN클라우드를 여행하는 히치하이커를 위한 안내서’라는 주제로 온라인 세미나(웨비나) 발표를 진행한다.   NHN클라우드 관계자는 “‘처음 배우는 NHN클라우드’가 클라우드 서비스를 공부하고 업무에 도입해 보고 싶은 이용자에 도움이 되는 기술 활용 길잡이가 되길 기대한다”며 “앞으로도 국내 대표 클라우드 서비스 제공사로서 클라우드 기술을 전파하기 위한 다양한 노력을 펼쳐 나가겠다”고 말했다.",105,https://n.news.naver.com/mnews/article/138/0002144972?sid=103
"NIA, 공공 SaaS 개발·검증사업 공모 개시",2023.03.24. 오후 9:22,"NIA(한국지능정보사회진흥원)는 국내 공공부문 민간 클라우드 이용 촉진 및 DX(디지털전환) 실현을 위해 '공공부문 이용 SaaS(서비스형 소프트웨어) 개발·검증' 사업의 참여기업 모집을 24일 시작한다고 밝혔다.현재 공공부문에서 이용 가능한 SaaS는 약 64개다. 이를 확충하기 위해 과학기술정보통신부와 NIA는 지난해 대비 40억원 증액(50%↑)된 총 120억원 규모로 '공공 SaaS 트랙'과 '교육 SaaS 트랙' 두 분야를 지원하는 사업을 추진한다.공공 SaaS 트랙에 참여를 희망하는 기업은 4월 25일까지 NIA 홈페이지의 입찰공고를 확인해 수행계획서를 온라인으로 제출하면 된다. 교육 SaaS 트랙의 경우 이달 31일까지였던 모집기한이 참여 희망 기업들의 의견에 따라 4월 20일까지로 연장됐다.이번 공고된 공공 SaaS 트랙의 모집 대상은 공공부문에서 이용이 가능한 SaaS 개발·유통을 희망하는 국내 기업이며, 유형에 따라 최대 2년까지 지원한다. CSAP(클라우드보안인증) 등 공공 제공요건을 충족하며, AI(인공지능) 등 첨단기술과 API(응용프로그램인터페이스) 등을 활용해 클라우드 네이티브로 개발한다. 공공에서 부족한 내부업무·행정용 SaaS, 수요확약서·의향서 등으로 공공부문 수요가 확보된 SaaS 등을 우선 선정할 예정이다.과기정통부와 NIA는 '제3차 클라우드 기본계획' 및 '대한민국 디지털 전략'에 따라 공공용 SaaS 제공 및 민간 클라우드 우선 도입지원 정책을 추진하고 있다. 지난해에는 신규로 80억원을 편성해 총 27개 SaaS를 지원했다. 그 결과 내부업무·행정용 12개, 공공혁신 서비스 15개 SaaS가 CSAP 획득을 진행 중이며, 전체 공공용 SaaS의 40%(64→91), 내부업무·행정용 60%(20→32)가 증가될 전망이다.황종성 NIA 원장은 ""공공부문이 이용할 수 있는 SaaS의 개발을 적극 지원하고, 민간기업이 공공시장에 진출할 수 있는 판로 개척을 위해 다양한 정책으로 뒷받침하겠다""며 ""나아가 디지털플랫폼정부의 성공적 구현을 위한 노력을 아끼지 않겠다""고 말했다.",105,https://n.news.naver.com/mnews/article/029/0002790875?sid=103
