title,date,main,section,url
제자리 높이뛰기로 10층까지 단숨에…로봇인가 로켓인가,2022.05.09. 오전 10:07,"제 몸의 100배 높이 도약하는 로봇 모터와 스프링, 고무줄 이용해 개발 생체 모방 로봇이 가졌던 한계 극복 “현존 소재로 가능한 최대높이 구현”



30센티의 로봇이 33미터 높이까지 치솟았다. 샌타바버라캘리포니아대 제공  생체모방 기술의 한계를 뛰어넘어 자기 키의 100배가 넘는 높이까지 뛰어오를 수 있는 로봇이 개발됐다.샌타바버라캘리포니아대(UCSB)가 중심이 된 미국 연구진은 회전 모터와 스프링, 고무줄의 장력(당기는 힘)을 이용해 제자리에서 32.9미터 높이까지 뛰어오를 수 있는 소형 로봇을 만들어 국제학술지 ‘네이처’에 발표했다. 한 번 도약에 지상에서 10층 건물 옥상까지 올라가는 셈이다. 연구진은 “이는 연소나 압축가스를 사용한 기존 도약 로봇의 8~10미터보다  3배 이상 뛰어난 능력”이라고 밝혔다.연구진이 이번에 개발한 키 30cm, 무게 30g의 로봇은 4개의 활 모양 스프링 위에 로켓을 얹어놓은 것같은 모양을 하고 있다. 각각의 활 스프링과 중앙의 굴대 사이엔 고무줄 4개가 바퀴살처럼 이어져 있다. 활 스프링의 소재는 탄소섬유다. 



도약 신기록을 세운 로봇은 모터와 스프링, 고무줄로 구성돼 있다.  정지 상태서 시속 96km까지 9밀리초그동안 과학자들은 개구리나 메뚜기, 캥거루처럼 높이 뛸 수 있는 능력을 갖춘 동물의 해부학적 구조를 모방한 도약 기계를 개발했다. 연구를 이끈 엘리엇 호크스 박사는 “동물 세계에서 도약 능력이 가장 뛰어난 것은 다람쥐만한 크기의 영장류 갈라고로 제자리에서 2.3미터 높이까지 뛸 수 있다”고 말했다. 그러나 생물체의 도약은 단 한 번의 근육 동작으로 낼 수 있는 힘까지만 가능하다는 것이 한계로 지적됐다. 연구진은 근육을 모방한 기존의 용수철 방식 대신 회전 모터를 이용해 이 한계를 극복했다. 모터로 스프링에 저장할 수 있는 에너지를 최대한 늘린 뒤 이를 한꺼번에 방출하는 방식이다.우선 회전 모터를 이용해 중앙의 굴대를 한껏 당긴다. 그러면 활이 구부러지면서 굴대와 활 사이에 이어놓은 고무줄도 함께 늘어난다. 장력이 최대치에 이르렀을 때 굴대의 걸쇠 장치를 풀면 축적된 에너지가 한꺼번에 방출되면서 로봇이 공중으로 튀어오른다. 연구진은 “실험 결과 장력이 풀릴 때 315G의 중력가속도가 생기면서 불과 9밀리초 사이에 도약 속도가 시속 60마일(96km)에 이르렀다”고 밝혔다. 연구진은 “새로 개발한 로봇의 도약 높이는 현재 사용할 수 있는 소재로 이룰 수 있는 한계치에 가깝다”고 덧붙였다. 



연속 사진으로 본 로봇의 도약 순간.  비행체 방불…달이나 험지 탐사에 유용할 듯연구진은 중력이 지구보다 약하고 공기저항도 없는 달 같은 곳에서 탐사활동을 하는 로봇에 이 기술을 적용하면 유용할 것으로 기대했다. 이 기술을 이용할 경우 한번에 125미터 높이까지 다다를 수 있는데다, 한 번 뛸 때 약 500m를 이동할 수 있기 때문에 험한 지형을 조사하는 데 유리할 수 있다는 것이다.  예컨대 현재 화성에서 임무 수행 중인 헬리콥터 인지뉴이티처럼 복잡한 이착륙 시스템을 구축하지 않아도 공중 사진 촬영을 할 수 있다.연구진은 지진 등의 재해 지역 실태를 파악하는 데도 요긴하게 쓸 수 있을 것으로 내다봤다.",105,https://n.news.naver.com/mnews/article/028/0002589823?sid=103
나들이객 몰린 어린이날 연휴…티맵 이용자 수도 역대 최대,2022.05.09. 오후 5:11,"가장 많은 이용자 몰린 곳은 '하남 스타필드'어린이날을 포함한 징검다리 연휴 기간에 국내 이동량이 크게 늘면서 티맵의 하루 사용자 수가 처음 500만명을 돌파했다. 이 기간 동안 이용자들이 가장 많이 방문한 장소는 스타필드 하남인 것으로 나타났다.티맵모빌리티는 어린이날인 지난 5일 기준 티맵 일 활성 사용자 수(DAU)가 502만명을 기록한 데 이어 6일 507만명, 7일 522만명으로 사흘 연속 최대 기록을 경신했다고 9일 발표했다.



 [사진=티맵모빌리티]기존 티맵 DAU 최대 기록인 484만명(2021년 11월 6일)과 비교하면 38만명(7.8%) 가량 증가한 수치다. 국내 자동차 등록 대수가 약 2천500만대인 점을 고려하면, 징검다리 연휴 기간에 매일 운전자 5명 중 1명은 티맵으로 목적지를 설정한 후 이동한 셈이다.지난달 중순 사적 모임 인원과 영업시간 제한이 전면 해제되면서 티맵 이용량은 꾸준히 증가했다. 특히 가정의 달인 5월 들어 국내 이동량 증가세가 도드라졌다. 실제로 5월 첫째 주 티맵 주간 활성 사용자 수(WAU)는 역대 최대치인 986만명으로 집계됐다.티맵모빌리티 측은 어린이날부터 시작된 징검다리 연휴 기간에 코로나19 장기화로 억눌렸던 야외 활동 욕구가 크게 치솟은 것으로 분석했다. 지난 1일부터 7일까지 1주간 티맵의 전체 길 안내 건수는 7천374만건이었다. 지난해 같은 기간(2021년 5월 1~7일) 6천30만건보다 1천344만건(22.2%) 증가했다. 전월 같은 기간과 비교해도 1천40만건(16.4%) 늘었다.티맵 이용자들은 징검다리 연휴 기간에 대형 쇼핑몰, 놀이동산, 공항 등을 주로 방문한 것으로 나타났다. 징검다리 연휴 기간 티맵의 전국 인기 목적지는 스타필드 하남, 에버랜드, 현대프리미엄아울렛 김포점, 스타필드 고양, 김포국제공항국내선 순이었다. 특히 어린이날 티맵 이용자들이 에버랜드를 목적지로 설정한 횟수는 9851건에 달했다.",105,https://n.news.naver.com/mnews/article/031/0000671231?sid=103
"원스토어 ""상장 철회는 없다""…구글-애플 독과점 깬다",2022.05.09. 오후 3:05,"기사내용 요약""SK쉴더스 상장 철회 유감…원스토어 성장 가능성 훨씬 커"" ""글로벌 시장서 성장 기회 놓칠 수 없다…상장 밀고 나갈 것""



[서울=뉴시스] 오동현 기자 = ""원스토어는 앞으로 성장할 가능성이 크기에 상장을 철회할 계획이 없다.""이재환 원스토어 대표는 9일 서울 여의도에서 IPO(기업공개) 추진 관련 미디어 간담회를 열고 SK쉴더스의 전철을 밟지 않겠다고 못 박았다. 토종 앱마켓 원스토어는 이달 중 유가증권시장(KOSPI) 상장을 추진한다. 같은 SK스퀘어 자회사인 SK쉴더스가 상장 절차를 자진 철회했기 때문에 원스토어의 행보에 관심이 쏠리고 있다.SK쉴더스의 경우 최종 공모가 확정을 위한 수요 예측을 실시했지만, 회사의 가치를 적절히 평가 받기 어려운 측면 등 제반 여건을 고려해 지난 6일 상장 철회 신고서를 제출한 바 있다.이 대표는 ""경제상황이 어려울 때 옥석이 가려진다고 생각한다""며 ""같은 계열사가 상장을 철회한 것은 굉장히 안타깝지만, 원스토어는 앞으로 성장 가능성이 훨씬 크다고 보기에 어려운 시장 상황임에도 상장을 쭉 밀고 나갈 생각""이라고 강조했다.공모가 고평가 우려에 대해선 ""미래 업사이드(상승 여력)를 놓고 보면, 현재 공모가도 상당한 할인율로 반영돼있다""며 ""적절한 공모가라 생각한다""고 말했다.상장이 성사되면 원스토어는 정보통신기술(ICT) 투자전문회사 SK스퀘어의 첫 번째 상장사에 이름을 올리게 된다. 다만 업계 일각에선 원스토어의 상장 시점에 우려를 나타내기도 한다. 국내외 금리 인상 기조로 증시가 불안해지면서 투자 심리가 위축됐기 때문이다. 김상돈 원스토어 최고재무책임자(CFO)는 ""글로벌 앱마켓 시장에서 원스토어의 거래액은 구글과 애플을 제외하면 사실상 1위다. 이런 사업적인 기회가 있는 상황에서 재무적인 상황을 고려해 IPO를 내년이나 내후년으로 미루면 글로벌 시장에서 성장할 기회를 놓칠 수 있다""면서 ""상장을 성공적으로 마무리하고 싶다""고 전했다. 2016년 출범한 원스토어는 구글과 애플이 독과점하고 있는 앱마켓 시장에서 유의미한 경쟁을 펼치는 전세계 유일한 기업으로 성장했다.원스토어의 성장은 2018년 7월 업계 최초로 앱마켓 수수료를 30%에서 20%로 낮추고, 자체 결제를 허용하며 수수료를 5%로 책정한 상생 정책 시행이 결정적 계기가 됐다. 또한 이용자들에게도 통신 3사 멤버십 할인 및 적립을 매일 10%까지 제공하고, 다양한 할인 이벤트 및 캐쉬백 등 혜택을 제공하며 고객들의 호응을 얻었다. 원스토어는 수수료 정책을 변경한 2018년 3분기부터 지난해 말까지 14개 분기 연속 성장을 달성하면서 지난해 1조 1319억 원의 거래액을 기록했고, 동기간 거래액 규모가 2배 이상 성장했다. 또한 지난해 매출액은 2142억 원으로 창사 6년 만에 2000억 원대를 돌파하며 2020년 대비 38%의 높은 성장세를 기록했다.상장 후 원스토어는 동남아, 유럽 등 글로벌 시장 개척에 나선다. 현재 '글로벌 원스토어' 서비스 출시를 위한 플랫폼 구축을 완료했고, 시장별 차별화 서비스를 준비 중이다. 동남아 시장에서는 국가별로 이용자들이 선호하는 결제 수단을 제공하기 위해 현지 결제 사업자들과의 파트너십을 추진하고 있다. 또한 유럽 시장 진출을 위해 현지 통신사를 비롯해 대규모 고객기반을 가진 사업자들과 마케팅 협력을 논의 중이다.이 대표는 ""구글과 애플의 독과점 시장에서 전세계 유일한 대안은 원스토어라 확신한다""며 ""글로벌 서비스에 필요한 역량을 갖췄고, 각국 현지화를 진행하고 있다. 수수료 경쟁력은 글로벌 시장에서도 유지할 것이다. 특히 동남아 시장의 경우 선불카드 등 현지 특화 결제수단을 최대한 수용해서 관련 수요를 흡수하려고 한다""고 밝혔다. 이어 ""유럽 시장은 통신사의 영향력이 막대하기 때문에 일종의 지역 통신사를 규합하는 '유럽판 원스토어'를 만들려고 한다. 이미 독일의 통신사 3곳과 함께 사업을 할 수 있는 방향과 전략에 대해 논의 중이다. 올 하반기 동남아 6개 국가에 이어, 향후 유럽 등지에서 서비스 예정""이라고 덧붙였다. 또 원스토어는 마이크로소프트(MS), 텐센트 등 글로벌 IT기업과의 협업을 통해 모바일의 한계를 넘어 PC, 콘솔 등 다양한 플랫폼으로 사업영역 확장을 추진한다. 이와 함께 애플 iOS 시장으로 진입하기 위한 준비에 박차를 가하고 있다.이 대표는 ""올해 연말이나, 내년 초 정도가 되면 원스토어가 애플 iOS 시장에 진입할 수 있을 것으로 본다. 원스토어는 안드로이드 앱마켓을 운영하면서 애플이 우려하는 보안 문제를 극복했고 문제가 없다. 서드파티 앱마켓에서 원스토어는 규모나 역량, 경험 등을 고려할 때 넘버1이 될 것""이라고 자신했다. 또 그는 ""오늘의 원스토어가 국내 7조 원의 시장에서 사업을 하는 안드로이드 앱마켓 사업자라면, 내일의 원스토어는 2025년 전세계 약 300조 원의 시장을 놓고 당당히 경쟁하는 글로벌 앱마켓 사업자로 도약할 것""이라고 밝혔다.앱마켓으로서 전세계 최초 상장을 앞둔 원스토어는 총 666만 주를 공모할 예정이며, 주당 공모 희망가는 3만4300원~4만1700원으로 상장 후 기업가치는 상단 기준 약 1조 1111억원이다. 기관투자자 대상 수요예측은 5월 9일~10일 실시하며, 일반인 청약은 12일~13일 진행된다. 대표 주관사는 NH투자증권, KB증권이며, SK증권이 공동주관사를 맡았다. 하나금융투자와 대신증권은 인수회사로 참여한다．",105,https://n.news.naver.com/mnews/article/003/0011171995?sid=103
이임사 하는 임혜숙 장관,2022.05.09. 오후 5:12,(서울=연합뉴스) 임혜숙 과학기술정보통신부 장관이 9일 세종특별자치시 세종파이낸스센터 과기정통부에서 열린 이임식에서 이임사 하고 있다. 2022.5.9 [과학기술정보통신부 제공. 재판매 및 DB 금지]    photo@yna.co.kr,105,https://n.news.naver.com/mnews/article/001/0013165992?sid=103
,,,105,https://n.news.naver.com/mnews/article/366/0000811968?sid=103
"한국방송·미디어공학회, '춘계 방송과 미디어 기술 워크숍' 개최",2022.05.09. 오후 2:24,한국방송·미디어공학회(회장 이수인)는 이달 17일 '춘계 방송과 미디어 기술 워크숍'을 개최한다고 9일 밝혔다. 행사는 디지털 전환과 방송·미디어를 주제로 열린다. 방송과 미디어 산업 전반을 디지털 전환을 조망하는 자리로 꾸려졌다. 키노트 세션은 김남두 KISDI 실장과 이상원 경희대 교수가 OTT와 광고를 주제로 강연을 진행한다. 행사 2일차인 이달 18일에는 방송의 디지털 전환 경험과 미래 방송 및 미래 디스플레이 전망에 관한 키노트 세션이 열린다. 김흥묵 프로그램 위원장은 “이번 워크숍을 통해 방송과 미디어 분야 산학연 전문가들이 디지털 전환 측면에서 새로운 관점을 발견하는 기회가 되길 바란다”고 말했다.,105,https://n.news.naver.com/mnews/article/030/0003015603?sid=103
“유니티의 모든 것이 여기에” ‘유니티 웨이브 2022’ 막올려,2022.05.09. 오후 2:25,"유니티는 자사의 최신 기술과 개발 노하우를 공유하는 ‘유니티 웨이브 2022’를 오늘(9일) 개최했다.온라인과 오프라인으로 동시에 진행되는 이번 행사는 게임, 시뮬레이션, 디지털 트윈,  가상·증강현실 등 다양한 산업 분야에서 사용되는 유니티 엔진의 기능을 소개하는 35개 세션이 오늘부터 13일까지 약 5일간 진행된다. 



‘유니티 웨이브 2022 (자료 출처-게임동아)이번 행사의 첫 강연에 나선 이는 유니티 코리아의 김범주 본부장이었다. 'Unity 2022 Introduction' 강연에 나선 김범주 본부장은 3D, 2D 그래픽과 XR(VR/AR/MR), 프로그래밍 및 플랫폼 등 유니티 2022의 다양한 신규 기능과 향후 개발 계획에 대한 세밀한 내용을 소개했다. 김 본부장은 유니티는 다양한 측면에서 퀄리티 향상에 노력하고 있으며, 메타버스 프로젝트를 비롯한 다양한 형태의 기획과 플랫폼에 대응하는 것을 중점으로 엔진을 개발하고 있다고 설명했다.여기에 다양한 분야에서 프로그램 제작에 나서고 있는 개발자들을 위해 프로젝트에 필요한 기능을 지원하는 패키지를 쉽게 추가 및 제거할 수 있는 '패키지 매니징', 빠르게 특정 코드와 어셋을 찾을 수 있는 검색 기능의 개선, 에디터 인터페이스 직관화 등 편의성을 강화하고 있다고 소개했다.



유니티 김범주 본부장(자료 출처-게임동아)아울러 URP, HDRP 등 플랫폼 별로 최적화된 그래픽 및 UI 퍼포먼스를 제공하는 기능을 강화하여 더욱 세밀한 그래픽 퍼포먼스 기능을 제공하며, 아티스트가 직관적으로 그래픽 개발에 참여하기 위해 실시간 콘텐츠 제작 도구인 '아티스트 그래프 툴즈'를 새롭게 도입하는 등 코딩을 모르는 이들도 쉽게 프로젝트를 구현할 수 있도록 지원한다고 밝혔다.이외에도 콘솔, XR, 메타버스 등 다양한 플랫폼과 프로젝트에 효과적으로 대응할 수 있는 기능을 소개한 김 본부장은 ""디바이스가 점차 늘어나는 현재 시장의 흐름에서 유니티는 다양한 개발환경에서도 빠르게 대응할 수 있는 기능을 지원하기 위해 노력할 예정이며, 어떤 목표를 가는 프로젝트던 효과적인 툴로 자리 잡을 수 있도록 노력할 것이다""라고 강연을 마쳤다.김 본부장의 강연으로 막을 올린 이번 ‘유니티 웨이브 2022’에서는 다양한 주제의 강연이 진행된다.



유니티 웨이브(자료 출처-게임동아) 유니티의 최신 샘플 게임 ‘기가야(Gigaya)’에 사용된 기술과 워크플로를 소개하는 것은 물론, XR 개발 워크플로 속도를 향상시킬 수 있는 유니티 최신 기능을 소개하는 강연이 진행된다. 아울러 메타(Meta)와 유니티 담당자가 참여해 다양한 광고 네트워크를 한 번의 연동으로 쉽게 수익화 할 수 있게 해주는 유니티 미디에이션(Unity Mediation), 광고 수익 최적화 방법을 소개하는 등 각 분야의 전문가들의 발표가 5일에 걸쳐 진행될 예정이다.한편, ‘유니티 웨이브 2022’는 한국과학기술회관과 온라인 채널을 통해서도 시청할 수 있으며, 사전 등록 후 무료로 참여할 수 있다. 여기에 행사 기간 중에도 온라인 참여를 원하는 누구나 등록 후 참여가 가능하다. 동아닷컴 게임전문 조영준 기자 june@gamedona.co.kr",105,https://n.news.naver.com/mnews/article/020/0003427286?sid=103
"브이에이코퍼레이션, 메타버스 방송제작사 인수",2022.05.09. 오전 11:24,"브이에이코퍼레이션이 메타버스 방송제작사 루트엠엔씨를 인수하고 자회사로 편입한다. 기술 기반 복합 콘텐츠 카테고리를 개척할 예정이다.브이에이코퍼레이션이 자회사로 편입한 루트엠엔씨는 방송콘텐츠 제작사 '컴퍼니코비'에서 분사한 가상현실(VR)·증강현실(AR)·혼합현실(MR) 등 실감콘텐츠 전문 제작사다. 지상파 방송사 정규 프로그램과 VR 콘텐츠까지 다양한 콘텐츠 제작 노하우와 전문 인력을 보유하고 있다.브이에이코퍼레이션은 루트엠엔씨 인수로 기술 기반 콘텐츠 기획력을 한층 강화시키며 제작·배급 등 콘텐츠 제작 전반을 커버할 수 있는 종합 콘텐츠 유니온을 구축했다. 유기적인 비즈니스 협업으로 버추얼 프로덕션과 기술력 기반 콘텐츠 제작 범위를 한층 확대할 계획이다.시각특수효과(VFX) 전문기업 모팩, 영화 투자배급사 에이스메이커무비웍스, 종합 콘텐츠 제작회사 포커스엑스 등 9개 자회사 간 시너지를 바탕으로 제작 속도와 완성도를 강화하며 영화·드라마 이외에도 엔터테인먼트 분야 콘텐츠 제작에도 박차를 가할 예정이다.브이에이코퍼레이션은 루트엠엔씨와 국내 최초로 선보이는 메타버스 음악 예능 프로그램 '아바타 싱어'를 제작하고 있다.김동언 브이에이코퍼레이션 대표는 “앞으로 브이에이코퍼레이션은 루트엠엔씨를 포함한 자회사와 긴밀한 네트워크를 구축해 나갈 것”이라며 “보유 기술 융합·밸류체인을 강화하고 다양한 콘텐츠 IP를 확보, 사업 다각화를 위한 비즈니스 모델을 확립할 계획”이라고 밝혔다.",105,https://n.news.naver.com/mnews/article/030/0003015534?sid=103
