title,date,main,section,url
"""앱 '소문' 통해 국산SW 공공시장서 더 많이 유통되게""",2021.10.22. 오후 4:56,"송영선 한국상용SW협회장 '2021 글로벌 상용SW명품대전'서 밝혀""우리 협회가 만들고 있는 앱 '소문'을 통해 회원사뿐 아니라 제조사, 총판사 등 누구나 상용SW 제품을 등록할 수 있으며, 공공발주자들에게 관련 정보를 보다 쉽게 제공함으로써 공공시장에서 상용SW가 지금 보다 많이 또 더욱 폭넓게 사용될 수 있도록 지원하겠습니다.""송영선 한국상용SW협회장은 22일 한국PMO협회(회장 김인현)와 공동 주최한  '2021 글로벌 상용SW명품대전'에서 이 같이 밝혔다. 이 행사는 명품 상용SW를 개발 및 보급해 국내 상용SW산업발전에 이바지한 기업에 명품대상 시상을 하고 아울러 국내 산업(공공 및 민간 각 분야)에 보급돼 있는 상용SW 중 뛰어난 제품과 기술을 발표하는 자리다. 행사는 코로나19 확산 방지를 위해 온라인으로 진행됐고 시상식만 오프라인으로 열렸다. 과기정통부와 공공부문발주자협의회, 정부정보화협의회, 문화정보화협의회, 한국IT서비스산업협회가 후원했다.송 회장은 '소문' 앱에 대해 ""올해부터 소프트웨어진흥법 전부개정안이 본격 시행된 가운데 정부가 적기발주 지원, 원격개발 활성화, 공정한 과업변경과 함께 상용SW 유통활성화를 4개 중점 과제로 선정해 추진 중""이라면서 ""우리 협회는 공공부분 상용SW 유통활성화를 위해 회원사들의 조달청 나라장터 종합쇼핑몰 등록을 적극 지원하고 있다. 공공발주자들이 상용SW제품을 보다 쉽게 검색하고 비교해 볼 수 있게 앱 '소문'을 개발중""이라고 설명했다.



22일 열린 '2021 글로벌 상용SW명품대전'에서 수상자들이 기념 사진을 찍었다. 맨 오른쪽이 송영선 한국상용SW협회장.이어 송 회장은 대·중·소 협력체계를 통한 SW산업 생태계 발전을 위한 노력에 힘을 다하고 있다면서 ""클라우드 환경에서 새롭게 추진되고 있는  '디지털 서비스 전문계약제도' 활성화를 위해 상용SW제품의 SaaS 및 PaaS 전환 지원이 더욱 절실한 것이 현재 SW산업 상황""이라면서 ""상용SW 소·부·장화 사업의 정책 지원 필요성을 주장하고 있으며 이를 반영하기 위해 최선을 다하고 있다""고 덧붙였다.이날 1부 행사에는 소프트웨어정책연구소 박현제 소장이 '디지털대전환 시대의 SW'라는 주제로 기조 강연을 했고, 과기정통부 김정삼 국장이 'SW생태계 혁신 전략'을 주제로 SW산업 정책을 설명했다. 2부 행사에는 상용SW 신기술과 제품 발표가 진행됐다.한편 이날 열린 '제7회 글로벌 상용SW명품대상 시상'에는 ▲한국상용SW협회장상에 테르텐의 캠큐브(CamCube)  ▲공공부문발주자협의회장상에 한글과컴퓨터의 '한컴구름' ▲과기정통부 장관상에 비아이매트릭스의 '아이 캔버스(i-CANVAS)'가 각각 수상의 영예를 안았다.공공부문발주자협의회 신제수 회장은 축사에서 “국내 SW시장에서 외산SW 의존도가 높아지며 디지털 주권이 위협받고 있는 이때, 국산 명품 상용SW를 선정해 시상하고 발표하는 명품대전을 개최해준 관계자에게 감사를 전한다""고 말했다. 정부정보화협의회 주양근 회장은 축사에서 ""코로나 팬더믹 이후 SW사업이 필수요소의 하나로 위상이 높아지고 있는 이때, 오늘 행사가 SW산업 관계자뿐만 아니라 공공부문정보화 담당자들에게도 뜻깊은 행사가 될 것""이라고 밝혔다.",105,https://n.news.naver.com/mnews/article/092/0002236953?sid=103
[박진영의 사회심리학] 모든 생명은 결국 하나라는 믿음,2021.10.23. 오전 6:01,"픽사베이 제공   '인간은 죽으면 어떻게 될까'라는 질문에 대해 죽으면 흙이 될테고 그 흙에서 새로운 생명들이 자라날 테니, 죽음은 삶과 맞닿아 있고 생명이란 순환하는 것이 아닌가 같은 두루뭉술한 생각을 한 적이 있다. 어떤 삶도 완전히 소멸하기보다 삶의 고리 속에서 영원히 이어지는 것이 아닌가 하는 그런 생각이다. 어떻게 보면 엉뚱하고 말도 안 되는 생각일 수 있겠다. 불교에 대해 아무 것도 알지 못하지만 한편으로는 어쩌면 윤회라고 하는 것도 이런 생각이랑 맞닿아 있는 것은 아닐까하는 궁금증이 든다.   뜬금없이 이런 이야기를 하는 이유는 '세상 모든 것이 하나로 이어진다'는 두루뭉술한 생각이 모든 생명을 향한 측은지심과 자비와도 관련을 보인다는 발견이 있었기 때문이다.   미국 듀크대 심리학과 케이트 디벨스 교수는 한 실험에서 사람들에게 다음과 같은 질문을 했다. “세상 모든 것들은 어떤 큰 근본적인 울타리 안에서 하나라는 믿음을 가지고 있는 사람들이 있습니다. 당신도 이런 생각을 하나요?” 그리고 이와 같은 생각을 얼마나 자주하는지 물었다.   연구진은 이어 “겉모습은 달라도 세상 모든 것은 근본적으로 하나로 이어져 있다”, “겉으로는 달라 보여도 모든 것은 자신보다 훨씬 큰 어떤 존재의 일부이다”같은 문장을 보여주고 각각에 얼마나 동의하는지도 물었다.   사람뿐 아니라 동물, 환경 같은 다른 생명에도 보편적인 관심을 쏟는지, 타인을 향해 너그러운 마음을 갖는 편인지, 사람은 누구나 다 나름의 부족함과 고통을 겪고 있음을 인지하고 있는지에 대해서도 질문했다.   그 결과 '모든 것은 하나'라는 믿음이 강한 사람들이 그렇지 않은 사람들에 비해 더 많은 존재들을 향해 자비심을 가지려 애쓰는 것으로 나타났다. 타인을 향해서도 너그러운 마음을 견지하려는 편인 것으로 나타났다.   반면 '잘 살기 위해서는 다른 무엇보다 자기 자신을 우선시 여겨야 한다'는 생각은 덜 하는 것으로 나타났다. 또 자신과 관련된 생각에 빠져 있는 정도도 비교적 덜 한 것으로 나타났다.   비슷하게 설득과 관련된 연구로 유명한 미국 애리조나대 로버트 치알디니 교수의 연구가 있다. 이 연구에서도 공감보다도 타인과 자신이 '하나'임을 느끼고 경계를 허무는 경험이 더 직접적으로 이타심과 도움 행동의 열쇠가 된다는 결과가 나타났다.   참 설명하기 어렵고 구체적으로 말하기도 어려운 개념이지만 수천년은 훌쩍 된 것 같은 오랜 철학적 개념이 도덕성을 견지하기 위한 또 다른 열쇠일 수도 있다는 것이다. 모든 것이 이어져 있고 나와 타인, 나와 다른 생명들 사이에도 실은 뚜렷한 구분이 없다면, 나를 위하는 것과 타인을 위하는 것 사이의 경계도 없는 셈이다. 오랜 논쟁 거리가 되어 온 '진정한 이타심'이 가능한 것이냐는 질문 또한 의미를 잃게 된다.   비논리적인 이야기인 것 같지만 한편으로는 꼭 그렇지만도 않다고 느껴지는 것이 진화심리학에서 이야기하는 가설, 즉 우리는 유전자의 그릇일 뿐 나라는 사람 자체보다 유전자를 남기는 것이 더 큰 목적이기 때문에 유전적으로 가까운 사람들을 돕는 것은 진화적으로도 충분히 이득인 일이라는 이야기와도 맞닿아 있는 듯 보이기 때문이다.   모든 생명은 결국 하나라는 믿음이 있어야 경계 없는, 진정한 자비가 가능함을 알기 때문에 다양한 종교들과 옛 성현들이 대상과의 경계가 사라진 물아일체의 경지를 추구했던 것은 아닐까? 한편 이런 경지가 근심을 없애주고 진정한 평화를 가져다준다고 하니 언젠가 한 번 정도는 이뤄보고 싶다는 생각이 든다. 관련된 연구들도 점점 더 많이 이루어지길 바란다.    ※참고자료  -Diebels, K. J., & Leary, M. R. (2019). The psychological implications of believing that everything is one. The Journal of Positive Psychology, 14(4), 463-473. https://doi.org/10.1080/17439760.2018.1484939   -Cialdini, R. B., Brown, S. L., Lewis, B. P., Luce, C., & Neuberg, S. L. (1997). Reinterpreting the empathy–altruism relationship: When one into one equals oneness. Journal of Personality and Social Psychology, 73(3), 481–494. https://doi.org/10.1037/0022-3514.73.3.481   ※필자소개 박진영 《나, 지금 이대로 괜찮은 사람》, 《나를 사랑하지 않는 나에게》를 썼다. 삶에 도움이 되는 심리학 연구를 알기 쉽고 공감 가게 풀어낸 책을 통해 독자들과 꾸준히 소통하고 있다. 온라인에서 지뇽뇽이라는 필명으로 활동하고 있다. 현재는 미국 노스캐롤라이나대에서 자기 자신에게 친절해지는 법과 겸손, 마음 챙김에 대한 연구를 하고 있다.",105,https://n.news.naver.com/mnews/article/584/0000016452?sid=103
[워케이션] 떠나요~ 일하러~ 전 지금 열일중입니다,2023.10.22. 오전 6:01,"[지방소멸 해법 ‘워케이션’] 제주 구좌 세화마을서 2박3일 워케이션 체험 질그랭이거점센터 공유사무실로 출근 한결 가벼운 몸과 마음…기사도 술술 능률 향상·스트레스 해소 가장 큰 장점 퇴근후 여행객 모드…지역 활성화 기여지방소멸이 심각하다. 농촌지역마다 관계인구를 불러 모으기 위한 노력이 한창이다. 여러 해법 가운데 ‘워케이션’이 눈길을 끈다. 워케이션(Workation)이란 일(Work)과 휴가(Vacation)의 합성어로, 휴가지에서 일하는 근무 형태다. 인터넷·컴퓨터·스마트폰만 있으며 어디서나 일할 수 있는 직종이 많아지면서 등장했다. 도시를 떠나 워케이션을 즐기는 이들을 ‘디지털 노마드족’이라고 부른다. 이들은 농촌에 짧게는 하루, 길게는 몇달씩 머물며 지역경제에 활기를 불어넣는다. 지방소멸의 대안으로 떠오른 워케이션 유형과 국내외 사례를 톺아봤다. 기자가 2박3일 워케이션 체험에도 나섰다.일하느라 노트북을 노려본 지 벌써 2시간째다. 목이 뻣뻣하고 졸음이 쏟아진다. 미간에 잡힌 주름은 좀체 펴질 줄 모른다. 머릿속이 어지러운 걸 보니 휴식이 필요한 때인가보다. 창밖으로 시선을 돌렸다. 넘실대는 파란 파도가 손에 잡힐 듯 가깝다. 곧장 노트북을 접고 일어섰다.“바다로 가자!”



한창 일에 몰두하다가 잠깐 쉬는 시간. 사무실 문만 나서면 곧장 제주 바다가 눈앞에 펼쳐진다. 지끈지끈하던 머리가 금세 상쾌해지고 다시 열심히 일할 힘이 생긴다. 워케이션으로 일과 휴식, 두마리 토끼를 한방에 잡았다. 제주=현진 기자 sajinga@nongmin.com 



공유 사무실 창밖 풍경이 그림 같다. 탁 트인 전망이 업무 스트레스를 확 풀어준다. ◆일과 쉼 동시에…능률 업(Up)=최근 2박3일 동안 제주 제주시 구좌읍 세화리 질그랭이거점센터를 방문했다. 지난해 5월 문을 연 센터는 세화리가 2015년 농림축산식품부의 ‘농촌중심지 활성화사업’에 선정되면서 마련했다. 사업비 78억원으로 오래된 예식장을 고쳐 1층에 사무소, 2·3·4층에 각각 세화마을협동조합이 운영하는 카페 477+, 공유 사무실, 게스트하우스를 뒀다.천혜의 풍광을 자랑하는 제주는 워케이션 성지로 꼽힌다. 그중에서도 질그랭이거점센터는 가장 많은 이용객이 찾는 곳이다. 공유 사무실은 일하기 편리하도록 모니터·복사기·프린터 등이 구비됐고 세미나실도 갖췄다. 휴식을 위한 마을 여행 프로그램도 풍성하다. 한 건물에 숙박시설까지 있는 것도 장점이다. 주로 기업에서 워크숍처럼 단체로 방문해 이용한다. 지난해에만 워케이션 목적으로 20개 기업에서 600여명이 찾았고 올해 이용객은 1000명을 넘어섰다. 공항에서 오는 직행버스가 있어 뚜벅이 이용객에게도 안성맞춤이다.



눈치 보지 않고 편한 복장·자세로 일할 수 있는 것도 워케이션의 장점이다. 한국관광공사가 지난해 시행한 ‘워케이션 시범사업’ 참가자를 대상으로 한 만족도 조사에 따르면 응답자의 68.2%가 업무 수행이 만족스러웠다고 답했다. 그 밖에 회사에 대한 충성심과 애사심을 강화한다는 연구 결과도 뒤따르면서 워케이션을 독려하는 기업이 많다. 이런 변화에 발맞춰 제주도는 워케이션사업 활성화를 위해 힘을 쏟고 있다. 통합 플랫폼을 개설해 민간 사업장 18곳을 선별·중개한다. 내년까지 공공 워케이션센터 3곳도 개소한다. 도 관계자는 “워케이션 이용을 촉진하기 위한 바우처사업도 진행한다”면서 “워케이션을 위해 제주를 찾는 분들이 눈에 띄게 늘고 있는데 이들에게 도움이 될 것”이라고 밝혔다.워케이션 일과는 오전 9시에 시작한다. 눈을 뜨자마자 모자를 눌러쓰고 밖으로 나간다. 백사장을 거닐며 기지개를 켜고 정신을 차린다. 게으름 피운다고 오해는 금물이다. 맑은 정신으로 스마트폰을 들어 뉴스를 훑어보고 머릿속으로 오늘 할 일을 천천히 정리하는 것도 엄연한 업무다. 철썩철썩 파도 소리를 배경음악 삼는 출근길이라니! 매일 1시간30분씩 지옥철을 타고 가는 서울에선 상상할 수 없는 일이다.오전 10시 정각, 공유 사무실에 짐을 부렸다. 근무 시간을 정확히 지키는 것은 워케이션 성공 팁이다. 휴가 온 기분에 휩쓸렸다간 업무 할당량을 채우기 어렵다. ‘일하기 싫으면 어쩌지’ 하는 걱정도 잠시, 수평선이 한눈에 담기는 자리에 앉으니 일하고 싶은 마음이 절로 든다. 한결 가벼운 마음으로 기사를 쓰기 시작한다. 일하다 집중력이 흐트러지면 자리를 옮긴다. 폭신한 소파에 앉거나 좌식 테이블이 있는 평상으로 가 반쯤 누워 일한다. 카페에 내려가 백색소음 속에서 일하는 것도 효과적이다. 몸과 마음이 편하니 기사가 술술 써진다. 틀에 박힌 사무실에서 벗어나 낯선 환경에서 일하는 것만으로도 능률이 높아지는 것.무엇보다 가장 큰 장점은 스트레스 해소가 쉽다는 점이다. 서울에서 IT업계에 종사하는 김도연씨(29)는 “꽉 막힌 사무실에선 속이 답답하고 늘 짜증이 났는데 여기선 바다를 보기만 해도 사르르 마음이 풀린다”며 웃었다. 놀고 싶어서 일을 미루게 되지 않느냐는 질문에 “아무리 워케이션이라지만 해야 하는 일이 정해져 있으니 게으름은 피울 수 없다”고 답했다.



제주 제주시 구좌읍 질그랭이거점센터 2층에 있는 카페. 음료 한잔을 사면 3층 공유 사무실을 마음껏 이용할 수 있다. ◆노마드족 북적이며 지역경제에 활기=워케이션에서 놓칠 수 없는 것이 ‘저녁이 있는 삶’이다. 일을 마치면 곧바로 여행객 모드가 된다. 동네 카페 구경을 해볼까. 해녀박물관에 가볼까. 뭘 해야 할지 모르겠다면 세화마을협동조합에서 제안하는 여행 프로그램에 참여해도 좋다. 아침에 다랑쉬오름 둘레길을 걷는 노르딕워킹과 퇴근 후 마을을 유람하는 야밤투어 등이 준비됐다. 물때가 맞으면 낮 동안 해녀 체험 프로그램도 할 수 있다. 여러 여행·체험 프로그램은 모두 지역민이 운영하는 것으로, 덕분에 일자리가 생기면서 지역경제에 활기가 돈다.여행의 묘미 가운데 하나는 맛있는 음식을 맛보는 것일 터. 저녁 일정은 맛집 탐방이다. 카페에 앉아 뭘 먹을까 고민하니 양군모 세화마을피디(PD)가 맛집 엽서를 건넨다. 세화마을협동조합은 워케이션 이용객을 위해 가볼 만한 음식점을 소개하는 다양한 전단을 제작·배포한다. 전단을 들고 식당에 방문하면 소소한 서비스도 받을 수 있다.고민을 거듭한 끝에 향토음식 전문점인 ‘모다정’을 골랐다. 메뉴는 이름도 생소한 접짝뼈국이다. 돼지고기로 맛을 낸 국물이 일품이다. 슬리퍼를 신고 나온 40∼50대 주민들 사이로 연신 가게를 두리번거리는 청년들이 앉아 있다. 질그랭이거점센터가 생긴 뒤로 동네 식당에 젊은 손님이 꽤 늘었다. 지역민들은 실제 매출에도 긍정적인 효과를 줬다고 입을 모은다.워케이션 체험 후기를 독자들에게 전달하고자 찾은 제주. 조금은 낯설고 기사 마감에 대한 부담은 여전히 컸지만 청정 자연에서 얻는 에너지 덕분인지 어느 때보다 열정이 넘치는 걸 느낄 수 있었다. 워라밸(Work and Life Balance·일과 삶의 균형)의 중요성을 실감하는 하루하루였다.",105,https://n.news.naver.com/mnews/article/662/0000030420?sid=103
"'선불충전금 1800억' 스타벅스, 금감원 조사 받는다",2021.10.22. 오후 3:20,"[디지털데일리 박현영기자] 금융감독원이 미등록 선불전자지급수단 발행업체(페이 업체)들의 재무상태를 조사 중인 가운데, 업체 중 스타벅스도 포함됐다. 커피 체인 업체 중에선 유일하다.   21일 금융권에 따르면 최근 금감원은 전자식 상품권을 발행하는 미등록 선불업체 58곳으로부터 사업 현황 자료를 전달받았다. 충전금 운영의 적정성을 판단하기 위함이다.    스타벅스처럼 자사 가맹점에서만 충전금을 사용하는 커피 전문점의 경우 현행법상 선불업체 등록 대상이 아니다. 하지만 스타벅스의 경우 선불충전금 규모가 이례적으로 커 조사 대상에 포함됐다. 홍성국 더불어민주당 의원 자료에 따르면 스타벅스 선불충전금은 1801억원에 달한다.    스타벅스는 스마트폰 애플리케이션을 통해 선불충전금을 예치하고, 이를 통해 음료를 구매할 수 있도록 하고 있다. 일정 금액을 충전하면 결제 시 포인트를 적립해주는 방식으로 충전 기능 사용자 수를 늘려왔다.",105,https://n.news.naver.com/mnews/article/138/0002112133?sid=103
우마무스메·천애명월도... 지스타2021 출품작 속속 공개,2021.10.23. 오전 8:01,"[서울경제] 지난해 코로나19로 온라인 개최했던 국내 최대 게임쇼 ‘지스타(G-Star)’가 오는 11월 17일 부산 벡스코에서 개막한다. 메인스폰서인 카카오게임즈를 비롯한 게임사들도 속속 참가작을 공개하며 ‘분위기 띄우기’에 나서고 있다.



우마무스메 프리티더비. /사진제공=카카오게임즈22일 카카오게임즈는 기대작 ‘우마무스메 프리티 더비’를 지스타에 출품한다고 밝혔다. 이 게임은 일본 사이게임즈가 연초 출시해 현지에서 큰 인기를 끌고 있다. 경마를 소재로 의인화한 실제 유명 경주마들을 성장시키는 독특한 게임성을 지녔다. 카카오게임즈는 연내 국내 출시를 목표로 현지화를 진행하고 있다. 지스타에 출품한 만큼 현장에서 출시일자를 공개할 가능성이 높다는 평가다.카카오게임즈는 우마무스메 외에도 여러 신작을 공개할 것으로 예상된다. 내년 초 출시가 목표인 모바일 액션RPG ‘가디스오더’, 내년 2분기 글로벌 출시 예정인 엑스엘게임즈 모바일 다중접속역할수행게임(MMORPG) 신작 등이 주요 후보로 꼽힌다.대형 부스를 차리는 크래프톤도 신작 ‘배틀그라운드: 뉴스테이트’를 들고 부산을 찾을 것으로 보인다. 이 게임은 크래프톤 대표작인 배틀그라운드 신작이다. 11월 11일 출시 예정으로, 글로벌 사전예약은 5,000만을 넘어섰다.



프로젝트: 니케 게임화면 /사진제공=시프트업업계는 시프트업의 출품작에도 큰 관심을 보이고 있다. 시프트업은 ‘국가대표급’ 일러스트레이터인 김형태 대표가 이끄는 회사다. 스프트업은 김 대표의 미려하고 독특한 그림체로 팬층이 두텁고, ‘데스티니 차일드’의 성공으로 개발력도 인정받았다. 시프트업은 이번 지스타에 개발 중인 모바일 신작 ‘프로젝트: 니케’와 콘솔 게임으로 제작 중인 ‘프로젝트: 이브’를 선보일 것으로 전망된다. 김 대표는 지스타 컨퍼런스 첫날 키노트도 맡는다.외 참가 소식을 알린 그라비티는 대표 지식재산권(IP)인 라그나로크 시리즈를 대거 선보일 것으로 예상된다. 대구 지역 대표 스타트업으로 유명한 엔젤게임즈는 ‘신의 탑M’, ‘프로젝트 펜디온’ 등을 출품할 가능성이 높다.해외 게임사 신작 출품도 이어지고 있다. 텐센트는 ‘천애명월도M’을 지스타2021에 출품한다고 밝혔다. 이 게임은 지난해 10월 중국에서 출시해 애플 앱스토어 매출 1위를 2개월 간 유지한 바 있다.",105,https://n.news.naver.com/mnews/article/011/0003976550?sid=103
"KT-BC카드-서울대, 빅데이터 신기술 인재 양성 협력",2021.10.23. 오전 8:59,"(왼쪽부터)신수정 KT Enterprise부문장, 김홍기 서울대 빅데이터사업단장, 변형균 BC카드 AI빅데이터본부장KT가 BC카드, 서울대 빅데이터 혁신공유대학 사업단과 빅데이터 신기술 인재양성과 이를 위한 교육 인프라 구축 등 협력을 강화하는 내용의 협약을 체결했다.협약에 따라 KT의 통신 데이터·클라우드 기술과 BC카드의 금융데이터를 학생 교육에 활용하고, 교육자료 개발 및 실무형 신기술 개발 교육에 기업의 빅데이터 전문가가 참여한다.다양한 인프라 확보 및 적극적 인적교류로 빅데이터 실무형 인재 양성에 기여할 것으로 기대된다.서울대 빅데이터 혁신공유대학 사업단은 교육부가 한국판 뉴딜 프로젝트로 진행하는 '디지털 신기술 인재양성 혁신공유대학'의 빅데이터 인재양성 분야를 담당한다.'디지털 신기술 인재양성 혁신공유대학'은 2026년까지 빅데이터·인공지능·차세대 반도체·미래자동차·바이오헬스·실감미디어·지능형 로봇·에너지 신사업 등 8개 핵심 신기술 분야 국가 수준 핵심인재 10만명 양성을 목표로 하고 있다.김홍기 서울대 빅데이터 혁신공유대학 사업단장은 “학생이 기업에서 실제로 운용되는 빅데이터를 다뤄볼 수 있어 실무 기술을 익히게 될 것”이라며 “교육용 빅데이터 플랫폼 개발을 통해 모든 참여학생이 학교와 지역을 뛰어넘어 균등한 인프라를 이용할 수 있는 토대가 되기를 바란다”고 말했다.신수정 KT 엔터프라이즈부문장은 “교육부 디지털 신기술 인재양성 혁신공유대학에서 앞으로 6년간 신기술 인재 10만명을 양성할 수 있도록 협력하고 서울대 빅데이터 사업단과 통신 빅데이터 및 클라우드 교육과정 협력을 넘어 산학협력으로 발전시킬 수 있도록 최선을 다하겠다”고 밝혔다.",105,https://n.news.naver.com/mnews/article/030/0002977144?sid=103
"코빗, ‘가상자산 거래의 새로운 시작’ 캠페인 전개",2021.10.22. 오전 10:38,"창사 이래 첫 대규모 브랜드 캠페인 진행



코빗 ‘가상자산 거래의 새로운 시작’ 브랜드 캠페인 포스터.ⓒ코빗[데일리안 = 이건엄 기자] 가상자산 거래소 코빗은 창사 이래 처음으로 ‘가상자산 거래의 새로운 시작’ 브랜드 캠페인을 전개한다고 22일 밝혔다.코빗 관계자는 “가상자산 거래의 새로운 시작 캠페인은 코빗이 가상자산 사업자 신고를 완료하고 보다 많은 사람들에게 코빗을 알리기 위해 기획됐다”며 “이번 캠페인을 통해 코빗 브랜드뿐만 아니라 NFT((Non-Fungible Token·대체불가능토큰) 마켓, 메타버스 기반 플랫폼 코빗타운 등 차별화된 부가 서비스를 알릴 계획”이라고 설명했다.이달부터 12월까지 총 두 달에 걸쳐 진행되는 캠페인은 신촌, 강남, 신사역 일대 옥외 전광판을 시작으로 버스 외부와 버스 쉘터, 지하철 역사 내 전광판에서 만나볼 수 있다. 내달부터는 온오프라인을 아울러 영상 광고도 진행된다.오세진 코빗 대표는 “가상자산 거래의 새로운 시작 캠페인은 공식 가상자산거래소로서 코빗의 다양한 서비스를 소개하기 위한 것”이라며 “앞으로도 가상자산 업계에 바람직한 투자 문화가 자리 잡을 수 있도록 노력하겠다”고 밝혔다.",105,https://n.news.naver.com/mnews/article/119/0002540680?sid=103
