title,date,main,section,url
"삼성·SK, 반도체 설비투자 20% 줄인다",2018.12.17. 오후 4:15,"D램도 역성장 전망…메모리 보릿고개 온다(지디넷코리아=박영민 기자)연말부터 메모리 반도체 호황이 저물고 보릿고개에 접어들 것으로 전망되는 가운데, 주요 업체들이 시설 투자에 잔뜩 몸을 사리고 있다.지난해와 올해 메모리 공급이 꾸준히 늘어난 동시에 최대 수요처인 데이터센터 업계의 수요 전망이 불확실해지고 있기 때문이다.특히 그나마 믿을 수 있는 언덕이었던 D램의 역성장이 점쳐지면서, 삼성전자와 SK하이닉스의 내년 상반기 실적에도 먹구름이 드리웠다.



삼성전자와 SK하이닉스가 내년에 반도체 시설투자비를 20%가량 축소한다. (자료=지디넷코리아)시장조사업체 IC인사이츠의 보고서에 따르면 삼성전자와 SK하이닉스의 내년도 시설 투자액은 180억 달러(약 20조4천억원)와 100억 달러(약 11조3천억원)로 전망됐다.이는 올해보다 각각 20%, 22%가량 줄어든 것이다.업계 총 설비투자비도 1천억 달러 밑으로 떨어질 것이라는 설명이다.내년도 D램 시장 매출도 1% 감소할 것으로 분석됐다. 지난해(77% 증가), 올해(39% 증가)와는 업황이 180도 달라지는 셈이다.



내년도 D램 시장은 1% 역성장할 전망이다. (사진=IC인사이츠)IC인사이츠는 ""D램은 집적회로(IC) 분야 중 지난 2013년 이래 가장 빠르게 성장해왔지만, 내년에 역성장이 점쳐진다""면서 ""각 업체의 투자 규모도 줄어들 것""이라고 내다봤다.D램 매출 역성장의 원인은 크게 두 가지다.우선 업체들이 공급을 늘려 수급이 완화된 상태다. 게다가 경제 불확실성이 확대돼 D램 시장의 급성장을 주도한 데이터센터 수요 전망이 불투명해졌다.



(자료=IC인사이츠)주목할 점은 매출 역성장이 점쳐지는 가운데, D램이 시장 성장률 측면에서 품목별로 아직 선두를 지키고 있다는 것이다.반면, 지난해 2번째로 빠른 성장률을 기록했던 낸드는 5위로 떨어졌다.업계 한 관계자는 ""(D램) 매출이 1% 줄어들어도 성장 전망이 가장 높다는 게 문제""라며 ""낸드플래시를 포함한 기타 집적회로(IC) 분야의 하락세는 말로 표현하지 않아도 될 정도""라고 설명했다.



SK하이닉스가 개발한 4D 낸드 구조의 96단 512기가비트(Gb) 트리플 레벨셀(TLC) 낸드플래시. (사진=SK하이닉스)메모리의 또 다른 축인 낸드는 D램보다 더 가파르게 매출이 감소할 전망이다. 서버용으로 납품되는 솔리드스테이트드라이브(SSD) 수요는 양호한 가운데, 그 외 품목들의 수요는 부진한 상황이다.주요 업체들이 3D 낸드로의 전환을 안정적으로 마쳐 공급과잉이 확대됐기 때문이다.이에 대해 삼성전자는 ""D램은 일부 고객사의 단기적인 재고 조정에 따라 가격이 안정화될 가능성이 있다""며 낸드도 3D 제품 공급이 증가하고 PC용 SSD 경쟁이 심화돼 가격 하락이 예상된다""고 말했다.SK하이닉스도 ""경기 불확실성과 재고를 고려해 내년 투자 지출을 하향 조정할 것""이라며 ""연간보다는 분기별로 투자 계획을 수립해 대처하겠다""고 강조했다.박영민 기자(pym@zdnet.co.kr)  ▶ 네이버 채널에서 ‘지디넷코리아’를 구독해주세요",105,https://n.news.naver.com/mnews/article/092/0002152682?sid=103
‘바나듐 배터리’ 신재생에너지로 주목,2018.12.17. 오전 3:08,"리튬 배터리보다 수명 10배 길어… 폭발 위험 없어 발전소에 적합美-日-中 상용화, 한국은 사용 제한



에이치투(H2)가 개발한 바나듐 레독스흐름 배터리. 작은 컨테이너 크기로 부피가 크다. H2 제공스마트폰과 태블릿 등 전자 제품뿐만 아니라 발전소에서 생산한 에너지 저장장치(ESS)에도 리튬이온 배터리가 널리 쓰인다. 효율이 90%가 넘어 현재까지 나온 수많은 종류의 배터리 중 가장 뛰어나기 때문이다. 하지만 리튬이온 배터리는 폭발이나 화재의 위험이 있다는 게 치명적인 단점이다. 류원희 숙명여대 화학생명공학부 교수는 “전기차나 발전소에 포함된 리튬이온 배터리에서 사고가 발생하면 곧바로 인명 피해나 환경 문제로 이어질 수 있다”며 “안전성 문제를 해결한 새로운 배터리가 최근 연구되고 있는 이유”라고 말했다. 리튬이온 배터리는 리튬코발트계 산화물로 만든 양극활 물질(리튬이온이 나오는 물질)과, 전도성이 뛰어난 구리로 만든 음극활 물질(도선에 전자를 내보내는 물질), 이 둘 사이에 위치하는 분리막과 전해액으로 구성된다.  



전해액을 뺀 모든 구성요소는 다 고체다. 리튬이온이 전해액을 통해 양극물질 사이를 오가며 충전 방전이 이뤄진다. 3000회가량 충전 방전을 하면 용량이 떨어지기 때문에 수명은 2년 안팎이다. 류 교수는 “급속으로 충전 방전하는 과정에서 리튬이 날카로운 모양을 이루며 쌓이면 양극물질이 직접 만나지 못하게 막는 분리막이 찢어지고, 양 극의 활물질이 만나 화재나 폭발로 이어진다”고 설명했다. 이런 문제를 해결하기 위해 현재 중국과 미국 일본을 중심으로 태양광과 같은 신재생에너지 사업의 ESS에는 ‘바나듐 레독스흐름 배터리’가 상용화되는 추세다. 바나듐 배터리는 양극과 음극 액체 바나듐으로 된 전해액을 이용하는 배터리다. 두 개로 분리된 탱크에 양극 전해액과 음극 전해액을 채워 넣는다. 탱크 속 전해액이 산화환원 반응을 일으키고, 이때 발생하는 전위차를 바탕으로 에너지를 생성해 저장한다. 실제 공장 규모에 바나듐 배터리를 적용했을 때 나타나는 효율은 70% 정도다. 바나듐 배터리는 부피가 수 m³의 큰 탱크가 필요해 배터리 크기도 크다. 스마트폰이나 자동차에 적용할 순 없다. 반면 완전히 분리된 탱크에 양 극의 전해질이 존재하기 때문에 화재 염려가 없다. 또 전해액만 제때 갈아주면 용량이 감소할 염려도 없다. 업계에서는 소모품까지 감안한 바나듐 배터리의 수명을 평균 20년 이상으로 보고 있다.  한국도 바나듐 배터리 개발 사업에 뛰어들고 있다. 2010년 KAIST의 연구원이 주도해 설립한 에이치투(H2)가 2013년에 바나듐 배터리 상용화 제품을 내놨다.  또 스탠다드에너지, 코리드에너지 등 중소기업도 투자에 나서고 있으며, 현대중공업과 두산중공업 등 대기업도 관련 연구를 진행하고 있다.  그럼에도 현재 국내 신재생에너지 발전소의 ESS에는 바나듐 배터리가 적용되지 못하고 있다. 정부가 신재생에너지 발전 시설의 공급인증서를 발급할 때 리튬이온 배터리에 가점을 부여하고 있기 때문이다. 사실상 리튬이온 배터리를 권장하고 있는 것이다. 이신학 에이치투 사업개발 매니저는 “내년부터 바나듐 배터리 등도 가점 부여 대상에 포함될 것으로 검토 중인 것으로 알려졌다”며 “신재생에너지 발전소와 연계할 수 있는 사업을 준비 중”이라고 말했다. 김진호 동아사이언스 기자 twok@donga.com ▶ 동아일보 단독 / 우아한 : 우리 아이들의 & 아름다운 한반도▶ 네이버 홈에서 [동아일보] 채널 구독하기ⓒ 동아일보 & donga.com, 무단 전재 및 재배포 금지",105,https://n.news.naver.com/mnews/article/020/0003187507?sid=103
"삼성전자·SK하이닉스, 안갯 속 설비투자 계속",2018.12.17. 오후 3:45,"경기 이천시의 SK하이닉스 M14 공장. /사진=SK하이닉스삼성전자와 SK하이닉스가 반도체 설비투자를 이어간다. 눈앞의 시장 상황이 안갯속임에도 장기적인 관점으로 접근하겠다는 속내다.17일 반도체업계에 따르면 SK하이닉스는 오는 19일 경기 이천시에서 M16공장 착공식을 진행한다. M16은 이천 본사 내 부지 5만3000㎡에 들어서며 2020년 10월 완공 예정이다. M16에서는 10나노 초반대 D램을 생산할 것으로 보인다.앞서 최태원 SK그룹 회장은 오는 2024년까지 총 46조원을 투자하겠다고 밝혔다. 당시 최 회장은 충북 청주시와 경기 이천시에 공장을 건설하겠다고 밝혔다.청주 M15공장은 지난해 4월 15조5000억원이 투입돼 착공됐다. 3D 낸드플래시 전용 공장으로 규모는 23만㎡ 규모다. M15공장은 내년부터 72단 3D 낸드플래시와 현재 개발 중인 96단 낸드플래시 생산에 나선다.



김기남 삼성전자 DS부문장이 23일 경기도 삼성전자 화성캠퍼스에서 열린 ‘화성 EUV 라인 기공식’에서 기념사를 하고 있다. /사진=삼성전자삼성전자도 설비 투자를 계속한다. 삼성전자는 지난 2월 경기 화성시에 삼성전자 화성 EUV 라인 기공식을 열고 건설에 착수했다. 화성 신공장은 삼성전자가 비메모리 부문인 파운드리시장 경쟁력 확보를 위한 전초기지 역할을 수행할 것으로 예상된다.화성 EUV라인의 초기 투자 규모는 건설비용을 포함해 2020년까지 60억달러 수준이다. 2019년 하반기 공장이 완공되면 2020년부터 본격 가동을 시작한다.반도체 업계 관계자는 “삼성전자와 SK하이닉스가 메모리 반도체시장의 고점 논란에도 불구하고 향후 수요 회복에 대비하는 차원에서 설비투자를 진행하는 것으로 분석된다”며 “다만 3D 낸드플래시 분야의 설비투자는 과잉이라는 견해도 존재하는 만큼 내년에는 속도 조절에 나설 것으로 보인다”고 말했다.박흥순 기자 soonn@mt.co.kr<저작권자 ⓒ '성공을 꿈꾸는 사람들의 경제 뉴스' 머니S, 무단전재 및 재배포 금지>▶ 고수들의 재테크 비법 ▶ 박학다식 '이건희칼럼'",105,https://n.news.naver.com/mnews/article/417/0000363903?sid=103
"[이슈] 반려견과 문화생활 즐겨요…하트독, 애견 동반 관광지 3곳 추천",2018.12.17. 오후 2:36,"본 기사는 최근 대세로 떠오른 신규, 인기 스마트폰 게임과 관련 방송 콘텐츠 등을 소개하는 코너입니다. 소개 자료는 각 모바일게임 개발사를 비롯해 퍼블리셔와 게임 공략 커뮤니티 헝그리앱 등에 기초하고 있습니다. <편집자주> 



애견 호텔, 애견 펜션, 애견 카페 등 반려견과 함께 쉴 수 있는 장소들에 대한 자세하고 정확한 정보를 제공하는 반려견 정보 어플 하트독이 반려견과 문화생활을 즐길 수 있는 애견 동반 가능 관광지로 광주시립미술관, 광명 업사이클 아트센터, 내장산 조각공원 등 3곳을 추천했다.  광주광역시 북구 운암동에 위치한 광주시립미술관은 지난 1992년 개관한 미술관이다. 본관뿐 아니라 어린이미술관, 하정웅미술관 등 다양한 전시관에서 각종 전시가 진행 중이며, 전시관을 둘러싼 공원에서 반려견과 다양한 전시품을 감상하며 산책을 즐길 수 있다. 목줄을 착용한 소형견까지 동반 입장이 가능하므로 방문을 계획하고 있다면 본인의 반려견이 입장 가능한지 사전에 문의하는 것이 좋겠다.경기도 광명시 가학동에 위치한 광명 업사이클 아트센터는 재활용품을 활용한 예술품을 전시하고 다양한 교육 행사가 이루어지는 예술 공간이다. 반려견과 함께 각종 예술품을 감상할 수 있으며, 아이를 동반한 가족이 방문해 재활용에 관한 다양한 프로그램을 체험할 수도 있다. 목줄을 착용한 대형견까지 동반 입장 가능하다.충청남도 정읍시 쌍암동에 위치한 내장산 조각공원은 국내 4대 미술전 대상 수상 작가 16명의 작품을 전시한 조각공원이다. 연인 또는 가족과 방문해 다양한 작품을 감상할 수 있으며, 공원 내 식물원이 자리하고 있어 반려견과 풀 내음을 맡으며 산책을 즐기기에도 좋다. 목줄을 착용한 대형견까지 동반 입장 가능하다.하트독(HAT DOG)은 '개와 함께 행복한 여행(HAppy Travel with DOG)'이라는 모토에서 영어 대문자를 따와 명명된 어플로, 전국의 애견 호텔, 애견 펜션 등의 숙소, 애견 카페, 반려견과 동반 입장이 가능한 음식점, 관광지에 대한 실제 사진·금액·이용 정보를 지역별·거리별·인기별로 제공하며, 직접 다녀온 사람들의 생생한 후기를 볼 수 있다. 이밖에도 반려견 동반 시 에티켓, 항공편·렌터카 등 운송수단 동반 탑승 노하우 등 다양한 정보도 제공한다.신정원 기자 (sjw1765@dailyesports.com)",105,https://n.news.naver.com/mnews/article/347/0000125451?sid=103
"‘매드로켓’·‘복싱스타’, 앱스토어 선정 10대 한국게임",2018.12.17. 오후 5:22,"네시삼십삼분(대표 한성진)은 모바일게임 ‘복싱스타’와 ‘매드로켓: 포그오브워’가 애플 앱스토어의 ‘꼭 즐겨봐야 할 10대 한국 게임’에 선정됐다고 17일 밝혔다.‘복싱스타’는 복싱을 소재로 한 모바일 스포츠 게임으로 직관적인 터치 조작이 특징이다. 지난 7월 140개국 글로벌 출시 이후 19개 국가 앱스토어에서 인기 1위를 기록하고 98일만에 1000만 다운로드를 돌파했다. 



 또 ‘매드로켓: 포그오브워’는 전장 안개를 도입해 차별점을 둔 개인 간 전투(PVP) 기반의 모바일 전략 게임이다. 상대 진영을 정찰하고 방어시설을 은닉하는 등 폭넓은 전술 구사가 가능하다.네시삼십삼분은 “애플 앱스토어에서 선정한 한국을 대표하는 10개의 게임 중 두 개나 선정되어 매우 기쁘고 감사하게 생각한다”며 “앞으로도 ‘복싱스타’와 ‘매드로켓’이 전 세계 이용자들에게 더욱 사랑받는 게임이 될 수 있도록 노력하겠다”고 밝혔다.[임영택기자 ytlim@mkinternet.com]▶매경 뉴스레터 '매콤달콤'을 지금 구독하세요▶뉴스 이상의 무궁무진한 프리미엄 읽을거리[ⓒ 매일경제 & mk.co.kr, 무단전재 및 재배포 금지]",105,https://n.news.naver.com/mnews/article/009/0004273039?sid=103
"중국 언론계, 블록체인으로 저작권 보호",2018.12.17. 오전 9:00,"'중국 재경 언론 판권 보호 연맹' 설립(지디넷코리아=유효정 중국 전문기자)중국 언론들이 저작권 보호를 위해 블록체인 기술을 이용하기로 했다.17일 중국 매일경제신문에 따르면 중국 언론 업계는 공동으로 '중국 재경 언론 판권 보호 연맹'을 설립하고 블록체인 기술 등을 이용해 판권 보호 작업을 진행키로 했다. 지난 주말 주요 언론 미디어가 공동으로 참여한 제 3회 중국 산경 미디어 융합 발전 포럼에서 이같은 내용이 발표됐다.중국 재경 언론 판권 보호 연맹은 블록체인, 공개 키 암호, 신뢰 타임 스탬프(trusted timestamp) 등 기술을 이용해 원 창작자의 창작을 인증하고 판권을 보호할 수 있는 기술을 채용할 계획이다.블록체인 기술을 이용해 텍스트의 'DNA'를 식별하고, DNA 식별 이후 텍스트와 70% 이상 유사도를 보이는 텍스트에 대해 소셜미디어와 홈페이지 전반에 걸쳐 DNA 추적이 가능하다. 만약 저작권 침해 행위가 발견되면 플랫폼 상에서 증거를 채집할 수 있다.



바이두가 저작권관리에 적용한 슈퍼체인 블록체인 기술 플랫폼 (사진=바이두)최근 중국에서는 블록체인 기술을 콘텐츠 저작권 보호에 이용하려는 시도가 이어지고 있다.중국 검색 포털 바이두도 자체 블록체인 플랫폼 '슈퍼체인(Xuper Chain)'을 이용해 콘텐츠 저작권 보호 연구를 통해 뉴스 콘텐츠 정보 출처와 유통을 추적할 수 있는 기술을 개발했다.특히 바이두는 앞서 지난 4월 블록체인 사진 서비스 플랫폼 '토템'을 만들어 사진 콘텐츠에 대한 블록체인 저작권보호를 시작했다. 토큰 체계를 도입해 업로드된 사진에 대한 보상도 한다.정부 단위에서도 블록체인 기술을 저작권 보호에 적용하기 위한 노력이 이뤄지고 있다.중국 쓰촨성 정부는 국가광전총국, 쓰촨성 블록체인 연구개발 센터와 협력해 영상 방면의 저작권 보호 기술 개발을 진행하고 있다. 영상 영역에서 판권 보호 문제가 심각한 문제로 떠올랐다는 판단 때문이다. 영상 저작물의 생산부터 양도 등 모든 판권 관리가 기록 및 추적될 수 있는 체계를 만들고 이 과정에서 정부의 시스템과 연동될 수 있도록 할 계획이다.유효정 중국 전문기자(hjyoo@zdnet.co.kr)  ▶ 네이버 채널에서 ‘지디넷코리아’를 구독해주세요",105,https://n.news.naver.com/mnews/article/092/0002152634?sid=103
내일 출근길 5도 안팎 기온 '뚝'… 강원영동 오후까지 5∼10㎜ 비,2023.10.15. 오후 5:27,"▲ 최근 완연한 가을날씨를 보이고 있는 가운데 15일 배후령 인근 산들에 단풍이 들기 시작했다. 김정호월요일인 16일 전국 내륙을 중심으로 아침 기온이 5도 안팎까지 크게 떨어지면서 가을 추위가 이어지겠다.강원영동은 아침부터 오후까지, 경북북부동해안은 오후에 가끔 비가 오겠다. 예상 강수량은 강원영동 5∼10㎜, 경북북부동해안 5㎜ 안팎이다.아침 최저기온은 5∼16도, 낮 최고기온은 18∼23도로 예보됐다.전국 주요 지역 아침 최저기온은 서울 9도, 인천 11도, 수원 9도, 춘천 9도, 강릉 13도, 청주 11도, 대전 10도, 세종 10도, 전주 12도, 광주 13도, 대구 12도, 부산 15도, 울산 12도, 창원 12도, 제주 17도 등이다.전국 주요 지역 한낮 최고기온은 서울 19도, 인천 18도, 수원 19도, 춘천 19도, 강릉 19도, 청주 20도, 대전 20도, 세종 20도, 전주 19도, 광주 20도, 대구 21도, 부산 23도, 울산 21도, 창원 22도, 제주 22도 등이다.낮과 밤 기온 차는 10∼15도까지 벌어지겠으니 건강관리에 신경 써야겠다.중부서해안, 강원영동, 남부지방, 제주도에서는 바람이 순간풍속이 시속 55㎞(15㎧) 내외로 강하게 불겠다.경기 북부 내륙과 강원 내륙·산지에는 서리가 내리는 곳이 있으니 농작물 관리에 유의해야 한다.동해안에는 너울에 의해 높은 물결이 방파제나 해안도로를 넘는 곳이 있을 수 있으니 해안가 접근을 자제하는 게 좋다.바다의 물결은 동해 앞바다에서 0.5∼2.5m, 서해 앞바다에서 0.5∼1.5m, 남해 앞바다에서 0.5∼1.0m로 일겠다.안쪽 먼바다(해안선에서 약 200㎞ 내의 먼바다)의 파고는 동해 0.5∼3.0m, 서해 1.5∼3.0m, 남해 0.5∼2.0m로 예측된다.",105,https://n.news.naver.com/mnews/article/654/0000054742?sid=103
"이경민 교수 ""게임에서 인지발달성 찾는 발상의 전환 필요""",2018.12.17. 오후 6:18,"""우리는 폭력성, 선정성을 찾기 위해 게임을 심사한다. 발상을 전환해서 어떤 게임을 하면 어떤 기능이 향상되는지 찾아 볼 수 있다""게임과학포럼이 서울 강남구 라마다호텔에서 개최한 '제1회 태그톡(T.A.G talk)'에서 '어떤 게임을 하면 머리가 좋아질까'라는 학부모 질의에 이경민 서울대학교 인지과학연구소장이 이와 같이 답변했다.먼저 질의 자체에 대해 ""어떤 머리에 좋은지 구체화할 필요성이 있다""며 ""뇌 인지발달인지, 퇴화를 막는 데 쓰이는 지 등 어떤 머리에 좋은지 목적을 명확하게 할 필요가 있다""고 밝혔다.    해외에서는 학부모 단체가 어떤 게임이 소아청소년기에 인지영역을 발전시키는 지 전문가의 의견을 종합해 가이드라인을 제작하고 있다고 한다. 이경민 교수는 ""어떤 게임이 좋을까. 완벽하게 객관적으로 만들어지지 않았다""며 ""일단 게임에 대해 긍정적으로 바라보는 게 필요하다""고 밝혔다. 한편, 게임과학포럼은 서울대학교 인지과학연구소를 중심으로 이경민 교수, 신석호 소아청소년정신과 원장, 김경일 아주대학교 교수 등 인지과학, 심리학, 게임과학 등 다분야의 연구자들 및 신경과, 정신건강의학과 의료진이 주축이 돼 구성됐다.  해당 포럼은 매월 1회 정기 모임을 통해 게임관련 연구에 대한 학제간 정보교류의 시간을 갖는다. 아울러 추가 연구가 필요한 주제들에 대해 과학적 연구를 수행하고, 그 결과를 함께 논의할 예정이다. 강미화 기자 redigo@fomos.co.kr[게임&게이머, 문화를 전합니다. 포모스게임│무단 전재 및 재배포 금지]포모스",105,https://n.news.naver.com/mnews/article/236/0000182030?sid=103
출근길 5도 안팎 추위 주의…일교차 10~15도 짙은 안개도[오늘날씨],2023.10.16. 오전 6:00,"아침 최저 기온 6~16도, 낮 최고 기온 18~23도""바람 강하게 불어 체감온도 더욱 낮아""



맑은 날씨를 보인 15일 오전 제주시 애월읍 새별오름에 억새꽃이 활짝 펴 눈길을 끌고 있다. 2023.10.15/뉴스1 ⓒ News1 오현지 기자(서울=뉴스1) 이기범 기자 = 월요일인 16일 내륙을 중심으로 아침부터 쌀쌀한 가을 날씨가 이어지겠다.기상청은 이날 중부 내륙을 중심으로 아침 기온이 5도 내외로 낮으며, 바람도 약간 강하게 불어 체감온도는 더욱 낮겠다고 예보했다. 특히 일교차는 10~15도로 커 건강관리에 유의해야 한다.아침 최저 기온은 6~16도로 전날(7~16.3도)과 비슷하거나 조금 낮은 수준이다. 낮 최고 기온은 18~23도로 예상된다.주요 도시 예상 최저 기온은 △서울 9도 △인천 11도 △춘천 10도 △강릉 14도 △대전 11도 △대구 11도 △전주 12도 △광주 13도 △부산 15도 △제주 17도다.예상 낮 최고 기온은 △서울 19도 △인천 18도 △춘천 19도 △강릉 18도 △대전 19도 △대구 21도 △전주 19도 △광주 20도 △부산 23도 △제주 22도다.이날 전국이 대체로 맑은 가운데, 동풍의 영향으로 오전부터 강원영동을 중심으로 가끔 비가 오는 곳이 있겠다. 예상 강수량은 △강원영동 5~10㎜ △경북북부동해안 5㎜ 내외 수준이다.아울러 밤 12시부터 오전 9시 남부내륙과 강원영서, 충북, 경기남동부를 중심으로 가시거리 200m 미만 짙은 안개가 끼는 곳이 많겠다. 그 밖의 내륙에도 가시거리 1㎞ 미만의 안개가 끼는 곳이 있겠다. 강원산지에는 낮은 구름에 의해 가시거리 200m 미만 짙은 안개가 끼는 곳이 있겠다.또 중부서해안과 강원영동, 남부지방, 제주도를 중심으로 순간풍속 시속 55㎞ 내외 강한 바람이 부는 곳이 있겠다.이날 동해안에는 너울에 의해 높은 물결이 방파제나 해안도로를 넘는 곳이 있겠다. 기상청은 해안가 접근을 자제하는 등 안전사고에 각별히 유의할 것을 당부했다.미세먼지 농도는 원활한 대기 확산으로 전 권역이 '좋음'에서 '보통'으로 예상된다.",105,https://n.news.naver.com/mnews/article/421/0007110804?sid=103
"LG유플러스, 영상 시청 기부 캠페인",2018.12.17. 오후 6:16,"LG유플러스 모델들이 공연 미디어 플랫폼 U+아이돌라이브 핑크 크리스마스 캐롤 캠페인을 홍보하고 있다.        LG유플러스는 공연 미디어 플랫폼 U+아이돌라이브에서 아이돌 캐롤 영상을 시청하면 시청 건수 당 후원금 100원을 적립해 기부하는 핑크 크리스마스 캐롤 캠페인을 연말까지 진행한다고 17일 밝혔다.LG유플러스는 전세계 아동을 돕는 국제 구호개발 NGO 세이브더칠드런과 손잡고 고객 참여형 캠페인을 기획했다. U+아이돌라이브 애플리케이션(앱) 내 핑크 크리스마스 캐롤 시청 시 조회수 1건당 후원금 100원이 적립된다.EXID, 청하, 아스트로, 위키미키, 오마이걸, 더보이즈, 라붐, 핫샷, 김동한 등 인기 아이돌이 핑크 크리스마스 캐롤에 참여했으며 한팀당 후원금 최대 1000만원까지 기부가 가능하다. 영상 시청으로 적립된 기부금은 세이브더칠드런에 전달, 긴급구호 아동기금으로 활용될 예정이다.syj@fnnews.com 서영준 기자     ▶ 세상의 모든 골 때리는 이야기 'fn파스'▶ 속보이는 연예뉴스 fn스타  ※ 저작권자 ⓒ 파이낸셜뉴스. 무단 전재-재배포 금지",105,https://n.news.naver.com/mnews/article/014/0004145789?sid=103
