title,date,main,section,url
"NHN데이터, 데이터 통합 관리 솔루션 ‘다이티’ 라인업 강화",2021.05.18. 오후 2:02,"NHN데이터(대표 이진수)는 데이터 통합 관리 솔루션 ‘다이티’의 신규 라입업 ‘데이터 마켓’을 출시했다고 18일 밝혔다. NHN데이터는 이번 라인업 강화를 통해 데이터 플랫폼 사업을 본격적으로 확대한다는 계획이다.NHN데이터의 기술력이 집약된 ‘다이티’는 지난 2019년 첫선을 보인 이후 최근 총 4종의 서비스 라인업을 완성했다. ‘다이티’ 솔루션 도입만으로 별도 인프라 구축 없이 고객 데이터를 수집·분석하고 오디언스 타겟 마케팅까지 한 번에 집행할 수 있다는 것이 NHN데이터의 설명이다.‘다이티’는 ▲웹로그 분석 서비스 ‘에이스카운터’ ▲타겟 오디언스 추출 솔루션 ‘다이티 오디언스 매니저’ ▲타겟팅 배너 관리 솔루션 ‘다이티 캠페인 매니저’ ▲데이터 허브 역할의 ‘다이티 데이터 마켓’ 등 총 4가지 라인업으로 구성된다.이번에 문을 연 ‘다이티 데이터 마켓’은 국내 최대 규모의 웹·앱 오디언스 데이터와 콘텐츠를 판매한다. 온라인 쇼핑몰처럼 데이터 및 콘텐츠 상품을 자유롭게 구경하고 구매 할 수 있는 환경을 제공한다. 데이터 상품은 3100만개 ADID와 3억1000개 쿠키 기반의 비식별 데이터로 구성된다. ‘다이티 데이터 마켓’을 통해 구매한 동종 업종 데이터는 내부 데이터와 결합해 고객을 다각적으로 이해하고 마케팅 전략을 수립하는 데 활용할 수 있다.NHN에 따르면 국내 1위 웹로그 분석 서비스 ‘에이스카운터’는 20년에 달하는 서비스 업력을 바탕으로 국내 1만2000여개 웹사이트 및 앱의 고객 데이터를 수집 및 분석하고 있다. ‘다이티 오디언스 매니저’는 수집된 고객 데이터를 기반으로 원하는 조건의 타겟 오디언스를 추출할 수 있도록 지원한다. 추출된 타겟 그룹은 이메일, 문자메시지를 활용한 기존 내부 마케팅이나 외부 미디어의 타겟 마케팅에 적용할 수 있다. ‘다이티 캠페인 매니저’를 통해 타겟 그룹을 대상으로 자사 사이트에 맞춤형 콘텐츠를 노출할 수도 있다.NHN데이터는 “기업 내외부 데이터를 다양하게 활용하고자 하는 수요에 주목해 ‘다이티’ 솔루션 풀 라인업을 선보이게 됐다”라며 “’다이티 데이터 마켓’ 등 신규 서비스와 기존 서비스의 시너지를 통해 국내는 물론 글로벌 시장에서 신뢰받는 데이터 플랫폼 브랜드로 발돋움할 것”이라고 밝혔다.[게임진 임영택기자 ytlim@mkinternet.com]▶ '경제 1위' 매일경제, 네이버에서 구독하세요▶ 이 제품은 '이렇게 만들죠' 영상으로 만나요▶ 부동산의 모든것 '매부리TV'가 펼칩니다[ⓒ 매일경제 & mk.co.kr, 무단전재 및 재배포 금지]",105,https://n.news.naver.com/mnews/article/009/0004795820?sid=103
"비즈플레이, 희망급식바우처 사업 협력",2021.05.18. 오전 10:11,"서울시 교육청, 한국간편결제진흥원, 신한은행 등과 함께 업무협약 



  [파이낸셜뉴스] 비즈플레이가 코로나19 장기화로 초중고생들의 결식 우려 해소를 위해 '희망급식바우처' 사업에 나섰다. 비즈플레이는 이를 위해 서울시 교육청, 한국간편결제진흥원, 신한은행 등과 함께 업무협약을 채결했다고 18일 밝혔다.   서울시 교육청은 학생들의 결식 우려를 해소하고 학부모의 부담을 완화하기 위해 '희망급식 바우처 지원' 사업을 추진한다.   희망급식 바우처는 대상 학부모가 지원 신청 시 제로페이 플랫폼을 통해 만 14세 이상 학생 또는 학부모의 휴대폰으로 전송된다.   희망급식 바우처는 집에서 가까운 편의점 GS25, CU, 세븐일레븐, 미니스톱, 이마트24, 씨스페이스 등 6곳에서 사용할 수 있다.   비플제로페이는 제로페이 모바일상품권 및 앱 운영 역량을 바탕으로 서울시 교육청과 협력해 6개 편의점 대상 구매물품을 제한하는 기능을 개발하고, 비플제로페이 앱 외 제로페이 모바일 상품권 구매 및 사용이 가능한 앱에 서비스 연계를 추진할 계획이다.   이번 업무협약을 통해 비즈플레이는 정부 바우처 사업에 대상 수혜자 목적성에 부합한 품목을 구매할 수 있는 제로페이 기반 시스템을 운영, 그 기능을 확장해나갈 예정이다.   비즈플레이 관계자는 ""이번 업무협약을 통해 비즈플레이는 국가 바우처 사업을 신속하게 진행할 수 있게 됐다""며 ""집행 후 실시간 모니터링 체계를 강화해 국가사업에 기여하겠다""고 말했다. 이어 ""학생과 학부모들이 비플제로페이 앱으로 편리하게 바우처를 사용할 수 있도록 시스템 운영에 최선을 다하겠다""고 말했다.   비플제로페이는 개인, 기업 제로페이 결제가 가능한 간편결제 앱이다. 지난해부터 한결원의 제로페이 모바일상품권 시스템을 운영하고 있다.    monarch@fnnews.com 김만기 기자   ▶ 날로먹고 구워먹는 금융이슈 [파인애플]▶ 모(毛)아 모아 [모아시스]▶ 헉! 소리나는 스!토리 뉴스 [헉스]  ※ 저작권자 ⓒ 파이낸셜뉴스. 무단 전재-재배포 금지",105,https://n.news.naver.com/mnews/article/014/0004640912?sid=103
"룽투코리아, 신작 모바일 MMORPG ‘블라스트M’ 사전예약 돌입",2021.05.18. 오전 11:44,"룽투코리아는 신작 모바일 MMORPG ‘블라스트M’의 사전예약 페이지를 개설하고 정식 출시 전까지 신청을 접수한다고 18일 밝혔다.‘블라스트M’은 애니메이션 화풍의 그래픽과 캐릭터를 특징으로 내세운 모바일게임이다. 사악한 사신의 부활로 절망에 빠진 세계를 구할 구원자의 모험담을 그렸다.강력한 보스와 각종 던전 등이 제공되며 아레나, 정점대결, 공성전, 통합서버 유적 등 각종 전투 콘텐츠도 마련됐다. ‘기사’, ‘미호’, ‘성령’, ‘펫’ 등 주인공의 성장를 돕는 보조 요소도 존재하며 전투 중 일정 조건에 도달하면 ‘메카닉’을 소환해 특별한 전투를 진행할 수도 있다.룽투코리아는 사전예약 페이지와 구글 플레이, 원스토어, 갤럭시스토어, 애플 앱스토어를 통해 사전예약을 신청 접수하며 참여자 전원에게는 ‘블라스트M 칭호’, ‘사전예약 상자’, ‘모험 보스 체력 열매’ 등의 게임 아이템을 제공한다.사전예약자 수와 공식카페의 목표 가입 인원수를 달성할 경우 추가 보상도 지급하며 SNS 공유 이벤트도 마련해 아이패드 프로, 애플워치, 원마운트 워터파크 종일권 등의 경품도 선물한다.[게임진 임영택기자 ytlim@mkinternet.com]▶ '경제 1위' 매일경제, 네이버에서 구독하세요▶ 이 제품은 '이렇게 만들죠' 영상으로 만나요▶ 부동산의 모든것 '매부리TV'가 펼칩니다[ⓒ 매일경제 & mk.co.kr, 무단전재 및 재배포 금지]",105,https://n.news.naver.com/mnews/article/009/0004795737?sid=103
한국도 달 너머 우주 탐사 준비한다,2021.05.18. 오후 4:01,"KAIST·항우연·천문연 심우주 탐사 계획 위해 머리 맞대



중국의 화성탐사선 톈원 1호. 궤도선, 착륙선, 탐사로버로 구성돼 있다. CNSA 제공   지구 중력이나 자기장의 영향이 미치지 않는 우주 공간을 탐사하는 달 보다 먼 우주를 탐사할 중장기 연구개발 계획을 수립하기 위해 관련 연구기관장이 머리를 맞댔다.   과학기술정보통신부는 용홍택 1차관과 이광형 KAIST 총장, 이상률 한국항공우주연구원 원장, 박영득 한국천문연구원 원장이 18일 오후 3시 대전 KAIST에 모여 심우주 탐사 전문가 간담회를 개최했다고 밝혔다.    앞서 각 기관은 심우주 탐사 시대 기관 간 협력이 필요하다는 공감대를 이뤄 지난해 12월 ‘심우주 탐사 분야의 연구개발 및 사업화를 위한 협력 양해각서(MOU)’를 체결했다. 심우주란 지구와 달 사이 거리를 넘어서는 우주를 뜻하는 용어다. 이에 따라 향후 연구개발 계획을 수립할 실무급 ‘심우주 탐사 연구연합회’ 발족을 준비중이다.    이날 전문가 간담회는 심우주 탐사와 관련된 연구기관의 현황 및 중장기적 계획을 공유하고 기관간 적극적인 협력을 위해 마련됐다. 심우주 탐사는 미래 우주 기술 확보, 우주자원 활용 등과도 연계돼 독자 발사체, 위성 기술 확보 이후 한국도 지속적으로 도전해야 할 분야다.    KAIST와 항우연, 천문연 3개 기관은 심우주 탐사 연구연합회를 통해 우주 과학연구와 탐사 기술 개발을 위한 연구계획을 공유·협의해 심우주 탐사 계획 수립을 지원한다는 방침이다.    이날 회의에서 각 기관의 심우주 탐사 전문가들은 지난해 MOU 체결 후 실무협의 진행 상황을 공유했다. 기관별 우주 탐사 추진 현황과 향후 계획 발표 이후 의견을 교환했다.    용홍택 과기정통부 1차관은 “올해 10월 한국형 발사체 ‘누리호’ 발사 이후 국내 우주개발 역량을 더욱 높이기 위해 우주탐사 계획을 포함한 우주개발 고도와 준비와 노력을 지속해야 할 것”이라며 “올해 하반기 수립 예정인 ‘국가 우주탐사 로드맵’과 연계해 정부 정책으로 검토할 계획”이라고 밝혔다. [김민수 기자 reborn@donga.com]▶코로나19 백신 치료제의 모든 것▶네이버에서 동아사이언스 구독하기▶'동아사이언스'에서 더 많은 뉴스 보기ⓒ 동아사이언스 콘텐츠 무단 전재 및 재배포 금지",105,https://n.news.naver.com/mnews/article/584/0000014288?sid=103
"美 코어에이아이, 대화형 AI로 한국시장 공략..합작법인도 추진",2021.05.18. 오후 4:09,"고객응대 업무 자동화…30% 이상 비용절감최근 한국에 지사 설립..초대 지사장 이영수씨AI 챗봇 한계 극복할 것국내 기업과 합작법인 설립 검토…""한국어 제약 우려 해소""



이영수 코어에이아이 코리아 지사장(사진=코어에이아이 코리아 제공)[이데일리 이후섭 기자] 인공지능(AI)을 활용한 챗봇 상담 시장이 커지면서, 미국 올랜도에 본사를 두고 있는 코어에이아이가 국내 시장에 상륙했다.이 회사는 AI 챗봇의 업그레이드 버전인 `디지털 비서` 플랫폼을 내세워 국내 금융, 이커머스, 제조업을 집중 공략할 방침이다. 한국어 지원 강화, 음성인식 등을 위해 국내 기업과 합작법인 설립 등 전략적 협업을 추진하고 있다.이영수 코어에이아이 코리아 지사장은 18일 첫 온라인 간담회를 통해 “기업의 약 80% 업무를 대화형 AI 기술을 통해 자동화하는 것을 목표로 하고 있다”며 “국내 대형 이커머스 업체가 우리와 프로젝트를 진행하고 있다. 금융, 이커머스 시장 등에 대한 공략을 강화할 것”이라고 말했다.코어에이아이의 대화형 AI 플랫폼은 글로벌 상위권 은행, 헬스케어 기업을 비롯해 포춘 500대 기업 중에 100개 이상의 기업들이 도입하고 있다고 한다. 그는 고객과 접점이 많은 고객센터 업무를 AI로 자동화하면 운영비용을 30% 이상 절감하고, 기존 대비 5배 빠른 서비스를 제공할 수 있다고 했다.이 지사장은 “미국 은행권에서는 대화형 AI를 활용해 음성인식을 통한 계좌이체, 계좌 확인의 기능을 제공하고 컨택센터와 연계해 최적화된 금융상품을 제안할 수 있는 단계까지 지원하고 있다”고 설명했다.



(자료=코어에이아이 코리아 온라인 간담회 화면 캡처)코어에이아이의 디지털 비서 플랫폼은 지식그래프, 펀더멘털 미닝, 마신러닝 등 3가지 자연어처리(NLP) 엔진을 조합해 적은 데이터를 가지고도 보다 높은 정확도를 제공할 수 있다고 한다. 웹 화면에서 드래그인드롭 방식으로 쉽게 개발할 수 있도록 노코드(no-code)기술이 적용돼 현업 담당자가 쉽게 디지털 비서를 개발할 수 있다고도 자랑했다.이 지사장은 “전사적자원관리(ERP), 고객관계관리(CRM), 인적자원(HR) 시스템 등 기업 내 다양한 어플리케이션과 통합 운영이 가능하도록 구성됐다”며 “비행기표 예약, 일정 관리 등의 비서 업무도 가능하고 회사 내 다양한 지식자산도 검색하는 등 다양한 업무를 할 수 있게 지원한다”고 강조했다.한국어 활용에 제약이 있을 것이라는 우려가 나오나, 회사 측은 국내 기업과의 협업을 통해 합작법인 설립 등 다양한 방안을 모색하고 있다고 전했다.그는 “국내 이커머스 업체와 진행하고 있는 프로젝트에서 한국어 인식률은 80% 이상 나온 것을 확인했고, 90% 이상으로 맞추기 위해 노력하고 있다”며 “한국어 관련 다양한 데이터베이스 기술을 확보하기 위해 본사와 협력해 국내에 투자하고, 국내 기업들과의 협업도 진행하고 있다. 음성인식을 지원하기 위해 국내 음성텍스트변환(STT) 업체와도 협업 모델을 진행하고 있다”고 말했다.이어 “금융권에서는 본인신용정보관리업(마이데이터) 사업에 대화형 AI 기술을 충분히 활용할 수 있을 것”이라면서 “금융소비자보호법 시행으로 고객에게 많은 정보를 요구할 수 밖에 없게 됐는데 대화형 AI 기술이 도움을 줄 수 있을 것”이라고 내다봤다.이후섭 (dlgntjq@edaily.co.kr)▶ #24시간 빠른 #미리보는 뉴스 #eNews+▶ 네이버에서 '이데일리 뉴스'를 만나보세요▶ 빡침해소, 청춘뉘우스 '스냅타임'＜ⓒ종합 경제정보 미디어 이데일리 - 무단전재 & 재배포 금지＞",105,https://n.news.naver.com/mnews/article/018/0004932891?sid=103
"농어촌공사, '모바일로 척척' 스마트 물관리 앱 개발 관심",2021.05.18. 오후 3:01,"(나주=연합뉴스) 송형일 기자 = 한국농어촌공사가 저수지 등 각종 시설물의 관리를 모바일로 해결하는 스마트 물관리 앱을 개발, 관심을 끈다.



농어촌공사가 개발한 스마트 물관리 앱 [한국농어촌공사 제공]    한국농어촌공사는 실시간 계측정보와 유지관리 매뉴얼 등 현장에서 필요한 정보를 모바일로 바로 확인하고 결과를 등록까지 할 수 있는 스마트 물관리 앱을 개발했다고 18일 밝혔다.    이 스마트 앱은 저수지 위치, 수위 등 각종 계측정보, 배수장 등 각종 시설물 정보와 가동현황, 유지 관리 점검 결과 확인 및 등록 등이 어디서든 가능하다    공사는 지난해 유지관리 매뉴얼 개편을 통해 표준화된 업무 매뉴얼을 구축하고 실무적으로 필요한 각종 정보를 앱에 담았다.    특히 현장에서 시설물의 매뉴얼을 직접 확인하고 점검 결과를 등록할 수 있는 점은 안전한 영농환경 조성과 농업인 서비스 강화에 큰 도움이 될 것으로 기대한다.    앱을 로그인하면 사용자의 담당 지구 현황, 점검 이력 조회도 가능하며 목적과 매뉴얼에 따라 각종 점검도 한다.    점검 과정과 결과를 앱을 통해 현장에서 등록하고 그 결과는 내부 업무시스템을 통해 지사는 물론 본사, 지역본부에서 확인이 가능하다.



농어촌공사가 개발한 스마트 물관리 앱 [한국농어촌공사 제공]    농어촌공사는 본격적인 영농철을 맞아 스마트 물관리 앱을 현장에서 이용하게 되면 안정적 농업용수 공급, 우기 대비 시설물 점검 등에 활용도가 높을 것으로 기대한다.    한국농어촌공사 관계자는 ""이 스마트 앱을 통해 누적된 정보를 농업용수 통합 데이터베이스 구축에 활용하고, 가뭄과 홍수 등 재해와 재난 예방에도 선제적으로 사용할 수 있다는 데 의의가 크다""고 말했다.    nicepen@yna.co.kr▶네이버에서도 뉴스는 연합뉴스[구독 클릭]▶[팩트체크] SNS 달군 백신가격 비교 글? ▶제보하기<저작권자(c) 연합뉴스(https://www.yna.co.kr/), 무단 전재-재배포 금지>",105,https://n.news.naver.com/mnews/article/001/0012401459?sid=103
"[기고] 시스템 반도체, 2100년을 바라보자",2021.05.18. 오후 2:07,"(지디넷코리아=이효승  네오와인 대표)나는 신입사원 이래로 반도체 설계만 30년을 했다. 30년 동안 설계를 했고 관련된 회사를 운영 하지만 항상 어렵고 배울것이 많은 산업이다. 요즘은 인공지능(AI) 반도체용 NPU IP와 관련한 소프트웨어 플랫폼을 개발하고 있다.이 분야 일을 오래 하면서 요즘같이 반도체에 510조를 쏟겠다는 말을 들으면 격세지감이 든다. 한때 시스템반도체는 우리나라에 적합한 산업이 아니라는 말을 시스템반도체 담당 사무관에게 듣기도 했다. 모욕적이고 황당한 일 이었는데 정부의 그런 시각이 몇년 전에는 팽배해서 천개나 되는 동종업계 스타트업이 거의 다 사라지고 지금은 몇개 남지 않았다.■ 중국은 170조 투자...담당 주무관 ""시스템반도체 우리한테 맞나"" 말하기도필자가 사업을 시작할 무렵인 2002년에 우리나라가 상당히 잘하는 반도체 분야가 있었다. CCTV 카메라용 DVR 칩셋과 카메라 신호처리 IC 분야였는데, 디지털 영상신호처리는 당시 기술로 꽤 많은 노하우를 갖고 있었고 성진CNC, 3R, IDIS, 하이트론 같은 DVR 회사의 수출과 내수도 상당했다. 사실 이 분야는 아직도 한화시스템, 넥스트칩이나 이니텍같은 국내 회사가 있기는 하다. 그러나 엄청난 세계 시장규모에 비하면 지금은 명맥이나 잇는 수준이다. 이 산업과 기술이 우리나라에서 중국으로 넘어가게 된 것은 하이실리콘 같은 화웨이 자회사가 들어오게 되면서 부터다.



이효승 네오와인 대표거대기업의 미세공정 개발비 부담을 당할수 없어 중소 시스템반도체 회사들이 이쪽 비지니스를 그만두게 되니 CCTV 와 IP 카메라 등을 하이실리콘 같은 중국에 내주게 된 것이다. 이 산업은 이후 발전을 거듭해 연간 수십조원의 시장을 만들고 DJI 의 드론과 전세계에 깔린 CCTV 를 통해 얼굴인식등 인공지능과 온세상 정보가 중국으로 가게되는 문제가 발생했다. 보안 카메라를 통해 중국이 전세계 빅브라더가 된것이다.중국이 1조 위엔, 우리나라 돈으로 170조원을 시스템반도체 등에 투자할 때 우리는 십년간 0.8조를 투자하면서 성과가 나오지 않는다는 말을 들었다. 당당 주무관이 시스템반도체가 우리나라 실정에 맞는가? 라는 시각을 갖고 있었으니 당연한 것 아니었을까한다.시스템반도체 기술은 전형적인 자본집약 산업이다. 정부는 510조를 쏟아 수만명의 인력을 기르고 시스템반도체 산업을 육성하겠다고 한다. 이런 산업성장 계획을 보면서 답답한 것은 정작 중요한 팹리스기업에는 얼마나 투자하고 있는가다.중소기업과 대기업간 상생을 위해 정부가 매칭해 투자한 자금들은 현재 팹리스 반도체가 아닌 칩리스 파운더리와 소재및 장비기업에 투자됐다. 물론 칩리스 파운더리도 중요 하겠지만 어떤 나라도 칩리스 투자와 장비기업을 팹리스보다 더 지원하는 나라는 없다.투자 펀드가 칩리스에 올인하니 이 투자액이 팹리스 인력을 블랙홀처럼 빨아들여 팹리스 인력이 유출되고, 많지 않은 경력자 부족으로 팹리스가 고사되는 상황이 나오고 있다.■""퀄컴 같은 회사 만들자면서 투자를 팹리스 대신 칩리스에 하는 건 모순""퀄컴, 엔비디아, AMD 등의 예를 들어 시스템반도체 산업을 육성 한다고 하면서 정작 반도체 상생 펀드는 장비기업과 칩리스만 투자한다. 퀄컴같은 회사가 소재나 장비회사인가? 엔비디아는 심지어 반도체 회사를 넘어 소프트웨어 회사라고 말한다. 시스템반도체가 발전과 진화를 거듭하면 반도체 베이스 위에 소프트웨어 회사가 된다. 이런 소프트웨어 플랫폼을 시스템을 모르는 파운더리 디자인하우스인 칩리스나 소재 장비회사에서 감당할 수 있을까?자본과 기술 비중이 8:2 정도인 팹리스 산업에서 우리 회사는 20년간 한푼도 투자를 받지 못했다. 말도 안되는 배수와 받아 봐야 얼마 안되는 투자에 관심이 없었다. 캐피털 또한 팹리스에 투자해 봐야 산출이 안 나온다고 한다.어떤 모임에 갔더니 시스템반도체 업계에 나보다 훨씬 더 많은 경험을 가진 교수님 말씀이 ""세상 어떤 나라가 메모리와 시스템반도체 두개 다 가진 국가가 있는가? 두개 다 육성이 가능한 것인가?"" 라는 회의적인 질문을 한다. 시스템반도체로 세계를 제패할 자신이 없으면 오피니언 리더 역할도 정부부처 사무관도 하지 말아야 한다. 팹리스 돕는다면서 상생 펀드를 만들었는데 그게 팹리스에 얼마나 투자됐는 지 아나? 또 소 부장 강소기업은 왜 장비나 소재쪽 에서만 나오나?팹리스 기업은 삼십년 전이나 지금이나 찬밥이다. 요즘에나 삼성전자에게 중소기업 대상 팹을 열어주지 삼십년간 90나노 미만의 파운더리 서비스를 해주는 국내팹이 없었다. 요즘은 시스템 반도체 산업을 위해 EUV 첨단 공정 지원을 하겠다고한다. 첨단 EUV 공정사용이 잘못된 것은 아니지만 시제품 개발에 수천억 단위 EUV 공정을 사용할수 있는 중소기업이 얼마나 될까?대만 TSMC가 강한 부분은 중소기업과의 강력한 네트워크다. 최근 삼성전자 EUV 5나노 프로세스에서 만든 칩에 열이 많이나 어렵게 유치한 고객(커스터머)이 경쟁사로 옮기는것을 고려중 이라고 한다. 이런 일들이 왜 TSMC 에서는 일어나지 않을까? 내가 보기에는 파운드리 비지니스에 대한 업(業)의 개념이 잘못돼 그렇다. 파운드리는 소소한 팹리스 수천개가 모여 IP개발, 시제품 개발, 양산성 검증 등을 하는 과정을 통해 집적도 향상, TR 구조설계 개선, 동작 속도 증가, 소모 전력절감, 열 발산 등의 문제를 체크하고 해결한다.삼성전자 파운드리 인원은 이만명인데 비해 경쟁사는 오만명 이라고 한다. 인원이 부족해서 중소기업 지원이 어렵다고 한다. 어떤 산업이든 바닥과 중간 허리가 강해야 톱레벨 서비스와 유지가 안정적이지 않을까?■비전과 목표 명확하지 않으면 산업 표류...100년을 보는 정책을지금같이 소수의 거대기업을 위해 IP 만들고 공정 셋업하고 그 회사만의 서비스를 위해 올인하면 양산할 칩이 많아질 수록 할일이 기하 급수적으로 증가한다. IP를 표준화하고 회사별 공정 셋업을 똑같이 해야 필요한 인원도 줄어들고 할일이 줄어들며 개발 속도가 빨라진다.비전과 목표가 명확하지 않으면 산업이 표류한다. 바이든이나 미중 반도체 전쟁 등을 보면 시스템반도체와 팹리스 설계 산업은 대한민국 산업의 중추며 핵심이다. 보다 큰 꿈을 갖자. 510조를 쏟아서 2030년까지 반도체 산업을 육성하는게 잘못된 것은 아니지만, 2100년을 생각해 반도체 부분에서는 메모리와 시스템반도체 모두 세계 1위가 된다는 원대한 꿈을 갖는건 어떨까?세계 1위 꿈을 갖고 있어야 장기적 그림도 만들어진다. 또 2100년 목표를 세워야 2030년이 보인다. 이 정도 꿈을 꿔야 선진국 도약과 청년과 장래의 소망을 생각할 수 있지 않을까?한반도 오천년 역사를 생각해 보면 80년 계획은 정말 작은 기간이다. 멀리 깊게 원대한 꿈을 이야기하는 정치, 경제, 기술 분야 지도자가 아쉽다.이효승 네오와인 대표(godinus@neowine.com) ▶ 지디넷코리아 '홈페이지' ▶ 네이버 채널 구독하기© 메가뉴스 & ZDNET, A RED VENTURES COMPANY, 무단전재-재배포 금지",105,https://n.news.naver.com/mnews/article/092/0002222398?sid=103
