title,date,main,section,url
색맹·청각장애? 게임할 땐 장애 없는 사회 만든다,2023.03.16. 오후 6:20,"콘진원, 장애인 접근성 개선 등기능성 게임 개발에 21억 지원해외는 MS 등 장애인 고려 설계국내선 색 구분 힘든 유저 위해넥슨·카겜 등 별도 옵션 제공도



글로벌 게임산업에서 '장애인 게임 접근성' 개선 논의가 활발한 가운데 국내에사도 이에 발을 맞추려는 움직임이 일고 있다. 다만 이제 첫발을 뗀 수준으로 정부와 업계 모두 장애인 게임 접근성 향상을 위한 투자와 노력을 더 해야 한다는 목소리가 나온다.16일 관련업계에 따르면 문화체육관광부 산하 한국콘텐츠진흥원은 최근 '2023 게임콘텐츠 제작지원' 기업 모집을 마감하고 평가와 선정 절차를 진행 중이다.게임콘텐츠 제작지원 사업은 국내외 게임시장을 개척할 게임 기업의 콘텐츠 상용화를 지원하는 것에 목적이 있다. 특히 기능성 게임콘텐츠에도 총 21억원 규모의 지원금을 쏟아붓는데 세부 분야에 장애인 게임 접근성이 포함됐다.장애인 게임 접근성은 글로벌 게임시장에서 이미 수년 전부터 논의가 이뤄져 왔다. MS(마이크로소프트), 소니 등 글로벌 게임사들은 장애가 있는 이용자들이 편리하게 게임을 즐길 수 있도록 여러 장치를 고안하고 있다. MS는 엑스박스 접근성 지침을 통해 장애인 게임 접근성에 관한 이해를 높일 수 있도록 지원하는 것은 물론 각종 툴과 전용 컨트롤러를 출시하고 있다. 소니 역시 올해 초 공개한 플레이스테이션5용 '프로젝트 레오나르도'를 장애인들도 이용할 수 있도록 설계했다.반면 국내에서 장애인 게임 접근성 논의는 초기 단계에 머물러 있다. 국내 게임업계가 장애인 게임 접근성 확대에 관심을 보이지 않고 있는 것은 아니다. 넥슨은 '메이플스토리'에서 청각 장애인들의 접근성을 높일 수 있도록 음악 퀴즈풀이 콘텐츠에 텍스트 설명 기능을 넣고 색 구분이 어려운 유저들을 위해 오브젝트 디자인에 차이를 두거나 모양과 패턴을 다르게 하는 등 여러 장치를 마련했다. 카카오게임즈의 '프렌즈팝콘', 스마일게이트의 '로스트아크', 크래프톤의 '배틀그라운드' 등도 색상 인지에 어려움이 있는 유저들을 위해 각종 옵션을 제공하고 있다. 넥슨, 엔씨소프트, 넷마블, 카카오게임즈 등은 게임 외적으로도 사회공헌 차원에서 각종 프로젝트를 진행하고 있다. 그러나 국내 게임산업이 지닌 위상에 비하면 장애인의 게임 접근권 보장은 미비한 게 사실이다.장애인들에게 게임은 심리적 안정과 삶의 질 향상을 돕는 수단으로 활용될 수 있다. 콘진원이 지난 1월30일 내놓은 '장애인 게임 접근성 제고 방안 기초연구' 보고서를 보면 '장애의 정도가 심한 장애인'들은 게임 이용 사유로 '여가 목적'(86.1%), '스트레스 해소'(65.8%)를 꼽았으며 게임 이용의 긍정적 효과로 '전반적 삶의 질 향상'(74.3%)과 '심리적 건강 증진'(65.2%)을 지목했다. 이에 국내 게임업계에서도 장애인 게임 접근성 논의에 보다 적극적으로 나설 필요성이 있다는 목소리가 제기된다. 장애인 e스포츠 대회 활성화가 필요하다는 지적도 있다. 전문가들은 업계뿐 아니라 정부 차원의 노력도 이뤄져야 한다고 강조한다.이재홍 한국게임정책학회장(숭실대 교수)은 ""국내 게임시장에는 장애를 극복할 수 있는 게임 작품이 많지 않은 게 현실""이라며 ""장애 유형이 매우 다양한 점 등을 고려했을 때 게임 접근성 향상은 하루아침에 이뤄지는 게 아닌 만큼 업계도 노력해야 하지만 정부 차원에서도 세제 지원, 진흥책 마련 등이 필요한 상황""이라고 말했다.",105,https://n.news.naver.com/mnews/article/029/0002789473?sid=103
"몰려 다니며 좀도둑질…10·20대, 침입범 절반 육박",2023.03.16. 오후 3:38,"에스원 범죄예방연구소가 최근 3년간(2020~2022년) 고객처 빅데이터를 분석해 침입범죄 동향을 파악한 결과 전체 범죄 건수는 줄었으나 생계형 범죄는 늘어난 것으로 나타났다.16일 에스원 범죄예방연구소에 따르면 침입범죄 건수는 지난 3년간 평균 25.8% 감소했다. 연구소는 무인 보안시스템이나 CCTV 등 첨단 보안솔루션이 보급되면서 범죄 기회가 감소했기 때문인 것으로 분석했다.에스원 CCTV 사용 고객은 최근 2년간 매년 4% 이상 증가했다. 무인 보안시스템 가입자 역시 매년 2% 이상 늘어나는 등 첨단 보안솔루션 보급은 점차 확대되고 있는 추세다. 서울 지역 보안용 CCTV 보급 대수도 지난해 기준 7만3965개로 매년 두자릿수 증가율을 보인다.침입범죄로 인한 피해는 현금이 88.4%로 가장 높았다. 현금을 노린 범죄 중 71.3%가 100만원 이하의 생계형 범죄로 나타났다. 전체 침입범죄의 85.5%는 단독범행이었다.



침입범죄는 주로 심야 시간대인 0~6시(65.3%)에 집중됐다. 18~24시(17.6%), 6~12시(10.0%), 12~18시(7.1%) 순이었다. 연령대별로는 10~20대(45.5%)가 가장 높았고 30~40대(34.3%), 50~60대(19.4%) 순이다.10대 범죄의 경우 단독범행(36.7%)보다 집단범행(68.3%)의 비중이 1.7배 가량 높았다. 연구소는 함께 어울려 다니는 경향이 높은 10대의 특성이 반영된 것으로 판단했다. 한편 침입 미수 건수는 전체 침입범죄의 48.3%에 달했다. 절반 가까운 범죄자가 침입을 시도하다 보안시스템 비상램프나 경고음에 놀라 도주한 것이다.에스원 관계자는 ""이번 분석을 통해 사회적으로 보안 인프라가 확충되면서 침입 범죄가 감소하는 것을 확인할 수 있었다""며 ""앞으로도 지자체는 물론 민간 기업에서도 보안 인프라 도입이 증가할 것으로 예상된다""고 말했다.",105,https://n.news.naver.com/mnews/article/008/0004863028?sid=103
"안랩, ‘글로벌 탄소중립 동향과 국내 대응’ 주제로 환경 특강 개최",2023.03.16. 오전 9:02,"안랩이 14일 임직원 대상 ESG 환경 특강을 개최했다고 16일 밝혔다.기후위기 전문가인 이유진 박사(녹색전환연구소 부소장)가 강의를 맡아 ‘글로벌 탄소중립 동향과 국내 대응’을 주제로 교육을 진행했다. 이번 강의에서는 각국의 탄소중립 선언을 비롯해 미국의 IRA(Inflation Reduction Act, 인플레이션 감축법)와 EU의 그린딜(European Green Deal), 글로벌 ESG 공시 의무화가 국내 기업에 미치는 영향, 기후위기 대응을 위한 탄소중립녹색성장기본법 등 우리나라의 기후변화 대응 정책 등에 대해 설명했다.이유진 박사는 “탄소중립이 환경에 관심 있는 일부 사람들만의 문제인 것이 아니라 탄소를 중심으로 하는 새로운 경제 체계가 형성되고 있는 것”이라며, “기업 또한 기후 위기에 빠르게 대응할 필요가 있다”라고 했다.안랩은 ‘기후위기’ 같은 거대 담론에 대한 임직원 이해를 높이고 관심을 촉구하기 위해 지난 해 9월, 10월에 이어 세 번째로 기후위기 강의를 마련했다. 현장 강의에는 임직원 80여명이 참석했으며, 강의 실황은 온라인으로 전사에 실시간 중계됐다. 안랩 임직원은 사내 게시판에 업로드 되는 강의 영상으로 언제든지 다시 학습할 수 있다.안랩은 환경 교육 뿐만 아니라 회사 홈페이지에 연재 중인 ESG 뉴스레터 ‘가치알랩’에서도 ‘클라우드의 탄소배출’, ‘의류 폐기물’, ‘일회용 쓰레기’ 등 다양한 환경 이슈를 다루며 환경 인식 확산에 힘쓰고 있다. 또 사내에서는 임직원의 협조와 참여로 △식당 및 카페 내 일회용 플라스틱 사용 저감 △일회용 비닐 대신 우산 빗물 제거기 이용 △다 읽은 책과 사용하지 않는 IT 자산(PC, 노트북 등) 기부 등을 실천하고 있다.",105,https://n.news.naver.com/mnews/article/366/0000885430?sid=103
클립 드롭스서 '한화이글스' 멤버십 NFT 판매,2023.03.16. 오전 10:57,"총 1750개…경기 선입장·구단 상점 할인·상품 디자인 투표권 등 제공그라운드엑스(대표 양주일)는 한화이글스 멤버십 대체불가토큰(NFT) '수리크루십'을 디지털 아트 및 NFT 유통 서비스 ‘클립 드롭스’에서 17일부터 판매한다고 밝혔다.수리크루십은 한화이글스의 마스코트 캐릭터 ‘수리’를 활용한 멤버십 NFT다. 17일 500개, 24일 1천250개가 선착순으로 판매된다. 수리크루십 NFT 보유자에게는 구단 식음매장과 굿즈 최대 25% 할인, 이벤트와 상품 디자인 투표권, 주말 경기 선입장 등이 제공된다. 프로야구가 개막하는 오는 4월부터 한화이글스 대전 홈 구장에 방문해 클립 지갑에 보관된 수리크루십 NFT를 인증하면 된다.구매한 수리크루십 NFT는 그라운드엑스의 디지털 자산 지갑 ‘클립’에 보관된다.



한화이글스 멤버십 NFT김태근 그라운드엑스 사업그룹장은 “구단 캐릭터의 다양한 모습을 만나보는 재미와 풍부한 혜택을 NFT 보유자와 팬들에게 선사하고자 한다”며, “클립 지갑을 통한 체크인 등 편의 기능으로 NFT를 소유하는 재미를 넘어 유용성을 체감할 수 있도록 입증해나가겠다”고 말했다.",105,https://n.news.naver.com/mnews/article/092/0002285662?sid=103
"액체이산화탄소, 최적의 생산방법 찾았다",2023.03.16. 오전 9:51,"UNIST 연구팀, 관련 논문 발표최근 신종 코로나바이러스 감염증(COVID19) 상황으로 액체이산화탄소 공급이 수요를 따라가지 못하는 상황에 놓였다. 액체이산화탄소는 기체 이산화탄소보다 장거리 운송·저장이 쉽다. 식음료, 가스, 금속 등 다양한 산업에 걸쳐 사용되고 있는 물질이기 때문에 수요는 점점 증가할 전망이다.울산과학기술원(UNIST, 총장 이용훈) 탄소중립대학원 및 에너지화학공학과 임한권 교수팀은  ‘블루 수소 연계를 위한 액체이산화탄소 최적 생산 모델의 기술·경제·환경적 타당성 분석 연구’를 진행해 국제학술지 ‘어플라이드 에너지(Applied Energy)’에 출판했다.다기준 의사결정 방법을 적용해 다양한 이산화탄소 액화 시스템에 대해 최적 시나리오 도출이 주요 내용이다.



블루 수소 연계 이산화탄소 포집과 액화 시스템 분석 개략도. [사진=UNIST]이번 연구는 ‘수소생산을 위한 천연가스 수증기 개질 반응 공정(Natural gas steam reforming)’에서 발생하는 배기가스를 대상으로 이산화탄소 포집과 액화 시스템을 설계하고 분석했다는 점에서 눈에 띈다.이 같은 공정으로 얻어진 수소를 블루 수소라 명명하는데 이번 연구에서는 블루 수소 연계를 위한 다양한 이산화탄소 액화 시스템과 더불어 4E(에너지, 엑서지, 경제성, 환경성) 타당성 분석을 통한 모든 측면을 고려했다.수소생산 과정에서 발생하는 배기가스를 대상으로 다기준 의사결정 기법을 적용한 이번 연구는 수소 생산과정에서 발생하는 이산화탄소 배출 저감의 기회를 제공한다. 동시에 액화 시스템의 기술적·경제적·환경적 측면에서의 중요한 지표가 될 것이라 기대된다.제1저자 최창권 에너지화학공학과 석‧박사통합과정 연구원은 “이번 연구를 통해 진행된 이산화탄소 액화 시스템 분석은 앞으로 예상되는 수소와 액체이산화탄소 수요를 동시에 만족시킬 수 있을 것으로 기대한다”며 “4E 타당성 기반의 다기준 의사결정 분석을 통해 액체이산화탄소 생산에 있어서 기술적·경제적·환경적 측면에서의 정량적 결과를 제시하고 구체적인 가이드라인으로 적용될 수 있을 것”이라고 말했다.임한권 탄소중립대학원 교수는 “이산화탄소 액화의 경우 다양한 기업과 산업에서 이미 광범위하게 다뤄지고 있는데 이산화탄소 포집 기반의 블루 수소 생산 공정과 연계된 지속가능한 이산화탄소 액화 시스템 모델 제시와 관련된 연구로서 매우 큰 의미를 가진다”며 “이번 연구가 액체이산화탄소 산업에 중요한 지표가 될 수 있을 것”이라고 전했다.이번 연구(논문명: Carbon capture and liquefaction from methane stream reforming unit: 4E’s analysis(Energy, Exergy, Economic, and Environmental))는 국제학술지인 어플라이드 에너지(Applied Energy) 2월 15일자 온라인에 실렸다.",105,https://n.news.naver.com/mnews/article/031/0000734630?sid=103
치매 치료 가능성 품은 새로운 타우 항체 국내서 개발,2023.03.16. 오후 6:48,"아델·아산병원 공동 연구, 국제 학회지 게재올해 미국서 임상시험 계획



서울아산병원 뇌과학교실 윤승용(왼쪽 사진부터 순서대로) 교수와 김동호 교수, 아델 연구진 송하림 박사, 김나영 박사. 아델 제공알츠하이머병 등 다양한 타우(TAU)병증 진행을 억제하는 데 도움이 될 수 있는 단일 클론 항체를 국내에서 개발했다. 연구진은 치매 치료 가능성을 확인한 것이라고 의미를 부여했다.바이오 벤처 아델과 울산의대 서울아산병원 연구진은 '아델(ADEL)-Y01'로 명명한 클론 항체가 최근 국제 의학 전문 학회지 '임상연구저널(The Journal of Clinical Investigation)' 온라인판에 게재됐다고 16일 밝혔다. 이번 연구는 과학기술정보통신부 중견연구사업과 보건복지부 비임상개발사업의 지원을 받았다.ADEL-Y01은 타우병증 발달과 확산에 핵심적인 역할을 하는 것으로 알려진 라이신 280에 아세틸화된 타우 단백질(tau-acK280)을 표적으로 삼은 항체다. 타우병증은 뇌에 타우 단백질이 축적돼 뇌세포의 사멸과 인지 기능 저하로 이어지는 질병군이다. 치매를 일으키는 알츠하이머병이 타우병증의 가장 흔한 유형이다.연구진은 ADEL-Y01이 타우병증 진행을 예방하고 신경 생존 능력을 증가시키는 것을 관찰했다. 특히 글로벌 제약사 바이오젠, 로슈 등이 개발한 타우의 N-말단을 표적으로 하는 항체에 비해 타우 응집 저해 및 전파 억제 효과가 뛰어난 것을 확인했다고 설명했다.공동책임저자인 울산의대 뇌과학교실 김동호 교수는 ""사람에 대한 안전성과 효능을 결정하기 위한 추가 임상 연구가 필요하지만 최근 알츠하이머병 치료제로 미국 식품의약국(FDA) 신속승인을 받은 베타 아밀로이드 항체(레카네맙)와 병용요법으로 개발을 기대할 수도 있다""고 밝혔다.올해 아델은 국내 혁신신약 연구개발기업 오스코텍과 공동개발 업무협약을 맺고 미국에서 ADEL-Y01 임상시험을 개시할 계획이다. 아델은 서울아산병원  윤승용 교수가 그간의 연구 결과를 바탕으로 2016년 창업했다.",105,https://n.news.naver.com/mnews/article/469/0000728930?sid=103
"NCT 127, 그래픽노블 ‘NCT 127 : Limitless’ 7월 론칭…Z2·유니버설뮤직 협업",2023.03.16. 오전 10:23,"사진=SM엔터테인먼트 제공NCT 127(엔시티 127)의 네오(NEO) 세계관과 음악이 오는 7월 만화형 소설로 새롭게 비쳐진다.16일 SM엔터테인먼트와 유니버설뮤직 등은 공식채널을 통해 NCT 127 그래픽노블 ‘NCT 127 : Limitless’(엔시티 127 : 리미트리스)를 오는 7월 론칭한다고 밝혔다.‘NCT 127 : Limitless’는 NCT 127의 음악과 NCT 세계관의 핵심 키워드 ‘꿈’ 등을 테마로 한 그래픽노블로, 미국 뉴욕 공연장을 배경으로 꿈-현실 교차의 미스터리 상황에서 성장하는 멤버들의 모습을 표현한다.하이브 오리지널, 카카오 웹툰 등 아티스트 IP를 활용한 새로운 장르접근법 차원과 함께, 글로벌 유력 업계의 협업을 토대로 한 K팝 IP 스핀오프라는 데서 주목된다.제작될 그래픽 노블 ‘NCT 127 : Limitless’는 일반 하드커버(9개 커버버전)와 디럭스 하드커버 에디션(친필사인, 아트프린트, 그룹샷 트레이딩카드 등)으로 구성될 예정이며, 금일부터 Z2 Comics 홈페이지에서 예약판매된다.SM엔터테인먼트는 “NCT는 무한한 가능성을 지니며 지역과 형식에 구애받지 않는 콘셉트를 가지고 만들어진 그룹이다. 이번 협업을 통해서 NCT 127의 영역이 음악의 경계를 넘어 그래픽노블로 확장되는 현상을 보는 것이 기쁘다”라고 전했다.케빈 믹(Kevin Meek) Z2 Comics의 CEO는 “SM엔터테인먼트, NCT 127, 그리고 유니버설뮤직 그룹과 함께 K팝 아티스트를 중점으로 한 첫 그래픽노블을 만들 수 있게 돼 기대가 크다”라고 소감을 밝혔다. 그는 또 “전 세계 NCT 팬들뿐만 아니라 K팝 팬들에게도 NCT의 세계관의 중심에 함께 할 수 있는 아름답고 사색적인 예술을 보여줄 기회가 왔다는 생각에 설렌다”라고 말을 이었다.양범준 유니버설뮤직 한국 지사 대표이사는 “음악과 아티스트 IP가 경계없이 확장될 수 있는지를 보게 되는 좋은 예”라고 말하며 “기존 Z2 Comics 협업 관계는 물론 SM엔터테인먼트와 함께함으로써 유니버설뮤직 그룹이 케이팝 지식재산권을 그래픽노블 업계에 성공적으로 안착시키게 된 것”이라고 전했다.",105,https://n.news.naver.com/mnews/article/030/0003084662?sid=103
"파수, 지난해 영업이익 52억원…전년比 23%↑",2023.03.16. 오후 8:04,"매출 441.2억원…""솔루션 중심 매출 확대와 구독형 비즈니스 성장이 견인""파수는 연결기준 지난해 매출이 441.2억원을 기록했으며, 영업이익은 52억원을 기록했다고 16일 공시를 통해 밝혔다.파수는 역대 최대 매출과 영업이익, 당기순이익을 기록했으며, 특히 순이익은 52.7억원으로 전년 대비 28% 증가했다.매출은 전년 대비 19.5억 증가했으며, 영업이익과 순이익은 각각 9.7억과 11.6억 증가했다. 특히 영업이익과 순이익은 2021년 흑자전환한 이래로 지난해에는 전년 대비 각각 23%, 28% 증가를 기록했다.



파수 로고파수의 실적 호조는 솔루션 중심 매출 확대와 연간 라이선스 형태의 구독형 비즈니스의 성장이 견인했다. 첫 해에 매출이 집중되는 영구 라이선스와 달리 매년 균등한 매출이 발생하는 구독형 비즈니스는 경영 가시성 및 안정성이 높다. 구독형 비즈니스의 매출 비중을 높이고자 한 파수의 지속적인 노력이 시장의 수요 증가와 맞물리면서 본격적인 체질 개선이 이뤄지고 있는 것으로 분석된다.한편, 파수는 1주당 100원을 지급하는 결산 배당을 진행할 계획이다. 파수는 주주의 이익과 기업의 가치 극대화를 위해 노력을 지속해 갈 예정이다.조규곤 파수 대표는 ""파수의 지속적인 노력으로 솔루션 중심 세일즈와 구독형 비즈니스가 자리잡으면서 지난해 실리 중심의 성장을 거둘 수 있었다""며 ""특히 구독형 비즈니스는 예측가능한 사업 환경을 만들어 줄 뿐 아니라 고객의 솔루션 도입 부담을 낮춰 더 다양한 규모와 산업으로의 고객 확대를 돕는다""고 설명했다.또한 ""파수는 소스코드 보안 DRM과 인공지능(AI)기반 개인정보 탐지 솔루션을 출시하는 등 적극적으로 국내외 시장 개척 및 확대에 나서고 있어 올 한 해도 유의미한 성장을 기대할 수 있을 것""이라고 밝혔다.",105,https://n.news.naver.com/mnews/article/092/0002285758?sid=103
"[게시판] 과천과학관, 1천여 명 대상 과학나눔사업 진행",2023.03.16. 오후 12:00,"국립과천과학관[연합뉴스TV 제공]▲ 국립과천과학관은 올해 과학문화 취약계층 1천여 명을 대상으로 과학나눔사업을 진행한다고 16일 밝혔다. 사업은 도서벽지 학교 현장을 찾아가는 '과학관이 간다', 과학관에 초청하는 '어서와 과학관', 장애인 대상 '보통의 과학관', 찾아가는 과학강연 등으로 구성됐다. 17일 청각장애 특수학교 '서울삼성학교'를 시작으로 11월까지 총 20회 열린다. (서울=연합뉴스)",105,https://n.news.naver.com/mnews/article/001/0013818224?sid=103
