title,date,main,section,url
[코인뉴스] 숨고르기 들어간 비트코인…이더리움은 질주 지속,2021.10.08. 오전 8:16,"6500만원대 횡보…5만5천달러 저항선은 유지시세차익 매물 영향…이더리움은 440만원 눈 앞



암호화폐 관련 이미지.ⓒ픽사베이[데일리안 = 이건엄 기자] 전날까지 가파른 상승세를 보였던 비트코인이 6500만원대에 머물며 숨고르기에 들어갔다. 시세가 10% 가까이 올랐던 만큼 차익 실현 매물이 시장에 나오면서 잠시 상승세가 꺾였다는 분석이다. 반면 이더리움은 알트코인 시장 강세에 힘입어 질주를 지속하고 있다.8일 암호화폐 거래소 업비트에 따르면 이날 오전 8시 기준 1비트코인은 6579만6000원에 거래되고 있다. 이는 24시간 전보다 1.8% 하락한 수준이다. 같은 시각 빗썸에서도 6569만4000원에 거래 중이다.비트코인은 지난주 상장지수펀드(ETF) 기대감에 상승기류를 탄 이후 지속적으로 오르며 전날 한 때 6700만원대를 돌파했다. 이후 차익 실현을 위해 일부 투자자들이 매도에 나서며 횡보세를 보이고 있는 상황이다.다만 저항선으로 여겨지고 있는 5만5000달러선은 유지하고 있는 만큼 투자자들은 향후 추가 반등이 가능할 것이란 기대감을 여전히 갖고 있는 상황이다.반면 이더리움은 알트코인 시장이 강세를 보이며 계속해서 질주하고 있다. 시장 전반이 활기를 띄면서 알트코인에 유입된 이들이 많아지면서 상승장을 이어가고 있다는 분석이다. 특히 대장주 비트코인이 하락함에 따라 차익을 노린 투자자들이 알트코인에 투자한 것도 시세 상승에 영향을 미친 것으로 풀이된다.이더리움은 같은 시각 업비트와 439만원에 거래되고 있다. 이는 24시간 전 보다 1.4% 오른 가격이다. 빗썸에서도 438만6000원에 거래되고 있다.",105,https://n.news.naver.com/mnews/article/119/0002536354?sid=103
"국내 급성 바이러스 간염, 80%는 ‘이것’ 때문",2023.10.24. 오후 3:21,"A형과 E형이 한국에서 가장 흔한 급성 바이러스 간염이라는 국내 연구결과가 나왔다. 급성 바이러스 간염은 특정 바이러스에 감염(Infection)돼 간 조직에 염증이 발생하는 질환이다.



이미지투데이 최광현‧정숙향 분당서울대병원 소화기내과 교수 연구팀은 2020~2021년 국내 12개 대학병원의 급성 바이러스성 간염환자 데이터를 조사‧분석한 결과, 국내에서 가장 흔한 급성 바이러스 간염은 ‘급성 A형 간염’이며, 일반인에게 다소 낯선 ‘급성 E형 간염’이 그 뒤를 이었다고 24일 밝혔다.이 연구결과는 네이처에서 발간하는 국제학술지 ‘사이언티픽 리포트(Scientific Reports)’에 최근 게재됐다.급성 바이러스 간염은 A형‧B형‧C형‧D형‧E형‧G형 간염 바이러스와 거대세포 바이러스 등의 감염으로 발생하며, 잠복기를 거쳐 발열‧구토‧복통‧황달 증상이 나타나는 게 특징이다. 증상이 나타나지 않는 경우도 있고, 특별한 치료 없이 자연적으로 회복될 때도 많다. 하지만 약 1%의 환자들은 매우 심한 간염으로 간 기능이 상실되는 급성 간부전이 나타나 사망에 이를 수 있다.연구팀은 국내에서 발생하는 급성 바이러스 간염의 병인(질환 원인)과 임상적 특징을 파악하기 위해 2020~2021년 국내 12개 대학병원에서 급성 바이러스성 간염환자 데이터를 조사‧분석했다. 연구기간 동안 등록된 총 428명의 급성 간염환자 가운데 37.4%인 160명이 급성 바이러스 간염으로 진단됐으며, 이들을 대상으로 간염의 원인 바이러스를 분석했다.



분당서울대병원 그 결과 급성 A형 간염이 78.8%로 가장 높은 비율을 차지했으며, 뒤이어 ▲급성 E형 간염(7.5%) ▲엡스타인-바 바이러스 간염(3.1%) ▲급성 B형 간염(3.1%) ▲급성 C형 간염(1.9%) ▲거대세포 바이러스 간염(1.2%) ▲헤르페스-심플렉스 바이러스 간염(0.6%) 순으로 나타났다.이 가운데 입원치료한 환자 비율은 86.7%, 투석치료를 받은 환자 비율은 3.2%, 중환자실에 입원한 환자 비율은 0.6%로 조사됐다. 1.3%의 환자는 간부전을 보였지만, 간이식을 받거나 사망한 환자는 없었다.  특히 A형 간염환자의 40.5%는 익히지 않은 조개와 굴을, E형 간염환자의 27.8%는 말린 과일을, 11.1%는 멧돼지의 혈액과 담즙을 섭취한 것으로 보고됐다.A형과 E형 간염은 오염된 음식물 섭취를 통해 감염될 수 있다. 이 때문에 예방을 위해서는 음식을 높은 온도에 가열해 충분히 익혀 먹어야 하며 생고기‧육가공식품‧조개류 등의 섭취에 각별한 주의가 필요하다.무엇보다 A형 간염은 예방백신이 있지만 E형 간염은 아직 백신이 없어 개인위생 관리를 통해 예방해야 한다.최광현 교수는 “급성 바이러스 간염 가운데 국내에서 가장 빈번하게 나타나는 급성 A형 간염은 항체형성률이 낮은 20~40대가 가장 취약한 것으로 알려져 있어 주의가 필요하다”며 “그 뒤를 잇는 급성 E형 간염에 대해서는 일반인은 물론이고 의료인 사이에서도 인지도가 낮아 조금 더 경각심을 가져야 한다”고 설명했다.",105,https://n.news.naver.com/mnews/article/662/0000030564?sid=103
[PLAY IT] 나만의 수면 관리사…구글 ‘네스트허브 2세대’ 써보니,2021.10.10. 오전 9:19,"- 카메라 대신 레이더 기술로 수면 정보 분석  - 7인치 디스플레이 장착…영상·사진 시청 가능   [디지털데일리 백승은 기자] 우리 곁의 전자제품은 더 이상 휴대폰이나 스피커와 같은 딱딱한 이름으로 불리지 않는다. ‘시리야’, ‘하이 빅스비’와 같은 이름을 부르면 금방 찾아와 정보를 전해 준다. 어느 시에서 말했듯 우리가 그의 이름을 불러주자 그는 우리에게로 왔다.    구글의 ‘구글 어시스턴트’ 역시 생활 속에서 흔하게 사용할 수 있는 인공지능(AI) 음성인식 서비스다. 지난 9월에는 AI 스피커 ‘네스트허브 2세대’를 국내 출시했다. 해외 직구로만 만나볼 수 있던 제품을 국내에서도 구매할 수 있게 된 것.   일반 AI 스피커와는 달리 7인치 디스플레이가 장착됐다. 각종 사진이나 동영상을 시청할 수 있을 뿐 아니라 잘 때 곁에 두면 수면 패턴을 확인할 수 있다. 스마트폰 애플리케이션(앱)으로 거실이나 주방 등을 설정한 뒤 관리도 가능하다. 이 제품을 구글에 대여해 일주일 동안 사용해 봤다.



    우선 제품을 사용하기 위해 ‘구글 홈’ 앱을 다운 받았다. 구글 계정으로 로그인을 한 뒤 목소리를 설정했다. 기기를 둘 위치를 설정하기도 했다. 거실이나 서재 등 다양한 옵션 중에서 선택하면 된다. 이외에도 스피커를 통해 사용할 기본 음악 서비스를 고르고 수면 상태 추적에 동의했다. 수면 상태 추적 서비스는 2022년 정식 서비스 출시 전까지 무료 미리보기로 이용 가능하다.   구글 네스트허브 2세대에는 카메라가 없다. 대신 레이더 기술 ‘모션 센스’를 통해 이용자의 숨소리나 움직임 등 동작을 감지하고 수면 질을 향상할 수 있는 방법을 찾아 준다. 취침 시간과 기상 시간을 설정하고 네스트허브 2세대를 가까운 곳에 두고 잠이 들었다. 



  이후 ‘수면 정보’를 확인해 보니 몇 시에 잠들어서 몇 시에 깼는지 전체 수면 시간은 몇 시간인지 상세히 나왔다. 잠들기 전까지 누워 있는 시간까지 확인 가능했다.



    “헤이 구글, 내 수면 정보 보여줘”라고 말하자 ‘수면 시간은 충분했지만 숙면을 취하진 못 했다’라며 설명해 줬다. 자는 동안 호흡수를 비롯해 얼마나 뒤척였는지 기침은 몇 번 했는지 알아볼 수 있었다. 코골이는 얼마나 했는지도 상세히 저장된다. 주변 조명과 온도 변화와 같이 수면을 방해하는 요소를 찾아낸다. 이번 주에 어떻게 수면을 했는지 모두 모아서 확인할 수도 있다.   취침 시간을 설정하면 그에 맞는 노래를 자동으로 재생해 준다. ‘시골 소리’와 같이 마음이 차분해지는 종류의 음악이다. 가족 구성원의 알람과 같은 시간으로 맞추는 것도 가능하다. 만약 수면 감지 센서를 이용하고 싶지 않거나 데이터를 지우고 싶다면 언제라도 비활성화 및 삭제할 수 있다. 수면 데이터를 구글 피트니스 앱과 연결해 더 확장한 건강 관리로 이용 가능하다. 



    디스플레이를 이용해 온라인동영상서비스(OTT)를 볼 수 있다. 유튜브를 비롯해 넷플릭스나 웨이브 등 다양한 영상을 시청 가능하다. 실제 시청해 보니 기존에 사용하던 태블릿이나 노트북에 비해 화질은 만족스럽지 않았다. 그렇지만 요리를 하는 등 양손이 자유롭지 않은 상황에서 음성인식으로 간단하게 원하는 영상을 볼 수 있는 점은 만족스러웠다. 사용하지 않을 때는 원하는 사진을 띄워 놓아 액자처럼 이용하는 방법도 있다.   ‘퀵 제스처’는 목소리를 낼 수 없을 때 간단한 손동작을 통해 기기를 제어할 수 있는 기능이다. 사용하니 손을 앞뒤로 당기는 것만으로도 영상을 멈추거나 음악 재생을 정지할 수 있어 편하게 이용했다.   네스트허브 2세대는 사용하던 AI 스피커에 비해 ‘풍성’했다. 기존 소장한 AI 스피커로는 날씨를 알려달라거나 음악을 트는 정도로만 사용했다. 네스트허브 2세대는 영상을 보고 알람시계 대용으로 사용하는 등 보다 실생활에 접목한 기능이 다양했다. 수면 추적 기능 또한 꾸준히 사용한다면 질 좋은 잠에 한 걸음 더 다가갈 수 있을 듯했다.   다만 12만원대 가격은 걸림돌이다. 간단한 ‘말동무’ 수준의 AI 스피커를 원하는 소비자보다는 수면 패턴을 상세하게 확인하고 싶거나 더 제대로 된 음성인식 기능을 활용하고 싶은 소비자에게 추천하고 싶다. 네스트허브 2세대의 출고가는 12만5000원이다.",105,https://n.news.naver.com/mnews/article/138/0002111410?sid=103
"“엄청 많은데,먹어보겠습니다” 쯔양 놀란 냉면 ‘식초’에 담긴 비밀",2021.10.10. 오후 7:47,"한국화학연구원은 유명 먹방 유튜버 쯔양과 함께 팔방미인 ‘식초’에 담긴 비밀을 파헤쳤다. [한국화학연구원 제공]



한국화학연구원은 유명 먹방 유튜버 쯔양과 함께 팔방미인 ‘식초’에 담긴 비밀을 파헤쳤다. [한국화학연구원 제공][헤럴드경제=구본혁 기자] “벌써 배부르다고요? 면을 엄청 많이 주셨어요 ㅎㅎ. 냉면에 식초가 빠지면 섭섭하지요. 한번 먹어보겠습니다!”(한국화학연구원 유튜브 채널 ‘맛있는 화학’에 출연한 유튜버 쯔양)고기와 환상궁합을 자랑하는 냉면. 냉면을 먹을 때 남녀 노소를 불문하고 식초를 뿌린다. 그렇다면 식초가 가져다주는 산뜻한 맛과 청량감은 어떻게 만들어졌을까? 한국화학연구원은 11일 공개 예정인 유튜브 채널 ‘맛있는 화학’을 통해 식초에 담긴 화학의 비밀을 자세히 파헤친다.이번 영상에는 국내 대표 먹방 유튜버 쯔양과 곽근재,오동엽 박사 출연했다.식욕을 돋아주는 식초는 조미료의 역할은 물론 탁월한 피로회복 효과와 살균기능까지 갖춘 팔방미인이다. 식초는 군대에서도 중요한 보급품이었다. 고대 로마에서는 전쟁에 지친 군사들의 피로를 풀어주고 힘을 북돋아 주는 자양강장제로 식초를 사용했다.



[123RF]오동엽 박사는 “식초에는 젖산을 분해해 피로를 빠르게 회복시키고 소화를 돕는 기능이 있기 때문”이라면서 “의학의 아버지 히포크라테스는 감기를 치료하는 항생제로, 중세 유럽에서는 흑사병 예방약으로 대항해시대에서는 괴혈병을 예방하기 위한 대책으로 사용돼왔다”고 설명했다.식초는 유기산의 일종인 아세트산이 3~5% 녹아있는 묽은 수용액인데 식초의 개성을 살리는 신맛 역시 아세트산의 산물이다.식초는 제조방법에 따라 크게 양조식초와 합성식초로 나뉜다. 우리가 흔히 말하는 식초는 양조식초를 의미한다. 양조식초는 포도, 사과, 레몬, 감, 매실 등의 과일과 쌀, 밀, 보리 등 곡류 어느것으로도 만들 수 있다.



[한국화학연구원 제공]과일이나 곡물에서 공통적으로 얻을 수 있는 '당' 덕분이다. 포도에 효모를 넣어주면 포도당 한 분가가 두 분자의 에탄올, 두 분자의 이산화탄소로 바뀌는 알코올발효가 일어난다.발효가 일어난 에탄올에 아세트산균을 넣어주면 에탄올이 분해돼 물과 아세트산이 만들어지는 초산발효가 진행된다. 이 발효가 일어나면 신맛이 나는 식초가 되는 것.반면 합성식초는 공업적으로 알데히드를 산화시켜 생산한 아세트산을 희석하고 다른 재료와 혼합해 만든 식초다. 생산이 빠르고 저렴하지만 순수한 신맛만 강하고 코를 찌르는 자극적 냄새가 난다. 합성식초는 초산 이외의 성분은 거의 없다. 6.25 한국전쟁 이후 많이 제조됐지만 오늘날에는 양조식초에 눌려 생산량이 현저히 준 상태다.



[한국화학연구원 제공]오 박사는 “원재료가 무엇이냐에 따라 함유되는 성분이 조금씩 달라지게 된다”며 “그래서 어떤 음식을 할 것이냐 어떤 음식을 주로 소비하느냐에 따라 고를 수 있는 선택지가 다양한 것도 매력”이라고 말했다.특히 식초는 스스로 새콤한 맛을 낼 뿐만 아니라 다른 조미료의 양을 조화롭게 만드는 능력을 가지고 있다. 음식이 너무 달 때 식초를 약간 넣으면 단맛이 줄어들고 찌개의 간이 짤 때 물 대신 식초를 약간 넣으면 짠맛이 훨씬 덜해진다.또 짠맛에 길들여진 미각을 평균치로 되돌리는 효과도 기대할 수 있다. 식초는 당뇨병이나 고혈압이 있어 달고 짠 음식을 줄이려는 사람들이 음식의 간을 맞추기 위해 택하는 향신료이기도 하다.오 박사는 “생선을 조리할 때 식초를 넣으면 비린내를 잡아주는 것은 물론 생선살이 부서지는 불상사를 줄이고 감칠맛을 더할 수도 있다”면서 “과일이나 채소에도 약간 가미하면 더욱 아삭해지는데, 단백질이나 채소의 조직을 단단하게 만들어주는 산의 성질을 가지고 있기 때문”이라고 말했다.",105,https://n.news.naver.com/mnews/article/016/0001897444?sid=103
"사업 변화 나선 카카오, 플랫폼 '선한 영향력' 보여줄까",2021.10.10. 오전 7:00,"김범수 의장 ""해외 진출 확대, 미래 기술 투자"" 변화 강조골목상권 침해 논란 사업 접고 추가 상생 의지 보여당장의 대대적 사업 변화는 쉽지 않을 듯…플랫폼 선한 영향력 집중[데일리안 = 최은수 기자] 



카카오 로고와 라이언 캐릭터.ⓒ카카오최근 국회 국정감사에서 독과점 논란으로 뭇매를 맞으며 사업 방향 변화가 불가피해진 카카오가 실제 사업 변화에 나서고 있다. 골목상권 사업 철수와 해외 진출 확대, 상생 방안 등 김범수 의장이 약속한 개선책 실천으로 장기적인 돌파구 마련에 성공할 수 있을지 주목된다.10일 IT업계에 따르면 카카오는 골목상권 침해 논란에 따라 미용실 예약 서비스 ‘카카오 헤어샵’ 연내 철수를 검토하는 등 본격적인 사업모델 변화를 추진하고 있다.택시 시장 독과점 이슈로 뭇매를 맞은 카카오모빌리티 경우 가입 택시 기사에세 배차 혜택을 주는 '프로멤버십' 폐지를 검토하고 있다. 또 카카오T 택시의 스마트호출료를 폐지하고 기업 대상 꽃·샐러드·간식 배달 중개 서비스를 중지했다. 이어 전화 대리운전 업체 2곳 추가 인수를 철회하는 등 많은 변화를 보이고 있다.카카오엔터테인먼트 역시 국회 국정감사에서 콘텐츠 제공업자(CP) 자회사들을 통해 웹툰 및 웹소설 창작자에게 높은 수수료를 징수해 '갑질' 논란이 일었다. 이에 이진수 대표는 ""전수조사 및 개선에 나서겠다""고 선언했고, 실제 지난 7일 자회사 7곳에 계약서 전달 협조 요청 공문을 보내 전수조사에 착수했다.김범수 의장이 설립한 개인회사 ‘케이큐브홀딩스’는 ‘금산분리(금융 자본과 산업 자본의 분리)‘ 원칙 위반, 전 김화영 대표 퇴직금 논란 등이 일었다. 김 의장은 이에 대해 공식 사과하며, 사회적 기업으로 전환하는 일정을 앞당기겠다는 방침을 밝혔다. ""추가 상생·골목상권 침해 안 한다"" 약속한 김범수…자회사들도 실천 나서



김범수 의장이 지난 7일 서울 여의도 국회에서 열린 산업통상자원중소벤처기업위원회의 중소벤처기업부 대상 국정감사에서 증인으로 참석했다.ⓒ데일리안 홍금표 기자이같은 카카오의 변화는 최근 플랫폼 독과점, 골목상권 침해 등 관련해 사회적 물의를 빚고, 국회 국정감사에서 정치권에게 집중 질타를 받은 뒤 카카오가 약속한 개선책을 실천에 옮기겠다는 의지로 풀이된다.실제 김 의장은 연이은 국회 국정감사에서 각종 논란에 거듭 사과하며 ""추가 상생방안을 신속히 발표하겠다"", ""글로벌 혁신에 대한 도전하고 미래기술 혁신에 집중하겠다"" 등 발언으로 대대적인 변화를 약속했다.또 그는 지난 7일 국회 산업통상자원중소벤처기업위원회의 중소벤처기업부 대상 국정감사에서 ""플랫폼이 활성화될수록 수수료를 더 내릴 수 있는 여지가 생긴다고 생각한다""며 시장 점유율이 상승해도 수수료를 올리지 않겠다는 방침도 밝혔다.다만 단기간 내 논란을 해소하고 대대적인 사업 모델 변화를 보여주기는 쉽지 않을 전망이다. 카카오모빌리티의 경우 업계 반발이 여전한 데다가, 여러 자회사들이 기업공개(IPO)를 앞두고 있어 수익성 개선이 시급해서다.사업 철수 역시 골목상권 침해 여부를 가리기가 쉽지 않고, 철수를 추진함에 있어서 지분과 여러 자영업자들이 얽혀 있다는 문제가 있다. 카카오가 연내 철수를 검토하고 있는 카카오 헤어샵의 경우 카카오 자회사인 카카오인베스트먼트가 지분 약 24.5%를 보유하고 있어, 나머지 지분을 보유한 주주들의 동의를 받아내는 데 쉽지 않다고 전해졌다.또 다른 철수 대상으로 거론된 카카오VX의 스크린골프 사업은 사실상 철수가 어렵다는 의견이 지배적이다. 스크린골프 시장이 사실상 '골프존'이 독점하고 있는 데다가 카카오VX의 스크린골프 브랜드 '프렌즈 골프샷'은 가맹 사업이 아니기 때문에 골목상권 침해로 보기 어렵다는 이유에서다.이와 관련 카카오 관계자는 ""지난달 중순 골목 상권 논란 사업 등에 대해서는 계열사 정리 및 철수를 검토한다고 발표한 후, 이에 해당하는 사업들에 대해 내부 논의 중에 있는 단계""라며 ""앞으로 골목 상권 논란이 있는 사업에 더 이상 추가 진출하지 않고 중소사업자·파트너들과 상생할 수 있는 방안을 지속적으로 모색해나갈 것""이라고 말했다. 영세 기업 진출 돕는 플랫폼 선한 영향력 집중해 돌파구…해외진출 주력



태국 씨얌 파라곤 백화점에 카카오웹툰 ‘사내맞선’이 광고되고 있는 모습.ⓒ카카오엔터테인먼트이에 업계에서는 앞으로 카카오가 중소기업, 자영업자 등의 반발이 거센 사업 영역에서 한발 물러나고, 스타트업 등 기업의 시장 진출을 돕는 플랫폼 역할에 눈을 돌려 돌파구를 마련할 것으로 보고 있다.실제 김 의장은 최근 국회 국정감사에서 영세 기업의 시장 진출을 돕는 플랫폼 비즈니스의 '선한 영향력'을 피력했다. 그는 ""플랫폼의 빛은 자본과 배경이 없어도, 시장의 큰 흐름에 참여할 기회가 생긴다는 것”이라면서 “카카오가 기술을 활용해 (중소사업자 등을)돕는 방향으로 나아가겠다”고 여러번 강조했다.카카오의 또 다른 돌파구는 해외 진출이 활발한 콘텐츠 사업을 앞세운 글로벌 성과 확대다. 해외매출 비중이 한 자릿수에 그쳐 내수시장에 의존한다는 지적을 받아온 카카오는 글로벌 사업 비중 확대를 주요 경영 목표로 꼽고 있다.카카오엔터테인먼트의 카카오웹툰은 대만, 태국에 진출해 성과를 냈고 다른 지역으로도 출시를 준비 중이다. 또 타파스, 래디쉬 등 해외 콘텐츠 플랫폼 '타파스'와 '래디쉬'를 인수하며 북미시장을 정조준하고 있다. 지난달에는 중국에서 텐센트와 합작회사를 통해 '포도만화'를 오픈했다. 일본에서는 카카오재팬의 '픽코마'가 웹툰 시장 1위를 석권하고 있다.이성엽 고려대학교 기술경영전문대학원 교수는 ""플랫폼은 공급자와 이용자를 연결해 비교와 추천 서비스를 제공하는 것이 본질적인 서비스이기 때문에 카카오도 고민이 많을 것""이라고 말했다.이어 그는 ""다만, 카카오가 물러나면 네이버 외에 다른 플랫폼이 대체하며 경쟁이 촉진되는 효과를 기대해볼 수 있다. 지금은 자영업자 등과 마찰에서 빚어지는 영역은 한발 물러나면서 내실을 다지는 과정이 될 것""이라고 진단했다.",105,https://n.news.naver.com/mnews/article/119/0002536839?sid=103
"방통위, 내달 개인위치정보사업 허가신청 접수",2021.10.10. 오후 12:00,"방송통신위원회는 올해 초 발표한 '2021년도 개인위치정보사업 허가심사 계획'에 따라 개인위치정보사업 허가 신청을 11월 2~9일 접수할 계획이라고 9일 밝혔다.개인위치정보사업은 특정 개인의 위치정보를 수집해 위치기반서비스사업을 하는 자에 제공하려는 사업을 가리킨다. 사업허가 또는 인가 신청을 희망하는 법인은 전자민원 홈페이지에서 신청 할 수 있다. 사업계획서는 방통위 인터넷이용자정책과에 방문해 제출하거나 우편으로 제출하면 된다.개인위치정보사업의 양수 또는 개인위치정보사업자인 법인의 합병·분할 등에 대한 인가 신청은 별도 접수기간 없이 상시 접수 가능하다.방통위는 허가신청 접수 이후 외부 전문가로 심사위원회를 구성해 관련 법령에 따라, 사업계획의 타당성 및 자금조달계획, 위치정보시스템 구축·확장·배치계획과 그에 따른 설비 투자계획, 위치정보 보호 관련 기술적·관리적 보호조치 계획 등을 종합적으로 심사할 계획이다. 이와 관련해 방통위는 허가를 희망하는 법인들의 편의를 위해 허가계획서 작성요령 설명회를 실시한다. 코로나19 확산 상황을 감안해 오는 19일 온-나라 PC영상회의를 활용해 비대면으로 설명회를 진행할 계획이다.한편 개인위치정보사업 허가제를 등록제로 완화하는 내용의 '위치정보의 보호 및 이용 등에 관한 법률' 개정안이 지난달 27일 국회 본회의를 통과함에 따라 내년 4월 말 이후 개인위치정보사업을 하고자 하는 경우에는 개정된 법률에 따라 '개인위치정보사업 등록 신청'이 가능하다.",105,https://n.news.naver.com/mnews/article/008/0004654761?sid=103
