title,date,main,section,url
"암호화폐 '사기' 취급하던 정부, 첫 정책 내놨다…""거래소 관리감독 강화""",2021.05.28. 오후 5:40,"[가상자산 거래 관리방안]암호화폐 거래소에 대한 첫 제도화



암호화폐 거래 시세 전광판의 모습. 2021.5.27/뉴스1 © News1 성동훈 기자(서울=뉴스1) 송화연 기자 = 정부가 오는 9월25일부터 암호화폐 거래소 등 가상자산 사업자에 대한 관리·감독을 강화한다. 암호화폐 거래소 임직원들의 암호화폐 거래행위가 금지되고 암호화폐 거래소가 자체 발행한 암호화폐에 대해 직접 매매·교환을 중개·알선하는 행위도 금지된다. 정부는 28일 암호화폐 시장규모 확대로 인한 불법행위 피해예방을 위해 암호화폐 관리체계와 각 분야 소관부처를 정한 '가상자산(암호화폐) 거래 관리방안'을 발표하고 이같은 내용을 밝혔다.과거 2017~2018년 암호화폐 투자광풍으로 정부가 업계에 자율규제안 마련을 종용한 적은 있지만 직접 나서 암호화폐에 대한 정부 정책을 내놓은 것은 이번이 처음이다. 기존에는 투자자 보호를 위해 암호화폐 거래소 업계에서 자율적으로 실시해온 규제를 정부가 법의 테두리내에 명문화해 암호화폐 거래소에 대한 첫 제도화라는 의미가 크다. 관리방안은 이날 오후 정부서울청사에서 구윤철 국무조정실장 주재로 열린 관계부처 차관회의를 통해 결정됐다. 회의에는 과학기술정보통신부와 기획재정부, 법무부, 방송통신위원회, 공정거래위원회, 금융위원회, 개인정보보호위원회, 경찰청, 국세청, 관세청 등이 참석했다.◇정부, 9월25일 기점으로 암호화폐 사업자 관리감독 기조 바꾼다금융위원회는 암호화폐 거래 시장의 확장에 따라 가상자산 사업자가 자금세탁 방지 의무를 지는 특정 금융거래정보의 보고 및 이용 등에 관한 법률(특금법) 개정안을 지난 3월25일 시행했다. 특금법 개정안은 암호화폐를 매수·매도·교환·보관·중개하는 사업자를 규제하는 법이다. 불법적인 암호화폐 거래를 사전에 차단하는 것이 특금법 개정안의 주된 목적으로 '빗썸', '업비트'처럼 암호화폐 거래를 지원하는 사업자가 주요 대상이다.가상자산 사업자는 사업을 영위하기 위해 일정 요건을 갖춘 뒤, 금융정보분석원(FIU)에 오는 9월24일까지 신고서를 제출해야 한다. 일정 요건이란 Δ정보보호 관리체계(ISMS) 인증 Δ실명확인 입·출금계정 개설(단 암호화폐와 금전의 교환 행위가 없는 사업자는 예외) Δ대표자 및 임원의 자격요건(대표‧임원이 특정 금융정보법, 금융관련법령 등 위반 없을 것 등) 구비 등을 뜻한다.정부는 이날 가상자산 사업자 신고유예기간(3월25일~9월24일) 전후로 단계를 나누어 각 단계별 리스크에 대응할 수 있도록 사업자 관리를 철저히 하겠다고 강조했다.◇""9월24일 전, 특금법 신고 수리에 집중…컨설팅도 지원""정부는 9월24일 이전까지 가상자산 사업자를 대상으로 조속한 신고유도와 컨설팅을 시행하기로 했다. 이를 위해 금융위원회, 금융감독원, 과학기술정보통신부는 가상자산 사업자 신고 요건 및 필요 보완사항에 대한 컨설팅을 제공한다.정부는 ""가상자산 사업자의 신고 접수시 신속하게 심사(FIU)해 조기 신고된 사업자 중심의 시장 재편이 신속히 이루어지도록 하겠다""며 ""가상자산 사업자의 폐업가능성에 시장 참여자가 미리 대응할 수 있도록 신고 신청·수리현황 공개 및 거래 유의사항 등을 지속 홍보하겠다""고 밝혔다.가상자산 사업자의 신고 현황은 FIU 공지사항에서, ISMS 인증현황은 한국인터넷진흥원(KISA) 알림마당을 통해 확인할 수 있게 된다.정부는 가상자산사업자 현황을 검찰·경찰 등 단속기관과 공유해 수사의 실효성을 제고하겠다고도 했다. 이날 정부가 파악한 암호화폐 거래 사업자는 60여곳(5월20일 기준)으로 이 중 20개사가 ISMS 인증을, 4개사는 ISMS 인증과 실명확인 입출금 계정을 운영(5월27일 기준)하고 있다. 다만 정부는 이 기간 중 가상자산 거래업자 등의 예치금 횡령, 해킹을 가장한 기획파산 등 위법행위에 대하여 엄정히 처리할 것이라고 엄포했다.



© News1 DB◇""9월25일부터 관련 사업자 엄격 관리…거래소 임직원 거래 제한도""정부는 가상자산 사업자 신고유예기간이 종료되는 9월24일을 기점으로 엄격하고 체계적인 관리에 돌입한다. 정부는 오는 9월25일부터 특금법에 규정된 가상자산 사업자의 Δ신고요건 Δ자금세탁방지 Δ횡령방지 Δ해킹방지 등 의무가 지켜지는지 관리·감독을 강화할 것이라고 예고했다.구체적으로 정부는 사업자가 신고요건을 갖춰 FIU에 신고(변경·갱신시도 적용)하도록 하고 미신고 영업의 경우 처벌(5년이하 징역·5000만원 이하 벌금) 하기로 했다. 또 자금세탁방지 의무를 엄격히 관리해 Δ고객확인 Δ의심거래 보고 Δ내부통제기준 마련 Δ가상자산 이전 시 정보제공 등 기본적인 의무위반여부를 검사하고, 미이행시 과태료·영업정지 등 제재를 하기로 했다.정부는 가상자산 사업자가 실명확인 입출금계정을 미개설할 시 신고를 불수리·말소하겠다는 계획도 제시했다. 이 밖에도 Δ고객 거래내역분리 관리 Δ예치금 분리관리 Δ미확인 고객과 거래금지 Δ미신고 사업자와 거래금지 Δ다크코인(추적할 수 없는 암호화폐) 거래 금지 등의 의무를 미이행시 과태료 부과‧영업정지‧신고 말소하기로 했다.정부는 고객 예치금을 횡령할 위험을 방지하기 위해 예치금 분리 관리 위반 시 과태료 부과‧영업정지‧신고 말소 등을 엄격히 관리하기로 했으며, 신고된 가상자산 사업자가 ISMS 인증을 유지하지 못할 경우 신고말소·불수리 하겠다고도 했다. 암호화폐 거래소의 보안 관리의 중요성을 강조한 대목이다.투명한 암호화폐 거래·보관을 위한 제도 개선도 추진된다. 정부는 특금법 시행령 개정을 추진하고 가상자산 사업자 등이 자체 발행한 가상자산에 대해 직접 매매‧교환을 중개·알선하는 행위를 금지하기로 했다. 이에 따라 일부 중소 암호화폐 거래소가 자체 발행한 암호화폐 거래는 모두 상장 폐지될 전망이다.또 특금법 시행령 개정을 통해 가상자산사업자·임직원의 암호화폐 거래 행위도 금지된다. 한국거래소가 임직원의 주식·파생상품 투자를 전면 금지하고 있는 것처럼, 상장 일정 등 내부 정보 획득에 용이한 암호화폐 거래소 소속 임직원의 거래를 관리·감독하겠다는 의지다.이 밖에도 정부는 해킹 등으로부터 투자자의 암호화폐를 안전하게 보관할 수 있도록 콜드월렛 보관비율을 상향하는 방안을 검토하기로 했다. 콜드월렛은 인터넷에 연결되지 않아 해킹이 어려운 지갑(USB 보관, 종이 지갑, 하드웨어 지갑 등)을 뜻한다. 이날 정부가 제시한 콜드월렛 보관비율은 70%로, 암호화폐 거래소는 보유 암호화폐의 30%만 핫월렛에 보관할 수 있게 될 전망이다.hwayeon@news1.kr▶ 네이버 메인에서 [뉴스1] 구독하기!▶  뉴스1&BBC 한글 뉴스 ▶  뉴스1 공채12기 수습기자 모집© 뉴스1코리아(news1.kr), 무단 전재 및 재배포 금지",105,https://n.news.naver.com/mnews/article/421/0005379758?sid=103
“해외 백신 괜히 맞았네”…방역 역차별 받는 韓 기업인들,2021.05.28. 오후 4:21,"해외 백신 접종 기업인, 입국하면 호텔 격리국내 백신 접종 입국자는 자택 귀가후 PCR검사”해외 백신 접종한 기업인은 역차별”



지난 26일 영종도 인천국제공항 1터미널에서 해외입국자들이 검역 절차를 안내받고 있다. /연합뉴스        최근 미국 출장길에 백신을 맞은 중견기업 대표 A씨는 ‘기업인 신속입국 및 격리면제’ 제도에 따라 한국 입국 후 14일 자가격리를 하지 않았다. A씨는 자가격리를 하지 않는 대신 인천공항 입국 직후 지정 호텔로 이동해 유전자증폭(PCR) 검사를 받고 결과가 나올 때까지 이 호텔에서 머물러야 했다. 정부는 격리면제를 받은 사람은 지정 임시생활시설(호텔)에서 PCR 검사를 받고 음성 결과가 나와야 밖에 나올 수 있도록 지침을 정했기 때문이다.그런데 정부가 지난달 29일 국내에서 신종 코로나 바이러스 감염증(코로나19) 백신을 접종한 사람은 국내 입국할 때 격리를 면제하기로 하면서 상황이 복잡해졌다. 이튿날 오전 급한 회의가 예정돼 있던 A씨는 ‘백신 인센티브’를 근거로 미국에서 받은 ‘코로나19 백신 증명서’를 당국에 제출했지만, ‘해외 백신 접종자는 대상이 아니다’라는 답변을 들었다. 이튿날 A씨는 아침 회의에 결국 참석하지 못했다.정부가 국내 코로나19 백신 접종을 늘리기 위한 백신 인센티브를 내놓았지만, 정부가 기업인의 해외 활동을 돕기 위해 도입한 ‘신속입국 절차’가 오히려 역차별을 낳고 있다는 지적이 나온다. 자가 격리가 완전 면제되는 국내 백신 접종자와 달리 해외에서 백신을 접종한 후 귀국하는 기업인들은 접종을 인정 받지 못해 ‘격리 면제’라는 지원 제도를 이용하면서도 호텔에 1박 2일 강제 숙박해야 한다.28일 방역당국에 따르면 모든 해외입국자는 14일간 자가격리 혹은 시설에서 격리되는 것이 원칙이지만, 계약 투자 등 중요한 사업상 목적이나 격리 면제서를 발급받은 대상자는 공항 선별진료소나 임시 검사시설에서 코로나19 진단검사를 받은 후 음성 판정을 받으면 격리를 면제받을 수 있다.이 제도에 따르면 ‘격리 면제’를 받은 기업인들은 방역당국과 계약한 호텔로 이동해 진단 검사 결과가 나올 때까지 기다려야 한다. 또 입국 후 받는 중간 PCR 진단검사 비용도 직접 자신이 내야 한다. 반면 14일의 단순 자가격리를 하는 사람은 인천공항으로 들어온 해외 입국자 전용버스와 KTX 전용칸으로 귀가한 후 자택 인근 관할 보건소에서 PCR 검사를 받고 자택에서 기다리면 된다. PCR 검사 비용도 모두 무료다.국내 백신 접종자는 자동으로 ‘격리 면제'를 해 준다. 국내에서 백신을 접종하고 해외를 다녀오면 호텔 격리 없이 공항에서 운영하는 해외입국자 전용버스나 KTX 전용칸을 이용해 자택으로 돌아와, 인근 보건소 PCR 검사에서 음성 판정만 받으면 바로 업무에 복귀할 수 있다. 이런 ‘격리 면제’에 해외 백신 접종자는 예외다.방역당국은 이달 초 해외에서 백신을 접종한 사람의 입국 제한을 풀어달라는 요청에 따라 세계보건기구(WHO)가 승인한 백신 접종자가 입국할 때 자가격리 면제를 검토하겠다고 밝혔지만, 아직까지 자세한 지침은 마련되지 않은 상태다. 국내와 달리 해외에서 발급된 백신 접종 확인서의 진위 여부의 판정이 어려운 것이 문제라고 한다.해외에서 활동하는 기업인들은 이를 두고 ‘행정 편의주의’라고 입을 모았다. 미국에서 화이자 접종을 두 차례 마친 한 기업인은 “미국은 백신이 넘쳐나서 동네 병원에만 가도 코로나19 백신을 맞을 수 있는데, 굳이 접종 확인서를 위조하면서까지 한국에 들어올 이유가 없다”고 했다. 그는 “이미 백신을 두 차례나 맞았는데, (격리 면제를 위해서) 한국에서 또 백신을 맞아야 하나”라며 “이제는 미국에서 백신을 맞은 것이 후회될 지경”이라고 했다.또 다른 기업인 B씨는 “정부가 불과 한 달 전까지 코로나 19 백신 물량 확보에 어려움을 겪었던 상황에서 해외 접종자에 대한 역차별을 하고 있다”고 했다. 그는 “이런 역차별이 개선되지 않으면 마스크 해방은 남의 나라 얘기가 될 것”이라며 “국내는 물론 해외 접종자까지 포함해 면제 기준을 명확히 해야 접종률을 높이는 데 도움이 될 것”이라고 했다.보건복지부 중앙사고수습본부 관계자는 “해외 백신을 접종하고 귀국한 사람들의 불만을 잘 알고 있다”고 했다. 이 관계자는 다만 “국가마다 인정하는 백신의 종류도 다르고, 또 우리 국민들이 이들 백신에 대해 갖고 있는 인식도 다르다”며 “이런 인식 차이를 감안해서 제도 정비를 고민하고 있다”고 했다.한편, 산업통상자원부에 따르면 기업인 격리면제 승인건수는 지난해 12월 14일부터 이달 21일까지 총 1만44건에 달한다. 이 중 미국(1902건)이 가장 많았고, 그다음이 중국(1534건), 독일(1322건) 순이었다. 일본은 방역과 상호주의를 이유로 지난 1월 14일부터 격리면제서 발급이 중단된 상태다.[김명지 기자 maeng@chosunbiz.com] ▶네이버에서 '명품 경제뉴스' 조선비즈를 구독하세요▶네이버 직원, 극단적 선택… 직장 내 괴롭힘 있었나▶""옷돈 얹어도 없다"" 반도체 기판 부족, 삼성·LG 전략은	저작권자 ⓒ 조선비즈, 무단 전재 및 재배포 금지",105,https://n.news.naver.com/mnews/article/366/0000724434?sid=103
"'격차 좁혀라' 태블릿 2위 삼성, 아이패드 맞서 중저가 라인업 구축",2021.05.28. 오전 7:02,"[일간스포츠 정길준]   



독일 삼성전자 홈페이지에서 유출된 갤럭시탭S7 FE. 삼성전자 제공     전 세계 태블릿 판매 2위 삼성전자가 애플의 신제품인 5세대 '아이패드 프로'에 맞서 중저가 라인업을 내놓는다. 사전예약을 시작하자마자 동날 정도로 인기를 끈 아이패드 프로에 대응해 합리적인 가격을 앞세워 소비자를 공략하기 위해서다.    27일 해외 IT 매체 샘모바일에 따르면, 최근 독일 삼성전자 홈페이지에서 '갤럭시탭 S7 FE(팬에디션)'(이하 갤탭S7 FE) 관련 정보가 유출됐다가 삭제됐다. 가격은 649유로(약 88만5000원)로 책정됐다.    삼성전자 관계자는 본지에 ""독일 법인이 실수로 올린 것 같다""며 ""출시 전 제품이라 밝힐 수 있는 내용이 없다""고 말했다. 이 제품은 유럽을 비롯해 국내에서 다음 달 중 출시가 유력한 것으로 전해졌다.    삼성전자가 스마트폰이 아닌 태블릿에 FE 버전을 추가하는 것은 이번이 처음이다. 프리미엄 제품인 S 시리즈의 사양을 일부 하향 조정하는 대신 가격을 낮춘 것이 특징이다.    갤탭S7 FE는 앞서 출시된 '갤럭시탭 S7 플러스'(이하 갤탭S7 플러스)와 마찬가지로 퀄컴의 AP(애플리케이션 프로세서)를 탑재했다. 대신 갤탭S7 플러스(스냅드래곤 865 5G+)보다 하위 버전(스냅드래곤 750G 5G)을 채택했다.    또 디스플레이 크기는 12.4형으로 같지만, 해상도는 다소 떨어진다. 카메라도 하나 빠졌다. 램과 스토리지 등 데이터 저장소 용량도 절반 수준으로 낮췄다.    그 대신 갤탭S7 FE는 가격 경쟁력을 확보했다. 512GB 기준 갤탭S7 플러스는 와이파이 버전이 124만9100원, 5G 버전이 144만9300원으로 높은 가격을 형성했다. 갤탭S7 FE는 90만원에 조금 미치지 못하는 가격으로 50만원가량 저렴하다.    이밖에 삼성전자는 오는 6월 더 저렴한 '갤럭시탭A7 라이트(가칭)'도 선보일 예정이다. 지난해 4월 출시된 보급형 '갤럭시탭S6 라이트'의 경우 가격이 40만~50만원대로 저렴하다. 신제품도 유사한 수준으로 가격이 정해질 것으로 관측된다.      



5세대 아이패드 프로. 애플 제공     이처럼 삼성전자가 중저가까지 태블릿 라인업을 확대한 것은 1위 애플과의 격차를 최대한 줄이기 위해서라는 분석이 나온다.    애플은 지난 24일 아이패드 프로의 사전예약을 시작했는데, 12.9형 모델이 얼마 지나지 않아 물량이 소진될 정도로 관심을 받았다.    큰 변화가 없었던 4세대 제품과 달리 5세대는 맥북 등 PC에 적용했던 애플 'M1' 칩을 탑재했다.    지난달 애플의 글로벌 마케팅을 담당하는 그렉조스위악 수석 부사장은 ""획기적인 M1 칩은 맥 제품에 있어 혁신이었으며, 이 칩을 아이패드 프로에도 도입하게 돼 기쁘다""며 ""M1은 성능의 큰 도약을 보장한다. 이제 아이패드 프로에 비견할 기기는 없다""고 자신했다.    또 12.9형 제품은 선명한 화질의 디스플레이로 주목을 받았다. LCD보다 진화하면서 OLED(유기발광다이오드)의 단점인 번인(화면 번짐)을 극복하기 위해 1만개 이상의 미니 LED를 촘촘하게 박았다.    애플이 옵션을 최소화한 11형 와이파이 128GB 모델도 99만9000원으로 비싸다. 용량을 최대로 높인 5G 지원 12.9형 모델은 300만원대에 달한다. 그런데도 애플은 다수의 충성고객을 확보하고 있어 흥행을 의심하지 않는 모양새다.      



삼성 갤럭시탭S7 플러스, FE와 애플 아이패드 프로 12.9형, 11형 사양 비교     삼성전자와 애플의 이번 신제품 출시는 글로벌 태블릿 시장 점유율에 적지 않은 영향을 미칠 것으로 보인다.    시장조사업체 스트래티지 애널리틱스의 보고서를 살펴보면, 올해 1분기 글로벌 태블릿 시장에서 1위 애플과 2위 삼성전자는 유일하게 두 자릿수 점유율을 보이지만 격차가 크다.    애플은 36.7%로 전년 동기 대비 6%포인트 이상 성장했지만, 삼성전자는 18.1%로 지난해 같은 기간에 비해 3%포인트 조금 넘게 증가하는 데 그쳤다.    정길준 기자 jeong.kiljhun@joongang.co.kr  ▶ [오늘의 운세 바로가기] [만화 바로가기]▶ [일간스포츠 바로가기]     ⓒ일간스포츠(https://isplus.joins.com) 무단 전재 및 재배포 금지""",105,https://n.news.naver.com/mnews/article/241/0003121425?sid=103
"‘웹소설+IP 영상화’...KT, ‘미디어’ 성장엔진 신호탄",2021.05.28. 오전 11:46,"웹소설 ‘쉿! 그놈을...’ 드라마로 공개IP발굴서 콘텐츠 제작·유통채널까지그룹 원천IP 공급기지役 강화 주력







드라마 ‘쉿! 그놈을 부탁해’ 포스터. [스토리위즈 제공]KT 자회사인 콘텐츠 전문기업 스토리위즈가 웹소설 지적재산권(IP)을 영상화하는 프로젝트를 시작한다.미디어·콘텐츠를 새 먹거리로 정조준하고 총력을 싣고 있는 KT가 미디어 경쟁력 강화를 위한 다양한 시도를 본격화 한다.스토리위즈는 28일 자사의 웹소설 ‘쉿! 그놈을 부탁해’를 원작으로 한 동명의 드라마가 KT그룹의 4대 미디어 플랫폼을 통해 공개될 예정이라고 밝혔다.이 드라마는 스토리위즈의 웹소설 IP를 KT 스튜디오지니가 드라마로 영상화해 KT 그룹 미디어 플랫폼을 통해 유통하는 작품이다. KT 스튜디오지니는 지난 1월 출범한 KT 미디어·콘텐츠 사업의 컨트롤 타워다.스토리위즈는 KT, KT 스튜디오지니와의 협업을 통해 이 IP의 영상화를 추진하며 나아가 정식으로 웹소설 출간 계약까지 함께 진행했다. 원천 IP로서의 가치를 극대화하기 위해 영상화와 출간 계약을 동시에 추진한다는 계획이다.‘쉿! 그놈을 부탁해’는 인생에 되는 것이라곤 하나도 없던 세 여자가 우연한 기회로 복수를 대신해 주는 네일샵 ‘네메시스’를 운영하면서 벌어지는 이야기를 그린 코믹 멜로물이다. 드라마는 3부작으로 제작된다.이날부터 올레 tv(IPTV)와 Seezn(온라인동영상플랫폼), 스카이라이프(위성방송)를 통해 VOD로 공개하며, 매주 금요일 밤 9시 40분 skyTV의 실시간 채널에서도 시청할 수 있다.전대진 스토리위즈 대표는 “이번에 드라마로 선보이는 ‘쉿!, 그놈을 부탁해’는 스토리위즈가 무료 연재 웹소설 IP를 발굴해 드라마로 제작하며 그 가치를 극대화한 사례”라며 “앞으로도 스토리위즈의 웹소설 플랫폼 ‘블라이스’를 통해 웹툰화, 영상화 등 확장 가능성을 지닌 우수한 웹소설 IP를 지속적으로 발굴하며 KT 그룹 내 원천 IP 공급 기지로서의 역할을 강화하겠다”고 밝혔다.한편, 이번 사례는 원천 IP 발굴, 콘텐츠 제작, 유통 채널까지 연계되는 KT 그룹 미디어 전략을 구현한 첫 시도다.KT는 ‘미디어·콘텐츠’를 새 핵심 먹거리로 삼고 올 들어 경쟁력 강화에 총력적을 펼치고 있는 상태다. KT 스튜디오지니 설립을 필두로, 지난 4월에는 알티캐스트의 미디어부문 자회사 알티미디어 지분 100%를 인수하기도 했다. 알티캐스트의 해외 시장 기반을 활용해 글로벌 미디어 사업을 확장하겠다는 계획이다.KT는 미디어 사업 성장을 통한 주가 부양 의지도 내비쳤다. 증권업계에서도 KT의 미디어 산업 향방에 주목하고 있다. 한국투자증권은 “무선 서비스 업종의 주가수익비율(PER)은 10배에 불과하지만 미디어 업종 PER은 26배에 달하기 때문에 종합 미디어 업체로의 전환은 KT 멀티플을 높이는 요인으로 작용할 것”이라고 전망했다.박세정 기자▶환경적 대화기구 '헤럴드에코'▶밀리터리 전문 콘텐츠 ‘헤밀’▶헤럴드경제 네이버 채널 구독- Copyrights ⓒ 헤럴드경제 & heraldbiz.com, 무단 전재 및 재배포 금지 -",105,https://n.news.naver.com/mnews/article/016/0001841152?sid=103
