title,date,main,section,url
"업비트, 국내 1호 코인 거래소 됐다…플라이빗, KODA도 특금법 신고",2021.09.17. 오후 10:42,"[디지털데일리 박현영기자] 업비트가 국내 최초로 '합법적인' 가상자산 거래소가 됐다.   17일 업비트는 금융정보분석원(FIU)이 업비트 운영사 두나무의 가상자산사업자 신고를 수리하기로 결정했으며, 신고 수리 공문을 수령하기 위해 대기 중이라고 밝혔다.    앞서 두나무는 특정금융정보법(특금법)에 따라 지난달 20일 FIU에 신고서를 접수했다. 심사에 약 한 달이 걸린 셈이다. 최대 심사 기간은 3개월이다.    두나무 관계자는 ""특금법 및 관련 법령에서 정한 의무를 이행하고, 자금세탁방지(AML) 및 고객 확인(KYC) 등을 강화해 안전한 거래환경을 조성하겠다""고 밝혔다.    한편 이날 FIU는 가상자산 거래소 플라이빗과 커스터디(수탁) 기업 한국디지털에셋(KODA)이 새로 신고서를 접수했다고 밝혔다. 앞서 지난 9일에는 빗썸이, 10일에는 코인원과 코빗이 신고서를 낸 바 있다.    플라이빗은 은행으로부터 실명확인 입출금계정(실명계좌)을 발급받지 못해 우선 '코인마켓'으로만 신고서를 냈다. 원화마켓을 운영하려면 실명계좌가 있어야 하기 때문이다.    이날 신고서를 낸 또 다른 사업자로는 KODA가 있다. KODA는 KB국민은행이 블록체인 투자사 해시드, 기술기업 해치랩스와 함께 설립한 가상자산 커스터디 기업이다.",105,https://n.news.naver.com/mnews/article/138/0002110557?sid=103
"이통3사, 비대면 추석 통화량 증가 대비 특별 소통대책 추진",2021.09.18. 오전 7:00,"[SK텔레콤 제공. 재판매 및 DB 금지]    (서울=연합뉴스) 조성흠 기자 = 이동통신 3사가 추석 연휴 통화량 증가에 대비해 특별 소통 대책을 추진한다.    18일 이통업계에 따르면 SK텔레콤은 고객의 트래픽 이용 현황을 인공지능(AI)과 빅데이터 기반으로 분석해 22일까지 통화 품질 유지를 위해 하루 평균 1천637명이 근무하기로 했다.    특히 이번 연휴는 정부가 전국민 무료 영상통화를 지원하기로 한 데 따라 추석 당일 전국 데이터 트래픽이 평소의 31% 증가한 최대 886TB(테라바이트)에 이를 것으로 SKT는 예상했다.    SKT는 트래픽 증가에 대비해 고속도로, 국도, 관광지, 쇼핑몰 등 9천여곳에 대해 기지국 용량 증설을 완료했다.    또한 티맵모빌리티, SK브로드밴드 등 자회사와 협력해 선제적으로 서버 용량 확대 및 사전 점검을 마쳤다.    통합보안관제센터를 중심으로 연휴 기간 SKT와 관계사 서비스에 보안침해 사고 발생을 차단하기 위한 공조 대응에도 나선다.



[KT 제공. 재판매 및 DB 금지]    KT도 연휴 기간 안정적인 통신 서비스를 제공하기 위한 집중 모니터링과 특별 대책을 추진한다.    24시간 모니터링 체계를 강화하고 하루 평균 1천490명이 근무하며 긴급복구 체계를 유지한다.    귀성 및 귀경객이 몰리는 주요 고속도로와 국도, 휴게소, 공항, KTX/SRT 역사, 터미널 등에서 무선 품질 사전점검을 마쳤다.    연휴 기간 인파가 몰릴 것으로 예상되는 백화점, 쇼핑몰 등 전국 1천100여곳을 집중 모니터링 대상으로 정해 통신 품질을 관리한다.    온라인동영상서비스(OTT) 시즌의 시청량 증가에 대비해 모니터링을 강화하고 데이터 처리량 확대 및 부하 분산 작업도 완료했다.    LG유플러스는 통화량 및 데이터 트래픽 급증에 대비해 네트워크 최적화, 24시간 종합상황실 운영 등 특별 소통 대책을 수립했다.    비상 상황에 긴급 대응할 수 있는 종합상황실을 서울 마곡사옥에 열고 24시간 집중 모니터링에 돌입했다.    트래픽 증가가 예상되는 전국 고속도로, 휴게소, KTX/SRT 역사, 터미널, 공항 등에 있는 기지국을 사전 점검하고 최적화 작업을 실시했다.    특정 지역에 통화량과 트래픽이 집중되는 명절 특성을 고려해 중요 거점 지역에 상시 출동 태세를 갖췄다.     또한 명절 통화량과 트래픽 추이를 분석해 주요 고속도로 요금소와 휴게소, 상습 정체구간에서도 적극적으로 고객 보호에 나설 계획이다.



[LG유플러스 제공. 재판매 및 DB 금지]    josh@yna.co.kr",105,https://n.news.naver.com/mnews/article/001/0012666313?sid=103
"선거철마다 반복되는 '네카오' 때리기, 이번엔 다르다",2021.09.18. 오전 6:01,"과거 뉴스·댓글·실검이 이슈였지만이번엔 각종 민생 사업이 도마에 올라카카오식 성장 전략에 '빨간불'



[서울경제] 선거를 앞두고 정치권에서 국내 양대 인터넷 기업인 네이버, 카카오(035720)를 압박하는 것은 매번 반복되는 풍경이다. 두 회사는 포털을 통해 뉴스, 블로그, 댓글 등 여론 형성에 막대한 영향력을 끼치는 서비스를 운영하기 때문이다. 편향된 뉴스 배치, 댓글 및 실검(실시간 급상승 검색어) 조작 등 각종 의혹들이 쏟아지며 논란이 됐다.하지만 내년 대통령 선거를 앞두고서는 플랫폼 기업의 ‘문어발’식 사업 확장과 골목상권 침해 등 민생 관련 사업이 도마에 올라 이전과는 결이 다르다는 평가다. 특히 그동안 뉴스 시장 점유율 70%를 차지하는 네이버가 주타깃이 됐다면 이번에는 택시, 퀵, 꽃배달, 헤어샵 등 각종 생활형 사업을 확장해 온 카카오가 집중포화를 받고 있다.최근 당정은 플랫폼 기업의 독과점 현상과 시장지배력 남용 문제를 화두로 내걸고 전방위적인 공격에 나섰다. 논란의 중심엔 카카오가 있다. 더불어민주당에서 ‘공룡 카카오의 문어발 확장’이라는 제목의 토론회를 여는가 하면 한상혁 방송통신위원장은 택시 등 사업을 하는 카카오모빌리티를 겨냥해 “심각하게 살펴보고 있으며 규제 방식을 고민하고 있다”고 밝혔다. 공정거래위원회도 카카오 창업자 김범수 이사회 의장의 개인 회사인 케이큐브홀딩스를 비롯해 카카오모빌리티, 카카오엔터테인먼트 등 그룹 전반에 대한 전방위적인 조사에 착수했다.카카오를 바라보는 여론의 시선도 곱지만은 않다. 각종 인터넷 커뮤니티에서는 카카오 투자회사 카카오벤처스가 장례 플랫폼 ‘고이’에 투자한 것을 두고 카카오프렌즈 캐릭터들이 상조 서비스에도 등장할 것이라고 비꼬는 글들이 돌고 있다. 뱅크, 페이, 보험, 택시, 게임 등 카카오가 생활 속 곳곳에 스며들어 소비자들이 종속된 상황을 풍자한 만화도 화제가 되고 있다. 게시물에는 ‘독과점이 이래서 무섭다’ ‘진작 규제했어야 했다’ ‘수수료 보면 답이 없다’ 등의 댓글들이 달렸다.업계에서는 이번 논란이 카카오가 단기간 인수(M&A) 합병을 통해 몸집을 키우는 과정에서 예견된 일이었다는 지적도 나온다. 카카오 그룹 내 국내 계열사는 2015년만 해도 45개였으나 올 상반기 기준 117개로 급증했다. 위정현 중앙대 경영학부 교수는 “M&A로 단기 급성장하는 기업들에게 나타나는 흔한 현상으로 계열사에 카카오의 초기 철학, 창업자의 비전을 공유하지 못하며 혼란에 빠졌다”고 평가했다. 위 교수는 “창업자인 김범수 카카오 이사회 의장이 ‘사회적 가치’를 아무리 강조해봐야 M&A를 통해 인수한 기업들에게는 먹히지 않는다”며 “원래 인수한 조직에 자사 문화를 심는 것은 어려운 일”이라고 말했다.본사 중심의 의사결정이 주를 이루는 네이버와 다르게 계열사 자율성을 앞세운 카카오의 경영방식도 양날의 칼로 평가된다. 지금까지 각 계열사들이 스스로 투자전략이나 사업방식을 주도하며 빠른 성장을 이끌었지만 시간이 지나며 그룹 전체의 일관성이나 체계에 균열을 만들었다는 것이다. 기업공개(IPO) 성과를 내려고 같은 계열사 간 경쟁을 한다거나 계열사 독자적으로 무리한 수익 확대에 나서는 모습이 종종 연출된다는 지적이다.카카오가 그동안 내수 중심의 서비스가 많은 탓에 영세 사업자들과의 갈등의 골이 깊어졌다는 비판도 있다. 카카오는 현재 웹툰·웹소설 등 콘텐츠 부문을 제외하면 아직까지 해외에서 두드러진 성과를 낸 사업이 없다. 이러한 문제점들을 인정하듯 카카오는 최근 내놓은 상생안에서 앞으로 글로벌 사업을 강화하겠다고 강조했다. 북미, 동남아, 일본 등에 적극 진출한다는 계획이다. 업계 관계자는 “김범수 의장도 스스로 말했듯 카카오가 지난 10년간 추구해왔던 성장 방식을 과감하게 버릴 때가 됐다""며 “그룹 운영방식과 사업 전략 등 전반적인 점검이 필요한 상황”이라고 말했다.",105,https://n.news.naver.com/mnews/article/011/0003964218?sid=103
"오라클, 자바(JAVA) 17 발표",2021.09.17. 오후 3:01,"[디지털데일리 이종현기자] 오라클은 프로그래밍 언어 자바(JAVA) 17의 최신 버전을 공개했다고 17일 밝혔다.   자바 17은 6개월 주기로 공개되는 자바의 최신 장기 지원 버전이다. 오라클 엔지니어와 오픈 JDK 커뮤니티 및 JCP 등 전 세계 자바 개발자 커뮤니티 구성원의 협업으로 완성됐다는 것이 오라클의 설명이다.   오라클은 자바 17 발표와 함께  ▲다음 LTS 공개 시점까지 자유롭게 무료 사용 라이선스 제공 ▲자바 17 고객 대상 최소 2029년 9월까지 보안, 성능, 버그 수정 업데이트 제공 ▲클라우드 환경의 자바 도입 가속화 등을 강조했다.   조지 사브 오라클 자바 플랫폼 그룹 개발 담당 부사장은 “오늘날 자바 개발자들이 당면한 가장 큰 과제 중 하나는 최신 LTS 버전의 사용만을 요구하는 기업이다. LTS 버전의 출시 주기가 2년으로 변경된 만큼, 보안을 우선하는 기업의 개발자들은 기능별 선호도와 필요에 따른 더 많은 선택권을 확보하게 됐다”고 말했다.",105,https://n.news.naver.com/mnews/article/138/0002110538?sid=103
네이버 ‘글로벌 AI 연구벨트’ 탄탄해진다..MS출신 영입,2021.09.17. 오후 1:18,"MS와 아마존 출신 ​​김용범 박사, 일본 와세다대 사카이 교수한국-일본-유럽-베트남-홍콩-미국 등 잇는 기술연구네트워크  [파이낸셜뉴스] 네이버는 글로벌 검색 및 인공지능(AI) 분야에서 맹활약하고 있는 외부 인사를 영입, 자사가 구축한 기술 연구 네트워크인 ‘글로벌 AI 연구벨트’를 강화했다고 17일 밝혔다.   네이버는 미국 위스콘신 대학교에서 자연어처리(NLP) 분야 박사학위 획득 후, 마이크로소프트(MS)와 아마존 등을 거친 대화형 AI 전문가 김용범 박사를 책임리더로 영입했다.   또 검색품질평가 분야 세계적 전문가로 꼽히는 일본 와세다 대학교 컴퓨터공학부 사카이 테츠야(SAKAI Tetsuya) 교수를 연구총괄자문으로 선임했다.   김용범 책임리더는 아마존에서 AI ‘알렉사(Alexa)’ 핵심 컴포넌트인 '다이나믹 랭킹 사이언스 그룹'을 이끌며, 사용자 의도와 맥락을 이해하고 서비스를 제공하기 위한 핵심 기술을 연구 개발했다. 다양한 디바이스에 탑재된 수만개 ‘알렉사 스킬(Alexa Skills)​’을 대상으로, 세계 각국 일반 및 기업 사용자가 원하는 응답을 제공하는 AI 시스템도 구축한 바 있다.   사카이 교수는 도시바 자회사 뉴스와치(NewsWatch)에서 자연어처리 연구소장과 MS 리서치 아시아 등을 거쳐 와세대 대학교 컴퓨터공학부 학과장을 역임했다. 사카이 교수는 지난 20년간 PC·모바일 검색, 질의응답, 자연어 대화 등 유효성 평가 방법을 연구했다.    



네이버 네이버 서치 사내독립기업(CIC) 강인호 책임리더는 “네이버가 가진 풍부한 데이터 및 서비스 운영 노하우와 이번에 영입한 전문가들 성과가 만나 사용자에게 더욱 고도화된 검색 경험을 선사할 수 있을 것으로 기대한다”면서 “앞으로도 네이버는 기술 선도 기업으로서 세계 전역의 뛰어난 연구자들과 협업하며 한층 더 높은 기술 성장을 도모해 나갈 것”이라고 말했다. #네이버 #서치 #AI연구벨트",105,https://n.news.naver.com/mnews/article/014/0004710942?sid=103
"[에이앤랩's IP매뉴얼] 구글 갑질방지법 시행, 플랫폼 사업자 특권 사라질까",2021.09.18. 오후 5:36,"신상민 법무법인 에이앤랩 변호사[법무법인 에이앤랩 신상민 변호사] 국내외적으로 많은 관심과 기대를 모은 이른바 ‘구글 갑질방지법’이라 불리는 전기통신사업법 일부개정안(2021. 9. 14. 개정된 법률 제18451호)이 9월 14일자로 시행되었다. 다만, 아직 신설된 법률조항의 내용을 구체화하는 하위법령은 마련되지는 않은 상태이다.국회 의안정보시스템에서 확인되는 개정 정보통신방법의 입법목적은 ‘앱 마켓사업자가 거래상의 지위를 부당하게 이용하여 모바일콘텐츠 등 제공사업자로 하여금 특정한 결제방식을 사용하도록 강제하는 행위’, ‘앱 마켓사업자가 모바일콘텐츠 등의 심사를 부당하게 지연하는 행위’ 등을 금지하는 것을 골자로 하고 있다.결국 앱 마켓산업 참여자의 공정한 경쟁을 촉진해 이용자의 이익을 저해하지 않도록 규제하는 것이 핵심일 것이다. 플랫폼 사업자의 특권을 내려놓고 서드파티 사업자들과 동등하게 비즈니스를 하라는 의미다.ICT기업들은 이번 개정법을 주목할 필요가 있다. 왜냐하면 자신의 비즈니스가 규정에 부합하는지 여부를 원점에서 검토해야 하기 때문이다. 상세한 개정내용은 아래와 같다.(1) 앱 마켓사업자는 모바일콘텐츠 등의 결제 및 환불에 관한 사항을 이용약관에 명시하는 등 대통령령으로 정하는 바에 따라 이용자의 피해를 예방하고 이용자의 권익을 보호하도록 함(제22조의9 제1항).(2) 과학기술정보통신부장관 또는 방송통신위원회는 모바일콘텐츠 등을 등록·판매하기 위하여 제공하는 자의 보호 등을 위하여 대통령령으로 정하는 바에 따라 앱 마켓사업자의 앱 마켓 운영에 관한 실태조사를 실시할 수 있도록 함(제22조의9 제2항).(3) 통신분쟁조정위원회의 조정대상에 ‘앱 마켓에서의 이용요금 결제, 결제 취소 또는 환급에 관한 분쟁’을 포함함(제45조의2 제1항 제6호).(4) 앱 마켓사업자가 거래상의 지위를 부당하게 이용하여 모바일콘텐츠 등 제공사업자로 하여금 특정한 결제방식을 사용하도록 강제하는 행위를 금지함(제50조 제1항 제9호).(5) 앱 마켓사업자가 모바일콘텐츠 등의 심사를 부당하게 지연하는 행위를 금지함(제50조 제1항 제10호).이와 같이 앱 마켓사업자의 거래상 지위 남용에 관한 신설 조항은 전기통신사업법 제50조의 금지행위 규정에 들어왔는데, 위 전기통신사업법 상 금지행위 규정은 전기통신업을 영위하는 업체 및 ICT기업이 운영하는 사업이 적법한지 살펴볼 때 항상 검토되어야 하는 대표적인 조항에 해당한다.이 조항은 형식적으로는 사후적 행위규제 조항이지만, 실질적으로 관련업체들이 사업 시행 이전에 저촉 여부를 선 검토하여야 하는 성격을 가진다.그런데 위 금지행위 규제 규정은 해서는 안 되는 행위에 대해 각 호로 열거적으로 규정하는 형식을 갖고 있기 때문에, 수시로 변화하는 현실을 잘 반영하지 못하는 경우가 종종 발생할 수 있을 것으로 보인다.오늘날 방송·통신융합, 각종 인터넷 플랫폼의 등장, 전자상거래의 활성화, 망을 통한 서비스의 확대 등으로 인해 사업자의 새로운 영업행위에 대해 규제의 필요성이 뒤늦게 드러나는 경우가 많은데, 위와 같이 전기통신사업법에는 금지행위 유형이 한정적으로만 열거되어 있는 한계가 생길 수 있다.이에 대해 처분관청은 전기통신사업법은 제5호의 ‘이용약관과 다르게 전기통신서비스를 제공하거나 전기통신이용자의 이익을 현저히 해치는 방식으로 전기통신서비스를 제공하는 행위’ 규정을 일종의 일반규정으로 보고 폭넓게 적용시키려는 경향을 보이기도 한다. 한정적 열거조항이라는 입법 방식에 따라 어쩔 수 없이 발생하는 현상일 수밖에 없다.사회의 역동적인 변화에 발맞춰 즉각적으로 입법개정이 이루어져서 변화에 걸맞는 법률을 바로 갖추는 것이 이상적일 것이다. 하지만 다양한 이해관계를 가지는 시민들이 공존하는 우리 사회에서 그러한 이상을 달성하기도 전에 각종 분쟁과 다툼이 발생하는 경우가 더 많은 것이 현실이다. 이른바 구글 갑질방지법(전기통신사업법 일부개정)도 기존에 금지행위 조항에 포섭되지 않았던 새로운 현상을 법의 테두리로 들여와 규제를 하는 입법에 해당한다. 이러한 입법개정을 통해 보다 공정하고 이용자 친화적인 생태계가 형성되기를 기원하면서, 언제 또 새로운 금지행위 유형이 추가될지 관심을 가지고 지켜보고자 한다.*법무법인 에이앤랩은 지식재산권전문브랜드 ‘아이피앤랩’을 운영 중이다.*기고는 이데일리의 편집방향과 다를 수 있습니다.",105,https://n.news.naver.com/mnews/article/018/0005040881?sid=103
봉이 김선달은 억울하다? [물에 관한 알쓸신잡],2021.09.18. 오후 9:31,"저렴한 물 값은 이득이기만 할까물은 모든 생명의 근원이고 없어선 안 될 중요한 존재입니다. 그런데 우리는 과연 일상생활에서 소중한 물에 대해 얼마나 알고 있을까요? 그동안 물에 관한 연구는 있었지만 물에 관한 이야기는 없었습니다. 물에 대한 지식은 교과서에서 배운 것이 대부분입니다. 국민 간식 라면부터 아이스 아메리카노 한잔에 얽힌 사연, 대동강 물 밑지고 판 봉이 김선달, 해외 여행 추억을 소환하는 공항 검색대의 생수까지 지금껏 들은 적 없는 일상생활 속 물 이야기를 전하겠습니다.



서울 시내에서 흐르는 청계천. (사진=이미지투데이)[최종수 토지주택연구원 연구위원] 봉이 김선달과 한양 상인 허풍선 간 술잔이 오가고 대동강 물값에 대한 흥정이 시작됩니다. 선달은 조상 대대로 내려온 대동강 물을 두고 조상님께 면목이 없어 못 팔겠다고 버티고 한양 상인들은 집요하게 흥정합니다.거래금액은 처음에는 1000냥이었으나 조금씩 올라가 결국 4000냥에 낙찰됐다. 선달은 낙찰금액이 정해지고 나서도 대동강 물 팔기가 못내 서운한 듯 한참 주저하다가 한양 상인들의 성화에 못 이기는 척 계약서에 도장을 찍습니다.대동강 물을 팔아먹었다는 봉이 김선달 얘기입니다.  1냥은 지금 돈의 가치로 따지면 7만원 정도니 주인 없는 대동강 물을 3억원이나 받고 팔았다는 이유로 봉이 김선달은 사기꾼의 대명사가 됐습니다.봉이 김선달은 희대의 사기꾼 오명을 썼지만 현재 다시 태어난다면 평가는 달라질 듯합니다. 십수년 전 서울 한복판에서 청계천을 두고 물 값을 내야 한다는 주장과 내지 않아도 된다는 쪽이 법정 다툼까지 갔으니 말입니다.결국 물 값은 내지 않는 것으로 결론 났지만 당시 계산서로 청구된 청계천 ‘물 값’은 매년 17억원이었습니다. 청계천보다 수량도 훨씬 많은 대동강을 사용 기한도 없이 3억원 정도에 팔았으니 청계천 사건을 봉이 김선달이 알았더라면 희대의 사기꾼 평가에 억울해 할 수도 있었겠네요.우리가 마시는 물 값도 한번 알아볼까요? 우리가 편의점에서 자주 사서 마시는 0.5ℓ 생수 한병 가격은 800~900원 정도 합니다.수돗물 값은 얼마나 할까요. 수돗물은 생수병에 넣어서 팔지 않고 계량기로 사용량을 검침해 요금을 부과하기 때문에 대개 1t 단위로 가격을 매깁니다.1t은 0.5ℓ 생수병 2000개에 해당하는 양입니다. 수돗물 1t 가격은 740원 수준입니다. 0.5Ю 생수 2000개에 해당하는 양의 수돗물을 생수 한 병과 바꾸려면 60원을 더 얹어줘야 하는 실정입니다. 생수에 비해 2000분의 1도 채 안 되는 가격인 셈입니다.



나란히 놓여 있는 생수병들. (사진=이미지투데이)우리는 어렸을 적부터 물을 아껴 쓰라는 말을 자주 들었습니다. 하지만 대부분 사람들은 여전히 물을 아껴 쓰지 않는 수준이 아니라 ‘물 쓰듯’ 펑펑 쓰고 있습니다.물을 아껴 쓰지 않는 이유는 싼 물 값도 한 몫 하는 것 같습니다. 한 달 동안 아낌없이 쓰고도 내는 수도요금은 커피 두 잔 값 수준이니 말입니다.수도요금이 싼 이유는 생산원가에도 못 미치는 수준으로 수돗물을 공급하기 때문입니다. 수돗물 생산원가가 t당 944원이니까 1t을 팔 때마다 200원 정도씩 밑지는 셈이지요. 물장사가 남는 장사라고 했는데 예외가 있었네요.다른 나라의 물 값 사정은 어떤지 알아보겠습니다. 주요 해외 국가의 평균 수도요금은 1t당 1651원으로 우리나라에 비해 2배 이상 높습니다. 가장 비싼 나라는 덴마크로 3910원입니다. 우리나라와 자주 비교하는 나라인 미국, 영국, 프랑스, 독일, 일본 등은 모두 1000원대 중반에서 2000천원 대 후반입니다. 물을 싸게 사용하는 것은 긍정적인 면만 있어 보이지만 알고 보면 원가 이하로 싼 수도요금은 예상치 못한 부작용을 가져 옵니다. 우선 물을 아껴 써야 한다는 공감을 얻기가 어렵고 수돗물이 워낙 싸다 보니 빗물과 중수도를 이용해야 하는 필요성을 느끼지 못하게 합니다. 시장 가격보다 싸게 물건을 판다는 것은 누군가는 손해를 보고 있다는 말입니다. 결국 수돗물 공급자에게 적자가 쌓이게 되고 누적된 적자로 노후 상수도관과 정수시설을 교체하기는 점점 어려워집니다.수도요금만 올리면 모든 문제가 간단하게 해결될 것처럼 보이지만 수도요금이 공공요금이다 보니 물가 상승이나 반대 여론을 의식해 인상을 결정하기 쉽지 않습니다.비싼 물 값 이야기도 빠질 수 없겠지요. 인터넷을 검색해 보면 한 병에 적게는 몇십만원에서부터 많게는 수억원을 호가하는 물도 있습니다. 이들은 대부분 물에 금가루를 첨가하거나 물병에 다이아몬드 장식을 한 것으로 물 자체가 비싼 것은 아닙니다. 물 자체가 비싼 물도 있습니다. 암 진단에 쓰이는 컴퓨터단층촬영(PET-CT)용 시약 제조용 산소-18 농축수가 주인공인데 1g에 5만원이 넘는다고 하네요. 이 물로 0.5ℓ 생수 한 병을 가득 채우면 자그마치 2500만원을 훌쩍 뛰어 넘습니다.봉이 김선달은 구전되는 설화 속 주인공이고 대동강 물을 팔아먹었다는 희대의 사기행각도 실재하지 않는 허구입니다.하지만 김선달 소재가 물이었다는 점은 우리가 물에 대해 어떻게 생각하고 있는지를 잘 반영하고 있는 것 같습니다. 과거에는 물은 팔고 사는 것으로 인식하지 않았기 때문에 돈을 받고 물을 판다는 사실이 기가 막힌 희대의 사기로 비춰졌던 것이죠.만약 봉이 김선달이 환생한다면 물을 팔고 사는 것이 당연해진 지금 현실을 어떻게 평가할까요? 그리고 그는 수돗물 1t을 얼마에 팔았을까요?



■최종수 연구위원(박사·기술사)은△토지주택연구원 연구위원 △University of Utah Visiting Professor △국회물포럼 물순환위원회 위원 △환경부 자문위원 △행정중심복합도시건설청 자문위원 △대전광역시 물순환위원회 위원 △한국물환경학회 이사 △한국방재학회 이사",105,https://n.news.naver.com/mnews/article/018/0005041118?sid=103
