title,date,main,section,url
신종 mRNA 백신 동물실험 성공…계절독감 20가지 모두 예방 효과,2022.11.25. 오전 11:48,"펜실베이니아대 연구진 '사이언스'에 논문 발표



독감백신 예방접종[촬영 성혜미](서울=연합뉴스) 임화섭 기자 = 계절성 인플루엔자(통칭 독감) 바이러스 20가지 모두에 예방 효과가 있도록 개발된 새 메신저리보핵산(mRNA) 백신이 동물실험에서 성공을 거뒀다.    이에 따라 한 가지 백신으로 모든 유형의 계절독감을 예방할 수 있는 '만능 독감백신'이 현실화할 수 있다는 희망이 커졌다. 다만 인간 상대 임상시험에서 어떤 결과가 나올지 아직은 알 수 없다.    인플루엔자 바이러스는 크게 A·B·C·D형으로 분류되며, 이 중 매년 계절독감 유행을 일으키는 것은 18개 아형(subtype)이 있는 A형과 2개 계통(lineage)이 있는 B형이다.    미국과학진흥협회(AAAS)가 발간하는 유력 과학저널 '사이언스'는 25일자로 발간한 최신호에 '알려진 모든 인플루엔자 바이러스 아형을 예방하는 다가(多價) 뉴클레오사이드 변형 mRNA 백신'(A multivalent nucleoside-modified mRNA vaccine against all known influenza virus subtypes)이라는 제목의 논문을 게재했다.    이 논문의 제1 저자는 펜실베이니아대 페렐만 의과대학 미생물학과의 클라우디아 아레발로 박사, 교신저자는 스콧 헨슬리 교수다.    연구진은 지질나노입자(lipid nanoparticle) 기술을 이용해 20가지 인플루엔자 바이러스를 예방할 수 있는 mRNA 백신을 설계했으며, 마우스(생쥐)와 페럿(족제비)으로 동물실험을 한 결과 효과가 있는 것으로 나타났다고 밝혔다.    사이언스는 이 연구논문과 별도로 이번 연구의 의미를 설명하는 해설을 따로 싣고 ""20가지 (계절독감 바이러스) 모두에 예방효과가 있는 만능 독감백신은 다음번 대유행을 방지하는 데 도움을 줄 수 있을 것""이라며 ""(이번 연구를 계기로) 만능 독감백신으로 가는 길이 열렸다""고 강조했다.    현재 널리 쓰이는 3가 또는 4가 계절독감 백신은 일부 특정 바이러스 종류 3∼4가지에만 효과가 있다.    세계보건기구(WHO)는 유행 예상 시기 1년 전에 지구 남반구와 북반구에 각각 가장 많이 유행할 계절독감 바이러스가 어떤 종류일 것인지 예상을 내놓으며, 백신 제조업체들이 이 예상을 바탕으로 1년간 준비해 계절독감 백신을 보급한다.    그러나 유행할 바이러스 종류에 대한 WHO의 예상이 1년 후에 들어맞지 않는 경우도 있으며, 이럴 경우에는 그해 계절독감 백신의 효과가 예년보다 낮아 독감 대유행으로 이어질 수 있다.     limhwasop@yna.co.kr",105,https://n.news.naver.com/mnews/article/001/0013601751?sid=103
[위믹스 사태] 거래지원 종료 여파…위메이드 3사 하한가,2022.11.25. 오전 9:59,"위메이드·위메이드맥스·위메이드플레이 나란히 급락…법적 다툼으로 전선 확대



국내 가상자산 거래소에서 거래 지원이 종료된 가상화폐 위믹스. [사진=위메이드]가상화폐 '위믹스'가 국내 4대 거래소에서 거래지원이 종료된다는 악재를 맞은 위메이드와 계열사 주가가 하한가를 기록 중이다.25일 장 개장 이후 위메이드와 위메이드맥스, 위메이드플레이는 나란히 급락했다. 위메이드는 현재 전일 대비 29.89%p 내린 3만9천400원에 거래되고 있고 위메이드맥스는 29.92%p 하락한 1만3천원까지 내려앉았다. 위메이드플레이 역시 21.81%p 내린 1만6천800원에 거래되고 있다.위메이드 3사의 주가 급락은 전일인 24일 디지털 자산 거래소 공동협의체(이하 DAXA)가 위믹스의 거래 지원을 종료한다고 발표한 여파다. 이에따라 위믹스는 업비트·빗썸·코인원·코빗 등 주요 거래소에서 오는 12월 8일부터 거래 지원이 종료된다.위메이드는 이날 오전 11시 긴급 간담회를 열고 장현국 대표가 직접 현 상황을 설명하고 대응책을 내놓을 예정이다. 이 회사는 앞서 ""위믹스 거래지원 종료에 대한 가처분 신청을 준비 중""이라며 ""개별 거래소 별로 바로 잡도록 하겠다""고 법적 대응을 예고한 바 있다.위메이드는 핵심 IP 자산인 '미르의 전설2'를 두고 공동 IP 소유권자인 액토즈소프트와 중국 모회사와 장기간 법적 다툼을 이어온 데 이어 거래 지원이 종료된 위믹스를 두고 가상자산 거래소들과 새로운 법적 공방 전선을 형성하게 될 전망이다.",105,https://n.news.naver.com/mnews/article/031/0000712856?sid=103
"이종호 장관 ""사이버위협 대응 기존 한계 뛰어넘어야""",2022.11.24. 오후 7:54,"제12회 '정보보호산업인의 밤' 개최""랜섬웨어 등 고도화되는 사이버위협에 대응하기 위해서는 기존 한계를 뛰어넘는 기술과 제품 개발, 우수 인적자원 확보를 위한 산업계 협력과 발전이 중요하다.""



24일 서울 여의도 켄싱턴호텔에서 열린 '제12회 정보보호산업인의 밤' 기념식에서 이종호 과학기술정보통신부 장관이 환영사를 하고 있다. [사진=김혜경 기자 ]24일 서울 여의도 켄싱턴호텔에서 열린 '제12회 정보보호산업인의 밤' 기념식에서 이종호 과학기술정보통신부 장관은 이 같이 전했다.이 장관은 ""최근 발생한 데이터센터 화재는 디지털 인프라와 서비스 안전이 담보되지 않을 경우 국민뿐만 아니라 국가안보까지 위협한다는 사실을 보여줬다""면서 ""재난대응체계를 원점에서 재검토하고 상시적인 점검체계를 구축하겠다""고 말했다.이어 ""사이버 침해사고가 급증하면서 위협에 직면한 전 산업계와 정부는 긴밀하게 협력해야 한다""며 ""산업계가 이 같은 위협에 대응할 수 있도록 힘을 모아달라""고 부연했다.



24일 서울 여의도 켄싱턴호텔에서 열린 '제12회 정보보호산업인의 밤' 기념식에서 참가자들이 기념촬영을 하고 있다. [사진=김혜경 기자]지난해 정보보호산업 매출액은 약 13조9천억원으로 전년 대비 13.4% 늘었고, 수출액은 약 2조1천억원으로 8.5% 증가했다. 비대면 서비스의 확산, 디지털 전환 가속화로 보안 제품‧서비스에 대한 수요가 늘어난 점이 주효했다.이날 기념식에서는 정보보호산업 발전에 기여한 단체와 개인의 공로를 치하하기 위해 과기정통부 장관 명의의 정보보호 대상과 공로상, 유공 표창이 수여됐다.올해 정보보호 공시 의무화가 첫 시행된 가운데 NHN과 현대중공업, 테크빌교육 3개사가 우수 공시 기업으로 선정됐다. NHN과 현대중공업은 의무 공시 기업, 테크빌교육은 자율 공시 기업이다.2년 이상 연속 정보보호공시 이행 기업 49개사의 경우 정보보호 투자액이 연평균 26.2%, 전담인력이 연평균 32.9% 증가한 것으로 나타났다.",105,https://n.news.naver.com/mnews/article/031/0000712726?sid=103
"이종호 과기부 장관, 슬로베니아 장관과 디지털 협력 논의",2022.11.25. 오후 2:12,"이종호 과학기술정보통신부 장관/과학기술정보통신부 제공        과학기술정보통신부는 이종호 과기정통부 장관이 서울에서 슬로베니아 이멜리야 스토이메노바 두(Emilija Stojmenova Duh) 디지털혁신 장관과 양자면담을 갖고 디지털 전환 관련 협력 방안을 논의했다고 25일 밝혔다.이번 면담은 슬로베니아 디지털혁신 장관의 방한을 계기로 이뤄졌다. 한국과 슬로베니아는 1994년에 과학기술협력협정을 체결하고 2008년도에 제1차 과학기술공동위원회를 개최하는 등 오랜 협력 관계를 갖고 있다.양 장관은 이번 회의를 통해 양 국의 디지털 정책과 현황, 반도체 등 핵심 기술의 연구개발 협력 가능성 등을 논의했다.이 장관은 지난 9월 뉴욕에서 윤석열 대통령이 세계시민들이 함께 추구해야 할 디지털 질서에 관해 연설한 ‘뉴욕구상’과 이를 구현하기 위한 ‘대한민국 디지털 전략’을 소개하고 한국이 자유와 인권, 연대라는 인류 보편적 가치를 디지털 전환의 핵심 가치로서 추구한다는 계획을 소개했다. 아울러 유럽연합(EU)의 핵심 발칸반도 회원국인 슬로베니아와 이러한 가치를 공유하며 디지털 전환에 슬기롭게 대응할 수 있기를 희망한다는 기대를 나타냈다.이외에도 슬로베니아가 한국과 협력에 관심이 많은 반도체 및 저전력 전자소자 연구에 대해서 연구현장 간 교류를 기반으로 호혜적인 협력 방안을 모색하기로 했다. 이 장관은 “슬로베니아의 높은 디지털 혁신 의지를 알게된 자리였다”며 “오늘 회의가 양 국의 다양한 디지털 분야 협력으로 연계돼 상호 성공적인 디지털 전환을 이뤄가기를 기대한다”고 말했다.",105,https://n.news.naver.com/mnews/article/366/0000857768?sid=103
Wemade CEO blasts delisting of Wemix coin by Korea's DAXA,2022.11.25. 오후 5:00,"Wemade CEO Chang Hyuk-guk tears up during an online press conference held Friday morning after the Digital Asset eXchange Alliance (DAXA), a trade group representing five Korean exchanges, announced Thursday night that Wemix, Wemade’s cryptocurrency, will be delisted because Wemade provided false information. [SCREEN CAPTURE]     Wemade's coin is in trouble, and it's taking the company down with it.    Digital Asset eXchange Alliance (DAXA), a trade group representing five Korean exchanges, announced Thursday night that Wemix, Wemade’s cryptocurrency, will be delisted because Wemade provided false information.    The five exchanges — Upbit, Bithumb, Coinone, Korbit and Gopax — will stop the trading of Wemix coins from Dec. 8, 3 p.m. Owners will be able to withdraw their money for a month after trading ends.    In a teary press conference, Wemade CEO Chang Hyun-guk said that the decision was arbitrary and unfair and that he would fight it in court.    ""This is gapjil!"" he said repeatedly during a press conference held Friday morning, using the Korean word for abuse of power.    The decision comes a month after Wemix was flagged with an Investment Warning by DAXA because of the differences between the number of tokens that were to be distributed according to company disclosures and the actual number outstanding.    The company reported last January that it expected 245,966,797 Wemix tokens to be available as of Oct. 31, but on Oct. 25, there were 318,421,502 Wemix tokens — a 72,454,705 difference.    “There were numerous errors found in the files they handed in, and they repeatedly changed the content of the files even after submission,” Upbit said. “A rare situation has occurred where our level of trust in management capabilities has plummeted to a point where it cannot recover.”    Wemix plunged from 2,200 won ($1.7) on Thursday when the news broke to 800 won Friday morning, losing over 95 percent of value since November last year.    The company’s stock has also been nosediving during the same period. It closed at 39,400 won on Friday, down 30 percent, the daily trading limit, compared to the previous day and down 85 percent compared to the same month last year.    Wemade CEO Chang had assured investors that the possibility of delisting is “almost zero” in a press conference held Nov. 2.    According to Chang, the difference occurred because the company failed to immediately report additional tokens to the market as it was planning to do so in a quarterly report scheduled for the end of the year.    The comment actually had a negative influence on DAXA officials and led to Thursday’s decision, according to local news outlet Block Media.    “Chang Hyuk-guk’s assurance that ‘Wemix will not be delisted’ had a negative effect,” a DAXA official reportedly told Block Media.    Chang insists that Wemade had fully complied with DAXA’s demands, especially Upbit’s.    “We have fully provided with all the data that Upbit had asked for,” said Chang in Friday's press conference. “Upbit never properly explained what its criteria are and just told us to ‘do what we can and see,’ without giving us detailed feedback of what’s missing and what’s not.”    Upbit is the only Korean crypto exchange out of the five DAXA members that demanded Wemade submit its plans on how many coins it’s planning to distribute in the market. But there are numerous coins that are trading without submitting their planned amounts, according to Chang.    “If the plan is so important, then why is it not applying the same rules to other companies?” Chang said. “If we are being penalized for submitting a plan and making changes along the way, then should we not have submitted anything at all, like the others? Why are we being punished for going the extra mile?”    “Upbit is a private company but it’s also a trading platform for social assets. This gapjil and unfairness is social evil.""    “I am not saying that we’ve done nothing wrong,” he added. “I will take full responsibility for our faults as the decision-maker, but we ask that Upbit make its rules clearer.”    Wemade will file a complaint in court to get the decision revoked.",105,https://n.news.naver.com/mnews/article/640/0000031806?sid=103
"한미약품-스펙트럼 폐암신약 포지오티닙, 美 FDA 승인 `불발`",2022.11.25. 오전 9:39,"한미약품 본사. 한미약품 제공.    한미약품은 파트너사 스펙트럼이 미국 FDA로부터 '현 시점에서는 포지오티닙을 승인할 수 없다'는 내용의 CRL(Complete Response Letter)을 수령했다고 25일 밝혔다.포지오티닙은 이전에 치료를 받은 경험이 있거나 HER2 엑손20 삽입 돌연변이가 있는 국소 진행성 또는 전이성 비소세포폐암 치료제로, 스펙트럼은 작년 12월 FDA에 시판허가를 신청한 바 있다.미국 항암제자문위원회(Oncology Drug Advisory Committee)는 지난 9월 23일, FDA의 시판허가 여부 결정에 앞서 포지오티닙이 환자에게 주는 현재의 혜택이 위험보다 크지 않다고 표결한 바 있다. 이번 FDA의 결정은 당시 항암제자문위원회의 권고를 따른 것이다.스펙트럼은 현지 시간 25일 오전(한국시간 25일 저녁)에 이번 FDA 통보와 관련한 상세 내용을 발표할 예정이다.한미약품은 ""스펙트럼 공식 입장발표 시간대가 한국 금요일 저녁이라는 점을 감안, 공시 시점에 관한 불필요한 오해를 없애기 위해 CRL 수령 사실을 먼저 시장에 밝히기로 했다""며 ""스펙트럼이 공식 입장 및 향후 계획 등을 발표하면 이에 대한 내용을 정리해 국내에 공개할 계획""이라고 말했다.",105,https://n.news.naver.com/mnews/article/029/0002768772?sid=103
"두나무, 취약계층 청년에 1인당 360만원 지원사업 참가자 모집",2022.11.25. 오후 2:53,"두나무 넥스트 스테퍼즈, 자산형성지원 사업...저소득 근로 청년 400명 대상



두나무 로고블록체인 및 핀테크 전문기업 두나무는 취약계층 청년 희망 기금 두나무 넥스트 스테퍼즈(Dunamu Next Steppers) '자산형성지원' 부문 참가자를 12월 5일부터 9일까지 모집한다고 25일 밝혔다.두나무 넥스트 스테퍼즈는 두나무의 지난해 고객예치금 이자수익 58억원을 투입해 금융지원에서 소외된 청년들을 돕고자 조성된 희망기금이다. 금융지원과 자산형성지원 등 총 2가지 사업으로 구성됐다.자산형성지원 사업은 참가자가 일정 금액(20만원, 25만원, 30만원 중 택1)을 1년 동안 저축하면 금액에 따라 적립금을 1대 1로 매칭, 두 배의 자산을 형성할 수 있도록 돕는 프로그램이다.만약, 월 적립금 30만원을 선택해 1년간 적립하면 만기 시 최대 360만원까지 지원받을 수 있다.두나무는 12월 5일부터 9일까지 총 400명의 참가자를 모집하며, 신청 조건은 만 19세 이상 34세 이하 청년 가운데 근로소득 금액이 세전 월 200만원 이하(2022년 10월 31일 기준)인 경우다.이석우 두나무 대표는 ""매달 늘어나는 자산을 통해 희망을 더하고, 멘토링과 함께 인생의 방향을 설계해 청년들의 목표를 이뤄가는 데 큰 힘이 됐으면 한다""며 ""미래사회 주역인 청년들이 건강하게 사회에 뿌리내릴 수 있도록 이번 자산형성지원 사업에 많은 관심과 참여를 부탁드린다""고 전했다.",105,https://n.news.naver.com/mnews/article/088/0000785941?sid=103
[콘텐츠 핫&뉴] ‘엘소드’ 오프라인 유저 행사 12월3일 개최,2022.11.25. 오후 4:44,"넥슨(대표 이정헌)은 온라인 액션 RPG ‘엘소드’의 오프라인 유저 행사 ‘엘소드 15주년 페스티벌’을 12월 3일 개최한다.페스티벌은 영원한 축제가 벌어지는 몽마들의 마을 ‘마그멜리아’로 이용자를 초대하는 콘셉트로 준비된다.12월 3일 오후 2시 잠실 비타500 콜로세움에서 약 180명의 이용자와 함께 진행된다.1부에서는 이용자들이 즐길 수 있는 다양한 참여형 미니게임 부스를 제공하고 2부에서는 ‘엘소드’ 개발진이 심연 레이드, 4라인 등에 대한 개발 비하인드 이야기를 전하고 15주년 겨울 업데이트를 소개할 예정이다.입장권은 25일 오후 6시부터 12월 2일 오후 6시까지 티켓링크에서 예매할 수 있다.◆‘뮤 온라인’ 신규 서버 ‘카라 오픈…’스피드 서버‘ 사전 론칭웹젠(대표 김태영)은 PC MMORPG ‘뮤 온라인’의 신규 서버 ‘카라’ 오픈을 맞아 ‘스피드 서버’를 사전 론칭하며 다양한 이벤트를 동시 진행한다.‘뮤 온라인’의 ‘스피드 서버’는 게임 회원들이 신규 캐릭터를 기존 서버 대비 3.5배 빠르게 육성할 수 있는 특별 서버다.‘스피드 서버’에서 신규 캐릭터를 생성한 모든 회원들은 서버 오픈 기념 선물 패키지를 무상으로 구매할 수 있다.특정 레벨 구간 도달 시마다 본 서버 이전 후 사용가능한 고급 장비 및 ‘상승의 부적’ 등의 아이템을 패키지를 얻을 수 있다.서버 내에서 가장 빠르게 캐릭터를 육성한 게임 회원들을 위한 ‘EXP 랭킹 이벤트’도 준비했다.또한 스피드 서버 전용 상품을 구매한 회원들을 위한 보너스 상품과 특정 패키지 구매시 동일 명의의 다른 계정에도 같은 패키지 상품을 선물 할 수 있는 ‘1+1 할인’ 혜택도 제공된다.",105,https://n.news.naver.com/mnews/article/009/0005050881?sid=103
"美FDA, 스펙트럼 비소세포폐암 치료제 ‘포지오티닙’ 승인 불허 통보",2022.11.25. 오후 3:05,"포지오티닙이 환자 제공 혜택이 위험보다 안 커미국 식품의약국(FDA)이 한미약품 파트너사 스펙트럼의 비소세포폐암 치료제 ‘포지오티닙’에 대해 승인 불허 결정을 통보했다.미 FDA는 CRL(Complete Response Letter)을 발송했다. 스펙트럼은 이날 저녁 CRL 관련한 상세 내용을 발표할 예정이다. 한미약품은 공식 입장발표 시간대가 금요일 저녁시간임을 고려해 CRL 수령 사실을 먼저 알린 후, 세부 내용을 다시 공개한다는 입장이다.



한미약품이 개발해 미국 기업 ‘스펙트럼’에 라이선스 아웃한 폐암 신약 ‘포지오티닙’이  KRAS 억제 제제와 병용 투여하면 효과가 더 높다는 연구결과가 미국과 유럽 연합 종양학회에 발표됐다. (사진=한미약품)포지오티닙은 이전에 치료를 받은 경험이 있거나 HER2 엑손20 삽입 돌연변이가 있는 국소 진행성이나 전이성 비소세포폐암 치료제다. 스펙트럼은 작년 12월 미FDA에 시판허가를 신청했다.하지만 미국 항암제자문위원회는 9월 23일, 미FDA의 시판허가 여부 결정에 앞서 포지오티닙이 환자에게 주는 현재의 혜택이 위험보다 크지 않다고 표결했다. 이번 미FDA의 결정은 당시 항암제자문위원회의 권고를 따른 것이다.",105,https://n.news.naver.com/mnews/article/092/0002274798?sid=103
"엘리스, 구글 학생개발자커뮤니티 프로그래밍 테스트 후원",2022.11.25. 오전 10:42,"엘리스랩[엘리스 제공. 재판매 및 DB 금지](서울=연합뉴스) 임성호 기자 = 디지털 교육 실습 플랫폼 엘리스는 구글 학생 개발자 커뮤니티(GDSC)의 프로그래밍 테스트를 후원했다고 25일 밝혔다.     GDSC는 구글 기술과 개발에 관심이 있는 학생들을 위한 대학 기반 커뮤니티 그룹이다. 국내에서는 한국과학기술원(KAIST), 연세대, 고려대, 이화여대, 성균관대 등 31개 대학에서 활동 중이다.     이번 행사는 K-디지털 플랫폼 사업 관련 사회공헌 활동의 일환으로 서울 성수동의 오프라인 교육장 엘리스랩에서 이달 초 열렸다. GDSC 소속 학생과 개발자 양성 과정 '엘리스 트랙' 교육생 포함 총 300여 명의 학생이 참가해 엘리스 플랫폼을 통해 기업 채용 코딩 테스트 수준의 알고리즘 문제를 풀었다.    엘리스 관계자는 ""엘리스랩을 활용한 지역 주민과 기업을 위한 프로그램 등 다채로운 사회적 공헌 활동을 이어나갈 계획""이라고 말했다.



엘리스XGDSC 로고[엘리스 제공. 재판매 및 DB 금지]    sh@yna.co.kr",105,https://n.news.naver.com/mnews/article/001/0013601562?sid=103
부산-아세안 이스포츠 페스티벌 27일 부산서 열려,2022.11.25. 오전 9:03,"홍보포스터(부산시 제공)(부산=뉴스1) 박채오 기자 = 부산시는 오는 27일 오전 11시 부산이스포츠경기장에서 '부산-아세안 이스포츠 페스티벌'을 개최한다고 25일 밝혔다.이번 행사는 '게임도시 부산'의 이미지를 강화하고 이스포츠를 통한 부산-아세안 지역 시민 간 문화교류를 활성화하기 위해 마련됐다.행사는 △부산-아세안 이스포츠 선수단 출정식 △배틀그라운드 게임종목 예·결선 등으로 구성되며, 아세안 10개국과 부산을 포함해 총 11개국에서 200여 명이 참여한다. 부대행사로 한-아세안 인디게임 전시, 부산 이스포츠 토크쇼, 글로벌 게임체험존(보드게임. 아케이드게임, 이벤트전)도 운영된다.페스티벌은 별도의 예매 없이 부산이스포츠경기장에서 무료로 관람할 수 있으며, 부대행사도 자유롭게 체험할 수 있다.",105,https://n.news.naver.com/mnews/article/421/0006481324?sid=103
"[단독] 코인 상장 대가로 뒷돈?…檢, 거래소·발행사 수사",2022.11.25. 오후 6:32,"잇단 폭락에 투자자 피해 속출'김치 코인' 신뢰성 타격 우려



사진=연합뉴스검찰이 암호화폐(코인) 상장 과정에서 거래소와 암호화폐 발행사 간 불법 거래가 있었는지 수사에 나섰다. 일부 ‘김치 코인’(국내 발행 코인)의 급락으로 투자자 피해가 속출하자 거래소들이 ‘뒷돈’을 받고 상장했는지 들여다보고 있다. 올 들어 루나 사태, 위믹스 사태 등이 불거진 가운데 불법 거래까지 사실로 확인되면 김치 코인의 신뢰성에 타격이 불가피할 전망이다.25일 국내 블록체인업계와 법조계에 따르면 서울남부지방검찰청 금융조사제1부는 최근 국내 코인 거래소의 코인 상장 과정을 정리한 자료를 확보 중이다. 이를 토대로 거래소의 상장 심사 과정이 적법했는지 조사하고 있다. 업비트 빗썸 코인원 코빗 고팍스 등 대형 거래소가 대상인 것으로 전해졌다.코인 상장은 코인 경제 생태계의 핵심으로 꼽힌다. 코인 발행사는 코인 상장으로 회사 운영자금을 마련한다. 벤처캐피털(VC) 등 초기 투자사도 상장으로 대부분 수익을 확보한다. 상장이 사실상 코인 발행의 성공 여부를 결정하는 셈이다. 이 때문에 업계에서는 일부 코인 발행 업체가 코인 상장 대가로 뒷돈이나 상당량의 자사 코인을 거래소에 제공했다는 소문이 끊이지 않았다.대부분 코인은 상장 이후 상승했다가 발행 물량이 급증하면서 폭락하는 양상을 보였다. 일부는 상장폐지됐다. 이 과정에서 상당수 개인투자자가 큰 손실을 봤다. 이런 피해가 반복되는 것은 거래소가 코인 상장과 폐지에 사실상 전권을 행사하기 때문이다. 주식시장의 기업공개(IPO)처럼 정부 허가를 받아야 하거나 수요예측, 보호예수 등 관련 규제도 없다. 코인 관련 미공개 정보 이용, 시세 조종, 부정 거래 등이 횡행해도 정부가 이를 처벌할 법적 근거가 없는 상황이다.",105,https://n.news.naver.com/mnews/article/015/0004779734?sid=103
