title,date,main,section,url
방역패스 의무적용 학원가도 '디지털 전환' 바람,2021.12.06. 오후 3:43,"KT 랜선에듀, 3월 출시 후 지역학원 공략…연말까지 무료이용 이벤트학원 시설에 코로나19 ‘방역패스’ 적용이 의무화 되면서, 전 산업 분야에서 불고 있는 '디지털 전환' 바람이 학원가로 확산되고 있다.12일 관련 업계에 따르면, KT는 대형학원에서만 가능했던 '인터넷강의(인강)' 환경을 중소형 학원도 월 이용료만 내고 구축할 수 있는 '랜선에듀' 서비스를 지난 3월 출시했다. 최근 주요 학원 관리 솔루션 업체 6곳과 제휴를 통해 전국 7천여개 학원을 공략 중이다.무엇보다 실시간 강좌뿐 아니라 지난 강좌까지 VOD로 제공한다는 점에서, 줌, 구글 클래스룸, 네이버웍스 등의 화상회의를 이용할 때보다 인강 환경에 최적화 됐다.



KT 랜선에듀 서비스를 커스터마이징 해 구축된 '대치인라이브'학원장이 강사 인원수만큼 호스트를 등록한 후 그에 따른 월 이용료를 납부하고, 강사나 학생은 따로 이용료를 낼 필요가 없다. 학원별 커스터마이징에 따라 출결 기록, 과제 제출, 강좌 시청 이력, 월별 성적표 기능도 도입할 수 있다.중대형 학원의 경우 보통 학원 경영, 직원관리 등을 위해 CRM, ERP 등 솔루션을 이미 이용하고 있기 때문에, KT는 기존 솔루션 공급 업체들의 영업력을 바탕으로 랜선에듀 사업을 확장하겠다는 포석이다. 이 같은 방법으로 확보한 학원 고객사는 전국에 175곳이다.6개 솔루션 사업자의 ERP, CRM을 사용하지 않는 소형 학원의 경우에도 따로 학원장이 ‘랜선에듀 온’ 상품의 각 패키지에 가입해 인강 서비스를 구현할 수 있다. 랜선에듀 온 교육형 패키지는 강사 호스트 중심의 강의 서비스를 제공한다. 호스트당 요금은 8천원으로, 가령 강사 5명이 동시 수업을 진행할 경우 월 이용료는 4만원이다. 동시 접속자 수는 최대 100명이다.



KT 랜선에듀 VOD 다시보기 화면대표 사례로는 지난 7월 디지털대성과 협력해 1타강사의 실시간 강좌를 연결하는 ‘대치 인 라이브’ 서비스다. 이 서비스는 학원의 요구에 맞춰 ‘커스터마이징’돼 디자인 됐다.대치 인 라이브에서는 온라인 강의 외에도 1:1 질의응답, 퀴즈풀이, 발표하기 기능을 활용해 실시간으로 강의 및 학습에 대한 피드백을 주고받을 수 있다. 자동으로 출결사항이 집계돼 학원 측에서 SMS를 통해 출결을 독려하거나 공지사항을 전송할 수도 있다.VOD 다시보기 기능을 통해 복습이 가능하며, 과제 제출 및 풀이, 강의 시청 이력, 월별 성적표(전국 단위) 등 면밀하게 학습 현황을 관리할 수 있는 기능도 이번 서비스에 포함됐다.최근엔 대전 최대 규모 학원사인 ‘제일학원’과 사업협약을 체결했으며, 광주, 창원, 전주, 청주 등 주요 거점지역의 핵심 회원사들과도 협력을 추진 중이다.학교 전용 랜선에듀 서비스는 ‘랜선에듀 스쿨‘ 상품으로 제공된다.박정호 KT 커스터머DX사업단장은 “차세대 온라인 교육 플랫폼 KT랜선에듀를 다양한 교육 분야로 지속 확산시켜 교육 현장에서 기술적, 물리적 제약 없이 오프라인 환경의 한계를 넘어선 온라인 기반 새로운 교육 서비스와 사업영역을 개척할 수 있도록 기여할 것”이라며 “앞으로 다양한 교육 전문 파트너사와 협업을 강화해 에듀테크 시장을 확장하고 누구나 시간과 장소에 구애 받지 않고 차별없이 양질의 교육을 받을 수 있도록 KT가 앞장서겠다”고 밝혔다.",105,https://n.news.naver.com/mnews/article/092/0002241257?sid=103
"스마일게이트 희망스튜디오-어썸피스, 지역아동 창작활동 위한 IT기기 후원",2021.12.06. 오전 8:51,"노트북 등 IT기기 후원…팔레트 창작 워크숍서 활용자율적으로 창작 활동에 몰두할 수 있는 환경 마련



스마일게이트멤버십 사회참여부문 멘토들과 김재우 어썸피스 대표,서울 송파구 구립  문정1동 지역아동센터 청소년들이 간담회를 하고 있는 모습.ⓒ스마일게이트[데일리안 = 최은수 기자] 스마일게이트 희망스튜디오와 모바일게임 개발사 ‘어썸피스’는 지난 3일 서울시 송파구에 위치한 지역아동센터에서 기부자와 청소년, 대학생 멘토들과 함께 커뮤니티 행사를 갖고 청소년 창의 커뮤니티 ‘팔레트’에 IT기기 후원을 진행한다고 6일 밝혔다.이번 후원식에는 김재우 어썸피스 대표를 비롯해 스마일게이트멤버십(이하 ‘SGM’) 사회참여부문 카이스트 SEED팀, 구립 문정1동 지역아동센터 엄미경 센터장 등이 참석했다.호러슈팅게임 ‘좀비 고등학교’로 잘 알려진 어썸피스는 스마일게이트 창작 지원 프로그램인 스마일게이트 멤버십(SGM) 출신으로, 매년 사회공헌 활동을 전개해 오고 있다. 어썸피스 사내 기부 캠페인에 참여한 임직원들이 기부금을 조성했고, 기부금은 팔레트 참여 기관(총 6개 아동지역센터 및 다문화대안학교 등 참여 아동 50여 명 대상)에 노트북 및 교사용 IT 기기 구입 비용으로 지원해 팔레트 활동에 쓰일 계획이다.스마일게이트 희망스튜디오에서 운영하는 팔레트는 창의/창작 경험이 상대적으로 부족한 취약계층 청소년을 대상으로 자신의 관심사를 발견하고 창작 활동을 펼칠 수 있도록 지원하는 커뮤니티다. IT 전공 대학생이 멘토로 참여해 청소년들과 창작 활동을 통해 협업 역량과 리더십을 향상할 수 있도록 지원한다.김재우 어썸피스 대표는 “취약계층 청소년의 창의창작 활동을 지원하는 ‘팔레트’ 사업의 취지에 깊이 공감하여 후원에 참여하게 됐다”며 “어썸피스가 게임 개발사로 성장하며 받았던 지원이 미래세대의 행복을 위한 선순환의 기부로 지속적으로 이어지도록 하겠다”고 말했다.권연주 스마일게이트 희망스튜디오 실장은 “이번 어썸피스의 후원을 계기로 아이들이 창작 활동에 더 몰입할 수 있는 환경을 마련할 수 있게 돼 기쁘다”며 “취약계층 청소년들의 창작 커뮤니티 활동을 지원하는 팔레트가 아이들이 자신의 가능성을 발견하고 나아가 미래의 꿈에 도전할 수 있도록 적극적으로 지원할 것”이라고 말했다.",105,https://n.news.naver.com/mnews/article/119/0002554499?sid=103
"확장하는 우주경제,어떻게 역동적 생태계 만들수 있을까",2021.12.06. 오전 9:31,"6~7일 코리아스페이스포럼 2021



지난해 11월 6일 서울 서초구 JW메이어트호텔 서울에서 개최된 '코리아 스페이스포럼 2020'에 참석한 국내 우주 스타트업 대표들은 국내 우주 스타트업 발전을 위해 정부 기술 라이선스의 활용을 장려하고 체계적인 창업 교육을 제공하며 성공적인 스타트업 육성 사례를 발굴할 필요가 있다고 강조했다. 사진 왼쪽부터 좌장을 맡은 박성동 쎄트렉아이 이사회의장, 박재필 나라스페이스 대표, 이성희 컨텍 대표, 김수종 이노스페이스 대표, 최명진 한컴인스페이스 대표다. KSF 영상 캡쳐   코리아스페이스포럼(KSF) 2021이 6일 서울 종로구 포시즌스호텔에서 막을 올린다.  올해로 3회째를 맞은 코리아스페이스포럼은 ‘확장하는 우주 경제, 역동적인 생태계 만들기’를 주제로 6~7일 이틀간 진행된다. 올해 포럼에는 미국항공우주국(NASA)을 비롯해 아마존웹서비스(AWS), 에어버스, 스페이스엔젤스, 유로컨설트, 아이스아이 등 해외기관 전문가와 우주기업인 19명, 국내 기관과 기업에서 29명 등 48명의 우주 전문가들이 참석해 미국 달 탐사 사업인 아르테미스 프로그램과 최초 지구방위 실험인 다트(DART), 한국형 발사체 경쟁력 전망 등 우주산업과 우주과학 분야의 최신 동향을 살펴보고 열띤 토론을 진행한다.  미국 유인 탐사 계획을 총괄하는 누주드 머랜시 NASA 탐사임무계획실 책임자는 미국이 2025년을 목표로 추진하는 유인 달 탐사 사업인 아르테미스 계획을 추진하는 이유와 궁극적인 방향을 소개한다. 아르테미스 프로젝트는 미국의 주도로 일본과 영국, 호주, 캐나다, 이탈리아, 룩셈부르크, 아랍에미리트(UAE), 폴란드 등이 함께 참여하고 있다. 한국도 올해 5월 한미 정상회담 후속 조치로 아르테미스 계획에 참여하기로 서명했다.   앤디 리브킨 미국 존스홉킨스대 교수는 인류 최초 소행성 방어 실험인 다트(DART)의 개요를 소개한다. DART는 지난달 24일 미국 캘리포니아 반덴버그 공군기지에서 스페이스X의 팰컨9 로켓에 실려 발사됐다. 이 임무는 지구에 위협이 될 가능성이 있는 소행성을 지구에서 멀어지게 하는 데 필요한 실제 데이터를 확보하는 게 목표다.  한국 우주개발 계획에 따른 파급효과가 우주산업에 미칠 청사진도 조망하는 자리도 마련된다. 정부는 지난 11월 15일 김부겸 국무총리 주재로 국가우주위원회를 열어 2031년까지 위성 170여 기를 개발하고 국내 발사체를 40여 회 발사하는 내용의 우주산업 육성 추진전략을 심의 확정했다. 고정환 한국형발사체개발사업 본부장은 지난 10월21일 발사한 누리호의 개발과정을 소개하고, 향후 누리호가 우주산업에 가져올 변화를 소개한다. 앞서 파콤 레빌론 유로컨설트 최고경영자는 급변하는 우주발사체 시장을 전망하고 발사체 선진국과 기술 경쟁 속에서 한국형발사체의 가능성과 도전 방향에 대한 견해를 내놓을 예정이다.  



지난 2019년 7월 19일 개최된 제1회 코리아스페이스포럼에서 스타트업별 비전 및 IR설명회가 진행되고 있다. 왼쪽부터 김동석 콩돌스페이스 로보틱스 대표, 이성문 우주로테크 대표, 박재필 나라스페이스 테크놀로지 대표. 코리아스페이스포럼/AZA   이튿날인 7일 이어지는 ‘탐색과 도전’에서 애리얼 에크블로우 미국 매사추세츠공대(MIT) 우주탐사 이니셔티브 창립자는 아르테미스 사업을 비롯해 스페이스X와 아랍에미리트(UAE) 화성 유인 탐사 계획이 추진되는 행성 간 여행 시대를 앞두고 젊은 세대의 역할을 강조할 예정이다. 세계 최대의 우주 엔젤 투자그룹인 스페이스엔젤스의 채드 앤더슨 매니징 파트너는 “코로나19가 가져온 우주산업의 지형변화를 소개할 예정이다.   이와 함께 데니스 스톤 미국항공우주국(NASA) LEO프로그램 사무소 프로젝트 책임자가 지구저궤도(LEO)에서 진행되는 기업들의 영리 행위를 지원하는 미국 정부의 지원계획을, 일본의 대표적인 민간 우주 전문가 이시다 마사야수 스페이스타이드 대표가 떠오르는 아시아 태평양 지역의 우주산업에 대한 가능성을 분석한 발표가 진행된다. 아울러 국내 우주산업 현황과 과제, 또 우주 스타트업 투자와 발굴에 대한 자유토론이 이틀간 이어질 예정이다.   올해는 신종코로나바이러스감염증(COVID-19·코로나19) 사태로 현장과 온라인을 혼합한 형식으로 행사를 진행한다.  모든 프로그램은 한국항공우주연구원의 공식 유튜브 채널 카리TV와 동아사이언스 유튜브 뉴스페이스 채널에서 한국어와 영어로 생중계된다. 자세한 내용은 공식 홈페이지(http://www.spaceforum.kr)에서 볼 수 있다.",105,https://n.news.naver.com/mnews/article/584/0000016966?sid=103
"여름휴가지 만족도, 제주 제치고 부산 1위",2023.10.18. 오전 11:14,"[서울=뉴시스] 김선웅 기자 = 8일 오후 부산 광안리 해변에서 열린 '2023 APP WORLD TOUR BUSAN SUP OPEN(APP 월드투어 부산 SUP 오픈, 이하 부산 SUP 오픈)'  경기에서 여자 장거리 경기 참가 선수들이 광안리 앞 바다를 향해 힘차게 출발하고 있다. SUP(썹, 패들보드)은 해양스포츠로서 이 대회는 KAPP(대한 패들서프 프로협회)가 주최하고 KAPP와 부산 수영구가 주관하며 7일부터 9일까지 진행된다. (사진=대한패들서프프로협회 제공) 2023.10.08. photo@newsis.com *재판매 및 DB 금지[서울=뉴시스] 박주연 기자 = 부산이 제주를 제치고 여름휴가지 만족도 1위를 차지했다.리서치전문기관 컨슈머인사이트가 실시해 18일 발표한 '연례 여름휴가 여행 만족도 조사'에 따르면 전국 16개 광역시도 중 부산은 736점(1000점 만점)을 얻어 2016년 첫 조사가 시작된 후 처음으로 1위를 기록했다.부산은 2020년 4위에서 해마다 한 계단씩 상승했다. 여행자원 5개 항목 모두 16개 광역시도 중 3위 안에 들었는데 특히 먹거리 항목이 1위였다. 교통·편의시설 등 여행환경 쾌적도도 매우 높았다. 엑스포 유치를 위한 다양한 활동과 개선 노력이 반영됐다는 평가다.강원(735점)은 부산과 단 1점 차이로 2위에 머물렀다. 쉴거리·볼거리 등 여행자원 매력도가 상승했고 여행환경 평가도 양호했으나 그 중 '물가·상도의' 점수 하락이 눈에 띈다. 전남(724점)은 4계단 껑충 뛰어올라 3위가 됐다. 볼거리·쉴거리 등 여행자원 평가가 두루 상승하며 지난해 7위에서 4계단 껑충 뛰어올랐다. 첫 조사부터 7년간 부동의 1위였던 제주(723점)는 1년 사이 34점 하락해 4위로 내려앉았다. 지난해 고물가 논란으로 23점 하락한 데 이어 올해 더 큰 폭으로 감소(-34점), 2년 사이 57점이나 하락했다. 먹거리와 쉴거리 점수가 낮아졌고 물가·상도의 평가는 전국 최하위로 떨어져 고물가 논란이 여전함을 나타냈다. 뒤를 이어 경남(721점), 경북(717점), 서울(707점), 전북(697점), 울산(690점), 충북(689점), 경기(674점), 광주(673점), 충남(671점), 인천(667점), 대구(664점), 대전(631점) 순이었다.컨슈머인사이트는 2016년부터 매년 9월 2만5000명 이상을 대상으로 '연례 여름휴가 여행 만족도 조사'를 시행하고 있다. 올해 조사는 1박 이상 국내 여름휴가(6월~8월)를 다녀왔다고 응답한 1만7281명을 대상으로 실시됐다.컨슈머인사이트는 ""물가 상승과 불경기로 여행에서 비용이 가장 중요한 관심사가 됐다""며 ""소비자가 부당하다고 느끼는 가격에 민감하게 반응하는 것은 조금도 이상하지 않으며, 이는 여행지 만족도에까지 큰 영향을 미치고 있다""고 분석했다.",105,https://n.news.naver.com/mnews/article/003/0012153708?sid=103
LG전자 공백 채운 삼성…Z플립3 등에 국내 점유율 85%,2021.12.06. 오후 3:06,"카운터포인트리서치 집계시장점유율 전분기 대비 14%P 상승



삼성전자가 '갤럭시 언팩 2021'을 통해 폴더블 스마트폰 '갤럭시Z폴드3'와 '갤럭시Z플립3' 등을 공개한 가운데 12일 서울 서초구 삼성 딜라이트샵을 찾은 고객들이 신제품을 살펴보고 있다. 이번에 공개된 제품들은 오는 17일부터 23일까지 국내 사전 판매되고, 27일 전세계에 순차적으로 출시 예정이다./김현민 기자 kimhyun81@삼성전자가 3분기 국내 스마트폰 시장에서 LG 스마트폰의 빈 자리를 차지하며 점유율을 85%까지 끌어올렸다. 이는 전분기 대비 14%포인트나 늘어난 수준으로 신작 Z시리즈 흥행에 따른 결과로 풀이된다.6일 카운터포인트 리서치에 의하면 올 상반기 LG 전자가 스마트폰 사업을 철수한 이후 반도체 등 주요 부품의 공급난 이슈로 올 3분기 국내 스마트폰 시장은 전년 동기 대비 9% 감소한 것으로 나타났다. 다만 전분기 대비로는 8% 증가했다.



카운터포인트리서치는 삼성이 8월 말 출시한 갤럭시Z플립3·폴드3 등 폴더블 스마트폰 신작이 기대 이상 판매 호조를 보이면서 시장 전체 성장을 이끈 것으로 분석했다.3분기 삼성은 폴더블폰 판매 호조에 갤럭시A 시리즈 강화로 기존 LG 전자 시장 점유율을 흡수하며 전분기 대비 14%포인트 늘어난 85% 점유율을 기록했다.개별 단말 중 올 3분기 국내 스마트폰 시장에서 가장 많이 팔린 모델은 Z플립3로 나타났다. 4위 Z폴드3와 함께 삼성의 3세대 폴더블폰 두 모델은 3분기 국내에서만 총 100만대 가까이 판매된 것으로 집계됐다. 



Z플립3은 전작 대비 가격을 낮춘 가운데 우수한 디자인과 방수 기능과 듀얼 스피커 등 하드웨어를 강화하면서 MZ 세대 고객을 사로잡은 것으로 평가됐다. Z폴드3도 전작 대비 가격을 낮추고 S펜 지원 강점을 갖췄다는 평가다. 카운터포인트리서치는 4분기 국내 스마트폰 시장도 삼성의 폴더블폰의 꾸준한 수요와 더불어 애플 아이폰13 시리즈 출시 효과가 더해지며 전분기(3분기) 대비 성장세를 이어갈 것으로 관측했다. 다만, 반도체 공급난 악재가 해소되지 않은 가운데 아이폰13 프로·프로맥스 등 일부 신모델의 공급 상황이 여유롭지 않다는 점, 예년 성수기 시즌 대비 삼성의 갤럭시 노트·FE 모델, 애플 SE 모델 등 플래그쉽 라인업이 약한 관계로 전체 성장율은 높지 않을 것으로 봤다.",105,https://n.news.naver.com/mnews/article/277/0005011062?sid=103
"""도로 살얼음·서리 주의"" 내일 전국 비온 뒤 기온 뚝 떨어진다",2023.10.18. 오후 3:06,"지난 8일 서울 마포구 하늘공원을 찾은 시민들이 우산을 쓰고 걷고 있다. 뉴스1           19일 전국에 비가 내린 뒤 기온이 뚝 떨어질 전망이다. 기상청은 ""19일 비가 오면서 잠시 따뜻해졌다가 20일 기온이 급강하해 도로에 살얼음이 낄 수 있어 운전과 보행에 주의를 기울여야 한다""고 밝혔다. 전국 유명 산에 단풍 행락객이 모일 것으로 예상되는 주말은 평년보다는 춥지만 맑은 날씨가 이어질 것으로 보인다.      기상청에 따르면, 짧고 요란한 비를 동반한 비구름이 19일 이른 새벽 경기 북부를 시작으로 점차 남하할 전망이다. 새벽에는 수도권과 강원권에, 오전 중에는 그 밖의 중부 지역에 비가 내릴 것으로 예상된다. 남부 지역은 저녁(오후 6시~9시)에 요란한 비가 지나갈 전망이다.      중부 지역 대부분은 짧은 비가 지나간 뒤 19일 오후에서 밤사이 소강상태를 보이다가 다시 약한 비가 시작되고, 이 비는 20일 오전까지 전국으로 확대될 것으로 예상된다. 제주도는 20일에 비가 올 전망이다.      이틀간 총 예상 강수량은 서울·인천·경기북부, 광주·전남, 대구·경북동부·부산·울산·경남·제주 5~20㎜, 경기 남부와 강원 내륙, 전북 지역이 5~30㎜, 충청권·경북서부 5~40㎜다.     ━   롤러코스터 기온에 기상청 “도로 살얼음·서리 주의”      



지난해 12월 대전 도심 도로 위에 생긴 얇은 살얼음. 연합뉴스           이번 비구름은 최근 기온이 뚝 떨어진 한반도에 상대적으로 따뜻한 공기를 몰고 올 전망이다. 기상청은 19일 아침 전국의 최저 기온을 8~17도로 예보했다. 18일 관측된 아침 최저 기온(1.8~13.6도)보다 하루 사이 약 5도가 올라간다는 예측이다. 19일 낮 최고기온은 16~25도로 최근 이어진 낮 기온과 비슷해 온종일 비교적 포근한 날씨가 이어질 것으로 예상된다.      20일에는 다시 아침 기온이 급강하해 도로에 살얼음이 끼고 서리가 내릴 수 있어 건강과 교통안전, 농작물 관리에 유의해야 한다. 따뜻한 바람을 몰고 온 기압골 후면으로 중국에 위치한 차가운 대륙 고기압이 한반도에 영향을 주기 때문이다.      기상청은 20일 전국 아침 최저기온은 5~14도, 낮 최고 기온은 14~19도로 예보했다. 특히 20일 오후부터는 평년보다 3~5도 낮은 추위가 찾아올 전망이다. 낮 기온도 뚝 떨어진다는 얘기다. 박중환 기상청 예보분석관은 “바람도 강하게 불면서 체감 온도는 하루 전보다 10도 이상 낮아 매우 추울 것”이라고 예상했다. 강풍 탓에 20일 새벽부터는 전해상에 풍랑 특보가 발표될 수 있다.       



쌀쌀한 가을 날씨를 보인 지난 5일 오전 서울 종로구 광화문네거리에서 외투와 긴팔 옷을 입은 시민들이 횡단보도 신호를 기다리고 있다. 연합뉴스      ━   21일 추위 절정, 다시 기온 오를 듯       21일 아침 최저기온은 더 떨어질 전망이다. 서울의 경우 19일 아침 최저기온 16도, 20일 8도에 이어 21일 5도로 ‘뚝뚝’ 떨어질 것으로 예상된다. 내륙 지역에선 기온이 영하권까지 떨어지는 등 추위가 절정에 이른 뒤 22일 낮부터 기온이 회복돼 점차 오를 전망이라고 기상청은 발표했다.",105,https://n.news.naver.com/mnews/article/025/0003315108?sid=103
"'인앱결제 고집' 애플, 러시아서도 소송 불사",2021.12.06. 오후 2:47,"""대안 결제방법 의무화는 부당"" 주장…법원에 제소인앱결제 문제로 전 세계에서 논란을 일으키고 있는 애플이 러시아에서도 법정 공방을 예고했다.애플은 앱스토어에서 인앱결제 외 다른 결제 방식을 공지하도록 한 러시아 연방반독점원(FAS) 규정에 대한 검토해줄 것을 요청했다고 러시아 국영매체 아르티(RT)가 5일 보도했다.애플이 문제 삼은 것은 FAS가 지난 8월 새롭게 도입한 조항이다. 이 조항에 따르면 앱스토어 플랫폼 이용자들에게 애플 인앱결제 외에 다른 결제 방식에 대해서도 알려줘야만 한다.



사진=씨넷FAS는 당시 애플 측에 9월 30일까지 시정 조치를 적용하도록 했다. 또 시정 조치를 하지 않을 경우 러시아 매출을 기준으로 벌금을 부과할 것이라고 경고했다.하지만 애플이 시정 조치를 취하지 않자 FAS는 지난 10월 제재 절차에 착수했다.애플은 앱스토어에서 자사 인앱결제 시스템을 이용하는 대가로 15~30% 수수료를 부과하고 있다. 이 수수료에 대해 에픽게임즈를 비롯한 여러 업체들이 독점 사업자의 횡포라면서 소송을 제기했다.또 한국을 비롯해 유럽연합(EU) 등 여러 지역에서 인앱결제 강제 조치를 시정하기 위한 입법 작업을 진행하고 있다.러시아 FAS가 지난 8월부터 적용한 ‘인앱결제 이외 결제 방법 공지’ 조항 역시 이런 조치의 일환으로 마련됐다.",105,https://n.news.naver.com/mnews/article/092/0002241247?sid=103
"KT희망나눔재단, 강동야학 등 KT희망나눔인상 수여",2021.12.06. 오후 2:19,KT그룹희망나눔재단이 선정한 KT희망나눔인상에 선정된 강동야학의 입학식KT그룹희망나눔재단은 2021년 나눔활동으로 지속가능한 사회를 만드는 데 기여한 5명을 '희망나눔인'으로 선정해 'KT희망나눔인상'을 수여했다.KT희망나눔인상 제1호는 교육 기회를 놓친 어르신 대상으로 초·중·고등 과정을 무료 지도하는 교육학교 '강동야학'이 수상했다. 강동야학은 1989년 개교 이후 뜻있는 후원과 교사들의 자발적 무료 봉사로 운영되고 있으며 매년 20~25명 교사들이 활동하고 40여명 학생들이 고등학교 검정고시를 목표로 교육받고 있다.KT그룹희망나눔재단은 강동야학 외에도 △어려운 이웃을 위해 1000원 식사를 제공하는 '해뜨는 식당'의 김윤경(47) 씨 △장애인 이동 편의를 위한 지도를 제작하는 협동조합 '무의'의 홍윤희(46)씨 △17년간 어르신들께 무료 안경 나눔을 하는 강상구(53)씨 △청소년과 지역사회 문제 해결을 위한 봉사단을 만들어 활동하고 있는 광양하이텍고등학교 김성태(44) 교사에게 상을 수여했다.KT그룹희망나눔재단은 “앞으로도 나눔의 실천을 전파하고 더불어 사는 사회를 만들기 위해 우리 사회 곳곳에서 묵묵히 활동하는 희망나눔인을 지속 발굴해 나가겠다”고 말했다.,105,https://n.news.naver.com/mnews/article/030/0002986132?sid=103
