title,date,main,section,url
"[이슈] 인기 모바일 액션 RPG '삼국지 천하무적', 신규 장수 ‘육손’ 추가 업데이트 실시",2018.12.27. 오후 5:44,"본 기사는 최근 대세로 떠오른 신규, 인기 스마트폰 게임과 관련 방송 콘텐츠 등을 소개하는 코너입니다. 소개 자료는 각 모바일게임 개발사를 비롯해 퍼블리셔와 게임 공략 커뮤니티 헝그리앱 등에 기초하고 있습니다. <편집자주>



위드허그가 서비스하는 인기 모바일 액션 RPG '삼국지 천하무적'이 금일(27일) 신규 장수와 시스템을 추가하는 업데이트를 실시했다.이번 업데이트를 통해 <삼국지연의>에서 주유와 함께 오나라 발전에 크게 기여한 장수 '육손'이 추가됐다. 제어형 전설 장수로 등장하며, 적군 패시브 스킬 무효화, 민첩 증가 등의 능력을 가지고 있어 이용자들의 PvP 전략 구상에 새로운 바람을 불러일으킬 것으로 보인다. 이밖에도 탈것 시스템, 장비 재주조 시스템 등 다양한 콘텐츠가 추가됐다.위드허그 게임사업팀 관계자는 ""이번 업데이트는 시작에 불과하며 앞으로 꾸준히 많은 콘텐츠가 지속적으로 추가될 예정""이라며, ""삼국지 게임의 특성상 이용자들의 게임에 대한 이해도와 열정이 누구보다 뛰어나기 때문에 지금까지 수많은 이용자들이 남겨 주신 피드백을 참고해 앞으로의 업데이트, 밸런스 유지, 게임 운영에 최선을 다하겠다""고 말했다.'삼국지 천하무적'은 중화권에서 가장 유명한 고전 소설 중 하나인 <삼국지연의>를 배경으로 만들어진 모바일 액션 RPG다. 원작에 관심이 없는 사람도 한 번쯤은 들어 봤을 법한 인물들부터 마니아만 알고 있는 장수들까지 약 100여 개의 캐릭터가 존재하며, 전투 중에는 지금껏 볼 수 없었던 화려한 액션이 펼쳐지도록 구현했다.업데이트를 기념해 출석 이벤트와 레벨 달성 이벤트 등 10여 종의 다양한 이벤트를 열고, 이용자들에게 초호화 상품을 지급한다. 또한, 사전예약 1위 어플 '모비'를 통해 '체력 400개'를, 게임 추천 어플 '찌'를 통해 '6,000원보', '체력 400개'를, 실행형 CPA 어플 '루팅'을 통해 '500 원보'를 제공한다.이밖에 공식 커뮤니티 '삼국지 천하무적 헝그리앱'을 통해서도 게임 관련 게시물 업로드와 같이 간단한 참여만으로도 게임 아이템을 지급하는 이벤트를 진행 중이다.신정원 기자 (sjw1765@dailyesports.com)",105,https://n.news.naver.com/mnews/article/347/0000125835?sid=103
"[이슈] 섀도우버스, 신규 카드팩 '차원왜곡' 전격 출시!",2018.12.27. 오후 4:50,"사이게임즈코리아(대표 와타나베 코우이치)는 대전형 온라인 CCG '섀도우버스'에 제 11탄 카드팩 '차원왜곡(ALTERSPHERE)'을 출시했다고 27일 밝혔다. 이번 제 11탄 카드팩 '차원왜곡(ALTERSPHERE)'을 통해 총 97장의 신규 카드가 추가된다. 신규 카드와 별개로 2장의 리더스킨이 포함된 특별 일러스트 카드 '신의 방패 브로디아', '인형 소녀 오르키스'가 포함된다.특히 카드팩 출시 전 공식 카페를 통해 1분 45초 가량의 홍보영상이 공개돼 이용자들의 관심을 끌고 있다. 이용자들은 카드 조합에 따라 전략 활용성이 높을 것이라고 분석하는 등 기대감을 드러냈다.또한 '이즈니아'에 도착한 에리카가 두려움의 대상인 암살자 집단 '암월'의 길드장인 리오드를 만나 자신의 과거를 떠올리는 '길드 전쟁 편 에리카'의 메인 스토리가 새롭게 업데이트됐다.사이게임즈코리아는 신규 카드팩 '차원왜곡(ALTERSPHERE)' 공개를 기념해 다양한 이벤트를 실시한다.먼저, 내년 1월4일까지 '로테이션'과 '언리미티드' 랭킹전을 즐기는 이용자들을 대상으로 승리 보상 이벤트를 진행한다. 이벤트 기간 동안 '로테이션'과 '언리미티드'에서는 일정 확률로 보물 상자가 출현하며, 보물 상자가 등장한 대전에서 승리 시 ▲루피 ▲카드팩 티켓 ▲최신 5종류의 카드팩에 추가된 골드 레어 이상의 카드 ▲차원을 총괄하는자 엠블럼과 카드 뒷면 등을 수령할 수 있다.이와 함께 오는 1월11일까지 튜토리얼을 완료하고 게임을 플레이하는 이용자들을 대상으로 신규 '차원왜곡' 카드팩 티켓을 최대 8장 제공하는 한정 로그인 보너스 이벤트도 진행될 예정이다.'섀도우버스'의 제 11탄 카드팩 '차원왜곡(ALTERSPHERE)'과 이벤트에 대해 보다 자세한 내용은 공식 카페 및 게임 내 공지사항을 통해 확인할 수 있다.이원희 기자 (cleanrap@dailygame.co.kr)",105,https://n.news.naver.com/mnews/article/347/0000125826?sid=103
"CJ ENM '다이아티비', 메이크어위시와 소아암 어린이 자선행사",2018.12.27. 오후 4:10,"[디지털데일리 이형두기자] CJ ENM이 성탄절을 맞아 소아암 어린이 대상 자선행사를 열었다.     CJ ENM(대표 허민회)의 1인 창작자 지원 사업 다이아티비는 지난 26일 서울 강남구 삼성서울병원에서 소아암 어린이를 위한 희망의 성탄 행사를 열었다고 27일 밝혔다. 난치병을 앓고 있는 아이들의 소원을 들어주는 자선 단체 ‘메이크어위시’가 함께 했다.    이번 행사는 삼성서울병원에서 준비한 완치 잔치를 앞두고 개최됐다. 악성림프종으로 투병 중인 박창현(가명)군의 소원인 ‘푸드 크리에이터 소프와의 만남’ 프로그램 기획을 계기로 마련됐다. ‘소프’, ‘나도’, ‘맛상무’, ‘도로시’ 등 다이아 티비 파트너 푸드 크리에이터 18개 팀과 어린이 120여 명이 참여했다.    크리에이터와 어린이들이 조를 이뤄 컵케이크 만들기와 감사 편지 쓰기 등의 이벤트에 참여하고 입원 중인 어린이 200명을 위해 목도리와 털모자 등 크리스마스 선물도 전달했다.    다이아티비 오진세 국장은 “1인 창작자들이 콘텐츠 영향력이 커질수록 책임 의식을 가지고 사회공헌 활동에 동참하고 있다”며 “소아암 어린이들이 희망찬 연말을 보내는 데 도움이 되길 바라는 파트너 창작자들의 적극적인 참여가 이루어진 행사였다”고 말했다.   <이형두 기자>dudu@ddaily.co.krIT언론의 새로운 대안[디지털데일리]IT정보의 즐거운 업그레이드[딜라이트닷넷]뉴스채널 설정 - 네이버 메인에서 디지털데일리 뉴스를 볼 수 있어요.이형두(dudu@ddaily.co.kr)<저작권자 © 디지털데일리 무단전재-재배포금지>",105,https://n.news.naver.com/mnews/article/138/0002068797?sid=103
"국산 3000t급 잠수함 저소음 설계기술, 기계연 최우수연구성과 선정",2018.12.27. 오후 6:30,"순수 국내 기술로 건조된 3000t급 잠수함인 도산안창호함의 진수식이 9월 14일 오후 거제 대우조선해양 옥포조선소에서 거행됐다. 대우조선해양 제공 잠수함 소음을 줄이는 설계 기술이 한국기계연구원이 뽑은 최우수 연구성과에 선정됐다. 소음은 잠수함의 전투력과 직결되는 핵심 사안이다. 소음이 크면 그만큼 적에게 위치가 노출되기 쉽기 때문이다.  한국기계연구원은 27일 올해 최우수 연구로 김봉기 기계시스템안전연구본부 책임연구원의 ‘잠수함 소음 해석·평가 및 저소음 설계 기술’을 선정했다고 밝혔다.바닷속에서 잠수함이 움직이면서 물속으로 퍼지는 소음인 ‘수중방사 소음’을 낸다. 이 소음을 탐지하는 것과 감추는 것이 잠수함은 물론 수상함의 성능과 생존력도 좌우한다.  수중방사 소음을 분석하는 기술과 함정이 내는 소음을 줄이는 설계기술은 군사기밀로 구분돼 국내 극소수 전문가만 연구하고 있다. 김 책임연구원은 잠수함이 움직일 때나 프로펠러가 회전할 때 나는 소음을 해석해 저소음 잠수함 설계에 적용할 방음 대책을 제안했다.김 책임연구원은 2014년부터 2016년까지 선박을 대상으로 음향 시험평가를 10회 수행하면서 국내에서 한꺼번에 가장 많은 신호를 측정하는 시스템을 개발하고 이를 해군에 제공했다. 해군은 이를 바탕으로 수중에서 나는 주된 소음원들의 전달 경로와 비중, 음향을 퍼트리는 효율, 저소음용 음향 코팅재의 성능을 연구했다. 이 음향정보로 개발된 저소음 설계기술은 올해 9월 진수식을 가진 3000t급 잠수함 ‘도산 안창호’함에 반영됐다. 최근 5년간 해군이 건조한 차기기뢰부설함과 차기군수지원함, 차세대 이지스 구축함 ‘광개토-Ⅲ 배치Ⅱ’에도 이 기술이 들어갔다. 26일 기본설계를 완료한 차기 3000t급 잠수함인 ‘장보고-Ⅲ 배치Ⅱ’도 이 기술이 적용돼 내년 하반기부터 건조에 들어간다. 



한국기계연구원은 2018년 최우수연구로 김봉기 기계시스템안전연구본부 책임연구원의 ′잠수함 소음 해석·평가 및 저소음 설계 기술′을 선정했다고 27일 밝혔다. -기계연 제공김 책임연구원은 “잠수함 소음 해석과 저소음 설계를 독자적으로 수행하게 되면서 잠수함 한 척당 수십억 원씩 들었던 해외 용역비도 절감하게 됐다”며 “민감한 군사정보를 국외 전문기관과 공유하지 않아 국방력 강화에 도움이 됐다”고 말했다.기계연은 1993년부터 탁월한 연구성과를 거둔 원내 연구자를 선정해 최우수연구상을 주고 있다. 시상식은 이달 27일 오후 3시 30분 대전 유성구 기계연구원에서 열리는 ‘제42주년 창립기념식’에서 열렸다.



한국기계연구원 박천홍 원장(왼쪽)과 김봉기 책임연구원(오른쪽)이 27일 열린 제42회 창립기념식에서 최우수연구상 시상식을 갖고 기념 사진을 찍고 있다. -한국기계연구원 제공 [조승한 기자 shinjsh@donga.com]",105,https://n.news.naver.com/mnews/article/584/0000002737?sid=103
"국내 통신시설, 재난에 취약…정부, D급 관리확대",2018.12.27. 오후 2:31,"3~19일간 실태점검 결과 … ""대대적 개선 필요""[아이뉴스24 김문기 기자] 과학기술정보통신부와 소방청이 통신시설에 대한 재난안전 실태조사 결과 재난대비가 허술한 것으로 드러났다.이에 따라 과기정통부는 점검대상을 D급까지 확대하는 한편, 점검주기도 단축할 계획이다. 추후 비상설기관 설립을 통해 통신시설의 등급도 조정한다.과학기술정보통신부(장관 유영민)는 27일 제62회 국정현안점검조정회의 논의를 거쳐 '통신재난 방지 및 통신망 안정성 강화 대책'을 확정하고, 주요 통신시설에 대한 실태점검 결과도 발표했다.이번 조사는 지난달 24일 KT 아현지사 통신구에서 발생한 화재로 인해 서울 5개 구와 경기 고양시 일대 통신장애가 발생한데 따른 후속 조치다. 이 사고로 해당 지역 시민들은 유․무선 전화와 인터넷을 사용하지 못해 불편을 겪은 바 있다.



◆ 500m 미만 통신구 소방시설 미비과기정통부는 재발방지 대책의 일환으로 지난 3일부터 19일까지 13일간 통신시설 1천300개소를 대상으로 현장실태 조사를 진행했다.이번 조사 대상은 구체적으로 전국 13개 주요통신사업자의 주요통신시설 A~D급 870개, 통신구 230개, ICD 122개, 기타 33개다. 점검팀은 총 62개팀으로 운영됐으며 과기정통부 중앙전파관리소 직원과 통신 소방 전문가, 소방청 인력 등이 참여했다.조사 결과 현재 중요통신시설 지정기준에 따라 각 통신시설에 대한 등급 상향 및 하향 등 재조정이 필요한 것으로 나타났다. C~D급 9개 국사는 등급상향을, A~B급 3개 국사는 등급하향 대상으로 조사됐다.특히 A~C급시설 점검결과 A급은 3개, B급 1개, C급 2개 통신국사에 복수전송로가 설치되지 않은 것으로 확인됐다. 이 곳은 모두 중소통신사 관할이다.아울러 KT 아현지사 화재지점이기도 한 통신구에 대한 소방시설 점검도 이뤄졌다. 결과적으로 현행법 상 설치의무가 없는 500m 미만 통신구의 설치율이 상대적으로 낮았다.소화기는 모든 통신구에 설치됐으나 자동소화장치의 경우 500m 이상 통신구는 17.2%인 16개소가 미설치됐다. 500m 미만 통신구는 52.4%인 66개소로 설치가 안됐다. 자동화재탐지설비도 500m 이상 통신구는 2.2%인 2개소가 미설치 됐으나 500m 미만 통신구는 10.3%인 13개소가 미비했다.통합 감시시설은 500m 이상 통신구에서는 2.2%인 2개소, 500m 미만 통신구는 22.2%인 28개소가 미설치된 것으로 나타났다. 또 연소방지설비는 500m 이상 통신구 중 살수헤드는 2개소, 연소방지도료는 40개소, 방화벽/문은 3개소가 미비했다. 500m 미만 통신구는 살수헤드 89개소, 연소방지도료 58개소, 방화벽/문은 41개소가 미설치됐다.



이번 조사에서는 통신구 입구와 맨홀의 CCTV 및 사고감지단말 설치 유무도 점검했다. 현행법상 통신구에 보안시설 설치 의무가 없어 이 곳 역시 취약점이 드러났다.CCTV 감시의 경우 500m 이상 통신구 중 39.8%인 37개소, 500m 미만 통신구는 63.5%인 80개소가 미설치 지역이다. 사고감지단말도 각각 9.7%인 9개소, 24.6%인 31개소가 설치되지 않았다.



◆ 내년 1월 통신시설 등급기준 확정과기정통부는 현재 선언적이거나 권고사항으로 돼 있는 화재, 수해, 지진 등 재난예방에 대한 상세 관리기준을 마련하고 의무화할 방침이다.특히 취약점이 드러난 500m 미만 통신구는 소방시설법 개정 전이라도 법령에 따른 자동화재탐지 장비, 연소방지설비 등을 조기 설치키로 했다. 소방시설법 시행령은 내년 1월 입법예고를 거쳐 6월 개정된다.정부의 점검대상도 전체 주요통신시설로 확대된다. 기존 A~C급 80개에서 D급이 포함되면서 870개를 정부가 관리하게 된다. 점검 주기도 단축한다. A~C급은 2년에서 1년으로 당기고, 점검미대상인 D급은 2년으로 신설된다.국민생활의 실질적 피해규모를 반영하기 위해 피해 행정구역 수에 통신국사 수용회선 수도 추가한다. 통신국사 등급도 재조정한다. 이를 위해 통신재난관리심의위원회를 내년 1월 중 신설해 최종 결정한다. 우선 내년 1월 등급지정 기준을 확정하고, 5월 등급 재조정을 실시한다.한 통신국사의 장애가 다른 통신국사로 연결되지 않도록 하기 위해 통신국사간 우회 전송로 확보 의무를 D급까지 확대키로 했다. 통신재난대응 전담인력을 두도록 하고 출입제한 조치를 의무화 한다.



단, 통신국사 인입경로 이중화가 통신국사간 전송로 이원화와 유사한 효과를 갖는다는 일부 통신사의 주장에 대해 심의위원회 심의를 거쳐 이를 검증, 반영하기로 했다.한편, 국방 및 경찰 등 안보안전관련 통신망과 의료, 에너지 등 국가기반시설의 통신망에 대한 이중화 및 이원화도 관계부처와 추진할 계획이다.김문기기자 moon@inews24.com▶네이버 채널에서 '아이뉴스24'를 구독해주세요.▶아이뉴스TV에서 부동산 고수를 만나보세요.[ⓒ 아이뉴스24 무단전재 및 재배포 금지]",105,https://n.news.naver.com/mnews/article/031/0000476665?sid=103
500m 이하 통신구 스프링쿨러 의무화...D등급 통신국사 우회로,2018.12.27. 오후 4:10,"민관 합동 통신시설 긴급복구 훈련500m 이하 통신구에 스프링클러 설치가 의무화된다. D등급 통신국사에도 우회 경로 확보 의무가 부과된다. 정부는 정기 점검 대상에 D등급 통신국사를 추가한다.과학기술정보통신부는 27일 제62회 국정현안점검조정회의에서 이 같은 내용의 '통신재난 방지 및 통신망 안정성 강화 대책'을 확정했다.KT 아현지사 화재로 드러난 통신재난 대응체계 미비점을 분석, 통신재난 '예방-대비-복구' 전 단계에서 관리 체계를 강화한 게 골자다.정부는 통신재난 예방을 위해 소방시설법 시행령을 개정, 500m 미만 통신구도 소방시설 설치를 의무화한다. 이에 앞서 과기정통부와 통신사는 법령 개정 이전인 새해 상반기까지 자동화재탐지설비와 연소방지설비 등을 설치하기로 했다.통신시설 관리 체계도 전면 개편한다. 정부 직접 점검 대상을 일반 D등급 통신국사로 확대, 2년 주기로 점검한다. 기존 A·B·C 등급 통신국사는 기존 2년에서 1년으로 점검 주기를 단축한다.또 통신·재난 전문가 등으로 구성한 '정보통신재난관리심의위원회'(가칭)를 출범, 등급 지정 기준 및 통신사의 재난 계획 수립 지침 등을 심의·확정한다. 기존 사업자 자율에서 정부 직접 점검 기능을 강화하기 위한 조치로, 재난 예방 효과를 높이기 위한 것이다.통신재난 발생 시 대비책도 강화한다.통신사 D등급 국사에도 통신망 우회로 설치를 의무화하는 한편 국방, 경찰 등 안보·안전 관련 통신망과 의료·에너지 등 국가기반시설 통신망에 대해서도 다각도로 이중화를 추진한다. 인접 통신국사 등으로 데이터트래픽을 전송할 수 있는 예비 경로를 확보, 한 국사가 마비돼도 피해를 최소화할 것으로 기대된다.우회로 구축 기술 방식은 정통재난심의위가 결정하며, 통신사 투자 부담을 고려해 유예 기간을 둘 방침이다.민·관 협력을 통한 대응·복구 시스템도 강화된다.정부와 통신사는 통신재난 시 이용자가 다른 통신사 무선 통신망을 이용하도록 로밍 제공과 함께 와이파이망 개방에 합의했다. 최악의 상황에서 다른 통신사 망을 활용해 국민에게 기본 소통 수단을 제공하기 위한 조치다. 통신재난 시 행동 요령에 대한 국민 홍보와 통신 장애 발생 손해배상 등에 대한 고지 의무도 강화한다.민원기 과기정통부 차관은 “사고가 재발되지 않도록 사전에 미흡한 부분은 강화하고, 안전관리를 철저히 기해서 국민이 신뢰할 수 있는 안전한 통신망 구축을 우선하겠다”고 밝혔다.이낙연 총리는 “새해 3월이면 세계 최초로 5세대(5G) 이통을 상용화하는 대한민국의 명성에 걸맞은 통신재난 대비 태세를 갖춰 달라”고 주문했다.한편 과기정통부는 행정안전부, 소방청, 방송통신위원회, 금융위원회, 통신사와 '통신재난 관리체계 개선 태스크포스(TF)'를 구성하고 통신재난 관리 체계 현황과 문제점을 분석해 개선 방안을 도출했다.박지성기자 jisung@etnews.com, 정예린기자 yeslin@etnews.com▶ 네이버 모바일에서 [전자신문] 채널 구독하기▶ 전자신문 바로가기 [Copyright ⓒ 전자신문 & 전자신문인터넷, 무단전재 및 재배포 금지]",105,https://n.news.naver.com/mnews/article/030/0002771276?sid=103
"과기부-통신사, 통신재난 대비 및 신속 극복 위한 협약 체결",2018.12.27. 오후 2:58,"(과천=연합뉴스) 이지은 기자 = 민원기 과학기술정보통신부 2차관과 통신사 관계자들이 27일 오후 경기도 정부과천청사 과학기술정보통신부에서 열린 통신재난의 사전대비 및 신속한 극복을 위한 과학기술정보통신부와 통신사업자간 협약식에서 협약서를 들고 기념촬영하고 있다. 왼쪽부터 강종렬 SK텔레콤 ICT인프라 센터장, 오성목 KT 네트워크부문장, 민원기 차관, 최택진 LG유플러스 네트워크부분장, 박찬웅 SK브로드밴드 인프라부문장. 2018.12.27    jieunlee@yna.co.kr▶뭐 하고 놀까? #흥  ▶쇼미더뉴스! 오늘 많이 본 뉴스영상 ▶네이버 홈에서 [연합뉴스] 채널 구독하기",105,https://n.news.naver.com/mnews/article/001/0010548113?sid=103
