title,date,main,section,url
민간 데이터센터 88곳 `관리 부실`… 방통용 26곳 불과,2022.10.23. 오전 11:33,"하영제 의원.    최근 SK C&C 판교 데이터센터 화재로 IDC(인터넷데이터센터) 관리 중요성에 대한 인식이 높아지는 가운데 민간이 운영하는 데이터센터 관리가 부실한 것으로 나타났다. IDC는 화재 등 유사시에 대비한 보호조치가 필요한 만큼 이중화 설비 등에 대한 개선 조치를 점검하고, 새로운 건축용도 기준이 필요하다는 지적이 나온다.   23일 국회 과학기술방송정보통신위원회 소속 하영제(국민의힘) 의원이 과학기술정보통신부로부터 제출받은 한국데이터센터연합회(KDCC) 자료에 의하면, 민간이 운영 중인 데이터센터 88곳의 관리가 부실한 것으로 확인됐다.자료에 따르면, 지난 2000년 이전 53개에 불과하던 국내 데이터센터는 2012년 114개, 2020년엔 156곳으로 늘어났다. 이 가운데 민간에서 운영중인 데이터센터는 88곳, 정부·공공 영역에서 운영 중인 데이터센터는 68곳이다. 그런데 민간 데이터센터 88곳 중 건물용도가 '방송통신'인 곳은 26곳에 불과한 것으로 분석됐다. 이어 업무용이 25곳, 교육연구가 10곳, 공장이 7곳, 자료없음이 20곳인 것으로 나타났다.하 의원에 따르면, 2018년 9월 건축법 시행령 이전까지 데이터센터는 업무시설, 방송통신시설, 교육연구시설, 공장 등 다양한 용도로 허가 받았다. 시행령 개정 이후 데이터센터는 방송통신시설 유형에 포함해 허가하고 있다. 이번 카카오 먹통 사태의 원인인 화재가 발생한 SK C&C의 판교 데이터센터의 건물 용도는 업무용이고, 네이버가 자체적으로 운용하는 춘천 데이터센터의 용도는 교육연구다. 국내 주요 데이터센터 사업자인 LG CNS의 가산 IT센터 및 부산클라우드데이터센터, 삼성SDS 구미ICT센터, LG유플러스의 가산IDC센터 및 평촌메가센터, 롯데정보통신의 가산 U-Bit센터, 현대오토에버 광주데이터센터 등은 건물 용도가 공장으로 등록돼 있다. 이 외에도 IDC의 연면적에 대한 자료없음이 18곳, 건물 규모에 대한 자료없음이 19곳으로 확인됐다. 특히 삼성SDS 춘천ICT금융센터, 현대자동차 의왕데이터센터, KDB금융그룹 여의도센터 등은 건물 규모, 연면적, 건물용도 등 모든 자료를 데이터센터연합회 측에 제공하지 않았다.하 의원은 ""다수의 데이터센터가 2018년 9월 이전에 허가가 완료됐는데 이들 시설의 전력 차단, 화재 등 유사시에 대비한 전력, 소방설비, 배터리 등 이중화 설비에 대한 개선 조치를 점검해야 한다""며 ""또 데이터센터에 대해 기존 건축용도인 방송통신시설이 아니라 새로운 건축용도 신설을 고려해야 한다""고 밝혔다.",105,https://n.news.naver.com/mnews/article/029/0002761050?sid=103
투명 필름이 통신·발열·발광까지!,2022.10.23. 오후 9:35,"[KBS 대전] [앵커] 유리창에서 빛이 나고 겨울에는  따뜻하다면 어떨까요? 국내 연구진이  이런 상상을 실제로 구현했습니다. 발열과 발광, 통신 기능까지 갖춘  투명 필름을 개발했는데  상용화가 추진되고 있습니다. 이연경 기자입니다. [리포트] 종이처럼 구부러지고 돌돌 말 수도 있는 투명한 필름. 겉보기엔 평범해 보이지만  특별한 기능을 갖추고 있습니다. 두께가 3mm에 불과하지만 2분 만에 63도까지 열을 내는가 하면, 안테나가 내장되어 5G 통신이 가능하고 조명처럼 알록달록한 색깔을 낼 수도 있습니다. 발열과 통신을 위해 소재 표면에 깊고 얇은 홈을 파  전기가 잘 통하는 물질을 채워 넣고 미세한 패턴을 새겨  빛을 내는 방식을 썼습니다.    [윤준보/카이스트 전기 및 전자공학부 교수 : ""아주 정밀한 3차원 마이크로 패턴이 전면에 심겨 있고 그래서 원하는 부분만 빛이 나오게 그것도 한 방향으로만 나오게 할 수 있는 원리가 되겠습니다.""] 이 때문에 필름처럼 얇고 유연한 소재뿐 아니라  플라스틱이나 유리에도  구현이 가능합니다. 또, 투명도는 90% 이상 높이면서도 전기 저항은 낮출 수 있습니다.    [이승섭/카이스트 기계공학과 교수 : ""국내·외 세계적인 대기업이랑 비교해서도 저희가 한 10~20배 정도 저항이 낮아서 안테나 성능을 극대화 할 수 있었습니다.""] 이번 기술은 자동차 후방 카메라 성에 제거와  스마트 안경 렌즈,  북라이트에 적용하기 위한 상용화가 진행 중입니다. 연구진은  이 밖에도 자율주행차나 스마트 빌딩,  실내 난방 등 다양한 분야에  활용이 가능할 것으로 전망하고 있습니다. KBS 뉴스 이연경입니다. 촬영기자:강수헌",105,https://n.news.naver.com/mnews/article/056/0011361206?sid=103
"""카톡 먹통 된 줄도 몰랐어요""…10대들 쓰는 메신저 따로 있다",2022.10.23. 오전 11:32,"20세 미만 인스타그램 사용자 고공행진""카톡·페메 대신 인스타로 소통…너무 편하다""""10대가 성인 되면 인스타가 주 메신저 될 수도""



사진=게티이미지뱅크""카카오톡이 먹통이 됐었다는 것도 몰랐어요.""최근 전국을 들썩이게 한 카카오톡 먹통 사태에도 아무런 감흥이 없는 연령대가 있다. 바로 10대다. 이들은 다른 연령대가 흔히 쓰는 카카오톡이나 라인, 텔레그램 등보다 인스타그램을 통해 소통하면서 ""카톡 먹통 사태에 별 영향이 없었다""고 입을 모았다. 일각에서는 현재 10대가 성인이 되는 시점에는 카카오톡 대신 인스타그램이 주 메신저가 될 가능성도 제기했다. ""카톡은 부모님이나 선생님하고만""



20세 미만 인스타그램 일 활성 사용자 수. /그래프=신현보 한경닷컴 기자



출처=한국갤럽21일 빅데이터플랫폼 모바일인덱스에 따르면 15일 카카오톡 먹통 사태 후 20세 미만 인스타그램 사용자 수가 전날 대비 2만3000여명 늘어나 106만명을 넘었다.20세 미만 인스타그램 사용자 수는 지난해 1월 70만 명선에서 꾸준히 늘어 최근 100만명을 웃돌고 있다. 실제 한국갤럽이 2월부터 6월까지 전국 만 13세 이상 5155명에게 미디어·콘텐츠·소셜 네트워크 서비스 18종 각각에 대한 이용 경험을 물은 결과, '1년 내 인스타그램을 사용한 적이 있다'는 13~18세 남성과 여성 비율은 각각 56%와 61%로 나타날 정도로 10대들에게 인기다. 이는 카카오톡 등 모바일메신저에 이어 2번째로 높은 비율이다.카카오톡 먹통 사태 후 17세 남학생 김 모 씨는 같은 반 친구에게서 ""카톡 이상해. 오 이건 보내지네""라는 인스타그램 다이렉트 메시지(DM)를 받았다. 평소 친구들과 소통할 때 인스타그램 DM을 사용한다는 김 씨는 ""인스타그램이 친구들과 소통하기에 카카오톡보다 더 재미있는 기능들이 많고 소통하기 쉽다""고 설명했다.



지난 15일 한 고등학교 남학생이 같은 반 친구에게서 인스타그램 다이렉트 메시지를 받은 장면. /사진=독자 제공10대들에 따르면 인스타그램은 매력이 너무 많다. 사진과 동영상을 공유해 친구들의 현황을 바로 알 수 있는 것은 물론, 채팅 기능도 가진다. 또 '인스타그램 스토리'라는 일상의 순간을 찍어 올릴 수 있는 기능이 있는데 24시간 동안 내가 올린 게시물이 지속된다. 쉽고 재미있게 만들 수 있어 보통 실시간으로 자신의 위치나 상태를 공유하는 데 사용된다. 이를 본 사람들은 스토리를 보고 DM을 보낼 수도 있다.지난해 새로 출시된 '릴스'라는 기능을 통해선 다른 인스타그램 이용자들과 함께 재미있는 동영상을 쉽게 제작해 공유할 수 있게 됐다. 보통 1분 이내의 짧은 영상으로 구성돼 유튜브 '쇼츠'나 '틱톡'처럼 큰 인기를 끌고 있다.지난 6월에는 프로필에서 원하는 게시물을 고정할 수 있는 기능을 출시하기도 했는데, 이 또한 자신의 개성을 나타내는 걸 좋아하는 10대들에게 특히 인기라는 평가가 나온다. 이 기능을 통해 이용자는 게시물 위 점 세 개 아이콘을 누른 뒤 '프로필 고정'을 선택해 이를 활용할 수 있다. 사용자는 자신을 대표하는 사진 세 장을 프로필처럼 설정할 수 있게 됐다.연예인이나 인플루언서를 보는 재미와 더불어 재밌는 숏폼(짧은 형식) 동영상도 짧은 영상을 선호하는 10대들에게 특히 더 인기인 것으로 파악된다. 이들 세대에도 메신저 앱 중 카카오톡 사용 비율이 가장 높기는 하지만, 대부분 학교나 부모님과의 소통 수단으로 쓰일 뿐이라는 게 10대들의 설명이다. 19세 여학생 정 모 씨는 ""페이스북 메신져도 요즘 잘 안 쓰고 카카오톡은 주로 부모님이나 반 단체 톡 때문에 쓰는 편""이라고 말했다.서용구 숙명여대 경영학과 교수는 ""요즘 청소년들은 기성 세대와 다르게 자신을 색다르게 표현할 수 있는 메신저를 선호한다""면서 ""지금 10대들이 어른이 되면 인스타그램이 주 메신저가 되고 카카오톡은 주로 업무용으로만 사용하는 시대가 올 가능성도 크다""고 전망했다.",105,https://n.news.naver.com/mnews/article/015/0004765850?sid=103
소비자단체협회 “오비맥주 가격 인상 철회해야”,2023.10.23. 오후 3:46,"OB맥주 영업이익률 23.2%동종 업계보다 3배이상 높아“원가압박 주장 크게 타당성 없어외식물가 위협…소비자 부담 가중”



 맥주 3사 최근 3개년 재무현황 분석. 한국소비자단체협의회 제공한국소비자단체협의회가 지난 11일부터 맥주 공장 출고가격을 평균 6.9% 인상한 오비맥주에 대해 가격 인상을 철회해야 한다고 23일 주장했다.협의회는 이날 성명문을 통해 “오비맥주는 환율 불안과 각종 원부자재 가격 상승, 국제유가 급등으로 인한 원가 부담을 가격 인상의 이유로 들었으며, 작년 3월 평균 7.7%의 인상 후 짧은 기간 내에 또 가격 인상을 단행했다”면서 “오비맥주의 가격 인상을 검토한 결과, 원가 압박에 대한 주장에 크게 타당성이 없었으며, 업체의 영업이익과 매출액까지 매우 양호한 것으로 나타나, 가격 인상의 타당성이 보이지 않는다”고 주장했다.협의회 물가감시센터의 분석에 따르면 국내산 맥주맥의 가격은 1㎏ 기준 지난 2021년 평균 1036.8원에서 지난해 988.22원으로 4.7% 하락했다. 다른 원재료인 홉의 경우도 한국무역협회의 자료를 분석한 결과 2021년 대비 2022년 평균 가격이 7.0% 하락했다. 또한 지난 8월부터 홉 가격이 전월대비 50.4% 급락하는 등 당분간 하락세를 보일 것으로 내다봤다.협의회는 “오비맥주의 매출원가율을 분석한 결과 2020년 40.1%에서 2021년 42.2%, 2022년 41.0%로 큰 변동이 없었다”면서 “오히려 지난해 매출원가율은 전년 대비 1.2%포인트 하락한 것으로 나타났고 영업이익률은 3.7%포인트나 올라 원가 부담으로 인한 가격 인상이라는 기업의 주장은 타당하지 않다”고 주장했다.국내 맥주시장 매출 상위 3개 업체 비교에서도 오비맥주의 영업이익률이 크게 높았다. 시장점유율 1위인 오비맥주의 지난해 영업이익률은 23.2%로 하이트진로(7.4%)나 롯데칠성음료(7.7%)보다 3배 가량 높았다. 지난해 오비맥주 매출액과 영업이익은 전년 대비 각각 16.0%, 38.1% 증가했다.협의회는 “이러한 실적에도 가장 먼저 가격 인상을 단행한 것은 이윤 확대에만 초점을 맞추고 오비맥주를 선택해 준 소비자는 전혀 고려하지 않은 가격 정책”이라고 비판했다.아울러 “맥주 시장의 또 다른 업체들인 하이트진로와 롯데칠성음료는 업계 1위 업체의 가격 정책에 편승해 이를 틈타 명분 없는 가격 인상을 단행하지 않아야 할 것이며, 본 협의회는 지속적으로 시장 현황을 감시하고 모니터링하면서 소비자와 함께 적극적으로 행동할 것”이라고 덧붙였다.이에 대해 오비맥주 관계는 “원재료의 90% 이상을 수입에 의존하고 있는 상황에서 최근 고환율, 고유가 등으로 인한 물류비 상승 영향을 받았다”면서 “협의회는 국내산 맥주보리 가격 하락 자료를 기반으로 제품가격 인상에 대해 강변했지만, 같은 기간 맥아의 국제시세는 48% 이상 급등했다”고 설명했다.",105,https://n.news.naver.com/mnews/article/009/0005203442?sid=103
[체험기]변한 게 없다고?…'아이폰14 프맥'은 달랐다,2022.10.23. 오전 7:00,"누르면 '톡' 다이내믹 아일랜드 눈길…카메라 저조도 기능 향상'카툭튀'·무게는 여전히 부담거리…애플페이 도입 '절실'



아이폰14 프로맥스.ⓒ데일리안 남궁경 기자[데일리안 = 남궁경 기자] 저조도에서 빛을 발휘하는 '카메라', '뿅'하고 내려오는 알림, 그리고 무거운 무게. 애플의 신제품 '아이폰14 프로맥스'를 일주일간 사용해보고 느낀 제품의 특장점이다. 외형적 변화는 크게 없지만, 사용자들이 체감할 수 있는 정도의 개선은 이뤄냈다는 인상을 받았다. 다만 여전한 무게와 애플페이가 없다는 점은 갤럭시 이용자로서 아쉽다는 느낌이 들었다.바이오칩16로 완성된 '감성'…저조도 기능 차이 선명아이폰14프로맥스에는 애플의 최신형 애플리케이션 프로세서(AP)인 ‘A16 바이오닉'이 탑재됐다. 뛰어난 성능 때문에 '괴물칩'이라고 불리는 A16바이오닉은 전작인 A15 바이오닉의 중앙처리장치(CPU)보다 20% 적은 전력을 사용하면서도 메모리 대역폭은 50% 늘어난 게 특징이다. 이 덕분에 사용시간은 늘어나고, 고사양 게임과 다이내믹 아일랜드, 4800만 화소 카메라의 원활한 구동이 가능해졌다.스마트폰 성능 확인에 쓰이는 벤치마크 프로그램 '긱벤치5'로 아이폰14 프로맥스 성능을 측정한 결과, 싱글코어 점수는 1872점, 멀티코어 점수는 5455점으로 나타났다. 전작인 아이폰13 프로맥스 싱글코어/멀티코어 점수가 각각 1700점대, 4700점대 수준인 점을 감안하면 성능개선만큼은 확실했다. 싱글코어는 전화나 문자전송 등 같은 단일 작업에서의 성능을, 멀티코어는 게임 등 고사양 작업 시 성능을 의미한다. 점수가 높으면 높을수록 더욱 쾌적한 사용이 가능하다는 의미로 볼 수 있다.



긱벤치5 결과.ⓒ데일리안 남궁경 기자A16바이오닉 칩은 단말 성능뿐만 아니라 주요 기능의 향상도 끌어냈다. 다이나믹 아일랜드 기능과 카메라 기능이 대표적이다.애플은 지난 2017년(아이폰 X)부터 노치 디자인을 고집해왔다. ‘페이스 아이디(ID)’를 작동하기 위한 도트 프로젝터 등 다양한 센서들을 탑재할 공간이 마땅하지 않아서다. 그러나 이번 아이폰14 프로·프로맥스에는 노치가 아닌 펀치홀 디자인이 채택됐다.



다이나믹 아일랜드.ⓒ애플 유튜브 갈무리다이나믹 아일랜드(Dynamic Island)는 애플의 아이폰14 프로·프로맥스 등 고급형 모델 2종에 새로 도입된 기능이다. 실시간으로 중요 경고, 알림, 현황을 확인할 수 있고 음악 재생이나 페이스 ID 등 활동도 확인할 수 있다.다이나믹 아일랜드는 유튜브, 지도, 페이스타임 등 애플리케이션(앱)을 최대 2개까지 설정해 이용할 수 있다. 가령 다이내믹아일랜드에 음악과 지도를 설정할 경우, 한쪽에는 음악 플레이리스트를 다른 한쪽에는 지도를 표시해주는 방식이다. 다만 문자메시지나 카카오톡 같은 메신저 기능이 다이내믹 아일랜드에서 사용할 수 없다는 점은 아쉬운 부분이었다. 상단에 뜨는 알림은 약 2초간 유지된 뒤 자동으로 사라진다.



아이폰14 프로맥스 카메라를 3배로 줌해 촬영한 장면.ⓒ데일리안 남궁경 기자가장 만족스러운 부분은 카메라였다. 아이폰 시리즈 중 처음으로 탑재된 4800만 화소는 전작보다 깨끗한 품질의 사진을 뽑아낸다. 특히 어두운 밤에 밝은 번화가를 찍어도 빛 번짐/잔상 등이 거의 발생하지 않은 걸 확인할 수 있었다. 또 빛이 거의 없는 저조도 환경에서 또렷한 사진을 얻어낼 수 있다. 단 4800만화소를 사용하기 위해서는 카메라 설정 내 'RAW모드'를 선택해야 한다.올웨이즈온디스플레이(AOD) 기능도 눈에 띄었다. 경쟁사 제품들이 꺼진 화면에 날짜·시계 정도만 표시하게 만들었다면, 아이폰14프로맥스는 기본 바탕화면에서 밝기만 낮춘 상태를 유지한 모습이었다. 조도센서가 다이나믹아일랜드 부분에 위치해 있어 주머니에 넣거나 암실에서는 시간만 뜬다.



아이폰14프로맥스로 촬영한 광화문 거리.ⓒ데일리안 남궁경 기자'아 맞다, 지갑'…그리운 삼성페이, 카툭튀·무게 단점도 명확



아이폰14 프로맥스가 '카메라 섬' 때문에 흔들리고 있다. ⓒ데일리안 남궁경 자성능은 괴물이지만, 외형은 아쉬웠다. 특히 전작부터 지적받던 카툭튀는 더 지독해졌다. 카메라를 둘러싼 프레임(카메라 섬)이 더 커진 탓이다. 제품을 평평한 바닥에 놓고 누르면 심하게 흔들거리는 모습이다.무거워진 무게도 문제다. 아이폰14프로맥스의 무게는 기본라인업인 아이폰14(172g)보다 68g더 무거운 240g이다. 전작보다도 2g더 무겁다.갤럭시 사용자로서 아이폰14를 사용할때 가장 불편했던 것은 '애플페이'의 부재였다. 대부분 갤럭시 이용자들은 지갑 없이 삼성페이를 이용해 지하철을 타거나 제품을 구매한다. 언제 어디서든 삼성페이를 내밀면 결제가 가능하기 때문이다.그러나 애플에는 이 기능이 없다. 엄밀히 말하면 지원하지 않는다. 카드사 단말기 투자비와 수수료 문제가 해결되지 않았기 때문이다. 업계에서는 연내 애플페이 국내 서비스 개시를 전망하고 있으나, 확정된 내용은 없다.",105,https://n.news.naver.com/mnews/article/119/0002650540?sid=103
"LGU+, '나는가수다'·'런닝맨' PD 영입",2022.10.23. 오전 11:18,"플랫폼 기업 전환 위한 U+3.0 전략 일환LG유플러스는 콘텐츠 기획과 제작 역량을 강화하기 위해 전문 인재를 영입했다고 23일 밝혔다. 차별화된 콘텐츠를 통해 미디어 경쟁력을 강화함으로써, 플랫폼 기업으로 전환에 속도를 낸다는 U+3.0 전략의 일환이다.새롭게 영입한 콘텐츠 전문 인재는 신정수 PD와 임형택 PD다. 이들은 콘텐츠∙플랫폼 경쟁력 강화를 위해 조직한 전문 조직인 최고콘텐츠책임자(CCO) 산하 '콘텐츠제작센터'에서 각종 콘텐츠 기획 및 제작 등 업무를 맡을 예정이다.신정수 PD는 1995년 MBC에 입사해 ▲전파견문록 ▲놀러와 ▲나는가수다 등 인기 프로그램을 연출했다. 신 PD는 이번달 말부터 CCO 조직 산하 콘텐츠제작센터를 대표하는 센터장으로 근무하며, 전반적인 콘텐츠 기획 및 제작 총괄 업무를 맡을 계획이다.



신정수 PD(왼쪽)와 임형택 PD.임형택 PD는 ▲SBS의 예능 프로그램인 '런닝맨' ▲디즈니플러스 '런닝맨: 뛰는 놈 위에 노는 놈' 등을 연출한 예능 콘텐츠 전문가다. 임 PD는 콘텐츠제작센터 내 버라이어티제작팀장으로 다양한 예능 콘텐츠 제작을 담당할 예정이다.앞서 LG유플러스는 지난해 말 인사개편에서 CJ ENM과 하이브 등을 거친 이상진 상무를 CCO 산하 콘텐츠사업담당으로 영입했다. 올해 초에는 CJ ENM 출신 미디어콘텐츠 전문가 이덕재 전무를 CCO로 영입하는 등 콘텐츠 역량 강화를 위한 인재 영입에 적극 나서고 있다.LG유플러스는 콘텐츠 전문 인재 영입을 지속 추진할 예정이다. 이를 위해 CCO 조직은 기존 미디어 제작방식과 형식, 경험 측면에서 차별화되는 혁신적인 콘텐츠 제작 환경 조성에 집중하고 있다.전문 인재를 중심으로 제작한 콘텐츠는 MZ세대를 핵심 타깃으로 한 모바일 서비스인 U+모바일tv와 IPTV 서비스인 U+tv 등 놀이 플랫폼을 통해 선보인다. LG유플러스는 새로운 콘텐츠 창작으로 U+3.0 전략의 핵심 중 하나인 놀이 플랫폼의 경쟁력을 높인다는 계획이다.이덕재 LG유플러스 CCO는 ""외부에서 빼어난 성공 경험을 쌓고 새로운 도전을 추구하는 콘텐츠 전문 제작 리더들을 콘텐츠사업 조직인 CCO에 영입해 LG유플러스의 미래 핵심 경쟁력인 놀이 플랫폼을 키울 것""이라고 말했다.",105,https://n.news.naver.com/mnews/article/092/0002271488?sid=103
