title,date,main,section,url
"세계 5위권 수준 슈퍼컴퓨터 구축한다…""2030년 엑사급 독자적 완성""",2021.05.28. 오후 1:31,"과기정통부, `국가초고성능컴퓨팅 혁신전략` 발표2030년까지 컴퓨팅파워 5위, 신서비스 10개 창출 목표세계 5위권 수준의 국가센터 6호기·7호기 순차 구축



(자료=과학기술정보통신부 제공)[이데일리 이후섭 기자] 정부가 2030년까지 컴퓨팅파워 5위, 선도기술 24개 확대 및 신서비스 10개 창출을 통해 초고성능컴퓨팅 강국으로 도약하겠다는 목표를 제시했다. 이를 위해 세계 5위권 수준의 국가센터 초고성능컴퓨터 6호기·7호기를 순차 구축할 계획이며, 엑사급 초고성능컴퓨터를 독자적으로 완성해 나갈 방침이다. 과학기술정보통신부는 28일 제36차 비상경제 중앙대책본부 회의에서 `국가초고성능컴퓨팅 혁신전략`을 발표하고, 추진을 본격화했다. `슈퍼컴퓨터`로 더 잘 알려져 있는 초고성능컴퓨터는 최근 데이터가 급증하고, 인공지능이 고도화됨에 따라 이를 처리하는 필수 인프라로서 4차 산업혁명시대 국가 경쟁력의 바로미터로 인식되고 있다. 세계 각 국은 매년 조 단위 대규모 투자를 통해 신규 인프라 확보 및 기술 선점 경쟁에 국가적 역량을 집중하고 있다.이번 혁신전략은 `1초에 100경번 연산`하는 엑사급 컴퓨팅 시대로의 전환 및 각 국의 기술안보 강화, 국내 수요 급증 등 국내외 패러다임 변화에 맞운 10년 간의 중장기 실행전략을 담고 있다. 구체적으로 2030년까지 컴퓨팅파워 5위, 선도기술 24개 확대 및 신서비스 10개 창출을 통한 초고성능컴퓨팅 강국 도약을 목표로 소재·나노, 자율주행, 국방·안보 등 초고성능컴퓨팅 활용을 중점 육성할 10대 전략 분야를 설정했다. △인프라 확충 △독자적 기술력 확보 △혁신적 활용 활성화를 위해 우선 국가 플래그십 초고성능컴퓨터로서 현재 세계 21위 수준인 국가센터 5호기(`누리온`)를 세계 5위급 수준의 6호기(2023년), 7호기(2028년)로 순차 교체·운영한다. 또 기상·국방 등 분야별 전문센터를 전략 분야와 연계해 2030년까지 10개 이상 지정해 관련 신규 인프라 확충을 적극 지원하고, 국가센터·전문센터 등 국가초고성능컴퓨팅자원 간의 연동체계를 구축하는 공동활용도 강화해 나간다.정부는 CPU 등 전략적 중요도가 높은 24개 핵심기술을 전략 기술로 선정한바 있으며, 앞으로 이를 프로세서·플랫폼기술·데이터집약형기술·활용기반기술 등 4대 분야로 묶어 집중적인 R&D 투자를 통해 현재 최고기술 대비 60~70% 수준인 기술력을 80% 이상까지 높일 계획이다. 이렇게 확보된 원천기술을 바탕으로 2030년까지 엑사급 초고성능컴퓨터를 설계부터 제작·설치까지 독자 구축해 시스템 역량을 완성하고, 완제품시장 진입도 이뤄낼 계획이다. 이러한 성과가 국내 산업생태계로 이어질 수 있도록 정부 R&D 사업에 관련 기업을 초기부터 적극 참여시키고, 기술사업화를 위한 초기시장 창출 및 기술 제공 등의 지원도 확대한다.우수 연구자나 산업계의 혁신적 잠재 수요가 실제 활용으로 이어질 수 있도록 국가초고성능컴퓨팅자원의 50%를 10대 전략 분야에, 20%는 기업에 우선적으로 제공하는 한편, 보안체계 강화 및 초고성능컴퓨팅 활용사업 확대, 혁신적 서비스 모델 발굴 등 연구자, 산업계, 정부·공공기관 수요자별 맞춤형 지원을 강화할 계획이다. 임혜숙 과기정통부 장관은 “초고성능컴퓨팅은 매우 도전적인 분야이지만, 과거 ICT 강국으로의 도약 경험과 세계 최고 수준의 반도체 역량 등을 바탕으로 모든 부처와 민·관이 한 팀이 되어 혁신전략을 체계적으로 이행해 나간다면 소기의 성과를 거둘 수 있을 것으로 생각한다”고 말했다.이후섭 (dlgntjq@edaily.co.kr)▶ #24시간 빠른 #미리보는 뉴스 #eNews+▶ 네이버에서 '이데일리 뉴스'를 만나보세요▶ 빡침해소, 청춘뉘우스 '스냅타임'＜ⓒ종합 경제정보 미디어 이데일리 - 무단전재 & 재배포 금지＞",105,https://n.news.naver.com/mnews/article/018/0004941246?sid=103
,,,105,https://n.news.naver.com/mnews/article/421/0005378809?sid=103
"넷마블·엔씨, 코로나19 백신 휴가 제도 도입",2021.05.28. 오전 11:09,"국내 대형 게임사 중 하나인 넷마블과 엔씨소프트는 각각 코로나19 백신 휴가 제도를 도입해 시행한다.먼저 넷마블은 지난 21일부터 넷마블컴퍼니 직원대상으로 코로나19 백신 휴가 제도를 시행 중이다. 코로나19 백신 접종 직원에 대해 접종일과 그 다음날, 총 2일의 유급 백신 휴가가 부여된다. 2회 접종이 필요한 백신의 경우 각 2일씩 총 4일의 휴가가 주어진다.또, 엔씨소프트는 6월부터 코로나19 백신 휴가 제도를 시행해 접종 시 1.5일의 유급 휴가를 제공한다. 백신 접종 당일 반차(0.5일)와 다음날(1일)을 휴가로 보장하며 1, 2차 접종으로 총 3일간 유급 휴가를 사용할 수 있다.최종배 기자 jovia@fomos.co.kr[게임&게이머, 문화를 전합니다. 포모스게임│무단 전재 및 재배포 금지]포모스",105,https://n.news.naver.com/mnews/article/236/0000212928?sid=103
"온다, 숙박 위탁 운영 브랜드 '쏘타컬랙션' 선봬",2021.05.28. 오후 5:22,"(지디넷코리아=안희정  기자)국내 숙박 상품 40여만 개를 유통중인 숙박 B2B 플랫폼 온다(ONDA)가 생활형 숙박시설의 운영부터 수익 창출까지 통합 관리를 제공하는 새로운 브랜드를 선보인다.온다(대표 오현석)는 생활형 숙박시설과 호텔의 위탁 운영 브랜드 ‘쏘타컬랙션(SoTA : Collection)’을 공식 출시한다고 28일 밝혔다.쏘타컬랙션은 최첨단 기술이라는 뜻과 앞서가는 트랜드라는 의미를 지닌 State-of-The-Art(SoTA)와 Collection의 합성어로, 숙박업 내에서 최첨단 기술이 선사하는 편리함과 감동을 고객경험으로 제공한다는 포부를 담고 있다. 이미 송도, 여수, 부산 광안리 등 600여 객실이 쏘타컬랙션과 함께하고 있으며, 2021년 말까지 운영객실을 2천객실까지 늘릴 계획이다.



[이미지] 온다 쏘타컬랙션 로고쏘타컬랙션은 전국 6만여 객실에 이르는 생활형 숙박시설, 이른바 레지던스형 숙박 시설의 운영과 판매를 돕기 위해 만들어졌다. 생활형 숙박시설은 국내에 장기 투숙하는 외국인, 지방 발령 직장인 등이 1개월 이상 1년 이하로 묵을 만한 숙소가 없는 문제점을 해결하기 위해 도입됐다. 오피스텔처럼 방 단위로 나눠서 분양, 소유, 거래가 가능한 것이 특징으로 각종 부동산 규제로부터 자유롭기까지해 수익형 부동산 투자 상품으로도 큰 인기를 끌어 왔다.다만, 관련법상 생활형 숙박시설은 위탁운영사를 통해 숙박 상품을 유통해야 하는데, 숙소의 운영과 판매를 책임지는 위탁운영사와의 잡음이 끊이지 않고 있어 대책 마련이 필요했던 분야이기도 하다.온다는 이 같은 생활형 숙박시설 업계의 문제를 해결하고자 지난 해 여름부터 전문 TF를 구성했고, 유럽, 중국, 중동 등 글로벌 유명 5성급 호텔에서 운영 경험을 쌓은 인재를 대거 영입해 시장 조사 및 시범 판매를 진행했다.이를 통해 선보인 쏘타컬랙션은 생활형 숙박시설 판매에서 가장 큰 문제인 숙소 운영의 불투명성을 원천적으로 차단한다. 전용 프로그램을 개발해 수분양자로 하여금 판매 현황, 운영비 지출 내역 등 운영 전반을 실시간으로 모니터링할 수 있도록 했으며, 수분양자들이 온라인 상에서 간편하게 숙박업 운영에 참여할 수 있는 방안도 마련 예정이다.특히 기존 업체들이 높은 비용의 인건비를 적용하던 영역을 IT 기술로 대체해 운영비를 대폭 절감하는 등 수분양자들의 이익 또한 극대화 할 방침이다. 쏘타컬랙션은 수분양자들에게 수익 배분 모델 뿐만 아니라 월정액 관리비 모델 등 다양한 수익 정산 모델을 제공한다. 다양한 수익 정산 모델을 고안해 낸 주된 이유는 시설마다 또 수분양자마다 원하는 정산 방식이 다르기에 이를 모두 수용하기 위함이라는 것이 온다 측의 설명이다.숙박 판매가 활발하다면 월정액 관리비 모델이 수분양자에게 유리하다. 숙박 시설 당 정액의 관리비만 내면 판매 대행, 숙소 운영, 인허가 문제 등 모든 숙소 운영을 온다에서 책임진다. 마치 아파트 관리비를 내듯 일정 금액만 지불하면 운영비 사용 내역, 숙소 판매 현황 등 모든 정보를 투명하게 제공받을 수 있다. 만약, 초기 단계일 경우 수익 배분 모델이 추천된다.쏘타컬랙션은 온다가 지난 5년간 쌓아 온 40만 객실이 넘는 실제 판매 데이터를 바탕으로 ▲시장환경 분석 ▲판매전략 수립 ▲운영환경 조사 ▲숙박시설 상태분석 등을 진행해 수분양자들의 수익을 극대화 할 계획이다. 또한 숙소 컨디션, 어메니티, 인테리어, 서비스 후기 등을 종합적으로 분석해 최신 트렌드의 숙박 운영 경험을 수분양자들에게 지속적으로 제공해 나가고자 한다.쏘타컬랙션은 자사 사이트 및 인스타그램, 페이스북 등 다양한 경로를 통해 숙박 상품을 효과적으로 알리고 있다. 더불어 온다가 보유한 자체 객실 관리 시스템과 시장 분석 데이터, 국내외 유수의 OTA 등과 연결된 전략적 판매 채널 확보 등으로 효과적인 숙박 사업 운영이 기대된다.박지훈 쏘타 사업본부장은 “쏘타컬랙션은 근래에 화두가 되고 있는 숙박 운영사들의 미정산 문제, 과다한 비용 부과 등 잘못된 사례들을 원천적으로 차단하고 해결하기 위해 탄생했다”며 “수분양자와의 신뢰 확보를 바탕으로 단순한 수분양자와 운영사 관계를 넘어 지속가능한 비지니스 파트너 관계로 나아가고자 한다”고 포부를 밝혔다.안희정 기자(hjan@zdnet.co.kr) ▶ 지디넷코리아 '홈페이지' ▶ 네이버 채널 구독하기© 메가뉴스 & ZDNET, A RED VENTURES COMPANY, 무단전재-재배포 금지",105,https://n.news.naver.com/mnews/article/092/0002223411?sid=103
풍선에 반려견 묶어 공중에 띄운 인도 유튜버 체포,2021.05.28. 오후 12:47,"비난 일자 영상 삭제…동물보호단체 고소



 자신의 반려견을 풍선에 묶어 공중에 띄운 인도 유튜버 가우라브 샤르마. [SNS 영상 캡처. 재판매 및 DB 금지]    (뉴델리=연합뉴스) 김영현 특파원 = 인도의 한 유튜버가 자신의 반려견을 헬륨 풍선에 묶어 공중에 띄웠다가 동물 학대 혐의로 경찰에 체포됐다.    28일 소셜미디어(SNS)에 올라온 영상을 살펴보면 인도 뉴델리에 사는 유튜버 가우라브 샤르마(32)는 여러 개의 헬륨 풍선에 반려견 '달러'를 묶은 뒤 공중으로 날려 보냈다.    풍선은 건물 벽을 따라 떠오르기 시작했고 몇 초 뒤 2층 발코니에서 누군가 이 개를 붙잡았다.    인디언익스프레스 등 현지 언론에 따르면 샤르마는 지난 21일 구독자가 400만명에 달하는 자신의 유튜브 채널에 이 영상을 올렸다가 비난이 빗발치자 삭제했다.    그러면서 그는 ""모든 안전 조치를 따랐다""고 해명했다.    이어 ""나는 애완동물을 사랑하며 달러를 어린이처럼 대한다""며 시청자에게 ""나의 행동에 영향받지 말라""고 했다. 하지만 해당 영상은 이미 여러 SNS에 공유된 상태다.    이와 관련해 동물복지단체 PFA는 샤르마를 고소했고, 경찰은 동물 학대 혐의 등으로 샤르마를 체포했다.    cool@yna.co.kr▶네이버에서도 뉴스는 연합뉴스[구독 클릭]▶[팩트체크]쉽게 한국국적 얻어 혜택만 누린다?▶제보하기<저작권자(c) 연합뉴스(https://www.yna.co.kr/), 무단 전재-재배포 금지>",105,https://n.news.naver.com/mnews/article/001/0012422755?sid=103
"'카러플', '배그 모바일'과 컬래버레이션 진행",2021.05.28. 오후 2:18,"넥슨은 모바일 레이싱 게임 '카트라이더 러쉬플러스(이하 카러플)'에 크래프톤 펍지스튜디오의 '플레이어언노운스 배틀그라운드(이하 배그) 모바일'과 컬래버레이션 업데이트를 진행했다.이번 업데이트에서는 레전드 아이템 카트 3레벨 헬멧과 클래식 수트(남), 3레벨 배낭, 프라이팬 핸드봉, 3레벨 헬멧 장식을 선보였다. 각 아이템들은 상점에서 구매 또는 서프라이즈 포인트 및 랭킹 코인으로 교환할 수 있다.  이와 함께 오는 6월 5일에는 레어 스피드 카트 프라이팬을 추가하고, 6월 18일까지 출석 이벤트 참여자를 대상으로 기간제 또는 영구 아이템으로 지급한다. 이어 6월 12일에는 마이룸 아이템으로 에어 드랍 건축물을 추가할 예정이다. 한편, 넥슨은 지난 27일 '카러플' 공식 유튜브에 '이제 카러플에서 치킨이닭!' 홍보 영상을 공개했다. 배찌와 에띠가 카트 바디에 탑승한 채 낙하산을 타고 내려오는 모습이 담겼다.최종배 기자 jovia@fomos.co.kr[게임&게이머, 문화를 전합니다. 포모스게임│무단 전재 및 재배포 금지]포모스",105,https://n.news.naver.com/mnews/article/236/0000212939?sid=103
"삼성 블록체인 월렛, 토카막 네트워크 토큰 'TON' 지원",2021.05.27. 오전 11:05,"삼성 스마트폰으로 TON 입·출금 가능



사진=토카막 네트워크온디맨드 이더리움 레이어2 플랫폼 토카막 네트워크가 삼성 블록체인 월렛에서 토카막 네트워크 생태계 토큰 톤(TON)의 입·출금 및 스테이킹 서비스를 제공한다고 27일 밝혔다.이번 삼성 블록체인 월렛 등재로 삼성 갤럭시 스마트폰을 쓰는 토카막 네트워크 사용자는 TON을 간편하게 입·출금 및 보관할 수 있고, 스테이킹도 모바일로 간편하게 참여 가능하다.스테이킹은 블록체인 네트워크 운영 및 검증을 위해 사용자의 가상자산을 블록체인상에 위탁하고 그 대가를 가상자산으로 보상받는 것으로 블록체인 운영 필수 기능 중 하나다.토카막 네트워크의 스테이킹은 현재 토카막 네트워크 재단, Level 19, DSRV, Talken 총 4개 오퍼레이터에 위임해 운영되고 있다. 지난해 9월 정식 출시 이후 현재까지 유통량의 53%에 달하는 약 1100만TON이 스테이킹돼 있으며, 스테이킹 물량에 대해 약 연 45%의 보상이 주어진다.토카막 네트워크는 이번 삼성 블록체인 월렛 등재를 통해 더 많은 토카막 네트워크의 이용자 커뮤니티가 활성화될 것이라 기대하고 있다.정순형 토카막 네트워크 파운더는 ""안정성이 검증된 삼성 블록체인 월렛에 토카막 스테이킹 앱이 탑재되고, 이를 통해 소개할 수 있어 매우 기쁘다""며 ""모바일 지원을 통해 더 많은 사용자가 토카막 네트워크에 참여하고, 이 과정에서 레이어2 네트워크의 신뢰 수준을 높일 수 있을 것""이라고 말했다.이영민 한경닷컴 기자 20min@hankyung.com▶ 경제지 네이버 구독 첫 400만, 한국경제 받아보세요▶ 한경 고품격 뉴스레터, 원클릭으로 구독하세요▶ 한국경제신문과 WSJ, 모바일한경으로 보세요 ⓒ 한국경제 & hankyung.com, 무단전재 및 재배포 금지",105,https://n.news.naver.com/mnews/article/015/0004552743?sid=103
"KT, 시즌·올레tv서 황인엽 온라인 팬미팅",2021.05.28. 오후 12:42,"시즌서 VIP 팬미팅 상품 단독 판매(지디넷코리아=김민선  기자)KT(대표 구현모)가 배우 황인엽의 온라인 팬미팅을 온라인동영상서비스(OTT) '시즌'과 IPTV '올레tv' 을 통해 진행한다고 28일 밝혔다.예매는 이날 11시부터이며, 팬미팅 개최 일정은 7일3일 오후 4시다.전 세계 팬들과 라이브로 진행될 황인엽의 첫 온라인 팬미팅은 기존 배우 팬미팅에서 볼 수 없었던 새로운 형식의 Q&A, 출연 작품 비하인드 토크, 개인 가방 최초 공개, 팬들의 위시리스트 이뤄주기, 황인엽 만의 패션 노하우 공개 등 다양한 코너를 선보인다.



KT가 시즌과 올레tv에서 황인엽 온라인 팬미팅을 진행한다.황인엽은 최근 성황리에 종영한 tvN 드라마 ‘여신강림’에서 서브남 ‘한서준’으로 출연해 국내외 팬들에게 강렬한 눈도장을 찍었다. 황인엽은 2018년 웹 드라마 ‘WHY(당신이 연인에게 차인 진짜 이유)’로 데뷔해 ‘프레쉬맨(아싸들의 인싸 도전기)’, KBS2 드라마 ‘녹두전’, JTBC 드라마 ’18 어게인’ 등 다채로운 작품을 통해 자신 만의 필모그래피를 구축했다. 특히 ‘여신강림’에 출연하며 20만 명이었던 SNS 팔로워 수가 900만 명 가까이 급증하기도 했다.이번 팬미팅은 애플우드크리에이티브와 KT가 주최하고 키이스트 주관으로 진행된다.국내 팬들은 시즌과 올레tv에서 팬미팅을 예매할 수 있으며, 해외 고객의 경우 ‘마이뮤직테이스트’, ‘프라이데이’ 등의 플랫폼에서 예매 가능하다.팬미팅 상품은 크게 일반 패키지와 VIP로 나눠진다. 일반 패키지는 ▲라이브 시청 ▲소장용 실황 VOD ▲소장용 공연 당일 메이킹 영상으로 구성되며, 다음달 4일부터 시즌과 올레tv에서 판매된다. 가격은 3만6천원(VAT별도)이다. VIP 패키지는 5월28일부터 시즌에서만 단독 판매되며, 일반 패키지에 더해 ▲황인엽 포스터 5종 세트 ▲퍼즐 세트 중 하나를 선택할 수 있다. 가격은 6만 2천 원(VAT별도)이다.유현중 KT 모바일미디어사업P-TF장은 “대세배우의 첫 온라인 팬미팅을 함께 준비할 수 있어 기쁘다”며, “알차게 준비한 굿즈들과 리허설 라이브 등 얼리버드 구매고객 혜택 등을 통해 고객들이 더 의미있는 시간을 보내길 바란다”고 말했다..김민선 기자(yoyoma@zdnet.co.kr) ▶ 지디넷코리아 '홈페이지' ▶ 네이버 채널 구독하기© 메가뉴스 & ZDNET, A RED VENTURES COMPANY, 무단전재-재배포 금지",105,https://n.news.naver.com/mnews/article/092/0002223362?sid=103
"스포라이브, 페이스북 승부 예측 이벤트 실시",2021.05.28. 오후 4:56,"스포츠 승부예측 게임사 스포라이브(대표 김홍민)는 페이스북 승부 예측 이벤트를 진행한다고 28일 밝혔다.국내 최초로 게임물관리위원회에서 심의를 받은 스포라이브는 전 세계 126개국의 각종 프로 스포츠 경기에 대한 승부예측 게임을 서비스하는 회사다.이번 페이스북 승부예측 이벤트는 이용자와 함께 하는 승부예측 게임문화 조성을 위해 기획됐다. 스포라이브가 펼치는 페이스북 이벤트는 이용자가 유럽 축구 국가 대항전의 경기 결과를 예측하고 마지막 최후의 1인이 남아 승리하게 되는 서바이벌 형식으로 마련됐다.국가 대항전이 시작하는 6월 12일부터 약 한 달간 실시할 예정이며 참가자 모집은 오는 31일부터 시작한다. 참가자는 스포츠를 좋아하는 누구나 참여할 수 있으며 스포라이브의 회원일 경우 당첨 확률이 높아진다.스포라이브측은 “스포츠 경기 직관이 어려운 시국이지만 이용자들과 함께 소통하며 만들어가는 승부예측 게임을 즐기는 문화를 만들고 싶었다”고 밝혔다.[게임진 임영택기자 ytlim@mkinternet.com]▶ '경제 1위' 매일경제, 네이버에서 구독하세요▶ 이 제품은 '이렇게 만들죠' 영상으로 만나요▶ 부동산의 모든것 '매부리TV'가 펼칩니다[ⓒ 매일경제 & mk.co.kr, 무단전재 및 재배포 금지]",105,https://n.news.naver.com/mnews/article/009/0004800969?sid=103
"강원도립대, 어르신 위한 디지털 문해력 강화 특강 진행",2021.05.28. 오후 3:36,"(강릉=연합뉴스) 28일 강원 강릉시 강원도립대학교 원격교육지원센터에서 열린 '성인학습자 디지털 문해력 강화' 특강에 참석한 어르신들이 스마트폰  및 사회관계망서비스(SNS) 사용법 등을 배우고 있다. 2021.5.28 [강원도립대학교 제공. 재판매 및 DB 금지]    yangdoo@yna.co.kr▶네이버에서도 뉴스는 연합뉴스[구독 클릭]▶[팩트체크]모더나 백신에 독성물질 포함?…아니다 ▶제보하기<저작권자(c) 연합뉴스(https://www.yna.co.kr/), 무단 전재-재배포 금지>",105,https://n.news.naver.com/mnews/article/001/0012423327?sid=103
"비트코인, 하루새 7% 하락…3만6천달러 붕괴",2021.05.28. 오후 9:02,"잠깐 상승하다가 또 떨어져…이더-도지코인도 동반 하락(지디넷코리아=김익현  기자)암호화폐 비트코인 가격이 하루 만에 7% 하락하면서 3만6천달러(약 4천만원) 밑으로 떨어졌다.비트코인 가격은 28일 오전 6시(미국 동부시간 기준) 3만5천904달러에 거래되고 있다고 CNBC가 보도했다.비트코인은 지난 주 중국과 미국의 규제 정책이 연이어 공개되면서 큰 폭으로 하락했다. 특히 지난 19일엔 하루 만에 30% 폭락하면서 3만달러(약 3천300만원) 선까지 위협받았다.



하지만 이번 주 들어 상승세로 돌아선 끝에 지난 26일엔 한 때 4만달러(약 4천460만원)를 넘어서기도 했다.그런 가운데 이날 또 다시 하락하면서 3만6천달러가 붕괴됐다.최근 비트코인에 대해선 엇갈린 전망이 나오고 있다. 미국 최대 은행인 JP모건은 비트코인 가치가 ‘제로’(0)까지 떨어질 수 있다고 경고했다.반면 캐시 우드 아크투자운용 대표가 비트코인이 50만달러(약 5억5천800만원)까지 상승할 것이란 기존 전망을 되풀이했다.또 다른 암호화폐인 이더 역시 하루 새 10% 떨어지면서 2천473달러(약 275만원)를 기록했다. 도지코인 역시 6% 떨어진 31센트(약 345원)에 거래되고 있다.김익현 기자(sini@zdnet.co.kr) ▶ 지디넷코리아 '홈페이지' ▶ 네이버 채널 구독하기© 메가뉴스 & ZDNET, A RED VENTURES COMPANY, 무단전재-재배포 금지",105,https://n.news.naver.com/mnews/article/092/0002223418?sid=103
"인텔리빅스, 하이퍼랩 합병 가결…지배구조 일원화",2021.05.28. 오후 5:24,"인텔리빅스 로고인텔리빅스(대표 장정훈)가 28일 임시주주총회를 열고 하이퍼랩 합병을 가결했다.인텔리빅스는 지난달 1대 주주인 하이퍼랩과 합병하기로 결정했으며 이날 계약 안건을 원안대로 통과시켰다. 다음달 30일까지 한 달간 채권자 보호 기간이 종료되면 7월 1일자로 합병이 최종 완료된다.인텔리빅스는 이번 합병을 통해 '간접 지배'에서 '직접 지배'로 지배 구조를 개편, 경영구조 일원화를 꾀하고 있다. 구조적 합병뿐만 아니라 사업도 통합할 예정이다.합병 이후 하이퍼랩은 인텔리빅스 신규 사업부로 편입, 조달청 나라장터를 통한 기존 판로를 지속 이어갈 방침이다. 하이퍼랩이 보유한 기업간거래(B2B), 기업정부거래(B2G) 인적 네트워크를 바탕으로 홍채인식, 네트워크 등 다양한 분야에서 사업을 추진할 계획이다.인텔리빅스 관계자는 “양사 합병으로 지배 구조를 일원화해 책임경영을 강화할 것”이라면서 “합병 시너지를 통해 사업 모델과 수익 구조 다변화를 기대한다”고 말했다.오다인기자 ohdain@etnews.com▶ ""2021 스마트 디지털 워크스페이스 이노베이션"" 개최▶ ""AI·DX SUMMIT KOREA 2021"" 6월 24일 개최 [Copyright ⓒ 전자신문 & 전자신문인터넷, 무단전재 및 재배포 금지]",105,https://n.news.naver.com/mnews/article/030/0002947430?sid=103
