title,date,main,section,url
빗방울까지 느껴지는 VR…'레디 플레이어 원' 같은 가상세계 나올까 [CES 2023],2023.01.06. 오후 4:51,"5일(현지시각) 미국 라스베이거스에서 열린 CES 2023에서 한 참가자가 햅트X의 VR 장갑을 체험하고 있다. 이 장갑은 물체의 재질에 따라 달라지는 촉감과 물체의 무게, 저항까지 구현한다. 최예린 기자하늘에서 떨어지는 빗방울, 부드럽게 휘어지는 갈대의 촉감, 배를 관통하는 총알의 충격, 화재현장의 뜨거운 불길, 모닥불에 구운 마시멜로우 냄새…5일(현지시간) 미국 라스베이거스에서 개막한 세계 최대 정보기술(IT)·가전 전시회 ‘CES 2023’에는 시각은 물론 오감을 자극하는 가상현실(VR)·증강현실(AR) 장비들이 대거 등장했다. 가상세계가 ‘발전된 영상’ 수준에 그친다는 비판을 극복하고, 진짜같은 허구를 만들기 위해 촉각·후각까지 총동원하는 것이다. 자동차와 갈대의 다른 촉감까지 구현미국 기업 햅트X는 5일(현지시각) 물체의 재질에 따라 달라지는 촉감을 구현한 VR 장갑을 선보였다. 이 장갑을 끼면 매끈하고 딱딱한 자동차와 부드럽고 휘어지는 갈대의 감촉이 서로 구분된다. 손가락은 물론 손등, 손바닥을 모두 감싸는 135개의 ‘공기방울’을 채웠다 비우며 세밀하게 촉각을 자극하는 기술이 핵심이다. 장갑 겉에는 장력 있는 엑소스켈레톤을 달아 물체의 무게와 저항까지 느껴진다. 손으로 가상세계의 벽을 밀어보면, 마치 실제 벽이 버티고 서있는 듯 쉽게 밀리지 않는다.촉각 장비들은 진동의 한계를 탈출하고 있다. 지금까지 몸에 착용하는 촉감 조끼와 장갑의 핵심 자극원은 진동이었다. 이번 CES에는 햅트X처럼 압력, 전기 자극, 온도 변화 등 다양한 자극원을 사용하는 장비가 등장했다. 스페인 기업 OWO는 촉감 수트에 전기 펄스를 사용했다. 이날 수트를 체험해본 참가자 모건 영씨는 “진동은 피부 바깥 느낌에 그친다면, 전기는 찌릿한 감각이 피부 속으로 들어온다”며 “총알을 맞을 때와 칼에 찔릴 때 느낌이 구분되는 게 놀랍다”고 했다.



5일(현지시각) 미국 라스베이거스에서 열린 CES 2023에서 한 참가자가 햅트X의 VR 장갑을 체험해보고 있다. 최예린 기자한국 기업 테그웨이의 ‘써모리얼-F1’은 화재현장 속 불길의 뜨거움, 물에 빠졌을 때 바다의 차가움을 구현하는 수트와 장갑을 소개했다. 열전소자로 즉시 온도를 높이고 낮춰 현실감을 높이는 기술이 핵심이다. 컨텐츠 연동은 아직 숙제가상세계 속 감각은 후각까지 확장되고 있다. VR 기기와 블루투스로 연동돼 향을 분출하는 미국 스타트업 OVR테크놀로지의 웨어러블 장치 '아이온'(ION)이 대표적이다. 향기 카트리지가 장착된 아이온은 캠핑장, 해안가 등 다양한 장소에 맞춰 향을 내뿜었다. 기자가 VR 헤드셋을 착용한 뒤 컨트롤러를 통해 가상의 마시멜로우를 집어드니 달달한 향이 코끝을 스쳤다. 장작으로 다가가 마시멜로우를 구운 후에는 타는 냄새로 순식간에 뒤바뀌었다. 장소를 이동하면 향이 곧바로 사라지게 설계해 사용자의 몰입도를 높였다는 설명이다. OVR테크놀로지는 AR 기기와도 동기화되는 '아이온3'(ION3)'를 조만간 출시한다는 계획이다.다만 다양한 컨텐츠와의 연동은 아직 숙제다. 장비가 아무리 정교한 감각을 구현해도 즐길 수 있는 영화, 게임 등 컨텐츠가 없으면 소용 없기 때문이다. 상용화도 문제다. 30~60만원대로 일반 소비자들이 감당할 수 있는 VR 수트들은 다소 현실감이 떨어지고, 햅트X 제품처럼 현실감이 높은 제품은 300만원을 넘어가 기업이 아닌 개인이 구매하긴 어렵다.새로운  메타버스 플랫폼 안 보여현실과 가상의 경계를 허무는 메타버스 플랫폼은 엔터테인먼트 분야에서 주로 활용되고 있었다. 스타트업 중심의 유레카 파크에선 아바타를 통해 집에서도 가수와 소통할 수 있는 폴카믹스의 메타버스 콘서트 플랫폼이 눈길을 끌었다. 자세 교정 기능을 더한 메타러닝의 메타버스 러닝 플랫폼도 소개됐다. 이들 모두 삼성전자의 사내 벤처 조직이다. 신한은행, 롯데정보통신 등 본업이 메타버스가 아닌 기업들도 실감형 메타버스 플랫폼을 내놨다.다만 글로벌 메타버스 기업은 이번 CES에서 새로운 제품이나 기술을 선보이지 않았다. 메타버스 플랫폼 '호라이즌월드'를 운영하는 메타(옛 페이스북)는 이번 CES에서 고객사 미팅만 하기로 했다. 기업용 메타버스 시장에 뛰어든 마이크로소프트도 이번 CES에서 처음으로 마련된 메타버스존에 가장 크게 자리 잡았지만 게임 콘텐츠를 전시하는 데 그쳤다. VR, AR 기기가 오감으로 영역을 넓히고 있지만 메타버스 플랫폼의 활용 범위는 여전히 제한적이라는 지적도 나온다.라스베이거스=최예린 기자 rambutan@hankyung.com허세민 기자 semin@hankyung.com",105,https://n.news.naver.com/mnews/article/015/0004796701?sid=103
[CES 2023] 테러 위협에 폭발물 탐지견까지 등장한 CES… 신분 확인도 강화,2023.01.06. 오전 10:10,"CES 참가자가 전시장 입구에서 가방 검사를 받고 있다. /박성우 기자        “가방 열어주세요. 엑스레이 검색대를 통과해주세요.”세계 최대 전자 전시회 ‘CES 2023′이 삼엄한 경비 속에 5일(현지 시각) 개막했다. 전 세계에 많은 인파가 몰리면서 사고나 테러 위협을 방지하기 위해 예전보다 보안이 한층 강화됐다.CES 전시관에 입장하기 위해서는 폭발물이나 총기류 소지 여부를 파악하기 위한 가방·소지품 검사를 받아야 했다. 2차적으로 금속탐지기 검사도 받아야 한다. 검사대 앞에는 폭발물 냄새를 맡는 탐지견이 수시로 돌아다녔다. CES 전시장 주변에는 총으로 무장한 현지 경찰들도 쉽게 볼 수 있었다.이번 CES 2023은 코로나19 팬데믹으로 규모가 축소된 이후 처음으로 정상 개최되는 행사다. 올해는 삼성전자, LG전자, SK 등 국내 기업을 비롯해 구글, 아마존, 마이크로소프트(MS) 등 빅테크 기업까지 170여개국, 3000여기업이 참가해 새로운 혁신 기술을 선보인다.



권총으로 무장한 한 보안요원이 폭발물 탐지견을 이끌고 전시장 수색을 하고 있는 모습. /박성우 기자        이번 행사를 주관하는 미국소비자기술협회(CTA)에 따르면 CES 전시 공간은 18만6000㎡로, 지난해보다 50% 넓어졌다. 이는 축구장 26개를 합친 규모다. 이곳을 찾는 관람객 수는 지난해 4만5000명보다 두 배 많은 10만명에 달할 것으로 예상된다.행사가 정상화 됨에 따라 참석자가 늘면서 사고를 방지하기 위한 보안이 강화된 것이다. 전시장에 들어가기 위해서는 총 3번의 관문을 통과해야 했다. 먼저 CES에서 제공한 출입증을 행사 관계자에게 확인을 받아야 한다. 다음 관문에서는 가방 검사다. 보안 요원들은 입장객 가운데 무작위로 여권 이름과 출입증 이름이 같은 지 비교하기도 했다. 전시관 밖을 나갈 경우 이러한 신분 확인 과정을 다시 거쳐야 한다.각종 컨퍼런스가 열리는 호텔에서도 동일한 가방 검사와 신분 확인 절차를 거쳐야 한다. 지난 2017년 라스베이거스의 한 호텔에서 총기를 난사해 60명의 사망자와 500여명이 다치는 사고가 발생하기도 했다.



ces 2023이 열리는 컨벤션센터 웨스트홀 앞에 경찰 차량이 정차한 모습. /박성우 기자        CTS는 CES 2023을 앞두고 ‘참가자 행동강령’도 발표했다. 모든 공식 CES 행사에서 총기, 무기(무기 모형 포함), 탄약, 위험한 기기 또는 물질, 불법적인 물품 반입을 금지하고 있다. 또 CES 참가자의 모든 가방은 일반 검사와 금속탐지기 검사 대상이라는 점을 공지하고 있다. 사전에 등록된 배지를 착용하지 않을 경우, 입장이 불가능하다.국내 전자업계 관계자는 “CES를 5번 이상 와봤지만 올해 유독 CES의 보안과 신분 확인이 깐깐해진 것 같다”라며 “행사장 입구에서는 여권을 가지고 오지 않아 입장을 막는 주최 측과 전시관에 들어오려는 입장객 간의 실랑이 하는 모습을 종종 봤다”고 했다.CES를 주최하는 미국소비자기술협회(CTA) 관계자는 “올해 CES는 17만명 이상이 인원이 한자리에 모이는 대규모 행사인 만큼 현지 경찰에서도 테러 대비 경계태세를 강화한 것으로 알고 있다”며 “티켓을 구입하고 입장하는 관람객들의 권리를 보호하기 위해 신분확인을 철저히 하는 이유도 있다”고 말했다.",105,https://n.news.naver.com/mnews/article/366/0000867882?sid=103
"소니, 장애인 접근성 높이는 PS5 컨트롤러 개발한다",2023.01.06. 오후 3:55,"CES 2023 통해 공개…컨트롤 용이하게 설계



 프로젝트 레오나르도[사진=SIE]소니에서 장애인 접근성을 위한 하드웨어가 출시된다.소니인터랙티브엔터테인먼트는 CES 2023을 통해 게임 접근성을 더욱 높이기 위한 플레이스테이션5 프로젝트 레오나르도(Project Leonardo)를 발표했다.접근성 분야의 전문가, 커뮤니티 회원, 게임 개발자들이 함께 개발한 컨트롤러 키트 Project Leonardo는 장애가 있는 이용자가 보다 쉽고 편안하게 오랜 시간 게임을 즐길 수 있도록 도울 예정이다.이 컨트롤러는 타사 접근성 액세서리에 호환 가능하며 PS5 콘솔과 통합된다. 장시간 컨트롤러를 잡기 어렵거나, 버튼이나 트리거로 구성된 작은 클러스터를 정확하게 누르기 어려운 이용자, 신체적 움직임을 제어하는 데 제한이 있는 수많은 이용자가 직면한 문제를 해결하도록 설계됐다.우선 사용자 지정이 용이하다. 다채로운 모양과 크기의 아날로그 스틱 캡과 버튼을 비롯해 교체 가능한 견고한 키트가 포함됐다. 구성 요소를 최대한 활용해 다양한 컨트롤 레이아웃을 만들 수 있다.아날로그 스틱과 게임 패드의 거리를 취향에 맞게 조정할 수 있으며 구성 요소를 다양하게 시험해 보면서 자신의 힘, 동작 범위에 최적화된 구성을 만들 수 있다.소프트웨어 사용자 지정도 가능하다. PS5 콘솔에서 자신만의 Project Leonardo 플레이 경험에 맞게 선택할 수 있는 옵션이 마련된다.  컨트롤러 버튼은 원하는 대로 지정할 수 있으며 하나의 기능을 위해 여러 개의 버튼을 매핑할 수 있다. 두 가지 기능을 동일한 버튼에 매핑하는 것도 가능하다. 컨트롤 프로필을 설정하고 프로필 버튼을 눌러 쉽게 전환할 수 있으며 이용자는 PS5 콘솔에서 최대 3개의 제어 프로필을 저장하고 액세스할 수 있다.다른 장치 및 접근성 액세서리와 함께 작동한다. Project Leonardo는 독립형 컨트롤러로 사용하거나 추가적인 Project Leonardo 또는 듀얼센스(DualSense) 무선 컨트롤러와 페어링할 수 있다.최대 2개의 Project Leonardo 컨트롤러와 1개의 DualSense 무선 컨트롤러를 하나의 가상 컨트롤러로 동시에 사용할 수 있으므로, 이용자는 특정 게임 플레이 요구에 맞게 장치를 믹스 앤 매치하거나 다른 사람들과 함께 플레이할 수 있다. Project Leonardo는 현재 개발 중이며, 향후 상세한 제품 기능과 출시 시기 등 많은 정보들이 순차적으로 공개될 예정이다.한편 접근성은 글로벌 대형 플랫폼사들에 화두로 부상하고 있다. 마이크로소프트 역시 지난 2018년 '엑스박스 어댑티브 컨트롤러'를 출시해 장애 양상에 맞는 컨트롤러 시스템을 구축할 수 있도록 지원한 바 있다.소니는 게임 접근성 향상은 플레이스테이션이 매우 중요하게 생각하는 핵심 주제 중 하나로서, 접근성의 기준을 높이고 장벽을 낮추고 있다고 밝혔다. 앞서 소니는 갓 오브 워 라그나로크, 더 라스트 오브 어스 파트I과 같은 플레이스테이션 스튜디오 게임의 접근성 옵션을 선보인 바 있다.",105,https://n.news.naver.com/mnews/article/031/0000721303?sid=103
"美뉴스케일파워, 루마니아 SMR 엔지니어링 용역 계약",2023.01.06. 오후 5:19,"[이데일리 하지나 기자] 미국 뉴스케일파워는 루마니아 로파워 뉴클리어 (RoPower Nuclear)로 부터 SMR(Small Modular Reactor) 원전 건설을 위한 상세설계 전 단계인 엔지니어링 용역 계약을 체결했다고 6일 밝혔다. .로파워는 루마니아 원자력 공사(Societatea Nationala Nuclearelectrica)와 민간 전력 회사인 누바파워·가스 (Nova Power & Gas)가 합작한 회사이다. 이번 계약으로 뉴스케일파워는 향후 8개월 동안 루마니아 SMR 건설 예정지인 도이체스티 부지에 대한 환경 평가 및 지하 지질 공학 조사 등을 통해 SMR 건설의 기본 토대를 마련하는 한편, 계약이 마무리 되는 대로 SMR 건설에 본격적으로 나설 예정이다. 



존 홉킨스 뉴스케일파워 사장은 “이번 계약을 통해 루마니아 SMR 건설에 한발 더 나아가게 됐다” 며 “안전하고 신뢰할 수 있는 SMR 건설을 위해 최선을 다 할 것”이라고 밝혔다. 뉴스케일파워는 지난 2021년 11월 루마니아 원자력 공사와 SMR을 건설하는 합의서를 체결한 바 있으며, 지난해 6월에는 기술 검토 및 인·허가 등을 위한 추가 MOU를 맺었다.",105,https://n.news.naver.com/mnews/article/018/0005401669?sid=103
"""美 포시마크 인수 완료""…네이버 ‘고가 논란’ 잠재우나",2023.01.06. 오후 3:57,"현지 1위 패션 중고거래 플랫폼 업체1.67조에 인수···국내 인터넷업계 최대수익성 우려에 성장성 증명 나서""이미지검색·라방 적용해 사업 시너지""



포시마크. 웹사이트 캡처[서울경제] 네이버가 미국 최대의 패션(의류) 중고 거래 플랫폼 ‘포시마크’의 인수를 완료했다. 네이버는 앞서 국내 인터넷 업계 사상 최대 규모의 빅딜을 예고하면서 ‘고가 인수합병(M&A)’ 논란에 휩싸였는데 앞으로 본격적인 사업 연계를 통해 이를 해소하겠다는 계획이다.네이버가 포시마크를 지분 100% 자회사로 편입시켰다고 6일 밝혔다. 포시마크의 기업가치는 약 12억 달러(1조 5000억 원)이며 네이버가 포시마크의 가용 현금에 대한 대가를 포함해 주식을 취득한 금액은 13억 1000만 달러(1조 6700억 원)다. 네이버는 보유 현금과 차입금으로 인수 자금을 조달했다.포시마크는 미국 실리콘밸리에 본사를 둔 현지 1위 개인간거래(C2C) 플랫폼이다. 중고 거래 중개에 특유의 커뮤니티 기능을 접목해 8000만 명 이상의 이용자를 확보했다. 네이버는 지난해 10월 이 회사를 인수한다는 계획을 처음 공개하며 취득 금액이 16억 달러, 당시 환율로 2조 3400억 원에 이를 것이라고 했다. 하지만 당시 금액을 보수적으로 잡으면서 포함시켰던 각종 비용 일부가 실제로는 제외돼 취득 대가가 낮아졌고 최근 원·달러 환율도 내려가며 당초 계획보다 6700억 원 적은 금액에 회사를 사들이게 됐다.네이버는 인수 마감 시한이었던 올해 4월 초보다 3개월 빠르게 인수절차를 완료했다. 업계에서는 네이버가 고가 인수 논란을 해소하기 위해 조기 인수를 결정한 것이 아니냐는 분석이 나온다. 네이버와 포시마크 간 사업 연계를 서둘러 포시마크의 성장성을 증명하려 한다는 것이다. 이에 네이버 관계자는 “시한 내 절차를 완료했을 뿐 서둘러 마무리한 건 아니다”고 말했다.네이버 관계자는 “스마트렌즈·라이브커머스(생방송 쇼핑) 등 자사 기술을 포시마크에 근시일 내 우선적으로 적용해 서비스 품질을 향상시키겠다”고 말했다. 스마트렌즈는 네이버의 인공지능(AI)을 적용한 이미지 검색 기능이다. 포털처럼 포시마크 플랫폼에서도 이용자가 이미지만으로 원하는 상품을 찾을 수 있게 하겠다는 것이다. 수십만 중소상공인을 지원하며 쌓은 노하우를 접목해 라이브커머스 기능도 고도화한다.네이버는 크림(한국), 빈티지시티(일본) 등 서비스 및 왈라팝, 베스티에르 콜렉티브(유럽) 등에 대한 투자에 이어 포시마크까지 인수하면서 글로벌 C2C 경쟁력을 키우고 있다. 최수연 대표는 “북미 시장으로까지 포트폴리오를 확대하며 본격적인 글로벌 C2C 경쟁에 진출했다”고 전했다.",105,https://n.news.naver.com/mnews/article/011/0004142150?sid=103
"오태석 과기정통부 차관 ""차세대 원전 본격 육성…민간 참여 독려""",2023.01.06. 오전 7:20,"오태석 과학기술정보통신부 제1차관이 20일 오전 서울 종로구 세종대로 정부서울청사에서 국가우주위원회 관련 사전브리핑을 하고 있다. 오 차관은 이날 브리핑에서 국가우주위원회는 대통령의 정책방향을 구체적으로 실천해 나가기 위해 제4차 우주개발진흥기본계획과 우주산업 클러스터 지정, 초소형위성체계 개발계획 등 핵심정책을 심의 ·의결할 예정이라고 밝혔다. 2022.12.21/뉴스1 ⓒ News1 김명섭 기자(서울=뉴스1) = ""과기정통부는 12대 국가전략기술 중 하나로 지정한 차세대 원전을 본격적으로 육성해 나갈 계획이다.""과학기술정보통신부는 오태석 제1차관이 6일 서울 강남구에서 열린 '2023 원자력계 신년인사회'에 참석해 이같이 말했다고 밝혔다.신년인사회는 우크라이나 전쟁 이후 국내외 상황을 고려해 '에너지 안보와 기후위기 극복을 위한 선택―원자력(原子力)'을 주제로 열렸다. 이날 행사에는 오태석 과기정통부 차관, 박일준 산업부 차관, 임승철 원안위 사무처장을 비롯하여 이원욱, 김영식, 한무경, 정운천, 양금희 국회의원 등 정부와 국회, 산·학·연의 원자력계 관계자 등 200여명이 참석했다.오태석 차관은 신년사에서 ""최근 탄소중립, 글로벌 에너지 공급망 불안 등의 환경은 지난 60여년간 기저부하 전원으로 국가 발전에 이바지한 원자력에 더 많은 역할을 요구하고 있고, 그 중심에 소형 모듈 원자로(SMR)가 있다""며 ""소듐냉각고속로(SFR), 초고온가스로(VHTR) 등 그간 확보된 혁신원자력시스템 기술의 해외 사업화와 용융염원자로(MSR) 등 새로운 기술개발에 민간이 적극 참여해줄 것""이라고 당부했다.",105,https://n.news.naver.com/mnews/article/421/0006561523?sid=103
여의도 면적 25배 … 롯데 메타버스 온다,2023.01.06. 오후 5:44,"초실감형 서비스 연내 출시롯데그룹이 올해 말까지 서울 여의도 면적 25배에 달하는 가상 공간인 '롯데 메타버스'(가칭)를 선보인다. 유통과 엔터테인먼트 부문 강자인 롯데그룹이 메타버스 세계에서도 선두주자가 될 수 있을지 관심이 집중된다.5일(현지시간) 롯데그룹의 정보기술(IT) 서비스 계열사인 롯데정보통신의 노준형 대표는 미국 라스베이거스에서 열린 CES 2023 기자간담회에서 ""현재까지 메이저 플랫폼 업체들은 메타버스를 커뮤니티와 게임, 마케팅에 활용할 뿐 유통이나 엔터테인먼트 같은 실생활에 도움이 되는 영역으로는 구현하지 않고 있다""며 ""'초실감형'이라는 차원 높은 메타버스 서비스를 올해 말까지 선보여 시장에 폭발적인 반응을 일으킬 것""이라고 밝혔다.실제로 롯데정보통신은 올해 CES에서 현실과 거의 구분되지 않는 초실감형 가상세계를 구현했다. 여의도 크기의 가상 공간을 만들고 이곳에 가상 쇼핑 공간과 K팝을 즐길 수 있는 가상 무대 등을 선보인 것이다.이번에 공개된 가상 쇼핑 공간 '롯데면세'에는 MCM, 아크메드라비, 록시땅, 메이크업포에버 등 루이비통모에헤네시(LVMH) 코스메틱이 참여했다. 정교하게 묘사된 디지털 트윈을 통해 오프라인 매장을 가지 않고도 상품의 질감과 색조 등 상세한 정보를 얻을 수 있다.향후 롯데 메타버스가 상용화될 경우 사용자가 가상 쇼핑 공간을 통해 상품을 구매하면 '디지털 트윈'으로 아바타가 이를 소유하고, 실제 상품도 받아볼 수 있다. 가상 무대에는 JYP엔터테인먼트의 아이돌 그룹 엔믹스(NMIXX)와 글로벌 순위 4위의 세계적 DJ Alok이 출연한다. 6만5000명 이상의 아바타 관객과 함께 실감 나는 공연을 즐길 수 있다.",105,https://n.news.naver.com/mnews/article/009/0005071261?sid=103
"시몬팜, 천연물 항암면역 보조 주사제 '아이소렐' 이달 출시",2023.01.06. 오전 9:37,"오스트리아 허가 제품



의약품 유통 전문기업 시몬팜은 항암치료 과정에서의 부작용을 줄이고 면역력을 높이는 천연성분 항암면역 보조 주사제 '아이소렐'을 이달 출시한다고 6일 밝혔다. 오스트리아 제약사 루카스파마로부터 도입했다. 겨우살이 식물인 미슬토(Mistletoe)는 면역 기능을 활성화하고 암세포 사멸을 촉진시키는 것으로 알려져 있다고 했다. 줄기와 잎이 항암 치료제로 사용되며, 비스코톡신 렉틴 소포 다당류 알칼로이드 등이 함유돼 있다는 설명이다. 렉틴과 비스코톡신은 항암 작용을 보이는 주요 활성 물질이라고 했다.  미슬토 면역 항암요법은 1920년대 독일 의학자 루돌프 슈나이너 박사에 의해 연구가 시작됐으며, 이후 주사제로 개발돼 유럽을 중심으로 발전했다고 회사 측은 전했다. 국내 의대 부속병원과 종합병원, 암 전문 클리닉, 요양병원 등에서 사용되고 있다고 했다.정창호 시몬팜 대표는 ""미슬토 주사요법은 효과를 인정받아 오랜 기간 유럽에서 사용돼 왔다""며 ""아이소렐은 오스트리아 연방보건안전청에서 허가받은 전문의약품으로서, 품질을 인정받았다""고 말했다.",105,https://n.news.naver.com/mnews/article/015/0004796555?sid=103
카카오 무료서비스 전 국민 보상…이모티콘 1200만명 받았다,2023.01.06. 오후 7:11,"[디지털데일리 이나연 기자] 지난해 10월 발생한 서비스 장애를 사과하는 의미로 카카오가 전 국민에게 이모티콘 3종을 제공한 가운데, 이용자 1200만명이 이에 화답했다.    6일 업계에 따르면 카카오는 전날 카카오톡 더보기 탭에 위치한 카카오나우에서 ‘마음 선물팩’을 통해 인기 이모티콘 3종을 모든 이용자에 지급했다. 이에 따라 이용자는 ‘춘식이는프렌즈2’ 이모티콘을 영구 사용할 수 있다. ‘토심이와토뭉이’ ‘망그러진곰’은 다운로드 후 90일까지 이용 가능하다.    카카오는 “지금까지 1200만명 이용자가 참여하고 많은 피드백을 주었다”며 “이러한 의견들을 반영해 이용상 혼선을 제거하고 더 많은 이가 사용할 수 있도록 노력하겠다”고 밝혔다.    한편, 이날 카카오는 선택 제공 부문인 톡서랍 플러스 이용권에 대한 이용자 불만과 우려에 대해서도 답했다. 구독 서비스 특성상 톡서랍 플러스는 1개월 뒤 자동 정기결제로 넘어가도록 설정돼있어, 일부 이용자 사이에서는 결국 서비스 보상보다 프로모션 성격이 강한 것 아니냐는 지적이 나온 바 있다.    이와 관련해 카카오는 “구독 서비스는 최초 사용 때 자동 결제 수단 등록이 필요하지만, 사전 해지 예약 설정 기능을 통해 원치 않는 결제 전환을 방지할 수 있으며, 결제 전환 1주일, 1일 전 충분한 사전 안내를 해드릴 예정”이라고 설명했다.   이어 “톡서랍 플러스 이용이 처음이라면, ‘첫 달 무료’로 체험이 가능하고, 다음 1개월은 마음 패키지 이용권을 사용해 최대 2개월까지 사용할 수 있다”고 부연했다.    카카오에 따르면 톡서랍 플러스로 보관한 데이터는 이용기간 종료 후 바로 삭제되지 않고, 해지 후 30일간 백업데이터 다운로드 기간과 충분한 사전 알림을 제공해 데이터가 유실되는 것을 사전에 방지할 방침이다.",105,https://n.news.naver.com/mnews/article/138/0002140343?sid=103
