title,date,main,section,url
"日 샤프, 반도체·레이저 사업 분사",2018.12.28. 오전 11:14,"8K·AI·IoT 등 미래 수요에 대응(지디넷코리아=박영민 기자)일본 샤프(Sharp)가 반도체·레이저 사업부를 분사하기로 결정했다. 액정과 태양전지 사업에 몰두한 나머지 뒤처진 반도체·레이저 사업 경쟁력을 높이는 것이 목표다.28일 일본 산케이신문 보도에 따르면 샤프는 지난 26일 개최된 이사회를 통해 반도체 등 전자 디바이스 사업 일부와 레이저 사업부를 분사하기로 결정했다.샤프는 ""8K와 인공지능(AI), 사물인터넷(IoT) 등 사업환경 변화에 대응키 위해 현재 IoT 전자 디바이스 사업부에 속해 있는 반도체와 레이저 사업을 각각 신설 자회사로 흡수 분할해 분사할 것""이라며 ""보다 더 자율적인 사업 체제의 구축을 도모할 예정""이라고 설명했다.



(사진=일본 Sharp)반도체·레이저 사업부는 대규모 집적회로(LSI)·센서와 레이저 부품 등 2개 회사로 나뉘게 될 전망이다.이를 위해 샤프는 현재 자사 반도체 사업의 생산·개발 거점인 일본 히로시마현 후쿠야마시에 '샤프 후쿠야마 세미컨덕터(SFS)'와 '샤프 후쿠야마 레이저 주식회사(SFL)'를 내년 1윌 새로 설립할 계획이다. 이후 분사 목표 시점은 내년 4월이다.SFS사는 반도체 사업부에서 진행해 온 사업을 그대로 이어받는다. 반도체와 반도체 응용 장치, 모듈, 파운드리(반도체 수탁생산) 사업 등이다. 이 부서의 지난 3분기 매출액은 735억 엔(약 7천400억원)이었다. SFL사도 레이저·레이저 응용장치·모듈 사업을 계속해 맡는다.타이젱우 샤프 사장은 ""분사를 통해 국내외 기업과 폭넓게 협력할 것""이라고 밝혔다. 이는 향후 해외 기업과 협업을 통해 생산은 해외로 이관하고, 일본 현지에서는 개발에 집중하겠다는 뜻으로도 해석됐다.박영민 기자(pym@zdnet.co.kr)  ▶ 네이버 채널에서 ‘지디넷코리아’를 구독해주세요",105,https://n.news.naver.com/mnews/article/092/0002153398?sid=103
KT 화재 매출피해 놓고 위로금 vs 손해배상 '입장차' ,2018.12.28. 오후 4:48,"KT, 피해신고 6875건 접수...1월 중순에 위로금 지급 피해상인 ""카드 안되면 매출 없어"" 손해배상 요구



【서울=뉴시스】박영태 기자 = 28일 오전 서울 영등포구 여의도 국회 의원회관에서 KT아현지사 화재 관련 중소상인 피해 대책 마련 간담회가 열리고 있다. 2018.12.28.since1999@newsis.com【서울=뉴시스】이국현 기자 = KT가 아현지사 통신구 화재와 관련해 요금 감면과 위로금 지급 계획을 밝힌 가운데 매출피해를 입은 상인들이 위로금이 아닌 손해배상을 요구하며 강력히 반발하고 나섰다. 피해 상인들은 28일 노웅래 국회 과학기술정보방송통신위원회 위원장이 주최한 'KT 화재 관련 중소상인 피해 대책 마련 간담회'에 참석해 이같이 밝혔다. 이날 이은표 KT불통피해상인대책위원회 공동위원장은 ""KT 화재로 장사를 망쳐 경영이 어려워지고 가게 문을 닫은 곳도 있다""며 ""손해 배상이 아니라 위로금을 지급한다니 어이가 없고 화가 난다""고 분통을 터트렸다. 강계명 서울지하도상가상인연합회장 역시 ""상인들이 장사할 시간에 여기에 온 것은 실질적 피해배상을 해주겠다는 답을 듣기 위해서다. 위로금 달라고 온 게 아니다. 우리 거지 아니다""며 ""손해사정인을 선정해 피해를 객관적으로 산정하고 배상해야 한다""고 성토했다.  중소상인업체 관계자는 ""카드결제가 안되면 그날 매출이 없는 것""이라며 ""자영업자 입장에선 이틀 동안 영업이익이 한달 생활비일 수 있는 만큼 이에 대한 책임을 져야 한다""고 요구했다. 반면 KT는 요금 감면과 위로금을 지급하겠다는 입장을 재차 확인했다. 앞서 KT는 화재로 전화 주문과 카드 결제 등 영업 손실을 입은 연 매출 5억원 이하 소상공인의 피해를 접수한 뒤 위로금을 지급키로 했다. 유무선 가입고객에는 1개월 이용요금을, 화재로 소실된 동케이블 기반 유선서비스 가입자에게 최대 6개월치 요금을 감면하기로 했다. 이승용 KT 전무는 ""KT는 5억원 이하 상인을 대상으로 피해 신고를 접수한 결과 6875건을 접수했다""며 ""검증과 보정 작업, 관계부처와 협조를 거쳐 내년 1월 10일께 위로금을 지급할 수 있는 대상자를 특정하고, 1월 중순 이후에는 위로금을 지급할 수 있을 것으로 보인다""고 밝혔다. 한편 이날 간담회를 주최한 노웅래 위원장은 ""KT는 도의적 차원의 위로금이 아닌 불법에 상응하는 배상금을 지급하는 것이 마땅하다""며 ""특정 손해배상, 직접 영업피해 보상과 함께 정신적 피해 보상도 해야한다""고 주장했다.lgh@newsis.com▶ 뉴시스 빅데이터 MSI 주가시세표 바로가기 ▶ 네이버에서 뉴시스 채널 구독하기<저작권자ⓒ 공감언론 뉴시스통신사. 무단전재-재배포 금지.>",105,https://n.news.naver.com/mnews/article/003/0008984759?sid=103
[인사]중소벤처기업부,2018.12.28. 오후 2:20,◇중소벤처기업부 <과장직위 승진> △국제협력담당관 진수웅 디지털타임스 홈페이지 바로가기 / 디지털타임스 뉴스 더보기네이버 채널에서 '디지털타임스'를 구독해주세요.,105,https://n.news.naver.com/mnews/article/029/0002500356?sid=103
"위닉스, 2019년형 제로 2.0 공기청정기 출시",2018.12.28. 오전 10:39,"시각장애인 위한 점자 버튼 추가…집진필터 면적도↑(지디넷코리아=김승민 기자)국내 생활가전기업 위닉스는 2019년형 제로 2.0 공기청정기를 출시했다고 28일 밝혔다.제로시리즈 공기청정기는 합리적인 가격, 품질 등 입소문에 힘입어 판매가 급증한 위닉스 대표 공기청정기 모델이다.2019년형 제로 2.0은 기존 제로의 업그레이드 버전이다. 마이크로 집진필터 면적 증가로 1㎡ 당 소비전력을 약 20% 낮췄고 초미세먼지를 99.9% 이상 제거할 수 있다. 시각장애인용 점자버튼을 추가한 것도 특징이다.



국내 생활가전기업 위닉스는 2019년형 제로 2.0 공기청정기를 출시했다고 28일 밝혔다.(사진=위닉스)위닉스 관계자는 “미세먼지 문제가 날로 심각해지는 가운데 공기청정기가 필수 가전으로 자리 잡고 있는 상황에서 누구나 편리하게 사용할 수 있도록 판매율이 가장 높은 제로2.0공기청정기에 ‘점자버튼’을 추가했다”고 전했다.신제품에 적용된 시각장애인을 위한 점자버튼과 음성가이드는 한국시각장애인협회 자문을 받아 적용했다.위닉스는 이번 제품 출시와 함께 기부 캠페인도 진행했다. 위닉스는 지난 19일 경기도시각장애인협회와 제품 출시 후 3개월간 100대 판매될 때마다 공기청정기 1대를 경기도시각장애인협회에 기부하는 파트너십을 맺었다. 제로 2.0이 10만대 이상 판매된 만큼 캠페인 효과도 높을 것으로 기대된다.위닉스는 새해 맑은하늘 맑은웃음 어린이 문예공모전, 공기톡톡콘서트 등 다양한 사회공헌도 펼칠 계획이다.위닉스 관계자는 “맑은 공기를 주제로 가족과 어린이를 위한 ‘어린이 그림대회’와, 미세먼지를 주제로 소비자가 원하는 다양한 정보를 제공해 온 ‘공기톡톡콘서트’는 위닉스 대표 환경캠페인으로 자리매김했다”며 “내년 4월에 진행될 제7회 공기톡톡콘서트는 미세먼지와 관련한 유명인들을 모시고 참석자들이 흥미로워할 수 있는 여러 가지 주제로 이야기 나눌 수 있는 특별한 자리가 될 것”이라고 말했다.김승민 기자(ksm@zdnet.co.kr)  ▶ 네이버 채널에서 ‘지디넷코리아’를 구독해주세요",105,https://n.news.naver.com/mnews/article/092/0002153390?sid=103
'라돈침대' 재발 막는다···방사선물질 포함 제품 안전규제 강화,2018.12.28. 오후 5:19,"신용현 국회 과학기술정보방송통신위 간사, 대표발의 '라돈침대방지법' 통과""방사선 물질 관련 제조나 수출입 업자 체계적 관리..종사자 건강검진 의무화""



신용현 국회 과학기술정보방송통신위원회 간사[서울경제] 라돈 등 방사선 물질이 포함된 가공제품을 제조 또는 수·출입하는 업자에 대한 안전규제가 강화된다. 올해 ‘라돈침대 사태’로 생활용품의 안전성에 대한 우려가 커지는 상황이어서 주목된다. 국회 과학기술정보방송통신위원회 간사인 신용현 바른미래당 의원은 자신이 대표 발의한 뒤 통합·조정 작업을 거친 ‘라돈침대방지법’(생활주변방사선 안전관리법 일부개정안)’이 27일 국회 본회의를 통과했다고 28일 밝혔다.이 법은 원료물질이나 공정부산물을 사용한 가공제품을 제조·수출입하는 업자에게 원자력안전위원회(원안위) 등록을 의무화했다. 가공제품 제조업자 등은 종사자의  건강을 보호하기 위한 조치도 실행해야 한다. 그동안에는 원료물질이나 공정 부산물을 수출입 또는 판매하는 자(취급자)에 대해 원안위가 방사선 물질 이용 가공제품의 안전 기준만 규정하고 등록 등 관리절차를 마련하지 않았다. 수출입, 유통·처리·처분·재활용 신고를 받아 관리한다고 했으나 ‘라돈침대’ 사태에 무방비였다는 비판을 받았다.신용현 의원은 “침대, 베개 등에서 라돈이 검출되며 생활방사선 안전에 대한 사회적 불안이 커졌다”며 “생활방사선법이 국회를 통과해 가공제품 제조나 수·출입업자에 대한 체계적 관리가 가능해지게 됐다”고 의미를 부여했다. 그는 이어 “방사선 물질에 대한 국민의 두려움을 어느 정도 해소할 수 있게 됐다”며 “라돈침대 회수 과정에서 부각된 종사자의 건강 문제도 해결하기 위해 건강검진 의무화 조항을 담았다”고 덧붙였다. /고광본 선임기자 kbgo@sedaily.com[서울경제 바로가기]애플워치4가 쏟아집니다! 서울경제썸 유튜브 구독 이벤트 [바로가기▶]Telegram으로 서울경제 뉴스를 실시간으로 받아보세요 [바로가기▶]저작권자 ⓒ 서울경제, 무단 전재 및 재배포 금지",105,https://n.news.naver.com/mnews/article/011/0003475042?sid=103
국세청 홈택스에 무설치 기반의 클라우드 전자서명 오픈,2018.12.28. 오후 12:34,"연말정산, 장소와 시간에 상관없이 무료로 클라우드인증서 사용한국전자인증이 공급[이데일리 김현아 기자]



한국전자인증(대표 신홍식)이 간편 전자서명 서비스인 클라우드사인(CloudSign)을 국세청 홈택스에 오픈했다.클라우드사인은 PC 환경에서 별도의 프로그램 설치가 필요 없으며 글로벌 간편인증 기술인 바이오인증(FIDO) 기술을 통해 지문이나 간편비밀번호만으로 전자서명을 이용할 수 있다.홈택스 이용 방법은 매우 간단하다.이용자가 클라우드사인에 무료로 가입한 후에 홈택스의 ‘클라우드’ 로그인 방식을 선택해 스마트폰 전화번호를 입력하고 지문인증 또는 간편비밀번호로 인증서를 확인하면 로그인이 되는 방식이다.최근 과학기술정통부는 웹표준 준수를 위한 가이드라인을 배포한 바 있는데, 한국전자인증의 클라우드사인은 웹표준을 준수할 뿐 아니라 인증서 저장 및 접근 방법에 대한 글로벌 표준을 준수한다. 보안성 강화를 위해 글로벌인증평가인 ‘WebTrust Audit’ 과 ISMS 인증평가를 받은 자체 시큐어인증센터에서 클라우드 서비스를 제공한다. 인증서는 하드웨어보안모듈(HSM)에 보관하고 있다.클라우드 전자서명 서비스는 클라우드 기반의 문서작성 후 문서서명과 계약을 위해 국내 뿐만 아니라 글로벌기업들도 앞다퉈 도입하고 있으며 Adobe사나 GlobalSign 등 글로벌 인증서비스 기관들도 이미 서비스를 오픈했다.안군식 본부장은 “국민들에게 편리한 전자서명 서비스를 무료로 제공하게 되어 무척 기쁘게 생각하며 글로벌한 추세인 만큼 앞으로 정부24, 대법원 등 공공서비스, 은행/카드/보험 등 금융서비스에서도 더 확산될 것으로 기대한다”고 말했다. 한국전자인증은 오픈을 기념하여 연말정산 기간 동안 특별 이벤트도 진행한다.김현아 (chaos@edaily.co.kr)네이버에서 이데일리 [구독하기▶]빡침해소! 청춘뉘우스~ [스냅타임▶]＜ⓒ종합 경제정보 미디어 이데일리 - 무단전재 & 재배포 금지＞",105,https://n.news.naver.com/mnews/article/018/0004281315?sid=103
[2018결산]재미로 보는 포모스 2018 어워드,2018.12.28. 오후 2:30,"지난해 포모스에서 처음으로 선보였던 '포모스' 어워드는 한 해를 마무리하며 주목받지 못한 게임부터 아쉬움을 남긴 게임에 지면으로나마 상을 전한 바 있다.올해 역시 바쁘게 달려온 게임업계를 위해 작은 상을 마련했으며 내년에도 흥미로운 게임들과 좋은 소식들이 이어지길 기대해본다.'좋은놈, 나쁜놈, 이상한놈 상' - 한국 지사를 통해 정식 판매 중인 콘솔 3사에 부여하는 상'맛은...굉장히 안정적이야' 상 - 구내식당 취재를 통해 인상적인 식사를 제공한 게임사에 주는 상'그 선 넘으면 정색이야' 상 - 신작에 대한 기대감을 정색으로 바꾼 게임사에 주는 상'내가 마 다했어 마' 상 - 마케팅이란 무엇인가, 게임 프로모션의 끝을 보여준 게임사에 주는 상'올해의 발견' 상 - 올해 등장한 게임 중 인상적인 게임에 바치는 상◆ '좋은놈, 나쁜놈, 이상한놈 상' - 소니, 닌텐도, 엑스박스(차례대로)



작년에 이어 올해도 콘솔 게이머에게 있어 행복한 한 해로 불릴 만큼 각종 대형 타이틀이 쏟아진 시기였다.소니(SIEK) 진영의 경우 '갓 오브 워' '스파이더맨'과 같은 양질의 독점 타이틀 한글화를 통해 유저들에게 인정받으며 올 한해 가장 바쁘게 움직인 콘솔 게임사였다. 근래의 노력이 아닌 꾸준히 척박한 콘솔 시장에서 꾸준히 노력한 결과 의미 있는 성과를 보여주고 있기에 팬들 사이에서는 좋은 게임사라는 인식이 이어지고 있다.반면 한국닌텐도의 경우 DS 시절 이후 다수의 시간이 지났음에도 불구하고 여전히 아쉬운 서비스를 보여주고 있다. 신형 게임기인 닌텐도 스위치의 경우 국내에서 기록적인 판매 성과에도 불구하고 여전히 본체 OS는 영어만 지원하며 제대로 된 E샵도 열리지 않아 한국 유저를 국적 없는 난민으로 만들어 서비스 면에 있어서는 가장 떨어지는 상황이다. 이제 그만 집나간 서비스 '미정'이를 찾아야 할 때다.마지막으로 엑스박스의 경우 소니와 같이 주요 타이틀에 대해서는 적극적으로 한글화를 진행하며 의욕적인 모습을 보여주는 듯하나 그 이상의 행보는 없었다. 특히 국내 유저를 위한 오프라인 행사가 몇 년 전부터 뚝 끊겨 알다가도 모를 게임사로 남았다.◆ '맛은...굉장히 안정적이야' 상 - 넥슨 구내식당



올해 포모스는 10월 공채시즌을 맞아 구내식당 탐방기라는 코너를 한 달간 진행했었다. 넥슨을 시작으로 네오위즈, NHN엔터테인먼트, 스마일게이트를 찾아봤으며 영양사님의 가호 아래 다양한 음식들을 맛볼 수 있었다.가장 인상적인 맛을 느낄 수 있었던 곳은 넥슨의 구내식당으로 깔끔한 국물맛이 일품이었던 '소고기 버섯전골'부터 초딩입맛을 저격하는 '철판 핫도그 떡볶이'까지 거를 타선이 없는 식단을 선보였다.또, 이날의 하이라이트 메뉴였던 '아몬드 크럼블 치킨 커틀릿'은 포모스 인근 식당에서도 제발 팔아줬으면 하는 바람이 들 정도였다. 영양사님에게 항상 감사하길 바란다.◆ '그 선 넘으면 정색이야' 상 - 디아블로 이모탈



블리자드의 게임을 좋아하는 유저에게 블리즈컨은 늘 기대와 설렘이 가득한 행사다. 매번 미국에서 진행되기에 밤새 블리즈컨을 기다리는 유저 역시 적지 않았다.특히, 올해 블리즈컨 2018에서는 '디아블로' 관련 발표가 이어질 것이라는 공식 발표와 함께 팬들의 기대감을 높이는 각종 루머들이 등장해 누가 봐도 '디아블로' 신작이 등장할 가능성이 높아 보였다.하지만 정작 나온 것은 '디아블로 2 리마스터'나 '디아블로 4'도 아닌 모바일게임 '디아블로 이모탈'이었으며 새벽까지 관련 소식을 지켜보던 유저들은 ""내가 이런 걸 기대했냐""며 ""자괴감 들고 괴롭다""는 등 아쉬움을 토로했다.넘지 말아야 할 선을 넘어 유저들에게 정색을 안겨준 블리자드에게 이 상을 제공한다.◆ '내가 마 다했어 마' 상 - 포트나이트



에픽게임즈가 '포트나이트'의 국내 출시를 앞두고 선보인 대규모 마케팅은 흥행 성과를 떠나 인상적이라는 평가를 하기 충분하다.영화 '가디언즈 오브 갤럭시'를 통해 '스타로드'로 유명세를 떨친 크리스 프렛을 고용해 '포륀이들'이라는 도발적인 광고를 선보이는가 하면 지스타에 참가해 '포트나이트' 테마로 꾸민 거대 부스를 선보였다.이것만으로는 모자란 지 지난 15일에는 서울 화정 체육관에서 '포트나이트 코리아'를 오픈하며 게임사가 할 수 있는 모든 마케팅을 진행했다. 지금도 TV를 켜면 심심치 않게 흘러나오는 '빵원' 광고를 보며 에픽게임즈의 물량 공세 마케팅이 현재 진행형으로 이어지고 있음을 엿볼 수 있다.◆ '올해의 발견' 상 - 플로렌스



인생 게임은 많지만 인생을 이야기하는 게임은 많이 없었다. 모바일 인디 게임에 혜성처럼 등장한 '플로렌스'는 연애에서 이별로 이어지는 평범한 사랑의 이야기를 담담히 표현하며 주목받은 게임이다.첫 데이트의 두근거리는 순간부터 이별의 아픔까지 세밀한 감정의 표현을 게임의 형태로 만나볼 수 있어 연애에 쓰라린 경험이 있는 사람이라면 누구나 자기 이야기처럼 착각하게 만드는 스토리텔링을 지녔다.사랑을 시작하는 것만큼이나 이별을 받아들여 성장하는 것 또한 아름답다는 걸 보여준 '플로렌스'는 드디어 게임 업계에서도 평범한 삶을 주제로도 뛰어난 게임을 만들 수 있다는 걸 보여준 작품이다.최종봉 기자 konako12@fomos.co.kr[게임&게이머, 문화를 전합니다. 포모스게임│무단 전재 및 재배포 금지]포모스",105,https://n.news.naver.com/mnews/article/236/0000182537?sid=103
"KB금융, 사외이사 선출 작업 시작",2018.12.28. 오전 10:30,"인선자문위원회 구성 등 사외이사 후보 평가(지디넷코리아=손예술 기자)KB금융지주 사외이사후보추천위원회(사추위)가 내년 3월 정기 주주총회에서 신임 사외이사 1명을 뽑기 위해 인선자문위원을 선정했다고 28일 밝혔다.현재 사외이사로 역임하고 있는 유석렬·스튜어트 솔로몬·박재하 이사는 내년 3월 임기가 만료되며, 중임 의사를 전달했다. 한종수 이사만 일신상의 이유로 이사 중임을 고사했다.사추위는 중임 의사를 밝힌 3명의 사외이사를 후보로 확정했으며, 신임 이사를 뽑기 위해 외부전문가로 구성된 인선자문위원회를 선정했다. 사추위는 사외이사 후보자들에 대한 인선자문위원의 평가 결과 집계, 평판 조회, 자격검증 등을 위해 세 차례 더 개최되며 내년 2월 중 사외이사 후보 추천 절차를 마무리할 계획이다.



KB금융지주 사외이사 후보 추천 프로세스.(자료=KB금융지주)이후 후보자가 결격사유 심사를 통과하게 되면 2019년 3월 정기 주주총회에 사외이사 후보로 최종 추천된다.KB금융은 사외이사 후보군을 매년 2회 상시 관리하고 있다. 주주와 외부 전문기관 추천을 통해 후보군을 구성하며 ▲금융경영 ▲재무 ▲회계 ▲법률·규제 ▲리스크 관리 ▲HR ▲IT ▲소비자보호 등 총 8개 전문분야로 관리 중이다.이번 사임 의사를 밝힌 한종수 사외이사가 회계 전문가인만큼, 이사회 구성의 다양성과 전문성 유지를 위해 금번 신임 사외이사 후보 추천은 회계 분야의 후보군 가운데에서 이뤄질 것으로 KB금융지주 측은 관측하고 있다.KB금융지주 측은 ""KB금융지주 주식을 1주 이상 보유한 주주라면 사외이사 후보를 추천할 수 있는 제도를 운영 중""이라고 설명했다.손예술 기자(kunst@zdnet.co.kr)  ▶ 네이버 채널에서 ‘지디넷코리아’를 구독해주세요",105,https://n.news.naver.com/mnews/article/092/0002153383?sid=103
강은비 '인터뷰와 실시간 소통을 동시에',2018.12.28. 오후 2:17,"(서울=뉴스1) 신웅수 기자 = BJ 강은비가 28일 오후 서울 서초구 aT센터에서 열린 2018 아프리카TV BJ 어워드에 앞서 언론 인터뷰를 하고 있다.강은비는 버라이어티BJ 여성부문과 신인상을 수상했다. 2018.12.28/뉴스1phonalist@news1.kr▶ [ 크립토허브 ]  [ 터닝포인트 2019 ] ▶ 에어팟&스타벅스 커피 경품(~1/25)[© 뉴스1코리아(news1.kr), 무단 전재 및 재배포 금지]",105,https://n.news.naver.com/mnews/article/421/0003760176?sid=103
[인사] 한국원자력의학원,2018.12.28. 오후 6:30,◇ 한국원자력의학원 △원자력병원장 홍영준 △전략기획실장 배근량[고재원 기자  jawon1212@donga.com],105,https://n.news.naver.com/mnews/article/584/0000002745?sid=103
"큐렉소 인공관절 수술로봇 신제품, 美 FDA 슬관절수술 임상 마쳐",2018.12.28. 오후 4:49,"의료로봇 전문기업 큐렉소(060280)가 인공관절 수술로봇 티솔루션원의 식품의약국(FDA) 허가를 위한 슬관절 인공관절치환수술 임상시험을 성공적으로 마쳤다고 28일 밝혔다.이 회사는 내년 슬관절수술용 로봇 티솔루션원의 미국 판매 허가를 노리고 있다.이번 임상은 큐렉소의 관계회사 티에스아이(TSI)가 티솔루션원을 이용한 슬관절 인공관절치환수술의 안전성과 효능을 평가하기 위해 진행했다. 티에스아이는 작년 3월 세인트빈센트 체리티 메디컬센터에서의 수술을 시작으로 미국 내 6개 병원에서 임상을 시행해왔다. 지난 20일 목표치인 115명에 대한 수술을 마무리했다.



큐렉소의 인공관절 수술로봇 ‘TSolutionOne’(티솔루션원). /큐렉소 제공회사는 임상에 참여한 환자의 예후를 6개월 동안 확인한 뒤 내년 2분기에 슬관절에 대한 FDA 허가를 신청할 예정이다. 또 임상을 시행한 미국 내 6개 병원 및 의료진과 지속적으로 협력해 트레이닝 병원으로 활용하는 것은 물론 최적의 제품 사용법을 개발할 계획이다.티에스아이는 2015년 10월 티솔루션원을 활용한 고관절용 수술에 대해 FDA로부터 판매 승인을 받은 바 있다.회사 관계자는 ""고관절 제품에 대한 개선점을 확인했으나 투자 효율화를 위해 우선 슬관절 제품 개발 및 임상에 집중했다""며 ""미국 임상에서 사용자 만족도가 높았던 만큼 내년 판매 허가를 받으면 미국에서 매출을 기대할 수 있을 것""이라고 했다.티솔루션원 슬관절 제품은 현재 국내 2개 병원이 도입했으며 최근 추가로 3대를 판매했다. 이를 포홈하면 올해 총 6대의 정형외과 수술로봇을 설치한 것이다. 현재 티솔루션원을 포함한 인공관절 수술로봇은 국내 17개 병원에 19대가 설치돼 있다.[허지윤 기자 jjyy@chosunbiz.com]chosunbiz.com",105,https://n.news.naver.com/mnews/article/366/0000423374?sid=103
