title,date,main,section,url
"KT 롤랩, AI 기반 '브로캐리'로 화물 중개·운송 디지털 전환 돕는다",2022.05.09. 오전 9:36,"KT그룹의 디지털 물류 플랫폼 전문기업 롤랩(lolab)이 인공지능(AI) 플랫폼 기반 화물 중개∙운송 서비스 '브로캐리'(Brokarry)를 출시했다고 9일 밝혔다.(KT 제공) © 뉴스1(서울=뉴스1) 윤지원 기자 = KT가 자회사를 통해 화물의 중개와 운송을 지원하는 인공지능(AI) 기반의 신규 서비스를 출시했다. KT그룹의 디지털 물류 플랫폼 전문기업 '롤랩'(lolab)은 AI 플랫폼 기반 화물 중개∙운송 서비스 '브로캐리'(Brokarry)를 출시했다고 9일 밝혔다.롤랩은 지난해 KT가 물류시장의 디지털 전환을 주도하기 위해 설립한 디지털 물류 플랫폼 전문기업이다. 통합 물류 서비스 제공 및 물류시장의 효율성 개선에 앞장서고 있으며 국내외 물류 전문기업과 협업해 사업 영역을 확장하고 있다.이번에 롤랩이 출시한 브로캐리 서비스는 화물을 발송하는 화주와 화물을 운송하는 차주를 연결해 책임지고 운송해주는 화물 중개∙운송 서비스다. 신속한 화물 운송이 가능하고 정산 및 지급까지 최단기간 내 처리할 수 있다는 게 롤랩 측 설명이다.이번 서비스 구현을 위해 롤랩은 AI, 빅데이터 등 KT의 최첨단 정보통신기술(ICT)을 기반으로 AI 최적 매칭 플랫폼을 KT와 공동 개발했다. 화주가 브로캐리의 오픈형 주문 시스템에 화물을 등록하면 이를 차주 데이터베이스(DB)와 연동해 AI 플랫폼이 맞춤형 매칭을 제공하는 식이다. 롤랩은 특히 편의성을 높이고 화주와 차주 모두에게 이익이 되는 상생형 사업모델을 추구하겠다는 구상이다. 화주에게는 AI 플랫폼을 통해 최적의 요금제로 투명하게 과금하고 최적의 차량 매칭으로 운용 효율성을 개선해준다. 또 정산 대행 서비스를 제공해 화주의 업무 부담을 줄이고 단순 중개를 넘어 책임 운송 보장을 통해 서비스의 신뢰도를 높인다는 설명이다. 또 차주에게는 AI 플랫폼 기반으로 맞춤형 물량을 제공해 공차 운행을 최소화할 수 있도록 지원한다. KT그룹 내 BC카드∙스마트로와 손잡고 운송 완료 시 국내 최초 익일 운임 지급을 보장해 운임 지급 지연이나 미지급 등의 문제를 해결해준다.롤랩은 KT와의 협력을 통해 플랫폼을 지속해서 고도화할 예정이다. 차량 위치 기반 실시간 AI 배차, 서비스 내 화물차 특화 내비게이션 탑재 등으로 서비스를 추가 확장한다. 신규 물류사업도 공동 개발해 물류시장 디지털 전환을 선도해 나갈 계획이다.최강림 롤랩 대표는 ""물류시장은 급속도로 성장하고 있지만 아날로그 방식을 답습하며 대다수 물류 종사자들이 고비용·저효율의 이중고를 겪고 있어 디지털 전환이 시급한 분야라고 판단했다""며 ""KT그룹이 보유한 기술과 롤랩의 현장 노하우를 결합해 화주와 차주 모두에게 더 나은 가치를 제공하고 국내 운송 경쟁력을 한 단계 끌어올리는 데 기여할 수 있도록 최선을 다하겠다""고 말했다.송재호 KT AI·DX융합사업부문장(부사장)은 ""KT는 디지털 전환을 통해 일하는 방식의 변화와 산업의 혁신을 주도하고 이를 고객과 함께하는 준비된 파트너""라며 ""특히 지난 10년간 축적한 방대한 AI와 빅데이터 등 IT 기술을 물류산업에 이식해 앞으로도 물류시장 내 다양한 파트너들과 함께 디지털 물류의 새 지평을 열겠다""고 밝혔다.",105,https://n.news.naver.com/mnews/article/421/0006078394?sid=103
애플 뮤직 '공간음향' K팝 플레이리스트 공개…BTS·세븐틴 포함,2022.05.09. 오전 11:44,"애플 뮤직 '공간음향' K팝 플레이리스트 공개 (애플 제공)© 뉴스1(서울=뉴스1) 오현주 기자 = 애플은 자체 음악 스트리밍 플랫폼 애플뮤직에 공간 음향 기술로 제작한 곡을 담은 '공간 음향으로 듣기 : K-팝' 플레이리스트를 공개했다고 9일 밝혔다. 플레이리스트는 Δ방탄소년단(BTS) Δ세븐틴 Δ싸이 등 국내 유명 아티스트가 부른 노래에 '돌비 애트모스 기술'을 입힌 음원으로 구성됐다. 이 기술은 미국 오디오 기술 기업인 '돌비'가 만든 것으로, 청취자가 모든 방향에서 소리를 생생하게 들을 수 있도록 돕는다. 국내 애플뮤직에서는 지난해 5월 처음 적용됐다. 애플 뮤직 구독자라면 누구나 Δ아이폰 Δ아이패드 Δ맥 등 애플 기기에서 모든 공간 음향 음원을 감상할 수 있다. 특히 공간 음향을 지원하는 에어팟과 H1 또는 W1 오디오 칩을 탑재한 비츠 헤드폰으로 청취시 자동으로 공간 음향 기술이 적용된 노래가 재생된다. 공간 음향 음원은 이미 애플 뮤직에서 인기를 끌고 있다. 올해 기준 애플 뮤직의 전세계 '오늘의 Top 100' 차트의 상위 10곡 중 73%가 공간 음향 기술이 적용됐다.  애플 측은 ""이번 플레이리스트로 전 세계 애플 뮤직 구독자는 강렬하고 밝고 활기찬 K팝 특유의 사운드를 한 차원 높아진 사운드로 더욱 손쉽게 감상할 수 있게 됐다""며 ""공간 음향은 모든 방향에서 소리를 들을 수 있어 콘서트장 한 가운데 있는 것과 같은 몰입형 청취 경험을 제공할 것""이라고 말했다.",105,https://n.news.naver.com/mnews/article/421/0006079017?sid=103
"배민, '클릭 당 광고' 적용 범위 확대…""비용 부담 메운다""",2022.05.09. 오후 6:19,"지난달 출시한 '우리가게클릭', 배민원 이용 점주도 신청 가능배달의민족(배민) 운영사 우아한형제들이 소비자 클릭 횟수에 따라 비용을 책정하는 새로운 광고 상품 ‘우리가게클릭’의 적용 범위를 확대한다.이 상품은 당초 중개 서비스 이용 점주를 대상으로 출시했는데, ‘단건 배달’ 배민원(1)을 이용하는 자영업자도 신청 가능하도록 했다. 배민의 새로운 비즈니스모델(BM)이 될 것이란 분석이 나온다.9일 배달 업계에 따르면 우아한형제들은 배민원을 쓰는 점주가 CPC(Cost per click) 과금 방식의 광고 서비스 우리가게클릭 신청이 가능하게끔 최근 이용 약관을 개정했다. 우리가게클릭은 앱에서 소비자에게 더 많이 가게를 드러내길 희망하는 음식점 사장들이 이용할 수 있는 부가 서비스다.점주들은 추가로 비용을 지불해, 앱 지면에 광고 빈도수를 높일 수 있다. 노출 기간은 한 달이다. 예산은 최소 5만~300만원, 클릭당 희망 광고 금액은 최소 200원에서 최대 600원까지 설정할 수 있다. 고객이 앱에서 가게를 누르면, 설정한 예산에서 금액이 차감된다.



(사진=지디넷코리아)우리가게클릭은 지난달 28일 출시, 11일까지 무료로 시범 운영된다. 원래 이 상품은 오픈리스트 이용 점주만 신청할 수 있었다. 오픈리스트는 사장이 주문건당 6.8% 수수료를 내는 배민 정률제 광고 상품으로, 일반(묶음) 배달 서비스 중개수수료다.배민원의 경우, 단순 중개(일반)와 달리 배민과 직접 계약한 배달원(라이더)이 곁들여져 추가 비용이 책정된다. 배민이 우리가게클릭 이용 영역을 확장한 건, 지난해 배민원 서비스 출시 후 불어난 비용 부담을 덜어내기 위한 전략으로 읽힌다.단건 배달 경쟁이 들끓던 지난해, 배민 라이더 자회사 우아한청년들 영업비용은 7천123억원으로 전년 대비 154% 늘었다. 외주용역비와 교육훈련비는 재작년 대비 순서대로 216%, 101%가량 증가한 5천741억원, 118억원으로 집계됐다. 빠른 배달 사업 파이를 키우고자, 관련 지출이 치솟은 것.



(사진=지디넷코리아)단건 배달 서비스를 이용하는 자영업자에게도 광고 상품을 내놓으며, 수익성 개선을 꾀하겠단 움직임이다. 배민원 이용 점주는 12일부터 우리가게클릭을 신청할 수 있다. 자영업자 커뮤니티 ‘아프니까 사장이다’에 따르면 우리가게클릭 실효성을 두고, 점주들 사이에선 주문 숫자가 늘었다는 의견과 클릭 대비 배달 증대 효과가 저조하단 목소리가 공존하고 있다.업계 관계자는 ""코로나19 확산 후 배달 산업 규모가 커지면서, 플랫폼 사업자는 자영업자와 라이더를 위한 여러 지원책을 선보여왔다""면서 ""CPC 광고 적용 범위를 확대한 건, 비용 부담을 메우기 위한 조처다. 향후 배민 핵심 BM으로 자리매김할 것""으로 전망했다.",105,https://n.news.naver.com/mnews/article/092/0002256208?sid=103
"[이상직 변호사의 DX문화살롱](17)AI 시대, 인간의 자아(自我)",2022.05.09. 오후 4:02,"인공지능(AI)은 인간의 정신활동을 모방한다. 그래서 AI가 무엇인지 알기 위해서는 먼저 인간을 알아야 한다. 각각의 인간을 보면 나약하고, 생로병사의 고통에 시달린다. 다른 사람과 어울리지 못하면 생존하기 어렵다. 타인이라는 거울 없이 자신을 인식하지 못한다. 공동체에서 칭찬을 받거나 부러움의 대상이 되고, 사랑하는 사람의 달콤한 속삭임을 듣는 등 '타인'으로부터 인정받을 때 자아를 느낀다. 독일 철학자 헤겔은 타인의 인정을 받으려고 끊임없이 생사를 건 투쟁을 하는 것이 인간이라고 했다. 그러나 타인이 원하는 것을 나도 원하는 삶이 해피엔딩이 될 수 있을까. 자신은 타인을 인정하지 않으면서 타인이 나를 인정해 주기만을 바라는 삶이 의미가 있을까. AI 시대라고 다르지 않다.루마니아 작가 에우제네 이오네스코의 연극 '대머리 여가수'를 보자. 집주인 스미스 부부는 신문에서 바비 왓슨의 부고를 보고 왓슨 가문은 같은 이름을 쓰는 까닭에 죽은 사람이 누구인지 헷갈린다고 한다. 손님으로 방문한 마틴 부부는 함께 왔지만 오늘 처음 만난 사람처럼 서로 인사를 하다가 자신들이 부부임을 깨닫고 포옹한다. 화재 예방을 위해 방문한 소방대장은 스미스 부인에게 뜬금없이 대머리 여가수에 대해 묻지만 그녀는 항상 같은 머리 스타일이라고 동문서답을 듣는다. 이 연극은 마치 꿈속처럼 앞뒤가 맞지 않는 대화와 상황이 반복된다. 개성 없는 불통 사회, 피상적인 가족관계, 부조리한 일상의 반복을 극적으로 표현하고 있다. 인간의 삶이 이렇게 부조리하다면 AI 세상도 부조리하지 않을 수 있을까.한일합방의 원흉 이토 히로부미를 저격한 인물은 안중근 의사다. 당시 그에게는 아버지 얼굴도 모르는 네살배기 아들 안준생이 있었다. 안중근 의사가 사형되고 가족은 일본의 감시를 피해 도망다녔다. 상해임시정부에서 도와주긴 했으나 잠시였다. 안준생의 삶은 고통의 연속으로, 내내 쫓기며 살았다. 조선총독부가 손을 내밀자 그 손을 덥석 잡았다. 살기 위해서였고, 그렇게 아버지를 떠나보냈다. “아버지는 아버지의 삶을 선택했지만 왜 나는 나의 삶을 선택할 수 없습니까? 아버지의 선택 때문에 나는 왜 이런 삶을 살아야 합니까? 아버지는 조선의 영웅이지만 가족에게는 재앙이었습니다.” 그의 항변이다. 일본이 준 돈으로 약국을 차렸다. 1939년 조선총독부의 주선으로 아버지를 대신해 이토 히로부미의 아들에게 사죄하는 의식을 치렀다. 그는 집으로 돌아가 어머니와 아내에게 말했다. 내가 바다에 몸을 던져 죽었어야 했는데 이렇게 살아 돌아왔다고. 그리고 눈물을 쏟았다. 김구 선생은 그를 변절자로 규정하고 응징하라고 지시를 내렸다. 광복 후 가족을 미국에 보내고 혼자 한국에 들어왔고, 신분을 숨기고 살다가 폐결핵으로 죽었다. 아들 안웅호는 미국에서 명망 높은 의사가 되었다. 안준생의 마지막 말이다. “영웅의 아들은 개같이 살았지만 변절자의 아들은 아픈 사람을 고치는 삶을 살 것이다.”그를 이해할 수 있을까? 쉽지 않겠다.인간을 이해할 수 있어야 AI를 이해하고 통제할 수 있다. 어떤 공동체이든 신기술이 기득권을 옹호하는 결과를 낳기도 하고 새로운 세력의 무기가 되기도 한다. AI도 마찬가지다. 돈이 많은 기득권 기업에 봉사할 수도 있고 새로운 젊은 기업에 기회를 줄 수도 있다. 인간에게 문명을 줄 수 있지만 위험을 가져올 수도 있다. AI에 완벽할 것을 기대할 수는 없다. AI는 우리를 닮았다. 우리가 완벽하지 않은데 AI에 완벽하기를 바라는 것은 뭔가 잘못됐다. 인간을 이해하고 AI를 이해해야 해결책이 나온다. 오직 타인에게만 인정받고자 하는 삶을 뛰어넘어야 한다. 인간 개체를 초월해서 생태계를 구성하는 모든 것과 공존을 추구하는 삶이어야 한다. 그것이 AI 시대 인간의 진정한 자아 찾기다.이상직 법무법인 태평양 변호사('나는 인공지능을 변호한다' 저자) sangjik.lee@bkl.co.kr",105,https://n.news.naver.com/mnews/article/030/0003015646?sid=103
"디지털 헬스케어에 돈이 몰린다…‘굿닥’, 201억원 투자유치 성공",2022.05.09. 오후 2:16,"-굿닥, 당초 투자금액 목표치 상회…디지털 헬스케어 투심확장 반영



[디지털데일리 신제인 기자] 비대면 진료 및 병원 예약 등 모바일 헬스케어 플랫폼 기업들이 나날이 성장하고 있다. 굿닥은 210억원 규모 시리즈A 투자를 성공리에 유치했다고 9일 밝혔다. 지난 2020년 7월 기업가치 극대화 및 기업공개(IPO)를 목적으로 모회사 케어랩스(263700)에서 물적 분할된 이후 첫 투자 성과다. 굿닥은 이번 투자 유치를 기점으로 개발자 채용 및 기술 기반 플랫폼 경쟁력 확대에 집중해 가는 등 모바일·디지털 토탈 헬스케어 ‘슈퍼앱’ 포지션을 한층 공고히 해 갈 방침이다. 이와 함께 ▲병원 찾기 ▲온·오프라인 진료 예약 ▲비대면 진료, 결제 ▲처방전 관리 ▲의약품 배송 등 의료와 관련한 모든 서비스를 ‘굿닥’ 앱 하나로 담아내고, 헬스케어 ‘슈퍼앱’으로 거듭나겠다는 계획을 전했다.  이번 굿닥의 시리즈A 투자에는 삼성벤처투자를 비롯해 마젤란기술투자, KB인베스트먼트, IBK기업은행, 디티앤인베스트먼트, 보광인베스트먼트, 이앤벤처파트너스, 티인베스트먼트, 케어랩스 등 국내외 유수 벤처캐피탈(VC) 기관들이 참여했다. 회사 측은 당초 시리즈A 목표치 200억원을 상회하는 성공적 투자 유치 배경에 대해 ▲헬스케어 앱으로서 높은 인지도와 브랜드 ▲코로나19 이후 디지털 헬스케어 투자심리 확대 ▲비대면진료, 태블릿 접수 등 서비스 급성장 등을 토대로 투자 유치 기간 동안 지속적으로 높은 관심들이 이어졌다고 설명했다. 임진석 굿닥 대표이사는 “굿닥은 대면과 비대면 진료를 포괄하여 환자와 병원, 약국을 연결하는 모바일 헬스케어 플랫폼으로 자리매김해 1차의료 질을 높여온 만큼, 향후 예방적 헬스케어 솔루션으로 성장해 갈 수 있다는 비전에 높은 평가를 받았다”며 “의식주, 금융 등 생활의 주요 요소가 모바일·디지털을 중심으로 변화해 온 것처럼, 건강 역시 일상적인 토탈케어가 가능한 플랫폼 서비스를 구축해 갈 계획”이라고 밝혔다. 한편, 굿닥은 지난해에 이어 지속적인 사용자 수 증가세를 기록해오고 있다고 전했다. 올해 역시 실시간 비대면 진료 서비스의 론칭을 기반으로, 지난 3월 월간 활성 사용자 수는 전월 대비 47% 증가해 앱스토어 의료 카테고리 1위, 애플 추천앱으로 선정되는 등 성장가도를 이어가고 있다.",105,https://n.news.naver.com/mnews/article/138/0002124264?sid=103
,,,105,https://n.news.naver.com/mnews/article/092/0002256113?sid=103
"한미약품 백혈병 치료제, 美 FDA 패스트트랙 품목 지정",2022.05.09. 오후 4:16,"급성골수성백혈병 치료제 후보물질FDA 지원으로 개발 속도 빨라질 예정



서울 송파구 한미약품 본사 전경. /한미약품 제공        한미약품이 자사 급성골수성백혈병 치료제인 신약 후보물질(HM43239)이 미국 식품의약국(FDA)으로부터 패스트트랙 개발 품목으로 지정됐다고 9일 밝혔다. 급성골수성백혈병은 암세포로 바뀌는 비정상적 백혈구가 단기간에 대량으로 생겨나 다른 장기로 침투하며 정상 세포를 죽이는 병이다.미국 FDA는 중증질환 등에 쓰이는 신약을 환자들에게 빠르게 공급하기 위해 패스트트랙 제도를 운영 중이다. 패스트트랙 개발 품목으로 지정되면 임상 단계에 따른 FDA의 지원을 받을 수 있어 전체 개발 과정이 신속하게 진행된다. 또 품목허가 신청 시 우선 심사 대상이 될 수 있다.한미약품에 따르면 이번에 패스트트랙으로 지정된 후보물질은 급성골수성백혈병에서 발현되는 돌연변이를 공격하도록 설계돼있다. 또 기존 약물에 내성을 보이던 환자들이 투약해도 효과가 있다고 한다.이 후보물질 글로벌 임상은 현재 진행 중이다. 한미약품은 글로벌 임상 1·2상을 통해 급성골수성백혈병 종양이 완전히 사라지거나, 기존 약물에 내성을 보여 치료에 실패한 환자에게서도 효과가 나타나는 등 반응이 확인됐다고 설명했다.한미약품은 지난해 11월 미국 나스닥에 상장한 바이오 기업 ‘앱토즈 바이오사이언스’에 이 후보물질을 기술수출했다.",105,https://n.news.naver.com/mnews/article/366/0000812153?sid=103
"KT스카이라이프 1분기 영업익 257억원...""플랫폼·광고 수익 개선""",2022.05.09. 오후 12:09,"전년보다 영업익 18.8% 증가 가입자 증가에 통신서비스 매출 2배 늘어분기 광고 수익 최초로 100억대 진입전체 상품 가입자 2만9000명 순증  [파이낸셜뉴스] KT스카이라이프가 콘텐츠 부문 수익증가와 가입자 증가에 힘입어 2022년 1분기 연결기준 영업이익이 전년보다 18.8% 늘어난 257억원을 기록했다고 9일 밝혔다.   스카이라이프와 HCN의 플랫폼부문 영업수익은 2258억원으로 전년보다 45.0%(701억원) 증가했다. 스카이라이프 인터넷과 모바일 가입자의 증가로 통신서비스 매출 287억원을 기록하며 전년 동기 대비 2배 이상 늘었다.   스카이라이프TV의 콘텐츠부문 영업수익은 150억원으로 전년 동기 대비 33.8%(38억원) 늘었다.   광고수익은 분기 광고수익 최초로 100억원대에 진입했다.   위성방송, 케이블방송, OTS, 인터넷, 모바일 등 스카이라이프 전체 상품의 가입자가 2만9000명이 증가했다. 6년 3분기만의 최대 순증이다. KT스카이라이프 관계자는 ""HCN을 통해 스카이라이프 인터넷과 모바일이 본격 판매되면 가입자 증가와 순증폭은 더욱 확대될 전망""이라고 말했다.   KT스카이라이프는 올 상반기 예능 콘텐츠 이번주도 잘 부탁해, 심장이 뛴다 38.5, 드라마 '구필수는 없다', '이상한 변호사 우영우' 등을 순차적으로 공개한다.   양춘식 KT스카이라이프 경영서비스본부장은 “방송과 인터넷, 모바일 등 가입자 순증 확대로 1분기 영업수익 2,408억원을 기록하며 연매출 1조클럽 달성을 위한 순조로운 시작을 보였다”면서 “스카이라이프TV 실적도 상승 추세인 만큼 새롭게 방송하는 예능과 드라마 콘텐츠를 발판 삼아 종합 미디어 콘텐츠 플랫폼의 위상을 공고히 하겠다”고 말했다.",105,https://n.news.naver.com/mnews/article/014/0004832964?sid=103
"웹젠 1분기 영업익, 전년대비 40% 급락",2022.05.09. 오후 7:54,"웹젠이 연결기준 올 1분기 매출 698억원, 영업이익 222억원을 기록했다고 9일 밝혔다. 전년 동기 대비 매출은 10.47%, 영업이익은 40.31% 하락한 수치다. 웹젠은 신작 모바일 게임 '뮤오리진3' 출시 준비로 마케팅 비용은 늘고 기존 게임들의 매출이 소폭 줄어든 영향을 받았다고 설명했다.웹젠은 자체 개발프로젝트의 진행을 서두르고 '뮤 오리진3' 등의 라이브게임 서비스 향상에 주력할 방침이다. '뮤 아크엔젤2'의 대만 출시를 시작으로 해외 시장 진출을 늘려 게임 서비스 점유율 확대도 꾀한다.현재 자회사 '웹젠블루락', '웹젠노바' 등에서 올 하반기 시장 출시를 목표로 5개 이상의 신작게임 개발 프로젝트를 진행 중이다. 장르 역시 MMORPG(다중접속역할수행게임), 캐주얼 게임, 수집형 RPG(역할수행게임)등으로 다양하다.퍼블리싱 계약으로 확보한 콘솔 게임 등을 비롯해 그간 사업으로 다루지 않았던 인디게임 시장에 진출하는 등 새로운 게임 시장에서의 사업 가능성도 확인한다. 웹젠은 현재 투자, 퍼블리싱 계약이 완료된 게임들의 외부 공개 여부 시기를 조율하고 있다.김태영 웹젠 대표는 ""코로나19 대응을 위한 재택근무 등의 외적요인으로 사업과 개발에서 일부 일정 지연은 있었지만 올해 사업 환경은 안정될 것""이라며 ""신작 개발은 물론 외부 투자와 퍼블리싱 계약 등 성장성 강화에 초점을 맞춰 전 임직원이 올해 사업을 전개하겠다""고 말했다.",105,https://n.news.naver.com/mnews/article/029/0002733298?sid=103
"퀄컴, IT 투어 재개…2022 지원자 모집",2022.05.09. 오전 10:12,"전국 4년제 대학 이공계 대학(원)생 대상퀄컴 샌디에이고 본사 방문 프로그램인 '퀄컴 IT 투어'가 재개된다.



퀄컴IT 투어 2022 포스터 [사진=퀄컴]퀄컴 인코퍼레이트는 퀄컴 샌디에이고 본사 방문 프로그램인 '퀄컴 IT 투어' 지원자를 모집한다고 9일 발표했다.국내 이공계 대학생 및 대학원생을 대상으로 진행하는 이번 프로그램은 8월 15일부터 8월 21일까지 미국 샌디에이고에서 열릴 예정이며, 지원서 접수는 오는 6월 1일부터 6월 30일까지다.올해 18번째로 진행되는 퀄컴 IT 투어는 한국의 이공계 대학(원)생들을 대상으로, 미래 글로벌 IT 분야의 인재를 지원하고자 마련된 행사다. 참여 학생들은 첨단 모바일 및 무선통신 분야의 최신 기술을 배우고 직접 체험해 볼 수 있으며, 퀄컴 임원이 참여한 가운데 직접 본인의 주제를 발표할 기회가 주어진다.퀄컴 IT 투어는 만 21세 이상 4년제 대학교에 재학 중인 이공계 학부 또는 석사과정 학생이면 누구든지 지원이 가능하다. 참가 희망자는 여러 지원서류와 함께 제안서를 제출해야 한다. 제안서 주제는 '5G, 커넥티드 지능형 엣지 (Connected Intelligent Edge), IoT, 로보틱스, AI, XR, 특화망, 커넥티드 카·자율주행 등 여러 주제 중 하나의 기술에 기반한 새로운 서비스 제안'이다.한편, 퀄컴코리아는 퀄컴 IT 투어를 소개하고 학생들의 적극적인 참여를 독려하기 위해 설명회를 개최한다. 설명회는 25일 한강로동에 위치한 아모레홀에서 진행되며, 프로그램에 관심 있는 사람이라면 누구나 참여 가능하다.권오형 퀄컴 본사 수석 부사장 겸 아태지역 총괄 사장은 ""뛰어난 국내 이공계 인재들의 많은 참여를 기대한다""며 ""퀄컴은 커넥티드 지능형 엣지와 같은 무선 통신 기술의 혁신을 이끌어나갈 인재들을 발굴, 육성하기 위해 직접 혁신 기술을 배우고 체험할 수 있는 기회를 확대해 나갈것""이라고 말했다.",105,https://n.news.naver.com/mnews/article/031/0000671073?sid=103
