title,date,main,section,url
명절 '효도폰' 최강자는 갤럭시A52s,2022.09.10. 오전 8:11,"'갤럭시A 최고작' A52s지원금으로 공짜폰 됐다저가 요금제 유지도 가능[서울경제] 명절 맞이 부모님 ‘효도폰’으로는 갤럭시A52s가 최적의 선택지로 보인다. 출고가는 60만 원에 가깝지만 공시지원금이 커 사실상 ‘공짜폰’으로 구매 가능하다. 지난해 출시한 모델임에도 갤럭시A 시리즈 최고 ‘명기’로 불릴 만큼 완성도도 높다.



갤럭시A52s. 사진제공=삼성전자10일 통신업계에 따르면 통신 3사는 갤럭시A52s에 50만 원 대 공시지원금을 제공하고 있다. SK텔레콤은 50만 원, KT는 52만5000원의 지원금을 주고 있다. 공시지원금 15%인 유통망 추가지원금을 감안하면 SK텔레콤 최대 지원금은 57만5000원, KT는 60만3750원이 된다. 갤럭시A52s 출고가는 59만9500원으로, 사실상 ‘공짜폰’인 셈이다.통상 공시지원금을 많이 받기 위해서는 고가 요금제를 의무 사용해야한다. “말만 공짜폰”이라는 비판이 나오는 이유다. 그러나 현재 두 통신사는 갤럭시A52s에 4만 원 대 5G 요금제에도 50만 원 이상 공시지원금을 제공하고 있다. 덕분에 통상 2년의 계약기간이 지났다면 비싼 요금을 사용할 필요 없이 기존 사용하던 요금제만 유지해도 새 폰을 얻을 수 있다.갤럭시A52s가 그저 그런 저가폰이 아니라는 점도 매력적이다. 퀄컴 스냅드래곤 778G 칩셋을 사용했고, D램은 6GB(기가바이트)로 넉넉하다. 6.5인치 대화면에 120Hz 주사율, 4500mAh 대용량 배터리도 탑재했다. 후면 카메라는 최대 6400만 화소 4개에 광학식손떨림방지기능(OIS)도 지원한다. IP67 등급 방수 방진도 갖췄다. 갤럭시A52s는 연초 갤럭시S22 시리즈 게임최적화서비스(GOS) 논란이 터졌을 때 재조명 받기도 했던 기기다. GOS가 적용된 최신 플래그십보다 성능이 뛰어나다는 점이 밝혀진 것이다. 현 시점 선택할 수 있는 중급형 기기 중 가격대 성능비가 가장 높은 스마트폰인 셈이다.갤럭시A52s가 마음에 들지 않거나 LG유플러스 가입자라면 갤럭시버디2도 저렴하게 구매할 수 있다. 갤럭시버디2는 갤럭시M23 5G 기반 LG유플러스 전용 모델이다. 스냅드래곤 750G에 4GB D램, 6.6인치 화면을 갖췄다. 갤럭시버디2 출고가는 39만9300원이지만 LG유플러스는 33만5000원의 공시지원금을 제공 중이다. 15% 추가지원금이 5만 원 가량으로, 1만 원대에 구입 가능하다. 역시 4만 원 대 요금제에도 최대 지원금을 받을 수 있다.가장 최근에 출시한 모델을 원한다면 갤럭시와이드6도 있다. 갤럭시A13 5G 기반으로 출고가 34만9800원에 요금제에 따라 10~17만 원의 공시지원금을 준다. 다만 요금제에 따라 공시지원금 규모가 다르고, 갤럭시A13이 갤럭시 시리즈 최저가 모델군이라는 점이 걸린다.구형이라도 플래그십 수준 성능을 원한다면 갤럭시S20 FE와 갤럭시S20 FE 2022가 있다. 갤럭시S20 FE는 SK텔레콤과 LG유플러스에서 각각 50만 원, 60만 원의 지원금을 제공 중이다. 출고가는 73만2600원으로, 추가지원금 감안 시 10만 원 내외에 구매할 수 있다. 다만 최대 지원금을 받기 위해서는 SK텔레콤 8만 원대, LG유플러스 10만 원 대 요금을 써야 한다.갤럭시S20 FE 2022는 출고가 69만9600원이지만 KT와 LG유플러스에서 각각 60만 원, 63만 원의 지원금을 주고 있어 추가지원금 감안시 공짜폰이다. 하지만 역시 10만 원 대 요금을 써야한다는 단점이 있다. 통신사 관계자는 “부모님이 쓰시기 좋은 중저가형 스마트폰들에 적절한 지원금이 갖춰져 있다”며 “추석 당일과 일요일은 신규 개통이 안 된다는 점은 유의해야 한다”고 전했다.",105,https://n.news.naver.com/mnews/article/011/0004097598?sid=103
“동의없는 통화 녹음 반대”vs“처벌법 반대”…진짜 여론은?[궁즉답],2022.09.11. 오전 6:01,"윤상현 의원실 발표 여론조사에서63.6% “상대방 동의 없는 녹음 반대”일주일 전 다른 조사는63.1% “통화녹음 금지법 발의 반대”질문방식에 대한 응답 차이…법적 방어권 지켜져야이데일리는 독자들이 궁금해하는 정치·경제·사회·문화 등 여러 분야의 질문을 담당기자들이 상세하게 답변드리는 ‘궁금하세요? 즉시 답해드립니다’(궁즉답) 코너를 연재합니다.<편집자 주>Q 상대방의 동의 없이 대화나 통화를 녹음하면 이를 처벌하는 통신비밀보호법 개정안이 발의됐습니다. 그런데 최근 이와 관련돼 발표된 여론조사를 보면 상반된 결과를 보이고 있는데요. 그 이유는 무엇인가요?[이데일리 정다슬 기자] 해당 법안을 발의한 윤상현 국민의힘 의원은 6일 국회 의원회관에서 열린 의원회관에서 국민 10명 중 6명은 상대방의 동의 없는 통화 녹음을 반대한다는 여론조사 결과를 6일 발표했습니다.이는 윤 의원이 한길리서치에 의뢰해 만 18세 이상 성인 2000명을 대상으로 조사한 결과(95% 신뢰수준에 오차범위 ±2.2%포인트, 응답률은 6.5%)입니다. 구체적으로 보면 응답자의 63.6%는 상대방이 자기의 동의 없이 녹음하는 것에 대해 반대한다고 응답했습니다. 찬성하는 의견은 29.5%였으며 잘 모름/무응답은 6.9%였습니다. 상대방이 자신의 동의 없이 녹음했을 때 법적 처벌이 필요하느냐는 질문에는 찬성이 52.5%, 반대 41.5%로 격차가 줄었습니다. 다만 통화 상대방이 자신의 동의 없이 녹음한 내용을 공개하면 법적 처벌이 필요하느냐는 질문에 대한 찬성 비율은 63.3%로 다시 격차가 벌어졌습니다. 반대는 29.0%였습니다.흥미로운 것은 불과 약 일주일 전 리얼미터가 미디어트리뷴의 의뢰로 전국 18세 이상 성인 9933명에게 접촉해 발표한 여론조사(95% 신뢰수준에서 오차범위 ±4.4%포인트, 응답률 5.1%)는 해당 법안에 부정적인 결과를 보여줬다는 것입니다. 이에 따르면, 응답자의 64.1%는 ‘통화녹음이 내부 고발 등 공익 목적으로 쓰이거나 자신을 보호하기 위한 용도로 쓰일 수 있으므로 법안 발의에 반대한다’고 답했습니다.왜 이런 결과가 나온 것일까요? 어느 한 쪽의 여론조사는 ‘진실’을, 어느 한 쪽 여론조사는 ‘거짓’을 말하고 있는 것일까요? 



국민의힘 윤상현 의원이 6일 오후 국회 의원회관에서 열린 ‘통신비밀보호법 개정안 토론회 - 동의없는 녹음, 이대로 좋은가?’에서 발언하고 있다. [국회사진기자단]섣불리 결론을 내리기 앞서 여론조사의 설계를 들여다봐야 합니다.양 여론조사는 모두 자동응답시스템(ARS)으로 이뤄졌습니다. 이는 사전에 녹음된 음성에 따라 응답자가 전화기의 버튼을 누르는 방식이지요. 이는 조사원이 실시간으로 묻는 면접조사에 비용이 적게 드는 반면, 응답률이 상대적으로 낮습니다. 응답자가 성별과 연령 등을 거짓으로 말해도 알아채지 못한다는 단점도 있지만, 반대로 ‘눈치보지 않고’ 솔직하게 답한다는 장점도 있지요.아울러 한길리서치는 100% 무선전화에서 무작위 표본 추출을 한 반면, 리얼미터는 97% 무선전화, 3% 유선 전화에서 무작위 표본추출을 했습니다. 유선전화는 휴대전화가 없는 고령자 등을 반영하는 효과가 있습니다. 다만 여기서는 그 비율이 작은 만큼, 큰 영향은 끼치지 않았을 것이라고 봅니다. 실제 양 여론조사기관이 밝힌 응답자 특성을 보면 성별·연령·광역지역별에서 눈에 띌만한 차이는 없었습니다. 양 여론조사가 가장 다른 점은 질문의 방식입니다. 한길리서치는 총 8개 질문에 대해 응답자가 어떻게 생각하는지 물었습니다.①전화통화를 할 때 상대방이 선생님(응답자)의 동의 없이 녹음하는 것 ②응답자가 상대방의 동의 없이 녹음하는 것 ③통화 상대방이 응답자의 동의 없이 녹음하는 것을 법적으로 처벌하는 것 ④통화 상대방의 동의 없는 녹음에 대해 법적 처벌이 필요하다고 생각할 경우, 필요한 처벌 ⑤통화 상대방이 응답자의 동의 없이 녹음한 내용을 동개하는 것을 법적으로 처벌하는 것 ⑥통화 상대방의 동의 없는 녹음을 공개하는 것에 대해 법적 처벌이 필요하다고 생각할 경우, 필요한 처벌 ⑦상대방하고 통화를 하는 상대방이 응답자의 동의 없이 통화·녹음한 내용이 재판의 증거로 채택하는 것 ⑧원칙적으로 통화 상대방의 동의 없는 통화 녹음을 제한하되, 대신 부패·부정사건이나 갑질·성희롱·폭력 사건 등과 같은 상황에 한해 사적 대화 녹음 및 공개를 허용하는 것 반면 리얼미터의 질문은 간단합니다. 바로 ‘최근 상대방의 동의 없이 통화 내용을 녹음할 경우 최대 10년의 징역형을 받을 수 있다는 법안이 발의되었는데요. 귀하께서는 이와 같은 내용의 통신비밀보호법 개정안 발의에 대해 찬성하십니까? 반대하십니까?’입니다. 답변의 방식 역시 다소 차이가 있었습니다. 한길리서치는 ‘찬성, 반대, 모름/무응답’으로 간소했지만, 리얼미터는 ‘통화녹음이 협박수단으로 악용되는 경우도 있을 뿐 아니라, 개인 사생활 인격권을 침해할 수 있으므로 법안 발의에 찬성한다’와 ‘통화녹음이 내부 고발 등 공익 목적으로 쓰이거나 자신을 보호하기 위한 용도로 쓰일 수 있으므로 법안 발의에 반대한다’로 찬성과 반대 논리를 분명하게 설명했죠. 물론, ‘잘 모르겠다’도 있었습니다.이같은 질문의 방식 차이는 사람들의 답변에도 영향을 미칩니다. 또 자세히 뜯어보면, 양 설문이 모순되지 않았다는 것도 확인해볼 수 있습니다. 한길리서치 설문조사에 따르면 적잖은 사람들이 상대방이 나의 동의 없이 나와의 통화를 녹음하거나, 내가 상대방의 동의 없이 상대방과의 통화를 녹음하는 행위를 반대했습니다. 법적 처벌이 있다고 밝힌 이도 과반을 넘었습니다.그렇다고 이 사람들이 ‘상대방의 동의 없이 통화내용을 녹음했다는 이유만으로 최대 10년의 징역을 받을 수 있는 법안’에 동의하는 것은 아닙니다. 심지어 상대방이 나의 동의 없이 녹음을 공개해 법적 처벌이 필요하다고 답하는 이 역시 벌금형(41.7%)이 맞다고 답하는 이가 징역형(21.5%)보다 2배 가까이 많았습니다. 즉, 녹음하는 것으로 최대 10년 징역형이라는 윤상현 의원의 개정안은 너무 과하다고 보는 이가 많다는 것이겠죠.흥미로운 것은 응답자들이 상대방이 나에게 동의를 받지 않고 녹음을 하거나 공개하는 것에 대해 반대하면서도 이 내용이 법적 증거로 채택되는 것에 대해서는 찬성하는 의견이 압도적으로 많았다는 것입니다. 응답자의 63.7%가 찬성 의견을, 응답자의 27.7%가 반대 의견을 내놓았습니다. 이는 국민들이 통화 내용을 법적 방어권 수단으로 인식하고 있다는 것을 보여줍니다. 이런 의미에서 상대방의 통화를 무단으로 녹음하는 것으로 징역형이라는 법안은 이같은 법적 방어권 수단을 원천적으로 박탈한다는 의미가 되겠죠. 윤 의원은 “법률안 수정안 검토 단계에서 갑질 문제나 직장 내 괴롭힘, 언어폭력, 협박, 성범죄 및 성범죄 무고 등 직접적인 위협이나 범죄 노출 등의 경우 예외나 단서조항을 통해 대안을 마련할 수 있다”며 “이번 토론회의 결론을 반영해 조만간 법률 수정안을 마련하도록 하겠다”고 말했습니다. 아무쪼록 이번 법안이 국민의 권리를 침해하지 않는 방향으로 생산적 논의가 이뤄지길 바라봅니다.  ※ 이데일리 궁즉답에서는 독자 여러분들이 알고 싶어하는 모든 이슈에 기자들이 직접 답을 드립니다.       채택되신 분들에게는 모바일 상품권을 보내드립니다.     이메일 : jebo@edaily.co.kr 카카오톡 : @씀 news",105,https://n.news.naver.com/mnews/article/018/0005314224?sid=103
"""키오스크 쓰는 법? 어렵지 않아요""…KT, 디지털 격차 해소 앞장선다",2022.09.11. 오전 9:00,"지난 2007년에 출범한 'KT IT 서포터즈'…취약계층 대상 IT 교육 ""민관이 함께 디지털 격차 해소해야""



2007년부터 시작된 'KT IT 서포터즈'는 정보 격차를 해소하기 위해 학생들은 물론, 노년층 및 다문화 가정 등 취약계층을 대상으로 각종 IT 교육을 진행하고 있다. 지난 7일 서울 종로구 KT 광화문 사옥에서 서포터즈 활동을 이끌어가고 있는 채욱 KT ESG 운영팀장을 만났다.(KT 제공)(서울=뉴스1) 윤지원 기자 = 코로나19를 기점으로 인공지능(AI) 스피커는 물론 키오스크에 메타버스까지 각종 신기술이 일상 속으로 스며들었다. 동시에 취약계층의 디지털 격차를 해소하는 문제가 숙제로 떠올랐다. 이를 두고 KT는 신기술 개발에 앞장선 기업이 격차 해소에도 선제적으로 나서야 한다는 답을 내놨다. 지난 7일 서울 종로구 KT 광화문 사옥에서 만난 채욱 KT ESG 운영팀장은 ""정보 소외 계층을 대상으로 격차를 해소하는 건 IT 기업으로서의 사회적 책임을 다하는 것""이라며 ""디지털 격차 해소를 위해 기업이 먼저 나서고 민관이 함께 하면 좋겠다""고 말했다. 채 팀장은 지난 2007년부터 시작된 사회 공헌 활동 조직 'KT IT 서포터즈'를 이끌고 있다. IT 서포터즈는 정보 격차를 해소하기 위해 학생은 물론, 노년층 및 다문화 가정 등 취약계층을 대상으로 IT 교육을 진행하고 있다. 채 팀장은 ""현재까지 IT 서포터즈의 교육을 받은 사람은 총 370만명에 활동 횟수는 35만회에 달한다""며 ""저소득층 시니어, 소상공인, 청소년 등 각계각층을 대상으로 활동해왔다""고 설명했다.코로나19를 변곡점으로 IT 교육의 필요성은 더욱 커졌다. 특히 식당, 카페 등 일상 가장 가까이에서 접할 수 있는 공간에 키오스크가 도입되며 관련 교육이 절실해졌다. 채 팀장과 함께 IT 서포터즈를 이끌어가고 있는 장윤형 ESG 운영팀 차장은 ""2020년도에 키오스크 교육용 앱을 개발했다""며 ""(키오스크에 대한) 두려움을 없애고자 했다""고 밝혔다. 실제로 KT가 개발한 앱은 △패스트푸드 △카페 △교통 예매 △ATM △무인민원발급 △병원에서 활용되는 키오스크를 유형별로 체험할 수 있도록 했다. 앱을 이용하고자 하는 사람은 누구나 구글 플레이스토어에서 무료로 다운로드할 수 있다.IT 서포터즈는 공공기관과 손잡고 노년층 일자리 창출에도 나섰다. 지난 2020년부터 한국노인인력개발원 및 경기도 사회서비스원과 함께 노년층 ICT 강사를 양성해왔다. 지금까지 500여명의 강사를 배출했으며 이들은 70만원대의 임금을 받고 있다. 경력단절여성의 고용 촉진에도 힘쓰고 있다. 현재 IT 서포터즈 강사 총 170여명 중 50여명은 경력단절여성 등을 포함, KT 외부에서 선발한 인력이다. IT 서포터즈 활동의 수혜자가 강사로 전환되는 경우도 있다. 서포터즈 최고령 강사 황영목씨(90)가 대표적인 사례다. 



2007년부터 시작된 'KT IT 서포터즈'는 정보 격차를 해소하기 위해 학생들은 물론, 노년층 및 다문화 가정 등 취약계층을 대상으로 각종 IT 교육을 진행하고 있다. 사진은 지난 7일 서울 종로구 KT 광화문 사옥에서 만난 장윤형 KT ESG운영팀 차장(KT 제공)채 팀장은 IT 서포터즈의 활동이 정부 정책에 반영할 때를 가장 보람찬 순간으로 꼽았다.채 팀장은 ""저희가 먼저 추진한 사업이 이후 정부 정책으로 제도화될 때 가장 자부심을 느낀다""며 ""기업은 정부나 지자체보다 앞서갈 수 있다. 기업이 먼저 나서고 민관이 함께 하는 게 좋은 것 같다""고 말했다. 실제로 과학기술정보통신부에서 추진하는 '디지털 배움터' 사업을 IT 서포터즈가 지원했다. 디지털 배움터는 취약계층의 디지털 역량을 키우는 정부 주관 교육 사업이다. 채 팀장은 ""IT 서포터즈에서 디지털 배움터 강사들을 가르쳐줬다""고 밝혔다. 정부에서 추진 중인 시니어 사물인터넷(IoT) 케어 사업에도 IT 서포터즈의 활동이 영향을 미쳤다. 채 팀장은 ""2015년도에 쪽방촌 고독사 문제를 해결하기 위해 센서를 달아 관리하는 솔루션을 제공했고 이게 지금 보건복지부에서 하는 IoT 케어 사업에도 영향을 미쳤다""고 말했다. 채 팀장은 ""정부 사업과 겹치는 게 아니냐고도 하지만 저희는 15년 동안 꾸준히, 반복적으로 교육해왔다""며 ""정부에서도 디지털 배움터를 하고 있지만 저희는 도서산간지역으로까지 찾아가는 교육을 하고 있다""고 말했다.신기술 자체에 집중하기보다도 현장에서 실제로 필요로 하는 것들에 주목해야 한다는 점도 강조했다. 채 팀장은 ""기술적인 걸 너무 앞세워서 수혜자를 대상으로 홍보성 활동을 해서는 안 되겠다고 생각했다""며 ""사람들이 진짜 필요한 것들을 해주는 게 IT 서포터즈 활동""이라고 말했다.",105,https://n.news.naver.com/mnews/article/421/0006328141?sid=103
,,,105,https://n.news.naver.com/mnews/article/088/0000843094?sid=103
[게임위드인] 건축·물류·자동차 시장도 진출…게임 바깥으로 나온 게임 엔진,2022.09.10. 오전 11:01,"언리얼 엔진에 구현된 부산항(왼쪽)과 볼보 승용차[에픽게임즈코리아 제공. 재판매 및 DB 금지]    (서울=연합뉴스) 김주환 기자 = 과거 게임 제작에만 한정적으로 쓰이던 게임 엔진이 게임 바깥세상으로 나와 소비자들을 만나고 있다.    특히 콘텐츠 산업뿐만 아니라 정보기술(IT)과 직접적인 관련이 없던 자동차, 건축, 패션 업계에서도 게임 엔진이 활용되는 사례가 늘어나고 있다.    게임 엔진은 게임의 기반이 되는 각종 알고리즘, 그래픽·음향 처리 기술, 데이터 처리 기술 등이 종합된 게임 제작 프로그램이다.    에픽게임즈의 '언리얼 엔진'과 유니티테크놀로지스의 '유니티'는 글로벌 상용 게임 엔진 시장에서 양강 구도를 형성하고 있다.



유니티로 구현된 가상 견본주택['메타갤러리' 캡처]  디지털 공간에 항만·공장 구현해 실시간 모니터링    이들 엔진은 발전된 실시간 컴퓨터그래픽(CG) 기술을 기반으로 비(非)게임 분야에도 활발하게 이용되고 있다.    실시간으로 이용자가 상호작용할 수 있는 3D(3차원) 콘텐츠를 만드는 데 특화된 기능 때문이다.    대우건설은 유니티를 활용해 지난 4월 업계 최초로 3차원 견본주택 '메타갤러리'를 만들어 아파트 분양 홈페이지에 선보였다.    이용자들은 가상 공간에 구현된 견본주택을 1인칭 시점으로 자유롭게 돌아다니며 둘러보고, 각종 인테리어 옵션에 따라 달라지는 외관을 실시간으로 비교해볼 수 있다.    부산항만공사와 국내 확장현실(XR) 기업 삼우이머션은 지난 5월 언리얼 엔진을 활용해 부산항의 '디지털 트윈'을 만들었다.    디지털 공간에 구현된 부산항에는 항만 내 컨테이너의 반출·입과 적재 상태, 차량과 선적 장비의 이동 현황이 실시간으로 반영된다.    이 기술을 활용하면 그간 관제실에서 폐쇄회로(CC)TV 영상만으로는 알 수 없던 현장 상황을 게임하듯 입체적으로 파악할 수 있다는 것이 에픽게임즈 측의 설명이다.    이 밖에 LG CNS, 현대두산인프라코어, 대우조선해양도 유니티를 활용해 작업 환경의 디지털 트윈을 제작했다.    가구·자동차 업계에서도 게임 엔진이 활발히 쓰인다.    페라리는 신차 '296 GTB'를 공개하면서 디자인 시각화, 제품 출시 영상 제작 등 전 과정에 언리얼 엔진을 활용했다.    볼보, 리비안, GMC 등도 자동차 내부 인터페이스에 언리얼 엔진을 활용한 3D 영상을 제공해 운전자에게 차량 관련 정보를 제공한다.    현대차의 고급 브랜드 제네시스는 유니티 엔진을 활용, 차량 조작법을 증강현실(AR)로 알려 주는 'AR 매뉴얼'을 제작했다.    사무용 가구 회사 플록은 유니티 엔진의 기능 '아트엔진'을 활용해 의자 제품을 디지털화했고, 그 결과 주문 오류와 반품을 줄여 딜러와 고객들의 만족도를 높였다.



펄어비스가 자체 개발한 '블랙스페이스 엔진'이 활용된 붉은사막[펄어비스 제공. 재판매 및 DB 금지]  펄어비스, 국내 대형 게임사로는 유일하게 자체 게임엔진 보유    글로벌 시장에서 게임 강국으로 꼽히는 한국도 대작 게임 개발에 자체 게임 엔진을 쓰는 경우는 드물다.    올해 발매된 국산 게임을 기준으로 보면 '미르M', '세븐나이츠 레볼루션', '히트2' 등이 언리얼 엔진으로 개발됐고 '던전앤파이터 모바일', '서머너즈워: 크로니클' 등은 유니티 기반으로 제작됐다.    발매를 앞둔 블록버스터급 게임인 엔씨소프트의 '쓰론 앤 리버티', 크래프톤의 '칼리스토 프로토콜', 넥슨의 '카트라이더: 드리프트'도 언리얼 엔진으로 제작 중이다.    국내 대형 게임사 중에서 유일하게 자체 엔진으로 게임을 출시한 기업은 펄어비스가 유일하다.    펄어비스는 MMORPG(다중접속역할수행게임) '검은사막'과 '검은사막 모바일' 개발에 자체 제작한 '검은사막 엔진'을 활용했다.    또 개발 중인 차기작 '붉은사막'과 '도깨비'에는 자체 제작한 차세대 게임 엔진인 '블랙스페이스 엔진'이 쓰였다.    펄어비스는 자체 게임 엔진 개발과 유지·보수에 상당한 인력과 연구개발(R&D) 예산을 투입해온 것으로 전해졌다.    펄어비스 반기보고서에 따르면 올 상반기 연구개발 비용은 약 708억 원으로, 영업수익 대비 38.2%를 기록했다.    이 같은 연구개발비 비중은 넷마블(31.5%), 크래프톤(24.1%), 엔씨소프트(16%)를 앞서는 수준이다.    다만 에픽게임즈·유니티 사례처럼 검은사막 엔진이나 블랙스페이스 엔진을 외부에 제공하고 있지는 않은 상황이다.    이 밖에 컴투스 역시 최근 자체 게임 엔진 개발에 뛰어들어 지난해 게임 엔진 및 협업 툴 개발 업무를 담당할 신입·경력직 사원 채용 공고를 낸 바 있다.    jujuk@yna.co.kr",105,https://n.news.naver.com/mnews/article/001/0013432167?sid=103
,,,105,https://n.news.naver.com/mnews/article/236/0000227443?sid=103
