title,date,main,section,url
카메라에 진심인 아이폰13...급 나누기 더 심해졌다,2021.10.22. 오후 4:39,"[리뷰] 애플 아이폰13 (A2633)애플 아이폰13은 A15 바이오닉 프로세서와 4GB 메모리, 6.1인치 슈퍼 레티나 XDR 디스플레이(OLED)를 탑재한 스마트폰이다. 전면에 1천200만 화소 트루뎁스 카메라, 후면에 1천200만 화소 초광각·광각 카메라를 탑재했다.후면 광각 카메라는 센서시프트 방식 손떨림 억제 기능을 적용했고 스마트HDR4를 이용해 역광 등 환경에서 보다 자연스러운 계조를 볼 수 있다. 방진·방수 등급은 IP68이며 최대 수심 6미터에서 최대 30분간 버틴다.



애플 아이폰13. (사진=지디넷코리아)색상은 핑크, 블루, 미드나이트, 스타라이트, 프로덕트 레드 등 5종류이다. 가격은 언락폰 기준 128GB 제품이 109만원이며 64GB 제품은 올해부터 판매하지 않는다.■ 전작과 비슷한 무게, 버튼 배치는 모두 변경아이폰13과 아이폰12는 화면 대각선 길이(6.1인치, 2532×1170 화소)와 가로·세로 길이(146.7mm, 71.5mm)가 같다. 두 제품을 나란히 늘어 놓으면 구별하기 쉽지 않지만 전세대 대비 확연히 줄어든 노치와 후면 카메라 배치로 구별할 수 있다.배터리 용량 증가(2775mAh→3,095mAh), 카메라 모듈 교체 등으로 무게는 9g(164g→173g), 두께는 0.25mm(7.4mm→7.65mm) 소폭 늘어났다. 그러나 아이폰12용 케이스를 재활용하는 것은 불가능하다.



카메라 배치의 나비효과로 각종 버튼 배치가 모두 바뀌었다. (사진=지디넷코리아)카메라 모듈 배치가 바뀌면서 각종 버튼 위치도 모두 바뀌어 아이폰12용 액세서리는 아예 들어맞지 않는다. 또 수화부 스피커도 화면 상단으로 올라가 기존 아이폰12용 화면보호용 필름이나 강화유리는 쓸 수 없다.■ 화면 최대 밝기 향상, 노치도 줄었다아이폰12 출시 당시 화면 밝기를 20% 이하로 낮추면 검은색 화면인데도 화면이 반짝거리거나 회색 빛이 표시되는 현상이 한 동안 논란이 됐었다. 아이폰13에서 같은 조건으로 테스트한 결과 같은 증상은 일어나지 않는다. 아이폰12의 문제도 iOS 14.5 업데이트로 해결됐다.화면 최대 밝기는 625니트에서 800니트로 올라갔다. 어두운 곳에서 밝기를 최소(0%)로 설정하면 아이폰12보다 훨씬 밝다. HDR 영상 재생시 최대 밝기는 1천200니트로 아이폰12와 같다. 패널 교체가 아니라 그동안 제한했던 최대 밝기를 올린 것으로 볼 수 있다.



아이폰X부터 처음 등장한 노치는 4년만에 면적을 20% 줄였다. (사진=지디넷코리아)아이폰X(2017) 이후로 줄곧 같은 크기를 유지했던 노치는 4년만에 부피를 20% 줄였다. 게임을 실행하면 화면이 넓어진 것을 쉽게 확인할 수 있지만 정작 iOS는 모처럼 남는 영역을 알뜰하게 쓰지 못한다. iOS 업데이트를 통한 보완을 기대한다.■ 데스크톱PC 거의 따라잡은 빠른 성능아이폰13에 탑재된 A15 바이오닉은 CPU는 고성능 코어 2개, 저전력 코어 4개를 조합했고 그래픽칩셋은 총 4개 코어, 신경망 처리를 담당하는 뉴럴엔진 코어는 16개를 내장했다.



아이폰12/13 긱벤치5 성능 비교. (자료=지디넷코리아)CPU·그래픽칩셋 성능 측정용 앱인 긱벤치5로 CPU 연산 성능(싱글코어·멀티코어)과 GPU 연산 성능을 측정한 결과 아이폰12 대비 성능 향상 폭은 싱글코어 10%, 멀티코어 15% 가량이며 GPU 연산 성능도 15% 가량 향상됐다.밥코 크로스마크는 인텔 코어 i5-8500T 프로세서를 장착한 데스크톱PC 성능을 기준으로 같은 작업을 얼마나 빨리 처리할 수 있는지 측정한다. 기준점은 1천점이며 점수가 2천점이면 기준 시스템 대비 두 배 빠른 속도로 작업을 처리할 수 있다는 의미다.



아이폰12/13 밥코 크로스마크 성능 비교. (사진=지디넷코리아)테스트 결과 아이폰13은 생산성과 콘텐츠 제작 등에서 모두 1천점을 넘겼다. 코어 i5-8500T 프로세서보다 근소하게 빠른 속도로 작업을 처리할 수 있다는 의미다. 전반적인 성능 차이는 아이폰12 대비 약 16% 정도다. 다만 일상적인 앱이나 웹서핑에서 차이를 느끼기란 쉽지 않다.셀룰러 속도도 간단히 테스트해봤다. 인텔 모뎀(아이폰11) 대비 20% 이상 빠른 속도를 보여줬던 아이폰12와 달리 아이폰13은 같은 시간, 같은 장소에서 측정하면 아이폰12와 큰 차이를 보이지 않는다.■ 센서 키운 광각 카메라, 더 영리해진 스마트HDR4아이폰13의 광각 카메라 센서 크기는 1/1.9인치(6.74×5.05mm)다. 아이폰12에 달았던 1/2.55인치 센서(5.6×4.2mm) 카메라보다 40% 이상 크고 아이폰12 프로맥스와 정확히 같다.



아이폰12와 아이폰13 카메라 비교. 광각 카메라를 대각선으로 배치했다. (사진=지디넷코리아)



아이폰13 주간 촬영 예제 사진. (사진=지디넷코리아)아이폰12는 광각 카메라에서 급 나누기가 있었지만 올해는 미니부터 프로까지 아이폰13 모든 라인업이 같은 광각 카메라를 쓴다. 여기에 렌즈 대신 센서를 움직이는 센서시프트 방식 손떨림 억제 기능도 포함됐다.



아이폰12로 야간 모드를 끄고 찍은 야경. (사진=지디넷코리아)



아이폰13으로 야간 모드를 끄고 찍은 야경. (사진=지디넷코리아)이런 개선은 특히 조명을 찾기 힘든 어두운 곳에서 효과를 낸다. 조명이 없는 어두운 곳에서 야간 모드를 끄고 찍은 사진을 비교하면 차이가 확연하다. 다소 노란 기가 돌고 노이즈가 끼는 아이폰12와 달리 아이폰13은 훨씬 나은 결과물을 보여준다.



아이폰13으로 햇빛을 마주 본 상태에서 찍은 예제 사진. (사진=지디넷코리아)



아이폰13 실내 촬영 예제 사진. (사진=지디넷코리아)스마트HDR4 성능도 향상되었다. 밝은 날보다는 흐린 날이나 해가 지는 시간대(이른바 골든아워), 혹은 역광이 비치는 상황에서 보다 정확하게 디테일을 살린다. 가장 밝은 곳은 유지하면서 어두운 곳은 확실히 어둡게 표현한다.



렌즈 플레어는 특히 야간 사진에서 적잖은 성가심을 선사한다. (사진=지디넷코리아)다만 빛을 정면으로 마주보면 생기는 렌즈 플레어는 아이폰11 이후 3년째 지속되고 있다. 센서가 지나치게 민감한데다 렌즈와 센서 사이 거리가 짧아서 생기는 문제지만 모처럼 말끔하게 찍힌 야경 사진에 끼어드는 플레어는 정말 성가시다.■ 올해 들어 더 심해진 급 나누기...4GB 메모리도 불만아이폰13은 폼팩터는 그대로 유지하면서 AP와 사진 향상에 주안점을 뒀다. 일상적인 작업에서는 성능 향상 폭을 체감하기 쉽지 않지만 전반적으로 15% 가량의 향상이 보인다.



올해는 아이폰13 미니부터 프로까지 3개 모델에서 같은 광각 카메라를 공유한다. (사진=지디넷코리아)특히 아이폰12 프로맥스급의 광각 카메라를 올해는 미니부터 프로까지 공유한다. 프로레스 동영상 촬영이나 프로로우 기능이 꼭 필요한 전문가가 아니라면 아이폰13으로도 충분히 만족할 수 있다.그러나 애플의 프로/非 프로 간 급 나누기는 아이폰13에 와서 더 심해졌다. 최신 안드로이드 스마트폰이 대부분 지원하는 90Hz 이상의 화면주사율은 아이폰13 프로에만 적용된다(프로모션). 특히 AP에서도 아이폰13 프로 이상만 5코어 GPU를 넣어준다.



iOS 15는 아직 줄어든 노치로 생겨난 여유공간을 제대로 활용하지 못한다. (사진=지디넷코리아)메모리 용량도 여전히 4GB에 머물렀다. 4GB 메모리와 6GB 메모리의 단가 차이는 크지 않은 것을 감안하면 다소 지나친 감이 있다. 그나마 최저 저장공간 용량이 64GB에서 128GB로 두 배 늘어난 것은 불행 중 다행이다.- 촬영 사진 원본 다운로드 (원드라이브) :https://1drv.ms/u/s!Aj8f0v7tesPMgYlMAUf8sBvxkN9Zsw?e=whlrtQ※ HEIC 파일이 지원되는 운영체제에서 열어 보시기 바랍니다.※ 샘플 사진의 영리·비영리 2차 활용과 재배포를 금합니다.",105,https://n.news.naver.com/mnews/article/092/0002236945?sid=103
"DGB데이터시스템, RPA 성공 도입을 위한 웨비나 개최",2021.10.22. 오후 3:16,"[디지털데일리 이상일기자] DGB데이터시스템(대표이사 김상근)은 RPA(로보틱스 프로세스 자동화)시스템의 성공적인 도입을 위한 ‘웨비나(Webinar)’ 프로그램을 개최했다고 22일 밝혔다.이번 웨비나는 단순 반복적인 업무 프로세스의 효율화를 위한 RPA 도입 및 운영과 RPA 관련 신기술 트렌드를 공유하기 위해 삼성SDS와 함께 진행했다.  DGB금융그룹 계열사별 디지털·IT 담당자와 RPA에 관심 있는 직원들이 실시간 온라인 웹 세미나에 참여해 RPA 도입 및 운영 시 필요사항과 솔루션 특장점 및 RPA 기술 트렌드 등에 대한 질의응답 시간을 가졌다.뿐만 아니라 대외 사업 활성화를 위해 힘쓰고 있는 DGB데이터시스템은 대구상공회의소와 협력해 영남권 지역 기업들의 웨비나 참여를 통한 RPA 도입 및 활성화를 독려했다.DGB데이터시스템 관계자는 “실제 업무에 RPA를 도입하기 전 점검해야 할 사항이 많은 만큼 신개념 웨비나를 통해 다양한 질문을 받고 의견을 공유했다”며 “앞으로도 그룹사와 영남권 기업들의 성공적인 RPA 도입과 운영을 통해 DGB금융그룹의 IT전문 회사로서 지역 DT 거점으로 거듭나도록 최선을 다하겠다”고 전했다. 한편, DGB금융그룹은 디지털 트랜스포메이션(Digital Transformation·DT) 전략 사업에 대응하고 단순 업무 자동화를 통한 고부가 가치업무의 집중 및 업무 생산성을 제고하기 위해 DGB데이터시스템을 주축으로 지주 RPA시스템 구축을 추진하고 있다. 이를 위해 지난달 지주 RPA설명회를 개최하고 RPA 과제 조사를 했으며, RPA 우선 과제 선정 및 사업 타당성 분석을 마친 뒤 연말 RPA시스템 도입에 착수할 계획이다.",105,https://n.news.naver.com/mnews/article/138/0002112132?sid=103
5년만에 온 찰리 푸스…추위 녹인 힐링 보이스,2023.10.22. 오후 6:15,"“5년 전 한국을 기억합니다. 정말 환상적이었어요. 오늘 밤, 모든 부정적인 기운은 날려버립시다!”미국 인기 가수 찰리 푸스(32·사진)가 지난 20일 서울 방이동 올림픽공원 KSPO돔에서 열린 콘서트에서 화려한 퍼포먼스로 공연장을 뜨겁게 달궜다. 직접 노래를 만들고 부르는 싱어송라이터답게 즉석에서 곡을 자유자재로 바꾸는 등 즉흥적 요소를 가미해 재미를 더했다.‘찰리, 비 콰이엇(Charlie Be Quiet!)’이란 노래로 공연을 시작한 그는 방탄소년단의 정국이 리메이크 무대를 펼친 ‘위 돈트 토크 애니모어(We Don’t Talk Anymore)’ 등을 불렀다. 이후 ‘루저(Loser)’ 등 히트곡을 이어 부르며 관객들의 떼창을 유발했다.푸스는 이날 공연에서 진성과 가성, 저음과 고음을 오가는 빼어난 가창력과 소름 돋는 고음으로 탄탄한 라이브 실력을 선보이며 ‘음악 천재 뮤지션’이란 별명이 왜 나왔는지를 입증했다. 지난해 정국과 협업한 ‘레프트 앤드 라이트(Left and Right)’를 들려줄 때는 “새벽 3시에 이 노래가 갑자기 떠오르더니 머리에서 계속 떠올랐다”고 소개했다. ‘던 포 미(Done for Me)’에서는 드럼과 베이스 등 화려한 실력의 밴드 연주에 맞춰 록스타처럼 흥과 끼를 마음껏 발산했다. 그는 키보드를 자유자재로 다루며 K팝의 성지인 KSPO돔을 쥐락펴락했다. 곡의 주요 선율과 리듬을 변환하고 강조하며 라이브의 묘미를 살렸다.앙코르으로 ‘원 콜 어 웨이(One Call Away)’를 부를 때는 팬들과 헤어지기 아쉽다는 듯 마지막 멜로디에서 고음을 아주 길게 끌기도 했다. 밴드가 모두 퇴장하고 홀로 키보드 앞에 선 푸스는 마지막 앙코르곡인 ‘시 유 어게인’을 부르기 시작했다. 가사처럼 한국 팬들과 다시 만날 날을 기약하며 공연을 마무리했다. 공연을 마친 푸스는 자기 모습이 담긴 태극기를 활짝 펼치며 한국에 대한 애정을 표하기도 했다.",105,https://n.news.naver.com/mnews/article/015/0004905271?sid=103
"[DD 퇴근길] “거의 성공했는데”…누리호, 아쉽지만 장하다",2021.10.22. 오후 5:28,"디지털데일리가 퇴근 즈음해서 읽을 수 있는 [DD퇴근길] 코너를 마련했습니다. 혹시 오늘 디지털데일리 기사를 놓치지는 않으셨나요? 퇴근 앞두고 저희가 요약 정리한 주요 기사를 가벼운 마음으로 읽어주시기 바랍니다. 전체 기사는 ‘디지털데일리 기사 하단의 관련뉴스(아웃링크)’에서 확인할 수 있습니다.



전 국민의 염원을 담은 한국형 발사체 ‘누리호(KSLV-II)’가 마침내 21일 오후 5시 하늘로 쏘아올려진 후 1단·페어링·2단 분리 등 모든 비행 절차를 성공적으로 마쳤지만, 위성모사체(모형위성)의 궤도 안착에는 실패하면서 ‘미완의 완성’이라는 평가를 받게 됐습니다. 하지만 많은 기술적 난제를 극복한 순수 독자개발 발사체의 첫 비행시험이라는 측면에서 의미가 크다는 평가입니다. 누리호는 내년 5월 19일 2차 발사를 걸쳐 2027년까지 네 차례 더 발사될 예정입니다. 항공우주연구원에 따르면, 이번 실패 원인은 3단 로켓 엔진이 46초 일찍 꺼진 것이 유일한 흠이었습니다. 더 정확히는 3단에 장착된 7톤급 액체엔진이 목표된 521초 동안 연소되지 못하고 475초에 조기 종료됐기 때문인데요. 그렇다보니 위상모사체가 당초 목표였던 700km 고도까진 올랐으나, 궤도 안착에는 실패했습니다. 누리호 발사 현장을 지켜본 문재인 대통령은 “아쉽게도 목표에 완벽하게 이르지 못했지만, 첫 번째 발사로 매우 훌륭한 성과를 거뒀다”며 “이제 한걸음만 더 나아가면 된다”고 강조했습니다.



초대형 TV 온다…삼성·LG 90인치대 '출격' 준비 삼성전자와 LG전자가 90인치대 '초대형' TV를 준비 중입니다. 삼성전자는 올해 8월 98인치 QLED TV 국내 판매를 시작한 데 이어 초대형 제품군인 마이크로LED TV 90인치 제품을 선보일 계획입니다. 지난 2월 가전 및 정보기술(IT) 전시회 ‘CES 2021’에서 삼성전자는 관련 제품을 상반기에 출시할 계획이라고 언급하기도 했죠.  이달 1일에는 마이크로LED TV(모델명 MNA99MS1A) 관련 국립전파연구원 전파 적합성평가를 마친 상태입니다.LG전자는 내년 초 90인치대 유기발광다이오드(OLED, 올레드) TV를 공개할 계획입니다. 패널 공급사인 LG디스플레이는 지난달 42~97인치대 TV용 OLED 패널 제품군을 가지고 있다고 언급했습니다. 내년 1분기 CES 2022에서 처음 90인치대 올레드TV를 선보일 가능성이 높습니다. 두 회사가 일제히 90인치대 제품을 준비하는 것은 TV 소비자가 점점 더 '거거익선'을 추구하고 있기 때문입니다. 전자업계 관계자는 ""70인치와 80인치대 제품 판매 비중이 점점 늘고 있다""라고 말했습니다.



‘배그’ 신작 게임, 빼빼로데이에 글로벌 출시 확정4년만에 전 세계 ‘배틀그라운드’ 열풍이 또 다시 불 것으로 보입니다. 크래프톤은 글로벌 사전예약 5000만명을 기록한 ‘배틀그라운드:뉴스테이트(NEW STATE)’를 11월11일 공식 출시합니다. 이번 신작은 전 세계 200여개국을 대상으로 17개 언어로 지원됩니다. 김창한 크래프톤 대표는 22일 펍지 스튜디오 배틀그라운드:뉴스테이트 온라인 쇼케이스에서 “펍지(PUBG) 프랜차이즈를 잇는 작품인 배틀그라운드:뉴스테이트는 그 자체만으로도 세계적인 경쟁력을 보여줄 수 있는 게임으로 자리매김할 것”이라고 포부를 밝혔지요.펍지 스튜디오에 따르면 안드로이드와 아이폰 iOS 버전 사전예약자 수는 총 5000만명 이상입니다. 한국 게임 역사상 최다 기록인데요. 배틀그라운드:뉴스테이트는 총기 커스터마이징, 드론 스토어, 리쿠르트 시스템 등 다양한 오리지널 피처를 선보일 예정입니다. ‘트로이’, ‘에란겔’을 포함해 총 4개 맵이 운영됩니다. 특히 안전하고 공정한 게임플레이 환경 조성을 위해 부정행위에 발빠르게 대응한다고 합니다. 크래프톤은 치트 방지 및 게임 코드 보호를 위해 기술적으로는 비인가 프로그램이나 에뮬레이터, 키보드와 마우스 사용 금지 조치 등을 적용합니다. 핵 사용 감지 및 제재에도 적극 나설 계획입니다. 



삼성전자 부인 불구 네트워크 사업 매각설 ‘또’…왜?삼성전자의 네트워사업부 매각설이 불거졌습니다. 삼성전자는 '사실무근'이라고 반박했지만 관련 가능성이 주기적으로 지속되고 있습니다. 매각설은 통신장비의 세대 전환 때마다 등장했는데요. 통신장비의 경우 안정적인 공급 능력이 중요합니다. 통신사가 공급사를 잘 바꾸지 않는 것도 이 때문입니다. 삼성전자는 5세대(5G) 이동통신 칩셋 단말기 장비를 모두 공급할 수 있는 유일한 업체입니다. 이와 같은 매각설이 지속적으로 불거질 경우 신규 고객 유치와 기존 고객 관리가 어려워질 수 있습니다.업계에서는 삼성전자가 네트워크사업부 매각을 비롯한 구조조정을 검토 중인 것으로 보고 있습니다. 한편 지난해 삼성전자의 5G 통신장비 점유율은 7.2%로 세계 5위입니다. 삼성전자는 그동안 ▲미국 1위 통신사 버라이즌 ▲일본 1위 통신사 NTT도코모 ▲유럽 1위 통신사 보다폰 등에 5G 솔루션을 납품했습니다.



'선불충전금 1800억' 스타벅스, 금감원 조사 받는다금융감독원이 미등록 선불전자지급수단 발행업체(페이 업체)들의 재무상태를 조사 중인 가운데, 업체 중 스타벅스도 포함됐습니다. 커피 체인 업체 중에선 유일합니다. 조사는 충전금 운영의 적정성을 판단하기 위해 진행됩니다. 스타벅스는 스마트폰 애플리케이션을 통해 선불충전금을 예치하고, 이를 통해 음료를 구매할 수 있도록 하고 있습니다. 단, 스타벅스처럼 자사 가맹점에서만 충전금을 사용하는 커피 전문점의 경우 현행법상 선불업체 등록 대상은 아닙니다. 하지만 스타벅스의 경우 선불충전금 규모가 이례적으로 커 조사 대상에 포함됐습니다. 홍성국 더불어민주당 의원 자료에 따르면 스타벅스 선불충전금은 1801억원에 달합니다.",105,https://n.news.naver.com/mnews/article/138/0002112151?sid=103
"""개그 같지만 실화였다""…애플 로고 박힌 천, 놀라운 근황 [배성수의 다다IT선]",2021.10.23. 오전 8:02,"2만5000원짜리 광택용 천주문 폭주에 대기시간만 3달



애플의 디스플레이 청소용 광택용 천이 2만5000원이라는 다소 높은 가격에 책정됐음에도 전 세계적으로 불티나게 팔리고 있습니다. 그간 고가 전략을 고수해 왔던 애플이 광택용 천마저 판매 흥행에 성공하자 일각에선 '애플은 어떤 제품을 내놔도 잘 팔린다'는 반응이 나옵니다.23일 애플코리아 홈페이지를 보면 애플은 광택용 천을 구매할 경우 제품을 받아보기 위해선 최소 10주에서 12주의 대기시간이 걸린다고 안내하고 있습니다. 기존 2주~4주로 책정돼 있던 기간이 주문 폭주로 인해 크게 늘어난 것입니다.앞서 애플은 지난 19일 맥 등 신제품 발표와 함께 기존엔 판매하지 않던 광택용 천을 일반 사용자에게 판매하기 시작했습니다. 한국 뿐만 아니라 미국, 인도 등 글로벌 시장에 정식으로 판매를 시작한 것이죠.



사진=애플 홈페이지 캡쳐하얀 색상의 광택용 천은 하단에 작은 애플 로고가 그려져 있는데요. 애플은 광택용 천이 아이폰, 아이패드, 아이맥 등 애플의 대부분의 기기에 호환된다고 설명하고 있습니다. 홈페이지 제품 설명을 보면 ""마모를 일으키지 않는 부드러운 소재로 만들어져 모든 애플 디스플레이를 안전하고 깨끗하게 닦아준다""고 설명하고 있습니다.광택용 천 판매가 논란이 된 부분은 과거 애플은 무상으로 제품을 지급했다는 겁니다. 그간 애플은나노텍스쳐 디스플레이가 탑재된 아이맥이나 프로 디스플레이 XDR 등을 구매하면 사은품으로 광택용 천을 함께 제공했습니다. 비매품이었던 만큼 분실 시 애플 고객센터에서 무료로 광택용 천을 제공해주기도 했습니다.광택용 천은 가격이 1000만원에 육박하는 애플의 고가 제품 청소 시에 사용이 권장됐던 천인데요. 그간 애플은 나노텍스처 디스플레이를 청소할 때 '다른 천은 절대 사용하지 말아달라'며 '애플 광택용 천만 사용해달라'고 안내했습니다. 전문가용 모니터 등 관리를 위해선 필수적인 제품인 셈이죠.애플이 지난 19일부터 광택용 천 판매를 시작하자 온라인 커뮤니티 등에선 '애플 로고'가 붙으면 평범한 제품도 가격이 폭등한다는 지적이 나왔습니다. 판매량도 높지 않을 것이란 관측이 대부분이었습니다. 그럼에도 이러한 일각의 예상을 비웃기라도 한듯 실제론 광택용 천은 전세계 애플 팬으로부터 주문이 폭주하고 있는 것으로 보입니다.광택용 천이 나노텍스쳐 디스플레이만을 위해서 사용해야 한다는 기존 애플 측의 설명과 달리 애플 대부분 기기에 활용될 수 있다는 점이 부각됐기 때문으로 풀이됩니다. 워낙 고가의 프리미엄 제품을 주로 판매하는 애플 특성상 2만5000원이라는 가격은 소비자게 상대적으로 저렴하게 느껴졌다는 분석도 나옵니다.애플 소식을 주로 전하는 마크 거먼 기자는 최근 트위터를 통해 ""광택용 천은 모든 물량이 동난 상태""라고 했는데요, 업계에서도 이번 광택용 천 주문 폭주 사태는 예상 외의 결과라는 반응이 나오고 있습니다. 미국에서도 한국과 마찬가지로 제품 배송 대기 시간이 최소 10주~12주로 책정돼 있는 것으로 알려졌습니다.",105,https://n.news.naver.com/mnews/article/015/0004619730?sid=103
방심위 신임 사무총장에 김진석 前 KBS비즈니스 사장,2021.10.23. 오후 5:24,"[이데일리 김현아 기자]



김진석 방송통신심의위원회 사무총장방송통신심의위원회(위원장 정연주)가 오는 26일(화) 김진석 前 KBS비즈니스 사장을 신임 사무총장으로 임명한다.김진석 사무총장(62)은 광주광역시 출신으로, 광주제일고, 서울대 영어영문학과를 졸업했다.1985년 KBS 기자로 입사한 후 KBS 보도본부 정치외교팀장, KBS 광주방송총국장, KBS 해설위원실장, KBS ‘일요진단’ 앵커, KBS비즈니스 사장 등을 역임했다.김 사무총장은 2017년 중앙선거방송토론위원회가 개최한 제19대 대통령선거 후보 제1차 토론회를 진행하고, 2차례에 걸쳐 국회방송자문위원회 위원으로 위촉된 바 있다.방송통신심의위원회 사무총장은 ‘방송통신위원회의 설치 및 운영에 관한 법률’ 제26조에 따라 방송통신심의위원회 위원장이 임명한다. 위원장의 명을 받아 사무를 처리하고, 사무처 직원을 지휘·감독한다.",105,https://n.news.naver.com/mnews/article/018/0005067928?sid=103
