title,date,main,section,url
“부잣집 아들로 살아본다면?” 재벌집막내아들 VS 금수저 [툰설툰설],2023.01.07. 오전 10:07,"일상 속 여유로운 틈을 타 웹툰과 웹소설을 보며 잠깐의 즐거움을 만끽하고 있는 당신, 콘텐츠 홍수 속에서 흥미로운 볼거리를 찾고 있나요? 시간을 순삭할 정주행감 콘텐츠를 탐색하고 있다면, <디지털데일리> 연재코너를 들여다보세요. 같은 소재 다른 줄거리, 두 편의 웹‘툰’ 또는 웹소‘설’을 다룬 <툰설툰설> 지금부터 시작합니다.  



  [디지털데일리 최민지 기자] ‘돈’이 권력이 되는 세상에서, 다음 생에는 부잣집에서 태어나고 싶다는 상상 한 번쯤 해본 적 있을 텐데요.    여기 재벌가 3세, 그리고 금수저를 들고 부잣집 아들로 다시 눈을 뜬 두 명이 있습니다. 바로 네이버웹툰 ‘재벌집막내아들’과 ‘금수저’ 주인공입니다.    재벌집막내아들과 금수저는 동명의 드라마로 제작돼 인기를 끌었던 만큼, 웹툰과 웹소설을 즐겨 보지 않은 분들이라도 익숙한 지식재산(IP)인데요. 웹툰에서는 드라마와는 다른 재미가 있습니다.    ◆재벌 장르물 역사 새로 쓴 ‘재벌집막내아들’     웹툰 재벌집막내아들 주인공 ‘윤현우’는 국내 최대 재벌가 순양그룹에서 뒤처리를 전문으로 하던 비서실장입니다. 그룹 비자금 문제를 다루던 중 충성을 바친 순양그룹에 버림받고 몰도바에서 죽임을 당하죠.    “순양그룹에서 개처럼 일하며 충성을 바친 시간이 13년이라고. 나를 이런 식으로 버린다고?”  “이름도 모르는 이 호수가... 내 무덤이구나.”  



네이버웹툰 재벌집막내아들 일부 장면 발췌. ⓒ네이버웹툰이후 윤현우는 원인을 모른 채 과거로 돌아가 순양그룹 창업주이자 총수인 진양철 막내 손자 ‘진도준’으로 환생합니다. 진도준으로 환생한 윤현우 최종 목표는 순양가를 집어삼키는 것이죠. 복수를 꿈꾸는 윤현우는 자신의 목표를 이루기 위해 본인이 가지고 있는 지식과 배경을 활용해 진양철 회장의 가장 사랑받는 손자가 돼 재벌가의 일원으로 성장합니다.    “난 지금 윤현우가 아니라 진도준이야.”   “이곳에서 순양그룹을 통째로 삼킬 거대한 괴물을 키울 것이다.”   산경(山景) 작가 웹소설 ‘재벌집막내아들’을 기반으로 한 동명의 웹툰 작품입니다. 지난 9월부터 네이버웹툰에서 단독 서비스를 시작했으며 드라마 방영에 앞서 웹툰을 먼저 선보여 드라마와 원작 웹소설에 대한 기대감을 올렸죠. 3개월만에 ‘관심 웹툰’ 등록자 수가 23만명을 넘기며 목요웹툰 인기 1위에 안착했습니다.    원작 웹소설이 웹툰, 드라마로 각색되는 과정에서 서로 다른 매력을 느낄 수 있습니다. 드라마와는 다른 인물 구도들도 보는 재미를 더합니다.    웹툰에서는 원작 웹소설과 마찬가지로 진양철 회장이 손자인 진도준을 더 아낍니다. 드라마에서 진도준이 어렵게 진양철 회장 신임을 얻었던 것과는 다른 모습이죠. 웹툰은 원작 웹소설에 더 가까운 만큼, 드라마 결말과 다른 마지막 장면도 기대해볼 수 있겠네요. 현재 웹툰은 28화까지 연재됐습니다.    완결이 난 원작 웹소설은 재벌가 비서에서 막내 아들로 회귀한 주인공이 재벌가를 통째로 차지하는 짜릿한 복수극으로 웹소설계 재벌물이라는 장르를 유행시킨 작품입니다. 재벌물, 기업물 웹소설 장르에 새로운 패러다임을 제시했다는 평가를 받고 있습니다. 문피아 유료 연재 기간 ‘투데이베스트’ 1위를 한 번도 놓치지 않은 작품이기도 하죠. 드라마 인기도 상당했습니다. 마지막화 시청률은 26.9%로, JTBC 역대 시청률 2위를 기록했죠.   ◆후천적 금수저가 된 인생 어드벤처 ‘금수저’   이번엔 스스로 부잣집 아들로 운명을 바꾼 주인공을 만나볼 차례입니다. 돈도 빽도 없는 가난한 집에서 태어난 흙수저 ‘이승천’은 어느 날 우연히 수상한 할머니로부터 부모를 바꿀 수 있는 신비한 금수저를 구매하게 됩니다.    “너와 동갑인 아이가 있는 집안에서, 이 금수저로 밥 세 끼만 먹어봐.”  “그럼 너와 그 아이가 바뀌게 되면서, 그 집안의 부모가 네 부모가 될 거다.”  



네이버웹툰 금수저 일부 장면 발췌. ⓒ네이버웹툰금수저로 세 끼만 먹으면 부모가 바뀐다는 할머니의 말에 지긋지긋한 흙수저 인생에서 벗어나고자 대기업 회장 외아들이자 자신과 또래 친구인 황태용 집에서 금수저로 식사를 하게 됩니다. 신비한 금수저로 세 번째 식사하게 된 순간, 이승천은 거대한 빛과 함께 마침내 꿈에 그리던 ‘금수저’ 황태용이 됩니다.   드라마와 달리 웹툰에서 이승천과 황태용은 친한 친구로 설정돼 있습니다. 이에 이승천은 금수저 사용 후 황태용 삶을 뺏은 것에 대한 죄책감을 느끼기도 하죠. 우려와 달리, 진짜 황태용은 가난한 이승천 집에서 가족들과 행복하게 지냈습니다. 그러던 중, 이승천 아버지가 사고를 당하게 됩니다.    “금수저고 뭐고...우리 가족에게 다시 돌아갈게요!”    과연 이승천은 부와 가족을 모두 얻을 수 있을까요? ‘금수저’는 수저계급론을 소재로 전개된 웹툰입니다. 수저계급론은 부모로부터 물려받은 부에 따라 인간 계급이 나뉜다는 자조적 표현의 신조어입니다. 부유한 정도를 수저 재질에 비유해 금수저, 은수저, 동수저, 흙수저로 계급을 나눕니다.    흙수저에서 탈출해 후천적 금수저가 된 주인공 이승천 삶을 통해 황금만능주의로 물든 현대 사회 민낯을 엿볼 수 있습니다. 동시에 가난한 집안에서도 웃음을 잃지 않고 바르게 성장한 황태용은 ‘진짜’ 금수저로 불려, 웹툰은 수저계급론이 만연한 사회에서 진정한 행복이 무엇인지를 보여줍니다.   금수저는 네이버웹툰 도전만화에서 처음 공개됐으며, 2016년 6월 정식 연재를 시작해 2018년 5월 총 105화를 마지막화로 완결됐는데요. 지난해 9월 웹툰을 원작으로 한 동명의 드라마로 방영됐습니다. 당시, 디즈니플러스(디즈니+) TV쇼 부문에서 일본, 인도네시아, 싱가포르 3개국에서 1위를 석권했는데요. 특히 인도네시아에서는 첫 방송 이후 한 달 넘게 1위 자리를 놓치지 않았다고 하네요. 그렇다면, 오늘 당신이 부잣집에서 삶을 새로 시작할 수 있다면 재벌집과 금수저 중 무엇을 선택하겠습니까?",105,https://n.news.naver.com/mnews/article/138/0002140349?sid=103
[CES2023 포토]SK 지속가능식품 푸드트럭,2023.01.07. 오후 8:17,"세계 최대 가전·IT(정보기술) 박람회 'CES 2023' 이틀째인 6일(현지시간) 미국 네바다주 라스베이거스 컨벤션센터(LVCC) 센트럴플라자에 마련된 SK(주) 지속가능식품 푸드트럭에서 관람객들이 대체유단백질로 만든 빙수, 크림치즈와 아이스크림 등을 시식하고 있다. SK-빙수는 SK㈜가 투자한 퍼펙트데이의 대체유단백질을 활용해 만든 디저트다. 우유가 아닌 대체유단백질을 얼려 얼음처럼 갈아 빙수를 만들었다.",105,https://n.news.naver.com/mnews/article/030/0003071092?sid=103
[IT발자국] 1967년 뉴욕 호텔서 시작된 ‘CES’…세계 최고 IT전시회 되기까지,2023.01.07. 오후 2:10,"<출처=LG디스플레이>  그동안 다양한 전자제품이 우리 곁에서 회자정리 거자필반(會者定離 去者必返)을 반복했습니다. 모두에게 사랑받던 기기가 어느 순간 사라지거나 오랜 세월이 지난 뒤 부활하기도 했습니다. <디지털데일리>는 그 이유를 전달하려고 합니다. <편집자주>   [디지털데일리 백승은 기자] 매년 1월이면 세계 각국의 정보기술(IT) 관계자들이 미국 라스베이거스로 향합니다. 미국 소비자기술협회(CTA)가 주관하는 ‘CES’에 참석하기 위해서인데요.    올해도 마찬가지입니다. ‘CES 2023’은 미국 현지시간 기준으로 1월5일부터 8일까지 진행되는데요. 최근 3년간 코로나19로 행사가 취소 또는 축소된 만큼 많은 기대가 쏠리고 있습니다. 참가 기업 수만 3100여개, 관람객만 10만명 이상일 것으로 보이는데요.   숫자만으로도 어마어마한 규모죠. 행사에서 한 해를 주름잡는 IT 신기술이 다양하게 등장하기 때문에 올해에도 글로벌 IT 업계의 눈길이 쏠리고 있습니다.   IT업계는 1월 미국 라스베이거스의 CES, 2월 스페인 바르셀로나의 모바일월드콩그레스(MWC), 9월 독일 베를린의 국제가전박람회(IFA)를 세계 3대 IT 전시회로 구분하는데요. 이 중에서도 CES는 규모, 주목도에서 모두 1위죠. 그렇다면 CES는 시작부터 이토록 창대한 행사였을까요?   ◆60년대 참가 기업 100여개, 관람객 1만여명으로 출발   지금으로부터 56년 전인 1967년, 첫 CES에서 전시를 한 기업은 117개에 불과했습니다. 관람객 수는 1만7500명이었죠.   첫 CES는 미국 뉴욕 힐튼호텔과 아메리카나 호텔에서 열렸죠. 기존에는 ‘시카고 뮤직쇼’의 메인 이벤트였으나, 별도로 분리된 행사가 열린 게 1967년입니다.    그런데 장소가 우리가 알고 있는 곳과는 조금 다르네요. 지금은 매년 초 라스베이거스에서 열리는데, 첫 장소는 뉴욕이니 말입니다.    뉴욕에서 첫 선을 보인 CES는 1972년 잠시 거취를 시카고로 옮겼습니다. 1973년에는 한국 기업이 처음으로 참가했는데요, 그 중 하나가 금성사(현 LG전자)입니다. 대한전선, 동남전기 등 10여개 한국 기업이 참가했죠.   그러던 1978년에는 아예 개최 방식을 조금 바꾸는데요. 1년에 라스베이거스와 시카고에서 번갈아서 1회씩 총 2회 진행하는 식으로 변경됩니다. 1월에는 라스베이거스에서 ‘WCES(Winter CES)’, 6월에는 시카고에서 SCES(Summer CES)행사가 열렸죠. 이듬해인 1979년에는 삼성전자가 처음 전시를 선보였습니다.   1994년까지 이렇게 1년에 2회 열렸지만, 시카고의 CES가 반응이 뜨뜻미지근했습니다. 1998년부터는 1월 라스베이거스에서만 열리는 행사로 바뀌어 지금까지 이어지고 있습니다.   ◆VCR부터 HD TV, ‘테트리스’도 CES서 공개…韓기업 위상도 고공행진   그간 획기적인 제품들이 CES에서 모습을 드러냈는데요. 2000년대 초까지는 주로 오디오나 영상 기술이 이목을 끌었습니다. 1970년에는 비디오카세트 레코더(VCR)가, 1974년에는 레이저디스크 플레이어가 공개됐습니다.    1981년 캠코더, 1991년 CD플레이어와 워크맨도 많은 기술적 발전을 보여줬죠. 1998년에는 고화질(HD) TV가 연달아 등장하며 놀라움을 자아냈습니다. 그해에는 오늘날까지 잘 알려진 블록 맞추기 게임 ‘테트리스’도 공개됐죠.   이처럼 2000년대 초까지 CES의 주인공은 TV와 오디오였는데요. 이후 좀 더 고차원적인 기술인 인공지능(AI)과 로봇, 가상현실(VR)과 자율주행차 등으로 영역이 확대되면서 정보통신기술(ICT) 전 영역을 다루는 전시회로 거듭났죠.   오늘날 성황리에 진행 중인 CES 2023의 키워드는 ▲모빌리티 ▲지속가능성 ▲디지털 헬스 ▲메타버스 등인데요. 특히 모빌리티의 중요도가 확장됐습니다. 참가한 모빌리티 기업만 300여개고, 설치 공간은 전년대비 25%가 커졌죠.   CES에서 국내 기업의 위상도 높아지고 있습니다. 이번 CES 혁신상에는 2100개 제품이 출품해 500여개가 수상의 영예를 안았습니다. 이중 한국 기업은 139개입니다. 2018년 65개에서 2021년 101개, 올해 139개로 매년 증가하는 추세죠.    이중 17개 기술이 ‘최고 혁신상’을 받았는데, 한국 기술이 총 9개입니다. ▲삼성전자 ▲LG전자 ▲SK ▲한양대학교 ▲소셜벤처 닷의 9개 기술 및 제품이 좋은 평가를 받았습니다.",105,https://n.news.naver.com/mnews/article/138/0002140356?sid=103
SK 대체유단백질 지속가능식품 푸드트럭,2023.01.07. 오전 11:13,"(라스베이거스=연합뉴스) 홍해인 기자 = 세계 최대 가전·IT(정보기술) 박람회 'CES 2023' 이틀째인 6일(현지시간) 미국 네바다주 라스베이거스 컨벤션센터(LVCC) 중앙 광장의 SK(주) 지속가능식품 푸드트럭에서 관람객들이 대체유단백질로 만든 빙수, 크림치즈와 아이스크림 등을 시식하고 있다.     SK-빙수는 SK㈜가 투자한 퍼펙트데이의 대체유단백질을 활용해 만든 디저트다. 우유가 아닌 대체유단백질을 얼려 얼음처럼 갈아 빙수를 만들었다. 2023.1.7    hihong@yna.co.kr",105,https://n.news.naver.com/mnews/article/001/0013686954?sid=103
"유레카 파크, 대한민국 미래 동력 한자리에",2023.01.07. 오후 6:01,"(라스베이거스=연합뉴스) 홍해인 기자 = 세계 최대 가전·IT(정보기술) 박람회 'CES 2023' 이틀째인 6일(현지시간) 미국 네바다주 라스베이거스 베네시안 엑스포의 유레카 파크로 불리는 홀G에 스타트업 등 대한민국 중소기업들의 전시 부스가 마련돼 있다.     베네시안 엑스포는 테크 이스트(Tech East), 테크 웨스트(Tech West) 등으로 나뉘어진 CES 전시장 중 테크 웨스트의 가장 큰 전시장이다. 홀A부터 D까지는 가전, 모빌리티를 제외한 영역의 산업 부스가 전시된다. 홀G는 유레카파크라는 이름으로 스타트업들 전시가 주로 이뤄진다. 2023.1.7    hihong@yna.co.kr",105,https://n.news.naver.com/mnews/article/001/0013687281?sid=103
MS도 모빌리티,2023.01.07. 오후 12:20,(라스베이거스=연합뉴스) 홍해인 기자 = 세계 최대 가전·IT(정보기술) 박람회 'CES 2023' 이틀째인 6일(현지시간) 미국 네바다주 라스베이거스 컨벤션센터(LVCC) 웨스트홀의 마이크로소프트 전시관에 독일 ZF 자율주행 셔틀이 전시돼 있다. 2023.1.7    hihong@yna.co.kr,105,https://n.news.naver.com/mnews/article/001/0013687084?sid=103
270여개 검증 거친 ‘현대차 인증중고차’ 24일부터 판매 개시,2023.10.19. 오전 10:39,"제조사가 끝까지 케어 한다는 철학5년·10만km 이내 무사고 차량 대상엄격한 품질기준 통과한 차량에만공식 인증 마크 부여..“신규 시장 개척”[이데일리 박민 기자] 현대자동차는 19일 경남 양산에 있는 ‘현대 인증중고차 양산센터’에서 상품화과정을 거쳐 품질 인증이 완료된 팰리세이드 인증중고차와 제네시스 G80 인증중고차를 첫 공개하고 24일부터 본격적인 판매에 나선다고 밝혔다.유원하 현대차 아시아대권역장(부사장)은 이날 “자동차는 ‘만든 사람이 끝까지 케어 한다(Made by us, Cared by us)’는 철학 아래 인증중고차 사업을 준비해왔다”며 “중고차 판매를 넘어서 고객이 더 현명하고 합리적인 선택을 할 수 있는 정보를 공유해, 투명하고 공정한 중고차 거래문화를 안착시킴으로써 국내 중고차시장의 선진화에 기여하고자 한다”고 말했다.유 부사장은 현대 인증중고차 사업 방향성으로 투명과 신뢰, 고객가치를 제시하고, 소비자를 최우선으로 사업을 펼쳐 나가겠다고 약속했다. 신차와 중고차 모두 현대차이기 때문에 중고차 고객도 신차 고객과 마찬가지로 세심하게 관리하고 국내 중고차 시장의 건강한 생태계 조성에도 힘쓰겠다는 의미다.현대차는 국내 완성차 브랜드 최초로 ‘제조사 인증중고차(Manufacturer Certified Pre-Owned)’를 시장에 공급해 신뢰도 높은 중고차를 안심하고 구매하기를 원하는(Peace of mind) 고객층을 신규로 개척할 계획이다.이를 위해 현대차·제네시스 인증중고차는 국내 최다 수준인 현대차 272개 항목, 제네시스 287개 항목에 걸친 진단·검사를 거쳐 품질 인증을 받고 판매된다. 특히 판매 대상 차량도 5년 10만km 이내 무사고 현대차, 제네시스 브랜드 차량으로 한정했다.(단 상용차는 제외, 전기차·수소전기차는 추후 확대 예정)



경남 양산에 위치한 ‘현대자동차 인증중고차 양산센터’ 전경.(사진=현대차)현대차는 우수한 품질의 중고차를 공급하기 위해 신차의 제조공장(factory)에 해당되는 인증중고차 전용 상품화센터를 경남 양산과 경기도 용인 두 곳에 마련했다. 온라인 플랫폼 등을 통해 매입된 중고차는 이곳에서 정밀진단과 품질개선, 검사, 인증 등의 상품화 과정을 거쳐 고품질의 차량으로 리뉴얼된다.정밀진단 결과에 따라 기능 정비와 판금·도장 등의 품질개선이 이뤄지며, 수리과정에서 사용되는 부품 역시 신차와 동일하게 현대차가 인증한 부품들만 투입된다. 이후 최종 점검을 추가로 진행하는 등 모든 검사 항목을 통과한 차량에 대해서만 ‘공식 인증 마크’(Hyundai Certified·GENESIS CERTIFIED)를 부여한다.이처럼 까다로운 상품화 과정이 수행되는 양산 인증중고차센터는 국내 최대 규모의 부지면적인 3만1574㎡(옛 9551평)에 연면적 1만76㎡(3048평) 규모의 지상 2층, 2개동으로 구성돼 있다. 하루 60대의 상품화가 가능해 연간으로 1만5000대의 중고차를 상품화할 수 있어 인증중고차 허브기지 역할을 할 예정이다용인 인증중고차센터는 중고차 복합단지 ‘오토허브’ 내 3개동에 걸쳐 연면적 7273㎡(옛 2200평) 규모로 하루 30대의 상품화가 가능하다. 현대차는. 향후 증가하는 수요에 대응해 주요 권역에 추가로 구축할 계획이다.현대차는 제조사로써 보유한 자체 데이터는 물론 외부 기관에서 확보한 대량의 정보를 기반으로 자체 개발한 중고차 통합정보 포털 ‘하이랩(Hi-LAB)’과 ‘인공지능 가격산정 엔진(AI Pricing Engine)’을 제공해 소비자가 중고차 구입을 꺼리는 핵심 원인이었던 판매자와 소비자간 정보의 비대칭 해소에 나설 계획이다.고객은 모바일 앱 ‘현대·제네시스 인증중고차’ 및 인증중고차 전용 웹사이트에서 상품검색 및 비교는 물론 견적, 계약, 결제, 배송 등 ‘내차사기’ 전과정을 온라인 원스톱 쇼핑으로 진행할 수 있으며, 최종 구입한 차량은 집 앞 등 고객이 원하는 장소로 배송된다. 현대차는 하나의 모바일 앱 및 웹 안에 현대 브랜드관과 제네시스 브랜드관을 운영해 고객은 편리하게 두 브랜드의 인증중고차를 구입할 수 있다.현대차는 신차 계약 고객이 타던 차량을 매입하는 ‘내차팔기’ 서비스도 선보인다. 국내 브랜드에서도 중고차 처리와 신차 구입이 동시에 가능해지는 것이다. ‘내차팔기’ 서비스는 지난해 4월 중소벤처기업부의 사업조정 권고안에 따라 현대차/제네시스 신차 구입 고객에 한해 이용이 가능하다.현대차는 자체 개발한 AI 가격산정 엔진 등을 통해 차량 가치를 객관적으로 평가해 공정한 가격(fair price)으로 신차 구입 고객의 중고차를 매입한다. ‘내차팔기’ 역시 실제 차량 상태 확인을 위한 전문인력 방문을 제외하고 매각 전과정을 온라인 채널에서 진행할 수 있다.현대차는 인증중고차 고객도 신차 고객에게 제공한 서비스와 멤버십을 이용할 수 있도록 하는 등 중고차 고객가치를 높였다. 신차와 동일하게 전국 1300여개의 현대차·제네시스 서비스망에서 보증서비스 등의 차량 관리를 받을 수 있으며, 신차 판매 시 제공된 무상 보증기간을 포함해 인증중고차 구매시점 기준으로 1년 2만km까지 무상 보증을 이용할 수 있다.현대차는 인증 중고차 사업 첫 개시한 올해는 두 달여가 남은 점을 감안해 판매 목표는 5000대로 정했다. 현대차 관계자는 “지난해 국내 중고차 거래 대수는 238만대로서 이 중 현대차와 제네시스 중고차는 90여 만대로 전체 중고차 거래의 약 38%를 차지한다”며 “내년부터 판매규모를 점차 확대해 나갈 예정”이라고 말했다.



현대자동차그룹 서울 양재동 사옥 전경.(사진=현대차그룹)",105,https://n.news.naver.com/mnews/article/018/0005599272?sid=103
메르세데스 벤츠 EQS,2023.01.07. 오후 12:27,(라스베이거스=연합뉴스) 홍해인 기자 = 세계 최대 가전·IT(정보기술) 박람회 CES 2023 개막 이틀째인 6일(현지시간) 미국 네바다주 라스베이거스 컨벤션 센터(LVCC) 웨스트 홀메르세데스 벤츠 전시관에 EQS가 전시돼 있다. 2023.1.7    hihong@yna.co.kr,105,https://n.news.naver.com/mnews/article/001/0013687095?sid=103
'푸조 인셉션' 콘셉트카,2023.01.07. 오후 12:42,(라스베이거스=연합뉴스) 홍해인 기자 = 세계 최대 가전·IT(정보기술) 박람회 CES 2023 개막 이틀째인 6일(현지시간) 미국 네바다주 라스베이거스 컨벤션 센터(LVCC) 웨스트 홀푸조 전시관에 전동화 비전을 담은 콘셉트카 '푸조 인셉션'이 전시돼 있다. 2023.1.7    hihong@yna.co.kr,105,https://n.news.naver.com/mnews/article/001/0013687111?sid=103
지프 랭글러 루비콘 전기차,2023.01.07. 오후 4:59,(라스베이거스=연합뉴스) 홍해인 기자 = 세계 최대 가전·IT(정보기술) 박람회 'CES 2023' 이틀째인 6일(현지시간) 미국 네바다주 라스베이거스 컨벤션센터(LVCC) 웨스트홀의 지프(JEEP) 전시관에 랭글러 루비콘 전기차가 전시돼 있다. 2023.1.7    hihong@yna.co.kr,105,https://n.news.naver.com/mnews/article/001/0013687246?sid=103
"[CES 2023] SKT ""UAM 체험 프로그램에 관람객 운집""",2023.01.07. 오전 9:01,"AI 반도체·가상발전소 기술 접목한 친환경 미래 모빌리티 기술 소개



관람객들이 SK텔레콤 부스 내 마련된 UAM 체험 시뮬레이터를 즐기고 있다.ⓒSKT[데일리안 = 남궁경 기자] SK텔레콤은 세계 최대 IT·가전 전시회 ‘국제전자제품박람회(CES) 2023’에서 선보인 '한국형 도심항공교통(K-UAM) 가상 체험 프로그램'이 관람객들로부터 큰 관심을 받았다고 7일 밝혔다. 회사는 이번 CES에서 도심항공교통 체계가 정착된 미래도시를 가상공간에 구현해 전시했다.SK 전시관에 설치된 UAM 항공기 형태의 가상 체험 시뮬레이터는 CES 2023 행사장의 핵심부인 센트럴 홀(Central Hall)에서 관람객의 발길이 끊이지 않는 체험 공간으로 인기를 끌었다고 회사는 설명했다.관람객들이 승객 4명이 탑승하는 실물 크기의 전기수직이착륙기(eVTOL) 좌석에 올라 VR 헤드셋을 착용하면 2030년 미래 부산의 풍경이 눈앞에 펼쳐진다.부산역에서 이륙해 동백섬으로 비행하는 동안 업무 일정과 회의 자료를 확인하는 동시에 인공지능의 안내에 따라 환승 교통편을 예약하고 여행에 어울리는 음악도 들을 수 있게 제작됐다.SK텔레콤 관계자는 “CES에서 제시한 미래상처럼 SK텔레콤과 우수한 파트너사들의 역량을 모아 글로벌 UAM 기술 경쟁을 선도하고, 다양한 ICT 기술을 접목해 세계에 자랑할 수 있는 UAM 생태계를 구축해 나갈 계획”이라고 말했다.한편, SK텔레콤은 이번 CES에서 SK그룹 8개사가 넷제로(Net Zero)를 주제로 함께 꾸민 전시관에 참여했다. UAM을 비롯해 AI반도체 ‘사피온(SAPEON)’, 신재생 에너지 가상 발전소를 연계한 친환경 기술을 통해 온실가스를 줄이는 방안을 제시했다. UAM 항공기 운항에 사피온 반도체를 활용하면 운용 효율을 높일 수 있고, 가상 발전소 기술을 통해 이착륙장인 버티포트(vertiport)의 전력 수요를 예측할 수 있다.



관람객들이 UAM 가상 체험 프로그램을 즐기기 위해 대기하고 있다.ⓒSKT",105,https://n.news.naver.com/mnews/article/119/0002673655?sid=103
지프 랭글러 루비콘 전기차,2023.01.07. 오후 4:59,(라스베이거스=연합뉴스) 홍해인 기자 = 세계 최대 가전·IT(정보기술) 박람회 'CES 2023' 이틀째인 6일(현지시간) 미국 네바다주 라스베이거스 컨벤션센터(LVCC) 웨스트홀의 지프(JEEP) 전시관에 랭글러 루비콘 전기차가 전시돼 있다. 2023.1.7    hihong@yna.co.kr,105,https://n.news.naver.com/mnews/article/001/0013687248?sid=103
