title,date,main,section,url
하루 2만보 성큼성큼… “걸으면 건강이 따라와요,2021.10.23. 오전 3:03,"[베스트 닥터의 베스트 건강법]박동일 강북삼성병원 소화기내과 교수



박동일 강북삼성병원 소화기내과 교수는 5년째 동대문역사문화공원역에서 병원까지 걸어서 출퇴근하고 있다. 박 교수가 병원 근처 서울역사박물관 산책로를 걷고 있다. 방역수칙을 준수하며 촬영했다. 평소에는 마스크를 착용하고 걷는다. 신원건 기자 laputa@donga.com헬스클럽 1년 회원권을 끊기는 쉽다. 하지만 1년 동안 꾸준히 헬스클럽에서 운동하는 것은 그리 쉬운 일이 아니다. 처음에는 주 3, 4회 가다가 얼마 지나지 않아 주 1회로 줄어든다. 그러다가 나중에는 샤워만 하고 오기도 한다.  이런 사례는 흔하다. 박동일 강북삼성병원 소화기내과 교수(54)도 그랬다. 병원 주변 헬스클럽에 등록했지만 가장 많이 갔을 때가 주 2회였다. 운동량이 부족하니 체중도 늘었다. 음식에 좀 신경을 썼더니 체중이 더 늘지는 않았지만 근육량은 줄었다. 지속적으로 할 수 있는 운동이 필요했다. 박 교수는 출퇴근길을 활용했다. 덕분에 몸 상태도 좋아졌단다. 톡톡히 효과를 본 셈이다. 박 교수의 건강법을 들어 봤다. ○“출퇴근 자체가 완벽한 운동” 언젠가 출근하는 전철 안에서 친한 병원 동료를 만났다. 그 후배가 병원 두 정거장 전에서 내렸다. 이유를 물었더니 걷기 위해서라고 했다. 당시만 해도 박 교수는 그런 후배를 보며 큰 감흥이 없었다.  그랬던 박 교수가 지금은 매일 걸어 출퇴근한다. 벌써 5년째다. 특별한 계기는 없었다. 병원에서 서너 정거장 떨어진 곳에서 저녁 약속이 있었다. 한번 걸어볼까 하며 청계천을 따라 걸었다. 의외로 괜찮았다. 출근할 때 걸어야겠다고 결심했다. 그게 시작이었다.  박 교수는 오전 6시 반 전후에 집을 나선다. 사람이 덜 붐비는 시간에 걷기 위해서다. 전철역까지 15분 정도 걸어간다. 전철을 한 번 갈아타고 동대문역사문화공원역에서 내린다. 이후 본격적으로 걷기 시작한다. 청계천을 따라 쭉 걷다가 청계광장으로 나온 후에는 덕수궁 길을 따라 걷는다.  걷는 속도는 시속 6km 정도. 너무 빠르지도, 느리지도 않다. 출근하는 데 1시간 반 정도 소요된다. 처음에는 주 3회 정도 이렇게 출근했다. 걸어 보니 좋았다. 얼마 후 매일 걷기로 바꿨다. 이후 출근길 걷기를 가급적 하루도 거르지 않는다. 비가 오면 우산을 쓰고 걷는다. 날씨가 너무 나쁘면 동대문역사문화공원부터 서울시청역까지 연결된 지하도를 걷는다.  출근길 걷기가 익숙해지자 퇴근길 걷기에 도전했다. 하지만 병원과 학회 업무도 많았고, 저녁 약속도 많았다. 매일 퇴근길 걷기는 쉽지 않았다. 신종 코로나바이러스 감염증(코로나19)이 확산하면서 저녁 약속이 크게 줄었다. 이젠 퇴근길 걷기도 매일 한다. 코스는 출근길 코스와 같다. 가끔 여유가 있을 때는 동대문역사문화공원을 지나쳐 30분 이상을 더 걷기도 한다.○하루 2만 보 이상 걸어 박 교수는 걷기 애플리케이션을 활용한다. 출퇴근길에 걷고 병원 안에서도 많이 걷다 보니 매일 2만 보를 넘는다. 박 교수는 “사실 처음에는 매일 1만 보 걷는 게 목표였는데, 걷다 보니 그 정도로는 건강 증진에 큰 도움이 되지 않는 것 같아 2만 보로 올렸다”고 말했다.  저녁 약속이 있는 날에는 낮에 걷는다. 진료가 없는 날에는 연구팀 동료들과 함께 점심시간을 이용해 인근 산에 오른다. 1시간 반 정도 소요된다. 박 교수는 “성곽 길을 따라 걷거나 인왕산 정상까지 종종 간다”고 말했다. 출퇴근하지 않는 휴일에도 걷는다. 아내와 함께 반려견을 데리고 집 주변 공원으로 간다. 평일처럼 2만 보는 걷지 못하지만 웬만하면 1만 보는 채운다. 휴일에 가끔 골프장에 갈 때도 카트를 타지 않고 18홀 내내 걷는다.  걷고 난 후에는 스트레칭을 한다. 종아리와 허벅지 근육을 이완시켜주는 동작 위주로 한다. 박 교수는 “몸이 쑤시는 채로 그냥 두면 나중에 더 아플 수 있어 스트레칭도 걷기 일환으로 생각하고 반드시 한다”고 말했다.  매일 이렇게 걸으면 오히려 피곤하지 않을까. 아주 고강도의 근력 운동이 아니기 때문에 피로감을 많이 느끼지는 않는다. 그래도 몸이 쉴 필요가 있단다. 이를 위해 휴일에 반나절 정도는 침대에 누워 휴식을 취한다. 다만 수면 리듬이 흐트러질 수 있어 잠은 몰아서 자지 않는다. 대신 밀린 책도 읽고, 인터넷 영상도 보며 느긋하게 시간을 보낸다. ○5년 동안 출퇴근 걷기의 효과 출퇴근 걷기를 하기 전 그의 몸 상태는 썩 좋지 않았다. 나이가 들면서 체중이 조금씩 불었고, 혈압과 콜레스테롤 수치도 높았다. 특히 콜레스테롤 수치가 높아 한때 약을 먹기도 했다. 출퇴근 걷기를 하면서 몸이 달라졌다. 혈압은 더 오르지 않아 정상 범위를 유지했다. 콜레스테롤 수치도 크게 떨어져 정상 수준을 거의 회복했다. 따로 근력 운동을 하지 않는데도 근육량이 늘었다. 뿐만 아니라 몸이 상당히 가벼워졌다는 느낌을 자주 받는다.  심리적으로도 많이 안정됐다. 일단 혼자 걷는 시간이 늘면서 자신을 돌아볼 기회를 많이 갖게 됐다. 머릿속으로는 밀린 일을 생각하면서 몸은 걷는 일이 많았다. 그러다 보니 골치를 꽤나 썩이는 여러 프로젝트의 해결점을 찾을 때도 더러 있었다. 미국에 있는 딸과도 출근 시간에 영상통화로 대화한다. 몇 달 전에는 대학을 졸업한 딸의 진로를 놓고 여러 날에 걸쳐 출근 화상통화를 하기도 했다. 업무량도 많고 미국과 시차가 있어 좀처럼 하지 못하던 통화를 이틀마다 하다 보니 서로에 대한 오해도 풀리고, 최적의 해법을 찾아냈단다. 걷기가 생활의 일부를 넘어 치유의 도구가 됐다.출퇴근길 걸을땐전용 운동화-양말 여분 충분히… 처음엔 천천히 걷고 자신만의 코스 개발하면 좋아



박동일 교수가 걷기를 끝낸 후 발을 쭉 뻗는 스트레칭을 하고 있다. 신원건 기자 laputa@donga.com출퇴근길 걷기로 건강을 챙기면 어떨까. 박동일 강북삼성병원 소화기내과 교수는 “한 달만 꾸준히 하면 적응이 돼 별로 어렵지 않을 것”이라고 했다. 다만 준비는 철저히 해야 한다.  첫째, 걷기용 운동화를 신어야 한다. 편한 구두라 해도 발에 무리가 간다. 출근 후 발에 땀이 찰 수 있기 때문에 사무실에 여분의 양말과 신발을 두는 게 좋다. 하루 이틀로 끝낼 게 아니기 때문에 자외선에도 대비해야 한다. 가급적 모자를 쓰고 걷도록 하자. 와이셔츠를 잘 안 입는다. 겉에는 양복을 입지만 면으로 입는다. 습관이 되니까 20분 지나면 땀이 식는다. 옷은 갈아입고 연구실 옷장에 여벌의 옷과 양말 같은 것을 놓는다.  둘째, 입문 단계에서 속도를 너무 내서는 안 된다. 무릎에 이상이 생길 수 있고 발바닥 통증도 나타나기 쉽다. 빨리 걸으려는 욕심을 줄이고 천천히 걷도록 하자. 어느 정도 적응이 되면 속도를 서서히 올린다.   셋째, 걷기 위한 자기만의 코스를 개발하는 게 좋다. 사람이 많거나 도심 거리는 일단 피하도록 하자. 한적한 거리라 해도 신호등이 많으면 피해야 한다. 출퇴근 시간이 조금 더 걸리더라도 걷기에 좋은 코스를 찾도록 하자. 이렇게 하려면 처음에는 여러 코스를 걸어봐야 한다.  넷째, 지하철이나 버스 같은 대중교통을 이용하는 시간도 줄이고, 그 시간에 걸어야 운동 효과를 높일 수 있다. 다리를 건너거나 복잡한 도심을 통과해야 할 때가 아니면 대중교통도 줄이고 걷도록 하자.  다섯째, 걷기를 끝냈다면 마무리 스트레칭을 해줘야 한다. 걷기 전, 혹은 걷는 도중에 스트레칭을 하는 것도 좋다. 다만 이 모든 과정을 생략하더라도 운동을 끝낸 후에는 꼭 스트레칭을 하자. 그래야 뭉치고 수축된 근육을 풀어줄 수 있다.",105,https://n.news.naver.com/mnews/article/020/0003389125?sid=103
“차라리 킥보드 없애라!” 혁신 이동 수단→길거리 골칫덩어리,2021.10.23. 오후 1:42,"길가에 방치된 공유킥보드[트위터 갈무리][헤럴드경제=유동현 기자] “공유킥보드, 그냥 사라져버리면 좋겠다고요?”근거리 친환경수단으로 주목받으며 빠르게 몸집을 키워온 공유킥보드가 잇단 악재에 직면했다. 시장을 둘러싼 부정적 여론과 더불어 각종 규제들로 성장에 제동이 걸린 것이다. 지난해 기준 1년 새 6배가량 성장하며 ‘라스트마일’(고객 목적지까지 마지막 이동거리) 대표 혁신 서비스로 각광받았으나 최근 시장 철수 기업까지 나타나며 적신호가 켜졌다.공유킥보드는 대중교통이 닿지 않는 마지막 장소까지 이동케 해주는 혁신 서비스로 주목받았다. 환경 친화적인데다 특히 지난해 코로나19로 사회적 거리두기가 이행되면서 이용량도 증가했다.모바일 분석업체 아이지에이웍스에 따르면 지난해 기준 이용자는 21만명으로 전년 동기(3만 7000명) 대비 6배 성장했다. 비교적 저렴한 가격에 가까운 거리를 편하게 이동할 수 있어 20∼30대 청년층 중심 이용률이 증가했다.시장이 급성장하면서 공유킥보드 업체들도 우후죽순 생겨났다. 14개 공유킥보드 회원사로 구성된 코리아스타트업포럼 퍼스널모빌리티산업협의회(SPMA)에 따르면 5월 기준 전국에서 운영되는 공유 킥보드는 9만 1028대에 이른다. 지난해 10월 대비 75% 성장한 수치다. 글로벌 모빌리티 기업들과 더불어 스타트업들이 가세하며 각축전이 벌어졌다.카카오도 “렌터카, 공유 킥보드를 통해 이동 수단을 더욱 촘촘히 연결할 예정”이라며 킥보드 시장 진출을 예고했다.



[헤럴드DB]이처럼 킥보드가 늘어날수록 이용자 문제도 불거졌다. 동승자 탑승, 교통법규 위반 등 각종 안전 위반 사례들이 발생하면서, 킥보드는 길거리의 골칫덩어리로 여겨졌다. 최고 속도는 시속 25km로 제한됐지만, 안전장치를 푸는 방법 등이 사회관계망서비스(SNS)서 공유되며 도로 위를 고속 질주하는 모습도 사회문제로 대두됐다. 이에 여론도 급속도로 악화되면서 ‘차라리 킥보드를 없애라’는 목소리에도 힘이 실렸다.안전 우려가 커지면서 규제들도 생겨났다. 부상 위험을 방지하기 위해 헬멧 미착용 시 벌금 부과, 이용 시 면허 소지를 골자로 하는 도로교통법개정안이 5월부터 시행됐다. 이어 서울시가 불법 주·정차 킥보드 즉시 견인 조치를 시행했다. ▷차도 ▷지하철 출입구 근처 이동에 방해되는 구역 ▷버스정류장·택시승강장 10m 이내 ▷시각장애인용 점자블록 위교통약자 엘리베이터 진입로 ▷횡단보도 진입로 등에서 보행자에 위협이 된다면 견인업체가 발견 즉시 전동킥보드를 끌고 가는 게 가능해졌다. 이에 따라 업체가 받은 견인료와 보관료도 시행 2개월 반 만에 3억원이 넘었다.



서울시는 지난 7월부터 공유킥보드 불법 주·정차 단속 및 즉시 견인 조치를 시행했다. 성동구청의 한 주차단속직원이 거리에 놓인 킥보드를 단속하고 있다. [성동구청 제공]부정적 여론과 맞물려 규제에 따른 이용률 감소로 킥보드 업계는 직격탄을 맞았다. 도로교통개정안 시행 후 ‘이용률 반토막’을 호소하던 업체들 중에는 규제를 이기지 못하고 사업 철수 및 축소 사례가 나타나기 시작했다. 최근에는 국내 진출한 독일 모빌리티 기업 ‘윈드’가 사업 철수를 발표했다. 복수 킥보드 업체는 서울 일부 지역 운영대수 축소에 들어갔다. 선두기업으로 꼽히는 A업체는 이달 영등포, 동작, 관악, 마포 지역 운영을 종료했다.킥보드 업계에서도 위기감이 커졌다. 좀처럼 진화되지 않는 부정 여론과 더불어 규제 흐름에 대한 부담 탓이다. 한 킥보드 업계 관계자는 “한때 친환경 수단으로 떠받들던 킥보드가 골칫거리로 전락해버린 측면도 사실”이라며 “이제 막 태동하는 산업인만큼 관련 제도가 마련되면서 규제 아래 성장해 나가는 것이 최선”이라 말했다.",105,https://n.news.naver.com/mnews/article/016/0001902931?sid=103
"[강민구의 星별우주]우주 문 연 누리호, 우주개발 예산은 얼마나",2021.10.23. 오후 4:01,"문재인 정부 연평균 우주개발 예산은 6041억원누리호 2조, 누리호 반복발사 6874억원우주개발 예산 늘어나지만 선진국 대비 적어[이데일리 강민구 기자] 지난 21일 국산 로켓 누리호가 발사되면서 우주로 향한 문을 열었습니다. 전 세계 각국이 우주를 개발하기 위한 경쟁을 펼치고 있는 가운데 우리나라도 우주에 도전하고 있는데요, 예산은 어느 정도 수준일까요.우선 국민들이 우주라고 하면 흔히 떠올리는 로켓인 나로호에는 5205억원, 누리호 개발·발사, 인프라 조성 등에는 1조 9572억원 정도가 들었습니다.과학기술정보통신부가 최근 낸 설명자료에 의하면 문재인 정부(2018년~2021년)의 연평균 우주개발 예산은 약 6041억원입니다. 박근혜 정부(2013년~2017년)의 연평균 예산(5700억원) 보다 투자 규모가 줄어들지 않았다는 입장입니다. 누리호를 비롯해 천리안 2A·2B호 등 대형 우주개발사업이 끝나는 시점이 도래하면서 우주개발 예산이 일부 줄어들기도 했지만 후속 사업이 본격적으로 이뤄지면 오히려 늘어날 것으로 예상하고 있습니다.앞으로 국내 주요 우주개발 사업으로는 △한국형 위성항법시스템(KPS) 개발(3조 7235억원) △한국형발사체 고도화(누리호 4회 반복발사, 6874억원) △정지궤도공공복합통신위성 개발(4118억원) △초소형군집위성시스템 개발(1219억원) △차세대중형위성 개발(3067억원) 등이 예정돼 있습니다.다른 나라와 비교하면 위치는 어느 정도일까요? 한 컨설팅 업체의 분석 내용을 참고하면 전 세계적으로 우리나라의 우주 개발 예산이 GDP 대비 비중이나 금액적으로 많지 않다는 것을 확인할 수 있습니다.유로컨설트의 2020년 예산 분석 자료에 의하면 우리나라의 우주개발 예산은 232달러(2011년)을 시작으로 599달러(2015년), 722달러(2020년)로 늘어나는 추세에 있습니다. 이는 누리호 개발과 인프라 투자 증가, 달탐사 사업 추진에 따른 것으로 보입니다.민수용 우주개발 예산은 2020년 기준으로 △미국(235억 1500만 달러) △러시아(20억 1600만 달러) △중국(59억 9200만 달러) △일본(23억 1800만 달러) △인도(17억 7900만 달러) △유럽연합(24억 2900만 달러) 수준이고, 우리나라는 7억 2200만 달러 수준으로 나타났습니다.우주 개발 총 예산의 GDP 비중(%)을 살펴보면 미국(0.21), 러시아(0.2), 프랑스(0.14), 중국(0.04), 일본(0.06), 인도(0.05), 한국(0.04) 정도로 조사됐습니다.



지난 21일 전남 고흥 나로우주센터에서 발사된 누리호가 우주로 올라가고 있다.(사진=과학기술정보통신부)",105,https://n.news.naver.com/mnews/article/018/0005067495?sid=103
엄마 살해당하자 춤추는 딸…치밀한 연출·가창력 빛났다,2023.10.22. 오후 6:15,"슈트라우스 오페라 '엘렉트라' 韓 초연불가리아 소피아 오페라극장대구오페라하우스와 공동제작



그리스 미케네 왕가의 아가멤논 궁전. 10년 만에 돌아온 남편 아가멤논을 클리템네스트라는 정부(情夫)인 아이기스토스와 함께 살해하고, 두 딸인 공주 엘렉트라와 크리소테미스마저 하녀처럼 취급한다.오스트리아 극작가 휴고 본 호프만스탈이 고대 그리스 비극을 각색한 대본에 리하르트 슈트라우스가 음악을 입힌 오페라 ‘엘렉트라(사진)’는 엄마에 대한 분노로 미쳐 날뛰는 엘렉트라를 하녀들이 비방하는 장면으로 시작한다.지난 20~21일 대구오페라하우스 무대에 오른 플라멘 카르탈로프 연출의 ‘엘렉트라’는 첫 장면부터 독특하다. 무대 한쪽에서 하녀들이 엘렉트라를 비난하는 노래를 부를 때 다른 한쪽에선 대형 가위를 든 엘렉트라가 제정신이 아닌 듯 자신의 머리카락을 마구 자른다. 음악과 가사에 맞게 입체적으로 시각화한 무대가 절묘하다.1909년 초연한 110분짜리 단막 오페라 ‘엘렉트라’는 이후 세계 오페라 극장의 주요 레퍼토리로 자리 잡았지만, 국내에서는 그동안 다양한 색깔의 성악가를 요구하는 캐스팅과 ‘친모 살해’라는 비윤리적 소재 등으로 무대에 오르지 못했다.이번 한국 초연은 연출가 카르탈로프가 이끄는 불가리아 소피아 국립 오페라·발레극장과 대구오페라하우스의 합작으로 성사됐다. 지난 6일 개막한 제20회 대구국제오페라 축제의 최고 기대작으로 무대에 오른 ‘엘렉트라’는 창의적이고 역동적인 무대 연출이 돋보였다. 극이 진행되는 아가멤논 궁전 내부는 반투명한 비닐 벽으로 나눠진 회전 무대로 구현됐다. 첫 장면부터 이 무대가 회전하면서 극에 생동감을 부여하고, 다음 장면으로 자연스럽게 이어지는 연속성을 살렸다.첫날 공연에서는 소프라노 릴리야 케하요바(엘렉트라)와 츠베티나 반달로프스카(크리소테미스), 메조소프라노 게르가나 루세코바(클리템네스트라)가 깊이 있는 내면 연기와 함께 각 배역에 맞는 가창을 극적으로 들려줘 객석의 호응을 이끌어냈다.",105,https://n.news.naver.com/mnews/article/015/0004905272?sid=103
"홍천군, 영귀미면에서 주민 드론 교육",2021.10.23. 오후 9:55,[KBS 춘천]홍천군은 오늘(23일) 영귀미면 생활체육공원에서 지역 주민들을 대상으로 드론 조종 교육과 시연 행사를 진행했습니다.이번 교육에는 촬영용과 농업용 등 드론 17대가 투입됐습니다.홍천군은 드론 산업 경쟁력 확보를 위해 지속적인 교육을 실시할 계획입니다.,105,https://n.news.naver.com/mnews/article/056/0011143017?sid=103
