title,date,main,section,url
[IT돋보기] '토스' 올라 탄 '타다'…택시 시장 전운 감돈다,2021.10.09. 오전 6:01,"토스 투자금 바탕으로 타다 양적 성장 투자 전망…타다 사업 확장 관심'토스'에 올라탄 '타다'가 모빌리티 사업 강화에 나선다. 이에 따라 택시 시장에 대한 지각변동이 일어날지 업계가 촉각을 곤두세우고 있다.특히, 토스가 모빌리티 사업에 진출하면서 핀테크 사업과의 시너지 효과가 예상되면서 카카오모빌리티가 사실상 장악하고 있는 택시 시장의 변화도 주목된다.9일 업계에 따르면 토스는 타다의 운영사인 VCNC의 지분 60%를 쏘카로부터 인수했다. 인수 금액은 공개되지 않았지만 투자금 모두를 타다의 성장에 쓰겠다는 것이 토스의 방침이다. 쏘카는 타다의 나머지 지분 40%를 VCNC를 통해 보유한 채 전략적으로 토스와 협업할 에정이다.



금융 플랫폼 토스가 타다를 인수한다. 사진은 타다 가맹 택시. [사진=타다]토스는 모빌리티 사업에 본격적으로 직접 진출하기보다는, 자신들의 핀테크 서비스를 타다의 다양한 모빌리티 서비스와 결합하는 등의 방식으로 시너지 효과를 내려는 목적이라고 발표했다. 즉 금융 서비스 확대 차원이다. 이를테면 '타다 라이트'를 통해 택시를 호출하고 요금을 결제할 때 토스의 간편결제를 활용하는 식이다. 실제로 카카오페이가 카카오모빌리티의 택시 호출 플랫폼인 '카카오T'를 등에 업고 급성장한 사례도 있다.토스 관계자는 ""모빌리티와 핀테크의 조합은 이미 동남아 '그랩' 등의 사례도 있다""며 ""택시 시장의 규모가 연간 12조원 정도 되는 만큼 그쪽에서 일어나는 결제와 관련해 저희 쪽에서도 고려해 볼 수 있는 영역이라고 생각했다""라고 말했다.다만 업계에서는 토스가 타다 인수를 위해 지불한 투자금이 타다의 양적 성장에 활용되면서 결국 모빌리티, 특히 택시 시장에 어느 정도의 지각변동을 유발할 수 있다는 관측이 나온다. 타다에 대한 투자가 제대로 이뤄진다면, 지난 2018년 국내 최초 '승차호출' 서비스로 모빌리티 서비스를 뒤흔들었던 명성만큼은 아니더라도 어느 정도 이전의 입지를 되찾을 수 있을 것이라는 기대다.타다의 핵심 서비스는 카카오모빌리티와 마찬가지로 플랫폼 가맹택시 서비스인 '타다 라이트'다. 하지만 시장 1위 사업자인 카카오모빌리티에 비하면 운행 대수는 물론 이용자 수도 훨씬 적다. 지난해부터는 SK텔레콤과 우버의 합작사인 '우티'가 본격적으로 서비스를 시작하면서 타다 라이트의 입지는 더욱 애매해졌다.모빌리티, 특시 택시 사업의 특성상 확장을 위해서는 지속적인 투자가 필요하다. 그러나 타다의 기존 최대주주인 쏘카는 아직 적자를 보고 있다. 주력 사업인 카셰어링 분야의 흑자 전환이 조만간 이뤄지는 것을 토대로 내년 기업공개(IPO)를 목표로 하고는 있지만, 아무래도 타다에 꾸준한 투자를 하기에는 여력이 제한적이었을 가능성이 크다. 더욱이 투자 대비 성과가 보장되지도 않는다.이러한 상황에서 토스의 인수를 통한 자금 수혈은 타다의 사업 활성화에 큰 도움이 될 것으로 보인다. 전반적인 마케팅 공세와 서비스 라인업 확대 등을 통한 발빠른 움직임이 기대되는 대목이다.타다는 현재 준고급택시 '타다 플러스', 공항 이동 예약 서비스 '타다 에어', 골프장 이동 예약 서비스 '타다 골프' 등의 서비스를 운영 중이다. 토스가 연말 새롭게 타다 서비스를 선보인다고 발표한 만큼 구체적인 방향성은 조만간 발표될 전망이다. 모빌리티업계 한 관계자는 ""꼭 일반택시 호출뿐만 아니라 타다가 하고 있는 다양한 택시 관련 사업을 염두에 둔 것으로 보인다""고 말했다.토스 입장에서도 모빌리티 사업과의 본격적인 시너지를 위해서는 결국 타다가 승기를 잡는 것이 중요하다. 카카오페이가 카카오T의 효과를 본 것은 카카오T의 이용자 수가 그만큼 많고 서비스도 활성화됐기 때문이다. 그렇기에 토스가 타다의 이용자 수를 늘리는 등 성공을 위해 노력하는 것은 예정된 수순이라는 전망이다.차두원 차두원모빌리티연구소 대표는 ""모빌리티 플랫폼 이용자들의 결제 규모가 만만찮고 이들의 결제 데이터를 확보할 수 있기 때문에 토스가 지속적으로 모빌리티 업체에 관심을 가져 왔으며 장기적으로는 이를 토대로 '카 커머스'를 염두에 둘 수도 있다""며 ""타다를 인수하면서 토스가 적어도 어느 정도는 타다의 마케팅 비용이나 기사들을 끌어들이기 위한 인센티브 등을 지원할 것으로 보인다""라고 말했다.토스의 투자로 타다가 다시 활성화될 경우 카카오모빌리티 위주로 돌아가는 국내 택시호출 시장이 다시 한 번 경쟁 체제로 들어갈 가능성도 제기된다.당장은 워낙 카카오모빌리티의 점유율이 높고 입지도 단단하기 때문에 큰 변화가 일어나지는 않겠지만, 지속적인 투자가 이어진다면 변수가 생길 수도 있다는 것이다. 경쟁 활성화로 인해 이용자나 택시기사 등에 대한 혜택이 늘어날 가능성도 대두된다.업계 관계자는 ""택시 기사들에 대한 수수료 인하라든지 각종 프로모션, 택시 이용자들에 대한 다양한 혜택 증가 등이 활성화될 수 있을 것""이라며 ""토스가 얼마나 지속적으로 타다에 투자를 하느냐가 중요할 전망""이라고 말했다.",105,https://n.news.naver.com/mnews/article/031/0000628004?sid=103
"휠체어 밀고 온 유인촌 장관, '모두예술극장'서 감동…왜?",2023.10.24. 오후 5:22,"[서울=뉴시스] 최진석 기자 = 유인촌 문화체육관광부 장관이 24일 서울 서대문구 장애예술공연장 '모두예술극장'에서 열린 개관식에서 한 참석자의 휠체어를 밀어주며 입장하고 있다. 2023.10.24. myjs@newsis.com[서울=뉴시스]신재우 기자 = ""저랑 다 일했던 분들인데 굉장히 오랜만입니다.""24일 서울 서대문구 모두예술극장 개관식에 유인촌 장관이 관람객의 휠체어를 밀고 입장하면서 참석자들과 반갑게 인사했다.유 장관은 이날 개관 축사에서 2008년 장관 재임 당시를 회상하며 ""15년 전으로 타임머신을 타고 돌아간 기분""이라고 표현했다. 그는 ""당시에 같이 머리를 맞대고 장애인을 위한 여러 가지 정책을 만들어 보려고 노력했고 장애인에 대한 생각을 조금 바꿔보자고 해서 시작한 작은 것들이 지금 이 정도로 만들어졌다""며 뿌듯함을 드러냈다.이어 ""장애인과 비장애인이 한 공간에 같은 시간에 함께 할 수 있다는 건 굉장히 중요한 의미가 있다. 그리 크지 않은 공간이지만 이 안에서 벌어질 수 있는 일은 우리가 상상할 수 없는 그런 세상을 넘나드는 공간이다""라며 ""이 공간에서 감각, 재능과 같은 예술 형태를 마음껏 펼쳐서 모두가 감동하고 갔으면 좋겠다""고 덧붙였다.



[서울=뉴시스] 최진석 기자 = 유인촌 문화체육관광부 장관이 24일 서울 서대문구 장애예술공연장 '모두예술극장'에서 열린 개관식에서 손뼉을 치고 있다. 2023.10.24. myjs@newsis.com모두예술극장은 이날 개막한 국내 첫 장애예술인 표준공연장이다. 문체부는 장애예술의 창의성·다양성·향유권을 실현하기 위해 공연·창작·교육·교류 등을 할 수 있는 공연장을 만들고자 공간을 기획했다. 지난해 10월부터 구세군빌딩 3개 층(1~3층)을 리모델링해 1년여 만에 문을 열게 됐다.공연장의 모든 층이 단차가 없는 것이 특징이다. 이 외에도 휠체어석으로 조정할 수 있는 250석 규모의 중극장, 연습실 등 창작레지던시와 교육 공간과 소규모 공연과 시연회(쇼케이스)가 가능한 창작 스튜디오 등 장애예술인을 위한 시설이 마련됐다. 공연장은 이달 초부터 시범 운영을 시작해 국내외 장애예술 우수 작품, 창작·기획 작품 등 10개 작품을 내년 2월까지 선보인다.



[서울=뉴시스] 최진석 기자 = 유인촌(왼쪽 두번째) 문화체육관광부 장관이 24일 서울 서대문구 장애예술공연장 '모두예술극장'에서 열린 개관식에서 참석자들과 현판제막을 하고 있다. 2023.10.24. myjs@newsis.com""그동안 뭐 하고 지냈어요? 우리 오랜만에 뭐 하나 같이 할까요?""이날 유 장관은 개관식에 앞서 김현희 한국장애인문화예술원 이사장 등 개관식에 참석한 장애예술인과 만나 일일이 인사를 나눴다. 그 중엔 2010년 장애인으로는 처음 장관 정책보좌관에 임명돼 유 장관과 일했던 차현미씨도 있었다. 이 외에도 그는 극장의 창작 스튜디오와 연습실, 단체 분장실 등을 방문해 공연을 준비 중인 단원들에게 ""연습을 많이 했냐""며 질문을 건내고 ""오늘 연주가 기대된다""는 격려를 건네기도 했다.기자들과 만난 유 장관은 ""여유 공간이 충분히 확보된 것 같아 좋다""며 ""국내 공연장이 대부분 열악해서 이런 여유 공간이 부족한데 그렇지 않아서 다행""이라며 시설을 본 소감을 밝혔다. 



[서울=뉴시스] 최진석 기자 = 유인촌 문화체육관광부 장관이 24일 서울 서대문구 장애예술공연장 '모두예술극장'에서 열린 개관식에서 축사를 하고 있다. 2023.10.24. myjs@newsis.com",105,https://n.news.naver.com/mnews/article/003/0012166423?sid=103
"스마일게이트 ""우리의 바다를 지켜줘"" 기부금 환경재단 전달",2021.10.08. 오후 4:42,"'지구쓰담' 캠페인 활동 모습 /스마일게이트 제공스마일게이트 메가포트가 인게임 사회 공헌 이벤트 '우리의 바다를 지켜줘'를 통해 모은 1200만 원 기부금을 환경재단에 전달했다고 8일 밝혔다. '우리의 바다를 지켜줘' 이벤트는 테일즈런너 이용자들이 여름 콘텐츠 업데이트 테마인 '감정의 제도' 바다 주변에 널려 있는 쓰레기를 줍는 퀘스트를 수행하면 스마일게이트가 후원금을 적립해 기부하는 내용이다. 지난 8월 4일부터 30일까지 진행했다. 스마일게이트 메가포트 관계자는 ""퀘스트 완료 목표 횟수인 20만 회를 훨씬 초과하는 117만 회가 성공적으로 완수돼 총 1200만 원의 기부금을 조성하게 됐다""며 ""이용자들의 적극적인 참여에 깊은 감사 말씀을 드린다""고 전했다.  조성된 기부금은 스마일게이트 희망스튜디오를 통해 환경재단의 '지구쓰담(지구의 쓰레기를 담다)' 캠페인에 전달됐다. 환경재단에서 진행하는 '지구쓰담 캠페인'은 바다 쓰레기 문제를 사회에 알려 시민 인식을 개선하고 정화 활동을 펼치며 관련 단체를 지원하는 캠페인이다. 스마일게이트 메가포트 임직원들은 퀘스트 목표 초과 달성에 대한 감사 의미로 지난 7일 경기도 판교 주변 하천 환경 정화 활동을 진행하기도 했다.김유진 스마일게이트 메가포트 팀장은 ""이번 이벤트의 성공으로 게임을 즐기면서 동시에 사회에 공헌하는 즐거운 기부문화가 더욱 널리 확산되길 바란다""며 ""스마일게이트 메가포트와 테일즈런너는 앞으로도 의미 있고 즐거운 사회 공헌 활동들을 이용자들과 함께 할 수 있도록 노력해 나가겠다""고 말했다.",105,https://n.news.naver.com/mnews/article/629/0000109806?sid=103
"“너무 비슷하지 않나요?” 중국 화웨이, 삼성 ‘베끼기’로 승부?",2021.10.09. 오후 9:58,"[렛츠고디지털 캡처][헤럴드경제=박혜림 기자] “삼성 위협했던 화웨이, 갤럭시Z플립 ‘닮은꼴’로 승부?”미국의 제재로 전 세계 2위 스마트폰 제조사에서 5위로 주저 앉은 중국 ‘화웨이’가 연내에 신형 폴더블(접는) 스마트폰을 출시할 것으로 보인다. 삼성전자의 전략스마트폰 갤럭시Z플립3을 연상케 하는 클램셸(위아래로 여닫는) 폰이다. 카메라 배열만 다를 뿐 매우 유사하다. 화웨이는 삼성전자를 위협했던 중국의 대표 스마트폰업체다. 하지만 현재 미국의 중국 견제로 어려움을 겪고 있는 상황이다. 9일 중국 현지 IT팁스터(정보유출가) 판다(Panda)는 웨이보를 통해 화웨이가 ‘메이트V’ 폴더블폰을 연내에 출시할 것이라고 주장했다. 최근 국내 출시 인기를 끌고 있는 삼성전자 갤럭시Z플립3와 매우 유사하다. 



삼성전자 폴더블폰 ‘갤럭시Z플립3’와 유사한 화웨이 폴더블폰 [렛츠고디지털 캡처]업계 안팎에선 갤럭시Z플립3를 떠올리게 하는 메이트V의 외관 디자인으로 미루어, 화웨이가 이번에도 삼성전자 갤럭시 폴더블폰을 염두에 둔 것 아니냐는 분석이 나온다.화웨이는 앞서 폴더블폰인 메이트X2를 출시한 바 있다. 이 제품 역시 시장에서 갤럭시Z폴드 시리즈와의 유사성이 잇따라 지적되자 리처드 유 화웨이 최고경영자(CEO)는 삼성전자 갤럭시Z폴드2와의 ‘차별점’을 거듭 강조하기도 했다.그럼에도 불구하고 메이트X2는 310만원에 달하는 높은 가격과 디스플레이 ‘주름 문제’ 등을 극복하지 못하며 현지에서도 큰 인기를 얻지 못했다. 이에 갤럭시Z플립 시리즈가 시장에서 반향을 일으키는 가운데, 유사 제품을 출시해 ‘재기’를 모색하려는 것 아니냔 관측이 나온다.시장조사업체 카날리스에 따르면 화웨이의 올해 2분기 글로벌 스마트폰 점유율은 5위로, 지난해 같은 기간(1위)와 비교하면 4계단 떨어졌다. 한편 디스플레이 전문 시장조사업체 디스플레이서플라이체인컨설턴트(DSCC)는 올해 폴더블폰 출하량이 750만대를 넘어서며 전년 대비 232% 성장할 것으로 내다봤다. 지난해 출하량 220만대의 3.4배 수준이다. 삼성전자의 점유율이 85%에 달할 것으로 예상되며 그 뒤를 화웨이(10%)가 이을 것으로 전망된다.",105,https://n.news.naver.com/mnews/article/016/0001897285?sid=103
토스가 망해가는 사업 인수하는 이유… “투자 받으려면 덩치가 중요”,2021.10.09. 오전 6:00,"수익 안 나도 상장 대박 낸 쿠팡 따라가는 토스내리막길 대기업 PG사업 인수로 외형 2배 키워 성장 정체 극복 위해 카카오식 문어발 확장 시도



이승건 비바리퍼블리카 대표가 지난 3월 기자간담회를 열고 토스뱅크에 대해 설명하고 있는 모습. /연합뉴스        간편 송금 등 금융 플랫폼 ‘토스’를 운영하는 비바리퍼블리카(이하 토스)가 카카오가 장악하고 있는 택시 호출 시장에서 고전하고 있는 ‘타다’를 전격 인수해 그 배경에 관심이 쏠리고 있다.8일 토스는 타다 운영사 VCNC(이하 ‘타다’)의 지분 60%를 인수하기로 했다고 밝혔다. 타다가 신주를 발행하고 토스가 인수하는 방식이다. 토스는 기존 쏘카를 제치고 타다의 최대주주가 됐다. 타다 서비스 운영도 쏘카가 아닌 토스가 주도적으로 하게 된다. 토스는 이번 인수를 통해 토스 결제의 외연을 모빌리티까지 확장하겠다고 밝혔다. 자사 2000만 고객과 타다의 900만 고객을 대상으로 통합하겠다는 것이다.지난해 3월 이른바 ‘타다 금지법(개정 여객자동차법)’ 통과로 렌터카·기사를 함께 부르는 서비스 ‘타다 베이직’이 사라지고 택시 위주로 모빌리티 시장이 재편되면서 이 시장은 카카오가 장악한 상태다. 타다는 타다 금지법 통과를 기점으로 ‘시동이 꺼진 혁신’이라는 평가를 받아 왔다. 일각에서는 금융 혁신 스타트업으로 꼽히는 비바리퍼블리카가 그 DNA를 모빌리티로 확장해 성장을 꾀하려 한다는 시각을 내놓기도 했다.회사 사정을 잘 아는 한 내부 관계자는 그러나 “전 세계 스타트업은 수익을 못 내도 상장을 통해 대박 낸 ‘쿠팡’을 따르는 시나리오가 유행처럼 퍼지고 있다”라면서 “여기까지 가기 위해서는 쿠팡에 돈을 댄 소프트뱅크처럼 벤처캐피털의 투자를 받아야 하고 이를 위해서는 ‘토스가 계속 성장하고 있다’라는 것을 보여줘야 하는데, 토스 이용자 수가 정체된 상황에서 이를 증명할 수 있는 유일한 지표는 ‘매출’일 수밖에 없다”라고 했다.최근 3년간 토스가 공시한 실적 동향을 보면, 실제로 회사는 매년 2배가량의 매출 성장을 이어가고 있다. 2018년 548억대에 그쳤던 매출은 2019년 1187억으로, 2020년 다시 3898억원으로 뛰었다. 2020년 눈에 띄는 매출 성장에는 토스가 2019년 말 인수한 LG유플러스의 전자결제사업부문(PG)의 매출이 작용했다고 전문가들은 말한다. 실제 지난해 토스의 별도 매출은 1766억원선이었는데 연결 회계기준으로 보면 2100억원 가량의 매출이 확 늘어난다.



타다 가맹 택시 모습. /타다 웹사이트 캡처.        토스 관계자는 “PG사업 영업이익률은 1%대로 대기업은 철수하는 분위기이지만, 토스는 매출 때문에 이를 인수한 것”이라며 ”매출을 다시 크게 끌어올릴 수 있는 카드로 타다를 품는 것”이라고 설명했다. 토스는 카카오뱅크, 카카오페이 등 경쟁 플랫폼 활약으로 월간 활성 사용자 수(MAU)가 꺾이면서 최근 ‘송금 수수료 평생 무료’ 등으로 승부수를 띄운 상황이다. 외부에서 돈을 벌 수 있는 매출원이 절실할 수밖에 없다.",105,https://n.news.naver.com/mnews/article/366/0000765615?sid=103
[사이언스 브런치] 소득불평등이 아이들 수학성적 떨어뜨린다,2021.10.09. 오후 2:01,"소득불평등이 학업기본인 수학성적, 읽기능력 저하의 주요원인“적당한 소득불평등이 성공동기 제공”은 옛말...역기능 심각교육시스템 개선만으로는 역부족...경제체질 개선이 우선



2022학년도 대학수학능력시험을 앞두고 1일 수능 모의평가가 전국적으로 실행돼 서울 여의도여자고등학교 고3학생들이 1교시 시험을 준비하고 있다. 2021. 9. 1 박지환 기자  popocar@seoul.co.kr‘21세기 자본’이라는 저서로 유명한 프랑스 파리경제대학 토마 피케티 교수나 2008년 노벨경제학상을 수상한 폴 크루그먼 미국 뉴욕시립대 교수 등 많은 학자들이 현재 전 세계 곳곳이 소득불평등이 심각한 수준이라고 지적하고 있다. 이 같은 소득불평등은 코로나19로 인해 더욱 심화될 것이라는 우려까지 나오고 있다. 실제로 지난해 한국은행은 ‘코로나19 위기 이후 성장불균형 평가‘ 보고서에서 “코로나19 이후 경제구조 변화로 소득불평등이 더 심화될 수 있음에 유의할 필요가 있다”고 경고하기도 했다.문제는 이 같은 소득불평등이 아동, 청소년들의 학업성취도에도 영향을 미치고 장기적으로 계층이동을 차단하 고착화시킬 수 있다는 연구결과가 나왔다.미국 미주리 캔사스시티대 사회학과 연구팀은 소득불평등이 10대 아동 청소년들의 수학성적에 직접적인 영향을 미친다고 9일 밝혔다. 이 같은 연구결과는 사회과학 분야 국제학술지 ‘교육학 리뷰’(Educational Review) 10월 6일자에 실렸다.소득불평등은 인구계층에 있어서 소득이 얼마나 불균등하게 분배되고 있는지, 고소득층과 저소득층간 격차를 말하는 것으로 소득 불평등이 커지고 오랜 동안 지속되면 국가경쟁력과 성장을 퇴화시키고 정치적 불안정으로 이어지게 된다. 미시적으로도 정신건강문제, 사회적 신뢰, 계층 이동성 저하 등 다양한 보건, 사회문제와도 연계돼 있다. 특히 다양한 경로를 통해 아동, 청소년의 학업성취도에도 영향을 미쳐 장기적으로 사회의 역동성을 줄이게 되는 원인으로도 알려져 있다.미국의 소득불평등은 U자 패턴을 따라온 것으로 알려졌는데 1910~1930년대에 가장 높았고, 1940~1970년대에 중산층이 증가하면서 떨어졌다가 1980년대 레이건 정부 집권 이후 신자유주의가 강화되면서 다시 상승해 오늘날 소득불평등은 선진국에서 가장 높은 수준이다. 신자유주의 경제체제를 받아들인 나라들은 소득 불평등 수준이 급격히 높아지고 떨어지지 않고 있는 상황이다. 이에 연구팀은 미국에서 소득불평등이 아동 청소년의 학업성취도에 어떤 영향을 미치는지 분석했다.연구팀은 미국 전체 주를 대상으로 1992년부터 2019년까지 소득격차와 함께 국가학력평가(NAEP) 데이터 중 초등학교 4학년의 수학과 읽기능력 결과를 비교분석했다. 그 결과 소득 불평등 수준이 높은 주에서 학업 성취도가 평균보다 낮게 나온 것으로 확인됐다. 소득 불평등이 가난한 학생들에게만 영향을 미치는 것이 아니라 학생들 전체의 학업 성취도를 떨어뜨리는 결과로 나타난 것이다. 고소득층으로 소득 집중이 오히려 전체 학생들의 학업성취도까지 떨어뜨린다는 말이다.연구팀은 수학성적의 변화 추이도 관찰했는데 소득불평등이 급격히 증가한 주의 경우는 수학점수가 17.5점 정도 상승했지만 계층간 소득격차가 크지 않은 주에서는 평균 24.3점 오른 것을 확인했다.읽기능력, 문해력 분야에서도 소득불평등이 영향을 미치는 것이 확인됐지만 수학점수만큼 크지는 않은 것으로 조사됐다.조셉 워크맨 교수는 “이번 연구결과는 학생들의 학업성취도를 높이기 위해서는 단순히 학교교육 시스템만 바꿔서는 해결되지 않는다는 것을 보여주고 있다”라며 “학업성취도를 높이기 위해서는 누진세, 재산새, 상속세, 자산세 등을 통해 사회 전체의 소득 불평등을 줄이는 것이 우선돼야 한다”라고 강조했다. 워크맨 교수는 “기존에는 적당한 소득 불평등이 성공의 동기를 제공한다고 알려져 있지만 현재 미국이나 그 밖의 선진국들의 소득불평등 수준은 그런 긍정적 기능을 기대할 수 있는 수준을 이미 넘어서 역기능적 수준”이라고 덧붙였다.없는 수준을 넘어섰다.",105,https://n.news.naver.com/mnews/article/081/0003221237?sid=103
