title,date,main,section,url
"[김한준 기자의 e게임] NBA 2K23, 돌아온 마이클 조던의 라스트 댄스",2022.09.16. 오전 11:18,"조던 챌린지 통해 마이클 조던의 중요한 15경기 완벽 재현마이클 조던이 피닉스 선즈의 데빈 부커와 함께 NBA 2K23의  표지모델 자리를 꿰찼다. 현역시절 23을 등번호로 달고 활약했던 마이클조던이 NBA 2K23에 등장한 것은 제작사 측의 노림수로 보인다.실제로 NBA 2K23 개발진은 단순히 마이클 조던을 표지모델에 등장하는 선에 그치지 않고 아예 게임 콘텐츠에 1982년 NCAA 결승부터 1998년 유타 재즈와의 NBA 결승까지 마이클조던의 상징적인 경기 15개를 구현하고 그의 발자취를 따라가는 조던챌린지까지 담아냈을 정도다. 이 정도면 마이클 조던 팬들은 물론 마이클 조던을 향한 헌정 게임이 아닌가 싶을 수준이다.디테일 또한 훌륭하다. 각 시대별 TV 중계 화질을 구현하고 스폰서 로고와 경기 해설, 장내 아나운서까지 당시의 현장과 방송을 그대로 구현했다. 단순히 화면에 보이는 모습만 그런 것이 아니라 1980년대와 1990년대에 유행했던 농구 전술과 경기 템포까지 그려냈다. 이런 게임에 NBA 올드팬이 할 수 있는 건 두 가지 뿐이다. 감탄하거나 추억에 잠기거나.



인게임 플레이도 크게 개선됐다. 확연하게 달라진 것이 크게 눈에 띄지는 않지만 처음 게임을 플레이하면 매 공방마다 그 차이가 느껴지는 수준이다. 포스트업 플레이를 시도하면 지체하지 않고 더블팀 수비가 달려들어 막무가내 플레이를 하기 어렵게 됐고 점프슛 능력이 준수한 선수의 경우에는 상대 수비가 근처에 서 있기만 해도 성공 확률이 급감했던 기존작과 달리 무난하게 슛을 성공시킬 수 있다.이는 전체적인 게임 전개를 빅맨을 통해 상대 수비를 뭉치게 하고 빈 공간을 스팟업 슈터나 오프더볼 무브를 하던 슈터가 차지해서 점프슛을 던지는 식의 플레이를 할 수 있게 한다. 전작에서도 이런 플레이가 안 됐더 것은 아니지만 심리전이나 눈치 싸움이 통하지 않는 대인전이 아닌 정해진 움직임을 수행하는 AI 팀을 상대로는 하기 어려웠다. 이번에는 싱글 플레이를 할 때에도 이런 식의 플레이를 진행할 수 있게 됐다.



또한 드리블 스킬을 난사하듯이 사용하다가 상대를 뚫어내는 플레이를 하지 못 하도록 드리블 스킬을 쓸 때마다 체력이 크게 줄어드는 요소를 더했다. 반대로 능력치가 높은 선수는 드리블 스킬을 사용 시 치고 나갈 때 순간적으로 부스트를 쓴 것처럼 선수가 탄력을 받아 달려나가는 움직임이 더해졌다. 돌파 시도를 남용하는 것은 지양하되 성공 시 쾌감은 확실하게 구현된 셈이다.게임 구성이나 인게임 내에서 농구 종목 특성을 구현한 점은 우수하지만 과금 요소가 더해진 마이팀, 마이플레이어 모드는 호불호가 갈릴 여지가 크다. 특히 실제 선수 활약상과 관련 없이 개발사가 임의로 높은 능력치를 부여한 시즌 카드가 꾸준하게 발매되는 NBA 2K 시리즈의 특성상 게임을 즐기는 내내 끝없이 과금부담이 생기게 된다.NBA 2K23은 언제부턴가 스포츠게임 개발사가 고민하는 두 가지 고민 중 하나를 해결한 게임이다. 매년 출시되는 게임에서 어떻게 전작과 다른 게임성을 갖추고 실제 종목의 트랜드를 반영할 것인가에 대한 고민은 확실히 해결했다. 다만 수익성을 위해 확률형아이템을 도입한만큼 이용자 반작용을 어떻게 줄일일 것인지에 대한 답은 찾지 못 했다.구매를 고려하는 이들 입장에서는 PC 버전과 현세대 콘솔 버전의 그래픽 및 게임성 차이가 존재한다는 점도 유의할 점이다. 더 나은 그래픽과 물리엔진은 플레이스테이션5와 엑스박스 시리즈 엑스 버전에만 적용됐다.",105,https://n.news.naver.com/mnews/article/092/0002268230?sid=103
반도체·SW·부동산·피싱 등 디지털혁신기업들 ICT대연합에 뭉쳤다,2022.09.16. 오후 8:18,"15~17일 서울 코엑스1층 B홀서 열리는 '4차산업혁명 페스티벌 2022'에 공동관 마련16일 지디넷코리아와 한국소프트웨어산업협회(KOSA)가 서울 삼성동 코엑스에서 주최·주관한 ‘2022년 대한민국 4차산업혁명 페스티벌’ 전시관에 국내 유망 디지털 혁신 기업이 뭉쳤다.혁신 디지털 기업이 모인 만큼 다채로운 신기술이 눈에 띄었다. ▲인프라닉스 ▲브이티더블유(VTW) ▲네오와인 ▲솔리데오시스템즈 ▲에버스핀 ▲샘코포레이션 6개 회사가 정보통신기술(ICT) 대연합 공동 전시관에 참여, 부스를 마련했다.



16일 지디넷코리아와 한국소프트웨어산업협회(KOSA)가 서울 삼성동 코엑스에서 주관한 ‘2022년 대한민국 4차산업혁명 페스티벌’에서 관람객들이 정보통신기술(ICT)대연합 제품을 보고 있다.(사진=유혜진 기자)인프라닉스는 사스(SaaS·서비스형 소프트웨어) 개발 환경 파스(PaaS·서비스형 플랫폼) 솔루션 ‘시스마스터(SysMaster) k8s’를 개발, 선보였다. 오운석 인프라닉스 마스터는 “표준적인 개발 환경을 제공해 개발 기간을 줄이고 효율적으로 유지·관리할 수 있다”며 “앱 보안 취약 요소를 점검해 즉각적인 패치를 제공한다”고 말했다.VTW는 디지털 전환 도구 ‘디앤에이(DnA) 플랫폼’을 선보였다. 로코드(Low Code) 기반으로 효율적으로 소프트웨어를 개발하게 돕는다. 로코드는 필요한 부품을 간단한 명령으로 조합해 소프트웨어를 개발하는 방법이다. 복잡한 코딩 과정을 단순하게 해 소프트웨어를 빠르게 만들어 배포할 수 있다.



16일 지디넷코리아와 한국소프트웨어산업협회(KOSA)가 서울 삼성동 코엑스에서 주최·주관한 ‘2022년 대한민국 4차산업혁명 페스티벌’에서 관람객들이 정보통신기술(ICT)대연합 제품을 보고 있다.(사진=유혜진 기자)네오와인은 반도체 설계(팹리스) 회사다. 사물인터넷(IoT) 보안을 책임질 인공지능(AI) 반도체를 개발하고 있다. 정품 인증 반도체 ‘알푸(ALPU)’와 정보기술(IT) 보안 반도체 ‘달푸(DALPU)’가 네오와인 대표 제품이다. 알푸는 불법 복제를 방지하고, 달푸는 정보 보안 역할을 한다. 자동차 첨단운전자지원체계(ADAS)가 대표적인 응용처다. 운전자가 졸고 있는지 얼굴을 인식해 안전 운전을 돕는다. 폐쇄회로TV(CCTV), 블랙박스, 셋톱박스, 태블릿 등에도 쓰인다. 김현도 네오와인 상무는 “전자제품 영역에서 보호할 가치가 있다면 어떤 제품에라도 네오와인 인공지능 보안 반도체를 쓸 수 있다”고 말했다.솔리데오시스템즈는 부동산 앱 ‘자두’와 전자문서 유통망 ‘피노’를 시연했다. 한 달에 1~3만원으로 자두에 있는 부동산 분석 보고서를 마음껏 볼 수 있다. 감정평가사가 아파트 동·호수, 단독·다가구주택, 상업용 건물, 토지를 평가한 결과가 나온다. 실거래가는 2년 이내 값을 제공한다. 관심 있는 부동산이 있다면 '피노'에 등기사항전부증명서(등기부등본)를 저장하면 된다. 강다민 솔리데오시스템즈 사원은 “자두와 피노만 있으면 부동산 정보를 한 번에 확인할 수 있다”며 “나도 얼마 전 이를 활용해 부동산 계약을 성공했다”고 들려줬다.



16일 지디넷코리아와 한국소프트웨어산업협회(KOSA)가 서울 삼성동 코엑스에서 주최·주관한 ‘2022년 대한민국 4차산업혁명 페스티벌’에 정보통신기술(ICT)대연합 전시장이 꾸려졌다. 에버스핀의 주요 고객은 금융사.(사진=유혜진 기자)에버스핀은 모바일 피싱 방지 솔루션 ‘페이크 파인더’를 출품했다. 금융사가 주요 고객이다. 보통 백신은 블랙리스트를 관리하지만 에버스핀은 알려지지 않은 위험 요소까지 찾으려고 세계 모든 정상 앱을 모아 대조했다고 회사 측은 전했다. 실시간 수집하는 인공지능(AI)을 4년 넘게 개발했다. 지금까지 2천만개를 수집해 클라우드 기반으로 데이터베이스를 관리한다. 하영빈 에버스핀 대표는 “4차산업혁명 페스티벌에 유일한 보안 기업으로 참여했다”며 “새로운 주류로 부상한 4차산업혁명 시대에 해킹과 피싱 같은 사이버 범죄는 여전한 위협”이라고 지적했다.



16일 지디넷코리아와 한국소프트웨어산업협회(KOSA)가 서울 삼성동 코엑스에서 주최·주관한 ‘2022년 대한민국 4차산업혁명 페스티벌’에 정보통신기술(ICT)대연합 전시장이 꾸려졌다. 박재범 샘코포레이션 대표가 관람객에게 제품을 소개하고 있다.(사진=유혜진 기자)샘코포레이션은 스토리를 넣으면 알아서 이미지를 연결해 영상 제작 도구를 만들었다. 지금은 사람이 수작업으로 실행하지만 단어를 넣거나 말하면 인공지능이 콘텐츠를 자동으로 만드는 게 목표다. 박재범 샘코포레이션 대표는 “누구나 쉽고 싸게 콘텐츠 만들게 돕는 게 목적”이라며 “영상을 만드는 데 필요한 프로그램 값만 해도 개인이 감당하기에 비싸다”고 설명했다. 이어 “널리 알리고 싶어서 무료 앱으로 제공한다”고 덧붙였다.",105,https://n.news.naver.com/mnews/article/092/0002268279?sid=103
"바로고, ‘학습조직화 우수기업 경진대회’ 고용노동부 장관상 수상",2022.09.16. 오전 9:09,"현업 이슈 개선 등 업무 성과 창출서 높은 점수 얻어바로고가 고용노동부와 한국산업인력공단이 주관하는 ‘학습조직화 우수기업 경진대회’에서 고용노동부 장관상(대상)을 수상했다고 16일 밝혔다.학습조직화 우수기업 경진대회는 한국산업인력공단에서 운영하는 중소기업학습조직화 지원 사업 참여 기업 중 모범 활동 사례를 발굴하고 전파하고자 마련됐다.이번 대회에서 바로고는 ▲실무 중심의 학습 프로그램 구축, ▲자체 웹 페이지 운영을 통한 효율성 제고 ▲학습문화 정착을 위한 체계적인 운영 관리 등의 성과를 인정받았다.



(사진=바로고)특히, 자기주도적 학습문화 조성하고자 학습조직을 내재화하고 이를 통해 현업 이슈 개선 등 업무 성과를 창출한 점에서 높은 평가를 받았다.바로고는 자발적 학습문화 정착을 위해 사내 지식과 정보를 공유하는 ‘지식 콘서트 프로그램’과 사외 교육을 지원하는 ‘학습자 주도의 육성 프로그램’을 도입해 운영하고 있다.바로고 관계자는 “학습조직화 사업을 운영하면서 산업 환경 변화에 능동적으로 대응할 수 있는 학습 분위기를 조성할 수 있게 됐다”며 “이 과정에서 업무 성과를 창출하는 등 긍정적 변화를 이뤄낸 만큼, 바로고만의 노하우로 현업 중심 인재 육성 프로그램을 만들어가겠다”고 말했다.",105,https://n.news.naver.com/mnews/article/092/0002268189?sid=103
,,,105,https://n.news.naver.com/mnews/article/236/0000227536?sid=103
8월 ICT 수입 18.7%↑수출 4.6%↓···환율 상승 여파,2022.09.16. 오후 3:44,"과학기술정보통신부 제공환율 상승 여파로 지난달 우리나라의 정보통신기술(ICT) 분야 수입액이 사상 최대치를 기록했다. ICT 수출액은 전년 대비 2개월 연속 감소했다. 특히 효자품목인 반도체마저 수출이 줄어들었다.16일 과학기술정보통신부(과기정통부)에 따르면 우리나라의 올해 8월 ICT 수입은 135억2000만달러로 작년 동월 대비 18.7% 증가했다. 이는 1996년 ICT 수출입 통계 집계를 시작한 이래 사상 최대치다.과기정통부는 환율 급등으로 ICT 수입액이 크게 늘었다고 설명했다. 7월 말 1299.1원이던 원·달러 환율은 지난달 29일 1350.4원으로 급등하며 13년 4개월 만에 최고치를 기록했다.품목별로는 반도체 수입이 67억2000만달러로 26.1% 증가했고, 휴대전화도 9억9000만달러로 29.6% 늘었다. 디스플레이는 4억1000만달러로 16.3% 증가했다. 다만 컴퓨터·주변기기는 13억2000만달러로 5.3% 감소했다.ICT 수출액은 193억1000만달러로 전년 동월(202억3000만달러)보다 4.6% 감소했다. ICT 수출이 두 달 연속으로 전년 대비 감소한 것은 2020년 5월 이후 2년여 만에 처음이다.특히 효자품목인 반도체 수출이 109억6000만달러로 6.8% 감소했다. 디스플레이는 5.3% 줄어든 20억9000만달러를 기록했으며 휴대전화는 3.3% 감소한 11억4000만달러였다. 컴퓨터·주변기기는 25.3% 급감해 12억6000만달러를 기록했다. 과기정통부는 ICT 수출이 줄어든 이유로 글로벌 경기 둔화와 정보기술(IT)기기 생산 축소 등을 꼽았다.지난달 ICT 수출은 줄고 수입은 증가했지만, 무역수지는 57억9000만달러 흑자로 잠정집계됐다. ICT산업이 우리나라 전체 수출에서 차지하는 비중은 34.1%로, 2016년 7월 이후 30% 이상을 유지하고 있다.",105,https://n.news.naver.com/mnews/article/032/0003173426?sid=103
"종편 재승인 심사위원 감사에 언론학계 ""범죄자인양 매도""",2022.09.16. 오전 11:19,"한국언론정보학회·한국지역언론학회, 감사원 규탄 성명서“어느 학자가 전문가들이 법이 규정한 재승인 심사에 나설 수 있겠는가”""감사원은 종편방송 재승인 심사에 참여한 심사위원들에 대한 조사를 철회하라"" ""감사원은 종편방송 재승인 심사에 참여한 심사위원 조사의 경위를 밝히고 해명하라"" ""감사원은 종편방송 재승인 심사에 참여한 심사위원들을 범죄자인양 매도하는 행위를 당장 중단하고 매도 책임자를 엄중 문책하라"" 15일 한국언론정보학회와 한국지역언론학회가 감사원이 '2020년 상반기 종합편성채널과 보도전문채널 재승인' 심사에 참여한 심사위원들을 상대로 조사를 벌이자 ""감사원의 언론학자 탄압을 규탄한다""는 제목의 성명서를 냈다. 재승인 심사위원회는 심사위원장을 제외하고 총 12명으로 구성됐는데, 이 중에는 학회 추천 몫이 있다. 이에 두 학회가 규탄하는 내용의 성명서를 낸 것이다. 



▲지난 7일자 TV조선 보도.두 학회는 ""국가 기관 요청 심사에 참가하는 학회 추천 심사위원들은 자율성과 독립성의 기초 위에 심사과정의 비밀을 보장받으며 전문성을 발휘함으로써 국가 정책에 이바지하고 나아가 한국 민주주의 발전에 기여해 왔다. 학자적 양심과 전문성에 입각해 진행된 심사에 대해 감사원 조사를 받게 된 사실에 충격을 금할 수 없다""고 밝혔다. 두 학회는 이어 ""법에 의한 절차와 심사 결과에 대해 감사원이 학자를 개인적으로 불러 조사하고, 일부 언론은 검찰 조사를 암시하는 기가 막힌 현실을 보면서, 과연 어느 학자와 전문가들이 법이 규정한 재승인 심사에 나설 수 있겠는가""라고 우려한 뒤 ""학회와 시민단체가 추천한 학자 및 전문인들에 대한 조사는 그 자체만으로도 향후 해당 방송사 재승인 심사에 대한 압력으로 작용할 수 있다""고 지적했다. 심사위원 일부를 검찰 수사 대상으로까지 언급해 보도한 언론 보도에 대해 ""심지어 감사원은 심사위원 중 일부를 불법적 행위를 공모한 범죄자로 매도하고 일부 언론은 검찰 수사의 대상으로까지 언급하고 있다""고 비판했다. 지난 6일 미디어오늘은 감사원 행정안전감사 4과가 지난달 초부터 종편·보도채널 재승인 심사에 참여한 심사위원 13명(위원장 포함)을 조사하고 있다고 보도했다. 감사원은 전 심사위원들을 방문해 조사하거나, 공문을 보내 특정일에 출석할 것을 요구했다. 감사원은 공문에서 ""지정기일에 반드시 출석하여 주시기 바란다""며 ""출석이 불가능할 때는 사유 및 출석가능 일자를 회보해달라""고 요청했다. 출석에 응한 일부 심사위원들에 따르면 조사는 1~2시간가량 소요됐다. 감사원은 '감사원법 제50조'에 따라 조사했다는 입장이지만, 일부 심사위원들은 감사원이 외부 인사이자 민간인인 전 심사위원을 상대로 무리한 조사를 하고 있다고 반발했다. 지난 7일 2020년 재승인 심사의 직접 이해당사자인 TV조선은 메인뉴스 '뉴스9'에서 '감사원, '점수 조작' 정황 포착… 검찰 이첩' '종편 재승인 심사에서 무슨 일이' 제목의 리포트를 보도했다. 보도를 보면 재승인 심사위원들이 평가 점수를 제출한 뒤 이후 점수를 낮춘 정황을 확인한 것으로 알려졌다고 했다. 그러나 누가 어떻게 점수를 수정했는지 구체적인 내용은 기사에 담기지 않았다. 종합편성채널 재승인 평가는 심사위원장을 제외한 전원이 참여한다. 심사위원 12명이 채점하며 1000점 만점에 650점 이상을 받아야 재승인을 통과한다. 항목별 최고점·최저점은 합산 점수에서 제외한다. 평가 결과 650점 미만이거나, 중점 심사항목인 '공적책임'에서 절반 이하의 점수를 받으면 조건부 재승인을 하거나 재승인 취소가 가능하다. TV조선은 2020년 심사에서 총점 653.39점을 받았으나 공적책임 항목에서 104.15점(210점 만점)을 받아 조건부 재승인이 결정됐다. 채널A는 총점·공적책임 항목에서 재승인 통과 기준을 충족했으나 검언유착 의혹으로 인해 '방송의 공적책임‧공정성에 영향을 미칠 수 있는 중대한 문제가 있었던 것으로 확인될 경우, 재승인 처분을 취소할 수 있다'는 조건이 부가됐다. [관련 기사 : 종편 재승인 심사위원 '민간인' 불러낸 감사원 '노림수'는]",105,https://n.news.naver.com/mnews/article/006/0000114670?sid=103
"정부, 美 당국과 'IRA' 세액공제 실무 회담 개최",2022.09.16. 오후 3:14,"산업부·기재부·외교부 등 관계부처 참석…美 STR·백악관(NSC/NEC)·상무부·재무부·국무부·에너지부 참석산업통상자원부는 16일 미국과 '인플레이션 감축법(IRA)' 전기자동차 세액공제 관련 실무협의를 영상으로 개최한다.우리 측에서는 윤창현 산업부 통상정책국장을 비롯해 산업부·기재부·외교부 등 관계부처가 참석한다. 미측에서는 USTR 대표보급을 비롯, USTR·백악관(NSC/NEC)·상무부·재무부·국무부·에너지부 등 관계부처가 참석한다.



산업통상자원부전경IRA는 북미에서 생산되는 전기차에만 세액공제를 주도록 규정하고 있다. 전기차 배터리에도 까다로운 원산지 규정을 둬 법안이 시행될 경우 국내 기업의 피해가 우려되는 상황이다.앞서 산업부는 이날 오전 정대진 통상차관보 주재로 미국 전기차 세액공제 제2차 민관합동 테스크포스(TF)를 개최했다고 밝혔다.",105,https://n.news.naver.com/mnews/article/092/0002268255?sid=103
"그라비티, '라그나로크 오리진' 대만-홍콩-마카오 지역 론칭",2022.09.16. 오전 10:57,"게임 내에서 중화권 인기 작곡가 겸 가수 ‘린쥔제’가 작곡 및 편곡한 테마곡 감상 가능그라비티가  대만, 홍콩, 마카오 지역에 모바일 MMORPG ‘라그나로크 오리진’을 9월 15일 오전 10시(대만 시간 기준) 론칭했다고 밝혔다.라그나로크 오리진은 세계 이용자들에게 꾸준히 사랑 받고 있는 라그나로크 온라인의 스탯, 스킬, 스토리, 퀘스트 등 주요 시스템을 재현 했으며 콘텐츠, 그래픽 등 모든 부분을 한층 업그레이드했다.지난 2020년에는 한국, 2021년에는 일본과 북미 지역에서 좋은 성과를 거둔 만큼 관심이 집중됐으며 예상보다 많은 이용자들이 사전예약에 참여했다.



라그나로크 오리진8월 4일부터 18일까지 진행한 대만, 홍콩, 마카오 지역 비공개시범서비스에서는 ‘펫 스킬 조합으로 다채로운 전투가 가능해서 좋았다’, ‘길드 탐험 플레이가 매우 흥미로웠다’, ‘소셜 이벤트가 잘 구성되어 있다’, ‘경매 시스템이 합리적이다’ 등의 호평을 받기도 했다. 라그나로크 오리진 대만, 홍콩, 마카오 지역 서비스는 그라비티의 홍콩 지사인 그라비티 게임 비전에서 맡아 진행한다.그라비티는 대만, 홍콩, 마카오 지역 라그나로크 오리진의 홍보 모델로 중화권 인기 작곡가 겸 가수인 ‘린쥔제’를 선정했다.게임 내 BGM 플레이어를 통해 린쥔제가 작·편곡한 테마곡을 감상할 수 있으며 론칭 후부터 일정 기간 동안 린쥔제 코스튬과 장식품을 획득 가능하다. 이외에도 다채로운 론칭 기념 이벤트를 순차적으로 진행할 예정이다.그라비티 게임 비전 황아영 COO는 “많은 이용자분들의 관심과 성원에 힘입어 다양한 시스템을 한층 강화한 라그나로크 오리진을 대만, 홍콩, 마카오 지역에 론칭했다. 비공개시범서비스와 사전예약에서 보여주신 이용자들의 뜨거운 관심에 감사드리며 앞으로 다양한 업데이트와 이벤트로 사랑에 보답할 테니 재미있게 즐겨주시길 바란다”라고 전했다.",105,https://n.news.naver.com/mnews/article/092/0002268221?sid=103
"위메이드, 중동 진출 성과 낸다… 장현국 ""존재감 확대할 것""",2022.09.16. 오후 3:01,"위메이드가 지난 5월 아랍에미리트(UAE) 두바이에 지사를 세운 가운데 장현국 대표가 최근 '포브스 중동'과의 인터뷰에서 사업 청사진을 밝혔다. /사진=포브스 중동 인터뷰 캡처  위메이드가 외신과의 인터뷰를 통해 중동 지역에서의 사업 청사진을 밝혔다. 회사는 중동의 탄탄한 커뮤니티를 겨냥해 블록체인 게임 플랫폼으로써 존재감을 높일 계획이다.장현국 위메이드 대표는 최근 포브스의 중동 지사 '포브스 중동'과의 인터뷰에서 ""위메이드는 중동의 강력한 커뮤니티를 목표로, 중동 및 북아프리카 투자를 강화하고 역량을 집중할 것""이라고 말했다.장 대표는 중동·북아프리카 블록체인 기술 시장의 장래성을 긍정적으로 내다봤다. 그는 ""현재 이 지역 블록체인 기술 시장은 시작 단계""라면서 ""중동과 아시아가 블록체인 기술과 산업의 중심지가 될 수 있다고 믿는다""고 말했다. 앞서 위메이드는 지난 5월 두바이 지사를 설립, 중동 지역 블록체인 사업을 확장하는 데 주력하고 있다. 국내 게임사 중 아랍에미리트(UAE)에 지사를 설립한 사례는 위메이드가 최초다. 위메이드가 두바이를 주목한 이유는 블록체인에 우호적인 현지 상황 때문이다. 두바이는 '친 블록체인'을 내세워 블록체인 기술 기업을 유치하는 데 힘을 쏟고 있다. 블록체인 기술을 기반으로 비즈니스 생태계와 가상자산 서비스에도 과감한 정책을 펼치는 중이다. 앞으로 크립토 분야 역시 발전할 가능성이 높다는 평가다.  장현국 대표는 인터뷰를 통해 ""위믹스는 게이머와 개발자 모두가 선택하는 플랫폼이 될 것""이라며 ""2022년 말까지 위믹스 플랫폼에서 100개의 블록체인 기반 게임을 출시할 계획""이라고 강조했다.이어 ""향후 3년 안에 모든 게임이 블록체인 게임이 전환되고, 블록체인 기반의 위믹스 3.0은 게임 토큰과 대체 불가능한 토큰(NFT)을 바탕으로 이용자들의 게임 통화 거래 방식을 변화시킬 것""이라고 전망했다.",105,https://n.news.naver.com/mnews/article/417/0000852461?sid=103
