title,date,main,section,url
"[2018결산]31개 게임사, 게임 하나에 울고 웃었다",2018.12.28. 오후 2:38,"올해도 게임사들은 게임 타이틀 하나에 일희일비했다. 주요 상장 게임사 31곳의 7분기(2016년 1월부터 2017년 9월까지) 매출 실적을 나열한 결과 매출 1000억 원이 넘는 게임사는 7곳으로, 펄어비스와 카카오가 합류했다.펄어비스는 지난 2월 선보인 '검은사막 모바일'로 호성적을 거뒀다. 올해 분기 평균 매출액은 1017억 원으로, 전년 대비 2.5배 가까이 늘었다. 카카오는 PC 게임 '카카오 배틀그라운드' 퍼블리싱으로 성장을 견인하면서 올해 분기 평균 1055억 원의 매출을 거뒀다. 카카오 게임하기에 입점하지 않은 MMORPG들의 흥행에 따라 모바일 게임 매출액은 감소세를 보였으나 PC 부문 성장이 유효했다.  



7분기 기준 매출액 5000억 원 이상을 기록한 3개 게임사 중에는 넥슨만 성장세를 보였다. 넥슨의 올해 평균 분기 매출액은 6879억 원으로, 전년 평균 분기 매출액(5913억 원)보다 16.3% 늘었다. 이 같은 넥슨의 성장세는 중국 지역 '던전앤파이터'에서 비롯됐다고 해도 과언이 아니다. 올해 중국 분기 매출액은 매 분기 전년 동기 대비 두 자릿수 이상 성장을 거듭했다. 3분기까지 중국 지역 누적 매출액은 1조 1429억 원, 분기별 평균 매출액은 3810억 원으로, 전체 매출의 절반 이상(55%)을 차지한다. 넷마블은 역성장했다. 올해 분기 매출 평균액은 15.6% 감소한 5114억 원을 기록했다. 신작 출시가 이어졌지만, 기존 대표 게임의 감소세를 완충하지 못한 것으로 풀이된다. 다만 12월 출시한 '블레이드 앤 소울 레볼루션'으로 4분기 매출액이 더해지면 이는 완화될 것으로 보인다.엔씨소프트는 2017년 2분기 선보인 '리니지M' 이후 신작이 없었음에도 불구하고, 평균 분기 매출액은 전년보다 0.3% 소폭 감소했다. '리니지M'의 대만 지역 출시와 '블레이드 앤 소울' '아이온'의 부분 유료화에 따라 전년 평균을 유지한 것으로 분석된다. NHN엔터테인먼트의 올해 분기 평균 매출액이 31.5% 증가했으나 이는 페이코 등 게임 외 사업으로 거둔 것이다. 3분기까지 게임 매출액은 3226억 원으로, 전체 매출액의 36%의 비중을 차지했다.'서머너즈 워: 천공의 아레나' 이후 흥행작을 찾고 있는 컴투스의 전년보다 분기 평균 매출액이 6.1% 하락세를 보였다. 



분기 평균 매출액 1000억 원을 넘어선 게임사들이 7개사로 늘었지만 중간격이라 할 수 있는 허리는 여전히 부재했다. 1055억 원의 분기 평균 매출액을 올린 카카오에 뒤를 이어 웹젠이 차지했다. 웹젠의 분기 평균 매출액은 558억 원으로 격차가 크다.100억 원 이상 1000억 원 미만 분기 평균 매출액을 기록한 게임사도 9곳에 불과했다.웹젠은 신작 '뮤 오리진2'로, 위메이드엔터테인먼트는 IP 로열티와 '이카루스M'로, 선데이토즈는 '위베어베어스 더 퍼즐', 룽투코리아는 '열혈강호', 와이제이엠게임즈는 '삼국지 블랙라벨', 네오위즈는 '브라운더스트'를 앞세우며 두 자릿수 이상 성장했다. 반면, 게임빌(10.9%)과 조이시티(3.3%), 액토즈소프트(27.9%) 등 3곳은 전년보다 분기 매출액은 줄었다.



100억 원 미만 게임사들의 하락세는 뚜렷했다. 15곳 중 11곳의 분기 평균 매출액이 하락한 것으로 나타났다.특히 썸에이지는 39.0%, 넥슨지티 37.0%, 엔터메이트는 36.2% 분기 매출이 크게 줄었다. 다만 엔터메이트의 경우 4분기 출시한 '다크에덴M'으로 분기 매출 하락세를 완화할 것으로 보인다. 분기 매출이 오른 게임사는 바른손이앤에이와 데브시스터즈, 넷게임즈, 플레이위드 4곳이다. 이 중 데브시스터즈는 '쿠키워즈(by.쿠키런)' 출시에 따라 올해 분기 평균 매출이 2배 가까이(95.5%) 늘었다.강미화 기자 redigo@fomos.co.kr [게임&게이머, 문화를 전합니다. 포모스게임│무단 전재 및 재배포 금지]포모스",105,https://n.news.naver.com/mnews/article/236/0000182540?sid=103
[인사]한국과학기술연구원(KIST),2018.12.28. 오후 2:13,"◆한국과학기술연구원(KIST)<본원>Δ청정신기술연구소장 책임연구원 한종희 Δ국가기반기술연구본부장 책임연구원 민병권 Δ대외협력본부장 책임연구원 김상경 ΔKIST 스쿨 대표교수 책임연구원 석현광 Δ수소·연료전지연구단장 책임연구원 윤창원 Δ에너지소재연구단장 책임연구원 손지원 Δ에너지저장연구단 책임연구원 정경윤 Δ양자정보연구단장 책임연구원 한상욱 Δ물자원순환연구센터장 책임연구원 홍석원 Δ환경복지연구센터장 책임연구원 김진영 Δ청정에너지연구센터장 책임연구원 이현주 Δ연구개발실장 책임관리원 김영종 Δ경영기획실장 책임관리원 변덕용 Δ문화홍보실장 책임관리원 강구인 Δ인프라운영실장 책임전문원 김정남 Δ청정신기술연구소 운영기획팀장 선임관리원 서보라 Δ구매·자산팀장 책임관리원 정현진 Δ건설관리팀장 선임전문원 김성영 Δ시설운영팀장 선임전문원 전승현 <강릉분원>Δ천연물소재연구센터장 책임연구원 정상훈 Δ천연물인포매틱스연구센터장 책임연구원 판철호 Δ스마트팜융합연구센터장 책임연구원 양중석 Δ강릉분원 중소기업지원센터장 책임관리원 이창근 <전북분원>Δ전북분원 연구지원부장 책임관리원 이돈재 Δ전북분원 중소기업지원센터장 책임전문원 강대신somangchoi@news1.kr▶ [ 크립토허브 ]  [ 터닝포인트 2019 ] ▶ 에어팟&스타벅스 커피 경품(~1/25)[© 뉴스1코리아(news1.kr), 무단 전재 및 재배포 금지]",105,https://n.news.naver.com/mnews/article/421/0003760158?sid=103
"KINS-KAIST, 미래 글로벌 원자력안전 전문가 배출",2018.12.28. 오후 4:40,"한국원자력안전기술원(KINS)은 지난 27일 대전 국제원자력안전학교에서 'KINS-KAIST 국제원자력 및 방사선안전 석사과정' 졸업식을 개최했다고 28일 밝혔다.이날 졸업식에서는 바레인, 요르단, 나이지리아, 케냐, 베트남 등 중동, 아프리카, 동남아시아 지역의 원자력 개도국 10명의 졸업생들이 학위를 받았다. KINS와 KAIST는 원자력 후발국가 학생들을 선발해 미래 원자력 지도자로 양성하기 위한 석사 과정을 2009년부터 운영해 오고 있다. 현재까지 9기 졸업생을 포함해 모두 27개국 100명의 졸업생을 배출했다.최영준 KINS 국제원자력안전학교장은 ""K-K 석사과정 졸업생들이 각국의 원자력안전 분야에서 왕성하게 활동하고 있으며, 앞으로 여러분들도 다양한 분야에서 선도적 역할을 해 줬으면 한다""고 말했다.대전=이준기기자 bongchu@dt.co.kr



KINS-KAIST 국제원자력 및 방사선안전 석사과정을 졸업한 10명의 졸업생들이 졸업식을 마치고 기념촬영을 하고 있다.    KINS 제공     디지털타임스 홈페이지 바로가기 / 디지털타임스 뉴스 더보기네이버 채널에서 '디지털타임스'를 구독해주세요.",105,https://n.news.naver.com/mnews/article/029/0002500396?sid=103
모바일 SF MMO ‘아스트로킹즈’ 상품 이벤트 진행,2018.12.28. 오전 10:50,"에이엔게임즈(대표 김환기)는 지난 26일 국내 출시한 SF 전략게임 ‘아스트로킹즈’의 다양한 상품 이벤트를 진행한다.‘아스트로킹즈’는 SF MMO 모바일 전략게임으로 거대한 은하제국의 패권을 놓고 전쟁, 행성발전, 연맹 등을 통해 수많은 유저들이 경쟁 및 협력을 하는 것이 특징이다.  



 현재 구글 플레이에 출시한 상태인 ‘아스트로킹즈’의 공식 네이버 카페를 방문해 이벤트에 참여하면 스타벅스 커피 교환권, 온라인 문화상품권, 구글 스토어 상품권 등 다양한 상품을 받을 수 있는 기회를 얻을 수 있다. 또한 게임 내 크리스탈 및 아이템을 얻을 수 있는 이벤트 및 인게임 크리스마스 이벤트도 진행하고 있다.[안희찬기자 chani@mkinternet.com]▶매경 뉴스레터 '매콤달콤'을 지금 구독하세요▶뉴스 이상의 무궁무진한 프리미엄 읽을거리[ⓒ 매일경제 & mk.co.kr, 무단전재 및 재배포 금지]",105,https://n.news.naver.com/mnews/article/009/0004279204?sid=103
한국 무시하는 애플?…잦은 '늑장 대응' 논란 ,2018.12.28. 오후 4:44,"""게임 비롯해 대다수 한국 서비스 늦어"" 지적[아이뉴스24 김나리, 윤선훈 기자] 애플이 올해를 나흘 남기고 간신히 자체등급분류 사업자로 지정됐다. 애플 측 늑장 대응이 원인인데 비단 게임뿐만 아니라 한국을 대상으로 한 서비스들 대부분이 상대적으로 늦다는 지적이 나온다.애플이 중국, 일본 등 인접 국가보다 상대적으로 시장 규모가 작은 한국을 이른바 홀대하는 것 아니냐는 비난까지 나온다.28일 게임물관리위원회와 업계에 따르면 애플은 올해를 불과 나흘 남겨둔 지난 27일 자체등급분류사업자 지정에 간신히 성공했다.



자체등급분류사업자란 사전 심의 없이 자체적으로 게임 등급을 매겨 서비스 할 수 있게 한 게임 사업자를 뜻한다.지난 2016년 게임산업진흥에 관한 법률이 개정되면서 애플은 오는 31일까지 자체등급분류사업자 지정을 받아야만 내년에도 현재와 같은 게임 서비스를 할 수 있다.그러나 애플이 이를 차일피일 미루는 등 미온적 태도를 보여 논란이 됐다.  업계에서는 자칫 내년부터 애플 앱스토어 게임 서비스가 중단되고, 게임 카테고리가 또 다시 폐쇄되는 것 아니냐는 우려가 나왔다.애플은 앞서도 국내 게임에 대한 사전 심의 정책을 이유로 국내 앱스토어의 게임 카테고리를 삭제했던 전력이 있다.결국 국내 앱스토어 게임 서비스 중단이라는 최악은 면했지만, 한국 시장에 대한 애플의 대응에 문제가 있다는 지적이다.애플의 이같은 이른바 '한국 홀대론'은 이번이 처음은 아니다. 최근 가입 차단 소동을 빚은 애플의 자체 보험 상품인 애플케어 플러스도 문제가 됐다.애플케어는 아이폰의 전화 기술지원 기간과 무상보증기간을 제품 구입 후 90일에서 2년으로 연장해 주는 프로그램이다. 애플케어플러스는 여기에 소비자 과실로 인한 파손에 대해 최대 2회까지 저렴한 비용으로 수리·제품교환을 더한 것이다.한국은 애플케어는 적용되지만 애플케어플러스는 적용되지 않는다. 일본, 중국 등에서 지원되는 것과 대조적이다.심지어 애플은 지난 5일부터 이용자들이 해외 애플 온라인에서 제품을 구매해 애플케어플러스를 적용받는 것까지 막고 있다. 애플은 신용카드 일련번호를 조회해 서비스 지원 국가에서 발급받지 않은 카드를 걸러냄으로써 애플케어플러스 가입을 일괄 차단하고 있다.업계 일각에서는 애플이 국내 이동통신사와 손잡고 내년 중 애플케어플러스를 국내 도입하려 한다는 얘기도 나온다. 하지만 설사 내년 도입한다 해도, 주요 시장에서 애플케어플러스가 적용되는 시점보다는 한참 늦은 상황이다.공식 애플스토어 입점 시기 역시 주변국보다 크게 늦었다. 가령 일본은 2003년, 중국은 2008년에 첫 애플스토어가 문을 열었다. 국내의 경우 지난 1월에야 서울 신사동 가로수길에 국내 유일의 애플스토어가 마련됐다. 한국에 아이폰이 들어온 시기가 2009년이라는 점을 감안할 때 입점 시기가 크게 늦었다는 뒷말이 나온다. 애플 아이폰 신형 모델의 1차 출시국에서 한국이 제외되는 경우도 흔한 일이다.최근 애플 등과 같은 글로벌 사업자의 이용자 차별 등에 대해서도 국내 기업과 같이 강력하게 규제해야 한다는 주장이 나오는 것도 이와 무관치 않다. 정부 역할이 중요하다는 지적도 나온다.위정현 중앙대 교수(경영학)는 ""애플과 같은 글로벌 기업에 있어 한국은 중국이나 일본에 비해 중요 한 시장이 아니기 때문에 국내 대응에도 미온적인 것""이라며 ""정부가 지속적으로 문제를 제기하고, 한국 시장이 가진 테스트베드로서의 의미 등을 적극 활용할 필요가 있다""고 강조했다.김나리기자 lord@inews24.com 윤선훈기자 krel@inews24.com▶네이버 채널에서 '아이뉴스24'를 구독해주세요.▶아이뉴스TV에서 부동산 고수를 만나보세요.[ⓒ 아이뉴스24 무단전재 및 재배포 금지]",105,https://n.news.naver.com/mnews/article/031/0000476819?sid=103
"크레이지아케이드, 다양한 협업으로 이용자 눈도장 ‘쾅’",2018.12.28. 오후 5:12,"라이브 스티커에 라인프렌즈 캐릭터까지…한재석 디렉터도 직접 나서 



넥슨이 인기게임 ‘크레이지아케이드’의 이용자 접점을 넓히기 위해 다양한 이색 마케팅 활동을 펼치고 있다. 최근에는 한재석 디렉터가 직접 출연한 바이럴 영상도 공개했다. 넥슨의 인기 온라인게임 ‘크레이지아케이드’가 게임을 넘어 다양한 분야에서 이용자들과의 접점 영역을 넓히고 있다. 스마트폰 애플리케이션에서 사용 가능한 ‘다오’, ‘배찌’ 라이브 스티커를 출시하고 유명 캐릭터 브랜드와의 컬래버레이션, 이색 바이럴 영상 제작 등 다양한 마케팅 활동으로 이목을 끌고 있다.넥슨은 지난 8월 삼성전자 갤럭시 라이브 스티커 운영사인 ‘시어스랩’과의 협업으로 ‘크레이지아케이드’의 라이브 스티커 10종을 ‘갤럭시앱스’에 출시했다. 이용자는 ‘다오’, ‘배찌’ 등 ‘크레이지아케이드’의 인기 캐릭터들과 함께 있는 장면을 연출하거나 직접 캐릭터로 변신하고 물풍선에 갇힌 모습 등 재치 있는 사진을 찍을 수 있다.해당 라이브 스티커의 경우 8월 한달 동안 ‘갤럭시앱스’에서 약 14만 번의 다운로드를 기록할 정도로 호응을 얻기도 했다. 또 라이브 스티커로 촬영한 사진을 공유하는 ‘프로듀스 셀크아왕’ 이벤트에서는 3만여 명의 이용자가 이벤트 참여 사진에 ‘좋아요’를 눌렀다.지난 13일에는 글로벌 캐릭터 브랜드 ‘라인프렌즈’와 손잡고 대규모 컬래버레이션 업데이트도 진행했다. 타겟 연령층이 좋아하는 캐릭터를 게임에 이식해 시선을 모으고 이슈화를 모색했다.‘크레이지아케이드’에서 캐릭터를 랜덤으로 선택하면 ‘라인프렌즈’의 인기 캐릭터인 ‘브라운’과 ‘코니’를 플레이할 수 있으며 ‘라인프렌즈’가 살고 있는 숲을 테마로 꾸며진 4종의 신규 맵과 함께 ‘브라운 물풍선’, ‘샐리 모자’ 등 20여 종의 다양한 치장 아이템도 만날 수 있다. 



지난 13일에는 라인프렌즈 캐릭터와의 컬래버레이션 콘텐츠를 적용해 이용자들에게 색다른 재미도 선사하고 있다. 여기에 넥슨이 서비스 중인 다른 온라인게임과의 협업도 펼쳤다. ‘메이플스토리’의 인기 캐릭터인 ‘루시드’와 ‘팬텀’으로 변장할 수 있는 치장 아이템을 지난 9월 선보였으며 ‘코튼X 탈것’, ‘미사일 전자파밴드’, ‘아이템박스 물풍선’ 등 ‘카트라이더’의 특징을 담은 아이템도 11월 PC방 이벤트 보상으로 지급했다.특히 최근에는 게임 디렉터가 적극적으로 출연에 나선 바이럴 영상을 선보여 눈길을 끌었다. 지난 20일 넥슨 페이스북을 통해 공개한 영상이 주인공이다. ‘크레이지아케이드’ 개발을 총괄하는 한재석 디렉터가 직접 등장해 ‘크레이지아케이드’가 친구들과 함께 즐기기 좋은 ‘인싸 게임’이라는 메시지를 전달했다. 특히 한 디렉터는 다소 우스꽝스러운 모습으로 반복적인 후렴구의 노래를 선사했다.넥슨 한재석 디렉터는 “게임 안팎으로 유저들과 소통할 수 있는 기회를 마련하고자 다양한 시도를 이어가는 중”이라며 “안정적인 라이브 서비스는 물론 다채로운 이벤트를 통해 오랜 기간 사랑받는 타이틀이 되도록 노력하겠다”고 밝혔다.[임영택기자 ytlim@mkinternet.com]▶매경 뉴스레터 '매콤달콤'을 지금 구독하세요▶뉴스 이상의 무궁무진한 프리미엄 읽을거리[ⓒ 매일경제 & mk.co.kr, 무단전재 및 재배포 금지]",105,https://n.news.naver.com/mnews/article/009/0004279451?sid=103
