title,date,main,section,url
"[이슈분석]기본도 안지킨 관리부실이 불러온 참사...제도개선, 보상안 논란 지속될듯",2021.10.31. 오후 4:02,"조경식 과기정통부 차관이 KT 네트워크장애사태 원인을 브리핑하고 있다.89분간 전국적으로 발생한 10·25 KT 유무선 통신 장애 핵심원인은 전국망에 영향을 줄 수 있는 중요 작업을 협력업체에만 맡겨놓고 확인하지 않은 KT의 관리책임으로 일단락됐다.KT는 실수와 책임을 인정하면서도 일탈로 예외적인 사례라고 주장했지만, 통신망 관리에 대한 총체적 부실이 드러나며 신뢰가 무너졌다는 비판을 피하기 어렵게 됐다.정부로서는 KT 주장대로 단순 일탈인 지, 통신사 망 관리 전반에 관리부실이 만연해있는 지 확인하는 게 첫번째 과제다. 코로나19로 통신망의 중요성에 대한 경각심이 높아진 가운데, 10·25 KT 유무선 통신 장애 원인 분석에서 확인된 기술적 쟁점을 검토해 보다 안전한 네트워크를 만들어야 한다. 신뢰와 자율에 맡겼던 부분까지 규제 영역으로 관리해야 하는 상황이 불가피해지면서, 정부의 고심도 깊어질 전망이다.



KT 통신장애 타임라인.◇'exit' 명령어 입력실수에서 출발과학기술정보통신부는 사고 로그기록을 분석한 결과, 10월 25일 11시 16분경부터 시작돼, 12시 45분경 KT의 복구조치가 완료돼 약 89분의 서비스 장애가 발생한 것으로 공식확인했다. KT 부산국사에서 기업 망 라우터 교체 작업 중 작업자가 잘못된 설정 명령을 입력한 것이 사태의 1차 원인이라고 봤다.라우터는 이용자로부터 데이터를 전송받아 데이터가 가야할 곳으로 안내·전송하는 역할을 한다. 옛 전화 교환수·교환기의 역할을 고도화된 컴퓨팅 시스템이 처리하는 것과 같다.라우터가 정확하게 데이터를 전송하기 위해서는 다른 라우터와 연결을 위한 수만개 이상 주소가 포함된 주소록을 정확하게 갖추고 있어야 한다.방대한 주소를 관리자가 수기로 입력하는 것은 어렵기 때문에 기존 관리하던 주소록을 소프트웨어(SW) 명령어 형태로 동시에 입력한다. 작업자는 라우터 장비를 교체하면서 주소설정을 위한 명령어 입력 과정에서 마무리 명령어인 'exit'를 누락했고, 라우터는 잘못된 주소록을 갖게됐다.KT가 교체한 장비는 내부망(IS-IS프로토콜) 전용 라우터였다. 설정 명령을 잘못하는 바람에 KT 내부망을 연결하는 주소록 1만여개가 정확하게 입력되지 않고, 외부망(BGP프로토콜)과 연결하는 3만7000개 이상 주소가 라우터에 동시입력됐다. 이에 따라 데이터가 제대로된 주소를 찾아가지 못하면서 광범위한 장애가 발생한 것이다.



홍진배 과기정통부 정보보호네트워크정책관과 사고조사반 관계자 등이 KT 네트워크사태 원인과 후속대책을 브리핑하고 있다.◇KT의 총체적 관리부실이 과정에서 KT의 심각한 관리 부실이 드러났다. KT 네트워크관제센터는 야간작업(01시~06시)을 승인했지만, 협력업체는 점심시간을 앞두고 주간에 작업을 진행해 피해가 겉잡을 수 없이 확산됐다.KT 본사 작업관리자 없이 협력업체 직원만 작업을 수행했으며, 네트워크가 연결된 채로 라우팅 작업을 진행했다.과기정통부가 본인과 당사자, KT 관리자에게 확인한 결과, 주간작업을 한 이유와 관련해 “야간작업을 좋아하는 사람은 없고, 주간작업을 선호하기 때문”이라는 다소 황당한 이유를 확인했다. KT 관리자는 사전 테스트도 진행하지 않았으며, 다른 업무가 있다며 자리를 비운 것으로 나타났다.라우터 작업 외주화 자체를 KT가 외부에 위험을 떠넘기는 형태로 책임을 회피한 것으로 보긴 어렵다. 라우터 초기 세팅 등을 위해 기기에 대해 지식이 충분한 제조사 또는 협력업체와 공동작업은 필수다. 그럼에도 네트워크 운영회사로서 라우팅 주소를 협력업체에 전달하고, 제대로 입력됐는지 확인하는 것은 명백한 KT의 책무다.세탁기를 구입해 바쁘다는 이유로 열쇠까지 설치기사에게 맡긴 이후에 확인도 하지 않은 상황에 비유할 수 있다. 세탁기 연결수도에서 물이 새서 집안 뿐만 아니라 남의 집까지 물바다로 만든 상황이다. KT 과업지시서대로 이행하지 않은 것은 협력업체의 책임일 수 있지만, 관리책임은 KT가 명확하게 져야할 것으로 보인다. 네트워크장비기업 관계자는 KT가 협력업체에 구상권을 청구하는 것도 어려울 것이라고 봤다.◇기술적 예방조치 미흡기술적 예방조치도 미흡했다. KT는 지역에서 발생한 오류가 전국으로 확산하는 것을 차단할 수 있는 시스템이 미흡한 것으로 나타났다.KT 네트워크 내부프로토콜은 잘못된 데이터 전달에 대한 안전장치 없이 전국을 모두 하나로 연결하고 있었다. 부산국사 라우터에 잘못된 라우팅 정보가 입력되자 지역전체를 관리하는 부산 백본 라우터에 잘못된 정보가 전달됐다. 이 정보는 곧바로 우리나라 통신망 전체를 관리하는 서울센터 라우터로 전달됐고, 결과적으로 30초만에 전국망 마비사태를 불러왔다. 네트워크가 차단된 가상 상태에서 오류 여부를 사전에 발견하기 위한 가상 테스트베드도 존재하지 않았다.KT 중앙관제센터는 부산 라우터 문제 발생을 인지하자마자, 전체 망에서 차단시키고, 잘못된 명령어를 발견해 수정하는 데 89분을 소요했다. 당초 디도스 공격가능성을 공표하며 혼선을 야기한 것은 문제이지만, 전체 네트워크를 대상으로 신속하게 문제원인을 파악하고 복구한 것은 네트워크 관리역량 측면에서는 우수성을 보여준다는 일부 견해도 있다.◇정부 후속 제도개선 '고심'과기정통부는 사고 발생 4일만에 전격적으로 원인분석결과를 발표했다. KT 관제센터와 부산 등 현장답사를 통해 수만개 이상 로그기록을 직접 확인한 결과, 외부 해킹, 디도스 등 원인을 둘러싸고 다양한 의혹이 지속되는 상황을 조기에 수습하려한 것으로 풀이된다.의혹은 해소됐지만, 이번 사태와 같은 관리 부실이 KT 전국망 관리에 만연해있는지, 다른 통신사도 통신망을 이와같이 관리하는지 의문은 남았다. 이번 사태를 '일탈이 이루어진 예외적인 사례'로 규정했다. 그러나, 과기정통부는 국내 통신사 전반을 확인하겠다는 입장이다.결과적으로는 당연히 해야할 일을 하지 않으면서, 규제 강화가 불가피하게 됐고, 기본과 신뢰에 맡겨두던 관리를 어디까지 제도화해야 하는지 과기정통부의 고심이 깊어지게 됐다. 방통위는 실질 보상안을 마련하는 일이 과제다.허성욱 과기정통부 네트워크정책실장은 “야간 작업과 사전 테스트는 기본 상식에 속하는 문제라 정부가 제도적으로 규제를 해야 될 대상인건지, 아닌 건지 솔직히 당황스럽다”며 “이번 사태는 파란 불에 신호등을 건너야 된다는 걸 어겨서 난 교통사고와도 같아, 후속 제도화를 고민하는데 도 어려움이 크다”고 토로했다.",105,https://n.news.naver.com/mnews/article/030/0002978817?sid=103
[인사] 삼성서울병원 부원장급 및 주요 보직,2021.10.31. 오후 3:38,[서울경제] 오세열 삼성서울병원 안과 교수가 신임 진료부원장으로 임명 받았다. 삼성서울병원은 이 같은 내용을 담은 부원장급 및 주요 보직 인사를 31일 발표했다. 발령일자는 다음달 1일이다. 지난 15일 박승우 신임 원장 취임 후 첫 발표된 이번 인사는 '중증 고난도 질환 중심 첨단지능형 병원'을 구축할 진용 구성 및 새 도약을 향한 의지를 나타내고 있다.다음은 부원장급 및 주요 보직 인사(11월 1일자)◇부원장급 △진료부원장 오세열(신임) △암병원장 이우용(신임) △심장뇌혈관병원장 권현철(유임) △연구부원장 이규성(유임) △기획총괄 김희철(신임) △미래병원추진단장 손영익(신임) △데이터혁신추진단장 이풍렬(유임) △간호부원장 홍정희(신임) ◇주요 보직 △교육인재개발실장 송윤미(신임) △QI실장 이준행(신임),105,https://n.news.naver.com/mnews/article/011/0003979591?sid=103
"[이젠, 우주]민간 주도 패권 경쟁…중심 선 스페이스X·블루오리진·버진갤럭틱",2021.10.31. 오후 4:00,"누리호 발사를 계기로 국내에서도 우주 산업이 큰 관심을 받고 있죠. 우주 기술 경쟁은 국가 방위와도 밀접한 관련이 있어 나라 간 ‘패권 다툼’으로 여겨지곤 합니다. 현재 우주 기술 개발은 과거와 달리 민간이 주도하고 있는 양상인데, 이 분야 선두 기업으론 스페이스X·블루오리진·버진갤럭틱이 꼽힙니다. 어떤 기술을 확보하고 있을까요?



누리호가 21일 오후 5시 전라남도 고흥군 나로우주센터 내 마련된 제2 발사대에서 점화된 후 우주로 향하고 있다.(사진=한국항공우주연구원)△국제우주정거장(ISS)을 대체·보완할 차세대 ‘우주 비즈니스 센터’ △지구 위성 ‘달’에 건설되는 유인기지 △태양계 네 번째 행성인 ‘화성’으로의 이주 계획 △초연결 시대를 열 인공위성 기반의 차세대 통신 ‘6G’ △돈만 있으면 떠날 수 있는 우주여행….꿈처럼 여겨졌던 우주 개발이 현실이 되고 있다. 인류의 상상을 실현하고 있는 주체는 놀랍게도 민간이다. 국가 단위의 연구개발이 자연스러울 법한 프로젝트들이지만, 기업이 우주 산업의 첨병으로 나선 지는 생각보다 오래됐다.민간 우주 개발에 다양한 족적을 남긴 스페이스X·블루오리진·버진갤럭틱 등이 대표적이다. 블루오리진은 아마존 창업자 제프 베이조스가 21년 전 ‘지구를 오염 산업으로부터 해방하기 위한 우주 식민지 건설’이라는 목표를 실현하기 위해 설립했다. 일론 머스크 테슬라 최고경영자(CEO)가 ‘화성의 식민지화·인류의 우주 진출’ 등을 이루기 위해 스페이스X를 창립한 시점도 2002년이다. 버진갤럭틱 역시 2004년 영국 버진그룹의 리처드 브랜슨 회장이 ‘우주관광’ 등의 사업을 영위하고자 세운 기업이다.우주 개발 산업의 세계 패러다임은 이들 기업의 발족으로 ‘뉴 스페이스(New Space)’로 전환되기 시작했다. 정부가 사업을 제시하고 기업이 따라오던 ‘올드 스페이스(Old Space)’에서 벗어나 민간이 우주개발을 주도하는 방식으로 변화, 새로운 시장이 형성되고 있다. 민간 우주 기업 역사는 20년 안팎으로 전통적인 산업군에 비해 짧지만 남긴 성과는 적지 않다.뉴 스페이스 시대 선두 ‘스페이스X’…블루오리진·버진갤럭틱 ‘추격’스페이스X는 뉴 스페이스 시대를 이끄는 기업으로 꼽힌다. 블루오리진과 버진갤럭틱 역시 우주 산업의 핵심 기술을 확보했지만, 스페이스X보단 뒤처져있는 것으로 평가된다.스페이스X는 2006년 세계 최초 민간개발 우주발사체 ‘팰컨1’를 쏘아 올린 것을 시작으로 △인공위성 △로켓 △로켓 엔진 △우주선 △우주관광 등의 영역에서 다양한 족적을 남겼다. 특히 2010년 지구 궤도상 우주선 ‘드래곤’을 발사, 발사 후 회수에 성공했다. 민간 기업 중에선 최초로 달성한 우주선 회수 기록이다. 드래곤은 2012년 ISS 도킹에도 성공한 바 있다.스페이스X의 도전은 여기서 멈추지 않았다. 2015년 ‘팰컨9’ 성공으로 재사용이 가능한 우주발사체 시대를 열었다. 국가 단위 사업에서도 이루지 못한 ‘재사용 발사체’ 기술을 민간 기업이 확보한 셈이다. 팰컨9는 2010년 첫 발사 이후 지난해까지 102회 발사됐는데, 실패 기록은 단 2회에 그친다. 스페이스X는 올해 5월 ‘같은 발사체 10회 사용’이란 대기록을 세우기도 했다.



스페이스X의 재사용 우주발사체 팰컨9.(사진=스페이스X)재사용 발사체는 우주 운송비용을 혁신적으로 떨어뜨렸다. 영국 이코노미스트가 집계한 통계자료를 보면 2005년 미국 주력 우주발사체로 사용된 아틀라스V를 통해 화물 1kg을 우주로 보내는 데 사용된 비용은 1만3400달러(약 1598만원) 수준이다. 반면 팰컨9는 2700달러(약 322만원)다.스페이스X는 우주 운송비용을 5분의 1 수준으로 감소시키며 뉴 스페이스 시대의 선두 기업 자리를 차지했다. 스페이스X는 재사용 발사체 확보 이후 인공위성 사업에 눈을 돌렸다. 스타링크 프로젝트는 재사용 발사체로 인한 경제성 확보로 시작될 수 있었다.스타링크는 저궤도 소형위성 수만 개를 쏘아 올려 지구 전역에서 이용 가능한 초고속 인터넷 서비스를 구축하는 사업이다. 스페이스X는 이미 스타링크용 위성을 1740대를 운용하고 있다. 2세대 스타링크 시스템 구축을 위해 3만대의 위성을 추가 배치할 계획이다. 머스크 CEO는 지난 8월 14개국에서 10만명이 스타링크 위성 인터넷 서비스에 가입했다고 밝힌 바 있다.



스페이스X는 저궤도 소형위성 수만 개를 쏘아 올려 지구 전역에서 이용 가능한 초고속 인터넷 서비스를 구축하는 사업인 ‘스타링크’ 프로젝트를 추진하고 있다. 사진은 스타링크 구상도.(사진=스페이스X)블루오리진 역시 재사용 우주발사체 핵심 기술을 확보했다. 블루오리진의 재사용 1단 로켓 ‘뉴 셰퍼드’는 수직 이륙 후 자세 전환 없이 지상에 내려오는 식으로 운용된다. 우주궤도에 진입하지 못하고 캡슐만 발사한 뒤 회수되는 방식이다. 스페이스X의 팰컨9는 이와 달리 우주궤도 진입을 위해 수평 비행 후 180도 회전해 지상에 수직 착륙할 수 있다. 팰컨9의 활용도가 더 높게 평가되는 이유다. 블루오리진은 팰컨9과 같은 방식의 재사용 발사체 ‘뉴 글렌’을 개발 중이다.블루오리진은 뉴 글렌 개발을 완료한 이후 세계 첫 민간 우주정거장을 운영하겠단 계획도 최근 밝힌 바 있다. 블루오리진 계획에 따르면 ‘오비탈 리프(Orbital Reef)’란 이름이 붙여진 이 시설은 ISS 고도(340~432㎞)보다 더 높은 500㎞ 상공의 궤도를 돈다. 뉴 글렌을 내년 4분기 발사해 오비탈 리프의 기초가 될 부품을 우주에 띄울 예정이다.오비탈 리프는 830㎥ 규모의 공간에서 최대 10명이 생활할 수 있도록 설계된다. 우주 여행객은 하루 32번씩 일출과 일몰을 우주 정거장에서 볼 수 있다. 회사는 2020년대 후반 오비탈 리프를 가동하겠단 목표다. 오비탈 리프는 우주 호텔·여행 등 ‘즐길 거리’부터 영화 제작과 같은 ‘엔터테인먼트’ 사업도 가능하다. 회사는 이 때문에 오비탈 리프를 ‘최초의 우주 비즈니스 센터’라고 표현했다.



블루오리진의 민간 우주정거장 ‘오비탈 리프’ 상상도.(사진=블루오리진)올드 스페이스 유산으로 큰 기업…우주관광 ‘각축전’우주관광 분야에선 스페이스X·블루오리진·버진갤럭틱 모두 각자의 방식으로 경쟁을 벌이는 양상이다. 첫 민간 주도 우주관광 기록은 버진갤럭틱이 세웠다. 지난 7월 리처드 브랜슨 회장이 직접 참여자로 나서면서 세계 이목이 쏠리기도 했다.버진갤럭틱은 우주 왕복선(VSS유니티)을 대형 항공기(VMS이브)에 싣고 이륙하는 식으로 우주관광을 진행했다. 공중에서 우주 왕복선 엔진을 점화한 후 90km까지 상승한 후 지구로 귀환하는 과정을 밟았다. 여행객들은 이를 통해 약 4분간 무중력을 체험할 수 있다.



버진갤럭틱의 우주선 스페이스십2.(사진=버진갤럭틱)스페이스X·블루오리진은 이와 달리 발사체를 활용한 우주여행을 선보였다. 블루오리진은 뉴 셰퍼드를 통해 올 7월과 10월 두 차례 우주관광을 진행했다. 첫 비행엔 제프 베이조스 아마존 창립자가, 두 번째 비행엔 90세의 노배우 윌리엄 섀트너가 탑승해 세간의 관심을 받았다. 섀트너는 미국 인기 드라마 ‘스타트렉’에서 제임스 커크 선장을 연기했던 배우다.스페이스X는 지난 9월 탑승객 전원(4명)이 민간인으로 구성된 우주관광에 성공했다. 버진갤럭틱이 약 4분, 블루오리진이 약 10분간 진행했던 우주관광과 달리 스페이스X는 무려 사흘 동안 지구를 도는 궤도 비행의 경험을 선사했다. 미국 신용카드 결제 처리업체 ‘시프트4 페이먼트’ 창업주인 재러드 아이잭먼이 약 2억 달러(약 2334억원)를 지불하고 티켓 4장을 구매했다. ‘인스피레이션4’란 이름으로 진행된 이번 여행은 발사체 팰컨9과 우주선 드래건 크루가 사용됐다. 탑승자들은 시속 2만7359㎞로 지구 주위를 돌며 하루 16번의 일출을 봤다.



스페이스X ‘인스퍼레이션4’에 참가한 민간 우주인들. 왼쪽부터 크리스 셈브로스키, 시안 프록터, 재러드 아이잭먼, 헤일리 아르세노.(사진=스페이스X)스페이스X·블루오리진·버진갤럭틱이 이처럼 빠르게 우주 산업의 성과를 올릴 수 있었던 배경은 ‘올드 스페이스 시대의 유산’이 꼽힌다. 이들 기업은 국가 주도의 연구개발 성과를 이전 받으며 핵심 기술을 빠르게 확보할 수 있었다. 항공우주업계 관계자는 “스페이스X가 우주 산업에 진출할 수 있었던 것은 1960년대 사람을 달로 보냈던 미국 항공우주국(NASA)의 기술을 이전받았기 때문”이라고 설명했다.우리나라 역시 지난 21일 발사한 누리호를 통해 뉴 스페이스 시대의 진입을 알렸다. 누리호는 개발 과정부터 국내 기업에 기술 이전을 염두에 두고 진행됐다. 누리호 프로젝트엔 약 300개 국내 기업이 참가했다. 전체 사업비의 80% 정도인 약 1조5000억원이 기업에 쓰였다. 자체 우주 발사체 확보는 민간 우주 산업의 기본 조건으로 꼽힌다. 우리나라는 2027년까지 총 6차례 누리호를 발사해 기술 완성도를 높이고 ‘자체 우주 운송 수단’ 확보를 달성할 계획이다. 2차 발사는 2022년 5월로 예정돼 있다.용홍택 과학기술정보통신부 제1차관은 누리호 1차 발사 당시 “그간 한국항공우주연구원을 중심으로 발사체 개발을 해왔는데, 추가 발사를 통해 이 기술을 완전히 민간에 전달할 계획”이라고 밝혔다.



한화가 ‘서울 ADEX 2021’ 전시를 통해 일반에 공개한 누리호 1단·2단에 탑재된 75t급 엔진.(사진=정두용 기자)",105,https://n.news.naver.com/mnews/article/293/0000036799?sid=103
"중견 코인거래소들, 신규사업으로 돌파구 찾는다…생존 잰걸음",2021.10.31. 오후 12:16,"가상자산과 전통 금융 융합한 비즈니스 기회 찾는다거래량 감소 타개할 활로 탐색…사업전략 부문 확충이상금융거래 보고 위한 자금세탁방지 시스템도 구축  [파이낸셜뉴스] 은행이 실명인증 계좌를 터주지 않아 정부에 가상자산 사업자 신고를 접수하지 못하고 영업실적이 10분의 1까지 떨어진 중견 가상자산 거래소들이 인재 채용을 통한 외연 확장과 시스템 보안 강화 등 신규사업으로 사업 방향을 잡고 있다. 중장기적으로 가상자산을 기반으로한 신사업을 통해 생존 활로를 찾으면서, 가상자산 사업자 신고를 위한 요건을 갖춰나가겠다는 의지다.     ""가상자산 신규 비즈니스 확장""   



국내 한 가상자산 거래소에서 비트코인 시세가 표시되고 있다./사진=뉴스1 31일 관련업계에 따르면 국내 중견 가상자산 거래소들이 중장기 사업 추진을 위한 인력 보강에 돌입했다. 은행의 실명계좌를 확보해 원화를 이용한 가상자산 거래가 허용된 4개 대형 거래소와 비교해 절대적인 매출은 낮지만, 법률에 따라 가상자산 사업자가 정의되는 특금법 시대를 기회로 삼아 가상자산 사업 확장에 집중하겠다는 것으로 풀이된다.   가상자산 거래소 지닥은 각 부문별 사업 확대를 위해 다양한 직군의 신규 인재를 영입한다. 지닥은 올해 본격적으로 가상자산 신사업 추진에 나서며 금융 및 정보기술(IT) 대기업들과 손 잡았다. 지닥은 SK (주)C&C와 부동산을 디지털 자산화해 NFT(Non-Fungible Token, 대체불가능한토큰) 형태로 소액 거래할 수 있는 서비스를 제공하기 위해 올해 5월 금융위원회 규제 샌드박스 인가를 신청했다. 또, 현재 SK증권과 디지털 자산 수탁 서비스를 개발하고 있고, 우리펀드서비스와 함께 개발한 기업용 가상자산 회계, 세무 서비스를 지난달 출시했다.   지닥 측은 ""우리금융과 하는 기업용 디지털 자산 관리 솔루션도 개발이 완료돼 사업부로 확장하고 있고, 커스터디 사업도 신규 전략이 필요한 상황""이라며 ""마케팅, 홍보, 비즈니스 전략 부문에서 신규 인력을 채용하려고 한다""고 말했다.   코어닥스도 거래소 신사업 추진을 위한 목적으로 기술과 운영, 사업기획 분야에서 신규 인원을 채용하겠다고 밝혔다. 코어닥스 역시 가상자산과 전통 금융 분야를 융합할 수 있는 신규 비즈니스를 모색하고 있다.     AML 보완해 특금법도 대응   



국내 가상자산 거래소들이 특금법 체제 하에 AML 시스템 강화를 위한 역량 확보에 집중하고 있다. 가상자산 거래소들은 신사업 추진과 더불어 현재 특금법에서 요구하는 가상자산 자금세탁방지(AML) 등 보안 강화에도 본격 나서고 있다. 플라이빗은 이달 글로벌 은행에서 10년 이상 AML 경력을 쌓은 전문가를 영입해 AML 업무 세밀화에 돌입했고, 포블게이트 역시 의심거래보고(STR) 시스템을 기존 AML 인프라와 연계하는 등 금융당국에 대한 보고 체계를 구축하고 있다.   내년 3월부터 특금법에 따라 국내 가상자산 사업자들에게 의무가 부과된 '트래블룰(가상산 송신자와 수신자 정보를 가상자산 사업자들이 파악해 의심거래로 의심될 경우 금융당국에 보고하는 것)' 준비도 중견 거래소들의 과제 중 하나다.   현재 국내에선 크게 빗썸, 코인원, 코빗이 라이트닝 네트워크를 기반으로 개발하는 코드 솔루션과 업비트 측의 람다256 솔루션인 베리파이바스프로 트래블룰 진영이 나눠져 있다. 최근 에이프로빗이 베리파이바스프 솔루션을 도입하기로 결정하며 선제적으로 대응하고 있다.   한 중견 가상자산 거래소 대표는 ""블록체인과 가상자산 산업은 글로벌 오픈 비즈니스이기 때문에 결국 해외 사업자들과 경쟁하는게 맞다고 본다""며 ""크게 볼때 산업이 이제 시작 단계인만큼 풍부한 잠재력을 적극 활용해나갈 생각""이라 말했다. #블록체인 #가상자산 #가상자산거래소",105,https://n.news.naver.com/mnews/article/014/0004731527?sid=103
