title,date,main,section,url
"AI 스타트업 라이언로켓, 제홍모 전 스트라드비젼 CTO 영입",2022.11.25. 오전 11:19,"제홍모 라이언로켓 신임 최고연구책임자(CRO). /라이언로켓 제공인공지능(AI) 스타트업 라이언로켓이 자사 최고연구책임자(CRO)로 제홍모 전 스트라드비젼 최고기술책임자(CTO)를 영입했다고 25일 밝혔다. 가상 얼굴 앱 '베리미'의 기술 고도화 목적이다.제 전 CTO는 포항공대에서 컴퓨터공학 석사 과정을 졸업한 뒤 박사 과정을 수료했다. 2009년 영상인식 스타트업 올라웍스의 초기 멤버로 AI 연구 총괄을 맡았고, 2012년 올라웍스가 인텔에 매각된 이후엔 인텔코리아 이미징카메라그룹 이사로 재직했다. 자율주행 사물 인식 기술을 개발하는 스타트업 스트라드비젼에는 2015년에 CTO로 합류했다. 스트라드비젼은 지난 8월 1150억원 규모의 시리즈C 투자를 유치하며 시장 주목을 받았다.라이언로켓은 베리미 앱의 베타 버전을 지난 9월 출시했다. AI 기술을 바탕으로 사용자 실제 얼굴 데이터를 모아 자신만의 가상 얼굴을 만들어주는 서비스다. 생성 기술 서비스의 핵심인 AI 최적화와 경량화로 앱 성능을 끌어올리고, 앞으로 버추얼 라이브 스트리밍 환경까지 구축하는 것이 그가 맡은 과제다.정승환 라이언로켓 대표는 ""글로벌 경쟁 속에서 기술적인 성취를 이뤄온 최고 전문가를 영입해 고무적""이라며 ""AI 시장이 요구하는 강도 높은 서비스 상용화를 실현하고, 새롭게 합류하는 핵심 인재에게 투자를 아끼지 않을 것""이라고 말했다.",105,https://n.news.naver.com/mnews/article/015/0004779499?sid=103
"'롯데의 심장, 자이언츠의 영원한 10번' 이대호 선수 NFT 발행",2022.11.25. 오후 5:31,"롯데정보통신, 28일 12시까지 유니폼 등 경매 붙여 낙찰자에게 NFT 제공



롯데그룹 계열 IT 회사인 롯데정보통신이 계열 야구단 롯데자이언츠와 ‘이대호 NFT’를 발행한다. 롯데정보통신은 25일 롯데자이언츠 소속 스타인 이대호 선수의 은퇴를 기념하기 위한 이벤트로 NFT를 발행한다고 발표했다.  이 대체 불가능 토큰(NFT)은 이대호 선수 은퇴 기념 유니폼 및 포토전시회의 사진 경매 낙찰자들을 대상으로 발행될 예정이다. 포토카드형 인증서 형태로 제작되는 한정판 이미지다.   포토카드에는 은퇴식 슬로건인 ‘RE:DAEHO’ 와 함께 이대호 선수의 현역 시절 모습을 담았다. ‘조선의 4번 타자’, ‘자이언츠 영원한 10번’, ‘거인의 자존심’, ‘롯데의 심장’ 등 4종류다. 이대호 선수의 사인도 들어 있다. 롯데정보통신은 지난 7월 블록체인 전문기업과 MOU를 체결하며 NFT 사업을 본격화해나가고 있으며, 내년 1월 중 실제 거래가 가능한 온라인장터를 열어 롯데그룹 계열사들과 함께 제작한 다양한 종류의 NFT를 판매할 예정이다. 롯데정보통신 관계자는 ""이번 NFT 발행은 향후 NFT 생태계 구축을 위한 시작점으로 그 의미가 깊다“며 ”앞으로도 스포츠, 엔터테인먼트를 비롯해 멤버십 기반 토큰 등 다양한 분야에서 NFT 사업을 확대해나갈 예정""이라고 전했다. ‘G-LOVE 1차 유니폼 경매’는 이날 오전 10시부터 28일 12시까지 온라인에서 진행된다. 롯데자이언츠 홈페이지와 모바일 애플리케이션에서 자세한 내용 및 경매 참여방법을 확인할 수 있다.",105,https://n.news.naver.com/mnews/article/015/0004779672?sid=103
"[오~컬쳐]'재벌집 막내아들'은 시작?…컴투스, 콘텐츠 수혜 더 남았다",2022.11.26. 오전 10:00,"최근 JTBC 드라마 '재벌집 막내아들'이 화제를 모으면서 제작사 SLL과 래몽래인에 관심이 집중되고 있다. 재벌집 막내아들의 경우 본 방송은 JTBC에서 방영되지만 넷플릭스, 디즈니+, 티빙 등 다양한 OTT 채널에서 스트리밍되는 만큼 그 영향력도 빠르게 확산되는 모습이다. 제작사 래몽래인의 역량이 주목받으면서 관련 계열회사도 그에 따른 상승 효과를 누리고 있다. 게임기업에서 종합 콘텐츠 기업으로 사업을 확장하고 있는 컴투스가 대표적인 수혜주로 떠오른 모습이다.""위지윅 인수하길 잘 했네""…컴투스의 선구안한 때 '컴투스 프로야구' 시리즈로 '야구게임 명가'로도 불렸던 컴투스의 선구안은 정확했다. 컴투스는 메타버스 사업을 구상하고 있던 지난해 3월 시각특수효과(VFX) 전문 기업 '위지윅스튜디오'의 지분 13.7%를 확보하며 본격적인 협업 구도를 구축했다. 이어 컴투스는 같은 해 8월 위지윅스튜디오에 1607억원을 추가 투자해 최대주주에 오르게 된다. 24일 기준 현재 컴투스는 위지윅스튜디오의 지분 38.05%를 보유하고 있다.위지윅스튜디오는 컴퓨터그래픽(CG)과 시각특수효과(VFX)를 바탕으로 국내외 영화와 드라마에 기술을 지원하거나 제작하는 사업을 주력으로 하고 있다. 컴투스가 메타버스 플랫폼 '컴투버스'를 준비하고 있는 만큼 CG·VFX 부문에서 협업을 떠올릴 수 있겠지만, 최근 행보를 보면 영상 콘텐츠에서의 성과가 눈에 띈다.



(사진=재벌집 막내아들 홈페이지 갈무리)이는 위지윅스튜디오가 보유한 자회사를 통해 알 수 있는데, 가장 눈에 띄는 곳이 '래몽래인'이다. 래몽래인은 △뉴노멀진(티빙) △시맨틱에러(왓챠) △신병(ENA·시즌) △재벌집 막내아들(JTBC) 등 올해만 4편 이상의 제작 영상을 선보이며 꾸준히 수익성을 확대하고 있다. 특히 재벌집 막내아들이 흥행 조짐을 보이면서 래몽래인에 대한 관심도도 증가하는 추세다. 래몽래인이 SLL과 공동제작한 '재벌집 막내아들'은 3화 기준 JTBC에서 10.8%의 시청률을 기록했다. 이는 1화(6.1%)와 2화(8.8%)에 이은 상승세로, 본 방송 뿐만 아니라 OTT 시청층까지 가세해 TV와 OTT 플랫폼을 번갈아 시청하는 유동층을 탄탄하게 구축한 것으로 알려졌다. 현재 위지윅스튜디오는 래몽래인의 지분 20.13%를 보유한 최대주주로 실질적인 지배력을 행사하고 있다. 재벌집 막내아들의 경우, 위지윅스튜디오가 투자에도 참여해 관련 성과를 나눌 수 있는 구조를 구축했다. 위지윅스튜디오가 보유한 콘텐츠 제작사 '이미지나인컴즈'도 컴투스의 '효자 종목'이다. 2020년 11월 위지윅스튜디오는 이미지나인컴즈를 인수하고 자회사로 편입해 콘텐츠 제작 역량을 확대한 바 있다. 이미지나인컴즈는 예능 △나는 차였어 △투페이스 △로또싱어 등을 제작한 데 이어 △넷플릭스 오리지널 시리즈 '블랙의 신부' △신병 등을 통해 콘텐츠 제작 역량을 쌓아온 기업이다. 같은 해 이미지나인컴즈가 승리호 투자·배급사인 '메리크리스마스'를 인수해 자회사로 편입하며 위지윅스튜디오→이미지나인컴즈→메리크리스마스로 이어지는 지배구조가 완성됐다. 



컴투스 콘텐츠 계열사 지배구조. (사진=각사 제공, 그래픽=채성오 기자)이 외에도 위지윅스튜디오는 연결 기준 △팝뮤직 △에프포스트 △위즈온센 △골드프레임 △엔피 △고즈넉이엔티 △얼반웍스 △MAA 등의 종속회사를 보유하고 있었는 데 올들어 일부 회사를 합병하며 새롭게 사업구조를 재편했다. 해당 합병 건은 이미지나인컴즈가 고즈넉이엔티(소설 IP 개발사), 팝뮤직(종합 엔터사), 에프포스트(콘텐츠 후반작업 전문기업)를 흡수합병하는 것으로, 이를 통해 이미지나인컴즈는 사명을 '에이투지엔터테인먼트'로 변경했다. 위지윅스튜디오는 이미지나인컴즈의 콘텐츠 제작 능력에 합병사가 보유한 IP, 매니지먼트, 콘텐츠 보정 기술을 더한 에이투지엔터테인먼트를 '글로벌 빅스튜디오'로 키운다는 계획이다.위지윅스튜디오와 관련 계열사의 콘텐츠 제작 및 수급이 확대되면서 컴투스의 수익성도 개선될 것으로 예상된다. 컴투스가 위지윅스튜디오의 최대주주인만큼, 관련 기업과 그 계열사의 콘텐츠 사업 성과를 공유할 수 있는 데다 다양한 엔터테인먼트 IP를 확보할 수 있어 메타버스·게임과 연계된 사업 확장성을 기대할 수 있게 된다.디즈니와 접점 만들까…메리크리스마스 복병래몽래인·위지윅스튜디오의 '재벌집 막내아들'이 흥행함에 따라 관련 계열사의 제작 차기작도 업계의 관심사로 떠오르고 있다. 특히 내년 공개를 목표로 메리크리스마스가 제작하는 '킬러들의 쇼핑몰'이 글로벌 OTT 오리지널 콘텐츠로 공개될 것이라고 알려지면서 또 한 번 흥행을 기대하는 모습이다.



(사진=디즈니코리아)킬러들의 쇼핑몰은 강지영 작가가 쓴 '살인자의 쇼핑몰'을 원작으로 둔 콘텐츠다. 소설은 어느 날 삼촌이 자살했다는 소식을 듣게 된 '정지안'이 쇼핑몰을 차지하기 위해 찾아온 살인마들과 마주하며 벌어지는 내용을 담았다. 앞서 강지영 작가가 쓴 '살인자의 쇼핑목록'이 지난 4월 tvN을 통해 드라마로 제작돼 호평을 받았던 만큼, 킬러들의 쇼핑몰의 영상화 소식도 높은 기대를 받고 있다. 콘텐츠업계에서는 킬러들의 쇼핑몰이 디즈니+ 오리지널로 편성될 가능성에 무게를 싣고 있다. 제작을 맡은 메리크리스마스가 디즈니+와 손잡을 경우, 해당 콘텐츠는 자연스럽게 글로벌 지역으로 뻗어나가며 흥행 시 막대한 수익을 얻게 된다. 이미 이미지나인컴즈(에이투지엔터테인먼트)가 '블랙의 신부'를 통해 넷플릭스 글로벌 넷플릭스 TV쇼 부문 톱10에 오른 바 있어, 해당 계약이 체결될 경우 또 한 번 컴투스의 콘텐츠 수익성이 확대될 전망이다.한 콘텐츠업계의 관계자는 ""위지윅스튜디오를 기반으로 한 콘텐츠 밸류체인은 종합 엔터테인먼트 기업을 표방하는 컴투스에 있어 신의 한 수로 평가받고 있다""며 ""제작사, 아티스트 매니지먼트 기업, 콘텐츠 후반작업 업체까지 필수적인 제작 파이프라인을 갖춤으로써 향후 글로벌 OTT에 편성되는 작품이 흥행할 경우 컴투스의 수익성도 대폭 늘어날 전망""이라고 말했다.",105,https://n.news.naver.com/mnews/article/293/0000041578?sid=103
알뜰폰 요금 역주행… 업계 “도매가 낮아져야”,2022.11.26. 오전 6:01,"알뜰폰 업체 수익성 악화통신사에 내는 도매가 변동 없어 “도매제공 의무 영구화” 주장도 나와



서울 시내에 위치한 알뜰폰 스퀘어 매장 모습. /뉴스1         정부가 올해 안에 알뜰폰 활성화 방안을 담은 가계통신비 인하 대책을 발표하기로 하면서 도매대가 인하 여부가 뜨거운 감자로 떠올랐다. 도매대가란 알뜰폰 사업자들이 내야 하는 망 이용료를 뜻한다. 알뜰폰 사업자들은 SK텔레콤·KT·LG유플러스 등 이동통신 3사의 망을 빌려 이를 기반으로 서비스를 제공하고 있다. 통신 3사 중 SK텔레콤이 알뜰폰 업체에 망을 의무적으로 제공하도록 돼 있어 정부와 3년에 한 번씩 가격 협상을 한다.올해는 정부와 SK텔레콤이 도매대가 협상을 하는 해다. 도매대가가 낮아져야 알뜰폰 사업자의 수익성도 개선되고, 알뜰폰 요금제도 더 저렴해질 수 있다. 또 정부와 SK텔레콤의 협상안을 참고해 KT와 LG유플러스도 도매가를 책정하기 때문에 협상 여부가 주목받는다. 현재 가계통신비 인하 대책 발표에 앞서 정부와 SK텔레콤이 막판 협상을 하는 것으로 전해졌다. 다만 알뜰폰 요금제가 인하되기까지는 해결돼야 할 몇 가지 쟁점이 있다. 알뜰폰 업체, 5년간 228억원 적자        최근 5년 사이 알뜰폰 업체의 수익성이 악화되면서 알뜰폰 요금제 가격도 오르고 있다.26일 과학기술정보통신부가 최근 국회에 제출한 자료에 따르면 알뜰폰 사업자의 영업이익은 지난 2017년부터 2021년까지 5년 동안 228억원의 적자를 냈다. 일부 알뜰폰 요금제는 지난해부터 가격이 조금씩 올랐다. SK텔링크 세븐모바일 ‘11GB+/통화맘껏’ 요금제, LG헬로비전 헬로모바일 ‘The 착한 데이터 유심 11GB’ 요금제 등은 1000원가량 요금이 인상됐다.알뜰폰 업체들의 수익성이 악화된 이유 중 하나는 수익배분방식 때문이다. 도매대가를 산정하는 방식은 종량형과 수익배분형 두 가지로 나뉜다. 5세대 이동통신(5G)과 4세대 이동통신(LTE) 등 주력 요금제에 적용되는 방식은 주로 수익배분형이 적용되는데, 요금제 가격의 일정 비율을 통신사에 도매대가로 납부하는 식이다. 예컨대 3만3000원짜리 알뜰폰 요금제의 도매대가율이 42%라면, 1만3860원을 알뜰폰업체가 통신사에 납부해야 한다. 따라서 이 비율이 낮아져야 알뜰폰 업체의 수익성이 개선될 수 있고, 요금을 인하할 수 있는 여력이 생긴다. 그런데 최근 이 비율이 낮아지지 않고 그대로 유지되고 있다.수익배분 방식에 대한 알뜰폰 업체와 이동통신사, 정부 간 갈등은 수년째 이어져 오고 있다. 알뜰폰 업체들은 수익배분방식에 대한 기준을 명문화하자고 주장하는 반면, 통신사는 과도한 규제라는 입장이다.



사진은 지난 9일 서울 서대문구 서대문역에 위치한 알뜰폰 스퀘어에 진열되어 있는 핸드폰. /뉴스1   도매제공의무 상시화 법안, 찬반양론 팽팽        3년마다 협의해야 하는 ‘일몰제’를 없애고 통신사들이 영구적으로 도매제공을 하도록 하자는 이야기도 나온다. 알뜰폰 업체 입장에서는 ‘도매제공 의무사업자’ 제도가 없어지면 시장에서 살아남기 힘들다고 주장하고 있다. 특히 3년에 한 번씩 협의해야 하는 상황이 부담스럽다는 것이다. 알뜰폰 업체 관계자는 “3년마다 재협상을 해야 하면 장기적인 관점에서 사업계획을 수립하는 것이 어렵고, 투자비 회수가 장기간 소요되는 설비투자 등은 진행할 수가 없는 상태가 된다”고 말했다.김영주 더불어민주당 의원과 김영식 국민의힘 의원이 도매제공 의무를 상시화하도록 하는 법안을 내놨지만 국회에 계류돼 있다. 국회 과학기술정보방송통신위원회는 최근 김영주 의원의 법률안에 대한 검토를 진행 중인데, 찬반의견이 팽팽한 만큼 신중하게 고려해서 입법정책적으로 판단해야 한다고 밝혔다.과기정통부는 해당 법안에 찬성 의견을 냈다. 과기정통부는 관계자는 “알뜰폰 시장 규모 자체는 성장했지만 매출액은 여전히 전체 이동통신 시장 대비 5%에 불과하고 영업이익이 적자인 상황이다”라며 “도매제공 의무제가 없어지면 도매제공의무사업자(SKT)가 알뜰폰 업체에 도매제공을 하지 않거나 일부 서비스만 도매로 제공할 수 있다”고 밝혔다. 그러면서 “이동통신 경쟁을 촉진하고 국민의 통신비 부담을 경감하기 위해서는 현행 도매제공의무제 유지가 필요하다”며 “이 제도가 없어지면 알뜰폰 사업자의 경쟁력 약화가 우려된다”고 했다.반대로 SK텔레콤은 “해당 제도가 최초로 도입 당시, 과도한 규제라는 이유로 3년 한시법으로 도입된 것이다”라며 “도매제공 의무사업자가 아닌 KT와 LG유플러스도 적극적으로 도매제공에 나서고 있어 법률로 의무사업자를 지정할 실익이 없다”고 했다. 이어 “지난 12년간 알뜰폰 시장의 비약적 성장을 고려하면, 의무 제도 영구화는 무리한 입법이다”라고 주장했다.알뜰폰 활성화 대책에 5G 중간요금제 도매제공 계획도 포함될지 주목된다. 통신 3사는 지난 8월 5G 중간요금제를 출시했지만, 알뜰폰 사업자들은 아직 이를 도매로 제공받지 못했다. 업계 관계자는 “5G 중간요금제에 대해서도 도매제공이 이뤄지면 알뜰폰 업체들은 더욱 경쟁력을 갖출 수 있겠지만, 통신사 입장에서는 자신들의 5G 가입자 추이에 중간요금제가 영향을 미치는 상황이어서 과연 논의가 순조롭게 이뤄질지 의문이다”라고 말했다.",105,https://n.news.naver.com/mnews/article/366/0000857868?sid=103
"[속보] 업비트·빗썸·코인원, 위믹스 '상장폐지'",2022.11.24. 오후 7:51,"ⓒ디지털자산 거래소협의체(닥사)가 24일 회의에서 위메이드가 발행한 '위믹스'의 거래지원종료(상장폐지)를 결정했다.이에 따라 국내 가상화폐거래소인 업비트, 빗썸, 코인원 등에서 거래 종료(매수/매도)일은 오는 12월 8일 오후 3시다.",105,https://n.news.naver.com/mnews/article/119/0002661171?sid=103
"위메이드, 위믹스 상폐? ""공정위에 제소할 것""",2022.11.26. 오후 4:53,"[디지털데일리 박세아 기자]  위메이드가 위믹스 상장폐지 관련 공정거래위원회에 제소할 방침이다.   26일 위메이드는 ""시장의 거의 100%를 점유하는 사업자들이 담합해 어떤 가상화폐를 상장할지 말지 결정하는 것은 불법이라고 알 고 있다""라며 ""더욱이, 닥사 내에서도 의견이 일치하지 않았던 것으로 알려지고 있는데, 이를 하나의 의견으로 모아서 행동하기로 한 것은 명백한 담합행위로 불법이라고 생각한다""라고 밝혔다.   앞서 위메이드는 가상자산거래소 연합체 닥사(DAXA)가 지난 24일 위믹스에 대해 거래지원 종료 결정을 내린것과 관련해 가처분 신청을 준비 중이라고 전한 바 있다.   당장 오는 12월 8일 위믹스 거래지원이 종료되기 때문에 가처분 신청이 빠르게 진행될 것으로 보인다.   위믹스 상장폐지에 대해 지난 25일 열린 긴급 미디어 간담회에서 위메이드 장현국 대표는 ""유통량의 정확한 기준이 없다""라며 ""문제가 된 사항을 정정했는데도 불구하고 위믹스 상장폐지 결정을 내린 것은 갑질""이라고 언급한 바 있다.",105,https://n.news.naver.com/mnews/article/138/0002137601?sid=103
강원 ICT 슈퍼위크 28일 개막…ICT 산업 성과 공유,2022.11.26. 오전 10:01,"30일까지 기업인 소통·제품 전시·특강 등 다채(춘천=연합뉴스) 이상학 기자 = 강원도 내 정보통신기술(ICT) 산업 성과를 한자리에서 만나는 '강원 ICT 슈퍼위크' 행사가 28일 개막해 30일까지 춘천 서면 강원창작개발센터 일대에서 열린다. 



강원정보문화진흥원 전경[강원정보문화진흥원 제공.재판매 및 DB 금지]    26일 강원정보문화산업진흥원에 따르면 ICT 슈퍼위크는 올 한해 강원도와 춘천시가 지역 내 기업을 지원해 추진한 다양한 사업의 성과를 공유하고, ICT산업 기업인과 소통을 위해 마련했다.     이번 행사는 지역 ICT 기업 제품 및 서비스 전시를 비롯해 콘퍼런스, 춘천시 드론 실증지원사업 시연회 등으로 펼쳐진다.     개막식은 28일 오후 3시 서면 강원창작개발센터 오디토리움에서 열린다. 



지난해 열린 행사에서 송길영 바이브컴퍼니 부사장 특강[연합뉴스 자료사진]    최양희 한림대 총장은 '디지털 대한민국, 디지털 강원, 디지털 춘천'이라는 주제로 기조연설을 한다.     이어 강원 ICT 유공자 포상과 강원 메이커톤 대회 시상식, 도내 ICT 진흥 정책 발표가 이어진다.     행사 기간인 28일 콘퍼런스 특강에 아침향기의 저자 고도원 시인과 서범강 한국웹툰산업협회회장의 특강도 마련한다.     또 30일에는 대통령의 글쓰기 저자 강원국 작가, 이경삼 KISAT 교수, 유지대 씨디에스 대표, 권호열 정보통신책임연구원(KIDSI) 원장이 특강을 한다. 



2021년 12월 드론택배 시연[강원정보문화진흥원 제공.재판매 및 DB 금지]     특히 행사 마지막 날인 30일 오후 2시 드론체험장에서 '춘천드론 실증 지원사업' 시연회도 개최한다.     강원도와 춘천시는 2002년부터 20년간 강원정보문화산업진흥원과 함께 강원도 ICT 산업을 육성 지원하고 있다.     지역 ICT 기업의 창업보육에서 사업화 지원까지 통합지원체계를 구축해 운영 중으로, 2020년부터는 SW 융합클러스터 2.0, 강원 VR·AR제작 거점센터, 메이커스페이스 전문랩 사업 등을 지원 중이다. 



    강원도 관계자는 ""그동안 춘천시와 강원정보문화산업진흥원이 구축한 ICT기반 인프라를 활용해 도민이 체감하는 산업을 적극적으로 육성하겠다""고 말했다,    hak@yna.co.kr",105,https://n.news.naver.com/mnews/article/001/0013603296?sid=103
"안랩, 국내 정보보안 기업 최초 '기업지배구조 보고서' 발간",2022.11.25. 오전 10:50,"보안기업 안랩 판교 사옥 (안랩 제공)(서울=뉴스1) 오현주 기자 = 안랩은 국내 정보보안 기업 최초로 기업지배구조 보고서를 발간했다고 25일 밝혔다. 안랩은 현행 공시규정상 기업지배구조의 공시의무는 없다. 하지만 ESG(환경·사회·지배구조) 경영 일환으로 보고서를 작성해 홈페이지에 공개했다.투자자의 권익을 보호하고 △주주 △임직원 △고객 △파트너사 등 이해관계자와의 소통을 통해 경영 투명성을 높이기 위해서다.보고서는 한국거래소(KRX)가 선정한 10가지 핵심원칙에 대해 설명하는 방식으로 작성됐다. '주주의 권리'와 '이사회 및 감사기구의 구성과 운영'에 관한 내용도 담았다.김덕환 안랩 재무기획실장은 ""건전한 지배구조를 알리고 유지하기 위해 앞으로도 지속적으로 기업지배구조보고서를 공개할 계획""이라며 ""필요할 경우 내년부터는 홈페이지 공개 외에도 다른 상장법인의 공시 일정에 맞춰서 함께 공시하는 방안도 검토 중""이라고 말했다.",105,https://n.news.naver.com/mnews/article/421/0006481737?sid=103
"스페이스엘비스, 대한민국 디자인대상 대통령 표창 수상",2022.11.26. 오전 10:15,"디자인 경영 부문 수상…제작·서비스 등 경영 성과 입증스페이스엘비스는 지난 23일 열린 '디자인코리아 2022'에서 대한민국 디자인대상 기업부문 대통령 표창을 수상했다고 밝혔다. 대한민국 디자인대상은 산업통상자원부가 주최하고 한국 디자인진흥원이 주관하는 디자인 시상식이다. 제조·서비스 혁신을 유도하고 디자인 경영전략 수립과 투자, 인재 양성 등 성과를 거둔 기업에 상을 수여한다.이승호 스페이스엘비스 대표는 “우리가 미디어, 콘텐츠 제작 영역에서 보여준 산업 전반의 확장성과 성과를 평가받은 유의미한 수상”이라며 ""내년부터 본격화할 미디어 환경 변화를 예측하고, 과감한 투자를 통해 메타버스 환경에 대응이 가능한 디자인 경영을 한층 강화할 것""이라고 수상 소감을 전했다.



스페이스엘비스가 지난 23일 열린 '디자인코리아 2022'에서 대한민국 디자인대상 기업부문 대통령 표창을 수상했다.스페이스엘비스는 미래 먹거리 사업으로 꼽히는 메타버스 관련 사업을 영위하고 있다. 이번 대통령상을 비롯해 올 한해 산업통상자원부 장관상, 과학기술정보통신부 장관상, 국무총리상 등을 잇따라 수상하며 업계 안팎에서 메타버스 산업 확장 가능성을 인정받고 있다.



(사진=스페이스엘비스)",105,https://n.news.naver.com/mnews/article/092/0002274827?sid=103
