title,date,main,section,url
"LGU+, 양자내성암호 적용망 TTA 시험·검증 완료",2021.05.18. 오전 10:06,"[디지털데일리 최민지기자] LG유플러스(대표 황현식)는 디지털 뉴딜 과제 일환으로 산업·의료분야 기업에 구축한 양자내성암호 전용회선에 대해 한국정보통신기술협회(TTA)로부터 시험·검증을 받았다고 18일 밝혔다.   양자내성암호는 암호키 교환 등 보안 핵심요소에 적용할 수 있어 확장성이 높고 수백㎞ 이상 장거리 전송이 가능하며, 별도 장비 없이 소프트웨어만으로도 구현할 수 있다. 휴대폰에서 소형 사물인터넷(IoT) 디바이스까지 유연하게 적용해 유무선 통신망 모든 영역에서 보안을 제공할 수 있다.   TTA 검증은 지난해 LG유플러스가 코위버와 함께 개발한 상용 광전송장비(ROADM)을 이용해 공장·병원에 구축한 양자내성암호 전용회선이 정상적으로 작동한다는 것을 확인했다는 의미가 있다. 시험은 지난 3월 중 초연결 지능형 연구개발망(KOREN) 구간 중 한국지능정보사회진흥원(NIA) 서울 사무소~부산 부경대학교 구간에서 진행됐다. 양자내성암호 알고리즘과 암호전송장비, 용용서비스 성능에 대한 산업분야 37개·의료분야 35개 항목 시험·검증을 수행했다.   LG유플러스가 사용한 공개키(비대칭키) 방식인 격자기반 양자내성암호 알고리즘은 키생성에 소요되는 시간과 키교환 프로세스에 사용하는 메모리 용량 등 시험 기준을 훨씬 능가했다.   이 알고리즘이 작동하는 광전송장비(ROADM)는 양자내성암호 키교환 알고리즘을 지원하고, 양자난수발생기(QRNG)와의 연동 또한 문제없이 작동했다. 의료정보시스템 등 응용서비스에서도 데이터 업로드‧다운로드에 100% 성공했고, 전송계층보안(TLS) 요청 처리시간과 서버 사용자 로그인 처리시간, 인증토큰과 PC 응용프로그램의 연동 응답시간도 모두 1초 이내에 작동했다.   권준혁 LG유플러스 네트워크부문장은 “TTA 시험·검증을 통과한 산업·의료분야 양자보안 솔루션이 올해에는 더욱 다양한 산업군에서 높은 보안성을 제공하게 된다”며 “암호키교환 등 알고리즘을 한층 더 업그레이드해 더욱 보편적이고 활용도가 높은 양자보안 인프라를 늘려 나가는데 LG유플러스가 앞장서겠다”고 말했다.   <최민지 기자>cmj@ddaily.co.kr▶ 네이버에서 디지털데일리 채널 구독하기▶ IT정보의 즐거운 업그레이드 [딜라이트닷넷]<저작권자 © 디지털데일리 무단전재-재배포금지>",105,https://n.news.naver.com/mnews/article/138/0002103553?sid=103
네이버 '동대문 패션시장 디지털 물류혁신'에 산업은행도 동참,2021.05.18. 오전 11:59,"혁신 스타트업 지속성장 위한 공동투자 및 지원 업무협약 체결



[서울=뉴시스]17일 브랜디 동대문 풀필먼트 센터에서 열린 업무 협약식에 네이버 한성숙 대표이사, 브랜디 서정민 대표, 산업은행 이동걸 회장 등이 참석했다. (사진=네이버 제공) 2021.05.18[서울=뉴시스] 이진영 기자 = 네이버는 지난 17일 산업은행과 국내 혁신 스타트업의 지속성장을 위한 공동 투자 및 지원을 위한 업무협약(MOU)을 체결했다고 18일 밝혔다.양사는 이번 MOU를 통해 물류를 포함한 디지털·뉴딜 분야 스타트업에 공동으로 투자하고, 네이버 풀필먼트 협력(NFA·NAVER Fulfillment Alliance) 기업 대상 금융을 지원하는 등 국내 벤처 생태계를 활성화하기 위한 파트너십을 구축했다.먼저 양사는 동대문 패션시장 물류의 디지털 전환을 위한 공동 투자 및 지원에 나선다. 네이버는 동대문 패션 중소상공인(SME)들이 물류 고민 없이 판매와 마케팅에만 집중할 수 있도록 동대문 물류 스타트업과의 제휴를 강화하고, 산업은행은 관련 운영 자금 투자를 지원한다. 1호 투자 기업으로는 커머스 플랫폼 '브랜디'를 선정했다. 브랜디는 동대문 기반 풀필먼트 서비스 통합 관리 시스템을 개발·운영하는 스타트업으로 지난해 9월 네이버로부터 100억원, 지난달 산은으로부터 100억 투자를 유치한 바 있다.이와 함께 네이버 풀필먼트 협력에 참여하는 스타트업을 대상으로 하는 투·융자 지원도 추진한다. SME들의 다양한 풀필먼트 수요를 해결할 수 있도록 관련 금융 지원을 강화해 이커머스 시장 진입 장벽을 낮춘다는 계획이다.아울러 네이버의 기술 스타트업 엑셀레이터인 D2SF와 협력해 로봇, 인공지능(AI) 등 뉴딜 분야 스타트업에 대한 공동 투자로 혁신 기업을 발굴 육성하고 네이버 투자 기업을 대상으로 산업은행의 넥스트라운드(NextRound) 참여 기회를 제공하는 등 후속 투자 유치를 지원해 지속 성장을 위한 생태계 조성에 힘쓰기로 했다.이어 같은 날 네이버는 브랜디와 함께 동대문 패션산업의 디지털화를 위한 업무 협약(MOU)을 맺고 동대문 패션 산업의 디지털화 및 글로벌 진출을 위해 힘을 합치기로 했다. 동대문 패션 SME들이 안정적으로 상품을 수급하고 판매할 수 있도록 네이버 플랫폼과 연동되는 풀필먼트 시스템을 구축하고, 향후 크로스보더 이커머스로 확장시켜 동대문 패션 SME의 글로벌 판로 확대를 모색하는 등 사업 확장을 지원할 계획이다. 네이버 한성숙 대표는 ""국내 이커머스 시장의 급성장에 따른 풀필먼트 혁신이 대두됨에 따라 다양한 물류 스타트업과의 협력을 강화하는 NFA를 통해 판매자와 이용자에게 새로운 가치를 전달할 것""이라며 ""이번 산업은행과의 파트너십을 통해 물류 영역뿐 아니라 디지털 전환이 필요한 각 산업 영역에서 혁신을 일으키는 스타트업들이 지속 성장할 수 있는 벤처 생태계를 조성해나가겠다""고 말했다.☞공감언론 뉴시스 mint@newsis.com▶ 네이버에서 뉴시스 구독하기▶ K-Artprice, 유명 미술작품 가격 공개▶ 뉴시스 빅데이터 MSI 주가시세표 바로가기<ⓒ 공감언론 뉴시스통신사. 무단전재-재배포 금지>",105,https://n.news.naver.com/mnews/article/003/0010504069?sid=103
"""아마존, MGM 스튜디오 인수 협상""",2021.05.18. 오전 9:08,"(서울=연합뉴스) 경수현 기자 = 제프 베이조스가 이끄는 아마존이 영화 '007' 시리즈 제작사로 유명한 MGM을 인수하려고 협상을 벌이고 있다고 로이터 통신이 17일(현지시간) 미 정보기술(IT) 전문매체 '디 인포메이션'을 인용해 보도했다.    이에 따르면 이 매체는 이날 복수의 소식통을 인용해 협상이 진행 중이며 현재로써는 거래가 성사되지 않을 가능성도 있다고 전했다.    이에 대해 아마존은 소문이나 추측에 대해서는 언급하지 않는다면서 특별한 입장을 내놓지 않았다.    MGM은 뿌리가 1920년대까지 거슬러 올라가는 전통의 영화 제작사로, 현재는 영화뿐만 아니라 케이블 채널 에픽스를 운영하면서 TV 쇼도 제작하고 있다.    MGM은 이미 여러 차례 매각을 추진한 바 있으며 최근에는 투자은행(IB) 모건스탠리 등과 접촉한 것으로 작년 12월 미 언론들은 보도했다.     아마존은 2010년 아마존 스튜디오를 세워 자체 드라마를 제작하는 등 미디어 산업에 꾸준히 발을 넓혀왔으며 온라인 동영상 서비스(OTT)인 '프라임 비디오' 서비스도 하고 있다.



아마존[아마존 제공]    evan@yna.co.kr▶네이버에서도 뉴스는 연합뉴스[구독 클릭]▶[팩트체크] SNS 달군 백신가격 비교 글? ▶제보하기<저작권자(c) 연합뉴스(https://www.yna.co.kr/), 무단 전재-재배포 금지>",105,https://n.news.naver.com/mnews/article/001/0012400089?sid=103
"콩스튜디오 '가디언테일즈', 7개월간 매출 1120억·1000만 다운로드 기록",2021.05.18. 오전 9:16,"[디지털데일리 왕진화기자] 가디언테일즈의 게임 누적 매출이 한화 약 1120억원을 돌파했다.   미국 게임 개발사 콩스튜디오(대표 WON)는 자사 모바일게임 '가디언테일즈'의 이같은 내용과 함께 2021년 2월말 기준 1000만 다운로드를 기록했다고 18일 밝혔다.    이는 2020년 7월말 가디언테일즈 그랜드 론칭 이후 7개월 간 중국과 일본을 제외한 글로벌 버전의 실적이다.    가디언테일즈는 탄탄한 스토리 라인과 귀여운 그래픽, 높은 완성도 등의 게임성이 입소문을 타면서 글로벌 그랜드 런칭에 앞서 진행한 사전 예약에만 100만명이 넘는 이용자가 몰리는 등 게이머들의 기대감을 한 몸에 받은 바 있다.    이런 인기에 힘입어 가디언테일즈는 7개월이라는 길지 않은 시간동안 1120억원의 매출을 기록했다. 이와 별도로 중국에서도 출시 첫날부터 3582만위안(한화 약 61억5000만원) 매출을 기록하며, 글로벌 흥행을 이어갔다.    콩스튜디오는 올해 2월 해외게임 권한인 외자판호를 받고 4월27일, 중국에서 비리비리를 통해 '캔터베리 공주와 기사의 판타지 모험: 챔피언의 검을 깨우다(약칭 坎公骑冠剑)'라는 게임명으로 서비스를 시작한 바 있다. 이는 중국 내에서 iOS 기준 매출순위 3위, 무료 다운로드 1위에 해당하는 기록이다.   콩스튜디오는 올해 하반기 가디언테일즈 모바일 버전 일본 정식 서비스와 닌텐도 스위치 버전의 글로벌 출시를 계획하고 있다.    특히 일본에서는 콩스튜디오 최초로 게임 개발부터 콘텐츠 현지화 작업, 일본 시장 게임 운영까지 모두 자체 퍼블리싱으로 준비 중이라는 게 회사 측 설명이다.   <왕진화 기자>wjh9080@ddaily.co.kr▶ 네이버에서 디지털데일리 채널 구독하기▶ IT정보의 즐거운 업그레이드 [딜라이트닷넷]<저작권자 © 디지털데일리 무단전재-재배포금지>",105,https://n.news.naver.com/mnews/article/138/0002103544?sid=103
"워너미디어-디스커버리, 49조원 합병…넷플릭스‧디즈니+ 쫓는다",2021.05.18. 오전 11:16,"[디지털데일리 최민지기자] 미국 통신사 AT&T 콘텐츠 자회사 워너미디어와 케이블TV 채널 사업자 디스커버리가 합병을 추진한다. AT&T는 미디어사업에서 한발 뒤로 물러났고, 신설회사는 넷플릭스‧디즈니플러스 중심 OTT 시장에서 새로운 활로를 모색한다.    17일(현지시간) AT&T와 디스커버리는 미디어 콘텐츠 자산에 합의한다고 밝혔다. 이에 따라 AT&T는 워너미디어 미디어사업부를 기업분할 후, 디스커버리와 합병하는 방안을 강구하고 있다.    새 회사 지분은 AT&T와 디스커버리가 각각 71% 29% 갖는다. 데이비드 자슬라브 디스커버리 최고경영자(CEO)가 새 회사를 맡을 예정이다.    AT&T는 현금과 부채 포함 총 430억달러(약 49조원)를 받는다. AT&T는 워너미디어 전신 타임워너는 지난 2018년 850억달러(약 97조원)에 인수하며 CNN, HBO, TBS 등을 보유하게 됐다. 하지만, 케이블TV에서 OTT시장으로 전환하는 미디어 환경에 대응하지 못했다는 평가다.    AT&T는 OTT시장에 대응하기 위해 ‘HBO맥스’를 선보였으나, 넷플릭스와 디즈니플러스와 격차는 크다. 넷플릭스 글로벌 가입자는 2억7000만명, 디즈니플러스의 경우 1억명을 넘어섰으나 HBO맥스는 6400만명에 불과하다. HBO맥스는 6월부터 글로벌 진출을 본격화한다는 방침이다. 디스커버리 OTT ‘디스커버리+’ 구독자는 1500만명이다.   이에 워너미디어와 디스커버리가 합병하면 양사의 방대한 미디어 콘텐츠를 결합해 넷플릭스‧디즈니플러스와는 차별화된 새로운 가치를 소비자에게 제공할 수 있다는 판단이다. 워너미디어는 케이블채널 CNN, HBO, 시네맥스, TNT, TBS과 스튜디오 워너브러더스를 소유하고 있다. 유명한 ‘왕좌의 게임’ 시리즈도 HBO 대표작으로 꼽힌다. 디스커버리는 디스커버리 케이블채널과 애니멀플래닛, HGTV 등을 보유하고 있다.   한편, 합병법인 기업가치는 1500억달러(약 171조원)에 달할 것으로 전망된다. 또, 신설기업은 콘텐츠 투자 200억달러를 투입할 예정이다.     <최민지 기자>cmj@ddaily.co.kr▶ 네이버에서 디지털데일리 채널 구독하기▶ IT정보의 즐거운 업그레이드 [딜라이트닷넷]<저작권자 © 디지털데일리 무단전재-재배포금지>",105,https://n.news.naver.com/mnews/article/138/0002103568?sid=103
"리움미술관, 다문화가정 200여 명 초청 행사…색각 이상 보정안경 도입",2023.10.24. 오전 9:51,"리움미술관이 서울 용산구, 마포구, 강북구, 성동구, 은평구 가족센터 등 8개 기관과 협력해 다문화(외국인) 가정의 부모와 자녀 200여 명을 초청한 미술관 관람 행사를 어제(23일) 진행했다고 밝혔습니다. 참석자들은 리움미술관의 <고미술 상설전>과 기획전 <강서경展>, <김범展>을 관람했고, 리움미술관 강당에서 삼성 관계사 임직원으로 구성된 삼성필하모닉오케스트라의 특별공연도 감상했습니다. 한국어, 영어, 중국어, 일본어로 전시와 미술관 공간을 안내하는 디지털가이드와 함께 생성형 인공지능(AI) 기술을 접목한 실시간 다국어 문자통역 솔루션을 통해 영어, 아랍어, 베트남어, 일본어, 러시아어, 스페인어, 중국어, 태국어 8개국 언어 실시간 문자통역 서비스가 제공됐습니다. 한선규 용산구가족센터장은 ""우리 사회 속 다문화가정의 비중이 점차 높아지면서 이들이 사회 구성원으로 안정적으로 정착할 수 있도록 사회적 포용성을 가지는 것이 중요한 시기""라며 ""환대와 존중 속에 마련된 초청 관람 행사를 통해 소속감과 상호 이해를 높이는 좋은 계기를 만들어주어 감사하다""고 전했습니다. 리움미술관은 11월과 12월에도 지역사회와 협력해 문화 취약계층을 초청하는 행사를 이어갈 예정입니다. 리움미술관은 아울러 다양한 특성을 가진 관람객을 위해 물리적, 심리적 장벽을 낮춰 문화향유의 기회를 확대하고 폭넓은 예술 경험을 지원하고자 호암미술관에서 시범적으로 운영해온 색각 이상 보정안경을 오늘(24일)부터 리움미술관에도 도입해 관람객에게 무료로 대여한다고 밝혔습니다. 리움미술관을 운영하는 삼성문화재단은 이를 위해 색각이상 보정안경 전문 기업 주식회사 알엠케이, 3차원 스캐닝·프린팅 기술을 활용한 맞춤 안경 제조 스타트업인 브리즘(주식회사 콥틱)과 업무협약(MOU)을 맺었습니다. 류문형 삼성문화재단 대표이사는 ""호암미술관에 이어 리움미술관에 도입되는 색각 이상 보정안경을 통해 더 많은 분이 작품 속의 생생한 색을 감상하고 즐기는 계기가 되기를 기대한다""고 밝혔습니다.■ 제보하기▷ 전화 : 02-781-1234, 4444▷ 이메일 : kbs1234@kbs.co.kr▷ 카카오톡 : 'KBS제보' 검색, 채널 추가▷ 네이버, 유튜브에서 KBS뉴스를 구독해주세요!",105,https://n.news.naver.com/mnews/article/056/0011587852?sid=103
[기자수첩]디지털정책 수장 된 임혜숙 장관의 과제,2021.05.18. 오전 7:37,"디지털뉴딜 1년 경과...남은 임기 1년 간 성과 창출해야(지디넷코리아=박수형  기자)임혜숙 과학기술정보통신부 장관이 지난 14일 취임에 이어 공식적인 업무에 돌입했다. ICT와 과학기술, 연구개발 분야에 여러 과제가 산적해 있고, 짧은 시간 안에 성과를 이끌어내기 만만치 않은 숙제도 많은 편이다.그런 가운데 남은 문재인 정부의 임기를 고려할 때 임혜숙 장관이 약 1년 동안 집중할 정책 과제에 관심이 쏠린다.과기정통부 안팎에서 임혜숙 장관에 가장 큰 기대를 거는 부분은 디지털뉴딜 정책의 성과 창출이다.지난 4년 동안 과기정통부가 강력하게 추진해온 ICT 정책을 살펴보면 세계최초 5G 이동통신 상용화와 대통령의 인공지능 기본구상에 이은 AI 국가전략이 꼽힌다. 4차 산업혁명에 대응하기 위한 별도조직도 꾸렸고 규제샌드박스를 통한 규제 혁신에도 집중했다.코로나19는 이와 같은 ICT 정책의 우선순위를 재편하게 했다. 한 부처의 정책을 뛰어넘어 코로나 이후 시대를 준비하기 위한 한국판 뉴딜 정책이 마련됐고, 그 중심에는 디지털전환을 골자로 한 디지털뉴딜 정책이 자리를 잡고 있다.



임혜숙 장관디지털뉴딜 정책이 시작된 뒤 1년 정도가 지났다. 막대한 예산이 투입됐고 여러 사업이 2년차에 접어들고 있는 시점이다.디지털뉴딜 사업 성격에 따라 일정 기간이 지나야 성과가 도출되는 사업이 상당수지만, 단기적인 과제들은 조기에 국민 체감과 성과 창출을 통한 추가 사업 동력을 얻어야 한다. 아울러 중장기 과제의 중간점검도 임혜숙 장관의 과제로 꼽힌다.여러 디지털뉴딜 사업이 다부처 사업인 만큼 주무부처 수장으로서 국무회의 등에서 의견 조율과 추진에도 힘을 실어야 한다.기존 ICT 정책도 살필 부분이 산적해 있다. 5G의 경우 국회 인사청문 과정에서도 질의가 집중됐던 28GHz 활용 문제에 대한 뾰족한 수를 내놓아야 한다. 5G 통신 상용화를 통해 꾀하려 했던 산업 융합 효과는 지키면서 기업에는 규제의 예측가능성을 이른 시기에 제시해야 한다.AI와 빅데이터 등은 세계 각국의 패권 전쟁으로 돌입한 만큼 보다 강력한 정책의 추진 동력을 이끌어내야 한다는 주문이 나오는 분야다. 단순히 국내 거버넌스 문제에 그치지 않고 미래 산업의 핵심 플랫폼이 된다는 점을 고려해 가벼이 볼 수 없는 부분이다.이밖에 또 ICT 분야에서 규제혁신 제도의 개선을 지속적으로 이끌어야 하고, 글로벌 디지털 공룡 회사로부터 국내 산업 생태계의 체질을 키우는 점도 산업계에서 요구하는 부분이다.소재 부품 장비와 바이오 등 중요도가 커진 연구개발에 대해서도 꾸준히 실질적인 정책 지원을 강화해야 한다는 목소리가 나오는 점도 잊지 않아야 할 부분이다.특히 바이오 분야에서 감염병 대응에 관련된 연구개발은 쉽지 않은 과제다. 실제 다른 감염병에 대한 백신을 만들어낸 국가도 소수에 불과한 가운데, 굉장히 도전적인 연구개발 정책을 이어가고 있는 상황이다. 때문에 “끝까지 지원하겠다”는 전임 장관의 기조를 이어받을 필요가 있다.R&D 예산의 비중을 꾸준히 늘려온 만큼 국민에 체감할 수 있는 성과로 이끌어야 한다. 연구자 중심의 자율적인 연구 조성 환경도 지난 4년 동안 과기정통부가 중점 과제로 꼽았던 만큼 이 부분도 지속적인 과제 중 하나다.ICT 과학기술 인재 육성과 관련한 분야는 1년 만에 청사진을 그리기는 쉽지 않다. 하지만 대통령이 취임 4주년 기자회견에서 밝힌 것처럼 여성 불모지인 분야에서 롤모델이 되어 달라는 주문은 되새길 점이다.이에 따라 여성 인재 관련 정책과 함께 일자리 문제까지 이어지는 인재 양성 사업에는 보다 면밀하게 살피고 다음 정부에서도 이어갈 수 있는 방향성은 제시해야 한다.박수형 기자(psooh@zdnet.co.kr) ▶ 지디넷코리아 '홈페이지' ▶ 네이버 채널 구독하기© 메가뉴스 & ZDNET, A RED VENTURES COMPANY, 무단전재-재배포 금지",105,https://n.news.naver.com/mnews/article/092/0002222323?sid=103
"최주선 삼성디스플레이 사장, SID 2021서 강연",2021.05.18. 오후 2:34,"(서울=연합뉴스) 삼성디스플레이 최주선 사장이 18일 온라인으로 열린 'SID 디스플레이 위크 2021'에서 기조연설하고 있다. 2021.5.18 [삼성디스플레이 제공. 재판매 및 DB 금지]    photo@yna.co.kr▶네이버에서도 뉴스는 연합뉴스[구독 클릭]▶[팩트체크] SNS 달군 백신가격 비교 글? ▶제보하기<저작권자(c) 연합뉴스(https://www.yna.co.kr/), 무단 전재-재배포 금지>",105,https://n.news.naver.com/mnews/article/001/0012401342?sid=103
“삼성폰을 해외 직구로 사다니…” 역차별에 돈 더 쓰는 LTE 고객들,2021.05.18. 오후 7:32,"해외 직구를 통해 갤럭시A52 LTE 제품을 40만원 초반에 구매했다는 스마트폰 후기가 잇따르고 있다. [온라인 커뮤니티 캡처][헤럴드경제=최준선 기자] “삼성 스마트폰을 외국에서 사다가 써야 하는 게 웃프다..”(고객)지난 3월 공개된 삼성전자의 역대급 가성비 스마트폰 갤럭시A52의 LTE 버전이 결국 국내에는 출시되지 않는 것으로 알려지면서 소비자들이 아쉬움을 토로하고 있다. 5G 모델은 이르면 내달 국내에 출시될 전망이지만, 굳이 5G 스마트폰을 구매할 필요성을 느끼지 못하는 일부 소비자들은 적지 않은 해외 직구 비용을 치르고서라도 LTE 모델 확보에 나서는 모습이다.삼성 스마트폰을 해외 직구로 구입하는 황당한 일이 벌어지고 있는 것이다.18일 관련 업계에 따르면, 현재 삼성전자의 갤럭시A52 스마트폰은 해외 직구를 통해 40만원 중후반 가격에 구매할 수 있다. 출고가가 349유로(약 47만원)로 책정된 갤럭시A52 LTE 버전은 미국 현지에서 30만원 후반대로 할인돼 판매되고 있는데, 여기에 수만원의 배송 비용이 더해진 것으로 분석된다.



갤럭시A52 [삼성전자]현지 소비자보다 비싼 가격을 치러야 함에도 구매 수요는 적지 않다. 스마트폰 관련 온라인 커뮤니티에선 A52 구매 방법에 대한 문의가 꾸준히 이어지고 있다. 지난달 초부터 오픈마켓에 노출되고 있는 한 판매 페이지의 경우 벌써 수십개의 구매 후기가 달리기도 했다.갤럭시A52는 지난 3월 글로벌 언팩 행사에 공개되자마자 소비자들의 관심을 모았다. 전작인 A51과 비교해 성능을 대폭 개선했음에도 불구하고 가격은 낮췄기 때문이다. 고성능 스마트폰의 대표 기능으로 꼽히는 광학식 손떨림 방지(OIS) 기능이 포함됐고, 화면이 얼마나 부드럽게 전환되는가를 의미하는 주사율도 전작 60㎐에서 90㎐로 개선했다. 메인카메라의 화소수 역시 4800만화소에서 6400만화소로 높아졌다. 이같은 성능 개선에도 가격은 369유로에서 349유로로 5% 이상 낮췄다.하지만 정작 국내 시장에는 제한적으로 출시된다. 최근 삼성전자는 갤럭시A52 5G 제품에 대한 국립전파연구원 적합성평가 인증을 획득하고 6월 중 자급제 판매를 준비하고 있는 것으로 전해졌는데, LTE 모델과 관련해선 별다른 움직임이 없다. 업계는 국내 5G 시장 확장을 위해 삼성전자가 LTE 모델은 전략적으로 국내 출시 계획에서 제외되고 있는 것으로 보고 있다. 5G모델의 경우 LTE 버전과 비교해 120㎐ 주사율을 지원하는 등 사양이 더 높지만, 출고가가 429유로(약 59만원)로 10만원 이상 비싸다.



지난달 초부터 오픈마켓에 노출되고 있는 한 갤럭시A52 판매 페이지에는 벌써 수십개의 구매 후기가 달렸다. 국내 시장에는 LTE 제품이 출시되지 않을 것이란 소식에 실망한 소비자들이 다수다. [인터파크 판매 캡처]5G 제품 역시 가성비로 긍정적 평가를 받고 있지만, 아직 5G 서비스의 효용을 체감하지 못하는 소비자들은 보다 저렴한 LTE 모델에 대한 선택권이 없다는 것 자체에 아쉬움을 드러내는 분위기다. 홍정민 더불어민주당 의원실에 따르면 2019년 상반기부터 2020년 10월께까지 5G 서비스를 사용하다가 다시 LTE로 돌아간 가입자 수는 56만 2656명에 달한다. 심지어 지난해 하반기부터는 자급제 5G 스마트폰인 경우 보다 저렴한 LTE 요금제를 이용할 수 있도록 열어둘 정도로 소비자의 불만이 팽배해 있다.human@heraldcorp.com▶환경적 대화기구 '헤럴드에코'▶밀리터리 전문 콘텐츠 ‘헤밀’▶헤럴드경제 네이버 채널 구독- Copyrights ⓒ 헤럴드경제 & heraldbiz.com, 무단 전재 및 재배포 금지 -",105,https://n.news.naver.com/mnews/article/016/0001836967?sid=103
