title,date,main,section,url
"네이버파이낸셜, 경남은행과 디지털 금융서비스 상품·마케팅 ‘맞손’",2021.10.08. 오후 2:01,"전북은행 이어 경남은행과 디지털 금융서비스 업무협약 체결금융상품·서비스 공동 기획, 공동 마케팅 등 협력



서래호 네이버파이낸셜 책임리더(오른쪽)와 김진한 BNK경남은행 디지털금융본부 상무가 8일 경남 창원시 BNK경남은행 본점에서 디지털 금융 서비스 업무협약을 체결하고 기념촬영을 하고 있다.(사진=네이버파이낸셜 제공)[이데일리 이후섭 기자] 네이버파이낸셜이 전북은행에 이어 경남은행과도 업무협약을 맺으며 금융사와 전략적 협력을 강화했다. 네이버파이낸셜은 경남은행과 디지털 금융 서비스 업무협력 제휴를 맺었다고 8일 밝혔다. 양사는 이날 창원시에 위치한 BNK경남은행 본사에서 △디지털 금융상품·서비스 공동 기획 △디지털 금융 혁신기술 개발 △양사 플랫폼 활성화를 위한 공동 마케팅 등을 위해 포괄적으로 협력하기로 약속했다.네이버파이낸셜은 이번 업무협약을 통해 오랫동안 지역경제 기반이 되어 온 BNK경남은행의 금융 노하우를 배우고, BNK경남은행은 IT기술과 데이터를 활용한 네이버파이낸셜의 디지털 역량을 경험할 수 있어, 양사가 모두가 `윈윈(win-win)`하는 방향으로 시너지를 낼 것으로 기대된다. 서래호 네이버파이낸셜 책임리더는 “BNK경남은행이 지역거점을 넘어 디지털에서도 금융 역량을 발휘할 수 있도록 적극 지원할 것이며, 함께 성장할 수 있는 장기적인 협력안을 다방면으로 모색할 계획”이라며 “네이버파이낸셜은 앞으로도 금융사와 협력·상생하며 금융 소비자를 위한 가치 창출과 디지털 금융 활성화에 기여할 수 있는 의미있는 성과들을 만들어 가겠다”고 말했다.",105,https://n.news.naver.com/mnews/article/018/0005055360?sid=103
LGU+ 유심 꽂아 디지털지갑 이용…'반도체 지문' 보안↑,2021.10.08. 오후 2:36,"기사내용 요약반도체 제조 공정서 만들어진 'Inborn ID'로 보안 강화PUF USIM 장착한 스마트폰으로 '디지털지갑' 사용LG유플러스-ICTK 홀딩스 세계 최초 상용화



[서울=뉴시스] 오동현 기자 = LG유플러스는 ICTK 홀딩스와 함께 ‘물리적 복제 방지기능(PUF)’ 기반 유심(USIM)을 세계 최초로 상용화했다고 8일 밝혔다.PUF는 제조 공정에서 만들어진 반도체의 미세구조 차이를 이용해 복제나 변경이 불가능한 ‘Inborn ID’, 일명 ‘반도체 지문’을 이용해 보안을 강화하는 기술이다. 반도체 지문을 통해 암호키를 안전하게 생성하고, USB 등에 저장한 뒤 사용하는 소유기반 검증 기능을 구현할 수 있다.이번에 개발한 PUF USIM을 스마트폰에 장착하면 금융, 디지털 자산관리 등 다양한 분야 서비스의 보안을 강화할 수 있다. 또한 PUF USIM을 디지털 자산과 실제 자산의 연동에 사용할 경우 대체 불가능 토큰(NFT)과 메타버스(Metaverse) 공간에서 자산을 거래하는 ‘디지털지갑’을 스마트폰에서 이용 가능하다.PUF USIM 기반의 디지털지갑에 신분증, 출입카드, 자동차 키, 공연티켓 등을 저장하면 실물을 보유하지 않아도 편리하고 안전하게 이용할 수 있다.앞서 양자내성암호(PQC) 기술을 PUF에 결합한 ‘Q-PUF USB’ 보안토큰을 디지털뉴딜 사업에 투입한 바 있는 LG유플러스는 다양한 산업분야의 파트너사들과 함께 PUF 활용 서비스를 확대해나갈 계획이다.이진혁 LG유플러스 미디어서비스개발담당은 “다가올 메타버스 시대에 나를 대신할 수 있는 Inborn ID 와 보안 기술이 가능해졌다”며 “고객이 안심하고 다양한 서비스를 제공받을 수 있는 End-to-End 보안체계를 완성하겠다”고 말했다.이정원 ICTK홀딩스 대표는 “국내 벤처의 독보적 보안기술을 통해 5G 시대 서비스 보안의 기틀을 마련한 것에 의미가 있다”며 “해외에서도 선도사례로 인식할 수 있는 의미 있는 케이스가 될 것”이라고 말했다.",105,https://n.news.naver.com/mnews/article/003/0010759558?sid=103
[아하! 우주] 중국이 가져온 달 암석 나이는 ‘19억 7000만년’,2021.10.08. 오후 3:41,"[서울신문 나우뉴스]



달 토양 샘플을 실은 무인 달 탐사선 창어 5호의 귀환 캡슐이 북부 내몽골 초원지대인 스즈왕에 무사히 착륙했다.(출처: CNSA)새로운 연구에 따르면, 중국이 달에서 가져온 암석 샘플이 아폴로 프로그램이 수십 년 전에 가져온 물질보다 10억 년 더 젊은 것일 수 있다는 연구결과가 나왔다.지난해 12월 중국의 창어 5호 우주선이 월면의 '폭풍의 바다'라는 지역에서 채취한 암석 샘플 1.73kg을 지구로 가져왔다. 이후 귀중한 월석 샘플에 접근할 수 있는 과학자들은 암석과 그 암석이 지닌 태양계의 비밀을 알아내기 위한 일련의 실험을 시작했다.다행히도 우주선은 달과 태양계 생성에 대한 과학자들의 지식 틀에 있는 중요한 구멍을 메우기 위해 완벽한 샘플을 채집한 것으로 보인다. 새로운 연구에 따르면, 이번에 회수된 달 암석 샘플 중 두 개의 작은 조각은 약 19억 7000만 년 전의 것으로 추정된다. 오차 범위는 플러스 마이너스 5000만 년이다.미주리주 세인트루이스에 있는 워싱턴 대학의 행성 과학자이자 공동 저자인 브래드 졸리프는 ""20억 년의 격차를 좁힐 수 있는 완벽한 표본""이라고 성명에서 밝혔다. 그는 베이징을 근거로 하는 연구팀에 참여하고 있다.그 간격의 범위는 회수된 아폴로 샘플의 암석 대부분이 형성된 약 30억 년 전부터 연대 측정이 가능한 젊은 충돌 크레이터가 형성된 약 10억 년 전까지다.45억 년의 태양계 역사를 구성하기 위해 과학자들은 시간이 기록된 샘플을 크레이터 연대 측정이라고 하는 상대 연령을 식별하는 기술에 결합했다.졸리프 박사는 ""행성 과학자들은 표면에 크레이터가 많을수록 더 오래되고 크레이터가 적을수록 표면이 더 젊다는 것을 알고 있다. 이는 훌륭한 상대적 결정법이다""이라면서 ""그러나 그것에 절대적인 연대를 결정하려면 월면에서 샘플을 가져와야 한다""라고 설명했다. 



창어-5가 착륙한 달의 룀케르 산의 광활한 화산 구릉지.(출처: CNSA/CLEP)이 접근방식을 사용하여 과학자들은 아폴로 샘플의 출처를 조사해 실험실에서 결정된 나이를 기록하고, 얼마나 많은 크레이터가 존재하는지를 계산할 수 있다. 그런 다음 행성 과학자들은 막 파헤쳐진 달의 토양에 대해 대략적인 연대를 추산할 수 있다. 이는 과학자들이 결코 얻을 수 없는 다른 태양계 천체의 신선한 샘플에 대해서도 마찬가지로 적용할 수 있는 연대 계산법이다.그런데 이제까지는 30억에서 10억 년 전의 달 샘플이 없었기 때문에 과학자들의 크레이터 연대 측정 타임라인에는 엄청난 간격이 있었다. 크기가 몇 밀리미터에 불과한 두 개의 작은 달 암석이 그 엄청난 간극을 구멍을 메우는 데 결정적인 도움이 되었다.졸리프 박사는 ""이 연구에서 우리는 '약 20억 년에 플러스 마이너스 5000만 년'이라는 매우 정확한 연대 측정을 성공했다""라며 ""이는 참으로 경이로운 결과로, 행성 시간의 관점에서 볼 때 그것은 매우 정확한 연대 결정""이라고 덧붙였다.이 샘플의 나이는 화산 폭발 중에 형성되는 현무암이라는 암석 유형이기 때문에 중요한데, 이전까지 과학자들은 약 30억 년 전까지 달에서 용암이 흐른 증거만을 가지고 있었기 때문이다. 과학자들은 달의 지각이 얇고 열을 생성하는 요소가 상대적으로 풍부하기 때문에 이 지역에서 가장 젊은 달의 현무암을 발견할 것으로 예상했다. 그러나 연구자들은 암석이 그렇게 늦게까지 어떻게 녹은 상태로 남아 있었는지에 대해서는 여전히 확실하게 밝혀내지 못하고 있다.이 연구결과는 '사이언스' 저널 10월 7일(현지시간) 발표된 논문에 게재되어 있다.",105,https://n.news.naver.com/mnews/article/081/0003221119?sid=103
[뉴스9 날씨] 내일 오전까지 매우 짙은 안개…강원 동해안 건조주의보,2023.10.24. 오후 9:58,"서리가 내리는 절기 상강인 오늘,  현재 대부분 지역에 구름이 많이 끼어있는데요. 특히 기압골이 지나가는 중부지방과 호남 서해안에는 밤까지 비가 조금 오는 곳이 있겠습니다. 비가 산발적으로 내리고 있어서 큰 우산이 아닌 작은 우산을 쓰시거나 비를 잠깐 피하시는 것이 좋겠습니다. 대기가 습한 데다 일교차가 커서 내륙 곳곳에 안개가 짙게 끼고 있습니다. 내일 오전까지 가시거리가 200m 이하로 매우 짧아질텐데요. 앞차와의 간격을 넉넉히 두고  천천히 운전하셔야겠습니다. 강원 동해안은 건조주의보가 발효 중입니다. 바깥 활동이 늘어나는 시기인 만큼 산불 등 화재 예방에 주의하셔야겠습니다. 내일 서울의 아침 기온은 13도, 한낮 기온은 22도 등으로  오늘과 비슷하거나 조금 높겠습니다. 안동과 진주의 아침 기온이 8도까지 떨어지겠지만, 안동의 낮 기온 22도, 진주 24도로 일교차가 매우 크겠습니다. 물결은 전 해상에서 비교적 잔잔하게 일겠습니다. 목요일에는 수도권과 영서, 충청에 비가 내리겠습니다. 날씨였습니다. 강아랑/그래픽:강채희/진행:김윤■ 제보하기▷ 전화 : 02-781-1234, 4444▷ 이메일 : kbs1234@kbs.co.kr▷ 카카오톡 : 'KBS제보' 검색, 채널 추가▷ 네이버, 유튜브에서 KBS뉴스를 구독해주세요!",105,https://n.news.naver.com/mnews/article/056/0011588439?sid=103
[아!이뉴스] '토스' 올라탄 '타다'…카카오모빌리티·쿠팡이츠 '백기',2021.10.08. 오후 7:37,"하루가 다르게 변화하는 IT세상 속에서 쏟아지는 정보를 일일이 다 보기 어려우신 독자분들을 위해, 독자 맞춤형 IT뉴스 요약 코너를 마련했습니다. 본지에서 오늘 다룬 IT기사를 한눈에 읽을 수 있도록 구성했습니다. 퇴근길에 가볍게 읽을 수 있기를 기대합니다. [편집자주]



금융 플랫폼 토스가 타다를 인수한다. 사진은 타다 가맹 택시. [사진=타다]◆ 카카오 vs 토스, 금융 넘어 모빌리티 '격전' 모바일 금융 플랫폼 토스가 모빌리티 플랫폼 '타다'를 전격 인수한다. 이로써 금융 분야에 동반 진출해 경쟁하고 있는 카카오와 함께 모빌리티 시장에서도 자웅을 겨룰 것으로 예상된다.8일 토스 운영사 비바리퍼블리카는 쏘카가 보유한 타다 운영사 브이씨엔씨(VCNC) 지분 60% 인수를 결정하고 3사 간 양해 각서(MOU)를 체결했다고 발표했다. 이번 인수는 타다가 발행한 신주를 토스가 매수하는 방식으로 이뤄진다. 토스는 매수한 금액 모두를 타다 성장을 위해 투자한다.토스는 타다 인수로 토스 결제 등 금융 비즈니스 외연을 확장하고, 모빌리티 서비스 이용자와 산업 종사자 선택폭을 넓혀 건전한 성장과 혁신을 이어간다. 우버와 그랩과 같이 모빌리티와 페이먼트 서비스의 결합을 통해 성장을 도모하기 위해서다.토스는 이번 타다 인수로 카카오와 금융에 이어 모빌리티에 이어서도 경쟁을 펼친다. 업계에서도 토스의 모빌리티 시장 진출이 현재 가맹 택시·호출서비스 등에서 압도적인 시장 점유율을 확보한 카카오의 견제구로 작용할 것으로 보고 있다.쿠팡이츠의 등장으로 다시 시장 경쟁이 활성화된 배달앱 시장과 같이 모빌리티도 토스 진입으로 다시 경쟁 상황으로 돌입할 가능성이 높다는 분석이다.앞서 빅데이터 분석 플랫폼 모바일인덱스는 올해 8월 기준 택시 호출 앱의 월간활성이용자수(MAU)는 1위는 카카오T(1016만명)라고 밝힌 바 있다. 2위는 SK텔레콤-우버의 합작법인인 우티(86만명)이며 타다는 9만명 수준이다.한편 토스 이승건 대표는 ""국내 택시 시장 규모는 연간 매출액 기준 약 12조 원에 달하고 절반 정도가 호출 앱을 통해 이루어지고 있어 토스의 결제사업 등 여러 금융서비스와 시너지가 기대된다""라며 ""토스는 창업 후 지속해서 사업 모델이 고착화된 시장에 진출해 기업과 소비자 모두에게 편리하고 혁신적인 서비스를 제시해 왔으며, 이번 인수 역시 같은 맥락""이라고 강조했다.



서울에서 운행중인 카카오T 택시의 모습. [사진=뉴시스]◆ '택시·대리' 엇갈린 주장…카카오모빌리티 '딜레마'카카오모빌리티가 택시·대리운전 업계와 상생을 하겠다며 나섰지만 업계 내부에서도 상충된 이해관계로 인해 결론에 도달하지 못하고 있다.택시업계는 법인 사업자와 개인택시 사업자로, 대리운전 업계는 대리운전 운영업체와 대리운전 기사 간 서로 다른 견해를 가지고 있어 전체를 아우르는 상생안을 내놓기 어려운 실정이다.카카오모빌리티는 추가적인 상생안을 순차적으로 내놓을 방침이지만 여러 이해관계들을 모두 수렴할 수 있는 묘안을 내놓지 못하는 이상 갈등이 쉽사리 해결되지 않을 전망이다.7일 업계에 따르면 카카오T블루 가맹 개인택시 기사들이 결성한 단체인 '택시모빌리티가맹점주협의회(모가협)'은 지난 4일 성명서를 발표했다. 이들은 카카오택시 가맹점협의회와 카카오모빌리티의 자회사 KM솔루션 간 맺은 협약에 대해 ""가맹점협의회는 결정권이 없다""고 지적했다. 모가협은 지난 3월 구성된 협의회다.모가협은 성명서에서 ""KM솔루션의 협의체 구성에 대해 절대로 동의하지 않는다""며 ""카카오T블루 택시의 운행 주체임에도 개인택시 크루들을 배제한 KM솔루션의 협의체 구성을 강력히 규탄한다""고 강조했다.앞서 가맹점협의회는 지난달 30일 카카오모빌리티의 운송가맹자회사인 KM솔루션과 카카오T 관련 상생협력 업무협약을 맺었다.가맹점협의회는 서울 지역 138개 가맹택시 운수사 중 103개 운수사가 모여 지난 5월 설립한 가맹택시 점주 협의체다. 협약에 따라 가맹점협의회는 이달 중 KM솔루션과 첫 정례회의를 진행한다. 카카오모빌리티는 지난달 택시업계를 위한 상생 방안을 발표하면서 가맹택시 사업자와 상생협의회를 구성하겠다고 밝힌 후속 조치다.그러나 개인택시 기사들은 자신들이 협의체에서 빠졌다며 반발했다. 또 법인택시 사주들만으로는 충분한 대표성을 지닐 수 없다고 주장했다.



장기환 쿠팡이츠 서비스 대표가 8일 국토위 국정감사에 증인으로 출석했다. 사진은 장기환 대표. [사진=국회방송]◆ ""쿠팡이츠, 배달 라이더 직고용·안전 배달료 도입하라"" 국회가 배달 플랫폼 '쿠팡이츠'에 배달 라이더와 상생안 마련을 주문했다.8일 여의도 국회에서 국토교통위원회의 한국도로공사·한국교통안전공단·한국도로공사서비스 국정감사가 진행됐다. 이날 증인으로 출석한 장기환 쿠팡이츠 서비스 대표에 여·야 의원들은 배달 라이더 직고용 및 안전 배달료, 표준계약서 등이 포함된 상생안 마련을 검토 또는 도입할 것을 촉구했다.진성준 의원(더불어민주당)은 ""지난해 을지로위원회를 중심으로 체결한 사회적 협약에 쿠팡도 서명했다""라며 ""협약에 따르면 표준계약서를 도입해야 하는데, 아직 쿠팡이 표준계약서 작성 여부를 제출하지 않고 있다""라고 꼬집었다.지난해 도입된 표준계약서에는 ▲종사자 권리 보호를 위한 불공정 거래행위와 부당한 처우 금지 ▲종사자 안전관리 강화를 통한 산업재해 예방 ▲분쟁 발생 시 해결방안 등이 담겨있다. 쿠팡이츠서비스는 쿠팡이 100% 지분을 소유한 자회사로, 해당 협약에 귀속된다.배달 라이더 산재 사고를 대비하는 회사의 대응책도 미비하다는 지적이 이어졌다. 천준호 의원(더불어민주당)은 ""올해 산재 쿠팡이츠 배달노동자의 산재 사고가 2천700여건을 넘었다""라며 ""배달원의 안전은 시민 모두의 안전임을 유념해달라""라고 강조했다. 현행 안전 교육이나 배달 라이더 등록 과정 모두 부실하다는 것.안전한 배달을 위해 '안전 배달료'를 도입해야 한다는 의견도 제시됐다. 심상정 의원(정의당)은 ""배달 노동자를 자영업자로 취급, 보험료도 내주지 않으면서 통제한다""라고 질타했다. 그러면서 ""자영업자와 계약하면서 왜 배달료가 고무줄로 책정되느냐""라며 플랫폼 배달 사업자 등록제 전환 및 안전 배달료 도입의 필요성을 강조했다.



정부의 디지털 뉴딜 사업이 수도권 지역에 집중돼 있어 지역 격차를 높이고 있다는 지적이 잇따랐다.◆""정부 디지털뉴딜, 수도권 편중 심화""내년도 예산 33조원이 투입되는 정부의 디지털 뉴딜 사업이 수도권 지역에 집중돼 있어 지역 격차를 높이고 있다는 지적이 잇따랐다.8일 과학기술정보방송통신위원회 국정감사에서는 디지털뉴딜의 핵심 사업인 데이터댐 구축, 인공지능 사업 등이 수도권 지역에 편중돼 있어 지역균형발전을 위한 개선이 필요하다는 의원들의 목소리가 높았다.변재일 의원(더불어민주당)은 ""디지털 뉴딜의 핵심인 '데이터댐' 구축 사업에 금액 기준으로 수도권에 71%가 집중돼 있다""면서, ""수도권에 인구·경제 집중 문제가 점점 심화되고 있는 가운데 디지털뉴딜 사업까지도 수도권 편중 현상이 나타난 것은 문제가 있다""고 지적했다.홍석준 의원(국민의 힘)도 ""인공지능 학습용데이터 구축사업의 지역별 참여기관을 보면, 수도권이 366개로 압도적으로 많고, 다음으로 영남권, 호남권 순으로 이어진다""면서, ""인공지능과 같은 신기술 기업 뿐만 아니라 (데이터라벨링 등) 단순알바 형태의 일자리도 수도권에 편향된 현상이 나타나고 있다""고 주장했다.◆ 양정숙 ""NIA 디지털배움터, 지자체별 주먹구구 배정""한국지능정보사회진흥원(NIA)이 지난해부터 시행하고 있는 '디지털배움터' 지원사업이 지자체별로 편차가 큰 것으로 나타났다.'디지털배움터'는 전 국민이 모바일 등 일상생활과 관련된 디지털 환경에서 불편함을 겪지 않도록 디지털 역량 교육사업을 지원한다.8일 국회 과학기술정보방송통신위원회 양정숙 의원(무소속)이 NIA로부터 제출받은 자료에 따르면, 인구 4만 수준인 부산 중구는 배움터를 7개 설치한 반면, 인구 100만명이 넘는 용인시는 배움터가 한 곳 밖에 없는 것으로 나타났다.양정숙 의원은 ""디지털 환경이 급변하면서 어르신과 노약자들은 모바일을 이용한 배달 주문은 물론, 키오스크가 설치된 곳에서는 매장 이용조차 힘든 것이 현실""이라며 ""디지털배움터 사업이 전국민을 대상으로 하는 보편 복지 차원의 교육인만큼 국민 모두 고루 혜택을 받을 수 있도록 배움터 배정이 원칙과 기준에 따라 선정돼야 할 것""이라고 지적했다.",105,https://n.news.naver.com/mnews/article/031/0000627993?sid=103
"경동나비엔, KSCI 보일러 부문 8년 연속 1위 차지",2021.10.08. 오후 12:40,"경동나비엔 프리미엄 콘덴싱보일러경동나비엔은 한국능률협회컨설팅(KMAC)이 주관하는 '2021 한국산업의 고객만족도(KCSI)'에서 보일러 부문에서 8년 연속 1위를 차지했다고 8일 밝혔다.한국산업의 고객만족도는 1992년 시작된 국내 최초 CSI 조사 모델로, 상품·서비스 고객 만족도를 평가하는 공신력 있는 지표다. 올해도 1만700여 명의 소비자가 112개 산업 분야 354개 기업 만족도를 직접 평가해 1위 기업을 선정했다.경동나비엔은 1988년 아시아 최초로 콘덴싱보일러를 개발했다. 에너지 절감과 환경보호를 위해 콘덴싱보일러의 국내 보급에 앞장서왔다. 실제 콘덴싱보일러는 일반보일러 대비 미세먼지의 주요 원인이 되는 질소산화물을 약 79% 감소시키고, 온실효과 주범인 이산화탄소 배출량을 크게 낮춰 대기질 개선에 기여한다. 지난해 4월부터는 대기관리권역 내 사용이 의무화됐다.경동나비엔은 제품 라인업을 다변화하며 고객 니즈에 맞춘 최적 제품을 제공한다. 프리미엄 콘덴싱 제품인 NCB900, NCB700 시리즈는 물론 친환경 기술로 콘덴싱보일러 표준을 제시한 NCB500 시리즈와 합리적인 가격대에 우수한 난방 성능을 자랑하는 NCB300 시리즈 등 다양한 기능과 가격대를 갖춘 제품으로 소비자 선택의 폭을 넓혔다.전양균 경동나비엔 전양균 본부장은 “보일러는 온수부터 난방까지 사계절 내내 일상과 밀접하게 연관된 생활 가전이기 때문에 소비자가 믿을 수 있고, 만족도가 높은 브랜드를 선택하는 것이 중요하다”면서 “앞으로도 고객 만족을 최우선 가치로 삼고 고객 소리에 귀 기울이며 쾌적한 생활환경을 만들어 나가기 위해 노력하겠다”고 말했다.",105,https://n.news.naver.com/mnews/article/030/0002974206?sid=103
카카오톡 선물하기에 ‘톰 포드’ 입점…콜라보 단독 상품도 선봬,2021.10.08. 오전 11:16,"톰 포드 선물하기 전용 상품 ‘T 스크류 캔버스 미니 쇼핑백 제품. 카카오커머스 제공[이데일리 노재웅 기자] 카카오커머스는 카카오톡 선물하기(이하 선물하기)에 글로벌 명품 브랜드인 ‘톰 포드’가 공식 브랜드관을 열었다고 8일 밝혔다. 이번 입점은 톰 포드의 아시아 지역 내 첫 온라인몰 입점이다.선물하기는 톰 포드의 뷰티 제품 외에도 남성 및 여성 가방, 지갑, 벨트, 슈즈, 언더웨어, 워치 등 약 120가지의 다양한 상품을 선보인다. 선물하기에서 구매하는 고객에게는 오프라인 매장에서 구매하는 것과 동일하게 선물 포장 서비스를 제공한다.대표 상품으로는 골드 지퍼 클로저가 특징인 톰 포드의 스테디셀러 ‘버클리 그레인 레더 지퍼 포트폴리오’ 가방이 있으며, 입점을 기념해 선물하기에서만 선보이는 단독 상품도 출시한다. 단독 상품인 ‘T 스크류 캔버스 미니 쇼핑백’은 캔버스 소재에 ‘애시드 옐로우’ 색이 매력적인 제품으로, 어떤 의상에 적용해도 포인트를 줄 수 있는 미니 쇼퍼백이라고 카카오커머스 측은 설명했다.카카오톡 선물하기 관계자는 “향후 톰 포드와의 지속적인 협업을 통해 매 시즌 새로운 상품을 선보일 계획”이라며 “차별화된 글로벌 명품 브랜드 소싱을 통해, 고객들에게 특별한 선물 경험을 제공할 예정”이라고 말했다.",105,https://n.news.naver.com/mnews/article/018/0005055256?sid=103
[포토]'반갑다 아이폰13',2021.10.08. 오전 10:41,[이데일리 방인권 기자] 애플 ‘아이폰13’ 시리즈가 국내에 정식 출시된 8일 서울 강남구 애플스토어 가로수길점에서 시민들이 제품을 살펴보고 있다.,105,https://n.news.naver.com/mnews/article/018/0005055215?sid=103
,,,105,https://n.news.naver.com/mnews/article/236/0000217767?sid=103
