title,date,main,section,url
[구글 앱삭제 카운트다운] ① '우려가 현실로'…웹툰·웹소설·OTT·음원 도미노 인상 [IT돋보기],2022.05.26. 오전 6:01,"네이버·카카오 비롯 주요 콘텐츠 앱 결제 가격 줄줄이 인상 예고 구글의 인앱결제 확대 적용이 콘텐츠 요금 인상의 후폭풍으로 이어지고 있다. 지난해 전세계 최초로 인앱결제 강제를 막는 '전기통신사업법 개정안'(구글 갑질금지법)을 제정했지만 거대 앱 마켓의 꼼수를 막기엔 역부족이다. 거대 앱 마켓 사업자들의 인앱결제 강제가 불러오는 논란과 우리 정부의 대응책에 대해 살피고, 해법을 모색해 보고자 한다.  [편집자주]구글이 오는 6월1일부터 자신들의 인앱결제 정책을 수용하지 않는 앱을 구글 플레이에서 삭제한다.그간 인앱결제 시스템 적용을 최대한 미뤄 오던 웹툰·웹소설·온라인동영상서비스(OTT) 등 디지털 콘텐츠 업계는 앱 삭제 시한이 다가오자 앱 내 결제 가격에 구글의 인앱결제 수수료를 적용하며 가격을 하나둘 올리는 추세다. 이로 인해 디지털 콘텐츠의 가격이 15~20%씩 인상되면서 업계에서는 소비자 부담 증가로 인해 생태계 전체에 미칠 악영향을 우려한다.◆웹툰·웹소설·OTT·음원 등 가리지 않고 줄줄이 가격 '인상'25일 업계에 따르면 네이버와 카카오는 최근 나란히 웹툰·웹소설 등 디지털 콘텐츠 이용권 가격 인상을 발표했다. 네이버는 네이버웹툰과 네이버 시리즈에서 구매하는 쿠키의 개당 가격을 100원에서 120원으로 올렸다. 카카오도 카카오페이지와 카카오웹툰의 결제 가격을 20% 인상했다. 카카오는 오는 6월 1일부터 가격 인상분이 적용되고, 네이버는 시점을 확정하지는 않았지만 비슷한 시기가 될 전망이다. 가격 인상은 안드로이드 앱 내 결제에 대해서만 적용된다.



네이버웹툰이 지난 11일 공지사항을 통해 구글 인앱결제로 인한 이용권 가격 인상을 발표했다. [사진=네이버웹툰]네이버·카카오가 가격 인상을 결정하자 다른 웹툰·웹소설 플랫폼들도 하나둘 뒤따르고 있다. 이달 말 들어 리디·코미코·문피아가 나란히 앱 결제 시 이용권 가격을 15~20% 올린다고 공지했다. 이들 역시 공통적으로 구글 인앱결제 정책 변경을 이유로 들었다. 6월1일 전까지 가격 인상분을 반영할 예정이다. 웹소설 플랫폼인 조아라의 경우 이미 지난 4월 선제적으로 이용권 가격을 약 40% 올린 바 있다.주요 웹툰·웹소설 플랫폼들이 나란히 가격 인상을 결정하면서 다른 플랫폼들도 결국 이 같은 수순을 밟을 전망이다. 웹툰업계 한 관계자는 ""각 플랫폼들과 계약을 맺은 에이전시(CP)에도 플랫폼 이용권 가격 인상 공문이 개별적으로 전달됐다""며 ""아직 가격 인상 공지를 하지 않은 다른 플랫폼들도 대부분 가격을 올리려는 분위기""라고 말했다.가격 인상은 웹툰·웹소설에만 그치지 않는다. 이미 OTT·음원 스트리밍 서비스 등도 구글의 인앱결제 정책을 이유로 이용권 요금을 올렸거나 인상을 검토 중이다. 현재 OTT 중에서는 티빙·웨이브·시즌 등이, 음원 스트리밍 서비스 중에서는 플로가 가격을 이미 인상했다. 왓챠 등 이미 구글 인앱결제 시스템을 적용해 왔던 일부 플랫폼을 제외하면 나머지 업체들도 마찬가지 수순을 밟을 것으로 보인다.이들 외 다른 디지털 콘텐츠 구독 상품들도 가격 인상을 시행하고 있다. 카카오는 카카오톡의 구독 서비스인 '이모티콘 플러스'의 가격을 월 4천900원에서 5천700원으로, '톡서랍 플러스'는 월 1천900원에서 2천200원으로 인상했다. 스포티비 역시 '스포티비 나우'의 이용권 가격을 베이직 기준 월 8천690원에서 9천900원으로 올렸다. 여타 다른 디지털콘텐츠 플랫폼들도 구글 인앱결제 적용으로 인한 안드로이드 앱 결제 가격 인상을 검토 중인 것으로 알려졌다.◆가격 부담 증가 속 이용자 소비 위축 예상…플랫폼 부담 전가 우려도이처럼 구글발(發) 콘텐츠 이용요금 인상이 잇따르면서 가장 우려되는 것은 소비자 피해다. 구글의 수수료 인상에 따라 가중되는 비용을 고스란히 소비자가 떠안게 됨으로써 결국 소비자들의 콘텐츠 이용 부담이 커지는 결과로 이어지게 됐기 때문이다.물론 이번 가격 인상은 앱 결제에만 적용되기 때문에 PC나 모바일 웹 결제 등을 활용할 경우 기존 가격 그대로 이용이 가능하다. 또 웹툰 플랫폼 등에서 지원하는 자동충전 기능을 PC·모바일 웹페이지를 통해 설정할 경우에도 가격 인상이 적용되지 않는다. 이미 자동충전 기능을 쓰던 이용자 역시 마찬가지다.다만 실질적으로 이를 인지하는 소비자가 얼마나 될지 의문이라고 업계에서는 우려한다. 이미 인앱결제 강제 정책을 시행 중인 애플의 경우, iOS 이용자들은 안드로이드 이용자 대비 디지털 콘텐츠 가격을 20~30% 더 부담해야 했다. 이러한 정책은 이미 수년 전부터 시행됐지만, 여전히 iOS 결제 시 안드로이드나 웹 결제 대비 가격이 더 비싸다는 것을 인지하지 못하고 웃돈을 얹어 콘텐츠를 구매하는 이용자들이 많다는 지적이다.더욱이 '이용자를 다른 결제 수단으로 유도해서는 안 된다'는 구글의 인앱결제 정책상 이와 같은 앱 외부에서의 결제 방식을 앱 내에서는 직접적으로 공지할 수가 없다. 또 구글이 앱 내에서 외부 결제 페이지로 연결하는 '아웃링크' 방식도 금지했기 때문에 결국 이용자가 이 같은 방법을 다른 경로를 통해 미리 숙지할 수밖에 없는 상황이다.



구글이 지난 3월 인앱결제 정책 관련 공지를 하면서 앱 개발사들에게 예시로 든 결제 UI의 모습. [사진=구글 블로그]업계에서는 이렇게 늘어난 소비자 부담이 디지털 콘텐츠 이용 감소로 이어질 것을 우려한다. 이 경우 플랫폼 업체들의 수익성 저하가 다가오고, 이에 따라 플랫폼 업체들이 관련 사업에 대한 투자를 줄이면서 결국 창작자들은 물론 콘텐츠 생태계 전반에 악영향을 미칠 수 있다고 보고 있다. 이는 지난해 한국웹툰산업협회 등 웹툰·웹소설 협·단체들이 잇따라 구글 인앱결제 의무화에 반대하는 성명서를 낸 이유이기도 했다.웹툰업계 고위 관계자는 ""물론 가격 인상으로 실제 (플랫폼사들의) 매출에 타격이 갈 것인지는 좀 더 지켜봐야 한다""라면서도 ""만일 매출 하락이 현실화되면 그 부담은 콘텐츠업계 전체로 갈 것""이라고 말했다. 그러면서 ""사실상 중간에 유통망이 하나 껴서 갑자기 가격이 20%가 올라가는 것이기 때문에 당연히 어떻게든 안 좋은 쪽으로 영향이 갈 수밖에 없지 않겠느냐""라고 토로했다.일각에서는 플랫폼들이 인앱결제 수수료 부담을 이용자뿐만 아니라 에이전시나 작가들에게 전가할 수 있다는 우려도 나온다. 웹툰·웹소설의 경우 플랫폼과 작가가 직계약을 맺기도 하지만, 플랫폼과 작가 사이에 기존의 출판사 역할을 하는 에이전시가 끼어 있는 경우가 많다. 구글 인앱결제 수수료 반영으로 기존 계약을 변경해야 하는 만큼 이 과정에서 에이전시와 작가들에게 불리한 방향으로 수수료율을 조정할 수 있다는 관측이다.다만 아직 웹툰·웹소설 플랫폼 중 이번 가격 인상으로 인해 에이전시 등에 돌아가는 수수료율을 조정한 사례는 없는 것으로 전해졌다.",105,https://n.news.naver.com/mnews/article/031/0000674845?sid=103
"위메이드커넥트, P&E게임 ‘에브리팜’ 해외 출시",2022.05.26. 오후 4:41,"[이데일리 김정유 기자] 위메이드커넥트는 P&E(Play & earn·돈 버는) 모바일 SNG ‘에브리팜’을 글로벌 시장에 정식 출시했다고 26일 밝혔다.한국, 중국 등을 제외한 글로벌 전 지역에 출시된 ‘에브리팜’은 위메이드커넥트가 서비스하고 있는 인기 SNG ‘에브리타운’에 블록체인 기술을 접목한 소셜 네트워크 장르 P&E 게임이다. ‘에브리팜’은 농장과 레스토랑에서의 생산, 경영 활동과 등장 인물들의 탄탄한 설정과 이야기, 친구들과의 소셜 네트워킹 등 원작의 대중성을 확대하며 블록체인 기술로 재미를 더했다.‘에브리팜’의 블록체인 기술 탑재는 기존 서비스 노하우에 자체 게임 토큰 ‘플레로 토큰’을 활용한 토큰 경제를 구축한 것이 특징이다. 이호대 위메이드커넥트 대표는 “‘에브리팜’은 모바일 SNG최고의 인기를 이어가고 있는 원작의 노하우에 경영 시뮬레이션에 최적화된 토큰 경제로 P&E의 재미를 전할 것”이라며 “글로벌 블록체인 플랫폼 위믹스와의 시너지를 낼 게임 개발과 퍼블리싱 사업을 확대해 나갈 것”이라고 말했다.",105,https://n.news.naver.com/mnews/article/018/0005226197?sid=103
"KT, 포스텍과 AI 전문인재 양성 협력",2022.05.26. 오전 11:06,"KT가 포스텍과 'KT-포스텍 AI 인재양성 프로그램'을 개설, AI 전문인재 양상을 위한 협력에 나선다고 26일 밝혔다.2023학년도에 신설되는 KT-포스텍 AI 인재양성 프로그램은 AI 전문 인재를 양성하기 위한 채용연계형 전일제 석사 과정이다.국내외 학사 학위(예정)자를 대상으로 올 하반기에 모집을 시작한다. 최종 선발될 경우 음성인식·합성, 자연어 처리, 그래픽스·컴퓨터 비전 등 인공지능 핵심 분야 맞춤형 커리큘럼을 바탕으로 교육을 받게 된다.KT는 학생들에게 대학원 재학 기간 입학금을 포함한 등록금 전액을 비롯해 연구 지원비를 지급하며, 원거리 학생을 위한 기숙사도 제공한다. 학생들은 KT가 보유한 최신 그래픽 처리장치(GPU) 서버를 연구에 활용할 수 있으며, 방학기간에는 KT 인턴십을 통해 대규모 AI 데이터를 직접 분석하고 연구하는 등 실전 경험을 확보할 수 있다. 졸업 후에는 KT 융합기술원 등에서 연구원으로 근무하게 된다.신현옥 KT 경영지원부문장(부사장)은 “프로그램에 참여하는 학생들이 대한민국 AI 산업 발전을 선도하는 핵심 인재로 성장할 수 있도록 다각적인 지원을 아끼지 않겠다”고 말했다.",105,https://n.news.naver.com/mnews/article/030/0003019444?sid=103
"씨엔알, 韓기업 최초 美서 임상대행 나선다",2022.05.26. 오후 5:24,"국내 1위 CRO社 미국 진출 속도현지 유명 회사와 본격 협력하반기 미국서 공동사업 개시美제약사 신약 임상 과정 대행윤회장 ""국내 제약·바이오 신약해외 시장 진출 적극 도울 것""올해 매출 500억원 돌파 기대



 ""지금까지 2000건이 넘는 임상시험을 국내 제약·바이오 기업으로부터 수탁받고 진행했습니다. 이제는 국내 1위 CRO(임상수탁기관) 기업을 넘어 세계 주요 플레이어로 거듭나고자 합니다. 씨엔알리서치가 국내에 머물지 않아야 국내 제약·바이오 기업들도 해외로 쭉쭉 뻗어나갈 테니까요.""국내 1위 CRO 기업 씨엔알리서치의 윤문태 대표(사진)는 최근 서울 강남구 역삼로 본사에서 매일경제와 만나 ""미국에서 신약 인허가와 관련된 정보를 제일 많이 알고 있는 CRO 업체 한 곳의 지분을 확보해 파트너십을 구축했다. 이 회사와 함께 미국에서 임상 분야 CRO 사업을 준비하고 있다""며 ""국내 회사들이 신약을 개발해 미국에 진출하려면 현지 기관에 임상시험계획(IND)을 신청해야 하는데, 이 부분에서 경험이 풍성한 회사와 함께하게 됐다""고 밝혔다. 윤 회장은 이어 ""미국 진출을 위한 국내에서의 작업은 마무리됐다""며 ""올 하반기에는 본격적으로 미국에서 공동 사업이 시작된다""고 말했다. 씨엔알리서치의 글로벌 진출은 가속도를 내고 있다. 지난해 300여 명이었던 임직원을 400명 이상으로 대폭 늘렸다. 윤 회장은 ""회사의 목적이 글로벌 진출이었던 만큼 단순히 덩치만 키운 게 아니다""며 ""글로벌 진출을 하기 위해 해외 허가 전문가를 다수 확보했고, 데이터 관리 전문 인력들도 새로 충원했다""고 밝혔다. CRO는 제약·바이오 기업의 의뢰를 받아 임상시험 설계와 데이터 관리, 품목 허가 등을 진행한다. 윤 회장이 씨엔알리서치를 설립한 것은 25년 전인 1997년이었다. 체계가 없던 임상 시스템에서 벗어나 국내 최초로 계량화된 임상 시스템을 도입한 그는 한국 CRO계 거목으로 평가받는다. 실제로 국내 50여 개 CRO 기업 중 씨앤알리서치 매출이 가장 많다. 윤 회장은 ""2020년 매출액은 341억원, 지난해엔 432억원으로 2년 연속 사상 최대치를 기록했다""며 ""올해는 연 매출 500억원을 넘어설 것으로 예상하고 있다""고 밝혔다. 이어 ""약사 출신으로서 CRO 사업은 업계 발전에 꼭 필요한 토대를 닦는 일이라고 생각했다""며 ""누군가는 반드시 해야 하는 일에 뛰어들어 즐거운 마음으로 임하니 지금에 이른 것 같다""며 웃음 지었다. 지난해 여러 바이오벤처가 코스닥 상장의 벽을 넘지 못했는데도 그해 12월 코스닥 상장에 성공한 데 대해서는 ""국제적 기준에 맞게 재무제표를 만들고 꼼꼼하게 준비한 결실""이라고 덧붙였다. 윤 회장은 최근 제약·바이오 업계의 글로벌스탠더드가 'IT(정보기술) 임상'이라고 강조했다. IT 임상이란 신약 개발과 임상, 신약 허가 과정 일체에 IT 기반 프로그램을 쓰는 것을 말한다. 그는 ""기존에는 임상 전 과정에서 나오는 데이터를 직접 손으로 종이에 써야 했다면 지금은 전자 문서화 프로그램을 쓰는 쪽으로 보편화되고 있다""면서 ""국내에서도 후자로 가고 있지만 아직도 가야 할 길이 멀다""고 지적했다. 이에 따라 윤 회장이 신경을 가장 많이 쓰는 분야도 '글로벌 진출'과 'IT 솔루션 개발'이다. 그는 ""미국 식품의약국(FDA)이나 유럽의약품청(EMA) 같은 해외 허가 당국의 심사를 받기에는 아직 국내 업체들의 IT 임상과 관련한 기술력이 모자라고 최적화 수준 또한 미진하다""면서 ""이번에 지분을 인수한 미국 CRO는 해외 글로벌 제약사들을 고객으로 두고 있기 때문에 씨엔알리서치가 자체 IT 솔루션을 구축하는 데 큰 도움이 된다""고 밝혔다. 국내 CRO들이 제약사들에 '을' 취급을 받는 현실에 대해선 ""글로벌 시선으로 보면 제약사들과 CRO는 대등한 관계""라며 ""국내에선 CRO가 한국표준산업분류에도 들어가 있지 않은데 이 기회에 CRO의 중요성이 더 많이 알려지길 바란다""고 말했다. 윤 회장은 서울대 약학대학을 졸업한 뒤 1978년 동아제약에서 제품 개발 업무를 맡다가 1984년 LG에 입사해 임상시험 업무를 맡았다.",105,https://n.news.naver.com/mnews/article/009/0004969544?sid=103
“보급형 왕좌 지킨다”… 신형 갤럭시A·M 출격,2022.05.26. 오후 2:37,"갤럭시A·M 신제품 출시 채비5G 중저가 요금제 수요 대비30만~40만원대 라인업 보강고객 선택지 확대로 시장 활력



삼성전자가 중저가 5세대(5G) 이동통신 스마트폰 국내 출시 라인업을 보강한다. 30만~40만원대 신제품 2종을 중저가 요금제 수요에 맞춰 선보일 예정이다. 지난달 샤오미가 레드미11 시리즈를 출시하고, 모토로라도 9년만에 5G폰으로 한국 복귀를 선언한 가운데 삼성전자도 실속형 모델을 앞세워 경합을 벌일 전망이다.국립전파연구원에 따르면 삼성전자는 최근 갤럭시A33 5G(SM-A336N)와 갤럭시M23 5G(SM-M236L)에 대한 적합성평가 인증을 받았다.갤럭시A33 5G는 삼성전자가 3월 '갤럭시A 이벤트 2022'를 통해 갤럭시A53 5G와 함께 발표한 보급형 제품군 주력 모델 중 하나다. 글로벌 출시와 동시에 국내 사전 판매를 진행한 갤럭시A53과 달리 유럽과 인도 등 해외 시장에만 먼저 출시가 이뤄졌다.갤럭시A33 5G는 5나노(㎚) 공정이 적용된 삼성 엑시노스1280 프로세서를 탑재하고, 방수방진 등 지원으로 전작 대비 제품 경쟁력을 높였다. 후면에는 4800만화소 메인, 1200만화소 초광각, 500만화소 심도, 500만화소 접사 등으로 구성된 쿼드 카메라를 장착했으며 인공지능(AI) 기술로 고품질 야간사진과 인물사진 촬영을 지원한다.갤럭시M23 5G는 LG유플러스용으로 리브랜딩, '갤럭시버디2'로 선보이는 방안이 유력하다. 앞서 출시된 SK텔레콤 갤럭시퀀텀3(갤럭시M53 5G), KT 갤럭시점프2(갤럭시M33 5G)에 이어 LG유플러스도 전용 단말의 기반 모델로 갤럭시M 시리즈를 채택한 것으로 분석된다.갤럭시M 시리즈는 인도 등 글로벌 시장에서 고성능 카메라와 대용량 배터리를 앞세워 상품성을 입증했다. 퀄컴 스냅드래곤750 프로세서를 탑재한 갤럭시M23 5G 역시 독일과 인도, 일본 등에서 온라인 자급제 채널을 통해 먼저 출시돼 호평받았다.삼성전자의 중저가 5G 스마트폰 라인업 추가 투입은 최근 도입 논의가 이뤄진 5G 중간요금제에 적시 대응하기 위한 것으로 풀이된다. 다양한 가격대에 촘촘하게 제품군을 배치, 5G 가입자 성장을 뒷받침한다는 구상이다.모토로라와 샤오미 등 국내 출시되는 외산폰과 경쟁도 관전 요소다. 모토로라는 엣지20 라이트와 모토G50 5G를 30만원대에 국내 선보였고, 샤오미는 레드미노트11 프로(5G)와 레드미노트11 롱텀에벌루션(LTE) 버전을 지난달부터 시판 중이다.이통사 유통망 관계자는 “중저가 시장에서 5G 스마트폰 선택지가 넓어짐에 따라 구형 모델에서 신제품으로 기기 교체를 원하는 소비자 관심도 커졌다”며 “신제품 출시 프로모션이 시장에 활기를 불어넣을 것으로 기대한다”고 말했다.",105,https://n.news.naver.com/mnews/article/030/0003019547?sid=103
"라인게임즈 ‘언디셈버’, ‘카오스 레벨 성장’ 기능 추가",2022.05.26. 오후 2:51,"라인게임즈 제공.[OSEN=임재형 기자] 라인게임즈가 핵앤슬래시 게임 ‘언디셈버’에 ‘카오스 레벨 성장’ 기능을 도입했다.26일 라인게임즈는 니즈게임즈가 개발한 멀티플랫폼 핵앤슬래시 액션 RPG ‘언디셈버’에 신규 콘텐츠를 업데이트했다. 이번 업데이트는 이용자들의 전투 플레이 재미를 더욱 향상시키고, 플레이에 대한 도전 욕구를 자극하는데 주안점을 두고 진행됐다. 이를 통해 먼저 ‘카오스 레벨 성장’ 기능을 새롭게 선보였다.‘카오스 레벨 성장’은 카오스 카드 성장 재료 혹은 카오스 카드를 재료로 사용해 보유 중인 카오스 카드의 레벨을 높일 수 있는 기능이다. 높아진 레벨의 카오스 카드를 이용하면 기존보다 높은 레벨의 까다로운 몬스터와 전투를 펼칠 수 있으며, 몬스터 처치 시 얻을 수 있는 장비 레벨이 높아지고 경험치와 골드 획득량도 증가한다.이와 함께 ‘장비 아이템 옵션 전승’ 기능을 추가했다. 해당 기능은 ‘장비 확정 전승’과 ‘부분 전승’으로 구분된다. ‘확정 전승’의 경우 기존 장비의 등급과 옵션뿐만 아니라 옵션의 티어(Tier)까지 다른 장비로 옮길 수 있는 것이 특징이다.이 밖에도 업데이트를 통해 신규 유물 장비 16종을 추가했으며, 일부 유물 장비를 리뉴얼했다. 이 외에도 기존 전투 스킬 시스템에만 적용됐던 ‘각성 기능’이 문장과 토템 스킬에도 추가되었다. /lisco@osen.co.kr",105,https://n.news.naver.com/mnews/article/109/0004622999?sid=103
