title,date,main,section,url
"넷마블 블록체인 토큰 'MBX', 빗썸 상장",2022.05.06. 오후 2:17,"""MBX 익스플로러 오픈 및 신작 출시 등 생태계 지속 확장""



넷마블 MBX 토큰 빗썸 상장.ⓒ넷마블[데일리안 = 최은수 기자] 넷마블은 블록체인 전문 자회사 마브렉스(MARBLEX)가 가상자산 거래소 빗썸에 MBX 토큰을 상장했다고 6일 밝혔다.이에 따라 오늘(6일)부터 모든 이용자들은 가상자산 거래소 빗썸에서 MBX 토큰 거래 및 입출금을 진행할 수 있다.MBX 토큰은 클레이튼(Klaytn) 메인넷 기반 블록체인 생태계 MBX의 유틸리티 토큰으로, 이용자 참여와 합리적 보상 제공이 선순환되는 생태계를 구축하는데 활용되고 있다.마브렉스는 거래소 상장을 기념해 오는 9일까지 MBX 토큰 거래에 참여한 이용자에게 매일 선착순(1000명)으로 0.5 MBX 토큰을, 일일 거래 기여도에 따라 일정량의 MBX 토큰을 각각 제공하는 이벤트를 개최한다.넷마블은 지난 3월 MBX 생태계와 MBX 월렛 애플리케이션(이하 앱)을 정식 출시한 바 있다. MBX 월렛 앱에서는 토큰 보관 기능 외에도 이네트리움(ITU) 등 게임 토큰을 브릿지 토큰인 MBXL로 교환하는 기능, 이를 1대 1 비율로 MBX 토큰과 교환하는 기능 등 토큰 스왑에 관한 모든 프로세스를 지원한다.넷마블은 향후 MBX의 트랜잭션 관련 정보를 확인할 수 있는 MBX 익스플로러 오픈을 비롯해 ‘제2의 나라 (글로벌)’, ‘몬스터 아레나’, ‘모두의 마블: 메타월드’ 등 블록체인 기반 게임 출시를 통해 생태계를 지속 확장해나갈 예정이다.",105,https://n.news.naver.com/mnews/article/119/0002601472?sid=103
"위메이드커넥트 '다크에덴M 온 위믹스', 글로벌 인기 상위권 등극",2022.05.06. 오후 2:41,"출시 하루 만에 홍콩, 태국 등 앱마켓 인기 톱 10위""자체 게임 토큰 '뎁코'와 MMORPG 재미 결합""



위메이드커넥트 신작 '다크에덴M 온 위믹스'.ⓒ위메이드커넥트[데일리안 = 최은수 기자] 위메이드커넥트 신작 '다크에덴M 온 위믹스(on WEMIX)'가 글로벌 출시 하루 만에 다양한 지역에서 앱마켓 인기 상위권에 오르며 흥행 기대감을 높이고 있다.위메이드커넥트는 플레이웍스가 개발하고 자사가 서비스하는 '다크에덴M 온 위믹스'가 홍콩, 태국 구글 플레이와 애플 앱스토어의 게임 전체 인기 순위 톱10을 기록했다고 6일 밝혔다.또한 미국, 독일, 러시아, 싱가포르, 브라질 등 20여개 국가의 애플 앱스토어와 구글 플레이 역할수행게임(RPG) 장르 인기 톱10을 기록하며 순항하고 있다.다크에덴M 온 위믹스는 지난 5일 한국, 일본 등 일부를 제외한 글로벌 전역에서 서비스를 시작했다. 이 게임은 자체 게임 토큰인 뎁코(DEBCO)를 탑재한 것이 특징이다. 뎁코(DEBCO)는 게임 내 보상인 메달과의 상호교환과 게임 외부에서의 위믹스 교환 등에 최적화된 토큰이다.위메이드커넥트는 다크에덴M 온 위믹스가 자체 토큰인 뎁코(DEBCO)와 다중접속역할수행게임(MMORPG)의 재미가 결합돼 플레이앤언(P&E)게임에 대한 글로벌 시장의 기대감을 충족했다고 설명했다.이밖에도 ▲위믹스 플랫폼에 대한 인지도와 토큰 ▲아이템을 획득할 수 있는 오픈 이벤트 ▲무한 PK 시스템 등의 콘텐츠와 ▲PC버전 동시 출시 ▲다국적 커뮤니티 및 SNS 운영 등이 호응의 배경이 된 것으로 풀이된다.이호대 위메이드커넥트 대표는 ""'다크에덴M 온 위믹스'는 위믹스 플랫폼의 안정성과 플레이웍스의 개발력이 더해진 글로벌 P&E게임의 기준을 제시할 게임”이라며 “플랫폼, 게임의 시너지 효과를 극대화할 위메이드커넥트만의 퍼블리싱 노하우를 선보일 것”이라고 말했다.위메이드커넥트는 올해 위메이드의 글로벌 블록체인 플랫폼 위믹스 기반 게임 개발과 퍼블리싱을 통한 라인업 및 서비스를 본격적으로 확대한다는 계획이다.",105,https://n.news.naver.com/mnews/article/119/0002601478?sid=103
"토스뱅크-중기중앙회, 개인사업자 혜택 강화 위해 맞손",2022.05.06. 오전 9:00,"[디지털데일리 이상일기자] 토스뱅크(대표이사 홍민택)는 주주사인 중소기업중앙회(이하 중기중앙회, 회장 김기문)와 손잡고 보다 많은 소상공인, 개인사업자에게 '사장님 대출'의 혜택을 확대한다고 6일 밝혔다.중소기업중앙회는 중소기업, 자영업자의 자주적 경제활동을 지원하고 있으며, 노란우산공제를 통해 폐업, 노령 등의 위험으로부터 생활안정을 기하고 사업재기 기회를 제공받을 수 있도록 하는 사회안전망 공제 제도를 운영하고 있다.토스뱅크는 중기중앙회와 함께 소상공인 금융 지원과 이들의 성장과 발전을 도모하기 위해 노란우산공제에 가입한 개인사업자에게 최대 0.5%p 우대금리를 제공한다. 한도는 기존 ‘사장님 대출’과 같이 최대 1억 원이다.토스뱅크 ‘사장님 대출’은 휴·폐업 상태가 아닌, 사업자 등록번호가 있는 개인사업자 중 1년 이상 또는 최근 6개월 이상 매출이 발생한 고객이라면 신청할 수 있다. 대출 기간은 최소 1년부터 최대 5년(만기 시 연장 가능)이며, 언제든지 중도상환수수료 없이 갚을 수 있어 금융비용을 절감할 수 있다.토스뱅크 관계자는 “이번 중기중앙회와의 협업으로 보다 많은 개인사업자 고객들이 번거롭게 은행을 방문하지 않고도 모바일을 통해 금융 혜택을 받을 수 있으면 좋겠다”라며 “앞으로도 중기중앙회가 운영하는 노란우산공제 가입 홍보 등 업무제휴를 통해 보다 차별화된 서비스와 혜택을 제공하면서 서민금융 활성화를 위해 노력하겠다”고 말했다.",105,https://n.news.naver.com/mnews/article/138/0002124126?sid=103
[망분리완화④] 망분리 완화=보안 약화? 보안업계 “No”,2022.05.06. 오전 9:20,"9년여 동안 우리나라 금융보안 정책의 근간이었던 ‘망분리’ 정책이 변화의 시기를 맞았다. 금융당국은 금융분야의 디지털 전환을 안정적으로 뒷받침하기 위해 클라우드 활용에 관한 규제와 망분리 규제 개선을 추진한다고 14일 발표했다. 중장기로는 망분리 대상 업무를 축소하고 '논리적 망분리'에 대한 선택권을 부여하는 방안도 검토한다. 9년여간 금융보안의 근간을 차지하던 망분리 정책의 변화는 금융사는 물론 보안업계에도 일정부분 영향을 줄 수 밖에 없다. <디지털데일리>는 5회에 걸쳐 금융 망분리 정책 변화에 따른 시장 영향을 조망한다.<편집자>   [디지털데일리 이종현기자] 금융권에서 망분리를 필수적으로 적용하게 된 것은 2013년부터다. 2011년 농협 전산망 마비 사태 이후 연이은 보안사고에 필용성이 대두됐다. 2013년 국내 주요 방송사와 금융회사 전산망이 마비되는 ‘3.20 사이버 테러’가 결정적인 계기가 됐다.   2013년 발표한 ‘금융전산 보안 강화 종합대책’에 따라 국내 금융권 기업에는 2014년까지 망분리가 의무화됐다. 도입 당시에도 내부망, 외부망용 PC를 각각 두는 ‘물리적 망분리’와 가상화(Virtualization)를 기반으로 한 ‘논리적 망분리’ 중 무엇을 선택하느냐는 논쟁거리였다.   당시에도 물리적 망분리보다는 논리적 망분리 도입이 선호됐다. 물리적 망분리의 경우 네트워크 장비가 필요한 만큼, 비교적 도입 비용이 높았기 때문이다. 하지만 기업은행이 전사의 물리적 망분리를 추진했고, 물리적 망분리가 표준으로 자리 잡게 됐다. 논리적 망분리 대비 물리적 망분리가 보안성 면에서 더 우수하다는 것이 선택의 주요 배경이다.   도입 이후 시행착오를 거치며 업계 표준이 된 물리적 망분리에 대한 회의론에 힘이 실린 것은 코로나19 이후부터다. 사회적 거리두기로 재택근무가 본격화되는 가운데, 물리적 망분리가 업무 중단을 초래했다는 비판이 제기됐다. 클라우드 활성화 등, 다른 정책 방향과 상충된다는 지적도 있다.   이에 금융위원회는 지난 4월 14일 망분리 규제 개선을 발표했다. 9년간 금융권 사이버보안의 기틀이 된 물리적 망분리가 완화될 전망이다.   발표 이후 일각에서는 정책 변경으로 인한 보안성 약화가 우려된다는 목소리도 나온다. 정권 교체기를 겨냥한 북한발 해킹 및 우크라이나를 침공한 러시아발 해킹의 증가가 예상되는 가운데 물리적 망분리를 대체할 만한 기술이 없다는 주장이다.   이와 관련 보안업계는 “걱정할 것 없다”는 입장이다. 물리적 망분리가 완화되더라도 특별히 높은 보안성이 요구되는 영역의 경우 물리적 망분리를 유지하고, 소프트웨어(SW) 개발이나 재택근무를 위한 영역에만 해제하는 등의 조치가 이뤄질 것이기 때문에 정책 변화로 갑작스레 보안성이 크게 약화되는 일은 없을 것이라는 의견이 주를 이룬다.   한 사이버보안 전문가는 “물리적 망분리가 외부침입 방지면에서 가장 탁월한 방법인 것은 분명하다. 하지만 망분리를 적용하면서 서비스의 경쟁력을 유지하는 것은 불가하다”고 말했다.   또 최근 기업 환경에서는 물리적 망분리를 하더라도 일정 영역에서는 연결이 될 수밖에 없다고도 강조했다. 폐쇄망만 사용하는 산업시설도 해킹되는 상황에서, 물리적 망분리로 금융시스템을 완벽히 보호하는 것은 불가능하다는 지적이다.   그는 물리적 망분리가 지나치게 맹신되고 있다고도 꼬집었다. “그간 국내 금융권의 경우 물리적 망분리 적용을 의무화함에 따라 다른 방면의 보안 솔루션 도입은 다소 소극적인 편이었다. 물리적 망분리가 모든 보안 이슈를 해결할 수 있는 만능열쇠처럼 여겼다”고 주장했다.   이어서 “보안을 위해서는 IT 시스템 전반에 대한 가시성을 확보하고, 재택근무로 넓어진 공격표면에 대한 보안도 갖춰야 한다. 급증하는 보안 이벤트를 자동 처리하도록 인공지능(AI) 기반의 솔루션 도입도 필수적”이라며 “개발 환경을 저해하지 않으면서 보안도 챙기는, ‘넥스트 망분리’를 고민해야 할 때”라고 피력했다.   줄곧 망분리 완화의 필요성을 주장해온 한국정보보호산업협회(KISIA) 이동범 회장도 환영 의사를 나타냈다.    이 회장은 “한국에서 물리적 망분리를 모두 없애야 한다는 것은 아니다. 다만 획일적인 물리적 망분리 적용은 문제가 있다고 생각한다”며 “이번 완화 조치가 매우 만족스러운 정도는 아니다. 다만 시범적으로 도입 후 확산한다는 측면에서 고무적”이라고 전했다.",105,https://n.news.naver.com/mnews/article/138/0002124129?sid=103
"가상인간 '로지', 네이버 AI로 목소리 얻다… 8일 컬투쇼 출연",2022.05.06. 오후 2:44,"가상인간 '로지'가 오는 8일 라디오 방송에 출연한다. /사진제공=네이버 가상인간 '로지'가 네이버 인공지능( AI) 음성합성 기술을 통해 목소리를 얻었다. 로지의 목소리는 오는 8일 라디오 방송에서 공개될 예정이다. 네이버는 6일 싸이더스 스튜디오 엑스와 손잡고 가상인간 로지의 AI 보이스를 클로바 AI 음성합성 기술로 만들었다고 밝혔다. 로지의 AI 보이스는 오는 8일 방송되는 SBS 파워FM '두시탈출 컬투쇼'에서 소개된다. 로지는 이날 방송에 스페셜 게스트로 나와 DJ 김태균과 버추얼 인플루언서로서의 활동에 대한 이야기를 나누고 청취자 사연도 직접 읽을 계획이다. 가상 인간이 라디오 방송에 출연하는 것은 이번이 처음이다.로지의 AI 보이스는 네이버 클로바에서 자체 개발한 NES(Natural Endto-end Speech Synthesis) 기술을 통해 제작됐다. 약 40분 수준의 짧은 녹음만으로도 분야에 대한 제약 없이 사용할 수 있고 사람에 가까운 자연스러운 목소리를 구현할 수 있는 게 특징이다. 로지의 MZ세대(1981~1995년 출생한 밀레니얼(M) 세대와 1996~2010년 출생한 Z세대를 통칭) 감성에 가장 적합한 목소리를 싸이더스 스튜디오 엑스 측이 선택하고 네이버가 이를 NES 기술을 활용해 AI 보이스로 만들었다. 로지가 별도 녹음 없이도 AI 보이스를 통해 음성으로 자유롭게 소통할 수 있게 돼 그동안 소셜네트워크서비스(SNS), 광고 등에 주력했던 활동 영역도 한층 넓어질 것으로 기대된다. 라디오 DJ 뿐만 아니라 도슨트, 사회자, 라이브 커머스 진행자 등 목소리를 필요로 하는 다양한 영역에서의 활동이 가능할 전망이다.네이버는 AI 보이스로 동영상을 더빙할 수 있는 '클로바더빙'을 통해 음성합성 기술을 서비스하고 있다. 클로바더빙에서는 다양한 성별, 연령대, 스타일의 105개 보이스를 자유롭게 사용할 수 있으며 영어, 일본어, 중국어, 스페인어 등 외국어 보이스도 제공된다. 클로바더빙의 AI 보이스는 채널A의 '오은영의 금쪽 상담소', '요즘 육아 금쪽같은 내 새끼' 등 실제 방송에서도 활용 중이다. 누구나 자신의 목소리로 개성 있는 AI 보이스를 제작할 수 있는 '보이스메이커' 서비스도 지난해 11월 베타 오픈했다. 보이스메이커로 제작된 AI 보이스는 클로바더빙을 통해 공개되며 이미 약 20개 사용자 보이스가 업로드됐다.김재민 네이버 클로바 보이스 책임리더는 ""국내 최초의 버추얼 인플루언서인 로지의 목소리를 클로바의 AI 기술로 제작하게 돼 의미가 깊다""면서 ""네이버는 로지와의 협업을 활발히 이어가는 한편 클로바 AI 보이스의 활용 범위를 계속해서 넓혀나갈 것""이라고 말했다.",105,https://n.news.naver.com/mnews/article/417/0000810568?sid=103
"디즈니+ 한국 론칭 이끈 김소연 총괄, 디즈니코리아 대표로",2022.05.06. 오전 10:24,"월트디즈니컴퍼니(이하 디즈니)가 '디즈니 플러스'(+)의 한국 론칭을 이끈 김소연 DTC 사업부 전무를 디즈니코리아 대표이사로 선임했다. 6일 디즈니 아시아태평양 지역(APAC) 측은 ""김소연 전무를 디즈니코리아 대표로 임명했다""며 ""후임이 결정되기 전까지 한국 DTC 사업부 총괄도 계속 겸임한다""고 발표했다. 



김소연 디즈니코리아 신임 대표(왼쪽)와 디즈니+. (사진=월트디즈니컴퍼니)이는 디즈니가 지난해 2월 당시 오상호 디즈니스튜디오 사업부 전무와 김소연 소비재사업부 상무를 각각 디즈니코리아 대표와 디즈니코리아 DTC 사업부 총괄에 임명한 이후 1년 3개월 여만에 단행한 인사다. 루크 강 월트디즈니 컴퍼니 아시아태평양 지역 총괄 사장은 ""김소연 신임 대표는 성공적인 디즈니+ 한국 론칭을 포함해 디즈니 내 다양한 사업 부문을 이끌며 디즈니코리아 비즈니스 성장에 중추적 역할을 담당했다""며 ""빠르게 변화하는 미디어 환경 속에서 디즈니+를 포함한 디즈니의 국내 사업 운영을 최적화하고 혁신을 이끌며 디즈니코리아 브랜드 가치와 비즈니스를 지속 발전시킬 것으로 확신한다""고 전했다.김소연 대표는 2007년 디즈니 채널 사업부에 합류한 이래 15년 간 디즈니에 몸 담으며 미디어, 채널, 소비재 및 DTC 사업부를 두루 거친 미디어 및 엔터테인먼트 전문가다. 앞서 김소연 대표는 소비재 사업부를 총괄하며 다양한 국내 파트너사와의 협업을 통해 디즈니 IP를 다양한 소비재로 확장하는 라이센싱 비즈니스에 주력했다. 그 밖에도 미디어사업부 및 채널사업부를 총괄하며 콘텐츠의 디지털 전환 전략을 통해 콘텐츠 세일즈 및 채널 비즈니스 성장을 이끌었다는 평가를 받았다.그는 디즈니코리아 내 디즈니+가 포함된 DTC사업부 총괄을 역임하며 지난해 11월 한국에 디즈니+ 서비스를 론칭시켰다. 출시 첫 해인 올해 최소 12개의 오리지널을 포함해 20개 이상의 한국 콘텐츠 공개 계획을 발표하며 적극적으로 비즈니스를 확장한 성과를 인정받은 것으로 풀이된다.한편, 오상호 디즈니코리아 전임 대표는 디즈니 동남아시아 스튜디오 사업부 총괄로 임명됐다. 그는 싱가포르, 말레이시아, 필리핀 등이 포함된 성장 시장에서 디즈니의 주요 스튜디오 사업 확장을 이끌 예정이다.",105,https://n.news.naver.com/mnews/article/293/0000039008?sid=103
"19일 IPO 예정이었던 SK쉴더스, 돌연 ‘상장 철회’",2022.05.06. 오전 8:57,"[디지털데일리 이종현기자] SK쉴더스가 상장 철회 신고서를 제출했다. 이에 따라 19일 기업공개(IPO) 예정이었던 잔여 일정은 모두 취소된다.   6일 SK쉴더스는 회사 기업가치를 적절히 평가받지 못했다며 상장 철회 신고서를 제출했다. 향후 시장 상황을 고려해 기업 가치를 온전히 평가받을 수 있는 시점에 재검토한다는 계획이다.   업계에서는 SK쉴더스의 상장 철회는 이는 지난 3일부터 4일까지 진행된 수요예측이 SK쉴더스의 기대치를 크게 밑돈 결과로 추정한다. SK쉴더스는 6일 공모가를 확정, 9일부터 10일까지 일반 투자자 대상 청약을 진행한 뒤 19일 상장할 예정이었다.   SK쉴더스 측은 “수요예측에 참여한 기관투자자에게 주식을 배정하지 않았고, 일반투자자 대상 청약 실시 전이므로 투자자 보호상 문제는 없다”고 말했다.",105,https://n.news.naver.com/mnews/article/138/0002124125?sid=103
,,,105,https://n.news.naver.com/mnews/article/236/0000223572?sid=103
,,,105,https://n.news.naver.com/mnews/article/056/0011589395?sid=103
"현대차, 숲 복원 프로젝트 ‘아이오닉 포레스트’ 통해 베트남 숲 조성",2023.10.25. 오전 9:48,"IUCN-굿네이버스와 삼자 협약 체결3년간 맹그로브 숲 조성…첫 해 12만그루 심는다[이데일리 이다원 기자] 현대차(005380)가 베트남 메콩강 삼각주 맹그로브 숲을 복원하기 위한 ‘아이오닉 포레스트’에 돌입한다고 25일 밝혔다.



제이크 브러너 세계자연보전연맹(IUCN) 베트남 대표(왼쪽부터), 오인원 현대차 베트남사업담당, 박동철 굿네이버스 베트남 대표가 24일(현지시각) 현대차 베트남 판매합작법인(HTV) 에서 국제환경기구 세계자연보전연맹(IUCN), 국제구호개발 NGO 굿네이버스와 ‘아이오닉 포레스트 베트남 맹그로브 숲 조성 사업 협약식’을 진행하고 기념 촬영을 하고 있다. (사진=현대차)현대차는 전날(현지시각) 현대차 베트남 판매합작법인(HTV)에서 국제환경기구 세계자연보전연맹(IUCN), 국제구호개발 비정부기구(NGO) 굿네이버스와 아이오닉 포레스트 베트남 맹그로브 숲 조성 사업 협약식을 열었다.이번 협약에 따라 현대차는 향후 3년간 베트남 메콩강 삼각주에 위치한 상업 중심지 ‘까 마우’ 지역에 새 맹그로브 나무를 심어 훼손된 맹그로브 숲을 복원한다.맹그로브는 민물과 바닷물이 만나는 습지에서 자라는 나무다. 맹그로브 숲이 형성되면 천연 방파제 역할을 할 수 있다. 뛰어난 수질 정화 능력은 물론 열대우림보다 3~5배 높은 탄소 흡수력도 가졌다.하지만 지역 주민들이 생계를 유지하기 위해 나무를 베면서 기능을 상실했다는 우려가 나왔다.현대차는 두 기구와 맹그로브 숲 복원의 필요성에 공감하며 아이오닉 포레스트를 새로 조성하고, 숲의 기존 역할을 복원하는 동시에 생물 다양성을 보전할 것을 기대하고 있다. 또 기후 변화에도 적극 대응한다.현대차는 먼저 첫 해 12만그루의 맹그로브 나무를 심고 검토·평가 과정을 거쳐 남은 2년간의 조성 계획을 구체화할 계획이다.현대자동차 관계자는 “현대차는 지난해 글로벌 CSV 이니셔티브 ‘현대 컨티뉴’를 공개하며 ‘아이오닉 포레스트’를 비롯해 해양 폐기물 수거 및 업사이클링을 추진하는 등 지속 가능한 미래를 위한 다양한 친환경 활동을 진행하고 있다”며 “앞으로도 인류와 자연의 공존을 위해 여러 파트너와 다양한 활동을 전개하며 힘쓸 것”이라고 말했다.",105,https://n.news.naver.com/mnews/article/018/0005603338?sid=103
,,,105,https://n.news.naver.com/mnews/article/421/0006074700?sid=103
,,,105,https://n.news.naver.com/mnews/article/236/0000223576?sid=103
