title,date,main,section,url
우주에서는 크리스마스를 어떻게 보낼까,2018.12.21. 오후 6:01,"아이나 어른이나 설레는 크리스마스가 다가옵니다. 크리스마스는 전 세계가 가장 기다리는 축제입니다. 과연 지구 뿐일까요? 때로는 우주라는 공간에서도 크리스마스를 즐기고 축하하기 위해 다양한 이벤트가 일어납니다. 우주라는 공간과 맞물린 색다른 크리스마스의 풍경들을 함께 살펴보겠습니다.우주에서 본 크리스마스 이브의 지구1968년 12월 21일 우주로 쏘아올린 아폴로 8호는 크리스마스 기간에 우주 탐사를 수행한 첫 번째 우주선이 됐습니다. 아폴로 8호가 우주에서 촬영한 사진 한 장은 20세기 지구에 전달된 특별한 크리스마스 선물이었습니다.  



1968년 12월24일 아폴로8호가 찍은 ‘지구돋이(Earthrise)’. NASA 당시 아폴로 8호가 발사 후 며칠이 지나 달을 선회하면서 의도하지 않은 방향의 변화가 일어나 지구가 그들의 시야로 들어왔습니다. 함께 있던 3명의 우주비행사 중 한 사람인 빌 앤더스는 그 순간 지평선 위로 떠오르는 크리스마스이브의 지구를 촬영했습니다. 우주에 떠있는 지구는 파란색과 흰색이 섞여 아름답게 빛납니다. 이 한 장의 사진은 사람들로 하여금 우리가 우주의 일부일 뿐이라는 것을 인식하게 해준 계기가 됐습니다.같은 날 우주비행사들은 달 궤도에서 성경 창세기 1장의 1절부터 10절까지 낭독했습니다. 그 모습은 TV를 통해 미국 전역으로 중계됐고 높은 시청률을 기록했습니다. 그로부터 7개월 후, 아폴로 11호가 인류 최초로 달 착륙에 성공하기에 이릅니다. 1968년 크리스마스 이브 달에서 아폴로 8의 역사적인 방송 바로보기.빈 캔으로 만든 트리에 숨은 사연은?인류가 우주에 본격적으로 진출하며 우주에서 더 오랜 시간을 안전하게 머무는 게 과제가 됐습니다. 이를 위해 미국에서는 아폴로 계획이 끝나고 남은 로켓인 새턴V를 개조해 스카이랩을 제작했습니다. 길이 17.5m, 지름 6.7m, 총무게 74.7t, 내부 공간의 크기 270평방미터의 거대한 크기의 우주정거장입니다. 넓은 내부에 각종 실험시설을 포함해 침실, 냉장고, 샤워시설, 화장실, 운동 기구 등을 설치했습니다.3명의 우주비행사들이 1973년 11월부터 이듬해 2월까지 마지막 임무를 수행하기 위해 스카이랩 4호에 탑승했습니다. 그들은 크리스마스를 앞두고 즉흥적으로 축하하는 기념물을 만들었는데요. 바로 우주식량을 담았던 빈 통조림을 활용해 만든 트리입니다.



1973년 우주에서 만든 크리스마스 캔 트리. NASA 독창적이고 매력적인 트리로 보이지만, 우주비행사들의 반란을 알리는 서막이었습니다. 이들은 빡빡한 탐사 일정에 지친 나머지 24시간 동안 지구 관제센터와의 통신을 끊고 임무 수행을 거부하기에 이르렀는데요. 우주 체류비용을 줄이기 위해 매일 20시간씩 근무하며, 실험을 마치고 다음 실험을 수행하기 전에 정신적으로 준비할 시간이 없는 살인적인 스케줄에 반기를 든 것이죠.결국 임무 수행에 대한 합의가 원활히 이뤄져 비행사들은 태양과 지구를 연구하고 여가를 보내는 시간을 더 많이 확보할 수 있게 됐습니다. 비행사 중 한 명인 윌리엄 포그는 당시 뉴욕타임즈와의 인터뷰에서 “처음에는 지구 관제센터에서 우리의 불평을 무기력함이나 우울증으로 생각했으나 이는 사실이 아니다”라며 “탐사 후반에 태양과 지구, 나 자신에 대해 연구할 시간이 생기면서 훨씬 더 즐겁게 임했다”고 말했습니다.



스카이랩. NASA 크리스마스 카드에 로켓 그림이?좀 더 과거로 거슬러 올라가면 크리스마스 카드에 자랑스럽게 그려진 추억의 로켓들을 찾아볼 수 있습니다. 1947년 세워진 호주의 사우스오스트레일리아 주의 우메라(Woomera)는 세계에서 가장 빠른 로켓을 발사하는 기지입니다. 40년대 후반에 제작된 카드에는 사막의 우메라 기지 위에 V2 로켓이 그러져 있습니다.제2차 세계대전이 막바지로 치닫던 1944년, 독일군은 V2로켓으로 영국에 공격을 가했습니다. 길이 14m, 무게 13t에 최대 속도가 음속의 4배 가까운 시속 5760km, 항속 거리는 330km에 달합니다. 탄두에 1t에 가까운 폭탄들을 싣고 와 공중에서 투하하는 방식입니다.대량으로 사람을 살상하는 무기인 V2가 가장 평화로운 연말연시에 주고받는 카드 앞면을 장식한다는 사실이 아이러니합니다. 그런데 이 탄도미사일은 미국의 우주 개척시대를 연 주역이기도 합니다. V2을 개발한 사람은 독일의 로켓 공학자 베르너 폰 브라운입니다. 그는 히틀러의 지원 아래 로켓 개발에 전념했습니다.V2의 폭격에도 독일이 전쟁에서 졌고, 승전국인 미국과 소련은 V2 기술을 확보하기 위해 경쟁을 벌였습니다. 결국 V2의 기술 전쟁에서는 미국이 승리했습니다. V2를 개발했던 폰 브라운은 자신의 연구진과 함께 미국으로 갑니다. 그리고 1958년부터 NASA의 책임자로 임명돼 앞서 소개한 스카이랩의 전신이자 아폴로 계획을 주도한 새턴V를 개발하며 미국의 우주로켓 사업에 결정적인 역할을 하게 됩니다.



평화와 전쟁이 공존하는 1940년대 우메라 카드. 마틴 위머 소련은 V2는 놓쳤지만, 세계 최초의 인공위성 스푸트니크 1호를 쏘아올리며 냉전시대 초반 맹렬히 미국을 앞서갔습니다. 소련의 옛 빈티지 크리스마스 카드에도 우주의 흔적이 종종 나타납니다. 한 카드를 살펴보면, 산타클로스가 우주에서 루돌프 대신 세 우주선에 의지해 썰매를 끌고 있는데요. 이 엄청난 우주선들은 당시 소련의 우주개발계획을 견인한 보스토크, 보스후트, 소유즈입니다. 크리스마스 행사를 권장하지 않는 소련에서도 크리스마스 카드 속에 우주에 대한 열망을 함께 담아낸 모습이 재미있게 다가옵니다. 



우주를 테마로 한 옛 소련의 빈티지 크리스마스 카드. http://www.mazaika.com 올해 ISS의 크리스마스는 엘프와 함께올해 크리스마스에도 우주에서는 어떤 크리스마스를 보내게 될까요? 지난 12월 3일 카자흐스탄에서 소유즈호가 발사됐습니다. 이때 우주로 떠난 NASA의 우주비행사 3명은 현재 국제 우주 정거장(ISS)에 머물고 있습니다. 이중 앤 맥클레인은 그녀의 아들을 비롯해 우주를 바라보는 전 세계의 어린이를 위해 크리스마스 엘프 인형을 데려갔습니다.크리스마스 엘프는 산타클로스의 도우미 역할을 하는 동화 속 요정입니다. 엘프는 매일 집에서 아이들을 지켜보고 밤마다 북극에 사는 산타에게 찾아가서 아이가 착하게 지내는지, 크리스마스 때 어떤 선물을 받고 싶은지 등을 알려주고 옵니다. 우주 정거장에 진출한 엘프는 우주 비행사들의 생활을 매일 지켜보며 그들의 탐사 활동에도 관심을 갖고 있음을 맥클레인의 트위터를 통해 말하고 있습니다. ISS의 영하 80도의 실험실 냉동고가 북극보다 차갑다며 호기심을 보이고 있습니다. 올해도 지구 밖 우주의 크리스마스는 외롭지 않을 것 같습니다.



ISS의 냉동고인 MELFI 옆에 있는 엘프. 앤 맥클레인 참고 http://libcom.org/history/1973-skylab-4-mutiny  https://www.space.com/42771-elf-on-a-shelf-in-space-astronaut-photos.html  https://medium.com/teamindus/how-astronauts-celebrate-christmas-af7e11e0b021 http://www.v2rocket.com/ ※필자소개 이종림. IT전문지 마이크로소프트웨어와 과학동아에서 기자로 일했다. TV 예능프로그램 ‘용감한 기자들’에 출연했다. 최신 IT기기, 게임, 사진, 음악, 고양이에 관심이 많다. [이종림 객원기자 lumen002@naver.com]",105,https://n.news.naver.com/mnews/article/584/0000002694?sid=103
"KT, 22~25일 신촌 연세로에서 상권활성화 페스티벌 개최",2018.12.21. 오후 5:32,"버벌진트, 팔로알토, 조문근밴드 및 BJ 창현 거리노래방 등 다채로운 공연KT 5G 체험존, Y 플리마켓, Y 이벤트존 등 다양한 체험 이벤트신촌 인근 상권 구매 영수증 제시하면 크리스마스 케이크 등 혜택[이데일리 김현아 기자]



KT(회장 황창규)가 22일부터 25일까지 나흘간 서대문구 신촌 연세로에서 1020 젊은 세대들을 위한 문화 축제인 ‘Y 스트리트 페스티벌’을 개최한다.서대문구가 주최하고 KT가 후원하는 이 페스티벌은 젊은 세대가 공감하고 즐길 수 있는 거리 문화 축제다.다채로운 공연무대, 플리마켓, KT 5G 체험존, 포토 이벤트 등 다양한 볼거리와 즐길거리를 준비했다.23일(일) Y 스테이지에서는 버벌진트, 팔로알토의 힙합 공연과 비트박스, 비보잉 무대를 즐길 수 있다. 크리스마스 이브인 24일(월)에는 ‘슈퍼스타K’ 시즌1 준우승 출신의 조문근밴드의 공연과 최고의 스트리트 뮤직 BJ 창현과 함께 하는 ‘거리 노래방’이 진행될 예정이다. Y세대를 위한 다채로운 즐길거리를 마련했다. 기가아이즈, VRT 영화관 등 KT의 혁신기술을 직접 체험해 볼 수 있는 5G 체험존과 함께 ‘Y 눈싸움’, 포토존 SNS 인증 이벤트, 룰렛 이벤트를 운영한다. 각 이벤트에서는 와이구마(군고구마), 루돌프 머리띠, 토끼모자, 루트리 마스크팩, 핫팩 등 다양한 경품을 증정한다. 또 홍대앞 예술시장 플리마켓과 연계하여 수공예 작가 60여 팀과 함께 젊은 세대의 기호에 맞는 다양한 제품을 판매하는 Y 플리마켓을 운영한다.신촌 인근 상권에서 물품을 구매한 영수증을 제시하는 페스티벌 참가자분에게는 크리스마스 케이크 및 Y 플리마켓에서 즉시 사용 가능한 5천원 할인쿠폰을 제공한다.이외에도 신촌 전철역부터 연세대 앞을 아우르는 대규모 크리스마스 거리가 꾸며질 예정이다.KT 마케팅부문 이필재 부문장은 “크리스마스와 연말연시를 맞이하여 Y브랜드 타깃의 젊은 세대들이 가족, 친구, 연인과 함께 풍성하게 즐길 수 있는 스트리트 문화공간을 마련했다”고 밝혔다.김현아 (chaos@edaily.co.kr)네이버에서 이데일리 [구독하기▶]빡침해소! 청춘뉘우스~ [스냅타임▶]＜ⓒ종합 경제정보 미디어 이데일리 - 무단전재 & 재배포 금지＞",105,https://n.news.naver.com/mnews/article/018/0004277887?sid=103
[헬스TALK] 바람불면 시리고 통증…겨울철 눈 건강 되찾는 방법은?,2018.12.22. 오전 6:02,"연일 건조한 날씨와 미세먼지로 인해 눈 건강에 적신호가 켜졌다. 겨울철은 안구 표면에 수분을 공급하는 눈물이 쉽게 마르기 때문에 안구건조증이 생기지 않도록 주의해야 하는 시기다.건강보험심사평가원이 집계한 자료에 따르면 국내 안구건조증 환자는 2015년 216만7968명에서 2016년 224만4627명, 2017년 232만9554명으로 해마다 증가하고 있다. 또 찬바람이 부는 2017년 10월부터 2018년 3월까지 매달 환자 수가 7%씩 늘어난 것으로 나타났다.



조선DB안구건조증의 증가는 건조한 날씨와 미세먼지, TV·스마트폰의 장시간 사용 때문이다. 이 중에서도 건조한 날씨는 안구건조증 발생과 가장 밀접한 원인으로 꼽힌다. 겨울의 경우 계절 특성상 기온과 습도가 낮고 실내 난방기구 사용이 잦아 안구건조증이 많이 발생한다.안구건조증은 눈을 보호하는 눈물막에 이상이 생겨 나타나는데 눈물막은 안구 표면을 지방층, 수성층, 점액층으로 나눠 덮고 있다. 이 중 어느 층의 성분이 부족하면 눈물이 빨리 마르거나 충분한 양이 나오지 않아 눈이 쉽게 피로해진다.눈이 피로해지면 안구가 붉게 충혈되고 시리고 뻑뻑한 느낌이 든다. 또 모래가 들어간 듯한 불편감이 발생한다. 이 같은 증상은 외출 시 찬바람이 많이 불 때나 머리를 말리기 위해 헤어 드라이기를 사용할 때 더 심해진다.안구 건조로 인한 증상은 인공 눈물을 사용하면 완화할 수 있다. 그러나 근본적인 치료는 어렵기 때문에 인공 눈물 사용과 함께 일상 생활에서 당분간 눈을 과도하게 사용하지 않고 눈에 좋은 음식을 많이 섭취하는 것이 좋다.오랜 시간 TV를 시청하거나 스마트폰을 사용하는 행위는 안구건조증을 악화시킬 수 있어 자제해야 한다. 업무 등을 이유로 불가피하게 사용해야 한다면 1시간 사용 후 5~10분 눈을 쉬게 해야 한다. 또 자주 눈을 깜박거리는 것이 눈물 보충에 도움이 된다.실내에서는 가습기나 젖은 빨래 등을 활용해 습도를 40~60% 수준으로 유지하고 물을 자주 마셔야 한다. 외출 시에는 안경을 착용해 바람과 눈의 직접적인 마찰을 줄이는 것도 방법이다.식습관은 눈 건강에 좋은 고등어, 참치, 꽁치, 연어 같은 생선과 케일이나 시금치 등 채소를 충분히 섭취하는 것이 좋다. 고등어와 참치에는 ‘오메가3’가 포함돼 눈물막을 튼튼하게 하고 눈물의 촉촉함을 유지시킨다. 또 케일은 ‘루테인’, 시금치는 ‘제아잔틴’이 풍부해 시력 보호 효과가 있다.김정섭 비앤빛 강남밝은세상안과 원장은 ""현대인의 눈은 항상 피로하고 건조해 각종 안과 질환에 쉽게 노출된다""며 ""눈은 한 번 나빠지면 회복되기 어렵기 때문에 평소 오메가3 등 눈에 좋은 영양소가 풍부한 식품을 골고루 섭취하는 것이 도움이 된다""고 밝혔다.[김태환 기자 topen@chosunbiz.com]chosunbiz.com",105,https://n.news.naver.com/mnews/article/366/0000422971?sid=103
[토요워치]만혼 육아일기 또다른 주연···아빠 못잖은 슈퍼맘도 있죠,2018.12.21. 오후 5:58,"출산 후 경쟁력 위해 재입사·대학원 노크쉬는날엔 전업주부 만나 교육정보 품앗이사회 성공→가정 행복→개인 만족 이어져커리어 우먼들, 선순환 위해 '고군 분투'



2215A02 세대별 가족 특징[서울경제] 고군분투하는 건 아빠들만이 아니다. 예전에는 육아에 전념하던 엄마들도 회사생활과 육아, 자기관리의 ‘세 마리 토끼’를 놓치지 않으려 사투를 벌이고 있다. 엄마들은 보통 육아의 책임을 아빠보다 크게 느끼고 출산 후 육아와 직장생활을 병행하기도 쉽지 않다. 하지만 육아와 직장생활을 넘어 학업과 체형관리·피부관리까지 무엇 하나 놓치지 않으려는 ‘슈퍼맘’이 늘며 하나의 사회적 트렌드로 떠오르고 있다.어린이집에 다니는 4세·6세 아이를 둔 올해 16년차 중소기업 차장인 박지연(41·가명)씨는 내년 2월 서울 유명대의 경영대학원을 졸업한다. 대학원이 퇴근 후 직장에서 차로 한 시간 거리에 있지만 본인이 학부 시절을 보냈던 학교를 다시 다니고 싶다는 생각에 용기를 내 등록한 게 벌써 6년 전이다. 이후 결혼과 함께 첫째·둘째가 연달아 태어나면서 몇 번 고비를 맞았지만 출산 후에도 사회에서 경쟁력을 유지하기 위해서는 전문성을 확보해야 한다는 생각에 자신을 채찍질했다. 박씨는 “둘째가 태어나면서 몇 번이나 회사를 그만둬야 하나 고민했다”며 “돌이켜보면 매일 전쟁 같았지만 퇴근 후 아이 병간호로 밤을 새우면서도 제출일에 맞춰 논문을 낼 때의 쾌감은 잊지 못할 것 같다”고 말한다. 세 자녀를 키우면서 일에도 철저하고 피부관리와 체형관리까지 완벽하게 해내는 대기업 부장 이윤정(44·가명)씨. 다른 사람은 그를 부러워하지만 그에게는 순간순간이 시간과의 전쟁이다. 오전6시께 일어나 세 자녀와 자신의 아침 식사를 준비하고 직접 운전해 출근하는 동안 식사를 마친다. 퇴근 후에는 아이들을 돌보며 업무 관련 뉴스를 시청하는 동시에 홈트레이닝 프로그램에 맞춰 체형관리를 위한 운동도 빼먹지 않는다. 주말에는 한 살이라도 젊어 보이기 위해 평소 다니는 피부과에서 관리를 받는다.이씨는 “매주 고생하는 자신을 위한 최소한의 선물”이라며 “결혼 연령이 늦어지는 요즘에는 조금이라도 엄마가 젊어 보여야 아이도 자신감을 얻는다”고 말했다.또래 학부모와의 네트워크는 슈퍼맘이 되기 위한 또 다른 과제다. 언론사에 다니는 최나현(38·가명)씨는 스스로 ‘을 중의 을’로 자처한다. 회사에서는 상사에게 늘 ‘죄송하다’를 반복하고 퇴근 후와 주말 동네에서는 함께 어린이집에 보내는 전업주부들에게 ‘고맙다’며 연신 머리를 조아리기 때문이다. 육아 및 교육 정보가 전업주부에 비해 현격히 떨어지는 직장인 엄마들은 육아 정보에서 늘 소외되게 마련이다. 이 때문에 남들이 좋다는 학원이나 방과후활동이라도 보내려면 전업주부 엄마들과의 네트워크가 필수다. 최씨는 직장에서 나오는 전시나 공연 표를 친한 전업주부 엄마들에게 돌아가며 나눠주는 대신 아이들의 학원 정보를 얻는다. 최씨는 “주말에 보내는 어린이 축구교실의 경우 8명이 그룹을 만들어야 하는데 전업주부 엄마들과 친분이 없으며 그룹을 구할 수 없다”며 “정보가 늦어 아들이 다른 애들 다하는 그룹 활동을 못하면 뒤처질까 걱정”이라고 했다.전문가들은 가족구성원의 행복만큼 자신의 행복과 일도 중시하는 특징을 가진 밀레니얼 세대(1980년대 초반~2000년대 초반 출생)가 속속 부모 대열에 들어서며 이 같은 슈퍼맘 현상이 더 확대될 것으로 전망한다. 김난도 서울대 소비자아동학과 교수는 지난 10월 열린 ‘트렌드 코리아 2019’ 출간 기자간담회에서 내년 10대 트렌드 중 하나로 ‘밀레니얼 가족’을 꼽으며 전통적인 엄마의 상이 단순히 ‘집밥 하는 엄마’에서 ‘밥 잘 사주는(돈 잘 버는) 예쁜 엄마’로 바뀌고 있다고 분석했다.     /양사록기자 sarok@sedaily.com[서울경제 바로가기]애플워치4가 쏟아집니다! 서울경제썸 유튜브 구독 이벤트 [바로가기▶]프리미엄 미디어 Signal이 투자의 바른 길을 안내합니다 [바로가기▶]저작권자 ⓒ 서울경제, 무단 전재 및 재배포 금지",105,https://n.news.naver.com/mnews/article/011/0003470746?sid=103
[부고]김인회(KT 경영기획부문장 사장)씨 모친상 ,2018.12.21. 오후 3:48,"▲김순례씨 별세, 김인회(KT 경영기획부문장 사장) 광회((주)쿠오핀 전무) 경회((주)현대인더스트리 전무)씨 모친상=21일 오전 7시 경기도 분당서울대병원장례식장 3호실, 발인 24일 오전 9시, 031)787-1500데일리안 이홍석 기자 (redstone@dailian.co.kr)ⓒ (주)데일리안 - 무단전재, 변형, 무단배포 금지",105,https://n.news.naver.com/mnews/article/119/0002301350?sid=103
알파콘 '하이테크 어워드' 토큰이코노미 부문 대상,2018.12.21. 오후 4:05,"[ 김봉구 기자  ] 



블록체인 기반 헬스케어 데이터 플랫폼기업 알파콘 네트워크 파운데이션이 21일 서울 영등포구 공군회관에서 열린 ‘2018 하이테크 어워드’에서 토큰이코노미 부문 대상을 받았다.알파콘 네트워크는 병원비를 자체 발행 가상화폐(암호화폐) 알파콘으로 결제하는 시스템을 구축했다. 알파콘 네트워크 병원에서 결제할 수 있으며 내년에는 해외 병원까지 서비스 범위를 확장할 계획. 이같은 실생활에서의 암호화폐 사용 편의성을 인정받아 수상했다.올 초 시작된 알파콘 프로젝트는 이더리움 ERC20 기반으로 알파콘 토큰을 개발 및 발행했다. 암호화폐 공개(ICO)를 거쳐 최근 암호화폐 거래소 비트소닉·넥시빗 등에 상장했고 다음달 글로벌 거래소 아이닥스에도 상장할 예정이다.함시원 알파콘 네트워크 대표(사진)는 “여러 헬스케어 기반 블록체인 플랫폼기업들 가운데 상을 받아 영광”이라며 “앞으로도 블록체인 활용 헬스케어 산업 분야를 선도하는 차별화된 서비스를 제공하고 글로벌 생태계 확장을 위해 더욱 노력하겠다”고 소감을 전했다.김봉구 한경닷컴 기자 kbk9@hankyung.com기사제보 및 보도자료 open@hankyung.com[한경닷컴 바로가기] [모바일한경 구독신청] 한국경제 채널 구독하고, 선물 받자!! <이벤트 자세히 보기> ⓒ 한국경제 & hankyung.com, 무단전재 및 재배포 금지",105,https://n.news.naver.com/mnews/article/015/0004066072?sid=103
브라운더스트 캐릭터 ‘벤타나’ 코스프레 공개,2018.12.21. 오후 6:17,"네오위즈(대표 문지수)는 겜프스(대표 이준희)가 개발한 모바일 전략 RPG ‘브라운더스트’의 캐릭터 ‘벤타나’ 코스프레를 공개했다.벤타나는 도발 및 일점사가 걸린 적에게 강력한 딜링을 보여주는 5성 공격형 용병이다. 치명 확률이 올라갈 수록 공격력이 강력해지는 특성도 지녔다. 



 이번 코스프레 화보는 국내 코스프레 전문팀 ‘알지코스(RZ COS)’의 멤버 ‘솜버’가 참여했다. ‘솜버’는 흑발에 긴 마검을 휘두르며 강한 일격을 가하는 벤타나의 매력을 잘 살려냈다.한편 네오위즈는 브라운더스트의 ‘윈터페스타’ 시리즈 2탄인 ‘아이스 마블(ICE MARBLE)’ 이벤트를 오는 2019년 1월 17일까지 진행한다. 이벤트 말판에서 하루 3회 주사위를 굴려 이동하는 장소에 있는 다양한 아이템을 획득하는 내용이다. 완주 횟수에 따라 ‘전설 스킬 전수권’, ‘다이아’ 등도 제공된다. 



  



 [임영택기자 ytlim@mkinternet.com]▶매경 뉴스레터 '매콤달콤'을 지금 구독하세요▶뉴스 이상의 무궁무진한 프리미엄 읽을거리[ⓒ 매일경제 & mk.co.kr, 무단전재 및 재배포 금지]",105,https://n.news.naver.com/mnews/article/009/0004276194?sid=103
'KISA를 해킹하라' 대회 종료…28명에 2천555만원 포상,2018.12.19. 오후 5:22,"59명이 163건 발견, 유효 취약점 60건 상정[아이뉴스24 김국배 기자] 한국인터넷진흥원(KISA)은 19일 실제 운영하는 홈페이지를 대상으로 취약점을 찾는 '핵 더 키사(Hack the KISA)' 대회 포상 시상식을 개최했다.이번 대회에는 총 485명의 민간 보안 전문가가 참여했으며 이중 59명이 163건의 취약점을 발견해 신고했다. KISA는 유효한 보안 취약점 60건을 선정하고 28명에게 총 상금 2천555만 원을 포상했다.대회 시작 26분만에 최초 신고가 접수되는 등 참여자들 간 치열한 취약점 발굴 경쟁을 벌였다는 게 KISA 측 설명이다. 이날 시상식에서는 파급도·난이도 등에 따라 높은 평가를 받은 상위 우수 신고자 4명이 포상을 받았다. 최고액 포상금은 400만원이다.



김석환 KISA 원장은 ""개방형 보안취약점 찾기 대회는 일상적인 보안 활동에서 발견되지 않는 취약점을 찾을 수 있도록 보완하는 데 도움이 된다""며 ""사이버 침해사고 예방을 위해 민간 기업들이 스스로 보안 취약점을 조치하고 관리할 수 있는 모범 사례로 '핵 더 키사' 성과를 적극 알릴 것""이라고 말했다한편 이날 KISA는 '2018년도 신규 보안 취약점 신고 포상제' 상위 우수 신고자 3명에 대한 시상식도 함께 개최했다. 올해 KISA는 1천108건의 신고를 받았고 이중 581건에 대해 포상했다. 신고건수는 전년대비 36.7% 증가했다.김국배기자 vermeer@inews24.com▶네이버 채널에서 '아이뉴스24'를 구독해주세요.▶아이뉴스TV에서 부동산 고수를 만나보세요.[ⓒ 아이뉴스24 무단전재 및 재배포 금지]",105,https://n.news.naver.com/mnews/article/031/0000475978?sid=103
