title,date,main,section,url
국내 유통 공룡 넘어 글로벌 '리커머스' 왕좌 노리는 네이버,2023.01.15. 오후 3:02,"포시마크, 지난 13일 온라인 기자간담회 진행 ""네이버의 강력한 기술력으로 다음 단계로 도약""창립자 마니쉬 샨드라 ""네이버 검색 기술력 '포시 렌즈'에 적용""""패션 리커머스 글로벌 리더 될 것"" 포부도



지난 10일(미국 현지시간 9일) 진행된 포시마크 타운홀에서 직원들의 질문에 답변 중인 네이버 최수연 대표. 네이버 제공 포털을 넘어 유통 공룡으로 자리 잡은 네이버가 글로벌 '리커머스' 강자로의 도약을 준비하고 있다.네이버는 지난주 북미 최대 패션 C2C(개인 간 거래) 커뮤니티인 포시마크를 1조 6천억에 인수를 완료했다.유저 수 8천만 명. 미국인 4명 중 1명이 하루 25분 이상 사용하는 포시마크는 북미 최대 개인 간 거래(C2C) 플랫폼이다. 현재까지 2억 300만 개 이상의 아이템이 이 플랫폼에서 판매됐다.지난 13일 온라인으로 진행된 포시마크 기자간담회에서 포시마크 창립자인 마니쉬 샨드라(Manish Chandra)는 ""포시마크는 네이버와 함께 다음 단계의 도약을 준비하고 있다""고 말했다.그는 ""네이버의 강력한 기술력을 활용해 유저 경험을 강화시킬 수 있다고 생각한다""며 ""네이버의 플랫폼 그리고 커뮤니티 그리고 콘텐츠 같은 경우 역시 포시마크의 소셜 유저 경험을 증폭시키는 데 많은 기여를 할 것""이라고 강조했다.



네이버 경영진과 포시마크 경영진이 참석한 포시마크 사내 설명회. 네이버 제공특히 네이버의 기술력을 높이 샀다. 그는 ""포시 렌즈(Posh Lens)를 통해 비주얼 서치를 도입하게 되는데, 이는 네이버의 우수한 기술력을 기반으로 한다""며 ""포시 렌즈를 통해 유저들은 포시마크에서 비슷한 리스팅을 찾을 수 있을 것""이라고 설명했다.이어 ""네이버의 고도화된 기술력과 콘텐츠 기술을 기반으로 저희의 커머스 커뮤니티와 인게이지먼트를 확장시켜 가겠다""고 약속했다.그는 "" 이런 공유한 비전과 가치를 기반으로 정말 패션 리커머스에서의 글로벌 리더가 되겠다""는 포부를 나타냈다.앞서 네이버는 포시마크에 이어 '스페인 당근마켓'으로 불리는 왈라팝'에도 1550억을 투자해 최대주주 자리에 올랐다. 한국의 '크림'에 이어 북미와 유럽 시장 중고거래 플랫폼을 손에 넣은 네이버는 글로벌 시장에서 C2C 장악력을 높인다는 계획이다.네이버가 중고거래 시장 확장에 나선 이유는 시장 성장 가능성이 기존의 이커머스를 뛰어넘기 때문이다.하나금융경영연구소에 따르면, 글로벌 중고거래 시장 규모는 2021년 32조 원에서 2025년 91조 원으로 성장한다는 분석이다.네이버 최수연 대표는 현지시간 9일 샌프란시스코 레드우드시티에 있는 포시마크 오피스에서 열린 사내 설명회에서 ""포시마크가 그동안 쌓아온 고유의 브랜드 정체성을 유지하면서 네이버와 협업해 나간다면, 네이버의 기술·사업 시너지가 더해져 '원 팀'으로 빠르게 자리매김할 수 있을 것으로 기대된다""고 말했다.※CBS노컷뉴스는 여러분의 제보로 함께 세상을 바꿉니다. 각종 비리와 부당대우, 사건사고와 미담 등 모든 얘깃거리를 알려주세요.이메일 : jebo@cbs.co.kr카카오톡 : @노컷뉴스사이트 : https://url.kr/b71afn",105,https://n.news.naver.com/mnews/article/079/0003727569?sid=103
미국 포시마크 본사의 포시마크 로고,2023.01.15. 오후 3:10,(레드우드시티[미 캘리포니아주]=연합뉴스) 김태종 특파원 = 지난 12일(현지시간) 미국 캘리포니아주 레드우드시티의 포시마크 본사에 있는 포시마크 로고 모습. 2023.1.15    taejong75@yna.co.kr,105,https://n.news.naver.com/mnews/article/001/0013701231?sid=103
"김영식 ""KT 소비자 피해 구제 사례 압도적으로 많아""",2023.01.15. 오후 3:51,"한국소비자원 최근 3년간 현황대표 연임 앞두고 공개 저격



KT 전국 네트워크 장애가 발생한 지난 2021년 10월 인터넷 연결이 끊어진 모바일과 PC 화면. 연합뉴스KT가 통신 3사 중 가장 많은 소비자 불만을 야기했다는 지적이 나왔다.15일 국민의힘 김영식 의원은 한국소비자원의 최근 3년간 이동통신·IPTV·초고속인터넷 상품별 소비자 피해 구제 현황을 분석한 결과 KT가 모든 서비스 상품에서 소비자 피해 구제 신청 사례가 압도적으로 많았다고 밝혔다. 2020~2022년 KT는 이동통신(1136건 )·IPTV(23건)·초고속인터넷(336건) 등 총 1495건의 피해 구제 민원이 접수됐다. SK텔레콤·SK브로드밴드가 944건, LG유플러스가 889건으로 뒤를 이었다.한국소비자원 피해 구제는 사업자가 제공하는 물품 또는 용역을 사용하거나 이용하는 과정에서 발생하는 소비자 피해를 구제하기 위해 사실조사·전문가 자문 등을 거쳐 관련 법률 및 규정에 따라 양 당사자에게 공정하고 객관적으로 합의를 권고하는 제도다.일반적으로 소비자와 사업자 간 분쟁이 해결되지 않을 때 활용한다.김영식 의원은 ""스스로 국민 통신기업이라 칭하는 KT의 피해 구제 접수 실적이 이토록 높은 것은 KT가 국민과 소비자를 대하는 자세가 얼마나 좋지 못한지를 보여주는 대표적인 사례다""고 꼬집었다.김 의원은 또 ""KT는 탈통신 정책이 추진되는 동안 28㎓ 이동통신 주파수 할당 취소와 통신구 화재 및 다수의 통신 장애, 초고속인터넷 속도 논란 등 통신기업의 근간이 흔들리고 있다""며 ""눈앞의 대표 연임보다 근본적인 통신 서비스 경쟁력 확보와 소비자 만족도 제고에 힘써야 할 것""이라고 말했다.이와 관련해 KT 측은 ""2022년이 2021년에 비해 건수가 감소하는 등 고객 불편을 줄이기 위해 특단의 노력을 기울이고 있다""고 말했다.정길준 기자 kjkj@edaily.co.kr",105,https://n.news.naver.com/mnews/article/241/0003251920?sid=103
"LG전자 H&A부문장 “前 폰 개발자들, UP가전 탄생에 큰 몫”",2023.01.15. 오전 10:09,"류재철 LG전자 H&A부문장 사장 - 류재철 LG전자 H&A부문장 사장이 지난 9일(현지시간) 미국 테네시 생산법인에서 간담회를 진행하고 있다.류재철 LG전자 H&A부문장 사장은 “스마트폰 사업을 정리한 게 생활가전(H&A)에게 엄청난 기회로 돌아왔다”며 “그 덕분에 지금의 ‘UP가전’이 탄생할 수 있었다”고 말했다.류 사장은 지난 9일(현지시간) 미국 테네시 생산법인에서 진행된 간담회에서 “정리된 모바일 사업에 관련됐던 소프트웨어 인력 중 상당수를 생활가전으로 전환했다”며 이렇게 말했다. UP가전은 LG전자의 연결 플랫폼 ‘LG씽큐(ThinQ)’를 통해 가전의 부품을 교체하지 않고도 새로운 기능을 추가하거나 성능을 개선할 수 있게 만들어진 개인 맞춤형 업그레이드 제품군이다.최근 생활가전 분야에서도 스마트홈 구축을 위한 연결 플랫폼 등 소프트웨어 인력이 필요한 영역이 넓어지고 있다. 하지만 분야를 막론하고 부족한 게 소프트웨어 인력이다. LG전자는 조주완 최고경영자(CEO) 사장이 앞서 CES 2023에서 밝혔듯, 하드웨어 기술자를 재교육해 소프트웨어 인재로 육성하는 ‘리스킬링’ 등을 활용해 내부 인력을 적극적으로 활용하고 있다.“요즘 SW인재 구하기가 별 따기  LG, 모바일에서 인재 대거 영입  가전서 첫 수백명 SW 프로젝트  SW로 맞춤 업글 ‘UP가전’ 탄생”류 사장은 “모바일 사업을 정리하면서 숫자를 언급할 수는 없지만 상당히 많은 소프트웨어 인재를 지난해 확보할 수 있었다”며 “1년 전 공개한 UP가전을 자신있게 추진할 수 있었던 이유도 이들이 있었기 때문”이라고 말했다. 이어 “어딜 가도 소프트웨어 인력을 못 구하는 요즘인데, 가전 쪽에서 몇백명 단위로 소프트웨어 프로젝트를 진행하는 건 처음”이라며 “프로젝트를 몇 개씩 돌리며 미래를 위해 과감한 투자를 하고 있다”고 말했다.류 사장은 “UP가전은 의미 있는 성장을 거두며 가전 시장의 패러다임을 바꾸고 있다”며 “국내에서 인정 받은 UP가전의 가치를 글로벌로 확대 전개하고, 계속 진화시켜 세상에 없던 차별화된 고객경험을 제공할 것”이라고 밝혔다. 이어 “고객이 힘들고 귀찮은 가사에서 해방돼 가치 있고 즐거운 일에 시간과 에너지를 쓸 수 있도록 ‘삶의 여유를 제공하는 가전’을 만드는 것이 궁극적 목표”라며 “최고의 제품은 기본이고, 집안일을 보다 완결성 있게 해결하도록 돕는 다양한 서비스 연계 방안을 검토 중”이라고 말했다.LG전자는 현재 세탁기, 건조기, 냉장고, 식기세척기 등 총 24종의 UP가전을 출시했다. 업그레이드 콘텐츠는 120개 이상 배포했다. LG전자에 따르면 UP가전 출시 뒤, 고객이 LG씽큐 앱에 제품을 연동하는 등록률이 지난해 대비 2배 이상 증가했고 LG 씽큐 앱에 UP가전을 연동시킨 고객 가운데 절반이 업그레이드로 신기능을 제품에 추가했다.LG전자는 올해부터 UP가전의 해외 브랜드인 ‘씽큐 업(ThinQ UP)’을 앞세워 미국에도 UP가전을 출시한다. 글로벌 출시 국가는 순차적으로 확대할 계획이다.클락스빌 김민석 기자",105,https://n.news.naver.com/mnews/article/081/0003332409?sid=103
"""北 해킹조직, 포털 '다음' 위장한 피싱메일로 정보탈취 시도""",2023.01.15. 오후 5:24,"""北 해킹조직, 포털 사이트 '다음' 위장한 피싱 메일 유포""(CG)[연합뉴스TV 제공](서울=연합뉴스) 오규진 기자 = 북한 해커 조직 '김수키'가 카카오가 운영하는 포털사이트 '다음'을 위장한 피싱 메일로 이용자들의 비밀번호 탈취를 시도한 것으로 나타났다.    15일 정보기술(IT) 업계에 따르면 이스트시큐리티는 최근 이런 내용을 담은 악성코드 분석 리포트를 자사 블로그에 게시했다.    이번에 발견된 피싱 메일은 다음(daum)과 유사한 영문 표기 'daurn' 도메인을 이용했으며, 비밀번호 변경을 유도하는 본문과 하이퍼링크가 포함돼 있다.    하이퍼링크를 클릭하면 카카오 로그인 페이지를 위장한 피싱 사이트에 접속되며, 이곳에 입력한 정보는 고스란히 공격자 서버로 전송된다.    이스트시큐리티는 공격 배후에 북한 정찰총국 산하 해킹 조직 김수키가 있다고 밝혔다.    앞서 북한은 지난해 최소 세 차례에 걸쳐 외교안보·통일·국방 전문가 892명에게 피싱 메일을 보냈으며, '먹통 사태'가 있었던 지난해 10월에는 카카오 계정 관리 서비스로 위장해 탈북민 등의 아이디·비밀번호 탈취를 시도했다.    문종현 이스트시큐리티 시큐리티대응센터장은 ""해외나 국내 중소기업 서버가 아닌 국내 유명 대학들의 서버를 이용한다는 점이 이례적""이라면서 ""새해에도 북한의 사이버 공격이 잇따라 이뤄지고 있는 만큼 각별한 주의가 필요하다""고 말했다.    acdc@yna.co.kr



북한 해킹 조직 '김수키'가 보낸 피싱 메일[이스트시큐리티 블로그 캡처. 재판매 및 DB 금지]",105,https://n.news.naver.com/mnews/article/001/0013701494?sid=103
[DD 퇴근길] 제4이통은 '스타링크'?…기간통신사업자 등록,2023.01.13. 오후 5:09,"디지털데일리가 퇴근 즈음해서 읽을 수 있는 [DD퇴근길] 코너를 마련했습니다. 혹시 오늘 디지털데일리 기사를 놓치지는 않으셨나요? 퇴근 앞두고 저희가 요약 정리한 주요 기사를 가벼운 마음으로 읽어주시기 바랍니다. 전체 기사는 ‘디지털데일리 기사 하단의 관련뉴스(아웃링크)’에서 확인할 수 있습니다.   



  스페이스X가 위성통신서비스 ‘스타링크’의 한국 시장 진출을 앞두고 최근 설립예정법인 형태로 기간통신사업자 등록을 신청한 사실이 확인됐습니다. 기간통신사업자 등록절차가 완료되기까진 약 30일이 소요될 예정입니다. 이후 스페이스X는 별도 법인을 통해 국경 간 공급 승인 신청 절차를 거쳐, 국내에서 본격적으로 서비스를 개시하게 됩니다.    당장 현재로선 주파수는 할당받지 않을 가능성이 큽니다. 최근 과기정통부가 KT·LG유플러스로부터 회수한 5G 28㎓ 대역 주파수를 신규사업자에 할당하겠다고 밝힌 가운데, 일각에선 스페이스X가 그 신규사업자로 지목됐는데요.    다만 현재 국내에서 28㎓ 대역은 지상망에서 쓰이고 있는 만큼, 위성통신사업자인 스페이스X가 해당 대역을 할당받을 이유는 없습니다. 스페이스X가 지상망으로 서비스를 확대한다 해도 해외사업자에 대한 주파수 할당 절차가 까다로운 만큼 당장은 할당받지 않을 가능성이 크다는 게 업계의 중론입니다.    국내 시장에서 스페이스X의 경쟁력에 대한 전문가들의 의견은 엇갈립니다. 가장 큰 걸림돌은 가격입니다. 다만 위성 탑재체 부품들의 소형화, 생산라인의 자동화 등 비용적인 부분이 해결되면 기지국을 세우기 어려운 바다·산지 등 소외 지역이나 비행기 등에서 향후 스페이스X의 경쟁력이 커질 것으로 점쳐집니다



  LG유플러스 개인정보 유출, 피해자는 보상받을 수 있을까?   LG유플러스가 지난 10일 홈페이지를 통해 개인정보 유출 사실을 알렸습니다. <디지털데일리>가 3일 최초 보도한 뒤 1주일 만의 공표입니다. 피해자 규모를 18만명이라고 밝혔으나 실제 피해자 수는 더 많은 것으로 전망돼 국내외에서 많은 관심이 집중되고 있습니다. 광범위한 피해가 예상되는 만큼 개인정보 유출 피해자가 피해보상을 받을 수 있는가를 묻는 이들도 많습니다. 일각에서는 개인정보보호위원회(이하 개인정보위)에 분쟁조정 신청 및 소송을 준비하는 움직임도 나타나고 있는데요.    업계 관계자나 전문가들은 입을 모아 보상 규모나 금액 등에 대해 ‘아직은 판단하기 어렵다’고 말했습니다. 정확한 피해 규모나 원인이 드러나지 않았기 때문에 구체적인 예측이 불가능하다는 것입니다. 다만 과거 사례를 통해 대략적인 추산은 가능합니다. 2014년 KB국민카드, 농협카드, 롯데카드 등 카드3사에서 개인정보 1억건이 유출된 당시 소송인측은 50만원을 배상 요구했고, 최종적으로 10만원을 보상토록 판결났습니다.    2016년 인터파크 개인정보 2540만건 유출에서도 30만원을 배상 요구했는데 최종 확정된 것은 10만원입니다. 다만 이 금액의 경우 소송에 참여한 이들이 받았는데, 소송 개시부터 마무리까지 5년의 시간이 걸렸습니다. 유출 피해자 중 실제 보상을 받은 것은 0.1% 남짓이라는 점은 고민해볼 거리입니다. 앞으로 조사 결과 등을 지켜봐야 할 듯합니다.



  ""日 의존도 낮춰라""…LG엔솔, 배터리 협력사에 특명   LG에너지솔루션이 소재·부품 생태계 안정화 작업을 이어가고 있습니다. 특히 과거 일본 의존도가 높았던 품목에 대해 국내 협력사와 내재화를 추진하고 있는데요. 노력의 일환으로 배터리 장비회사들에 프로그래머블 로직 컨트롤러(PLC) 교체를 요구하고 있습니다. PLC는 반도체, 2차전지 등 제조설비를 움직이고 모니터링하는 데 사용되는 부품으로, 배터리 부문에서는 일본 미쓰비시 PLC가 90% 내외의 점유율을 차지하고 있죠. 지난해부터 일부 장비 제조사에 지멘스 PLC 사용을 권하고 있습니다.    또, 일본 쇼와덴코, DNP 등이 과반수를 차지하며 파우치 배터리 필름 분야에서도 협업을 통해 내재화를 이뤄 나가고 있습니다. 포스코케미칼과는 인조흑연 음극재 국산화를 달성하기도 했죠. 배터리 업계 관계자는 “권영수 부회장이 온 뒤로 LG에너지솔루션 공급망에서 여러 변화가 있었다. 이 과정에서 역할이 늘어난 협력사도 줄어든 협력사도 나타나는 분위기”라고 언급했습니다.



  KT도 '갤럭시S22 울트라' 공시지원금 ↑…최대 65만원   KT가 13일 갤럭시 S22 울트라 모델의 공시지원금을 기존 최대 50만원에서 65만원까지 높였습니다. 내달 1일 예정된 삼성전자의 갤럭시 S23 신제품 공개에 앞서 최근 SK텔레콤과 LG유플러스가 각각 62만원, 60만원까지 공시지원금을 올린데 이어 KT까지 가세하면서 본격적인 재고털이에 나선 것으로 분석됩니다.   이에 따라 출고가 145만2000원인 256GB 모델의 경우, 13만원대의 5G 초이스 프리미엄 요금제를 사용할 경우 공시지원금 65만원에 추가지원금(공시지원금의 15%) 9만7500원을 할인받아 총 70만4500원에 구매 가능합니다. 512GB 모델과 갤럭시Z 폴드4 512GB 모델에도 적용됩니다. 다만 고가요금제의 경우, 공시지원금(단말할인)보단 선택약정을 통한 요금할인이 조금 더 유리합니다.



  애플 팀 쿡 CEO, 연봉 40% 줄인다…한화 약 1288억원→606억원   팀 쿡 애플 최고경영자(CEO)가 올해 연봉을 전년대비 40% 삭감합니다. 이번 조치에 따라 지난해 한화로 1228억원에 달했던 연봉이 올해 606억원으로 줄어듭니다. 올해 쿡 CEO의 연봉은 4900만달러(약 606억원)로 결정됐는데요. 기본금 300만달러(약 37억원)에 보너스 600만달러(약 74억원), 주식 보상 4000만달러(약 494억원) 등입니다.    기본금과 보너스는 지난해와 같지만 주식 보상 비중이 기존 50%에서 75%로 상향 조정됐습니다. 서류에 따르면 쿡 CEO의 2022년 연봉은 총 9940만달러(약 1228억원)이었으며, 주식 보상 및 보너스만 8300만달러(약 1026억원) 수준이었습니다. 한편 애플의 연례 주주총회는 미국 시간으로 오는 3월10일 진행될 예정입니다.",105,https://n.news.naver.com/mnews/article/138/0002140739?sid=103
미중갈등으로 中 과학기술 연구 성과 향상?,2023.01.15. 오전 11:08,"중 과학자 귀국 행렬...글로벌 유수 연구논문 발표 잇달아미국 등 해외에서 유학을 받은 중국인 인재들이 자국으로의 귀국 행렬이 이어지고 있다. 이들은 고국으로 돌아가 잇달아 연구성과를 발표하기 시작한 것으로 알려졌다.사이언스는 중국 정부가 진행 중인 1천명의 젊은 해외 연구자 영입 프로그램(Young Thousand Talents)이 성과를 내기 시작했다는 연구를 최근 발표했다. 해당 프로그램은 중국이 지난 2008년부터 해외 과학자 및 기업인을 중국으로 유인하는 천인재능프로그램(Thousand Talents Programs)의 일환으로 진행돼 왔다.



사진=뉴시스YTT 프로그램을 통해 해외에서 중국으로 귀국하는 젊은 연구자들에게 높은 급여와 창업자금을 포함한 광범위한 연구 환경이 제공됐다. 2011년~2017년 기간 동안 3천명이 넘는 연구원들이 정부 보조금을 받았다.파격적인 정부 지원은 연구 성과로 되돌아왔다. 사이언스지가 해외에서 박사 학위를 취득한 후 중국 학계로 돌아온 약 300명을 대상으로 조사한 결과, 정부 보조금을 받은 연구자들은 해외 체류기간동안보다 귀국 후 더 많은 논문을 발표한 것으로 나타났다. 중국 귀국 후 7년 동안 YTT 장학생들은 미국에 머물렀던 연구원들과 비교해 한 분야에서 상위 10%에 속하는 저널을 포함해 27% 더 많은 논문을 발표했다.특히 고가의 연구 장비와 많은 연구원들이 필요한 생물학·의학·화학 분야에서의 연구 성과가 두드러진 것으로 확인됐다.이는 미·중간 갈등과도 무관치 않다. 지난 2018년 트럼프 행정부는 중국의 해외 우수인재 영입 프로그램을 미국의 기술과 지식재산을 탈취하려는 시도로 간주, FBI를 통해 조사에 들어가는 등 대중국 이니셔티브(China Initiative)를 시행했다.사이언스는 미중 갈등으로 인한 중국 귀국자 비율이 높아지면 단기적으로는 중국의 연구 발전에 도움이 될 것으로 전망했다.",105,https://n.news.naver.com/mnews/article/092/0002279682?sid=103
질문에 답하는 유국희 원자력안전위원장,2023.01.15. 오후 10:55,(서울=연합뉴스) 최재구 기자 = 유국희 원자력안전위원회 위원장이 서울 사무실에서 연합뉴스와 인터뷰 하며 질문에 답하고 있다. 2023.1.15    jjaeck9@yna.co.kr,105,https://n.news.naver.com/mnews/article/001/0013701844?sid=103
