title,date,main,section,url
원하면 어디서나 초고속인터넷 쓴다,2018.12.28. 오전 6:01,"보편적 역무 지정 입법예고[아이뉴스24 도민선 기자] 2020년부터 농어촌 지역을 비롯한 전국 어디서나 초고속인터넷을 이용할 수 있게 된다.과학기술정보통신부(장관 유영민)는 초고속인터넷을 보편적 역무로 지정하기 위하여 전기통신사업법 시행령 개정안을 마련하고, 내년 2월 8일까지 입법예고한다고 28일 발표했다.보편적 역무는 국민의 통신기본권 보장을 위해 전기통신사업자가 의무적으로 제공하도록 하는 기본적 통신서비스를 말한다. 현재 시내전화, 공중전화 등 음성서비스를 중심으로 규정돼 있다.초고속인터넷은 일상생활에 필수재로서 자리매김하고 있으나, 농어촌 지역과 외딴 건물 등에서는 통신사업자가 낮은 수익성을 이유로 초고속인터넷을 제공하지 않는 경우가 존재한다.



 이용자가 초고속인터넷을 신청해도 통신사업자가 수익성이 낮아 제공하지 못하는 건물은 80여만개로 추정되지만, 실제대상은 신청율 (BcN 사업 평균 30%)에 따라 상이하다.이에 따라 수익성이 낮아 신청을 해도 초고속인터넷을 제공받지 못했던 지역의 소비자에게 서비스를 이용할 수 있도록 한다.이를 통해 그동안 시장기능에 의해서는 초고속인터넷이 제공되지 못했던 곳에서 정보 격차가 해소되며, 4차산업혁명의 기반인 네트워크 인프라가 확산될 것으로 보인다. 미국, 스페인, 핀란드 등은 초고속인터넷을 보편적역무로 지정해 보급에 나서고 있다고 과기정통부는 설명했다.초고속 인터넷 보편적 역무 제도는 내년 중 고시 개정을 통해 제공 대상, 지정 속도, 제공 사업자 및 손실보전 방법 등 세부사항을 정하고 2020년에 시행될 예정이다.이와 함께 저소득층(기초생활보장자, 차상위계층, 기초연금수급자) 및 장애인 등이 요금을 감면받을 수 있는 이동통신 서비스의 범위에 5G 서비스를 포함한다.이번 전기통신사업법 시행령안에 대한 의견이 있는 기관, 단체 또는 개인은 내년 2월 8일까지 통합입법예고센터에서 의견을 제출할 수 있다.도민선기자 domingo@inews24.com▶네이버 채널에서 '아이뉴스24'를 구독해주세요.▶아이뉴스TV에서 부동산 고수를 만나보세요.[ⓒ 아이뉴스24 무단전재 및 재배포 금지]",105,https://n.news.naver.com/mnews/article/031/0000476714?sid=103
"화웨이, TSMC '7나노 EUV' 1호 고객 됐다",2018.12.28. 오전 10:08,"모바일 AP 양산 위탁…이르면 내년 1분기부터 양산(지디넷코리아=박영민 기자)중국 화웨이가 내년 양산을 앞둔 대만 TSMC 7나노미터(nm) 극자외선(EUV) 파운드리 공정의 첫 번째 고객사가 됐다. 올해 맺어진 양사의 '7나노 동맹'이 계속해서 이어지는 모양새다.28일 대만 차이나타임즈는 화웨이의 자회사 하이실리콘(HiSilicon)이 TSMC의 EUV 공정 노드 제조방식을 채택한 첫 업체가 됐다고 보도했다.TSMC는 향후 N7+(7FF+) 파운드리 공정을 통해 화웨이의 7나노 기반의 모바일 애플리케이션 프로세서(AP)를 수탁 생산한다.TSMC는 N7+ 또는 7FF+라 불리는 7나노 EUV 공정의 대량 양산을 이르면 내년 1분기부터 진행할 계획이라고 밝혔지만, 업계는 2분기가 돼서야 양산을 시작할 것으로 보고 있다.화웨이는 애플과 함께 TSMC의 주요 고객사 중 하나다. 올해 9월 공개된 업계 첫 7나노 기반 모바일 AP '기린 980'도 TSMC의 불화아르곤(ArF) 방식을 통한 7나노 공정으로 생산됐다.TSMC는 7나노 도입에 한발 앞선 덕분에 화웨이와 애플뿐 아니라 퀄컴·AMD·엔비디아·자일링스·미디어텍 등과도 협력 중이다.



(자료=지디넷코리아)7나노 공정과 관련, TSMC의 유일한 경쟁사로 평가받는 삼성전자는 TSMC보다 7나노 공정 진입은 한발 늦었지만, 올해 앞서 EUV 공정 개발을 마쳤다.삼성은 퀄컴의 5G 모뎀 칩인 '스냅드래곤 5100'과 IBM의 서버용 중앙처리장치(CPU)를 EUV 노드인 7나노 LPP(7LPP) 공정을 통해 수탁 생산키로 했다.반도체 업계 한 관계자는 ""TSMC가 EUV 공정 양산 단계에 진입하기 전까지 삼성이 앞으로 고객사를 얼마나 더 확보할지가 관건이 됐다""고 말했다.10나노 이하 미세공정의 필수 요소로 꼽히는 EUV는 반도체 원자재인 웨이퍼에 빛으로 회로를 그리는 포토 리소그래피(Photo Lithography) 기술이다.극자외선 파장의 광원을 사용해 웨이퍼에 미세한 회로를 새기는 방식으로, 불화아르곤(ArF) 방식보다 파장이 짧다는 게 장점이다.박영민 기자(pym@zdnet.co.kr)  ▶ 네이버 채널에서 ‘지디넷코리아’를 구독해주세요",105,https://n.news.naver.com/mnews/article/092/0002153380?sid=103
[기로에선카풀]③프랑스 사례로 본 카풀 문제 해결안,2018.12.28. 오후 3:50,"'블라블라카' 운행중 비용은 최소화, 영리추구목적↓특정 시간대 자가용 유상 운송 가능한 면허 제도 운영[이데일리 김유성 기자] 카풀 업계와 택시 업계 간 갈등을 줄이기 위한 타협 사례 중 하나로 프랑스 카풀 서비스와 면허 제도가 언급됐다. 프랑스에서는 카풀 서비스 ‘블라블라카(BlaBlaCar)’가 운영되고 있다. 더불어 제한적으로 자가용 유상운송을 허용하는 VTC 제도도 있다. 택시 업계와 자가용 유상운송 차이를 메우는 일종의 접점인 셈이다.  김도승 목포대 법학과 교수는 프랑스 카풀 사례로 봤을 때 한국의 카카오T카풀은 진정한 의미의 카풀 서비스가 아니라고 전했다. 출퇴근 시간과 서비스 운송 횟수에 제한이 있을 뿐 유상 운송과 다르지 않다는 게 그의 시각이다. 그는 VTC 제도처럼 일반인들의 자가용 유상 운송을 제도권으로 끌어들일 필요가 있다고도 전했다. 택시가 부족한 시간 제한적으로 유상운송할 수 있는 서비스가 VTC다. 



프랑스 3가지 차량 서비스 유형별 특징 (자료 : 김도승 목포대 법학과 교수)카풀 플랫폼 ‘블라블라카(BlaBlaCar)’는 2006년 스타트업으로 시작해 2017년 기준 5000만명 이상 가입회원을 보유한 기업이다. 26일 국회의원회관에서 열린 ‘공유경제 플랫폼 시대의 법제도 개선방안 국회토론회’에서 국내 카풀 문제를 해결하기 위한 참고사항 중 하나로 ‘블라블라카’가 언급됐다.블라블라카는 출퇴근 때만 허용되는 우리 카풀과 달리 시간 제한이 없다. 카카오T카풀처럼 횟수 제한이 있는 것은 아니다. 다만 차주와 동일한 시간과 목적지를 가진 사람과만 동승할 수 있다.  사용방법은 드라이버가 출발지와 도착지를 입력해 해당 코스를 등록한다. 승객이 이를 보고 골라서 탄다. 승객은 예약 요금과 부가가치세를 결제한다. 요금은 저렴한 수준이다. 운행에 필요한 비용 정도이기 때문이다. 지나가는 차주의 선의에 따라 차를 탈 수 있는 ‘히치하이크(hitchhike)’가 모바일로 옮겨온 것으로도 볼 수 있다.실제 파리에서 리옹까지 약 470km 거리에서 블라블라카를 이용할 때 동승자가 내는 요금은 46.5유로(약 5만9000원)였다. 



김도승 목포대 법학과 교수는 “드라이버가 승객을 골라 태우면 진정한 카풀이 될 수 있을까”라면서 “프랑스 카풀은 운행비를 분담하는 정도로 그친다”고 말했다. 그는 “요금이 택시비와 비슷하거나 싼 정도에서 (최근 우리나라의 카풀은) 택시의 유상운송을 대체하는 것으로도 볼 수 있다”고 진단했다. 그는 카카오T카풀 등 우리나라에서 하고 있는 카풀이 사실상 자가용 운송업에 해당되므로 드라이버에게는 일정한 법적 자격 기준을 요구해야한다고 언급했다. 이중 하나가 프랑스의 VTC 면허다. VTC 제도는 프랑스의 여러 교통 수단 중 하나다. VTC 면허를 취득한 직업 운전사는 자신의 차량으로 사용자에 운송 서비스를 제공한다. 이용자는 사전 예약을 통해서만 이용이 가능하다. 이에 따라 VTC 면허를 소지 않은 운전자가 동승자를 태우고 요금을 받으면 위법이다. 우버 운전자도 VTC면허를 소지해야 한다. 김 교수는 “우버도 완전 무규제 플랫폼은 아니다”고 말했다. 그는 “출퇴근 타이밍에 제한적인 카풀을 사용하지말고 제한적인 자가용 유상운송을 허용할 수 있는 허가제를 도입해야한다”고 주장했다. 일반 택시보다는 완화된 형태이지만 불특정 다수가 유상운송을 할 수 없게 정부에서 제한을 두자는 뜻이다. 김 교수는 “(카카오T카풀은) 카풀이라는 본래적인 의미와 동떨어져 있다”면서 “(새로운 시대에 맞춰) 일정한 규제 완화가 필요하다”고 말했다. 한편 업계에서는 법인 택시의 사납금 제도도 손봐야할 때라고 전하고 있다. 하루 운행에 따른 일정 비용을 내는 사납금 제도는 ICT 기술이 없던 시절 고안된 제도다. 법인 택시 운전기사 입장에서는 부담이 크다. 하지만 법인택시 사업주 입장에서는 택시 기사의 노동 근거를 파악하기 쉽지 않은 이유로 사납금 제도가 운영되고 있다. 최근 앱 미터기 기술과 위치기반 서비스가 상용화된 시점에서는 기사들의 운임 수익을 쉽게 파악할 수 있다. 업계 관계자는 “카풀로 택시 업계 불합리점이 발견되고 부각됐다”면서 “택시 기사 권익을 높일 수 있는 여러 기술 방안을 논의하고 바꿔나가야할 때”라고 말했다.김유성 (kys401@edaily.co.kr)네이버에서 이데일리 [구독하기▶]빡침해소! 청춘뉘우스~ [스냅타임▶]＜ⓒ종합 경제정보 미디어 이데일리 - 무단전재 & 재배포 금지＞",105,https://n.news.naver.com/mnews/article/018/0004281430?sid=103
"쿠웨이트 국립 은행, 리플넷 기반 국제 송금 상품 선봬",2018.12.28. 오후 2:41,"쿠웨이트 국립 은행이 리플(XRP)의 블록체인 플랫폼인 리플넷(RippleNet)을 활용한 국제 송금 상품을 출시했다고 27일(현지시간) 코인텔레그래프가 전했다. 중동 국가에서 블록체인 기반의 국제 송금 상품을 구현한 사례는 쿠웨이트 국립 은행이 최초로 꼽힌다.    쿠웨이트 국립 은행의 기술 담당 부사장인 디미트리오스 코코시우리스는 “수일씩 걸리던 국제 송금에 블록체인 기술을 접목, 수초 내로 24시간 내내 가능해졌다”면서 “요르단 등 인근 국가를 시작으로 점차 다른 나라로 서비스를 확장할 것”이라고 밝혔다.    1952년 설립된 쿠웨이트 국립 은행은 총자산 863억달러에 달하는 쿠웨이트 최대의 은행으로 알려졌다. 쿠웨이트 국립 은행 외에도 최근 말레이시아의 CIMB 그룹 홀딩스와 일본의 미쓰비시 UFJ 금융 그룹도 리플넷을 이용해 국제 송금 및 결제 시스템을 구축하겠다고 밝힌 바 있다.        chu@fnnews.com 추현우 기자   ▶ 세상의 모든 골 때리는 이야기 'fn파스'▶ 속보이는 연예뉴스 fn스타  ※ 저작권자 ⓒ 파이낸셜뉴스. 무단 전재-재배포 금지",105,https://n.news.naver.com/mnews/article/014/0004151437?sid=103
"온라인에서 뛰쳐나온 게임 ‘엘소드’, 내년에도 오프라인 접점 늘린다",2018.12.28. 오후 5:10,"방탈출 카페에서 레스토랑까지 이색 공간 선보여 ‘화제’ 



다양한 오프라인 공간으로 고객 접점을 늘렸던 ‘엘소드’가 내년에도 온라인과 오프라인을 잇는 이색 공간을 선보일 예정이다.<사진=지난 2월 선보인 ‘엘소드 방탈출 테마카페’ 포스터 이미지> 올해 다양한 오프라인 공간을 마련해 이용자와의 접점을 늘려왔던 넥슨의 인기게임 ‘엘소드’가 내년에도 다양한 이색 공간을 선보일 예정이다.28일 넥슨은 내년 중 ‘엘소드’ 정식 서비스 11주년을 맞아 다양한 이벤트와 함께 게임을 소재로 꾸며진 오프라인 공간을 꾸밀 예정이라고 밝혔다. 올해 온오프라인의 경계를 허문 이색 마케팅으로 화제를 모았던 전략을 이어나간다는 계획이다.넥슨은 올해 ‘엘소드’ 팬들을 위해 방탈출 테마카페, 엘소드카페, 엘소드레스토랑 등 오프라인에서도 ‘엘소드’를 만날 수 있는 다양한 공간을 선보였다.올해 1월 오픈한 ‘엘소드카페’가 첫 주자다. 넥슨은 몬스터브레드 홍대점과 제휴를 맺고 약 한달 간 ‘엘소드카페’를 운영했다. 엘소드 캐릭터의 얼굴을 생생하게 묘사한 ‘캐릭터 아트 라떼’를 비롯해 이용자들에게 친숙한 게임 속 펫 ‘뽀루’와 ‘헤지호그’를 활용해 만든 ‘쿠키’, 게임 아이템을 그대로 재현한 ‘엘리오스 스페셜 드링크’ 등 다양한 음식을 선보였다.특히 메뉴를 주문한 모든 고객에게 ‘3차 전직’ 공식 일러스트를 담은 ‘에어컵홀더’를 제공해 팬들의 관심을 모았다. ‘헤지호그’를 소재로 만든 ‘안마봉’, ‘동전지갑’, ‘펜 4종 세트’ 등 굿즈도 함께 선보여 호응을 얻었다.지난 2월에는 ‘코드케이 강남점’과 제휴를 맺고 ‘엘소드 방탈출 카페’를 열기도 했다. 게임에 등장하는 ‘얼어붙은 물의 신전’을 모티브로 내외관 디자인을 꾸며 게임 속에 들어온 듯한 분위기를 연출했다. 최대 여섯 명이 한 팀을 이뤄 팀워크와 추리력, 직관력 등을 동원해 문제를 풀어 탈출하는 형태로  엘소드 팬 뿐만 아니라 일반 고객들에게도 높은 인기를 끌었다.여름에도 ‘엘소드’의 오프라인 고객 접점 늘리기는 이어졌다. 수제버거 가게 ‘카퍼룸’과 제휴를 통해 지난 7월 23일부터 9월 21일까지 운영된 ‘엘소드 레스토랑’이 주인공이다. 



넥슨은 지난 1월에는 몬스터브레드 홍대점과 제휴를 맺고 약 한달간 ‘엘소드카페’도 운영했다.<사진=엘소드카페에서 판매한 전용 메뉴> 엘소드 캐릭터와 펫을 활용해 제작한 상품을 판매하고 엘소드 전용 메뉴를 주문한 고객에게 캐릭터 매트와 컵받침을 제공했다. 특히 엘소드 레스토랑에서 ‘2018 천생엘분’ 행사를 개최하고 여름 업데이트 내용 발표와 ‘엘리오스 시식회’, ‘길드 간담회’ 등의 현장 이벤트로 호응을 얻었다.최근에는 ‘엘소드’에 2년만에 등장하는 신규 캐릭터 ‘라비’를 업데이트하며 온라인에서도 이용자가 즐길거리를 늘리는데도 힘썼다.넥슨은 내년에도 오프라인 공간 개설은 물론 11주년을 기념하는 다양한 이벤트로 팬들의 만족도를 높여갈 예정이다.넥슨 퍼블리싱RPG실 염홍원 실장은 “2019년에도 엘소드를 소재로 한 이색 공간을 선보일 계획”이라며 “엘소드 정식 서비스 개시 11주년을 맞이해 준비한 다채로운 이벤트에 게임 팬들의 많은 참여를 부탁드린다”고 밝혔다.[임영택기자 ytlim@mkinternet.com]▶매경 뉴스레터 '매콤달콤'을 지금 구독하세요▶뉴스 이상의 무궁무진한 프리미엄 읽을거리[ⓒ 매일경제 & mk.co.kr, 무단전재 및 재배포 금지]",105,https://n.news.naver.com/mnews/article/009/0004279446?sid=103
[인사]KAIST,2018.12.28. 오후 2:13,◇KAIST △예산팀장 김돌비 △기획팀장 조성운 △경영전략팀장 정성훈 △입학전형팀장 김정현 △과학영재교육원 운영팀장 손승목 디지털타임스 홈페이지 바로가기 / 디지털타임스 뉴스 더보기네이버 채널에서 '디지털타임스'를 구독해주세요.,105,https://n.news.naver.com/mnews/article/029/0002500353?sid=103
"김학도 중기부 차관, 세밑 중소기업 현장 방문",2018.12.28. 오후 4:36,김학도 중소벤처기업부 차관(오른쪽 두번째)이 28일 경기 시흥에 위치한 현대·기아자동차 1차 협력사로 용접너트와 공구세트를 생산하는 기업인 프론텍(대표 민수홍)을 찾아 현장 애로사항을 청취하고 있다. 중기부 제공     디지털타임스 홈페이지 바로가기 / 디지털타임스 뉴스 더보기네이버 채널에서 '디지털타임스'를 구독해주세요.,105,https://n.news.naver.com/mnews/article/029/0002500394?sid=103
아이폰 공장 인도행 소식에 中서 고개 드는 '실업 공포',2018.12.28. 오전 11:03,"무역전쟁 여파 '중국 탈출 신호' 해석…中누리꾼 ""애플 안 써"" 격분



중국의 폭스콘 공장 입구[EPA=연합뉴스]    (상하이=연합뉴스) 차대운 특파원 = 미중 무역전쟁에 따른 악영향을 최소화하려고 애플이 최신형 아이폰을 인도에서 생산할 것이라는 보도가 나오자 중국에서는 이런 움직임이 현실화할 경우 대량 감원 사태로 이어질 수 있다는 우려가 커지고 있다.    이미 무역 전쟁의 불똥을 피하려고 중국과 외국 기업들이 생산 시설을 동남아시아 등 다른 곳으로 옮기는 현상이 나타나면서 중국에서 실업 우려가 커지던 상황이어서 아이폰 생산 시설 이전 계획이 사실로 확인되면 '실업 공포'를 자극할 가능성이 커 보인다.    로이터 통신은 27일(현지시간) 애플이 이르면 내년부터 최신형 아이폰을 인도에서 조립하기로 했다고 보도했다.    애플은 대만의 위탁생산업체 폭스콘을 통해 대부분의 아이폰 제품을 중국에서 생산한다.    인도의 현지 위탁생산업체를 통해서도 아이폰SE 등 일부 저가 모델이 만들어지지만, 아이폰XS 등 최신형 제품은 중국 내 폭스콘 공장에서만 출하된다.    폭스콘은 저임금 비숙련 노동자들을 대규모로 투입해 아이폰 등 애플 제품을 조립한다. 따라서 중국 내 생산 물량이 축소되면 대량 감원 사태로 이어질 수밖에 없는 구조다.    실제로 신형 아이폰 판매 부진의 여파로 애플이 지난달 발주량을 계획보다 축소하자 폭스콘 선전(深천<土+川>) 공장에서는 수천명의 노동자들이 공장을 떠난 것으로 보도된 바 있다.    무역 전쟁의 충격과 경기둔화 가속화 추세 속에서 중국에서는 실업 증가 우려가 이미 상당히 커진 상황이다.    11월 도시 실업률은 4.9%로 중국 정부는 아직 안정적인 상태를 유지하고 있다고 자평한다.    그러나 무역 전쟁으로 인한 해외 주문 감소, 기업들의 해외 생산기지 이전 등 여파로 수출 기업들이 밀집한 광둥성에서는 대량 감원 사태가 이미 현실이 되고 있다.    또 중국이 통계를 '관리'하고 있는 만큼 실제 실업자 증가는 이미 심각한 수준이라는 지적도 있다.    중국 농업농촌부는 이달 초 약 7천400만명의 농민공(農民工·농촌 출신 도시 노동자)들이 창업을 위해 귀향했다고 발표했지만 일각에서는 비숙련공들이 대규모로 일자리를 잃어 고향으로 돌아간 것이라는 분석도 나온다.    아울러 중국 정부는 이달 경영에 어려움이 있는 기업이 감원하지 않거나 감원 규모를 줄이면 실업보험료의 50%를 돌려주는 내용을 포함한 고용 대책을 발표했다. 이는 중국 정부 역시 현재의 고용 동향에 이상이 있다는 점을 사실상 인정한 것으로 풀이되기도 했다.    한편, 애플이 생산기지를 옮기기로 한다는 소식에 많은 중국 누리꾼들은 아이폰 '불매 의사'를 밝히는 등 격한 반응을 보였다.    아이폰은 미국 기업인 애플의 제품이지만 중국에서 만들어진다는 인식 덕분에 그간 미중 무역 전쟁 속에서도 직접적인 불매 운동 대상으로 부각되지는 않았다.    'Will'이라는 아이디를 쓰는 누리꾼은 ""오늘 아직도 아이폰을 쓰는 것은 중국에서 만들어졌기 때문이었다""며 ""아이폰이 더 중국에서 제조된 것이 아니라면 나는 그것을 버릴 것""이라고 말했다.    cha@yna.co.kr▶뭐 하고 놀까? #흥  ▶쇼미더뉴스! 오늘 많이 본 뉴스영상 ▶네이버 홈에서 [연합뉴스] 채널 구독하기",105,https://n.news.naver.com/mnews/article/001/0010549738?sid=103
"우본 ""한파·폭설로 일부지역 우편물 배달정지""",2018.12.28. 오후 5:13,"/사진=우정사업본부세밑 한파와 폭설로 인해 일부지역의 우편물 배달이 일시정지됐다.28일 과학기술정보통신부 우정사업본부에 따르면 이날 오전 11시 현재 전라·제주 일부지역으로 향하는 우편물이 배달되지 않았다. 전라지역의 경우 해남 해남북평, 영광, 함평, 나주, 장흥, 우수영, 진도, 사가, 영암우편집중국, 송지, 남악, 무안, 해제, 고창, 고창해리 등 15곳의 우체국에서 배달이 불가능한 상태며 제주지역은 제주우편집중국, 모슬포, 한림 등 3곳도 우편물 이동을 중단한 상태다. 이날 한파와 폭설로 인해 도로가 결빙되는 곳이 많아 우편물 배달에 어려움을 겪고 있는 상황이다. 중부지방과 일부 남부내륙에 한파특보가 발령됐고 충남·전라도 서해안은 대설특보가 발효돼 많은 적설량을 기록할 것으로 예상된다.우정사업본부 측은 “지역상황에 따라 배달이 재개될 경우 시한성 우편물을 자동차로 배달할 방침”이라며 “배달정지 우체국은 고객에게 안내문자를 발송해 혼선을 최소화 하겠다”고 밝혔다.채성오 기자 cso86@mt.co.kr<저작권자 ⓒ '성공을 꿈꾸는 사람들의 경제 뉴스' 머니S, 무단전재 및 재배포 금지>▶ 고수들의 재테크 비법 ▶ 박학다식 '이건희칼럼'",105,https://n.news.naver.com/mnews/article/417/0000366873?sid=103
