title,date,main,section,url
"이종호, 새정부 첫 과기장관으로…과학기술 5대 강국 전략 탄력받나",2022.05.04. 오후 3:05,"기사내용 요약세계적 반도체 석학으로 과학기술 발전 및 효율적 R&D 동력 확보망중립성·주파수 조정 등 ICT 현안 돌파할 정무 리더십이 숙제 



[서울=뉴시스] 전진환 기자 = 이종호 과학기술정보통신부 장관 후보자가 3일 서울 여의도 국회 과학기술정보방송통신위원회 전체회의실에서 열린 인사청문회에 출석해 자리하고 있다. (공동취재사진) 2022.05.03.  photo@newsis.com[서울=뉴시스] 이진영 기자 = 이종호 과학기술정보통신부 장관 후보자가 국회 인사 청문회 문턱을 넘었다. 오는 10일 출범하는 윤석열 새정부의 첫 내각에 무난히 입성하게 됐다. 새 정부가 '과학기술 5대 강국 도약'을 비전으로 제시한 가운데 세계적 반도체 석학으로서의 입지전적인 업적에 현장 경륜을 기반으로 연구개발(R&D) 혁신을 위한 실효성 있는 후속 정책들이 수립, 시행될 것이라는 기대가 높다. 반면 방송·통신, 플랫폼 정책 등 여러 이해관계가 얽힌 ICT(정보통신기술) 산업계 이슈를 제대로 풀어갈 정무 감각과 리더십 검증이 그의 숙제로 던져졌다.4일 정치권에 따르면 이종호 과기정통부 장관 후보자에 대한 국회 인사청문회가 전일 국회 과학기술정보방송통신위원회에서 진행됐으며, 관련 보고서가 같은 날 늦은 시각 채택됐다. 이 내정자는 새정부 출범과 더불어 정식 장관 임명장을 받을 예정이다. 코로나19로 인해 경제·사회 전반에 걸쳐 근본적인 변혁이 이뤄지고 있고, 글로벌 기술패권 경쟁이 나날이 격화됨에 따라 과기정통부 장관의 어깨에 드리워진 무게감이 어느 때보다 높다. '과학기술 중심국가' 국정철학 실현 탄력받을 듯 이 장관 내정자는 명실공히 세계적인 과학자다. 비메모리 반도체 분야의 표준 기술인 3차원 반도체 기술을 세계 최초로 개발했다. 현장에서 잔뼈가 굵은 이 장관 후보자가 과기정통부 장관으로 취임함에 따라 새정부의 '과학기술 5대 강국 도약' 목표에 큰 동력을 얻게 됐다. 실제 그는 전일 진행된 국회 인사 청문회장에서 ""초격차 기술 확보와 기초연구 강화를 양대 축으로 한국을 과학기술 강국으로 자리매김하게 하겠다""고 강조했다.  무엇보다 과학기술 경쟁력의 기반이라고 할 수 있는 연구개발(R&D) 분야에 대한 실효성 있는 정책들이 추진될 것으로 관측되고 있다. 특히 그는 민간이 주도하고 정부가 뒷받침하는 식으로 과학기술 시스템을 재설계한다는 구상이다. 또 경제는 물론 환경·보건·안전 등 국가의 다양한 현안을 해결하는 임무지향형·문제해결형 R&D와 산·학·연의 혁신주체가 활발히 협업하는 개방형 R&D를 통해 효율성을 높이겠다는 전략도 세웠다. 아울러 ▲글로벌 디지털 강국 ▲디지털 플랫폼 정부 실현 ▲2027년 세계 3위권내 인공지능 국가로의 도약 ▲2026년 세계 최초 6G(6세대 이동통신) 기술 시연 ▲반도체 초강대국 건설 ▲세계 7대 우주강국 등 새정부의 국정과제 달성을 위해 그가 어떤 색깔의 리더십을 펼칠지 이목이 쏠리고 있다.이종호 과기장관 내정자는 전일 ""기술패권 시대에 있어 국가 생존에 필수적인 반도체·인공지능·우주·바이오 등의 핵심기술 확보를 위해 전략적 투자를 강화하는 한편, 본격적인 대한민국 우주시대도 열어가겠다""라고 포부를 제시했다.



[서울=뉴시스] 김선웅 기자 = 이종호 과학기술정보통신부 장관 후보자가 3일 서울 여의도 국회에서 열린 인사청문회에서 의원들의 질의에 답하고 있다. (공동취재사진) 2022.05.03. photo@newsis.com ICT 현안 이슈 대외협상·정무 리더십이 숙제반면 방송통신, 플랫폼 등 ICT 산업분야에서의 경륜과 경험이 그의 약점이다.더군다나 망 사용료, 5G 주파수, 중간요금제, 플랫폼법 등 ICT 분야는 방송·통신사, 콘텐츠, 플랫폼 정책은 이해당사간 대립이 첨예한 사안들이 산적돼 있다. 특히 OTT(온라인동영상서비스)나 플랫폼, 정보보호 관련 정책의 경우 자칫 통상마찰로까지 이어질 수 있는 민감한 현안이다. 고도의 정무감각과 협상조정력 등이 요구되는 이유다. 주로 학교와 연구라는 울타리에서 지내온 그가 이런 얽히고 설킨 문제들을 잘 풀어낼 수 있을 지에 대해서는 안팎에서 불안한 시선을 보내고 있다. 실제 전날 진행된 인사청문회에서 이 내정자는 이들 현안 질의에 원론적인 답변이나 유보적인 입장을 표명하는데 그쳤다. 이 내정자는 과기부에 부여된 임무에 대해 ""민관의 역량을 총결집해 우리 과학기술·ICT를 다시금 혁신하고, 이를 통해 기술패권 경쟁과 디지털 대전환에 선도적으로 대응함으로써 국가의 경쟁력을 강화하고 국민들의 삶의 질을 높여가는 것""이라고 설명했다. 또 ""과학기술과 정보통신 분야를 뛰어넘어 우리 사회 전반에 혁신의 물결이 일어나는 데 최선을 다하겠다""고 다짐했다. 새정부 첫 과기장관으로서 과학기술과 ICT에 대한 향후 5년의 초석을 잘 세울 수 있을지 조명이 집중된다.",105,https://n.news.naver.com/mnews/article/003/0011165051?sid=103
"LG전자, 한화호텔앤드리조트와 '클로이 로봇 공급' 협약 체결",2022.05.04. 오전 10:01,"맞춤형 로봇으로 호텔 서비스 디지털 전환 가속도LG전자가 한화호텔앤드리조트와 맞춤형 로봇 솔루션 업무협약을 체결하고 호텔 서비스의 디지털 전환(DX)에 속도를 낸다.LG전자는 3일 서울 여의도 한화생명빌딩에서 호텔 서비스 디지털 전환을 위한 기술 교류 및 LG전자 로봇 공급을 위한 업무협약을 체결했다. 이 날 협약식에는 한화호텔앤드리조트 김형조 대표이사, LG전자 장익환 BS사업본부장 등이 참석했다.



LG전자가 3일 한화호텔앤드리조트와 호텔 서비스  디지털 전환 고도화 기술 교류 및 LG전자 로봇 솔루션 공급 업무협약(MOU)을 체결했다. 왼쪽부터 LG전자 장익환 BS사업본부장, 한화호텔앤드리조트 김형조 대표이사.(사진=LG전자)LG전자는 한화리조트 동부산점을 시작으로 해운대, 용인, 제주 소재 호텔 및 리조트 지점 등에 LG 클로이(CLOi) 로봇을 공급할 계획이다.앞서 LG전자는 강원도 속초에 있는 한화리조트 설악 쏘라노에 'LG 클로이 서브봇'과 '가이드봇'을 각각 공급한 바 있다. 로봇은 호텔 안내를 비롯해 주변 관광지와 쇼핑 정보 제공, 다국어 통역 등 다양한 컨시어지 서비스부터 비대면 배송 서비스 등에 활용됐다.김형조 한화호텔앤드리조트 대표이사는 ""코로나19를 겪으면서 서비스 로봇은 우리 일상과 함께 하는 중""이라며 ""당사가 전국에서 운영 중인 호텔과 리조트의 빅데이터를 기반으로 고객 편의성 향상에 힘쓰겠다""고 말했다.장익환 LG전자 BS사업본부장은 ""이번 협업을 통해 보다 많은 고객이 다양한 공간에 최적화된 LG전자의 맞춤형 로봇 솔루션을 경험하기를 기대한다""라고 말했다.LG전자는 지난 2017년 인천공항에서 ▲LG 클로이 가이드봇 운영을 시작으로 ▲서브봇 2종 ▲셰프봇 ▲바리스타봇 등을 지속 선보인 데 이어, 최근 비대면 방역에 최적화된 LG 클로이 UV-C 봇을 출시하며 총 6종의 다양한 공간에 최적화된 LG 클로이 로",105,https://n.news.naver.com/mnews/article/092/0002255850?sid=103
“홈게이트웨이 누락 배경에 과기부”…아파트 전수조사 결의안,2022.05.04. 오후 11:52,"[앵커] 방문객을 확인하는  아파트 월패드를 통해  내 일상이 촬영될 수 있고, 이런 해킹의 핵심에는  '홈게이트웨이'라는 법적 필수 장비가 설치돼 있지 않기 때문이라는 보도,  저희가 계속 해드렸는데요. 많은 아파트에 홈게이트웨이가 설치되지 않은 데에는 정부 부처도 책임이 있다는 지적이 나오고 있습니다. 김민아 기자가 보도합니다. [리포트] 2년 전 국민신문고에 올라온 글입니다. 대부분 아파트 현장에  홈게이트웨이 내장형 월패드가 시공되고 있는데  'KC인증'을 받은 경우 기술 기준을  만족할 수 있는 지를 묻고 있습니다. 담당 부처인  과학기술정보통신부는,  'KC인증'을 받으면 관련 조항을 충족한다고 답했습니다. 하지만 정작 KC인증 기관인 국립전파연구원은 전자파 위해성에 대한 인증일 뿐, 해킹 방지 기능이 있는  홈게이트웨이가 있는 지 여부를  확인하는 것은 아니라고 밝혔습니다.[남우기/한국기술사회 부회장 : ""과기부에서 잘못 해석한 것 같아요. KC인증은 전자파 적합성 검토니까...이름이 홈네트워크라 붙어있다 하더라도 홈네트워크의 기술기준을 인증해준 게 아니고.""] 하지만 과기부의 답변 이후  월패드 제조사들은  KC인증만 받은 채 홈게이트웨이 내장형이라는 이름으로  월패드를 건설사에 다량 납품했습니다. 이에 대해 과기부는 당시 답변은 홈게이트웨이 존재와 관련 없이  해당 기기가 KC인증의 대상에 해당한다는 취지의 설명이라고 밝혔습니다.[최성준/과기부 네트워크정책과장 : ""'KC인증을 받으면 1항에 충족됩니까'라고 (국민신문고에서)물었고 'KC인증을 받으면 충족됩니다'라고 답변한 겁니다. 상호호환성 확보를 위해 KS(홈게이트웨이 기술 표준)적용이 필요하고...""] 하지만 정부의 잘못된 해석이  해킹 방지 기능이 없는 월패드가 많은 아파트에 시공된 계기 중 하나라는 비판이 제기되고 있습니다. [김정호/더불어민주당 의원 : ""이래도 되고 저래도 된다고 집행기관이 임의로 해석을 하게 되니까 엉터리로 해서 지금 (제조사나 건설사가) 법령을 위반하고 피해 나가고 있는데.""] 이런 가운데 10여 명의 국회의원이  전국 아파트를 대상으로  홈게이트웨이 등 지능형 홈네트워크 필수 장비에 대한  전수조사를 촉구하는  결의안을 내놨습니다. KBS 뉴스 김민아입니다.촬영기자:이상훈 이중우/영상편집:최찬종/그래픽:서수민",105,https://n.news.naver.com/mnews/article/056/0011260836?sid=103
"스마일게이트 테일즈런너, 리그 레볼루션 v1 돌입",2022.05.04. 오후 3:51,"신규 리그 시스템 선보여스마일게이트 메가포트(대표 장인아)는 인기 온라인 레이싱 게임 ‘테일즈런너’(개발사 라온엔터테인먼트)에 신규 캐주얼 경쟁 리그 시스템인 ‘리그 레볼루션 v1(이하 리그 v1)’을 시작한다고 4일 밝혔다.리그 v1은 내달 1차 점검 전까지 진행되는 신규 리그 시스템으로 기존 리그와 달리 캐릭터와 능력치 간의 밸런스를 최적화 함으로써 유저들의 컨트롤 능력에 따른 공정한 승부에 보다 초점이 맞춰져 있다. 밸런스를 맞추기 위한 방안을 새로 ‘스탯 시스템’을 도입했다.이번 업데이트로 적용된 스탯 시스템은 모든 유저가 동일한 스탯 포인트를 가지고 최고속도, 가속도, 힘, 컨트롤 등 총 4개의 능력치에 본인이 원하는 만큼 스탯을 투자해 본인만의 리그 세팅을 맞추는 시스템이다.



스마일게이트 메가포트, 테일즈런너 리그 레볼루션 v1.또한 리그 v1은 메이저리그와 마이너리그 등 2개의 별도 리그 시스템으로 운영 된다. 메이저리그는 실력 경쟁이 주 목적으로 티어간의 승급과 강등이 있는 반면, 마이너리그는 강등 없이 꾸준한 플레이로 점수와 재화를 획득할 수 있다. 리그에 참여한 이용자들은 플레이 시 획득하는 업적 포인트로 총 50단계의 업적 보상을 획득할 수 있다. 보상으로는 신규 아이템 리그 레볼루션 상자, 레볼루션 코인, 흑화 설향 교환권 등이 준비돼 있다.이번 업데이트로 ‘런너 행복 증진’ 개선 내용이 업데이트 됐다. 이용자들이 원했던 캐릭터 모델링 개선으로 ‘마키’ 캐릭터의 머리 사이즈가 조정됐다. 캐릭터들의 모델링 개선도 순차적으로 적용될 예정이다. 또한 ‘감정의 제도’ 캐릭터인 시오넬의 포즈 5종도 수정 됐고, ‘닥터헬 연구소’ 맵의 슬라임의 이동 속도가 무작위로 바뀌어 보다 도전적인 플레이를 할 수 있게 됐다.끝으로 신규 아이템으로 리그 v1을 기념한 리그 레볼루션 상자, 레볼루션 지렁이, 리그 레볼루션 패키지 등 신규 아이템을 얻을 수 있는 상품이 추가 됐고, 상점 내 스토리 캐릭터인 카인의 전용 복장 ‘눈꽃’ 7종 세트를 얻을 수 있는 카인 눈꽃 패키지가 추가됐다.스마일게이트 메가포트의 김유진 팀장은 “이번 업데이트는 유저들이 많은 관심을 두고 있었던 리그 개편에 대한 것으로 보다 런너들의 참여도를 더한 리그로 개편하기 위한 출발점”이라며 “런너들의 플레이 성향과 결과를 지속적으로 살펴 보며 더 나은 리그가 될 수 있도록 최선을 다할 것”이라고 전했다.라온엔터테인먼트 이재준 PD는 “테일즈런너는 달리기 게임으로 이번 리그 개편은 달리기 본연의 재미에 보다 초점을 맞추고 진행 했다”라며 “앞으로도 런너 여러분들이 테일즈런너에서 더 많은 추억을 남길 수 있도록 더 나은 콘텐츠 개발에 역량을 집중하겠다”고 덧붙였다.",105,https://n.news.naver.com/mnews/article/092/0002255896?sid=103
[포토]ICT체험관 '티움' 오프라인 투어,2022.05.04. 오전 11:46,[이데일리 이영훈 기자] SK텔레콤이 일상 회복을 맞아 ICT체험관 '티움(T.um)'의 오프라인 투어 프로그램을 재개한 4일 오전 서울 을지로 SK텔레콤빌딩에서 우이초 축구부 선수들이 '티움'의 투어 프로그램을 체험하고 있다.,105,https://n.news.naver.com/mnews/article/018/0005207616?sid=103
"“200만원→110만원, 이게 웬일이냐” 삼성 ‘반값’ 유혹",2022.05.04. 오후 7:51,"갤럭시Z폴드3 광고 영상의 한 장면 [삼성전자 유튜브 캡처][헤럴드경제=박혜림 기자] “이게 웬일이냐…200만원→110만원 초고가 삼성 접는폰 ‘반값’ 유혹”삼성전자의 초고가 폴더블(접는) 스마트폰 갤럭시Z폴드3의 공시지원금이 대폭 확대됐다. 출시 1년도 안돼 사실상 ‘반값폰’이 됐다. 오는 8월 신형 갤럭시Z폴드 출시를 앞두고 일찌감치 재고 소진에 나선 모양새다.SK텔레콤은 3일 갤럭시Z폴드3 공시지원금을 기존 62만5000원(12만5000원 요금제 기준)에서 72만5000원으로 10만원 가량 상향 조정했다.이에 따라 SK텔레콤향 갤럭시Z폴드3의 실구매가도 116만4950원으로 크게 낮아졌다. 공시지원금 72만5000원에 추가지원금 15%를 제외한 금액이다. 당초 갤럭시Z폴드3의 최대 공시지원금액은 61만7000원(LG유플러스 13만원 요금제)이었다.



삼성전자 갤럭시Z폴드3.이날 SK텔레콤은 갤럭시Z폴드3 외에도 갤럭시Z플립3, 갤럭시Z플립 5G 등에 대한 공시지원금도 높였다. 갤럭시Z플립3 공시지원금은 기존 50만원에서 60만원으로 10만원 상향됐고, 갤럭시Z플립 5G는 출고가가 10만원 가량 낮아졌다. 앞서 KT도 지난달 29일 갤럭시Z폴드2에 대한 공시지원금을 기존 대비 17만원 더 높인 바 있다.업계에서는 통신사의 이같은 조치가 재고 소진의 일환이라고 보고 있다. 8월로 예정된 삼성전자 신형 폴더블폰 출시를 앞두고 구형 제품을 털어내려는 목적이라는 것이다.한편 삼성전자는 8월께 하반기 언팩을 열고 갤럭시Z폴드4와 갤럭시Z플립4를 공개한다. 업계 및 IT팁스터(정보유출가) 등에 따르면 갤럭시Z폴드4는 전작인 갤럭시Z폴드3와 크게 다르지 않은 외관 디자인을 채택한 것으로 알려졌다. S펜을 보관할 수 있는 슬롯도 포함되지 않는다.



갤폴드3 모습.[삼성전자]대신 전작보다 두께와 무게는 줄어들고, 힌지 구조는 개선된다. 갤럭시Z폴드 시리즈의 고질적인 문제로 거론됐던 디스플레이 힌지 부분 주름이 더욱 옅어질 전망이다.또 두께가 얇아짐에도 배터리 용량은 전작과 동일할 것으로 보이며 가격은 소폭 인하될 가능성이 제기된다.",105,https://n.news.naver.com/mnews/article/016/0001987018?sid=103
"SKT ‘젬’, 가정의 달 선물 쏜다…워커힐·에버랜드 등 푸짐",2022.05.04. 오전 8:35,"SKT 제공[이데일리 노재웅 기자] SK텔레콤은 가정의 달을 맞아 젬(ZEM) 서비스에서 경품 프로모션을 진행한다고 4일 밝혔다.SKT는 오는 5월31일까지 새로운 ZEM에서 가장 기대되는 기능을 고르는 ‘우리 아이 꿀잼 선물 A to ZEM’ 프로모션을 진행한다.이번 프로모션에 참여한 고객에게는 추첨을 통해 △워커힐 호텔 1박 이용권(3명) △가족사진 촬영권(10명) △에버랜드 이용권 4매(50명) △아웃백 식사권(100명) △파리바게뜨 이용권(1000명) 등 경품을 제공한다.참여 가능 대상은 프로모션 기간 내 ZEM 앱에서 자녀 신규 등록을 완료한 고객이다. 해당 고객은 ZEM 앱 내 이벤트 배너를 클릭해 참여 가능하다. 이와 함께 SKT는 ZEM 서비스를 이용 중인 부모와 자녀 양쪽의 의견을 반영해 △습관 만들기 △약속모드 세분화 △앱 사용 리포트 제공 등 ZEM 서비스를 한층 고도화해 5월 중 선보일 방침이다.습관 만들기 기능은 자녀가 스마트폰을 넘어 일상에서 올바른 생활 습관을 자기 주도적으로 형성할 수 있도록 돕는다.예를 들어 ‘매일 30분 줄넘기’ ‘TV 보기 전에 숙제 끝내기’ 등 자녀가 스스로 습관을 기간, 요일별로 설정할 수 있다. 부모는 자녀와 함께 약속한 습관 목표를 완료하면 미리 설정해 놓은 칭찬 이모티콘 등으로 응원과 격려의 피드백을 전할 수 있다.또 개편된 ZEM은 기존 서비스의 사용모드를 약속모드, 집중모드, 자유모드 등으로 세분화해 제공한다. 약속모드의 경우 자녀와 부모가 어떤 앱을 몇 시간이나 사용할지 미리 상의해서 이용 시간을 설정할 수 있다.김지형 SKT 통합마케팅전략담당은 “가정의 달과 어린이날을 기념해 부모와 아이들이 더욱 활발히 소통하는 계기가 될 수 있도록 이번 ZEM서비스 개편과 프로모션을 준비했다”며 “SKT는 앞으로도 아이의 스마트폰 과몰입 방지를 위한 서비스를 지속적으로 고도화하며 사회적 가치를 높이는 ESG 활동에 앞장설 것”이라고 밝혔다.",105,https://n.news.naver.com/mnews/article/018/0005207323?sid=103
