title,date,main,section,url
"넷플릭스 ""SKB 필요로 망 증설한 것, 우린 부당이득 아냐""",2021.12.24. 오후 5:37,"망사용료 공방 2차전서 SKB 반소 입장 밝혀…""기존 계약·법률상 근거 없어""망사용료 납부를 둘러싼 SK브로드밴드와 넷플릭스의 2심 공판이 ‘부당이익반환’에 초점이 맞춰지면서 넷플릭스도 이에 적극 방어하고 나섰다.넷플릭스 측 법률대리인인 김앤장법률사무소는 지난 23일 2심 변론준비기일에 앞서 이달 초 재판부에 항소이유서와 함께 반소청구에 대한 답변서를 제출하고 부당이익반환의 부당성에 대해 집중적으로 피력한 것으로 알려졌다.지난 6월 1심 판결에서는 법원이 넷플릭스가 요청한 망사용료 채무부존재 확인을 기각하면서, 이를 바탕으로 SK브로드밴드는 2심에서 부당이익반환에 대한 판단을 요구하는 것으로 논의의 폭을 좁혔다.넷플릭스 항소에 SK브로드밴드는 즉각 부당이익반환을 위한 반소를 제기했고, 내년 3월 2심 1차 변론 돌입에 따라 구체적인 부당이득 액수 감정에 돌입한 상태다.



반소에 대한 넷플릭스 측 주장을 요약하면, ‘기존 계약과 법률상 망이용 대가 지급을 요구할 근거가 없고’, ‘부당이득 자체가 성립하지 않는다’는 것이다.넷플릭스 측은 자신들의 채무부존재확인 청구를 기각한 1심조차 ‘피고의 부당이득반환 채권은 성립하지 않는다’고 판시했던 점과 더불어 법리와 사실 관계를 고려할 때 부당이득은 전혀 성립되지 않는다는 입장이다.부당이익이 성립하려면 기존 계약이나 법률상 근거해야 하는데, 그간 SK브로드밴드는 그에 따른 것이 아닌 ‘콘텐츠 전송은 당연히 유상’이라는 전제를 만들어 논리를 폈고 자신들에게 어떤 법률상 권리가 있는지도 밝히지 못했다는 것이다.넷플릭스는 그간 SK브로드밴드가 과거 망 유지와 관리, 증설에 투자해놓고 그에 대한 비용적인 책임을 망이용대가로 요구하는 것은 타당하지 않다고 주장해왔다. 즉, 기존 SK브로드밴드와 넷플릭스 간 합의를 뒤엎는 요구라는 것이다.넷플릭스는 합의 이행에 충실했다는 입장이다. SK브로드밴드가 일본 도쿄, 홍콩에 위치한 넷플릭스 자체 콘텐츠전송네트워크(CDN)인 오픈커넥트(OCA)까지 콘텐츠 데이터를 받기로 합의했고, 해당 국가에서 국내 구간에 전용회선도 자신들이 원활한 데이터 전송을 위해 필요에 의해 설치했으며 이 또한 합의에 해당한다는 것이다. ISP간 무정산 합의가 없었더라도 넷플릭스가 부당이득을 얻은 것은 아니라는 입장이다.넷플릭스는 부당이익반환에 대한 부당성 주장뿐 아니라 항소를 제기한만큼 다시 한번 망사용료라는 채무가 없음을 확인받겠다는 계획이다. 2심에서는 오픈커넥트의 역할을 중심으로 논리를 펼 것으로 보인다.지난 23일 SK브로드밴드 측 법률대리인인 법무법인 세종의 강신섭 변호사는 서울 서초구 서울고등법원에서 변론준비기일 후 기자들을 만나 “지난 1심 판결에서 가장 아쉬운 부분이 부당이득 반환 청구권이 성립되지 않았다는 부분이었다”며 “그래서 우리가 반소했던 것이고, 이번 항소심에서도 바로 잡을 수 있는 상황이라 생각한다”고 말했다.이어 ""부당이득 액수 감정은 다음 기일에 할 것""이라며 ""감정에 대한 기간 산정도 다음 기일 정도에 얘기되지 않을까 한다""고 덧붙였다.",105,https://n.news.naver.com/mnews/article/092/0002243204?sid=103
"안랩, 사회적 가치실현 활동으로 다양한 분야에서 수상 잇따라",2021.12.24. 오전 11:25,"강석균 안랩 대표가 제 7회 중견기업의 날 기념식에서 김부겸 국무총리로부터 산업포장을 받고 있다.안랩이 정보보호, 고용, 교육 등 다양한 영역에서 사회적 가치실현 활동을 펼친 공로를 인정받아 관련분야 상을 잇따라 수상하고 있다.안랩은 지난달 17일, 비대면 업무환경에 필요한 보안솔루션을 적시에 제공해 디지털 전환 생태계 조성에 기여한 공로로 '중견기업인의 날(산업통상자원부 및 한국중견기업연합회가 주최)' 행사에서 '산업포장'을 수상했다. 이어 지난 2일, IT 산업 생태계 조성을 위한 산학연 활동 등 국내 정보보호산업 발전에 기여한 공로를 인정받아 '정보보호산업인의 밤(과학기술정보통신부 주최)'에서 '정보보호 산업발전 유공 장관 표창'을 받았다.고용 분야에선 무기계약직(별정직) 근로자를 정규직으로 전환하고 처우를 개선한 성과로 지난 9일 노사발전재단으로부터 '2021년 차별없는 일터 우수사업장 우수상'을 수상했다. 안랩은 2020년 비정규직 차별 진단에서 '차별없는 사업장' 결과를 받은 이후에도 자체적으로 회사 내 고용형태에 따른 차별을 해소하기 위해 무기계약직 근로자를 정규직으로 전환했다. 또, 기존 무기계약직에 적용되던 승진 상한을 해제했다.교육 분야에선 성남시 청소년 진로 체험 사업에 참여해 중고등학생을 대상으로 IT정보보안 분야 진로 교육을 적극적으로 수행해 지난 15일 성남시로부터 표창을 수상했다.안랩은 지난 9월과 11월 온라인으로 진행한 성남형교육 '청바지프로젝트(*)'에서 성남시 7개 중학교 1학년 학생 1247명에게 정보보안 분야 직무 소개, 랜선(비대면) 사옥 투어, 실시간 Q&A 등의 프로그램을 제공한 바 있다.강석균 안랩 대표는 “안랩은 창업이래 '끊임없는 연구개발로 함께 살아가는 사회에 기여한다'라는 미션을 바탕으로 사회적 책임을 다하고자 노력해왔다”며 “앞으로도 안랩만의 '업(業)의 개념'과 비전이 녹아있는 사회적 가치 실현 활동으로 중견 기업 ESG경영의 모범 사례가 될 수 있도록 노력 하겠다“고 말했다.안랩은 12월 기존 사회가치실현팀 인력에 ESG 전담인원을 충원해 확대 개편한 ESG 전담조직 '지속가능경영팀'을 신설하며 ESG경영을 본격화했다. 또한 ESG경영 내재화 차원으로 사내 임직원 대상 '환경', '인권', '반부패', '중대재해법' 교육을 시행하고 사내 ESG교육 프로그램을 매달 한 차례로 정례화 했다. 이밖에도 사내 카페에 '다회용컵'을 도입해 사내 친환경 문화 확산에 나서는 등 ESG 경영 활동을 활발히 펼치고 있다.",105,https://n.news.naver.com/mnews/article/030/0002989849?sid=103
"美 컬럼비아 의대 연구팀 ""부스터샷, 오미크론 방어 역부족""",2021.12.25. 오후 5:41,"2차 접종까지 마친 사람도 오미크론 중화하는 항체 효능 매우 낮은 것으로 확인신종 코로나바이러스 감염증(코로나19) 새 변이 오미크론이 주요 백신 부스터샷(추가접종)으로도 침투를 막기엔 불충분하다는 연구 결과가 나왔다.미국 컬럼비아대 의대 데이비드 호 의학 교수팀이 과학저널 '네이처'에 지난 23일(현지시각) 발표한 연구 논문을 보면 오미크론 변이는 지금까지 개발된 코로나19 백신 접종이나 자연감염으로 생기는 면역 방어를 광범위하게 회피하는 것으로 드러났다.연구팀은 먼저 백신 접종으로 생기는 항체가 오미크론 변이를 어느 정도 중화하는지 테스트했다.시험 대상은 현재 가장 널리 쓰이는 화이자와 모더나, 아스트라제네카, 얀센 등 백신 4종으로 제한했다. 오미크론 변이에 대한 이들 백신의 방어력은 예상보다 나빴다.2차 접종까지 마친 사람도 오미크론을 중화하는 항체 효능은 매우 낮은 것으로 확인됐다. 변이 출현 이전의 야생형 바이러스를 중화하는 효능과 비교하면 차이가 확연했다.



의료팀이 코로나19 중환자와 위중증 환자 집중 치료실에서 환자들을 돌보고 있다. [사진=뉴시스]코로나19에 감염됐다가 회복한 환자에게서 분리한 항체의 경우엔 백신을 통해 형성된 항체보다 오미크론 중화 능력이 더 약했다.더구나 화이자나 모더나 등 mRNA 백신으로 추가접종을 하더라도 항체의 오미크론 중화 작용은 충분하지 못할 것으로 예측됐다.이런 결과는 앞서 영국과 남아프리카공화국에서 진행된 오미크론 변이에 대한 백신 효능 테스트 결과와 대체로 부합한다. 이들 나라에서도 2차까지 백신을 맞은 접종자들을 대상으로 항체 효능을 시험했다.또한, 현재 사용 중인 코로나19 단클론 항체치료제도 오미크론을 막기엔 역부족인 것으로 나타났다. 감염 초기에 이런 항체치료제를 투여하면 위중증 진행을 막는 데 상당한 효과를 볼 수 있다.연구팀은 오미크론이 지금까지 본 코로나19 변이 중 가장 완벽하게 중화항체를 회피하는 바이러스라는 결론을 내렸다.호 교수팀은 오미크론 변이의 스파이크 단백질에서 항체를 피하는 데 도움을 주는 4개의 돌연변이를 추가로 찾아냈다.오미크론 변이의 특징은 세포 감염에 필요한 스파이크 단백질의 돌연변이가 대거 늘었다는 것이다. 스파이크 단백질의 돌연변이가 이렇게 증가하면 기존 백신이나 치료용 항체의 공격을 회피할 가능성이 크다.코로나19 백신이나 치료용 항체의 표적이 대체로 다 스파이크 단백질이기 때문이다.호 교수팀은 또 오미크론 변이도 숙주세포의 ACE2 수용체와 스파이크 단백질의 융합을 통해 감염 경로를 연다는 것을 확인했다.호 교수는 ""코로나19가 어떻게 진화할지를 예측해 이에 맞는 백신과 치료제를 개발해야 할 것""이라고 강조했다.",105,https://n.news.naver.com/mnews/article/031/0000644468?sid=103
"위메이드, 미르4 새해맞이 '소망의 냄비' 이벤트 개최",2021.12.24. 오후 5:22,"출석 및 수렵 통한 아이템 선물 이벤트 실시



위메이드가 '미르4' 새해맞이 소망의 냄비 이벤트를 연다.  [사진=위메이드]위메이드(대표 장현국)의 모바일 대규모다중접속역할수행게임(RPG) '미르4'가 새해를 맞아 이벤트를 실시한다.23일부터 4주간 선물을 받을 수 있는 출석 이벤트가 열린다. 출석 이벤트는 14일씩 총 2회 진행되며, 신룡의 강화지원 상자와 영웅 재료 보합 상자 등을 담은 '소망의 버선', 성장을 위한 약재 제작 재료인 '설삼', '석유' 등이 주어진다.또한, 6일부터 2주 동안 수렵 이벤트가 진행된다. 미르 대륙에 위치한 몬스터를 사냥하면 '소원 편지'를 획득할 수 있다. 소원 편지는 각 지역 도시에 위치한 NPC(비플레이어 캐릭터)를 통해 각종 강화석 및 이벤트 아이템인 소망의 냄비, 소망의 보합으로 교환 가능하다.일정 수량의 소망의 냄비를 모으면 신비로운 용의 재료 소환상자, 신룡의 강화석 등을 얻을 수 있고, 보감에 등록해 전투 효율을 높일 수 있는 '소망의 종 보감패' 획득도 가능하다. 소원 편지를 소망의 보합으로 교환하면 무공비급 소환권, 단약 등 푸짐한 아이템을 얻을 수 있다.이와 함께, 캐릭터를 더욱 강력하게 성장시킬 수 있는 보패 시스템이 등장했다. 보패 아이템은, 필드 및 각종 의뢰를 통해 획득한 ‘월광석’을 선계 정령촌으로 가져가면 NPC를 통해 일반, 희귀 등급 보패 두 종류로 제작 가능하다.",105,https://n.news.naver.com/mnews/article/031/0000644416?sid=103
내년 마이크로소프트 클라우드는 어떻게 날까,2021.12.24. 오후 3:58,"올해 마이크로소프트의 클라우드 서비스는 빠르게 성장했다. 내년에도 더 커져 세계 2위 엔터프라이즈 퍼블릭 클라우드 업체로 성장할 것으로 전망된다. 내년 새롭게 건립될 마이크로소프트의 데이터센터는 50~100개로 예상된다.미국 지디넷의 마이크로소프트 전문기자인 매리 조폴리는 최근 내년도 마이크로소프트 클라우드 사업을 전망했다.마이크로소프트 클라우드는 단일 상품은 아니다. 마이크로소프트 애저와 동의어도 아니다. 마이크로소프트의 여러 기업용 구독 서비스의 총칭이다.



미국 와이오밍주에 위치한 마이크로소프트 데이터센터마이크로소프트는 실적보고서에서'커머셜 클라우드'라 불러오던 부문을 '마이크로소프트 클라우드'로 조용히 변경했다. 마이크로소프트의 회계연도 2022년이 시작된 지난 7월부터다.마이크로소프트 클라우드는 마이크로소프트365, 애저, 애저 서비스, 다이나믹스365, 일부 링크드인 기업용 서비스, 클라우드 데이터베이스 및 분석 서비스, 엔터프라이즈 모빌리티&시큐리티, 익스체인지서버 온라인 버전, 셰어포인트서버 등을 포함한다.지난 10월 마이크로소프트는 회계연도 2022년 1분기동안 207억달러 매출을 거뒀다고 발표했다. 이를 연간추정매출로 환산하면 연 800억달러다.새해 마이크로소프트 클라우드의 다음 포인트는 '뉘앙스'다. 뉘앙스는 지난 4월 197억달러(22조원)에 인수된 인공지능(AI) 개발업체로 애플의 시리 개발로 유명세를 탔었다. 뉘앙스는 현재 의사와 환자 간 소통 과정을 돕는 헬스케어 음성인식에 초점을 맞추고 있다.마이크로소프트는 뉘앙스의 기술이 다양한 헬스케어 분야에서 유용할 것이라고 보고 있다. 내년 1분기 각국 반독점규제기관의 심사를 무사히 넘기면 본격적인 뉘앙스 기반의 산업용 클라우드 서비스가 대거 출시될 것으로 예상된다. 현재로선 다이나믹스 컨택센터가 뉘앙스 기술과 가장 먼저 만날 것으로 보인다.올해 본격적으로 점화된 산업 클라우드 경쟁은 내년 더 치열해질 것으로 전망된다. 마이크로소프트는 일찌감치 산업별 특화 클라우드 서비스 번들을 제공해왔다. 마이크로소프트365, 애저, 다이나믹스365 등의 묶음상품과, 산업 특성에 맞게 잘 정의되고 다듬어진 템플릿, API가 헬스케어, 유통, 금융, 제조, 비영리단체, 공공 등의 시장을 노리고 나올 것으로 예상된다.과거 마이크로소프트는 'Better Together'란 캠페인을 벌였었다. 이 캠페인으로 마이크로소프트는 고객에게 자사 중심의 제품군을 사용하면 최상의 컴퓨팅 경험을 얻을 수 있다고 강조했다. 클라우드의 수직적 결합은 이런 마이크로소프트의 옛 캠페인과 상통한다. 산업별 번들은 다이나믹365와 파워프랫폼 등 구매우선순위에서 한발 밀려있는 제품의 판매를 늘리는데도 도움을 줄 수 있다.애저 측면을 보면, 마이크로소프트는 퀀텀 컴퓨팅 클라우드인 '애저 퀀텀', 통신서비스회사용 클라우드인 '오퍼레이터용 애저', 인공위성 지상국 서비스인 '애저 스페이스' 등과 같이 떠오르는 영역에서 성과물을 판매하는데 노력할 것으로 보인다. 미국 연방 클라우드 작업과 모두 연관되는 분야다.몇달전 마이크로소프트는 클라우드+AI 사업부를 재편하고 새로운 단일 전략 임부 및 기술팀을 꾸렸다. 이팀은 미국 연방정부 사업, 퀀텀 컴퓨터, 통신서비스, 인공위성 산업 등에 집중하는 조직이다.지난 2년간 무성한 소문을 낳았던 마이크로소프트의 '메타OS' 전략이 구체적인 제품으로 나올 것으로 예상된다. 마이크로소프트는 플루이드 프레임워크, 마이크로소프트 서치, 마이크로소프트 그래프 등을 조합해 화이트보드, 플래너, 리스트, 투두 같은 오피스 스위트에서 핵심을 이루도록 구상하고 있다.메타OS란 플랫폼은 '메타버스'와 무관하지만, 팀즈, 아웃룩, 기타 오피스 제품과 관련되는 업무 플랫폼이다.AI가 당연히 메타OS 계획의 핵심 요소다. 또 애저의 핵심요소기도 하다. 마이크로소프트는 점차 '대규모 AI'를 밀고 있다. 애저 고객에게 대규모 AI 모델과 코그니티브 서비스, 슈퍼컴퓨팅 자원 등에 접근하게 한다는 것이다.데이터 플랫폼 및 서비스도 마이크로소프트 클라우드 성장을 견인할 요소다.제임스 필립스 마이크로소프트 사장이 이끄는 디지털 트랜스포메이션 플랫폼 그룹에 주목할 만하다. 산업 클라우드뿐 아니라, 다이나믹스365, 파워플랫폼, 애저 AI 플랫폼, 애저 데이터 플랫폼, 애저 IoT 플랫폼 등을 풀스택 통합으로 밀고 있는 조직이다.매리 조폴리는 ""함께하면 더 좋다가 돌아왔다""며 ""마이크로소프트는 2022년과 그 이후에 성장하는 마이크로소프트 클라우드 서비스 제품군과 함께 개념에서 벗어나 진짜 판매를 시작할 것""이라고 전망했다.",105,https://n.news.naver.com/mnews/article/092/0002243192?sid=103
