title,date,main,section,url
"벤처·스타트업 업계 ""혁신 지속하며 상생할 수 있는 대선 공약 마련해달라""",2021.10.08. 오후 3:42,"혁신벤처단체協, 혁신강국 실현을 위한 혁신·벤처 정책 제언더불어민주당 ""제2의 타다같은 사태 안나타나도록 살펴볼 것""



혁신벤처단체협의회-더불어민주당 간담회 개최 (한국벤처기업협회 제공) © 뉴스1(서울=뉴스1) 송화연 기자 = ""일각에선 (정부가 선거철마다) 스타트업을 희생시켜 표심을 얻는 것이 아니냐는 목소리가 나옵니다. 스타트업에 맘껏 뛸 기회를 주십시오. 혁신을 지속하는 가운데 상생을 찾는 게 다음 대선의 정책 방향으로 해주십시오. ""8일 혁신벤처단체협의회는 서울 구로구 벤처기업협회 사무실에서 더불어민주당 의원들과 만나 내년 대선을 앞두고 벤처·스타트업 시장이 활성화될 수 있도록 전방위적인 정책 고려를 부탁드린다고 입을 모았다.혁신벤처단체협의회는 국내 벤처 생태계 조성을 위해 구성된 범혁신단체 모임으로, 벤처기업협회, 코리아스타트업포럼, 코스닥협회, 한국벤처캐피탈협회, 한국액셀러레이터협회, 한국핀테크산업협회 등 21개 단체로 구성됐다.협의회는 내년 3월 제 20대 대통령선거를 앞두고 벤처업계 혁신을 위한 구체적 실천과제를 정치권에 제안하기 위해 이날 간담회를 마련됐다. 행사에는 송영길·김병욱·윤관석 더불어민주당 의원 등이 참석했다.협의회는 이날 간담회에서 혁신·벤처 주요 정책을 제안하고, 협·단체별로 아쉬운 점과 요구사항을 건의했다. 행사에 참여한 협단체 대표들은 ""건강한 벤처 생태계는 우리나라를 혁신강국으로 만드는 데 일조할 것""이라며 총 72개의 친(親) 벤처·스타트업 과제를 제시했다.72개 과제는 Δ시장친화 환경조성(15개 과제) Δ기술강국 실현(14개 과제) Δ인재 유입 촉진(10개 과제) Δ혁신자금 공급(18개 과제) Δ성장 인프라 확충(15개 과제)이다.구체적으로 협의회는 '규제 샌드박스 제도 정비'와 '핀테크산업 네거티브 방식의 규제체계 전환', '스마트팩토리 등 데이터 표준 정립 및 확산', '금융기관의 벤처펀드 출자 규제 완화' 등을 제시했다. 협의회는 이날 162페이지에 달하는 혁신·벤처 정책 제안집을 더불어민주당 측에 전달했다.강삼권 벤처기업협회 회장은 ""세계는 지금 '혁신 전쟁의 시대'로, 혁신전쟁에서 승리하기 위해서는 선도자가 돼야한다""며 ""최근 벤처기업들의 성과를 볼 때 선도자로서 충분한 역량과 환경을 갖추고 있다. 제안 내용이 새로운 정부 출범을 맞아 선도국가로 부상할 수 있는 마중물이 되기를 기대한다""고 밝혔다.더불어민주당은 건강한 스타트업·벤처 생태계 조성을 위한 방안을 적극적으로 고민해 공약으로 담겠다는 계획이다.이날 간담회에 참석한 이소영 더불어민주당 대변인은 ""타다같은 사태가 나타나지 않도록 살펴보겠다""라며 ""로톡, 강남언니 등 새로운 서비스가 나올 때 기존 사업과의 갈등으로 나아가지 못하는 스타트업이 있다. 이들을 어떻게 중재하고 기존 산업과의 매듭을 풀지 더 고민하겠다""고 말했다.송영길 더불어민주당 대표는 ""기업가 정신이 충만한 혁신강국 실현과 선순환 혁신·벤처생태계 발전을 혁단협과 함께 만들어나가겠다""고 강조했다.",105,https://n.news.naver.com/mnews/article/421/0005646426?sid=103
[날씨] 밤까지 서해안 비 조금…내륙 안개주의,2023.10.24. 오후 9:51,"오늘 밤까지 충남과 전라서해안에 비가 조금 더 이어지겠습니다. 서울 등 중부 곳곳으로도 빗방울이 떨어지는 곳이 있겠습니다. 오늘 밤사이에도 내륙은 200m 앞을 내다보기 힘들 정도의 짙은 안개가 끼겠는데요. 교통안전에 유의하시기 바랍니다. 내일은 전국이 구름 많다가, 낮부터 차차 맑아지겠습니다. 나흘째 강원 동해안에 건조주의보가 발효 중인데요. 산불 등 화재예방에 각별한 주의가 필요하겠습니다. 내일 아침 최저기온 오늘보다 1~6도 가량 높습니다. 서울이 13도, 인천 14도 보이겠고, 낮기온도 서울 22도로 오늘보다 높아 온화하겠습니다. 남부지방도 아침에 대구가 10도, 광주 12도 예상되고요. 낮에는 기온이 올라 일교차가 크겠습니다.모레 오후에는 서울을 포함한 수도권과 영서, 충청에, 금요일에는 전라 서해안과 영동에 비소식 있습니다. 날씨였습니다.",105,https://n.news.naver.com/mnews/article/448/0000433128?sid=103
"""행복 호르몬 신호 전달 억제해 당뇨병·지방간 개선""",2021.10.08. 오전 10:23,"KAIST·분당서울대병원 ""세로토닌 신호 억제 표적 치료제 개발에 기여""



내장지방에서 세로토닌 수용체 2B 발현량과 간 지표 사이 상관관계[KAIST 제공. 재판매 및 DB 금지](대전=연합뉴스) 박주영 기자 = 한국과학기술원(KAIST)은 김하일 교수와 분당서울대병원 최성희 교수 공동 연구팀이 지방조직의 세로토닌 신호를 억제해 당뇨병과 지방간을 개선할 수 있음을 확인했다고 8일 밝혔다.     세로토닌은 기분과 감정을 조절하는 뇌 신경전달물질로, '행복 호르몬'이라고도 불린다.    말초 조직에서는 비만·당뇨 등 상황에서 에너지 대사를 조절하는 역할을 하는데, 간 조직의 세로토닌 신호 전달은 지방 합성을 촉진하는 것으로 알려져 있다. 



비만 시 지방세포의 세로토닌 신호 전달에 의한 지방간 형성 모식도[KAIST 제공. 재판매 및 DB 금지]연구팀은 지방세포에서 세로토닌을 받아들이는 수용체 '2B' 신호 전달을 억제하면 지방조직 내 염증 반응이 감소하며 지방간을 억제하는 등 대사 지표가 개선되는 것을 발견했다.     사람의 지방조직과 실험용 쥐 모델에서 비만 시 세로토닌 2B 수용체 발현이 내장지방에서 특이적으로 증가하는 것을 확인했다.     김하일 교수는 ""세로토닌이 중추신경을 통하지 않고도 직접 지방조직에 작용한다는 것을 새롭게 밝혔다""며 ""세로토닌 신호 억제를 표적으로 하는 새로운 당뇨병·지방간 치료제 개발에 기여할 것""이라고 말했다.    이번 연구 결과는 국제 학술지 '임상연구저널'(Journal of Clinical Investigation) 전날 자 온라인판에 실렸다.     jyoung@yna.co.kr",105,https://n.news.naver.com/mnews/article/001/0012650324?sid=103
"[르포]'아이폰13' 출시 첫날…""예약구매 안 해도 현장에서 살 수 있어요""",2021.10.08. 오후 4:55,"""길게 늘어선 줄은 없었다""…대부분 온라인 구매 후 시간맞춰 픽업온라인에서 품절과 달리 매장에는 예상보다 재고 많아



애플이 '아이폰13'을 8일 국내 출시한 가운데 소비자들이 온라인에서 아이폰13을 구매한 후 제품을 받기 위해 애플스토어를 방문했다. 사진은 애플스토어 여의도점. © 뉴스1



애플의 '아이폰13'이 8일 국내 출시됐다. 사진은 왼쪽부터 아이폰13 미니, 아이폰13, 아이폰13 프로, 아이폰13 프로 맥스. © 뉴스1(서울=뉴스1) 이창규 기자 = ""대부분 온라인에서 예약 구매 후 픽업하러 오시지만 예약 구매 안 해도 일부 제품은 재고가 있어 현장에서 직접 보고 살 수 있어요.""애플의 신형 스마트폰인 '아이폰13'이 8일 국내에 정식 출시됐다. 10여명의 소비자들이 온라인을 통해 아이폰13을 예약 구매한 후 픽업을 위해 이 날 아침부터 여의도 애플스토어 앞에서 기다렸다. 올해 초 두 번째로 문을 연 애플스토어 여의도점은 평소 오픈 시간은 오전 10시지만 이 날은 오전 8시부터 방문자들을 받고 제품을 전달했다. 온라인을 통해 아이폰13을 구매한 이들은 직접 픽업 시간을 설정, 시간에 맞춰 매장을 방문했다. 이 날 애플스토어를 방문한 이강청(34)씨는 ""삼성폰을 사용했었는데 1년 정도 사용한 후에는 많이 느려져서 아이폰6부터 아이폰을 사용하고 있다""며 ""지난해 아이폰SE를 구매해서 사용하다 배터리가 너무 빨리 닳아 교체하게 됐다""고 말했다. 그는 이어 ""또한 최근 카메라에 취미를 가졌는데 출사를 나갈 때를 제외하고는 너무 무거워서 카메라를 들고 다니기 어려웠는데 아이폰13의 카메라 성능이 좋아져 아이폰13 프로를 구매하게 됐다""고 말했다. 아이폰13은 전작보다 카메라 렌즈가 커지면서 후면 카메라 모듈도 커졌다. 이에 따라 '카툭튀'(카메라가 툭 튀어나온 현상)가 더 심해졌다. 아이폰12의 카메라 모듈 두께는 1.5~1.7mm였으나 아이폰13는 2.51~3.65mm다.카메라 크기가 커지면서 성능도 향상됐다. 광각 카메라는 역대 아이폰 카메라 중 가장 큰 1.9㎛ 센서와 ƒ1.5 조리개를 탑재했으며 초광각 카메라도 ƒ/1.8 조리개를 탑재해 전작보다 저조도 상황에서의 촬영이 향상됐다. 또한 아이폰13 프로 시리즈의 망원 카메라 사양을 77mm로 통일했으며 전 모델에 센서 시프트(손떨림방지기능·OIS)가 적용됐다.



애플이 8일 아이폰13을 국내 출시한 가운데 카메라 렌즈가 커지면서 후면 카메라 모듈의 '카툭튀' 현상도 심해졌다. 사진의 왼쪽이 아이폰13, 오른쪽이 아이폰12다. © 뉴스1



애플이 8일 '아이폰13'을 국내 출시했다. 사진은 아이폰13의 파란색 색상을 전작과 비교한 모습. 왼쪽부터 아이폰13 시에라 블루, 아이폰13 블루, 아이폰12 블루. © 뉴스1LG전자가 휴대폰 사업을 종료하면서 아이폰으로 갈아타는 고객도 늘고 있다. LG전자는 지난 7월31일자로 휴대폰 사업을 종료했다.V50 씽큐(ThinQ)를 사용했다는 방문자 A(21)씨는 ""스마트폰을 바꾸면서 갤럭시와 아이폰 중 고민을 많이 했다. 그런데 최근 갤럭시Z플립3에 발열 이슈가 있어서 아이폰을 선택했다""고 말했다. 이어 ""아이폰13에서 120헤르츠(Hz) 주사율을 지원하는 점도 마음에 들었다""고 덧붙였다.이 날 매장을 찾은 대부분의 방문객들은 예약 구매를 한 이들이었으나 현장에서 제품을 보고 구매를 하기 위해 방문한 이들도 있었다. 40대 방문객 B씨는 ""아이폰8을 사용하면서 홈버튼에 대한 미련때문에 바꾸지 않았다. 그러나 성능 저하가 점점 심해지면서 교체하게 됐다""며 ""현장에서 직접 보고 구매하기 위해 온라인에서 구매하지 않았다""고 말했다. 애플과 이동통신3사, 쿠팡과 11번가 등 온라인몰은 지난 1일부터 아이폰13의 예약판매를 실시했다. 특히 카드할인과 무이자 할부 등의 혜택을 앞세운 온라인몰에서는 예약판매 시작과 함께 빠르게 물량이 소진됐다. 방문객 C(26)씨는 ""쿠팡에서 아이폰13 프로 시에라 블루 색상을 구입하려고 헀으나 예약판매를 시작하자마자 품절이 되면서 구입하지 못했다""며 ""그런데 애플스토어에서 예약하니 이 날 제품을 받을 수 있다고 해서 오게 됐다""고 말했다. 애플스토어 직원은 ""온라인에서 구매 시 출고까지 기다려야 될 수도 있지만 매장을 방문할 경우 재고가 있으면 즉시 구입할 수 있다""며 ""현재 아이폰13 프로 맥스는 재고가 없고 아이폰13 프로는 실버 외에 다른 색상은 재고가 있다. 아이폰13도 핑크와 스타라이트 색상 외에 다른 색상은 재고가 있다""고 말했다.",105,https://n.news.naver.com/mnews/article/421/0005646701?sid=103
"유니티, 새로운 브랜드 아이덴티티 발표",2021.10.08. 오전 10:38,"[서울경제] 실시간 3D 콘텐츠 제작 및 운영 플랫폼을 제공하는 유니티는 새로운 브랜드 아이덴티티(BI)를 발표했다고 8일 밝혔다. 



유니티는 지난 2006년 인디게임 개발자 대상 게임엔진으로 시작해 현재 다양한 산업 분야에서 50개가 넘는 제품과 서비스를 제공하고 있다. 이용하는 개발자, 크리에이터, 운영자는 수백만 명에 달한다. 이러한 성장세에 발맞춰 유니티는 새로운 BI를 내세우게 됐다. 새로운 유니티 로고는 완전한 3차원 큐브 디자인을 채택했다. 유니티 큐브의 x, y, z축이 만나는 지점은 유니티의 기술과 크리에이터 간의 결합을 상징한다. 세 방향으로 향해 있는 화살표는 유니티가 크리에이터에게 제공하는 무한한 가능성을 표현한다. 워드마크는 대문자 ‘U’를 사용하고 등록 기호도 새롭게 추가했다.유니티는 새로운 로고 디자인을 토대로 통일성과 일관성을 갖춘 제품 시스템을 구현할 예정이다. 이를 통해 유니티 사용자는 필요한 제품을 쉽게 식별해 검색하고 제품 간의 관계를 한 눈에 파악할 수 있게 될 전망이다.



또 주요 제품의 새 3D 제품 로고에 애니메이션 효과를 적용했다. 유니티의 웹사이트 및 소셜미디어 채널에서 새로운 로고가 적용되며, 유니티의 브랜드가 표시되는 다양한 곳에 새로운 브랜딩이 적용될 예정이다.김인숙 유니티 코리아 대표는 “새롭게 선보이는 브랜드 아이덴티티는 유니티가 보유한 다제품 생태계의 모습을 반영하고 다방면으로 크리에이터를 지원하고자 하는 유니티의 방향성을 나타낸다”며 “앞으로도 새로운 브랜드 아이덴티티에 걸맞게 성장하는 유니티의 미래를 기대해주시기 바란다”라고 말했다.",105,https://n.news.naver.com/mnews/article/011/0003970972?sid=103
[날씨] 밤까지 곳곳 약한 비…내일 남부 큰 일교차,2023.10.24. 오후 5:43,"절기 상강인 오늘, 중부지방은 하늘빛이 흐렸고요. 가을비가 지났습니다. 오늘 밤까지, 서쪽 지역을 중심으로 약한 비가 조금 더 이어지겠습니다. 우산 잘 챙겨 주시길 바랍니다.이처럼, 곳곳에 비구름이 지나긴 했지만, 큰 추위 없이 바람결은 선선했는데요. 내일도 큰 추위 걱정은 없겠습니다. 내일 아침 서울은 13도, 한낮에는 22도까지 오르면서 평년 기온을 4도가량 웃돌겠고요. 남부지방을 중심으로는 일교차가 크게 벌어지겠습니다. 하루 사이에도 많게는 15도가량 기온 차가 크니까요. 옷차림에 신경 써주셔야겠습니다.내일 하늘 표정은 양호합니다. 전국 하늘에는 가끔 구름만 많겠고요. 오전까지 내륙 지역은 안개가 짙게 끼면서, 시야가 답답하겠습니다.화재 사고에도 유의하셔야겠습니다. 현재, 강원 동해안 지역에는 건조주의보가 발효 중인데요. 작은 불씨도 크게 번질 수 있습니다. 경각심을 갖고 산불 등 화재가 발생하지 않도록 조심하셔야겠습니다.당분간 이른 추위는 없겠고요. 모레 오후에는 수도권과 강원영서, 충청 지역에 비 소식이 있습니다. 금요일에는 호남 서해안과 강원영동 지역에 비가 내릴 것으로 전망됩니다. 지금까지 날씨 전해 드렸습니다.(강지수 기상캐스터) #가을비 #비 #일교차 #선선 #건조 #환절기 #상강연합뉴스TV 기사문의 및 제보 : 카톡/라인 jebo23",105,https://n.news.naver.com/mnews/article/422/0000625582?sid=103
‘모두예술극장’ 개관에 유인촌 “비장애인들도 새로운 경험 나눌 공간”,2023.10.24. 오후 4:40,"장애예술인 표준공연장, 서울서 첫 선



유인촌(왼쪽 네 번째) 문체부 장관이 24일 ‘모두예술극장’에서 장애예술 관계자들과 개관식을 진행하고 있다. 사진 제공=문체부[서울경제] “다소 불편할 수도 있겠죠. 비장애인이 생각지도 느끼지도 못했던 또 다른 새로운 세상에 대한 경험을 나눌 수 있는 공간이라고 생각합니다.”유인촌 문화체육관광부 장관이 24일 국내 첫 장애예술인 표준 공연장인 ‘모두예술극장’ 개관식에서 2008년 이명박 정부 초대 문체부 장관을 지낸 시절을 돌아보며 “15년이 지나 겨우 만들어졌지만 굉장히 뿌듯하다”면서 이같이 말했다. 모두예술극장은 서울 서대문구 충정로 구세군빌딩의 3개 층(1~3층)을 리모델링해 만들었으며 전체 면적은 2014㎡다. 공간 구성 면에서는 휠체어석 상황에 맞춰 가변 조정한 250석 규모의 중극장, 연습실 등 창작레지던시와 교육 공간, 장애인의 편리를 위한 샤워실과 화장실 등이 마련됐다. 장애예술인들의 공연 신청이 폭주하면서 내년 3월까지 예약이 끝난 것으로 전해졌다.유 장관은 “모두예술극장 조성과 운영 모델이 다른 공연장의 표준이 되기를 바라며 문화 예술 공간의 접근성 수준이 높아지도록 적극 지원하겠다”고 덧붙였다.",105,https://n.news.naver.com/mnews/article/011/0004252825?sid=103
,,,105,https://n.news.naver.com/mnews/article/347/0000157211?sid=103
"티맵, 중소 주차설비업체 디지털화 지원",2021.10.08. 오후 5:13,"티맵모빌리티가 중소 주차설비 업체의 디지털 전환(DX)을 돕는 동반성장 사업에 나선다.티맵모빌리티는 플랫폼 기업과 설비업체 간 상생 체계 구축을 위한 업무협약(MOU)을 한국주차설비공업협동조합과 체결했다고 8일 밝혔다. 티맵모빌리티는 이번 MOU를 통해 중소 주차설비 업체의 디지털화를 지원한다. 중소 업체들의 주차 관련 서비스를 누적 이용자 수 3000만 명이 넘는 티맵 내비게이션 등과 연동하고, 각종 데이터를 공유하기로 했다. 티맵모빌리티 관계자는 “대형 플랫폼 기업의 공세에 밀려 휘청이는 중소기업들의 경쟁력을 키워주겠다는 취지”라고 말했다.이번 MOU는 주차설비 업체들의 역할과 플랫폼사인 티맵의 역할을 명확히 구분한 게 특징이다. 대형 플랫폼 기업이 시장에 직접 진출하거나, 기존 중소기업을 대형 플랫폼에 종속시키는 통상 방식과는 반대다. 각자의 영역을 존중하고 협력해 상생 발전하기 위해서라고 티맵모빌리티는 설명했다.설비업체는 차량이 주차장에 들어갈 때 동작하는 차량 번호인식기, 차단기 등을 설치하고 유지·관리한다. 대부분 중소기업인 탓에 모바일 앱 내 결제, 주차정보 데이터화 등 정보기술(IT) 시스템 도입이 느린 편이다.양성우 티맵모빌리티 MOD(수요기반모빌리티서비스)2그룹장은 “중소 설비사들이 시장에서 외면받지 않도록 여러 측면에서 디지털 전환을 지원할 것”이라고 말했다.",105,https://n.news.naver.com/mnews/article/015/0004614197?sid=103
"""업계 움직임 두 눈으로 확인할 수 있어 유익""",2021.10.08. 오후 1:44,"[4차 산업혁명 페스티벌] 블록체인·AI·메타버스 등 신산업 종사자 사이서 호평메타버스, 인공지능(AI), 블록체인 등 4차 산업혁명 기술을 직접 체험할 수 있는 ‘대한민국 4차 산업혁명 페스티벌 & 블록체인 서울’이 업계 종사자 사이에서 호평을 받았다.행사 마지막 날인 8일 ‘4차 산업혁명 페스티벌 & 블록체인 서울’에는 6, 7일에 이어 다수의 관련 업계 종사자가 참여했다.클라우드 운영관리 기업 메가존클라우드의 엄정훈 매니저는 “행사 진행도 매끄러웠고, 무엇보다 4차 산업혁명과 관련한 정보를 필요로 하는 방문객을 대면할 수 있어 유익했다”며, “다만, 코로나19로 인해 모객이 많이 안 된 것 같아 아쉬웠다”고 말했다.금융 클라우드 기반 금융사기 방지 기업 더치트 정유석 책임매니저는 “여러모로 유익한 행사였다”고 평하며, “특히, 블록체인과 암호화폐 등 4차 산업혁명 핵심 기술을 다루는 우리 회사에 많은 도움이 됐다”고 소감을 전했다.정 책임매니저는 이어 “블록체인 기반 암호화폐가 시장의 조명을 받는 만큼 이에 따른 사기 문제도 뒤따르는데, 이를 방지하는 기술을 알릴 수 있어 뿌듯했다”고 덧붙였다.



대한민국 4차 산업혁명 페스티벌 & 블록체인 서울



대한민국 4차 산업혁명 페스티벌 & 블록체인 서울한국전자투표 정권호 사원은 업계 동향을 두 눈으로 확인할 수 있어 도움이 됐다고 말했다. 정 씨는 “대한민국 4차 산업혁명의 현주소는 물론 다수의 참여형 프로그램을 통해 방문객‘의 이해를 높이려는 노력이 엿보여 만족스러웠다”면서 “매끄러운 행사 진행과 쾌적한 관람 동선도 인상적이었다”고 언급했다.통합정보보호 기업 마크애니디앤디의 김민근 대리는 “이번에 블록체인 기반 증명서 발급 및 관리 플랫폼을 출품했는데, 많은 방문객에 홍보할 수 있어 유익했다”며 ”행사 진행도 좋았고 다음 해에도 기회가 된다면 참가하고 싶다”고 밝혔다.지디넷코리아가 주관하고 4차산업혁명위원회, 과학기술정보통신부, 산업통상자원부, 국토교통부, 공정거래위원회 등이 후원한 4차산업혁명 페스티벌은 8일 막을 내린다.행사 마지막 날에는 블록체인 관련 업체및 유관 기관 관계자가 연사로 나서는 ’블록체인 서울 컨퍼런스‘가 진행된다. 코로나19 확산 방지를 위해 온라인으로도 생중계된다.전시회에는 100여개 기업이 참가해 4차 산업혁명과 관련한 첨단기술을 선보인다.",105,https://n.news.naver.com/mnews/article/092/0002235666?sid=103
아이폰13 판매 시작,2021.10.08. 오후 3:18,(서울=뉴스1) 박세연 기자 = 애플의 스마트폰 아이폰13 시리즈 판매가 시작된 8일 서울 강남구 Apple 가로수길에서 고객들이 아이폰13을 살펴보고 있다. 2021.10.8/뉴스1,105,https://n.news.naver.com/mnews/article/421/0005646315?sid=103
"클라우드 기업 클루커스, 신입·경력직 대규모 공채",2021.10.08. 오전 11:51,"클라우드 컨설턴트, 엔지니어 등 전부문 모집



(사진=클루커스)[이데일리 김국배 기자] 클라우드 관리 기업(MSP) 클루커스가 오는 17일까지 클라우드 및 데이터 분야 신입·경력직 채용을 진행한다.이번 채용은 서울 본사와 뉴욕·부산지사를 포함한 것으로, 채용 부문은 △클라우드 컨설턴트 및 엔지니어 △클라우드 운영 △데이터베이스 엔지니어 △데이터 플랫폼 엔지니어 △데이터 사이언티스트 △클라우드 영업 △서비스 개발 등 전 분야다.클루커스는 마이크로소프트(MS) 클라우드 전문 기업으로 전 직원의 80%가 기술 컨설턴트로 구성돼 있다. SK, 한화, CJ 등 대기업을 비롯해 펄어비스, 크래프톤 등 게임사와 스타트업을 고객사로 확보하고 있다. 국내에서 유일하게 MS로부터 ‘2021 올해의 파트너상’을 받기도 했다.최근엔 인공지능(AI)·머신러닝 분야 ‘어드밴스드 스페셜라이제이션’ 자격을 취득했다. 이는 MS 클라우드 고급 기술 전문 자격 중 하나다.",105,https://n.news.naver.com/mnews/article/018/0005055278?sid=103
