title,date,main,section,url
LGU+ IPTV서 '티빙' 편하게 본다…전용 요금제 출시,2023.03.16. 오전 9:17,"기사내용 요약U+tv서 편하게 티빙 오리지널 콘텐츠 시청 가능인터넷+티빙 결합 또는 티빙만 추가 선택할 수 있어



[서울=뉴시스] LG유플러스가 IPTV 서비스 U+tv에서 온라인동영상서비스(OTT) '티빙'을 볼 수 있도록 라인업을 개편하고 전용 요금제와 부가서비스를 출시했다. (사진=LGU+ 제공) *재판매 및 DB 금지[서울=뉴시스] 심지혜 기자 = LG유플러스와 티빙이 콘텐츠, 모바일 서비스 분야에 이어 홈서비스에서도 협력한다. LG유플러스는 IPTV 서비스 U+tv에서 온라인동영상서비스(OTT) '티빙'을 볼 수 있도록 라인업을 개편하고 전용 요금제와 부가서비스를 출시했다고 16일 밝혔다.이번 OTT TV 라인업 개편으로 티빙의 환승연애·술꾼도시여자들·유미의세포들 등 오리지널 콘텐츠를 TV에서 편하게 볼 수 있도록 했다. tvN, Mnet, JTBC의 드라마·예능 프로그램과 파라마운트+의 최신 영화도 볼 수 있다.이를 위해 티빙 요금제도 출시했다. 요금제는 ▲프리미엄 티빙(3년 약정·인터넷 결합 시 월 2만7000원, 1080p 화질, 티빙 2명 동시 시청) ▲프리미엄 티빙 플러스(3년 약정·인터넷 결합 시 월 3만원, 최대 4K 화질, 티빙 4명 동시 시청)를 오는 23일 출시한다.기존 U+tv 요금제에 티빙만 추가로 이용하는 부가서비스는 ▲스탠다드(월 1만900원, 1080p 화질, 티빙 2명 동시 시청) ▲프리미엄(월 1만3천900원, 최대 4K 화질, 티빙 4명 동시 시청)가 있다.티빙 요금제 또는 부가서비스를 이용하면 TV 외에도 스마트폰, 패드로 집 밖에서도 티빙을 동시 시청할 수 있다.새로 출시되는 부가서비스는 U+tv 설정화면의 ‘마이메뉴’에서 손쉽게 가입 또는 해지할 수 있다. 이미 티빙을 구독하고 있는 고객이라면 이용 중인 ID를 입력해 연동할 수 있다.이건영 LG유플러스 홈미디어트라이브 상무는 ""LG유플러스는 4대 플랫폼 전략의 일환으로 OTT TV를 야심차게 선보인 뒤 더욱 편리한 시청경험을 제공하고자 노력하고 있다""며 ""OTT TV에서 티빙을 시청할 수 있게 되면서 누구나 만족할 수 있는 미디어 플랫폼을 만들어가도록 노력하겠다""고 말했다.",105,https://n.news.naver.com/mnews/article/003/0011745366?sid=103
"[게시판] 엔씨소프트 임직원 ""혈액 수급난 극복"" 헌혈 캠페인",2023.03.16. 오후 6:00,[엔씨소프트 제공. 재판매 및 DB 금지]    ▲ 엔씨소프트는 최근 지속되고 있는 혈액 수급난 극복을 위해 14∼15일 대한적십자사 경기남부혈액원과 함께 임직원 헌혈 캠페인을 진행했다고 16일 밝혔다. 엔씨소프트는 앞으로도 상·하반기 연 2회 정기적으로 헌혈 캠페인을 진행한다고 덧붙였다. (서울=연합뉴스),105,https://n.news.naver.com/mnews/article/001/0013819710?sid=103
"""목소리로 본인 확인해요"" SKT, 음성인증 AI 출시",2023.03.16. 오후 5:20,SK텔레콤이 미국 음성 기술 기업 핀드롭과 인공지능(AI) 콘택트센터를 포함한 음성인증 AI 서비스를 출시한다고 16일 밝혔다.AI 기반 음성인증은 이용자 고유 음성을 판별해 추가 인증 없이 간단한 음성만으로 개인을 인증할 수 있는 기술이다. 두 회사는 음성인증 기술을 AI 콘택트센터에 활용하면 고객 상담시간과 대기시간을 대폭 단축할 수 있을 것으로 기대하고 있다.이용자가 고객센터에서 최초 음성 등록 과정만 거치면 이후 통화 시 별도 인증 없이 상담사와 대화할 때 자동으로 인증된다.,105,https://n.news.naver.com/mnews/article/009/0005102544?sid=103
[부음]최우성(한겨레신문사 사장)씨 장모상,2023.03.16. 오후 2:59,"▲김영식씨 별세, 신소미 소림(풍덕고 교사) 소진씨 모친상, 고태조(영남대 교수) 최우성(한겨레신문사 사장) 박승모(가좌연세소아과병원 원장)씨 장모상=16일, 이대서울병원(발산역) 장례식장 특1호실, 발인 18일. (02)6986-4440",105,https://n.news.naver.com/mnews/article/030/0003084800?sid=103
"유유제약, 해외 의약품 기부로 ESG경영 실천",2023.03.16. 오후 12:12,"이은덕(왼쪽)한국사랑나눔공동체 이사장과 천경석 유유제약 영업마케팅본부장이 기념촬영하고 있다. 유유제약 제공.    유유제약은 한국사랑나눔공동체를 통해 캄보디아 헤브론병원에 의약품을 기부해 ESG경영을 실천했다고 16일 밝혔다.유유제약은 유유마이코부틴캡슐(항결핵제), 유유이반드론산정(골다공증 치료제), 유로가바캡슐(뇌전증 치료제), 유로바젯정(원발성 고콜레스테롤혈증 치료제), 유판씨(비타민), 베노플러스겔(멍 및 부종 치료), 속편아제정(소화제) 등 다양한 의약품 및 의약외품을 기부했다.헤브론병원은 2007년 김우정 원장 등 한국인 의사들이 경제적으로 어려운 캄보디아 환자들을 위해 무료 진료소를 개설한 것으로 시작됐다. 현재 100여 명의 의료진이 12개 진료과를 운영하며 매년 6만여 명의 환자를 치료하고 있다.천경석 유유제약 영업마케팅본부 본부장은 ""기업의 사회적 책임 및 ESG경영 실천을 위해 향후에도 다양한 NGO단체와 협업을 모색하겠다""고 말했다.",105,https://n.news.naver.com/mnews/article/029/0002789324?sid=103
[이창근의 헤디트] 첨단 서라벌이 우리에게,2023.03.16. 오후 2:52,"소실된 역사 속의 신라왕경이 디지털로 복원된다지금은 터로만 남아있는 신라왕경이 첨단기술로 복원된다. 신라왕경의 중심이며 불국사의 10배 규모에 달했던 황룡사의 옛 모습까지 디지털로 만나게 된다. 천년 도읍지 경주의 K-관광 매력이 한층 더 높아진다.문화재청과 경주시가 올해부터 2025년까지 ‘신라왕경 디지털 복원’을 추진한다. 신라왕경 천 년 역사를 디지털로 재현해 문화유산과 역사인물‧이야기를 가상공간에서 시간여행 하듯이 경험할 수 있게 한다. 언제가 될지 모르는 신라왕경의 모습을 실제가 아닌 XR(확장현실)이지만, 실물 복원 전에 우리 국민이 접할 수 있다는 점에 의의가 있다고 본다.



신라왕경 360방 복원도.‘역사도시 디지털 복원 사업’은 우리나라 대표 문화유산의 디지털 복원과 콘텐츠 보급‧확산 기반 조성이다. 이미 1단계 사업이었던 한양도성을 마무리했고, 올해부터 2단계로 신라왕경을 추진한다. 3단계는 백제왕도를 대상으로 진행되고, 차후에는 고구려, 가야, 마한, 탐라, 중원, 예맥, 후백제 역사문화권까지 계속된다.살아 숨 쉬는 황룡사 9층 목탑웅장한 신라시대의 유물 역시 디지털로 재현된다. AR(증강현실), VR(가상현실), MR(혼합현실)로 문화재를 복원한다는 것은 결코 쉬운 작업이 아니다. 무한한 상상력의 예술인 미디어아트라면 오히려 수월하다. 하지만 디지털 복원은 정교함이 요구되며 적확해야 한다. 지금은 사라지고 없는 건축유적을 실물 복원과 마찬가지로 유적 현장에서 직접 볼 수 있는 기회를 제공하는 것이기 때문이다.신라왕경의 중심지라고 할 수 있는 황룡사는 553년(신라 진흥왕 14년) 창건을 시작한 이후 오랜 시간 변화를 거듭하여 신라 최대의 사찰이 됐다. 9층 목탑은 645년(신라 선덕여왕 14년)에 완공됐다. 하지만 1238년(고려 고종 25년) 몽골 침입으로 모두 불타 없어져 현재는 ‘경주 황룡사지(사적)’라는 이름으로 그 흔적만 남았다.



2000년 경주세계문화엑스포 VR영상관 내 신라왕경 황룡사 모습.국내에서 실물이 사라진 문화재를 디지털 기술로 복원, 구현한 것은 2000년 9월 1일이 시초다. 당시 ‘경주세계문화엑스포 2000’ 주제영상관에서는 1300년 전 서라벌의 모습이 복원된 바 있다. 황룡사는 동양 최대의 사찰이었다. 경내 면적은 불국사의 8배(3만 평)로 황룡사 중금당만 따지고 본다면 서울 숭례문(남대문)의 6배 규모다. 황룡사는 진흥왕부터 선덕여왕까지 4대에 걸쳐 93년이라는 긴 세월 동안 조성된 국가사찰이었다.문화유산의 디지털 복원과 재현제4차 산업혁명 시대를 사는 우리 일상에 디지털 가속화에 따라 인공지능(AI), 빅데이터, 사물인터넷(IOT) 등 지능정보기술이 도래했다. 사람, 데이터, 사물이 네트워크로 소통하는 작금의 사회는 그야말로 초연결사회다.문화재 디지털 복원 전문가 박진호 박사(고려대 교수)에 따르면 “황룡사 9층 목탑을 되살리는 방법은 디지털 복원이다. 건물이나 목탑의 모양, 건축 양식에 대한 증거와 자료가 부족해 3차원 데이터를 확보할 수 있는 대상이 없을 때는 ‘가상 추정’ 복원을 진행한다”며 “문화재의 고증과 복원에 가장 근접한 학계의 정설에 기반해 3D 모델링을 하게 된다. 만약 문화재를 고증하는 근거인 이론이나 정설이 바뀐다면 언제든지 수정이 가능하다는 것 또한 디지털 복원의 장점”이라고 밝힌 바 있다.박진호 교수는 “우리나라뿐만 아니라 세계문화유산 중에는 멀쩡히 남아 있는 것보다 훼손되고 망실된 경우가 더 많다. 따라서 현재는 가상 추정을 통해 디지털 문화재 복원에 한 걸음 더 다가가는 단계라고 할 수 있다”며 문화유산 디지털 복원의 현실적 방법론을 제시했다.



김영택 화백의 황룡사 펜화 작품(왼쪽)과 펜화 기반 황룡사 디지털 복원도(오른쪽).디지털 기술의 발전으로 콘텐츠의 소비 취향이 세분화, 다양화되고 시공간을 초월한 신기술 융합 체험 콘텐츠의 활성화, 쌍방향적 소비를 지원하는 상호작용형 매체 활용 확대 등 문화유산의 향유방식도 변화하고 있다.우리는 역사를 책과 사진으로만 접해서는 그 당시의 모습을 머릿속에 그리기는 쉽지 않다. 문화재 디지털 복원 작업은 역사 속으로 직접 들어가는 듯한 경험을 제공하는 일종의 ‘디지털 타임머신’이라고 할 수 있다.그래서 신라왕경 복원 정비사업은 최첨단 기술을 활용한 디지털 재현, 수요자 중심의 복원을 통해 다양한 콘텐츠와 스토리가 있는 의미 있는 복원사업이 되도록 추진돼야 한다.현실로 다가올 ‘서라벌 천년 시간여행’문화유산의 과거 모습을 가상공간에 구현하여 보존·복원 기초연구로 활용하고, 국민들이 간접 체험을 통해 역사문화에 대한 정체성을 인식하는 것이 중요하다. 고증이 어려운 중요 건축물에 대하여 디지털 기술을 활용한 체험 콘텐츠 제작을 통해 신개념의 문화 향유 서비스가 필요하다.디지털 재현에 대해 안형기 박사(한국고고환경연구소 디지털콘텐츠실장)는 “문화유산의 본질과 당시 사람들의 이야기, 더 나아가 지형을 포함한 당시의 세계관을 재현하는 것이 중요하다”며 “단순한 영상콘텐츠에서 탈피하여 생활상 복원과 스토리텔링을 중심으로 대중에게 소구력 있는 디지털 헤리티지 콘텐츠로 탄생해야 한다”고 강조했다.신라 서라벌은 과거의 동로마 제국의 수도 콘스탄티노플, 당나라 장안성 그리고 이슬람 제국의 수도였던 바그다드와 함께 세계적인 고대(古代) 4대 도시다. 오늘날의 경주는 풍부한 문화유산을 보유하고 있으며, 대한민국의 대표 디지털 복원 대상지로 최적지다. 실체적 복원 완성도 향상과 데이터 활용을 통한 원형 보존, 관광자원화, 연관 산업 육성 등 미래 먹거리산업의 디딤돌이다.



신라왕경 상상도.올해부터 3개년에 걸쳐 ‘서라벌 천년 시간여행’ 사업이 시작된다. 디지털 콘텐츠 개발이 그 핵심내용이다. 문화재청 자료에 따르면 1차연도인 올해 월성, 동궁과 월지, 동부사적지대, 천관사지가 그 대상이다. 2차연도(2024년)는 인왕동사지, 춘양‧월정교지, 대릉원, 황룡사지다. 마지막 3차연도(2025년)는 분황사지, 구황동원지유적, 남산일원, 사천왕사지, 첨성대, 미탄사지까지 디지털로 복원한다. 우리가 역사책에서만 봤던 천년 신라의 모습이 현실로 다가오게 된다.국가적 프로젝트로 채택돼 진행되는 이 사업은 궁극적으로 문화유산의 원천자료를 확보하여 국민들에게 멸실 문화유산의 간접 체험을 제공, 역사‧문화 인식 제고와 문화유산 향유권을 신장하는 것이다. 또, 지역 특화 디지털 콘텐츠 제작․전시를 통해 지역 경제‧관광 활성화와 디지털 문화유산 복원 관련 산업의 민간 육성, 전문인력 양성과 일자리 창출을 지원하는 주춧돌이다.무엇보다 지금은 사라지고 없는 건축 유적을 실물 복원과 마찬가지로 유적 현장에서 직접 볼 수 있는 기회를 제공하는 것이다. 디지털 혁명기, 건축유적 복원의 새로운 방법으로 문화유산의 가치 회복에 이바지하리라 본다.디지털 헤리티지 효과문화재가 주는 전통 그대로의 고즈넉한 모습과 세월에서 느껴지는 벅차오르는 감동은 우리 가슴 속의 카타르시스다. 제4차 산업혁명 시대에 새로운 매체를 통해 작금의 우리에게 향유하도록 하는 것 또한 무수한 세월을 쌓아온 문화재가 새로운 역사를 쌓아가는 과정이다. 2003년 유네스코(UNESCO)가 『디지털 유산 보존에 관한 헌장』에서 제시한 ‘디지털 헤리티지’가 그 기본정신이다.



신라왕경 360방 CG(사진=경주시 제공).따라서 신라왕경의 실체는 오랜 시간이 걸리더라도 반드시 복원돼야 한다. 하지만 실물 복원에는 신중함이 요구된다. 디지털이 항상 과거의 유산을 완벽하게 재현할 수 있는 건 아니기 때문이다. 디지털 복원은 언제든지 새로운 이론이나 고증 자료가 나오면 쉽게 수정할 수 있어서 실제 신라왕경 디지털 복원에 나서기 전에 우선하여 주효한 작업이다.일찍이 로마는 유럽의 대표적 고도(古都)로서 매년 수백만의 관광객들이 전 세계에서 몰린다. 아날로그 유적이 많이 산재해 있기 때문에 그 문화유산만으로도 매혹적인 콘텐츠가 된다. 아직 신라 경주는 유럽의 로마처럼 전 세계에 잘 알려진 고도는 아니다. 그러나 ‘서라벌 천년 시간여행’ 콘텐츠를 통해 전 세계를 대상으로 아주 매력적인 ‘디지털 가상관광’으로, 즉 ‘K-문화유산’으로서 활용 가능성이 무한하리라 본다.전 세계는 관광산업 재도약을 위한 경쟁 국면에 본격적으로 돌입했다. 우리나라도 마찬가지다. 한국관광의 킬러 콘텐츠는 K-컬처라는 소프트파워다. 한국을 찾는 외국인을 대상으로 매력적 K-관광 경험을 제공해야 한다. 그래야만 지속가능한 방한 관광의 파급력을 얻을 수 있다. 더 자주 더 오래 머무는 한국관광 실현을 위해서 특색있는 관광콘텐츠 확충이 시급하다. 또, K-콘텐츠로 문화유산을 통한 산업화에 활력이 되도록 하는 것도 무엇보다 중요하다.디지털 헤리티지를 통한 신라 경주! K-관광 효과를 위해서는 주도면밀한 마스터플래닝이 중요하다. 소프트웨어(콘텐츠)와 하드웨어(장소)는 어느 정도 갖춰졌다. 이제 휴먼웨어다. 준비하는 문화재청 디지털문화유산팀과 국립문화재연구원, 경주시의 역할이 중요하다. 이런 국가 차원의 디지털 프로젝트는 쌍방향의 국민적 공감대 형성을 충분히 고려해야 한다. 경주시 문화재과(대구 소재 H아트프로젝트 위‧수탁)가 올해 5월 천마총 발굴 50주년을 기념해 문화재청 국비공모선정사업으로 추진하는 ‘2023 문화유산 미디어아트–경주역사유적지구 대릉원’도 마찬가지다.이탈리아 로마가 로마시대 잘 남아있는 문화유산으로 ‘아날로그 고도’를 이루었다면 우리는 신라왕경 디지털 프로젝트를 통해 ‘디지털 고도’를 이룰 수 있다. 경주가 품은 유네스코 세계유산 경주역사유적지구와 3년 뒤 탄생할 신라왕경 디지털 콘텐츠가 서로 잘 융화된다면 ‘K-고도’까지 기대해볼 수 있다. 그렇게만 된다면 경주는 전 세계인이 방문하고 싶은 관광명소로 탈바꿈할 수 있을 것이다.",105,https://n.news.naver.com/mnews/article/092/0002285701?sid=103
[G-브리핑⓵] ‘데스티니 차일드’ 내러티브 던전 ‘에끌로그’ 추가,2023.03.16. 오후 12:16,"시프트업(대표 김형태)은 데스티니 차일드에 내러티브 던전 ‘에끌로그(Eclogue)’를 추가하고 신규 캐릭터 ‘디케’를 업데이트했다고 16일 밝혔다.내러티브 던전은 일정 기간동안 개방되는 이벤트 던전으로 새로운 차일드의 스토리를 접하고 여러 미션을 통해 각종 보상을 획득할 수 있다. 이단 심문관 ‘디케’가 퇴마사 협회의 오세아니아 지부장을 조사하라는 상부의 지시를 받고 조사하던 중, 배후에 더 큰 세력이 있음을 직감하며 이야기가 전개된다.레이스 챌린지가 같은 기간 진행된다. ‘레이스 챌린지’는 난이도가 상승하는 총 10개의 구간으로 구성되어 있다.◆ 발로란트, VCT 퍼시픽 주제곡 공개아시아 지역 권역 이스포츠 대회인 VCT 퍼시픽은 15일 ‘Making Waves(메이킹 웨이브스)’라는 제목의 타이틀 곡을 공개했다. ‘Making Waves’는 라이엇 게임즈와 (여자)아이들의 멤버인 ‘민니’, Don Diablo(돈 디아블로)의 컬래버레이션을 통해 만들어졌다.VCT 퍼시픽은 다양한 문화권을 존중하며 파도와 같이 끊임없이 부딪히고 도전하겠다라는 의미를 담아 ‘파도를 일으켜라(The Rising Waves)’라는 모토를 내세웠다. 민니와 돈 디아블로가 참여한 타이틀 곡인 ‘Making Waves’ 또한 VCT 퍼시픽의 리그 브랜드에 맞는 리듬과 가사를 담고 있다.민니는 (여자)아이들에서 만들어냈던 몽환적인 분위기에서 벗어나 강렬한 음색과 파워풀한 창법 등 전과 다른 모습을 보여줬다.한편 VCT 퍼시픽은 오는 25일 서울 마포구 상암 아프리카 콜로세움에서 개막전을 열고 10주 동안의 혈전에 돌입한다.◆ ‘배틀그라운드’ 22.2 업데이트 라이브 서버 적용크래프톤(대표 김창한)은 ‘PUBG: 배틀그라운드(이하 배틀그라운드)’의 22.2 업데이트를 라이브 서버에 적용했다고 16일 밝혔다.다양한 무기 선택권을 제공하기 위해 신규 총기 ‘FAMAS’를 선보인다. FAMAS는 5.56mm 탄약을 사용하는 돌격소총(AR)으로 빠른 발사 속도와 강력한 초당 피해량을 자랑한다. 독특하고 세련된 디자인을 갖춘 것은 물론 단발, 점사, 연사 모드까지 사용 가능하다.데스턴 맵의 지형도 변경됐다. 이용자들이 더욱 원활하고 안전하게 이동할 수 있도록 바클리프트(Barclift)와 투리타(Turrita) 사이에 언덕이 추가됐다.출시 6주년을 맞아 다양한 즐길 거리도 마련됐다. ‘특별 보급’ 이벤트를 통해 미션을 수행하면 6주년 기념 스킨, 헌터 상자, 밀수품 쿠폰 등 다양한 보상을 얻을 수 있다.배틀그라운드 개발 로드맵을 발표하는 ‘개발자 토크: A New 6eginning’ 행사도 진행된다.◆ ‘월드 플리퍼’ 신규 한정 캐릭터 추가카카오게임즈(대표 조계현)는 16일 모바일 액션 RPG ‘월드 플리퍼’에 신규 한정 캐릭터를 추가하고 서머 시즌 이벤트를 개최한다고 밝혔다.이번에 등장한 ‘★5 [네이키드 프린세스 리리스]’는 스트라토스 왕가에 남겨진 마지막 공주로 수많은 눈부신 빛의 구슬을 폭발시켜 필드 전체에 광속성 대미지를 가하고 잠시 동안 마비 효과를 준다. ‘★5 [서머 세이버 세라]’는 전직 보안부대 수석으로 바이크에서 전방에 미사일을 연속 발사해 주위의 적에게 뇌속성 대미지를 입힌다.이 외에도‘★4 [용의 맹우 아젤]’이 한정 캐릭터로 등장하고 ‘★5 [자애로운 구세주 맘나리아]’, ‘★3 [신출내기 모험가 미레트]’ 등의 신규 캐릭터를 함께 추가한다.카카오게임즈는 오는 27일까지 ‘★5 [네이키드 프린세스 리리스]’를 포함한 한정 캐릭터 3종과 신규 캐릭터 2종이 대거 등장하는 ‘픽업 이벤트’를 실시한다.이와 함께 서머 시즌 이벤트도 진행한다. 오는 30일까지 게임에 접속하는 이용자 전원에게 매일 ‘성도석 50개’를 지급한다. 4월 10일까지 매일 캐릭터 ‘1회 무료 픽업’을 제공한다.",105,https://n.news.naver.com/mnews/article/009/0005102293?sid=103
"SK이노-국민대, 그린 탄소감축 디자인에 '맞손'",2023.03.16. 오후 2:57,"'그린 ESG 디자인 개발산학협동 업무협약' 체결SK이노베이션과 국민대는 16일 서울 종로구 SK서린빌딩에서 ‘그린 ESG 디자인 개발산학협동 업무협약(MOU)을’ 체결했다.김준 SK이노베이션 부회장과 임홍재 국민대 총장은 이날 협약식에서 양 측의 강점인 친환경, 디자인 분야의 역량을 모아 SK이노베이션의 그린 이야기를 보다 많은 이해관계자들에게 전하는 방안을 찾는데 뜻을 모았다.양 측은 SK이노베이션의 파이낸셜 스토리 ‘카본 투 그린’을 직관적이고 친숙하게 표현하는 캐릭터, 글씨체, 조형물, 친환경 상품(굿즈) 등을 개발할 계획이다. 지난해 첫 선을 보인 SK이노베이션의 친환경 캐릭터 ‘행코(행복코끼리)’는 행코와 함께하는 ‘프렌즈 캐릭터’도 개발해 행코가 전하는 친환경 이야기를 더욱 풍부히 만들게 된다.SK이노베이션이 추진 중인 에너지 슈퍼스테이션, 도시유전, 폐플라스틱 재활용 종합단지(ARC), 미래형 전기차(EV) 배터리 등의 그린 신사업도 디자인 소재가 된다. 신사업들은 인류가 당면한 환경위기를 극복하기 위한 넷제로 실현에 반드시 필요하다.



김준 SK이노베이션 부회장(오른쪽에서 3번째)과 임홍재 국민대 총장(왼쪽에서 4번째)이 16일 오후 서울 종로구 SK서린빌딩에서 ‘그린 ESG 디자인 개발산학협동 업무협약(MOU)’을 체결 후 SK이노베이션 친환경 캐릭터 ‘행코’(가운데)와 기념 촬영을 하고 있다.하지만 이전에 없던 새로운 사업의 특성상 보다 많은 이해관계자들에게 친숙하게 다가가야 하는 과제 또한 안고 있다. 국민대 디자인계열 교수진 및 학생들은 이를 조형물로 만들어 미래 넷제로 시대의 모습을 먼저 엿볼 수 있게 할 계획이다.폐배터리 재활용(BMR), 탄소 포집∙저장∙활용(CCUS), 소형모듈원전(SMR), 차량용 경량화소재 UD Tape, 리튬이온배터리분리막(LiBS)처럼 현재 진행 중인 SK이노베이션 계열의 사업과 제품에 대해서도 친환경 정체성을 확고히 하는 방향으로 디자인을 만드는데 머리를 맞댄다.SK이노베이션과 국민대는 산학협력으로 탄생하는 디자인을 ‘공유인프라’화해 친환경을 다루는 사업, 사회공헌 등에서의 소재로 적극 활용하는 방안을 모색한다. 올 10월에는 서울 중구 동대문디자인플라자(DDP)에서 국민대 주관의 ‘행복그린 전시회’(가칭)를 개최해 산학협력 결과물을 소개하고, 친환경과 탄소감축 노력에 대한 대국민 인식 변화를 이끌어내는 계기로 만들 계획이다. SK이노베이션은 전시회 이후에도 다양한 플랫폼에서 산학협력 결과물들을 선보일 방침이다.김준 SK이노베이션 부회장은 “국민대와의 산학협동은 ESG와 탄소감축에 공감하는 신진 학생작가들이 ‘친환경’ ‘탄소감축’ ‘그린’을 실용적, 예술적으로 자유롭게 구현하는 계기가 될 것”이라며 “탄소감축을 위한 SK이노베이션 ESG 경영의 진정성을 널리 알리는 기회가 되기를 바란다”고 말했다.",105,https://n.news.naver.com/mnews/article/092/0002285704?sid=103
