title,date,main,section,url
"""살해당할 확률 두 배""…공포에 떠는 美 임산부들[과학을읽다]",2021.11.20. 오전 7:00,"-美 연구 결과, 주요 질병 대비 살해 당한 숫자 두 배-나이 어리고 흑인 여성일수록 위험도 높아



미국에서 임산부들이 임신 관련 질병보다 남편 등에 의해 살해되는 경우가 훨씬 더 많다는 충격적인 조사 결과가 나왔다.19일 국제학술지 네이처에 따르면, 최근 비제이 싱 미국 미시간대 의과대 교수 연구팀은 사상 처음으로 미 전역에 걸쳐 임산부의 사망 원인을 구체적으로 분석해 이같은 결과를 얻었다.연구팀은 2018~2019년 사이 2년간 임신 중 또는 산후 1년 이내에 살해 당한 여성의 숫자를 273명으로 파악했다. 이는 출혈ㆍ태반장애 등 임산부의 주요 사망 원인으로 분류된 질병으로 숨진 숫자 보다 두 배 이상 많은 수치다. 또 임신하면 살해당할 위험이 높아지는 것으로 조사됐다. 10~44세 사이에 임신 중이거나 산후 1년이 지나지 않은 여성의 사망 원인 중 타살의 비율은 그렇지 않은 여성보다 16% 더 높았다.연구팀은 2018~2019년 사이에 미국 질병통제센터(CDC) 소속 국립건강통계센터가 보유한 50개 주의 사망 통계를 분석해 이같은 결과를 얻었다. 미국 정부는 2003년 이후 임신 중이거나 산후 42일 또는 1년 이전에 사망한 사람의 사망 증명서에 죽음의 원인을 명시하도록 의무화하기 시작했다. 2018년 이후 실제로 미국내 50개 주 모두가 이같은 제도를 도입해 시행하기 시작했다. 이에 따라 연구팀은 2018~2019년에 수집된 해당 데이터를 분석한 결과 이같은 결론을 얻었다. 임산 중 또는 출산 1년 이전  살해당한 여성의 숫자는 부유한 주들을 중심으로 미국 전역에서 늘어나는 추세다.전문가들은 이미 가정 폭력 등 학대에 노출돼 있는 여성들이 임신을 할 경우 살인의 위험이 증가할 것으로 예상해 왔다. 실제 연구팀은 살해된 임산부들의 3분의2가 자택에서 숨졌는데, 이것은 대체로 남편 또는 남자친구에 의해 살해당했다는 것을 의미한다고 봤다.연구팀은 특히 흑인 여성들이 임신 중 살해 당할 위험이 더 크다는 사실도 확인했다. 통계에서 임신한 흑인 여성의 경우 살해당할 확률이 임신하지 않은 경우보다 3배나 더 높았다. 뿐만 아니라 흑인 여성들은 산부인과 관련 질병으로 인한 사망 위험에도 훨씬 더 많이 노출돼 있었다. 임신 중 또는 산후 1년 이전에 산부인과 질환으로 숨진 흑인 여성의 숫자는 비히스패틱계 백인 여성보다 2.5배 더 많았다.연령 별로는 10~24세의 어린 여성들은 나이가 더 많은 여성들에 비해 임신 중 살해될 확률이 더 높았다.싱 교수는 ""이번 연구 결과는 정책 당국자나 병원들이 임신 중이거나 최근 출산한 여성들의 안전을 개선하기 위해 사용되어야 한다""면서 ""사회적으로 임신이 행복한 시간이라는 생각이 있지만, 많은 여성들에게 그것은 사실이 아니며 많은 임산부들이 집에서 안전하지 않다""고 말했다.",105,https://n.news.naver.com/mnews/article/277/0005002577?sid=103
"위메이드, 디파이 서비스 '클레바' 연내 출시한다",2021.11.19. 오후 2:20,"클레이튼 최초의 레버리지 이자농사 서비스…""연내 출시 목표""



위메이드, 디파이 서비스 '클레바' 출시 (위메이드 제공) © 뉴스1(서울=뉴스1) 송화연 기자 = 위메이드는 탈중앙화금융(디파이) 서비스 '클레바'(KLEVA)를 출시한다고 19일 밝혔다.디파이는 전통적인 금융기관에 의존하지 않고 블록체인과 스마트 컨트랙트를 이용해서 금융 서비스를 제공하는 것을 의미한다. 디파이 참여자들은 암호화폐를 예치하고 유동성을 공급하는 대가로 보상을 받게 되는데, 이러한 일련의 과정을 '이자농사'라 부른다.클레바는 클레이튼(카카오 블록체인 플랫폼) 최초의 레버리지 이자농사 디파이 서비스로, 참여자들은 담보물을 바탕으로 암호화폐를 대여해 더 큰 자산으로 이자농사에 참여할 수 있다.익명 기반의 디파이 서비스가 악의적인 자금 갈취의 위험을 안고 있는 것에 비해, 클레바는 상장사 위메이드가 제공하는 서비스라는 점에서 충분히 신뢰할 수 있다는 점도 장점이다.위메이드는 향후 클레이튼 기반의 다른 디파이 서비스들과 시너지를 내며 클레바의 생태계를 확장해 나가는 것을 목표로 하고 있다. 첫 번째 파트너로 클레이파이의 런치패드 플랫폼 '클레이스타터'를 통해 사전 마케팅을 진행할 예정이다. 클레바는 위메이드와 위메이드가 투자한 스마트 컨트랙트 기술 스타트업 수호아이오가 공동 개발했다. 위메이드가 그동안 축적해 온 블록체인 서비스 경험과 보안에 강점을 가진 수호아이오의 개발력이 시너지를 낼 것으로 기대된다.장현국 위메이드 최고경영자(CEO)는 ""이미 서비스를 하고 있는 암호화폐, 블록체인 게임, 개별 게임 코인, 코인 거래소, 대체불가능한토큰(NFT) 거래소에 이어, 디파이를 출시해 이미 블록체인 생태계 퍼즐을 완성했다""며 ""실서비스 경험으로 고도화될 디파이는 위믹스 블록체인 이코노미의 금융 플랫폼이 될 것이다""고 말했다.한편 클레바는 위메이드의 싱가포르 법인 위메이드트리를 통해 연내에 출시 예정이며, 클레바 웹사이트에서 계속 정보를 공개해 나갈 계획이다.",105,https://n.news.naver.com/mnews/article/421/0005735676?sid=103
"""PPL 덕에 한국 드라마 성장..그러나 이젠 바뀔 때 됐다""",2021.11.20. 오후 4:00,"[편집자주] '간접광고'(PPL)는 K콘텐츠의 딜레마다. 극의 흐름을 다소 훼손하더라도 치솟는 제작비를 충당하기 위해 선택해 왔던 고육책이다. 그러나 'PPL 프리' 제작환경을 보장하는 글로벌 OTT의 등장으로 상황은 달라졌다. 이용자들은 유료로 구독하면서 광고까지 보길 원하지 않는다. 국내 PPL의 현주소와 개선책을 짚어본다.[[MT리포트]K콘텐츠 발목잡는 PPL④'PPL 대부' 최충훈 대표 인터뷰]



최충훈 어지니스 대표.국내 1호 PPL 마케팅 회사 어지니스의 최충훈 대표는 ""세계화된 한국 드라마는 국내기업뿐 아니라 해외 기업들에게도 매우 매력적인 마케팅 공간""이라며 ""기존 중국, 일본 위주로 PPL 문의가 종종 들어오는 수준이었다면, 최근에는 인도네시아 등 동남아 쪽에서도 문의가 많이 오는 상황""이라고 말했다. 한국 드라마가 넷플릭스 등 글로벌 OTT를 통해 방영되면서 해외 시청자들에게 인지도를 높일 기회로 판단했기 때문이다.━영화서 시작한 PPL 드라마로, 2002년 겨울연가가 기점━최 대표는 PPL계 대부로 통한다. 국내에서 처음 PPL 총괄 시스템을 만들어냈다. 2010년 PPL 규정이 생기기 전인 1998년부터 PPL사업을 시작했다. 지상파 방송국에서 소품 보조, 카메라 보조, 매니저 등으로 일하다 미국 할리우드의 PPL 사례를 본 게 계기가 됐다. 그는 ""드라마 제작사와 기업을 찾아다니며 영화 '이티 (E.T.)'에서 소년이 허시 초콜릿 '리세스 피시스'를 건네는 장면으로 엄청난 매출 상승을 기록했던 사례를 프레젠테이션하며 하나씩 설득했다""고 당시를 회상했다. 초기에는 영화 PPL이 많았지만 시간이 지나며 드라마 PPL 비중이 훨씬 늘어났다. 영화는 촬영 후 개봉까지가 길고, 개봉 자체도 보장되지 않기 때문에 광고주들이 점차 순환이 빠른 드라마로 눈을 돌린 것. 그는 ""2002년 겨울연가를 기점으로 PPL이 활성화되기 시작했다""고 말했다.  최근 PPL 과용에 대한 비판과 관련  그는 '콘텐츠 생산의 급증'을 원인으로 꼽았다. 그는 ""과거 지상파3사만 있었을 때에는 연간 생산되는 콘텐츠가 제한적이어서 소수의 작품에 PPL을 원하는 광고주들이 몰려 제작진의 구미에 맞게 노출했다""며 ""반면 지금은 콘텐츠 수가 워낙 많다 보니 PPL을 받기를 원하는 곳이 PPL을 하고 싶어하는 광고주의 수를 훌쩍 넘게 된 것""이라고 설명했다.



서브웨이 ppl이에 촬영현장 분위기도 바뀌었다. 최 대표는 ""예전에는 PPL을 들고가면 좀 비협조적이었다. '우리가 이걸 왜 해줘야 하지?' 하는 식이었다""며 ""지금은 당연히 해야 한다고 생각하는 분위기""라고 전했다. 그러면서 ""무게추가 광고주 입맛으로 기울게 돼 과도한 PPL이 양산되고 있는 것이 사실""이라고 덧붙였다. 최 대표는 ""이를 무조건 제작사와 광고주 탓으로만 돌리면 안된다""면서 근본 원인은 과도한 출연료와 스타 작가의 고료라고 지적했다. 그는 ""국내 자본으로 제작하는 대부분의 드라마들이 천정부지로 높아진 제작비를 충당하는 유일한 길은 PPL""이라면서 ""점차 해외 자본이 들어오고 해외 판권도 확장돼 제작사의 수익구조가 정상화되면 이 같은 현상은 사그라들 것""이라고 전망했다. 그는 이어 ""제 입장에서도 지금처럼 과도하게 PPL이 나오는 시장이 썩 좋지만은 않다""며 ""장기적으로 봤을 때 PPL 시장이 더 커지려면 PPL도 적정선의 수위가 필요하고, 제작사의 수익성에도 적절히 도움이 되는 시장이 되어야 한다""고 전했다. ━드라마 넘어 PPL 시장 더욱 커질 것..모호한 규제 해소돼야 발전 가능━모호한 현행 PPL 규제도 꼬집었다. 최 대표는 ""심의마다 기준이 좀 달라서 난감한 때가 있다""며 ""어쩔 때는 괜찮은데 어쩔 때는 사소한 것도 문제가 될 때도 있고, 잣대가 명확하지 않은 부분이 저희를 힘들게 하는 요소 중 하나""라고 말했다. 방송법 시행령에 따르면 간접광고는 '프로그램의 내용·구성에 영향을 미치지 않아야 하고, 시청자의 시청흐름을 방해하지 않아야 한다. 규정 위반 여부는 방송통신심의위원회 위원들의 주관과 재량에 달려 있는 셈이다. 최근 예능 PPL이 늘어난 것도 이와 무관치않다는 지적이다. 최 대표는 ""드라마는 이야기가 있는 극이다 보니 표현에 제약이 있지만 예능은 재미있게 표현이 가능하다""고 전했다. 기존에 드라마와 예능의 PPL 비중이 9대 1이었다면, 지금은 6대 4까지 올라왔다.  최 대표는 최근 콘텐츠 시장이 활성화되면서 글로벌 PPL 시장도 더 커질 것으로 전망했다. 그는 ""PPL이 있었기 때문에 한국 콘텐츠가 지금처럼 성장하지 않았나 생각한다""며 ""한국 콘텐츠의 위상에 맞는 PPL 시스템을 발전시키는 것은 앞으로의 과제""라고 밝혔다. 이어 ""최근 글로벌 파트너사와 해외 콘텐츠에 국내 기업 PPL도 진행 중""이라면서 ""국내에서 PPL을 성공시킨 경험을 바탕으로 국내 기업들이 해외 시청자들에게 까지 닿을 수 있도록 건강한 생태계를 만들기 위해 노력하겠다""고 밝혔다.",105,https://n.news.naver.com/mnews/article/008/0004673050?sid=103
오징어게임 깐부 할아버지 걸린 치매..치료제 시장 열릴까,2021.11.20. 오후 8:01,"글로벌 치매 치료제 시장, 오는 2024년 126억달러 규모 성장 예상국내 기업, 경구용·패치제·디지털 치료제 등 다양한 형태의 치매치료제 개발 중     



넷플릭스 '오징어 게임'에서 오일남 역을 맡은 배우 오영수씨. [사진 넷플릭스]    # “우린 깐부잖아. 깐부끼린 네 거 내 거가 없는 거야”      '오징어게임'은 456억원의 상금을 타기 위해 목숨을 걸고 게임을 펼치는 사람들의 이야기를 담은 작품이다. 극 중 성기훈(이정재)은 치매 노인 오일남(오영수)와 힘든 게임 과정에서 서로를 도와왔다. 하지만 목숨이 오고가는 구슬치기 게임에서 정신이 오락가락하는 오일남을 성기훈이 이용하면서 극의 긴장감은 고조됐다. 결국 오일남이 이를 알면서도 게임에 져줬다는 사실을 알게 된 성기훈은 눈물을 흘리게 된다.      이는 전 세계적으로 선풍적인 인기를 끈 넷플리스 오리지널 콘텐트 '오징어게임'의 한 장면이다. 극 중 인물인 오일남이 앓고 있는 ‘치매’에 관심이 쏠리면서, 관련 치료제 시장도 주목 받고 있다.       치매는 후천적 요인에 의해 기억력, 판단력, 언어, 사고력, 학습능력 등 주요 신경인지장애가 나타나 일상생활을 혼자 하기 어려운 상태의 질환이다. 치매는 퇴행성변화를 일으키는 원인에 따라 알츠하이머병, 혈관성치매, 루이소제 치매, 약물성 치매 등 70여 가지로 구분된다.      급속한 고령화로 인해 국내 치매 환자는 급증하고 있다. 2020년 기준 65세 이상 인구 813만 중 10.3%가 치매이며 환자 수는 84만명이다. 치매 환자가 늘고 있는 만큼 치매 치료제 시장도 꾸준한 성장세를 보이고 있다. 국내 치매 치료제 시장은 연평균 8.6% 성장하면서 2025년에는 3600억원 규모로 성장할 것으로 전망되고 있다. 글로벌 치매 치료제 시장 규모는 현재 약 30억 달러(약 3조5560억원)에서 오는 2024년 126억 달러(약 14조9360억원) 규모로 커질 것으로 예상된다.      물론 치매 치료제 개발이 쉬운 건 아니다. 지난 6월 미국 바이오젠사가 개발한 ‘아두카누맙’이 미국 FDA로부터 세계 첫 ‘치매 치료 신약’으로 조건부 허가를 획득했다. 하지만 미국 의료·과학계 전문가들은 임상3상 효과를 입증할 근거가 불충분하다면서 효능과 승인 절차에 대한 의문을 제기하고 있다. 또한 최근 미국 증권거래위원회(SEC)가 치매 치료제 실험 결과를 조작했다는 의혹을 받는 바이오 업체 ‘카사바사이언스’에 대한 조사에 착수하기도 했다.      치매 치료제 개발을 선도하는 미국이 각종 논란에 휩싸이면서 국내 제약·바이오 기업이 개발하고 있는 치료제가 기회를 얻을 수 있을 거란 평가가 나오고 있다.        국내에선 최근 경구용부터 피부부착형(패치제), 디지털 치료제 등 다양한 형태의 치매 치료제가 개발 중이다. 우선 셀트리온은 지난 5일 알츠하이머 치매 치료용 도네페질(Donepezil) 패치제 ‘도네리온패치’가 식품의약품안전처로부터 품목허가를 획득해 세계 최초의 도네페질 패치제의 지위를 확보하게 됐다고 밝혔다.    도네리온패치는 한국, 대만, 호주, 말레이시아 등 4개국 약 400명의 경증 및 중등증 치매 환자를 대상으로 실시한 임상 3상 결과 유효성을 확보했다. 특히 경증 및 중등증의 알츠하이머 치매 환자들에게서 기억, 언어, 재구성, 행동, 지남력 등을 다루는 대표적 표준 도구인 ADAS-cog 평가에서 경구용 도네페질 대비 비열등성을 입증한 바 있다.    앞서 셀트리온은 지난 8월 도네페질 패치제를 주도적으로 개발해온 아이큐어와의 계약으로 도네리온 패치의 12년 국내 독점 판매 권리를 확보했다. 국내에선 셀트리온이 도네페질 패치를 판매하고, 아이큐어는 도네페질 패치의 생산·공급을 담당할 예정이다. 아이큐어는 지난 4월 미국 식품의약국(FDA)으로부터 임상 1상을 승인받으며 해외 진출에도 박차를 가하고 있다.    바이오 벤처기업 아리바이오는 최근 미국 보스턴에서 열린 ‘2021 알츠하이머 임상학회(CTAD)’에서 알츠하이머병 치료제인 ‘AR1001’의 미국 임상 2상 결과를 발표했다. 회사 측은 “미국 내 21개 임상센터에서 환자 115명을 대상으로 12개월간 진행한 임상 2상 시험에서 중대한 이상 반응이 발견되지 않았으며, 인지기능 악화 속도가 현저히 개선됐다”고 설명했다.      아리바이오가 개발 중인 알츠하이머 치매 치료제는 뇌 신경세포의 사멸을 억제하고 새로운 신경세포의 생성을 촉진하는 방식으로 먹는 형태인 경구용이다. 아리바이오는 임상 2상 결과를 바탕으로 내년 초 임상 3상 시험 진입을 목표로 하고 있다.      디지털 치료제 개발도 눈길을 끈다. 디지털 치료제는 IT기술을 활용해 모바일 앱, 가상현실(VR), 게임 등 다양한 형태의 소프트웨어로 질병을 예방하고 치료·관리해준다.    디지털 치료제 개발 업체 로완(ROWAN)은 국내 최고 신경과 전문 의료연구팀과 함께 디지털 종합 치매예방 프로그램 ‘슈퍼브레인’을 출시했다. 혈관위험 인자관리, 인지학습, 운동, 영양교육, 동기강화 등 다섯 가지 영역에서의 다중인지 중재 효과를 국내 최초로 입증했다. 현재 50여개 치매안심센터, 복지관, 병의원에 서비스 중이다. 로완은 LG유플러스, LG전자와 함께 '시니어 대상 디지털 헬스케어 사업 활성화를 위한 업무협약'을 체결하기도 했다.      업계 관계자는 “해외에서 승인·개발되고 있는 치매 치료제가 아직 효능·부작용 등의 문제가 제기 되고 있다”며 “국내 제약바이오기업이 개발하고 있는 치매치료제도 편의성·효과 등을 입증한다면 시장에서 상당한 영향력을 발휘 할 수 있을 것”이라고 말했다.",105,https://n.news.naver.com/mnews/article/243/0000018797?sid=103
[보안 따라잡기]“내년 ‘디지털 팬데믹’ 위험…딥페이크·모바일지갑 악용”,2021.11.20. 오후 2:41,"금융보안원, 사이버공격 대유행 `디지털 팬데믹` 경고`제로 트러스트` 도입 확산…운영복원력 확보해 대응""딥페이크, 모바일지갑 통한 새로운 공격 계속 시도될 것""



[이데일리 이후섭 기자] 내년에도 랜섬웨어 등 사이버 공격이 지속되면서 `디지털 팬데믹(Digital Pandemic)`이 발생할 수 있다는 경고가 나왔다. 딥페이크, 암호화폐, 모바일지갑 등을 통한 새로운 공격이 늘어날 것이라는 전망이다.금융보안원은 최근 `2022년 디지털금융 및 사이버보안 이슈 전망`을 통해 내년 주목해야 할 10대 이슈를 선정해 발표했다.첫번째 이슈로 꼽은 것이 `사이버공격의 대유행, 디지털 팬데믹`이다. 금융분야 사이버위협이 증가하고, 랜섬웨어 등 사이버 공격의 대유행으로 인해 디지털 팬데믹이 발생할 수 있다는 점을 경고한 것이다.이 외에도 사이버보안 분야에서는 △제로 트러스트 전략에 따른 차세대 보안환경 확산 △금융안정을 위협하는 제3자 리스크, 강조되는 운영복원력의 확보 등을 이슈로 선정했다.제로 트러스트는 보안 시스템을 통과해 내부에 접속한 사용자일지라도 신뢰하지 않고 검증하는 것을 기본으로 하는 보안 전략으로, 급증하는 사이버위협에 대응하기 위해 제로 트러스트 도입이 확산될 것으로 전망했다. 이에 더해 인공지능(AI), 자동화 등 신기술을 활용한 차세대 보안환경을 구축하는 기업이 늘어날 것으로 보인다.또 클라우드 사업자, 핀테크 기업 등 제3자 활용이 증가됨에 따라 발생하는 리스크를 관리할 필요성도 커지고 있다. 기업들은 이러한 위협에 노출될 것으로 대비해 재해 상황에서도 서비스를 지속 제공하고 운영 중단 상황을 예방·복구·학습할 수 있는 `운영복원력`을 확보하는데 치중해야 할 전망이다.글로벌 보안기업 체크포인트도 최근 `2022년 사이버 보안 예측 보고서`를 발표하면서 공급망 등을 노린 공격이 지속될 것으로 우려했다. 특히 딥페이크, 암호화폐, 모바일지갑 등을 통한 새로운 공격이 계속 시도될 것으로 내다봤다.체크포인트는 보고서를 통해 “사이버 범죄자들은 다양한 피싱공격과 사기를 감행하기 위해 내년에도 코로나19 관련 가짜뉴스 캠페인을 지속적으로 악용할 것”이라며 “모바일 지갑과 모바일 결제 플랫폼이 더 자주 사용되면서, 사이버 범죄자들은 모바일 디바이스에 대한 의존도 증가를 악용하기 위해 관련 기술을 발전시키고 변화시킬 것”이라고 전망했다. 또 딥페이크 기술을 악용하는 사례도 늘어날 것으로 봤다. 체크포인트는 “가짜 영상이나 음성을 만드는 기술이 이제는 무기화해 목표가 뚜렷한 콘텐츠를 제작하고 여론, 주가 또는 더 심각한 것들을 조작하는데 사용될 만큼 발전했다”며 “딥페이크 소셜 엔지니어링 공격을 사용해 민감한 데이터에도 접근할 수 있게 될 것”이라고 우려했다.",105,https://n.news.naver.com/mnews/article/018/0005090160?sid=103
"中 화제작 ‘천애명월도M’, 부산 지스타서 韓 이용자 첫 만남",2021.11.20. 오전 10:44,"텐센트 산하 오로라스튜디오, 지스타서 한국어판 첫 공개



 텐센트게임즈 산하 오로라스튜디오는 신작 모바일 MMORPG ‘천애명월도M’의 한국어 버전을 지난 17일 부산 벡스코에서 개막한 게임전시회 ‘지스타2021’을 통해 최초 공개했다.오로라스튜디오는 17일 ‘지스타TV’에서 쇼케이스를 개최하고 게임의 내용을 소개했으며 ‘지스타’ B2C관에 부스를 꾸리고 관람객들이 ‘천애명월도M’을 직접 시연할 수 있도록 했다. 각종 현장 무대 이벤트와 온라인 방송을 마련해 ‘지스타’ 관람객은 물론 방송 시청자들도 현장의 열기를 느낄 수 있었다.현장에서는 게임 시연 외에도 사전예약존이 운영됐으며 게임 속 캐릭터로 분장한 코스튬 플레이어와 함께 기념 촬영을 할 수 있는 포토존도 설치됐다. 



  



  



 또 유명 인플루언서가 참가하는 ‘천애명월도M’ PvP 매치로 볼거리를 마련하고 관람객들이 즉석에서 1대1 대결을 펼치는 논검 PVP 승률 이벤트, 캐릭터의 외형을 직접 꾸며보는 ‘도전! 커스터마이징’ 등의 이벤트도 각종 경품을 제공했다. 천하제일 천애 퀴즈쇼, 스탬프 미션, SNS 공유 이벤트 등도 진행 중이다.‘천애명월도M’은 유명 무협소설 ‘천애명월도’의 세계관을 기반으로 제작된 모바일 MMORPG다. 지난해 10월 중국 시장에 출시돼 애플 앱스토어 매출 순위 1위를 차지한바 있다.올해 ‘지스타’는 오프라인 전시를 재개해 메인스폰서 카카오게임즈를 비롯해 그라비티, 시프트업, 엔젤게임즈, 오로라스튜디오, 쿠카게임즈 등의 기업이 B2C부스를 마련하고 관람객을 맞이했다. 행사는 오는 21일까지 진행된다.",105,https://n.news.naver.com/mnews/article/009/0004881919?sid=103
