title,date,main,section,url
"TTA, 원엠투엠 기술총회에서 '릴리즈4' 승인",2022.12.05. 오후 2:33,"원엠투엠 로고한국정보통신기술협회(TTA)는 지난달 28일부터 이달 2일까지 TTA 글로벌 IoT시험인증센터에서 13개국 60여명이 참석해 '제57차 원엠투엠(oneM2M) 기술총회'를 성황리에 개최했다고 밝혔다.원엠투엠 기술총회는 사물인터넷(IoT) 국제 표준화를 위해 TTA를 비롯한 유럽 ETSI, 미국 TIA, 일본 TTC 등 세계 지역별 대표 표준화기관 8곳이 공동으로 2012년 설립한 표준화 기구의 최고의사결정 회의체다.이번 회의에서는 스마트-X(시티·헬스·교통·공장)과 재난안전 등 다양한 분야의 버티컬 산업을 지원하는 원엠투엠 릴리즈4 표준이 최종 승인(Ratification)됐다. 릴리즈4 표준은 24개 세부규격과 7개의 기술보고서로 구성해 5세대(5G) 이동통신 네트워크 연동, 최신 엣지 컴퓨팅 기술 연동, 스마트 디바이스 간 호환성을 보장하는 스마트 디바이스 템플릿(SDT) 4.0 등을 제공한다. 다양한 분야의 융합 산업에서 IoT 디지털 융합 플랫폼 제공을 가능하게하는 표준이다.차기 표준인 원엠투엠 릴리즈5는는 우리나라가 주도권을 가진 메타버스와 인공지능(AI), 오픈 데이터 라이센스 기능을 포함할 예정이다. 개인정보보호 중요성이 국제적으로 중요해 짐에 따라, EU의 일반개인정보보호법(GDPR), 한국의 개인정보보호법을 지원할 수 있게 개발하기로 결정했다. 이외에도, 확장가상세계(메타버스) 분야에 IoT 기술을 적용하기 위해 한성대학교와 세종대학교 등이 공동으로 제안한 '메타버스 IoT' 표준 개발이 본격 시작돼, 관련 용어와 정의, 유스케이스 발굴 등에 대한 논의가 활발하게 진행됐다.최영해 TTA 회장은 “원엠투엠 릴리즈 4 비준으로 다양한 버티컬 산업에서 IoT 확산이 가속화돼 향후 AI와 메타버스에서 필요한 다양한 기능 및 데이터를 제공하는 필수 플랫폼으로 발전할 것으로 기대된다”고 밝혔다.



TTA 로고",105,https://n.news.naver.com/mnews/article/030/0003063697?sid=103
"""사고사망 만인율 낮춘다""…통신4사, 업무용 차량에 안전보건 문구 부착",2022.12.05. 오후 2:01,"통신업계, 올해부터 자율적 안전보건협의체 운영…안전보건 수준 강화 노력통신4사(SK텔레콤·KT·LG유플러스·SK브로드밴드)가 고용노동부가 제시한 사고사망 만인율 감축 목표에 동참한다.만인율이란 사망자 수 1만배를 전체 근로자 수로 나눈 값을 말한다. 국내 사고사망 만인율은 OECD 평균 수준을 상회하고 있다.



고용노동부 로고. [사진=고용노동부.]통신4사는 고용노동부·안전보건공단과 함께 '통신4사-고용부·안전보건공단 안전보건 차량 공동 캠페인' 발대식을 개최했다고 5일 발표했다.4사는 올해 초부터 국내 통신업 안전보건 수준을 높이기 위해 각 기업 안전보건 담당 임원과 부서장이 참여하는 '통신 4사 안전보건협의체'를 운영하고 있다. 협의체는 업무용 차량 총 3천500대에 캠페인 핵심 슬로건을 부착해 운행할 계획이다.협의체는 안전보건 동향과 신기술, 사고사례, 협력사 안전보건 상생방안 등을 서로 공유하고 논의하고 있다. 4사에 따르면 이번 캠페인 참여도 협의체의 제안에서 시작됐다.고용노동부는 지난 11월 사고사망 만인율을 2026년까지 OECD 평균수준으로 감축하겠다는 목표를 제시했다. 이를 위해 사후 규제와 처벌 중심에서 위험성 평가 중심 자기규율 예방체계에 초점을 둔 중대재해 감축 로드맵을 발표했다.류경희 산업안전보건본부장은 ""로드맵 목표인 중대재해 감축은 사회구성원 모두가 안전을 중요한 가치로 여기는 문화가 정착되어야 가능하다""며, ""안전문화가 뒷받침돼야 안전선진국으로 갈 수 있다""고 강조했다.그러면서 ""통신업 종사자 산재 예방은 물론, 대국민 안전의식 개선을 위해 통신업을 대표하는 4개사의 자발적인 주도로 이루어졌다는 점에서 의미가 있다""면서 ""캠페인에 참여하는 4사 차량들이 전국을 누비면서 안전문화 인식 개선에 기여할 것으로 기대된다""고 전했다.통신4사 관계자는 ""안전보건협의체를 통해 스마트 안전 솔루션 등 산업재해 예방책을 함께 고도화하고, 근로자가 안전하고 건강하게 일할 수 있는 환경을 만들기 위해 지속 협력할 계획""이라고 강조했다.",105,https://n.news.naver.com/mnews/article/031/0000714761?sid=103
"한미마이크로닉스, 일체형 수랭 쿨러 신제품 2종 출시",2022.12.05. 오전 9:51,"ML240·360 프로즌튜나 Rev.2, 워터블록 팬 속도 향상한미마이크로닉스가 5일 데스크톱PC용 프로세서 냉각장치 2종을 국내 출시했다.신제품은 'ML240·360 프로즌튜나 Rev.2'로 각각 듀얼팬(120mm×2), 트리플팬(120mm×3)으로 구성되었다.워터블록 팬 속도는 2,300rpm에서 2,500rpm으로 높였다. 팬 구동 소음은 기존 제품과 같은 23dBA 수준으로 유지했다.



ML240·360 프로즌튜나 Rev.2. (사진=한미마이크로닉스)워터펌프에는 냉각수 온도, 펌프 속도를 직관적으로 확인할 수 있는 LED 인디케이터를 탑재했다. 또 워터펌프와 라디에이터 등 각 부품은 누수 방지를 위해 빈틈없이 결합되도록 설계했다.에이수스, 기가바이트, MSI, 애즈락 등 주요 메인보드 제조사가 제공하는 RGB LED 동기화 기능과도 연동된다.색상은 화이트 한 종류이며 가격은 미정.",105,https://n.news.naver.com/mnews/article/092/0002275528?sid=103
"깃랩, 단일 테넌트 SaaS 깃랩 데디케이티드 출시",2022.12.05. 오전 10:04,"깃랩 단일 테넌트 서비스형 소프트웨어(SaaS) 솔루션인 깃랩 데디케이티드를 한정 출시한다고 5일 밝혔다.새로운 제품은 복잡한 컴플라이언스 요건을 충족할 수 있도록 데이터 레지던시, 격리 및 프라이빗 네트워킹에 중점을 둔 엔터프라이즈 데브섹옵스 플랫폼의 모든 이점을 제공한다.또한 사용자는 격리된 인스턴스로 작업을 수행하면서 클라우드의 효율성을 활용하고, 플랫폼 및 인프라 관리의 오버헤드를 제거할 수 있다.



깃랩 데디케이티드(이미지=깃랩)깃랩의 2022년 글로벌 데브섹옵스 조사에 따르면, 보안 및 컴플라이언스는 개발자와 운영 및 보안 리더들에게 가장 중요한 투자 영역으로 부상했다. 글로벌 인터넷 정책 세분화가 증가하고, 데이터 거버넌스의 복잡성이 확대됨에 따라, 보안 및 컴플라이언스는 기술 리더들뿐만 아니라 대기업 및 규제 산업의 최우선 관심사가 되었다.사이버 보안이 보다 광범위한 영역에서 주목받게 되면서 기업들은 데브섹옵스 전략을 조정하고, 최신 기술을 채택해야 한다. 깃랩 데디케이티드는 이러한 목표를 실현하고, 복잡한 컴플라이언스 요건을 충족할 수 있도록 고객 네트워크와 깃랩 데브섹옵스 플랫폼 간의 비공개 연결뿐 아니라 향상된 배포 제어 기능을 제공한다.깃랩의 데이비드 디산토 제품 담당 부사장은 “우리의 목표는 고객의 조건에 맞게 고객을 만족시키는 것이다. 따라서 단일 배포 모델로 모든 고객의 요구를 충족시킬 수 없다는 것을 알고 있다.”며, “깃랩 데디케이티드는 기업들이 복잡한 컴플라이언스 및 규제 요건을 충족할 수 있도록 부가적인 배포 제어, 데이터 레지던시, 격리 및 프라이빗 네트워킹을 제공한다”고 말했다.복잡한 컴플라이언스 요건을 충족시키고 유지하는데 도움을 주는 깃랩 데디케이티드는 정부기관과 금융기관 등 엄격한 규제산업에 매우 적합하다. 이는 새로운 단일 테넌트 SaaS 제품으로, 지역에 기반한 비공개 연결로 지원되며, 깃랩에서 관리 및 호스팅이 이뤄지고, 한정 출시 기간 중 고객이 선택한 아마존웹서비스(AWS) 지역에 배포된다.기업들은 팀이 인프라를 구축하고, 관리할 필요 없이 깃랩의 데브섹옵스 플랫폼을 빌드할 수 있다. 이를 통해 기업들은 주기 단축, 비용 절감, 보안 향상, 개발자 생산성 개선 등 깃랩의 모든 이점을 활용할 수 있으며, 자체적인 호스팅보다 더 낮은 총 소유비용으로 보다 신속하게 가치를 창출할 수 있다.IDC의 데브옵스 및 데브섹옵스 수석 연구 분석가인 케이티 노턴은 “글로벌 인터넷 및 데이터 보호정책이 계속해서 진화함에 따라, 기업들은 기존 및 신규 컴플라이언스 요건을 반드시 충족할 수 있어야 한다”며 “깃랩 데디케이티드는 기업이 혁신적인 소프트웨어 개발과 같은 비즈니스에 중요한 작업에 집중할 수 있도록 보안 및 컴플라이언스 요건을 충족할 수 있는 단일 테넌트 SaaS 플랫폼을 제공한다”고 밝혔다.",105,https://n.news.naver.com/mnews/article/092/0002275534?sid=103
"위메이드, 위믹스 유통량 모니터링 시스템 구축한다",2022.12.05. 오후 5:14,위메이드가 크로스앵글과 ‘위믹스 유통량 모니터링 시스템 구축’을 위한 MOU를 체결했다. [위메이드 제공][헤럴드경제=김현일 기자] 위메이드가 가상자산 정보플랫폼 전문기업 크로스앵글과 ‘위믹스 유통량 모니터링 시스템 구축’을 위한 양해각서(MOU)를 체결했다고 5일 밝혔다.양사는 이번 MOU에 따라 ▷실시간 유통량 감시 서비스(Live Watch) ▷초과 유통 알람(Over circulation alarm) ▷분기별 온체인 감사 보고서(Quarterly On-chain Audit Report) 등 세 가지 영역에서 상호 협력하기로 했다.위메이드는 크로스앵글이 구축 중인 실시간 유통량 감시 서비스를 위믹스에 최초 적용할 예정이다. 이를 통해 위믹스의 유통 현황을 투자자들에게 투명하게 공개할 수 있을 것으로 보고 있다. 실시간 유통량 감시 서비스는 이르면 연내 크로스앵글의 가상자산 데이터 인텔리전스 플랫폼 ‘쟁글(Xangle)’에서 선보일 예정이다.계획량 이상의 위믹스가 유통될 경우 자동으로 공시가 되는 시스템도 마련한다. 쟁글의 공시는 ‘가상자산의 전자공시시스템’으로 불린다. 블록체인 프로젝트의 대외 신뢰도 평가 척도로 활용되고 있다.위메이드는 유통량 정보를 담은 온체인 감사 보고서도 분기별로 발간하는 등 크로스앵글의 서비스를 적극 도입해 위믹스를 첫 번째 모범 사례로 만들 계획이다.,105,https://n.news.naver.com/mnews/article/016/0002074263?sid=103
"대한민국 SW 대상 '원투씨엠'...이홍구 수산아이앤티 대표, 은탑산업훈장",2022.12.05. 오후 5:02,"원투씨엠(에코스 플랫폼 v2.19.2)이 올해 최고의 소프트웨어(SW)에 주어지는 대한민국 SW대상 대통령상을 수상했다. 이홍구 수산아이앤티 대표는 SW 산업 발전 유공으로 은탑산업훈장을 받았다.과학기술정보통신부는 5일 SW 산업인의 대한민국 경제성장에 기여한 공로를 치하하고 사기를 고취하기 위해 '제23회 소프트웨어 산업인의 날' 기념행사를 개최했다.과기정통부는 이날 'SW 산업 발전 유공'에 대한 포상(훈장·포장 등 정부포상 19점, 장관표창 25점)과, '대한민국 소프트웨어 대상'(3점) 및 '대한민국 소프트웨어 기술대상'(1점) 등 총 48점을 시상했다.SW 산업 발전 유공은 이홍구 수산아이앤티 대표가 은탑산업훈장을, 백준기 중앙대 부총장이 황조근정훈장을 수상했다. 문진일 드림시큐리티 대표와 이종열 삼성전자 부사장이 산업포장을 수상했다.강병준 전자신문 편집국장, 김종현 쿠콘 대표 등 7명이 대통령 표창을, 노종혁 주식회사 더씨에스알 전무, 박종일 한양대 교수 등 8명이 국무총리 표창을 받았다.



대한민국 SW대상은 원투씨엠(에코스 플랫폼 v2.19.2)이 대통령상을, 비아이매트릭스(AUD플랫폼7)와 아이렌소프트(오븐미디어 엔진 0.13.0)가 국무총리상을, 대한민국 SW 기술대상은 한국전력공사(IDPP Platform)가 과기정통부장관상을 수상했다.이종호 과기정통부 장관은 “나라 안팎으로 어려운 경제 여건에도 SW산업의 견조한 성장과 SW산업경쟁력 강화라는 성과를 이루어준 데 감사한다”며 “인공지능·데이터, 클라우드, 메타버스, 블록체인 등 대한민국 디지털 전략을 선도할 신기술의 근간이 SW인 만큼 우리나라 디지털 선도국가로 도약하는데 중추적 역할을 수행해 달라”고 말했다.이 장관은 “디지털 대전환의 선두에 선 SW 산업인과 청년인재가 한껏 역량을 발휘하고 자긍심을 가질 수 있도록 최선을 다해 지원하겠다”고 밝혔다.",105,https://n.news.naver.com/mnews/article/030/0003063780?sid=103
[DR 특집]최적 솔루션으로 업무 연속성 확보해야,2022.12.05. 오후 4:02,"디지털 전환이 가속화되며 정보기술(IT)이 산업 전반에 필수 기본 요소로 자리잡았다.이는 IT시스템과 서비스 장애에 따른 사회적·경제적 손실이 그만큼 커질 수 있다는 의미다. 여러 기업 장비가 밀집된 데이터센터 장애는 최근 사례처럼 막대한 사회적 손실을 초래한다.한국데이터센터연합회에 따르면, 2020년 기준 국내 데이터센터는 156개(공공 68개, 민간 88개)다. 집계에서 빠진 공공기관별 전산센터와 지난해·올해 새로 인가를 받은 데이터센터까지 합하면 수치는 늘어날 것으로 추정된다.아날로그 또는 디지털 요인으로 인한 데이터센터 마비 사태를 방지하는 것은 기업의 핵심 리스크 관리 요소다. 철저한 설비 점검과 장애 대응체계 확립, 재해복구(DR) 솔루션 도입을 통해 업무 연속성을 유지해야 한다.



◇화재·침수 등 장애 요인 다양데이터센터 설비나 장비를 마비시키는 아날로그적 요인에는 지진이나 화재, 침수, 전쟁, 정전 등이 있다. 국내에서 발생하는 데이터센터 사고는 화재, 침수와 이에 따른 정전에 집중돼 있다.전산장비와 전력 케이블, 수배전반, 변압기, 발전기, 무정전전압공급장치(UPS), 축전지, 냉동기 등에 화재가 발생하거나 침수돼 서비스가 마비되는 사례가 일반적이다.2010년 시티은행 데이터센터 침수, 2014년 삼성SDS 과천 데이터센터 화재, 올해 SK(주) C&C 판교 데이터센터 화재 등이 대표적이다.전문가들은 데이터센터 냉수 배관과 전력 루트를 이중으로 설치하고, 배터리실과 장비실을 물리적으로 구분해 장애에 대비해야 한다고 조언한다.데이터센터 티어(Tier) 인증업무를 수행하는 업타임 인스티튜트는 데이터센터 인프라를 티어1~티어4로 구분하고, 티어3 이상으로 설계하도록 권고한다. 냉수 배관과 전력 루트가 이중인 티어3 이상은 무중단 유지보수가 가능한 상태로 '연속 IT 고장시간'이 1.6시간 이하, 가용성은 99.98%다.리튬이온 배터리 화재 대비도 강화해야 한다. 2012년부터 국내 데이터센터에 적용된 리튬이온 배터리는 자체 산소 발생, 열폭주 등 구조적 특성상 한번 불이 붙으면 잘 꺼지지 않는다.화재 때 산소를 발생시키지 않는 인산철 리튬 배터리가 개발됐지만 국내에는 2025년 이후 보급될 전망이다.스탠더드시험연구소가 발표한 압축공기포 기반 리튬이온 배터리 화재진압시스템이 대안이 될지 주목된다. 시스템은 압축공기포를 통해 물의 5배 이상 냉각 성능을 발휘, 리튬이온 배터리 화재를 빠르게 진압한다.



◇투자 늘려 재해복구(DR) 체계 확립해야화재나 침수 같은 아날로그 요인 이외에 해킹이나 시스템 오류 같은 디지털 요인도 데이터센터에 장애를 일으킬 수 있다. 전산장비가 노후화되면서 전산장애 요인이 되기도 한다.기업은 전산 서비스 장애 대응을 위해 내부 서버를 이중화해 페일오버를 통한 고가용성(HA)을 확보하고 백업센터를 운영한다.백업센터가 50㎞ 이상 떨어져 있을 경우 레이턴시로 인해 액티브-액티브 구성이 사실상 어렵다. 이에 따라 주센터 인근에 백업센터를 구성, 액티브-액티브 체계를 확보하고 원거리에 보완적으로 백업센터를 추가 운영하는 방안이 이상적이다.최근 무중단 업무가 필요한 병원이나 제조 생산시설을 중심으로 근거리 액티브-액티브 구성이 늘고 있어 주목할 필요가 있다.액티브-액티브 구성은 백업센터 스토리지, 서버, 데이터베이스관리시스탬(DBMS) 등을 평상시에도 운영하며 장애에 대응하는 방식이다. 평상시엔 각각 다른 업무에 이용하며 전산자원을 가동시키고 주센터 장애 때 복구 시간을 최소화한다.관건은 비용이다. 기업은 비용 절감을 위해 백업센터에 주요 업무에 대한 전산 환경망을 구성한다. 그나마 액티브-액티브가 아니라 액티브 스탠바이 형태로 구성, 장애가 발생하면 백업센터 가동, 정합성 확보 등에 오랜 시간이 걸린다.그러나 데이터센터에 장애가 발생하면 액티브-액티브 구성에 투자하는 것보다 몇 배의 보상이 필요하다. 무엇보다 심각한 기업 이미지 손상을 입게 된다는 점을 잊지 말아야 한다.



◇검증된 솔루션으로 실시간 장애 대응데이터센터 장애에 대비하려면 주기적 장애대응 훈련을 실시해야 한다. 전산 시스템을 운영하다 보면 예상치 못한 장애가 발생하고 시나리오에 없던 상황에 맞닥뜨리게 되는 경우가 많다는 게 전산 운영 담당자의 얘기다. 이 같은 상황을 반영해 장애 대응 매뉴얼도 항상 최신화해야 한다.국가적 가이드라인 도입 필요성도 제기된다. 데이터센터 인가는 상면, 전력시설 등 기본 규격에 초점을 맞출뿐 재난 대응 수준에 대해서는 살피지 않는다. 각 기업이 자체 장애 대응 매뉴얼을 만들어 대응한다.데이터센터 관련 기업 대표는 “미국은 티어3 인증을 받으면 보험료를 30% 할인해주는 등 국가 차원에서 데이터센터 장애를 막기 위한 정책을 운영한다”며 “정부 제정 DR 가이드라인 도입을 통해 안정성을 높이고 데이터센터 산업도 활성화해야 한다”고 말했다.무엇보다 데이터센터 설비 투자를 늘리고 검증된 솔루션으로 업무 연속성을 확보하는 게 중요하다.델 테크놀로지스, 베리타스, VM웨어, 오라클, 효성인포메이션시스템, HPE·HPE아루바 등 전문 기업이 액티브-액티브 체계 확보, 실시간 데이터 복구 등을 위한 전문 솔루션을 제공하고 있다.자동화를 통한 빠르고 안정적인 재해복구, 총소유비용(TCO) 절감, 운영 효율성 제고를 위해 눈여겨봐야 할 제품이다.",105,https://n.news.naver.com/mnews/article/030/0003063753?sid=103
"""동식님, 내년 주요 사업이 뭔가요?""…KT클라우드, 수평적인 조직문화 '눈길'",2022.12.05. 오후 3:57,"'보일링 포인트' 문화로 MZ세대까지 아우르는 소통문화 구축8개월 만에 직원 수 2배 증가… ""격의없는 소통으로 DX시장 선도""



윤동식 KT클라우드 대표와 직원들이 자유롭게 대화를 나누고 있다. /KT클라우드 제공KT의 클라우드 사업 자회사인 KT클라우드가 출범 8개월을 맞아 윤동식 대표가 전 직원에게 경영 현안과 성과를 투명하게 공개하는 '케클 공유해'를 진행했다고 밝혔다.KT클라우드는 5일 온라인으로 케클 공유해 행사를 열었다고 밝혔다. 행사는 별도의 사회자나 딱딱한 격식 없이 윤 대표가 직접 전직원과 소통하는 방식으로 진행됐다. 윤 대표는 출범 원년의 경영 현안과 실제 성과, 조직이 나아갈 방향 등을 밝혔다. 윤 대표는 출범 당시에도 가장 먼저 '임직원 출정식'을 갖고 사업 전략과 비전을 공유하는 등 내부 소통에 힘써왔다는 설명이다.직원들은 윤 대표를 '동식님'으로 부르며 다양한 질문을 던졌다. 자유롭고 수평적인 소통을 지향하는 KT클라우드는 윤 대표도 여느 직원과 다름 없이 '님' 호칭을 사용한다.KT클라우드 관계자는 ""회사가 출범할 때 직원이 280여명이었는데, 8개월 만에 두배 이상 증가했다""며 ""특히 출범 후 영입된 직원들의 평균 연령이 33.7세인 만큼, 젊은 세대와의 격의없는 소통을 위해 직급제를 폐지하고, '님' 호칭제를 전면 도입했다""고 설명했다.KT클라우드는 디지털전환(DX) 사업을 추진하는 만큼, 산업의 발전과 변화에 민첩하게 대응할 수 있도록 고유한 기업문화와 공유된 가치를 만들어간다는 구상이다. 특히 회사가 KT 출신의 클라우드와 인터넷데이터센터(IDC) 분야의 오랜 경력을 보유한 인력과 출범 후 영입한 젊고 자유로운 IT·개발 인력, 공채 신입사원 등 다양한 연령과 배경으로 구성돼 있어 이들이 하나로 융합되어 자유롭고 유연한 환경에서 도전과 창의성을 마음껏 발휘할 수 있는 조직문화를 만드는 것이 중요하다는 설명이다.KT클라우드는 고유의 기업문화 프로그램 '보일링 포인트'를 도입해 세대별 교류와 세대간 융합, 전 직원의 소통과 공감에 힘을 쏟고 있다. 보일링 포인트는 끓는 점(100℃)을 의미한다. 즐거운 회사 생활을 위해 다양한 직원들과 교류하며, 서로 융화돼 회사와 함께 뜨겁게 성장해보자의 의미를 담았다. 먼저 세대별 교류와 조직 적응을 위한 대표 프로그램인 ‘90℃’를 통해서는 90년대 생 직원이 다른 부서의 직원들과 소통하며 친분을 쌓아간다. 참가자 스스로 활동 주제를 기획하고 진행하며, 회사는 반차, 활동 지원비, 버킷 리스트 등을 지원하고 있어 만족도가 높다. 마찬가지로 80년대생을 위한 80℃, 70년대생을 위한 70℃에서도 각 세대별 직원들에게 큰 호응을 얻고 있다.또 다른 ‘보일링 포인트’ 프로그램으로는 전 세대를 아우르는 '케클 런치'가 있다. 부서, 직무, 나이에 상관없이 랜덤으로 매칭된 다양한 직원들과 식사를 하면서 친분을 쌓을 수 있다. 별도 시간을 내지 않고 점심시간에 참가할 수 있고, 선·후배 세대간 소통으로 사내 관계를 넓힐 수 있다.이 밖에도 사내 모든 임원회의와 주간·월간 사업전략 회의는 임직원 누구나 참석할 수 있다.윤동식 대표는 ""우리만의 고유한 기업문화로 전 임직원이 더욱 단단해진 케클 원팀이 됐고, 이는 우리의 사업 경쟁력이자 미래의 성장 동력""이라며 ""앞으로도 격의 없는 소통과 경계 없는 공유로 서로 공감하고, 본질에 더 집중하여 대한민국의 1위 DX 기업으로 시장을 선도할 것""이라고 강조했다.한편 KT클라우드는 지난 4월 1일 KT그룹의 클라우드·IDC 사업부문을 현물출자 방식으로 분리해 별도 법인으로 출범했다. KT클라우드는 오는 2026년까지 매출 2조원 규모로 성장하겠다는 목표를 밝혔다.발로 뛰는 더팩트는 24시간 여러분의 제보를 기다립니다.▶카카오톡: '더팩트제보' 검색▶이메일: jebo@tf.co.kr▶뉴스 홈페이지: http://talk.tf.co.kr/bbs/report/write",105,https://n.news.naver.com/mnews/article/629/0000188475?sid=103
