title,date,main,section,url
"코인원, 이용자 확인 제도 시행 예고…""본인 인증해야 서비스 이용""",2021.09.17. 오전 10:17,"코인원 직원들이 본사 대회의실에서 대화를 나누고 있다. (코인원 제공) © 뉴스1(서울=뉴스1) 송화연 기자 = 국내 암호화폐 거래소 코인원은 연내 전 이용자를 대상으로 이용자확인제도(KYC)를 시행한다고 17일 밝혔다. 코인원은 개정 특정금융정보법(특금법) 시행에 따라 이용자확인제도 및 자금세탁방지(AML)의무를 한층 강화한다는 계획이다.코인원은 지난 16일 신규 및 기존 이용자를 대상으로 하는 이용자확인제도 계획을 홈페이지에 공지했다.이용자확인제도란 금융회사 등이 이용자와 거래 시 금융회사가 제공하는 서비스가 자금세탁 등에 악용되지 않도록 이용자확인 및 검증, 거래목적 확인 등의 절차를 거치는 것을 말한다. 개정 특금법에 따라 가상자산사업자가 금융회사 등에 포함됨으로써 고객신원확인(CDD)은 법률적 의무사항이 됐다.코인원은 연내 이용자확인제도를 시행한다. 정확한 일정은 향후 홈페이지를 통해 공지할 예정이다. 앞으로 코인원 신규 이용자는 가입 시, 기존 이용자는 로그인 시점에 휴대폰 본인확인과 신분증 인증, 계좌 인증을 완료해야만 서비스를 이용할 수 있다.이용자확인제도는 해외 거주자에게도 적용된다. 기존 코인원을 이용 중이거나 코인원에 신규가입을 희망하는 해외 거주 개인 이용자는 오프라인 고객센터를 통한 대면 인증 절차를 필수적으로 진행해야 한다. 이용자확인절차 진행이 불가능한 이용자의 경우 거래 및 입출금 등 서비스 이용이 불가능해져 보유 자산을 사전에 출금해야 한다.차명훈 코인원 대표는 ""특금법 시행을 앞두고 자금세탁방지와 이용자확인제도를 고도화해 나갈 계획""이라며 ""트래블룰 합작법인 코드(CODE)를 통해 국제자금세탁방지기구(FATF) 및 금융당국의 기준에 부합하는 트래블룰 시스템 구축에도 전력을 다할 것""이라고 말했다.",105,https://n.news.naver.com/mnews/article/421/0005610552?sid=103
유튜브 2분기 한국 영상 6만개 지웠다,2021.09.18. 오전 7:06,"한국 삭제 영상 순위 18위... 국가별 통계 공개 이후 가장 낮은 수치유튜브가 지난 2분기(4~6월) 삭제한 한국 영상 수는 6만8380개로 나타났다. 분기별 추이를 비교해보면 국가별 정보를 공개한 이래 가장 삭제한 영상 수가 적었다. 유튜브는 최근 투명성 보고서의 일환으로 2021년 2분기 커뮤니티 가이드 시정조치 내역을 공개했다. 유튜브는 분기별로 이 같은 내용을 공개해왔다. 



▲ 유튜브 스마트폰 화면. 사진=gettyimages유튜브가 지난 2분기 동안 삭제한 한국 영상(IP 기준)은 6만8380개로 나타났다. 국가별로 보면 18번째로 영상 삭제가 많았다. 이는 유튜브가 국가별 통계를 제공한 이후 가장 낮은 수치다. 이전 시정조치 내역을 종합해보면 2021년 1분기 유튜브가 삭제한 한국 영상 수는 11만9461건으로 세계에서 15번째로 삭제 영상 수가 많았다. 앞서 2020년의 경우 1분기 26만2020건(5위), 2분기 25만8013건(9위), 3분기 44만7734건(5위), 4분기 12만1994건(14위)으로 나타났다. 유튜브는 자체 심의 규정인 커뮤니티 가이드를 위반한 영상을 삭제하고 있는데 국가별 영상 삭제 내역 사유를 별도로 공개하지 않기 때문에 구체적인 이유는 알기 힘들다. 같은 기간 유튜브가 전세계에서 삭제한 전체 영상은 627만8771건에 달했다. 삭제 사유를 보면 △ 아동보호 29.9% △과한 노출 및 성적인 콘텐츠 22.4% △ 폭력적 또는 노골적 콘텐츠 16.8% △ 스팸, 현혹성 콘텐츠 및 사기 14.1% △ 폭력조장 및 폭력적 극단주의 6.9% 순이다. 같은 기간 유튜브가 전세계에서 삭제한 채널은 418만7640개에 달한다.",105,https://n.news.naver.com/mnews/article/006/0000109747?sid=103
세포유전자치료 석학들 한자리에,2023.10.27. 오후 4:17,"차바이오, 글로벌 포럼 개회…줄기세포 등 최신정보 공유



윤호섭 차 종합연구원장이 27일 판교 차바이오컴플렉스에서 열린 '글로벌 포럼 온 퓨처 메디신(Global Forum on Future Medicine) 2023'에서 개회사를 하고 있다./사진=차바이오그룹 제공차바이오그룹은 27일 경기도 성남 판교 차바이오컴플렉스에서 '글로벌 포럼 온 퓨처 메디신(Global Forum on Future Medicine) 2023'을 개최했다.국내 제약·바이오기업과 협회, 정부 관계자 등 400여명이 모인 가운데 세포·유전자치료(CGT) 분야 석학들이 최신 연구현황을 공유했다. 이날 포럼에는 동물의 체내에서 사람의 장기를 제작하는 연구를 진행중인 히로미츠 나카우치 미국 스탠퍼드대 유전학 교수, 유도만능줄기세포를 척수손상 치료에 적용한 히데유키 오카노 일본 게이오대 의과대학 교수 등이 참석했다.특히 줄기세포를 이용한 인체 장기 제조와 노화방지 연구가 참석자들의 관심을 끌었다. 이동률 차 의과대학 교수는 체세포복제줄기세포로 만든 중간엽세포로 여성난소노화를 억제하고 가임력을 증진하는 연구를 발표했다. 이 교수는 ""난소 건강이 여성 생식력과 직접 연관이 있다""며 ""줄기세포를 활용해 난소 기능과 건강을 보존할 수 있는 효과적인 방법을 연구하고 있다""고 소개했다.줄기세포로 척수손상, 파킨슨병 등 난치성 질환을 치료하는 가능성을 제시하는 발표도 주목을 받았다. 김광수 하버드대 의과대학 교수는 파킨슨병 환자의 피부 세포를 역분화시켜 유도만능줄기세포(iPSC)로 만든 뒤 다시 도파민 신경세포로 분화해 뇌에 이식, 세계 최초로 파킨슨병 치료에 성공한 내용을 발표했다. 재생의학 분야의 규제와 오픈이노베이션에 대해서도 논의가 이뤄졌다. 최미라 식품의약품안전평가원 세포유전자치료제과장은  정부가 첨단재생의료 및 첨단바이오의약품 안전 및 지원에 관한 법률 발효후 3년간 바이오의약품 발전을 위해 어떤 지원책을 펼쳤는지 설명했다. 신이치 노다 일본 의약품·의료기기종합기구 재생의료심사부 심사관는 일본 재생의료의 규제와 현황을 발표했다.행사를 주관한 윤호섭 차 종합연구원장은 ""차바이오그룹의 연구∙임상 성과를 소개하고, 세포·유전자치료제와 재생의학 분야를 선도하는 세계 석학들의 최신지견을 공유했다""며 ""이번 포럼이 국내를 넘어 미국, 일본 등 선진국 연구진들과 전략적으로 협력하며 글로벌 협업하는 계기가 되길 바란다""고 말했다.",105,https://n.news.naver.com/mnews/article/648/0000020545?sid=103
"카카오엔터프라이즈, 롯데글로벌로지스와 AI 물류 만든다",2021.09.17. 오후 3:17,"혁신 물류 사업 연계 가능한 IT 기술 지원.. MOU  [파이낸셜뉴스] 카카오엔터프라이즈는 롯데글로벌로지스와 손잡고 물류산업 디지털 트렌스포메이션을 돕는다고 17일 밝혔다.   카카오엔터프라이즈는 전날 서울 중구 롯데글로벌로지스 본사에서 카카오엔터프라이즈 백상엽 대표, 롯데글로벌로지스 박찬복 대표 등 주요 관계자가 참석한 가운데 AI 기반 물류 생태계를 구축하는 내용의 업무협약(MOU)을 체결했다.   양사는 긴밀한 협업을 통해 기존 물류 산업에 관한 다양한 서비스 및 솔루션 등을 연결하고, 그 결과로 쌓이는 수많은 물류 데이터를 인공지능(AI)으로 분석해 비즈니스 인사이트를 얻을 수 있도록 할 예정이다.   롯데글로벌로지스는 물류 산업과 AI 기술 융합이 가능한 사항을 발굴하고, 관련 시스템 개발업무에 적극 협조하기로 하였다. 카카오엔터프라이즈는 시스템 개발 및 협력사 간 신규 비즈니스 교류를 비롯해 롯데글로벌로지스 고객사에 마케팅, 물류 솔루션, ‘카카오워크’ 서비스를 제공한다.   양사는 △음성 인식 기술을 활용한 신속한 물류정보 시스템 구축 △물류 데이터 기반 최적화된 의사 결정과 서비스 제공 △AI 기반 콜센터 혁신 서비스 발굴을 통해 양사 간 협업모델을 구체화해 나갈 예정이다.    



카카오엔터프라이즈 백상엽 대표(오른쪽)와 롯데글로벌로지스 박찬복 대표는 지난 16일 서울 중구 롯데글로벌로지스 본사에서 AI 기반 물류 생태계를 구축하는 내용의 업무협약(MOU)을 체결했다. 카카오엔터프라이즈 제공 백상엽 카카오엔터프라이즈 대표는 “롯데글로벌로지스가 보유한 물류 산업 인프라와 노하우에 카카오엔터프라이즈가 보유한 AI, 빅데이터, 클라우드 기반 표준 플랫폼을 결합해 물류생태계 디지털 트렌스포메이션에 실질적으로 기여할 것”이라며 “물류 솔루션 편의성을 높이고 혁신을 적극 지원할 것”이라고 강조했다. #롯데글로벌로지스 #카카오엔터프라이즈",105,https://n.news.naver.com/mnews/article/014/0004711017?sid=103
"업비트, 선제적 조치로 보이스피싱 용의자 현장 검거",2021.09.17. 오전 10:37,"이상 거래 감지 시스템 통해 1억2000만원 피해 예방사기단 인출책 포착…신속한 경찰 신고로 현장 검거



업비트 로고.ⓒ업비트[데일리안 = 이건엄 기자] 업비트는 상시 모니터링 및 신속한 선제 조치를 통해 1억2000만원의 보이스피싱 피해를 막고, 인출책으로 의심되는 용의자의 현장 검거를 이끌었다고 17일 밝혔다.업비트는 최근 검찰을 사칭하는 보이스피싱 사기단의 디지털 자산 지갑으로 의심되는 주소를 확인하고, 해당 주소로의 출금을 막았다.이에 더해 과거 해당 주소로 출금한 이력이 있는 회원들의 거래 활동을 상시 모니터링 했다. 문제의 주소로 출금한 이력이 있는 회원 A씨와 B씨가 추가로 출금 하려는 정황이 업비트 이상거래 탐지 시스템에 포착된 것은 지난 15일이다. 업비트는 이들의 출금을 즉시 정지하고 유선 연락을 취해 사실을 알리고, 경찰에 신고할 것을 당부했다.업비트는 통신사기피해환급법 시행령 개정 전부터 디지털 자산 관련 범죄를 예방하고 피해자를 보호하기 위해 적극적인 조치를 취해 왔다고 강조했다. 이상거래 감지 시스템을 고도화하고 입출금 모니터링 시스템을 강화해 전기통신금융 사기 방지를 위해 총력을 다했다는 설명이다.은행에 보이스피싱 신고가 접수되면 업비트와 정보를 공유해 즉각적인 조치를 취하고, 수사기관의 수사에 협조한다. 신고가 없더라도 24시간 이상 거래 모니터링으로 의심 계정에 선제적 조치를 취한 후 은행 및 수사기관에 이를 공유하는 등 긴밀히 협조하고 있다.업비트 운영사 두나무 관계자는 “나날이 교묘해지는 보이스피싱 사기 수법에 대응하기 위해 시스템 고도화 및 모니터링을 강화하고 은행 및 수사기관과 긴밀히 협조하고 있다”며 “업비트 이용자들이 피해를 입지 않도록 업비트 투자자 보호 센터에서 디지털 자산 관련 범죄 유형을 면밀히 분석하고 보이스피싱 피해 근절을 위한 방안을 마련하기 위해 노력하고 있다”고 밝혔다.",105,https://n.news.naver.com/mnews/article/119/0002531323?sid=103
"獨 인피니온, “차량용 반도체 가격 인상 불가피”",2021.09.18. 오후 2:35,"- 인피니온, 캐파 증설 위해 가격 인상   [디지털데일리 윤상호 기자] 시스템반도체 가격 상승이 지속할 전망이다. 독일 인피니온 최고경영자(CEO)가 시스템반도체 가격인상을 검토 중이라고 밝혔다. 인피니온은 차량용 반도체 업체다.   17일(현지시각) 로이터에 따르면 인피니온 라인하르트 플로스 CEO는 “우리는 상당한 가격 인상을 기대하고 있다”라고 밝혔다.   인피니온은 차량용 반도체 제조사다. 올해 들어 차량용 반도체는 공급이 수요를 충족시키지 못하는 상황이다. 주요 자동차 제조사는 차량용 반도체 부족으로 조업 중단을 반복하고 있다.   이날 인피니온은 오스트리아 빌라흐에서 반도체 공장 준공식을 개최했다. 16억유로(약 2조2200억원)를 투자했다. 12인치 웨이퍼를 이용 전력반도체를 생산한다.   한편 인피니온은 생산능력(캐파) 확대 투자를 위해 가격인상이 불가피하다고 설명했다. 다만 가격을 무작정 올리지는 않을 것이라고 약속했다.   로이터는 “플로스 CEO가 최고가를 지불하는 고객에게 차량용 반도체를 우선 판매하지는 않을 것”이라고 했다고 보도했다.",105,https://n.news.naver.com/mnews/article/138/0002110568?sid=103
"심사 땐 ‘1등급’, 판매 후엔 ‘등급외’…‘고무줄 성능’ 미세먼지 간이측정기",2021.09.18. 오전 12:17,"[앵커] 요즘은 공공기관 등에서 미세먼지 간이측정기를 이용해 실내 공기 질을 측정하고 사람들에게 알려주기도 하는데요. 그런데 이 간이측정기들 상당수가 1등급 인증을 받은 것으로 돼 있는데도 다시 성능을 평가해 보면, 정확도가 크게 떨어지는 경우가 많았습니다. 박영민 기자가 취재했습니다. [리포트] 버스 정류장 인근에 설치된 '미세먼지 신호등'입니다. 간이측정기가 주변의 미세먼지 농도를 파악해  실시간으로 알려줍니다. 이 간이측정기는 미세먼지 농도를 정확히 측정하고 있을까? [해당 구청 관계자/음성변조 : ""환경측정기기 검사 시스템 이쪽에서 1등급 받은 제품으로 나와 있어요.""]이런 미세먼지 간이측정기는 3년 전부터 관계기관에서 성능인증을 받아야만 판매할 수 있습니다. 시중에서 판매 중인 '1등급' 제품을 수거해  다시 성능 평가를 해봤습니다. 1등급을 받기 위해선 실내외 시험 과정에서 정확도 등 5개 항목에 대한 기준치를 모두 충족해야 합니다. 최종 성능 평가 결과 1등급 제품 4개 중 3개는 등급외, 나머지 1개 제품은 3등급 판정이 나왔습니다. 인증 때는  정확도 높은 측정으로  1등급을 받은 제품들이 그 뒤  실제 사용할 때는 정확도가 크게 떨어집니다.간이측정기는 처음 제품을 만들거나 수입할 때 한 번의 성능인증만 받으면 그뿐. 그 뒤 재평가나, 점검이 의무화돼있지 않기 때문에 관리 사각지대에 놓이게 되는 겁니다. [인증시험기관 관계자/음성변조 : ""새 제품을 사서 보면 자체 시험 성적서가 첨부돼 있거나 그런 게 없어요. 판매 전에 자체 테스트를 해서 보정도 좀 하면 좋은데 (그런 게 없어요).""] 생산업체들도 품질 관리 인력이나 검사 장비가 부족하다는 등의 이유로 내부 품질 테스트를 하지 않습니다. 사후 관리 규정이 전무한 상탭니다. [김성원/국회 환경노동위원 : ""미세먼지에 대한 정확한 정보 제공은 매우 중요합니다. 미세먼지 간이측정기의 인증뿐만 아니라 사후관리가 반드시 필요합니다.""] 올해 8월까지 성능인증을 받은 미세먼지 간이측정기는  모두 343개. 이 가운데 절반이  1등급 인증을 받아 시중에서 팔리고 있습니다. KBS 뉴스 박영민입니다.촬영기자:조정석 김보현 홍성백/영상편집:박주연/그래픽:한종헌",105,https://n.news.naver.com/mnews/article/056/0011123135?sid=103
"SKT, T다이렉트샵 추석 선물 기획전...선착순 경품 지급",2021.09.18. 오전 8:32,"[서울=뉴시스] 이진영 기자 = SK텔레콤은 추석을 맞아 공식 온라인몰 T다이렉트샵에서 풍성한 선물을 담은 'T다이렉트샵 추석 선물 기획전'을 연휴 기간 진행한다고 18일 밝혔다.오는 22일까지 T다이렉트샵에서 ‘바로픽업’으로 주문한 고객은 선착순으로 ▲정관장 홍삼지감(500명) ▲스팸 8호 선물세트(500명) ▲카카오 딘트 문구세트(50명) 중 하나를 선택해 받을 수 있다.T다이렉트샵에서 주문 후 가까운 매장에서 바로 휴대폰을 받을 수 있는 '바로픽업' 서비스는 19일과 21일을 제외한 연휴 기간 내내 이용 가능하며, 이벤트 사은품은 24일부터 순차 배송 예정이다. SKT는 T다이렉트샵을 통해 추석에 부모님 또는 아이들에게 선물하기 좋은 제품도 추천했다.부모님을 위한 선물로는 40만 원 중반대의 출고가에 ▲6.6인치 FHD+화면 ▲6,400만 화소 카메라 ▲5,000mAh 대용량 배터리 및 15W 고속 충전 기능 ▲삼성페이/지문인식 기능 등 뛰어난 스펙을 갖춘 실속 있는 5G 스마트폰 ‘갤럭시 와이드5’가 대표적이다.또, 아이들을 위해서는 ‘아이폰12미니 티다 디즈니 스페셜 에디션’이 제격이다. ‘아이폰12 미니 티다 디즈니 스페셜 에디션’은 지난해 굿즈 돌풍을 일으켰던 레디백(다용도 가방)으로 패키징한 한정판 상품으로, 디즈니 레디백은 ▲아이폰 12 미니 128G 화이트 ▲곰돌이 푸 맥세이프 충전기 ▲곰돌이 푸 데코 세트(폰 케이스, 카메라 스티커, 폰 스트랩) ▲곰돌이 푸 커스텀 스티커로 구성되어 있다.이 밖에도 SKT는 T다이렉트샵을 통해 ‘갤럭시 퀀텀2’·’아이폰SE’·’갤럭시 워치4’ 등을 추석에 부모님과 아이들에게 선물하기 좋은 선물로 추천했다.",105,https://n.news.naver.com/mnews/article/003/0010728544?sid=103
"[추석에 뭐 보지] ② IPTV, 볼 거 없어 헤매지 말고 여기로…""콘텐츠 종합선물세트""",2021.09.18. 오전 10:01,"영화·방송·키즈·애니 등 장르별 큐레이션한 '추석투어 특집관' 편성IPTV 3사가 신종 코로나바이러스 감염증(코로나19) '집콕'명절을 보내게 될 이용자들에 특집관, 다양한 경품 이벤트 등 볼거리 즐길거리를 제공한다.'랑종' 등 최신영화 제공뿐만 아니라 세대 맞춤형 영화 특집관, 온 가족이 함께 즐길 수 있는 미스터트롯·K-팝 콘서트에 추석맞이 할인 혜택까지, 즐거운 명절을 위한 선물 보따리를 마련했다.



SKB가 추석 연휴를 맞아 풍성한 볼거리와 다채로운 이벤트를 마련했다. [사진=SKB]◆ SKB '한가위에 떠나는 B tv 콘텐츠 여행'SK브로드밴드(대표 최진환)는 연휴 기간 B tv 이용자 맞춤 콘텐츠 제공, 각종 할인 혜택을 더한 'B tv 콘텐츠 여행'을 선보인다.우선 '다시 만나고 싶은 일상 여행'을 주제로 영화·방송·키즈·애니 등 장르별 추천작을 선별한 'B tv 추석 투어 특집관'을 편성한다.예컨대 여행 마니아를 위해 아름다운 여행지 배경 영화를 모은 '랜선 해외여행' 사회적 거리 두기로 가족과 떨어져 연휴를 보내는 시청자를 위한 '가족 영화' 등 여러 테마로 큐레이션 한다. B tv뿐 아니라 모바일 B tv에서도 동일하게 구현된다.다양한 연령대를 위한 콘텐츠도 강화한다. '뽀로로' '시크릿쥬쥬' '신비아파트' '포켓몬스터' 등 인기 키즈·애니 시리즈 113개와 극장판 31편 등을 최대 70% 할인 제공한다. 또 '신나는 트로트 모음' '누구나 쉽게 따라 할 수 있는 윤은희의 건강 댄스' 등 신규 콘텐츠를 통해 시니어 이용자가 집에서도 즐거운 시간을 보내도록 돕는다.최신 콘텐츠도 B tv 여행을 풍요롭게 한다. '씽크홀' '랑종' 등 극장 상영 중이거나 최근 극장 막을 내린 화제작이 추석을 맞아 B tv 이용자를 찾아간다. 올해 개봉한 주요작을 비롯해 인기 영화 110여편은 최대 50% 할인된다.가격 부담은 줄였다. '삼진그룹 영어토익반' '#살아있다' '히트맨' 등 인기 영화 30여편과 '결혼 작사 이혼 작곡2' '라켓 소년단' '미치지 않고서야' 등 인기 드라마를 포함해 모든 장르에서 무료 VOD 콘텐츠를 만날 수 있다.SK브로드밴드는 추석 이벤트 기간 중 B tv를 가장 오래 시청한 '시청왕' 가장 많은 VOD를 결제한 '구매왕' 가장 많은 콘텐츠를 시청한 '다작왕'을 각 5명 선정해 신세계 모바일상품권 10만원권 등 다양한 경품을 증정할 예정이다.



KT가 추석 연휴를 맞아 풍성한 볼거리와 다채로운 이벤트를 마련했다. [사진=KT]◆ 올레 tv ""우리집 거실에서 최신 화제 영화 즐기고 TV 포인트 받자""KT(대표 구현모) 올레 tv는 오는 23일까지 한가위 특집관에서 선보이는 '씽크홀' '랑종' '이스케이프 룸2: 노 웨이 아웃' 등 최신 화제작 영화 20여편 중 3편 이상을 구매한 전원에게 올레 tv TV포인트 1만점을 증정한다.또 30일까지 300여편의 최신 영화를 무제한으로 즐길 수 있는 월정액 '프라임무비 익스프레스' 신규 가입자에 TV 포인트 9천점을 제공한다.이외에도 올레 tv 디즈니 특집관에서 '블랙위도우' '루카' '크루엘라' 등의 소장용 영화 90여편을 제공하며, 3편 이상 구매한 전원에게 디즈니 캠핑 매트와 디즈니 소피아 잉글리쉬 워크북 등으로 구성된 디즈니 럭키박스를 랜덤으로 증정한다.영유아 전용 IPTV 서비스 올레 tv 키즈랜드에서는 핑크퐁, 뽀로로, 타요, 로보카 폴리 등 8종의 인기 캐릭터 콘텐츠 총 830여편을 무료로 제공한다. 또 30일까지 키즈랜드 캐릭터영어놀이관에서 바다나무 콘텐츠를 시청하고, 리모콘을 통해 이벤트에 응모한 전원에 바다나무 온라인 학습 체험권을 제공하며 100명을 추첨해 바다나무 한정판 파티세트를 증정한다.올레 tv 뮤즈(MU:Z)에서는 코로나19로 오프라인 현장에서 콘서트를 즐기지 못하는 음악 팬들을 위해 8090년 탑골공원 노래부터 신인 아이돌 음원까지 즐길 수 있는 K-POP 콘서트 전용관을 새롭게 단장했다.가족과 함께 즐길 수 있는 뮤지컬과 클래식 공연 실황도 무료로 공개하며 OST를 비롯해 홈트족을 위한 운동 음악 플레이리스트 등 뮤직 비디오를 연속으로 재생해주는 테마관도 운영한다. 뮤즈 콘서트 전용관에서 유료 콘서트를 1편 이상 구매한 모두에게는 올레 tv TV 쿠폰도 증정한다.



LG유플러스가 추석 연휴를 맞아 풍성한 볼거리와 다채로운 이벤트를 마련했다. [사진=LG유플러스]◆ U+tv 상반기 놓친 영화 추석특가…'트로트 콘텐츠' 전 국민 무료 개방LG유플러스(대표 황현식) U+tv는 추석을 맞이해 이른바 '갓성비 특가 영화' 프로모션을 선보인다.프로모션은 오는 23일까지 올 상반기 인기 영화를 최대 50% 할인하는 행사로 '미나리' '분노의 질주: 더 얼티메이트' 등 75편의 콘텐츠를 저렴하게 볼 수 있게 된다.회사는 추석 기간 동안 다양한 경품 이벤트도 연다. 콘텐츠 최다 구매자에게는 최신형 스마트폰 또는 태블릿을 증정하고, 최신영화 구매자 중 추첨을 통해 스마트워치를 제공한다. 또 추석 특집관 내 최신영화 2편 이상을 이용한 전원에 5천원 할인 쿠폰을 증정한다.U+모바일tv에서는 트로트 콘텐츠를 전국민에게 무상 개방한다. 앱 마켓에서 U+모바일tv를 내려받으면 누구나 통신사 관계없이 '내일은 미스터 트롯 Top6(임영웅·영탁·이찬원·정동원·장민호·김희재)'와 '내일은 미스 트롯' 우승자 송가인의 무대를 즐길 수 있다.U+모바일tv에서는 이들의 공연 실황을 담은 영화 '미스터 트롯:더 무비'와 국내 트로트 신드롬을 일으킨 송가인의 콘서트 '송가인 더 드라마' 등을 이달 30일까지 무료로 서비스한다. 또 올해 개봉작 '더스파이'를 비롯해 다양한 최신 영화도 무료로 시청할 수 있도록 할 예정이다.아울러 U+모바일tv에서는 오는 30일까지 경품 이벤트도 진행한다. 기간 내 U+모바일tv에서 추석 특선 무료 콘텐츠를 포함해 일반 VOD를 시청하면 추첨을 통해 스포츠브랜드 한정판 운동화, 캠핑 용품 등 추석 선물을 증정받을 수 있다.",105,https://n.news.naver.com/mnews/article/031/0000624997?sid=103
