title,date,main,section,url
모바일 게임 '전함소녀' 정식 서비스 시작,2018.12.21. 오후 6:10,"모에포인트는 모에판타지가 개발한 모바일 게임 '전함소녀'의 정식 서비스를 시작한다고 21일 밝혔다. 이 게임은 함선을 미소녀로 표현한 시뮬레이션 게임이다. 유저는 다양한 국적의 캐릭터를 수집하고, 육성할 수 있으며 건조 시스템을 통해 과금 없이도 높은 등급의 캐릭터를 얻을 수 있다. 특히, 강원함에 이어 한국에서 직접 자체 제작한 첫 전투함이자 유도탄구축함인 울산함까지 만나볼 수 있다. 또한, 일본 성우 더빙뿐만 아니라 이번에 추가된 한국 성우 및 다국어 더빙 선택이 가능하다.출시를 기념해 특별 함선 괴벤과 연료, 탄약, 강재, 알루미늄 등의 아이템을 획득할 수 있는 특별 한정 퀘스트를 비롯해 경험치 1.5배 및 원정 대성공 확률 2배의 혜택을 받을 수 있다. 이와 함께 자원, 서약, 건조 한정 패키지도 구매할 수 있으며, 매일 게임 로그인 시 보상을 획득할 수 있는 접속 프로모션과 첫 충전, 레벨업 프로모션도 진행된다. 강미화 기자 redigo@fomos.co.kr [게임&게이머, 문화를 전합니다. 포모스게임│무단 전재 및 재배포 금지]포모스",105,https://n.news.naver.com/mnews/article/236/0000182273?sid=103
"추락하는 아이폰 판매량…""내년 1Q 400만대 감소 전망""",2018.12.21. 오후 2:49,"아이폰XR·XS·XS맥스 생산량 감소…""미·중 갈등 여파""(지디넷코리아=이은정 기자)애플이 내년 1분기 아이폰 생산량을 400만대 가량 더 줄일 것이라는 전망이 나왔다.20일 나인투파이브맥은 로젠블랏증권 준장 애널리스트의 보고서를 인용해 애플이 내년 1분기(1~3월) 아이폰 생산량을 400만대 줄일 것이라는 가능성을 제기했다.준장은 이 기간 애플이 각각 ▲아이폰XR 250만대 ▲아이폰XS 100만대 ▲아이폰XS맥스 50만대 가량 줄일 것이라고 분석했다. 세 개 모델은 지난 9월부터 출시된 아이폰 신제품이다.이는 화웨이 창업자의 딸인 멍완저우 최고재무책임자(CFO)가 캐나다에서 체포되는 등 미국과 중국의 갈등 여파에 따른 것이라고 준장은 분석했다.준장은 ""해당 사건으로 중국 기업들이 애플 대신 화웨이 제품을 선택한 사람들에게 혜택을 주고 있다""며 ""아이폰 대신 화웨이 제품을 구매한 직원들에게 보조금이 지급되기도 한다""고 말했다. 



애플의 아이폰XR 이미지 (사진=애플)증권사의 아이폰 판매량 전망치와 애플 협력사의 매출액 전망치가 잇따라 하향 조정되면서 내년 1분기 아이폰 판매량은 전년 동기(5천222만대) 수준을을 하회할 전망이다. 애플은 올 하반기 들어 더 이상 애플 개별 기기 판매량을 공개하지 않겠다고 선언했다.한편, 퀄컴이 인텔 칩을 사용한 아이폰 일부 모델에 대한 소송을 진행하면서 애플은 중국에 이어 독일에서도 일부 구형 아이폰 판매를 중단하게 됐다.이은정 기자(lejj@zdnet.co.kr)  ▶ 네이버 채널에서 ‘지디넷코리아’를 구독해주세요",105,https://n.news.naver.com/mnews/article/092/0002153083?sid=103
"[포토]레몬헬스케어, ‘2018 K-Global Startup 공모전’서 최우수상",2018.12.22. 오후 12:12,[이데일리 노진환 기자] 레몬헬스케어가 지난 19일 과학기술정보통신부가 삼성동 코엑스에서 주최한 ‘2018 K-Global 스타트업 공모전’ 최종 피칭대회에서 스마트 헬스케어 플랫폼 ‘엠케어(M-Care)로 최우수상을 수상했다. 정보통신산업진흥원 김득중 본부장(왼쪽)과 레몬헬스케어 권기욱 전무가 기념촬영을 하고 있다. (사진=레몬헬스케어)노진환 (shdmf@edaily.co.kr)네이버에서 이데일리 [구독하기▶]빡침해소! 청춘뉘우스~ [스냅타임▶]＜ⓒ종합 경제정보 미디어 이데일리 - 무단전재 & 재배포 금지＞,105,https://n.news.naver.com/mnews/article/018/0004278136?sid=103
[2018 하반기 인기상품]품질우수-누리아이티 서버보안솔루션 '바로PAM',2018.12.19. 오후 6:00,"누리아이티가 개발한 바로PAM(BaroPAM)은 윈도, 서버·네트워크 장비, 데이터베이스 환경에서 일회용 인증키를 접목시킨 2차 인증으로 정보자산 접근을 제어하는 솔루션이다.누리아이티(대표 이종일)가 개발한 바로PAM(BaroPAM)은 윈도·맥·리눅스·유닉스 운용체계(OS)에서 '일회용 인증키'를 접목시킨 2차 인증으로 중앙 집중적 인증 메커니즘을 지원하는 단순하면서도 강력한 정보자산 접근제어 인증 솔루션이다.총 3단계에 걸친 보안절차로 서버, 데이터베이스, 애플리케이션, 네트워크장비, 보안장비, 저장장치 등 정보자산을 보호한다. 기존 '지식기반 인증요소'인 아이디·비밀번호 인증방식에 '소유기반 인증요소'인 일회용 인증키를 추가한 '2차 인증'으로 보안을 크게 강화했다.윈도 환경에서는 부팅단계에 시모스(CMOS) 비밀번호로 1단계 보안절차를 거치며 바로PAM 앱을 열어 2단계로 일회용 인증키를 생성한 후 3단계로 인증키와 비밀번호를 입력해 로그인 한다. 맥·리눅스·유닉스 환경에서는 아이디 입력 후 앱을 열어 1차적으로 일회용 인증키를 생성하고 2차적으로 인증키와 비밀번호를 입력해 로그인하며 마지막으로 이상접속을 탐지·차단하는 '바로IDS'를 통해 불법적인 정보자산 접속을 제어한다. 데이터베이스(DB) 환경에서는 아이디·비밀번호로 1단계, 일회용 인증키로 2단계 보안절차를 거친 후 3단계로 서버에서 DB 접속 시 한 번 더 일회용 인증키를 요구해 불법적인 DB 접속을 제어한다.비밀번호·아이디 기반 인증은 기념일·생일·전화번호 등 추측 가능한 비밀번호가 사용된다. 비밀번호만으로는 결코 안전하지 않아 매번 사용할 때마다 비밀번호를 대체할 수 있는 일회용 인증키가 필요하다. 정보유출, 해킹위협으로부터 각종 정보자산을 보호하기 위해 2차 인증은 선택이 아닌 필수라는 지적이다.누리아이티는 지난 8월 기존 플라스틱 인증카드에 지문정보·지문인식 모듈(BTP)을 내장한 지문인식 인증카드를 선보였다. 금융거래는 물론 신분확인 등 보안·인증이 필요한 모든 영역에서 활용할 수 있다. 서버에 생체정보인 지문정보를 보관하지 않아 생체정보 유출을 원천 방지했다. 휴대가 간편하고 카드를 분실하거나 비밀번호가 노출돼도 지문인증이 필요하기 때문에 타인이 사용할 수도 없다.누리아이티는 세계 최초로 지문을 카드에서 직접 등록하는 방식을 적용해 카드의 편리함을 유지했다. 생체 인식으로 보안성을 강화한 제품으로 시장 평가가 좋다. 누리아이티는 향후 생체인식 기술을 국내·외 불문하고 강력한 보안이 필요한 중요시설에 도입할 계획이다. 나아가 기업 정보자산의 접근제어뿐만 아니라 국방, 신용·체크카드, 사원증·출입증·보안카드 등으로 사업영역을 확대할 방침이다.이준희기자 jhlee@etnews.com▶ 네이버 모바일에서 [전자신문] 채널 구독하기▶ 전자신문 바로가기 [Copyright ⓒ 전자신문 & 전자신문인터넷, 무단전재 및 재배포 금지]",105,https://n.news.naver.com/mnews/article/030/0002769429?sid=103
"파수닷컴, ‘데이터 거버넌스 자동화’ 리서치 결과 발표",2018.12.19. 오후 4:35,"[디지털데일리 홍하나기자] 파수닷컴(대표 조규곤)은 ‘데이터 거버넌스 자동화’를 주제로 글로벌 공동 리서치를 실시한 결과를 19일 발표했다.   이번 조사는 글로벌 정보관리협회 AIIM과 함께 진행했다. 전 세계 275개 기관을 상대로 조사한 결과, 조사 대상 기관의 51%가 향후 18~24개월 내에 데이터 거버넌스에 더 많은 투자를 진행할 계획이다.  또 인공지능(AI) 및 머신러닝 기반 기술에도 적극 투자할 것으로 나타났다.   이와 같은 투자 증가 계획은 프라이버시, 보안, 개인정보보호법(GDPR) 등이 주요 동인으로 작용하고 있는 것으로 조사됐다. 데이터 거버넌스 자동화의 이점으로는 민감한 데이터를 사이버 위협, 내부자 위협 또는 실수, 장치 손실로부터 사전에 보호할 수 있다는 답변이 많았다. 뒤이어 더 이상 유용하지 않은 정보를 제거해 민감한 데이터 유출 위험을 줄일 수 있다는 답변이 나왔다.   이강만 부사장은 “많은 기업들이 ECM, ERP, 그룹웨어 등 각기 다른 시스템에서 개별적으로 관리하고 있어서 ROT 데이터 문제가 크게 부각되고 있다”고 말했다.   <홍하나 기자>hhn0626@ddaily.co.krIT언론의 새로운 대안[디지털데일리]IT정보의 즐거운 업그레이드[딜라이트닷넷]뉴스채널 설정 - 네이버 메인에서 디지털데일리 뉴스를 볼 수 있어요.홍하나(hhn0626@ddaily.co.kr)<저작권자 © 디지털데일리 무단전재-재배포금지>",105,https://n.news.naver.com/mnews/article/138/0002068536?sid=103
"카카오 배틀그라운드, 정식 서비스 이후 1년간 이용자 발자취 공개",2018.12.21. 오후 5:26,"신규 맵 ‘비켄디’ 업데이트 및 기념 이벤트 진행 중금일부터 ‘PUBG: 서바이버 패스 패키지’ 할인 판매 시작카카오게임즈(각자 대표 남궁훈, 조계현)는 자사가 서비스하고, 펍지주식회사(대표 김창한)에서 개발한 ‘카카오 배틀그라운드’가, 정식 서비스 1주년을 맞아 이용자 히스토리를 공개했다고 21일 밝혔다.지난해 12월 21일 정식 서비스를 시작한 ‘카카오 배틀그라운드’는 1년간 국내 이용자들에게 배틀로얄의 다양한 경험을 제공해 왔다.금일 공개된 히스토리에는 1년간 이용자들의 다양한 발자취를 담은 것으로, 공식 홈페이지를 통해 만나볼 수 있다. 먼저 ‘카카오 배틀그라운드’ 전체 매치 횟수는 1480만건(14,815,747)으로 나타났으며, 플레이 타임은 약 3억 9600만(396,153,897) 시간을 기록했다. 또한 이용자들이 게임 내에서 이동한 전체 거리는 약 29억6800만km로, 이는 태양에서 천왕성까지의 거리(약 30억 km)와 비슷하다.‘카카오 배틀그라운드’ 이용자들이 가장 많이 플레이한 맵은 약 572만건을 즐긴 에란겔이었으며, 미라마는 561만건을 기록했다. 플레이 한 모드는 스쿼드(4인)가 716만건으로 가장 많았으며, 다음으로 듀오(2인) 모드가 507만건을 기록했다.이 외에도 1주년 히스토리에는 전체 획득한 배틀 포인트, 전체 보급상자 횟수, 가장 많이 사용한 무기 등 다양한 정보가 담겨있다.한편, ‘카카오 배틀그라운드’는 지난 19일 설원을 배경으로 한 신규 맵 ‘비켄디’를 업데이트 했다. ‘비켄디’는 기존 맵 ‘사녹’의 빠른 속도감과 ‘에란겔’의 긴장감을 동시에 전달하는 6km X 6km 규모의 새로운 생존 전장이다. 또한 ‘비켄디’ 업데이트를 기념해 오는 1월 8일까지 단계별 임무를 완료하면 아이템과 추첨을 통해 경품을 증정하는 ‘미스터K의 비켄디(Mr.K's VIKENDI) 생존일지’ 이벤트도 진행 중이다.아울러 ‘비켄디’를 플레이 해 치킨(최후의 1인)을 달성한 후 개인 페이스북에 해시태그와 함께 스크린샷을 업로드하면 추첨을 통해 게임밍 헤드셋(스틸시리즈 ARCTICS5 7.1 SURROUND RGB), 치킨 세트(BBQ 황금올리브치킨+콜라 1.25L), 게임 아이템을 증정하는 이벤트도 오는 1월 8일까지 진행된다.마지막으로 ‘카카오 배틀그라운드’는 금일부터 오는 1월 4일 오전 3시 5분까지 ‘PUBG: 서바이버 패스 패키지(카카오 배틀그라운드+서바이버 패스:비켄디 코드)’를 기존 37,700원에서 26,900원으로 할인 판매 한다.‘카카오 배틀그라운드’의 서비스 1주년 히스토리 공개 및 각종 이벤트에 대한 보다 자세한 사항은 공식 홈페이지와 페이스북에서 확인할 수 있다. 전자신문인터넷 소성렬 기자 hisabisa@etnews.com▶ 네이버 모바일에서 [전자신문] 채널 구독하기▶ 전자신문 바로가기 [Copyright ⓒ 전자신문 & 전자신문인터넷, 무단전재 및 재배포 금지]",105,https://n.news.naver.com/mnews/article/030/0002770134?sid=103
 화성에서 날아온 ‘화이트 크리스마스’ 소식 ,2018.12.22. 오후 12:20,"북위 73도 저지대의 82km 크기 분화구중심부 얼음 두께는 최대 1.8km로 추정



화성 북위 73도 저지대에 있는 코롤료프 분화구의 얼음층. ESA 제공  크리스마스 시즌이 다가오면, 많은 사람이 눈 내리는  화이트 크리스마스를 바란다. 하지만 한국에선 올해도 3년째 눈 없는 크리스마스를 맞을 것이라는 예보다.  대신 유럽우주국(ESA)의 우주 탐사선이 화성에서 보내온 사진으로 화이트크리스마스의 아쉬움을 달래보자. 크리스마스 시즌을 맞아 최근 유럽우주국이 일년 내내 하얀 세상을 펼치는 화성의 한 분화구 모습을 공개했다. 화성 북위 73도의 저지대에 우뚝 솟아 있는 코롤료프(Korolev) 분화구다.



  너비가 82km나 되는 이 분화구는 일년 내내 얼음층에 뒤덮여 있다. 과학자들은 얼음의 양이 2210㎦에 이르며, 분화구 중심부의 얼음 두께는 1.8km에 이르는 것으로 추정한다. 화성 대기와 지질 탐사 임무를 수행하고 있는 탐사위성 마스 익스프레스(Mars Express)가 올 4월4일에 촬영한 사진 5개를 합성한 것으로, 해상도는 픽셀당 21미터에 이른다. 분화구는 외곽이 산봉우리처럼 삐죽 치솟아 있는데, 이것이 얼음으로 차가워진 공기가 밖으로 빠져나가지 못하도록 가둬 얼음을 보호해준다. 높이 2km짜리 원형 방패로 일종의 공기 단열층을 만드는 것이다.



빨간색이 고지대, 파란색이 저지대다. ESA 제공  땅속에서 액체 상태 호수 추정층도 발견 유럽 최초의 화성 탐사선인 마스 익스프레스는 공교롭게도 2003년 크리스마스일에 화성 궤도에 진입했다. 이날 마스 익스프레스는 착륙선 비글2호를 화성 표면에 내려보냈으나, 이후 비글2호와의 통신이 끊겼다. 마스 익스프레스는 대신 고해상도의 칼라 스테레오 카메라로 화성 표면을 샅샅이 살피며 화성 극지대에서 얼음층을 찾아냈다. 과학자들은 특히 지난 7월 마스 익스프레스의 레이더장치가 보내온 자료를 통해 화성 남극 근처 얼음층 아래에서 액체 상태의 물로 이뤄진 폭 19km의 호수 추정층을 발견했다고 발표했다. 사실로 판명날 경우, 화성 생명체 존재에 대한 기대감이 한껏 높아질 전망이다.  코롤료프 분화구는 러시아 로켓공학자이자 우주선 설계자인 세르게이 코롤료프의 이름에서 따온 것이다. 그는 1957년 인류 최초의 인공위성인 스푸트니크 프로그램에 참여했으며, 이후 1961년 유리 가가린을 최초의 우주비행사로 만든 보스토크 프로그램에도 참여했다. 곽노필 선임기자 nopil@hani.co.kr, ▶곽노필의 미래창 바로가기  [신뢰도 1위 ‘한겨레’ 네이버 메인 추가] [블록체인 미디어 : 코인데스크] [신문구독][ⓒ한겨레신문 : 무단전재 및 재배포 금지]",105,https://n.news.naver.com/mnews/article/028/0002437022?sid=103
"CGV, 캐나다 첫 스크린X관 오픈…’아쿠아맨’으로 첫 선",2018.12.22. 오전 3:02,"[스포츠월드=이혜진 기자] CGV의 다면상영특별관 스크린X가 캐나다에 진출한다.    스크린X는 올해만 스위스, 프랑스, 스페인 등 서유럽 진출과 쿠웨이트, 아랍에미리트 등 중동 진출에 이어 새로운 관람 문화를 선도하기 위해 캐나다까지 진출하는 확장세를 보이고 있다.   CJ CGV(대표이사 최병환)는 21일(현지시간) 캐나다 1위 극장사업자 씨네플렉스(Cineplex)와 손잡고 캐나다 온타리오주 토론토에 위치한 씨네플렉스 퀸즈웨이&브이아이피(Cineplex Cinemas Queensway and VIP)에 첫 스크린X관(247석)을 오픈했다고 밝혔다.   씨네플렉스는 지난 2016년 CJ CGV 자회사 CJ 4DPLEX와 협력해 캐나다 토론토 영 던다스&브이아이피(Cineplex Cinemas Yonge-Dundas and VIP) 극장에 첫 4DX관을 오픈했다. 지난 9월에는 4DX 13개관 추가 오픈을 계약하며 협력체계를 공고히 하고 있는 파트너사이기도 하다. 뜨거운 호응을 얻고 있는 오감체험특별관 4DX에 이어 몰입형 상영 포맷으로 떠오르고 있는 다면상영시스템 스크린X를 통해 캐나다 관객에게 색다른 관람 경험을 제공하고자 오픈하게 됐다.   첫 스크린X 상영작으로는 워너 브러더스의 ‘아쿠아맨’이 선정됐다. 영화 ‘아쿠아맨’은 땅의 아들이자 바다의 왕, 심해의 수호자인 슈퍼히어로 아쿠아맨의 지상 세계와 수중 세계를 오가는 위대한 여정과 탄생을 그린 액션 블록버스터다. ‘아쿠아맨’ 스크린X 버전은 화려한 아틀란티스 바다 왕국과 다양한 심해 크리처를 3면 스크린에 풍부하게 담아냈다.    씨네플렉스의 댄 맥그라스(Dan McGrath) 운영총괄(COO)은 ""관객들에게 선보일 새롭고 혁신적인 경험을 항상 찾고 있다”며 ""스크린X는 우리가 찾던 완벽한 포맷이며, 우리는 이 파트너십을 꾸준히 이어가길 바란다”고 전했다.   CJ CGV 김종열 신사업추진본부장은 ""씨네플렉스와의 파트너십을 바탕으로 캐나다에도 스크린X관을 선보이게 되어 기쁘다”며 “앞으로도 더 많은 스크린X관과 다양한 콘텐츠들로 관객들을 매료시킬 수 있도록 노력하겠다”고 말했다.   한편, 스크린X는 현재 미국, 중국, 태국, 인도네시아, 베트남, 터키, 일본, 프랑스 등 총 16개국에서 189개 스크린을 운영 중이다.   hjlee@sportsworldi.com   사진=영화 ‘아쿠아맨’ 스크린X 스틸컷",105,https://n.news.naver.com/mnews/article/396/0000498797?sid=103
"씹거나, 짜먹거나…뜨는 숙취해소제 '나야 나'",2018.12.21. 오후 5:15,"전예진 기자의 토요약국젤리 형태 '레디큐츄' 20代에 인기'헛겔'은 스틱형 제품이라 보관 편리음주 前에 먹어야 효과 높아져[ 전예진 기자  ] 



송년회가 많은 연말 숙취해소제 판매가 급증하고 있습니다. 국내 숙취해소제 시장은 1800억원 규모로 추정되는데요. 편의점 매출 기준으로 ‘컨디션’(CJ헬스케어) ‘여명808’(그래미) ‘상쾌환’(삼양) ‘모닝케어’(동아제약)가 4강 구도를 형성하고 있습니다. ‘헛개파워’(광동제약)와 ‘레디큐’(한독)도 시장 점유율이 높아지는 추세입니다.이 중 어떤 제품이 효과가 좋은지 궁금해하는 분이 많은데요. 주요 성분에 큰 차이가 없기 때문에 ‘도긴개긴’입니다. 대부분 미배아발효추출물인 글루메이트가 주성분입니다. 콩에서 추출한 성분과 쌀 배아를 발효한 물질입니다. 이 물질은 숙취를 일으키는 알코올 성분인 아세트알데히드를 분해하는 등 숙취 해소에 효과가 있는 것으로 알려져 있습니다.글루메이트를 기반으로 다양한 성분을 첨가해 맛과 향이 달라지죠. 예를 들어 여성용으로 출시된 컨디션레이디에는 지방 간 발생을 예방하는 것으로 알려진 베타인과 피부 보습 성분인 히알루론산이 들어 있습니다. 프리미엄 제품 컨디션CEO에는 월계수 잎과 자리, 선인장 열매 복합추출물을 넣었습니다. 가격이 1만원으로 다른 제품의 두 배인데, 효과도 두 배인지는 확실치 않습니다. 헛개컨디션과 헛개파워는 이름처럼 헛개나무열매추출물을 사용했습니다. 여기에 인진쑥 갈근 감초 대잎둥굴레 배초향 엉겅퀴 등 식물성 성분을 추가하기도 합니다. 식물 성분의 ‘끝판왕’은 여명808입니다. 오리나무와 마가목추출물을 주원료로 한 숙취 해소용 천연차라는데 맛은 한약 수준입니다. 고약한 맛이 단점이지만 ‘입에 쓴 약이 보약’이라는 말처럼 효과를 본 마니아층이 형성돼 있기도 합니다.



최근에는 강황을 넣은 제품이 인기입니다. 카레의 주원료인 강황은 알코올 분해를 촉진하고 간 기능을 보호하는 기능이 있습니다. 모닝케어 강황(왼쪽)과 레디큐가 대표적이죠. 레디큐는 강황 특유의 향을 없애기 위해 망고 맛으로 차별화했습니다. 마시는 숙취 해소제 시장에서 제형을 다르게 개발한 제품도 잇달아 나오고 있습니다. 쫄깃한 젤리 형태인 레디큐츄는 20대에서 인기입니다. 환 형태의 상쾌환도 좋은 반응을 얻고 있습니다. 헛개 창출 산사나무열매 칡꽃 등 식물 성분을 고농축한 제품인데요. 과음으로 속이 더부룩할 때 알약처럼 물과 함께 먹을 수 있고 휴대가 편리하다는 점 때문에 찾는 사람이 많다고 합니다. 짜먹는 감기약의 인기 속에 짜먹는 숙취 해소제도 입소문을 타고 있습니다. ‘헛겔’(JW중외제약·오른쪽)은 헛개나무열매, 홍삼, 강황, 망고 농축액을 함유한 짜먹는 스틱형 포장의 겔 제품인데요. 환과 젤리, 겔 형태의 제품은 음주 전과 중간에 음료 제품과 함께 복용하면 효과를 높일 수 있다고 합니다.ace@hankyung.com[한경닷컴 바로가기] [모바일한경 구독신청] 한국경제 채널 구독하고, 선물 받자!! <이벤트 자세히 보기> ⓒ 한국경제 & hankyung.com, 무단전재 및 재배포 금지",105,https://n.news.naver.com/mnews/article/015/0004066120?sid=103
