title,date,main,section,url
"SK바사 ""임상3상 백신, 부스터샷용으로 내년 상반기 출시""",2021.12.06. 오후 5:49,"2021 대한민국 바이오 투자 콘퍼런스국내 제약·바이오社 한 자리에""2상 성공으로 선구매 문의 늘어개발 늦지 않아…백신 수요 충분""한미약품 ""mRNA백신 기술확보TF팀 꾸려 항암제 등으로 확장""메드팩토, 파이프라인 10개 임상 앱클론·티움바이오도 개발 속도



6일 서울 한강로 드래곤시티에서 열린 '2021 대한민국 바이오 투자 콘퍼런스'(KBIC 2021)에서 김훈택 티움바이오 대표가 신약 개발 진척 상황을 설명하고 있다. 7일까지 이틀간 열리는 이번 행사에는 국내 대표 바이오·헬스케어 기업 96곳이 기업설명회를 한다.    김병언  기자“독자 개발 중인 코로나19 백신이 부스터샷에 활용되도록 내년 상반기에 선보일 계획입니다.”박영주 SK바이오사이언스 기업설명(IR) 실장은 6일 서울 한강로 드래곤시티에서 열린 ‘2021 대한민국 바이오 투자 콘퍼런스(KBIC 2021)’에서 임상 3상 중인 재조합 단백질 방식의 코로나19 백신(GBP510) 개발 계획을 이같이 밝혔다. 글로벌 민간기구 감염병혁신연합(CEPI)의 지원을 받아 개발 중인 이 백신 수요가 부스터샷만으로도 충분하다는 게 회사 측 판단이다. 화이자 모더나 등이 주도하는 코로나19 백신 시장에서 승산이 있다는 의미다.다국적 제약사 텃밭인 항암제 시장에서는 국내 제약·바이오 기업이 선전하고 있다. 한미약품의 항암 신약 2개는 내년 미국 식품의약국(FDA)의 허가 가능성이 점쳐지고 있고, 앱클론 등은 최근 뜨거운 관심 분야인 세포치료제 분야에서 개발 속도를 높이고 있다. SK바사 “조만간 선구매 계약 기대”박 실장은 SK바이오사이언스가 개발 중인 코로나19 백신의 흥행 조짐 분위기를 전했다. 그는 “임상 2상 결과가 성공적으로 나오면서 선구매 계약을 타진하는 국가가 늘고 있다”며 “조만간 선구매 계약이 이뤄질 것으로 기대한다”고 했다. SK바이오사이언스는 GBP510 투약군 99% 이상에서 바이러스를 무력화하는 중화항체가 형성됐다는 임상 1·2상 결과를 얻었다.박 실장은 “코로나19 백신이 너무 늦게 나오는 것 아니냐는 얘기가 있지만 기회는 충분하다”며 “세계 인구의 45%가 코로나19 백신을 한 차례도 맞지 않았다”고 했다. 이어 “현재 진행 중인 글로벌 임상 3상 속도는 한국이 가장 빠르다”며 “내년 상반기 한국에서 가장 먼저 품목 허가가 날 것”이라고 했다.메신저 리보핵산(mRNA) 방식 코로나19 백신을 개발하고 있는 아이진은 오미크론 변이 바이러스 대응에 자신감을 보였다. 김석현 아이진 연구소장은 “오미크론 항원의 서열을 제공받아 백신 원료로 쓰이는 플라스미드 제작에 들어갔다”며 “미국 모더나와 화이자에 비해 (개발이) 5~6개월 이상 늦지 않도록 속도를 내겠다”고 말했다.코로나19 항체 치료제 ‘렉키로나’로 유럽의약품청(EMA) 승인 문턱을 넘은 셀트리온은 흡입형 렉키로나 개발에 속도를 내고 있다. 이수영 셀트리온 신약연구본부장(전무)은 “연내 흡입형 치료제 임상 1상을 마치겠다”고 했다. 메드팩토·앱클론 등 개발 계획 공개항암 세션 첫 발표 기업은 메드팩토였다. 박창원 메드팩토 이사는 “내년에는 임상 속도가 가장 빠르고 사업성이 확실한 파이프라인 중심으로 후속 임상에 진입할 계획”이라며 “그 대상은 대장암과 침윤성 섬유종증(데스모이드), 췌장암이 될 것”이라고 강조했다. 메드팩토는 핵심 파이프라인인 백토서팁으로 10개 임상을 하고 있다.키메릭 항원 수용체 T세포(CAR-T) 치료제를 개발하는 앱클론의 이종서 대표는 “내년 초 림프종과 백혈병을 타깃으로 하는 ‘AT101’ 임상 1상 환자 투약이 가능할 것으로 기대한다”고 말했다. 앱클론은 지난 6월 식품의약품안전처에 AT101의 임상 1·2상을 신청했다. 이 대표는 “조만간 임상 승인 여부가 결정될 것”이라고 했다.티움바이오는 항암제와 희귀질환 시장을 모두 겨냥하고 있다. 김훈택 티움바이오 대표는 “희귀질환 치료제 시장 성장률은 일반의약품보다 두 배가량 높다”며 “임상 기간이 짧고 질환 원인이 명확한 경우도 많아 신약 성공 가능성이 높다”고 말했다. 티움바이오의 대표적 희귀질환 파이프라인은 혈우병이다. 김 대표는 “노보노디스크의 ‘노보세븐’, 다케다의 ‘훼이바’ 등이 시장에 나와 있지만 약물 지속 기간이 짧고 가격이 비싸다”며 “우리는 전임상 단계에서 노보세븐과 같은 용량을 투여해도 효능이 뛰어나다는 것을 확인했다”고 말했다. 허성진 LG화학 사업개발부문 담당은 “오픈이노베이션(개방형 혁신) 전략 일환으로 후기 임상 단계인 항암제, 초기 임상 단계인 면역세포치료제, 세포·유전자치료제 플랫폼 등의 기술 도입을 검토하고 있다”고 말했다. 한미약품, mRNA 자신감…전담 TF 구성이날 메인 행사의 첫 번째 발표자로 나선 권세창 한미약품 사장은 mRNA 백신 플랫폼을 독자 구축했다며 자신감을 보였다. 그는 “어떤 변이 코로나19 바이러스 백신을 개발하더라도 화이자와 모더나 특허를 침해하지 않을 정도의 자체 기술을 확보했다”고 강조했다. 한미약품은 코로나19 백신뿐 아니라 항암제 등으로 mRNA 백신·치료제 개발을 확장하기 위해 내부에 전담 태스크포스(TF)도 꾸렸다.권 사장은 사노피와 얀센 등 글로벌 제약사에 기술수출 ‘잭팟’을 터뜨렸다가 반환된 파이프라인에 대해서도 포기하지 않고 적극적으로 개발을 시도하겠다고 강조했다. 그는 “얀센이 반환한 비만 치료제는 간 등 대사 질환 치료제로의 가능성을 확인했다”며 “이르면 내년에 임상 결과를 확인할 수 있을 것”이라고 전했다. 한미약품은 사노피가 반환한 당뇨 신약(에페글레나타이드)도 대사 질환으로 적용 분야를 확대해 사업 기회를 노리고 있다.",105,https://n.news.naver.com/mnews/article/015/0004637313?sid=103
"""탄소중립…작은 것부터 실천하세요"" 구미시 캠페인 펼쳐",2021.12.06. 오후 2:49,"""불필요한 전자우편함 비웁시다""[구미시 제공. 재판매 및 DB 금지]    (구미=연합뉴스) 홍창진 기자 = 경북 구미시는 대한민국 2050 탄소중립 비전 선언 1주년을 나흘 앞두고 6일 시청과 구미역 광장에서 '디지털 탄소 다이어트' 캠페인을 펼쳤다.    이 캠페인은 탄소중립 실천 분위기를 확산시키기 위해 컴퓨터나 온라인상에 저장 중인 불필요한 데이터(일명 '다크 데이터')를 삭제해 데이터 저장소에서 배출되는 온실가스를 줄인다는 취지로 진행된다.    시는 경북기후·환경네트워크, 온실가스진단컨설턴트와 함께 시민을 대상으로 불필요한 전자우편 삭제하기, 인터넷 영상시청 줄이기, 음악 스트리밍 감상 대신 내려받기 등 실천방안을 홍보했다.    또 이날부터 오는 10일까지 탄소중립 주간에는 공공기관 내 사용하지 않는 전자우편함 비우기를 독려할 계획이다.    시 관계자는 ""데이터 시대 탄소중립 사회로 전환을 위해 전자우편함 비우기 등 시민들이 할 수 있는 작은 일부터 적극적으로 동참할 것을 당부드린다""고 말했다.    realism@yna.co.kr",105,https://n.news.naver.com/mnews/article/001/0012829086?sid=103
"정부, LG전자 상생결제 모범사례 선정",2021.12.06. 오후 4:06,- 2020년 상생결제 낙수율 7.4%   [디지털데일리 윤상호 기자] 정부가 LG전자를 상생결제 모범사례로 선정했다.   LG전자(대표 배두용)는 정부서울청사 별관에서 열린 ‘공정경제 성과 보고대회’에서 상생결제 확산 모범사례로 뽑혔다고 6일 밝혔다.   이날 LG전자는 2차 협력사까지 결제환경을 개선한 사례를 발표했다. LG전자는 2015년 상생결제를 도입했다. 2차 이하 협력사가 도움을 받을 수 있도록 1차 협력사 참여를 독려하고 있다.   작년 LG전자는 1차 협력사에 상생결제로 7조1484억원을 지급했다. 이 중 5314억원이 2차 협력사로 갔다. 상생결제 낙수율은 7.4%를 기록했다. 국내 대기업 중 가장 높다. LG전자는 올해 낙수율은 두 자릿수를 넘을 것으로 예측했다.   LG전자 구매/공급망관리(SCM)경영센터장 왕철민 전무는 “상생의 온기가 2차 이하 협력사까지 전달될 수 있도록 협력사와 함께 노력해 나갈 것”이라고 말했다.,105,https://n.news.naver.com/mnews/article/138/0002114782?sid=103
"웹젠, 신작 ‘뮤오리진3’ 사내 테스트 진행…내년 1분기 출시",2021.12.06. 오전 11:47,"‘뮤’ IP 모바일게임 최초 ‘언리얼 엔진4’로 제작…탁월한 그래픽·비행 콘텐트로 차별화   



'뮤 오리진3' 이미지 [사진 웹젠]    웹젠이 신작 모바일게임 ‘뮤오리진3’의 사내 테스트를 시작으로 출시 준비에 나선다.    웹젠은 금일부터 12월 10일까지 자사 임직원을 대상으로 신작 ‘뮤오리진3(MU Origin 3)’의 사내 테스트(IBT, Internal Beta Test)를 진행한다고 6일 밝혔다. 내년 1월 중에는 정식 서비스를 목표로 사전예약도 시작할 계획이다.      웹젠이 준비하고 있는 뮤오리진3는 뮤(MU) IP 모바일게임 ‘뮤오리진’ 시리즈의 최신작이다. 2015년 출시된 뮤오리진은 국내 모든 앱 마켓(구글 플레이스토어, 애플 앱스토어, 원스토어)에서 매출 및 인기순위 1위에 오른 바 있다. 2018년 선보인 ‘뮤오리진2’ 역시 출시 후 앱 마켓 매출 순위 2위에 오르며 흥행했다.      스테디셀러인 전작들의 뒤를 잇는 뮤오리진3는 ‘언리얼 엔진4’를 기반으로 제작됐다. 모바일 환경에 맞게 콘텐트와 게임성을 최적화하는 한편, 언리얼 엔진을 사용한 그래픽 품질도 크게 향상됐다.      특히 뮤 IP 게임 중 최초로 실제 비행 시스템을 도입해 뮤 IP 시리즈의 오리지널리티인 날개의 기능을 확대했다. 기존 뮤의 날개 시스템은 근거리 이동만 가능했지만 뮤오리진3에서는 게임의 오픈월드 내 육지와 바다, 공중을 자유롭게 비행하면서 탐험할 수 있다.      동시에 전작 뮤오리진2에서 최초로 시도했던 전 서버 대결 콘텐트 ‘어비스 전장’이 기술적으로 더 발전했다. 서버 경계를 넘어 전 이용자가 모이는 어비스 전장은 치열한 PK(Player Killing)가 가능한 공간이다. 이곳에는 각 서버의 전용 영지와 별도의 분쟁 지역이 존재해, 각각의 영지를 둘러싼 전 서버의 대규모 경쟁이 가능하다.      이외에도 ‘스톤헨지’, ‘이스터 섬 동상’ 등 세계적인 유적지들을 게임 내 곳곳에 입체적으로 구현했다. 빛과 그림자, 건축물의 질감 등을 사실적으로 표현해 몰입감을 높였다. 외형을 원하는 대로 제작할 수 있는 캐릭터 커스터마이징 기능도 한층 세밀해졌다.      MMORPG의 장르적 재미도 살렸다. ‘보스 레이드’와 ‘어비스 공성전’, ‘길드 콘텐트’ 등 다양한 협동 및 경쟁 콘텐트로 이용자 간 활발한 상호작용을 지원하며, 아이템과 장비를 수집하는 파밍 요소는 늘리고 확률형 아이템의 비중은 크게 줄였다.      웹젠은 이후 사업 일정에 맞춰 뮤오리진3의 공식 커뮤니티를 열고, 세계관과 콘텐트 등의 각종 게임 정보와 이벤트 소식을 공개하면서 내년 1분기 서비스를 준비할 계획이다.",105,https://n.news.naver.com/mnews/article/243/0000019543?sid=103
"보드게임 '땅끝까지 이르러', 오늘 밤 자정 와디즈 펀딩 마감",2021.12.06. 오전 9:46,"[이데일리 이윤정 기자] 국내 보드게임 제작사 백훔은 자사 보드게임 ‘땅끝까지 이르러’ 와디즈(Wadiz) 리워드 펀딩이 오늘 밤 자정에 종료된다고 6일 밝혔다.



(사진제공=백훔)순수 창작 보드게임 ‘땅끝까지 이르러’는 10월 28일 와디즈 펀딩 시작과 동시에 목표금액의 100% 펀딩 을성공하고, 30분만에 목표 금액의 2000% 펀딩을 기록하는 등 많은 관심을 받아 현재는 와디즈 BEST 펀딩에 선정된 바 있다.특히 쉽고 간단하게 제작되어 만 5세 이상부터 교육용으로 즐길 수 있으며, 라이브 드로잉 마스터 김정기 작가의 수준 높은 일러스트를 통해 선물용으로도 인기를 끌고 있다.현민우 백훔 부대표는 “게임을 만들면서 가장 우선시한 것은 쉽고 재미있어야 한다는 것이지만, 또한 역사 테마이기 때문에 잘못된 내용이 없도록 충분한 주의를 기울였다”면서 “펀딩 기간 동안 많은 관심을 보내주신 서포터들께 작은 보답의 의미로 구성품 추가와 카드 품질 업그레이드를 결정했다”고 말했다.한편 2015년 설립된 보드게임 전문 회사 백훔은 역사를 테마로 한 보드게임을 제작해왔으며, 4번째 역사 시리즈 ‘땅끝까지 이르러’ 외에도 다양한 보드게임 출시를 준비하고 있다. 자세한 내용은 와디즈 홈페이지에서 확인할 수 있다.",105,https://n.news.naver.com/mnews/article/018/0005100774?sid=103
IR52 장영실상 30주년 기념 비전선포식,2021.12.06. 오후 5:14,(서울=연합뉴스) 진연수 기자 = 6일 오후 서울 강남구 그랜드 인터컨티넨탈 서울 파르나스 호텔에서 열린 IR52 장영실상 30주년 기념식에서 임혜숙 과학기술정보통신부 장관과 구자균 한국산업기술진흥협회장 등 참석자들이 비전 선포를 하고 있다. 2021.12.6    jin90@yna.co.kr,105,https://n.news.naver.com/mnews/article/001/0012864670?sid=103
"로봇 자동화 AI 추천 서비스 마로솔, 프리 시리즈A 투자유치",2021.12.06. 오전 9:16,"[이데일리 이윤정 기자] 로봇 자동화 AI 추천 서비스 ‘마로솔’을 개발한 빅웨이브로보틱스㈜는 ‘카카오인베스트먼트’와 ‘KB인베스먼트(이하 KB)’로부터 15억 규모의  프리 시리즈 A(Pre Series A) 투자를 유치했다고 6일 밝혔다. 



(사진제공=빅웨이브로보틱스㈜)마로솔은 로봇 자동화를 희망하는 수요기업과 공급기업을 효과적으로 매칭해주는 로봇자동화 온라인 플랫폼이다. 이번 투자를 계기로 마로솔은 데이터베이스를 기반으로 검증된 로봇과 패키지 솔루션에 대한 로봇 전용 금융 서비스 출시와 향후 중고 로봇 시장 형성에 핵심이 될 RaaS(Robot-as-a-Service) 서비스 개발에 박차를 가할 계획이다.전수안 카카오인베스트먼트 수석은 “마로솔은 출시 1년도 안 되어 로봇 업계 내 필수 플랫폼으로 자리잡았다. 정보 비대칭 문제 해소는 물론 매출 증가와 수익화까지 가능한 비즈니스모델의 우수성과 팀의 역량을 높이 평가하였다”고 투자 소감을 밝혔다.송민재 KB 심사역은 “마로솔은 공급기업 중심의 로봇 시장을 수요자 중심으로 성공적으로 빠르게 변화시켜 나가고 있다”며 “수요기업들의 높은 만족도를 확인 후 로봇 업계 내 유니콘 기업으로 성장할 것을 확신하고 투자를 결심하게 되었다”고 언급했다.김민교 빅웨이브로보틱스 대표는 “마로솔은 수요기업과 공급기업 모두 만족하는 서비스로 성장하고 있으며, 스케일업에 대한 확신이 들어 첫 기관투자를 유치하게 되었다”고 언급하며 “이번 투자유치를 통해 다양한 협업이 가능한 파트너들과 함께하게 된 점은 향후 마로솔의 성장에 큰 힘이 될 것”이라고 기대감을 드러냈다.한편 로봇 자동화 온라인 플랫폼 마로솔과 관련한 더욱 자세한 내용은 공식 홈페이지에서 확인할 수 있다.",105,https://n.news.naver.com/mnews/article/018/0005100724?sid=103
"유국희 신임 원안위원장 ""안전규제 과학 전문성 강화할 것""",2021.12.06. 오후 4:28,"선제적 규제·열린 소통 강조



 ""객관적인 과학을 바탕으로 열린 안전 규제를 통해 믿음직한 원자력안전위원회를 만들어가겠다.""6일 본격적인 업무에 들어간 유국희 원자력안전위원회 신임 위원장(사진)은 이날 취임사를 통해 이처럼 포부를 밝혔다. 그는 ""원자력 안전은 정치적인 입장이나 유불리에 따라 좌우될 수도, 타협할 수도 없는 절대 명제""라며 ""원자력 안전규제는 과학적 지식에 기반한 명확한 기준에 따라 수행돼야 한다""고 강조했다. 이날 취임식은 코로나19 유행 상황을 고려해 생략했다.유 위원장은 ""원안위의 지난 10년이 국내 원자력 안전규제의 기틀을 마련하고 독립된 규제기관으로서 자리 매김하는 시기였다면, 앞으로의 10년은 국민께 신뢰받는 유능한 규제기관으로 발돋움하는 도약의 시기가 돼야 한다""고 강조했다. 그러면서 △과학적인 전문성을 갖춘 유능한 규제기관 △국민 신뢰를 얻기 위한 열린 안전규제 △국민 안전관리 대책의 철저한 추진 등을 역점을 두고 추진해나가겠다고 포부를 밝혔다. 유 위원장은 ""원자력 시설에서 발생할 수 있는 문제를 선제적으로 찾아내 사고를 예방할 수 있는 규제역량을 갖춰야 한다""며 ""원전에 있어서는 철저한 점검으로 안전성을 확인하되,월성 원전의 삼중수소 문제 등 국민의 우려가 큰 현안은 객관적이고 투명한 조사를 통해 의혹을 명확히 해소하고 그 과정에서 부족한 점이 있으면 확실히 보완해 나가겠다""고 강조했다. 문재인 대통령은 지난 3일 8명의 차관급 인사를 단행하면서 신임 원안위원장으로 유국희 전 국립중앙과학관장을 임명했다.",105,https://n.news.naver.com/mnews/article/009/0004889576?sid=103
"KT그룹희망나눔재단, 선한영향력 '강동야학'에 'KT희망나눔인상'",2021.12.06. 오전 9:38,"""코로나19로 어렵고 힘든 시기 수상자들의 활동이 국민들에게 따뜻한 희망 전파하길""KT그룹희망나눔재단이 우리사회 사회 곳곳에서 선한 영향력을 실천하는 이웃에 감사의 마음을 전했다.



KT희망나눔인상을 수상한 '강동야학'의 입학식 모습 [사진= KT그룹희망나눔재단]KT그룹희망나눔재단(이사장 조성준)은 올 한해 나눔 활동으로 지속가능한 사회를 만드는 데 기여한 5명을 '희망나눔인'으로 선정해 'KT희망나눔인상'을 수여했다고 6일 발표했다.'KT희망나눔인상'은 나눔으로 아름다운 사회 가치를 만드는데 기여한 사람들의 활동을 격려하고 나눔의 가치를 전파하고자 KT그룹희망나눔재단이 제정한 상이다.지난 7월 21일부터 10월 30일까지 홈페이지를 통해 후보자 추천을 받았으며 ▲ 사회적 기여도 ▲ 기여한 역할의 가치와 중요성 ▲ 지속성을 기준으로 심사 및 인터뷰 과정을 거쳐 총 5명(단체의 경우 대표자 1명)을 선정했다.'KT희망나눔인상' 제1호는 교육 기회를 놓친 노인 대상으로 초∙중∙고등 과정을 무료로 지도하는 교육학교 '강동야학'에 돌아갔다. 강동야학은 1989년 개교 이후 뜻있는 후원과 교사들의 자발적 무료 봉사로 운영되고 있으며, 매년 20~25명의 교사들이 활동하고 40여명의 학생들이 고등학교 검정고시를 목표로 교육을 받고 있다. 40여명의 학생 중 95% 이상이 50~70대로 구성돼 있으며, 매년 5~6명씩 지금까지 총 300여명의 고등학교 검정고시 합격생을 배출했다.KT그룹희망나눔재단은 강동야학 외에도 ▲ 어려운 이웃을 위해 1천원의 식사를 제공하는 '해뜨는 식당'의 김윤경(47) 씨 ▲ 장애인의 이동 편의를 위한 지도를 제작하는 협동조합 '무의'의 홍윤희(46) 씨 ▲ 17년간 어르신들께 무료 안경 나눔을 하는 강상구(53) 씨 ▲청소년들과 함께 지역사회 문제 해결을 위한 봉사단을 만들어 활동하고 있는 광양하이텍고등학교 김성태(44) 교사에게 'KT희망나눔인상'을 수여했다.KT그룹희망나눔재단은 ""코로나19로 모두가 힘들고 어려운 상황이지만 ‘KT희망나눔인상’ 수상자들의 활동이 국민들에게 따뜻하고 선한 이 시대의 이웃으로 사랑받길 바란다""며 ""앞으로도 나눔의 실천을 전파하고 더불어 사는 사회를 만들기 위해 우리 사회 곳곳에서 묵묵히 활동하는 희망나눔인을 지속 발굴해 나갈 것""이라고 말했다.",105,https://n.news.naver.com/mnews/article/031/0000640547?sid=103
IR52 장영실상 30주년 기념식,2021.12.06. 오후 5:14,(서울=연합뉴스) 진연수 기자 = 임혜숙 과학기술정보통신부 장관(왼쪽 첫번째)이 6일 오후 서울 강남구 그랜드 인터컨티넨탈 서울 파르나스 호텔에서 열린 IR52 장영실상 30주년 기념식에서 수상자들과 기념촬영을 하고 있다. 2021.12.6    jin90@yna.co.kr,105,https://n.news.naver.com/mnews/article/001/0012864674?sid=103
