title,date,main,section,url
"'27세 마에스트로' 메켈레 ""지휘자는 언제나 준비돼 있어야""",2023.10.17. 오후 5:15,"30일 오슬로 필하모닉과 내한…시벨리우스 곡만으로 프로그램 편성7세 오페라 합창하며 지휘자 꿈꿔…""매번 새로운 것 발견하는 게 음악의 매력""



지휘자 클라우스 메켈레[Marco Borggreve·빈체로 제공. 재판매 및 DB 금지]    (서울=연합뉴스) 강애란 기자 = 핀란드 출신 지휘자 클라우스 메켈레(27)는 최근 클래식 음악계에서 독보적으로 눈에 띄는 인물이다.    그는 20대 나이에 '천재 지휘자', '젊은 거장', '클래식계 아이돌' 등이라고 불리며 백발의 거장들이 주로 오르는 포디움을 당당히 차지했다. 1996년생인 메켈레는 같은 세대 지휘자들 가운데서도 압도적인 실력을 자랑한다.    이력만 보더라도 그가 보수적인 클래식 음악계에서 얼마큼 실력을 인정받고 있는지 가늠할 수 있다. 그는 단 한 번의 지휘로 노르웨이 오슬로 필하모닉 상임지휘자에 발탁돼 2020년부터 오케스트라를 이끌고 있고, 2021년부터는 프랑스 파리 오케스트라의 음악감독을 맡았다. 31세가 되는 2027년부터는 유럽 최정상급 교향악단으로 꼽히는 로열 콘세르트허바우 오케스트라(RCO)의 상임 지휘자로 활동한다.    이처럼 '최연소' 타이틀을 달고 유명 오케스트라들의 러브콜을 받는 메켈레가 처음 한국을 찾는다. 그는 오는 30일 서울 송파구 롯데콘서트홀에서 오슬로 필하모닉을 이끌고 핀란드의 작곡가 시벨리우스의 곡들을 연주한다.     메켈레는 17일 연합뉴스와 한 서면 인터뷰에서 ""팬데믹으로 2021년과 2022년 예정됐던 두 번의 내한 공연을 하지 못해 진심으로 아쉽고 죄송했다""며 ""하지만 그때의 아쉬움 때문에 이번 공연에 대한 기대가 배가 됐다""고 말했다.    다만 메켈레는 자신의 음악보다 '어린 지휘자'로 주목받아온 탓인지 나이에 관한 질문은 받지 않았다. 대신 지휘자가 된 배경과 과정, 자신이 생각하는 지휘자로서 갖춰야 할 역량에 관해 답했다.    그는 ""7세에 핀란드 헬싱키에서 오페라 '카르멘'에 출연하는 합창단의 일원으로써 함께했다""며 ""그때 제 눈에는 지휘자밖에 보이지 않았던 것 같다. (지휘자는) 작은 모니터 화면으로밖에 보이지 않았지만, 그때부터 지휘자의 꿈을 꾸기 시작했다""고 말했다. 



지휘자 클라우스 메켈레[Marco Borggreve·빈체로 제공. 재판매 및 DB 금지]    본격적으로 메켈레가 지휘 공부를 하고, 지휘자로서 자리를 잡게 된 것은 12세에 지휘자 요르마 파눌라를 만나면서부터다. 메켈레는 파눌라의 교육법은 '이렇게 지휘해라', '저렇게 지휘해라'라는 직접적인 가르침이 아니었다고 회상했다. 지휘를 해보도록 한 뒤 직접 조언해주거나, 제자들이 서로 리뷰하도록 했다고 전했다.    메켈레는 ""파눌라의 수업에서 가장 독특하면서도 멋진 부분은 매주 오케스트라를 직접 지휘할 기회를 가질 수 있다는 점이었다""며 ""대편성 오케스트라는 아니지만, 직접 사람들 앞에 서서 지휘함으로써 물리적으로 제가 어떻게 지휘해야 하는지를 깨닫고, 심리적으로도 지휘하는 제 모습에 점점 편안함을 느끼게 됐다""고 설명했다.    이어 ""파눌라는 우리가 음악에서 어떤 것을 찾아내야 하고 어떻게 구현해야 하는지, 각자가 추구하고 만들어가고자 하는 음악적인 방향에 초점을 맞췄다""며 ""이런 방식의 가르침이 지금까지도 제 지휘 활동에 아주 큰 도움이 되고 있다""고 말했다.    메켈레는 지휘자에게 가장 중요한 역량이 무엇인지 묻자 ""언제나 음악적으로 준비가 돼 있어야 한다""고 답했다.    ""제가 리허설에서 보여주는 모든 해석과 움직임에는 근거가 있어야 해요. 그리고 제가 원하는 지점을 확실하게 표현해 보여줘야 하고요. 사람(단원)들에게 진실한 모습을 보이고, 서로를 존중하는 것도 중요해요.""



지휘자 클라우스 메켈레[Marco Borggreve·빈체로 제공. 재판매 및 DB 금지]    메켈레는 오슬로 필하모닉에 대한 애정과 자신감도 보였다.     그는 ""오슬로 필하모닉은 강한(Strong) 오케스트라다. 현악 파트나 관악 파트, 악기에 상관없이 모두 깊고 강한 소리를 갖고 있다""며 ""마리스 얀손스가 20년 넘게 오케스트라를 이끌며 쌓아온 디테일한 접근 방식도 아직 오케스트라에 남아있다""고 말했다.    이어 ""오슬로 필하모닉만의 풍부하고 깊은 사운드가 있다""며 ""연주를 보시면 아마 바로 느끼실 수 있다""고 자신했다.    메켈레는 이번 내한 공연 프로그램을 시벨리우스의 곡만으로 채웠다. 30일 서울 공연에서는 시벨리우스의 '투오넬라의 백조', 바이올린 협주곡, 교향곡 5번을 연주하고, 이에 앞서 28일 경기 고양아람누리에서 열리는 공연에서는 바이올린 협주곡과 교향곡 2번을 들려준다. 바이올린 협연은 네덜란드 출신 바이올리니스트 재니 얀센이 맡았다.     메켈레와 오슬로 필하모닉에 시벨리우스는 특별하다. 팬데믹 기간 시벨리우스 교향곡 전곡을 녹음했고, 교향곡 프로그램으로 투어도 다녔다.     메켈레는 이번 프로그램에 대해 ""오슬로 필하모닉을 가장 잘 보여줄 수 있는 음악""이라며 ""100여년 전 시벨리우스 본인이 직접 오슬로 필하모닉을 여러 차례 지휘했기 때문에 그 전통도 무시할 수 없다. 이들(오케스트라)은 시벨리우스를 어떻게 연주해야 하는지 이미 몸으로 알고 있다""고 말했다.    이어 ""한국 투어를 위해 선택한 교향곡 2번과 5번은 시벨리우스가 가진 각각의 다른 면을 보여준다고 생각한다""며 ""로맨틱한 모습과 어두운 모습을 모두 볼 수 있을 것""이라고 덧붙였다.    ""시벨리우스 교향곡 전곡을 녹음했을 때뿐만 아니라 매일, 매번 (작품에서) 새로운 점을 발견해요. 지난 12일에도 교향곡 5번을 연주했는데, 리허설 때 새로운 것을 발견하게 되더군요. 이런 게 음악가라는 직업에 있어 가장 재밌고 매력적인 부분이 아닐까 생각해요.""



지휘자 클라우스 메켈레[Marco Borggreve·빈체로 제공. 재판매 및 DB 금지]    aeran@yna.co.kr",105,https://n.news.naver.com/mnews/article/001/0014268831?sid=103
"'팀네이버' 합류한 포시마크…""글로벌 C2C 리더될 것""",2023.01.15. 오후 4:00,"기사내용 요약포시마크, 네이버 피인수 후 첫 기자간담회커뮤니티와 커머스 결합해 창업…북미 1위 C2C 플랫폼으로네이버 스마트렌즈 기술 접목된 '포시렌즈' 테스트 버전 첫 공개시너지 창출 속도 내 마케팅·검색·커뮤니티 강화 목표글로벌 진출 속도…""패션 리커머스에서 글로벌 리더 기대""



마니시 샨드라 포시마크 CEO가 지난 12일 미국 캘리포니아 레드우드시티에 위치한 포시마크 본사에서 개최된 기자간담회에서 발표를 하고 있다(사진=네이버) *재판매 및 DB 금지[레드우드시티=뉴시스]최은수 기자 = ""인공지능(AI) 등 네이버의 앞선 기술력과 쇼핑부문 노하우와 합쳐질 경우 새로운 기회를 얻을 수 있을 거라 확신했습니다.""(마니시 샨드라 포시마크 CEO)북미 최대 패션 중고거래(C2C) 플랫폼 포시마크가 네이버 자회사로 편입된 이후 처음으로 기자간담회를 열고 미래 비전을 공개했다. 현재 포시마크는 네이버의 이미지 검색 도구 스마트렌즈 기술을 자사 앱에 도입하는 등 모기업과의 시너지 창출에 빠르게 속도를 내고 있다.‘모바일 쇼핑의 미래는 다양한 커뮤니티와의 결합’이라는 인사이트로 스마트폰 초창기 포시마크를 창업한 마니시 샨드라 최고경영자(CEO)는 팀 네이버 기술력을 더해 글로벌 C2C 시장에서 새로운 트렌드를 제시하겠다는 포부를 드러냈다. 이를 통해 수익성을 개선해 내년 흑자 전환에 성공하겠다는 각오다.네이버와 시너지 본격화…스마트렌즈 기술 접목한 '포시렌즈' 첫 공개마니시 대표는 지난 12일(현지시간) 미국 캘리포니아 레드우드시티에 위치한 포시마크 본사에서 열린 기자 간담회에서 “네이버에 많은 기대를 걸고 있다”라며 “네이버의 강력한 기술을 활용해 이용자 경험을 크게 강화할 수 있을 것""이라고 밝혔다. 이날 포시마크는 네이버 스마트렌즈 기술을 적용한 ‘포시렌즈’ 테스트 버전을 처음으로 공개했다. 앞서 네이버가 지난 6일 포시마크 인수 절차를 끝마친 지 약 일주일 만이다. 포시렌즈는 포시마크 사용자가 원하는 상품을 촬영하면, 비슷한 상품과 가격을 한번에 볼 수 있는 기능이다. 사용자들의 검색 편의성을 한층 더 높일 수 있을 것으로 기대된다.아울러 포시마크가 자체 기술로 개발한 라이브 커머스인 ‘포시 쇼’에도 네이버의 라이브 커머스 기술을 접목해 서비스를 더욱 고도화할 계획이다. 



지난 12일(현지시간) 미국 캘리포니아 레드우드시티 포시마크 본사에서 개최된 기자간담회에서 공개된 포시렌즈 이미지(사진=최은수 기자) *재판매 및 DB 금지글로벌 'C2C 강자' 꿈꾸는  네이버…'커뮤니티+커머스' 포시마크 경쟁력 주목네이버가 포시마크를 1조6000억원이 넘는 거금을 들여 인수한 이유는 글로벌 C2C 시장이 초기단계로 조기 시장 선점 효과가 적지않을 분야라는 전략적 판단 때문이다.아마존, 구글 등 기존 빅테크 강자들이 아직 발을 딛지 않았다는 점도 네이버가 눈독을 들인 또다른 이유다. 누구나 창작자로 참여할 수 있었던 ‘지식iN’과 ‘블로그’ ‘카페’ 등이 검색 엔진으로서 네이버의 초기 성장을 견인했던 것처럼, C2C 커머스도 누구나 쉽게 판매자가 될 수 있고 또 한번 창작자를 증폭시킬 수 있다는 기대다. 실제 네이버는 2021년 스페인 최대 중고거래 플랫폼인 왈라팝에 투자한 데 이어 최근 추가 투자를 통해 최대주주로 올라섰다. 이밖에도 리셀 플랫폼 ‘크림’과 일본 빈티지패션 전문 플랫폼 ‘빈티지시티’ 등 글로벌 시장에서 C2C 서비스 라인업을 구축하고 있다. 포시마크는 커뮤니티+커머스 결합으로 북미에서 독보적인 1위 패션 C2C 플랫폼이라는 점에서 아시아 중심으로 진출해왔던 네이버의 북미 진출의 교두보가 될 수 있다. 아울러 포시마크 사용자 80%를 차지하는 MZ세대를 집중 공략할 수 있는 기회이기도 하다. 인스타그램에서 게시물이 공유되는 것처럼 포시마크는 일간 50만건 이상의 새로운 판매글이 게시되고 10억건 이상의 소셜 인터랙션(좋아요, 공유 등)이 발생하고 있다. 커뮤니티 활성 사용자 수는 3700만명에 이른다. 100만 명 이상의 팔로워를 보유한 셀러들도 있다. 인스타그램 '스토리'와 유사한 '포시 스토리', 스트리밍 포맷의 라이브 커머스 '포시 쇼' 기능도 제공하고 있다. 포시마크는 왜 네이버를 인수주체로 결정했을까. 포시마크 창업자들은 네이버가 자사처럼 커뮤니티와 커머스 사업에 주력한다는 점과 뛰어난 기술력 등을 이유로 꼽았다.네이버가 갖춘 글로벌 수준 기술력과 검색 기능을 포시마크 플랫폼에 곧바로 적용할 수 있는 기회를 노린 것이다. 기존 고객의 재방문과 거래고객 증가를 이끌어내는 것이 중요한 포시마크 입장에서는 검색 기능과 커뮤니티 활성화가 필수적이다. 



지난 12일(현지시간) 미국 캘리포니아 레드우드시티에 위치한 포시마크 본사에서 개최된 기자간담회에 스티븐 영 CMO, 마니시 샨드라 창업자 및 CEO, 트레이시 선 공동 창업자 및 SVP가 발표를 하고 있다.(사진=네이버) *재판매 및 DB 금지다만 포시마크가 네이버를 처음부터 잘 알고 있었던 것은 아니다. 파트너십 논의 과정에서 최수연 네이버 대표를 비롯해 네이버의 인수 의지 및 기술 연동에 대한 열의를 갖고 적극적으로 임한 것이 영향을 미쳤다. 마니시 대표는 “처음에는 네이버가 한국에 있는 검색 소프트웨어 회사라는 것 정도만 알고 있었고, 얼마나 큰 회사이며 다양한 사업과 기술을 가지고 있는지까지는 몰랐다”면서도 “초창기 미팅 중 네이버 팀에서 어떻게 하면 혁신을 통해서 포시마크와 네이버에 기술력을 연동을 할 수 있는지에 대한 자료를 정말 준비를 잘해왔다”고 회고했다. 그러면서 “이를 통해 네이버가 콘텐츠, 커뮤니티 그리고 자율성을 기반으로 하는 회사라는 점에서 공통점이 많다고 느꼈고 글로벌 진출 기회를 얻는 데 도움을 줄 수 있다고 생각했다”고 설명했다.특히 최수연 네이버 대표는 특유의 친화력으로 포시마크 창업자들과 활발히 소통하며 인수합병을 주도했다는 후문이다.포시마크가 나스닥 상장 철회를 선택한 이유는포시마크는 네이버 인수를 마치면서 나스닥 시장에서 상장을 철회했다. 이를 통해 비상장사로서 장기적이고 유연하게 커뮤니티 형성에 더욱 초점을 맞출 수 있을 것으로 기대하고 있다. 경영도 마니시 CEO가 그대로 맡는다.특히 포시마크의 경쟁력인 ‘커뮤니티+커머스’ 결합을 네이버와 시너지로 더욱 강화하면서 경쟁력을 가져갈 수 있을 것으로 기대된다. 마니시 대표는 “소셜, 커머스, 마켓플레이스 세 가지를 모두 결합하는 곳은 없다”라며 “아마존도 소셜을 추가하려고 했고 인스타그램도 커머스를 추가하려고 했지만 결국은 지속하지 못했다. 이 세가지를 다 결합한 포시마크가 독보적이고 특별한 이유”라고 자신감을 드러냈다. 네이버는 자사 기술을 포시마크에 심는 데 주력할 예정이다. 향후에는 북미 시장에 먼저 진출한 네이버웹툰, 왓패드 스튜디오와 연계도 예고했다. 아울러 포시마크는 캐나다, 호주, 인도에 이어 네이버를 발판 삼아 글로벌 진출을 한 단계 업그레이드하겠다는 의지를 거듭 드러냈다. 특히 네이버에 인수된 것을 계기로 한국 진출 가능성도 시사했다. 마니시 대표는 “논의를 막 시작한 단계이지만 글로벌로 더 성장하고 싶은 파트너십의 방향을 생각했을 때 (한국 진출을) 고려해볼 수 있다”고 말했다. 이밖에 네이버 일본 관계사 '라인'이 주로 활약하고 있는 일본과 동남아 시장 공략 가능성도 점쳐진다. 마니시 대표는 “네이버와 파트너십이 자사를 글로벌 플레이어로 만드는데 도움이 될 것이며 두 회사 통합에 집중할 것”이라며 “고도화된 검색, 기술력, 고유한 비전과 가치를 기반으로 패션 리커머스에서 글로벌 리더가 되기를 기대한다”고 밝혔다.",105,https://n.news.naver.com/mnews/article/003/0011643639?sid=103
"김영식 의원 ""KT, 최근 3년 소비자 피해구제 접수 최다""",2023.01.15. 오후 12:59,"기사내용 요약KT, 3년 간 한국소비자원 피해구제 신청 1495건통신·IPTV·초고속인터넷 등 全 상품서 가장 많아



[서울=뉴시스] 정병혁 기자 = 서울시내에 위치한 KT. 2021.10.25. jhope@newsis.com[서울=뉴시스]윤현성 기자 = 최근 3년간 KT와 관련한 소비자 피해구제 신청 접수가 가장 많은 것으로 집계됐다. 소비자와 사업자 간 분쟁이 원활히 해결되지 않아 한국소비자원이 개입하게 되는 경우가 가장 많았다는 것이다.김영식 국민의힘 국회의원은 한국소비자원에 접수된 최근 3년간 통신사업자의 이동통신·IPTV·초고속인터넷 상품별 소비자 피해구제 현황을 분석한 결과 KT가 모든 서비스 상품에서 소비자들 피해구제 신청 실적이 압도적으로 높은 것으로 나타났다고 15일 밝혔다.한국소비자원에 접수된 소비자 피해구제 신청 현황자료에 따르면 지난 2020년 ~2022년 KT에 대해서는 총 1495건의 피해구제 민원이 접수됐다. 이동통신 1136건, IPTV 23건, 초고속인터넷 336건 등으로 통신사업자(SK계열, KT, LG유플러스) 중 가장 높았다.한국소비자원의 '피해구제'는 소비자가 사업자가 제공하는 물품 또는 용역을 사용·이용하는 과정에서 발생하는 피해를 구제하기 위해 사실조사, 전문가 자문 등을 거쳐 관련법률 및 규정에 따라 양 당사자에게 공정하고 객관적으로 합의를 권고하는 제도다. 일반적으로 소비자와 사업자 간 분쟁이 해결되지 않을 때 진행된다.김영식 의원은 ""스스로 국민 통신기업이라 칭하는 KT의 피해구제 접수 실적이 이토록 높은 것은 KT가 국민과 소비자를 대하는 자세가 얼마나 좋지 못한지를 보여주는 대표적인 사례""라며 ""소비자 불만도 제대로 처리하지 못해 피해구제로 이어지는 등 사업의 기본적 문제도 해결하지 못하는 기업이 국민기업이라 불릴 자격이 있는지 의문""이라고 지적했다.이어 ""KT는 탈통신 정책이 추진되는 동안 28㎓ 이동통신 주파수 할당 취소, 통신국 화재와 다수의 통신 장애, 10기가(Gbps) 초고속인터넷 속도 논란 등 통신기업으로써의 근간이 흔들리고 있다""며 ""눈앞의 대표 연임보다 근본적인 통신 서비스 경쟁력 확보와 소비자 만족도 제고에 힘써야 할 것""이라고 덧붙였다.한편 KT는 이같은 조사 결과에 대해 2021년에 비해 2022년의 이동통신 부문 소비자 피해구제 신청 건수가 더 줄어드는 등 고객불편을 줄이기 위해 특단의 노력을 기울이고 있다고 전했다.",105,https://n.news.naver.com/mnews/article/003/0011643363?sid=103
"LG전자 美 테네시 공장, ‘등대공장’ 선정… 해외공장 첫 사례",2023.01.15. 오전 10:25,"LG전자 미국 테네시 공장 전경. /LG전자         세계경제포럼(WEF)이 LG전자의 미국 테네시 공장을 ‘등대공장’으로 선정했다.WEF는 등대공장을 ‘첨단기술을 도입해 세계 제조업의 미래를 밝히는 공장’으로 정의한다. WEF는 2018년부터 세계 각국 공장들을 심사해 매년 두 차례씩 등대공장을 선발 중이다. 지난해 3월에는 창원 LG스마트파크를 등대공장으로 뽑았다.LG전자 측은 “한국 기업이 해외에 세운 공장 중에선 처음으로 등대공장에 선정된 것”이라며 “인공지능(AI), 빅데이터, 사물인터넷(IoT)과 같은 디지털 기술을 도입하고 로봇을 활용해 공정을 자동화하는 등 첨단 제조기술을 접목했다는 점에서 높은 평가를 받았다”고 설명했다.2018년 말 준공된 테네시 공장은 연간 세탁기 120만대, 건조기 60만대를 생산할 수 있는 능력을 갖췄다. 부품 제조부터 세탁기를 완성하고 포장하는 작업까지 한 개 라인에서 수행하는 ‘완결형 통합생산체계’가 특징이다. LG전자는 테네시 공장의 자동화율을 현재 63%에서 올 연말 70%로 끌어올릴 방침이다.류재철 LG전자 H&A사업본부장(사장)은 “창원 LG스마트파크에 이어 테네시 공장까지 등대공장에 선정돼 생활가전 분야의 압도적인 제조기술과 경쟁 우위를 인정받았다”며 “맞춤형 제조 혁신으로 차별화된 고객 경험을 제공하기 위해 끊임없이 노력할 것”이라고 했다.",105,https://n.news.naver.com/mnews/article/366/0000869888?sid=103
