title,date,main,section,url
"'통신재난, 함께 극복하겠습니다'",2018.12.27. 오후 2:45,"(과천=뉴스1) 신웅수 기자 = 민원기 과학기술정보통신부 제2차관이 27일 오후 경기 정부과천청사에서 열린 통신재난의 사전대비 및 신속한 극복을 위한 과기부-통신사업자간 협약식에서 협약서에 서명하고 있다.왼쪽부터 강종렬 SK텔레콤 ICT인프라 센터장, 오성목 KT 네트워크부문장, 민원기 과학기술정보통신부 2차관, 최택진 LG유플러스 네트워크부분장, 박찬웅 SK브로드밴드 인프라부문장. 2018.12.27/뉴스1phonalist@news1.kr▶ [ 크립토허브 ]  [ 터닝포인트 2019 ] ▶ 에어팟&스타벅스 커피 경품(~1/25)[© 뉴스1코리아(news1.kr), 무단 전재 및 재배포 금지]",105,https://n.news.naver.com/mnews/article/421/0003758582?sid=103
"넷마블, 2년 연속 해외서 한국 빛낸 브랜드 톱30 선정",2018.12.27. 오전 10:51,"'넷마블'로고. ⓒ 넷마블  ‘브랜드스탁’ 발표, 패널회원 3만명 대상 설문조사지난해 올해도 25위 넷마블이 2년 연속 ‘올해 해외에서 대한민국 위상을 빛낸 브랜드 톱30’에 선정됐다고 27일 밝혔다. 브랜드가치평가회사 브랜드스탁이 해외시장에서 대한민국의 위상을 높이는데 기여한 브랜드를 조사한 결과, 넷마블은 88.56점(100점 만점)을 기록해 작년에 이어 2년 연속 25위에 올랐다.이번 조사는 브랜드스탁의 패널회원 3만여명을 대상으로 진행됐으며 넷마블은 게임업계에서는 유일하게 30위권 내에 이름을 올렸다. 상위 점수의 브랜드로는 삼성 갤럭시(95.15점), 삼성 QLED TV(94.95점), 신라면(94.62점), 인천공항(93.78점), LG V40(93.61점) 등이 차지했다.넷마블은 기존 흥행작인 ‘리니지2 레볼루션’, ‘마블퓨처파이트’, ‘마블 컨테스트 오브 챔피언스(카밤)’ 등에 더해 올해 해외 자회사 잼시티가 내놓은 ‘해리포터:호그와트미스터리’, 일본시장에 출시한 ‘더 킹 오브 파이터즈 올스타’ 등이 성과를 거두며 3분기 기준 해외 매출 비중이 73%로 확대됐다.한편 넷마블은 올해 4월 브랜드스탁이 발표한 ‘2018 대한민국 브랜드스타’에서도 게임부문 1위를 차지한 바 있다. 데일리안 이호연 기자 (mico911@dailian.co.kr)ⓒ (주)데일리안 - 무단전재, 변형, 무단배포 금지",105,https://n.news.naver.com/mnews/article/119/0002302119?sid=103
넥슨 '듀랑고' 살리기 나선다,2018.12.27. 오후 5:01,"흥행에는 예상 밖 부진했지만 게임대상 3관왕 작품성'호평'.. 과금요소 확대 여부 관심           



   '야생의 땅: 듀랑고' 넥슨 제공        올 초 출시된 넥슨의 모바일게임 '야생의 땅: 듀랑고'가 재기를 노린다.27일 게임업계 관계자는 ""넥슨 내부에서 '야생의 땅: 듀랑고'의 흥행 실패 원인을 분석하고 있다""라며 ""이를 토대로 게임을 전면 개선해 내년에 새롭게 게임을 내 놓을 예정""이라고 밝혔다.'야생의 땅: 듀랑고'는 이미 있던 장르에 새로움을 더하는 것이 아닌, 장르의 밑바닥부터 새롭게 개발했다. '야생의 땅: 듀랑고'는 샌드박스 MMORPG에 현대인이 공룡시대로 워프해 생존해 나가는 독특한 게임 방식을 선보였다. 게임에 담긴 거대한 세계관과 이용자가 스스로 개척해 가는 스토리를 접목, 10대부터 40대까지 폭넓은 이용자층을 확보할 수 있는 게임이다.작품성을 인정받아 '2018 대한민국 게임대상'에서 기술·창작상 기획/시나리오와 그래픽 부문 수상에 이어 국무총리상인 최우수상 수상작으로 선정돼 3관왕에 오르기도 했다.'야생의 땅: 듀랑고'는 출시 직후 잠시 매출 순위 상위권을 기록했으나 이후 현재는 매출순위 200위권 밖으로 떨어졌다. 작품성에도 불구하고 시장에서 냉혹한 평가를 받으며 흥행에는 성과를 거두지 못한 것.넥슨에서 공을 들인 '야생의 땅: 듀랑고'가 사실상 실패하면서 넥슨코리아의 실적에도 타격을 줬다. 이같은 상업적 실패는 '착한 과금'을 표방한 것에서도 기인했다는 지적이다. '야생의 땅: 듀랑고'는 유료 과금 요소를 최소화했다.출시 당시 넥슨 관계자는 ""듀랑고의 경우 개발 단계부터 단기적 매출을 추구하기보다 장기적인 관점에서 기획된 게임""이라고 설명한 바 있다.이번에 '야생의 땅: 듀랑고'를 전면적으로 개편하는 작업을 진행하는 과정 중에서도 이같은 과금 요소를 확대할 것이냐를 놓고 갑론을박이 벌어진 것으로 알려졌다. 하지만 출시 때 초심을 잃지않고 계속해서 '착한 과금' 기조를 유지하면서 새로운 게임의 재미를 제시한다는 방침이다.이 관계자는 ""'야생의 땅: 듀랑고'를 전면 개편하는 과정에서 과금 요소를 넣어야 한다는 주장도 나왔지만 출발할 때 본래 취지를 살리기로 합의가 됐다""라며 ""넥슨이 야심차게 준비했던 작품이었던 만큼 새롭게 준비해서 재기를 노릴 것""이라고 말했다.true@fnnews.com 김아름 기자     ▶ 세상의 모든 골 때리는 이야기 'fn파스'▶ 속보이는 연예뉴스 fn스타  ※ 저작권자 ⓒ 파이낸셜뉴스. 무단 전재-재배포 금지",105,https://n.news.naver.com/mnews/article/014/0004150949?sid=103
"'문자로 카톡처럼 실시간 채팅'…삼성·이통사, RCS서비스 출시",2018.12.27. 오전 11:59,"KT가 먼저 28일 시작…카카오톡 대항마 될지 주목(서울=연합뉴스) 채새롬 기자 = 삼성전자와 이통3사가 손잡고 그룹채팅 등이 가능한 차세대 메시지 서비스(RCS·Rich Communication Suite)를 선보인다.



KT-삼성전자, '채팅' 출시[KT 제공]    KT와 삼성전자는 28일 삼성전자 갤럭시노트9을 통해 RCS '채팅'을 출시한다고 27일 밝혔다. SK텔레콤과 LG유플러스는 개발 일정에 따라 조만간 이 서비스를 내놓을 예정이다. 내년 1월 이후에는 대상 단말도 삼성전자 갤럭시S9 시리즈 등으로 확대된다.    RCS는 세계이동통신사업자협회(GSMA)가 만든 통합 메신저 규격으로, 기존 단문 메시지(SMS)와 멀티미디어메시징 서비스(MMS)에 그룹채팅 등 기능을 더한 서비스다.    단말기 자체에 RCS 솔루션을 탑재하기 때문에 별도의 애플리케이션 설치나 가입 없이 스마트폰 메시지 앱에서 채팅 서비스 사용에 동의하면 바로 이용할 수 있다. 문자메시지와 달리 별도의 요금이 부과되지 않고 이용 중인 요금제에 따라 데이터가 차감된다.    KT는 내년 6월 30일까지 데이터 차감 없이 무료로 채팅 서비스를 이용할 수 있는 프로모션을 진행한다. SK텔레콤은 5MB 이하의 메시지에 는 비과금 처리하기로 했다.    최대 100명과 동시에 그룹채팅을 할 수 있으며 최대 100MB에 이르는 대용량 파일을 전송할 수 있다. 기존 MMS는 1MB 크기로 데이터 전송이 제한됐지만, 채팅 서비스는 화질 저하 없이 원본 그대로 사진과 영상을 공유한다.     대화 상대방이 채팅 서비스를 이용하지 않으면 기존의 문자메시지로 자동 전환된다. 카카오톡처럼 상대방의 메시지 수신 여부도 알 수 있다.     인공지능과 결합한 '챗봇(ChatBot)' 서비스도 가능해진다.    KT는 ""기업이 챗봇서비스를 통해 일대일 상담을 할 수 있고 상품정보를 문의할 수 있다""며 ""향후 채팅서비스 내에서 상품 주문, 결제까지 가능하도록 업그레이드할 예정""이라고 전했다.     KT 마케팅부문 5G사업본부장 박현진 상무는 ""5G 시대를 맞아 고객에게 새로운 가치와 경험을 제공할 수 있는 차세대 메시지 서비스를 출시한다""며 ""RCS 서비스에 이어, 5G형 영상 커뮤니케이션 서비스를 통해 진화된 서비스를 계속 선보이겠다""고 밝혔다.     삼성전자 관계자는 ""국내 서비스 개시에 이어 미국, 유럽 등에서 내년 RCS 서비스를 시작할 예정""이라며 ""이 서비스는 삼성페이처럼 갤럭시 스마트폰 차별화 요소가 될 것""이라고 기대했다.    다만 이 서비스는 일부 갤럭시 스마트폰에서만 가능한 기능이어서 카카오톡 등이 선점한 모바일 메신저 시장에서 의미 있는 성과를 낼 수 있을지는 미지수다. 통신3사는 앞서 2012년에도 RCS 서비스인 '조인'을 내놨지만, 모바일 메신저에 비해 떨어지는 기능과 요금 부담 등에 밀려 사라졌다. 애플은 자체 RCS '아이메시지'를 제공하고 있다.    srchae@yna.co.kr▶뭐 하고 놀까? #흥  ▶쇼미더뉴스! 오늘 많이 본 뉴스영상 ▶네이버 홈에서 [연합뉴스] 채널 구독하기",105,https://n.news.naver.com/mnews/article/001/0010547605?sid=103
"[특집-정보보호통합인증]이지시큐 '아테나(ATHENA)', 정보보호관리체계(ISMS) 통합인증·유지관리 솔루션",2018.12.27. 오후 2:10,"이지시큐 아테나(ATHENA)는 정보보호 위험분석 자동화 기술기반 정보보호관리체계(ISMS) 통합인증·유지관리 솔루션이다.이지시큐(대표 정경섭)가 정보보호관리체계(ISMS) 통합인증·유지관리 솔루션 '아테나(ATHENA)'를 자체 개발했다. 정보보호 위험분석 자동화 기술기반 가격대비 성능이 뛰어난 게 특징이다.아테나 사용자는 각 메뉴에서 보고서·증적을 조회하거나 다운로드 시 안전한 PDF를 받을 수 있다. 워드프로세스로 작성된 문서도 PDF 문서로 즉석 변환시켜 열람·다운로드할 수 있다. 사용자 PC에서 클라이언트 프로그램을 사용해 아테나 솔루션으로 로그인 시 ID·PW 외 OTP 복합인증, IP 접근통제, 사용자권한분류 등 기능을 적용해 보안성을 강화했다.아테나는 ISMS 인증취득·유지운영에 드는 비용을 현저히 절감했다. 1년 무제한 사용 라이선스 기준 연 1000만원이 되지 않는다. 컨설팅 비용과 인증 수수료 합계액을 과태료 3000만원 이하로 발생시켜 고객 부담을 줄였다.정보보호 유관 업무자도 직관적이고 편리하게 사용할 수 있다. 플랫폼 임대형과 온프레미스 내부설치형 2가지 방식으로 솔루션을 제공한다. 둘 다 가격대비 성능이 우수하다. 아테나는 현재 30여개 고객사로부터 호평을 받고 있다.아테나는 고객 예산과 필요에 따라 ISMS 컨설팅 상품을 선택해 효율적이고 투명한 견적을 산출할 수 있다. 컨설팅 요소를 자동화해 비용을 절감하고 위험진단분석평가 정확도를 높여 정보보호 대책을 실행에 옮긴다.이지시큐는 단기 프로젝트 방식 컨설팅이 아닌 정보보호 담당자의 멘토 역할을 하는 '상시관리형 리얼 컨설팅'을 표방한다. 시간제약으로 인한 현황분석 한계와 컨설팅 품질저하를 방지한다. 주기적인 보안, 인프라 담당자 정기적 인터뷰를 통해 현황을 세밀하게 분석하고 관리적 취약점을 발견할 수 있도록 돕는다.또 컨설팅 결과물을 조율하고 의문점 발생 시 즉각적인 조치가 가능하다. 돌발적인 고객사의 보안이슈에 대한 상시 질의응답과 전문적인 피드백을 제공한다. 중장기 정보보호대책과 마스터플랜을 실현할 수 있게 현실적이고 지속적인 정보보호 관리체계를 구현한다.지난달 ISMS와 개인정보보호관리체계(PIMS) 인증이 통합된 '정보보호 및 개인정보보호관리체계(ISMS-P)'가 정식 시행됐다. 이지시큐는 효율적이고 경제적인 아테나 솔루션 장점을 앞세워 고객사에 ISMS-P 통합인증·유지관리 서비스를 지속 제공하고 있다.



이준희기자 jhlee@etnews.com▶ 네이버 모바일에서 [전자신문] 채널 구독하기▶ 전자신문 바로가기 [Copyright ⓒ 전자신문 & 전자신문인터넷, 무단전재 및 재배포 금지]",105,https://n.news.naver.com/mnews/article/030/0002771165?sid=103
[2018 하반기 인기상품]품질우수-펜타시큐리티 지능형 웹방화벽 'WAPPLES(와플)',2018.12.27. 오후 12:00,"정보보안전문기업 펜타시큐리티시스템의 지능형 웹방화벽 'WAPPLES(와플)'이 2018년 하반기 '전자신문 인기상품'으로 선정됐다.펜타시큐리티 와플은 웹 애플리케이션 보안에 특화된 웹방화벽(WAF)이다. 전반적인 웹 공격에 대응하고 정보 유출, 부정 로그인, 웹사이트 위변조 방지 기능을 제공한다. 자체 개발한 논리분석탐지 'COCEP' 엔진을 탑재해 아직 알려지지 않은 신종 공격 대응이 가능하다. 고성능 웹방화벽임에도 미탐률과 오탐률이 적다. 국내 및 아시아 태평양 지역에서 시장점유율 1위를 고수하고 있다.최근 버전 업그레이드된 'WAPPLES 5.0'은 10대 웹 애플리케이션 취약점(OWASP TOP 10)에 대한 보안정책을 강화했다. 자동화 툴에 의한 부정접근 방지 기능을 추가하는 등 보안성을 한층 더 높였다. 탐지 룰 보강과 예외처리 등 기능을 개선해 WAF 효용성의 기본인 탐지 성능을 대폭 높였다. 설정 및 로그 데이터베이스(DB) 관리 이분화, 백업과 복구 등 기능 업그레이드를 통해 안정성을 강화했다. 또 전체 사용자인터페이스(UI) 개선으로 사용자 편의성을 한층 더 높였다.특히 머신러닝 기능을 탑재해 CPU 사용량, 메모리 사용량, 프로세스별 CPU 사용량 등 상태를 실시간 자가 점검하고 상황에 대응한다. 수집한 정보를 실시간으로 분석해 사전에 설정한 위험 단계에 이르기 전 상황을 운영자에게 전달함으로써 사고 발생 위험을 크게 낮출 수 있다.복수의 와플 사용 고객은 'WAPPLES Control Center'를 통해 환경 전체를 통합 관리할 수 있다. 와플 컨트롤 센터는 하드웨어(HD) 및 소프트웨어(SW) 혼용 등 복잡한 환경에서도 정책 일원화 및 이관이 용이하며 통합 관리가 가능하다.와플은 시장조사기관 프로스트 앤 설리반이 선정하는 '올해의 웹방화벽' 부문에 3년 연속 선정됐다. '가트너 매직 쿼드런트' WAF 부문에 4년 연속 등재되는 등 국내 시장뿐 아니라 아시아-태평양 시장에서도 시장 점유율 1위 제품으로 다수 레퍼런스를 축적하고 있다.김정희기자 jhakim@etnews.com▶ 네이버 모바일에서 [전자신문] 채널 구독하기▶ 전자신문 바로가기 [Copyright ⓒ 전자신문 & 전자신문인터넷, 무단전재 및 재배포 금지]",105,https://n.news.naver.com/mnews/article/030/0002771079?sid=103
과기부-통신사업자 '통신재난 함께 극복',2018.12.27. 오후 2:45,"(과천=뉴스1) 신웅수 기자 = 민원기 과학기술정보통신부 제2차관이 27일 오후 경기 정부과천청사에서 열린 통신재난의 사전대비 및 신속한 극복을 위한 과기부-통신사업자간 협약식에서 인사말을 하고 있다.왼쪽부터 강종렬 SK텔레콤 ICT인프라 센터장, 오성목 KT 네트워크부문장, 민원기 과학기술정보통신부 2차관, 최택진 LG유플러스 네트워크부분장, 박찬웅 SK브로드밴드 인프라부문장. 2018.12.27/뉴스1phonalist@news1.kr▶ [ 크립토허브 ]  [ 터닝포인트 2019 ] ▶ 에어팟&스타벅스 커피 경품(~1/25)[© 뉴스1코리아(news1.kr), 무단 전재 및 재배포 금지]",105,https://n.news.naver.com/mnews/article/421/0003758583?sid=103
"""맥을 윈도로?"" 크라우드펀딩 USB 저장장치의 진실",2018.12.27. 오전 10:43,"윈도 라이선스 확보와 설치는 소비자 몫...주의해야(지디넷코리아=권봉석 기자)맥 컴퓨터를 윈도 PC로 바꿔준다는 저장장치가 국내 크라우드펀딩 사이트 와디즈에 올라와 소비자들의 관심을 끌고 있다. 그러나 지디넷코리아 취재 결과 이 제품은 고속 읽기·쓰기가 가능한 USB-C 방식 플래시 메모리에 불과한 것으로 나타났다. 윈도 라이선스 확보와 설치는 소비자 몫으로 주의가 요구된다.기존 썬더볼트3나 USB 3.1 Gen.2 방식 외장형 저장장치에 비해 가격이 비싸지만 무상보증기간이 1년으로 제한되는 문제도 있다. 이 제품을 제조한 A사는 ""제품 원가와 자금력 등 스타트업의 한계""라고 말했다.



지난달 와디즈에서 크라우드펀딩에 성공한 USB-C 저장장치. (사진=와디즈)크라우드펀딩 플랫폼을 제공한 와디즈는 ""제품이나 서비스를 홍보하기 위해 제조사가 직접 작성한 콘텐츠에 대해 일률적으로 과대/과장 광고를 판단하기 어려운 점이 있다""고 설명했다. 콘텐츠 작성에 대한 1차 책임은 제조사에 있다는 것이다.■ ""맥에 꽂기만 하면 윈도 PC가 된다?""국내 인터넷 환경은 인터넷뱅킹이나 전자정부 등에서 아직도 일정 부분 윈도 기반 액티브X에 의존하고 있다. 이 때문에 국내 맥 이용자들은 패러렐즈 데스크톱이나 버추얼박스 등 가상 PC 애플리케이션이나 맥 저장공간 중 일부를 윈도 운영체제용으로 지정해 다시 부팅하는 부트캠프로 이 문제를 해결한다.A사가 크라우드펀딩 서비스 와디즈에 등록한 한 저장장치(이하 'B제품')는 '맥에 꽂기만 하면 윈도 PC 기능을 쓸 수 있다'는 문구로 맥 이용자들의 관심을 한 몸에 모았다. 이 제품은 지난 11월 중순 목표액의 17배 이상인 5천375만원 이상을 모금하며 펀딩을 마쳤다.



윈도 라이선스 구매와 설치는 펀딩에 참여한 소비자의 몫이다. (그림=웹사이트 캡처)그러나 설명을 유심히 읽어보면 이 제품은 윈도 라이선스를 제공하지 않는다. USB 저장장치를 연결해 윈도 운영체제를 설치하고 장치 드라이버 등 각종 프로그램을 설치하는 것은 여전히 소비자의 몫이다. 윈도 운영체제 구동에는 맥OS 기본 기능인 부트캠프를 활용한다.이에 대해 A사는 ""(해당 광고 문구는) 소비자가 윈도 라이선스를 가지고 있거나 신규 구매할 경우를 대상으로 한 것이다. 또 제품이 고가이다 보니 맥 컴퓨터에서 윈도 운영체제를 쓰고 싶어하는 사람들을 주 소비자층으로 잡았다. 운영체제 설치가 아니라 고속 저장장치 용도로 쓰려는 소비자들도 많다""고 밝혔다.플랫폼을 제공한 와디즈는 ""펀딩 프로젝트 관련 모든 콘텐츠는 제조사가 제품이나 서비스를 적극적으로 알리고자 콘텐츠를 작성하고 있기 때문에 정량적인 기준이나 잣대로 이를 판단하기에 어려운 점이 있다. 단 최근 유관기관에서 과대/과장광고에 대해 보수적으로 접근해 달라는 요청을 받았고 이에 심사를 강화중이다""라고 답변했다.■ ""레이드0로 속도 향상... 내구도 문제 없다""B제품은 기존 USB 저장장치에 비해 두 배 이상 빠른 속도를 강점으로 내세우고 있다. A사 관계자는 ""대만 AS미디어 컨트롤러 칩과 도시바 MLC 플래시 칩을 적용한 다음 레이드(RAID) 0로 연결해 입출력 속도를 높였다""고 밝혔다.레이드 0는 안정성 대신 속도를 중시한 저장장치 구성 방식이다. 몇 년 전 나온 고성능 SSD 제품에도 플래시 메모리를 여러개 묶어 레이드 0로 구성하는 방식이 흔히 쓰였다.그러나 최근에는 일반 소비자용 저장장치에 레이드 0를 적용하는 경우가 드물다. SSD나 플래시 메모리 성능이 상향평준화된 데다 플래시 메모리가 하나만 고장나도 전체 저장공간을 포기해야 하는 위험이 따르기 때문이다.



B제품은 레이드 0를 이용해 읽기/쓰기 속도를 향상시켰다. (그림=웹사이트 캡처)A사 관계자는 ""현재 시판되는 SSD도 B제품과 기본적으로 같은 구조다. 레이드 0를 적용하지 않아도 플래시 메모리에 이상이 생기면 모든 데이터가 날아가는 것은 마찬가지다""라고 반론했다.또 ""다른 USB 저장장치의 MTBF(평균 무고장 시간)는 50만~100만 시간이지만 B제품의 MTBF는 200만 시간이다. 저장장치의 실질적인 수명을 따지는 TBW(보증쓰기용량) 역시 기존 제품과 큰 차이 없는 150TBW다""라고 밝혔다. 단 TBW는 실제 제품을 제작하는 해외 제조사가 통보한 값이다.■ ""제품 원가 등으로 무상보증기간은 1년이 최선""삼성전자나 WD(샌디스크) 등 유명 제조사가 만든 USB-C 외장 SSD는 모두 무상보증기간 3년을 제공한다. 실구매가도 1TB 제품 기준 22만원 전후로 B제품보다 훨씬 저렴하다. 반면 B제품은 256GB 제품 가격이 40만원 이상이며 무상보증기간은 1년이다.A사 관계자는 ""제품 가격이 급격히 상승한 원인은 도시바를 통해 주문 생산한 플래시 메모리를 쓰기 때문이다. 대량 생산을 하지 않는 이상 원가도 자연히 올라간다. 또 MLC(2비트)와 현재 주로 쓰이는 TLC(3비트) 플래시 메모리의 안정성에서도 차이가 있다""고 설명했다.무상보증기간이 1년인 이유에 대해서는 ""내부적으로는 1년 이상도 검토했지만 스타트업 특성상 대량의 제품을 한꺼번에 만들어 놓기 쉽지 않은 면이 있다. 현재로서는 1년 정도를 제공하는 것이 최선의 선택이다. 1년 뒤에 문제가 생기면 유상 교환도 검토중이다""라고 답변했다.■ 와디즈 ""제품 출고되면 보증은 제조사의 몫""A사 관계자는 ""B제품은 지금까지 3번 정도 설계를 개선해 왔다. 최초 시제품은 2015년에 만들어졌지만 3년간 가혹한 환경에서 테스트를 거친 지금도 아직까지 문제가 없다. 기본 하드웨어 설계는 이미 검증된 제품""이라고 주장했다.그러나 MTBF는 어디까지나 평균값이다. A사가 밝힌 200만 시간 이전에 제품이 고장날 가능성도 여전히 남아 있다. 또 무상보증기간 이내라도 A사가 문을 닫으면 제품 교환이나 수리 등 어떤 대처도 기대할 수 없다. A사 역시 이 문제에 대해 명확한 답을 내놓지 못했다.



저장장치 제조사가 밝힌 MTBF는 평균값에 불과하다. (그림=웹사이트 캡처)크라우드펀딩 플랫폼을 제공한 와디즈는 ""자금 조달이나 유통 등 여러 면에서 기존 전자상거래와 다른 특성때문에 관련 법령의 모든 규정을 적용하기는 어렵지만 통신판매의 당사자는 제조사다""라고 설명했다.또 ""제품이 완성·배송된 뒤 15일간 문제가 있는지 확인하고 모니터링한 후 문제가 없는 경우 정산을 시행하고 있다. 완제품이 아닌 프로토타입, 혹은 시제품으로 출시되는 제품에는 결제 전은 물론 공지사항을 통해 미리 고지하고 있다""고 덧붙였다.권봉석 기자(bskwon@zdnet.co.kr)  ▶ 네이버 채널에서 ‘지디넷코리아’를 구독해주세요",105,https://n.news.naver.com/mnews/article/092/0002153314?sid=103
