title,date,main,section,url
네이버 14년간의 '찐 한글사랑'…한글정보 총망라 페이지 공개,2021.10.09. 오후 3:56,"기사내용 요약2008년부터 지속된 '한글한글 아름답게' 캠페인 진행2019년 AI로 제작한 '나눔손글씨' 대표작



[서울=뉴시스] 이진영 기자 = 네이버가 9일 한글날을 기념한 캠페인을 통해 한글의 우수성과 아름다움을 알리기 위한 노력을 이어간다. 네이버는 지난 14년간의 한글 홍보 성과와 자사 서비스를 연계해 한글 관련 콘텐츠를 소개하는 '네이버 한글날' 캠페인 페이지를 공개했다고 발표했다. 새롭게 선보인 캠페인 페이지에는 한글 글꼴의 역사부터 대표 문학 작품, 맞춤법 제정 과정 등 한글과 연관된 정보를 망라했다. 각 정보는 네이버의 서비스를 통해 텍스트, 영상 등 한글 정보를 다양한 유형의 콘텐츠로 접할 수 있도록 구성됐다. 가령 네이버 플레이스 검색 결과로 사용자 인근의 한글 박물관 위치 정보를 전달하는 식이다.사용자 스스로 맞춤법 이해도를 확인해볼 수 있는 이색 이벤트인 '한글날 맞춤법 시험'도 마련됐다. 일상에서 혼동하기 쉬운 여러 유형의 맞춤법을 간단한 퀴즈로 제시하는 방식이다. 결과 페이지에는 퀴즈 점수, 답안과 함께 네이버의 인공지능(AI) 기술이 집약된 키보드 앱 '스마트보드'도 함께 소개됐다. 스마트보드는 문장 단위로 한글 맞춤법을 검사하고 수정하는 기능을 제공해 별도 맞춤법 검사기를 이용하지 않아도 보다 손쉽게 맞춤법 확인이 가능하다.또 ▲마루 부리 글꼴 소개 ▲한글 점자 역사 ▲한글 시험 3종 ▲한글 관련 지식 모음 ▲한글 기록을 잇는 기술 등의 내용도 담겼다.



특히 네이버는 이번 캠페인을 통해 그간 한글의 아름다움을 조명하기 위해 들여온 노력의 결과도 함께 소개했다. 2019년 네이버가 클로바의 인공지능 기술을 활용해 제작한 '나눔손글씨' 109종이 대표 사례다. 나눔손글씨는 공모를 통해 접수된 다수 사용자의 손글씨를 국내 최고 수준의 OCR(광학 문자 판독) 기술과 딥러닝 기술을 활용해 글꼴로 만들어낸 것이다.한글 글꼴 제작·배포는 네이버가 지난 2008년부터 지속해온 대표 한글 홍보 캠페인이다. '한글한글 아름답게' 캠페인을 통해 네이버 본문용 서체인 나눔고딕체와 나눔명조체를 시작으로 나눔스퀘어체, 나눔스퀘어라운드체 등 누구나 쉽게 다운받아 사용할 수 있도록 서체를 개발해 무료 배포하고 있다.이밖에 지난 6일에는 '마루 프로젝트'의 일환으로 진행돼 제작 과정부터 사용자 의견을 반영한 디지털 화면용 '마루 부리 글꼴' 5종 완성본을 무료로 공개하기도 했다.",105,https://n.news.naver.com/mnews/article/003/0010760679?sid=103
위드 코로나 앞두고 ‘돌파감염’ 1만명… “백신 접종해도 방심 말아야”,2021.10.08. 오후 4:54,"12월 얀센 포함 일반인 부스터샷 접종 계획안 검토



전체 인구 대비 신종 코로나바이러스 감염증(코로나19) 백신 접종 완료율이 55%를 넘어선 가운데 6일 하루 3만6000여명이 1차 접종을 했고, 51만여명이 접종을 완료했다. 이날 오전 서울 서대문구 북아현문화체육센터에 마련된 신종 코로나바이러스 감염증(코로나19) 백신 예방접종센터를 찾은 시민들이 백신 접종을 한 뒤 대기하고 있다./연합뉴스        코로나19 얀센 백신 접종자의 추가 접종(부스터샷)이 추진된다. 델타 등 변이 바이러스가 지속적으로 출현하고 코로나19 백신 효과가 시간이 지날수록 줄어들면서 ‘돌파감염’이 최대 변수로 떠오르기 때문이다. 화이자, 모더나, 아스트라제네카 백신 접종자를 위한 추가 접종 계획 발표도 속도를 낼 것으로 보인다.8일 중앙방역대책본부(방대본)에 따르면 국내 돌파감염 추정 사례는 지난달 26일 기준 백신 접종 완료자 2004만4857명 중 0.053%인 1만540명이다. 4월 2명이었던 돌파감염 사례는 6월 116명, 7월 1180명, 8월 2764명, 9월 6471명을 기록하며 가파른 상승 곡선을 그리고 있다. 연령별로는 돌파감염 발생률이 30대가 0.119%로 가장 높았다. 돌파감염은 코로나19 백신을 맞고, 2주가 지난 뒤에도 코로나19 확진 판정을 받은 경우를 말한다.백신 종류별로는 얀센 접종자의 돌파감염 발생률이 0.193%(10만명당 192.8명)로 가장 높았다. 이어 아스트라제네카 0.049%(10만명당 49.3명), 화이자 0.040%(10만명당 40.0명), 모더나 0.004%(10만명당 3.5명) 순이었다.얀센 돌파감염 비율이 다른 백신에 비교해 월등히 높은 편이다. 이에 따라 방역 당국은 12월 전에는 얀센 백신 접종자에 대한 부스터샷 접종을 결정할 방침이다. 정은경 질병관리청장도 지난 7일 열린 국회 보건복지위원회의 질병청 국정감사에서 “얀센 백신 접종자는 (접종 완료 후) 6개월이 도래하는 시점이 12월이기 때문에 그전까지는 검토할 예정이다”라고 밝혔다.얀센 외에도 화이자, 모더나, 아스트라제네카 백신 접종을 완료한 일반 국민 역시 기본 접종 완료 후 6개월이 도래해, 올해 말쯤 추가 접종 계획이 수립될 예정이다. 변이도 주요 변수다. 감염력이 높은 코로나19 델타 변이 바이러스가 우세종이 되면서 예방접종을 하더라도 돌파감염 사례는 늘고 있다. 돌파감염 추정 사례 중 변이 바이러스 분석을 마친 2331명 중 90.2%(2103명)는 주요 변이에 감염된 것으로 확인됐다. 신규 확진자 10명 중 9명 이상이 변이에 감염된 것이다.돌파감염은 곳곳에서 발생하고 있다. 9월 넷째 주(19~25일)에 발생한 18세 이상 확진자 1만3280명 중 2768명인 약 21%가 돌파감염 추정 사례다. 이와 함께 서울시에서 조사한 결과에 따르면 최근 두 달간 노인 관련 시설에서 발생한 코로나19 확진자의 63%가 백신 접종 후 돌파감염된 사례인 것으로 파악됐다. 경기도 연천의 한 군부대에서 이틀간 확진된 46명 중 34명(74%)은 이미 권장 횟수대로 백신 접종을 마치고도 감염이 된 돌파감염 사례로 확인됐다.전문가들은 앞으로 돌파감염은 늘어날 수밖에 없다고 분석했다. 정기석 한림대 성심병원 호흡기내과 교수는 “백신 접종 완료율이 높아지면서 돌파감염자 숫자도 늘어날 수밖에 없을 것”이라면서 “접종 완료율이 100%가 된다고 하면 확진자 중 돌파감염자는 전원(100%)이 아니겠느냐”라고 말했다. 정 교수는 “고령층이나 만성질환자 등 면역력이 약한 층일수록 위증증 악화 가능성이 크고, 백신 접종 효과도 빠르게 떨어질 수 있기 때문에 부스터샷을 서두를 필요가 있다”면서 “다만 일반 국민을 대상으로 부스터샷을 확대하기 위해서는 보다 면밀한 과학적 근거를 바탕으로 한 설득이 필요할 것으로 보인다”고 덧붙였다.부스터샷이 항체의 감소를 막을 수 있는지 아직 명확하진 않다는 게 전문가 설명이다. 정재훈 가천대 길병원 예방의학교실 교수는 “백신 접종 이후 효과가 감소한다는 것은 맞지만, 어느 정도 비율로 떨어지는지 또한 추가 접종을 했을 시 백신 효과 감소를 확실하게 막는지 추가로 확인해야 한다”면서 “고위험군을 제외한 일반인 부스터샷 접종 결정은 시기상조다”라고 말했다.고령층 등 코로나19 고위험군을 제외한 일반 국민에게 부스터샷 접종은 가급적 재검토해야 한다는 의견도 있다. 마상혁 대한백신학회 부회장은 “백신 접종률을 올려봐야, 돌파감염이 계속 발생하므로 접종률 자체에만 의미를 둬선 안 된다”면서 “백신 접종으로 코로나 제로는 불가능하기 때문에 중환자의 발생, 사망률의 감소를 위해서는 고위험군만 접종을 하는 것이 맞다”고 강조했다. 마 부회장은 “정부가 백신 1차 접종만 해도 예방효과가 86%에 달한다고 홍보하는 것은 국민 기만이다”라면서 “백신 접종을 해도 얼마든지 돌파감염이 될 수 있기 때문에, 과학에 입각해 코로나19 관련한 방향을 정해야 한다”고 덧붙였다.정부는 올해 말 일반 국민의 부스터샷을 개시할 방침이다. 11월 9일 단계적 일상 회복인 이른바 ‘위드(with) 코로나’ 시작도 앞뒀다. 결국 돌파감염이 최대 변수가 될 수도 있다. 의료계 한 관계자는 “당국이 확진자 증가 추세에만 골몰할 게 아니라 돌파감염 비율이 각 백신별로 어느 정도 되는지, 백신 접종 이후에도 추가 감염 가능성이 얼마나 되는지를 보다 명확하게 숫자로 보여줄 필요가 있다”면서 “백신 접종 이후에도 실내에서는 마스크를 쓰는 등의 노력은 계속 필요하다”고 말했다.",105,https://n.news.naver.com/mnews/article/366/0000765547?sid=103
수천만 원 시계·골드바 거래에도 세금은 0원?···중고플랫폼 과세 사각지대 논란,2021.10.08. 오후 4:24,"박홍근 의원 “불법은닉재산 세탁 활용 가능성 높아”국세청장 “과세 기준 심도 있게 검토하겠다”



당근마켓에 올라온 고액 상품들/사진 제공=박홍근 더불어민주당 의원실[서울경제] 최근 중고거래가 활발해지면서 수천만 원을 호가하는 고급 시계와 골드바 등도 당근마켓, 중고나라, 번개장터 등 중고 거래 플랫폼에서 거래가 이뤄지고 있다. 하지만 개인 간 중고거래에서는 세금이 부과되지 않아 탈세가 우려된다는 지적이 나온다.8일 국회 기획재정위원회 소속 더불어민주당 박홍근 의원은 당근마켓, 중고나라, 번개장터 등 주요 중고거래 플랫폼에서 1,000만 원 안팎의 명품 시계, 700만 원 안팎의 골드바 등이 거래된 사실을 확인했다고 밝혔다. 또 1억 원에 가까운 제품이나 3,000만 원짜리 골드바도 거래 요청이 되는 것으로 나타났다.사업상 상품을 팔거나 서비스를 제공하는 모든 사업자는 부가가치세(세율10%)를 신고하고 낼 의무가 있다. 사업 소득이 있으면 종합소득세(6~45%)도 신고해야 한다. 하지만 중고거래 플랫폼에서는 사업자라 할지라도 세금을 내지 않아도 아무런 제재를 받지 않고 있다.박 의원이 이날 중고거래 플랫폼을 통한 소득에 대한 과세 현황을 요청하자 국세청은 “중고 물품 판매 사업자가 중고물품을 판매하고 부가가치세, 종합소득세 신고 시 ‘중고거래 플랫폼’을 이용한 판매금액을 구분하지 않는다”고 답변했다.아울러 국세청은 중고거래 플랫폼을 통해 반복적으로 물품을 판매해 소득을 올리는 이용자에 과세하는 기준이 있느냐는 박 의원의 질의에 “사업소득인지 아닌지는 거래 횟수, 빈도, 거래 전후의 사정 등을 고려하고 사회통념에 비춰 판단해야 한다”며 “거래 횟수와 금액 기준에 관해서는 법령에 규정돼 있지 않다”고 밝혔다. 현행 제도하에서는 사업자가 중고거래 플랫폼에서 반복적으로 고액의 상품을 거래해도 세금을 부과할 명분과 이들의 ‘꼼수’ 탈세를 막을 방법이 없다는 뜻으로 풀이된다.박 의원은 “누구는 정당하게 사업자등록을 하고 성실히 세금을 내고 운영하는데, 누구는 한번에 1억 원 가까운 물품을 거래하며 세금도 안 내고 불법·탈법 가능성도 높은 거래를 할 수 있도록 방치하는 것에 개선이 필요하다”며 “범죄를 통해 획득한 장물이나 불법은닉재산 세탁에 활용될 가능성도 높다”고 우려했다.이날 김대지 국세청장은 기재위 국정감사에서 “(박 의원의 지적에) 100% 공감하고 기획재정부와 상의해 구체적인 과세 기준에 대해 의견을 제시하겠다”고 강조했다. 이어 김 청장은 “계속해서 이뤄지는 사업 성격이 있으면 과세에 반영하도록 돼있다”며 “(중고거래 플랫폼에 물품을) 올리는 분들이 사업자일 수도 있고 반복적으로 할 수도 있으니 심도 있게 검토하겠다”고 말했다.",105,https://n.news.naver.com/mnews/article/011/0003971159?sid=103
"윈스, 부산외대와 정보보안 인력 육성 협력",2021.10.08. 오후 1:11,"1억4천만원 규모 보안 장비도 기증윈스가 정보보안 인력 육성과 채용 지원을 위해 부산외국어대학과 협력한다.



김홍구 부산외대 총장(왼쪽)과 김대연 윈스 대표 [사진=윈스]윈스(대표 김대연)는 부산외대와 부산지역 정보보안 인재 육성·채용을 위한 업무협약(MOU)을 체결했다고 8일 발표했다. 부산외대에 약 1억4천만원 규모 보안 장비도 기증했다.이번 협약을 통해 양 측은 관제인력 양성을 위한 교육 과정 개설, 학생 인턴십 실시, 견학·취업 활동 등 지원, 정보통신기술(ICT) 혁신 인재 4.0 관련 연구 등을 공동 추진한다. 윈스가 기증한 침입방지시스템(IPS), 디도스(DDoS) 대응 시스템 등 장비 4대는 학생들의 실습·연구 과정에 쓰일 예정이다.김대연 윈스 대표는 ""기증한 장비가 교육 커리큘럼에 바로 활용돼 학생들이 최신 이론을 이해하고 실무능력을 갖춘 보안 전문가로 성장하길 바란다""고 말했다.김홍구 부산외대 총장은 ""현장에서 실제 활용되는 보안 장비는 실습 환경 개선에 큰 도움이 된다""면서 ""장비 기증과 교육 시너지 향상에 적극 나서준 점에 감사한다""고 했다.",105,https://n.news.naver.com/mnews/article/031/0000627913?sid=103
[폴인인사이트] 메타버스 '생활화' 시대…우리가 갖춰야 할 능력은,2021.10.09. 오전 8:00,"최근 메타버스 솔루션의 중심이 '기능'이 아닌 '체험 자체'로 옮겨가고 있어요. ‘포토샵 그림’ 대신 실제 유화를 그리는 듯한 경험을 주는 거죠.      김범주 유니티코리아 에반젤리즘 본부장은 최근 메타버스의 흐름을 이렇게 설명했다. 그동안 컴퓨터 프로그램이 효율성을 극대화하는 데 집중했다면, 메타버스 플랫폼은 체험의 수준을 실제화하는 데 힘을 쏟는다는 것이다.       유니티코리아는 2003년 덴마크에서 만들어진 게임엔진 회사다. 닌텐도와 소니, 액티비전 블리자드 등 전 세계 매출 상위 게임사 100곳 중 94곳이 이들의 고객이다. 메타버스 대표 사례로 주목받은 네이버제트의 제페토 역시 유니티 엔진을 기반으로 만들어졌다.        김 본부장은 회사에서 '기술 기반의 홍보'를 총괄하고 있다. '생각을 널리 퍼뜨린다'는 단어를 택한 직무 이름(에반젤리즘)처럼 회사의 기술을 활용할 방법을 업계에 알리는 역할을 한다.        그는 메타버스를 ""20년 전부터 시도된 ‘가상사회 실험’의 연장선""이라고 말했다. ""온 국민이 '게이머'가 되면서 메타버스가 다시 관심을 받게 된 것""이라며 ""이제 '메타버스의 생활화'가 점점 가까워지고 있다""고 강조했다.        지난 1일 김 본부장을 만나 메타버스가 어떻게 진화하고 있는지 물었다. 다음은 일문일답.        



김범주 본부장은 유니티코리아 합류 전 신씨네·코코엔터프라이즈 등에서 TV 애니메이션과 영화 연출을 맡았다. 블루사이드·엔씨소프트 등에서 게임 콘텐트 기획 및 영상 연출 업무도 담당했다. [사진 폴인, 송승훈]      Q : ‘메타버스의 생활화’는 무슨 뜻인가요?     예를 들어 그림을 그릴 때 과거 프로그램은 일을 얼마나 효율적으로 처리할 수 있는지에 집중했어요. 하지만 최근에는 흐름이 달라졌죠. 가상현실(VR) 기기를 착용하고 가상의 아틀리에서 유화를 그릴 수 있게 한 솔루션이 나왔습니다.      여기서는 실제 화실에 앉아 있는 것처럼 밖에서 빗소리, 새소리가 들립니다. 손에는 팔레트와 붓을 들고요. 붓으로 팔레트의 물감을 찍어 실제 캔버스에 그림을 그리는 효과를 경험할 수 있습니다. 기존 포토샵에서 단축키 중심으로 그림 생산에 치중하는 것과는 다른 흐름이죠. 심지어 다른 VR 페인팅 프로그램은 아예 '되돌리기(Undo)' 기능을 뺀 것도 있어요. 현실처럼 잘못 그린 것도 받아들이며 그리게 하는 거죠.        



메타버스 솔루션이자 VR 게임인 ‘버밀리언(Vermillion)’을 활용하는 모습. [사진 버밀리언 홈페이지]      Q : 직장인이 활용할 만한 솔루션은 어떤 게 있나요?     저도 직장인이다 보니 메타버스 솔루션 중 몰입도를 높이는 서비스를 활용합니다. '이머스드(Immersed)'라는 VR 솔루션 기기를 착용하면 외부 시야가 전부 차단됩니다. 대신 제 시야에 원하는 배경을 만들 수 있죠. 카페나 산은 물론, 우주선까지요. 그리고 그 공간 위에 모니터를 5~6개까지 띄울 수 있습니다. 제가 필요한 것만으로 시야를 가득 채우니 몰입이 될 수밖에 없어요.      Q : 사람들과 함께 하는 솔루션 쪽에선 어떤 흐름이 있나요?     'VR챗(VR CHAT)'을 눈여겨보고 있습니다. 이 솔루션이 구현한 가상공간에서 사람들이 함께할 수 있는 놀이가 무엇인지 보고 있어요. 대표적으로 유튜버 '우왁굳'이 이 솔루션을 활용해 콘텐트를 만드는데요. VR챗에 상황극을 할 수 있는 판만 만들고 자신은 굳이 스토리를 짜지 않아요. 여기에 참여하는 사람들과 ‘공동창작’을 하는 거죠.       이 흐름은 우리 전통놀이에서도 찾을 수 있는 것입니다. 예전에 우리나라에서 마당놀이를 즐겨 했죠. 이 놀이의 특징은 중간중간 스토리를 이끄는 '별주부전' 같은 내용이 나온다는 건데요. 이때 연기자와 관객이 나뉘지 않습니다. 놀이를 보던 관객이 연기자의 손에 끌려 잔치하듯 끌려가는 모습이 나타나죠. 우리나라에만 있는 건 아닌 이런 분위기가 다시 메타버스 솔루션에서 나타나고 있어요.      Q : 다시 소통할 능력이 중요해지는 거군요.     그렇습니다. 결국 중요한 건 다양한 기술이 나오는데 이걸 나만의 문법으로 어떻게 이용하느냐예요. 메타버스 시대에는 콘텐트이든, 플랫폼이든 생산자와 소비자가 구분되지 않습니다. 생산자는 제페토와 같은 놀이터를 만들어놓고, 안에서 노는 플레이어와 소비자가 함께 어우러지는 거죠. 게임엔진을 기반으로 한 플랫폼을 많이 써보면서 '상호작용할 콘텐트'는 어떻게 만들어야 할지에 대한 고민이 필요합니다.      Q : 메타버스 솔루션에 대해 비즈니스 관점에서 더 생각해야 할 게 있을까요?     기업이든 크리에이터 같은 사용자든 메타버스에 대해 이제 파악하고 있는 단계라고 봐요. 양쪽이 상황이 크게 다르지 않은 거죠. 모두가 이걸 어떻게 이익으로 만들 수 있을지, 시도하고 만드는 과정 중에 있습니다. 돌이켜보면 과거에도 비슷한 상황이 많았습니다.       게임을 예로 들면 '도트(dot)'라는 걸 화면에 찍어 2D 게임을 만들던 시절이 있었습니다. 그런데 철권 같은 3D 게임이 등장하면서 표현의 영역이 넓어졌죠. 처음에는 캐릭터가 이상하다며 어색해했지만, 어느 순간 게임 시장이 뒤바뀌었습니다.        중요한 건 '신기술이 도입돼 불편하다' '이전보다 못한다'는 생각을 하기보다, 여기서 어떤 부분을 이용할 수 있을지 고민해야 한다는 겁니다. 실제로 현재 메타버스에 대한 정의도 실리콘밸리 기업들, 빅테크 기업마다 각각 의견이 다를 거에요.       자기만의 접근법을 고안해서 제안할 수 있다면, 개인이든 업체든 리더가 될 기회는 남았다고 생각합니다. 다만 메타버스 이름만 갖고 하면 안 되고, 메타버스의 무엇을 만들었는데 이전보다 더 나아진 가치가 있다는 걸 보여줘야 할 거예요.      Q : 앞으로 메타버스는 어떻게 진화할까요?     기술적 한계가 점점 사라질 겁니다. 메타버스의 주요 조건 중 하나가 '고몰입'인데요. 고몰입을 만드는 VR의 수준이 아주 쾌적하지만은 않아요. VR 헤드셋이 안경 쓰듯 편해야 하는데, 아직은 무겁죠. 하지만 이런 문제는 5년 정도면 해결될 겁니다. 현실적인 그래픽과 이를 지원할 클라우드도 발전할 거에요.       또 데이터의 연결이 더 긴밀해질 겁니다. 우리가 건축설계를 할 때, 캐드를 활용해 도면을 그리고 그걸 3D화하죠. 이 데이터를 게임이나 온라인 지도 등에 활용할 수 있을까요? 지금으로선 어렵지만, 앞으로 나아지리라 봅니다. 이렇게 디지털 데이터가 서로 연결된다면 데이터를 생산하는 노동을 줄일 수 있을 겁니다. 대신 인간의 판단력은 더 높아지겠죠.       결국 메타버스는 '사람의 인지능력과 지능을 향상하는 도구(Intelligence Implication)'로 발전할 거예요. 제가 몸담은 유니티도 메타버스를 구현하는 도구로 사람들이 잘 쓸 수 있는 엔진을 제공하는 것이 목표입니다.        



14일 오후 8시에 열리는 폴인세미나 라이브 '앞으로의 메타버스, 어떻게 진화할까'.       김 본부장은 인터뷰에서 다 전하지 못한 메타버스 이야기를 오는 14일 오후 8시에 열리는 폴인세미나 '앞으로의 메타버스, 어떻게 진화할까'에서 60분 동안 들려줄 예정이다. 세미나는 온라인 라이브로 진행되며 폴인 홈페이지에서 신청할 수 있다.",105,https://n.news.naver.com/mnews/article/025/0003141105?sid=103
KBS 사장 공모에 15명 지원…13명이 KBS 출신,2021.10.08. 오후 9:06,"27일 임명제청[이데일리 김현아 기자]



KBS 이사회는 제25대 사장 후보자 공모에 15명이 지원했다고 8일 밝혔다. 이중 13명은 KBS 출신이다.이사회는 서류 심사 등을 거쳐 후보자를 3명으로 추린다. 이후 후보자들은 오는 23일 비전 발표회에서 시민참여단의 평가를 받은 뒤 이사회 면접 심사에 임한다. 최종 후보자는 27일 결정되고, 이사회는 청와대에 임명을 제청한다.양승동 KBS 사장은 공모에 지원하지 않아 오는 12월 9일 임기를 마친다.다음은 응모자 명단이다(접수순).▲박문혁 방역신문 대표 겸 기자·전 교육부 사무관▲김진수 KBS 뉴스전문위원·전 KBS 해설국장▲임병걸 KBS 부사장·전 KBS 도쿄 특파원▲엄경철,KBS 부산총국장·전 KBS 통합뉴스룸 국장▲김의철 KBS 비즈니스 사장·전 KBS 보도본부장▲배재성 KBS 뉴스전문위원·전 KBS-N 부사장(파견직)▲윤제춘 KBS 뉴스전문위원·전 KBS 워싱턴지국장▲이영준 KBS 시사교양국 PD·전 KBS 편성마케팅 국장▲서재석 전 KBS 정책본부장·전 KBS 이사▲김재연 전 KBS 교양국 제작부주간·명지대학교 초빙교수▲안정균 KP 커뮤니케이션 고문·전 KBS 프로듀서▲정순길 전 KBS 춘천방송총국장·전 KP(율)미디어 대표▲정상현 우석대 행정학과 명예 교수·전민일보 논설위원▲김종명 KBS 보도본부장·전 KBS 런던 특파원▲이상필 TX Tech 이사·전 KBS 관악산 송신소  차장",105,https://n.news.naver.com/mnews/article/018/0005055979?sid=103
