title,date,main,section,url
"""밖으로 접는 폰, 초대형 카메라""…삼성 '폼팩터 제국' 흔들기 나선 中",2022.05.04. 오전 6:30,"기사내용 요약화웨이, 갤폴드와 달리 '아웃폴딩' 방식 폴더블폰 출시인덕션 넘어 '가마솥' 올린 샤오미…초대형·고성능 카메라 탑재LG전자 '롤러블폰' 빈자리 노리는 오포…실물도 이미 공개폴더블 강자 삼성, 차세대 폼팩터도 주도할까…특허 등록 多[서울=뉴시스]윤현성 기자 = 삼성전자가 갤럭시 Z 플립과 폴드 시리즈를 필두로 글로벌 폴더블폰 시장에서 압도적 우위를 점하며 폼팩터(새로운 형태) 시장을 압도하고 있는 가운데 중국 제조사들이 독특한 폼팩터로 연일 도전장을 내고 있다. 지금은 모바일 사업에서 철수했지만 LG전자 한때 LG 윙, 롤러블폰 등을 내세우며 폼팩터 경쟁에 불을 붙인 바 있다. 지금은 LG전자를 대신해 중국 제조사들이 삼성의 폼팩터 시장의 최대 경쟁자로 급부상하고 있다. 화웨이, '아웃폴딩' 폴더블폰 출시…내구성 문제에도 차별화 초점 뒀나4일 업계에 따르면 화웨이, 샤오미, 오포 등 중국업체들은 각기 다른 독특한 형태의 스마트폰을 속속 공개하고 있다. 화웨이의 경우 폴더블이라는 가장 기본적인 폼팩터 신작을 출시했는데, 갤럭시 폴드와 같은 기존의 폴더블폰과는 다른 형태를 띄고 있다. 최근 공개된 화웨이의 차세대 스마트폰 '메이트Xs2'에는 '아웃폴딩' 방식이 다시 적용됐다. 아웃폴딩 방식은 말 그대로 휴대전화를 '바깥'으로 접는 방식이다. 삼성전자의 갤럭시 폴드의 경우 커다란 메인화면이 안쪽으로 접히는 인폴딩 방식이 적용됐지만, 아웃폴딩 방식의 메이트Xs2는 메인화면이 바깥으로 접혀 전·후면 모두 활용이 가능하다는 게 특징이다. 화웨이는 메이트X와 메이트Xs에 아웃폴딩을 적용했다가 메이트 X2에는 인폴딩 방식으로 전환한 바 있다. 아웃폴딩 방식의 경우 대화면 액정이 그대로 바깥에 노출돼 내구성이 취약하다는 우려를 받고 있는데, 화웨이가 이같은 방식으로 회귀한 것은 폴더블폰 절대 강자인 삼성전자와 차별성을 주고자 하는 전략으로 읽힌다.샤오미, '2억화소' 초거대 카메라로 승부수…롤러블폰 도전하는 오포샤오미는 바 형태는 유지했지만 '역대급' 크기의 카메라로 새로운 폼팩터 구축에 나섰다. 최근 렌더링 이미지가 공개된 샤오미의 차기작 '샤오미 12 울트라'는 거대한 카메라 모듈이 제품 후면의 절반을 차지하고 있다. 제조사간 스마트폰 카메라 개발 경쟁의 가열로 카메라 크기가 점차 커지면서 소비자들 사이에서는 '카툭튀'(카메라가 툭 튀어나왔다), '인덕션' 등 조롱이 나온 바 있는데 이를 정면 돌파하고 카메라 성능을 극대화하기 위한 신제품 전략으로 풀이된다.샤오미 12 울트라의 카메라는 거대한 크기에 걸맞게 쿼드 카메라(4개 카메라)가 탑재됐고, 특히 이 가운데 1개는 독일의 카메라 제조사인 라이카와 함께 제작된 잠망식 망원렌즈가 적용된 것으로 알려졌다. 메인 카메라 모듈은 2억 화소에 달하는 초고화질 촬영 기능을 제공할 것으로 전망된다. 삼성전자의 최신 플래그십 '갤럭시 S22 울트라'에 탑재된 1억800만 화소의 광각 카메라와 비교해도 압도적인 성능이다.



샤오미 12 울트라 렌더링 이미지. (사진=테크웹) *재판매 및 DB 금지오포는 당초 LG전자가 주도해왔던 롤러블폰 개발에 뛰어들고 있다. 폴더블폰이 '접는' 형태라면 롤러블폰은 마치 상소문처럼 둘둘 '마는' 형태의 스마트폰이다.오포는 지난 3월 열린 모바일 월드 콩그레스(MWC) 2022에서 롤러블폰인 '오포 X 2021' 실물을 깜짝 공개한 바 있다. 당시 공개된 롤러블폰은 유리 전시관 안에서 작동되는 모습만 보여져 관람객들의 직접 구동이 불가했고 세부적인 정보도 발표되지 않았다. 다만 스마트폰이 실제로 펴졌다 말리는 모습은 공개됐는데, 이용에 방해되는 주름 등이 크게 눈에 띄지 않았다는 점에서 롤러블폰을 위한 디스플레이 기술이 일정 수준 이상에 올랐음을 보여줬다.'폴더블 강자' 삼성, 폼팩터서도 한 발 앞설까…점유율 경쟁 귀추중국업체들이 이같이 다양한 폼팩터에 도전하는 이유는 기존 바 형태의 스마트폰은 애플이, 신형 폼팩터의 대표격인 폴더블폰은 삼성이 눈에 띄게 앞서 있기 때문으로 보인다. 이미 나와있는 형태의 스마트폰 형태를 따라가는 '안전한 길'을 따라가기만 하면 시장 주도권을 확보할 수 없다는 계산인 셈이다.중국업체들이 무리수로 보일 만큼 과감한 도전을 이어가고 있는 가운데 삼성전자도 '폼팩터 초격차' 유지를 위해 부지런히 움직이고 있다. 업계에 따르면 삼성전자는 이미 '2번 이상' 접는 폴더블폰, '롤러블폰' 등과 관련한 특허를 지난해 세계지식재산권기구(WIPO)로부터 승인받았다. 삼성전자가 명확한 특허 내용을 공개하진 않았으나 십자(十) 형태로 가로와 세로가 모두 접히는 폴더블폰, 병풍처럼 여러 번 접을 수 있는 폴더블폰, 기존 바 형태에서 추가 화면 확장을 가능케 하는 롤러블 기능이 담긴 스마트폰 등과 관련한 것으로 알려졌다.



삼성전자의 2번 이상 접는 폴더블폰인 '트리 폴드' 예상 이미지. (사진=렛츠고디지털) *재판매 및 DB 금지글로벌 시장조사업체 카운터포인트리서치에 따르면 글로벌 폴더블폰 출하량은 2019년 50만대에서 2020년 300만대, 2021년 860만대로 급성장했고, 올해에는 전년도의 2배에 달하는 1640만대에 이를 것으로 전망된다. 이 가운데 삼성전자의 점유율은 내년까지도 70~80% 수준에 달할 것으로 예측되고 있다.폴더블폰 절대강자 삼성이 새로운 폼팩터 경쟁에서도 앞서가는 모습을 보이고 있는 가운데 중국 제주사들이 얼마나 바짝 따라잡을 수 있을 지 귀추가 주목된다.",105,https://n.news.naver.com/mnews/article/003/0011163284?sid=103
"큐렉소, 1분기 매출 147억원…전년比 145.7% 증가",2022.05.04. 오전 9:24,"의료로봇 판매 증가영업이익 흑자전환큐렉소는 2022년 1분기에 147억원의 매출을 기록했다고 4일 밝혔다. 작년 1분기보다 145.7% 증가한 수치다.  1분기 매출을 이끈 건 의료로봇의 판매 증가다. 큐렉소는 1분기에 총 13대의 의료로봇을 판매했다. 2020년과 지난해 1분기 판매 대수인 2대, 1대보다 크게 늘었다. 2020년과 지난해 1분기 매출은 각각 83억원, 59억원이었다.  수익성 측면에서의 개선도 이뤄졌다고 했다. 큐렉소의 1분기 매출원가율은 78.9%로, 2020년 84.6%, 2021년 81.0%보다 개선됐다. 이에 따라 2022년 1분기 영업이익은 1억2000만원을 기록해, 지난해 1분기 영업손실 16억1000만원 대비 흑자전환했다.  큐렉소는 올해 매출 확대에 따른 영업 지렛대(영업레버리지) 효과로 수익성 개선 등을 기대하고 있다. 이재준 큐렉소 대표는 “큐렉소는 2020년부터 올 1분기까지 누적 61대의 의료로봇을 판매하는 등 판매 대수가 크게 늘고 있다”며 “국내뿐 아니라 미국 인도 및 동남아시아 등 해외 의료시장에서 ‘K-의료로봇’의 위상을 넓혀갈 것”이라고 말했다.",105,https://n.news.naver.com/mnews/article/015/0004694317?sid=103
"한국MS, 마크로젠에 클라우드 제공…""유전체 분석 환경 고도화""",2022.05.04. 오후 2:59,"유전체 빅데이터 AI로 분석[이데일리 김국배 기자] 한국마이크로소프트(MS)는 유전체 분석 기업 마크로젠과 유전체 분석 환경 고도화를 위한 업무협약을 맺었다고 4일 밝혔다.



이지은 한국마이크로소프트 대표(좌)와 김창훈 마크로젠 대표 (사진=한국MS)MS는 마크로젠에 클라우드 ‘애저’를 제공해 유전체 빅데이터를 인공지능(AI)으로 분석하기 위한 첨단 IT 환경을 지원할 예정이다. 또한 다양한 산업 특화 경험을 바탕으로 축적된 기술과 교육을 제공하기로 했다. 특히 차세대 염기 서열 분석(NGS) 데이터 운용 가용성과 안정성이 높아질 것으로 회사 측은 기대했다.김창훈 마크로젠 대표는 “이번 협약은 글로벌 클라우드 기업과 협력해 헬스케어 영역에서의 디지털 전환을 위한 채비를 했다는 점에서 의미가 크다”며 “포스트 코로나 시대의 디지털 헬스케어 기업으로서 개인 유전체 정보, 생활정보, 의료 정보 등 통합 빅데이터와 AI를 결합해 개인별 맞춤 건강관리 솔루션을 제공할 것”이라고 했다.이지은 한국MS 대표는 “MS는 생명공학 및 바이오 산업 발전을 위한 다양하고 우수한 클라우드 기술을 보유하고 있다”며 “앞으로도 디지털 전환을 위한 최적의 파트너가 될 것”이라고 말했다.",105,https://n.news.naver.com/mnews/article/018/0005207746?sid=103
"마드라스체크 이학준 대표, ""지식 근로자 갖춘 모든 기업이 플로우의 고객""",2022.05.04. 오후 6:13,"“플로우를 활용하면 자연스럽게 투명성과 자율성, 그리고 상호보완성을 확보하게 된다···소프트웨어 기업인 우리가 여의도와 강남역에 오프라인 팝업 스토어를 개장한 배경도 협업 툴 플로우를 모르는 사람이 없게 하자, 업무 관리를 시작할 때 플로우를 떠올리게 하자는 목표를 놓고 자율성 있게 업무를 추진한 데서 나온 결과다”마드라스체크 이학준 대표가 답한 이 짧은 문장 하나에 협업 툴 ‘플로우’의 활용 가치는 물론, 기업 문화까지 자연스레 함축돼있었다. 소프트웨어 기업이 오프라인 스토어를 여는 시도만 놓고 보더라도 자유롭고 실용적인 업무 방식, 그리고 투명한 소통 등이 있기에 가능했을 테니 말이다.마드라스체크는 2015년 웹캐시 사내 벤처 1호로 시작한 소프트웨어 기업으로, 프로젝트 소통 중심의 협업 툴 ‘플로우’를 서비스하고 있다. 지난해부터 여의도 두 곳에 팝업스토어를 개장한 데 이어 최근에는 비즈니스의 중심지인 강남역에도 팝업 스토어를 개장하는 등 남들이 가지 않는 시도로 주목을 받고 있다. 이학준 대표를 만나 마드라스체크 만의 특징과 방향성을 듣는 시간을 가졌다.“플로우는 프로젝트에 집중하는 협업 툴”



마드라스체크 이학준 대표가 강남구 팝업스토어에서 플로우를 소개하고 있다. 출처=IT동아이학준 대표가 생각하는 플로우란 어떤 협업 툴인지 물어보았다. 그는 “대다수의 협업 툴은 메신저나 채팅 등 소통 기능을 중심으로 하나, 플로우는 프로젝트 관리 중심의 실질적인 업무 관리 기능에 역점을 두고 있다”라며 소개를 시작했다. 플로우는 업무의 단위를 ‘프로젝트’로 구분하며, 프로젝트를 기반으로 정보를 구분하고 소통한다. 덕분에 여러 업무가 혼선을 빚는 조건에서도 정확하게 구분할 수 있고, 이를 다른 사람과 공유하거나 우선순위 작업을 두는 식으로 협업을 추진한다. 그룹웨어나 사내 메신저를 활용하는 기업이더라도 추가로 도입해서 프로젝트를 정리하는 게 플로우의 방식이다.이 대표는 프로젝트 관리 기능을 중점으로 하는 협업 툴은 플로우가 유일하다며, 주목할만한 기능을 추가로 소개했다. 그는 “플로우가 프로젝트 중심으로 동작하는 만큼, 외부 협력사와의 협업도 잘 갖춰놓았다. 링크만 공유하면 유료 고객이 아닌 타사 관계자도 웹브라우저를 통해 프로젝트 진행 상황이나 업무 흐름 등에 관여할 수 있다. 또한 인터넷 기반 서비스는 물론 서버를 별도로 갖추고 내부망에서만 동작하게 하는 기능도 제공한다. 덕분에 10~30인 미만의 중소기업부터 대기업은 물론, 언론사나 금융 등 사내 보안이 중요한 업계에서도 플로우를 선택하는 사례가 늘고 있다”라고 답했다.“플로우의 문화, 협업 툴이 주는 자율성에서 시작”그렇지만 플로우의 특징만 듣고서 비즈니스의 중심지에 팝업 스토어를 개장한 이유를 유추하긴 쉽지 않았다. 통상적으로 팝업스토어는 소프트웨어보다는 제조 기업, 소비재 기업에서 개장하기 때문이다. 이에 대해 이 대표는 고객 경험(Customer Experience, CX) 중심의 전략, 그리고 플로우를 활용하는 마드라스체크 본연의 기업 문화를 사유로 들었다.



강남역과 역삼역 사이에 위치한 플로우 팝업스토어. 제공=마드라스체크그는 “우리 기업의 기업 문화는 투명성, 자율성, 상호보완성이 핵심이다. 기업 규모가 커지면서 기업 자체가 스스로 운영되는 단계에 접어들었고, 모든 직원들이 각자의 목표를 수립하고 과제를 수행하며, 결과에 대한 성과를 공유하기 시작했다. 특히 플로우는 모든 사용자가 프로젝트를 통해 정보와 업무 내용 등을 파악할 수 있고, 업무 진행 과정과 성과가 자동으로 보고서로 만들어져 더 능동적으로 일하는 환경을 만들어준다. 그러면서 협업 과정에 있는 각 부서들이 서로의 상황을 파악하고 업무를 추진하므로 더 유기적인 보완 관계를 이루게 된다”고 답했다.실제로 플로우를 활용하면 업무를 인수인계할 필요 없이 직접 프로젝트를 파악하면 되고, 업무 프로세스가 투명하게 공개되므로 협업 간 조율도 쉬워진다. 말 그대로 ‘저쪽 부서는 무슨 일을 하는지도 모르는데 맨날 바쁘다고 하더라’라고 생각할 필요 없이 직접 찾아서 어떤 일을 하는지 볼 수 있고, 이를 토대로 각자의 업무를 조율하고 관리할 수 있다. 모든 업무 과정이 보고서로 작성되는 만큼 인사나 관리자 측면에서도 이상적이다.“업데이트는 2주 간격··· 전 임직원이 믿고 협업한 성과”



제공=마드라스 체크여기에 고객 경험 중심의 업무 추진이 기류로 작용하면서, 마드라스체크 특유의 문화가 만들어졌다. 마드라스체크는 최근에도 OKR 목표 관리 기능이나 알림 탭 기능을 추가하는 등 2주 간격으로 서비스를 업데이트하고 있다. 하나의 기능을 만드는데도 고객 경험 팀이 같이 보고 설계하고, 디자인이나 개발팀이 모두 서로 리뷰하고 피드백을 준다. 원활한 개발 계획을 위해 매월 부서가 정보를 공유하는 ‘오렌지 미팅’을 추진하고 있고, 영업 팀은 현장의 목소리를 서비스화 하기 위해 노력한다. 특히나 개발진은 플로우의 프로젝트 공유 기능을 통해 과거부터 현재까지의 개발 이력을 투명하게 파악하고, 이를 토대로 성장하며 플로우 서비스를 발전시키고 있다. 그 전반적인 노력이 ‘팝업 스토어’라는 결과로 이어졌다.이 대표는 “플로우를 통해 전 직원들이 서로 믿고 업무를 추진하는 신뢰가 쌓이면서, 서로가 믿고 자율적으로 업무를 추진하는 기업 문화가 자리 잡게 됐다. 대표는 목표를 지정하고, 직원들은 목표 달성을 위해 나아가는 그림이 그려졌다. 팝업스토어 역시 협업 툴 플로우를 모르는 사람이 없게 하자, 업무 관리를 시작할 때 플로우를 떠올리게 하자는 목표를 제시하고 자율적으로 업무를 추진하는 과정에서 등장한 발상이다”라고 답했다.



마드라스체크는 올해 4월에는 메타버스 기반의 플로우 체험 팝업 스토어를 선보인 바 있다. 제공=마드라스체크팝업스토어의 성과나 의의는 어떨까. 이 대표는 “소프트웨어가 무형의 자산이긴 하지만, 꼭 온라인으로만 홍보할 필요는 없다. 실제로 팝업 스토어에는 플로우를 활용하고 있는 고객은 물론, 플로우 자체를 말로만 접해본 사람들도 누구나 들어와서 경험하고 간다. 협업 툴이라는 게 이론적으로만 설명하기가 힘든데, 직접 고객을 대상으로 설명하고 체험할 기회를 제공하면서 영업 측면에서도 좋은 결과를 낳고 있다”고 답했다.실제로 팝업 스토어는 단순히 협업 툴 소개를 넘어서, 고객에 대한 교육이나 피드백 창구, 마케팅 창구 등 다양한 방면에서 긍정적인 결과를 창출하고 있다. 팝업 스토어는 마드라스체크와 협업 툴 플로우, 그리고 고객 경험에 대한 기업 문화와 목표 의식이라는 퍼즐이 맞춰진 결과물인 셈이다.팝업스토어로 집중된 시선, 그다음 행보는?



이학준 대표는 앞으로도 플로우가 프로젝트 중심의 전문 협업 툴로 나아갈 것이라는 의지를 밝혔다. 출처=IT동아소프트웨어 기업의 팝업 스토어로 시선을 모은 마드라스체크, 당면한 과제와 목표는 무엇일까? 일단 IT 기업들이 열을 올리고 있는 개발자 확보에 집중하겠다는 뜻을 밝혔다. 이 대표는 “마드라스체크 역시 개발자 확보에 공을 들이고 있다. 특히 개발자들이 모든 작업을 플로우 하나만을 활용해 일정을 수립하고 마감하는 등 고유의 개발 문화를 갖추고 소통한다. 특히 신입 직원이 입사해도 기존에 작업해놓은 모든 내역을 직접 확인할 수 있는 시스템을 갖추고 있다. 돈 잘 버는 회사도 중요하지만, 모두가 함께 성장할 수 있는 문화가 우리의 가치관”이라고 말했다.또한, 장기적으로 추구하는 목표에 대해서도 밝혔다. 이학준 대표는 “국내 협업 툴 시장은 각각 특성을 가진 협업 툴들이 나눠갖기 시작했으나, 장기적으로는 각각의 도구가 연결될 것 같다. 메일은 MS 아웃룩을 사용하고, 자료 공유는 구글 드라이브를 활용하는 식으로 결국은 원 툴이 아닌 멀티 툴로 나아갈 것이다. 그래서 플로우도 기능 확장보다는 프로젝트 관리용 협업 도구라는 콘셉트를 유지할 생각이다. 전자 결재도 넣고, 이메일도 넣고, 드라이브도 넣고 하다 보면 결국은 경쟁 범위만 늘어나므로 프로젝트 관리라는 목적 하나만 전문적으로 승부하겠다. SAP가 ERP(전사적 자원 관리), 세일즈포스가 CRM(고객 관계 관리)만으로 세계적인 기업이 된 것과 같은 전략이다”라며 포부를 밝혔다.동아닷컴 IT전문 남시현 기자 (sh@itdonga.com)",105,https://n.news.naver.com/mnews/article/020/0003426601?sid=103
"컴투스, 데브시스터즈 '쿠키런: 킹덤' 유럽 공략 지원",2022.05.04. 오전 10:37,"컴투스는 데브시스터즈와 함께 ‘쿠키런: 킹덤’의 유럽 시장 공략을 본격화한다고 4일 전했다. /사진제공=컴투스 컴투스는 데브시스터즈와 손잡고 글로벌 인기작 '쿠키런: 킹덤'을 통해 유럽 시장 공략에 나선다고 4일 밝혔다. 컴투스는 작년 8월 데브시스터즈와 맺은 업무 제휴 계약에 따라 유럽 24개국에서 '쿠키런: 킹덤' 서비스를 위한 전략적 비즈니스 파트너의 역할을 담당한다. 독일, 프랑스 등 유럽 주요 국가에서 원활한 라이브 서비스 및 언어 지원에 나서고 국가별 이용자의 취향을 맞춘 공격적인 로컬 마케팅을 추진할 방침이다. 이번 유럽 현지 공략은 단순 업무 제휴를 넘어 양사의 사업 노하우와 지식재산권(IP)을 적극 공유하는 비즈니스 협업 사례다. 특히 유럽 시장에서도 강력한 팬덤을 구축하고 있는 '서머너즈 워'의 현지 서비스 노하우와 쿠키런: 킹덤의 게임성이 만나 높은 시너지를 창출할 것으로 기대된다.양사는 전략적 협업을 통해 유럽 지역 내 쿠키런: 킹덤의 브랜드 인지도를 높이고 시장 점유율을 확대해 나갈 방침이다. 또한 유럽 지역을 시작으로 향후 데브시스터즈와 함께 글로벌 시장을 겨냥한 다양한 형태의 사업 모델도 모색해 나갈 예정이다.쿠키런: 킹덤은 쿠키들의 서사를 기반으로 펼쳐지는 캐릭터 수집형 역할수행게임(RPG)이다. 출시 이후 국내는 물론 일본, 태국, 대만의 주요 애플리케이션(앱) 마켓 인기 순위 1위에 오르고 미국 애플 앱스토어 인기 순위 2위와 매출 순위 3위를 기록하는 등 큰 인기를 끌고 있다.",105,https://n.news.naver.com/mnews/article/417/0000809965?sid=103
"수젠텍, 여성호르몬 진단 제품 3종 'CE CoC' 인증 획득",2022.05.04. 오후 2:52,"유럽 전역에 판매 가능



수젠텍은 여성호르몬 진단 제품 3종에 대해 유럽 'CE CoC' 인증을 획득했다고 4일 밝혔다. CoC 인증을 획득하면 국가별 별도 인증을 받지 않아도 유럽 전역에서 판매가 가능해진다는 설명이다.유럽 CE 인증은 자기적합성선언(DoC) 인증과 적합성(CoC) 인증으로 구분된다. CoC의 평가 기준이 더 엄격하다고 했다.  이번 3종은 조기 임신발견 및 유지 확인(Surearly SMART Pregnancy DUO), 배란 여부 확인(Surearly SMART Ovulation DUO), 폐경 여부 및 진행 상황 확인(Surearly SMART Menopause DUO) 등에 쓰인다. 기존 제품들은 보통 1개의 호르몬으로 진단하지만, 이들은 2개의 호르몬을 검사해 정확도를 높였다고 회사 측은 전했다. 또 모바일 앱(응용 프로그램)과 연동이 가능하여 여성 호르몬의 변화를 지속적으로 확인할 수 있다고 했다. 회사 관계자는 ""여성 질환의 주된 원인은 호르몬 변화에서 시작되는데, 병원 진료 이외에 별다른 관리방법이 없다""며 ""수젠텍의 제품은 단순 여성호르몬 진단을 넘어 호르몬 변화에 따른 생체정보를 활용해 다양한 분야에서 활용될 수 있어 의미가 크다""고 말했다. 이들 제품은 유럽 협력사를 통해 약국과 편의점 등에서 일반 소비자에게 판매될 예정이다. 온라인 판매도 전개할 계획이다.손미진 수젠텍 대표는 ""유럽 지역의 소매 사업을 시작으로 중동과 아시아 지역으로 판로 개척도 진행 중""이라며 ""이후 원격진료에 대한 병원과의 연계, 헬스케어 플랫폼 사업제휴 등 다양한 측면에서 사업 확장을 준비하고 있다""고 했다.",105,https://n.news.naver.com/mnews/article/015/0004694550?sid=103
"차바이오텍 美 자회사, 세포·유전자치료제 CDMO 시설 완공",2022.05.04. 오전 9:19,"마티카 바이오테크놀로지



차바이오텍은 미국 자회사 마티카 바이오테크놀로지가 세포·유전자치료제 위탁개발생산(CDMO) 시설을 본격 가동한다고 4일 밝혔다. 마티카 바이오의 CDMO 시설은 미국 텍사스주 칼리지스테이션에 위치해 있다. 미국 식품의약국(FDA)이 인정하는 우수의약품제조및품질관리 기준(cGMP)에 맞춰 설계 및 시공됐다. 500L 용량의 세포 배양기(바이오리액터)와 글로벌 수준의 제조설비를 갖추고 있다는 설명이다.이 시설에는 ‘G-CON’의 ‘모듈식 POD’ 공법이 적용됐다. 다른 장소에서 구조물을 만든 후, 건설 현장으로 운송해 조립·설치하는 방식이다. 고객이나 시장의 요구에 맞춰 시설을 쉽게 변경할 수 있다는 설명이다.  마티카 바이오는 세포·유전자치료제의 핵심 원료인 ‘렌티 바이러스벡터’ ‘아데노 부속 바이러스 벡터’ 등 바이러스 전달체를 생산한다. 세포·유전자치료제 개발 및 생산 서비스도 할 예정이다. 이를 위해 싸토리우스와 실시간 공정분석기술과 자동화 시스템을 개발하고 있다. 의약품 개발·생산 일정을 단축하고 균일한 품질의 제품을 대량 생산하기 위해서다. 또 텍사스 A&M대와 플라스미드 DNA, 단백질 등에 대한 공동연구도 진행하고 있다.송윤정 마티카 바이오 대표는 ”세계적인 수준의 기술력을 내재화하고, 모기업인 차바이오텍의 세포치료제 연구개발 경험과 노하우를 도입해 글로벌 세포·유전자치료제 CDMO 시장을 선도하겠다“고 말했다. 차바이오텍은 2024년 완공 예정인 판교 제2테크노밸리 첨단 바이오시설 ‘CGB(Cell Gene Biobank)’에 마티카 바이오의 선진 시장 CDMO 사업 기술력과 경험을 접목할 예정이다. 이를 통해 북미 유럽 아시아 CDMO 시장에서 차별화된 경쟁력을 확보한다는 목표다.",105,https://n.news.naver.com/mnews/article/015/0004694311?sid=103
