title,date,main,section,url
"""하루 새 2400% 급등""…'오징어 게임' 가상화폐까지 나왔다",2021.10.29. 오전 10:46,"'오징어 게임' 세계적인 인기가상화폐 시장까지 번져24시간 만에 2400% 폭등



/사진=스퀴드게임 토큰넷플릭스 오리지널 '오징어게임'의 세계적인 흥행과 함께 암호화폐까지 등장했다. CNBC는 28일(현지시간) '오징어게임'의 이름을 딴 '스퀴드게임 토큰(SQUID)'이라는 가상화폐가 등장, 24시간 동안 2400% 폭등세를 보였다고 전했다. 시가 총액은 1억7400만 달러(약 2036억6700만 원)에 달한다. 스퀴드게임 토큰은 '오징어게임'에서 영감을 받아 만들어진 것으로 알려졌다. 지난 26일부터 거래가 시작됐다. 하루 전 만 해도 0.09달러에 거래됐지만, 갑작스럽게 급등세를 보인 것. 스퀴드게임 토큰에 우려의 목소리도 나왔다. 코인마켓캡 측은 ""인기 탈중앙화 거래소인 팬케익스와프에서 스퀴드게임 토큰을 판매할 수 없다는 보고를 받았다""면서 투자자들의 주의를 당부했다. 



/사진=스퀴드게임 토큰거래가 불가한 이유에 대해서는 공식적으로 밝혀지진 않았지만, 코인이 특정 조건을 충족하지 못할 경우 판매하지 못하도록 막는 반덤핑 기술 때문이 아니겠냐는 분석이다. 스퀴드게임 토큰의 흥행에 CNBC는 도지코인, 스바이누 등이 일론 머스크 테슬라 CEO의 한 마디에 급등했던 것과 같이 온라인에서 흥행하는 '밈'을 활용한 코인 홍보가 적중했다고 분석했다.",105,https://n.news.naver.com/mnews/article/015/0004622256?sid=103
"포시에스, 일본 최대 IT 전시회서 전자계약 서비스 '이폼사인' 선보여",2021.10.31. 오후 12:02,"재팬 IT 위크에 참가한 포시에스 전시 부스전자문서·리포팅 솔루션 전문기업 포시에스(대표 박미경)는 27~29일 3일간 일본 치바현 마쿠하리 멧세에서 열린 '제12회 재팬 IT 위크'에 참가, 클라우드 기반 전자계약 서비스 '이폼사인'을 선보이며 일본 전자계약 시장 선점에 본격 나선다고 31일 밝혔다.재팬 IT 위크는 지난해 기준 500여개 기업들이 참가하고, 약 2만2000명 이상이 방문한 일본 최대 규모 IT 전시회다.전시회 현장 부스에선 포시에스 일본 지사 직원들이 고객들에 이폼사인을 소개하고 비대면 전자계약 데모 시연 등을 진행했다. 코로나19 여파로 일본 내에서도 디지털화 필요성이 급격히 증가하는 시점에서, 비대면으로 계약, 신청, 동의 업무가 가능한 이폼사인에 대한 관심은 뜨거웠다.이폼사인은 국내 금융권에서 70% 이상 디지털 창구 시스템 구축 레퍼런스를 보유한 오즈 이폼 전자문서 엔진 기술을 기반으로 개발된 안정적인 서비스이다. 별도 시스템 구축 없이 매월 합리적인 비용으로 계약서, 신청서, 동의서를 간편하게 전자문서로 만들어 사용할 수 있다.포시에스 관계자는 “중소기업·공공기관은 물론 국내 대기업도 이폼사인을 도입하는 등 서비스 안정성과 기술력을 모든 기업군에서 인정받고 있고 이러한 레퍼런스는 전자계약 서비스 도입을 검토하고 있는 일본 기업에도 긍정적인 영향을 주고 있다”고 말했다.박미경 대표는 “코로나19 이후 비대면 업무와 디지털 전환이 전 세계 주요 화두로 떠올랐고, 일본 역시 디지털화를 적극 추진하는 분위기”라며 “도장 결재 문화가 깊숙이 자리 잡고 있는 일본에서 공격적인 영업·마케팅 활동으로 비대면 전자계약 시장을 선점하고, 일본 현지 파트너·고객 확보에 집중할 것”이라고 말했다.",105,https://n.news.naver.com/mnews/article/030/0002978684?sid=103
"`메타`로 이름 바꾼 페이스북, `좋아요` 늘까",2021.10.31. 오전 10:40,"세계 최대 소셜미디어 페이스북이 사명을 '메타(Meta)'로 바꿨다. AR(증강현실)·VR(가상현실) 분야 생태계 구축에 힘 쓰고 메타버스 기업으로 거듭나겠다는 목표다. 증오 조장, 극단주의적 사상 유포 등 내부 고발자의 폭로로 사면초가에 놓인 페이스북이 이미지 변신에 성공할 수 있을지 주목된다.마크 저커버그 페이스북 창업자 겸 CEO(최고경영자)는 지난달 28일 온라인으로 열린 '커넥트 2021'에서 ""메타는 지금까지와 마찬가지로 사람을 연결하는데 중점을 둔 회사""라며 새로운 사명 메타와 무한대를 뜻하는 수학 기호(∞) 모양의 로고를 공개했다. 메타는 최근 세계 각국 기업들이 성장성에 집중하며 투자하고 있는 메타버스와 관련이 있다. 메타버스는 가상을 의미하는 메타(Meta)와 현실 세계를 의미하는 유니버스(Universe)의 합성어로 3D(3차원) 가상과 현실을 자유롭게 넘나들 수 있는 세계를 말한다. 이번 사명 변경은 메타버스 시장 지배력을 강화하겠다는 전략을 담은 것으로 풀이된다. 저커버그는 ""다른 기술 기업들이 기술의 활용에 주력한다면 메타는 사람 사이의 소통을 위한 기반 기술 개발에 집중한다""며 ""메타버스가 세상을 연결하는데 발휘할 강력한 영향력을 확신하고 새로운 로드맵을 통해 메타버스를 일상화함으로써 사람들이 친구·가족과 소통하고 각자가 원하는 커뮤니티를 만나고 비즈니스가 성장할 수 있도록 지원할 것""이라고 밝혔다. 앞서 페이스북은 지난 2014년 VR 헤드셋 제조 기업인 오큘러스VR을 23억 달러(약 2조6000억원)에 인수하는 등 관련 투자를 지속하고 있다. 지난해에는 메타버스 사업 육성을 목표로 전담 AR·VR 연구 부서 '페이스북리얼리티랩(FRL)'을 신설하기도 했다.페이스북, 인스타그램, 왓츠앱 등 회사의 핵심 애플리케이션(앱)은 명칭을 그대로 유지하고 메타 아래로 들어간다. 다만 지주회사 체제는 아니다. 또 다른 빅테크 기업 구글이 지주회사 '알파벳'을 만들며 지배구조를 개편한 것과는 다른 방식이다.페이스북의 사명 변경을 두고 위기 탈출용으로 보는 시각도 존재한다. 사명 변경이 최근 증오 발언과 허위 정보, 극단주의적 사상을 유포하고 10대들의 정신건강에 해를 끼쳤다는 내부 고발자의 폭로로 회사가 위기에 내몰린 상황에서 나온 조치이기 때문이다. 이에 페이스북이 이번 사명 변경으로 기업 이미지를 탈바꿈할 수 있을지 관심이 쏠린다.한편 일각에서는 메타라는 사명에 조롱도 나온다. 미국 CNN 등 외신은 메타가 히브리어로 '죽은'(dead)이란 단어와 발음이 비슷하다며 이스라엘 소셜미디어 이용자들이 조롱하고 있다고 보도했다.",105,https://n.news.naver.com/mnews/article/029/0002703589?sid=103
"[100세건강] 'M자형 탈모' 환자 절반이 2030 남성…""원인별 치료 필요""",2023.10.22. 오전 6:00,"대다수 약은 의사처방 받아야 할 전문약…해외직구는 자제해야치료 늦을수록 효과 떨어져…중단 시 3~6개월 내 또 다시 탈모



ⓒ News1 DB(서울=뉴스1) 강승지 기자 = 환절기 탈모라는 말이 나올 만큼 가을은 큰 일교차로 두피가 건조해지고 각질이나 염증 등으로 인해 모발이 빠지기 쉬운 계절이다.이미 남성형 탈모를 앓고 있거나 의심되는 남성이라면 호르몬 영향뿐만 아니라 계절적으로 탈모 발생 위험이 높은 만큼 세심한 관리와 주의가 요구된다.남성들의 주요한 외모 관리 영역 중 하나인 '헤어스타일'에 영향을 미치는 탈모 환자 수는 매년 증가하고 있다.앞이마 선이 넓어지는, 일명 'M자형 탈모'를 의미하는 안드로젠 탈모증에서 20~30대 환자는 전체 환자 수의 약 50%(2022년 건강보험심사평가원 통계 기준)를 차지할 만큼 많다.그러나 이들 사이에서 의학적 치료보다 해외직구 등을 통해 개인적인 경로로 약물을 구입하거나 영양제나 샴푸 등 자기관리 제품에 의존하는 비율이 더 높게 나타나고 있다.



5일 오후 서울 마포구 더불어민주당 미래당사 '블루소다'에서 민주당 청년선대위 주최로 청년 탈모인 초청 간담회가 열리고 있다. (사진은 기사 내용과 무관함) 2022.1.5/뉴스1 ⓒ News1 구윤성 기자탈모를 관리하는 성인 남성을 대상으로 관리 방법을 조사한 결과, 탈모 방지용 샴푸가 39.8%로 가장 높았고 탈모 치료제와 병원 방문은 각각 12.2%, 7.4%에 그쳤다.문제는 이들 사이에서 흔한 자기관리 방법이 의학적 효과가 입증되지 않았다는 점이다. 대부분 탈모 방지용 샴푸는 기능성 화장품으로 분류되고 있다.식품의약품안전처에 따르면 탈모 기능성 화장품의 역할을 '탈모 증상 완화에 도움'을 줄 뿐 탈모를 예방하거나 치료할 수 없다고 강조한다.전문가들도 탈모 범위가 넓어질수록 탈모 치료 효과가 떨어질 수 있어 가급적 조기에 의학적 치료를 시작하는 게 중요하다고 조언한다.일부 환자들은 치료비에 대한 부담으로 해외직구를 통해 약값이 저렴한 반면 국내 식품의약품안전처에 허가되지 않은 제네릭(복제약) 의약품을 구입하는 경우도 있다.하지만 대다수 탈모약은 식약처 허가를 거쳐야 하는 엄연한 전문의약품으로, 의사에게 처방받은 뒤 약국에서 약을 수령해야 한다.의사 처방 없이 해외직구로 구매한 무허가 의약품은 성분·주의 사항 등 안전하게 사용하기 위한 최소한의 주의사항 조차 기재하지 않고 있는 경우가 많다.유통 및 보관 과정에서 불순물 혼입이나 변질·오염 등 문제가 발생할 위험 역시 높다.남성형 탈모는 남성 호르몬인 테스토스테론이 전환된 디하이드로테스토스테론(DHT)에 의해 유발되는데, 5-알파 환원효소의 활성을 억제하는 형태로 치료가 이뤄진다.특히 시간이 지날수록 증상이 진행되는 질환이라 초기 원인에 따른 의학적 치료를 받으면 증상 악화를 막을 수 있다. 하지만 치료 시기가 늦어질수록 그 효과가 낮아지게 된다.국내 식약처 허가를 받고, 의학적으로 치료 효과가 입증된 경구용 치료제(먹는 약)로 두타스테리드와 피나스테리드가 있다. 두 성분 모두 5-알파 환원효소의 활성을 억제한다.5-알파 환원효소는 크게 1형과 2형 2가지 종류가 있는데 1형은 피부에, 2형은 주로 생식기나 전립선 등에 분포한다.이 가운데 피나스테리드는 2형 효소를 차단하며, 두타스테리드는 1형과 2형을 모두 차단해 DHT 생성을 더욱 효과적으로 억제한다고 알려졌다.이들 약은 최소 3개월에서 6개월 이상 복용하면 치료 효과를 볼 수 있으며, 이 효과를 유지하기 위해 꾸준히 치료받아야 한다.치료를 중단하면 3~6개월 내 다시 탈모가 진행될 수 있다.이에 대해 최지웅 아주대학교병원 피부과 교수는 남성형 탈모 치료에서 가장 중요한 것은 조기 진단과 꾸준한 치료라고 강조했다.최 교수에 따르면 나이가 들며 모낭의 소형화가 진행될수록 탈모약의 효과 또한 떨어지기 때문에, 초기에 치료할수록 효과가 커질 수 있다.최 교수는 ""많은 환자가 치료를 지속하기 어려워하는 이유 중 하나가 단기간 내 치료 효과가 나타나지 않는다는 점""이라며 ""포기하지 말고, 원인에 맞는 의학적 치료를 꾸준히 한다면 분명 치료 목표에 도달할 수 있을 것""이라고 했다.",105,https://n.news.naver.com/mnews/article/421/0007124341?sid=103
일찍 찾아온 ‘반도체 겨울’…삼성·SK 수익성 빨간불 켜지나,2021.10.31. 오후 6:21,"극자외선(EUV) 노광장비를 도입한 SK하이닉스 이천 M16 공장 전경. [연합뉴스]       이른바 ‘반도체의 겨울’이 현실화할 가능성이 커지고 있다. D램 메모리 반도체 가격이 2년여 만에 최대 하락 폭을 보이면서다. 삼성전자·SK하이닉스 등 메모리 반도체 업체의 수익성에도 빨간불이 들어왔다. 업계는 재고 수준을 낮추고, 원가 경쟁력을 높여 시장 변화에 대응할 계획이라고 밝혔다.       31일 대만의 시장조사업체 트렌드포스에 따르면 10월 PC용 D램 범용제품(DDR4 8Gb) 고정거래가격의 평균값이 3.71달러로 전달의 4.1달러보다 9.51% 하락했다. PC용 D램 가격이 하락한 것은 지난해 10월(8.95%) 이후 1년 만이다.       



10월 D램 고정거래가격 하락률. 그래픽=김경진 기자 capkim@joongang.co.kr           고정거래가격은 반도체 업체가 대형 컴퓨터 제조업체에 대량 납품할 때 적용하는 고정된 가격을 말한다. D램 고정거래가격이 내려갈 것이라는 관측은 올해 여름부터 나왔다. 반도체 고정거래가격의 선행지표인 현물거래가격이 지난 8월 하락세 양상을 보여서다.       현물거래가격은 중소 정보기술(IT) 업체나 PC 부품 도매상이 거래하는 가격으로 보통 2~3개월의 시차를 두고 고정거래가격에 반영된다. 시장조사업체 D램익스체인지에 따르면 D램 범용제품의 현물거래가격은 올해 고점이던 3월 말(5.3달러) 대비 36% 하락했다.      ━   10월 D램 고정거래가격 9.51% 하락       



서울 서초구 삼성전자 서초사옥. [뉴스1]       지난 8월 미국 투자은행인 모건스탠리는 ‘반도체 시장의 겨울이 오고 있다’라는 제목의 보고서에서 “PC와 스마트폰, 서버 수요가 줄면서 D램 가격이 연내 하락세로 돌아설 것”이라고 전망하기도 했다.       업계는 ‘위드 코로나(점진적 일상 회복)’ 국면으로 그동안 급증했던 재택근무 인력의 PC 수요가 줄고, PC 업체들이 원활한 수급을 위해 물량을 미리 확보하면서 이번 D램 가격 하락에 영향을 줬다고 분석한다. 이에 따라 예상보다 일찍 ‘피크아웃(고점 통과 후 하락 전환)’ 조짐이 나타났다는 얘기다. SK하이닉스는 지난 26일 3분기 실적을 발표하면서 “일부 고객이 재고를 우선 소진하려는 계획에 따라 가격 협상이 장기화하는 어려움이 있었다”고 밝혔다.       



삼성전자가 EUV 기술과 14나노 공정을 적용해 양산한 DDR5 D램. [사진 삼성전자]       전문가들은 D램 가격 하락이 내년 1~2분기까지 이어질 것이며 삼성전자·SK하이닉스 등에 부정적 영향을 줄 것으로 전망했다. 김선우 메리츠증권 연구원은 “내년 2분기까지 D램 가격이 상당히 많이 하락할 것”이라며 “다만 2분기에는 1분기보다 하락 폭이 줄어들면서 긍정적 신호가 나타날 것”이라고 전망했다.      ━   내년까지 하락세…재고 감축 등으로 대응       삼성전자와 SK하이닉스는 반도체 재고 감축 등으로 메모리 시장 변화에 대비하고 있다. 한진만 삼성전자 메모리 전략마케팅실장(부사장)은 지난 28일 실적 발표에서 “과거보다 메모리 사이클의 주기나 변동 폭이 줄었고, 재고가 낮은 수준이라 크게 우려할 상황은 아니다”라고 말했다. 삼성전자는 14나노 D램, 7세대 176단 V낸드 등 신규 첨단공정으로 원가 경쟁력을 높인다는 전략이다.       김선우 연구원은 “D램 가격에 선행하는 것은 결국 수요·공급의 싸움”이라며 “투자와 관련해 SK하이닉스가 3분기 실적 설명회 때 소극적으로 얘기한 것은 수급이 회복할 수 있는 여지를 만들기 위한 것으로 보인다”고 말했다. 이어 “삼성전자가 여느 3분기 실적 설명회 때와 다르게 이번에 연간 투자계획을 밝히지 않은 것이 또 다른 불확실성”이라며 “남은 4분기 메모리 반도체에 대한 투자를 더 집행하려는 것 아니냐는 우려가 나오기 때문이다. 수요가 줄어드는 시점에선 부담이 될 수밖에 없다”고 덧붙였다.",105,https://n.news.naver.com/mnews/article/025/0003146913?sid=103
3000억달러 돌파한 머스크 재산 이틀 만에 3100억달러도 넘어서,2021.10.31. 오전 7:00,"세계 10대 부호 - 블룸버그 억만장자 리스트 갈무리(서울=뉴스1) 박형기 기자 = 세계최고의 부호인 일론 머스크 테슬라 최고경영자의 재산이 3000억 달러를 돌파한지 만에 이틀 만에 3100억 달러마저 돌파했다.블룸버그의 억만장자 지수에 따르면 30일(현지시간) 현재 머스크의 재산은 전일보다 93억 달러 불어 3110억 달러를 기록하고 있다. 이는 2위인 제프 베이조스 아마존 창업자(1950억 달러)보다 1000억 달러 이상 많은 것이다. 이는 테슬라의 주가가 연일 사상최고치를 경신하고 있기 때문이다. 테슬라는 전일(29일) 뉴욕증시에서 전거래일보다 3.43% 급등한 1114달러를 기록했다. 테슬라가 1100달러를 넘어선 것은 처음이다. 이로써 시총도 1조1190억 달러로 늘었다.



테슬라 일일(29일) 주가 추이 - 야후 파이낸스 갈무리머스크의 재산이 3000억 달러를 돌파한 것은 지난 28일이다. 28일 현재 머스크의 재산은 3020억 달러였다. 개인재산이 3000억 달러를 돌파한 것은 인류 최초였다. 불과 이틀 머스크의 재산이 3100억 달러마저 돌파한 것.머스크는 테슬라 지분 23%를 확보하고 있어 테슬라 주가가 상승하면서 그의 개인재산도 기하급수적으로 늘고 있다. 지난 25일 테슬라는 미국의 유명 렌터카 업체인 허츠가 2022년 말까지 테슬라의 전기차 10만 대를 구입할 것이라고 밝히자 사상 최초로 주가 1000달러를 돌파, '천슬라'를 달성했다. 시총도 1조 달러를 넘어섰다. 이후 테슬라의 주가는 연일 사상최고치를 경신하고 있다. 한편 머스크의 재산은 핀란드, 칠레, 베트남의 연간 국내총생산(GDP)보다 많다.",105,https://n.news.naver.com/mnews/article/421/0005691658?sid=103
"'BTS·오징어게임'에 반한 외국유학생들…""한국에서 살래요""[과학을읽다]",2021.10.31. 오전 8:52,"자료사진. 기사와 관련이 없음.""학위 취득 후에도 한국에서 연구 활동을 계속하고 싶어하는 우수한 외국 인재들이 많다. 그런데 영주권이나 국적 취득이 너무 까다롭다.""지난 28일 카이스트와 법무부가 개최한 '우수 외국인재 소통 간담회'에서 나온 니콜라이 카이스트 교수의 말입니다. 니콜라이 교수는 카이스트를 졸업한 후 미국에서 박사학위를 따고 한국에 다시 돌아와 지난해 특별 귀화해 현재 모교에서 학생들을 가르치고 있는 '특이한' 사례입니다. 미국이나 유럽의 자유로운 생활과 연구 환경을 동경해 갈수록 해외로의 인재 유출이 늘어나고 있는 상황에서 미국 출신 박사급 인재가 다시 한국으로 돌아 오다니 말이죠.그런데 '제2의 니콜라이 교수'들이 갈수록 늘어나고 있습니다. 법무부에 따르면 2011년부터 올해 9월까지 우리나라 국적을 취득한 우수 외국인재는 총 220명인데, 2010년대는 10명대에 머물렀지만 2016년 25명으로 늘어난 후 지난해에는 38명으로 대폭 늘어났습니다. 올해도 9월 말 현재 27명이나 되죠. 우리나라에서 공부 중인 석ㆍ박사 유학생 등 '잠재적' 우수인재도 석사 과정 2만2062명, 박사 과정 1만3445명 등 4만명에 육박하며, 교수, 전문가 등  전문 인력도 6000명이 넘습니다. 이중 카이스트에만 학사 421명, 석사 236명, 박사 266명, 연구원 79명, 교원 67명 등 총 1069명이 공부나 근무를 하고 있습니다. 우리나라는 2020년 기준 총 연구개발(R&D) 투자 규모가 세계5위에 달하며, 국민총생산(GDP) 대비 비율은 세계 2위에 달합니다. 과학기술 투자가 세계 최고인 국가에 인재들이 몰리는 것은 당연합니다. 게다가 선진국 문턱에 진입한 한국의 경제적, 문화적, 정치적, 사회적 수준이 높아지면서 선망의 대상이 되고 있는 점도 한 몫을 하고 있다고 생각합니다. 세계 최고로 안전한 치안, 편리한 교통, 첨단 ICT 기술이 구현된 인프라, 독특한 한식 문화, BTSㆍ블랙핑크ㆍ'오징어 게임' 등 문화 예술에 반해 한국에 살고 싶어하는 외국인들이 점점 많아지고 있죠.마침 우리나라는 인구 감소로 인해 산업계 인력 공급에 비상이 걸려 있습니다. 특히나 교육 시스템 등의 문제로 양질의 인력 공급은 부족한 상황에서 이같은 우수 외국인재들은 '가뭄 속 단비'와 같은 존재들이겠죠. 그렇다면 이들이 학계에서 갑질의 희생양이 되거나 처우ㆍ신분상의 불안으로 한국을 떠나는 일이 없도록 해야 할 것입니다. 미국 조차 과학기술자들이나 예술가 등 전문 인력들은 그 어렵다는 영주권·시민권을 원하기만 하면 척척 내주며 우수 인재 확보에 나서고 있습니다.하지만 현실은 어떨까요? 니콜라이 교수의 호소 말고도 아직까지 우리나라는 외국인에 대해 닫혀 있는 사회입니다. 최근 전북대의 사례가 대표적입니다. 이 학교 이 모 교수는 몽골 출신 박사과정 A씨에게 1년 6개월간 자녀의 주 3회 통원 치료를 시키는가 하면 '말을 안 듣는다'는 이유로 양말을 집어던지는 등 폭언을 서슴지 않았다. A씨의 논문에 자신의 형제들의 이름을 올리는 '도둑질'은 물론, 인건비 2400여만원을 편취하기도 했습니다. 마침 이날 법무부는 카이스트의 외국인 학생ㆍ교직원들에게 정착을 위한 지원을 강화하겠다고 약속했답니다. 말 뿐이 아닌 실제 정책으로 나타나 다문화 연구자들이 어울려 '공동체' 한국을 일궈 나가는 사회를 꿈꿔 봅니다.",105,https://n.news.naver.com/mnews/article/277/0004991665?sid=103
