title,date,main,section,url
"정부, '알뜰폰 분리' 없이 LG유플+CJ헬로 승인 …왜?",2019.12.15. 오후 12:01,"1사 1MVNO 깨고 새로운 기준점 제시, 3위 사업자 통한 시장 경쟁유도[아이뉴스24 김문기 기자] "" 1사 1 MVNO는 깨졌다. 알뜰폰 시장도 바뀌고 있다.""LG유플러스의 CJ헬로 인수의 최대 쟁점이 됐던 알뜰폰에 대한 정부의 분리 매각 등 조치는 없없다. 공정거래위원회에 이어 과학기술정보통신 역시 M&A에 따른 알뜰폰 경쟁 위축 등 우려에도 이의 물리적인 분리 매각 등 조치 보다 오히려 시장을 활성화 할 수 있는 조건 등에 방안을 찾았다.여기에는 알뜰폰 시장 역시 경쟁 상황이 변했고, 망 도매대가 인하 등 경쟁을 유도할 수 있는 지원방안 마련이 우선이라는 판단이 작용한 것으로 풀이된다. 이번 인허가 조건도 알뜰폰 활성화 등에 초점을 맞추는 등 정부 의지를 재차 확인시켰다는 평가다.15일 과학기술정보통신부(장관 최기영)는 지난 3월 LG유플러스가 CJ헬로 인수를 위해 신청한 주식취득 인가와 최다액출자자 변경승인 건에 대해 조건부 인가 및 변경승인 했다고 발표했다.



이태희 과기정통부 네트워크정책실장이 13일 서울정부종합청사에서 브리핑을 하고 있다이번 M&A로 LG유플러스는 이통 서비스 외에 자체 운영중인 알뜰폰에 더해 CJ헬로의 알뜰폰 서비스까지 확보하게 됐다. 기존 1사 1 MVNO(알뜰폰) 정책에 더해 독행기업 소멸 등 논란으로 이번 M&A관련 CJ헬로 알뜰폰 사업의 분리 및 매각 등 가능성과 주장이 집중 거론됐던 배경이다.그러나 이는 공정위 기업결합 심사에서도 제외됐고, 과기정통부 역시 분리매각 대신 활성화 방안에 중점을 뒀다. 도매대가 인하 등을 통한 시장 활성화 유도가 더 시급하다는 판단이 작용할 것으로 풀이된다. LG유플러스 측도 이에 맞춰 다양한 지원 등 상생안 마련에 적극 나선 것도 긍정적이었다는 평가다.이태희 과기정통부 네트워크정책실장은 브리핑을 통해 ""그동안 1사 1MVNO를 유지했던 게 사실이고, 그에 따른 (CJ헬로 알뜰폰) 분리매각과 형태적 조건 부과에 대한 심도있는 논의도 진행했다""며 "" 주안점 자체를 알뜰폰 시장 활성화와 이용자보호, 가계통신비 인하 등으로 보고 인수를 허용한 것""이라고 강조했다.이는 정부가 사실상 '1사 1MVNO' 원칙을 깨고, 향후 알뜰폰 시장의 인수합병 및 구도변화에 대한 기준도 시장 활성화와 이용자보호, 가계통신비 인하 3가지 핵심사안에 맞춰 검토하겠다는 의미와 정책 변화를 공식화 한 것으로 보인다.가령 KT가 KT엠모바일 이 외 또다른 MVNO를 두거나 SK텔레콤도 마찬가지로 SK텔링크 이 외 다른 MVNO 사업자를, 또는 MVNO와 MVNO간 결합 등이 신청됐을 때도 3가지 핵심기준을 통해 이의 허용을 검토하겠다는 뜻으로 풀이된다.실제로 과기정통부가 이번 LG유플러스에 부과한 알뜰폰 경쟁 여건 개선 관련 조건들 역시 이 같은 알뜰폰 시장 활성화 대책 방향과 의지 등을 확신시켰다.우선 LG유플러스에 기존 LTE 요금제뿐만 아니라 5G 요금제 모두 도매제공하도록 했다. 5G는 중저가 요금제가 출시될 수 있도록 도매대가를 인하하도록 했고,  LTE 요금제는 도매대가를 의무사업자 보다도 최대 4%포인트 더 인하하도록 했다. 종량제도 의무사업자 대비 평균 3.2% 인하된다.이태희 실장은 ""알뜰폰 행태적 조치로 LG유플러스의 알뜰폰 점유율이 늘면 SK텔레콤과 KT도 알뜰폰 시장에서 좀 더 낮은 요금제를 출시하는 등 경쟁 활성화에 도움이 될 것이라 판단한다""고 설명했다.현재 알뜰폰 도매제공의무사업자는 SK텔레콤이나 아직 5G 도매제공 기준은 마련된 게 없다.  SK텔레콤이 5G 도매제공 계획을 밝히기는 했으나 기존과 같은 의무제공사업자는 아닌 것.이에 LG유플러스에 5G 망을 도매제공토록 하고, SK텔레콤 등 보다 낮게 망을 도매제공토록 하면 SK텔레콤과 KT 역시 가격을 내릴 수밖에 없다는 얘기다.일각에서는 알뜰폰 1위 사업자인 CJ헬로가 LG유플러스로 넘어가면서, 경쟁사도 다수의 MVNO 인수에 나설 수 있어, 기간통신사업자의 지배력 전이 문제가 본격화 될 수 있다는 우려도 있다. 과기정통부는 이 같은 우려에도 선을 그었다.이태희 실장은 ""이번 조치가 중장기적으로 시장에 불리하게 작용할지 알 수 없으나 현재로선 알뜰폰 활성화와 이용자에게 도움이 될 것이라 판단했다""며 ""2010년 기간통신사업자 자회사의 알뜰폰 사업을 허용하면서 점유율을 50%로 제한했고, 이는 여전히 유효하다""고 강조했다.과기정통부는 유료방송과 통신의 인수합병이 지속적으로 발생할 수 있다고 판단, 앞으로도 공정위와 긴밀히 협력, 신속히 결정한다는 방침이다.김문기기자 moon@inews24.com▶네이버 채널에서 '아이뉴스24'를 구독해주세요.▶아이뉴스24 창간 20주년 인문기행 2020-바이칼 호수[ⓒ 아이뉴스24 무단전재 및 재배포 금지]",105,https://n.news.naver.com/mnews/article/031/0000518758?sid=103
[구자경 별세]고 구자경 명예회장 어록,2019.12.15. 오후 1:05,"고 구자경 LG 명예회장▲“기업의 사명은 끊임없는 자기 혁신”생산경제의 주체인 기업이 사회 속에서 그 역할을 다하는 길은 우선 기업 본래의 활동에 있어서 끊임없이 혁신함으로써 산업고도화를 이룩하는 것이고, 그런 과정을 통해 많은 사람들의 복된 생활과 사회복지에 기여하는 것이다.(1984.7 그룹사보 '럭키금성' 창간사 중에서)▲연구개발이 기업 성장의 요체기술우위를 통해 앞서가는 제품을 만들고, 품질에 대한 신뢰를 심어 나감으로써 시장을 개척해 나가는 것이 기업성장의 요체라고 생각한다. 기업활동이 하루 이틀하고 끝낼 일이 아니라면 역시 연구개발을 바탕으로 해서 끊임없이 새로운 제품을 기업화하고, 그 제품들이 품질면에서나 가격면에서 소비자들의 요구를 충족할 수 있도록 노력해야 기업이 영속적으로 살아 남고 꾸준히 성장할 수 있다.(1983.10. 전경련 최고경영자 과정 특강 '나의 기업경영과 경영철학' 중에서)▲미래를 향해 전력을 다해 뛰는 것이 기업활동미래지향적인 생각 없이는 모든 인간사의 발전은 결코 기대할 수 없다. 특히 기업경영에 있어서 가장 절실히 요구되는 불굴의 도전과 개척정신은 바로 미래지향적인 진취심에서 나오는 것이다. 기업은 과거에 얽매어서는 안됨은 물론이거니와 현재에 안주해서도 안 된다. 미래를 향해 전력을 다해 뛰는 것이 바로 기업활동이다.(1987.4 서울대 경영대학원 최고경영자과정 특강 '기업경영과 나' 중에서)▲기업은 인재의 힘으로 경쟁하고 인재와 함께 성장기업은 인재의 힘으로 경쟁하고 인재와 함께 성장한다. 기업의 궁극적 목표인 인류의 번영과 복지도 인재의 빛나는 창의와 부단한 노력에 의해서만 이룩될 수 있다, 인재 육성은 기업의 기본 사명이자 전략이요, 사회적 책임이다.(1988.11. 인화원 개원식 'LG 인재 육성의 뜻' 중에서)▲경영혁신은 종착역이 없는 여정경영혁신을 하면서 '여기까지가 끝이다'라고 하게 되면 그것이 곧 발전의 한계가 되고 만다. 경영혁신은 끊임없이 더 높은 목표를 지향하여 추구해야 하는 '종착역이 없는 여정'인 것이다.(1992, 저서 “오직 이 길 밖에 없다” 중에서)▲혁신은 영원한 진행형의 과제이며 내 평생의 숙원혁신은 종착역이 없는 여정이며 영원한 진행형의 과제이다. 신임 경영자들을 중심으로 혁신을 더욱 가속화해서 내 평생의 숙원과 우리 모두의 꿈을 반드시 이루어주기를 간절히 바란다.(1995.2. 구자경 회장 이임사 중에서)▲우리 그룹의 기본 마인드는 개척정신초창기부터 오늘날까지 우리 그룹은 개척자적 의지로 국내에 불모지였던 화학과 전기·전자, 에너지 산업을 선도해 왔으며, 이를 통해 국민경제 발전에 큰 기여를 했다고 자부한다.(2012. 저서 “오직 이 길 밖에 없다” 중에서)▲세계 최고가 있는 곳 어디든지 달려가 배우고 철저하게 우리 것 만들어야세계 최고가 있는 곳이면 어디든지 달려가서 배우고, 거기에 우리의 지식과 지혜를 결합해 철저하게 우리 것으로 만들어야 한다.(2012. 저서 “오직 이 길 밖에 없다” 중에서)권건호기자 wingh1@etnews.com▶ 네이버 모바일에서 [전자신문] 채널 구독하기▶ 전자신문 바로가기 [Copyright ⓒ 전자신문 & 전자신문인터넷, 무단전재 및 재배포 금지]",105,https://n.news.naver.com/mnews/article/030/0002857249?sid=103
“안드로이드폰도 와이파이 보안 강화”..암호화 기능 더해,2019.12.15. 오전 9:01,"KT, 와이파이 접속에 필요한 가입자고유정보(IMSI)에 암호화기능개인정보 보안 위해 아이폰 이어 안드로이드폰도 적용전국 KT 와이파이 적용 완료..갤럭시 S10 단말부터[이데일리 김현아 기자]



KT(회장 황창규)가 와이파이(WiFi) 접속 시, 가입자 정보 유출을 막는 ‘IMSI 프라이버시(International Mobile Subscriber Identity Privacy)’ 기능을 국내 최초로 안드로이드폰에 적용했다.IMSI는 국제적으로 이용하고 있는 가입자 고유의 식별번호다. IMSI 프라이버시 기능은 와이파이에 접속할 때 가입자 고유 정보를 암호화하여 단말과 와이파이 무선송수신장치(AP) 간에 공유하는 기술을 말한다. 인터넷국제표준화단체(IETF)에서 와이파이 IMSI 암호화 기능을 필수 기능으로 요구하고 있지 않음에도, 고객 개인 정보를 보호하기 위해 국제표준화단체(3GPP)의 IMSI 프라이버시 고도화 규격을 채택해 기술을 개발했다.IMSI 프라이버시 기능을 적용함에 따라, KT 고객은 전국 13만개의 KT 와이파이 존에서 KT 와이파이와 KT 기가 와이파이 등에 접속할 경우, 더 강화된 개인 정보 보안 환경에서 안전하게 와이파이를 이용할 수 있게 된다. 지난해 KT가 세계 최초로 상용화 한 최신 규격의 와이파이6(802.11ax)의 10 기가 와이파이(10 GiGA WiFi)가 설치된 스타벅스 리저브와 수원 KT 위즈파크에서도 자동으로 적용된다.삼성 갤럭시S10 LTE와 갤럭시S10 5G 단말에서 구글의 최신 운영체제(OS)인 ‘안드로이드10 OS’로 업데이트 하면 별도의 설정 없이 IMSI 프라이버시 기능이 적용된다. 향후 갤럭시노트10을 비롯해 신규로 출시된 단말에 확대 적용되며, LG전자 스마트폰은 내년에 ‘안드로이드10 OS’ 적용 단말에서 기능을 사용할 수 있다. KT 5G사업본부장 박현진 상무는 “KT는 ‘고객 최우선’을 핵심가치로 고객 개인 정보 강화에 힘을 쏟고 있다”며 “앞으로도 차별화된 기술력을 바탕으로 고객이 만족할 수 있는 서비스를 지속적으로 선보일 것”이라고 말했다.김현아 (chaos@edaily.co.kr)네이버 홈에서 ‘이데일리’ 뉴스 [구독하기▶]꿀잼가득 [영상보기▶] , 청춘뉘우스~ [스냅타임▶]＜ⓒ종합 경제정보 미디어 이데일리 - 무단전재 & 재배포 금지＞",105,https://n.news.naver.com/mnews/article/018/0004537057?sid=103
"과기정통부, LG유플러스의 CJ헬로 인수 승인···통신사·케이블TV 첫 결합",2019.12.15. 오후 12:02,"과학기술정보통신부가 LG유플러스의 CJ헬로를 조건부 승인했다.LG유플러스는 케이블TV 1위 CJ헬로를 인수해 유료방송 시장 점유율 24.8%를 차지, 시장 2위로 단숨에 뛰어오르게 됐다.정부가 통신사업자와 케이블TV 사업자간 기업결합을 승인한 첫 사례다.앞서 공정거래위원회가 교차판매 금지·알뜰폰 경쟁제한성 해소 조치 등 강력한 조건을 부과하지 않은 만큼 과기정통부 역시 분리매각 등 큰 조건을 부과하지 않았다.과기정통부는 LG유플러스가 CJ헬로를 인수하기 위해 신청한 주식취득 인가와 최다액출자자 변경승인 건에 대해 전기통신사업법과 방송법에 따라 심사한 결과 기업 결합을 승인하되, 공정 경쟁 및 이용자 보호를 위한 조건을 부과했다고 밝혔다.과기정통부는 LG유플러스가 실질적 알뜰폰 1위 사업자였던 CJ헬로 인수를 통해 가입자 약 122만 명에 이르는 압도적 1위 사업자로 올라선다.과기정통부는 알뜰폰 활성화·가계통신비 절감에 도움이 되는 방향으로 판단했다.이에 따라 LG유플러스가 알뜰폰 사업자에 요금제 중 완전 무제한 요금제를 제외한 5G·LTE 요금제를 모두 도매제공 하도록 했다. 데이터 선구매제 할인도 도입해야 한다. 알뜰폰에게 무선 다회선 및 유·무선 결합 할인을 LG유플러스와 동일하게 제공하고, 5G 단말기나 유심 구매 또한 동등 조건으로 구매 대행하도록 했다.이용자 보호를 위해 CJ헬로 알뜰폰 가입자에게 LG유플러스로 전환하도록 강요 및 유인하거나, 지원금을 차별 지급하는 행위도 금지했다.CJ헬로 또한 통신망 이원화 등을 조기 구축하게 했으며, 농·어촌 등 음영지역에 2022년까지 초고속인터넷 커버리지를 확보하도록 했다.방송분야에선 과기정통부는 전국사업자인 IPTV의 케이블TV 인수로 지역채널 시청규모 축소를 비롯한 실질적 지역성 약화 등을 우려해 조건을 부과했다.CJ헬로는 '8VSB(아날로그 요금으로 디지털 방송을 볼 수 있는 방식) 기본상품'에 지역채널을 포함하고, LG유플러스는 CJ헬로 지역채널 콘텐츠를 무료 VOD로 제공하도록 했다. 또 CJ헬로가 지역 콘텐츠 비중을 포함한 지역채널 운영계획을 수립하도록 했다.가격인상 가능성은 높지 않다고 봤다. 하지만 8VSB는 인상 가능성이 QAM에 비해 높으므로 8VSB 신규 가입 또는 연장을 지연·거부하거나 불리한 요금 부과 행위를 금지했다. 또 CJ헬로 가입자를 LG유플러스로 부당 전환하는 것을 방지하기 위해 8VSB 가입자의 QAM으로 전환 또는 케이블TV 가입자의 IPTV로 전환을 강요하는 행위도 금지했다.결합 이후에도 LG유플러스는 시장 2위 사업자로, 경쟁제한 가능성이 높지 않다고 판단했다. 다만 채널 구성·개편 과정에서 중소 방송채널사용사업자(PP)에게 부당한 영향력 행사를 방지하기 위해 PP의견을 반영한 평가기준 및 사용료 배분기준을 마련하고, 매년 PP 프로그램 사용료 지급 규모 및 전년 대비 증가율을 공개하도록 했다.이외에도 홈쇼핑 포함 PP와 협상 시 CJ헬로와 LG유플러스가 별도 협상을 진행하고, 매년 PP 사용료 및 홈쇼핑 송출수수료 규모와 증가율을 공개하도록 했다.이용자 편익을 위해서는 방송구역별 차이에 따른 8VSB 상품 수(종류) 및 상품별 채널 수 격차를 해소하도록 했다. 아울러 제공 중인 장애인, 기초생활수급자 요금 감면과 장기약정, 결합상품에 요금 할인을 유지하도록 했다.승인 결정에 따라, LG유플러스는 과기정통부로부터 인수 효력이 발생하는 처분 통지 공문을 최종적으로 받아야 한다.LG유플러스는 24일 CJ헬로 주주총회를 통해 사명을 'LG 헬로비전'으로 변경, 송구영 신임 대표를 비롯한 사내이사를 선임할 예정이다.주주총회 이후 LG유플러스가 CJ ENM에 총 금액 8000억원 중 계약금을 제외한 잔금을 지불하면 인수 절차가 공식적으로 마무리된다.하현회 LG유플러스 부회장은 “통신방송 시장의 자발적 구조개편으로 산업이 활성화되도록 정부가 CJ헬로 인수를 승인한 데 환영한다”며 “요구 사항을 성실히 이행하겠다”고 밝혔다.이어 “이번 인수를 바탕으로 LG그룹 통신 사업 역사 제 2의 도약을 이루겠다”며 “두 배로 확대된 유료방송 가입자를 기반으로 유무선 경쟁 구조를 재편하고, 다양한 융복합 서비스를 발굴하겠다”고 강조했다.〈표〉 LG유플러스-CJ헬로 인수 일지



정예린기자 yeslin@etnews.com▶ 네이버 모바일에서 [전자신문] 채널 구독하기▶ 전자신문 바로가기 [Copyright ⓒ 전자신문 & 전자신문인터넷, 무단전재 및 재배포 금지]",105,https://n.news.naver.com/mnews/article/030/0002857235?sid=103
