title,date,main,section,url
"카카오택시 따라잡기 쉽지 않네… 우티, 이용자 늘리기 난항",2022.12.05. 오후 4:01,"프로모션 확대에도 11월 이용자 감소이용자 수십 배 많은 카카오는 계속 성장택시 기사 앱 MAU도 1년 새 36% 줄어”서비스 먹통에도 익숙한 카카오T로 돌아가”가맹 택시 확대, 고객 편의 서비스 적극 도입



우티 로고. /우티 제공        택시 애플리케이션(앱) 호출 시장에서 우티가 고전을 면치 못하고 있다. 카카오의 택시 호출 시장 독점을 막기 위해 우티는 가맹 택시 수를 늘리고 기사 대상 프로모션을 확대했지만, 이용자 수는 오히려 줄어들면서 부진한 모습이다.5일 앱 정보 업체 모바일인덱스에 따르면 택시 기사들이 사용하는 우티 기사 앱의 지난 11월 월간 활성 이용자 수(MAU·iOS+안드로이드)는 6만1731명으로, 전년 동기 9만6554명 대비 36.1% 줄었다. 이는 같은 기간 카카오T 기사 앱 MAU가 6.1%(16만2077명→15만2236명) 감소한 것과 비교해 부진한 성적이다. MAU는 한달동안 얼마나 많은 유저가 앱을 사용했는지 확인할 수 있는 중요한 앱 평가 지표다.소비자들이 사용하는 우티 앱의 MAU도 지난 11월 49만6396명으로, 지난해 11월 50만69명에서 0.7% 감소했다. 반면 카카오모빌리티의 카카오T 앱의 지난 11월 MAU는 1170만8625명으로 1년 새 3% 늘었다. 이용자 수 차이가 수십 배에 달하는 상황에서도 카카오 이용자 수는 늘어난 반면 우티는 줄어든 것이다.



서울역 택시 승강장에 카카오택시가 대기하는 모습. /연합뉴스        우티는 우버와 티맵모빌리티가 합작해 만든 택시 플랫폼이다. 지난해 11월 통합 앱을 출시하면서 카카오를 대체할 택시 서비스로 주목받으면서 택시 앱 호출 시장 2위를 기록 중이다. 지난달 15일 카카오 서비스 먹통 사태 당시 우티는 양대 앱 마켓 인기 순위 2위에 오르기도 했다.그러나 우티의 인기는 오래가지 못했다. 우티의 일간 활성 이용자 수(DAU·iOS+안드로이드)는 카카오 먹통 당일과 다음날 각각 14만7734명, 9만2305명으로 평소 대비 3~4배 치솟았지만, 이틀 만에 기존 수치로 내려갔다. 지난 10월 우티 앱 MAU는 64만5411명으로 전월 대비 39.8% 급증했지만, 한 달 만에 23.1% 하락하면서 다시 50만명 아래로 내려왔다.업계는 카카오 서비스 먹통을 경험한 소비자들이 카카오T를 대신할 서비스로 우티를 선택했지만, 서비스가 정상화되면서 익숙한 카카오T로 되돌아간 것으로 보고 있다. 모빌리티 업계 관계자는 “카카오가 다양한 서비스로 소비자를 묶어두는 락인(lock-in·특정 제품이나 서비스에 소비자를 묶어두는 것) 효과를 잘 보여주는 사례다”라며 “서비스 먹통이 장기화됐다면 소비자 이탈이 빨라질 수 있었겠지만, 실제 먹통은 하루 정도에 불과해 대세를 바꾸는 데는 한계가 있었다”라고 했다.



우티 프로모션 포스터. /우티 제공        우티는 탑승 전 요금을 결정하는 사전 확정 요금제, 시간대에 따라 요금제가 달라지는 탄력요금제, 택시 합승 서비스 등 고객 편의를 높이는 차별화된 서비스로 점유율을 높여간다는 전략이다. 우티의 가맹 택시 수는 1만여대로, 우티는 올해 말까지 2만대로 늘린다는 계획이다.우티는 택시 기사 확보에도 열을 올리고 있다. 가맹 택시를 늘려야 배차 시간을 줄여 양질의 서비스를 제공할 수 있기 때문이다. 이를 위해 우티는 요금과 상관없이 손님을 태울 때마다 인센티브를 지급하는 택시 기사 대상 프로모션을 진행 중이다.",105,https://n.news.naver.com/mnews/article/366/0000859969?sid=103
"임윤찬, 데카와 전속 계약…“오직 음악만을 위해 살아갈 것”",2023.10.19. 오전 10:07,"피아니스트 임윤찬이 클래식 명문 레이블 데카(Decca)와 레코딩 전속 계약을 체결했습니다. 유니버설뮤직 산하 레이블 데카는 “오랜 시간을 노력한 끝에 임윤찬과 레코딩 계약을 체결했다”며 “데카 공식 데뷔 앨범은 내년 봄에 나올 예정”이라고 밝혔습니다. 1929년 영국에서 설립된 데카는 지휘자 게오르그 솔티, 성악가 루치아노 파바로티, 피아니스트 블라디미르 아시케나지, 바이올리니스트 정경화와 같은 세계 정상급 아티스트들의 음반을 남긴 레이블입니다. 임윤찬은 데카와의 전속 계약에 대해 “데카는 너무나도 많은 전설적인 음악가들과 같이 일해왔기에 정말 음악가로서 좋아할 수밖에 없는 레이블”이라고 소감을 밝혔습니다. 이어 “오직 음악만을 위해서 살아갈 것이며, 음악을 위해서라면 다른 모든 것들을 포기하리라 다짐했다”며 “내 음악이 더욱 깊어지기를 바랐고, 이 바람이 관객들에게 닿았다면 만족한다”고 말했습니다. 임윤찬은 지난해 6월 밴 클라이번 콩쿠르에서 18세 나이로 역대 최연소 우승을 차지하며 국제 무대에 자신의 이름을 알렸습니다.  임윤찬이 밴 클라이번 콩쿠르 결선에서 연주한 라흐마니노프의 피아노 협주곡 3번 영상은 유튜브에서 조회수 1천200만회를 기록했습니다.  데카의 도미닉 파이프 레이블 디렉터 및 헬렌 로저스 총괄 프로듀서는 “우리는 임윤찬과 함께 데카의 새로운 장을 열고자 한다”며 “이는 피아니스트들의 황금기를 떠올리게 함과 동시에, 진정으로 탁월한 것이 무엇인지에 대한 기준을 세우는 장이 될 것”이라고 임윤찬과 함께하게 된 소감을 전했습니다.  데카는 전속 계약 발표와 함께 임윤찬이 리스트의 ‘사랑의 꿈’을 연주한 모습을 시작부터 끝까지 중간에 끊지 않고 원테이크로 촬영한 영상을 유튜브 임윤찬 채널에 공개했습니다.[사진 출처 : 연합뉴스 / 유니버설뮤직 제공]■ 제보하기▷ 전화 : 02-781-1234, 4444▷ 이메일 : kbs1234@kbs.co.kr▷ 카카오톡 : 'KBS제보' 검색, 채널 추가▷ 네이버, 유튜브에서 KBS뉴스를 구독해주세요!",105,https://n.news.naver.com/mnews/article/056/0011584973?sid=103
"네이버웹툰, 시각장애인 웹툰 감상 돕는 기술 첫 공개",2022.12.05. 오후 1:00,"5일 제10회 ‘널리 웨비나’서 웹툰 대체 텍스트 제공 기술 공개‘배리어프리 웹툰’ 첫발…18만개 회차에 적용해 내년 1월 베타 시작화자 추론 및 대사 없는 컷의 대체 텍스트 제공 기능까지 개발 목표



윤승섭 네이버웹툰 기획자가 5일 열린 ‘제10회 2022 널리 세미나’ 웨비나에서 ‘시각 장애인들의 웹툰 감상을 위한 작지만 큰 진전’을 주제로 발표를 진행하고 있다. ⓒ네이버웹툰[데일리안 = 민단비 기자] 네이버웹툰이 시각장애인의 웹툰 감상을 돕는 인공지능(AI) 기술을 공개했다. 네이버웹툰은 이 기술을 18만개 웹툰에 적용해 내년 1월 배리어 프리 웹툰 베타 서비스를 시작한다.네이버웹툰은 5일 열린 정보 접근성 기술과 노하우를 공유하는 행사인 ‘제10회 2022 널리 세미나: 현재를 넘어, 새로운 세상으로의 접근’ 웨비나에서 AI 기술을 활용한 웹툰 대체 텍스트 제공 기술을 처음 공개했다.네이버웹툰은 완결 및 연재 중 회차 약 18만개에 웹툰 대체 텍스트를 적용해 내년 1월 배리어프리(Barrier Free) 웹툰 베타 서비스를 시작하고 이용자의 의견을 반영해 서비스를 보완해 나갈 예정이다. 배리어프리 웹툰 베타 서비스는 우선 한국어에만 적용되며 향후 서비스 언어를 점차 확대할 계획이다.최근 웹툰 속 장면이나 대사는 ‘밈(인터넷 유행 콘텐츠)’이 될 정도로 생활에 깊숙하게 관여하고 있을 뿐만 아니라 웹툰을 원작으로 하는 영상 콘텐츠가 늘어남에 따라 원작 웹툰 감상에 대한 수요가 커졌다. 이처럼 웹툰이 대중문화의 한 장르로 자리매김하면서 네이버웹툰은 소외된 이용자 없이 모든 이용자가 웹툰을 즐기고 감상할 수 있는 환경을 만들기 위해 지난해 하반기부터 대체 텍스트 자동 제공 기능 개발에 착수하기 시작했다는 설명이다.이날 ‘시각 장애인들의 웹툰 감상을 위한 작지만 큰 진전’을 주제로 발표를 진행한 윤승섭 네이버웹툰 기획자는 “장애인과 비장애인 사용자를 나누지 않고 모든 사용자라는 관점에서 고민을 이어간 결과 어렵지만 시도해보자라는 결정을 내릴 수 있었다”고 서비스 기획 의도를 밝혔다.시각장애인에게 웹툰 정보를 전달하기 위해서는 웹툰의 이미지 정보를 텍스트 정보로 변환시키고 이를 다시 청각 정보로 변환시키는 과정이 필요하다. 네이버웹툰은 수천 개에 달하는 완결된 작품들과 매주 새롭게 추가되는 수백 개 회차의 이미지 정보를 빠르게 텍스트 정보로 변환시킬 수 있는 방법을 찾는 것에 집중했고, 1년여의 연구 끝에 ‘AI를 활용한 웹툰 대체 텍스트 자동 제공’ 기술을 개발했다. 텍스트 정보를 청각 정보로 변환 시키는 과정은 스마트폰 운영체제(OS)에서 기본으로 제공하는 ‘보이스오버’나 ‘톡백’ 기능으로 가능하다.웹툰 대체 텍스트 자동 제공은 크게 ▲컷 나누기 ▲대사 영역 추론 ▲대사 추출 ▲대사 순서 결정의 네 가지 단계를 거쳐 완성된다. 네이버웹툰이 활용한 기술은 ‘OCR(광학문자인식)’과 ‘웹툰 오브젝트 디텍션’ 기술이다.웹툰은 대부분 세로로 긴 스크롤 방식으로 제공되기 때문에 한 회차의 이미지 크기가 굉장히 크다. 따라서 대사 영역을 추론하고 텍스트를 추출하는 과정에 앞서 컷 나누기 작업이 반드시 선행되어야 한다. 특히 이 과정에서 대사, 말풍선, 컷 라인이 훼손되지 않게 컷을 잘 나눠야 이후 대사를 순서대로 나열할 수 있다. 네이버웹툰은 이를 해결하기 위해 컷, 말풍선, 대사 영역 등을 추론하는 웹툰 특화 객체 탐지 기술 ‘웹툰 오브젝트 디텍션’을 개발했다.컷 나누기 이후에는 웹툰 오브젝트 디텍션을 이용해 대사 영역을 추론한다. 웹툰은 스토리가 전달되어야 한다는 특성 때문에 말풍선의 순서를 명확하게 인식해야 하며, 말풍선과 말풍선 밖의 대사도 구별할 수 있어야 한다. 또한 건물 간판처럼 배경에 삽입된 텍스트가 대체 텍스트에 포함되면 스토리 전달을 방해할 수도 있다. 범용적인 OCR만으로는 서로 다른 말풍선과 컷의 단어를 하나의 문장으로 인식하는 경우가 발생해 대사의 순서가 섞이는 결과가 발생한다. 네이버웹툰은 웹툰 오브젝트 디텍션으로 대사 영역을 먼저 추론하는 작업을 진행해 이 같은 오류를 줄였다.웹툰 오브젝트 디텍션을 통해 추론한 대사 영역의 OCR 결과로 텍스트를 추출하고 추론한 말풍선과 컷의 위치 정보를 활용해 대사 순서를 결정하는 과정을 거치면 웹툰 대체 텍스트가 완성된다.네이버웹툰은 대사를 누가 했는지 알 수 있는 화자 추론 기능과 대사가 없는 컷에도 대체 텍스트를 제공하는기능을 개발하는 것을 장기 목표로 삼고 있다.‘AI로 만드는 웹툰 대체 텍스트’ 발표를 진행한 박준현 네이버웹툰 AI 연구원은 “현재 버전의 대체 텍스트 자동 생성 기술은 아직 초기 단계로, 스토리 전달을 완벽하게 할 수 있는 대체 텍스트를 만들기 위해 계속 도전하고 연구를 진행할 것”이라고 말했다.﻿﻿﻿



박준현 네이버웹툰 AI연구원이 5일 열린 ‘제10회 2022 널리 세미나’ 웨비나에서 ‘AI로 만드는 웹툰 대체 텍스트’ 발표를 진행하는 모습. ⓒ네이버웹툰이어 ‘AI에서 서비스까지’를 주제로 발표한 이지훈 네이버웹툰 AI 엔지니어는 “AI 기술을 통해 지속 가능한 방식으로 다양한 정보의 접근성을 지원할 수 있을 것으로 기대한다”며 “접근성에 대한 사회적 요구 증가는 궁극적으로 우리 모두를 위한 방향성”이라며 발표를 마무리했다.김대식 네이버웹툰 AI 리드는 “대체 텍스트 제공은 네이버웹툰이 중요하게 생각하는 ‘다양성’이라는 가치를 지키기 위한 기술적 노력의 일환”이라며 “네이버웹툰은 장애나 언어 등의 장벽 없이 누구나 웹툰을 창작하고 감상할 수 있는 환경 구축을 위해 글로벌 1위 스토리테크 플랫폼으로서의 책임과 노력을 다하겠다”라고 밝혔다.



이지훈 네이버웹툰 AI 엔지니어가 5일 열린 ‘제10회 2022 널리 세미나’ 웨비나에서 ‘AI에서 서비스까지’를 주제로 발표하는 모습. ⓒ네이버웹툰",105,https://n.news.naver.com/mnews/article/119/0002664214?sid=103
"위미르-인그리드, 디지털트윈기반 TMS 환경정보 플랫폼 'NOx 측정 장치' 개발",2022.12.05. 오후 2:51,"[이데일리 이윤정 기자] 위미르와 인그리드는 개별설비 대기오염물질 측정을 위한 설비 부착용 NOx 측정 장치를 개발했다고 5일 밝혔다. 



(사진=위미르)환경오염 대기관리권역(4개 권역 8개, 특·광역시와 69개 시군)에 포함된 창원시의 사업장은 대기오염물질 총량 관리제도에 따라 의무적으로 TMS의 구축이 필요하다.TMS는 법적 허용치 초과 시 설비 전체를 가동 중단해야 하는 문제로 생산의 차질이 우려되는 문제를 해결하기 위해‘굴뚝 자동 측정기’로 굴뚝에서 나오는 기체의 오염도를 실시간 측정하고, 데이터를 관제소로 전송하여 오염도를 통제할 수 있도록 하는 설비다.이번에 개발된 NOx 측정 장치는 설비별 초과배출량 사전 확인을 통한 설비 전체 가동 중단 문제 해결에 따른 생산 차질 대폭 감소하며 설비운전 시 즉각 조치로 배출량 초과 방지 효과 (부과금 회피) 및 현장 작업자의 배출량 저감을 위한 운전개선 활동 Insight 제공으로 설비개선 비용을 절감할 수 있다.위미르(주)와 ㈜인그리드는 화학, 정유 및 발전소 등 대기오염물질 관리가 필요한 산업시설을 대상으로 확산 공급을 추진하여 사업화 가능, 탄소저감 표준화 기술 시장을 선점할 계획이다.",105,https://n.news.naver.com/mnews/article/018/0005380902?sid=103
"전자신문, 엘솔루 'AI번역서비스' 구축 계약 체결",2022.12.05. 오후 4:14,전자신문과 엘솔루(옛 시스트란 인터내셔널)가 5일 서울 서초구 전자신문사에서 '글로벌 독자를 위한 AI 번역서비스 구축' 계약을 체결했다. 전자신문은 이번 AI 시스템 구축으로 오는 12일부터 모든 기사에 대한 실시간 영문 번역 시범 서비스를 시작한다. 양승욱 전자신문사 사장(왼쪽)과 김우균 엘솔루 대표.,105,https://n.news.naver.com/mnews/article/030/0003063762?sid=103
올해 유튜브 최고 인기 동영상은 '에버랜드 소울리스 좌',2022.12.05. 오전 11:16,"유튜브, 2022년 화제 모은 인기 동영상 및 크리에이터 발표유튜브가 올해 화제가 됐던 상위 10위 인기 동영상과 크리에이터를 5일 발표했다. 가장 인기를 얻은 동영상은 '소울리스 좌'란 별명을 얻으며 주목을 받은 티타남의 '에버랜드 아마존 N년차의 멘트! 중독성 갑'으로 나타났다.



유튜브 2022 국내 최고 인기 동영상 상위 10위(TOP 10) [사진=유튜브]이 동영상은 놀이기구 탑승을 안내하는 경쾌한 리듬의 노래와 일관적인 톤으로 속사포 랩을 하는 에버랜드 직원의 모습이 묘한 조화를 이루며 주목을 받았다. 영상의 주인공은 영혼이 없는 듯하지만 프로페셔널한 모습으로 많은 직장인의 공감을 사며 '소울리스 좌'라는 별명을 얻기도 했다.이와 함께 음악 콘텐츠도 상위권을 차지했다. 딩고 뮤직의 가수 태연 라이브 영상이 올해 최고 인기 동영상 2위를 기록했고 3위에는 걸그룹 뉴진스의 퍼포먼스를 원테이크로 촬영한 KBS '뮤직뱅크' 콘텐츠가 이름을 올렸다.다양한 토크쇼 콘텐츠도 인기였다. 가수 이영지가 진행하는 '차린건 쥐뿔도 없지만' 채널의 콘텐츠와 스튜디오 와플의 배우 주현영 토크 편 등이 인기를 끌었다.올해 국내 이용자가 가장 많이 시청한 쇼츠(짧은 영상)에는 1분요리 뚝딱이형이 마늘보쌈을 요리하는 '한국에서 10년 산 외국인도 보고 기겁한 한국음식 1위'가 뽑혔다.인기 뮤직비디오 1위는 가수 임영웅의 '다시 만날 수 있을까'가 차지했다. 가수 임영웅은 지난해에 이어 2년 연속 1위를 기록했다. 이밖에 동명의 드라마 OST로 주목을 받은 '우리들의 블루스', 산뜻한 멜로디로 편안함을 주는 노래 '무지개(Rainbow)'가 각각 5위, 10위에도 이름을 올리며 인기를 입증했다.구독자 수 변동을 기준으로 매긴 국내 최고 인기 크리에이터 상위 10위에는 숏박스와 너덜트가 각각 1위와 2위를 기록했다. 일상 소재를 재치 있는 짧은 영상으로 구성한 '코믹 숏무비' 또는 '스케치 코미디' 장르를 흥행시키며 누구나 공감할 수 있는 대사와 상황으로 웃음을 전했단 평가다.아울러 2022년 구독자 수 변동을 기준으로 전년 대비 200% 이상 성장한 국내 급성장 크리에이터 상위 10위 중 1위는 '빵쏭'이 차지했다. '미용실 갔다가 머리 망했을 때'나 '점심 메뉴 고르기 어려울 때' 등 일상 속 다양한 상황에 어울리는 노래를 선보이며 공감과 재미를 얻었다.",105,https://n.news.naver.com/mnews/article/031/0000714730?sid=103
"크래프톤, 에픽게임즈 스토어에 '배틀그라운드' 출시",2022.12.05. 오전 10:19,"배틀그라운드[크래프톤 제공. 재판매 및 DB 금지]    (서울=연합뉴스) 김주환 기자 = 크래프톤은 'PUBG: 배틀그라운드'를 글로벌 온라인 게임 플랫폼인 에픽게임즈 스토어에 정식 출시한다고 5일 밝혔다.    배틀그라운드의 에픽게임즈 스토어 버전은 오는 8일부터 플레이 가능하며, 스팀 이용자들과 교차 플레이가 가능하다.    배틀그라운드는 2017년 스팀 플랫폼에 처음 출시된 이래 카카오게임즈와의 퍼블리싱, 플레이스테이션·엑스박스 버전 출시 등으로 플랫폼을 넓혀왔다.    크래프톤은 에픽게임즈 스토어 이용자들에게 오는 6일부터 다음 달 5일까지 인게임 아이템으로 구성된 '파운더스 팩'을 제공하고, 이밖에 특별한 아이템을 얻을 수 있는 '스타터 팩'과 '특별보급 이벤트' 등을 마련했다고 덧붙였다.    jujuk@yna.co.kr",105,https://n.news.naver.com/mnews/article/001/0013623255?sid=103
"LG유플러스, 국제 스마트항만 컨퍼런스에 B2B 솔루션 전시",2022.12.05. 오전 11:32,"LG유플러스 전시부스LG유플러스가 6일부터 이틀간 울산시 울산전시컨벤션센터에서 열리는 '2022 조선·해운·항만 디지털전환 국제 콘퍼런스'에 참가해 항만 디지털트윈과 스마트팩토리 솔루션을 소개한다.LG유플러스는 이번 행사의 공동주관사인 울산항만공사 초청으로 참여했다. 양측은 지난 7월 울산항을 '에코 스마트항만'으로 조성하기 위한 업무협약을 체결했다.LG유플러스는 스마트항만, 스마트팩토리, 환경·안전 솔루션, 기업전용망 등 4개 분야 상품과 기술을 전시한다. 항만의 실제 모습을 그대로 재현해 3차원 가상 세계를 만드는 '항만 디지털트윈'은 최근 구축이 완료된 부산신항의 사례를 영상으로 제작, 운영장비 및 차량을 실시간 관제하는 시뮬레이션을 선보인다. 스마트팩토리 솔루션 분야는 △공장 내 설비의 교체 시기를 확인할 수 있는 '모터진단' △인공지능(AI)이 정상적인 생산라인을 학습해 제조 과정에서 발생하는 이상상황을 감지하는 '생산라인 이상감지' 등으로 구성된다.'5G 전용망' '5G 동글' 등 스마트팩토리 구현에 기본이 되는 솔루션을 비롯해 작업자 안전을 지원하는 '지능형 폐쇄회로(CC)TV'나 공사 현장에서 중대 재해를 예방할 수 있는 '스마트 안전장구 4종(스마트헬멧·안전고리·안전벨트·안전비콘)' 등 LB2B 솔루션도 전시한다.권근섭 LG유플러스스마트팩토리사업담당은 “울산항만공사와 탄탄한 협력 네트워크를 통해 울산항을 발전시키는 것은 물론 국내 항만 솔루션을 해외에 알리는 데 기여하겠다”고 밝혔다.",105,https://n.news.naver.com/mnews/article/030/0003063613?sid=103
"실내 마스크 해제 논란 키우며 중앙부처와 충돌하는 지자체...전문가 ""시기상조""",2022.12.05. 오후 6:00,"대전시, 충남도 해제 움직임에 방역당국 '반대' 표명전문가, 계절 특성과 독감 유행 등 ""서둘러선 안 돼""



정기석 중앙재난안전대책본부 코로나19 특별대응단장이 16일 정부서울청사 브리핑실에서 코로나19 대응 현황 등을 브리핑하고 있다.     연합뉴스 제공    대전시에 이어 충청남도가 자체적으로 실내 마스크 착용 의무화 해제를 추진하면서 중앙부처의 기조와 충돌을 빚고 있다. 방역 전문가들은 실내 마스크 의무 해제는 코로나 확진자와 사망자 증가로 이어질 수 있는 만큼 시기상조라는 우려를 내놓고 있다. 자칫 실내 마스크 의무 해제가 코로나 재유행과 트윈데믹(코로나19와 독감의 동시 유행)을 불러오는 불쏘시개가 될 수 있다는 지적이다. 최근 대전시와 충남도는 실내 마스크 착용 실효성에 의문을 제기하며 자체적으로 해제하겠다고 예고했다. 대전시는 오는 15일까지 실내 마스크 의무를 해제하지 않으면 자체 행정명령을 통해 해제하겠다고 방역 당국에 통보했다. 대전시는 해제 이유로 식당, 카페 등에서 이미 대부분 마스크를 벗고 취식을 하고 있어 정책의 실효성이 떨어지고, 아이들의 정서·언어 발달에 도움이 되지 않는다는 점을 들었다. 이장우 대전시장은 앞서 지난달 30일 ""12월 중 정부 차원의 결정이 없을 경우 내년 1월 실내 마스크 착용 자율화를 추진하겠다""고 밝혔다.충남도도 이날 실내 마스크 착용 해제 계획을 밝혔다. 김태흠 충남도지사는 이날 실국원장 회의에서 ""실내 마스크 착용 의무가 코로나19 예방에 얼마나 효과가 있는지 의문""이라며 ""마스크 착용을 자율에 맡기는 게 바람직하다""고 말했다. 김 지사는 그러면서 ""해외 출장으로 미국, 유럽 등을 다녀보니 외국은 실내 마스크 착용이 의무화돼 있지 않았다""면서 ""경제협력개발기구(OECD) 국가 중 실내 마스크 착용 의무를 유지하는 나라는 우리가 유일하다""고 해제 이유를 설명했다.권성동 국민의힘 의원도 이날 페이스북을 통해 ""대한민국도 실내 마스크 착용 의무 해제를 즉시 준비하자""며 ""적어도 내년 1월 말에는 의무해제 검토가 아닌 시행을 전제로 대책 마련에 나서야 한다""고 밝혔다. 이에 대해 방역 당국은 곤혹스럽다는 입장이다. 동절기 코로나와 독감 유행이 안정화된 이후 실내 마스크 착용 해제 여부를 검토하겠다고 밝힌 상황에서 관련 논란이 불거졌기 때문이다. 정기석 코로나19 특별대응단장 겸 국가감염병위기대응자문위원장은 이날 ""실내 마스크 해제를 추진할 경우 확진자와 사망자가 늘어날 것인 만큼 신중히 접근해야 한다""고 반대의사를 명확히 했다.방역 전문가들도 실내 마스크 해제에 반대 목소리를 내고 있다. 류충민 한국생명공학연구원 감염병연구센터장은 ""독감이 유행하는 겨울철에 실내 마스크 해제는 시기상조라 생각한다""며 ""마스크 착용은 독감뿐 아니라 코로나 감염을 예방해 트윈데믹에 따른 사회적 비용을 줄일 수 있어 코로나 종식 때까지 유지돼야 한다""고 밝혔다. 유승민 을지대 의대 학장은 ""코로나 확진자와 위중증 환자, 사망자가 줄지 않는 상황에서 실내 마스크 해제는 유행을 키우는 요인이 될 수 있다""면서 ""외국은 백신 접종률이 높아 감염률이 비교적 낮은 우리나라와 달리 자체 감염 비중이 높아 실내 마스크 의무를 해제한 것인 만큼 우리와 비교하는 것은 무리가 있다""고 주장했다. 한편 방역당국은 오는 15일과 26일 공개토론회를 열고 실내 마스크 해제 여부를 논의할 계획이다.",105,https://n.news.naver.com/mnews/article/029/0002770751?sid=103
