title,date,main,section,url
검은 바탕 금빛 한자… 光化門 현판도 새 모습,2023.10.15. 오후 6:21,"광화문 월대 복원·현판 공개왕실 행사 무대이자 소통 장소“50m 월대, 유적을 잇는 출발점”해태상 월대 전면부로 위치 이동다른 전각 현판처럼 검정으로복원 논란 마침표 찍을지 주목



15일 서울 종로구 광화문광장에서 열린 광화문 월대 및 현판 복원 기념식을 찾은 시민들이 새 현판이 걸린 광화문을 배경으로 기념사진을 찍고 있다. 문화재청은 이번 복원에서 과거 부재 40여점을 활용하고, 난간 양쪽을 장식하던 각 석조물과 광화문 앞 해태(해치)상 등의 위치도 조정했다. 2010년부터 광화문에 걸려 있던 현판을 철거하고 검은 바탕에 금색으로 쓴 새 현판으로 교체했다. 홍윤기 기자중요한 행사가 있을 때 임금이 백성과 만나던 ‘역사의 길’이 100여년 만에 다시 열렸다. 광화문을 나타내는 이름표인 현판도 새로 태어난다.15일 서울 광화문 앞 광장에서 월대(越臺, 月臺)와 금빛 이름을 새긴 광화문 현판이 시민들에게 공개됐다. 월대는 궁궐, 종묘 등 중요한 건물의 앞에 넓게 설치한 대를 가리킨다. 건축물을 울타리처럼 두르는 석조물 난간석을 양쪽에 둬 건물의 위엄을 높이는 동시에 왕실의 주요 의례나 만남 등 각종 행사가 펼쳐지는 무대로도 썼다. 임금과 백성이 만나 소통하는 장소이기도 했으나 1910년 일제가 식민 통치의 정당성을 알리는 행사를 열고 1923년 이후 선로가 놓이면서 제 모습을 잃었다.문화재청은 2006년부터 광화문을 복원·정비하는 사업을 추진해 왔다. 조사 결과 광화문 월대는 길이 48.7ｍ, 폭 29.7ｍ 규모로 육조 거리를 향해 뻗어 있었고, 중앙 부분에 임금이 지나도록 만든 길을 가리키는 어도가 7ｍ 정도 있었던 것으로 확인됐다.



‘임금의 길’ 광화문 월대 100년 만에 복원 - 15일 서울 종로구 광화문 앞 광장에서 진행된 광화문 월대 및 현판 복원 기념식에서 시민들이 월대를 지나 경복궁으로 향하고 있다. 월대는 임금이 중요한 행사 때 백성과 만나던 넓은 대 형태의 길이다. 일제강점기 때 소실됐다가 문화재청이 2006년부터 진행한 복원 작업을 마무리하고 공개했다. 검은 바탕에 금색으로 한자를 쓴 광화문 현판도 이날 함께 내걸었다. 홍윤기 기자고종(재위 1863~1907) 때 경복궁을 중건하면서 남긴 기록인 ‘영건일기’와 각종 사진 자료를 토대로 보면 광화문 월대는 여러 차례 변화 과정을 겪었다. 이번 복원에서는 과거 부재 40여점을 활용했다. 조선왕릉 난간석 연구로 박사 학위를 받은 전나나 국립대한민국임시정부기념관 학예연구사의 논문이 실마리가 됐다. 문화재청이 이를 토대로 조사한 결과 동구릉에 모여 있던 난간석과 용두석(龍頭石·용의 머리를 연상시키는 석조물) 등 40여점이 원래 광화문에 있었던 것으로 확인됐다.난간 양쪽을 장식하던 각 석조물도 제자리를 찾았다. 모두 19점의 난간석이 미세하게 다른 점을 확인해 각각의 위치를 특정할 수 있었다.이건희 삼성그룹 선대 회장 유족 측이 기증한 동물 조각상인 서수상(瑞獸像·상서로운 동물상) 한 쌍도 복원 과정에 큰 힘이 된 것으로 알려졌다. 오랜 기간 경기 용인 호암미술관 야외 전시장에 있었던 이 석상을 주목한 한 유튜버가 2021년 9월 광화문 월대와 해태상을 주제로 한 콘텐츠를 올렸다. 이를 본 시민이 문화재청에 알리면서 그 존재가 드러났다.광화문 앞에 있었던 해태(해치)상도 위치를 옮긴다. 문화재청은 해태상을 어디에 둘지 논의를 이어 왔다. 광화문 앞이 차로인 점, 해태상의 의미 등을 고려해 최종적으로 월대 전면부에 두기로 했다.문화재청이 함께 공개한 새로운 현판은 검정 바탕에 동판을 도금한 금빛 글자로 한자 ‘光化門’(광화문)이라고 적혀 있다. 경복궁 중건 당시 훈련대장이자 조선시대 궁 등의 건축 공사를 관장하던 영건도감 제조를 겸한 임태영이 한자로 쓴 것으로, 2010년 제작한 기존 현판은 흰색 바탕에 검은색 글자였다.김민규 동국대 불교학술원 문화재연구소 전임연구원 겸 문화재청 전문위원이 광화문 현판 제작을 둘러싼 논의가 한창이던 2018년 ‘영건일기’를 분석한 내용을 학술지에 발표하면서 급물살을 탔다. 김 연구원은 광화문, 근정전, 경회루 등 경복궁 주요 전각의 현판 바탕이 검은색으로 기록돼 있다는 점을 짚으며 “화재에서 무사하길 기원하는 마음으로 추정된다”고 밝혔다. 이후 여러 차례의 실험과 논의 끝에 광화문 현판은 검은 바탕에 금빛 글자로 결정됐다. 학계 안팎에서는 새 현판이 그간 현판 복원을 둘러싸고 이어 온 논쟁에 마침표를 찍을지 주목하고 있다.문화재청 관계자는 “약 50ｍ 길이의 월대가 놓인 광화문은 이전까지의 광화문과 확연히 다를 것”이라며 “경복궁에서 열리는 수문장 교대 의식도 달라진 모습으로 관람객을 맞게 된다”고 밝혔다. 문화재위원회 산하 궁능문화재분과 위원장인 홍승재 원광대 명예교수는 월대 복원에 대해 “그동안 단절됐던 광화문과 육조거리를 연결함으로써 한양 도성의 중심축을 회복하고 각 유적을 잇는 출발점이 될 것”이라고 평가했다.",105,https://n.news.naver.com/mnews/article/081/0003400481?sid=103
"""내년 D램 시장 -1% 역성장""",2018.12.17. 오전 3:13,"삼성전자·SK하이닉스의 주력 메모리(저장용) 반도체인 D램 시장이 내년 역(逆)성장할 것이라는 전망이 제기됐다.미국의 반도체 시장 조사 업체인 IC인사이츠는 13일(현지 시각) 발표한 보고서를 통해 ""내년 세계 D램 시장은 올해보다 1% 줄어들 것""이라고 밝혔다. D램은 작년 77% 성장한 데 이어 올해도 39%의 성장률을 기록할 전망이지만 내년에는 성장세가 크게 꺾인다는 것이다. IC인사이츠는 ""그동안 D램 시장 성장세를 주도해왔던 데이터센터용 제품 수요가 미·중 무역 전쟁 우려와 세계경제 위축에 따라 급속도로 줄어들면서 내년에 시장이 줄어들 것""이라고 분석했다.이미 대형 거래처 간 거래에 적용되는 D램 판매 가격은 지난 10월 이후 하락세를 그리고 있다. 삼성전자 주가는 지난 14일 3만8950원을 기록해 5월 주식 액면 분할 이후 처음으로 종가 기준 4만원 이하로 떨어졌다. 금융 정보 업체인 에프앤가이드에 따르면 14일 하루에만 삼성전자 실적 전망치를 낮춘 증권사 리포트가 10개 이상 쏟아졌다. 반도체 업계 관계자는 ""삼성전자와 SK하이닉스의 실적도 올 4분기부터 큰 폭으로 하락 반전할 가능성이 크다""고 말했다.[강동철 기자 charley@chosun.com] 	[조선닷컴 바로가기][조선일보 구독신청하기] - Copyrights ⓒ 조선일보 & chosun.com, 무단 전재 및 재배포 금지 -",105,https://n.news.naver.com/mnews/article/023/0003416479?sid=103
"정부, 글로벌IT기업 과세·中企 망 이용료 완화 추진",2018.12.17. 오후 5:24,"2019년 경제정책방향 확정[아이뉴스24 도민선 기자] 정부가 글로벌IT기업에 대한 과세와 함께 중소콘텐츠 제작기업의 망 이용료 부담 완화에 나선다.특히 4차산업혁명 등 중장기 도전요인에 대응하기 위해 '혁신성장·미래전략 관계장관회의'를 신설하기로 했다.정부는 17일 오전 청와대에서 문재인 대통령을 주재로 확대경제장관회의를 열어 이 같은 내용의 '2019년 경제정책방향'을 확정했다.정부는 내년 정책으로 경제·사회의 포용성을 강화하고 공정경제 질서를 확립하기 위한 법제도 정비 방안을 마련, 추진키로 했다.



다국적 IT기업에 대한 국제적인 과세기준 논의에 적극 참여하고, 국내외 IT기업간 역차별 완화에 나설 계획이다. 이는 국내에 물리적인 고정사업장이 없는 글로벌 IT기업에 법인세 등을 부과하기 위한 차원. 관련 여러 개정안이 나와있는 상태다. 다만 정부는 이에 앞서 국제적인 과세기준 합의 등이 선행돼야 한다는 점도 강조했다.특히 정부는 구글, 페이스북 등 글로벌 대형 콘텐츠 기업과의 공정경쟁 환경 조성을 위해 국내 콘텐츠 제작기업의 망 이용부담 완화를 동시에 꾀한다. 이와 관련 주무부처인 과학기술정보통신부는 지난 2016년 초부터 중소CP 부담 완화를 위한 상호접속 개선 TF 등을 운영 중이다.이 외 정부는 민간의 5세대 이동통신(5G) 투자에 대한 세제지원을 확대하고, 스마트폰·자율주행자동차 등 5세대통신(5G) 융합 프로젝트 지원도 강화하기로 했다.아울러 '혁신성장·미래전략 관계장관회의'를 신설, 관련 정책을 속도감있게 추진한다는 방침이다.도민선기자 domingo@inews24.com▶네이버 채널에서 '아이뉴스24'를 구독해주세요.▶아이뉴스TV에서 부동산 고수를 만나보세요.[ⓒ 아이뉴스24 무단전재 및 재배포 금지]",105,https://n.news.naver.com/mnews/article/031/0000475665?sid=103
"KT, 화재 피해 소상공인 위해 '온마켓 행사' 진행…시장서 구매시 상품 지급",2018.12.17. 오후 4:08,"KT가 화재로 피해를 입었던 소상공인을 위한 지원에 앞장선다. KT는 20일까지 소상공인 지원을 위한 ‘KT 온마켓’ 행사를 진행한다고 17일 밝혔다. 추혜선 정의당 의원이 13일 ""6일부터 실시한 피해 지역 식당 이용하기 캠페인은 사실상 KT 임직원들을 동원한 여론무마용 이벤트에 불과하다""고 지적했던 것이 무색해지는 모양새다. 앞서 KT는 6일부터 통신 장애 피해 지역 식당을 방문해 매출을 올려주고 있다. KT 온마켓은 피해 지역 식당 살리기 캠페인의 2차 조치인 셈이다.



15일 서울 마포구 망원시장에서 KT 직원들이 KT 온마켓 행사를 진행 중인 모습. /KT 제공KT 온마켓 행사는 12일 서울 마포구 월드컵시장을 시작으로 20일까지 망원시장·공덕시장·아현시장·포방터시장·인왕시장·백련시장·후암시장·용문시장을 포함한 총 9개 전통시장에서 소상공인을 지원하는 행사다.KT는 소상공인에게 방한조끼와 방한용 앞치마 같은 물품을 제공한다. 시장에서 물건을 구매한 고객에게는 구매 가격에 따라 장바구니와 핫팩 같은 물품을 제공한다.11월 24일 서울 서대문구 KT 아현지사 화재로 통신 피해를 입은 지역의 소상공인을 돕기 위해서다. 앞서 KT는 6일부터 KT는 광화문빌딩·혜화지사 임직원들을 중심으로 해당 피해 지역의 음식점에서 점심·저녁식사를 하는 캠페인을 펼치고 있다.이필재 KT 마케팅부문장은 ""화재 사고로 인한 서비스 장애로 불편을 겪은 소상공인들에게 조금이나마 위로가 될 수 있도록 전통시장 지원 행사를 진행하고 있다""며 ""재발 방지와 더불어 고객 신뢰 회복을 위해 최선을 다하겠다""고 말했다.[안별 기자 ahnbyeol@chosunbiz.com]chosunbiz.com",105,https://n.news.naver.com/mnews/article/366/0000422525?sid=103
"한국e스포츠협회, 김영만 협회장 선임…13년만에 구원투수 복귀",2018.12.17. 오후 3:05,"김영만 한빛소프트 부회장이 공석이던 한국e스포츠협회장을 맡았다. 지난 2005년 회장 자리에서 물러난뒤 13년만의 복귀다. 한국e스포츠협회는 17일 김영만 부회장을 새 협회장으로 선임했다고 발표했다. 이날 협회는 임시 총회를 개최해 신임 회장 선임 건을 의결했다.



김영만 한국e스포츠협회장김영만 신임 협회장은 지난 1999년 1세대 게임사인 한빛소프트를 창업, 국내 온라인 게임 산업을 이끈 인물이다. 한빛소프트는 <스타크래프트> 등을 국내에 유통한 회사로, 이후 <오디션> 등을 글로벌 히트시키며 2002년 코스닥 시장에 입성했다.2008년 한빛소프트 회장직에서 물러난 김 신임 협회장은 회사를 티쓰리엔터테인먼트에 매각한 후 2013년부터 최근까지 비엔엠홀딩스의 회장직을 역임했으며, 현재 한빛소프트 부회장을 다시 맡고 있다. 비엔엠홀딩스는 게임 아이템 중개 사업 업체인 아이엠아이와 아이템베이를 보유한 지주회사로, 파티게임즈가 지난 8월 700억원에 인수했다.특히 김 신임 협회장은 2000년부터 약 5년여간 협회 전신인 ‘21세기프로게임협회’에서 초대 회장을 맡았고, 이후 2007년까지 한국게임산업협회장직을 지내며 게임산업 발전에 앞장섰다. 김 신임 협회장은 임시 총회에서 “협회가 어려움에 처해있는 상황에서, 초대 회장으로서 책임감을 느낀다. 현재 e스포츠와 관련하여 많은 현안들이 있으나, 오랫동안 협회장이 공석인 탓에 협회가 중요한 때에 힘을 못 내고 있어 안타까웠다”며 “e스포츠가 전 세계가 주목하는 정식 스포츠로 발전하는 중대한 시점에서 협회의 새 구심점이 되어 협회 정상화에 힘을 쏟겠다”고 말했다.취임 후 김영만 협회장은 내년 1월까지 정부, 협회 회원사, 게임사, 미디어, 관계사 등 e스포츠 업계 관계자들을 두루 만나며, 협회의 역할과 방향성에 대해 열린 마음으로 의견을 들은 후, 협회 정상화 방안을 조속히 발표할 예정이다. 한국e스포츠협회는 새로운 회장 취임과 함께, 조직 정상화와 재정적 안정성 확보, e스포츠의 정식스포츠화 등을 내년 최우선 해결 과제로 삼고 노력할 계획이다. 김영만 신임 협회장의 임기는 협회 정관에 따라 3년이다.조진호 기자 ftw@kyunghyang.com▶ [스포츠경향 인기 무료만화 보기]▶ [지금 옆사람이 보고있는 뉴스]©스포츠경향(sports.khan.co.kr), 무단전재 및 재배포 금지",105,https://n.news.naver.com/mnews/article/144/0000587558?sid=103
[2018결산/통신] 실적악화부터 화재까지 ‘다사다난’ 통신사…빛바랜 세계 최초 5G,2018.12.17. 오전 11:35,"- SKT ‘ICT지주사 전환’·KT ‘황창규 대표 유지’·LGU+ ‘그룹 재편’ 영향    [디지털데일리 윤상호기자] 쉽지 않은 한 해였다. 가계통신비 인하 요구는 빗발쳤다. 실적은 하향세다. 알뜰폰(MVNO, 이동전화재판매)도 유통도 다 힘들다. 5세대(5G) 이동통신 세계 최초 상용화는 빛이 바랬다. KT 통신구 화재 때문이다. 장밋빛 미래보다 우려가 크다. 통신과 통신에 직접 관련된 산업 모두 쉽지 않은 세상이다. 통신과 다른 사업의 융합을 통해 살길을 찾는 통신사의 발걸음이 분주하다.   2017년 4분기 SK텔레콤 KT LG유플러스 무선 가입자당평균매출액(ARPU)은 ▲SK텔레콤 3만5209원 ▲KT 3만4077원 ▲LG유플러스 3만4630원 이다. 같은 기준(K-IFRS1018)을 적용한 올 3분기 3사 ARPU는 ▲SK텔레콤 3만2075원 ▲KT 3만2372원 ▲LG유플러스 3만1965원이다. ▲SK텔레콤 3134원 ▲KT 1705원 ▲LG유플러스2665원 감소했다. SK텔레콤 KT는 4분기 연속 LG유플러스는 5분기 연속 빠졌다. 5G 이동통신 가입자 모집을 본격화하는 내년 하반기까지는 답이 없다. 보편요금제, 기본료 폐지 등 정부와 국회, 시민단체 요구는 그대로다. 5G 요금을 제대로 받을 수 있을지 미지수다.   3사의 요금개편은 알뜰폰에 직격탄이 됐다. 번호이동 시장에서 알뜰폰 가입자 유출은 지난 11월 월 3만명대까지 증가했다. 싼 요금이라는 장점이 없어진 상황. 해법을 찾기 어렵다. 구조조정이 불가피하다. 통신사 손익악화는 유통도 영향권이다. 통신사의 소극적 가입자 쟁탈전, 소비자의 휴대폰 사용기간 증가는 전체 휴대폰 판매량 감소로 이어졌다. 대리점과 판매점은 요금제와 휴대폰 판매 수당이 주 수익원이다. 한 축이 무너졌다. 국회는 아예 통신 유통이 휴대폰 판매를 하지 못하게 하는 완전 자급제를 추진하고 있다. 생존을 걱정하게 됐다.   12월1일 5G를 세계 최초 상용화했다. 과학기술정보통신부의 의지대로다. 1주일을 앞두고 돌발 상황이 발생했다. 세계 최초 상용화 축하행사 ‘코리아5G데이’는 유야무야 됐다. KT가 재를 뿌렸다. 11월24일 발생한 KT아현지사 통신구 화재 탓이다. 관리등급 D의 통신구 일부가 불에 탔다. 서울 ▲서대문구 ▲용산구 ▲마포구 ▲중구 ▲은평구 일대와 경기 고양시 덕양구 일부의 KT 유무선통신망이 끊겼다. 피해복구는 아직 진행형이다. 통신을 이용했던 경제활동 전체가 마비됐다. 관리 소홀과 책임론이 부상했다. 축배를 들 생각만 했던 정부와 통신사의 민낯이 드러났다. 정보통신기술(ICT)와 다른 산업과 융합은 기회 대신 재앙이 될 수 있다는 경각심을 심었다. 그나마 12월 정기국회 마지막 본회의에서 5G 투자 세액공제 길이 열린 것이 위안이다. 5G 이동통신 기지국 시설 투자금액 2%, 고용증가율에 따라 최대 3%까지 세액공제가 가능하다.   SK텔레콤은 고객 신뢰 회복과 ICT지주사 전환 노선을 이어갔다. 박정호 대표 취임 후 줄곧 강조한 사안이다. ‘고객가치혁신’이라는 이름으로 ▲약정 ▲로밍 ▲멤버십 ▲렌탈 ▲요금제 등을 개선했다. 효과는 아직이다. 신뢰는 단기간에 얻을 수 있는 일이 아니다. 통신사에 대한 소비자의 불신을 SK텔레콤 혼자 바꿀 수도 없다. ICT지주사 전환은 인수합병(M&A)과 관계사 재편으로 구체화하고 있다. SK텔레콤은 2019년 조직개편에서 박 대표가 SK브로드밴드 대표를 겸임하고 SK텔레콤은 ▲이동통신(MNO) ▲미디어 ▲보안 ▲커머스 4대 사업부로 재편했다. 밑그림이다. 지주사 밑에 ▲SK텔레콤+SK브로드밴드 ▲SK브로드밴드/아이리버 ▲SDT캡스/SK인포섹 ▲11번가/SK스토아 ▲SK하이닉스 등이 오는 시나리오가 예상된다.   KT는 숱한 소문에도 불구 황창규 대표가 자리를 지켰다. 내년이 임기 마지막 해임을 감안하면 KT 민영화 이후 최초로 연임 후 임기를 마치는 대표가 될 전망이다. 반면 그의 임기 동안 KT가 이룩한 성과가 위협을 받고 있다. 지난 11월 발생한 화재 때문이다. 5G와 실적 모두 위태롭다. 황 대표는 취임 후 5G 선도 이미지 구축에 힘을 쏟았다. 롱텀에볼루션(LTE) 실기를 만회하기 위해서다. 화재는 5G 마케팅 전략에 악영향이다. 보상에 들어갈 비용도 만만치 않다. 비용은 내년 1분기부터 실적에 반영된다. 보상비용은 비용대로 브랜드 손상은 손상대로 입을 처지다.   LG유플러스는 재무구조 개선에 집중했다. 지난 3분기 부채비율은 93.0%. 창사 이래 처음으로 100% 아래로 내려왔다. 그룹 수장 교체로 최고경영자(CEO)가 바뀌었다. 권영수 전 대표가 LG로 LG 하현회 부회장이 대표로 왔다. LG그룹은 구광모 회장 체제로 전환에 따라 구본준 LG 부회장의 계열분리를 앞두고 있다. LG유플러스가 추진하던 유료방송 인수 등은 계열분리 등 그룹 재편 영향권이다. 계열분리 윤곽이 드러나야 M&A 등 재원이 필요한 사업을 진행할 수 있다. 5G는 화웨이에 발목을 잡혔다. LTE 전환 때도 구설은 있었지만 이 정도는 아니었다. 미국과 중국 패권경쟁 유탄이 LG유플러스에 떨어진 모양새다. 대안이 없는 LG유플러스로써는 조용해지길 기다릴 수 밖에 없다.    한편 와이브로(모바일 와이맥스)가 역사 속으로 사라졌다. SK텔레콤 KT은 와이브로를 오는 12월31일까지만 서비스한다. 지난 2002년 서비스 개발 후 16년 2006년 상용화 후 12년 만이다. 와이브로는 한국이 표준을 만든 이동통신 기술이다. LTE와 경쟁에서 밀렸다. 생태계를 만들지 못했다. SK텔레콤과 KT를 제외한 다른 나라 통신사는 서비스를 접은지 오래다. 통신장비와 단말기를 만드는 곳도 없다. 세계 최초 상용화의 씁쓸한 종말이다.   <윤상호 기자>crow@ddaily.co.krIT언론의 새로운 대안[디지털데일리]IT정보의 즐거운 업그레이드[딜라이트닷넷]뉴스채널 설정 - 네이버 메인에서 디지털데일리 뉴스를 볼 수 있어요.윤상호(crow@ddaily.co.kr)<저작권자 © 디지털데일리 무단전재-재배포금지>",105,https://n.news.naver.com/mnews/article/138/0002068431?sid=103
권오경 한국공학한림원 제13대 회장,2018.12.17. 오후 6:18,(서울=연합뉴스) 권오경 한국공학한림원 회장(한양대 석학교수)이 내년부터 2년간 공학한림원을 다시 이끌게 됐다.    한국공학한림원은 17일 서울 소공동 웨스틴조선호텔에서 열린 제43차 정기총회에서 권오경 현 회장을 제13대 회장으로 선출했다고 밝혔다. 2018.12.17 [한국공학한림원 제공]    photo@yna.co.kr▶뭐 하고 놀까? #흥  ▶쇼미더뉴스! 오늘 많이 본 뉴스영상 ▶네이버 홈에서 [연합뉴스] 채널 구독하기,105,https://n.news.naver.com/mnews/article/001/0010531155?sid=103
SKT 로밍서비스 기자간담회,2018.12.17. 오후 1:54,"(서울=뉴스1) 이승배 기자 = 17일 오전 서울 중구 삼화빌딩에서 열린 SKT 로밍서비스 기자간담회에서 최정호 팀장이 서비스에 대해 발표하고 있다.SK텔레콤은 이날 발표를 통해 SK텔레콤 가입자가 출국시 데이터로밍에 가입한 뒤 현지에서 'T'전화로 통화하면 전 세계 168개국에서 음성통화를 무료로 이용할 수 있다고 밝혔다. 2018.12.17/뉴스1 photolee@news1.kr▶ [ 크립토허브 ]  [ 터닝포인트 2019 ] ▶ 에어팟&스타벅스 커피 경품(~12/25)[© 뉴스1코리아(news1.kr), 무단 전재 및 재배포 금지]",105,https://n.news.naver.com/mnews/article/421/0003743475?sid=103
,,,105,https://n.news.naver.com/mnews/article/030/0002768591?sid=103
SKT '해외서 음성통화 무료로 쓴다',2018.12.17. 오후 1:53,"(서울=뉴스1) 이승배 기자 = 17일 오전 서울 중구 삼화빌딩에서 열린 SKT 로밍서비스 기자간담회에서 최정호 팀장이 서비스에 대해 발표하고 있다.SK텔레콤은 이날 발표를 통해 SK텔레콤 가입자가 출국시 데이터로밍에 가입한 뒤 현지에서 'T'전화로 통화하면 전 세계 168개국에서 음성통화를 무료로 이용할 수 있다고 밝혔다. 2018.12.17/뉴스1photolee@news1.kr▶ [ 크립토허브 ]  [ 터닝포인트 2019 ] ▶ 에어팟&스타벅스 커피 경품(~12/25)[© 뉴스1코리아(news1.kr), 무단 전재 및 재배포 금지]",105,https://n.news.naver.com/mnews/article/421/0003743472?sid=103
"""두꺼운 외투 챙기세요"" 내일 출근길 기온 뚝… 수요일까지 아침은 춥다",2023.10.15. 오후 2:11,"15일 오전 서울 마포구 하늘공원에서 열린 '2023 서울억새축제'를 찾은 시민들이 억새밭 사이를 거닐며 가을 정취를 만끽하고 있다. 뉴시스월요일인 16일 출근길에는 두꺼운 외투를 입어야겠다. 아침 기온이 전날보다 크게 떨어져 추워지기 때문이다. 쌀쌀한 가을 날씨는 수요일(18일)까지 계속될 전망이다.15일 기상청에 따르면, 16일 전국의 아침 최저기온은 6~16도로 예상된다. 주말 아침기온에 비해 2~6도가량 낮다. 17일 아침기온은 최저 3~13도로 더 낮아진다. 특히 내륙 지역은 대부분 아침기온이 5도 내외로 떨어질 전망이다. 15일부터 16일 오전까지는 중부서해안과 강원 영동, 남부지방, 제주도 등을 중심으로 순간풍속 시속 55㎞ 안팎의 강한 바람이 분다. 출근길 체감온도가 더욱 낮을 것으로 전망되는 이유다. 16일엔 경기북부와 강원내륙·산지에, 17일엔 전국 대부분 내륙에 서리가 내리겠다.주 중반까지 아침 기온이 급격히 낮아지는 이유는 우리나라 주변 기압계가 서쪽 고기압, 동쪽 저기압이 놓이는 '서고동저' 형태로 재편돼 바람이 많이 불고 밤사이 복사냉각이 활발해지기 때문이다. 반면 낮에는 날씨가 맑아 기온이 오르면서 평년과 비슷한 20~23도를 보일 전망이다. 이에 낮밤 기온차가 15도 이상으로 클 것으로 예상돼 건강 관리에 유의해야 한다.주 후반에는 평년과 비슷한 기온이 유지되다가 주말인 21일쯤 아침 기온이 1~14도로 다시 크게 낮아질 것으로 예보됐다.",105,https://n.news.naver.com/mnews/article/469/0000765109?sid=103
