title,date,main,section,url
[IT돋보기] '인앱결제 방지법' 구체화 착수…매출액 최대 2% 과징금 부과,2021.10.19. 오후 2:07,"방통위, 유관 협·단체와 인앱결제 방지법 논의…구글·애플에는 '법 준수' 촉구방송통신위원회가 지난 9월 14일 발효된 '구글 인앱결제 강제 방지법(전기통신사업법 개정안)'을 구체화하기 위한 작업에 착수했다. 특히 실효성 담보를 위해 인앱결제 강제 시 매출액의 최대 2%를 과징금으로 부과하겠다는 방침을 세웠다.방통위는 19일 서울 강남 한 모임공간에서 '인앱결제 관련 하위법령 정비와 실태 파악을 위한 간담회'를 개최했다. 이날 코리아스타트업포럼, 한국게임산업협회, 한국디지털기업협회, 한국모바일게임협회, 한국모바일산업협회, 한국인터넷기업협회 등이 업계를 대표해 참석했다.



19일 서울 강남구 한 모임공간에서 진행된 인앱결제 관련 간담회에서 참석자들이 발언하고 있다.◆인앱결제 강제하면 매출액 최대 2% 과징금 부과키로방통위는 개정법의 금지 행위와 관련, 금지 행위의 세부 유형을 정하고 위법성 판단 기준을 제시하는 고시를 제정하겠다고 발표했다. 특히 앱 마켓 사업자를 대상으로 신설된 금지 행위의 세부 규정의 방향성에 대해 업계 관계자들과 구체적으로 논의했다.우선 개정법에서는 ▲거래상 지위를 부당하게 이용해 모바일 콘텐츠 등 제공 사업자에게 특정한 결제방식을 강제하는 행위(제9호) ▲모바일 콘텐츠 등의 심사를 부당하게 지연하는 행위(제10호) ▲모바일 콘텐츠 등을 부당하게 삭제하는 행위(제11호)를 금지 행위로 규정했다.금지 행위를 할 경우 부과할 과징금 기준도 정했다. 이에 제9호는 매출액의 2%, 제10호와 제11호에 대해서는 매출액의 1%에 해당하는 과징금을 부과하도록 했다. 방통위는 제9호 '특정한 결제방식 강제'의 경우 위법 행위가 상대적으로 중대하기 때문에 과징금을 보다 높게 정했다고 발표했다.기본적으로 개정법의 적용을 받는 앱 마켓 서비스 사업자의 인앱 결제 서비스 수수료를 매출 산정 기준으로 한다는 계획이다. 다만 구체적인 적용 범위에 대해서는 지속적으로 논의하겠다는 방침이다.'특정한 결제방식 강제'는 다른 결제 방식을 사용하면 불이익을 제공하는 유형을 일컫는다. 세부적으로 모바일 콘텐츠 등의 등록·갱신·점검을 거부·제한·지연하거나 삭제·차단하는 행위 혹은 앱 마켓 이용을 정지·제한하는 행위 등 불이익을 주는 것을 금지하는 것으로 규정했다.여기에는 콘텐츠 제공 사업자가 다른 결제방식을 사용하는 것을 기술적·절차적으로 제한하는 행위도 들어간다. 또 타 결제방식을 사용하는 사업자에게 수수료, 앱 마켓 노출 또는 그 밖의 경제적 이익 등에 대해 불합리하거나 차별적인 조건·제한을 부과하는 행위도 포함된다.



인앱결제 관련 시행령‧고시 주요 제개정 방향. [사진=방통위]'모바일 콘텐츠 등의 심사를 부당하게 지연하는 행위'의 경우 모바일콘텐츠 '심사'의 범위에 앱 마켓 등록뿐만 아니라 등록·갱신·점검 등 앱 마켓 운영 과정에서 발생하는 과정들을 망라해 포함하기로 했다. 또 '모바일 콘텐츠 등을 부당하게 삭제하는 행위'에 대해서는 '삭제'의 의미를 보다 넓게 잡았다. 구체적으로 '삭제하거나 삭제에 준하는 정도로 접근을 차단·제한하거나 기능을 제한하는 행위'로 '삭제'의 개념을 정립했다.방통위는 위와 같은 금지행위의 세부 유형에 대한 시행령을 준비한다. 다만 위법성 판단 기준을 제시하는 심사 기준은 신설 금지행위 규정이 시장에 미치는 영향이 상당함을 고려해 시행령 대신 고시로 제정할 방침이다.◆방통위 ""구글·애플, 인앱결제 방지법 착실히 지켜야…적극 대응할 것""방통위는 이와 함께 이용자 보호 및 실태조사와 관련한 하위법령 세부 내용도 시행령 형태로 마련한다.이용자 보호와 관련해서는 앱 마켓 사업자가 불만처리·분쟁해결 절차 및 기본 정보의 제공 방법을 이용약관에 명시하도록 했고, 앱 마켓 사용자가 이용자에게 인앱결제를 제공하는 경우 이용자에게 중요사항 사전 고지, 미성년자 보호 조치, 해지수단 제공 및 해지 제한 금지를 통해 이용자 보호 의무를 부과토록 했다. 또 결제·환불 과정에서 앱 마켓 사업자가 이용자 불만을 접수하는 경우 모바일 콘텐츠 사업자에게 전달하고 결과에 대한 이용자 회신 의무도 지게 했다.아울러 시행령 제30조의10을 신설해 앱 마켓 실태조사 관련 사항을 명시했다. 모바일콘텐츠 등 제공 사업자 보호 목적을 위해 이용자 보호 업무 평가를 기준으로 규정하되 부가통신사업 실태조사 규정 등으로 보완토록 했다.김재철 방통위 이용자정책국장은 ""방통위는 개정법의 취지를 제대로 시행하고 집행의 실효성을 담보하기 위해 지난달부터 제도정비반을 운영하고 하위 법령에 대해 논의했다""며 ""앱 마켓 전 과정에서 불공정행위가 발생하지 않도록 신설된 금지행위의 분석을 시행령에서 구체화하고 신설된 금지행위의 위법상 판단하는 심사 기준으로 거래상의 지위, 강제성, 부당성 등의 세부 내용을 고시에 넣고자 한다""고 설명했다.한편 방통위는 최근 인앱결제 강제 방지법에 대해 구체적인 이행 계획을 알리지 않은 구글·애플과 관련해 하위법령 제정 전에도 얼마든지 사실 조사에 착수할 수 있다고 경고했다. 구글과 애플은 지난 11일 방통위에 법 이행 계획을 제출했다. 그러나 구글은 세부적인 계획을 빠뜨렸고 애플은 기존 결제 정책·지침만으로도 개정법에 부합한다고 항변했다.김재철 국장은 ""방통위는 해당 사업자들과 면담을 통해 구체적인 계획 제출을 강력히 촉구했으며 조만간 자료 재제출을 정식으로 요구할 계획""이라며 ""그럼에도 가시적 이행 계획이 확인되지 않을 경우 하위법령 제정 전이라도 가능한 범위 내에서 사실 조사에 착수하는 등 불법 행위에 적극 대응할 것""이라고 강조했다. 방통위는 이번 주 중으로 구글과 애플에 자료 재제출을 재요청할 예정이다.",105,https://n.news.naver.com/mnews/article/031/0000629608?sid=103
"""콩 자라면서 뿌리·토양 내 미생물 종류와 비율 달라진다""",2021.10.19. 오전 11:00,"다양한 콩의 생육단계별 식물과 뿌리혹 모습[농촌진흥청 제공. 재판매 및 DB 금지](서울=연합뉴스) 이영섭 기자 = 콩이 자라는 단계에 따라 뿌리와 근권토양(뿌리둘레 2∼3㎜ 범위 토양) 내 미생물의 종류와 비율이 크게 달라진다는 사실이 연구를 통해 확인됐다.    농촌진흥청은 차세대 염기서열 분석기술로 콩 근권토양을 대량 분석한 결과 이같이 나타났다고 19일 밝혔다.    콩의 뿌리혹 부분에는 공기 중 질소를 모아 콩에 공급하는 박테리아 등의 미생물이 있었고, 근권토양에도 다양한 기능을 가진 방선균류(actinobacteria), 알파프로테오박테리아(alphaproteobacteria) 등 미생물이 있었다.    이들 미생물이 분비하는 토양 내 효소는 콩이 자라면서 더 활성화됐고, 근권토양 내 미생물의 수와 종류도 늘어났다.    특히 콩의 꼬투리가 자라기 시작할 때 뿌리혹에 질소를 고정하는 미생물 외에도 플라보박테리아(flavobacterium)나 엔테로박터(enterobacter) 등이 늘어나 전체 미생물의 24.2%를 차지했다.    이는 환경 변화에 따른 스트레스에 대한 콩의 저항성 증진 등과 관련 있는 것으로 농촌진흥청은 분석했다.    농촌진흥청은 이번 연구 결과를 활용해 콩 토양을 개간할 때 콩 성장에 필수적인 생물 비료를 개발할 계획이다.    이번 연구 결과는 과학저널 '프론티어스 인 플랜트 사이언스'(Frontiers in Plant Science)와 '분자과학 국제저널'(International Journal of Molecular Sciences)에 게재됐다.    김정준 농촌진흥청 환경개선미생물연구단장은 ""콩 근권토양과 뿌리혹 미생물 변화에 대한 이해는 우수한 콩 육종 소재 개발뿐 아니라 불량 환경에 대한 저항성을 높이는 재배방법 등 신기술 개발의 초석이 될 수 있다""고 말했다.    younglee@yna.co.kr",105,https://n.news.naver.com/mnews/article/001/0012731344?sid=103
실리콘 웨이퍼 출하량 전년比 13.9% 증가…반도체 수요 증가 영향,2021.10.19. 오전 10:08,"올해 실리콘 웨이퍼(반도체 원판) 출하량이 139억9800만in²(제곱인치)를 기록, 전년대비 13.9% 증가한 것으로 나타났다. 반도체 수요가 강하기 때문으로 분석된다.19일 국제반도체장비재료협회(SEMI)에 실리콘 웨이퍼 출하량은 파운드리(반도체 위탁생산)와 메모리 반도체 분야의 지속적인 성장으로 내년 148억9600만in²(전년대비 6.4% 증가), 2023년 155억8700만in²(4.6% 증가), 2024년 160억3700만in²(2.9% 증가)에 달할 것으로 전망된다.이나 스크보르초바 SEMI 마켓 연구원은 “여러 산업 분야에서 반도체에 대한 강한 수요가 이어지고 있어 실리콘 출하량이 크게 증가하고 있다”라며 “내년에도 성장이 계속될 것으로 예상되지만 거시경제 회복 속도와 웨이퍼 생산 시설의 추가 시점에 따라 웨이퍼 출하량에 변동이 올 수 있다”고 말했다.실리콘 웨이퍼는 반도체 제작의 핵심 소재로 PC, 통신, 소비자가전 등 대부분의 전자제품에 들어간다. 웨이퍼 디스크(둥근 판)는 1인치(25.4㎜)에서 12인치(300㎜)에 이르기까지 다양한 크기로 생산되며, 대부분의 반도체 칩을 만드는 데 사용된다.",105,https://n.news.naver.com/mnews/article/366/0000767469?sid=103
"넷마블, 메타버스 개발 역량 강화…나인엠인터렉티브 인수",2021.10.19. 오후 5:55,"[일간스포츠 권오용]   



넷마블에프앤씨와 나인엠인터렉티브 CI.     넷마블이 요즘 주목받고 있는 메타버스(확장형 가상세계) 개발 역량을 강화한다.   넷마블은 개발 자회사 넷마블에프앤씨가 실사형 스포츠게임 전문 개발사 나인엠인터렉티브를 100% 흡수합병한다고 19일 밝혔다.    나인엠인터렉티브는 EA스포츠 출신의 핵심 인력이 주축이 돼 2014년 설립한 개발사로, 모바일 게임 ‘얼티밋 테니스’와 ‘익스트림 풋볼’, ‘9M 프로야구’, ‘CPBL 프로베이스볼’을 선보였다.      두 회사 모두 주권비상장법인으로 넷마블에프앤씨가 존속회사, 나인엠인터랙티브는 소멸회사가 되며 합병기일은 12월 3일이다.    넷마블에프앤씨는 메타버스 게임 및 플랫폼 사업을 추진하고 있다. 최근 지분 100%를 출자해 자회사 ‘메타버스엔터테인먼트’를 설립, 가상현실 플랫폼 개발과 버츄얼 아이돌 매니지먼트 등 게임과 연계된 메타버스 콘텐츠 제작과 서비스 사업 계획을 밝혔다    서우원 넷마블에프앤씨 공동대표는 “실사형 스포츠게임에서 탁월한 역량을 가진 나인엠인터렉티브는 딥러닝을 활용한 메타휴먼 생성 기술은 물론 모션캡쳐와 네트워크 기술력을 보유하고 있어 성장성이 기대된다”고 말했다.      서 공동대표는 또 “넷마블에프앤씨는 양 사가 보유한 기술 및 인적 자원을 메타버스 게임 및 플랫폼 개발에 적극 활용할 것”이라고 했다.      권오용 기자 kwon.ohyong@joongang.co.kr",105,https://n.news.naver.com/mnews/article/241/0003162795?sid=103
"광주 광산구, 경로당 노인여가 IPTV로 비대면 전환",2021.10.19. 오후 4:14,"IPTV 시청하며 경로당 노인여가프로그램 비대면 참여[광주 광산구 제공. 재판매 및 DB 금지](광주=연합뉴스) 정회성 기자 = 광주 광산구는 인터넷 멀티미디어방송(IPTV) 지역 채널을 활용해 경로당 노인 여가 프로그램을 비대면으로 제공한다고 19일 밝혔다.    경로당 366곳의 IPTV 설치를 지원한 광산구는 전용 채널을 이용해 낙상과 치매 예방, 한글 교실 등 노인 여가 프로그램을 송출하고 있다.    광산구보건소, 국민건강보험공단, 노인복지관 등이 편성표 구성에 참여해 주 5회 요일별 프로그램을 내보낸다.    이달 들어 프로그램 수가 41개로 증가했다.    대면 방식 때 30여 곳에 한정됐던 노인 여가 프로그램 운영 경로당이 비대면 전환 후 모든 곳으로 확대됐다.    어르신이 '우리 동네 경로당 소개'를 통해 제작에 직접 참여하면서 호응도가 올라갔다.    광산구 경로당 노인 여가 프로그램을 시청하려면 IPTV 전용 리모컨으로 '#4839'를 입력하면 된다.    hs@yna.co.kr",105,https://n.news.naver.com/mnews/article/001/0012732613?sid=103
카카오브레인 '초거대 AI' 만든다,2021.10.19. 오후 5:45,"서울대 등 6개교와 공동 연구카카오의 인공지능(AI) 연구 자회사 카카오브레인이 국내 6개 대학과 AI 연구에서 산학협력에 나선다고 19일 밝혔다.카카오브레인은 고려대, 서울대, 포스텍, 한양대, KAIST, UNIST(울산과학기술) 등 6개 대학의 AI 연구실 7곳과 2024년 10월까지 3년간 공동 연구를 진행한다.공동 연구 주제는 메모리 기반 초거대 모델 학습 플랫폼과 방법론, 인식 및 추론 모델의 한계점을 극복하는 새로운 방법론, 비디오 인식 및 생성 한계점을 극복하는 새로운 방법론 등이다.이준석 서울대 데이터사이언스대학원 교수는 “생활에 도움을 줄 수 있는 기술을 만들어야 한다는 큰 방향에서 카카오브레인과 공감대가 있었다”고 말했다. 조민수 포스텍 컴퓨터공학과·인공지능대학원 교수는 “시각, 언어, 추론, 학습 등 다양한 방면의 연구자들이 사회 발전에 기여하고 있다는 자부심을 가지고 서로 협력할 수 있는 분위기를 조성할 것”이라고 강조했다. 카카오브레인 측은 “7개 연구실과 딥 모델 학습 패러다임의 한계를 뛰어넘는 차세대 학습 기술을 연구해 대한민국의 AI 리더십을 확보하겠다”고 밝혔다.앞서 카카오의 정보기술(IT) 서비스 자회사인 카카오엔터프라이즈도 학계와 공동 연구를 강화하고 있다. AI 연구 성과를 이어가기 위해 인재 육성과 다양한 산학 협력 프로그램을 운영 중이다. 우수 AI 인재들과 공동 연구, 협업을 진행하는 ‘리서치 멤버십’ 프로그램이 대표적이다. 카카오엔터프라이즈는 올해 3월부터 KAIST와 머신러닝 및 컴퓨터 비전 분야에서 공동 연구를 하고 있다.",105,https://n.news.naver.com/mnews/article/015/0004618074?sid=103
"현대홈쇼핑, 저소득층 육아맘·청소년 지원금 2억 전달",2021.10.19. 오후 2:49,"적십자사에 ‘하이 캠페인’ 지원금 전달유모차 370대 및 위생키트 지원 전개올해까지 5년간 4000명에 8억원 지원



19일 서울 송파구 정신여자고등학교 회의실에서 진행된 ‘하이(H!) 캠페인’ 지원금 전달식에서 관계자들이 기념촬영하고 있다. 왼쪽부터 임대규 현대홈쇼핑 사장, 최성이 정신여고 교장, 신희영 대한적십자사 회장. 현대백화점그룹 제공.[이데일리TV 이혜라 기자] 현대홈쇼핑(057050)은 대한적십자사에 ‘하이(H!) 캠페인’ 사업을 위한 지원금 2억원을 전달했다고 19일 밝혔다. 이번 지원금은 지난 1월 이후 출산했거나 올해 출산을 앞둔 중위소득 70% 이하의 저소득층 육아맘 370명에게 유모차 370대를 지원하는 데 사용된다. 조손가정이나 한부모 가정 등 경제적으로 어려움을 겪는 청소년(초등학교 3학년~고등학교 3학년) 700명에게 6개월간 사용할 수 있는 생리대와 속옷·파우치 등으로 구성된 위생키트도 지원할 계획이다. 수도권 소재 중·고등학교 18곳에 생리대 무료지급기(20개)도 설치한다.임대규 현대홈쇼핑 사장은 “경제적 어려움을 겪고 있는 아이와 학생들이 건강하게 성장하는 데 도움을 주기 위해 캠페인을 전개하고 있다”며 “사회적 가치 실현을 위해 소외계층을 대상으로 한 맞춤형 지원 사업을 강화해 나갈 것”이라고 말했다.현대홈쇼핑은 지난 2017년부터 여성 생애주기에 맞춰 필요한 물품을 지원하는 하이 캠페인을 진행하고 있다. 올해를 포함하면 총 4000명에게 8억원을 지원하게 됐다.",105,https://n.news.naver.com/mnews/article/018/0005063811?sid=103
"IPO돌입 카카오페이, 대신증권 ""상장후 성장 기대감 커""",2021.10.19. 오후 5:27,"[디지털데일리 박세아 기자] 우여곡절 끝에 다음 달 3일 상장을 앞둔 카카오페이를 둘러싸고, 상장 이후 신용평가 시스템 완성 등 성장에 대한 시장 기대감이 크다는 분석이 나와 주목된다.19일 대신증권 박혜진 연구원은 ""카카오페이는 플랫폼 본질에 더욱 충실한 종합 핀테크 기업으로서 확장 가능성이 크다""고 예측했다.    카카오페이는 국내 대표 핀테크 기업이다. 2014년 국내 최초로 간편결제 사업을 시작했다. 카카오페이는 3수 끝에 기업공개(IPO) 일정에 돌입한다. 앞서 카카오페이는 3분기 중 고평가 논란과 금융소비자법 이슈로 상장 일정을 두 차례 연기한 바 있다.    박 연구원은 ""카카오뱅크와 카카오페이가 출범 초기에는 독자적인 사업모델을 구축하는 데 집중해 경쟁하는 구도로 보일 수 있으나, 향후 협업하게 될 것""이라며 ""이렇게 구축된 카카오 금융유니버스의 대안 신용평가 시스템이 성공적으로 완성된다면 기존 금융권이 하지 않았던 새로운 영역을 개척하는 것""이라고 언급했다. 3500만명 가입자, 67조원 거래액, 57만개 가맹점으로 카카오페이가 구축할 수 있는 대안 신용평가 여역이 무궁무진하다는 설명이다.    그는 상장 이후 성장성을 증명해야 하는 과제도 안고 있을 수 있다고도 짚었다. 카카오페이는 지난달 금융소비자보호법 계도기간 종료에 맞춰 투자 서비스를 개편하고 일부 보험 서비스를 잠정 종료했다. 금융당국이 온라인 금융플랫폼의 상품 비교·추천 서비스를 미등록 중개행위로 보고 시정 조치를 요구해서다.   다만, 박 연구원은 규제는 강화될 수 있지만, 어차피 거쳐가야 할 관문이고, 확장성에 제동이 걸릴만한 요인은 아니라고 판단했다.    그는 ""금융위 권고는 전면적인 상품판매 중단이 아닌 사용자 인터페이스(UI) 개선을 통해 판매 주체를 분명하게 명시하라는 것""이라며 ""카카오페이 플랫폼에서 가능할지는 미지수이나, 증권·보험업 라이선스를 보유한 자회사를 통해 상품을 판매할 수 있을 것""이라고 전망했다.   한편 카카오페이는 20일부터 이틀간 기관투자자 대상 수요예측을 진행한다. 또 25일부터 이틀 동안 일반청약을 진행한 뒤 다음 달 3일 코스피 시장에 상장한다.    희망 공모가는 기존과 같은 6만~9만원이다. 공모가 상단 기준으로 기업가치는 약 11조7330억원이다.",105,https://n.news.naver.com/mnews/article/138/0002111907?sid=103
"뉴타닉스, 관리 쉽고 보안성 높인 하이퍼컨버지드인프라  'AOS 6' 공개",2021.10.19. 오후 4:24,"뉴타닉스 발표자료/뉴타닉스[디지털데일리 박세아 기자] 뉴타닉스가 클라우드 네트워크 관리를 간소화하고, 자동화된 제로 트러스트 보안 등 기능을 강화한 하이퍼컨버지드인프라(이하 HCI) 소프트웨어 'AOS 6'를 공개했다.    19일 뉴타닉스는 온라인 기자간담회를 통해 뉴타닉스의 최신 기술 동향에 대해 공유하는 시간을 가졌다. 이 자리에서 뉴타닉스는 21일 개최될 닷넥스트(.NEXT) 컨퍼런스의 주축이 될 뉴타닉스 HCI 소프트웨어 새버전 AOS 6의 특징과 추가된 기능 등 정보를 전달했다.   뉴타닉스 김정훈 상무는 ""AOS 6는 다수 클라우드 네트워크 관리를 최대한 단순화하고 기업이 가상 프라이빗 클라우드를 구축할 수 있도록 설계됐다""고 설명했다. AOS 6는 엔터프라이즈용 가상화 솔루션 AHV와 가상 네트워킹 및 한층 강화된 보안 기능을 갖추고 완벽한 IaaS 스택을 제공하도록 기능이 추가됐다. 또 모든 워크로드를 지원을 위한 데이터 서비스가 확대됐으며, 엔터프라이즈급 재해복구(이하 DR) 기능이 강화됐다.   엔터프라이즈 AHV 플랫폼은 플로우(Flow)를 통해 가상 네트워킹(VPC) 환경을 구축하는 기능이 추가돼 멀티 테넌트 클라우드 환경을 구축할 수 있다. 또한, 메트로 클러스터 기반 자동 DR 전환 및 서버 용량 활용을 통한 VM 집적도 향상을 통해 DR 기능과 효율성이 향상됐다. 레드햇 RHEL 및 오픈시프트(OpenShift) 인증 지원도 추가됐다.   김 상무는 ""뉴타닉스 AHV는 이제 레드햇의 인증을 받은 하이퍼바이저로 뉴타닉스 클라우드 플랫폼에서 레드햇 엔터프라이즈 리눅스와 오픈시프트를 지원한다""고 강조했다.    특히 플로우를 통한 가상 네트워킹은 IT 운영자가 손쉽게 관리할 수 있으며, 자동화된 프로비저닝, 클라우드 전반에 걸친 워크로드 이동성 및 일관된 네트워킹을 지원하고 1차 랜섬웨어 방어선으로서의 네트워크 역할을 한는 설명이다.    AOS 6는 미션 크리티컬한 DR을 위해 토폴로지 가시성 기반의 중앙집중화된 DR, SLA 관리를 지원하며, DR 암호화 기능을 통해 데이터 복제본의 클라우드 전송 시 강화된 보안을 구현한다.   뉴타닉스는 이번 소프트웨어 출시를 통해 인프라 단을 넘어서 워크로드 관리 및 거버넌스에 집중할 방침이다. 역할 기반 접근 제어(RBAC)와 프로젝트별 용량 할당이 가능한 셀프서비스 포탈을 제공하며, 애플리케이션 배포 스케줄링에 따른 자동화된 배포 및 즉시 사용 가능한 IT 서비스 관리(ITSM)를 통한 승인을 지원한다.   뉴타닉스의 클라우드 플랫폼을 기반으로 제로 트러스트 보안도 구현한다. 퀄리스(Qualys)와 협업을 통해 통합 보안 패치의 우선순위를 지정하고, 감염 방지를 위한 정책을 자동적으로 생성하며, 사전에 저장된 데이터 기반으로 4000가지 이상의 랜섬웨어 서명 탐지 및 차단이 가능하다.   데이터 분석 시간 단축도 이번 AOS6의 특징 중 하나라고 강조했다. 김 상무는 ""뉴타닉스 HCI에서는 모든 워크로드를 위한 데이터 서비스를 제공해 클라우드에 핵심적인 비즈니스 크리티컬 애플리케이션의 성능을 극대화시킨다""며 ""스케일업 데이터베이스에 2배 높은 성능을 제공하며, 옵테인과 NVMe 조합은 기존 올-NVMe 기술 대비 30% 더 빠른 읽기 속도를 구현한다""고 말했다.     뉴타닉스 개방형 플랫폼의 아키텍처는 클라우데라(Cloudera), SAS 환경에서 데이터 복제를 통해 가용성을 향상시키고 뉴타닉스 플랫폼은 고속의 애플리케이션 처리 성능을 제공하는 방식으로 향상됐다.    뉴타닉스는 데이터 렌즈(Data Lens)를 새롭게 출시해 기업의 데이터 관리를 지원하는 내용도 빼놓지 않았다. 전세계 파일, 오브젝트, NAS 스토리지에 저장된 파일 및 오브젝트 데이터에 대한 완벽한 가시성, 라이프사이클 관리, 보호 및 랜섬웨어 차단, 감사 및 컴플라이언스 준수를 지원한다.   뉴타닉스 최승철 사장은 ""향후 뉴타닉스는 HCI 분야에 머물지 않고 다양한 신제품을 만들어 낼 것""이라며 ""주요 타겟은 멀티클라우드 시장에서 단일플랫폼이지만 폐쇄적이지 않은 개방적인 토탈솔루션 제공자가 될 것""이라고 언급했다.",105,https://n.news.naver.com/mnews/article/138/0002111898?sid=103
