title,date,main,section,url
문체부-OTT 음악저작권료 행정소송 '실체적 위법' 다툰다,2021.10.29. 오후 6:47,29일 문화체육관광부와 OTT 3사 간 행정소송 2차 변론이 열린 서울행정법원 제B220호 법정.문화체육관광부와 온라인동영상서비스(OTT)가 행정소송에서 문체부의 음악저작권협회 음악저작물 사용료 징수규정 개정 승인 과정에서 실체적 위법 여투를 다툰다.서울행정법원 재판부는 29일 웨이브·티빙·왓챠 등 OTT 3사가 문체부를 상대로 제기한 '음악저작권료 징수규정 승인처분 취소' 행정소송 2차 공판에서 “실체적 하자를 확인하겠다”며 “다음 변론기일까지 실체적 하자 유무를 입증할 수 있는 자료를 제출해달라”고 주문했다.OTT 3사가 원고 자격이 있다고 인정하고 징수규정 개정 심사 절차상 발생한 절차적 하자뿐만 아니라 문체부 승인에 실체적 하자가 있는지를 판단하겠다는 의미로 풀이된다.또 OTT 3사가 제기한 문서제출명령 관련 추가 검토해 판단하겠다는 입장을 밝혔다. 재판부는 “문체부 측이 문서제출명령 관련 모든 자료를 제출할 수 없다는 입장문을 28일 보냈다”며 “검토가 필요하다”고 전했다. 문체부 측은 “제공할 수 있는 자료는 다 제출했다”며 “회의록은 모두 공개한 전례가 없어 제출이 어렵다”고 설명했다.OTT 측은 “내부 검토보고서는 다 제출해달라는 것이 아니라 자료 목록을 주면 필요한 내용을 일부 공개 신청을 하겠다는 것”이라며 “자료 공개가 어렵다면 실체적 하자를 확인하기 위해 재판부와 함께 잠깐 열람이라도 했으면 한다”고 요청했다.다음 변론기일은 내년 1월 14일이다. 양측은 실체적 하자 여부를 밝히는 데 총력을 다할 것으로 전망된다.,105,https://n.news.naver.com/mnews/article/030/0002978562?sid=103
물은 나무 꼭대기까지 어떻게 올라갈까 [물에 관한 알쓸신잡],2021.10.30. 오전 11:31,"뿌리에서 흡수한 물의 전달 과정[최종수 토지주택연구원 연구위원] 세상에서 가장 키가 큰 나무는 얼마나 높을까요? 세상에서 가장 키가 큰 나무는 미국 캘리포니아 북쪽 레드우드 국립공원에 있는 하이페리온(Hyperion)이라는 이름을 가진 레드우드(미국 삼나무)입니다. 높이는 120m 정도로 건물 한 층 높이를 3m로 기준할 경우 40층짜리 건물과 비슷한 수준입니다.나무가 높이 자라는 것은 광합성에 필요한 햇빛을 잘 받기 위해서입니다. 다른 나무들보다 키가 크면 햇빛을 받는 데 유리하지요. 그런데 나무의 키가 커지면 고려할 사항도 생깁니다. 바로 식물에게 절대적으로 필요한 물을 높은 나무꼭대기까지 어떻게 공급할 것인가 입니다.



삼나무 숲. (사진=이미지투데이)하이페리온은 수령이 800년 정도 되는데 그동안 높이 성장하는 과정에서 물을 공급하는 것은 큰 문제가 되지 않았던 것 같습니다. 높은 나무의 꼭대기까지 물은 어떻게 올라갈 수 있을까요?고층 건물에 수돗물을 공급하기 위해 설치하는 고성능 펌프도 20층 이상의 높이까지 직접 올려 보내기에는 한계가 있습니다. 그런데 아무 동력도 사용하지 않는 나무는 어떻게 40층의 높이까지 물을 올려 보낼 수 있을까요?높은 나무 꼭대기까지 물이 전달되는 원리는 아직 명확하게 밝혀지지 않았지만, 다음과 같은 몇 가지 가설이 복합 작용하기 때문으로 알려져 있습니다. 뿌리에서 밀어 올리는 뿌리압, 펌프의 원리로 나뭇잎에서 끌어당기는 힘, 줄기에서 물관을 타고 물이 올라가는 모세관 현상 등이 복합 작용해야 물이 올라갈 수 있습니다.물이 올라가는 데 관여하는 현상을 하나씩 좀 더 구체적으로 살펴볼까요.먼저 땅속에 있는 물을 뿌리로 빨아들이는 삼투현상입니다. 삼투현상에 의해 땅속에 있는 물이 나무 뿌리로 이동하게 되면 뿌리압이라고 하는 뿌리 속 물의 압력이 높아집니다. 뿌리에서 밀어 올리는 압력으로 물은 줄기를 타고 서서히 위쪽으로 이동하게 됩니다. 나무의 뿌리압은 수종과 계절에 따라 다양하지만 몇m에 달하는 높이까지 물을 밀어 올릴 수 있다고 합니다.뿌리에서 나무 꼭대기로 물을 밀어 올리는 힘이 뿌리압이라고 하면 나무 꼭대기에서 물을 끌어당기는 힘도 있습니다. 바로 흡인력입니다.광합성으로 나뭇잎 뒷면 기공을 통해 수증기를 내보내면 물을 공급하는 물관 내부는 압력이 낮아지고, 물관 내부의 낮아진 압력은 흡인력을 나타내 아래쪽 물을 끌어 올리게 됩니다.마치 빨대로 물을 빨아올리는 원리와 같습니다. 나무에 잎이 무성해 광합성이 활발하게 되면 기공을 통해 내보내는 물의 양이 증가하고 결국은 물을 빨아올리는 힘도 커집니다. 이 흡인력은 나무꼭대기까지 물이 올라가는데 가장 크게 영향을 미치는 힘으로 알려졌습니다.



(이미지=최종수 위원)물을 밀어 올리는 뿌리압과 위에서 끌어당기는 흡인력 외에 영향을 미치는 것은 바로 모세관 현상입니다. 물이 줄기에 있는 물관을 타고 위로 올라가는 현상을 말합니다.물은 다른 물질에 달라붙는 부착력과 같은 물 분자끼리 잡아당기는 응집력이 매우 강한 물질입니다. 선두에 있는 물분자가 부착력을 발휘해 물관을 타고 올라가기 시작하면 나머지 물분자들이 응집력을 발휘해 선두를 따라가는 형태가 됩니다.100m가 넘는 높이의 나무 꼭대기까지 물이 올라갈 수 있는 이유를 삼투현상에 의한 뿌리압, 증산작용에 의한 흡인력, 모세관 현상 등으로 설명했지만 이것만으로는 높은 나무 꼭대기까지 물이 올라가는 것을 정확하게 설명해주지는 못합니다. 나뭇잎 증산작용에 의해 물관의 낮아진 압력이 빨대의 원리로 물을 끌어 올리는 흡인력이 가장 큰 동력이라고 했지만, 이른 봄에 나뭇잎이 전혀 없는 상태에서도 나무꼭대기에 물이 공급되는 것을 설명하지는 못합니다.한여름에 잎이 무성하고 증산작용이 활발할 때에도 수십m 높이 나무에 물이 공급되는 것을 설명하기에는 한계가 있습니다. 빨대의 원리로 물을 끌어 올릴 수 있는 높이는 10m가 채 되지 않아섭니다. 대기압이 밀어 올릴 수 있는 한계는 10m 내외기 때문에 아무리 성능 좋은 펌프도 10m 이상 높이로는 물을 끌어올리지 못합니다.흡인력 다음으로 중요한 힘은 뿌리압인데 뿌리압 역시 밀어 올릴 수 있는 물의 최대 높이가 수m 밖에는 되지 않습니다. 물관에서 모세관 현상으로 올라갈 수 있는 물의 높이는 수cm에 불과합니다. 자연 현상을 과학으로 명쾌하게 설명하기란 참 쉽지 않습니다. 높은 나무꼭대기에까지 물이 어떻게 올라가는지에 대한 질문도 마찬가지입니다.질문은 간단해 보였지만 막상 과학으로 설명하기는 쉽지 않습니다. 우리는 인공지능이 사람보다 바둑도 잘 두고 운전도 잘하는 시대에 살고 있지만 자연은 여전히 우리에게 신비함 그 자체입니다.



■최종수 연구위원(박사·기술사)은△토지주택연구원 연구위원 △University of Utah Visiting Professor △국회물포럼 물순환위원회 위원 △환경부 자문위원 △행정중심복합도시건설청 자문위원 △대전광역시 물순환위원회 위원 △한국물환경학회 이사 △한국방재학회 이사",105,https://n.news.naver.com/mnews/article/018/0005073906?sid=103
대통령도 현장도 무시…우주개발 발목 잡는 건 누구?[과학을읽다],2021.10.30. 오전 10:13,"누리호개량사업 '보류'한 예비타당성조사 결론 살펴 보니



[이미지출처=연합뉴스]""대통령의 정책 결정과 현장의 의견이 관료주의에 의해 무시당했다.""최근 공개된 '한국형 발사체 고도화 사업', 즉 누리호 개량 사업을 보류시킨 예비타당성 조사 보고서를 입수해 검토한 후 느낀 결론입니다.정부는 내년 5월 2차 발사로 마무리되는 누리호를 개량해 우주 발사체 시장에서 경쟁력을 갖추겠다는 목표로 2조200억원 규모의 개량 사업, 즉 '한국형 발사체 고도화 사업'을 추진 중입니다. 누리호는 현재 1.5t 규모의 위성을 600~800km의 저궤도에 올릴 수 있는 성능 밖에 안 됩니다. 신뢰도를 높이고 성능을 개량해야 우주 발사체 시장에서 살아남을 수 있습니다. 또 우리나라는 2030년 달 착륙 탐사선을 발사할 예정인데, 현재의 누리호로는 감당할 수 없지만 개량 사업을 통해 성능을 높여 830kg 무게의 달착륙 탐사선을 달 전이 궤도에 올릴 수 있다는 계획도 있었습니다. 문재인 대통령이 지난 3월 누리호 1단부 엔진 3차 종합 연소시험에 참석해 이같은 계획을 공식화하기도 했죠.그러나 이같은 고도화 사업은 지금 표류하고 있습니다. 지난 8월 한국과학기술기획평가원 주도로 실시된 예비타당성 조사에서 추가 발사 사업 예산 6800여억원만 통과되고 나머지 1조5000억원대의 개량 사업 예산은 보류됐기 때문입니다. 



조사보고서를 보면 한국 우주 정책의 문제점, 즉 예타 제도라는 관료주의의 비효율성, 민간인 비전문가들의 정치적 판단이 현장을 무시한 채 결정을 좌우한다는 그동안의 비판 지점이 그대로 드러나 보입니다. 우선 보고서는 개량 사업에 대해 ""필요성은 존재한다""면서도 ""최종 성능 검증이 완료되지 않은 현 시점에 성능 고도화를 추진하는 것은 불확실성이 크다""고 보류 이유를 설명했습니다. 현장 연구개발자들의 말은 전혀 다릅니다. 기술 연구 개발은 연속성이 필수라 1차, 2차 발사의 성공 여부와 관계없이 꾸준히 개량 사업과 관련된 연구개발(R&D)이 진행되도록 해줘야 한다는 것입니다. 당장 이번 보류 때문에 발사체 제작ㆍ조립 인력을 제외한 R&D 인력들은 내년까지 서류작업에만 매달려 있어야 합니다. 엄청난 시간ㆍ인력ㆍ예산 낭비가 아닐 수 없습니다. 누리호 1차 발사가 대단한 성과를 거두긴 했지만, 다른 나라의 사례에서도 볼 수 있듯 수많은 실패가 노정돼 있을 지도 모르는 상황에서 최대 2년간의 시간 낭비가 예상됩니다. 자칫 개발 일정이 지연될 경우 2030년 달 착륙 탐사선을 차기 발사체를 이용해 발사하겠다는 계획도 차질을 빚게 되죠.보고서에는 대통령 선거를 앞두고 정치적 판단이 개입된 것으로 볼 수 있는 내용도 있습니다. 보고서는 ""대규모 예산 투입이 필요하고 현재 시점에서 다양한 불확실성이 있음을 고려할 때 개량형 한국형 발사체의 개발 방향 및 개념 설계에 대한 공감대 형성이 이뤄질 필요가 있다""고 적시했습니다. 이미 문 대통령이 고도화 사업을 공약한 상태에서 장기적·연속적·안정적 투자가 필요한 연구 개발의 특성, 전문가들을 놀리지 말아 달라는 연구 현장의 의견마저 무시한 채 '공감대 형성', '다양한 불확정성'을 이유로 사업을 보류시킨 것입니다. 결론적으로 보고서는 ""막대한 예산이 투입되니 차기 대통령이 당선되고 나서 결정하자""라는 얘기로 읽힙니다. 10월 1차, 내년 5월 2차 발사를 끝낸 후, 즉 내년 대통령 선거 이후에 결정하자는 뜻입니다.덕분에 문 대통령은 의문의 1패를 당했고, R&D 인력은 허송세월하고 있습니다. 한국 우주 개발 정책이 이미 1년 이상 지체됐습니다. 기왕 수십년의 시간ㆍ노력과 엄청난 예산을 투자해 우주발사체 기술을 확보한 한국은 최대한 서둘러 경쟁력있는 발사체를 개발해 시장에 진입해야 하는 데 발목이 잡혔습니다. 이번 보고서는 예타라는 관료주의와 비전문가들의 정치적 판단 이 우주 정책의 발목을 잡고 있다는 업계 전문가들의 지적을 실감할 수 있는 계기가 됐습니다.",105,https://n.news.naver.com/mnews/article/277/0004991516?sid=103
"'메타'로 이름 바꾼 페이스북…""과제는 SF를 현실로 만드는 것""",2021.10.30. 오전 10:15,"'알파벳'으로 변경한 구글과 비슷…막대한 투자 감당 여부가 관건



메타(옛 페이스북)의 로고[로이터 연합뉴스 자료사진. 재판매 및 DB 금지]    (샌프란시스코=연합뉴스) 정성호 특파원 = 세계 최대 소셜미디어 페이스북이 '메타버스'(Metaverse) 구축에 집중적으로 투자하겠다며 사명을 '메타'로 바꾸면서 이 회사가 공상과학소설(SF) 속 세계를 현실로 만들어야 하는 과제를 안게 됐다고 CNBC가 29일(현지시간) 보도했다.     메타가 앞으로 나아갈 길이 장밋빛이 아니라 고난의 행군이 될 수 있다는 뜻으로 받아들여지는 말이다.    메타버스는 'Meta'(초월적)란 접두사와 'Universe'의 합성어로 현실세계와 융합된 3차원 가상세계를 뜻한다.    소설 '스노 크래시'에서 처음 등장한 단어로, 현실세계의 확장으로서 경제·사회·문화 활동이 벌어지는 방대한 온라인 공간을 가리킨다.    마크 저커버그 메타 최고경영자(CEO)는 메타버스가 인터넷의 다음 세대가 될 것이라며 이번 사명 변경이 ""인터넷의 다음 챕터의 시작이자 우리 회사의 다음 챕터""라고 말했다.    페이스북의 사명 변경은 2015년 세계 최대 검색엔진 구글이 지주회사 '알파벳'을 설립한 조치와 여러 면에서 포개진다.    구글은 당시 자율주행·드론·불로장생 등 다양한 미래 지향적 사업에 도전하겠다며 알파벳이란 우산을 만들고 그 밑에 구글과 각종 도전적 프로젝트인 일명 '아더 벳츠'를 두는 조직 개편을 했다.    구글이 벌어들인 막대한 수익으로 아더 벳츠에 투자한다는 구상이었다.    CNBC는 ""지난 6년간 알파벳의 결과는 페이스북이 앞으로 겪을 것으로 예상되는 일을 잘 보여준다""고 지적했다.    그러나 당초 야심과 달리 구글의 아더 벳츠 가운데 수익을 내는 사업으로 자리 잡은 것은 아직 하나도 없다.    예고한 대로라면 이미 몇 년 전에 시작했어야 할 자율주행차 운행은 여전히 초기 단계이고, 고(高)고도 풍선을 띄워 오지에 인터넷을 제공한다던 '프로젝트 룬(Loon)'은 폐기됐다. 스마트 홈 사업 부문인 '네스트'는 구글에 통합됐다.    자율주행 자회사인 웨이모와 생명공학 자회사 베릴리는 알파벳으로부터 수혈받은 돈으로 부족해 외부 투자자들로부터도 투자금을 모집하고 있다.    CNBC는 ""이는 메타에 '가장 야심 찬 아이디어도 상장사가 기꺼이 쓰려는 것보다 더 많은 시간과 돈을 필요로 한다'는 신호가 될 것""이라고 지적했다.    저커버그 CEO는 메타가 앞으로 1년간 메타버스 관련 기술을 개발하고 인력을 채용하는 데 100억달러(약 11조7천억원)를 지출하겠다고 밝혔다.    그러나 실제 메타버스를 현실화하는 데 필요한 기술을 달성하기까지는 아직도 멀었다는 관측도 나온다.     저커버그 CEO는 10년을 말했지만 메타버스에 특화한 리서치업체 '아틸러리 인텔리전스'는 할리우드 영화 '레디 플레이어 원'에서 묘사된 것처럼 완전한 몰입형 메타버스까지는 30년이 남았다고 평가했다.    페이스북 투자자들이 그때까지 참고 기다려줄 수 있을지는 미지수다.    물론 페이스북은 그동안에도 수차례 사업 방향의 전환을 시도했고 이에 성공하면서 기업가치 9천억달러(약 1천57조원)짜리 회사가 됐다.    2012년 저커버그 CEO는 이용자들이 스마트폰으로 옮겨가자 '모바일 퍼스트' 제품에 우선순위를 두라고 지시했고 같은 해 모바일에 초점을 맞춘 사진·동영상 소셜미디어 '인스타그램'을 인수했다.    이 전략은 주효해 광고주와 이용자를 만족시켰고, 페이스북에 젊은 이용자를 안겼다.    페이스북은 또 2016년에는 '동영상 퍼스트'로 전환하는 시도에 나섰고, 2017년에는 온라인 동호회와 비슷한 '그룹'을 도입해 이용자 간 연결을 강화하는 데 주력하기도 했다.    CNBC는 이번 사명 변경과 소셜미디어 기업에서 메타버스 기업으로 거듭나겠다는 선언이 기업가치가 약 9천억달러에 달하는 기업으로서는 위험한 움직임이라고 지적했다.    sisyphe@yna.co.kr",105,https://n.news.naver.com/mnews/article/001/0012757893?sid=103
