title,date,main,section,url
AI 딥러닝 적용 `24시간 산불 감시`…ICT 활용해 원전 등 국가 중요시설물 보호,2023.01.31. 오후 3:28,"산림청, '올해 산불방지 종합대책' 발표AI, 감지센서 활용해 연기나 불꽃 감지고성능 산불진화차 도입..강원 등 배치



남성현 산림청장이 31일 정부대전청사에서 '2023년산불방지 종합 대책'에 관한 브리핑을 하고 있다.    산림청 제공    AI(인공지능) 기술과 산불감지센서 등을 적용해 24시간 연기나 불꽃 등 산불을 감지하는 '지능형 CCTV'가 대형산불 발생 위험이 큰 강원·경북 동해안 지역에서 설치된다. 또한 산불로부터 원전, 가스, 문화재 등 국가 중요시설물을 보호하기 위한 실시간 'ICT 기반 산불상황관제시스템'이 가동된다.남성현 산림청장은 31일 정부대전청사에서 이런 내용을 담은 '2023년 전국 산불방지 종합대책'을 발표했다.종합대책에 따르면 ICT 기반 산불 예방·감시를 강화하기 위해 산불 위험이 큰 강원과 경북 동해안 지역을 중심으로 '산불예방 ICT 플랫폼'을 지난해 6곳에서 올해 10곳으로 늘려 24시간 산불감시체계를 구축한다. 이 플랫폼은 AI 딥러닝 기술과 산불감지센서를 연계한 지능형 CCTV를 갖춰 산불 여부를 실시간 감지한다. 최근 산림과 인접한 건축물 화재가 산불로 번지는 사례가 증가함에 따라 산림인접 시설별 산불 산불취약지수 자동산출 프로그램을 활용해 사전 위험관리를 지원한다. 또한 산림으로부터 100m 이내 소각행위를 전면 금지하고, 산불 발생 시 연료물질 역할을 할 수 있는 소나무재선충병 훈증 처리목의 파쇄 비중을 2025년까지 80%까지 높여 산불 위험요소를 사전에 제거한다.산불로부터 국가 중요시설을 보호하기 위한 선제적 대응체계도 구축한다. 이를 위해 ICT 기반의 '산불상황관제시스템'에 원전, 가스, 송전시설, 문화재 등 14만6000개의 위치를 탑재해 실시간 산불 상황을 관제한다. 전국 송전철탑의 77%가 산림에 설치돼 있는 점을 감안해 한전과 협업해 송전철탑, 송전선로 안전 관리를 강화하고, 인근 산불 시 산불 지연제(리타던트)를 투입해 확산 방지에 나선다. 산불 지연제는 지난해 봄 밀양 대형 산불 때 산불 확산 방지에 효과가 있었다고 산림청은 설명했다. 실제, 지연제가 섞인 낙엽은 75% 가량이 연소되지 않았고, 2개월 간 효과가 지속됐다.산림청은 올해 동해안 지역 등 대형 산불 취약지역에 대한 대응 역량을 높여 나갈 계획이다. 경북 울진에 '국립동해안산불방지센터'를 신설해 산불재난특수진화대와 진화 장비 등을 배치하고, 오는 12월에는 'DMZ 항공관리소'를 새로 만들어 산림청 헬기의 경우 50분 이내, 임차 헬기 30분 이내 출동할 수 있는 체제를 구축한다.아울러, 담수량이 기존 진화차에 비해 3배 이상 많고, 험준한 산악지형에 특화된 고성능 산불진화차 18대를 강원, 경북 동해안 지역에 우선 배치하고, 드론에 열화상카메라를 장착해 야간 중 화선과 이동을 확인할 수 있도록 지원한다.이와 함께 동시다발 산불이 난 경우 진화 자원의 최적 배치 알고리즘을 개발해 진화 전략 수립에 활용하고, 산불 발생지역 주민의 안전을 위해 대피 명령과 강제 대피 조치 제도를 마련·운영할 계획이다.남성현 산림청장은 ""산림청을 중심으로 지자체, 행안부, 국방부, 소방청 등 유관기관과 협력해 산불 재난에 적극 대응하겠다""며 ""산불로부터 안전한 대한민국이 되도록 국민 여러분의 협조와 관심을 부탁드린다""고 말했다.한편, 지난해 산불 발생 건수는 740건으로, 10년 간 평균(535건)보다 38% 이상 증가했고, 입산자 실화(32%), 소각산불(26%), 담뱃불 실화(6%) 등 대부분이 사람에 의한 부주의로 산불이 발생한 것으로 조사됐다.  



지난해 발생한 밀양 산불 진화 장면    산림청 제공",105,https://n.news.naver.com/mnews/article/029/0002781396?sid=103
페이코인 사태 내일이 분수령…닥사와 소명 회의 예정,2023.01.31. 오후 4:39,"서비스 종료 여부 결론 내고, 닥사와 회의 진행할 듯페이코인 ""은행 계좌 확보 자신...곧 해소될 이슈""서비스 종료·상폐 두개 악재 터지면 이용자 피해 우려금융당국의 신고 불수리 결정 후 시총 3300억 증발[이데일리 임유경 기자] 300만 이용자를 보유한 국내 가상자산 결제서비스 페이코인의 서비스 종료 및 상장폐지 여부가 사실상 내일(1일) 판가름날 전망이다.31일 가상자산 업계에 따르면 페이코인 측과 디지털자산 거래소 공동협의체(DAXA·이하 닥사) 회원사 중 페이코인을 상장한 업비트, 빗썸, 코인원 담당자들이 다음 달 1일 회의를 가진다. 닥사는 같은 달 6일부로 서비스를 종료해야 하는 페이코인을 유의종목으로 지정해 놓은 상태로, 이날 회의는 페이코인의 현재 상황을 공유하고, 향후 계획 등을 듣는 일종의 소명 자리가 될 예정이다.페이코인은 지난 6일 금융당국으로부터 한 달 내에 결제 서비스를 중지하라는 통보를 받았다. 서비스를 계속하려면 지난해 연말까지 은행 실명계좌를 획득하고 ‘가상자산 매매업자’로 변경 신고를 내라고 했는데, 기한 내 은행실명계좌 확보에 실패하면서다. 페이코인은 이용자로부터 코인을 받은 후, 원화로 환전해 가맹점에 정산해주는 구조로 운영되는데, 금융당국은 이 과정에서 ‘코인 매매’가 일어나기 때문에 가상자산 거래소처럼 은행 실명계좌가 필요하다는 유권해석을 내렸다.



[이데일리 김일환 기자]이번 회의에서 페이코인 측은 서비스 종료일인 6일 전에 은행 실명확인 계좌를 확보하고 금융당국에 가상자산 매매업자로 재신고할 수 있는지 여부에 대해 닥사와 상황을 공유할 것으로 보인다. 즉, 이날까지는 페이코인 측도 서비스 종료 여부에 대한 결론을 내리고 후속 조치에 집중해야 한다는 얘기다.서비스 종료일까지 일주일도 시간이 남지 않은 상황에서 극적인 계약성사 소식이 나올 가능성은 크지 않아 보인다. 커머스 업계에 따르면 페이코인 측도 이미 파트너 가맹점에 서비스 일시 종료에 대한 안내를 시작한 것으로 전해진다.페이코인은 불가피하게 서비스가 종료되더라도 상장폐지만은 막아야 하는 입장이다. 닥사는 서비스가 종료될 경우 페이코인을 상장폐지할 수 있다는 분위기를 풍기고 있다. 닥사 소속 거래소 관계자는 “결제용 코인인데 결제 서비스가 중단되는 것만큼 중대한 상장폐지 검토 사유가 또 있겠느냐”며 상장폐지 가능성을 배제하지 않았다.페이코인은 은행실명계좌 확보가 시간문제라고 보고 있다. 따라서, 이날 회의에서도 실명계좌를 받으면 서비스가 재개될 수 있다는 점을 강조할 것으로 보인다. 페이코인 관계자는 “은행과 실명계좌를 계약 논의가 막바지에 있다”며 “실명계좌 확보는 시간의 문제일 뿐이라 본다”고 강조했다.현재 상장폐지될 경우 300만명에 이르는 페이코인 실사용자들이 막대한 금전적 피해를 볼 수 있다는 점도 호소할 것으로 예상된다. 금융 당국이 페이코인에 서비스 종료를 통보한 직후 페이코인 이용자들은 한 차례 타격을 입은 바 있다. 당시 페이코인 가격은 37% 넘게 폭락했고, 시가총액은 3300억원이 증발했다. 현재는 다소 회복된 상태다. 서비스 종료와 상장폐지라는 초대형 악재가 한번에 몰아칠 경우 시장은 더 크게 동요할 것으로 보인다.",105,https://n.news.naver.com/mnews/article/018/0005415623?sid=103
"리디, 웹툰 구독 서비스 `만타` 스페인어 서비스 시작",2023.01.31. 오전 10:53,"리디가 글로벌 웹툰 구독 서비스 '만타(Manta)'에서 스페인어 서비스를 시작한다. 리디 제공    리디는 글로벌 웹툰 구독 서비스 '만타(Manta)'의 스페인어 서비스를 시작한다고 31일 밝혔다.'상수리나무 아래', '반쪽' 등 글로벌 인기작을 스페인어로 공개하고 현지 문화와 감수성을 고려해 다양한 작품들을 순차적으로 선보일 예정이다.만타는 다양한 장르의 웹툰을 월정액으로 부담 없이 즐길 수 있는 구독 서비스다. 2020년 11월 북미 시장에 출시한 이후 현재 175여개국에서 서비스 중이다. 지난해 10월에는 800만 다운로드를 돌파한 데 이어 구글 플레이스토어 만화 카테고리에서 1위에 등극하기도 했다. 지난해에는 뉴욕 타임스퀘어에 리디의 메가 히트작인 '상수리나무 아래'를 중심으로 한 글로벌 마케팅을 펼쳤다. 특히 만타에서 '상수리나무 아래' 시즌2 연재를 기념한 틱톡 챌린지는 누적 조회수 87억을 돌파했다.만타 앱은 구글 플레이스토어와 애플 앱스토어에서 내려받을 수 있으며 앱에서 영어와 스페인어를 설정할 수 있다.배기식 리디 대표이사는 ""이번 만타의 스페인어 서비스는 단순한 언어 확장이 아닌 철저한 현지화 분석과 다양한 시도 끝에 선보이게 된 것""이라며 ""앞으로도 다양한 국적의 글로벌 고객과 함께하기 위해 사업 역량을 강화하는 데 집중해 나갈 계획""이라고 말했다.",105,https://n.news.naver.com/mnews/article/029/0002781305?sid=103
"기상청, 아세안 기상청장 포럼 첫 추진…ODA·녹색산업 지원 강화",2023.01.31. 오전 7:00,"中·日과 소위 참가 형식 벗어나 고위급 포럼으로 역할 주도농식품부·환경부 등 ODA 지원 역할도…수출기술 개발 주력



유희동 기상청장. /뉴스1 ⓒ News1 김명섭 기자(서울=뉴스1) 황덕현 기자 = 기상청이 개청 이래 처음으로 동남아시아 국가 기상청장 포럼을 추진하고 있다. 이를 통해 기상·기후 분야 공적개발원조(ODA) 사업을 강화하겠다는 취지다. ODA는 기본적으로 개발도상국에 대한 지원이지만 국내 녹색산업이 해외로 진출하기 위한 교두보를 마련하는 성격도 있다. 윤석열 대통령이 강조한 '전 부처의 산업부화'에 기상청도 적극 나선 셈이다. 31일 <뉴스1> 취재를 종합하면 기상청과 한국기상산업기술원 등은 가칭 '아시아 지역 기후변화 대응 고위급 정책포럼'을 추진 중이다. 올해 처음 추진하는 고위급 정책포럼은 아세안(ASEAN) 회원국이 대상이다. 9월쯤 싱가포르와 인도네시아, 태국, 베트남 등 동남아 10개국 기상청장을 모두 초청해 동남아 지역 기상·기후 ODA를 지속·확대하기 위한 정책을 협의할 계획이다.기상청은 그동안 아세안의 기상지구물리소위원회(SCMG)에 중국, 일본과 참가하는 형식으로 아세안에 대한 ODA 사업을 지원해왔다. 이번 고위급 포럼을 통해 보다 주도적으로 ODA 사업을 추진할 계획이다. 기상청 관계자는 ""3월 중 세부계획을 수립한 뒤 9월쯤 포럼을 개최할 예정""이라고 밝혔다.기상청은 지금도 아세안 지역에서 여러 ODA 사업을 추진하고 있다. 인도네시아와 베트남, 캄보디아 등에는 예보 기술과 위험기상 분석 기술을 전수했다. 지난해부터는 40억원을 들여 필리핀에서 태풍 감시·예측 플랫폼을 구축 중이다. 라오스에는 올해까지 약 36억원을 투자해 태풍관제 시스템을 구축해주고 있다.기상청의 ODA 사업은 다른 부처의 ODA 사업을 기술적으로 지원하는 역할을 한다. 아세안 지역에서는 다른 부처나 한국 기업의 ODA사업에서 날씨나 기후 정확도가 성패에 영향을 미치는 경우가 많기 때문이다. 농림축산식품부가 필리핀과 인도네시아 등에서 추진한 K-스마트팜, 환경부 산하 한국수자원공사가 인도네시아에서 추진 중인 광역상수도 사업 등이 대표적이다. 산림청이 추진 중인 숲 조성 사업도 있다. 산림청은 2025년까지 베트남 남딘, 닌빈과 캄보디아 씨엠림에 자연휴양림 등을 조성하고 있다. 산림 보전·복원 사업은 탄소배출권을 확보하는 것과 관계가 깊다. 탄소를 흡수하는 나무를 벌채하지 않고 보호하는 것만으로도 탄소를 감축하는 효과를 국제적으로 인정받기 때문이다. 산림청은 ODA를 통해 국가 온실가스 감축목표(NDC)를 달성을 위해 확보해야 할 국외 탄소배출권 확보를 추진 중이다.기상청의 대(對) 아세안 ODA 사업 강화가 결국 국내 녹색산업 수출과 국외 탄소배출권 확보 등에 직간접적 지원 역할을 하는 것이다. 환경부가 2027년까지 추진 중인 '녹색산업 100조원 수출'을 지원하는 역할도 된다.   



서울 동작구 신대방동 기상청 본청 전경. /뉴스1 ⓒ News1 황덕현 기자녹색산업 지원 역할을 강화하기 위해 기상청은 올해 스마트시티와 호우·대설·태풍·지진 감시·대응 기술 개발에 주력할 계획이다. 기상청 산하 한국기상산업기술원이 올해 추진 중인 5대 신규과제 13건을 보면 정보통신기술(ICT)과 빅데이터, 인공지능(AI)을 융복합해 서비스화하는 것에 방점을 두고 있다. 세부적으로는 서울 송파구를 대상으로 폭염과 한파를 분석해 날씨가 도시 내 시민에게 미치는 영향 등을 실증 분석하는 연구를 진행한다. 인공지능을 활용해 지진 정보를 생산하고, 영상을 통해 지진 해일을 자동 관측하는 등 기술도 개발한다. 기상청과 한국기상산업기술원은 이 같은 신기술을 개발해 향후 기술 수출까지 노리고 있다. 지난해 취임한 유희동 기상청장은 국회 업무보고를 통해 기상산업을 키워 사회적 가치를 창출하겠다고 밝힌 바 있다.",105,https://n.news.naver.com/mnews/article/421/0006602662?sid=103
"[포토] 랩투아이, '코싸인 앱' 시연회",2023.01.31. 오후 8:02,[이데일리 김태형] 랩투아이 임직원들이 31일 경기도 성남시 랩투아이 본사에서 열린 기자간담회에서 코싸인 앱을 시연하고 있다.코싸인 앱은 AI데이터로 디지털자산 시장 분석 및 투자정보 제공하여 투자자 스스로 합리적인 투자를 할 수 있도록 도와준다.,105,https://n.news.naver.com/mnews/article/018/0005415794?sid=103
"울산시, 서울서 바이오기업 유치 설명회…인프라·지원책 홍보",2023.01.31. 오후 2:27,"바이오 데이터팜[울산시 제공. 재판매 및 DB 금지]    (울산=연합뉴스) 허광무 기자 = 울산시는 31일 오후 서울 코엑스 컨퍼런스룸에서 '바이오 기업 유치 설명회'를 열었다.    이 행사에는 게놈(유전체) 서비스산업 규제자유특구사업 참여 기업, 생명 의약 분야 기업, 전문 투자기관 등 약 30개 기업·기관 관계자 70여 명이 참석했다.    시는 이들 기업과 기관을 대상으로 그동안 추진해 온 바이오산업 육성 정책의 추진 성과를 공유하고, 민선 8기에 추진할 바이오산업 활성화 전략을 발표했다.    또 게놈 서비스산업 규제자유특구사업으로 운영하는 '바이오 데이터 팜'의 장비와 시스템 인프라 현황을 소개하고 활용 방법을 시연, 울산 게놈 바이오 산업의 강점을 중점적으로 홍보했다.    아울러 울산의 기업 투자 환경과 지원 정책도 함께 소개하면서 울산에 투자 의향을 지닌 기업과의 네트워크 확보에 주력했다.    시는 이날 설명회가 바이오 기업의 신기술 개발과 경쟁력 확보, 투자자들과의 교류 확대를 통한 실질적 사업화 등에 도움이 될 것으로 기대하고 있다.    노동완 울산시 산업국장은 ""앞서 1만 명 게놈 빅데이터를 구축하고 관련 분야 연구 인프라를 갖춘 울산은 바이오 기업을 운영하기 위한 최적지""라면서 ""창업, 성장, 사업화 등 기업 전 주기에 필요한 다양한 지원사업을 확충해 바이오 기업을 적극적으로 유치하겠다""라고 밝혔다.    hkm@yna.co.kr",105,https://n.news.naver.com/mnews/article/001/0013728505?sid=103
"진원생명과학 ""텍사스 신규공장 생산 의약품 첫 공급 계약""",2023.01.31. 오전 10:39,"진원생명과학[진원생명과학 홈페이지 캡처. 재판매 및 DB 금지](서울=연합뉴스) 조현영 기자 = 진원생명과학은 미국 텍사스주 신규 공장에서 생산하는 DNA 의약품을 처음으로 공급하는 계약을 했다고 31일 밝혔다.    계약 규모는 580만 달러(약 72억 원)이며 계약 상대방은 아시아 바이오 업체이나, 계약에 따라 공개되지 않았다.    VGXI는 지난해 10월 미국 텍사스주에 대규모 DNA 의약품 위탁개발생산(CDMO)이 가능한 신규 공장을 준공한 바 있다.     박영근 진원생명과학 대표이사는 ""신규 공장에서 생산하게 되는 첫 공급계약을 체결하게 돼 기쁘다""라며 ""지속해서 증가하는 고품질 플라스미드 DNA 의약품 수요를 선점하기 위해 꾸준히 영업활동을 펼쳐 실적 개선에 집중할 것""이라고 밝혔다.     hyun0@yna.co.kr",105,https://n.news.naver.com/mnews/article/001/0013727709?sid=103
[인사] 한국전기연구원,2023.01.31. 오전 10:37,"◇한국전기연구원 ▽본부장, 센터장, 실장 △전력망연구본부장 및 의왕분원장 이상호 △전기기기연구본부장 주문노 △전기응용연구본부장 한성태 △전략정책본부장 김태현 △경영지원본부장 및 운영관리실장(광주) 겸임 문소민 △차세대전력망연구센터장 이승렬 △전기환경연구센터장 강성만 △전기물리연구센터장 장성록 △강소특구기획실장 김종문 △인공지능연구센터장 최오규 △절연재료연구센터장 강동준 △사업운영실장 김대웅 △운영관리실장(안산) 백창제 △대외협력실장 서재훈",105,https://n.news.naver.com/mnews/article/584/0000021753?sid=103
"TBS, '서울시 지원 중단' 조례에 행정소송 결정",2023.01.31. 오후 6:11,"15일 오후 서울 종로구 서울시의회 본회의장에서 열린 '제315회 시의회 정례회'에서 '티비에서(tbs) 설립 및 운영에 관한 조례 폐지 조례안'이 통과되고 있다. 2022.11.15./사진제공=뉴시스서울시의 'TBS 예산지원 중단' 조례에 대해  TBS가 행정소송에 나선다.31일 방송업계에 따르면, TBS 이사회는 지난 12일 서울시의회가 통과시킨 TBS 지원조례 폐지안에 대한 행정소송을 제기하기로 했다.서울시의회는 지난해 11월 '서울시 미디어재단 TBS 설립 및 운영에 관한 조례 폐지조례'를 통과시켰다. 이는 TBS가 서울시 출자·출연기관에서 나와 독립 경영을 할 수 있도록 서울시의 TBS 지원을 폐지하는 내용이다. 1년 간의 유예기간을 거쳐 내년 1월1일 시행된다.TBS는 전체 예산의 70%를 서울시 출연금에 의존하고 있어, 지원이 끊길 경우 사실상 TBS의 운영의 파행이 불가피한 상황이다. 서울시의 TBS에 대한 올해 출연금은 232억원으로 지난해(320억원)보다 88억원 줄었다.",105,https://n.news.naver.com/mnews/article/008/0004845845?sid=103
"""고젝·그렙 덤벼"" 라오스에서도 '카카오T', 동남아 진출 신호탄",2023.01.31. 오전 11:09,"/사진=카카오모빌리티카카오모빌리티가 라오스에 진출해 '고젝'·'그랩' 등 글로벌 업체와 본격적인 경쟁에 나선다. 카카오모빌리티는 라오스 기업 엘브이엠씨홀딩스와 업무협약을 체결하고 현지 전용 서비스 플랫폼을 구축한다고 31일 밝혔다. 라오스를 방문한 한국인뿐 아니라 현지인도 이용할 수 있는 모빌리티 서비스를 연내 출시한다는 목표다. 1997년 라오스에 설립된 엘브이엠씨홀딩스는 베트남·미얀마·캄보디아 등 인도차이나반도에서 자동차, 오토바이 생산 및 제조 등 모빌리티 사업을 전개한다. 라오스 내 민간기업 중 최대 규모로 라오스 차량판매 1위, 베트남 상용차 판매 2위 등 동남아 시장 입지가 탄탄하다. ━전기 풍부한데 대중교통 부족 ""전기차 테스트베드""━라오스는 미국·중국과 함께 세계적인 모빌리티 시장으로 평가된다. 동남아에서 유일한 내륙국으로, 메콩 지역의 모든 국가(캄보디아·미얀마·태국·베트남) 및 중국과 국경을 맞대고 있어 동남아 진출 전초기지로 적합하다는 판단이다. 또 전력을 수출할 정도로 전기에너지가 풍부해 전기차 주요 테스트베드가 될 전망이다. 반면 대중교통 인프라는 현저히 부족해 카카오모빌리티만의 고도화된 데이터 분석 및 ICT(정보통신기술) 기반 서비스 운영 노하우를 이식한다는 방침이다. 카카오모빌리티는 라오스 서비스 운영 경험을 발판 삼아 향후 동남아 전역으로 사업을 확장할 예정이다. 고젝·그랩 등 글로벌 모빌리티 기업의 아성이 높은 동남아 시장에서 카카오모빌리티가 지닌 독자 기술 인프라의 경쟁력을 입증한다는 계획이다.  ━韓 택시 앱 넘어 '비욘드 코리아' ━카카오모빌리티는 해외진출을 적극 추진 중이다. 지난해엔 괌에 카카오T 플랫폼을 적용,  현지 택시 예약 서비스와 공항 픽업 서비스를 제공하고 있다. 세계 32개국에서 운영 중인 '카카오T 로밍'도 엔데믹(감염병의 풍토병화)으로 상승세다. 해외 여행 수요가 회복되기 시작한 지난해 6월 첫주(2~8일) 대비 올해 설 연휴 기간(1월 19~25일) 베트남과 태국에서 카카오T 로밍 일평균 운행완료수가 각각 3.8배, 7.5배 이상 증가했다. 지난해 10월 자유여행이 재개된 일본에선 국경 완화 시점(10월 13~19일) 대비 운행완료수가 무려 27배 이상 증가했다. 안규진 카카오모빌리티 사업부문총괄 부사장은 ""해외 로밍을 넘어 기술 인프라의 현지 직접 적용을 통해 한국 모빌리티 플랫폼의 세계화를 이뤄나가고 있다""며 ""이번 라오스 진출을 계기로 전세계 주요 모빌리티 시장인 동남아시아에서 글로벌 경쟁력을 입증하고 성공적인 해외 진출 사례를 지속적으로 만들어나가겠다""고 말했다.",105,https://n.news.naver.com/mnews/article/008/0004845550?sid=103
애플 전문 분석가 “폴더블 아이패드 내년에 나올 수도”,2023.01.31. 오후 1:54,"서울 신사동 가로수길 애플 매장의 로고 모습./ 뉴스1        아이폰 제조업체 애플이 2024년에 화면이 접히는 폴더블 아이패드를 출시할 것이라는 전망이 나왔다.애플 분석 전문가인 궈밍치 TF증권 애널리스트는 30일(현지 시각) 자신의 트위터에 “올해 아이패드 출하량에 대해 신중한 입장”이라며 “전년 대비 출하량이 10∼15% 줄어들 것이다”라고 전망했다.이어 “그럼에도 내년에 폴더블 아이패드에 대해 긍정적”이라며 “이 새로운 모델이 출하량을 늘리고 제품 믹스를 개선할 것으로 기대한다”고 했다.궈밍치 애널리스트는 2021년에는 폴더블 아이폰의 2024년 출시를 예상했는데, 이번에는 출시 시기는 같지만 제품은 폴더블 아이폰이 아닌 아이패드로 바꿨다.궈밍치 애널리스트의 이런 전망은 시장분석기관 CSS 인사이트의 보고서와도 일치한다는 점에서 폴더블 아이패드의 내년 출시에 무게가 실린다.CCS 인사이트는 지난해 10월 낸 보고서에서 애플이 2024년 접히는 스크린의 아이패드를 출시할 가능성이 크다고 전망한 바 있다.CCS 인사이트의 벤 우드 리서치 수석 애널리스트는 당시 “지금 애플이 폴더블 아이폰을 만드는 것은 맞지 않는다”라며 “우리가 볼 때 애플은 그런 트렌드를 피하고 아마도 폴더블 아이패드에 발을 담글 것”이라고 예상했다.한편 삼성은 그동안 여러 개의 폴더블폰을 출시했다. 이에 경쟁사인 애플 역시 폴더블 아이폰을 내놓을지 시장의 관심이 쏠렸으나 궈밍치는 폴더블 아이폰에 대해서는 언급하지 않았다.다만, 애플이 폴더블 아이패드를 먼저 출시한 후 시장 반응을 본 뒤 폴더블 아이폰을 내놓을 수 있다는 전망도 나온다.",105,https://n.news.naver.com/mnews/article/366/0000873543?sid=103
