title,date,main,section,url
"비트코인, 4% 올라 2만8000달러 회복…'파월 충격' 벗어나",2023.03.24. 오전 9:32,"파월 연준 의장, 전날 기자회견서 금리인하 가능성 일축비트코인 4% 하락했으나, 하루 만에 제자리로'금리인상 사이클 막바지'에 주목연내 1차례 0.25% 인상 후 금리 인상 중단 가능성 커[이데일리 임유경 기자] 제롬 파월 연방준비제도(Fed)의장의 매파적 발언에 하락했던 비트코인이 하루 만에 반등에 성공했다.24일 가상자산 시황 중계 사이트 코인마켓캡에 따르면 이날(오전 8시30분 기준) 비트코인 시세는 24시간 전 대비 4% 상승한 2만8360달러를 기록했다. 알트코인(비트코인 외 가상자산) 대표주자 이더리움은 5% 올라 1817달러에 거래 중이다. 전체 가상자산 시가총액은 3.6% 커져 1조1900억 달러를 기록했다.가상자산 시장은 전날 파월 연준 의장이 연내 금리인하 가능성을 일축하면서 위축됐다.



제롬 파월 연준 의장22일(현지시간) 연준은 연방공개시장위원회(FOMC) 정례회의를 통해 3월 기준금리를 0.25%포인트 인상하기로 결정했다. 파월 의장은 회의를 마친 뒤 가진 기자회견에서 은행 시스템 위기 확산을 막기 위해 모든 수단을 동원하겠다면서도, 인플레이션이 지속될 가능성이 있어 금리인하는 하지 않겠다는 입장을 밝혔다. 시장이 기대하고 있는 금리 인하 시점에 대해선 “FOMC 참석자들이 올해 중 금리인하를 전망하지 않는다는 것이 가장 유력한 시나리오”라며, 선을 그었다. 오히려 “우리가 금리를 더 올릴 필요가 있다면 그렇게 할 것”이라며, 매파적 발언을 쏟아냈다.파월 충격은 하루만에 가신 분위기다. 이제 시장은 연준의 금리인상 사이클이 막바지에 이르렀다는 점에 더 주목하고 있다. 연준은 올해 최종 금리 중위값을 지난해 12월 예상치와 같은 5.1%로 제시했는데, 이는 올해 한 번 더 0.25%포인트 금리를 인상하고 금리인상을 중단할 수 있다는 의미다.  시카고상품거래소(CME) 그룹의 페드워치에 따르면 연방기금(FF) 금리 선물시장은 오는 5월 연준이 금리를 인상하지 않을 가능성을 65.8%로 보고 있다. 한편, 가상자산뿐 아니라 미국 뉴욕 증시도 일제히 반등에 성공했다. 23일(현지시간) 뉴욕증권거래소에서 우량주를 모아 놓은 다우존스30 산업평균지수는 전장보다 0.23% 상승 마감했다. 대형주 중심의 스탠더드앤드푸어스(S&P)500지수와 기술주 중심의 나스닥지수는 각각 0.30%, 1.01% 상승했다.",105,https://n.news.naver.com/mnews/article/018/0005448835?sid=103
하늘길 열리니 ‘이 앱 써야겠네’…2년 전 대비 이용량 40.2% 급증한 통번역 앱,2023.03.24. 오후 10:16,"파파고 앱 이미지   지난달 이용자, 1년 전보다 파파고 26.7%·구글 번역 11% 증가전문가 ""영어 외 외국어 사용국 여행·자유여행 늘어났기 때문""코로나19에 따른 사회적 거리두기가 풀린 지난해 초 이후 해외여행이 늘면서 지난 1년간 네이버 파파고를 비롯한 통번역 앱 이용량도 함께 증가한 것으로 나타났다.24일 아이지에이웍스의 빅데이터 분석 솔루션 모바일인덱스에 따르면 지난달 파파고 앱 구글 플레이스토어·애플 앱스토어 합산 월간 활성 이용자는 530만8606명으로 집계됐다.1년 전 418만9145명보다 26.7%, 2년 전 378만5372명보다는 40.2% 증가한 것이다. 파파고 앱 이용자는 지난해 2월까지 450만 명 아래에 머물다가 그해 3월부터 대체로 꾸준히 증가했다. 일본 무비자 입국이 2년 7개월 만에 재개되며 관광객이 늘어난 이후인 지난해 11월에는 500만 명을 넘긴 뒤 계속 상승세다.파파고 앱은 영어와 중국어, 일본어, 프랑스어, 스페인어 등 13개 다국적 언어 인공지능(AI) 번역 서비스를 제공한다.네이버 자체 분석에 따르면 지난달 기준 해외에서 파파고를 쓴 이는 1년 전보다 35% 늘었다. 엔데믹으로 해외여행 수요가 오른 데 따른 것으로 추정된다고 네이버는 밝혔다.국내에서 파파고 다음으로 널리 쓰이는 통번역 앱인 ‘구글 번역’도 지난 1년 사이 인기가 소폭 늘었다. 지난달 구글 번역 앱 이용자는 225만9404명으로, 1년 전(203만6387명)보다 약 11% 증가했다. 지난해 11월(214만9736명) 이후 3달 연속 이용자가 증가한 것이다. AI·집단지성 번역 앱 플리토 역시 지난달 앱 이용자가 2만7319명으로 1년 전 1만8295명에 비해 49.3% 올랐다. 통번역 앱 사용자 증가는 해외여행 수요가 지난해부터 다시 늘었고, 여행지나 여행 방식이 다양해진 분위기와 밀접하게 연관된 것으로 분석된다. 한국관광공사의 집계에  따르면 지난 1월 해외로 출국한 우리 여행객은 전년 동기 대비 1109% 폭증한 178만2313명이었다. 지난해에는 모두 655만4031명이 출국하면서 2021년 122만2541명보다 436.1% 급증했다.",105,https://n.news.naver.com/mnews/article/021/0002563190?sid=103
"""'테라·루나 사건' 핵심인물 권도형 체포""…마침내",2023.03.24. 오후 12:17,"몬테네그로 공항서 현지경찰에 체포법무부 ""송환 절차 진행할 예정""



/그래픽=비즈워치법무부는 '테라‧루나 사건' 관련 핵심 인물인 권도형 테라폼랩스 대표를 23일(현지시간) 몬테네그로 포드고리차 공항에서 현지 경찰이 체포했다고 24일 확인했다.권도형 씨와 일당 중 1명은 세르비아와 국경을 접하는 몬테네그로로 이동해 포드고리차 공항에서 코스타리카 위조여권을 이용, 아랍에미리트(UAE) 두바이로 출국하려다가 체포됐다고 법무부는 설명했다.법무부 관계자는 ""양국은 범죄인 인도에 관한 유럽협약' 가입국이므로 법률과 국제협약에 따라 송환 절차를 진행할 예정""이라고 말했다.'테라‧루나 사건'은 테라폼랩스가 개당 1달러로 가격이 고정되는 콘셉트의 스테이블 코인 '테라USD'을 내놓고 다른 코인 '루나'로 가격을 유지해왔지만 이같은 구조가 붕괴하고 다른 가상자산 가격도 줄줄이 하락해 대규모 투자 피해자가 발생한 일을 말한다.권도형 대표는 당시 싱가포르로 출국해선 귀국하지 않았다.",105,https://n.news.naver.com/mnews/article/648/0000014909?sid=103
,,,105,https://n.news.naver.com/mnews/article/347/0000170936?sid=103
"NHN클라우드, 클라우드 입문서 '처음 배우는 NHN클라우드' 출간",2023.03.24. 오후 1:52,"NHN클라우드가 클라우드 이용자를 위한 NHN클라우드 기본 개념 및 기술 활용법을 소개하는 기술 서적 '처음 배우는 NHN클라우드'를 출간한다.'처음 배우는 NHN클라우드'는 클라우드 활용 노하우를 담은 기본 학습서로 클라우드 기술 개념과 NHN클라우드의 다양한 서비스 실습 사례 등을 제공하는 책이다. 클라우드 이용 초심자가 서비스를 이용하며 맞닥뜨릴 수 있는 궁금증과 이에 대한 해결책을 스토리와 실습을 기반으로 알기 쉽게 소개한다.NHN클라우드를 이해하고 다루는 데 필요한 기본기를 배우려는 개발자, 시스템 엔지니어, 기술 영업사원, 정보기술(IT) 분야 전공자는 책에 담긴 다양한 활용 사례를 바탕으로 역량을 쌓을 수 있다.NHN클라우드 관계자는 “'처음 배우는 NHN클라우드'가 클라우드 서비스를 공부하고 업무에 도입해 보고 싶은 이용자에 도움이 되는 기술 활용 길잡이가 되길 기대한다”며 “클라우드 기술을 전파하기 위해 노력하겠다”고 말했다.",105,https://n.news.naver.com/mnews/article/030/0003086488?sid=103
,,,105,https://n.news.naver.com/mnews/article/236/0000232519?sid=103
"""'혁신가 딜레마'에 빠졌나""…혹평 이어진 구글챗봇 '바드'",2023.03.24. 오후 6:47,"출시 후 이용자 가운데서 혹평 나와""혁신 실패하면 위협 직면할 것""구글이 내놓은 인공지능(AI) 챗봇 '바드'가 마이크로소프트(MS) 검색 엔진 '빙'보다 떨어진다는 평가가 나왔다. 앞서 MS는 오픈AI가 개발한 챗봇 '챗GPT'를 빙에 이식함으로써 검색 기능을 끌어올렸다. 하지만 구글 검색과 바드의 조합은 이를 따라잡는 데 실패했다는 지적이다.23일(현지시간) 미국 경제매체 '비즈니스 인사이더'에 따르면 구글은 지난 21일부터 미국과 영국 등에서 일부 이용자를 대상으로 바드 테스트를 진행하고 있는데, 일부 이용자들은 바드의 성능에 대해 불만을 표출하고 있다.일례로 구독자 수 1670만명에 달하는 미국 최대의 테크 유튜버 'MKBHD'(본명 마르케스 브라운리)는 자신의 공식 트위터 계정에 ""구글 바드를 이용해 봤는데 이런 말을 할 줄 몰랐다. 지금까지는 빙이 바드를 훨씬 앞선다""라고 지적했다.



구글 로고 [이미지출처=연합뉴스]바드의 성능에 혹평을 내린 것은 브라운리뿐만이 아니다. 에딘 몰릭 미 펜실베이니아대 교수는 ""아직 판단이 이른 감이 있으나 구글의 바드는 MS의 빙, 오픈AI의 최신예 GPT-4만큼 학습 도구로서의 능력은 없는 것 같다""라고 했다. 몰릭 교수는 바드에게 시 창작을 지시하는 방식으로 성능을 실험했는데, 빙과 비교해 확연히 떨어지는 모습을 보여줬다고 한다.영화감독인 데이비드 린치는 ""GPT-4로 만든 영화 시나리오는 흥미진진했지만 바드는 평범한 것을 내놨다""라고 했다. 또 바드는 단어 퍼즐 맞추기 실험에서도 빙보다 뒤처지는 모습을 보였다고도 전했다.이를 두고 '비즈니스 인사이더'는 ""구글은 혁신가의 딜레마에 빠졌다""라며 ""혁신에 실패하면서 위협에 직면할 수 있다""라고 지적했다. 구글이 AI 기술의 상업적 적용에서 MS에 뒤처진 결과, 주력 사업인 검색 분야에서도 흔들릴 수 있다는 것이다. 한편 MS는 챗GPT 개발사 오픈AI와 전격 협력, 검색 엔진 '빙'에 GPT 계열 AI를 이식하거나 자사 사무용 소프트웨어에 AI를 탑재하는 등 다양한 AI 관련 제품을 내놓고 있다.",105,https://n.news.naver.com/mnews/article/277/0005235892?sid=103
골수이식후 'NK세포' 투여하니…혈액암 진행 절반으로,2023.03.24. 오전 6:01,"이규형 서울아산병원 교수 연구팀유사메모리 NK세포 등 증식 확인



(왼쪽부터) 이규형 서울아산병원 혈액내과 교수, 최인표 한국생명공학연구원 명예연구원, 조광현 카이스트 바이오및뇌공학과 교수. 사진 제공=서울아산병원[서울경제] 예후가 나쁜 급성골수성백혈병(AML·Acute Myeloid Leukemia) 환자에게 골수이식 후 자연살해(NK)세포를 투여하면 질병 진행을 억제할 수 있다는 분석 결과가 나왔다.이규형 서울아산병원 혈액내과 교수와 최인표 한국생명공학연구원 명예연구원(인게니움테라퓨틱스 최고연구책임자), 조광현 카이스트 바이오및뇌공학과 교수 공동 연구팀은 AML 진단 후 부모-자식 간 골수이식을 받은 환자들에게 골수 공여자의 NK세포를 투여한 결과 투여받지 않은 환자군보다 병의 진행이 50% 정도 감소한 것으로 나타났다고 23일 밝혔다.AML은 비림프구성 또는 골수에서 만들어지는 골수성 백혈구의 줄기세포에서 발생한 악성 종양을 말한다. 성인의 급성 백혈병 중 가장 흔한 유형으로 인구 고령화 추세에 따라 골수형성이상증후군과 함께 발병 빈도가 급증하고 있다. 다만 백혈병 세포가 항암제에 내성을 보이고 골수이식을 해도 기대만큼 치료 효과를 보기 어렵다.연구팀은 2015∼2018년 AML과 골수형성이상증후군으로 부모-자식 간 골수이식을 받은 반일치 골수이식 환자를 모집한 다음 NK세포 투여군40명에게 골수 공여자의 NK세포 치료제를 골수이식 후 2~3주에 걸쳐 2회 투여하고 대조군 36명과 비교했다. 평균 30개월 동안 추적관찰한 결과 NK세포 투여군은 35%에서만 질병이 진행됐지만 비투여군은 61%로 50% 가량 차이를 보였다. 골수이식 후 3개월이 경과한 시점에 면역 회복 정도를 살펴보기 위해 NK세포와 T세포의 평균 개수를 측정한 결과 NK세포 투여군이 비투여군보다 각각 1.8배, 2.6배 더 많은 것으로 확인됐다. NK세포는 혈액 내 백혈구의 일종으로 면역체계 최전방을 방어하는 세포다. 다른 자극 없이 암 세포의 근원이 되는 암 줄기세포를 인식하고 살상해 차세대 면역치료법으로 주목받고 있다. T세포는 바이러스가 우리 몸 안으로 들어왔을 때 바이러스에 감염된 세포만 골라 죽이는 역할을 한다.연구팀은 NK세포 투여군에서 활성이 높고 체내 지속성이 긴 '유사메모리 NK세포'가 비투여군에 비해 34배 증가한 점을 확인했다. 또 증가된 유사메모리 NK세포가 환자의 메모리 CD8 T세포를 증식시켜 항암 효능을 높인다는 사실을 밝혀냈다. CD8 T세포는 체내에 들어온 항체를 생산하도록 만드는 외부 물질들을 기억해 강하고 빠른 면역 반응을 일으키고 병원체나 종양을 퇴치시켜 면역력을 향상시킨다.이번 연구는 연구자 주도 임상 2상으로 진행됐다. 연구팀은 NK세포 치료제의 조건부 허가를 목표로 국내 의료기관 3곳에서 AML 관련 유효성과 안전성을 검증하기 위한 임상 2상 시험을 준비 중이다. 연구 결과는 최근 혈액암 분야 국제학술지 ‘루케미아(Leukemia)’ 온라인판에 게재됐다.이규형 교수는 “난치성 혈액질환에서 NK세포의 효력을 임상적으로 확인할 수 있었다”며 “그동안 추가적인 치료가 불가능했던 환자들에게 NK세포 치료제가 폭넓게 적용할 수 있도록 노력하겠다”고 말했다.",105,https://n.news.naver.com/mnews/article/011/0004170783?sid=103
"엔씨, 경북연구원과 ‘천년 신라왕경 디지털 복원’ MOU",2023.03.24. 오후 1:34,"엔씨소프트와 경북연구원은 ‘천년 신라왕경 디지털 복원’ 업무협약을 체결했다. (좌)엔씨소프트 최형근 센터장, (우)경북연구원 유철균 원장엔씨소프트(대표 김택진)는 경북연구원과 ‘천년 신라왕경 디지털 복원’을 위한 업무협약(MOU)을 지난 23일 체결했다.이번 업무협약을 통해 엔씨(NC)와 경북연구원은 ▲스토리 기반 신라왕경 디지털 콘텐츠 제작·전시 체험 ▲3D 콘텐츠 기술을 활용한 권역별 AR·VR콘텐츠 제작 ▲공동 관심분야에 대한 연구 등 다방면의 협력을 추진한다.엔씨소프트의 ‘아트 이노베이션 센터(Art Innovation Center)’ 산하 ‘스캔 스튜디오(Scan Studio)’에서 디지털 콘텐츠 제작 등 관련 기술을 지원한다.엔씨소프트 최형근 아트 이노베이션 센터장은 “엔씨소프트의 고도화된 비주얼 기술력을 신라왕경 디지털 복원에 사용하게 되어 기쁘다”며 “꾸준한 R&D로 발전시킨 기술을 통해 사회적으로 의미있는 활동을 지속해 나갈 것”이라고 말했다.경북연구원 유철균 원장은 “엔씨소프트와의 업무협약을 통해 세계인이 온라인 가상공간에서 신라왕경을 즐길 수 있는 날이 오길 기대한다”고 말했다.",105,https://n.news.naver.com/mnews/article/009/0005106360?sid=103
"美국무 ""틱톡, 美 안보에 위협…어떤 방법으로든 위협 끝내야""",2023.03.24. 오전 1:58,"""한일관계 개선, 中·北 도전대응 등 많은 분야에서 美 역량 강화""



블링컨 美국무장관(워싱턴 AP=연합뉴스) 토니 블링컨 미국 국무부 장관이 23일(현지시간) 워싱턴DC에 있는 미국 하원 외교위원회에서 발언하고 있다. 2023.3.23(워싱턴=연합뉴스) 김동현 특파원 = 토니 블링컨 미국 국무부 장관은 23일(현지시간) 미국에서 널리 사용하는 중국의 동영상 공유 플랫폼 틱톡이 미국의 안보에 위협이라는 입장을 밝혔다.     블링컨 장관은 이날 하원 외교위원회에서 공화당 소속 켄 벅 의원이 틱톡을 금지해야 한다고 생각하느냐고 묻자 국무부가 2021년 7월부터 국무부 직원은 물론이며 대사관 계약업체와 제3자 판매업체 등의 틱톡 사용을 금지했으며 파트너들이 틱톡의 문제를 인지하도록 정보보안정책을 조율해왔다고 설명했다.    이어 ""(바이든 행정부가) 틱톡의 모회사(중국의 바이트댄스)가 틱톡(미국 사업)을 매각할 것을 요구한 것으로 이해하고 있다""며 ""행정부는 틱톡이 제기하는 도전을 해결하는 데 전념하고 있으며 대응에 필요한 조치를 하고 있다""고 말했다.    그는 틱톡이 안보 위협이냐는 질문에 ""그렇게 생각한다""고 말했다.     벅 의원이 위협이라면 금지해야 하는 것이 아니냐고 재차 묻자 ""그렇게 할 수 있는 방법이 여러 가지인데 어떤 방법으로든 (위협을) 끝내야 한다""고 답했다.     한편 블링컨 장관은 최근 한국과 일본의 관계 개선과 관련해 ""역내 가장 긴밀한 동맹이자 파트너인 한국과 일본이 미국뿐 아니라 서로 그리고 한미일 3자 관계와 협력을 강화하는 게 우리의 안보뿐 아니라 세계에서 많은 일을 할 수 있게 우리 능력을 강화한다""고 말했다.    그러면서 ""우리는 한미일 3국의 힘을 중국과 북한이 제기하는 도전에 대응하는 것뿐만 아니라 인도주의 지원, 안전한 해양 영역 확보, 우주 협력 등 여러 다른 영역에 투입하고 있다""고 설명했다.    bluekey@yna.co.kr",105,https://n.news.naver.com/mnews/article/001/0013834514?sid=103
"백기 든 누누티비 ""한국 OTT 콘텐츠 일괄 삭제…피해 수긍""",2023.03.24. 오전 10:41,"누누티비 메인 화면. 사진=누누티비 캡처불법 온라인 동영상 스트리밍 사이트 '누누티비'가 온라인동영상서비스(OTT) 콘텐츠를 무단으로 마구 올렸다가 비판을 받자 한국 OTT 콘텐츠를 모두 삭제하겠다고 밝혔다.누누티비는 23일 '국내 OTT/오리지널 시리즈 전체 자료 삭제 안내'라는 제목의 공지문을 올리고 ""최근 누누티비에 대해 이슈화돼 있는 국내 OTT/오리지널 시리즈와 관련된 모든 동영상을 일괄 삭제할 예정""이라고 공지했다.삭제 대상은 웨이브, 쿠팡플레이, 왓챠, 티빙, KT 시즌, 그 외 기타 한국 오리지널 모든 시리즈로 명시했다. 반면 넷플릭스와 디즈니플러스 등 해외 OTT 콘텐츠들에 대한 언급은 없었다.



누누티비 측이 업로드한 '국내 OTT 오리지널 자료 삭제 리포트(1차)'. 사진=누누티비 캡처이후 누누티비가 24일 홈페이지에 업로드한 '국내 OTT 오리지널 자료 삭제 리포트(1차)' 게시글에는 ""어제 발표한 공지사항 내용에 따라 다음과 같이 국내 OTT 업체에 대한 오리지널 시리즈를 모두 삭제하였으며 필터링 조치를 완료했다""고 기재됐다.삭제 완료된 자료에는 △유미의 세포들 △술꾼도시여자들 △환승연애 △좋좋소 등 국내 OTT 콘텐츠가 포함됐다.누누티비 측은 ""이들 자료는 더 이상 업로드 진행되지 않으며, 국내 OTT 콘텐츠는 추후에도 영구적으로 업로드 진행되지 않는다""고 설명했다.지난 2021년 개설된 누누티비는 국내외 유료 OTT의 신작 콘텐츠가 공개되는 즉시 스트리밍해 문제가 됐다.불법 콘텐츠 대응 기구인 방송통신심의위원회(방심위)가 URL(인터넷주소) 차단에 나섰지만 누누티브는 도메인 변경 등 수법으로 운영을 지속해왔다.영상저작권보호협의체가 추산한 누누티비 내 콘텐츠 조회수가 지난달 기준으로 18억회를 훌쩍 넘기고, 최근 흥행한 넷플릭스의 한국 오리지널 시리즈 '더글로리'도 무단으로 스트리밍되고 있다는 소식이 전해지면서 비판 여론은 더욱 커졌다.이에 과학기술정보통신부가 직접 URL 차단을 강화하고, 더불어민주당 변재일 의원이 누누티비 같은 사례를 막기 위한 정보통신망법 개정안을 발의하는 등 국회까지 나섰다.변 의원이 발의한 법안은 일정 규모 이상의 정보통신서비스 제공자가 국내에 캐시서버를 설치할 경우 접속차단을 위한 기술적 조치를 의무화하는 내용이다. 해당 법안이 통과되면 누누티비처럼 우리나라에 캐시서버를 둔 콘텐츠전송네트워크를 우회하면서 도메인을 변경하는 사례를 잡아내 제재할 수 있다.이처럼 우리나라에서 누누티비를 제재하기 위한 여론과 조치가 활발해지자 누누티비는 결국 한국 OTT에 한정해 삭제 조치를 결정한 것으로 보인다.누누티비는 ""국내 OTT 피해에 대해 어느 정도 수긍하며 앞으로 자료 요청 또한 국내 OTT 관련된 모든 자료는 처리하지 않을 예정""이라며 ""금주 내로 국내 OTT와 관련된 모든 자료를 일괄 삭제할 예정으로, 완료되면 다시 한번 공지를 통해 안내하겠다""고 전했다.",105,https://n.news.naver.com/mnews/article/030/0003086429?sid=103
‘섀도우버스 코리아 오픈 2023 시즌1’ 25일 결승전,2023.03.24. 오후 2:31,"액토즈소프트의 e스포츠 자회사 브이에스게임(대표 구오하이빈)은 VSG TV를 통해 진행하는 ‘섀도우버스 코리아 오픈 2023 시즌 1’의 최종일 경기를 오는 25일에 진행한다.‘섀도우버스 코리아 오픈 2023 시즌 1’의 우승자에게는 300만 원의 우승 상금과 한국 지역 최강자를 결정하는 그랜드 파이널의 초청권이 제공된다.지난 8강 경기에서 ‘섀도우버스 코리아 오픈’ 최다 우승자 ‘makima’ 선수가 4강에 안착, 대회 최초 3회 우승에 도전한다.또 지난 18년 4강, 19년 8강 무대에 오른 바 있는 ‘parktak’ 선수가 5년 만에 다시금 준결승에 진출, 개인 최고 성적을 경신할 수 있을지 여부도 주목받고 있다.한편, 4강 무대에 처음으로 이름을 올리며 ‘makima’, ‘parktak’과 같은 기존의 강자들을 상대하게 된  ‘maltesey’, ‘Flower’ 선수들이 어떤 활약을 펼칠지 역시 관심을 받고 있다.‘섀도우버스 코리아 오픈 2023 시즌 1’의 4강 경기 및 결승전은 5전 3선승제, 싱글 엘리미네이션 토너먼트 방식의 무관중 오프라인 경기로 진행된다.",105,https://n.news.naver.com/mnews/article/009/0005106399?sid=103
2월 수입 상용차 신규등록 245대 중 '볼보트럭' 109대,2023.03.24. 오후 2:13,"특장 134대·트랙터 73대·덤프 37대·카고 1대한국수입자동차협회(KAIDA)는 2월 수입 상용차 신규 등록대수가 245대로 집계됐다고 24일 밝혔다.브랜드별로는 볼보트럭 109대, 만(MAN) 51대, 스카니아 43대, 메르세데스-벤츠 24대, 메르세데스-벤츠 밴 18대 등이다.차종별로는 특장이 134대로 가장 많았다. 이어 트랙터 73대, 덤프 37대, 카고 1대 순으로 나타났다.



20일 경기도 평택시에 위치한 볼보트럭 종합출고센터에서 진행된 2021 신차 출시 미디어 간담회에서 박강석 볼보트럭코리아 사장(오른쪽)과 야콥 할그렌 주한스웨덴대사가 기념사진을 촬영하고 있다. 사진=볼보트럭코리아특장은 볼보트럭이 74대로 가장 높은 판매량을 기록했다. 이어 만 20대, 메르세데스-벤츠 밴 18대, 스카니아 15대, 메르세데스-벤츠 7대 순이다.트랙터에서는 볼보트럭이 33대, 메르세데스-벤츠 15대, 스카니아 13대, 만 12대를 판매했다.",105,https://n.news.naver.com/mnews/article/092/0002286552?sid=103
