title,date,main,section,url
,,,105,https://n.news.naver.com/mnews/article/236/0000218025?sid=103
[여기는 원주] 잇따르는 드론 테러…‘안티 드론’으로 대처,2021.10.19. 오후 7:29,"[KBS 춘천] [앵커] 무인 비행기, 드론이 빠르게 보급되고 있습니다. 잘 쓰면 좋지만, 잘못 쓰면 큰 문제가 되는데요. 실제로 해외에선 테러에 쓰이기도 했습니다. 정부와 민간기업이 손잡고 이런 드론 테러에 대응하기 위한 이른바 '안티드론' 기술을 개발했습니다. 영월에서 열린 기술 시연 현장을  이현기 기자가 다녀왔습니다. [리포트] 2019년 사우디아라비아. 유전에서 불기둥과 검은 연기가 치솟습니다. 무인항공기, 드론에 의한 공격이었습니다. 우리나라에서도 최근 3년 사이 발전소와 공항에도 무허가 드론이 잇따라 출현해 비상이 걸린 적이 있었습니다. 아무리 쳐다봐도 비행 물체는 보이지 않는 하늘. 그런데, 드론 테러 대응을 위한 '안티드론' 차량의 레이더에 미확인 물체 하나가 포착됩니다. 감시 카메라로 보니 드론입니다. 200 미터 정도 떨어진 지점에 비행 허가를 받지 않은 드론이 출현한 겁니다. 대테러 차량에서 즉시 교란 전파를 쏩니다. 드론은 하늘에 멈춰 섭니다. 이른바 '재밍' 시스템입니다. 이어, 멈춰선 드론을 다른 곳으로 강제로 이동시킵니다. 드론 작전의 핵심 설비입니다. 시야 바깥에 있는 드론을 찾아내서 제어할 수 있는 기능들이 이 차량 한 대에 모두 담겨 있습니다. 언뜻 보면 총처럼 보이는 장비도 등장했습니다. 망원경으로 드론을 찾아내면, 이 총으로 전파를 발사해,  상대 드론을 멈추게 합니다. 드론을 격추하는 대신, 제어권을 빼앗아오는 이른바 '소프트 킬' 대응입니다. [국찬호/안티 드론 시스템 개발사 상무 : ""미리 자기가 보호하고 있는 중요 시설에 드론이 들어왔을 때, 또는 소형 무인기가 들어왔을 때 빠르게 경보를 해주고 대처 방안을 세우도록.""] 이번 시연엔 국가정보원과 군부대, 민간드론회사 등 10여 개 기관이 참여했습니다. 이들은 앞으로 날씨나 지형에 상관없이 안티드론을 투입할 수 있도록 기술을 더 발전시켜 상용화를 추진하기로 했습니다. KBS 뉴스 이현기입니다.  촬영기자:최중호원주서 제25회 노인의 날 기념식 열려 대한노인회 원주시지회는 오늘(19일) 옛 원주문화원에서 제25회 노인의 날 기념식을 개최했습니다.이번 노인의 날 기념식에서는 평소 노인복지 증진에 기여한 모범 노인 33명에게 표창장이 수여됐습니다.또 경로당 활성화 등의 역할을 하게 될 읍면동 대표 24명에게 지역봉사 지도원 위촉장도 전달했습니다.원주시, 원주교도소 이전사업 건축 허가 완료 원주시는 원주교도소 이전 예정 부지에 대한 토지 보상이 사실상 마무리돼, 건축 허가를 완료했다고 밝혔습니다.원주교도소는 원주시 봉산동 일대 17만 제곱미터의 부지에 1,100명을 수용할 수 있는 규모로 2025년까지 조성될 예정입니다.원주교도소 이전 사업은 전액 국비로 추진되며, 사업비는 1,339억 원입니다.",105,https://n.news.naver.com/mnews/article/056/0011140209?sid=103
"""모바일게임 이용자 92.5%, 다양한 앱마켓서 게임 다운로드 원해""",2021.10.19. 오전 8:50,"""국내 애플리케이션 마켓에는 왜 이 게임이 없나요? 입점해주세요."" 국내 모바일 게임 이용자 대부분이 다양한 앱마켓에서 자신이 원하는 게임을 다운로드받길 원한다는 조사 결과가 나왔다. 주요 게임사들의 해외 플랫폼 입점 쏠림 현상이 두드러지는 가운데 국내 앱마켓에만 입점하지 않는 게임들이 있어 '소비자 권리 침해'로 이어지고 있다는 지적이 제기된다. 19일 서울YMCA가 공개한  ‘앱마켓에 대한 소비자 인식 및 실태 파악 조사’ 결과에 따르면 모바일 유료 게임 이용자 1000명을 대상으로 시행한 설문조사에서 92.5%의 응답자가 ‘다양한 앱마켓에서 내가 원하는 게임, 콘텐츠, 앱을 다운로드 받을 수 있는 것이 소비자의 권리’라고 답했다.이용자들이 앱마켓을 선택하는 이유 중 첫 번째로 꼽은 것은 ‘앱 등록 여부’(86.4%)였다. 응답자 10명 중 7명은 원스토어, 갤럭시스토어 등 국내 앱마켓을 이용하지 않는 이유로 ‘앱이 없어서’라고 답변했다. 또한 구글플레이 이용자의 89%가 ‘국내 앱마켓에 게임이 다양해질 경우 이용 의향이 있다’고 답했다.서울YMCA는 ""각 앱마켓이 제공하는 다양한 혜택을 누리며 게임을 즐기길 원하는 이용자들의 요구를 앱마켓 입점을 결정하는 게임사들이 제대로 수용하지 못하고 있는 것으로 보인다""고 지적했다. 



최근 김영식 국민의 힘 의원이 앱마켓 게임 콘텐츠 입점 현황을 조사한 결과 국내 3대 게임사인 엔씨소프트·넷마블·넥슨(3N)이 출시한 모바일게임 53종 중 국내 앱마켓에 입점한 게임은 7종인 13%에 불과했다. 반면 3N은 구글 플레이스토어와 애플 앱스토어에는 53종 모두 입점시켰다. 국내 대표 게임사인 3N부터 게임 대부분을 국내 앱마켓에 입점하지 않으면서 정작 국내 이용자들이 해외 앱마켓만 이용해야 하는 상황인 셈이다.이번 설문조사에서 각 앱 마켓별 이용자들의 사용 이유를 보면 외산 앱마켓과 국내 앱마켓 간 차이는 더욱 두드러진다. 구글 플레이를 주로 이용하는 이용자의 90.6%는 ‘앱 등록 여부’를 주 사용 이유로 꼽았다. 반면 원스토어 주 이용자의 83.2%는 주 사용 이유로 할인, 쿠폰 등 앱마켓이 제공하는 ‘혜택이 다양해서’라고 답했다.  또한 구글 플레이 주 이용자가 국내 앱마켓을 이용하지 않는 이유로는 ‘앱 등록이 안 되어서’가 67.8%, 국내 앱마켓 주 이용자가 구글플레이를 이용하지 않는 이유는 ‘제공하는 혜택이 없어서’가 75.8%로 나타났다.모든 앱마켓에 원하는 콘텐츠가 골고루 입점 돼 소비자 혜택이 더욱 확대돼야 한다는 목소리도 높다. 전체 응답자 중 90.8%는 ‘앱마켓 브랜드 간의 공정한 경쟁이 있어야 소비자가 받을 수 있는 혜택이 많아진다’고 답변했다. 그 중 61.5%는 다양한 앱마켓에서 원하는 게임, 콘텐츠, 앱을 다운로드 받아야 하는 이유로 ‘앱마켓 간 가격, 프로모션 경쟁 활성화로 소비자 혜택이 증가하기 때문’을 첫 번째로 꼽았다.또 응답자 중 88.3%는 ‘원하는 게임이 모든 앱마켓에 동시 런칭한다면 혜택이 좋은 앱마켓을 선택할 것’이라고 답했다.이번 조사는 최근 3개월간 모바일 게임 내 아이템 구매에 1만원 이상 지출한 안드로이드 스마트폰 이용자를 대상(2021년 9월 24일~30일)으로 진행됐다. 조사 대상자 1000명 중 구글 플레이를 주로 이용하는 이들의 비율은 87.6%, 원스토어와 갤럭시스토어 등 국내 앱마켓을 주로 이용하는 이들은 12.4%로 집계됐다. 한편 모바일콘텐츠산업 실태조사에 따르면 지난해 구글과 애플의 국내 앱마켓 시장점유율은 88%(구글 66.5%·애플 21.5%)에 달했다.",105,https://n.news.naver.com/mnews/article/277/0004985180?sid=103
"한국인, 9월에만 유튜브 701억분 봤다…카카오톡, 279억분 사용",2021.10.19. 오전 9:05,"토스·넷플릭스·틱톡 사용시간, 전년比 급증



한국인이 가장 오래 사용하는 앱 (와이즈앱 제공) © 뉴스1(서울=뉴스1) 김근욱 기자 = 지난 9월 한국인이 가장 오래 사용한 앱은 '유튜브'인 것으로 나타났다. 전년 동기 대비 사용시간 증가율이 가장 높은 앱은 '넷플릭스'와 '틱톡'이었다.10일 앱 분석업체 와이즈앱이 발표한 자료에 따르면 지난 9월 한국인이 가장 오래 사용한 앱은 '유튜브'로 사용시간은 701억분이었다. 그 뒤는 Δ카카오톡 279억분 Δ네이버 197억분 Δ인스타그램 71억분 Δ틱톡 46억분 Δ넷플릭스 42억분 Δ티맵 40억분 Δ페이스북 40억분 Δ다음 37억분 Δ네이버 웹툰 34억분 순이었다.전년 동기 대비 사용시간 증가율이 가장 높은 앱은 온라인 동영상 서비스(OTT) '넷플릭스'와 숏폼 플랫폼 '틱톡'이었다. 넷플릭스는 26억분에서 42억분으로, 틱톡은 28억분에서 46억 분으로 두 앱 모두 1년 전보다 사용시간이 61% 증가했다. 가장 많은 사람이 사용한 앱은 '카카오톡'으로 사용자는 4385만명으로 조사됐다. 그 뒤로 Δ유튜브 4203만명 Δ네이버 3925만명 Δ쿠팡 2403만명 Δ밴드 2008만명 Δ네이버 지도 1752만명 Δ인스타그램 1744만명 Δ배달의민족 1707만명 Δ당근마켓 1601만명 Δ토스 1304만 명 순이었다.전년 동기 대비 사용자 증가율이 가장 높은 앱은 '토스'였다. 토스 사용자 수는 855만명에서 1304만 명으로 1년 전보다 사용자가 53% 늘어났다. 위 조사는한국인 만 10세 이상 개인 안드로이드 사용자 3867만명과 iOS 사용자 855명을 대상으로 조사했다. 유튜브를 제외한 구글·애플 앱과 이동통신사, 단말제조사 앱은 조사대상에서 제외했다고 밝혔다.",105,https://n.news.naver.com/mnews/article/421/0005665294?sid=103
"IT 업계 ""위드 코로나에도 원격근무 계속""",2021.10.19. 오후 4:20,"네이버·카카오 ""연말까지 유지""...라인플러스 ""유연 근무형태 장기 발전""정부가 다음 달부터 '단계적 일상 회복(위드 코로나)' 체계로 방역체계 전환을 준비 중인 가운데, 네이버·카카오 등 IT 기업들은 원격근무를 유지할 계획이다.네이버와 카카오는 올 연말까지 원격근무를 유지한다는 입장이다. 네이버 관계사 라인플러스는 위드 코로나 체계에서도 전일 재택부터 주 n회 재택까지 조합해 선택할 수 있는 ‘하이브리드 워크 제도’를 이어간다. 쿠팡과 배달의민족도 현행 근무체제를 유지, 직방도 자체 메타버스 업무 플랫폼 메타폴리스 근무를 지속한다.정부는 이달 말 위드 코로나를 위한 구체적 로드맵을 제시하고, 다음 달 초부터는 위드 코로나 체계로 전환할 계획이다. 13일 출범한 코로나19 일상회복지원위원회는 방역의료·경제민생·사회문화·자치안전 4개 분과에서 위드코로나의 기본 방향을 논의하는 등 방역 체계 전환을 위한 준비를 서두르고 있다.



원격근무 (출처=픽사베이)네카라쿠배 등 IT기업 ""원격 근무 유지 대세""원격근무를 기본 근무 형태로 적용하고 있는 네이버는 올 연말까지 현 체제를 그대로 유지한다는 방침이다. 네이버 관계자는 “연말까지는 원격 근무를 유지하고, 그 이후의 근무 제도는 어떻게 될지 내부적으로 논의 중”이라고 밝혔다.카카오 역시 올 연말까지 원격근무 체제를 지속할 전망이다. 카카오 관계자는 “올해 여름 이미 코로나19 발생 상황과는 상관없이 올해 연말까지 원격근무를 계속 유지한다는 전사 공지가 내려졌다. 이후 근무체제에 대한 가이드는 12월 말쯤 공지될 것”이라고 설명했다.라인플러스는 지난 7월 공식화한 혼합형 근무제 ‘하이브리드 워크 제도’를 코로나 종식 후에도 적용한다는 방침이다. 라인플러스는 우선 이 제도를 내년 6월까지 시행하기로 했다.라인플러스 관계자는 “하이브리드 워크 제도로 제주도에서 한 달가량 머무는 직원도 등장했다”면서 “퇴사 등 큰 결정 없이 회사 일을 하면서 다른 지역에 머물 수 있다는 것에 직원들이 만족감을 느끼고 있다”고 설명했다.



제주에서 근무했던 라인 황진우 기획자쿠팡에서는 사무실 직원 90% 이상이 원격근무를 하도록 한 현 근무 체제 외 다른 변경 사항에 대한 언급은 없는 상황이다. 현재 주 2회 원격근무를 시행하고 있는 배달의민족 역시 위드 코로나 체계에서도 이를 우선 적용한다는 입장이다.배달의민족 관계자는 “위드 코로나 정부 방침에 맞춰 따로 정책을 발표한 것은 아직 없으나, 주 2회 재택근무 상시화가 진행되지 않을까 싶다”고 부연했다.



직방 메타폴리스자체 메타버스 업무 플랫폼 ‘메타폴리스’를 도입한 직방도 위드 코로나 정책 시행과는 관계없이 메타버스 근무를 이어간다. 직방은 올해 2월 코로나19가 종식돼도 원격근무를 지속하겠다고 선언한 바 있다.당근마켓도 전사 원격 근무를 기본 적용, 필요에 따라 출근할 수 있도록 한 근무 체제를 위드 코로나 상황에서도 유지한다.당근마켓 관계자는 ""코로나19 이전에는 매주 목요일 전사 재택을 도입했고, 코로나19 이후로는 본인 업무에 따라 필요 시에만 사무실 출근 하고 있다. 위드 코로나 시대가 되더라도 업무 방식에 있어 큰 변화는 없을 것 같다""고 언급했다.라인플러스 관계자는 “라인에 여러가지 복지 제도가 많은데 그 중에서도 하이브리드 워크 제도가 가장 좋다고 꼽는 직원들이 많다”며 “이전에는 출퇴근 준비 및 이동에 하루 두 시간이 들었는데, 이를 아낄 수 있어 시간 활용, 체력 면에서 더 능률적이라는 직원들의 반응이 나왔다”고 말했다.이어 그는 “이에 라인플러스도 내년 상반기까지 개인 고정석이 아닌 자율 좌석제 기반 ‘모바일 오피스’로 변경하고, 코로나 종식 후에는 해외 근무도 가능하게 할지 검토 중”이라면서 “유연한 근무 형태를 지속 실험해 발전시킬 계획”이라고 덧붙였다.",105,https://n.news.naver.com/mnews/article/092/0002236549?sid=103
"""모바일 게임 이용자 92.5%, 다양한 앱마켓 이용 원해""",2021.10.19. 오후 2:09,"국내 앱마켓엔 원하는 앱 없어, 다양한 앱마켓 이용 제한국내 모바일 이용자 90% 이상이 다양한 앱마켓에서 게임을 다운로드 받고 싶어하는 것으로 조사됐다.



YMCA가 모바일 게임 이용자 앱마켓 인식 조사 결과를 발표했다. 사진은 이용자 응답 관련 그래프. [사진=YMCA]서울 YMCA는 국내 모바일 게임 이용자의 권익 향상을 위한 연구 목적으로 시행한 설문조사 결과 92.5%의 응답자가 '다양한 앱마켓에서 내가 원하는 게임, 컨텐츠, 앱을 다운로드 받을 수 있는 것이 소비자의 권리'라고 답했다고 19일 발표했다.이번 설문조사는 모바일 유료 게임 이용자 1천명을 대상으로 진행됐다. 조사 대상자 1천 명 중 구글플레이를 주로 이용하는 이들의 비율은 87.6%, 원스토어와 갤럭시스토어 등 국내 앱마켓을 주로 이용하는 이들은 12.4%로 집계됐다.이용자들은 앱마켓 선택의 첫 번째 이유는 '앱 등록 여부’(86.4%)'라고 답했다. 원스토어, 갤럭시스토어 등 국내 앱마켓을 이용하지 않는 이유로 약 70%가 '앱이 없어서'라고 응답했다. 또한 구글플레이 이용자의 89%가 '국내 앱마켓에 게임이 다양해질 경우 이용 의향이 있다'고 답했다.YMCA는 ""이러한 응답 결과는 각 앱마켓이 제공하는 다양한 혜택을 누리며 게임을 즐기길 원하는 이용자들의 요구를 앱마켓 입점을 결정하는 게임사들이 제대로 수용하지 못하고 있는 것""이라고 판단했다.실제 최근 한 조사에 따르면 국내 3대 게임사인 엔씨소프트, 넷마블, 넥슨이 출시한 모바일게임 중 단 13%만이 국내 앱마켓에 입점한 것으로 나타났다.모든 앱마켓에 원하는 콘텐츠가 골고루 입점 돼 소비자 혜택이 더욱 늘어나길 바라는 목소리도 눈에 띈다. 전체 응답자 중 90.8%는 '앱마켓 브랜드 간의 공정한 경쟁이 있어야 소비자가 받을 수 있는 혜택이 많아진다'고 응답했다. 그 중 61.5%는 다양한 앱마켓에서 원하는 게임, 컨텐츠, 앱을 다운로드 받아야 하는 이유로 '앱마켓 간 가격, 프로모션 경쟁 활성화로 소비자 혜택이 증가하기 때문'을 첫 번째로 꼽았다.또 응답자 중 88.3%는 '원하는 게임이 모든 앱마켓에 동시 런칭한다면 혜택이 좋은 앱마켓을 선택할 것'이라고 답했다.한편 구글플레이를 주로 이용하는 이용자의 90.6%가 '앱 등록 여부'를 주 사용 이유로 꼽았고, 원스토어 주 이용자의 83.2%는 주 사용 이유로 할인, 쿠폰 등 앱마켓이 제공하는 '혜택이 다양해서'라고 답했다.반대로 구글플레이 주 이용자가 국내 앱마켓을 이용하지 않는 이유로는 '앱 등록이 안 되어서'가 67.8%, 국내 앱마켓 주 이용자가 구글플레이를 이용하지 않는 이유는 '제공하는 혜택이 없어서'가 75.8%로 나타났다.",105,https://n.news.naver.com/mnews/article/031/0000629612?sid=103
"에이서, 다양한 분야 최적화 크롬북 출시",2021.10.19. 오후 5:53,"[파이낸셜뉴스] 디바이스 생산·판매 업체 에이서가 가정과 기업, 학교 등 다양한 분야에 맞춤화된 크롬북 신제품을 출시했다고 19일 밝혔다.    



에이서가 새로 출시한 크롬북 스핀 514. 에이서 제공.'크롬북 스핀(Chromebook Spin) 514·크롬북 엔터프라이즈 스핀 514'는 14인치 풀 HD가 탑재됐다. 블루 글래스 필터와 소음 감소 기술이 적용돼 화상회의와 원격 수업 등에 최적화 설계됐다. 화면 크기는 14인치 이상이며, 360도 회전되는 컨버터블 형태를 지녔다. 노트북, 태블릿, 텐트, 디스플레이 모드 등 다양한 형태로 사용할 수 있다.   '크롬북 515'와 '크롬북 엔터프라이즈 515는 기업에서 클라우드 기술을 활용해 업무와 보완, 인력 등을 관리하는 매니저가 사용하기에 최적화돼 있다고 에이서 측은 설명했다. DTS 오디오, 듀얼 마이크, 스마트 앰프 등의 기술이 적용됐다.   '크롬북 514'는 1.3㎏의 무게와 16.85㎜ 두께로 구성됐다. 배터리 수명은 최대 15시간 지속된다. 30분 만에 용량의 50%까지 충전할 수 있는 급속 충전기능을 제공한다.   '크롬북 스핀 314'는 재생 플라스틱을 사용한 오션글래스(OceanGlass) 터치패드가 탑재된 친환경 크롬북이다. 14인치 풀HD IPS 터치스크린 디스플레이와 10시간 배터리 지속 기능 등이 지원된다. 최신 인텔 프로세서 탑재로 교육 현장에서 유용하게 사용할 수 있을 것으로 기대된다.   에이서의 이번 크롬북 신제품의 국내 출시 일정은 아직 정해지지 않았다. 자세한 사항은 에이서 홈페이지를 통해 확인할 수 있다.   제임스 린 에이서 IT제품 사업 총괄은 ""이번에 공개한 크롬북 신제품은 디스플레이 크기, 내구성, 연결성 등 고객의 광범위한 요구를 충족시킬 수 있도록 다양한 옵션으로 구성돼 있다""고 했다. #에이서 #크롬북",105,https://n.news.naver.com/mnews/article/014/0004725776?sid=103
