title,date,main,section,url
스마트시티 전문가들 모인다…'글로벌 스마트시티 컨퍼런스'개최,2019.12.16. 오후 2:53,"사진=글로벌 스마트시티 얼라이언스글로벌 스마트시티 얼라이언스는 오는 23일 서울 용산 드래곤시티호텔에서 '2019 글로벌 스마트시티 이니셔티브 컨퍼런스'를 개최한다고 16일 밝혔다.글로벌 스마트시티 얼라이언스, 에듀해시 글로벌 파트너스, DXC테크놀로지, IBM이 공동 주관하는 이번 행사의 핵심 테마는 스마트시티다. 스마트시티에 4차산업 핵심기술인 인공지능(AI), 빅데이터, 클라우드, 블록체인, 5G(5세대 이동통신), 사물인터넷(IoT) 등이 융합되는 만큼 전 산업을 망라하는 의미 깊은 자리가 될 것이라고 주최측은 설명했다.국내외 스마트시티 관련 주요 인사들과 글로벌 기업 리더들이 참석해 교류의 장을 만들고, 실질적 스마트시티 비즈니스 사례를 통해 새로운 패러다임을 제시하는 자리가 될 것이라고 기대했다.이번 행사에는 오갑수 한국블록체인협회장, 제임스 김 주한미국상공회의소 회장, 송희경 국회 4차산업혁명포럼 공동대표 등이 축사한다. 황종성 부산스마트시티 마스터플래너, 조성행 세종스마트시티 마스터플랜 리더, 조대연 국토교통과학기술진흥원 스마트시티 혁신 성장동력 사업단장이 기조강연 한다.첫 세션에서는 란딥 카푸어 DXC테크놀로지 아시아 최고기술책임자(CTO)가 '글로벌 혁신: 스마트시티 테스트베드의 가치' 주제로, 두 번째 세션에서는 앤지 윤 IBM 아시아태평양 지역 글로벌 협력 GM이 '글로벌 스마트시티와 스마트 기술들에 대한 인사이트 공유' 주제로 각각 발표한다.패널토의 세션에서는 전중훤 글로벌 스마트시티 얼라이언스 회장을 중심으로 김재규교육그룹의 김재규회장, 에듀해시글로벌파트너스 김용균 CTO를 비롯해 네이버 NBP, IBM, R3 코다, 히타치, 삼성 등의 기업인들이 참석한다.전중훤 글로벌 스마트시티 얼라이언스 회장은 ""눈에 보이고 손에 잡히는 스마트시티의 실제 상용화 현장 사례를 통해 스마트시티 성과와 과제를 함께 점검해 볼 수 있는 유익한 행사가 될 것""이라고 말했다.김산하 한경닷컴 기자 sanha@hankyung.com기사제보 및 보도자료 open@hankyung.com▶ 네이버에서 한국경제 뉴스를 받아보세요▶ 한경닷컴 바로가기  ▶ 모바일한경 구독신청 ⓒ 한국경제 & hankyung.com, 무단전재 및 재배포 금지",105,https://n.news.naver.com/mnews/article/015/0004258154?sid=103
"[내일날씨] 아침 기온 5도 내외, 강풍까지… 체감온도 ‘뚝’",2023.10.16. 오후 6:03,"내일(17일) 대부분 지역에서 아침 기온이 5도 내외로 내려가 춥겠고, 서리가 내리는 곳도 있겠다.     기상청에 따르면 내일 아침 기온은 내륙 대부분 지역에서 5도 내외로 내려가겠고, 바람도 약간 강하게 불면서 체감온도는 더욱 낮아 춥겠다. 강원내륙·산지와 그 밖의 높은 산지에는 아침 기온이 0도 내외로 내려가 얼음이 어는 곳도 있겠다.  



   쌀쌀한 가을 날씨를 보인 16일 서울 종로구 광화문광장에서 시민들이 걸어가고 있다. 연합뉴스    내륙을 중심으로 낮과 밤의 기온 차는 15~20도로 매우 커, 건강관리에 주의가 필요하다. 내일 아침 최저기온은 3~13도, 낮 최고기온은 19~24도, 모레(18일) 아침 최저기온은 5~14도, 낮 최고기온은 19~24도가 되겠다.     내일 새벽(00시)부터 아침(09시) 사이 강원 영서와 충북, 남부내륙을 중심으로 가시거리 1㎞ 미만의 안개가 끼는 곳이 있겠다.",105,https://n.news.naver.com/mnews/article/022/0003865075?sid=103
"요기요와 살림 합친다는 배민에… 자영업자들 “독점반대, 공공형 플랫폼 구축해야”",2019.12.16. 오후 4:32,"전국가맹점주협의회 “1개 기업이 국내 배달앱 시장 통일… 자영업에 고통 더할 것” 



   국내 배달앱 시장 2위 요기요를 운영하는 독일기업 딜리버리히어로가 1위인 배달의민족(이하 배민) 운영사 우아한형제들을 인수하자 자영업자들이 독점이 우려된다며 반발하고 나섰다.   전국가맹점주협의회는 “1개 기업으로 국내 배달앱 시장이 통일되는 것은 자영업 시장에 고통을 더하게 될 것”이라며 “650만 자영업자들은 배달앱 시장의 독점 장악을 강력히 반대한다”고 16일 밝혔다.   협의회는 “배달앱은 분명 소비자에게 각종 정보와 편의를 제공하는 긍정적인 역할을 수행하고 있지만 사실상 유통과정이 한 단계 추가되면서 많은 자영업자가 수수료와 광고료 부담에 고통받고 있다”고 토로했다.   



   이어 “배달앱 회사들이 개별 영세 사업자에게 고율의 수수료를 뜯어 대형 프랜차이즈 가맹점에 할인 혜택을 몰아주는 마케팅 방식 또한 크게 우려된다”며 “독일 자본에 90% 이상의 배달앱 시장이 지배받는 기형적인 상황을 앞둔 자영업자들은 각종 수수료 인상과 횡포 현실화에 대한 공포가 있다”고 우려를 드러냈다.    그러면서 협의회는 “공정거래위원회가 이번 인수합병 심사뿐만 아니라 자영업 시장의 어려움을 해결하고 배달앱 시장의 수수료 문제를 근원적으로 해결해 가는 방향을 마련하기를 바란다”라며 “배달앱 수수료 체계를 단순히 개별 기업의 이해가 아니라 사회적 합의에 따라 합리적으로 만들어야 한다”고 주장했다.   마지막으로 협의회는 “공공형 배달앱 플랫폼을 구축하고 소상공인이 이에 직접 참여해 안정성이 보장되는 온라인·배달앱 시장 제도 보완과 지원이 필요하다”고 덧붙였다.   현화영 기자 hhy@segye.com   사진=연합뉴스ⓒ 세상을 보는 눈, 세계일보",105,https://n.news.naver.com/mnews/article/022/0003422577?sid=103
일상 속 블록체인 기술 한눈에… 더 풍성해진 '블록체인 진흥주간',2019.12.16. 오후 5:02,"민·관 사업 전시규모 2배로 커져20개社 참여 채용상담회도 개최 



민원기 과학기술정보통신부 제2차관(왼쪽)이 16일 서울 코엑스 그랜드볼룸에서 개막한 블록체인 진흥주간 전시부스를 둘러보고 있다. SK텔레콤 김종승 팀장이 블록체인 기반 모바일 신분증명 서비스 '이니셜'을 민 차관에게 소개하고 있다. 과학기술정보통신부 제공 실생활 속으로 성큼 들어온 블록체인 기술의 현주소를 한자리에서 볼 수 있는 블록체인 진흥주간이 16일 서울 코엑스 그랜드볼룸에서 개막했다. 블록체인 진흥주간은 과학기술정보통신부가 블록체인에 대한 대국민 인식을 제고하고 블록체인 산업 생태계 활성화를 위해 지난해부터 진행한 행사다.  2회째 열린 올해 진흥주간 행사에는 블록체인, 핀테크 산업 활성화에 힘쓴 유공자들에 대한 포상도 진행됐다. 블록체인 아이디어톤, 핀테크X인슈어테크 해커톤, 블록체인 학술대회 등 관련 행사 우수자에 대한 시상식도 열렸다. 전문가 기조강연자로는 IBM 엄경순 전무와 람다256 박재현 대표가 나섰다.  17일에는 한국인터넷진흥원(KISA)에서 진행하고 있는 공공, 민간 블록체인 시범사업을 소개하는 자리가 마련된다. 오는 18일에는 블록체인 대학 ICT센터에서 진행한 연구 성과를 공유하고 블록체인 기술 이슈를 논의하는 '블록체인 기술 밋업'이 개최된다.  과기정통부가 운영하고 있는 블록체인 규제개선 연구반의 연구발표도 17일로 예정돼 있다. 올해 5개 분과(공공서비스, 금융, 물류·유통, 에너지, 헬스케어)로 진행한 블록체인 규제개선 연구반에서 도출한 규제 개선안이 발표된다. 또 블록체인과 핀테크분야 취업을 원하는 청년들을 대상으로 블록체인, 핀테크 전문기업 20개가 참여하는 채용상담회도 오는 18일 진행될 예정이다.  아울러 16일부터 18일까지 코엑스 그랜드볼룸 로비에서는 실제 활용되고 있는 블록체인 기술을 만나볼 수 있는 전시도 진행된다. 전시에는 블록체인 기반 모바일 전자증명 서비스 '이니셜', 탈중앙화 기부 플랫폼 '체리' 등 민간 주도 블록체인 시범사업 서비스부터 블록체인 기반 스마트병원, 식품안전관리인증 플랫폼, 전자우편사서함 서비스 등의 공공분야 블록체인 시범사업 서비스도 만날 수 있다.  올해 블록체인 진흥주간은 지난해보다 대폭 커진 전시규모가 눈에 띈다. 지난해에는 협소한 전시공간과 미숙한 진행으로 참여한 기업 관계자들 사이에서 전시성 행사 아니냐는 불만이 터져나오기도 했다.  하지만 올해 진흥주간은 전시공간이 대폭 늘어 기업들도 체험형 전시장을 꾸리는 등 더 적극적으로 참여했다. 시범 서비스 사례도 지난해는 6개에 불과했지만 올해는 12개로 2배나 많아졌다.  블록체인 진흥주간 첫 날 행사장을 찾은 민원기 과기정통부 2차관은 ""OECD가 지난 2017년에 이어 올해도 준비하고 있는 보고서를 통해 인공지능(AI)과 블록체인 기술이 우리 인류의 미래를 변화시킬 신기술이 될 것이라고 했다""며 ""보안성과 신뢰성이라는 기술적 특성을 가진 블록체인은 디지털 사회의 신뢰를 보장하는 기반 기술로 주목받고 있다""고 말했다.   jjoony@fnnews.com 허준 기자 ▶ 헉! 소리나는 스!토리 뉴스 [헉스]▶ 클릭해, 뉴스 들어간다 [뉴스쿨] ▶ 세상에 이런일이 [fn파스]  ※ 저작권자 ⓒ 파이낸셜뉴스. 무단 전재-재배포 금지",105,https://n.news.naver.com/mnews/article/014/0004343917?sid=103
3500개 십자가로 가득… 파격의 오페라 ‘노르마’,2023.10.16. 오후 7:17,"예술의전당 개관 30주년 26~29일 공연



16일 예술의전당에서 열린 간담회에서 노르마 역의 소프라노 데시레 랑카토레(왼쪽부터)와 여지원, 지휘자 로베르토 아바도, 메조소프라노 테레사 이에르볼리노, 베이스 박종민이 기념촬영을 하고 있다. 예술의전당 제공3500개 십자가가 빽빽이 둘러싼 압도적인 무대의 ‘노르마’가 서울 예술의전당 전관 개관 30주년 기념작으로 오는 26~29일 오페라극장에 오른다. 파격적인 연출로 2016년 영국 로열오페라하우스 초연 당시 ‘아름답고 자극적’, ‘충격적이고 도발적’(가디언)이라는 평가를 들었던 작품이다.오페라 ‘노르마’는 사랑을 위해 조국을 버린 여신 노르마의 비극적인 운명을 담은 이야기다. 1831년 4월 16일 프랑스 파리의 로데온 극장에서 성공을 거둔 알렉산드르 수메(1786~1845)의 비극적 연극 ‘노르마, 또는 유아살해’(Norma, ossia L´infanticidio)를 소재로 만들었다. 수메의 원작을 기반으로 하되 결말을 장엄한 자기희생으로 바꾸고 일부 장면을 수정해 대본을 완성했다.1831년 12월 26일 밀라노의 라 스칼라 극장에서 초연해 세계적인 주목을 받은 화제작이기도 하지만, 소프라노에게 고난이도의 가창력을 요구하는 어려움으로 자주 상연되지는 않았다. 하지만 소프라노 마리아 칼라스(1923~1977)가 작품에 새로운 지평을 열었고 현재는 유럽 전역에서 공연된다. 벨칸토 오페라의 대가 빈첸초 벨리니(1801~1835)의 최고 수작으로 꼽히며 이탈리아 지폐에 새겨진 유일한 오페라로 역사적으로도 의미가 있다.16일 예술의전당에서 열린 기자간담회에서 지휘자 로베르토 아바도는 “벨리니가 정점을 찍은 작품으로 향후 많은 작곡가에게도 큰 영감을 미쳤다”고 ‘노르마’를 소개하면서 “노르마의 고통과 많은 에고(자아)가 한 차원 더 높은 차원으로 변화하면서 카타르시스를 주는 굉장히 열정적인 작품”이라고 설명했다.노르마는 세계를 무대로 활약하는 소프라노 여지원과 데시레 랑카토레가 맡았다. ‘리카르토 무티가 선택한 소프라노’로 알려진 여지원은 2015년 한국 소프라노 최초로 오스트리아 잘츠부르크 페스티벌에서 오페라 ‘에르나니’ 주역으로 무대에 서기도 했다.국내에서 처음 노르마를 연기하는 여지원은 “이탈리아 오페라의 정수라고 불리는 ‘노르마’로 한국에서 노래할 수 있어 기쁘다”는 소감을 전했다. 그는 “노르마는 감정을 억제하면서 노래해야 하는 부분이 많고 테크닉적으로 준비돼 있지 않으면 노래할 수 없어 어려운 역할”이라면서도 “감정을 폭발시키는 역할 위주로 연기를 해 왔는데 이 프로덕션을 하면서 감정을 계속 감추고 속에 있는 걸 노래로 표현하는 게 재밌다. 고음도 질렀다가 아름다운 음악도 불러서 지루할 틈이 없을 것 같다”고 말했다.



알렉스 오예. 예술의전당 제공이번 ‘노르마’의 연출은 1992년 스페인 바르셀로나올림픽 개막식을 연출했던 알렉스 오예가 맡았다. 종교의 위압감을 느끼게 하는 십자가들은 무수히 많은 십자가가 세워진 리투아니아 성당에서 영감을 받았다. 영국에서도 초연 당시 파격적인 연출로 주목받았다.지난달 기자들과 만난 오예는 “나의 무대는 굉장히 현실적이고 전통의 틀에서 벗어나 있어 리스크가 있지만 그 위험을 감수하지 않는다면 오페라라는 장르는 과거에 머물게 된다. 현실에서 일어난 일을 반영해 그에 맞는 각색이 필요하다”고 설명한 바 있다. 기원전 50년 시기의 이야기를 다룬 데다 서양에서 이미 고전적인 연출은 다 보여준 만큼 색다르게 시도했다.노르마의 아버지 오르베소 역으로 출연하는 베이스 박종민은 “현대인도 공감할 수 있는 새로운 스타일을 선보이기 때문에 훨씬 더 흥미롭다. 원작에서는 주인공이 스스로 불길 속으로 몸을 던지지만, 이번 작품에서는 전혀 새롭게 죽음을 맞이한다”고 말했다.오페라가 한국에서는 대중적인 장르가 아닌 데다 작품도 어렵지만 여지원과 랑카토레를 비롯해 박종민, 메조소프라노 테레사 이에르볼리노 등 국내외 최정상급 성악가들이 출연하는 만큼 기대가 크다. 아바도는 “노르마는 캐스팅이 어렵다. 곡을 제대로 표현해 줄 수 있는 환상적인 캐스팅이 중요한데 이번에 각자 역할을 맡은 가수들이 정말 탁월하다. 관객들이 호기심을 가지고 좋아해 주면서 봤으면 한다”고 말했다.",105,https://n.news.naver.com/mnews/article/081/0003400803?sid=103
[취재앤팩트] 광화문 월대 백 년 만에 복원...다시 열린 '소통의 길',2023.10.16. 오후 1:08,"[앵커]경복궁 정문인 광화문이 월대 복원으로 백 년 만에 제 모습을 되찾았습니다.'왕의 길'이자 '소통의 길'이었던 광화문 월대 복원의 과정과 역사적 의미를 취재기자 연결해 자세히 짚어보겠습니다. 이교준 기자![기자]네, 문화생활과학부입니다.[앵커]어제저녁 광화문 주변에 수많은 인파가 몰렸는데 월대 복원 기념행사 어떻게 진행됐나요?[기자]어제저녁 화려한 미디어 파사드와 점등식이 펼쳐진 가운데 광화문 월대와 현판이 공개됐습니다.사전 신청한 시민들이 왕이 다니던 길을 밟으며 경복궁으로 입장하는 장관이 펼쳐졌습니다.'광화문 월대 새길 맞이 행사'를 보기 위해 광화문 주변에 몰려든 시민들이 환호하며 백 년 만의 월대 복원을 축하했는데요.문화재청은 기념행사에 만여 명이 참여한 것으로 추산했습니다.[앵커]월대는 무엇이고, 이번 복원은 어떤 역사적 의미가 있나요?[기자]지난 2006년 시작된 광화문 복원사업이 월대 복원으로 17년 만에 마무리된 것인데요.월대는 조선 궁궐의 주요 건물 앞에 넓게 쌓은 기단 형태의 구조물입니다.월대 중앙에 있는 길이 약 50미터의 왕이 다니던 길 어도(御道)에서 엿볼 수 있듯이 왕이 백성과 만나고 외국의 사신도 맞이했던 공간입니다.고종이 임진왜란 때 불탄 경복궁을 1867년 중건하면서 광화문 월대를 설치했는데 일제강점기에 전차 선로가 깔리며 땅 밑에 파묻혔습니다.이번 복원으로 백 년 만에 제 모습을 찾게 된 것입니다.최응천 문화재청장의 기념사를 들어보겠습니다.[최응천 / 문화재청장 : 궁궐의 월대들은 임금이 백성과 직접 소통하는 공간이었습니다. 오늘 첫선을 보인 광화문 월대가 이런 역사적 가치를 계승하여 우리 국민들은 물론이고 세계인들과 과거와 현재, 그리고 미래가 연결되는 소통의 공간으로 거듭나길 기원합니다.][앵커]서수상도 제자리를 찾았는데 이번에 백 년 전 모습을 하나하나 되살린 것인가요?[기자]네, 이번 복원과정에서 동구릉에 있던 난간석 등 부재 40여 점을 다시 사용하는 등 월대 원형을 되살리려 애쓴 점이 주목됩니다.임금이 다니던 길 어도 가장 앞부분을 장식했던 동물 조각상인 서수상도 되찾아 복원공사의 대미를 장식할 수 있었습니다.지난 8월 이건희 삼성그룹 회장 유족의 기증으로 월대 복원의 마지막 퍼즐을 맞추게 됐습니다.또 왕실의 재앙을 막아주는 것으로 알려진 해치상도 월대 앞으로 자리를 옮겼습니다.[앵커]광화문 현판이 우여곡절 끝에 새롭게 걸렸는데 여전히 논란이 계속되고 있나요?[기자]광화문 현판은 지난 2010년 균열 발생으로 부실 복원 논란에 이어 배경색과 글씨 등을 놓고 논쟁이 이어졌습니다.약 13년 만에 새 단장을 하게 된 것입니다.기존 흰색 바탕에 검은색 글씨에서 검은색 바탕에 금빛 글씨로 바뀌었습니다.'경복궁 영건일기' 등을 토대로 고증을 거쳐 경복궁 중건 당시 훈련대장이자 궁궐 건축 공사를 관장했던 임태영의 한문 해서체를 그대로 따랐습니다.이에 한국바른말연구원 등 10여 개 단체는 새 현판이 한자로 적힌 데 대해 ""광화문은 대한민국의 역사이자 서울의 상징""이라며 반대 입장을 표명했습니다.[앵커]정부는 월대 복원 이후 어떤 계획을 갖고 있나요? 앞으로 과제는 무엇인가요?[기자]월대가 복원됐지만 경복궁 전체로 보면 복원은 아직 30% 수준인 것으로 전해졌습니다.문화재청은 오는 2045년까지 경복궁 내부의 담장과 전각 등에 대한 복원정비를 계속할 계획입니다.경복궁은 매년 5백만 명 이상의 관광객이 찾는 대표적 문화관광 명소인데요.정부는 광화문의 완성으로 K-컬처의 상징적 문화공간으로 자리매김하길 기대하고 있습니다.이에 광화문 월대 복원에 맞춰 궁중문화축전 등 다채로운 문화체험 행사를 진행하고 있습니다.광화문이 제모습을 찾게 돼 관광객에 인기 높은 수문장 교대식도 달라질 예정입니다.지금까지 문화생활과학부에서 YTN 이교준입니다.※ '당신의 제보가 뉴스가 됩니다'[카카오톡] YTN 검색해 채널 추가[전화] 02-398-8585[메일] social@ytn.co.kr",105,https://n.news.naver.com/mnews/article/052/0001947508?sid=103
"첫출근 유인촌 “예술인, 생계보조형 지원 대신 간접지원할 것”",2023.10.16. 오전 10:59,"신임 유인촌 문화체육관광부 장관이 취임식을 열고, 예술인 지원체계 개편 등을 예고했습니다. 유 장관은 오늘(16일) 정부세종청사에서 열린 취임식에서 빛나는 'K-컬처'의 이면에는 AI 등 신기술의 확산과 글로벌 OTT 서비스의 급격한 성장 등이 존재한다며, 새로운 정책 방향을 제시했습니다. 먼저 예술 지원 체계에 대해서는 ""단순한 생계보조형 직접지원보다는 창작공간 지원, 공연장 대여 등 간접지원 방식을 통해 예술인들이 마음껏 활동할 수 있는 환경을 만들어주고자 한다""고 밝혔습니다. 이어 ""과거 장관 재임 시절을 돌이켜보면 가장 아쉬웠던 점은 지역 간 문화 불균형을 획기적으로 개선하지 못하고 떠난 것""이라며, 계층·지역 간 문화 격차를 해소하고 문화가 중심이 되는 지역균형발전을 이끌겠다고 했습니다. 또 ▲국제 기준에 맞는 규제 개선 등 콘텐츠 산업 집중 육성 ▲생활체육과 학교체육 활성화 ▲코로나 19로 위축됐던 관광 산업 재도약 등을 목표로 제시했습니다. 논란이 됐던 과거 재임 시절 반말 발언과 블랙리스트 의혹에 대해서도 직접 언급했습니다. 유 장관은 ""(당시) 장관을 처음 하다 보니 시행착오를 많이 했고 무조건 정면 돌파했다. 모든 걸 해결하고 싶었다""며 ""1인 시위든 수십 명이 하든 그냥 지나친 적이 없다. 그래서 시끄러웠다. '고생하지 말고 들어가라'고 하면 '왜 반말하느냐'는 답이 돌아왔다. 인터넷에 바로 뉴스가 났다""고 말했습니다. 그러면서 ""어떻게든 친근하게 다가가고 싶었던 것""이라며 ""해결된 것도 있고 안된 것도 있지만, 그 나름대로 노력의 결과가 있었다고 생각한다""고 덧붙였습니다. 블랙리스트 문제와 관련해서는 ""현장에 있는 양심상 그런 짓은 안 했다""며 ""'왜 저렇게 반대할까' 미워는 했어도 (지원한) 기록을 보면 다 나온다""고 말했습니다. 이어 ""직원들이 (박근혜 정부 시절 블랙리스트) 트라우마에서 벗어나면 좋겠다""며 ""이념 문제, 부처 간 이견 갈등, 현장 소통에서 벌어지는 갈등은 세상이 변해도 존재하니 피하지 말고 갈등을 해결하도록 노력하자""고 당부했습니다. 앞서 유 장관은 이명박 정부에서 문체부 장관을 지내던 2008년 10월 국회 문체위 국정감사장에서 사진기자들을 가리키며 ""사진 찍지 마"" 등의 발언을 해 논란이 불거졌으며, 전 정부에 임명된 문체부 산하 기관장들에 대해 사퇴를 종용했다는 의혹을 받기도 했습니다.[사진 출처 : 연합뉴스]■ 제보하기▷ 전화 : 02-781-1234, 4444▷ 이메일 : kbs1234@kbs.co.kr▷ 카카오톡 : 'KBS제보' 검색, 채널 추가▷ 네이버, 유튜브에서 KBS뉴스를 구독해주세요!",105,https://n.news.naver.com/mnews/article/056/0011582552?sid=103
KT도 가세...판 커지는 5G 알뜰폰시장,2019.12.16. 오후 4:08,"5만·7만원대 요금제 2종 출시



KT엠모바일 모델이 5G 알뜰폰 요금제를 소개하고 있다./사진제공=KT엠모바일[서울경제] KT(030200)의 알뜰폰 자회사 KT엠모바일이 2가지 5G 요금제를 출시하고 본격적으로 5G 알뜰폰 서비스를 시작한다고 16일 밝혔다. KB국민은행 알뜰폰 ‘리브엠’에 이어 알뜰폰 업계에서도 5G 도입이 점차 확대되고 있다. KT엠모바일의 5G 요금제는 ‘5G 슬림 M’과 ‘5G 스페셜 M’으로 구성된다. 5G 슬림 M은 기본료 5만 5,000원에 8GB의 기본 데이터를 제공하며 초과시 1Mbps 속도로 무제한 사용이 가능하다. 5G 스페셜 M은 기본료 7만 7,000원에 200GB의 기본 데이터를 제공한다. 데이터 사용 초과 이후엔 10Mbps의 속도로 무제한 사용이 가능하다. 테더링을 위한 20GB의 추가 데이터도 제공한다. KT엠모바일은 요금제 출시를 기념해 할인 프로모션을 진행할 예정이다. 올해 말까지 5G 슬림 M에 가입하는 고객은 평생 기본료 9,900원을 할인받아 월 4만 5,100원에 5G를 이용할 수 있다. 또 5G 스페셜 M 고객 역시 기본료 1만 4,300원 평생 할인으로 월 6만 2,700원에 이용 가능하다. 특히 이동통신 3사와 달리 약정이 없다는 점에서 5G 자급제폰 활성화와 함께 관심을 받을 것으로 보인다.전승배 KT엠모바일 사업운영본부장은 “자급제 단말로 가입이 가능한 무약정 5G 유심 요금제 2종을 준비했다”라며 “경제적인 KT엠모바일 5G 유심 요금제와 함께 5G 시대를 보다 저렴하게 경험할 수 있길 바란다”고 밝혔다./권경원기자 nahere@sedaily.com[서울경제 바로가기]▶ 지옥철 대안? '한강수상택시'타고 잠실-여의도 출근해보니 [세모탈]▶ 네이버 채널에서 '서울경제' 채널 구독해주세요! 저작권자 ⓒ 서울경제, 무단 전재 및 재배포 금지",105,https://n.news.naver.com/mnews/article/011/0003666977?sid=103
