title,date,main,section,url
'가짜 보도자료' 파문...램테크놀러지 어떤 회사?,2021.11.26. 오후 2:51,"기사내용 요약가짜보도에 급등, 해명에 급락했다 반등해명 왜 늦었나 의혹, 부사장 지분 매각 등창업자 길준잉 35% 최대주주·길준봉 1.77%7.4억 매각 김홍달, 삼성 출신 기술사업부장



 [서울=뉴시스] 이승주 기자 = 램테크놀러지가 '가짜 보도자료' 소동에 주가가 급등락하더니 이를 틈타 부사장의 지분 매각까지 드러나면서 논란이 되고 있다. 그동안 해당 기업을 다룬 증권사 애널리스트가 없었던 만큼 어떤 기업인지 주목된다.램테크놀러지(171010)는 26일 오전 11시30분께 11.72% 하락한 8510원에 거래되고 있다. 앞서 램테크놀러지는 지난 19일 6840원에 마감했지만 다음 거래일인 22일에 29.97% 급등, 23일에도 장중 29.92%까지 올랐다. 이 같은 급등세는 '가짜 보도자료'에서 출발했다. 22일 사측을 사칭한 보도자료가 언론에 배포되면서, 램테크놀러지가 '촉순도 불화수소 생산 관련 특허를 등록했다'는 뉴스가 나와 투자 수요가 몰린 것이다. 하지만 이 같은 보도에도 사측은 즉시 해명은 하지 않았고, 그 바람에 다음날 오전에도 이틀 연속 상한가로 직행했다. 그 사이 김홍달 램테크놀러지 부사장은 자신이 보유한 자사 지분 전량을 매각했다. 금융감독원 전자공시에 따르면 김 부사장은 22일 3만주를 주당 8890원에 처분한 데 이어 23일에는 남은 4만1255주 전량을 1만1550원에 장내 매도했다. 총 7억4000만원이 넘는 규모다. 23일 회사가 해당 보도자료는 직접 배포한 게 아니라고 뒤늦게 해명하면서 주가는 다시 급락, 7410원에 마감했다. 그럼에도 다음날 주가는 다시 상한가로 치솟았다.'가짜 보도자료'를 배포한 주체가 누구인지, 사측이 즉시 해명하지 않은 이유는 무엇인지, 부사장이 마침 지분 전량을 매각한 배경은 무엇인지 등 점점 의혹이 점차 커지는 가운데, 투자업계에서는 램테크놀러지에 대한 궁금증이 커지고 있다. 그동안 해당 기업을 분석한 증권사 애널리스트 리포트가 하나도 없었기 때문이다.



램테크놀러지는 지난 2001년 반도체 소재를 국산화를 목표로 설립된 화학소재 전문기업이다. 시가총액 988억원 규모로 지난 2013년 코스닥에 상장했다. 반도체와 OLED(발광유기다이오드), 2차전지 등 IT산업에서 사용되는 핵심 유무기 케미컬을 제조해 SK하이닉스와 삼성SDI, 온세미컨덕터코리아 등 국내·외 IT기업에 공급한다. 지난 2001년 반도체 박리액을 시작으로 2004년 LCD 세정액, 2008년 터치패널과 LED소재 등을 개발해왔다. 지난 2012년 사업화 연계 기술개발사업(R&D)업체로 선정됐으며 BOE식각액 국산화를 이뤘다. 지난 2015년 용해액의 양산 공급을 시작했고 지난해에는 중소벤처기업부 '소부장(소재·부품·장비) 강소기업 100'에 선정됐다. 경기 용인시 처인구에 본사를 둔 전직원 70여명 규모의 기업이다. 충남 금산군 군북면에 공장을 운영하고 있으며 내년께 당진에 신공장이 완공을 앞두고 있다. 2002년 기업부설연구소를 설립했으며, 국내외 총 21개 특허를 보유하고 있다. 종속기업으로는 중국 소재 화학소재 개발 기업 람태과전자재료유한공사가 있다.길준잉 회장이 2001년 반도체 엔지니어 출신을 주축으로 창업했다. 경영진 포함 주요 임원진이 삼성전자와 SK하이닉스, 삼성정밀화학 등 주요 IT기업 출신으로 구성됐다는 점이 강점이지만, 최근 실적과 신용도 하락세를 겪었다. 공시에 따르면 이크레더블 신용평가는 2019년 B+에서 지난해 BB, 지난 5월에는 BBB-로 하락했다. 지난 3분기 말 연결 기준 매출액은 335억9327만원, 영업이익은 32억9214만원으로 올들어 3분기 연속 감소세다. 다만 매출액은 전년 동기(321억원)와 비교하면 늘었다. 코로나19 확산에도 지난해 매출액은 이전 수준을 이어갔는데 수익성은 하락한 것으로 분석된다. 한국IR협의회에 따르면 지난해 3분기 매출액영업이익률과 매출액순이익률은 각각 3.7%, 3.8%로 하락했는데, 상품 매출 확대에 따른 원가부담 가중이 원인으로 파악했다. 지분 5% 이상 보유자는 최대주주인 길 회장이 유일하다. 그는 1961년생으로 창업 당시부터 2018년까지 대표이사를 역임했으며, 현재는 투자유치와 대외업무를 총괄하고 있다. 영남대에서 화학공학을 전공하고 단국대에서 화학 석사 학위를 취득했으며 삼성전자(반도체)에서 근무한 경력이 있다. 길 회장의 형 길준봉 대표이사는 회사 주식 23만5876주(1.77%)를 보유하고 있다. 1960년생으로 TJB대전방송에서 근무한 적 있으며, 2019년부터 램테크놀러지 경영을 총괄하고 있다.  이번에 '가짜 보도자료' 소동 중 보유 지분 전량을 매각해 의혹을 받은 김 부사장은 1958년생으로 기술사업부장을 맡고 있다. 동양화학(OCI)와 삼성종합기술원, 종합화학연구소, 삼성정밀화학 등을 거쳐 2006년 회사에 발을 들였다. 김 부사장의 매각으로 최대주주 길 회장의 지분율은 35.63%에서 35.10%로 줄었다．",105,https://n.news.naver.com/mnews/article/003/0010856407?sid=103
"한-브라질, 우주·생명공학 협력 강화한다",2021.11.26. 오전 7:11,"제3차 한-브라질 과학기술공동위원회 개최우리나라와 브라질이 우주와 생명공학 분야에서 협력을 강화하기로 했다.과학기술정보통신부(장관 임혜숙)는 브라질 과학기술혁신부와 26일 제3차 한-브라질 과학기술공동위원회(공동위)를 화상으로 개최했다.이번 회의는 1991년 체결된 한-브라질 과학기술협력협정에 근거해 추진되는 정부 간 협의체이다. 두 나라의 과학기술정책 교류, 공동연구 와 연구기관 간 협력 방안을 논의하는 자리이다.



과학기술정보통신부. [사진=과기정통부]이번 공동위는 과학기술 분야 주요정책을 공유하고 새로운 협력방안을 모색하는 순서로 진행됐다.우리나라는 올해 발표된 2022년 국가연구개발 투자방향에 대해 소개했다. 브라질는 과학기술 분야 재정지원 체계를 소개해 두 나라  정책에 대한 이해도를 높였다.두 나라는 앞으로 생명공학 분야에서 뇌 질환 원인 분석과 감염병 대응 연구에 협력하기로 했다. 더불어 우주 분야에서는 우주 망원경의 광학계 기술개발, 우주기상‧천문 관측 등 연구 역량을 결합할 수 있는 협력방안에 대해 논의했다.우리나라와 브라질은 상호 강점과 정책을 고려해 앞으로 유망 협력분야로 재생에너지, 정보통신기술과 소프트웨어(ICT‧SW) 분야에서의 협력 가능성도 확인했다.김성규 과기정통부 국제협력관은 “이번 과기공동위는 두 나라의 상호 강점을 결합할 수 있는 실질적 협력이 긴밀하게 논의되는 자리였다”며 “생명공학, 우주 등을 포함한 다양한 분야에서 두 나라가 공동으로 성과를 창출할 수 있는 공동 협력과제를 발굴·확대해 가는 협력관계를 만들어가겠다“고 말했다.",105,https://n.news.naver.com/mnews/article/031/0000638793?sid=103
[단독] ‘카카오 미래이니셔티브센터’도 변화…남궁훈 센터장 임명 유력,2021.11.26. 오후 6:02,"남궁훈 카카오게임즈 대표, ‘김범수 복심’ 재차 입증‘카카오 시즌2’ 미래 10년 준비…메타버스 등 연관 전망



남궁훈 카카오게임즈 대표[이데일리 이대호 기자] 카카오 공동체의 미래 10년을 준비하는 ‘카카오 이니셔티브센터’ 센터장에 남궁훈 카카오게임즈 대표 임명이 유력하다.26일 업계에 따르면 카카오가 미래이니셔티브센터 센터장에 남궁 대표를 내정했다. 카카오 이사회를 거치면 신임 센터장에 오른다. 카카오 사정에 정통한 관계자는 “남궁훈 카카오게임즈 대표의 카카오 미래이니셔티브센터 센터장 임명을 내정했다. 사실상 확정 수준으로 보면 될 것”이라고 전했다현재 카카오 이니셔티브센터는 김범수 의장이 이끌고 있다. 김 의장 결단 없이는 남궁 대표의 센터장 임명도 이뤄지지 않는다. 남궁 대표가 김범수의 복심이라는 것을 재차 입증한 사례다.남궁 대표는 김범수 의장과 한게임에서 한솥밥을 먹을 만큼 오랜 기간 호흡을 맞춰온 인물이다. 카카오게임즈 전신인 엔진을 창업했고 김 의장이 남궁 대표를 불러들여 다시 의기투합했다. 이번엔 카카오의 미래 전략까지 맡기는 상황이다. 미래이니셔티브센터는 외부로 잘 드러나지 않았던 조직이다. 카카오 공동체의 글로벌과 미래먹거리를 총괄하는 역할을 하는 것으로 알려져 있다. PC에서 모바일로 세대교체를 이끈 카카오의 미래 10년을 준비한다. 조직의 기치도 ‘모바일을 넘어(beyond mobile)’이다.향후 카카오 공동체 내 카카오게임즈의 위상도 올라갈 것으로 예상된다. 최근 남궁 대표는 메타버스와 대체불가토큰(NFT) 대응을 공언한 바 있다. 카카오 시즌2가 메타버스와 밀접하게 연관될 것으로 예상할 수 있는 부분이다.",105,https://n.news.naver.com/mnews/article/018/0005094971?sid=103
조효제 GS파워 대표 부천시서 감사패 받아,2021.11.26. 오후 1:52,"국제판타스틱영화제 발전에 기여한 공로 인정받아GS파워는 조효제 대표가 부천시 대표축제인 부천국제판타스틱영화제 발전에 기여한 공로를 인정받아 부천시에서 감사패를 받았다고 26일 밝혔다.조 대표는 25일 부천 채림웨딩홀에서 열린 부천국제판타스틱영화제 후원회장 취임식 및 송년모임 행사에서 장덕천 부천시장에게서 감사패를 받았다. 부천에서 열병합발전소를 운영하고 있는 GS파워는 지역사회와의 상생과 기업의 사회 적책임을 다하기 위해 매년 부천국제판타스틱영화제의 성공적인 개최를 후원하고 있다.조효제 GS파워 사장은 ""부천시에 사업장을 둔 기업으로서 부천시의 대표 축제인 부천국제판타스틱영화제 발전을 위해 후원을 하는 것은 당연한데 이렇게 감사패를 주니 감사드린다”며 “GS파워는 앞으로도 지역사회 발전을 위해 다양한 사회공헌활동을 펼쳐 나갈 것”이라고 밝혔다.



조효제 GS파워 대표(오른쪽 첫 번째)가 감사패 수상 후 장덕천 부천시장 등과 포즈를 취했다.



조효제 GS파워 대표기(오른쪽)가 장덕천 부천시장에게서 감사패를 받고 있다.",105,https://n.news.naver.com/mnews/article/092/0002240428?sid=103
"KT-차이나모바일-NTT도코모, 전략적 제휴 5년 연장",2021.11.26. 오전 9:42,"제11차 SCFA 총회…3번째 제휴 연장KT가 중국의 차이나모바일, 일본의 NTT도코모와의 지속적 협력을 통해 동북아 ICT 리더십 강화에 나선다.



KT가 25일 화상으로 진행한 제 11차 SCFA 총회에서 중국의 차이나모바일, 일본의 NTT 도코모와의 전략적 제휴를 5년 연장했다. SCFA 총회에 참석한 KT 구현모 대표가 협약서에 서명 후 기념촬영을 하는 모습. [사진=KT]KT(대표 구현모)는 지난 25일 화상으로 진행된 제 11차 SCFA(Strategic Cooperation Framework Agreement) 총회에서 중국의 차이나모바일, 일본의 NTT 도코모와의 전략적 제휴를 5년 연장했다고 26일 발표했다.이에 3사는 2022년 1월 기존의 협정 기간이 만료된 후 5년 뒤인 2027년까지 중장기적인 협력 관계를 유지하게 된다. 제휴는 2014년과 2017년에 이은 3번째 연장이다.2011년 KT 주도로 설립된 SCFA는 아시아 최대 규모의 통신 사업자간 전략적 협의체다. 3사는 지난 5년간 앱·콘텐츠, 5G, 사물인터넷(IoT) 네트워크 기술, AI, 로밍 등의 다양한 분야에서 협력해왔다.IoT 분야에서는 2019년 5월 KT-NTT도코모 간에 르노삼성의 커넥티드카 서비스 상용 론칭과 계약을 이뤄냈으며, 서비스 차별화와 상용 사례 발굴을 위한 논의도 꾸준히 진행해왔다.2017년에는 3사 간 합의로 AI 태스크포스(TF)를 신설하고 AI 전략과 서비스 및 네트워크, 차세대 AI, 기업의 디지털 전환, 코로나19 대응 등 다양한 분야에서 AI 기반의 선진 사례를 공유하며 각 사의 AI 사업 경쟁력 강화를 도모해왔다. 마케팅 분야에서도 각국의 모바일 시장 환경과 전략을 공유하며 시사점을 도출하는 등 교류를 지속해오고 있다.특히 5G 상용화 시점에는 가장 먼저 5G 상용 서비스를 개시한 KT의 사례를 시작으로 중국과 일본에서도 순차적으로 5G를 론칭하기 위한 논의를 진행하며, 아시아 3국이 글로벌 5G 시장을 선도해나갈 수 있는 기회의 장도 마련했다.이번 총회에서는 로밍 분야의 성과가 두드러졌다. 지난 10년 간 3사는 전략적인 기술 협력을 통해 VoLTE 로밍, 5G 비단독모드(NSA, Non-Stand Alone) 로밍을 상용화 한 바 있으며, 그간 쌓은 협력 노하우를 바탕으로 금번 총회에서 5G 단독모드(SA, Stand Alone) 로밍 시연 또한 성공적으로 마쳤다.이번 5G 단독모드 로밍 시연을 위해 KT와 차이나모바일은 지난 8월부터 양 사간 SA 방식의 5G 로밍 시험망을 구축해 연동에 성공했으며, 한국과 중국 간 양방향 영상통화와 고화질 동영상 재생 등의 시연을 통해 NSA 로밍 대비 한 단계 진화된 기술방식을 선보였다.구현모 KT 대표는 ""한중일 3사의 5년 협력 연장으로 지난 10여년 간 탄탄한 신뢰 관계를 구축하며 동북아 최대 통신 협의체로 자리매김한 SCFA가 보다 심도 깊은 협력을 이어갈 계기를 마련했다""며 ""차이나모바일, NTT도코모와의 협력을 기반으로 글로벌 디지털 트렌드를 선도하고, 차세대 네트워크 및 산업 전반의 디지털 전환을 위한 협력을 통해 동북아 글로벌 ICT 리더십을 공고히 해 나갈 것""이라고 말했다.",105,https://n.news.naver.com/mnews/article/031/0000638823?sid=103
비트코인·이더리움 등 일제히 반등…7400만원 육박,2021.11.26. 오전 8:40,"비트코인 2.9%↑…이데리움도 5% 넘게 올라샌드박스·디센트럴랜드, 차익실현 매물에 약세



(사진=이미지투데이)[이데일리 이후섭 기자] 비트코인을 비롯해 이더리움 등 주요 암호화폐 가격이 일제히 반등세를 보이고 있다.26일 국내 암호화폐 거래소 업비트에 따르면 이날 오전 8시 8분 기준 비트코인은 24시간 전보다 2.87% 오른 7370만4000원에 거래되고 있다. 이더리움도 하루 전보다 5.70% 뛴 565만5000원을 기록했다.국제 시세도 오름세다. 암호화폐 정보사이트 코인마켓캡에 따르면 비트코인 가격은 24시간 전보다 3.48% 오른 5만9094달러로 6만달러 회복을 눈앞에 두고 있다. 일주일 전과 비교하면 4.46% 오른 수치다. 이더리움도 6.39% 오른 4531달러에 거래되고 있다. 솔라나도 1.4% 넘게 오르고 있으며 에이다, 리플 등도 각각 0.48%, 0.77% 상승세를 보이고 있다.비트코인 가격은 이번주 약세를 이어가며 6만달러를 밑돌고 있다. 지난 24일에는 5만5000달러대까지 떨어지기도했다. 인도 정부가 비트코인 등 암호화폐 거래를 금지하는 법안을 추진하고 있고, 국제통과기금(IMF)도 엘살바도르에 비트코인을 법정 화폐로 사용해선 안 된다고 경고하는 등 여러 압박에 조정 국면이 이어지고 있다. 바닥권에 근접했다고 생각하는 저가 매수세가 몰리면서 이날 소폭 반등에 나선 것으로 풀이된다.전날 20~30%의 급등세를 보였던 메타버스 관련 코인 샌드박스, 디센트럴랜드 등은 차익실현 매물에 약세를 면치 못하고 있다. 같은 시간 샌드박스는 전날보다 4.80% 내린 8920원, 디센트럴랜드는 1.62% 하락한 6365원에 거래 중이다.",105,https://n.news.naver.com/mnews/article/018/0005094485?sid=103
,,,105,https://n.news.naver.com/mnews/article/014/0004746171?sid=103
"[공공솔루션마켓]행안부, ""코로나19 위기, 디지털 정부혁신 가속화 계기""",2021.11.26. 오후 5:02,"장경미 행정안전부 디지털정부기반과장행정안전부가 디지털 정부혁신 추진 현황과 주요 추진과제를 소개했다.행안부는 코로나19 위기를 디지털 정부혁신 가속화 계기로 삼아 세계선도국가로 도약하기 위해 당초 계획보다 진전된 디지털 정부혁신 발전계획을 수립했다.장경미 행정안전부 디지털정부기반과장은 “디지털 전환은 위기극복 핵심 수단이자 포스트 코로나 시대 사회변화에 대응하기 위한 필수요소”라며 “코로나19 대응 과정에서 우리나라 디지털 역량을 확인하는 동시에 디지털 정부혁신 가속화·전면확대 요구가 증대했다”고 설명했다.이어 “디지털 정부혁신 가속화·확대를 위한 전자정부법 등 주요법령과 각 부처 소관법령의 정비가 필요하다”고 덧붙였다.행안부는 생애주기 맞춤형 서비스를 확대하고 국민비서 서비스를 개시했다. 또 전자증명서 활용을 확대하고 있으며 모바일 신분증도 도입한다. 여기에 마이데이터를 개발하고 공공데이터 개발하고 클라우드 확대도 추진한다.정부는 플라스틱 카드 형태 현 신분증을 온·오프라인에서도 안전하고 편리하게 이용할 수 있도록 모바일 신분증을 도입해 공공·민간의 서비스를 혁신하고 디지털 경제 활성화 견인한다는 방침이다.장 과장은 “지난해 모바일 공무원증 시범 구축에 이어 올해 모바일 운전면허증, 내년엔 국가유공자증, 장애인등록증 등으로 확대할 계획”이라며 “지갑 없는 사회 구현으로 국민 편의성 증진과 신분증 도용 노출의 안전성이 확보되고, 온·오프라인 신원증명 통합으로 다양한 부가서비스 창출이 가능하다”고 강조했다.행안부는 디지털 기반 혁신성장과 코로나19 이후 비대면 환경 대응을 위해 기관별 소규모 전산환경을 클라우드 통합 운영으로 전면 전환한다고 밝힌 바 있다.공공 클라우드센터는 국가 안보, 수사재판, 내부 업무 등 중요 정보를 처리하는 정보시스템을 맡고 민간 클라우드센터는 대국민 공개용, 정보자원의 효율성이 우선되는 정보시스템을 다룬다는 계획이다.장 과장은 “현재 행정·공공기관 정보시스템 가운데 약 83%가 소규모 전산실을 쓰고 있으며 약 66%는 노후 시스템”이라며 “공공서비스의 안정성과 운영관리 전문성, 사이버 위협 대응력을 강화해 디지털 수요에 적합한 공공부문 디지털 인프라를 구현할 수 있다”고 말했다.",105,https://n.news.naver.com/mnews/article/030/0002984417?sid=103
청주대 통계학과 학생 3팀 '특허데이터톤대회' 장려상 수상,2021.11.26. 오전 10:42,"전기차 배터리 화재 해결 아이디어 제시 등 호평



청주대학교 빅데이터 통계학전공 이현수, 송아연, 원동준, 우예림 학생(왼쪽부터)이 기념촬영을 하고 있다. ©뉴스1(청주=뉴스1) 이성기 기자 = 청주대학교(총장 차천수) 빅데이터 통계학전공 학생들이 '2021 특허데이터톤 대회'에서 3개의 장려상을 수상했다.청주대는 특허데이터톤 대회에서 '지능형 Smart headlamp', '전기차 배터리 고온으로 인한 화재 소화 및 방지를 위한 특허 빅데이터 분석', 'ICT기반 친환경 조명시스템'을 연구주제로 참여한 3개의 팀이 각각 장려상을 받았다고 26일 밝혔다. 김태열·최규식·김현승·임범규 학생으로 구성된 팀은 '지능형 Smart headlamp'를 주제로 운전자의 편의성과 안정성을 향상하기 위해 기존 자동차 헤드램프의 문제점을 발굴하고 이를 개선하기 위한 지능형 스마트 헤드램프 아이디어를 제안했다. 지능형 스마트 헤드램프는 야간 주행에서 운전자의 시야를 지속적으로 확보할 수 있을 것으로 기대를 모았다.이현수·원동준·우예림·송아연 팀은 전기차 배터리로 인해 발상하는 사고에 관심을 두고 이 문제를 해결하기 위해 '배터리 화재 소화 및 방지' 관련 아이디어를 제안했다.  학생들은 특허 빅데이터를 통해 시계열 분석을 진행해 '배터리 화재 소화 및 방지' 유망기술을 예측했다.김민성·이상혁·진완서 팀은 기존의 조명 시스템의 문제점을 발견하고, 이를 해결하기 위해 '정보통신 기술 기반 친환경 조명 시스템'에 대한 특허 빅데이터를 수집했다. 이들은 한국어 데이터를 처리하고 분석하기 위한 방법론을 활용해 '정보통신 기술 기반 친환경 조명 시스템'에서의 공백 기술을 발굴하려고 했다. 이를 통해 친환경 조명 기술 선제 확보가 가능할 것으로 기대를 모았다.특허청이 주최하고 한국특허전략개발원이 주관한 '특허 데이터톤 대회'는 4차 산업혁명 시대 핵심 자산인 특허 데이터와 민간 아이디어를 결합해 해커톤 방식으로 정책 문제 해결 방안을 도출하기 위해 마련했다.",105,https://n.news.naver.com/mnews/article/421/0005748520?sid=103
"메가존클라우드-마인즈랩, 클라우드 기반 인공지능 플랫폼 '맞손'",2021.11.26. 오후 2:46,"연내 TF 조직 구성해 협력사업 속도메가존클라우드(대표 이주완)는 인공인간 인공지능(AI) 전문기업 마인즈랩(대표 유태준)과 함께 클라우드 기반 AI플랫폼 공동사업 협력 체결했다고 26일 발표했다.



(좌측부터) 마인즈랩 유태준 대표와 메가존클라우드 이주완 대표가 협약에 체결하고 기념사진을 촬영하고 있다. [사진=메가존클라우드]이번 협약을 통해서 메가존클라우드는 마인즈랩이 보유하고 있는 AI 인공지능 플랫폼을 비롯한 다양한 서비스 플랫폼을 기반으로 공동사업에 협력하기로 했다.마인즈랩은 빅데이터 분석 사업을 시작으로 2017년부터 본격적인 AI 개발 사업에 참여하여 현재 40여개의 다양한 AI엔진과 응용프로그램을 제공하고 있다. 지난 3월에는 세계 최초로 종합 AI를 갖춘 AI인간을 개발하는 등 최근 주요 엔터프라이즈 기업들을 고객사로 확보했다.메가존클라우드는 이러한 마인즈랩의 다양한 AI서비스를 메가존클라우드가 보유하고 있는 5천여고객를 대상으로 구축·운영 서비스를 제공하고, 연내 TF형태의 조직을 구성하여 협력사업의 속도를 낸다는 전략이다.직접 고객뿐만 아니라 메가존이 보유하고 있는 20여 관계사들과 협업을 통해서 다양한 산업군의 고객들에게 맞춤형 AI 서비스 엔진을 마인즈랩과 함꼐 서비스할 예정이다.유태준 마인즈랩 대표는 ""메가존클라우드가 가진 클라우드에 대한 높은 기술력은 마인즈랩이 보유하고 있는 AI서비스들과 엔진에 대한 기술력을 강화하고, 국내 뿐 아니라 메가존클라우드의 헤외지사들과 시너지효과를 낼것으로 기대하고 있다""고 밝혔다.이주완 메가존클라우드대표는 ""마인즈랩과 긴밀한 파트너쉽을 통해 메가존클라우드 고객들에게 AI인공지능 플랫폼과 엔진을 제공할 수 있을 것으로 기대한다""고 밝혔다.",105,https://n.news.naver.com/mnews/article/031/0000638907?sid=103
