title,date,main,section,url
"위메이드, 中 '전기패업' 서비스 금지 소송 승소",2018.12.28. 오후 8:58,"중국 지재권 법원, 미르의전설2 저작권 침해 및 부정당경쟁행위 인정[아이뉴스24 문영수 기자] 위메이드(대표 장현국)는 '미르의전설2' 저작권 침해 웹게임인 '전기패업' 개발사 37게임즈를 상대로 낸 서비스 금지 소송에서 승소 판결을 받았다고 28일 발표했다.전기패업은 2014년 말에 출시해 중국 웹게임 시장에서 1위를 기록하는 등 현재까지 4년 넘게 서비스되고 있다.위메이드는 2016년 4월 전기패업이 미르의전설2 저작권을 침해하고 있을 뿐 아니라 미르의전설2의 가치를 정당한 대가 없이 사용하고 있다는 이유로 중국 북경 지식재산권법원에 서비스 금지를 요청했다.



중국 내 3대 지식재산권법원 전문 법원 중 하나인 북경 지식재산권법원은 위메이드의 의견을 받아들여 미르의전설2 정식 라이센스를 받지 않은 전기패업의 서비스를 저작권 침해 및 부정당경쟁행위로 규정하고 이를 중단하도록 결정했다.중국 법원 판결에 따라 37게임즈는 전기패업의 서비스, 마케팅, 운영하는 행위를 즉각 중단해야 함은 물론, 관련 자료도 모두 폐기해야 한다는 게 회사 측 설명이다.이번 소송에서 37게임즈는 ""샨다게임즈로부터 서브 라이센스를 받았으므로 저작권 침해가 아니다""고 주장했고 샨다게임즈는 ""위메이드가 2007년 온라인 게임 '전기세계'에 대해 화해해 준 것을 적극 활용해 전기세계 게임을 서브 라이센스한 것""이라고 대응한 것으로 알려졌다.그러나 북경 지식재산권법원 재판부는 ""전기패업이 샨다게임즈로부터 서브 라이센스를 받은 사실과는 무관하게 미르의전설2 저작권을 침해하고 부당하게 미르의전설2를 활용하고 있는 점이 명백하다""고 판단했다.전기패업은 여전히 중국에서 톱3를 기록하고 전기패업 모바일도 텐센트가 퍼블리싱하며 좋은 성과를 거두고 있기에, 37게임즈는 위메이드와 협상해 정식 라이센스를 받으려 할 가능성도 제기된다.특히 이 판결은 위메이드와 샨다게임즈의 분쟁 관련한 첫 본안 판결이고 샨다게임즈의 서브 라이센스 자체가 불법이라는 명확한 판결인 만큼 앞으로 진행되는 다른 분쟁에 있어서 결정적인 판례로 작용될 전망이라는 게 회사 측 설명이다.향후 위메이드는 이번 소송 결과를 적극 활용해 미르의전설2 IP를 침해하는 불법 행위에 대해 적극적인 법적 조치를 취할 계획이며 중국 관계 당국과 긴밀한 공조를 통해 IP의 보호 및 관리, 감독도 더욱 강화할 방침이다.장현국 위메이드 대표는 ""이번 판결로 샨다게임즈의 서브 라이센스가 불법행위라는 점은 보다 명확해 졌으니 현재 진행 중인 다른 소송들에도 매우 긍정적인 영향을 미칠 것으로 기대하고 있다""며 ""시간이 걸렸지만 IP 사업은 계획대로 추진되고 있다""라고 말했다.문영수기자 mj@inews24.com▶네이버 채널에서 '아이뉴스24'를 구독해주세요.▶아이뉴스TV에서 부동산 고수를 만나보세요.[ⓒ 아이뉴스24 무단전재 및 재배포 금지]",105,https://n.news.naver.com/mnews/article/031/0000476836?sid=103
"SKT, SK인포섹 자회사 편입 완료",2018.12.27. 오후 5:00,"[디지털데일리 최민지기자] SK텔레콤(대표 박정호)이 SK인포섹 자회사 편입을 완료했다고 27일 공시했다.    SK인포섹 자회사 편입을 위해 SK텔레콤은 주식교환 대가로 SK(주)에 주식을 처분했다. 기존 SK인포섹 최대주주였던 SK(주)는 장외매수를 통해 자사주 126만668주를 매수, SK(주)의 SK텔레콤 지분은 기존 25.22%에서 26.78%로 증가했다.    SK텔레콤은 “SK인포섹을 100% 자회사로 편입해 융합보안 사업 영역에서 시너지 효과를 창출하고자 한다”고 말했다.    <최민지 기자>cmj@ddaily.co.krIT언론의 새로운 대안[디지털데일리]IT정보의 즐거운 업그레이드[딜라이트닷넷]뉴스채널 설정 - 네이버 메인에서 디지털데일리 뉴스를 볼 수 있어요.최민지(cmj@ddaily.co.kr)<저작권자 © 디지털데일리 무단전재-재배포금지>",105,https://n.news.naver.com/mnews/article/138/0002068800?sid=103
과학기자협회장에 이영완 조선일보 전문기자 당선,2018.12.28. 오후 6:27,"이영완 조선일보 기자(서울=뉴스1) 최소망 기자 = 제27대 한국과학기자협회장으로 이영완 조선일보 과학전문기자가 당선됐다. 임기는 2019년 1월1일부터 2년이다.이 신임 회장은 서울대 미생물학과를 졸업하고 2000년 동아일보에 경력기자로 입사한 후 2004년 조선일보로 옮겨 현재 과학전문기자로 활동하고 있다.이 신임 회장은 ""과학의학기자들의 전문성을 개발하기 위한 연수, 시상제도를 확대하고 과학과 의학의 융합 취재도 적극 지원하겠다""면서 ""과학기자대회를 과학기술계, 의학계, 사회를 이어주는 교량이 되도록 발전시키겠다""고 계획을 밝혔다.과학기자협회는 1984년 과학 언론 창달, 과학기자 자질 향상을 목적으로 설립된 과학기자클럽으로 시작해 현재 국내 일간신문, 방송, 통신사 등 50여개 회원사의 300여명 회원으로 구성된 사단법인단체다.somangchoi@news1.kr▶ [ 크립토허브 ]  [ 터닝포인트 2019 ] ▶ 에어팟&스타벅스 커피 경품(~1/25)[© 뉴스1코리아(news1.kr), 무단 전재 및 재배포 금지]",105,https://n.news.naver.com/mnews/article/421/0003760640?sid=103
"넥슨재단, ‘푸르메재단 넥슨어린이재활병원’에 운영기금 3억 원 기부",2018.12.28. 오후 3:05,"넥슨아레나 e스포츠 리그 및 온라인게임 유저 행사 티켓 수익금 전액 포함모바일게임 ‘마블 배틀라인’ 유저 대상 연말 기부 이벤트 통해 1억 원 조성넥슨(대표 이정헌)은 28일 넥슨재단(이사장 김정욱)이 푸르메재단 넥슨어린이재활병원(원장 임윤명)에 환아 치료 지원 및 병원 운영을 위한 운영기금 3억 1,400만 원을 기부했다고 밝혔다.기금에는 넥슨의 e스포츠 경기장 ‘넥슨아레나’에서 진행된 ‘FIFA 온라인 4 챔피언십 프리시즌’, ‘크레이지레이싱 카트라이더 리그’ 등 e스포츠 경기 티켓 수익금과 온라인게임 ‘엘소드’, ‘카운터스트라이크 온라인’의 유저 행사 티켓 수익금 등 다양한 행사 및 프로모션 수익금 전액이 담겼다.또한, 넥슨이 개발 및 서비스 중인 마블 IP(지식재산권) 기반 전략 카드 배틀 모바일게임 ‘마블 배틀라인(MARVEL Battle Lines)’에서 지난 13일부터 27일까지 연말 기념 유저 대상 기부 이벤트를 통해 조성한 1억 원도 기부금에 포함됐다.넥슨재단 김정욱 이사장은 “연말을 맞아 넥슨과 유저들이 한 뜻으로 조성한 기금을 어린이재활을 위해 기부하게 되어 더욱 뜻 깊다”며 “더 많은 어린이들의 재활 치료 지속과 병원의 운영 안정을 위해 계속해서 많은 응원과 관심이 이어지길 바란다”고 말했다.한편, 넥슨은 지난 2016년 ‘푸르메재단 넥슨어린이재활병원’ 개원 이후 환아들의 재활치료 지원 및 안정적인 병원 운영을 위해 올해까지 총 12억 5,500만 원을 기부했다.전자신문인터넷 소성렬 기자 hisabisa@etnews.com ▶ 네이버 모바일에서 [전자신문] 채널 구독하기▶ 전자신문 바로가기 [Copyright ⓒ 전자신문 & 전자신문인터넷, 무단전재 및 재배포 금지]",105,https://n.news.naver.com/mnews/article/030/0002771556?sid=103
"넥슨재단, ‘푸르메재단 넥슨어린이재활병원’에 운영기금 3억 원 기부",2018.12.28. 오후 2:35,"㈜넥슨은 28일 넥슨재단이 푸르메재단넥슨어린이재활병원에 환아 치료 지원 및 병원 운영을 위한 운영기금 3억 1400만 원을 기부했다고 28일 밝혔다.  기금에는 넥슨의 e스포츠 경기장 ‘넥슨아레나’에서 진행된 ‘FIFA 온라인 4 챔피언십 프리시즌’, ‘크레이지레이싱 카트라이더 리그’ 등 e스포츠 경기 티켓 수익금과 온라인게임 ‘엘소드’, ‘카운터스트라이크 온라인’의 유저 행사 티켓 수익금 등 다양한 행사 및 프로모션 수익금 전액이 담겼다.  또 넥슨이 개발 및 서비스 중인 마블 IP(지식재산권) 기반 전략 카드 배틀 모바일게임 ‘마블 배틀라인’에서 지난 13일부터 27일까지 연말 기념 유저 대상 기부 이벤트를 통해 조성한 1억 원도 기부금에 포함됐다.  넥슨재단 김정욱 이사장은 “연말을 맞아 넥슨과 유저들이 한 뜻으로 조성한 기금을 어린이재활을 위해 기부하게 되어 더욱 뜻 깊다”며 “더 많은 어린이들의 재활 치료 지속과 병원의 운영 안정을 위해 계속해서 많은 응원과 관심이 이어지길 바란다”고 말했다.  한편 넥슨은 지난 2016년 ‘푸르메재단 넥슨어린이재활병원’ 개원 이후 환아들의 재활치료 지원 및 안정적인 병원 운영을 위해 올해까지 총 12억 5500만 원을 기부했다.   true@fnnews.com 김아름 기자   ▶ 세상의 모든 골 때리는 이야기 'fn파스'▶ 속보이는 연예뉴스 fn스타  ※ 저작권자 ⓒ 파이낸셜뉴스. 무단 전재-재배포 금지",105,https://n.news.naver.com/mnews/article/014/0004151432?sid=103
국민 10명 중 6명 “암 검진 받았다”...수검률 1위는 ‘위암’,2018.12.28. 오전 10:17,"올해 우리 국민 10명 중 6명이 암 검진을 받은 것으로 나타났다.국립암센터는 전국 성인 4000명을 표본으로 한 '2018년 암 검진 수검행태조사' 결과를 28일 발표했다.조사 결과, 올해 우리 국민의 '암 검진 권고안 이행 수검률'은 63.3%로 집계됐다.조사가 시작된 2004년과 비교해 24.5% 포인트 증가했지만, 2014년 이후로 정체되는 경향을 보였다. 이 중에서 국가 암 검진을 통해 암 검진을 받은 수검률은 53.4%였다.암종별 권고안 이행 수검률은 위암 72.8%, 유방암 63.1%, 대장암 58.4%, 자궁경부암은 55.6% 순이었다.2018년 암 검진을 받지 않은 주된 이유로는 '건강하기 때문에'(42.5%)였다. 다음은 '시간적 여유가 없어서'(19.7%), '검사과정이 힘들어서'(15.5%), '암 발견의 두려움'(6.2%) 등의 순이었다.암 발생 초기에는 자각증상이 없을 수 있고 식욕부진, 기력저하 등의 증상만을 경험하는 경우가 많다. 암이 상당히 진행된 이후에야 체중감소, 출혈과 같은 증상이 나타난다.서민아 국립암센터 암검진사업과장은 ""암 검진의 효과를 보려면 몸에 이상증상이 없이 건강하다고 느낄 때 권고안 주기에 맞춰 암 검진을 꾸준하게 받아야 한다""고 말했다.김수연기자 newsnews@dt.co.kr                                                                                                                                                                                                                                                                                                                                                                                     디지털타임스 홈페이지 바로가기 / 디지털타임스 뉴스 더보기네이버 채널에서 '디지털타임스'를 구독해주세요.",105,https://n.news.naver.com/mnews/article/029/0002500329?sid=103
신한은행 차기 행장으로 진옥동 내정자 확정,2018.12.28. 오전 8:55,"내년 3월부터 본격 행보…1년 9개월 임기(지디넷코리아=손예술 기자)신한은행이 27일 임원후보추천위원회(임추위)를 열고 진옥동 은행장 최종 후보를 차기 은행장으로 확장했다고 밝혔다.진옥동 신한은행장 내정자는 은행 주주총회를 거쳐 정식 선임된다. 임기 시작은 내년 3월부터이며,  2020년말까지 1년 9개월 간 은행장으로 일하게 된다.종전 은행장 임기는 2년이었으나 이보다 3개월 줄어들었다. 신한은행 측은 기존 최고경영자(CEO) 임기 시작이 3월이고 부사장·부행장 등 임원급 임기는 1월로 달라 조용병 신한금융지주 회장이 이 시점을 맞췄다고 설명했다. 앞으로 은행장과 부사장·부행장의 임기 종료 시점은 12월말로 동일해진다.



신한은행 신임 은행장 내정자 진옥동 신한금융지주 부사장.(사진=신한금융지주)진옥동 차기 행장은 내년 3월 취임 전까지 위성호 현 행장으로부터 업무 인수인계를 받는다. 최근 위성호 행장은 임기 만료 시점 전 은행장이 바뀌게 된 것에 대해 불만을 내비쳤으나 남은 시점까지 인수인계에 집중하겠다는 방침을 밝힌 바 있다.진 차기 행장은 신한금융지주의 자회사이자 일본 현지법인인 SBJ은행의 산파 역할을 한 인물이다. 그는 1961년생으로 위성호 행장보다 세 살 젊다. 서울 덕수상업고등학교와 한국방송통신대 경영학과를 졸업했다. 이후 중앙대 경영학 석사 학위를 받고 1980년 기업은행 입행 후 1986년 신한은행으로 자리를 옮겼다. 1995년 일본 오사카지점에서 일한 뒤 2008년 오사카지점을 역임했다. 이후 SBJ은행 법인장고 신한은행 경영지원그룹장을 역임했다.손예술 기자(kunst@zdnet.co.kr)  ▶ 네이버 채널에서 ‘지디넷코리아’를 구독해주세요",105,https://n.news.naver.com/mnews/article/092/0002153374?sid=103
[2018결산]돌아보는 올해의 게임업계 화제,2018.12.28. 오후 2:30,"2018년은 성과 위주 성장을 이어온 국내 게임업계가 다시금 게임의 본질에 대해 돌이켜보는 화두가 중심이 된 한해였다.성과 위주의 성장은 적정한 과금, 아이템 확률 논란 등 반복되는 과제를 낳았다. 특히, 세계보건기구로부터 시작된 게임장애 질병화에 대한 움직임은 게임의 본질마저 의심한다. 더불어 빠른 모바일 게임에 대한 적응을 이뤄냈지만, 장르편중과 특정국에 대한 수출집중이라는 문제로 이어졌다. 시장에 빠르게 적응하거나 변화를 모색한 게임사들은 두각을 나타낸 양상이다. 올 한해 주요 화제들을 살펴보자.■ 착한 과금 게임은 이제 시작



올해 게임업계의 화두 중 하나는 착한 과금 게임이다. 적절한 과금이 부여된 게임을 의미하는 말이다. 모바일 게임 중 RPG와 MMORPG가 주요 장르로 자리 잡은 이후 무거워진 과금 비중에 유저 불만이 높아진 것은 물론, 베스파의 '킹스레이드', X.D 글로벌의 '소녀전선' 등의 경우 낮은 과금 비중으로 화제가 되며 매출 차트 상위권에 오르는 양상이 생겨나자 유저 불만을 줄일 방법을 찾기 시작한 게임사들이 착한 과금 게임을 선보이기 시작했다.올 초 선보인 넥슨의 '야생의 땅: 듀랑고'를 필두로, 펄어비스의 '검은사막 모바일' 등은 착한 과금 게임을 강조하고 나선 바 있다. '야생의 땅: 듀랑고'는 서바이벌시뮬레이션 세계관을 바탕으로 새로운 재미 요소를 선보이는 데 성공했으며 '검은사막 모바일'은 지금도 매출 상위권을 유지하며 꾸준한 인기를 얻는 성과를 얻었다. 착한 과금 게임의 성과는 이후 온라인, 모바일을 포함한 출시작에서 주요한 과제가 됐으며 게이머들도 게임 선택에 있어 민감한 사항으로 자리 잡았다. 연말을 앞두고 출시된 스마일게이트RPG의 '로스트아크'의 경우도 과금에 대한 게임사의 고려가 반영돼 출시 후 호응을 얻어냈다. 더불어 본격적인 국내 서비스를 시작한 에픽게임즈코리아의 '포트나이트'는 시즌 패스 요금제를 통해 착한 과금의 새로운 대안을 제시하기도 했다.  착한 과금 게임은 아직은 시도되는 시기지만, 곧 양질의 타이틀과 이를 즐기는 적정한 수준의 과금 수준이 정립될 것으로 기대를 모으고 있다.■ 여전한 확률형 아이템 논란



앞서 언급된 착한 과금 게임의 정착에서 해결과제로 떠오르고 있는 것은 다름 아닌 확률형 게임아이템이다. 벨기에는 EA의 '피파' 시리즈, '오버워치' '카운터 스트라이크: 글로벌 오펜시브' 등에 등장한 확률형 아이템을 도박으로 분류해야 된다고 결론 내렸다. 따라서 밸브와 블리자드의 경우 네덜란드와 벨기에 등 일부 유럽 국가에서 게임 내 확률형 아이템 사용 방식 및 내용물을 공개하는 방식으로 변경했다.국내에선 지난 6월부터 확률형 아이템 자율규제 확대 강화안을 시행하며 한국게임자율규제평가위원회를 통해 미준수 게임물을 알리고 있지만, 국내 게임사의 준수율에 비해 해외 게임사들의 준수율이 떨어지고 있는 상황이다.확률형 게임 아이템은 무작위로 등장하는 아이템을 뜻한다. 1만원 상당의 아이템을 구매한 유저나 10만 원 상당의 아이템을 구매한 유저가 확률에 따라서는 동일한 아이템을 가질 수도 있다. 게임 안에서 재미 요소 강화를 위해 등장했지만, 확정 아이템이 아니다 보니 보다 많은 과금을 유도하는 면이 부각되며 꾸준히 해소해야 될 문제점으로 지적돼 왔다.■ 게이머는 환자?...게임 장애 질병화 



게임장애 질병화 논란 역시 해결되지 않은 과제다. 세계보건기구(WHO)는 '게임 장애(Gaming disorder)'가 포함된 국제질병분류기호 11차 개정판(ICD-11)을 공표했다. 이번 개정판은 내년 5월 예정된 세계보건총회에서 발표되며 2022년 1월 1일부터 효력이 발생한다.게임 질병화가 공식화되면 게임을 한다는 이유로 잠재적인 정신질환자로 특정지을 수 있고, 기준도 모호해 게임 장애 적용 시 전체 인구의 적게는 1%부터 많게는 40%까지 정신질환환자로 추정된다. 국내에서는 통계청이 ICD-11 채택 의사가 없다고 밝혔지만, 가능성이 열려 있고, 게임 장애에 부여된 질병 코드가 발효되면 도박과 게임이 동일 선상에 선다는 점에서 우려의 목소리가 크다. ■ 엔씨표 게임 IP 국내 모바일 게임 시장에서 우뚝 



엔씨소프트의 게임 IP가 온라인 시장에 이어 모바일 시장에서도 맹활약을 펼치고 있다. 대표 아이피인 '리니지'와 '리니지2', '블레이드앤소울' 모두 모바일에서 두각을 나타내고 있는 양상이다.지난해 6월 선보인 '리니지M'은 '리니지'를 모바일로 옮긴 엔씨소프트 자체 개발작으로 출시 후 줄 곳 구글플레이 게임 매출 순위에서 1위를 유지하고 있다. 회사측은 올해 5월 '리니지M' 성공과 함께 '리니지' 베이스의 '리니지M'이 아닌 각각의 게임을 독자 서비스하는 것으로 결정해 각각의 게이머에게 다른 콘텐츠를 제공하고 있다. 하나의 IP를 공유하는 2개의 게임이 된 것.'리니지2'와 '블레이드앤소울'은 '리니지2 레볼루션'과 '블레이드앤소울 레볼루션'으로 넷마블이 IP를 활용해 모바일 게임화한 경우다. '리니지2 레볼루션'은 '리니지M'에 구글플레이 게임 매출 순위 1위를 넘겨주긴 했으나 2주년을 맞는 동안 꾸준히 상위권을 유지하고 있으며 이달 초 출시된 '블레이드앤소울 레볼루션' 역시 출시와 함께 앱스토어 매출 1위를 기록하는 등 호응 속에 게임 서비스 중이다. 각 게임들의 본편이라고 할 수 있는 온라인 게임의 경우 하향세를 보였으나, 올해 하반기에 들어서 반등에 성공하며 꾸준한 저력을 과시하고 있다. 엔씨소프트는 내년 출시를 목표로 모바일 게임으로 개발 중인 '리니지2M' '아이온2' '블레이드 앤 소울2' '블레이드 앤 소울M' '블레이드 앤 소울S'를 통해 본격적인 IP확장을 이뤄나갈 계획이다.■ IP 장착 MMORPG에 편중된 모바일 게임 시장



엔씨표 게임 외에도 펄어비스의 '검은사막 모바일', 웹젠의 '뮤오리진2' 등 올해 모바일 게임 출시작은 IP 기반 MMORPG였다. MMORPG가 대중화되며 매출 순위 10위권 이내의 게임으로 수익이 몰렸다. 구글플레이를 기준으로 최고 매출 게임과 인기 게임 순위를 살펴보면 격차가 크다. 인기 게임 순위엔 가볍게 즐길 수 있는 소규모 다장르 게임이 빠르게 순위가 변동되는 반면, 최고 매출 게임 순위는 국내 및 외산 MMORPG 중심으로 굳어졌다.양질의 게임이 수익과 인기를 얻는 것은 당연한 양상이나, 대형 게임사가 서비스 중인 인기 IP MMORPG로 굳어졌다는 점은 지난해에 비해 두드러진 현 게임시장의 변화이며 게이머의 확대도 머물렀다는 방증이 될 수 있다는 점에서 우려도 뒤따르고 있다.■ 글로벌 시장은 중국 시장을 지칭하는 말이 아니다



중국은 지난해 국산 게임에 대해 판호를 발급하지 않는 데 이어 올해 8월 아동 및 청소년 시력 보호를 위해 온라인 게임의 총량을 제한하고 신규 게임 운영 숫자를 통제하기 시작했다.이에 따라 기존에 서비스되고 있는 국산 게임을 제외하고, 신작 게임들의 중국 진출은 가로막혀 있다. 더불어 중국 내 게임 시장의 위축도 우려되는 상황이었다.  3분기 중국 최대의 게임사 중 하나인 텐센트그룹의 매출액 성과를 예로 살펴보면 예상치보다는 낮았지만 13조 1635억원의 수익을 올리며 24% 성장했다. 결국 중국 정부는 게임사업의 현상은 유지하되 성장을 늦춘 셈이며 중국 출시를 앞둔 신작만 발목이 잡힌 상황인 것.중국 진출의 물꼬가 트이길 기대하기 어려운 상황이지만 중국 제외 아시아 시장 및 일찌감치 유럽, 북미, 일본 등으로 진출한 국내 게임사의 성공사례는 꾸준히 나오고 있다. '배틀그라운드'의 크래프톤(펍지), '검은사막'의 펄어비스는 북미, 유럽에서 '세븐나이츠' '리니지2레볼루션'의 넷마블, '킹스레이드'의 베스파, '탈리온'의 게임빌 등은 일본에서, '서머너즈워'의 컴투스 역시 글로벌 시장에서의 꾸준한 성공사례를 이어가고 있다. 이중 크래프톤(펍지), 펄어비스, 넷마블 등은 국내 및 중국 시장에 익숙한 모바일, 온라인에 편중된 것이 아닌 콘솔까지 영역을 넓히며 글로벌 시장을 정조준하는 모양새다. 세계는 넓고 게이머는 많다.최종배 기자 jovia@fomos.co.kr[게임&게이머, 문화를 전합니다. 포모스게임│무단 전재 및 재배포 금지]포모스",105,https://n.news.naver.com/mnews/article/236/0000182535?sid=103
"신한DS, 스틸리언과 모바일앱 보안 사업 협력",2018.12.28. 오후 2:36,"(지디넷코리아=임민철 기자)신한DS(대표 유동욱)는 지난 18일 스틸리언(대표 박찬암)과  '모바일 앱 보안솔루션 사업협력(MOU)'을 체결하고 협력에 나섰다고 28일 밝혔다.양사는 최근 모바일 환경으로의 서비스 전환이 빨라짐에 따라 모바일앱 보안 위협에 효과적으로 대응하기 위해 MOU를 체결했다. 이에 ▲모바일앱 보안 경쟁력 강화를 위한 상품 개발 ▲사업 협력 수행 ▲양사 기술 교류 및 교육 지원을 진행한다. 또 모바일앱 위변조방지, 난독화, 가상키패드, 모바일 백신 솔루션 R&D 확대에도 협력한다.



유동욱 신한DS 대표(왼쪽)와 박찬암 스틸리언 대표신한DS는 정보보호전문서비스 회사다. 주요정보통신기반시설 등 정보보호 컨설팅서비스를 제공하고 있다. 스틸리언은 모바일앱 보안 전문회사다. 보안 커뮤니티에서 유명 화이트해커로 알려진 창업자 박찬암 대표는 미국 포브스지가 선정한 ‘2018, 아시아의 영향력 있는 30세 이하 30인(Forbes 30 under 30 Asia)’에 선정된 인물이다.유동욱 신한DS 대표는 ""통합 앱 보안 솔루션의 핵심 기술을 보유한 스틸리언과의 사업협력을 추진하게 되었다”며 “이 협력으로 금융권 및 기업이 추구하는 금융ICT분야의 성공적인 비즈니스 모델을 창출해나갈 수 있을 것""이라고 기대했다.임민철 기자(imc@zdnet.co.kr)  ▶ 네이버 채널에서 ‘지디넷코리아’를 구독해주세요",105,https://n.news.naver.com/mnews/article/092/0002153412?sid=103
