title,date,main,section,url
"KT, '채권문서관리시스템' 출시",2022.11.25. 오전 9:34,"기계약 문서 스캔 등 가능…대부업체의 불편함 해소KT는 대부업체의 채권관리를 디지털화 하는 전자문서 디지털전환(DX) 서비스를 시작한다고 25일 밝혔다.KT는 지난해 8월 넷케이티아이 등 14개 업체와 전자문서를 기반으로 많은 산업의 디지털 전환을 모색하기 위해 전자문서DX 원팀을 구성했다. 지난 4월에는 ‘전자문서 및 전자거래 기본법’ 개정 이후 국내 최초로 과학기술정보통신부로부터 ‘공인전자문서센터’ 지정인가를 획득했다.KT는 기업에 직접 제공하는 B2B 방식과 다른 솔루션 업체에 API를 제공하는 방식으로 서비스를 운영한다. KT는 금융업, 유통업 등 서류 보관이 많지만 전자문서 솔루션 인프라를 구축하기 어려운 기업에 사업을 확장하고 있다.



KT가 출시한 채권문서관리시스템은 대부업체와 신용평가기관 등이 업무 불편함을 해소하고 효율적으로 전자문서 서비스를 활용하도록 개발했다. KT는 공전센터 API를 채권문서관리시스템에 연계해 기업들에게 제공하는 방식을 사용했다.기존 대부업계에서는 대출서류와 함께 집합담보의 관리·양도·매각 등의 부속채권 관리 업무를 종이 문서로 하는 경우가 많았다. 이 때 소비자와 주고받은 계약 서류를 서고 등 특정 장소에 다량으로 보관하며 원본이 훼손되거나 신뢰성이 하락하는 문제가 있기도 했다. 각 서류에 대한 개별 확인, 이관 절차 등 서류 관리에도 불편이 있었다.KT는 이러한 불편을 해소하기 위해 관련 기관의 요구사항을 분석해 기업 콘텐츠 관리(ECM) 솔루션에 채권관리 업무 프로세스를 반영했다. 이를 기반으로 시스템을 개발했고 전자계약 체결 및 공전센터 내 계약서 원본 보관 등이 가능하게 했다.특히 KT는 신규 계약서류 외에도 기존 종이 계약 문서도 공전센터에 신뢰스캔 방식으로 보관할 수 있게 하는 것도 검토 중이다.KT는 금융위원회 선정 우수대부업체 중 한 곳인 태강대부에 채권문서관리시스템을 제공하며, 이후 업체별 요구사항을 반영해 리드코프 등 다른 대부업체에도. 확대한다는 계획이다.김영식 KT DX플랫폼사업본부장은 “앞으로도 공전센터 관련 여러 서비스를 지속 개발해 사업 영역을 발굴해 나가겠다”고 말했다.",105,https://n.news.naver.com/mnews/article/092/0002274761?sid=103
방통위 “스팸 데이터 연 4천만 건 분석해 제공”,2022.11.25. 오후 5:40,"방송통신위원회는 오늘(25일) 한국인터넷진흥원(KISA)과 스팸 데이터 개방 협력 기관을 대상으로 ‘2022 스팸 데이터 개방 성과공유회’를 열었습니다. 방통위와 KISA는 2020년부터 불법 대출, 도박, 보이스피싱 등 범죄의 미끼로 악용되는 스팸 데이터를 경찰청, 한국마사회, 금감원 등 13개 기관과 공유하는 협력 체계를 구축했습니다. 이를 통해 연간 약 4천만 건에 달하는 스팸 데이터를 분석해 수요기관이 필요로 하는 맞춤형 정보를 제공했습니다. 이날 공유회에서는 사행산업통합감독위원회의 스팸 데이터를 활용한 불법도박 사이트 근절 사례, 한국정보통신진흥협회의 가입 권유와 과장 광고 등 통신 시장 모니터링 결과 등을 발표했습니다.",105,https://n.news.naver.com/mnews/article/056/0011381333?sid=103
"NHN, ESG 평가 A등급 획득…한 단계 상승, 게임 업계 두 번째",2022.11.25. 오전 9:51,"NHN 판교 사옥 '플레이뮤지엄'. /NHN 제공        NHN은 25일 한국ESG기준원의 ‘2022년 ESG 평가’에서 전년 대비 한 단계 상승한 통합 A등급을 받았다고 밝혔다. 게임 업계에서 유일하게 등급이 상향된 것으로 통합 A등급은 NHN과 엔씨소프트가 유일하다.NHN에 따르면 한국ESG기준원은 국내 ESG(환경·사회·지배구조) 평가 기관 중 하나다. 매년 국내 상장사를 대상으로 지속가능경영 수준을 평가해 ESG 등급을 발표하고 있다.NHN은 사회(S)와 지배구조(G) 부문에서 지난해와 동일한 A등급을 받았다. 환경(E) 부문은 전년 대비 두 단계 높은 B+등급을 획득했다. 환경 부문 등급 상향에는 환경경영 이행을 위한 전담 조직 신설과 환경·에너지경영시스템(ISO14001/50001) 인증 획득을 통한 전사적 환경경영 체계 구축, 임직원 참여를 유도한 친환경 캠페인 및 교육 운영 등이 긍정적인 영향을 미쳤다.사회 부문에서는 지역 정보기술(IT) 인재 양성, 일자리 창출 등 사회적 책임을 고려한 비즈니스 모델과 사회 공헌 활동을 구성했다. 협력사와의 동반성장을 도모한 성과를 인정 받았다. 지배구조 부문에서 NHN은 이사회 및 산하 위원회 중심의 투명하고 전문적인 의사결정 구조를 확립했다. 동시에 중장기 주주환원정책을 마련해 소통하는 등 주주친화 경영을 위한 노력을 이어가고 있다.정연훈 NHN ESG부문 대표는 “내년에는 NHN ESG의 가치와 성과를 담은 첫 지속가능경영보고서를 발간하고, ESG 경영에 대한 대내외 소통을 더욱 적극적으로 이어나가겠다”라고 했다.",105,https://n.news.naver.com/mnews/article/366/0000857664?sid=103
"[Oh쎈 초점] '제2의 포켓몬 고'...'블루 아카이브', 韓日 양국서 IP 잠재력 입증",2022.11.25. 오전 10:46,"넥슨게임즈 제공.[OSEN=고용준 기자] 게임 IP의 확장 잠재력을 언급할 때 '포켓몬스터'의 사례를 든다. 전세계적으로 25년 가까이 인기를 끌어온 ‘포켓몬스터’는 지난 1996년 닌텐도 ‘게임보이’용 소프트웨어로 첫 선을 보여 TV 애니메이션을 통해 큰 인기를 끌었다. 이후 트레이딩카드게임과 '포켓몬 고'로 공전의 흥행을 기록하면서 최상위 수준의 글로벌 IP로 발돋움했다. 넥슨게임즈의 ‘블루 아카이브’도 IP 파워를 보여주고 있다. 임은 물론, 게임 IP에 기반한 다양한 콘텐츠를 속속 선보이며, 한일 양국에서 IP로서 입지를 더욱 단단히 하고 있다. 아트북, 공식굿즈, 트레이딩카드게임, 콜라보카페 등 활발한 IP 확장에 양국 유저들의 반응도 뜨겁다.▲'블루 아카이브', 서브컬처 본고장 일본에서도 통해 넥슨게임즈는 일본 배급사 ‘요스타’, 만화 및 게임 관련 서적 전문 출판사 ‘이치진샤’와의 협업을 통해 지난 10월 5일 ‘블루 아카이브 공식 아트북’을 출간했다.  ‘블루 아카이브’의 공식 아트북은 게임 아트북으로는 드물게 출간 직후 이틀 간 일본 아마존 도서 부문에서 베스트셀러 1위를 차지했고, 대부분의 온라인 및 오프라인 판매처에서 초판이 매진되는 등 남다른 흥행을 기록했다.  ‘블루 아카이브’ IP를 다양한 방식으로 즐길 수 있는 콘텐츠 및 굿즈 제작도 활발하다. 지난 2021년 5월에는 게임의 무대가 되는 ‘학원도시 키보토스’에서의 대난동을 주제로 한 공식 코믹스 ‘블루 아카이브 앤솔로지’를 출시했으며, 메신저 라인에 캐릭터들을 활용한 다채로운 스탬프와 스마트폰 테마를 선보였다.또 일본 배급사 ‘요스타’와의 협업을 통한 굿즈들도 현지 팬들로부터 좋은 반응을 얻고 있다. 지난 3월 발매한 OST 앨범은 두 차례에 걸친 판매분이 모두 매진됐다. 다양한 영역의 파트너들과의 컬래버레이션도 주목할 만하다. ‘맥스 팩토리’와 협업해 제작한 피규어가 일본 아마존, 에니메이트 등 주요 온라인 판매처에서 피규어 부문 베스트 셀러 1위를 차지하기도 했다.  ▲ 컬래버레이션 카페도 인기 만점케이블 애니메이션 채널 ‘애니플러스’와의 협업을 통해 지난 10일부터 내달 25일까지 6주간 서울 합정과 부산 서면에 컬래버 카페도 인기 만점이다. 컬래버 카페 서울 합정점, 부산 서면점에는 오픈 첫날에만 약 1,900명 이상의 팬들이 방문해 ‘블루 아카이브’에 대한 뜨거운 열기를 확인했다. 굿즈 중 ‘블루 아카이브’ 게임에 등장하는 샬레 오피스와 게임개발부실 배경을 구현한 ‘아크릴 배경 디오라마 2종’, ‘무선 충전 스탠드’, ‘일러스트 특대형 장패드 2종’ 등의 굿즈들은 카페 오픈 첫날부터 모두 품절될 정도의 인기를 끌었다. 오픈 이후에도 팬들의 방문은 꾸준히 이어지고 있으며, 인기 굿즈들은 품절과 재입고가 반복되며 완판 행진을 이어가고 있다.애니플러스 MD 사업팀 관계자는 “오픈 첫날부터 현재까지도 많은 ‘블루 아카이브’ 팬의 방문이 대거 이어지고 있다”며 “고객들의 안전과 원활한 이용을 위해 굿즈 구매권 배부, 굿즈샵 조기 오픈을 지속해야 할 정도로 열기가 뜨겁다”고 말했다.컬래버 카페를 방문한 ‘블루 아카이브’ 유저는 “’블루 아카이브의 매력은 각기 다른 스토리를 가지고 있는 매력적인 캐릭터”라며 “게임 속에만 있었던 다채로운 캐릭터들이 담긴 굿즈들은 ‘블루 아카이브를 즐길 수 있는 또다른 콘텐츠라고 생각한다.”고 소감을 밝기기도 했다.



  넥슨게임즈 제공.▲ 다변화 콘텐츠로 자리매김 ‘블루 아카이브’ IP‘블루 아카이브’가 매력적인 캐릭터와 탄탄한 스토리로 인기 게임으로 자리잡은 만큼, 다채로운 굿즈와 콘텐츠는 그 자체로 게임 이용자들에게 새롭고 신선한 흥미를 제공한다. 또 게임 이용자들은 게임 세계관에 대한 공감과 이해수준을 높이거나, 애정을 지니고 있는 캐릭터들에 대한 호감이나 유대감을 강화할 수도 있다.‘블루 아카이브’ IP를 기반으로 한 소설, 만화 등의 콘텐츠의 흥행을 통해 IP 자체의 확장성도 기대된다. 블루 아카이브 IP의 인지도 증가, IP에 흥미를 가지고 즐기는 저변 확대가 가능하며, 이에 지속적으로 새로운 유형의 콘텐츠 제작이 가능한 기반이 강화될 수 있다. 다변화된 콘텐츠는 IP의 가치를 폭발적으로 성장시키는 기폭제로 작용할 수도 있다.게임 외적인 IP의 확장 잠재력에 더해 게임 자체에도 긍정적인 영향을 줄 수 있다. 기존 게임 이용자들 또한 다양한 유형의 콘텐츠를 통해 게임 플레이를 통한 재미를 한층 배가할 수 있기 때문이다. 즉, ‘게임’을 통해 파생된 다양한 콘텐츠를 통해 IP의 생명력과 확장성을 강화하는 일종의 선순환 사이클을 형성해 나갈 수 있다고 볼 수 있다.넥슨게임즈 MX 스튜디오의 김용하 총괄 PD는 “‘블루 아카이브’가 하나의 훌륭한 IP로 자리잡는 것을 목표로 하고 있다”며 “게임 서비스 및 운영에 최선을 다하는 한편, 더 많은 분들이 ‘블루 아카이브’ IP를 즐길 수 있는 방안을 지속적으로 고민할 것”이라고 밝혔다. / scrapper@osen.co.kr",105,https://n.news.naver.com/mnews/article/109/0004746832?sid=103
[콘텐츠 핫&뉴]‘A3:스틸얼라이브’ 배틀로얄 맵 업데이트,2022.11.25. 오후 12:12,"넷마블(대표 권영식, 도기욱)은 모바일 배틀로얄 MMORPG ‘A3: 스틸얼라이브’에 신규 배틀로얄 맵 ‘방치된 성역’을 업데이트하고 각종 성장요소를 확장했다고 25일 밝혔다.신규 배틀로얄 맵 ‘방치된 성역’은 기존 배틀로얄 맵과 다르게 PvP가 특화된 신규 맵이다.총 3개의 구역으로 나눠져 있으며 1구역에서는 특정 지역에서만 등장하는 몬스터를 사냥해 레벨을 상승시키고 아이템을 얻을 수 있다.2구역은 극한의 PvP를 경험할 수 있는 구역으로 3개의 회복 등대를 이용한 전략적 플레이가 필요하다.마지막 3구역은 몬스터도 회복 등대도 존재하지 않는 결투장으로 매 15초마다 등장하는 보급품을 이용해 최후의 생존자가 되어야 한다.이와 함께 ▲280레벨 신화 배경 등급세트 장비▲티어8 유물▲13등급 망토와 망토 문양이 추가됐으며 ‘이차원의 화랑 시즌5’를 실시한다.또한 넷마블은 신규 길드 이벤트 ‘월드보스의 그림자’를 오는 12월 21일까지 실시한다.넷마블은 내달 21일까지 7일 출석 이벤트를 통해 ‘금바늘’, ‘마법 실타래 선택상자II’, ‘블루다이아’ 등의 아이템을 제공한다.◆ ‘피파온라인4’ 태극 전사 선전 기원 뷰잉 파티 진행넥슨(대표 이정헌)은 축구게임 ‘EA SPORTS™ FIFA Online 4(이하 ‘피파 온라인 4’)’, ‘EA SPORTS™ FIFA 모바일(이하 ‘피파 모바일’)’에서 태극 전사들의 선전을 기원하는 단체 관람 및 응원 행사로 뷰잉 파티를 실시했다고 25일 밝혔다.‘피파 온라인 4’ 뷰잉 파티는 200여 명이 방문한 가운데 잠실 비타500 콜로세움에서 진행됐다.또 카타르 현지에 나가 있는 축구 예능 유튜브 채널 ‘이스타TV’와 연결해 우루과이전을 앞두고 전운이 감도는 현장 분위기를 살펴보는 시간을 가졌다.‘피파 모바일’은 강남에 위치한 펍에서 이용자들을 초청해 각종 음료 제공, 게임 체험존 운영, 경품 지급 등과 함께 태극 전사를 응원했다.경기가 시작되자 관람객들은 준비된 대형 스크린에 시선을 고정하고 남미 강호 우루과이에 맞서는 태극 전사들을 열렬히 응원했다.뷰잉 파티는 2차전과 3차전에도 계속된다. 28일 가나전, 12월 3일 포르투갈전의 뷰잉 파티는 광명 아이벡스 스튜디오에서 진행될 예정이다.◆수집형 RPG ‘엑소스 히어로즈’ 시그니처 영웅 ‘모모링’ 공개라인게임즈(대표 김민규)는 25일 수집형 RPG ‘엑소스 히어로즈’에 신규 시그니처 영웅 ‘모모링’을 공개했다.5성 운명 등급 ‘모모링’은 ‘노스 폰 프로스티’ 국가를 대표하는 시그니처 영웅으로 아군의 약화 효과를 해제하면서 아군 전체에게 보호막을 부여하는 등 동료들을 보호 및 강화하는 스킬들을 보유하고 있다.‘모모링’은 오는 12월 8일까지 보다 높은 확률로 획득할 수 있다.이와 함께 페이트코어(캐릭터 능력 및 외형 변경 의상) 테마 ‘지각변동’의 배경 이야기를 확인할 수 있는 코어레이드가 진행된다.코어레이드를 공략하면 ‘4~5성 아티팩트 소환권’을 획득할 수 있다.‘엑소스 히어로즈’의 론칭 3주년을 기념해 특별한 이벤트도 마련됐다. 오는 12월 22일까지 ‘엑소스 히어로즈’에 접속하는 모든 이용자들은 총 154회에 걸쳐 고급 무료 영입을 진행할 수 있다.또한 동일한 기간 동안 총 15일 접속 시 최대 ‘900 제스(인게임 재화)’, ‘국가 영입 티켓 10장’ 등 보상을 받을 수 있는 ‘15일간의 선물’ 이벤트가 진행된다.◆썸에이지, ‘데카론M’ 신규 필드 ‘소금평원’ 업데이트썸에이지(대표 박홍서)는 서비스하는 MMORPG ‘데카론M’에 신규 필드 ‘소금 평원’을 업데이트했다고 25일 밝혔다.‘소금 평원’은 ‘데카론M’에서만 즐길 수 있는 신규 콘텐츠로 ‘데카론M’ 만의 독특한 스토리가 전개될 예정이다.해조류와 붉은 산호로 붉게 물든 ‘모제 크피’와 오랜 시간 자연 정제된 최고의 품질을 지닌 소금광산 ‘코팔니아’ 2가지 맵을 만나볼 수 있다.강력해진 필드 보스 모제 크피의 ‘타락신관 드메네즈’와 코팔니아의 ‘발락’을 통해 보다 높은 단계의 아이템을 차지할 수 있게 되었다.특히 무기 전설 등급 소켓 보석 ‘헬리온의 권능’, ‘론도우의 권능’, ‘시즈의 권능’ 과 6종의 영웅 등급 무기 소켓 보석이 추가되어 상위 레벨 유저들의 호응이 예상된다.한편 오는 12월 8일까지 스페셜 출석 이벤트를 진행한다.",105,https://n.news.naver.com/mnews/article/009/0005050743?sid=103
"[속보]위메이드 장현국 ""위믹스 상폐 결정은 업비트의 슈퍼 갑질""",2022.11.25. 오전 11:11,"[서울=뉴시스]위메이드 장현국 대표. (사진=위메이드 제공)[서울=뉴시스] 오동현 기자 = 장현국 위메이드 대표는 25일 온라인 기자간담회를 열고 전날 밤 국내 4대 거래소의 '위믹스' 상장 폐지 결정에 ""상식적으로 납득이 되지 않는다""며 반발했다. 디지털자산 거래소공협의체(닥사, DAXA)는 위믹스 거래지원종료(상장폐지)를 결정했다. 현재 위믹스가 상장된 국내 거래소는 빗썸, 코인원, 업비트, 코빗 등 4곳이다.장 대표는 ""위믹스 유통 계획을 제출한 곳은 국내 4대 거래소 가운데 업비트뿐이다. 이번 사태는 업비트의 슈퍼 갑질이라고 본다""며 ""상장 폐지에 대한 어떤 가이드라인도 없는데, 위믹스가 어떤 기준을 맞추지 못했는지 아무런 설명도 없었다. 일방적인 거래 지원 종료는 갑질""이라고 주장했다.",105,https://n.news.naver.com/mnews/article/003/0011557686?sid=103
"[위믹스 사태] 장현국 대표 ""업비트의 슈퍼 갑질이 문제""",2022.11.25. 오후 12:20,"유통계획 제출한 곳은 업비트 한 곳뿐…블록체인 사업에 미칠 영향 제한적



장현국 대표가 25일 진행된 온라인 간담회에서 입장을 밝히고 있다. [사진=문영수 기자]가상화폐 '위믹스'가 국내 4대 거래소에서 거래 지원이 종료된 것과 관련해 장현국 위메이드 대표가 업비트의 '슈퍼 갑질'로 인해 초래된 문제라고 주장했다. 위믹스 사태로 인해 블록체인 사업에 미칠 영향은 제한적이라고 선을 그었다.장현국 대표는 25일 오전 진행된 온라인 간담회에서 ""어제 내려진 결론으로 인해 많은 분들과 투자자들, 위믹스 홀더와 주주들에게 심려 끼쳐드린 점 깊이 사과드린다""고 운을 뗀 뒤 ""업비트의 갑질이라고 생각한다. 그것도 슈퍼 갑질이라고 보고 있다""고 목소리를 높였다. 이날 장 대표는 ▲위메이드가 위믹스 유통계획을 제출한 거래소가 업비트 한 곳뿐이라는 점 ▲과정과 결과의 불투명성 ▲타 코인과 위믹스의 불공정 등을 핵심 이유로 꼽았다.그는 ""4주 전 문제가 됐을 때  업비트 측에 업비트가 정의한 유통량이 무엇인지 기준과 가이드라인을 달라고 했으나 지금까지도 준적이 없다. 피드백도 원할하지 않았다""며 ""기준도, 가이드라인도 없는데 거래지원을 종료시킨 결정은 비합리적이라고 생각한다""고 말했다.이어 ""우리도 위믹스 거래 지원 종료를 업비트 공지를 보고 알았다. 외부 공표 전에 무엇이 문제였고 해결되지 않아 미진하다는 걸 알리는 게 상식적인 방안이나 소명 중에 무엇이 불충분했는지 말해주지 않았다""면서 ""이러한 불투명한 결론은 '갑'들이 하는 거다. 한국의 가상화폐 투자자들이 이런 대우를 받아도 되는지 심각한 의문을 갖고 있다""고 지적했다.아울러 ""업비트에 들어가서 개별 코인들 눌러보라. 유통계획이 없는 코인이 부지기수""라며 ""이게 거래지원을 종료할만큼 중요한 변수인데 이를 받지도 않은 코인 유통시키고 있다. 왜 위메이드와 위믹스의 기준을 다른 코인에는 적용하지 않는건지 묻고 싶다""고 덧붙였다.장 대표는 업비트 측이 위믹스 거래지원 종료를 SNS에 올린 점도 문제삼았다. 그는 ""업비트 경영진 한분이 인스타에다 관련 기사를 올리면서 자랑하고 있었다. 이게 이 일이 인스타에 올려서 자랑할 일인가""라며 ""이 일로 인해 직접적으로 영향을 받을 회사도 많고 투자자들이 많은 사안이다. 과정은 매우 신중해야 하며 결론을 공표하는 과정도 공정해야 한다""고 말했다.장현국 대표는 ""왜 위믹스를 상장폐지시는지, 다른 코인은 왜 그 기준을 적용하지 않았는지 업비트에 질문해야 한다고 본다""면서 ""업비트는 명확히 답을 해야 할 것""이라고 지적했다.아울러 ""어떤 커뮤니케이션이 있었는지 모든 이메일과 통신, 녹음한 회의, 줌회의를 적절한 시점에 공개하겠다""며 ""법적 절차를 진행해야 해서 당장 공개는 어렵다. 재판부에 증거가 제출된 이후에는 모두에게 공개해서 업비트가 어떤갑질을 했는지, 위믹스에게 어떤 소명 요구했는지 알리겠다""고 말했다.이번 위믹스 사태로 블록체인 P2E 사업에 미치는 영향은 제한적일 것이라고도 했다. 장 대표는 ""위믹스는 사업의 축이 글로벌로 가 있어 국내 거래소에 거래가 되는지 안되는지 여부가 사업에 미치는 영향은 제한적""이라고 말했다.한편 업비트를 비롯한 주요 가상자산 거래소가 모인 디지털 자산 거래소 공동협의체(이하 DAXA)는 위믹스의 거래 지원을 종료한다고 24일 발표했다. 지난달 27일 위믹스를 투자 유의 종목으로 지정한지 28일만이다. 이에따라 위믹스는 업비트·빗썸·코인원·코빗 등 주요 거래소에서 오는 12월 8일부터 거래 지원이 종료된다.",105,https://n.news.naver.com/mnews/article/031/0000712908?sid=103
"장현국, 상폐 '위믹스' 더 샀다…""11월 월급 5241만원 올인""",2022.11.25. 오후 1:22,"장현국 위메이드 대표장현국 위메이드 대표가 위믹스 상장폐지 논란 속에서도 월급으로 위믹스를 추가 매입했다. 25일 위메이드에 따르면 장 대표는 이날 오전 9시45분에 11월 급여(약 5241만원)로 9만480개의 위믹스를 추가 매입했다. 지난 4월부터 9차례에 걸쳐 위믹스를 매수해온 장 대표의 평가손익은 -77.43%다.장 대표는 이날 기자간담회에서 ""오늘 오전에도 위믹스를 매입했다""라며 ""그만 두기 전까지 위믹스를 1개도 안 팔겠다, 위메이드 주식도 1개도 안팔겠다는 약속을 지킬 것""이라고 말했다. 한편, 전날 업비트·빗썸·코인원·코빗·고팍스 등 5개 거래소로 구성된 디지털자산거래소 공동협의체 닥사(DAXA)는 위믹스 거래지원 종료를 결정했다. 이에 따라 내달 8일 오후 8시에 5대 거래소에서 위믹스가 일제히 상장 폐지될 전망이다.



/사진=위메이드",105,https://n.news.naver.com/mnews/article/008/0004822282?sid=103
,,,105,https://n.news.naver.com/mnews/article/347/0000168242?sid=103
‘신장 결석’ 발생 위험 낮추는 ‘이것’… 스웨덴 연구팀 분석,2022.11.25. 오후 6:01,"ⓒ게티이미지뱅크커피를 많이 마실수록 신장 결석 발생 위험이 낮아진다는 연구 결과가 나왔다. 커피 속 카페인이 이뇨 작용을 해 소변의 흐름을 증가시키기 때문이라는 설명이다. 스웨덴 카롤린스카 연구팀은 영국 바이오뱅크와 핀란드 핀젠 등에 등록된 57만1657명의 유전 정보를 이용해 커피 섭취와 신장 결석 발생 위험의 상관 관계에 대해 분석했다. 이 가운데 신장 결석 환자는 1만392명이고, 나머지 56만1265명은 신장 결석이 없었다. 그 결과, 유전적으로 커피 소비가 50% 증가할 것으로 예측될 때마다 신장 결석 발생 위험은 40% 감소했다. 연구팀은 “커피와 카페인 섭취량이 많을수록 신장 결석 발생 위험이 낮아졌다”며 “커피의 카페인이 이뇨 효과를 나타내고, 소변의 흐름을 증가시킨 덕분으로 여겨진다”고 설명했다.신장 결석은 전체 인구의 약 10~15%가 앓는 것으로 전해졌다. 카페인은 신장 결석의 주범인 ‘칼슘 옥살레이트’ 결정이 신장 세뇨관 상피 세포의 표면에 달라붙는 것을 억제할 수 있다. 또 커피에 풍부한 유기산의 일종인 ‘구연산’도 신장 결석 형성 억제제로 알려져 있다.



ⓒ게티이미지뱅크기존 연구에서도 카페인은 신장 결석 발생 위험을 낮추는 것으로 나타났다. 미국 보스턴의 브라이엄 여성병원 연구팀이 8년간 환자 19만4095명을 대상으로 조사한 결과, 커피를 하루 1회 이상 섭취한 사람은 주 1회 미만으로 섭취한 사람보다 신장 결석 발생 위험이 약 26% 더 낮았다.",105,https://n.news.naver.com/mnews/article/020/0003464506?sid=103
