title,date,main,section,url
"배민, 민노총과 배달료 협상 합의안 마련···보험료 지급 포함",2021.12.24. 오후 6:14,"최대 연간 100만 원 보험료 2년간 지원직선거리 아닌 실거리 기준으로 변경



민주노총 서비스연맹 서비스일반노조 배달플랫폼지부 조합원들이 지난 23일 오후 서울 송파구 배달의민족 본사 인근에서 열린 '배달의 민족 임금교섭 승리!' 배달노동자 결의대회에서 배달료 인상 및 픽업거리 할증 도입을 촉구하며 행진을 하고 있다./연합뉴스[서울경제] 우아한형제들의 자회사 우아한청년들은 민주노총 서비스일반노동조합 배달플랫폼지부와 함께 24일 노사 협상을 통해 배달료 단체 협상 합의안을 도출했고 밝혔다. 이번 합의안은 노조 조합원들의 투표를 거쳐 가결될 시 다음 달 중 시행될 예정이다.합의안에 따르면 우선 우아한청년들은 라이더의 안전한 운행을 지원하고자 연간 최대 100만 원의 보험료를 지원하기로 했다. 1년 이상 배송대행 기본계약자 중 1일 20건 이상, 연간 200일 이상 배송실적이 있는 오토바이 가입자를 대상으로 2년간 보험료를 지원한다.또 유상종합보험 가입자의 경우 연간 100만 원, 유상책임보험 가입자의 경우 연간 50만 원을 2년동안 지원받는다. 이는 당사 렌탈 바이크(민트바이크)를 사용하는 라이더에게도 동일 적용되며, 연간 100만 원의 보험료를 2년간 지원한다.



우아한청년들이 민주노총 서비스일반노동조합 배달플랫폼지부와 마련한 배달료 합의안의 일부 내용/사진 제공=우아한청년들아울러 우아한청년들은 배달료 산정 기준을 기존 직선거리에서 내비게이션 실거리 기준으로 변경했다. 500m 이내 3,000원이었던 기존 배달료를 675m 미만일 경우 기본 3,000원으로 조정한다. 또 675m 이상 1,900m 미만은 3,500원으로, 1,900m 이상은 3,500원에 100m당 80원을 추가 지급하기로 했다.이밖에 노사는 배달 노동자를 위한 공제조합 출범을 위해 함께 노력하기로 했다. 공제조합 설립 시 배달 과정에서 사고 등이 발생할 경우 공제조합을 통해 손해배상 등을 지원할 수 있어 라이더 안전망 확충을 위해 다양한 지원을 할 수 있을 것으로 기대된다.김병우 우아한청년들 대표는 “이번 교섭을 통해 오토바이 가입자 대상 보험료 지원, 내비게이션 실거리제 도입, 공제조합 설립 등 배달 라이더들의 실질적인 배달 환경 개선을 이룰 수 있게 됐다”며 “앞으로도 배달 라이더들의 안전 강화 및 교육 등 활동을 통해 배달 환경 개선에 힘쓰겠다”고 말했다.",105,https://n.news.naver.com/mnews/article/011/0004000715?sid=103
[표지로 읽는 과학]오미크론 변이 첫 보고한 남아공 연구자 등 네이처 선정 올해의 인물 10인,2021.12.25. 오전 6:01,"네이처 제공   국제학술지 네이처는 15일 2021년 한해 동안 과학계에 기여한 10인을 선정해 발표했다. 1년 동안 과학계에서 주요한 사건들이 일어났으며 그 사건마다 이정표 역할을 한 주요 인물을 선정했다. 이를 상징하기 위해 네이처는 복잡한 자연 속에 우뚝 솟아 있는 사람을 그린 일러스트를 23일 표지에 담았다.   신종 코로나바이러스 감염증(COVID-19·코로나19) 오미크론 변이를 첫 발견해 신속하게 보고하고 대중에게 코로나 변이에 대한 정보를 알린 인물, 백신 불평등을 예견하며 해소법을 주장했던 인물 등이 선정됐다.    툴리오 드 올리베이라 남아프리카공화국 콰줄루나탈 연구혁신및시퀀싱플랫폼연구소(KRISP) 소장은 지난달 25일 오미크론 변이를 전 세계에 신속히 알렸다. 그는 지난해 베타 변이를 첫 발견한 사람이기도 하다.    드 올리베이라 소장은 베타 변이를 발표했을 당시 각국이 남아공에 대한 출입국을 제한하며 경제적 불이익을 가져다줬던 상처를 떠올렸다. 하지만 대유행을 막아야 한다는 생각에 흔들리지 않고 오미크론 변이를 신속하게 보고했다. 이 덕분에 세계 각국에서는 유행 초기부터 오미크론 변이 확진자를 찾아내고 역학조사가 가능할 수 있었다.   네이처는 ""드 올리베이라 소장이 새 변이에 보고할 시 남아공에 미칠 타격을 예상하면서도 오미크론 피해를 줄이기 위해 신속하게 보고했다""고 높게 평가했다.    메간 칼 영국공중보건국 코로나19 수석역학자는 본인의 SNS 트위터에서 코로나19 변이에 대한 정부 데이터를 정확하고 쉽게 설명해왔다. 네이처는 인터넷에서 코로나19 변이에 대한 가짜뉴스가 퍼지는 것을 막는 데 일조했다는 평가를 곁들이며 올해의 인물에 선정했다.   네이처는 위니 바이애니마 유엔에이즈계획(UNAIDS) 사무국장을 '백신 워리어'라 칭하며 소개했다. 그는 코로나19 대유행 초기부터 중저소득국가에 백신이 공평하게 공급되지 않을 것을 경고해왔다. 이미 후천성면역결핍증후군(AIDS·에이즈) 치료제 공급에서 비슷한 현상을 목격했기 때문이다. 그는 모든 사람에게 백신 접종 기회를 부여하려면 가능한 한 많은 기업이 백신을 제조해야 하고, 백신 공급 인프라를 구축해야 한다고 주장했다.   안타깝게도 백신 불평등은 현실화했다. 화이자와 모더나 등 주요 코로나19 백신 제조사들은 지적재산권 권리를 굳건히 지켜왔고, 백신 대부분은 고소득국가로 돌아갔다. 네이처에 따르면 저소득국가의 백신 접종률은 6%에 불과한 상황이다. 세계보건기구(WHO)에서는 저소득국가 백신 접종률을 약 7.5% 가량으로 보고 있다.   바이애니마 국장은 세계국민백신연합(PVA)을 설립하고 백신 공급에 형평성이 있어야 함을 강력하게 주장해왔다. 그 결과 지난 5월 미국 정부가 백신 공급을 늘리기 위해 제조사들의 특허 포기를 지지하도록 이끌어 냈다.     네이처는 이외에도 폭염, 홍수 등 극한 기후변화를 연구하는 프리데리케 오토 영국 옥스퍼드대 환경변화연구소 명예 연구원, 장 룽차오 중국국가과학기술산업위원회 달탐사센터 화성탐사선 톈원 1호 수석 설계자, 인공지능(AI) 윤리 전문가인 팀니트 게브루 분산인공지능연구소 설립자, 단백질 구조 예측 AI인 '알파폴드'를 개발한 존 점퍼 구글 딥마인드 수석연구원을 올해의 인물로 선정했다.    또 전세계 원주민들이 생물다양성과 기후 보호에 기여하고 있음을 인정받게 한 환경운동가 빅토리아 타울리코르푸즈, 엉터리 논문을 찾는 소프트웨어를 개발해 가짜논문 수백 편을 철회하도록 한 기욤 카바낙 프랑스 툴루즈대 컴퓨터과학과 교수, 알츠하이머 치료제 승인을 포함한 여러 의약품 이슈에 중요한 역할을 해온 재닛 우드콕 미국식품의약국(FDA) 국장 대행도 올해의 10인에 선정됐다.",105,https://n.news.naver.com/mnews/article/584/0000017236?sid=103
"P2E 게임 ‘무한돌파삼국지 리버스’, 결국 앱마켓 삭제 수순",2021.12.24. 오후 8:23,"구글 플레이서 검색 안돼…기존 이용자는 접속 가능소위 ‘돈버는게임(P2E, 플레이투언)’으로 불리는 ‘무한돌파삼국지 리버스’가 결국 앱 마켓 삭제 절차에 돌입했다.24일 ‘무한돌파삼국지 리버스’의 개발사 나트리스는 게임물관리위원회로부터 등급분류취소 확정 통보를 받았다고 공식 카페를 통해 공지했다.실제 국내 구글 플레이에서는 ‘무한돌파삼국지 리버스’가 검색되지 않는 상황이다. 전일까지 매출 순위 20위권 내에 존재했지만 순위에서도 찾아볼 수 없게 됐다. 다만 기존 기기에 설치돼 있는 경우 접속이 가능하며 가상재화 ‘무돌토큰’도 정상적으로 수취할 수 있다. 나트리스는 공지를 “무돌토큰 관련 콘텐츠가 제외된 ‘무한돌파삼국지 리버스L’을 준비하고 있다”라며 “이번 등급분류 취소와 관련해 김앤장 법률사무소를 통해 집행정지 가처분 소송 및 등급분류결정취소처분 취소소송을 진행할 예정”이라고 설명했다. 



 P2E 게임은 블록체인 기술을 적용해 실제 현금으로 교환할 수 있는 가상자산을 제공하는 게임을 말한다. 올해 베트남 기업 스카이마비스의 ‘엑시 인피니티’와 국내 위메이드의 ‘미르4’ 글로벌 버전이 흥행에 성공하면서 시장의 관심을 끌었다.그러나 국내에서는 게임물관리위원회가 사행성 우려를 이유로 유통을 금지한다. 게임을 통해 얻은 유무형의 재화를 환전하는 것을 금하는 게임산업진흥에관한법률 제32조 1항 7조를 어겼다는 판단이다. 가상자산 지급을 일종의 경품 제공으로 간주해 제28조 3호에 따른 사행성 조장 금지 규정을 했다고 해석하기도 한다.지난달 출시된 ‘무한돌파삼국지 리버스’는 이달초 ‘돈버는게임’이라는 입소문을 타고 인기를 끌었다. 게임물관리위원회는 ‘무한돌파삼국지 리버스’에 대해 검토하고 최근 등급분류취소 예정통보를 나트리스측에 전달했다.다만 나트리스의 법적 대응 예고로 ‘무한돌파삼국지 리버스’의 서비스가 재개될 공산도 존재한다. 이미 법적 다툼을 통해 서비스를 유지 중인 대체불가토큰(NFT) 적용 블록체인 게임 ‘파이브스타즈’의 사례가 있기 때문이다.‘파이브스타즈’ 개발사 스카이피플은 지난 5월 게임물관리위원회의 등급분류 취소 결정에 맞서 가처분 및 행정처분 취소 소송을 제기했고 서울행정법원은 지난 6월 이를 인용했다. 스카이피플은 게임물관리위원회를 상대로 본안 소송을 진행하며 현재도 ‘파이브스타즈’의 서비스를 이어가고 있고 있다.",105,https://n.news.naver.com/mnews/article/009/0004898902?sid=103
"홈파티·연말 선물 ‘득템’ 마지막 기회, 어디서 살까?",2021.12.24. 오후 4:12,"[디지털데일리 이안나 기자] 연말연시를 앞둔 12월은 커머스 업계 성수기다. 크리스마스 및 지난 한 해 감사 표시로 선물 거래가 증가하는 시기이기 때문. 여기에 사회적 거리두기 강화로 크리스마스 선물을 비대면으로 전달해주거나 연말 송년회도 ‘홈파티’에서 진행하는 경우가 많아졌다.    가족·지인들과 풍성한 연말을 보내기 위해 준비하고 있다면 이번 할인전들을 눈여겨보면 좋다. 이번 주말을 끝으로 종료되는 이벤트가 있는가 하면 올해 마지막 주 진행하는 프로모션까지 포함했다. ◆위메프, ‘굿바이 2021’…연말 총결산 앙코르 세일=위메프는 오는 27일부터 31일까지 진행하는 ‘굿바이2021’을 진행한다. 올 한해 판매된 상품을 총결산해 이용자들에게 가장 많은 사랑을 받았던 상품을 다시 한번 선보인다.‘베스트 of 베스트관’에서는 5일간 매일 인기 상품 중 10개씩을 엄선해 초특가에 공개한다. 주요 상품은 ▲페브리즈 에어(275g) 3개+양치컵 ▲Pays 롯데리아 1만원권(11% 할인) ▲락앤락 무직타이거 클립텀블러(540mL) 등이다. ‘카테고리별 베스트관’에선 ▲스노우볼 메이커 눈오리/눈사람 등 1+1 ▲비비안 폴라베어 남녀공용 상하의세트(EZ140ZU) ▲삼립 발효미종 호빵 12봉 2박스 등을 준비했다.행사 기간 매일 오전·오후 11시 정각 포인트 지급 이벤트도 연다. 각각 선착순으로 2500명, 하루 5000명에게 위메프 포인트 1000원을 지급한다. 포인트 지급 이벤트에 참여한 일반 회원은 VIP클럽 즉시 승급 혜택도 받는다. VIP클럽 혜택은 다음 달 마지막 날까지 유지된다.



◆인터파크, ‘2021 인터파크TV 베스트 상품 어워즈’ 진행=오는 28일 오전 11시엔 인터파크 라이브커머스 플랫폼 ‘인터파크TV’에서 ‘2021 베스트상품 어워즈’ 라이브 방송이 진행된다. 올 한해 라이브커머스를 통해 시청자들에게 사랑 받은 상품을 부문별로 선정하고 소개하는 연말 결산 행사다. 한해를 마무리하는 결산 어워즈인만큼 풍성한 혜택과 이벤트를 마련했다.이날 방송 주요 상품으로 ▲삼성전자 갤럭시탭S7FE ▲롯데제과 빼빼로 ▲코베아 멀티올인원 올블랙 ▲코베아 파워센스 히터 ▲골드팡 24K 순금 주얼리 등이 있으며, 라이브 방송 혜택가로 구매할 수 있다. 적극적으로 댓글 참여를 한 고객 중 추첨해 커피 기프티콘(100명)을 증정하며, 방송 중 진행되는 퀴즈 정답을 맞히면 인터파크 아이포인트 5만점을 적립(5명)해준다. 댓글로 구매인증 시 추첨을 통해 케이크 기프티콘을 경품으로 제공(10명)한다.



  ◆11번가 “새해 선물, 펜싱 국가대표 F4 달력 어떠세요?”=11번가는 펜싱 국가대표 선수들의 ‘2022 펜싱 F4 캘린더’와 ‘펜싱 픽토그램 티셔츠’를 단독 판매하고 있다. 일명 ‘펜싱 F4’로 불리는 2020 도쿄올림픽 남자 사브르 국가대표팀 선수들(김정환, 구본길, 김준호, 오상욱)이 코로나19 기부 이벤트를 위해 나선 프로젝트다. 판매금 일부는 코로나19로 어려움을 겪고 있는 저소득층 아동 및 청소년에게 기부될 예정이다.    달력은 최근 다양한 굿즈 등 ‘팬더스트리’(팬+인더스트리) 사업을 확장하고 있는 드림어스컴퍼니(음악플랫폼 플로 운영사)와 ‘펜싱F4’가 협업해 출시했다. 캘린더 판매가는 1만6000원, 펜싱과 기부를 픽토그램 이미지로 만든 ‘펜싱 픽토그램 티셔츠’를 함께 구매할 경우 3만6000원이다. 배송은 내년 1월 18일부터 시작된다.



   ◆ 카카오커머스 “크리스마스 게임하고 경품도 받고”=카카오톡선물하기는 25일까지 경품 프로모션 ‘크리스마스 선물게임’ 이벤트를 진행한다. 카카오 단체 대화방에서 선물게임을 보낼 때마다 랜덤 선물상자를 열 수 있는 열쇠를 지급한다. 대화방과 선물할 인원을 설정한 후, 보낼 선물을 골라 결제하면 대화방에서 자동으로 랜덤 혹은 선착순으로 선물게임이 진행된다. 편의점 상품 혹은 커피 교환권 등을 활용해 지인들 대상으로 소소한 이벤트를 열 수 있는 셈이다.   선물게임 결제 1건당 열쇠 1개가 카카오톡 메시지로 발송되고, 즉시 선물 상자를 열어 당첨 경품을 확인할 수 있다. 순금 열쇠 펜던트(6명), 초콜릿 간식박스(20명), 컵케이크 모양 양말세트 (50명), 카카오쇼핑포인트 등 다양한 선물을 랜덤 증정한다. 한편 선물하기에선 크리스마스 기획전도 운영 중이다. 다양한 상황과 가격대별 선물을 추천해준다. 



  ◆SSG닷컴, 연말 기획전 막바지…기프트박스 구매로 최대 45%할인=SSG닷컴이 이달 중순부터 시작한 ‘더 원더풀 프레젠트’ 프로모션은 이번 주말인 26일까지 진행한다. 총 2000억원 규모 물량을 풀고 할인·기획 상품을 선보인다. 디즈니 캐릭터 완구류부터 패션, 뷰티, 명품, 가전 품목 상품을 특가에 판매한다.   겨울왕국, 토이스토리 등 디즈니 인기 콘텐츠와 관련된 완구 위주로 구성된 '원더풀 기프트박스' 5종을 준비했다. 기프트박스 구매 시 개별 상품으로 구매할 때보다 최대 45% 저렴하게 구매할 수 있다. 홈파티 소품인 종이 폭죽도 증정한다. SSG닷컴을 처음 이용하는 고객을 대상으로 현금처럼 쓸 수 있는 SSG머니 5000원을, 선물하기 서비스를 이용하는 고객에게는 SSG머니 1000원을 증정한다.



◆롯데온 “조카 얼굴은 못 봐도, 선물은 줘야해!”=롯데온은 오는 26일까지 연말 및 크리스마스 선물을 최대 20% 할인해 판매한다. 롯데백화점과 토이러저스 등 다양한 외부 셀러가 입점해 있어 명품을 비롯한 고가 선물부터 중저가 실속 상품까지 비교·검색할 수 있다. 선물하기 탭에선 상황 및 성별에 따라 명품 선물과 스몰럭셔리 등 16가지 테마로 상품을 제안한다.크리스마스 선물 인기 항목으로 꼽히는 쥬얼리를 구매할 기회도 마련했다. 롯데온·롯데백화점은 ‘제이에스티나 홀리데이 기프트’를 진행해 연말 한정판 쥬얼리를 선보인다. 상품 구매 시 온·오프라인에서 각각 사은품을 증정한다. 전국 롯데마트 토이저러스 매장과 동시에 1000여개 완구 상품을 최대 50% 할인 판매하고 구매 금액에 따라 사은품을 준다.",105,https://n.news.naver.com/mnews/article/138/0002115988?sid=103
"이재명·안철수 “돈 버는 게임, 무조건 규제부터 할 필요 없어”",2021.12.24. 오후 6:59,"[디지털데일리 왕진화 기자] 주요 차기 대선 주자들이 유명 게임 유튜브 채널에 출연해 게임에 대한 전반적인 의견을 나눴다.    이전 대선 주자들 사이에선 볼 수 없었던 이례적 행보다. 비교적 젊은 세대로 구성된 게이머 민심을 사로잡아 이들의 표심까지 저격하겠다는 전략으로 풀이된다. 특히 플레이투언(Play to Earn, 이하 P2E) 등 요즘 게이머가 관심을 많이 두고 있는 주제에 대한 시선을 가감 없이 드러내기도 했다.    이재명 더불어민주당 대선 후보와 안철수 국민의당 대선 후보는 각각 지난 20일, 23일에 게임 전문 유튜브 채널 ‘김성회의 G식백과’를 통해 “국내에서 P2E 서비스를 무조건 금지할 필요는 없다”고 밝혔다.   이재명 대선 후보는 P2E에 대해 긍정적인 입장을 내비쳤다. 이 후보는 지난 20일 게임 전문 유튜브 채널 ‘김성회의 G식백과’를 통해 “P2E가 세계적인 흐름인 만큼 나쁘게 볼 필요는 없다고 생각한다”며 “해외에서 이미 활발한 산업인 만큼 무조건 금지하면 쇄국 정책하는 꼴”이라고 지적했다.    그는 “흐름에 끌려갈 게 아니라 우리가 선도할 필요가 있다”며 “문제점들을 최소화하고 긍정적 요소를 키워 사회 전체적으로 도움이 된다면 새로운 제도로서 받아들여야 한다”고 강조했다.   안철수 대선 후보도 같은 채널에 지난 23일 출연해 P2E 게임 해외 서비스 사례를 1년간 지켜보는 것도 나쁘지 않다고 피력했다.   안 후보는 “P2E 게임을 허용하는 국가를 1년 정도 지켜보자”며 “좋은 측면과 나쁜 측면을 체크하고, 나쁜 측면은 어떻게 개선하면 좋은 쪽으로 바뀔 수 있을지도 생각하고 판단해도 늦지 않다”고 말했다.   게임사를 향한 규제에 대해선 바라보는 시선이 조금 달랐다. 이 후보는 게임사에 대한 과한 규제가 불필요하다는 입장이다. 이 후보는 “불필요한 규제로 인해 과거 국내 게임 산업이 잘 나가다가 중국에 따라잡혔다”며 “매출이나 이용자 수 등을 고려해 회사 규모를 나눠 규제를 별도 적용하는 등 합리적인 정책이 필요하다”고 말했다.   안 후보 또한 “정부가 관심을 가지고 진흥을 하면 할수록, 해당 산업에 좋은 영향을 미치지 못한 것 같다”고 지적했다. 다만 그렇다고 해서 너무 풀어주는 것도 좋지 않다고 선을 그었다.    안 후보는 “너무 무관심으로 일관해 사업자를 풀어주면 시장이 왜곡돼 고스란히 이용자에게 피해를 줄 수 있다”고 우려하며, “적극적인 진흥보단 기반을 닦아 자유롭게 많은 시도를 할 수 있도록 지원하는 게 낫다”고 강조했다.    한편, 구독자 75만명인 ‘김성회의 G식백과’를 운영하는 유튜버 김성회 씨는 윤석열 국민의힘 대선 후보 출연도 추진했다. 다만 윤 후보는 인터뷰에 응하지 않은 것으로 알려졌다.",105,https://n.news.naver.com/mnews/article/138/0002115996?sid=103
