title,date,main,section,url
"""연봉 최소 2배, 이뿐만이 아니다"" 넷플릭스코리아 '꿈의 직장' 떠오른 이유",2021.11.26. 오전 9:34,"연차 사용 근태관련 '규칙없음'스톡옵션 받을 수 있는 기회도철저한 성과주의에 자율적 문화올해 PD 작가 수십명 대거 이직""넷플릭스로 가면 콘텐츠 제작 같은 고유 영역에만 집중할 수 있고 커리어 개발도 됩니다.""(한국 콘텐츠업계 관계자)넷플릭스 오리지널 드라마 <오징어게임> <지옥>이 인기를 끌면서, 넷플릭스코리아가 콘텐츠 제작 업계에서 취업 선호 기업으로 떠오르고 있다. 직원 개개인의 자율성을 중요시해 높은 연봉을 받으며 자신이 원하는 일을 주도적으로 할 수 있기 때문이다. 넷플릭스 대표인 리드 헤이스팅스의 인사철학인 '규칙과 규정을 없앤다(No Rules Rules)'도 인재를 넷플릭스로 유입시키는 요인이란 분석이다.  26일 업계에 따르면, 올해만 수십명의 국내 인력이 넷플릭스로 이직했다. 이에 힘입어 올해 넷플릭스코리아 인원은 100명을 훌쩍 넘어선 것으로 알려졌다. 평균 연봉도 지난해 1억원을 이미 넘어섰는데, 올해 <오징어게임>과  <지옥> 등의 인기를 힘입어 더욱 올랐을 것으로 파악된다. 한 업계 관계자는 ""현재 8000만원을 받는 제작자가 넷플릭스로 옮기면 최소 2배 이상 연봉이 뛴다""고 귀띔했다.넷플릭스코리아는 총 3개 부문 (콘텐츠·제작·백오피스)로 나뉜다. 콘텐츠 부문은 감독과 작가와 협력해 전략을 짜는 역할을 하고, 제작 부문은 드라마 영화를 제작하는 역할을 한다. 넷플릭스코리아 관계자는 ""콘텐츠와 제작부문 인력이 전체 넷플릭스코리아 인력에서 차지하는 비중이 많다""고 설명했다. 애플과 구글 등 타 한국지사는 미국 본사의 지시를 받는 백오피스 인력이 주인 것을 감안하면, 넷플릭스코리아는 미국 본사 지시를 단순히 수행하고 있는 조직이 아니라 '콘텐츠 생산기지'로서 일을 하고 있는 것이다. 색상편집자, 음향전문가, 대본작가, 감독 등이 대거 넷플릭스에 합류한 이유이기도 하다. 서울 종각역 센트로폴리스에 본사가 있지만, 현장인력 위주여서 주로 제작인력은 충무로와 상암동에서 일한다.채용 시장에서 넷플릭스코리아에 대한 선호도가 높아진 데는 절차와 형식이 만드는 '비효율성'을 제거하는 여러 조치들도 한몫 하고 있다는 평가다. 예컨대 사내 거의 모든 문서를 적극 공개해 누구나 읽고 간단한 의견을 남길 수 있도록 했다. 연차휴가 기간이나 근태규칙 형식도 없다. 휴가방침은 ""휴가를 쓰자""만 있는 상태다. 모든 직원은 매년 연봉과 스톡옵션 중 무엇으로 보상받을지 선택한다. 10년 만기 스톡옵션은 행사를 제한하는 기간이 없으며, 퇴사하더라도 계속 보유할 수 있다.이에 대해 넷플릭스는 사내 문화를 '어린왕자' 저자인 생텍쥐페리의 명언('배를 만들고 싶다면, 사람들이 나무를 모으고 일을 분담하게 시키는 대신, 사람들이 넓고 끝없는 바다를 동경하게 하라')으로 묘사했다. 1인 단위로 일하면서도 정보를 공유하면서 상호 간 동의 결정을 하는 구조로 자율성과 책임성을 동시에 부여한다는 설명이다. .",105,https://n.news.naver.com/mnews/article/009/0004884746?sid=103
"케이블TV SO 6개사, IPTV 서비스 가능해진다",2021.11.26. 오전 11:50,"과기정통부, SO 6개사 IPTV 허가 심사 결과 발표6개사 모두 500점 만점에 350점 이상 획득…이르면 내년부터



© News1(서울=뉴스1) 김정현 기자 = 종합유선방송사업자(SO) 6개사가 앞으로 기존 방송 구역 내에서 케이블TV 방식 외에 IPTV 서비스를 제공할 수 있게 됐다.26일 과학기술정보통신부는 지난 11월23일부터 26일까지 비공개로 진행한 SO 6개사에 대한 IPTV 허가 심사 결과를 발표했다. 이번 결과에 따라 Δ㈜한국케이블TV광주방송(광주 동구·북구) Δ㈜케이씨티브이제주방송(제주·서귀포) Δ㈜아름방송네트워크(경기 성남) Δ㈜서경방송(경남 진주, 사천, 남해, 하동, 산청, 함양) ΔJCN울산중앙방송㈜(울산 중구, 남구, 동구,북구, 울주) Δ금강방송㈜(전북 익산, 군산) 6개 사업자는 기존에 허가받은 구역 내에서 IPTV방식의 방송 서비스를 제공할 수 있도록 허용됐다.앞서 과기정통부는 지난 11월23일부터 26일까지 방송, 법률, 경영·회계, 기술, 소비자 등 5개 분야의 외부 전문가로 허가 심사위원회를 구성해 비공개 심사를 진행했다.허가 심사위원회에서 지난 7월 수립된 허가 심사 기본계획에 따라 Δ기술적 능력 Δ재정적 능력 Δ방송의 공적책임 Δ유료방송시장에서의 공정경쟁 측면 등을 종합적으로 검토한 결과, 6개사 모두 총점 500점 만점 중 기준점수인 350점 이상을 획득했다. 허가 심사위원회 측은 ""6개 SO 모두 오랜 기간 해당 방송구역 내에서 방송서비스를 제공해 왔고, IPTV방식의 방송 서비스 제공을 위한 기술적 능력 및 시설계획 등에 특별한 우려사항은 없었다""며 ""허가하는 것이 적정하다""는 의견을 제시했다.6개 SO는 IPTV방식의 방송서비스 제공을 위한 주전송장치 등 방송시스템 구축, 셋톱박스 개발 등을 거쳐 이르면 1년 후부터 서비스를 개시할 예정이다.과기정통부 측은 ""방송의 기술 규제를 없애는 세계적 추세에 따라 기술 중립성 도입을 위한 법적 기반이 조속히 마련될 필요가 있다""며 ""망 운영의 효율성 제고와 품질 경쟁 촉진, 이용자의 서비스 선택 다양화, 신규 망 투자, 셋톱박스 개발 및 보급 증가 등의 효과가 기대된다""고 말했다.",105,https://n.news.naver.com/mnews/article/421/0005748734?sid=103
,,,105,https://n.news.naver.com/mnews/article/092/0002240465?sid=103
‘아이폰빠’ 美 월가 삼성 것 쓰게 한 이재용 한마디?,2021.11.26. 오후 5:52,"[헤럴드경제=김민지 기자] “애플·블랙베리만 쓰던 미국 월가를 바꿔 놓은 이재용의 한마디?”이재용 삼성전자 부회장이 직접 갤럭시 스마트폰을 영업했던 사례가 뒤늦게 알려져 화제다. 업무용 스마트폰으로 애플, 블랙베리만을 허용하던 미국 월가의 중심 ‘골드만삭스’의 빗장을 풀었다. 이 부회장의 영업으로 골드만삭스는 삼성전자에 특별 인증을 내줬다.26일 업계에 따르면, 전날 서울 서초구 서울중앙지방법원에서 열린 회계부정·부당합병 관련 1심 속행공판에서 이재용 부회장이 골드만삭스 고위 경영진과 주고받은 이메일 내용이 공개됐다.2015년 7월 당시 이 부회장은 이메일을 통해 “왜 골드만삭스에서는 삼성 스마트폰을 사용하지 못하나요? 보안 때문인가요?”라고 물었다. 이후 답변을 받은 그는 “알겠습니다. 제가 기술진과 다시 방문해 애로 사항을 해결하겠습니다”라고 말했다.



이재용 삼성전자 부회장[연합]골드만삭스와 같은 대형 투자 은행에겐 보안이 생명이다. 특히, 업무 기밀이 스마트폰을 통해 유출될 수 있다는 우려가 크다. 때문에 임직원들은 회사 기술부서에서 별도의 인증을 받은 휴대전화만 업무용으로 사용할 수 있다. 당시 골드만삭스 기술부서의 특별인증을 받은 스마트폰은 애플과 블랙베리 두가지였다.이 부회장은 골드만삭스 경영진과의 미팅에서 이 같은 사실을 확인하고 직접 영업에 나선 것으로 나타났다.특히 그는 이메일 내용처럼 삼성전자 엔지니어들과 함께 직접 골드만삭스 뉴욕 본사에 찾아갔다. 엔지니어들은 골드만삭스 측에 삼성전자 스마트폰의 장점과 보안 기능에 대해 프레젠테이션 했다.



골드만삭스 로고 [헤럴드경제DB]그 노력은 까다롭기로 유명한 골드만삭스의 기준을 통과하는 성과로 이어졌다. 골드만삭스 기술부서는 삼성전자 스마트폰에 특별 인증을 내줬다. 현재 골드만삭스 임직원들은 삼성전자 스마트폰도 업무용 전화기로 사용 중인 것으로 알려졌다.결국 이재용 부회장의 ‘영업맨’적 면모가 골드만삭스 임직원 시장이라는 대규모 프로젝트를 성사시킨 셈이다. 이 부회장이 직접 영업에 뛰어든 사례는 이번이 처음이 아니다. 삼성전자는 지난해 버라이즌에 약 7조9000억원 규모의 네트워크 솔루션 공급 계약을 체결했다. 한국 통신장비 산업 역사상 역대 최대 규모의 단일 수출 계약이었다. 이 부회장은 이 과정에서 한스 베스트베리 버라이즌 CEO와 영상통화를 하는 등 적극 영업에 나섰던 것으로 알려졌다.",105,https://n.news.naver.com/mnews/article/016/0001917652?sid=103
주머니에서 쓰윽...'호크아이' PPL은 아이폰 아닌 '이것' [IT썰],2021.11.26. 오전 8:04,"지난 24일 공개된 디즈니+ 오리지널 시리즈 호크아이에서 호크아이가 구글 픽셀폰을 보는 장면지난 24일 공개된 디즈니+ 오리지널 시리즈 '호크아이'에서는 주인공 호크아이가 주머니에서 구글 픽셀3를 꺼내는 장면이 나온다. 이번 오리지널 시리즈에서는 호크아이 뿐만 아니라 호크아이의 오랜 팬으로 등장하는 여자 주인공 케이트 비숍, 케이트의 어머니 등 모든 캐릭터가 모두 픽셀 시리즈를 사용한다. 외신은 ""다른 마블 캐릭터와 달리 평범한 아이덴티티를 가진 호크아이에게 어울리는 스마트폰""이라고 평가했다. 호크아이가 사용하는 픽셀3는 2019년 '어벤저스: 엔드게임'에서도 쓰던 스마트폰이다. 케이트 비숍과 케이트의 어머니는 픽셀4를 사용한다. 최근 구글이 출시한 픽셀6이 영상에 등장하지 않은 이유는 촬영 당시 픽셀6가 출시되지 않았기 때문으로 풀이된다. 호크아이 촬영 시점은 지난해 12월부터 올해 4월로, 픽셀6는 올해 10월 출시됐다. 또 호크아이가 어벤저스 시리즈 때부터 같은 폰을 계속 쓰는 이유는 호크아이의 캐릭터와 어울리기 때문이란 분석도 있다. IT전문매체 폰아레나는 ""새로운 스마트폰이 출시될 때마다 살 여유가 있을 법한 아이언맨이나 파괴적인 힘을 가진 헐크 등과 달리, 호크아이는 어벤저스 활동이 없으면 평범한 일상을 살아가는 캐릭터이기 때문""이라고 해석했다.앞선 마블 시리즈에서는 각 캐릭터들이 특정 스마트폰을 사용하는 모습이 자주 등장했다. 아이언맨은 1편부터 2편에서 LG전자 스마트폰을 사용했다. 아이언맨1에서 토니 스타크가 공격받는 상황에서 꺼내든 스마트폰은 가로로 화면을 돌릴 수 있는 'LG-VX9400' 모델로, 지난해 LG전자가 출시한 윙과 유사한 형태다. 이외에 '스파이더맨:노웨이홈'에서는 소니 엑스페리아가 등장한 바 있다. 디즈니+ 오리지널 시리즈 '호크아이'는 '어벤져스'의 원년 멤버 호크아이의 과거, 현재, 미래에 걸쳐 숨겨진 이야기를 담은 시리즈다. 호크아이로 지난 10년 동안 '어벤져스' 시리즈에서 활약한 배우 제레미 레너가 호크아이의 입체적인 면모를 선보일 예정이다.",105,https://n.news.naver.com/mnews/article/008/0004675577?sid=103
"위메이드맥스, ‘미르4’ 개발사 위메이드넥스트 자회사 편입",2021.11.26. 오후 5:50,"게임 개발 역량 강화·경영 효율성 제고 목적



위메이드맥스 로고.ⓒ위메이드맥스[데일리안 = 김은경 기자] 위메이드맥스는 ‘미르4’ 개발사 위메이드넥스트를 자회사로 편입하기로 결정했다고 26일 밝혔다.위메이드맥스는 이날 이사회를 개최하고 포괄적 주식 교환을 통해 위메이드넥스트를 완전 자회사로 편입하기로 결의했다.회사는 “이번 포괄적 주식 교환으로 상업적인 성공을 거둔 미르4의 게임 개발 역량을 강화하고 경영 효율성을 제고할 방침”이라고 강조했다.지난 9월 블록체인 게임 개발사로 전환을 선언한 위메이드맥스는 계열사에서 개발하는 모든 게임에 블록체인 기술 적용을 선언한 바 있다.장현국 위메이드 대표는 “위메이드맥스는 이제 대규모 인수합병(M&A) 플랫폼이 됐다”며 “이번 M&A를 기점으로 보다 적극적으로 좋은 기업 M&A에 나설 것”이라고 말했다.",105,https://n.news.naver.com/mnews/article/119/0002551935?sid=103
금강·서경방송 등 중소 케이블TV에 IPTV 사업 허가,2021.11.26. 오전 11:48,"ⓒ게티이미지뱅크중소 케이블TV(개별SO) 6개사가 인터넷멀티미디어방송(IPTV) 사업을 할 수 있게 됐다.과학기술정보통신부는 금강방송, 서경방송, 아름방송, 케이블TV광주방송, JCN울산중앙방송, KCTV제주방송 등 개별SO 6개사에 대한 IPTV 허가 심사 결과 기존 종합유선방송구역 내에서 케이블TV 방식 외에 자체 인터넷망을 이용한 IPTV 방식 방송서비스를 제공하도록 허가했다.과기정통부는 앞서 허가 심사를 위해 방송, 법률, 경영·회계, 기술, 소비자 등 5개 분야 외부 전문가로 허가 심사위원회를 구성하고 심사를 진행했다. 심사 결과 신청 법인 6개사 모두 총점 500점 만점에 기준 점수 350점 이상을 획득했다.심사위원회는 6개 SO 모두 오랜 기간 해당 방송구역 내 방송서비스를 제공했고 IPTV 방식 방송 서비스 제공을 위한 기술적 능력과 시설계획 등에 특별한 우려 사항은 없다고 판단했다.6개사는 IPTV 방식 방송서비스 제공을 위한 주전송장치 등 방송시스템 구축, 셋톱박스 개발 등을 거쳐 이르면 내년 하반기부터 서비스를 개시할 예정이다.과기정통부는 “개별SO IPTV 사업 허가는 유료방송 기술중립성을 위해 전송기술 장벽을 허무는 것”이라며 “SO도 IP 기반의 양방향 서비스 제공을 통해 망 운영 효율성 제고와 품질 경쟁을 촉진하는 등 경쟁력을 향상하고 이용자 서비스 선택 다양성에 기여할 것”이라고 밝혔다.이어 “신규 망 투자, 셋톱박스 개발 및 보급 증가 등 관련 산업 활성화도 기대된다”며 “방송 기술 규제를 없애는 세계적 추세에 따라 기술중립성 도입을 위한 법적 기반이 조속히 마련될 필요가 있다”고 강조했다.",105,https://n.news.naver.com/mnews/article/030/0002984357?sid=103
"인신협, ‘2021 언론대상 언론윤리대상’ 시상식 개최",2021.11.26. 오후 2:54,"""새로운 미디어 환경 선도해 가자”언론5단체 중 하나인 한국인터넷신문협회(회장 이의춘, 이하 인신협)는 지난 25일 한국프레스센터 국제회의장에서 ‘2021 언론대상 및 언론윤리대상’ 시상식 행사를 성료했다고 밝혔다.인신협이 주최하고 한국언론진흥재단이 후원한 이날 행사에서는 올해로 5회째를 맞은 ‘언론대상’과 올해 처음 실시된 ‘언론윤리대상’시상식이 함께 열렸다.인신협은 인터넷신문의 지속 발전과 저널리즘의 질적 향상에 기여하기 위해 매년 ‘언론대상’을 시상하고 있다. 지난 1월 제정된 언론윤리헌장의 확산을 위한 언론윤리실천 캠페인의 일환으로 올해부터 ‘언론윤리대상’을 신설했다.



이의춘 인신협 회장이의춘 인신협 회장은 “공적 책무를 부여받은 언론에 있어 윤리적 정당성은 무엇보다 중요하다”며 “자유로운 소통과 저널리즘의 신뢰 회복이라는 인터넷신문에게 주어진 큰 과제를 함께 해결해 나가며 새로운 미디어 환경을 선도해 가자”고 말했다.인신협 산하 KINA 언론대상 이장규 운영위원장은 “올해로 5회차로 접어든 언론대상은 양적으로나 질적으로나 꾸준히 성장해 대표적 인터넷 언론상으로 자리 잡았다”며 “언론윤리대상 역시 첫 회임에도 불구하고 예상보다 훨씬 많은 지원이 몰렸다. 앞으로 대표적 인터넷 언론윤리상으로 자리매김할 것으로 본다”고 말했다.



‘2021 언론대상 및 언론윤리대상’ 시상식한편 2021 언론윤리대상 매체 부문 최우수상을 받은 시사위크는 기사가 수정됐을 때 독자들이 그 내용과 이유 등을 쉽게 확인할 수 있도록 하는 '기사수정이력제'를 소개했다. 이날 발표를 맡은 정소현 취재팀장은 ""시사위크는 이러한 제도적 장치를 통해, 투명한 보도와 책임있는 설명, 피해를 최소화하는 공정한 보도라는 언론윤리헌장의 원칙을 실천하고 있다""고 설명했다.언론윤리대상 기자 부문 최우수상을 받은 프라임경제의 추민선, 김은경, 황이화, 노병우 기자는 다양한 수용자에 대한 고려가 없는 뉴스 속 난해한 표현은 ‘알 권리’에 대한 ‘물리적 침해’나 다름이 없었다며 ‘쉬운 말 뉴스’제작을 통해 수용자를 확대하고 시민의 알 권리를 신장시키며 나아가 실질적 사회 변화를 이끌어 낼 수 있다고 밝혔다.",105,https://n.news.naver.com/mnews/article/092/0002240439?sid=103
"LGU+, 디지털커머스사업그룹 조직 신설...""MZ '찐팬' 잡는다""",2021.11.26. 오후 3:05,"LG유플러스 용산 사옥/사진=머니투데이DBLG유플러스가 디지털 관련 조직을 통합한 디지털커머스사업그룹을 내년 신설한다. 해당 조직을 통해 디지털 환경에 익숙한 MZ세대(1980년대~2000년대 밀레니얼 세대와 Z세대) 고객을 확보하는데 주력할 계획이다. LG유플러스는 안정적 조직운영과 함께 핵심 전략의 실행력을 높이기 위해 조직개편을 단행했다고 26일 밝혔다. 전체적인 사업 부문은 기존과 같은 체계를 유지하되, 세부 사업그룹을 신설해 전문성을 높인 것이 특징이다. 이번에 신설된 디지털커머스사업그룹은 컨슈머 부문 산하 디지털 관련 조직을 통합한 것이다. MZ세대 등 새로운 디지털 고객 경험을 만드는 역할을 맡게 될 전망이다. 또 컨슈머 부문은 컨슈머 사업그룹과 컨슈머 서비스그룹으로 재편했다. 컨슈머 사업의 질적 성장을 강화하고 서비스 차별화를 통해 고객 일상의 새로운 경험을 제공하기 위해서다. 컨슈머 부문 총괄은 올해 7월 선임된 정수헌 부사장이 계속 맡는다. 이밖에 기업 부문과 NW부문은 현 조직 체계를 그대로 유지한다. 기업부문장은 최택진 부사장, NW부문장은 권준혁 전무가 유임된다. LG유플러스는 ""이번 조직개편은 취임 2년 차에 접어든 황현식 CEO가 올해 새롭게 선포한 '고객 일상의 즐거운 변화를 주도하는 디지털 혁신 기업'이라는 비전을 실행하기 위한 의중이 강하게 반영된 것""이라고 설명했다.",105,https://n.news.naver.com/mnews/article/008/0004675786?sid=103
"위행남 전남대병원 간호사 질병관리청장상 수상···""코로나19 확산 방지 기여""",2021.11.26. 오전 11:27,"질병관리청, 2021년 감염병관리시설 운영관리 유공자 선정



위행남 전남대병원 수간호사/사진 제공=전남대병원[서울경제] 전남대병원은 위행남 수간호사가 감염병관리시설 운영관리 유공자로 질병관리청장상을 수상했다고 26일 밝혔다.질병관리청은 감염병관리시설 운영·관리에 공헌한 사람의 공적을 칭찬하고 널리 알려 감염병관리시설에 대한 인식을 확대하기 위해 감염병관리시설 운영관리 유공자를 선정했다. 위 간호사는 코로나19 발생 시기부터 1년간 감염관리실 팀장을 맡으면서 감염병 확산방지 및 확진자 치료·관리업무 등 감염병 대응에 매진했다. 특히 코로나19 확진자 및 의심 환자가 발생했을 때 원내 노출을 최소화하고 신속하게 조치를 취함으로써 지역사회 확산방지에 주력했다는 평가다. 정기적으로 원내 감염관리를 위한 각종 위원회 활동을 하면서 감염발생에 대한 철저한 분석과 개선 대책을 마련해 의료 질 향상에도 기여했다.위 간호사는 지난 1988년 전남대병원에 입사한 이래 내과·외과 병동 수간호사와 화순전남대병원 응급센터 팀장, 감염관리실 팀장 등을 맡으며 ‘나이팅게일 정신’을 성실히 수행해 왔다.",105,https://n.news.naver.com/mnews/article/011/0003989967?sid=103
,,,105,https://n.news.naver.com/mnews/article/236/0000219040?sid=103
"멘티스코, 캐리소프트와 합작법인 설립 ""NFT 도입 '캐리파크' 개발""",2021.11.26. 오후 3:39,"게임 개발사 멘티스코는 캐리소프트와 합작 법인을 통해 NFT(대체불가토큰)가 도입된 메타버스 게임을 개발 중이라고 26일 밝혔다. 캐리소프트의 '캐리와 친구들'의 IP(지적재산권)를 활용해 멘티스코가 개발을 담당하고 합작 법인에서 퍼블리싱을 담당한다. '캐리파크'는 11살 초등학생으로 성장한 '캐리와 친구들' 캐릭터들이 사는 가상의 도시를 배경으로 하는 메타버스 게임이다. 유저들은 이 3D (3차원) 소셜 미디어 가상공간에서 자신만의 캐릭터를 생성해 '캐리와 친구들'의 메인 스토리에 자연스럽게 스며들게 된다. 다양한 게임, 가상현실 경험과 소셜 활동을 즐길 수 있고, 메타버스 내의 유저간, 그리고 유저와 '캐리와 친구들' 간의 쌍방향 커뮤니케이션으로 연결되는 게이미피케이션(Gamification)이 강조되어 있다.또 '캐리파크'에는 디지털 부동산과 사용자 창작물 등에 블록체인 기반의 NFT를 적용함으로써 현실과 같은 실제 경제 활동을 경험할 수 있도록 설계되어 있다.'캐리파크'는 언리얼 엔진 4를 기반으로 2022년 가을 첫 선을 보일 계획이다. 구글 플레이오와 애플 앱스토어에 선출시 후 PC버전, 콘솔버전 등의 출시가 결정될 예정이다. 한편 캐리소프트는 '캐리파크'의 배경과 세계관으로 다양한 장단편의 애니메이션을 제작 중이다. 2022년 초 3D 애니메이션의 글로벌 개봉이 예정되어 있고, 이어 메타버스 게임 '캐리파크'를 출시함으로서 더욱 효율적인 마케팅과 홍보효과가 지속될 전망이다. 윤정현 멘티스코 대표는 ""개봉 예정인 애니메이션 캐릭터들이 '캐리파크'의 NPC로 등장하는만큼 애니메이션과 게임의 시너지 효과가 극대화될 것으로 보인다""며 ""'캐리와 친구들'의 세계관과 게임 개발에 필요한 어셋은 상당 부분 확보되어 있어 빠른 개발이 가능하다""고 말했다.",105,https://n.news.naver.com/mnews/article/008/0004675799?sid=103
1인 미디어 대전 시상식 참석한 오세훈 시장,2021.11.26. 오후 3:17,(서울=연합뉴스) 오세훈 서울특별시장(왼쪽)이 26일 서울 중구 동대문디자인플라자에서 열린 '2021 대한민국 1인 미디어 대전' 시상식에 참석해 한 참가자와 휴대전화로 촬영을 하고 있다. 2021.11.26    photo@yna.co.kr,105,https://n.news.naver.com/mnews/article/001/0012876202?sid=103
"위메이드맥스, 미르4 개발사 위메이드넥스트 자회사 편입",2021.11.26. 오후 5:47,위메이드맥스 CI. /위메이드 제공        위메이드맥스는 26일 ‘미르4′ 개발사인 위메이드넥스트를 자회사로 편입한다고 밝혔다.위메이드맥스에 따르면 회사는 이날 이사회를 열고 포괄적 주식 교환을 통해 위메이드넥스트를 완전 자회사로 편입하기로 결의했다. 위메이드넥스트는 글로벌 170여개국에서 블록체인 게임 미르4의 성공을 이끌었다.지난 9월 블록체인 게임 개발사로 전환하기로 선언한 위메이드맥스는 계열사에서 개발하는 모든 게임에 블록체인 기술 적용하기로 했다. 장현국 위메이드 대표는 “이번 인수합병(M&A)을 기점으로 앞으로 M&A에 더욱 적극적으로 나설 계획이다”라고 했다.,105,https://n.news.naver.com/mnews/article/366/0000776565?sid=103
