title,date,main,section,url
노조 추천 이사 불발…기업은행 노사관계 다시 '급랭',2021.04.09. 오후 4:58,"수출입은행 노조의 '재도전'에도 영향 미칠 듯(지디넷코리아=차재서  기자)'노조 추천 이사' 선임이 불발되자 기업은행 노동조합이 강하게 반발하고 나섰다. 윤종원 기업은행장이 노조 측 인사를 이사회에 합류시키도록 힘쓰겠다는 약속과 달리 소극적인 모습을 보임으로써 이를 무산시켰다는 이유에서다.9일 전국금융산업노동조합 기업은행지부는 이날 공식 입장문을 통해 ""은성수 금융위원장과 윤종원 행장이 기업은행 노조를 기만했다""면서 ""금융노조, 한국노총과 함께 이번 사태에 대한 대응 방안을 논의하고 있다""고 밝혔다.이는 기업은행의 노조 추천 이사 선임이 무산된 데 따른 발언이다.지난 9일 금융위원회는 김정훈 단국대 행정복지대학원 겸임교수와 정소민 한양대 법학전문대학원 교수를 기업은행 사외이사(임기 3년)로 선임했다. 다만 두 사람 모두 사측이 제시한 후보라 ‘노조 추천 이사 선임’은 다음을 기약하게 됐다. 행장의 제청을 거쳐 금융위원장이 임명하는 자리다.



윤종원 기업은행장노조 관계자는 ""윤종원 행장이 '노조 추천 이사제' 도입 의지를 밝히라는 성명 공표를 가로막으면서 재차 추진을 약속했고 2020년 수출입은행의 실패 사례를 답습하지 않겠다는 뜻도 분명히 했다""며 ""그럼에도 노조 추천 인사 3명 중 단 한 명만을 후보군(4명)에 올렸고, 금융위원장은 해당 인물을 부적격 사유로 배제했다""고 주장했다. 기업은행의 이번 사외이사 추천 작업이 보여주기식에 불과했다는 얘기다.그간 기업은행 노조는 사외이사 4명 중 적어도 한 명을 노조 측 추천 인사로 채우자고 요구해왔다. 직원의 목소리를 반영하는 경영 문화를 만들고, 금융소비자보호법 시행과 맞물려 소비자와 직원 모두를 보호할 전문가를 영입해야 한다는 취지였다. 특히 '노조 추천 이사제'는 의사결정 과정의 투명성을 높이고 경영자와 근로자가 성과를 함께 책임지는 환경을 조성하겠다며 문재인 정부가 제시한 국정과제이기도 하다.이에 윤종원 행장도 지난해 취임 후 노조와 이를 추진하기로 합의했다. 그러나 이 같은 결과를 맞으면서 윤 행장으로서는 결국 그 약속을 지키지 못한 셈이 됐다.노조 측은 ""공공기관 노동이사제는 더불어민주당 대선공약이고, 청와대 경제사회노동위원회의 노정 합의사항이자 민주당과 한국노총 간 정책 협약사항""이라며 ""이중·삼중의 약속을 해놓고도 집권세력은 기어이 신의를 저버렸다""고 지적했다.업계에서는 금융권 내 노조 추천 이사가 등장하기까지 상당한 시간이 걸릴 것으로 내다보고 있다. 수출입은행 노조가 올해 재도전에 나선다고 하나, 같은 국책은행인 기업은행이 실패한 만큼 그 문턱을 넘긴 쉽지 않을 것이란 분석이다.현재 수출입은행 노조는 나명현 사외이사의 임기 만료(5월31일)를 앞두고 후보를 물색 중이며, 사측과 협의를 거쳐 복수의 후보를 제시할 계획이다. 이들 역시 지난해 1월 사외이사 2명을 채우는 과정에서 외부 인사를 추천했으나 실패한 바 있다. 당시 방문규 수출입은행장도 사측 후보 3명과 노조 측 후보 1명 등 4명을 기획재정부에 재청했다.국책은행 노조 관계자는 ""정부와 가까운 인물을 사외이사로 앉히는 관행이 되풀이된다면 국책은행의 경영환경을 개선할 수 없다""면서 ""정부와 여당이 국정과제를 이행할 의지를 갖고 있는지 의문""이라고 비판했다.차재서 기자(sia0413@zdnet.co.kr) ▶ 지디넷코리아 '홈페이지' ▶ 네이버 채널 구독하기© 메가뉴스 & ZDNET, A RED VENTURES COMPANY, 무단전재-재배포 금지",105,https://n.news.naver.com/mnews/article/092/0002218749?sid=103
"정부-업계, 반도체 공급망 대책 ‘맞손’",2021.04.09. 오후 1:37,"- 글로벌 환경 변화 대응 논의   [디지털데일리 윤상호 기자] 정부와 업계가 반도체 공급망 불안 대응을 위해 머리를 맞댔다.   산업통상자원부(장관 성윤모)는 서울 중구 웨스틴조선호텔에서 ‘반도체협회 회장단 간담회’를 개최했다고 9일 밝혔다.   성윤모 산업부 장관과 ▲반도체협회 이정배 회장(삼성전자 사장) ▲SK하이닉스 이석희 대표 ▲DB하이텍 최창식 대표 ▲실리콘마이터스 허염 대표 ▲반도체협회 이창한 부회장 등이 참석했다.   이들은 ▲글로벌 반도체 공급 부족 현상 ▲주요국 반도체 산업 육성 정책 등을 공유했다. 국내 투자 확대 및 정부 지원방안 등 향후 대응방안을 논의했다.   업계는 ▲국내 반도체 제조시설 구축 확대를 위한 인센티브 지원 확대 ▲반도체 초격차를 이끌어 갈 우수한 인재 양성 및 공급 ▲국내 반도체 공급망 안정화 지원 ▲반도체 산업을 둘러싼 급변하는 국제 정세에 능동적 대응을 위한 정부 지원 등을 건의했다.   성 장관은 “최근 반도체 산업은 기업간 경쟁을 넘어 국가간 경쟁에 직면한 만큼 정부와 민간이 힘을 합쳐 당면한 위기를 극복해 나가야 할 시점”이라며 “메모리‧수탁생산(파운드리) 생산능력 확충 등 안정적 공급망 구축을 위해 민간의 적극적 투자 확대를 주문하고 산업 생태계 활성화를 위한 연대와 협력이 필요하다”라고 언급했다.   또 “정부 차원에서도 우리나라를 세계 최고의 첨단 반도체 제조의 글로벌 공장으로 조성하고 종합 반도체 강국으로 도약하기 위한 전략을 마련 중”이라며 “회의에서 제기된 업계의 대정부 건의사항을 반영해 우리 반도체 산업 생태계 강화에 실질적 도움이 될 수 있는 종합정책(K-반도체 벨트 전략)을 수립해 조만간 발표하겠다”고 말했다.   반도체협회 이정배 회장은 “반도체 산업은 인공지능(AI), 자율자동차, 바이오 등 미래 산업 발전에 필수 요소이며 국가 경제를 이끌어 가는 핵심산업”이라며 “반도체 산업의 지속적 발전을 위해서는 반도체 인력양성을 위한 정부 차원의 종합적 지원 체계 구축이 필요하며 국내 반도체 제조시설 확대에 대한 세액공제 등 정부의 정책 지원 강화를 요청했다”라고 전했다.   <윤상호 기자>crow@ddaily.co.kr▶ 네이버에서 디지털데일리 채널 구독하기▶ IT정보의 즐거운 업그레이드 [딜라이트닷넷]<저작권자 © 디지털데일리 무단전재-재배포금지>",105,https://n.news.naver.com/mnews/article/138/0002101406?sid=103
"“갤S21 카메라 활용 이렇게”…삼성, ‘갤럭시 팬 클래스’ 운영",2021.04.09. 오전 9:01,"제품 활용법·라이프스타일 맞춘 주제별 교육삼성 디지털 프라자, ‘배우는 공간’으로 진화



삼성전자가 최신 갤럭시 제품 활용법 등 다양한 프로그램을 제공하는 ‘갤럭시 팬(Fan) 클래스’를 운영한다고 9일 밝혔다. 사진은 삼성 디지털프라자 서울 강남본점에서 갤럭시 팬큐레이터가 예비 신혼 부부를 위해 '셀프 웨딩 기록법' 교육을 진행하고 있는 모습.ⓒ삼성전자삼성전자는 ‘갤럭시Z폴드2’·‘갤럭시S21’ 등 최신 제품 활용법부터 고객의 라이프스타일을 반영한 주제별 맞춤 교육까지 다양한 프로그램을 제공하는 ‘갤럭시 팬(Fan) 클래스’를 운영한다고 9일 밝혔다.매장을 기존 단순한 제품 구매 공간이라는 개념에서 한 차원 더 나아가 고객들과 지속적으로 소통하며 다양한 브랜드 경험을 선사하는 공간으로 진화시키자는 취지에서 기획됐다.클래스는 삼성 디지털프라자 등에 마련된 전국 62개 갤럭시 스튜디오에서 3월 말부터 진행되고 있다.최신 갤럭시 제품의 혁신 기능을 배울 수 있는 ‘갤럭시 찐 활용법’ 외에 각 지역 랜드마크로 자리잡은 삼성 디지털프라자의 가치와 역할 등을 교육 프로그램 편성에 반영했다.세부적으로 ▲공신들의 공부 환경 만들기 ▲셀프 웨딩 기록법 ▲댕냥이 인생샷 비법 ▲내 멋대로 폰 커스텀 등 특화 프로그램이 운영 초기부터 뜨거운 반응을 얻고 있다고 회사 측은 설명했다.삼성 디지털프라자 연수송도점에서 ‘댕냥이 인생샷 비법’ 클래스를 수강한 한 고객은 “강아지가 활발한 편이라 사진이 항상 흔들렸는데, 갤럭시 팬 클래스에서 모션 포토나 싱글테이크 등 순간 포착에 유용한 기능들을 배워서 정말 유익했다”며 “삼성 디지털프라자는 제품을 구입할 때만 방문했는데 앞으로 자주 들려서 더 다양한 활용법들을 알아가고 싶다”는 수강 소감을 남겼다.삼성전자 관계자는 “앞으로도 구매 이후 일상 속에서 제품의 가치와 효용을 지속적으로 체감할 수 있도록 고객 취향과 눈높이에 맞춘 다양한 교육 프로그램을 제공할 예정”이라며 “갤럭시 팬 클래스에서 함께 소통하고 즐겁게 배우며 나만의 새로운 가능성을 발견해 보길 바란다”고 말했다.클래스 참석 예약과 자세한 내용 확인은 삼성전자 홈페이지에서 할 수 있다.데일리안 김은경 기자 (ek@dailian.co.kr)▶ 데일리안 네이버 구독하기▶ 데일리안 만평보기▶ 제보하기ⓒ (주)데일리안 - 무단전재, 변형, 무단배포 금지",105,https://n.news.naver.com/mnews/article/119/0002483481?sid=103
"삼성전자, '갤럭시 Fan 클래스' 운영",2021.04.09. 오전 9:00,"(서울=연합뉴스) 삼성전자가 최신 갤럭시 제품 활용법 등을 제공하는 '갤럭시 Fan 클래스'를 전국 62개 갤럭시 스튜디오에서 운영한다고 9일 밝혔다. 사진은 갤럭시 팬큐레이터가 예비 신혼부부에게 '셀프 웨딩 기록법'을 교육하는 모습. 2021.4.9     [삼성전자 제공. 재판매 및 DB 금지]    photo@yna.co.kr▶네이버에서도 뉴스는 연합뉴스[구독 클릭]▶[팩트체크]'올해의 의학자상'수상자가 밝힌 백신 무용론?▶제보하기<저작권자(c) 연합뉴스(https://www.yna.co.kr/), 무단 전재-재배포 금지>",105,https://n.news.naver.com/mnews/article/001/0012317523?sid=103
내일 아침 내륙 곳곳에 짙은 안개…일교차 15도로 커,2023.10.29. 오후 5:52,"아침 5~14도·낮 19~23도…중부·경북내륙 서리 대비



황금빛 물결 장관인 보령 청라은행마을(보령=연합뉴스) 29일 충남 보령시 청라면 장현1리 신경섭 전통가옥과 정촌유기농원 일대를 찾은 관광객들이 제9회 청라은행마을 축제를 즐기고 있다. 청라은행마을은 수령 100년이 30여 그루를 포함해 모두 1천여 그루의 은행나무가 있는 우리나라 최대 은행나무 군락지로, 가을이면 마을 전체가 노란 은행나무 단풍으로 황금빛 물결을 이뤄 최고의 가을 여행지로 각광 받고 있다. 2023.10.29 [보령시 제공. 재판매 및 DB 금지] cobra@yna.co.kr    (서울=연합뉴스) 이재영 기자 = 월요일인 30일 날씨도 이번 주말과 비슷하겠다.    30일 아침 최저기온은 5~14도이고 낮 최고기온은 19~23도일 것으로 전망된다.    이는 평년기온보다 약간 높은 것이다.    주요 도시 예상 최저기온과 최고기온은 서울 11도와 21도, 인천 12도와 19도, 대전·울산 9도와 21도, 광주 11도와 22도, 대구 8도와 22도, 부산 13도와 22도다.    밤사이 복사냉각에 기온이 떨어지면서 30일 아침 경기남동부·강원내륙·강원산지·충청·호남·경상내륙에 가시거리 200ｍ 미만 짙은 안개, 나머지 지역엔 가시거리 1㎞ 미만 안개가 끼겠다.    중부내륙·산지와 경북내륙엔 서리도 내리겠으니 냉해가 없게 대비가 필요하다.    강원내륙·산지의 경우 아침 기온이 0도 안팎으로 떨어져 안개와 이슬이 도로에 얼어붙어 살얼음을 만들 수 있으니 주의해야 한다.    낮에는 햇볕에 기온이 오르겠고 이에 낮과 밤 기온 차가 내륙을 중심으로 15도 내외로 크겠다.    11월 1일까지 달 인력이 강해 해수면이 높겠다. 전라해안과 경남남해안, 제주해안 저지대는 밀물 때 침수될 수 있으니 대비해야 한다.    jylee24@yna.co.kr",105,https://n.news.naver.com/mnews/article/001/0014295191?sid=103
"고대인 세이지, '검은사막' 향후 스토리 주역으로 활약",2021.04.09. 오후 4:33,"MMORPG '검은사막'에 22번째 클래스 세이지가 추가됐다. 이 캐릭터는 온라인 버전에 지난 달 23일 첫 적용됐으며 31일에는 콘솔 버전에 적용되며 게이머를 만나고 있다. 세이지는 고대인이라는 설정으로, 기획 단계에서 지난 2016년 선보인 다크나이트 이전부터 제작하려다가 당시 더 높은 퀄리티를 갖추기 위해 보류된 바 있다. 검은사막스튜디오는 21종의 캐릭터를 꾸준히 선보이면서 쌓아온 노하우와 계속된 내부 테스트 끝에 완성된 세이지를 공개할 수 있게 됐다. 그가 사용하는 큐브 형태의 무기 카이브는 마법 공격과 시공간을 다루는 능력으로 적을 상대한다. 게임 내 기존 캐릭터에서는 볼 수 없던 동작과 기술 이펙트를 선보이는 것이 특징이다.이 캐릭터는 차원의 힘을 활용한 이펙트 스킬을 갖췄다. 차원의 힘으로 일정 시간 동안 충돌 없이 원하는 지점으로 자유롭게 이동하는 균열의 연결고리부터, 위력적인 파괴를 일으켜 일정 범위의 적에게 큰 피해를 주고, 방어력을 약화시키는 대붕괴, 100% 치명타로 피해를 입히는 아토르의 원기, 주변의 적들에게 번개로 피해주는 아토마기아를 보유하고 있다.또, 고대의 비밀을 풀어낼 실마리를 가진 배경 스토리를 갖춰 게임의 재미를 더하는 요소로 활약한다. 고대 과학자이자 상아탑의 괴짜로 불렸던 세이지는 검은 침탈자의 존재를 확인하고, 그 존재를 대중에게 알렸지만 선동죄로 체포돼 감옥에 갇힌다. 스스로를 가둬 영면에 빠진 그는 최후의 고대인으로 남아 다시 세상으로 나온다. 세이지 등장 이후 스토리는 게임 내 마스코트 흑정령과 협동 던전 아토락시온에 대한 내용으로 이어질 예정이다.



김재희 검은사막스튜디오 총괄 PD는 ""새로운 캐릭터를 만들 때마다 '더 새롭고, 재미있고, 즐길 수 있을까'에 대한 고민을 많이한다""며 ""큐브형 무기를 사용하는 클래스 세이지는 많은 캐릭터를 만들면서 생긴 노하우를 바탕으로 제작됐다""고 소개했다. 또, 그는 ""세이지의 고유한 동작과 기술 이펙트는 기존에 없던 신비로운 느낌으로 만들었는데, 늘 새로운 시도와 높은 완성도를 추구하는 아트실의 도전이 있었기에 가능했다""고 덧붙였다. 최종배 기자 jovia@fomos.co.kr[게임&게이머, 문화를 전합니다. 포모스게임│무단 전재 및 재배포 금지]포모스",105,https://n.news.naver.com/mnews/article/236/0000211875?sid=103
"삼성디스플레이, 올해 임금 7.5% 올린다…전자 계열사 인상폭에 발맞춰",2021.04.09. 오후 4:03,"삼성디스플레이 아산캠퍼스 전경. /삼성디스플레이 제공삼성디스플레이 노사가 9일 올해 직원 임금을 평균 7.5% 올리는 데 합의했다.삼성디스플레이 사측은 이날 사원협의회와 만나 기본급 4.5%에 성과급 3%를 더한 총 7.5% 임금 인상안에 중지를 모았다. 회사 관계자는 ""개인 고과에 따라 성과 인상률이 차등 적용되는 만큼 개인별 최종 임금 인상률에는 차이가 있을 수 있다""고 설명했다. 삼성디스플레이의 임금 인상률은 삼성그룹 전자 계열사의 맏형격인 삼성전자의 인상률(7.5%)과 동등한 수준이다. 앞서 지난달 삼성전자는 노사 합의로 기본 4.5%에 성과 3%를 더해 올해 임금을 총 7.5% 인상하기로 했다. 이같은 인상률은 최근 10년간 최고 수준이다. 이어 삼성SDI와 삼성전기도 각각 노사협의회를 통해 임금을 7% 올리기로 했다. [윤진우 기자 jiinwoo@chosunbiz.com] ▶네이버에서 '명품 경제뉴스' 조선비즈를 구독하세요▶공공전세주택 공급이 전세불안 못 잡는다는 이유▶현대차 MZ세대가 추진하는 '사무직 노조', 대체 뭐가 다르길래	저작권자 ⓒ 조선비즈, 무단 전재 및 재배포 금지",105,https://n.news.naver.com/mnews/article/366/0000699111?sid=103
신간 '뉴노멀 시대의 장소브랜딩' 출간,2021.04.09. 오후 6:37,"""장소의 가치는 어떻게 창조되어 가는가?""앨리슨파트너스코리아 이광호 팀장, 코로나19 이후 변화된 장소브랜딩 트렌드지역내 상점부터 컨벤션, 도시, 국가까지 다양한 장소의 브랜딩 비법 소개



 장소에 브랜딩이 왜 필요할까. 이 물음에 대해 명확한 답을 제시해주는 책이 출간돼 화제다. 10여년간 장소 기반 커뮤니케이션을 경험한 앨리슨파트너스 코리아의 이광호 팀장이 출간한 '뉴노멀 시대의 장소브랜딩'은 책 한권으로 공공과 민간의 다양한 분야에서 장소의 부흥을 꿈꾸는 이들에게 최적의 브랜드 전략을 제시한다. 지역내 작은 상점부터 쇼핑몰, 컨벤션과 지역축제, 도시와 국가에 이르기까지 각 장소만의 특색을 살린 차별화 포인트가 많을수록 보다 주목받으며 방문하고 싶은 곳으로 가치가 상승한다. 반면 사람들이 외면하는 장소는 반대 상황에 직면해 쇠퇴의 길을 걷는다.  저자는 기존에 장소와 도시의 브랜딩 비법을 소개하는 책에서 한발 더 나아가 코로나19와 인공지능(AI), 빅데이터 등 4차 산업혁명 시대의 기술로 변화 속도가 빨라진 장소브랜딩 트렌드에 관심을 기울였다. 특히 도시재생, 마이스(MICE) 행사, 스마트시티 등 장소의 최신 트렌드를 다양한 이론과 실제 사례로 소개하면서 실전 적용률을 높였다. 이 책은 도시계획 및 브랜딩 전문가들의 연구와 실제 적용사례를 통해 생생한 현장감을 더하고 있다. 이광호 팀장은 ""장소의 매력을 알리고 지속적으로 커뮤니케이션 하는 일은 세계의 모든 장소들이 안고 있는 과제""라며 ""한국은 인구 감소에 따른 지역 균형 발전 과제도 안고 있는데 이러한 고민들을 해결하는데 이 책이 약간의 실마리를 제공하게 되길 기대한다""고 말했다. 저자는 경기대에서 관광경영학을, 홍익대 대학원에서 광고홍보학을 공부했다. PR 컨설팅 회사, 중앙일간지 등을 거쳐 ㈜메카피알을 설립해 운영했고, 현재는 통합마케팅(IMC) 컨설팅 회사인 앨리슨파트너스코리아에서 팀장으로 근무하고 있다.[김병호 기자]▶ '경제 1위' 매일경제, 네이버에서 구독하세요▶ 이 제품은 '이렇게 만들죠' 영상으로 만나요▶ 부동산의 모든것 '매부리TV'가 펼칩니다[ⓒ 매일경제 & mk.co.kr, 무단전재 및 재배포 금지]",105,https://n.news.naver.com/mnews/article/009/0004777356?sid=103
항암 치료 중 '오체투지'로 쓴 시집 남기고…이정모 시인 별세,2023.10.29. 오전 9:44,"[페이스북 캡처]    (서울=연합뉴스) 이충원 기자 = ""독자에게 걸어가는 한 걸음 한 걸음이 오체투지였다. 좀 더 다른, 나만의 시로 가는 길에는 나귀도 마방도 없었다""(시집 '백 년의 내간체' 작가의 말 중)    평생 치열하고 뜨겁게 시를 썼지만, 60대 이후에야 시집 4권을 남긴 시인 이정모씨가 27일 오후 10시께 양산부산대병원에서 세상을 떠났다고 유족이 29일 전했다. 향년 74세.     1949년 강원도 춘천에서 태어나 부산에서 자란 고인은 부산상고 재학 중인 1960년대 말 '연세춘추'의 전국 고교생 문예작품 현상공모에서 장원을 했고, 부산 시내 고교 연합 문학동아리를 만들어 이끄는 등 일찌감치 문재(文才)를 발휘했다. 생업 때문에 시인의 꿈을 접어둔 채 부산은행에 다녔고, 50대에는 개인사업을 했다. 그래도 시작(詩作)을 멈춘 적은 없었다. 2007년 월간 '심상' 신인상을 받으며 늦깎이 등단했다. 부산작가회의, 부산시인협회, 시울림 시낭송회, 윤동주선양회 회원으로 활동했다.    2010년에 나온 첫 시집 '제 몸이 통로다'에 시를 향한 갈망을 담았다.     '이미 시(詩)에게 관통 당한 한 세월/그 힘으로 퍼득이던 내 모습이/왠지 낯설지가 않다'('대목장 신씨' 중)    '논에 뿌리면 수천의 목숨이 될 쌀알을/생각도 없이 속에 쓸어 넣으면서/생명처럼 풋풋한 시 한 줄 못 쓰는 건/염치없는 짓이다'('염치' 중)    국제신문은 첫 시집을 두고 ""시를 생각하는 시인의 마음과 태도 자체가 시가 됐다""고 썼다. 김경복 문학평론가는 ""시마(詩魔)에 붙들렸다""고 표현했다.     이런 자세는 '기억의 귀'(2014), '허공의 신발'(2018)을 지나 올해 나온 마지막 시집 '백 년의 내간체'로 이어졌다. 간암이 폐로 전이된 상태에서 항암치료를 받으며 쓴 시를 담았다. 추천사를 쓴 성윤석 시인은 '백 년의 내간체'가 ""시간의 시집""이라며 ""한 일생이 시간의 언어를 발명하고 그 내력을 좇아 돌에 새긴 듯 쓴 시집""이라고 했다.     의식이 혼미해진 고인을 대신해 시집을 마무리한 손음 시인은 ""항암치료를 하느라 화장실에 기어가면서도 시를 쓰신 분이었다""며 ""이분을 보노라면 '누가 함부로 시집을 내는가'라는 생각이 들 만큼 치열하고 뜨겁게 시를 대했다""고 말했다. 고인이 시집 '작가의 말'에 쓴 '오체투지'는 그저 비유가 아니었던 셈.     유족은 부인 염현숙씨와 사이에 1남1녀로 이은빈·이규호씨와 사위 황기원씨, 며느리 남지원씨 등이 있다. 마지막 시집 '백 년의 내간체'를 보지 못한 채 눈을 감은 고인을 위해 29일 오후 4시 빈소가 차려진 부산 좋은강안병원 장례식장 2호실에서 출판기념회가 열린다. 발인 30일 오전 6시, 장지 양산 천주교하늘공원. ☎ 051-610-9672     chungwon@yna.co.kr※ 부고 게재 문의는 팩스 02-398-3111, 카톡 okjebo, 이메일 jebo@yna.co.kr(확인용 유족 연락처 필수)",105,https://n.news.naver.com/mnews/article/001/0014294205?sid=103
"우버택시, '이용요금 20% 할인' 4월까지 연장",2021.04.09. 오후 2:27,"신규 고객 최대 1만원 할인…""서울 1천 대 돌파""[아이뉴스24 윤지혜 기자] 4월 한 달간 우버택시 이용요금을 20% 할인받을 수 있다.우버와 티맵모빌리티 합작사 우티(UT LLC)는 오는 30일까지 우버택시 할인 프로모션을 연장한다.



 [사진=우버]우버 택시를 처음 이용하는 승객은 새로 발급된 프로모션 코드(KNEW10)를 이용해 최대 1만원을 할인받을 수 있다. 이후 탑승부터는 신규 및 기존고객도 신규 코드(KTAXI20)를 사용해 20% 할인 혜택을 받을 수 있다.단, 차량 호출 전 미리 우버 앱에 프로모션 코드를 등록해야 한다.우티가 올 초 선보인 우버택시는 현재 서울을 중심으로 1천 대 이상 운행 중이다. 자동 배차 및 비대면 앱 결제 서비스 뿐 아니라 색상으로 승객찾기, 112 지원 버튼 및 안심 연락처 등 안전 기능을 도입해 다른 가맹택시와 차별화하고 있다./윤지혜 기자(jie@inews24.com)▶네이버 채널에서 '아이뉴스24'를 구독해주세요.▶재밌는 아이뉴스TV 영상보기 ▶아이뉴스24 바로가기[ⓒ 아이뉴스24 무단전재 및 재배포 금지]",105,https://n.news.naver.com/mnews/article/031/0000592489?sid=103
