title,date,main,section,url
[위클리 스마트] 네이버·카카오 QR 오류에 토스 QR 이용자 2배로,2021.12.25. 오전 10:00,"네이버 QR코드도 먹통(세종=연합뉴스) 홍해인 기자 = 13일 세종시 나성동 한 식당에서 질병관리청 쿠브(COOV·전자예방접종증명서) 애플리케이션과 연결된 네이버 앱 QR체크인 시스템이 오류로 인해 '방역패스'(백신패스) 확인이 이뤄지지 않고 있다.     이날 낮 11시 40분께부터 쿠브 앱에 접속이 되지 않는다는 신고 사례가 전국 곳곳에서 속출했다.    네이버·카카오·토스 등 백신접종을 확인할 수 있는 다른 앱에서도 한때 QR코드가 원활히 생성되지 않았다. 2021.12.13 hihong@yna.co.kr    (서울=연합뉴스) 한혜원 기자 = 새해가 코 앞으로 다가온 연말에 크고 작은 정보기술(IT) 기업들이 긴장하고 있다.    특히 거대 플랫폼 업체들은 서비스가 원활하지 않아 실망한 고객들이 타사 서비스로 떠나는 일이 없도록 만전을 기하고 있다.    연말 연시에는 메시징 서비스와 선물 주고받기 등 사람과 사람을 연결하는 이용자가 몰린다.    특히 온라인 메신저에 1년 중 가장 많은 트래픽이 쏟아지는 날이 바로 옛 해 마지막 날과 새해 첫날이다. 전국 메신저 이용자들의 송년·신년 인사가 자정을 전후한 몇 분 사이에한꺼번에 몰린다.    거대 플랫폼인 네이버·카카오 이용자들의 관성이 깨지는 계기가 발생할 수 있는 때이기도 하다.    반드시 연말연시가 아니더라도 트래픽 급증에 양대 플랫폼의 서비스가 원활하지 않게 되면 이용자들은 다른 플랫폼으로 눈을 돌리게 되고, 우연한 경험이 '다른 플랫폼도 편리하다'는 인식으로 이어지기도 한다.    25일 IT업계에 따르면 이달 14일 핀테크 애플리케이션(앱)인 토스에서 신종 코로나바이러스 감염증(코로나19) 백신 접종 증명 QR코드를 이용하는 사람이 바로 전날인 13일의 두 배로 늘었다.     하루 만에 두 배가 된 이용량은 먹통 사태가 진정된 지 일주일이 지나고도 유지되고 있다.     방역패스 위반 시 과태료 부과가 시작된 13일, 점심 피크 시간에 네이버와 카카오에서 접종 증명이 이뤄지지 않아 큰 혼란이 벌어졌다.     14일 점심에는 네이버에서만 37분간 접종 증명이 되지 않았다.     이는 마찬가지 서비스를 제공하는 토스와 통신3사 본인확인 서비스 '패스'(PASS)로 이용자를 분산시키는 계기가 됐다.     토스 관계자는 ""다른 업체들이 오류가 난 반사이익도 있었지만, '일단 써보니 편하다'고 생각되면서 이 시기 증가한 이용자 수가 유지되는 것 같다""고 말했다. 



토스[비바리퍼블리카 제공]    카카오모빌리티의 길 안내 서비스 '카카오 내비'는 17일 퇴근 시간대인 오후 5시부터 2시간가량 멈춰 섰다.    17일은 사회적 거리두기가 강화 시행되는 18일 전 마지막 금요일 밤이었던 데다, 한파까지 겹쳐 이용자들이 일시에 몰렸다.     카카오 내비가 멈춘 탓에 카카오 내비를 기본 길 안내 도구로 쓰는 국내 최대 이동 호출 앱 '카카오T'도 먹통이 됐다.     이날 '카카오T'가 작동하지 않자 경쟁 앱인 '우티'와 '타다'의 신규 설치 건수가 크게 늘었다.     모바일인덱스에 따르면 지난 17일 하루 동안 '카카오T', '우티', '타다'의 신규설치 건수는 총 4만8천687건으로, 1주일 전인 10일 2만8천296건보다 72.1% 급증했다.     세 앱의 신규설치 건수 증가분 중 60.8%(1만2천407건)가 '카카오T'에서, 31.0%(6천320건)가 '우티'에서, 8.2%(1천664건)가 '타다'에서 나왔다.     11월 기준 '카카오T'의 월간활성이용자(MAU) 수가 1천137만명으로 '우티'(50만명)의 22배, '타다'(11만8천명)의 96배에 달하는 것을 고려하면 이날 '카카오T'보다 경쟁 앱에서 신규설치가 특히 많이 일어난 것으로 볼 수 있다.     카카오모빌리티 관계자는 ""현재는 최고 트래픽의 2배 이상을 처리할 수 있는 수준으로 서버를 증설했다""고 설명했다. 



카카오톡 오류[연합뉴스TV 제공]    올해 3분기 기준 MAU가 4천680만명에 달하는 카카오톡도 연말연시 비상 대응 모드에 들어갔다.     카카오톡은 2020년 1월 1일 0시부터 오전 2시 15분까지 메시지 수신·발신이 먹통이 된 사례가 있다.    hye1@yna.co.kr",105,https://n.news.naver.com/mnews/article/001/0012803633?sid=103
[달콤한 사이언스] 과학자들 “최악의 변이 바이러스 또 나올라” 우려하는 이유,2021.12.25. 오전 11:02,"개도국, 저개발국에서도 백신접종 거부 분위기 확산백신 거부는 가짜뉴스 때문...평소 정부 신뢰도도 영향증거기반정보보다 가짜뉴스, 잘못된 정보 확산이 더 빨라



선진국 뿐만 아니라 후진국서도 백신거부 확산 분위기 - 개발도상국과 저개발국가에서는 지금까지 글로벌백신불평등이 문제였는데 최근에는 이들 국가에서도 백신접종 거부 분위기가 커지고 있다. 전문가들은 백신 개발이 가장 활발하고 보급도 많이 된 미국에서 백신 거부자들이 가장 많다는 것을 아이러니라고 지적하고 있다.네이처 제공최근 선진국 이외 개발도상국, 저개발국가에서도 코로나19 백신 접종을 거부하는 분위기가 높아지면서 과학자들이 델타, 오미크론에 이어 또다른 최악의 변이 바이러스 등장을 우려하고 있다.과학저널 ‘네이처’는 선진국들 중심에서 백신접종률이 높아지고 백신생산량이 늘어나면서 개발도상국이나 저개발국가들에서도 코로나19 백신 접종을 회피하는 분위기가 나타나면서 연구자들의 우려가 커지고 있다는 분석을 내놨다.그동안 코로나19 백신 회피는 선진국들 중심에서 나타나고 저개발국가들에서는 백신 접근성이 떨어진다는 것이 문제였다. 그런데 백신보급이 늘어나면서 저개발국가에서도 백신을 거부하는 분위기가 커지면서 새로운 코로나19 변종바이러스 등장 우려가 커지고 있다. 스페인 바르셀로나 국제보건연구소 감염병학자인 제프리 라자러스 바르셀로나대 의대교수는 “코로나19를 비롯해 바이러스성 감염병들은 지역사회 감염이 많을 경우 쉽게 변이가 나타나는 경향이 크다”라며 “백신접종을 통해 바이러스 확산을 억제하는 것이 변이를 차단할 수 있는 최선의 방법”이라고 말했다.인구 대부분이 백신 접종을 받지 않은 탄자니아, 콩고민주공화국, 파푸아뉴기니, 네팔는 물론 오미크론 변이가 처음 나온 남아프리카공화국에서도 백신부족이 문제가 아닌 백신접종 거부 분위기 때문일 것이라는 예측을 내놓고 있다. 미국 존스홉킨스대 의대 행동과학자 루팔리 리메이 교수는 “여전히 많은 나라들에서 백신 부족이 문제가 되고 있지만 저개발국가들이 많은 남반구 사람들이 생각보다 많이 백신접종을 피하는 것으로 확인되고 있다”고 밝히기도 했다.이 같은 분위기는 실제로 아프리카 현지에서도 감지되고 있다. 남아프리카 에이즈연구센터 살림 압둘 카림 소장은 “지난 10월 말까지만 해도 아프리카 국가들의 가장 큰 문제는 백신 물량이 충분치 않다는 것”이라며 “현재 아프리카 대부분 국가에서는 충분한 백신이 공급됐음에도 백신 접종률은 공급된 것의 64%에 불과하다”고 밝혔다. 공급된 백신이 아프리카 인구 전체를 맞힐 정도로 충분치도 않지만 백신이 처음 나왔을 때보다 늘어났음에도 이제는 백신을 맞으려고 하지 않는다는 것이다. 게다가 남아공에서는 현재 매주 접종량은 가장 많은 사람이 맞았을 때인 9월과 비교해서도 4분의1 수준으로 떨어져 있다. 또 1차접종만 받고 2차, 3차 추가접종을 하지 않는 사람들이 많아지고 있다는 것이다.독일 베를린사회과학연구소가 주도한 공동연구팀은 코로나백신이 나오기 전인 지난해 7월 전 세계 12개국 약 4만 5000명을 대상으로 한 설문조사에서는 미국을 비롯한 선진국들보다 저소득국가, 개발도상국가의 국민들이 백신접종에 더 적극적으로 나타났다. 그렇지만 백신접종이 진행되고 각종 변이 바이러스들이 등장하면서 상황이 급변했다고 네이처는 분석했다. 조사당시 백신 수용도가 97%로 가장 높았던 네팔은 성인의 40% 정도만 1차 접종을 마친 현재 접종속도가 0에 수렴할 정도로 접종 희망률이 낮아졌다는 것이다.



백신 접종률 낮아진 네팔 - 백신이 나오기 전까지만해도 백신이 나오면 접종하겠다는 이들이 98%나 됐던 네팔에서는 백신접종이 본격화되기 시작한 최근 접종 거부 분위기가 커져 성인의 40%만 1차 접종을 마친 상태이다.네이처 제공영국 케임브리지대 연구진이 25개국 2만 5334명을 대상으로 한 또다른 백신 수용성 연구에 따르면 전체 인구의 3%만 접종한 파푸아뉴기니에서도 80% 이상의 사람이 백신접종 계획이 없다고 밝힌 것으로 나타났다.감염병학자와 커뮤니케이션학자 등 전문가에 따르면 백신 회피에는 ▲백신 개발속도 ▲가짜뉴스를 비롯한 정보의 부정확성 ▲정부의 신뢰도가 큰 영향을 미친다. 백신 개발을 주도하고 있는 선진국에서는 백신이 빠르게 개발되고 보급되고 있지만 사용 권장사항이 자주 변경되면서 백신거부 분위기가 생기는 것이며 평소 정부의 신뢰도가 높거나 코로나19 대유행에 있어서 초기 대응을 잘한 국가들에서는 백신에 대한 수용도가 훨씬 높다고 전문가들은 밝히고 있다. 저개발 국가나 개발도상국들의 경우는 유통기한이 임박한 백신이 공급되면서 마치 부자들이 먹고 남는 음식을 던져주는 것 같은 느낌을 주기 때문에 초기에 비해 백신거부하는 사람이 늘었을 것이라고 지적하면서 글로벌 백신 불평등은 반드시 해결해야 한다고 강조했다.리메이 교수는 “무엇보다 많은 곳에서 백신 보급속도나 증거기반 정보보다 가짜뉴스와 잘못된 정보가 더 빠르게 퍼지고 있는 것이 문제”라며 “이 때문에 각국 정부는 백신접종률을 높이고 더 이상의 변이 발생을 차단하기 위해서는 백신 거부감의 이면에 있는 사회적, 심리적 문제도 동시에 해결해 나가야 할 것”이라고 말했다.",105,https://n.news.naver.com/mnews/article/081/0003240175?sid=103
우주의 비밀 풀 성탄절 선물… 역사상 가장 큰 ‘인류의 눈’ 우주로,2021.12.25. 오전 6:01,"美 NASA, 제임스 웹 우주망원경 발사25년간 12조원 투자한 역대 최고 성능허블 망원경의 100배 성능, 적외선 탐지우주 탄생 초기·외계 생명체 비밀 탐색



제임스 웹 우주망원경이 관측 임무를 수행하는 모습 상상도. /NASA 제공        미국 항공우주국(NASA)이 한국 시각으로 25일 오후 9시 20분 ‘제임스 웹 우주망원경’(이하 ‘웹’)을 남미 프랑스령 기아나의 유럽우주센터에서 아리안5 로켓에 실어 발사한다. 개발 비용 100억달러(약 11조9000억원), 개발 기간 25년이 소요된 역사상 최대 크기(주거울 지름 기준), 최고 관측 성능을 자랑하는 신형 우주망원경이다.우주망원경은 별빛을 차단하는 지구 대기권을 뚫고 올라가 우주의 생생한 모습을 인간 대신 들여다본다. 1990년 발사된 세계 최초의 우주망원경인 ‘허블 우주망원경’(허블)이 유명하다. 웹은 허블보다 100배 높은 관측 성능을 바탕으로, 전례 없이 먼 거리의 우주를 관측함으로써 135억년 전 우주 탄생 초기의 모습을 포착한다. 빛의 속도는 유한하기 때문에 먼 거리에서 오는 별빛을 볼수록 더 오래된 별빛, 즉 과거의 모습을 보게 된다. 웹은 외계 행성의 생명체 존재 가능성도 지금보다 더 면밀히 탐색할 예정이다.



허블 우주망원경이 촬영한 독수리 성운(왼쪽)과 앞으로 제임스 웹 우주망원경이 촬영할 독수리 성운 예상 모습(오른쪽). 관측 성능이 높아져 더 많은 별과 은하를 관측할 것으로 보인다. /NASA 제공        웹의 주거울(별빛을 한곳으로 모으는 반사경) 지름은 6.5m로 허블(2.4m)보다 2.7배 크다. 면적은 25㎡(약 7.6평)다. 허블이 보지 못하는 적외선 영역의 빛을 주로 감지한다. 별이 내는 빛(가시광선)은 먼 거리를 진행하면 파장이 늘어져 적외선으로 보이는 ‘도플러 효과’가 작용하기 때문에 먼 거리의 별은 가시광선보다 적외선 센서로 감지하는 게 유리하다. NASA는 웹의 관측 성능을 두고 “허블보다 100배 강력하다” “이론적으로 (지구와) 달 거리에 있는 호박벌의 열을 감지할 만큼 민감하다”라고 설명했다.



위에서부터 스피처, 허블, 제임스 웹 우주망원경과 각각의 주거울. /NASA 제공        주거울은 18개의 육각형 거울 조각(segment)을 서로 이어 붙인 형태다. 조각 연결 부위를 접고 펼 수 있도록 했다. 직경이 6.5m인 주거울을 직경 5.5m의 로켓 화물칸에 그대로 실을 수 없기 때문이다. 주거울은 가벼운 재료인 베릴륨으로 제작돼, 표면에 빛을 잘 반사하는 금을 도금했다. 주거울의 면적당 무게는 허블의 10분의 1 수준이고, 우주망원경 전체 무게도 약 6.2t(톤)으로 허블(약 11t)의 절반 수준이다.



제임스 웹 우주만원경의 주거울을 살펴보는 연구원. /NASA 제공



아리안5 로켓의 화물칸에 접힌 상태로 탑재되는 제임스 웹 우주망원경. /NASA 제공        웹이 제대로 작동하려면 영하 223℃의 극저온 환경이 유지돼야 한다. 머리카락 두께보다 얇은 고분자막을 알루미늄으로 코팅한 5겹짜리 가림막(sunshield)이 태양빛을 차단한다. 가림막은 두 대각선 길이가 테니스장 크기와 비슷한 14m, 21m인 다이아몬드 모양이다. 주거울은 가림막의 그늘에서 태양을 등지고 별을 관측한다. 태양빛에 노출되는 가림막은 최고 125℃까지 뜨거워지고, 반대편 주거울은 최저 영하 235℃까지 차가워지기 때문에 NASA는 웹이 이런 극단적인 온도 차이를 견딜 수 있도록 내구성에도 신경 써야 했다.



제임스 웹 우주망원경의 태양빛 차단 역할을 하는 가림막. /NASA 제공



제임스 웹 우주망원경. 그림상 오른쪽에서 오는 태양빛을 가림막이 태양빛을 차단하고 주거울은 가림막의 그늘에서 태양을 등지고 별빛(Light)을 관측한다. /NASA 제공        허블이 560㎞ 상공에서 지구를 공전는 것과 달리 웹은 지구에서 150만㎞ 떨어진 ‘라그랑주점’에서 태양을 공전한다. 라그랑주점은 지구와 태양의 중력이 서로 상쇄돼 안정적인 공전이 가능한 지점이다. 중력으로 인한 빛의 왜곡과 망원경에 미치는 외부 영향을 최소화하고, 웹-지구 간 거리를 일정하게 유지해 안정적으로 교신할 수 있다. 주거울의 18개 거울 조각들은 서로 수㎚(나노미터·1㎚는 10억분의 1m) 이내의 높이차로 편평하게 정렬돼야 하는데 이를 위한 미세조정에도 라그랑주점이 유리하다.역대 최고 성능을 구현하기 위해 유럽우주국(ESA), 캐나다우주국(CSA)이 협력하고 미국 내 29개주, 해외 14개국의 300개 이상 대학·기관·기업의 과학자·공학자 수천명이 연구에 참여했다.웹은 1996년 개발 시작 25년 만에, 최초 발사 목표 시점이었던 2006년 이후 15년 만에 이날 우주로 나간다. 기술적인 문제로 연기를 거듭하다가 지난해엔 신종 코로나 바이러스 감염증(코로나19) 여파로 현장 작업에 차질을 겪었고 이달에는 기상 악화와 통신 문제로 세 차례 발사일이 미뤄졌다.웹은 6개월 후 본격적인 관측 임무를 시작한다. 발사 후 접혀있는 주거울, 가림막, 태양전지판 등을 펼치는 데 1개월, 장비의 미세조정과 극저온 냉각 등 관측 준비를 하는 데 5개월이 걸린다. 계획된 임무기간은 5~10년이다.국립과천과학관은 이날 오후 8시 40분부터 유튜브를 통해 웹이 발사되는 모습을 생중계한다. 강성주 과천과학관 박사는 “제임스 웹 우주망원경은 천문학의 역사를 다시 쓰게 할 수 있다”라며 “이번 발사는 전 세계인을 위한 크리스마스 선물이 될 것”이라고 말했다.



제임스 웹 우주망원경의 관측 임무 수행 사상도. /NASA 제공",105,https://n.news.naver.com/mnews/article/366/0000782769?sid=103
[위클리 건강] 영유아 자녀 부모가 꼭 알아야 할 4가지 응급상황,2021.12.25. 오전 7:00,"발열·낙상사고 땐 바로 응급실 가기보단 아이 상태 지속 관찰해야버튼 건전지 삼켰다면 지체하지 말고 즉시 의료기관 방문



유아 [게티이미지뱅크 제공]    (서울=연합뉴스) 오수진 기자 = 아이에게 치명적인 신체·정신적 손상을 남길 수 있는 응급 상황은 신속한 처치가 필수다.     영유아는 의사소통이 원활하지 않으므로 부모를 비롯한 주변인의 빠른 판단과 적극적인 처치가 무엇보다 중요하다.     서울대학교병원 응급의학과 박중완 교수에 따르면 영유아가 가장 흔히 겪는 응급 상황은 고열, 낙상사고, 이물 흡입, 구토·설사 등 4가지로 정리할 수 있다.     박 교수는 ""신종 코로나바이러스 감염증(코로나19) 확산 이후 개인위생 수칙을 철저히 지킨 덕분에 바이러스, 세균 감염이 크게 줄어들었다""며 ""이 때문에 고열로 아이들이 응급실을 찾는 일은 많이 줄었지만, 가정 내 머무는 시간이 늘면서 낙상사고, 이물 흡입 등으로 응급실을 찾는 경우는 여전히 많다""고 25일 설명했다.    박 교수는 자녀를 응급실에 보내야 하나 고민하는 부모라면 119 구급대 이용을 주저하지 말라고 조언했다. 위급 시 적절한 상담과 의료기관 도착 전 필요한 조치를 가장 빠르게 받는 방법이기 때문이다. ""체온 39℃ 이하면 자는 아이 깨워 해열제 먹일 필요 없어""    박 교수는 평소 건강한 아이고 체온이 39℃ 이하라면 굳이 해열제를 먹이는 것보다 아이가 평소보다 처지거나 칭얼대는지 잘 관찰하는 것이 더 중요하다고 강조했다.    해열제의 목적은 열을 낮추는 것이 아니라 발열로 인한 아이의 불편감을 줄여주는 것에 그친다는게 그의 설명이다.     박 교수는 ""자는 아이가 열이 난다고 억지로 깨워서 해열제를 먹게 할 필요는 없다""며 ""열이 많이 난다면 아이가 불편해 자주 깨고 울 텐데 그때 해열제를 주면 된다""고 설명했다.    그러나 건강한 아이와 달리 평소에 심장, 폐 관련 질환을 앓고 있거나 대사질환이 있는 아이는 발열을 확인한 즉시 해열제를 복용토록 해야 한다. 고열은 몸의 대사를 증가시켜 질병이 있는 아이의 신체에 큰 부담을 줄 수 있다. 



실내 그네 낙상사고 (PG)[김민아 제작] 일러스트  ""낙상 사고시 CT 필요 드물어…평소와 다른 행동 보일 때 즉시 응급실로""    낙상 사고가 발생해도 아이가 집안 내 1ｍ 미만의 높이에서 떨어졌고 사고 이후 평소와 비슷한 컨디션이라면 큰 걱정을 하지 않아도 된다.    박 교수는 ""낙상 사고 후 머리에 혹이 났다며 컴퓨터단층촬영(CT)을 요구하는 부모님들이 계시는데 가정 내 낙상 사고의 경우 심각한 뇌 손상으로 이어지는 경우는 극히 드물다""고 말했다.    박 교수는 머리를 다친 아이가 CT를 찍어야 하는 케이스는 낙상 사고 후 의식이 흐려지거나 교통사고의 경우처럼 심한 머리 손상이 예상될 때라고 강조했다.    다만 가정 내 낙상 사고라도 아이와 평소와 같지 않은 행동을 보이거나 의식 소실 등 증상이 나타난다면 즉시 응급실을 방문해야 한다고 그는 권했다. ""영유아에겐 아몬드, 땅콩은 절대 주지 마세요""    기도 이물 흡입은 발열이나 낙상사고만큼 흔하지는 않지만 심각한 후유증을 남기거나 아이의 생명을 위협할 가능성이 커 특히 주의가 필요하다.    영유아 기도 이물 흡입의 절반 이상은 음식물로 인한 사고다. 박 교수는 4세 미만 영유아에게 아몬드와 땅콩 같은 딱딱한 음식물을 절대 줘서는 안 된다고 강조했다.    그는 ""아이들은 음식물을 바로 씹지 않고 오물오물 입안에서 가지고 노는 경우가 많고 성인보다 음식물을 삼키는 기능도 덜 발달한 상태""라고 말했다.     박 교수에 따르면 땅콩이 기도로 넘어가 기관지 내시경으로 땅콩을 제거해야 하는 사례가 흔하며, 아몬드가 기도를 막아 건강했던 아이가 사망한 사례도 있다고 전했다. 아이가 포도알을 그대로 삼켰다가 질식해 심정지 상태로 병원에 온 경우도 있었다.     버튼 건전지를 삼키는 사고는 곧바로 응급실을 방문해야 하는 '초응급상황'이다. 버튼 건전지는 식도 점막을 빠르게 녹여 6시간 이내 식도에 구멍을 낸다. 심한 경우 사망에 이르기도 한다.    박 교수는 ""최근 전자 담배 흡연 인구가 늘고 있는데 액상 전자 담배를 아이가 마시면 니코틴 중독으로 아이가 크게 위험해질 수 있다""고 경고했다. 



육아[연합뉴스TV 제공]  ""구토·설사 심하다고 절대 굶기면 안 됩니다""    아이들은 탈수에 취약하다. 구토와 설사가 심하면 증상이 사라질때까지 아이에게 음식이나 분유를 아예 주지 않는 부모가 있는데 이런 일은 절대로 해서는 안 된다.    박 교수는 ""아이가 토하거나 설사하면 그만큼 수분을 보충해줘야 한다""며 ""대신 음식을 조금씩, 자주, 천천히 먹여야 한다""고 말했다.    설사가 심한 경우 기름기가 많거나 당분이 많은 음식은 오히려 증상을 악화할 수 있다고 그는 부연했다.    아이가 음식물이나 수분 섭취를 거부한다면 방치하는 것보다 병원을 방문해 수액 치료 등을 받는 것이 좋다.    kiki@yna.co.kr",105,https://n.news.naver.com/mnews/article/001/0012803535?sid=103
