title,date,main,section,url
"TTA, 사물인터넷 국제 표준화 위한 'oneM2M 기술총회' 성료",2022.12.05. 오후 2:19,"기사내용 요약TTA 글로벌 IoT시험인증센터서 진행…13개국 참석스마트 시티·헬스 및 재난안전 지원 관련 표준 승인



[서울=뉴시스]심지혜 기자 = 한국정보통신기술협회(TTA)는 ‘제57차 oneM2M 기술총회’를 개최했다고 5일 밝혔다.oneM2M은 사물인터넷(IoT) 플랫폼 표준화를 위해서 TTA 등 세계 지역별 대표 표준화기관 8곳이 공동으로 설립한 글로벌 표준화 기구다. 지난달 28일부터 이달 2일까지 TTA 글로벌 IoT시험인증센터에서 열린 기술총회에는 13개국 60여 명이 참석했다. 이번 회의에서는 스마트-X(시티, 헬스, 교통, 공장)와 재난안전 등 다양한 분야의 버티컬 산업을 지원하는 oneM2M 릴리즈 4 표준이 최종 승인됐다. 릴리즈 4 표준은 24개 세부규격과 7개의 기술보고서로 구성돼 5G 네트워크 연동, 최신 엣지 컴퓨팅 기술 연동, 스마트 디바이스 간 호환성을 보장하는 스마트 디바이스 템플릿(SDT) 4.0 등을 제공함으로써 다양한 분야의 버티컬 산업에서 사물인터넷 디지털 융합 플랫폼 제공을 가능하게 한다. 차기 표준인 oneM2M 릴리즈 5에는 메타버스와 인공지능, 오픈 데이터 라이센스 기능을 포함하고 개인정보보호 중요성이 국제적으로 중요해 짐에 따라 유럽연합(EU)의 일반개인정보보호법(GDPR) 및 한국의 개인정보보호법을 지원할 수 있게 개발하기로 결정했다.현재 우리나라는 TTA를 비롯해 6개 산·학·연 기관이 사물인터넷 플랫폼을 기반으로 하는 인공지능 학습데이터 처리 및 관리, 학습 모델 개발 등에 관한 oneM2M 표준 개발을 선도하고 있다. 확장가상세계(메타버스) 분야에 IoT 기술을 적용하기 위해 한성대학교와 세종대학교 등이 공동으로 제안한 ‘메타버스 IoT’ 표준 개발을 위한 관련 용어와 정의, 활용 사례 발굴 등에 대한 논의도 진행 중이다. 최영해 TTA 회장은 ""디지털 대전환 시대를 맞아 다양한 ICT융합 서비스에 필요한 데이터 관리 기능을 제공하는 글로벌 표준 플랫폼으로 oneM2M이 중요하다""고 강조했다.",105,https://n.news.naver.com/mnews/article/003/0011575607?sid=103
"KISA-ISC, 2022 한·중 인터넷 협력포럼 개최",2022.12.05. 오후 3:16,"[디지털데일리 이종현기자] 한국인터넷진흥원(KISA)은 중국인터넷협회(ISC)와 함께 중국 소재 한국 기업 및 중국 기업을 대상으로 중국 개인정보보호법 준법경영 협력포럼을 온라인으로 개최했다고 5일 밝혔다.   KISA와 ISC는 한·중 기업인 대상으로 중국 개인정보보호 관련 주요 법에 대한 인식 제고 등 준법경영을 지원하기 위해 법률 내용, 준수 방법 등 정보를 공유하는 공동포럼을 2017년부터 매년 개최해 왔다.   최근 중국 정부는 디디추싱에 개인정보보호법 위반 등으로 80억2600만위안(약 1조5500억원)의 과징금을 부과하는 등 개인정보보호 관련 규제를 점점 더 강화하는 중이다. 개인정보 및 데이터 처리 관련 법률이 구체화 및 강화되고 있는 추세다.   이에 양 기관은 중국에 진출한 한국 기업뿐만 아니라 중국 기업이 중국 개인정보보호 법률 위반으로 중국 정부로부터 벌금 부과 등 불이익을 받지 않도록 준법경영을 지원한다는 의미에서 이번 협력포럼을 개최했다고 전했다.   협력포럼에서는 ‘개인정보보호 및 데이터 보안 역량 강화’를 주제로 ▲재중 한국 기업의 중국 데이터 3법 이해 ▲중국 기업의 개인정보보호 및 준법경영 ▲네트워크안전법 보안등급 평가 시 주요 개선 사례 등의 내용을 다뤘다.   KISA 오용석 개인정보정책단장은 “이번 협력포럼은 양 기관의 협력을 보다 증진할 수 있는 계기를 마련하는 한편 자체적으로 법률에 대응할 여력이 부족한 중국 진출 중소기업 등이 중국 개인정보보호법을 잘 준수할 수 있도록 지원함에 초점을 뒀다”며 “향후 개최되는 개인정보보호 포럼, 세미나에 우리 기업의 많은 관심과 참여를 바란다”고 말했다.",105,https://n.news.naver.com/mnews/article/138/0002138145?sid=103
"워크데이 3분기 매출 16억 달러, 전년 대비 20.5% 증가",2022.12.05. 오전 8:51,"[디지털데일리 이상일기자] 기업용 인사 및 재무관리를 위한 클라우드 애플리케이션 기업인 워크데이는 2022년 10월 31일자로 마감된 2023 회계년도 3분기총 매출은 16억 달러(약 2조 784억원)로 2022회계년도 3분기 대비 20.5% 증가했다고 밝혔다. 구독 매출은 14억3000만 달러(약 1조 8575억원)로 전년 동기 대비 22.3% 증가했다.아닐 부스리(Aneel Bhusri) 워크데이 공동 창업자 겸 공동 CEO겸 대표이사는 ""우리는 다시 한 번 건실한 분기 실적을 달성함으로써, 우리의 재무 및 인사 클라우드 솔루션이 오늘날 변화하는 세계에서 비즈니스를 하는 기업에게 얼마나 중요한지 입증했다”며 ""현재의 거시 경제 상황으로 불확실성이 증가한 건 분명하지만 직원들의 뛰어난 역량과 회사의 지속적 혁신을 기반으로 장기적 기회를 추구하며 미래를 잘 헤쳐 나갈 수 있으리라 확신한다""고 말했다.한편 워크데이는 산업 액셀러레이터를 포함하는 보다 개방되고 연결된 파트너 생태계에 대한 비전을 발표했다. 산업 액셀러레이터는 파트너와 함께 고객의 클라우드 트랜스포메이션을 가속화하는 새로운 산업 프로그램이다.또, 워크데이는 고객이 변화하는 비즈니스와 직원의 요구를 충족하도록 지원하는 새로운 기술과 사용자 경험 발표를 통해 워크데이 익스텐드(Workday Extend) 내의 로우코드/노코드(low-code/no-code) 앱 개발 기능과 AI/ML 기반의 차세대 스킬 기술을 선보였다. 이를 이용해서 기업은 워크데이 안팎으로 스킬 데이터를 쉽고 안전하게 이동시킬 수 있어 보다 개인화된 직원 경험을 제공할 수 있다.",105,https://n.news.naver.com/mnews/article/138/0002138090?sid=103
"금감원 대표번호로 걸어도 ‘당한다’…진짜 같은 가짜, ‘악성 앱’ 주의보",2022.12.05. 오후 9:55,https://news.kbs.co.kr/special/danuri/2022/intro.html,105,https://n.news.naver.com/mnews/article/056/0011387011?sid=103
"삼쩜삼, 양도세 상담·부가세 계산 기능 추가 앱 '2.0' 출시",2022.12.05. 오후 3:23,"삼쩜삼 2.0 출시[자비스앤빌런즈 제공. 재판매 및 DB 금지](서울=연합뉴스) 임성호 기자 = 세금 신고·환급 도움 서비스 '삼쩜삼' 운영사인 인공지능(AI) 스타트업 자비스앤빌런즈는 양도소득세 상담 등의 기능이 추가된 삼쩜삼 앱 '2.0'을 공개했다고 5일 밝혔다.    이번 개편을 통해 양도소득세 상담과 신고를 위한 세무사 연결을 비롯해 1월 정기 부가가치세 신고 기간을 앞두고 개인사업자용 예상 부가가치세를 계산할 수 있는 기능이 추가됐다.    아울러 가장 많은 카드공제 환급액 도출을 위한 '카드사용 황금비율 계산기'와 실수령액 기준 '희망 연봉 계산기' 기능도 생겼다.    현재 2.0 앱에서 예상 부가가치세 계산 기능만 제공하고 있으나, 1·7월 정기 부가가치세 신고 기간에는 개인사업자가 스스로 신고까지 마칠 수 있는 부가가치세 정기 신고 도움 서비스도 선보일 예정이다.    이번 업데이트는 기존 긱워커(초단기 근로자) 대상 종합소득세 신고 및 환급 도움 서비스에 집중했던 데서 나아가 다양한 고객에게 편리한 세무 서비스를 제공한다는 '세무 슈퍼앱 전략'의 일환이라고 자비스앤빌런즈는 설명했다.    2020년 5월 출시한 삼쩜삼 가입자 수는 지난달 말 기준 1천379만 명이며, 누적 환급신고액은 5천774억 원이라고 자비스앤빌런즈는 밝혔다.    김범섭 자비스앤빌런즈 대표는 ""앱 2.0은 삼쩜삼이 지향하는 개인 세무 시장의 혁신을 통한 고객의 부를 늘려 드리겠다는 목표에 따라 준비했다""고 말했다.    sh@yna.co.kr",105,https://n.news.naver.com/mnews/article/001/0013624175?sid=103
"더에스엠씨그룹 김용태 대표, '유공광고인' 문체부 장관 표창",2022.12.05. 오전 10:30,"기사내용 요약150여 브랜드 미디어 운영, 매년 3만개 이상 콘텐츠 제작



[서울=뉴시스] 오동현 기자 = 뉴미디어 종합 콘텐츠 기업 더에스엠씨그룹은 김용태 대표가 ‘2022 한국광고대회’에서 문화체육관광부 장관 표창을 수상했다고 5일 밝혔다.유공광고인 정부포상식은 광고산업의 발전과 광고업계에 공헌한 광고인을 위한 시상식이다. 1992년부터 매년 광고의 날을 기점으로 실시되고 있으며, 광고 분야 민간전문가 심사위원회와 문체부 공적 심사위원회, 행정안전부 자격 기준 검증, 국민 공개검증 등을 거쳐 최종 결정된다.김용태 대표는 뉴미디어 광고 산업의 초창기라 할 수 있는 2009년 6월 더에스엠씨그룹을 창업해 블로그, 트위터, 페이스북, 인스타그램, 유튜브, 틱톡을 기반으로 소셜미디어 산업 전반에 영향력을 펼치며 디지털 광고 시장의 발전과 활성화에 기여해온 공로를 인정받아 문화체육관광부 장관 표창 대상자로 선정됐다.더에스엠씨그룹은 창립 이래 소셜미디어 태동기인 2014년을 기점으로 성장을 이루며, 2022년 연매출 1200억원(IP, 커머스 포함)을 내다보는 뉴미디어 종합 콘텐츠 기업으로 발돋움했다. 현재는 ▲더에스엠씨그룹(연구, 경영기획, 투자) ▲소셜엠씨(소셜미디어 종합광고) ▲데이드(디지털 종합광고) ▲IMK(관광, 공공) ▲민트(퍼포먼스 마케팅) ▲밀리언뷰(소셜 엔터테인먼트) ▲콘크리(콘텐츠 커머스) 등 각 특화조직으로 구성된 600여 명의 임직원과 함께 150개의 브랜드 미디어를 운영하며 매년 3만개 이상의 콘텐츠를 제작하고 있다.각 계열사의 임직원은 크리에이터로써 하나의 프로젝트에 필요한 인원이 모여 협업하는 구조로 연계돼 있다.김 대표는 디지털 광고 영역에 그치지 않고, 다년간 브랜드 운영 경험을 토대로 광고와 커머스를 결합한 새로운 D2C(소비자 직접 판매) 비즈니스 모델을 구현하기도 했다. 2017년 콘크리 설립을 통해 기존 일반 벤더 역할 뿐만 아니라 퍼포먼스 마케팅을 실행하는 마케팅 벤더 역할로 새로운 시장을 개척했고, 펫, 푸드, 헬스&뷰티 등의 카테고리에도 도전했다. 특히 보고쿡 미역국수는 2020년 말 출시 이후 1년 만에 누적 판매량 80만개 돌파, 네이버 쇼핑 검색 국수 1위 등의 성과를 달성한 바 있다.또한 ▲이십세들 ▲OTR ▲방구석연구소 ▲메타브 ▲지구반상회 ▲예그맨 등 자체 IP(지식재산권) 사업 확장을 통해 광고 산업의 새로운 콘텐츠 플랫폼 모델을 제시했고, 성공적인 콘텐츠 플랫폼 모델을 구축했다. 이를 통해 MZ세대 특화 광고를 브랜드와 함께 제작하고 있다.이 밖에 지난 8월에는 자사가 5000시간 이상의 숏폼 콘텐츠 연구와 실전 경험을 통해 제작한 마케팅 실전서 '숏폼 콘텐츠 머니타이제이션'을 출간했다. 작년 9월에는 '콘텐츠 머니타이제이션'을 출간해 경제 경영 및 마케팅 분야 베스트셀러에 등극되기도 했다. 내년에는 '콘텐츠 머니타이제이션-크리에이터' 관련 내용을 담은 서적을 출간할 계획이다. 김 대표는 ""끊임없이 변화하는 광고 산업에서 더에스엠씨그룹만의 경쟁력을 높이고자 꾸준한 노력을 해온 성과들이 수상이라는 결과로 이어질 수 있게 돼 기쁘게 생각한다""며 ""여기까지 성장할 수 있었던 것은 임직원 한명 한명이 콘텐츠 크리에이터로써 최선의 노력을 이룬 결과라 생각하고, 앞으로도 함께 성장하며 뉴미디어 광고 산업의 트렌드를 이끌어가겠다""고 전했다.",105,https://n.news.naver.com/mnews/article/003/0011574940?sid=103
"AI ""한국 승리 확률 4%""…조별리그 결과는 모두 빗나갔다",2022.12.05. 오후 10:39,"3일 포르투갈전에서 후반 추가시간 황희찬의 역전골을 어시스트한 손흥민이 세리머니 후 뜨겁게 포옹하고 있다. / 사진=연합뉴스오는 6일 오전 4시 국제축구연맹(FIFA) 랭킹 1위 브라질과의 2022 카타르 월드컵 16강전을 앞두고 긴장감이 높아지는 가운데 인공지능(AI) 승부 예측에서도 한국이 이길 확률은 매우 낮은 것으로 나타났다. 업체마다 수치는 제각각이지만 한국의 승리 확률을 4~23%선으로 내다봤다.한국은 '이변'에 기대를 건다. 앞서 지난 3일 치러졌던 조별리그 경기에서도 AI는 포르투갈의 우세를 점쳤는데, 예상과 달리 한국이 극적 승리를 거뒀다. 월드컵에서 종종 연출되는 '대이변'의 주인공이 이번엔 대한민국이 되길 바라는 상황이다. AI가 예측한 승리확률 4%라는데…이변 노린다



그래픽=스포키 캡처5일 인공지능(AI) 승부 예측 시스템에 따르면 이번 브라질전에서 한국의 승률은 매우 낮다. LG유플러스의 스포츠 커뮤니티 플랫폼 '스포키'에서 제공하는 AI 승부예측에 따르면 한국은 브라질과의 16강전에서 85% 확률로 패배한다. 무승부는 11%, 승리는 4%로 예상됐다.미국 닐슨 산하 데이터 업체 그레이스노트에 따르면 한국이 브라질을 상대로 승리를 거둘 확률은 23%로 전망됐다. 16강 진출국 중 가장 낮은 수치다. 반면 브라질은 8강에 오를 확률이 무려 77%로 가장 높았다.데이터 전문 업체 옵타는 한국이 브라질을 제치고 8강에 올라갈 확률을 15.99%로 상향 조정했다. 기존 14.41%에서 1.58%포인트 올려잡았지만 여전히 승리 확률은 매우 낮다. 옵타의 계산에 따르면 한국의 4강 확률은 6.43%, 결승 진출 확률은 1.48%, 우승 확률은 0.38% 매우 희박하다. 아직 16강전을 치르지도 않은 브라질은 4강 확률(62.32%)과 결승 진출 확률(34.73%), 우승 확률(20.61%) 모두 1위로 집계됐다.다만 옵타는 ""브라질은 수비수들의 부상이 속출하며 수비라인에 문제가 생겼다""며 ""한국이 이 같은 약점을 공격하면 의외의 결과를 얻을 수도 있다""고 분석했다.'축구지능' 떨어지는 AI…""슈퍼컴도 빗나가네""



브라질 축구대표팀 네이마르가 2022카타르 월드컵 16강 한국과의 경기를 하루 앞둔 4일 오후(현지시간) 카타르 알아라비 SC훈련장에서 훈련을 하고 있다. 사진=뉴스1AI 시스템들은 브라질과의 16강전을 앞두고 비관적인 전망을 내놓고 있지만, 다행히도 지금까지 이들이 내놓은 승부 예측 결과의 적중률은 그다지 높지 않다.스포키는 지난달 24일 우루과이와의 H조 조별리그 1차전에 대해 우루과이 승리 확률은 70%, 한국의 승리 확률은 11%로 전망했다. 하지만 실제 결과는 19% 확률로 예측됐던 무승부였다. 가나전의 경우 한국이 42% 확률로 승리, 무승부는 28%, 가나가 이길 확률은 30%로 내다봤지만 실제로는 2대 3으로 패했다. 포르투갈전에서는 한국이 56% 확률로 패배, 무승부 확률은 24%, 승리 확률은 20%로 전망했지만 결과적으로 가장 적은 확률로 예상된 '승리'를 거뒀다.



그래픽=스포키옵타가 슈퍼컴퓨터를 활용해 내놓은 예상도 빗나갔다. 옵타는 우루과이전 경기를 앞두고 우루과이 56.2%, 무승부 18.9%, 한국 승리 24.9%를 점쳤다. 가나전 분석에서도 한국 대표팀의 승률은 40.9%, 가나의 승률은 31.3%, 무승부 확률은 27.8%로 내다봤다. 포르투갈전 역시 포르투갈 승리 58.4%, 무승부 22.3%, 한국 승리 19.3%로 예상했지만 실제 경기 결과를 비껴갔다.월드컵 조별리그는 여러 변수가 작용하는 데다 AI 예측의 핵심인 빅데이터가 부족하기 때문에 축구 승부 예측의 정확도는 아직 떨어지는 것으로 풀이된다.""브라질전 이변 가능성""…美 매체 '놀라운 전망'



3일 오전(한국시간) 카타르 알라이얀의 에듀케이션 시티 스타디움에서 열린 2022 카타르 월드컵 조별리그 H조 3차전 대한민국과 포르투갈 경기에서 승리를 거두며 16강 진출에 성공한 대표팀 손흥민이 울먹이고 있다. 사진=연합뉴스IT 업계는 고도화된 승부예측 시스템으로 구체적인 전망을 내놨지만 스포츠 전문가들의 예측 적중률보다는 낮은 전망을 내놨다. 오히려 스포츠 전문가들의 분석이 실제와 같거나 비슷해 눈길을 끈다.영국 공영방송 BBC에서 해설위원으로 활동하고 있는 크리스 서튼은 카타르 월드컵 개막 전에 '일본의 독일 승, 한국의 우루과이 무승부'를 맞혀 '인간 문어'라는 별명을 얻었다. 그는 포르투갈전에서 한국이 1대 0으로 승리할 것으로 예상했다. 박지성 SBS 해설위원 역시 같은 예측을 내놨다. 실제 우루과이와의 경기 결과 한국 대표팀은 이들의 예상 비슷하게 경기에서 '우세'를 보이며 무승부를 거뒀다. 높은 확률의 한국이 패할 것으로 전망했던 AI 예상과 달랐다.이번 브라질전에 대해서는 전문가들 예상도 밝지 않은 상황이다. 크리스 서튼은 한국이 브라질과의 경기에서 0대 2의 패배를 거둘 것으로 내다봤다. 그는 ""한국은 포루투갈을 상대로 그들의 후방에서 얼마나 잘 조직돼 있는지 보여줬지만, 브라질을 괴롭히기에 충분하지 않다고 생각한다""고 밝혔다. 부상으로 네이마르 선수가 출전하지 않더라도 브라질이 승리할 것으로 판단했다. 브라질전을 앞두고 나온 모든 예상은 한국의 패배를 점치고 있어 암울한 상황이다.



3일 오전(한국시간) 카타르 알라이얀의 에듀케이션 시티 스타디움에서 열린 2022 카타르 월드컵 조별리그 H조 3차전 대한민국과 포르투갈 경기. 황희찬이 역전골을 넣고 세리머니를 하고 있다. 사진=연합뉴스그러나 ""공은 둥글다""라는 명언처럼 이들의 예측과 전혀 다른 결과도 언제든 나올 수 있다는 가능성도 존재한다. 미국의 스포츠 전문 채널 ESPN은 ""브라질은 월드컵 5회 우승국이며 부상으로 결장했던 네이마르가 복귀할 가능성이 높아 한국에겐 어려운 경기가 될 것""이라면서도 ""한국이 부담 없이 기량을 펼치고, 16강은 단판 승부라는 점을 감안하면 한국에게도 희망이 있다. 한국이 단결해서 한 팀으로 싸우고 브라질에 두려움을 보이지 않는다면 이변을 일으킬 가능성이 있다""고 전망했다.박지성 SBS 해설위원 역시 브라질전과 관련해 ""축구는 모르는 것""이라며 ""6월 친선 경기를 통해 얻은 경험이 16강에서 발휘되고, 포르투갈전 때 마음가짐으로 다시 준비한다면 결과는 모르는 일이다. 포르투갈전과 똑같은 집중력을 가지고 수비에 집중한다면 초조해지는 건 브라질이다. 잘 견디면 우리에게도 찬스는 온다. 찬스를 잘 살리면 포르투갈 전과 같은 결과가 가능하다""고 내다봤다.",105,https://n.news.naver.com/mnews/article/015/0004783786?sid=103
"위메이드, 위믹스 유통량 실시간 모니터링 시스템 구축한다",2022.12.05. 오후 5:49,"위메이드는 크로스앵글과 '위믹스 유통량 모니터링 시스템 구축'을 위한 MOU를 5일 체결했다. /사진=뉴스1 위메이드가 가상자산 정보플랫폼 전문기업 크로스앵글과 '위믹스 유통량 모니터링 시스템 구축'을 위한 업무협약(MOU)에 나섰다. 위메이드의 자체 발행 가상자산 위믹스가 국내 4개 가상자산 거래소로부터 상장폐지(거래지원 종료) 통보를 받으면서 각 거래소를 상대로 상장폐지 효력정지 가처분 신청을 내고 법정 공방에 들어간 가운데 투자자 신뢰 회복을 위한 노력의 일환으로 풀이된다.위메이드는 5일 크로스앵글과 '위믹스 유통량 모니터링 시스템 구축'을 위한 MOU를 체결했다고 밝혔다.이번 MOU로 양사는 ▲실시간 유통량 감시 서비스(Live Watch) ▲초과 유통 알람(Over circulation alarm) ▲분기별 온체인 감사 보고서(Quarterly On-chain Audit Report) 등 세 가지 영역에서 상호협력하기로 했다. 크로스앵글은 가상자산 데이터 인텔리전스 플랫폼 '쟁글(Xangle)'을 운영하며 각종 블록체인 프로젝트의 투명한 정보공개 문화를 조성하고 있다.위메이드는 크로스앵글이 구축하고 있는 실시간 유통량 감시 서비스를 위믹스에 최초 적용한다. 이를 통해 위믹스의 유통 현황을 투자자들에게 투명하게 공개한다. 실시간 유통량 감시 서비스는 이르면 연내 크로스앵글의 쟁글에서 선보일 예정이다.정확한 정보를 제공을 통해 투자자들을 보호하고자 계획량 이상의 위믹스가 유통될 경우 자동으로 공시가 진행되는 시스템도 마련한다. 유통량 정보를 담은 온체인 감사 보고서도 분기별로 발간한다.위메이드 관계자는 ""크로스앵글은 블록체인과 암호화폐 프로젝트가 갖춰야 할 투명성의 표준을 제시하고 있다""며 ""이에 적극 응해 실시간 유통량 감시 서비스를 도입함으로써 위믹스를 첫 번째 모범 사례로 만들 계획이다""고 말했다.",105,https://n.news.naver.com/mnews/article/417/0000875052?sid=103
