title,date,main,section,url
"과기정통부, 디지털교과서 개발 지원…2년간 최대 3.7억원",2023.03.24. 오후 2:32,"K-클라우드 프로젝트 일환[이데일리 임유경 기자] 과학기술정보통신부는 클라우드 방식(SaaS)교과서 개발 지원 사업의 공고를 오는 4월 20일까지로 연장한다고 24일 밝혔다.과기정통부는 K-클라우드 프로젝트의 일환인 ‘교육 SaaS 개발 지원사업’에서 ‘디지털교과서’ 유형을 신설하고, 지난 2월 16일 해당 사업을 공고한 후 발행사에도 안내했다. 발행사는 해당 사업을 통해, 2년간 최대 3.7억원의 개발비와 함께 국내 대표적 클라우드 기업에서 제공하는 소프트웨어 개발 도구, 기술 교육·컨설팅 등의 서비스를 지원받을 수 있다. 



교육부는 지난 2월 ‘디지털 기반 교육혁신 방안’을 통해 2025년부터 수학·영어·정보 과목에 AI 디지털교과서를 도입한다는 계획을 발표한 바 있으며, 이와 관련하여 사용자의 편의성과 최근의 디지털 기술 동향을 고려할 때 AI 디지털교과서 개발에도 SaaS를 접목하는 것이 바람직하다는 논의가 있었다.이에 과기정통부와 교육부는 교과서 발행사와 기술(에듀테크, 클라우드) 기업이 협력할 수 있는 계기를 제공하기 위해 사업 설명회를 진행하고, 발행사·기술 기업 간담회, 클라우드 기업 서비스 설명회 등을 차례로 개최하였다. 이 과정에서, 교과서 발행사와 기술 기업들이 양자 간 협력 체계를 구축할 시간적인 여유가 필요하다는 현장의 요청이 있어, 당초 3월 31일까지였던 사업 공고 기간도 연장했다.과기정통부 관계자는 “교육부와 AI 디지털교과서 개발을 위해 더욱 긴밀하게 협력하고, 교과서 발행사, 기술 기업 등과도 지속적으로 소통하여 차질 없는 개발이 이루어질 수 있도록 지원할 예정이다”고 밝혔다.",105,https://n.news.naver.com/mnews/article/018/0005449083?sid=103
"통신3사 CEO '연봉킹' LGU+…""직원킹 SKT·장기근속 KT""",2023.03.24. 오전 11:22,"황현식 LG유플러스 대표, 22억8700만원 받아 '1위'



통신3사 CEO, 왼쪽부터 구현모 KT 대표, 유영상 SK텔레콤 사장, 황현식 LG유플러스 사장./그래픽=비즈워치SK텔레콤과 KT, LG유플러스 등 통신3사의 최고경영자(CEO) 가운데 지난해 가장 많은 연봉을 받은 인물은 황현식 LG유플러스 대표이사 사장인 것으로 나타났다. 이와 함께 직원 연봉이 많은 곳은 SK텔레콤, 직원들이 가장 오래 근무하는 곳은 KT였다. 24일 통신3사의 사업 보고서를 보면 황현식 LG유플러스 사장은 지난해 22억8700만원을 개인보수로 수령했다.이 가운데 급여는 13억9000만원이었다. LG유플러스는 황 사장에게 월평균 5100만원을 지급했다. 상여는 8억9600만원이었다. 회사 관계자는 ""황 사장은 2021년 매출 13조, 영업이익 9800억원 등 계량 지표에서 성과를 창출했다""며 ""중장기적 성장을 위한 비전을 제시하고 사업 구조 변화를 이끌어내는 점 등을 고려했다""고 설명했다.SK텔레콤의 유영상 대표이사 사장은 21억3700만원을 받아 근소한 차이로 2위가 됐다. 유 사장은 연간 급여 11억원, 상여 10억2400만원, 기타 근로소득 1300만원을 받았다.SK텔레콤은 ""유 사장은 새로운 성장 전략과 함께 유무선 통신 기반의 인공지능(AI)·디지털 인프라 서비스 기업 비전을 수립했다""며 ""이를 통해 고객과 주주 등 이해 관계자를 대상으로 새로운 성장 스토리를 제시함으로써 기업가치를 제고했다""고 평가했다.구현모 KT 대표이사 사장은 15억6100만원을 받았다. 급여는 5억5600만원, 상여 9억7300만원, 기타 근로소득이 3200만원이다. 기타 근로소득에는 건강검진비, 의료비지원금 등이 포함된다.KT는 ""이사회 결의에 따라 전년도 경영 성과를 종합적으로 평가해 성과급을 지급했는데, 여기엔 장기 성과급으로서 개인에게 지급된 주식수를 당시 주가로 산출한 금액도 포함됐다""고 했다.차기 KT 대표 후보였다가 사퇴 의사를 밝힌 것으로 알려진 윤경림 사내이사(그룹 트랜스포메이션부문장·사장)는 5억7000만원을 받았다. 급여 4억6000만원, 상여 8500만원, 기타 근로소득 2500만원 등을 수령했다.직원 규모와 평균 근속연수, 평균 연봉도 엇갈린다.KT 직원 규모는 2만544명, 평균 근속연수는 22년, 연간 평균 급여는 1억300만원이었다.LG유플러스의 직원은 1만433명, 평균 근속연수는 9년3개월, 연간 평균 급여는 1억100만원으로 집계됐다.SK텔레콤 직원 규모는 5413명, 평균 근속연수는 13년1개월, 연간 평균 급여는 1억4500만원으로 나타났다.",105,https://n.news.naver.com/mnews/article/648/0000014908?sid=103
"스마일게이트 ""VR 게임 '크로스파이어: 시에라 스쿼드' 공개""",2023.03.24. 오전 8:29,"크로스파이어: 시에라 스쿼드 시연에 참가한 GDC 2023 관람객[스마일게이트 제공. 재판매 및 DB 금지]    (서울=연합뉴스) 김주환 기자 = 스마일게이트는 가상현실(VR) 슈팅 게임 '크로스파이어: 시에라 스쿼드'를 미국 샌프란시스코에서 열린 'GDC(게임 개발자 회의) 2023'에서 공개했다고 24일 밝혔다.    스마일게이트 엔터테인먼트가 제작 중인 '크로스파이어: 시에라 스쿼드'는 '크로스파이어' IP(지식재산)를 VR로 확장한 게임으로, 소니의 '플레이스테이션 VR2' 플랫폼으로 제작됐다.    이 게임은 최대 4인까지 가능한 협동 플레이, 39개의 다양한 총기와 60여 개의 캠페인, 고도화된 인공지능(AI)으로 사람처럼 행동하는 적 인공지능이 특징이다.    스마일게이트는 지난 22일(현지 시간) 열린 에픽게임즈 부스에 참여해 '크로스파이어: 시에라 스쿼드' 체험 공간을 마련했다.    이상균 스마일게이트 개발실장은 ""시연 기간 플레이에 참여한 여러 게이머와 관람객의 피드백을 바탕으로, 완성도를 한층 높일 계획""이라고 말했다.    jujuk@yna.co.kr",105,https://n.news.naver.com/mnews/article/001/0013834694?sid=103
,,,105,https://n.news.naver.com/mnews/article/236/0000232525?sid=103
"윤경림 사의에 자문사들도 당혹...""코리아 딥 디스카운트되는 나쁜 사례""",2023.03.24. 오전 11:16,"""KT는 공기업 아닌 민간 상장사…정부 개입, 주식회사 제도 근간 흔드는 행위""윤경림 KT 차기 대표(CEO) 후보가 사임한 데 대해 국내 의결권 자문사들은 아쉬움을 내비치면서 ""코리아 딥 디스카운트가 될 수도 있다""는 우려를 내비쳤다. 앞서 이들 자문사는 윤 후보자에 대해 '적격하다'는 입장을 밝힌 바 있다.



윤경림 KT그룹 트랜스포메이션 부문장(사장) [사진=KT]24일 류영재 서스틴베스트 대표는 아이뉴스24와의 통화에서 ""전문성을 갖추고 재선정 과정을 거쳐 선정된 윤 후보가 사퇴를 한 것이 의아스럽다""며 사퇴 배경에 의혹을 제기했다.그는 ""상장사 CEO는 이사회를 거쳐 주총에서 결정되는 사안인데 과거 공기업이었다는 것 때문에, 통신이 국가 사업이라는 것 때문에 정부가 어떤 입김을 불어넣거나 영향력을 행사했다면 이는 주식회사 제도의 근간 자체를 흔든 것""이라며 ""이것이야말로 코리아 딥 디스카운트를 일으키는 행위""라고 강변했다.외부 개입으로 상장사 CEO 선정 절차가 방해를 받는 것은 한국 상장 기업에 대한 해외 투자자들의 신뢰를 떨어뜨리는 심각한 문제라는 지적인 것이다.서스틴베스트는 ESG(환경·사회·지배구조) 평가사이자 국내 유일 독립계 민간 의결권 자문사다. 한국ESG기준원(KCGS), 한국ESG연구소(대신경제연구소) 등과 함께 국내 3대 의결권 자문사로 꼽힌다. 앞서 서스틴베스트 측은 오는 31일 KT 정기 주주총회에서 윤 후보자 KT CEO 선임안에 대해 찬성할 것을 권고한 바 있다.윤 후보 선임에 대해 찬성 의견을 냈던 한국ESG평가원 측도 ""KT는 더는 공기업이 아니다""면서 윤 후보 사퇴에 외풍이 개입됐을 가능성에 대한 문제를 꼬집었다.손종원 한국ESG평가원 대표는 ""기본적으로 기업은 주주가치를 올릴 수 있는 지배구조를 갖춰야 한다고 생각한다. 그러기 위해선 공정성과 투명성, 전문성, 독립성이 필요하고 이런 측면에서 윤 후보자는 문제 소지가 없다고 판단했다""고 설명했다.이어 ""만일 외부에서 관료 또는 법조계 출신의 사람을 KT 차기 CEO로 추천해 영입을 시도한다면 전문성과 독립성 측면에서 부정적으로 생각한다""며 ""내부에서 다시금 선정해 전문성을 갖춘 적임자를 새로 선임한다면 반대할 이유는 없지만 외부 정치인 출신 들어오는 것에 대해서는 아주 부정적으로 본다""고 덧붙였다.",105,https://n.news.naver.com/mnews/article/031/0000736324?sid=103
,,,105,https://n.news.naver.com/mnews/article/236/0000232504?sid=103
'K-클라우드 프로젝트'에 AI 디지털 교과서 개발 추가,2023.03.24. 오후 2:14,"디지털 교과서(서울=연합뉴스) 강민지 기자 = 22일 오전 서울 강남구 코엑스에서 열린 '2022 에듀테크 코리아 페어'에서 참관객들이 디지털 교과서를 체험하고 있다. 에듀테크는 가상·증강현실(VR·AR), 인공지능(AI), 메타버스 등 첨단 정보통신기술을 교육에 접목해 쌍방향·맞춤형 학습을 제공하는 산업. 2022.9.22 mjkang@yna.co.kr(서울=연합뉴스) 조성미 기자 = 과학기술정보통신부는 2025년부터 수학·영어·정보 과목에서 도입 예정인 인공지능(AI) 기술 기반 디지털 교과서를 발행사가 서비스형 소프트웨어(SaaS)로 개발하도록 지원한다고 24일 밝혔다.    이에 따라 과기정통부는 'K-클라우드 프로젝트' 내 교육용 SaaS 개발 지원사업에 '디지털 교과서' 유형을 추가하기로 했다.    디지털 교과서가 별도 설치 과정 없이 소프트웨어를 웹상에서 이용하는 SaaS 형태로 제공되면 서버의 트래픽 급변에 탄력적으로 대응이 가능하고, 데이터 관리에도 용이하다고 과기정통부는 설명했다.    디지털 교과서 발행사는 2년간 개발비 최대 3억7천만 원과 함께 소프트웨어 개발 도구와 기술 교육·컨설팅 기회를 지원받는다.    과기정통부 관계자는 ""교육부와 AI 디지털 교과서 개발에 더욱 긴밀하게 협력하고, 교과서 발행사, 기술 기업 등과 계속 소통해 차질 없는 개발이 이루어질 수 있도록 지원하겠다""고 말했다.    csm@yna.co.kr",105,https://n.news.naver.com/mnews/article/001/0013835723?sid=103
차기 우리은행장 선출 '속도전'…4인 후보 명단 선정,2023.03.24. 오후 9:12,"임종룡 회장 취임 직후 자추위 열어…5월께 최종 선임차기 우리은행장 선출을 위한 과정이 발빠르게 진행되고 있다.24일 우리금융지주 자회사 대표이사 후보 추천위원회(자추위)를 열고 4명의 후보군을 추렸다고 밝혔다.4명 후보는 이석태 국내영업부문장·강신국 기업투자금융부문장·박완식 우리카드 대표·조병규 우리캐피탈 대표다.



(사진=우리금융그룹)이날 자추위는 후보자 명단을 추림과 동시에 은행장 선정 절차도 개선했다. 4명의 후보는 ▲전문가 심층 인터뷰 ▲평판조회 ▲업무역량 평가를 거쳐 최종 후보군에 이름을 올린다.최종 후보군은 2명이 될 예정이며, 최종 2인은 심층면접을 치루게 된다.우리금융 측은 ""우리은행장은 5월말경 자추위에서 최종적으로 선임될 예정""이라며 ""새로 도입한 은행장 선정 프로그램을 토대로 앞으로 회장, 은행장, 임원 등 경영진을 선발하는 시스템을 구축할 것""이라고 설명했다.앞서 지난 7일 이원근 우리은행장은 사의를 표명했다.",105,https://n.news.naver.com/mnews/article/092/0002286595?sid=103
[그래픽] 주요국 틱톡 제재 현황,2023.03.24. 오후 4:08,(서울=연합뉴스) 김민지 기자 = 세계적 인기를 구가하는 중국의 동영상 공유 플랫폼 틱톡에 대한 제재와 견제가 속출하고 있다.    지난달 백악관은 연방정부 전 기관에 30일 내 정부에서 발급한 휴대전화에서 틱톡을 삭제하라는 지침을 내렸다.    북미와 유럽은 물론 아시아 지역 국가도 틱톡을 이미 금지했거나 차단하려는 움직임을 보이고 있다.    minfo@yna.co.kr    트위터 @yonhap_graphics  페이스북 tuney.kr/LeYN1,105,https://n.news.naver.com/mnews/article/001/0013836187?sid=103
"디랩스, GDC 2023서 블록체인 게임 ‘럼블레이싱스타’ 처음 공개…현지 관심 높아",2023.03.24. 오전 8:13,"미국 샌프란시스코에서 열린 게임 개발자 컨퍼런스(GDC 2023)에서 디랩스의 블록체인 게임 '럼블 레이싱 스타'를 관람객이 플레이하고 있다./ 샌프란시스코=이소연 기자        “게임 그래픽이 훌륭하고 마치 실제 박진감 넘치는 레이싱 게임을 하는 듯한 느낌을 받았다. 세상에 하나뿐인 나만의 카트까지 대체불가토큰(NFT)으로 가질 수 있게 된다면 게임이 더 특별해질 것 같다”네시삼십삼분의 블록체인 개발 자회사 디랩스는 블록체인 기술을 적용한 게임 ‘럼블 레이싱 스타’를 미국 샌프란시스코에서 개막한 ‘게임 개발자 컨퍼런스(GDC 2023)’에서 23일(현지시각) 처음 공개했다. 이날 게임 시연에 참여한 던칸 디 마우로 서던캘리포니아대학교(USC) 컴퓨터공학과 학생은 이렇게 말했다.디랩스에 따르면 ‘럼블 레이싱 스타’는 잔디깎이를 이용해 전 세계 플레어들과 경주를 펼치는 독특한 레이싱 게임으로, NFT와 연동한 프로필 사진이 특징이다.



게임 '럼블레이싱스타'./ 디랩스 제공        디랩스는 이날부터 24일까지 블록체인 기업 폴리곤의 부스에 참여해 ‘럼블 레이싱 스타’ 시연 버전을 관람객들에게 선보인다.이날 행사장에는 게임 시연에 참가하고자 하는 많은 관람객이 몰렸다. 다양한 경주장과 게임 그래픽 등에 관심을 나타내는 이들이 많았다.권준모 디랩스 대표는 “NFT나 지갑, 암호화폐에 대한 지식이 없어도 누구나 간편하고 쉽게 즐길 수 있는 게임으로 개발 중이다”라며 “최종적으로는 커뮤니티가 소유권을 가지는 탈중앙화 게임을 추구하겠다”라고 했다.",105,https://n.news.naver.com/mnews/article/366/0000887627?sid=103
한반도 덮친 황사...중 연구진 “해마다 더 자주 오고 더 세진다”,2023.03.24. 오후 4:39,"중국발 황사, 이번 주 내 영향권 벗어날 듯“중국 베이징 대기오염 영향은 제한적”중국 산업화로 중금속 포함되기도… “건강관리 유의해야”



중국발 황사가 찾아온 24일 오전 서울 시청역 전광판에 '미세먼지 나쁨'이 표시돼 있다. 서울시는 이날 오전 4시 기준 미세먼지(PM-10) 경보를 해제하고 주의보로 전환했다. /뉴스1



        매년 봄철마다 한반도를 덮치는 중국발 황사로 미세먼지주의보가 내려졌다. 최근 본격적으로 시작된 황사는 이르면 주말 사이 영향이 누그러질 전망이다. 황사는 모래뿐만 아니라 호흡기질환을 유발할 수 있는 유해물질이 포함된 만큼, 각별한 주의가 필요하다.환경부는 24일 수도권과 충청, 호남, 제주, 경북 지역에 미세먼지주의보를 발령했다. 이날 오후 1시 기준 1시간 평균 미세먼지(PM10·1000분의 10㎜) 농도는 서울 174㎍/㎥, 강화 191㎍/㎥, 서청주 213㎍/㎥, 광주 150㎍/㎥, 부산 144㎍/㎥ 등이다. 연평균 미세먼지 농도가 36㎍/㎥인 점을 고려하면 상당히 높은 수치다.황사 영향이 심해진 전날에는 한때 서울은 385㎍/㎥, 강화 391㎍/㎥, 서청주 385㎍/㎥, 군산 294㎍/㎥ 등으로 대기질이 악화한 것으로 나타났다. 환경부는 수도권과 중부지역에 황사 위기경보를 ‘관심’에서 ‘주의’ 단계로 상향시켰다. 황사 위기경보 ‘주의’ 단계는 미세먼지 농도가 300㎍/㎥ 이상으로 지속할 때 발령한다.이번 황사는 중국 고비사막과 네이멍구 고원에서 발원해 규모를 키우면서 한반도에 상륙했다. 특히 중국 수도 베이징의 미세먼지 농도가 22일 오전 500㎍/㎥에 달하면서, 황사가 한반도에 더 많이 유입되는 것 아니냐는 관측도 나왔다. 전 세계에서 채택하는 공기질지수(AQI)는 우수(0∼50㎍/㎥), 양호(51∼100㎍/㎥), 약한 오염(101∼150㎍/㎥), 중급 오염(151∼200㎍/㎥), 심각 오염(201∼300㎍/㎥), 엄중 오염(301∼500㎍/㎥) 등 6단계로 나뉘는데, 이미 수치로 표현할 수 없을 만큼 대기오염이 심각한 것이다.기상청은 이번 황사는 이르면 25일이나 이번 주 중으로 영향이 사라질 것으로 전망했다. 중국 베이징에서 나타나고 있는 황사와 미세먼지의 한반도 유입도 제한적일 것으로 예상했다.현재 중국과 한반도 상공에 나타난 기류 흐름을 살펴본 결과, 베이징의 공기가 한반도로 유입될 수 없다는 것이다. 현재 중국 기류는 베이징의 동쪽에서 시계 방향으로, 한반도 기류는 서해 쪽에서 반시계 방향으로 돌고 있다. 이 경우 베이징의 공기는 중국 산둥반도로 흘러간다는 게 기상청의 설명이다.우진규 기상청 통보관은 “현재 한반도 미세먼지 농도는 200㎍/㎥ 수준으로, 농도가 400㎍/㎥ 수준이었던 전날과 비교하면 옅어졌다”며 “한반도는 이날까지 황사 영향을 받을 것으로 보고, 25일부터는 황사 영향권에서 조금씩 벗어날 것으로 보인다”고 설명했다.우 통보관은 “현재 한반도로 들어온 황사는 중국 베이징에서 나타난 대기오염 현상과는 관계가 없다”며 “이번 황사는 내몽골 고원과 고비사막에서 발원한 것이 베이징 동쪽을 돌아와 상륙한 것”이라고 강조했다.황사는 통상적으로 중국 내륙 사막에서 발생한 모래바람을 의미하지만, 산업화로 인해 중금속이 섞여 인체에 치명적인 질환을 일으킬 수 있다. 최근에는 황사에 납과 카드뮴, 크롬 등의 중금속이 묻어 있는 것으로 조사됐다. 황사에 장기간 노출되면 만성 폐질환은 물론, 심장·뇌·간으로 유해물질이 이동해 질병을 유발할 수 있다.기상청은 다양한 관측기법을 활용해 황사 모니터링을 강화하고 있다. 황사 발생 시 노약자나 호흡기질환자는 최대한 외출을 자제해야 한다. 기상청은 “이날 오후 2시 기준 서울을 포함한 전국에 황사가 관측되고 있다”며 “외출을 최대한 자제하고, 건강관리 등에 유의해야 한다”고 밝혔다.중국발 황사는 중국 고비사막과 고원지대의 사막화로 점점 길고 강력해질 전망이다. 정젠종 중국 남방과학기술대 교수는 황사의 발원지인 고비사막에서 기후변화와 과도한 방목으로 사막화가 진행되면서 지난 10년간 황사 빈도가 증가했다는 연구결과를 지난해 5월 국제학술지 ‘환경 과학: 대기(Environmental Science: Atmospheres)’에 발표했다.몽골 지역의 모래폭풍은 2012년 기준 초속 3m에서 2020년 초속 3.7m로 강력해졌다. 같은 기간 모래폭풍이 발생하는 기간도 46일에서 57일로 늘어났다. 연구팀은 풍속 증가와 모래폭풍 빈도가 비례한다며 건조 지역의 식생 감소와 건조한 토양 포면 상태가 영향을 미친다고 설명했다. 실제로 이 지역의 사막화 면적은 1976~1988년 2100㎢에서 1988~2000년 3600㎢로 계속 증가했다.연구팀은 “황사 활동은 예측하지 못한 미래에 더 빈번하고 심각해질 수 있음을 예고한다”며 “이 과정은 바람 침식이 일어나도록 하는 지형을 만드는 활동에 의해 발생한다”고 했다. 그러면서 “황사 발생을 완화하기 위해 식생이 있는 지표를 회복하는 등 효과적인 조정이 필요하다”고 강조했다.참고 자료Environmental Science: Atmospheres, DOI: https://doi.org/10.1039/D2EA00058J",105,https://n.news.naver.com/mnews/article/366/0000887878?sid=103
"룰루메딕, 건강데이터 기반 미래 병원비 예측 서비스",2023.03.24. 오후 3:47,"16개 주요 질병 위험도 체크, 의료비 예측 가능 



룰루메딕 제공.  [파이낸셜뉴스] 룰루메딕이 ‘현재 건강 데이터’로 미래 병원비를 예측할 수 있는 서비스를 시작한다.   16개 주요 질병 위험도를 체크 해 미래 의료비를 예측해 볼 수 있다. 이와 함께, 외국에서 받은 검진 결과도 연동이 가능하다.   24일 룰루메딕은 자사 비대면 진료 애플리케이션 내 사용자의 생체정보와 라이프 사이클 관련 부가 기능을 추가해 ‘건강분석’ 기능을 한층 고도화한다고 밝혔다.   룰루메딕은 사용자의 건강검진 데이터를 분석해 객관화된 수치로 생체나이를 표시하고 질병별 경고 신호를 포착한 예방 가이드를 제공한다. 또 국민건강보험공단에 등록된 1000만 명 이상의 빅데이터 기반 분석을 통해 10년 후의 개인 의료비를 예측하는 등 맞춤 의료 소비 설계를 제공한다.   이번 업데이트에서 건강검진 정보를 사용자의 선택에 따라 연동할 수 있는 기능이 추가됐다.   룰루메딕의 건강 분석 서비스는 국내 사용자뿐만 아니라 외국인도 이용 가능하다. 해외 사용자는 외국 의료기관으로부터 받은 건강검진데이터를 사진 찍어 룰루메딕 앱에 올리면 생체정보와 건강지표를 자사 건강분석 모델에 적용, 국내 사용자와 동일한 생체나이와 예측 의료비 정보를 제공받을 수 있다.   또 개인의 의료비 소비를 기반으로 한 맞춤형 보험설계도 제공할 예정이다.   보험금 청구를 위해 병원에 직접 방문해야 했던 기존의 번거로움을 해소시키기 위해 새로운 기능도 추가됐다. 비대면 서류발급 서비스인 ‘마이써티’를 통해 손쉽게 진단서나 병원 영수증과 같은 보험 필요 서류를 다운 받을 수 있다.   김태현 룰루메딕의 이사는 “그동안 코로나19와 재택근무 문화 정착으로 국내외 퍼스널 헬스케어 시장은 지속해서 성장하고 있다”며 “마스크 없는 일상으로의 복귀 후에도 계속되는 개인 건강에 관한 관심을 양질의 K-헬스 콘텐츠로 이어가겠다”고 말했다.",105,https://n.news.naver.com/mnews/article/014/0004986537?sid=103
