title,date,main,section,url
국가안보실 “北 해킹으로 핵무기 개발…사이버안보 기본법 추진”,2022.09.20. 오후 12:36,"임종득 2차장, 국정원 주최 사이버안보 학술회의 발표""국가안보실 컨트롤타워로 사이버위기 대응법 시급""""동맹국과 사이버안보동맹 맺고 공세적 대응 추진""시민단체 '안보 과잉' 우려 있어, 여론수렴 주목돼[이데일리 최훈길 기자] 윤석열정부 국가안보실이 사이버 공격에 대응하기 위한 사이버안보 기본법 제정을 추진하기로 했다. 국가안보실을 컨트롤타워로 만들어 사이버 공격에 적극 대응하겠다는 이유에서다. 시민단체에서는 안보 과잉 우려도 제기하고 있어 충분한 여론수렴과 사회적 공론화가 필요할 전망이다. 대통령실 소속 임종득 국가안보실 2차장은 20일 서울 중구 더플라자호텔에서 국가보안기술연구소와 함께 주최한 ‘2022 사이버공간에서의 국제 평화안보체계 구축에 관한 국제 학술회의’에 참석해 “북한은 가상자산 등 금전탈취 해킹으로 조달한 자금을 핵무기와 대량살상무기(WMD) 개발에 사용하면서 세계 평화를 위협하고 있다”며 “국가 차원의 사이버위기 대응을 위한 법·제도 마련이 시급하다”며 이같은 입장을 밝혔다. 임 차장은 “정치적 논리나 부처 간의 이해관계에 따라 사이버안보 기본법은 2006년부터 16년간 국회의 문턱을 넘지 못해왔다”며 “국민을 보호하는 막중한 책임에 있어서 여야나 진보·보수가 없으며 한마음으로 법안 제정에 힘을 모아야 한다”고 말했다. 



임종득 국가안보실 2차장은 20일 서울 중구 더플라자호텔에서 “국가 차원의 사이버위기 대응을 위한 법·제도 마련이 시급하다”고 말했다. (사진=최훈길 기자)사이버안보 기본법은 사이버안보 관련해 부처별로 흩어져 있는 법안·업무를 모아 컨트롤타워를 만드는 게 골자다. 김병기 더불어민주당 의원이 대표발의한 국가사이버안보법안, 조태용 국민의힘 의원이 대표발의한 ‘사이버안보기본법안’이 국회 계류 중이다. 시민단체들은 ‘안보 과잉’ 우려를 제기하고 있고, 민간 기업과 정부 부처들은 국정원 중심의 안보 체계 구축에 난색을 표하고 있어서다. 이에 임 차장은 “만들어진 법안에는 국가안보실을 명실상부하게 컨트롤타워로 하고 각 부처의 역할을 정립할 것”이라며 국정원 컨트롤타워 가능성에 선을 그었다. 이어 “제정 과정에서 제기되는 다양한 의견을 적극적으로 수렴하고 철저히 검토해 대부분이 공감할 수 있는 안을 마련해 나갈 것”이라고 약속했다. 아울러 임 차장은 “사이버위협에 억지력을 행사하기 위한 국가사이버안보전략 방향을 제시할 것”이라며 “주요국과 사이버안보동맹 체결을 검토 중”이라고 전했다. 사이버안보동맹 체결 관련해서는 “사이버 상호방어 개념을 명분화해 국제연대를 강화할 것”이라며 “사이버위협에 동맹국과 공동대응하는 방어체계를 마련할 것”이라고 덧붙였다. 임 차장은 “민관 협업을 강화함으로써 튼튼하고 유기적인 국가 사이버안보 생태계를 구축해나갈 것”이라고 예고했다. 관련해 그는 “국정원에서 11월 개소를 준비 중인 사이버안보협력센터는 민관 정보공유를 확대를 통한 범국가적 사이버위협 대응 기반을 구축하는 모범적인 사례가 될 것”이라고 내다봤다. 임 차장은 “공세적 사이버안보 패러다임으로의 전환이 중요하다”며 “국가 배후나 국제 해킹 조직에 우리 정부의 대응 의지를 보이는 것이 중요하다”고 강조했다. 이어 “사이버안보기본법, 국가위기관리기본지침, 국가사이버안보전략 등의 제·개정을 통해 관련된 제도적 뒷받침도 병행해 나갈 계획”이라고 강조했다.",105,https://n.news.naver.com/mnews/article/018/0005321120?sid=103
"LGU+, AWS클라우드에 백업망",2022.09.20. 오전 10:02,"(서울=연합뉴스) LG유플러스가 아마존웹서비스(AWS), 삼성전자와 함께 지진이나 화재 등 재난 상황에서도 안정적인 5G망 운용이 가능한 백업망을 AWS 클라우드에 구성하는 데 성공했다고 20일 밝혔다. 사진은 LG유플러스 직원들이 5G UPF 장비를 살펴보고 있는 모습. 2022.9.20 [LG유플러스 제공. 재판매 및 DB 금지]    photo@yna.co.kr",105,https://n.news.naver.com/mnews/article/001/0013448943?sid=103
"바이오니아, 탈모 화장품 ‘코스메르나’ 원료생산 설비 구축",2022.09.20. 오후 3:54,"대량 올리고 합성기 개발원료 양산 성공바이오니아는 탈모 화장품 ‘코스메르나’의 대량 생산에 필요한 대용량 디옥시리보핵산(DNA)·리보핵산(RNA) 올리고합성기를 개발해, 원료 ‘SAMiRNA’의 대량합성에 성공했다고 20일 밝혔다. 회사는 2000년 세계 최초로 ‘384 DNA합성기’를 개발했다. 이 기기를 통해 수 mg량의 염기서열이 다른 올리고DNA 384개를 동시에 합성할 수 있다. 바이오니아는 이를 이용해 연구용 DNA와 RNA를 합성해 공급해 왔다.  이번에 개발한 합성기는 기존의 384 DNA합성기에 비해 10만배 이상 대량으로 DNA와 RNA를 합성할 수 있다고 회사는 설명했다. 바이오니아에 따르면 대용량 합성기는 현재 해외 업체 두 곳에서 개발 및 판매하고 있다. 하지만 장비 가격이 고가인데다, SAMiRNA를 합성하는 최적화된 설계(프로토콜)가 없었다. 바이오니아는 지난 10여년간 새로운 방식의 대용량 합성기를 연구 개발해 왔으며, 이번에 SAMiRNA 대량합성에 성공했다는 게 회사 측의 설명이다. 이번 대량합성기 개발로 코스메르나 출시도 순조로울 것으로 기대하고 있다. 코스메르나는 세계 최초 짧은간섭 리보핵산(siRNA) 기반 탈모 완화 화장품이다. 다만 고가인 siRNA의 생산 비용 우려가 있는 실정이다. 바이오니아는 이번 개발로 원료 생산체계를 확립해 원료 생산비를 대폭 절감하면서, 높은 수익성을 확보할 수 있게 됐다고 했다. 또 고가의 대용량 합성기를 자체 개발함으로써 설비 투자에 들어가는 자금부담도 덜었다고 했다. 회사는 코스메르나 출시 후 판매 증가 추이를 고려해 원료 생산장비를 계속해서 증설해 나갈 방침이다. 이번 개발을 통해 향후 수요 급증 시에도 빠르게 대규모 추가 증설이 가능하다고 설명했다. 이와 함께 코스메르나가 유럽에 성공적으로 안착한 후 글로벌 수요를 대비할 공장 부지도 공주산단에 이미 마련했다고 전했다. 바이오니아 관계자는 “유럽 화장품등록포털(CPNP) 등록 완료 이후 코스메르나의 수요가 급격히 늘 것으로 예상해, 선제적으로 원료 생산능력 향상을 위해 다양한 연구개발을 진행해 왔다”며 “코스메르나 원료 생산능력 향상을 위해 지속적으로 노력하겠다”고 말했다.",105,https://n.news.naver.com/mnews/article/015/0004751857?sid=103
카카오 공동체 총출동…'3000억 상생약속' 지킨다,2022.09.20. 오후 2:51,"전통시장 상인 디지털 전환 돕고창작재단 웹툰·웹소설 작가 육성'플랫폼 독과점' 논란 정면 돌파



카카오의 소상공인 지원 프로그램 중 하나인 '‘우리동네 단골시장’. /사진 제공=카카오[서울경제] 카카오가 공동체(그룹) 계열사를 총동원해 상생 약속을 실천하고 있다. 지난해 하반기 플랫폼 독과점 논란이 불거진 후 올해 4월 사회와 함께하는 지속 가능 성장안을 제시하며 위기 돌파에 나섰다.20일 카카오에 따르면 회사는 올해 하반기 본사와 산하재단 카카오임팩트, 카카오엔터테인먼트(카카오엔터), 카카오게임즈, 카카오모빌리티 등 공동체 계열사들을 통해 상생 약속을 본격적으로 이행하고 있다.카카오는 5년 간 3000억 원의 상생기금을 조성해 소상공인과 지역 파트너, 디지털 콘텐츠 창작자, 공연·예술 창작자, 모빌리티 플랫폼 종사자, 스타트업과 사회혁신가, 지역사회와 이동·디지털 약자 등 지원에 활용하겠다는 계획을 세웠다.



계획 추진의 하나로 카카오는 소상공인을 위한 ‘소신상인’ 프로젝트를 진행 중이다. 소신을 가지고 사업을 운영하는 상인들을 지원하는 활동이다. 이 중 ‘우리동네 단골시장’은 전통시장 상인을 대상으로 디지털 전환을 돕는 프로그램이다. 튜터가 시장에 상주하며 카카오톡 채널 등 마케팅 플랫폼 활용법을 상인들에게 가르친다. 서울 양천구 신영시장을 시작으로 전국 10곳을 추가 선정 중이다.‘카카오 소신상인 지원혜택’은 카카오톡 채널을 활용한 마케팅 비용을 지원한다. 누적 50억 원 정도를 지원했다. 카카오메이커스는 농축수산물 판매자의 판로 개척, 가격 안정화, 환경 비용 절감 등을 지원하는 ‘제가버치’ 프로젝트를 운영 중이다.카카오엔터는 국내 최초 웹툰·웹소설 재단인 ‘카카오창작재단’을 8월 설립, 온라인 창작 아카데미를 시작했다. 작가 수익 정산을 투명화하는 ‘파트너 포털’도 구축했다. 카카오게임즈는 260억 규모의 ‘같이가자 카카오게임즈 상생펀드’를 통해 소규모·인디 개발사에 투자하고 있다. 디지털 사각지대 해소에도 힘쓰고 있다.카카오임팩트와 카카오모빌리티는 5년 간 총 100억 원의 ‘모빌리티 플랫폼 종사자 상생기금’을 조성한다. 이달 7일 희망브리지전국재해구호협회에 질병과 사고를 겪은 택시기사를 지원하는 데 22억원을 지정 기탁했다. 카카오임팩트는 누적 39명의 ‘사회혁신가’를 선발해 활동비, 홍보, 네트워크 형성 등 사회혁신 활동을 지원해왔다.홍은택 카카오 각자대표는 “상생은 카카오 성장을 위한 미션(과제)이 아니라 필수적인 본질이다”며 “파트너들이 디지털 전환을 하고 실질적인 수익을 거둘 수 있도록 지원을 아끼지 않겠다”고 말했다.",105,https://n.news.naver.com/mnews/article/011/0004100848?sid=103
"차병원·바이오그룹, 차의대에 연구원 박사과정 신설",2022.09.20. 오후 3:14,"(서울=연합뉴스) 김잔디 기자 = 차병원·바이오그룹은 소속 연구원 역량을 강화하고 연구개발(R&D) 경쟁력을 높이고자 차의과학대학교와 손잡고 박사 과정을 신설했다고 20일 밝혔다.    신설한 바이오소재공학과 박사과정은 정규 4학기와 연구기로 진행된다. 분자세포생물학, 인체생리학, 면역생명과학특론 등 3개 전공 필수과목과 분자 신호전달학, 면역과 질병 등 9개 전공 선택과목으로 이뤄졌다. 차의과학대학교 바이오소재공학과장 곽규범 교수 등이 강의한다.     박사 과정에는 차병원·바이오그룹 내 R&D 연구원 중에서 10여 명이 선발돼 학비 등을 지원받는다. 차병원·바이오그룹은 앞으로 매 학기 그룹 내 우수 인재를 선발해 교육함으로써 인재를 육성할 계획이다.     이번에 선발된 미래의학연구원 면역세포치료연구팀 정주연 책임은 ""20여 년 쌓아온 실무 경험에 전문지식을 더해 연구 역량을 강화할 기회가 될 것""이라며 ""회사가 과정을 개설해 줘 마음 편하게 연구하며 공부할 수 있게 됐다""고 말했다.     차병원·바이오그룹은 이 밖에도 2017년부터 '차바이오 MBA' 과정을 개설해 운영하는 등 인재를 키우는 데 집중하고 있다. 차바이오 MBA는 현재까지 100여 명의 졸업생을 배출했다. 



(서울=연합뉴스) 차바이오 MBA 5기 학생들이 강의를 듣고 있다. 2022.09.20. [차병원·바이오그룹 제공. 재판매 및 DB 금지]    jandi@yna.co.kr",105,https://n.news.naver.com/mnews/article/001/0013450304?sid=103
"지엔티파마 ""넬로넴다즈 임상 결과, 국제 학술지 게재""",2022.09.20. 오전 9:02,"[이데일리 석지헌 기자] 신약 개발 기업 지엔티파마는 뇌졸중 치료제 ‘넬로넴다즈’의 한국 임상 2상 연구 논문이 국제 학술지 ‘뇌졸중(Stroke)’ 9월호에 게재됐다고 20일 밝혔다. ‘Stroke’는 미국 심장협회(American Heart Association) 학술지로, 제출된 연구 논문은 해당 분야 학자들의 엄격한 심사와 승인을 받아 게재된다.



지엔티파마 사옥 전경.(사진= 지엔티파마)학술지에 실린 연구 논문에는 발병 후 8시간 이내에 혈전 제거 수술을 받은 뇌졸중 환자 208명을 대상으로 넬로넴다즈의 효과와 안전성을 분석한 결과가 담겼다. 연구 논문에 따르면 넬로넴다즈의 장애 개선 효과는 뇌졸중 약효의 3대 평가(장애 평가, 일상생활 평가, 신경학적 평가)에서 플라시보(위약)와 비교해 확연하게 개선된 것으로 나타났다.넬로넴다즈 임상 2상은 급성 허혈성 뇌졸중 발생 8시간 이내에 약물 투여와 혈전 제거 수술을 받는 앞순환계 내 대혈관폐색이 있는 19세 이상 환자를 대상으로 진행했다. 환자는 12시간 간격으로 5일 동안 10회 플라시보, 저용량(넬로넴다즈 총 2,750mg), 고용량(넬로넴다즈 총 5,250mg)을 투여받았고 12주에 걸쳐 약효와 안전성을 조사했다.약물을 1회 이상 투여받고 12주 후에 뇌졸중 장애 평가 척도인 mRS 분석을 완료한 환자 183명 중 12주 후에 mRS 점수가 0~2(독립 행동 가능)인 비율은 플라시보, 저용량, 고용량 그룹에서 각각 54.1%, 61.5%, 63.2%였다. 넬로넴다즈의 장애 개선 효과는 mRS 0(정상)~6(사망)의 분포 분석에서도 확연히 나타났다. 일상생활 평가 척도인 BI 점수가 90보다 높은(독립 활동 가능) 환자의 비율은 플라시보 그룹 43.6%에 비해 넬로넴다즈 그룹 63%로 현저히 개선됐다. 10회의 약물을 모두 투여받은 환자 152명에게서 넬로넴다즈의 약효는 더욱 확연히 나타났다. 특히 고용량 그룹은 4주, 8주, 12주 후에 mRS 분포 분석에서 유의적인 장애 개선 효과가 나타났다. 12주 후에 BI 점수가 90보다 높은 환자의 비율은 플라시보 그룹 41.9%, 고용량 그룹 64.4%로 유의적인(P=0.0410) 개선 효과가 확인됐다.지엔티파마는 임상 2상 결과에 따라 발병 후 12시간 이내에 혈전 제거 수술을 받는 중증 급성 뇌졸중 환자 496명을 대상으로 고용량 넬로넴다즈의 약효와 안전성을 검증하는 국내 임상 3상을 진행하고 있다. 현재까지 224명의 환자가 등록돼 45%가 넘는 진행률을 보이고 있으며, 2023년 3월까지 모든 환자 등록이 완료될 것으로 회사 측은 전망하고 있다. 넬로넴다즈 임상 3상은 중국에서도 순조롭게 진행 중이다. 중국 임상 3상은 최근 독립적 데이터 모니터링 위원회(IDMC)로부터 임상을 계속 진행해도 된다는 권고를 받았다. 지엔티파마는 국내외에서 진행 중인 임상 3상을 성공적으로 완수해 3년 이내에 뇌졸중 치료제를 출시한다는 계획이다.곽병주 지엔티파마 곽병주 대표이사는 ”단일표적 뇌신경세포 보호 약물에 비해 넬로넴다즈의 우월한 약효와 안전성은 동물모델에 이어 재관류 치료를 받는 뇌졸중 환자에게서 확인되고 있어 현재 진행 중인 임상 3상에서도 의미 있는 결과가 기대된다”고 말했다.",105,https://n.news.naver.com/mnews/article/018/0005320832?sid=103
"CGV, 영화 '정직한 후보2' 오늘 무비오픈런",2022.09.20. 오후 4:33,"CGV가 NEW 배급으로 28일 개봉하는 영화 '정직한 후보2'를 카카오 쇼핑라이브 무비오픈런을 통해 소개한다.20일 오후 10시 진행되는 카카오 쇼핑라이브에서는 유튜버 백수골방과 이시아가 출현해 영화를 더욱 재미있게 즐길 수 있는 관람 포인트를 소개한다. '정직한 후보2' 전용 관람권과 매점 특가 상품도 라이브 방송을 통해 만나볼 수 있다.정직한 후보2는 화려한 복귀 기회를 잡은 전 국회의원 '주상숙'과 비서 '박희철'이 '진실의 주둥이'를 쌍으로 얻게 되는 상황을 그렸다. 웃음 대폭발 코미디 영화로 전작 출연진 라미란, 김무열, 윤경호뿐 아니라 서현우, 박진주, 윤두준 배우 등이 새로 합류했다.라이브 방송에서는 '정직한 후보2'를 볼 수 있는 전용 관람권도 한정 판매할 예정이다. 영화를 보며 함께 즐길 수 있는 매점 상품도 라이브 방송에서 특가로 만나볼 수 있다. CGV는 정직한 후보2 라이브 방송을 시청하는 팬들을 위한 이벤트도 마련했다.정직한 후보2 카카오 라이브 방송은 카카오 쇼핑탭 쇼핑라이브를 클릭해 참여할 수 있다. 자세한 내용은 CGV 홈페이지와 모바일 앱 이벤트 페이지에서 확인할 수 있다.주우현 CJ CGV 커머스사업팀장은 “CGV는 영화팬이 더욱 재미있고 알차게 영화를 즐길 수 있도록 무비오픈런으로 다양한 혜택을 제공하고 있다”며 “라이브 방송에서 전용 관람권도 구입하고 소중한 분들과 극장을 찾아 시원한 웃음 나누시길 바란다”고 말했다.CGV는 올해 2월 '더 배트맨'을 시작으로 영화 개봉 전 작품에 대한 심층 소개와 관람 포인트를 안내하고 전용 관람권·굿즈를 판매하는 영화 소개 프로그램 '무비오픈런'을 가동하고 있다.",105,https://n.news.naver.com/mnews/article/030/0003045364?sid=103
"경남도-대웅제약, 바이오 스타트업 성장·지원 '맞손'",2022.09.20. 오후 3:43,"경남 바이오 스타트업 육성 업무협약[경남도 제공. 재판매 및 DB 금지](창원=연합뉴스) 황봉규 기자 = 경남도와 대웅제약은 20일 경남도청 도정회의실에서 바이오 스타트업의 성장과 투자 유치를 지원하기 위한 업무협약을 했다.    이날 협약식에는 박완수 경남지사와 전승호 대웅제약 대표, 대웅제약 자회사인 아피셀테라퓨틱스 유종상 대표, 노충식 경남테크노파크 원장과 민정상 이모티브 대표, 부산대학교 의과대학 교수인 김재호 하이셀텍 대표, 강양제 디보 대표 등 도내 바이오 스타트업 관계자가 참석했다.    도내 바이오 스타트업 중 이모티브는 인지기능 개선용 디지털치료제를, 하이셀텍은 줄기세포 치료제를, 디보는 의료데이터 관리 플랫폼을 개발·연구한다.    이날 협약에서 경남도와 대웅제약은 도내 바이오 스타트업을 체계적으로 육성하기 위해 기술·기업 진단과 비즈니스 모델 발굴, 기술 및 제품개발 컨설팅, 연구개발·사업화 및 마케팅 자금 지원, 판로 및 파트너 발굴, 후속 투자유치와 인수·합병(M&A)·기업공개(IPO)·글로벌 진출 등에 협력하기로 했다.     박 지사는 ""높은 부가가치를 창출하는 바이오산업은 미래의 중요한 성장동력""이라며 ""이번 협약은 바이오 스타트업 육성을 위해 산·학·연·병·관이 협력한 전국 최초의 모델인 만큼 수도권에 버금가는 바이오 인프라를 육성해 기술력을 갖춘 세계적인 바이오 업체가 탄생할 수 있도록 지원해 나가겠다""고 말했다.    경남도는 2024년까지 지원하는 '바이오 스타트업 스튜디오 운영사업'을 통해 이모티브, 하이셀텍, 디보를 올해 대상기업으로 정해 성장을 지원하고, 대웅제약은 우수한 기술력을 확보하는 기업에 투자할 예정이다.    bong@yna.co.kr",105,https://n.news.naver.com/mnews/article/001/0013450415?sid=103
"SKT, 양자 기술로 가스누출 감지…국내 첫 현장실증",2022.09.20. 오후 6:06,"(서울=뉴스1) = SK텔레콤은 20일 보령 LNG 터미널, 퀀텀센싱과 함께 충청남도 보령에 위치한 LNG 저장탱크에 양자가스센싱 시스템을 설치·적용하는 업무협약(MOU)을 체결했다고 밝혔다. 양자센싱 관련 국내 첫 현장 실증 사업이다.양자센싱은 미세한 크기의 양자를 검출해 전기신호로 바꾸는 기술로, 가스센싱·자율주행 등 다양한 분야에서 미세한 빛을 측정하는 기술에 활용될 수 있다.김동만 퀀텀센싱 대표이사(왼쪽부터)와 김봉진 보령 LNG터미널 대표이사, 하민용 SK텔레콤 최고사업개발책임자가 협약 기념 촬영을 하고 있다. (SK텔레콤 제공) 2022.9.20/뉴스1        SK텔레콤은 대형 가스 시설물에서 유출 사고를 실시간으로 파악할 수 있는 양자(퀀텀) 기반의 가스센싱 시스템을 충남 보령 LNG(액화천연가스) 터미널에서 현장 실증한다고 20일 밝혔다.이날 SKT에 따르면 SKT와 보령 LNG 터미널, 퀀텀센싱 등 3사는 보령의 LNG 저장탱크에 양자가스센싱 시스템을 설치·적용하기로 하는 업무협약을 체결했다. ‘양자센싱’은 미세한 크기의 양자를 검출해 이를 전기신호로 바꾸는 기술로, 가스센싱∙자율주행 등 다양한 첨단 분야에서 미세한 빛을 측정하는 기술에 광범위하게 활용될 수 있다.SKT는 올해 4분기 중 현장 환경 실사를 통해 양자가스센싱 시스템 설치를 위한 최적 요건을 산정하고, 내년에 시스템을 설치 및 적용한다. 국내에서 이 시스템을 실증하는 사례는 SKT가 처음이다.SKT에 따르면 현재 대형 가스 시설물의 관제를 위해서는 ‘화학반응식 가스 탐지 방식’ 또는 ‘적외선 기반 방식’을 주로 이용한다. 기존 방식은 건물 외부에 탐지기를 설치하면 바람의 영향으로 감지 능력이 떨어지거나, 탐지거리가 짧고 가스 농도 측정은 어려웠다. 반면 양자가스센싱은 가스의 농도와 부피, 누출 형상 등 다양한 정보를 파악할 수 있어 가스가 누출된 지점부터 확산 방향까지 실시간 모니터링할 수 있다.이번 실증사업은 양자 산업이 양자센싱이라는 새로운 분야로 확장된다는 의미가 있다고 SKT는 설명했다. 지금까지는 주로 통신보안 분야에서 양자의 특성을 활용한 QKD(양자키분배기)와 QRNG(양자난수생성기) 기술이 사용됐다.SKT에서 지난해 분사한 SK스퀘어의 자회사 IDQ는 실증사업에 양자가스센서의 레이저 수신부에 해당하는 핵심 부품인 단일광자검출기 ‘아이디큐브’(ID Qube)를 공급한다.하민용 SKT CDO(최고사업개발책임자)는 “앞으로 가스 생산기지 및 가스누출 위험이 있는 다양한 사이트로 확대 적용하고, 각종 환경 가스 누출을 검출하는 환경 분야로 확장할 것”이라고 말했다.",105,https://n.news.naver.com/mnews/article/366/0000841836?sid=103
