title,date,main,section,url
"KAIST, 호르몬 조절 수용체 구조와 작용 메커니즘 규명",2022.05.06. 오전 10:11,"호르몬 분비 이상으로 생기는 말단비대증, 신경 뇌분비 종양, 뇌 기능    관련 신약 개발 기대KAIST(총장 이광형)는 생명과학과 송지준 교수 연구팀이 초저온 전자 현미경을 이용, 호르몬 조절 물질인 소마토스타틴과 그 수용체인 소마토스타틴 리셉터 2(SSTR2) 복합체의 3차원 원자 해상도 구조를 규명해 호르몬 조절 메커니즘을 규명했다고 6일 밝혔다.소마토스타틴은 성장호르몬의 분비를 억제하는 작용이 있는 호르몬이다. 내장과 뇌에 관련된 호르몬이며, 호르몬 분비 조절과 세포의 증식, 뇌 신경 물질 전달에 관여한다.송 교수 연구팀은 연세대학교 이원태 교수 연구팀, 피씨지-바이오텍 연구팀과의 공동연구를 통해, 소마토스타틴과 결합해 다양한 호르몬의 분비를 억제하는 SSTR2 복합체 구조를 3차원 원자 해상도로 초저온 전자현미경을 이용해 규명했다. 이를 통해 소마토스타틴이 SSTR2를 통해 호르몬 분비를 억제하는 메커니즘을 규명했다.



성장호르몬 억제 호르몬인 소마토스타틴(SST-14)과 그 수용체 (SSTR2) 복합체의 초저온 전자현미경 구조. 소마토스타틴의 수용체가 소마토스타틴(SST-14)의 트립토판-라이신(붉은색)을 인식한다. (자료=KAIST)소마토스타틴 수용체의 작용 메커니즘을 이용해 말단비대증, 신경뇌분비 종양의 제어 및 뇌기능을 향상할 수 있는 물질 개발에 이용될 수 있을 것으로 기대된다.SSTR2은 세포막에 있는 막 단백질로, 세포 밖의 소마토스타틴을 신호로 인식해 세포 내로 전달하는 역할을 한다. 최근 KAIST 생명과학과 이승희 교수 연구팀에서도 소마토스타틴이 인지기능 향상에 기여한다는 것을 밝힌 바 있다. 그러나 소마토스타틴이 세포막에 존재하는 수용체와 결합하는 자세한 메커니즘이나 신약 개발에 필수적인 역할을 하는 3차원 원자구조는 알려지지 않았다.연구팀은 초저온 전자현미경으로 소마토스타틴이 결합된 SSTR2 복합체의 원자 3차원 구조를 규명했다. 이를 바탕으로 소마토스타틴과 결합하는데 중요한 아미노산들을 발견하고, 이들의 기능을 세포 내에서 확인했다.또 연구팀은 딥마인드가 단백질 구조예측을 위해 개발한 인공지능 프로그램 '알파폴드'를 이용해 소마토스타틴 수용체의 이성질 형태인 SSTR1, SSTR3, SSTR4, SSTR5의 구조를 예측, 이성질 형태 각각의 소마토스타틴 결합 메커니즘을 밝혀냈다. 이성질 형태란 같은 분자식을 갖는 화합물이지만 분자 구조가 다른 형태를 말한다.이번 연구는 한국연구재단 바이오-의료기술개발사업의 지원을 받아 수행됐으며, 학술지 'e라이프(eLife)'에 최근 게재됐다.",105,https://n.news.naver.com/mnews/article/092/0002256005?sid=103
"아이폰14, '한방 없던' 전작과 달리 애플표 '혁신' 보여줄까",2022.05.06. 오전 12:01,"올해 9월경 출시 예정…업계 ""국내서 삼성 GOS 논란 '반사이익' 볼 수도""



애플이 올해 9월경 내놓을 플래그십 스마트폰 '아이폰14'에 대한 관심이 높아지고 있다. 사진은 아이폰14 렌더링 이미지. /트위터 애플허브 캡처오는 9월 출시가 점쳐지는 애플의 신형 플래그십 스마트폰 '아이폰14'에 관심이 쏠린다. 최근 선보인 '아이폰SE 3세대'를 두고 '혁신이 없다'는 안팎의 아쉬운 평가가 잇따랐던 가운데, '아이폰14' 시리즈가 '아이폰 마이나'들의 마음을 빼앗을 혁신을 통해 올해 스마트폰 판매 실적을 견인할 수 있을지 이목이 집중된다.6일 업계에 따르면 '아이폰14' 시리즈의 경우 전작과 달리 일반·프로·맥스·프로맥스 4종으로 구성되는 것으로 알려졌다. 화면이 가장 작은 모델인 '미니'는 단종될 것으로 보인다. '아이폰14' 및 '아이폰14 프로'(이상 6.1형), '아이폰14 맥스'와 '아이폰14 프로맥스'(이상 6.7형) 총 4종으로 구성될 예정이다.맥루머스 등 주요 외신에 따르면 '아이폰14' 색상은 일부 재편될 예정으로, 아이폰12에서 인기를 끌었던 '퍼플' 색상이 추가될 가능성이 높다. 보도에 따르면 '아이폰14' 기본 라인업은 △블랙 △화이트 △블루 △레드 △퍼플 등 5가지 색상으로, 프로 라인업은 △그래파이트 △골드 △실버 △퍼플 등 4가지로 구성된다.맥루머스는 ""애플은 지난해 '아이폰12'에 퍼플 색상을 추가하면서 소비자들에게 긍정적인 반응을 얻었다""며 애플이 이번 '아이폰14'에서도 '컬러 마케팅'에 나설 것으로 내다봤다.'아이폰14' 시리즈 디자인의 가장 큰 차별화 포인트는 전면 디스플레이에 카메라 구멍이 뚫려있는 원형, 타원형 펀치홀(구멍)이 될 것으로 보인다. 아이폰 시리즈 최초로 'M자 탈모'로 불린 특유의 '노치' 디자인이 사라질 전망이다. 원형 펀치홀에는 페이스 ID 도트 프로젝터가 포함되며 알약 모양에는 전면 카메라와 페이스 ID 적외선 카메라 등이 탑재될 것으로 알려졌다.



업계에선 GOS 논란으로 곤욕을 치르고 있는 삼성전자로 아이폰14가 반사이익을 얻을 수 있다고 전망했다. /더팩트 DB이외에도 상위 모델과 일반 모델의 차별점은 커질 것으로 보인다. '아이폰14 프로' 제품군에는 AP로 A16 바이오닉 칩을 탑재할 전망이다. 하위 모델에는 '아이폰13' 시리즈, '아이폰SE3'과 마찬가지로 A15 바이오닉칩을 장착할 것으로 예상된다.'아이폰14 프로' 라인의 경우 카메라 화소가 높아짐에 따라 후면 카메라가 두꺼워질 전망이다. '아이폰14 프로'와 '프로맥스'는 전작보다 4배 높은 4800만 화소의 카메라를 채택할 것으로 보인다. '아이폰13 프로'와 '프로맥스'의 경우 1200만 화소의 카메라가 탑재된 바 있다.이에 따라 카메라 모듈 두께는 전작(3.6mm)보다 두꺼워진 4.17mm로, '카툭튀'가 보다 심해질 것으로 보인다.업계에선 '아이폰SE3'가 기대 이상의 호응을 얻지 못한 만큼 하반기 출시될 '아이폰14'의 역할이 그 어느 때보다 중요하다고 보고 있다. 실제 지난해 글로벌 스마트폰 시장에서 가장 많이 팔린 스마트폰 1~5위에 아이폰 시리즈가 이름을 올리기도 했다.스마트폰 시장에서는 올해 삼성전자 '갤럭시' 시리즈의 '게임옵티마이징서비스(GOS)' 논란이  '아이폰14' 시리즈의 한국 시장 공략에 호재로 작용할 수 있다는 해석도 나온다. 직접 경쟁을 벌이는 삼성전자 갤럭시 촤상위급 모델의 이미지 훼손이 불가피해진만큼 갤럭시 충성 고객들의 이탈이 현실화할 수 있다는 것이다. 삼성전자는 발열과 지나친 배터리 소모를 방지하기 위해 GOS 기능을 '갤럭시S22' 시리즈에 의무화했지만, 성능 저하로 고객들 불만이 팽배해진 바 있다.업계 한 관계자는 ""최상위 '갤럭시S' 시리즈에 관해 '성능이 좋지 않다'는 인식이 확산하면서 국내는 물론 글로벌 시장에서까지 연쇄적으로 (갤럭시) 전체 라인업에 부정적인 영향이 미칠 가능성이 커졌다""라며 ""무엇보다 기존 갤럭시 고객들이 '아이폰14'로 눈을 돌리게 된다면 시장 점유율 판도 변화도 지금과 달라질 것""이라고 말했다. 발로 뛰는 더팩트는 24시간 여러분의 제보를 기다립니다.▶카카오톡: '더팩트제보' 검색▶이메일: jebo@tf.co.kr▶뉴스 홈페이지: http://talk.tf.co.kr/bbs/report/write",105,https://n.news.naver.com/mnews/article/629/0000147706?sid=103
,,,105,https://n.news.naver.com/mnews/article/236/0000223575?sid=103
"위메이드, 신작 '미르M: 뱅가드 앤 배가본드' 사전 테스트 시작",2022.05.06. 오전 10:38,"위메이드 '미르M: 뱅가드 앤 배가본드' 사전 테스트 시작(위메이드 제공)© 뉴스1(서울=뉴스1) 이정후 기자 = 위메이드는 신작 모바일 게임 '미르M: 뱅가드 앤 배가본드'(미르M)의 사전 테스트를 오는 19일부터 4일간 진행한다고 6일 밝혔다.위메이드는 이번 사전 테스트를 통해 게임 완성도를 높이고 재미와 밸런스, 서비스 안정성 등 게임의 전반적인 부분을 점검할 예정이다.미르M은 다중접속역할수행게임(MMORPG)으로 8방향 그리드와 쿼터뷰 방식을 적용했다. 언리얼 엔진을 활용해 고품질 그래픽을 선보일 예정이며 모바일과 PC에서 모두 이용할 수 있는 크로스 플레이를 지원한다.위메이드 측은 ""이번 테스트는 미르M 개발 과정에서 처음으로 이용자들에게 선보이는 것""이라며 ""그동안 브랜드 사이트와 공식 유튜브 채널을 통해 선보였던 다양한 콘텐츠를 사전 테스트에서 직접 경험할 수 있을 것""이라고 밝혔다.",105,https://n.news.naver.com/mnews/article/421/0006075021?sid=103
"쿠팡플레이, 미국 축구리그 MLS 독점 생중계",2022.05.06. 오전 8:55,"치차리토·세르단 샤키리 등 스타 선수들의 화려한 플레이쿠팡플레이가 국내 축구팬들에게 유럽리그 출신 스타 축구선수들의 무대이자 미국 최상위 프로축구 리그인 메이저리그사커(이하 MLS)를 독점 생중계 서비스한다.쿠팡플레이는8일부터 MLS의 2022-2023 시즌 경기들을 디지털 독점 라이브 중계한다. 이에 MLS 라운드별 2~3경기를 쿠팡플레이에서 만나볼 수 있으며, 특히 리그 최고 명문팀 LA 갤럭시의 경기는 매주 고정 편성될 예정이다.이번 시즌 MLS에는 치차리토, 세르단 샤키리, 카를로스 벨라, 알렉산드레 파투, 더글라스 코스타 등 많은 스타 플레이어가 뛰고 있다.



MLS쿠팡플레이는 MLS 경기뿐만 아니라 축구 국가대표팀 해외파 선수인 손흥민(토트넘 홋스퍼 FC), 이강인(레알 마요르카), 황의조(FC 지롱댕 드 보르도), 김민재(페네르바체 SK)의 소속팀 경기를 디지털 생중계하는 유일한 플랫폼이다. 또 쿠팡플레이는 한국프로축구연맹과 파트너십을 체결해 오는 5월 5일부터 K리그 전 경기 생중계를 시작한다.올 여름 7월 쿠팡플레이는 '쿠팡플레이 시리즈'를 통해 토트넘 홋스퍼를 한국에 초대하고, 오는 7월 13일 팀 K리그를 상대로 열리는 첫 경기는 오직 쿠팡플레이에서만 라이브로 볼 수 있다.쿠팡플레이는 쿠팡 와우 회원에게 제공되는 동영상 스트리밍 서비스다. 쿠팡플레이는 모바일, 태블릿, PC웹사이트뿐만 아니라 스마트 TV에서도 즐길 수 있어 큰 TV화면으로 실시간 스포츠경기를 생생하게 관전할 수 있다.",105,https://n.news.naver.com/mnews/article/092/0002255978?sid=103
"펄어비스, 게임으로 우리 문화유산 세계에 알린다",2022.05.06. 오후 2:22,"우리 문화유산의 콘텐츠화, 가치 알리기 등



허진영 펄어비스 대표(오른쪽)와 김현모 문화재청장이 서울 경복궁 홍복전에서 '게임을 통한 문화유산 콘텐츠 보급 확산'을 위한 MOU를 체결한 모습.ⓒ펄어비스[데일리안 = 최은수 기자] 펄어비스는 문화재청과 ‘게임을 통한 문화유산 콘텐츠 보급 확산’을 위한 업무 협약(MOU)을 체결했다고 6일 밝혔다.양사는 문화유산과 관련된 각종 정보나 데이터를 소재로한 게임을 국내외에 개발•보급하는 등 우리 문화유산의 가치를 이해하고 관심을 높이는데 필요한 협업을 진행할 계획이다.펄어비스의 게임 개발 역량을 기반으로 해외 이용자들이 자연스럽게 우리 문화유산을 경험할 수 있도록 ▲문화유산의 콘텐츠화 ▲문화유산 디지털화 및 공동활용 ▲문화유산 가치 홍보 등을 협업하기로 했다. 또한 문화재청 및 한국문화유산활용단체연합회와 다양한 사회공헌도 함께할 예정이다.펄어비스는 게임을 통한 우리 문화 및 문화유산을 널리 알리는데 적극 나서고 있다. 지난해 12월 ‘게임 한류 확산’을 위한 한국관광공사와 업무 협약을, 같은달 ‘대한민국 문화유산 가치 제고’를 위해 국립박물관문화재단과 업무 협약을 맺은 바 있다.",105,https://n.news.naver.com/mnews/article/119/0002601475?sid=103
남극 빙하 밑 퇴적층이 스펀지처럼 거대한 지하수 머금어,2022.05.06. 오후 3:11,"고대 바다 진흙·모래로 형성…빙하 유실에 중요한 작용   



윌런스 빙하류에서 자기지전류탐사로 지하수를 확인 중인 연구팀[Kerry Key/Lamont-Doherty Earth Observatory 제공/ 재판매 및 DB 금지] photo@yna.co.kr(서울=연합뉴스) 엄남석 기자 = 남극대륙 서(西)남극의 빙상 아래서 퇴적층이 거대한 스펀지처럼 엄청난 양의 지하수를 머금고 있는 것이 확인됐다.     빙하가 빠르게 흐르는 '윌런스 빙하류'(ice stream) 아래서 포착된 이 지하수 시스템은 수백 미터 깊이에 달하며 남극대륙 내 다른 곳에도 존재할 것으로 추정돼, 지구온난화 시대 남극의 얼음과 지구의 미래에 중요한 작용을 할 수 있는 것으로 제시됐다.     미국 컬럼비아대학과 BBC뉴스 등에 따르면 '스크립스 해양연구소'의 클로에 구스타프슨 박사가 이끄는 연구팀은 서남극 윌런스 빙하류에서 6주에 걸쳐 '자기지전류탐사(磁氣地電流探査)로 얼음 밑의 지하수를 파악한 결과를 과학저널 '사이언스'(Science)에 발표했다.     자기지전류탐사는 전자기장 변화를 분석해 깊이 묻혀있는 물질을 파악하는데, 얼음이나 기반암, 지하수의 존재는 물론 짠물 여부도 알 수 있다.     남극 빙상 밑 지하수의 존재는 오래 전부터 추정은 돼왔지만 실제 측정을 통해 확인된 것은 이번이 처음이다. 



윌런스 빙하류와 연구팀 이동 지역(황색·적색점). 중앙 하늘색은 윌런스 빙저호. [Chloe Gustafson 제공/ 재판매 및 DB 금지] photo@yna.co.kr윌런스 빙하류는 약 800ｍ 두께의 얼음이 폭 100㎞에 걸쳐 로스 빙붕을 향해 빠르게 흘러내리는 지역으로 2000년대에 위성 관측을 통해 얼음 표면이 수개월에 걸쳐 오르내리는 것을 통해 얼음밑 호수인 빙저호로 물이 흘러들고 나가는 것을 파악한 바 있다.       연구팀은 이번 자기지전류탐사를 통해 빙하의 바닥부터 약 5㎞ 깊이까지 구조를 파악했으며, 빙하류와 기반암 사이에 500∼2천ｍ에 걸쳐 고대 바다의 진흙과 모래로 된 공극이 있는 퇴적층이 존재하는 것을 확인했다.      이 퇴적층의 공극은 약 5천∼7천년 전의 짠 바닷물을 머금고 있지만 상층부는 빙하 밑에서 얼음의 압력과 마찰로 생성된 민물이 스며들며 혼합돼 지하수 시스템을 형성하고 있는 것으로 분석했다.      컬럼비아대학 '라몬-도허티 지구관측소' 대학원생으로 연구에 참여한 구스타프슨 박사는 ""퇴적층은 거대한 스펀지처럼 생각되는데, 약 100㎢에 걸쳐 퇴적층이 머금고 있는 물을 모두 짜내 지상 위에 채운다면 약 220ｍ에서 820ｍ 깊이에 달할 것""이라고 했다.     그러면서 ""엠파이어스테이트 빌딩(440ｍ) 높이와 비교한다면 비교적 얕은 서쪽 지역은 빌딩의 절반 정도, 깊은 곳은 빌딩 두 개를 잠기게 할 수 있다""고 했다.     윌런스 빙저호 깊이가 2∼15ｍ로 엠파이어스테이트 빌딩으로 따지면 1∼4층에 불과하다.     연구팀은 지구온난화 및 해수면 상승과 관련해 빙하 밑 지하수 발견이 갖는 의미를 이해하는 데는 더 많은 연구가 필요한 것으로 지적했다.     연구팀은 빙하에서 나온 물이 퇴적층으로 스며들면 빙하 밑에 물이 고여 윤활 작용을 하는 것을 막아 빙하가 바다로 밀려내려가는 것을 늦춰주는 제동장치 역할을 할 수도 있는 것으로 분석했다.     하지만 빙하의 두께가 얇다면 이에 따른 압력이 줄어들며 퇴적층의 물이 스며나와 윤활 작용을 함으로써 빙하가 흘러내리는 속도를 올리는 반대 현상도 나타날 수 있는 것으로 지적됐다.     연구팀은 남극의 빙하가 해수면을 57ｍ까지 높일 수 있는 잠재력을 갖고 있어 빙하가 바다로 흘러내리는 것을 통제하는 모든 과정을 종합적으로 고려할 필요가 있다고 강조하면서, 현재 관련 모델은 빙하 밑 지하수의 역할이 반영되지 않은 상태라고 했다.       eomns@yna.co.kr",105,https://n.news.naver.com/mnews/article/001/0013161324?sid=103
"기아, 인도 판매점에 '그린' 입힌다…태양광 패널 설치·폐수 재사용",2023.10.26. 오전 9:10,"손명식 기아 인도 판매실장(오른쪽 6번째), 하딥 싱 브라르(Hardeep Singh Brar) 기아 인도 판매 마케팅 담당(오른쪽 7번째) 등 관계자들이 그린 워크숍 프로그램 행사에서 기념 촬영하고 있는 모습(기아 제공)(서울=뉴스1) 금준혁 기자 = 기아(000270)는 26일 인도에서 '그린 워크숍' 프로그램을 현지 판매거점에 적용한다고 밝혔다.그린 워크숍은 해외 판매거점을 친환경적 공간으로 개선하는 프로그램이다. 인도 하리야나주 로탁 시의 란시 기아 판매점에서 그린 워크숍 프로그램을 처음으로 시행했다. 건물 옥상에 태양광 패널을 설치해 최대 80%까지 전력 소비량을 줄이고 태양광으로 충전되는 전기차충전 시설도 마련했다. 빗물 수거장치로 지하수 고갈을 막고 폐수 처리 장치로 세차에 쓴 폐수도 재사용한다. 이외에도 스팀 세차장, 자연 조명 시스템 등이 적용됐다.기아는 2026년까지 인도 내 150곳 이상의 판매거점에 적용하고 글로벌 거점으로도 확장할 예정이다.",105,https://n.news.naver.com/mnews/article/421/0007134323?sid=103
"[코인뉴스] 비트코인, 1억 간다더니 4700만도 위태…하락장 언제까지",2022.05.06. 오후 3:51,"나스닥 폭락에 시세 붕괴…‘공포’ 분위기 지속



서울 서초구 빗썸 고객센터에서 관계자가 시세를 확인하고 있다.ⓒ뉴시스[데일리안 = 이건엄 기자] 하루 만에 폭락한 비트코인이 4700만원마저 위태로운 상태에 놓이면서 투자자들의 불안감이 고조되고 있다. 약세장이 지속되며 추가하락에 대한 공포가 시장 전반에 팽배하기 때문이다.6일 암호화폐 거래소 업비트에 따르면 이날 오후 2시 30분 기준 1비트코인은 4714만2000원으로 전날 대비 1.1% 하락했다. 빗썸에서는 4.5% 급락한 4702만1000원을 기록 중이다. 암호화폐는 주식과 달리 거래소 단위로 거래 가격이 매겨지기 때문에 같은 종류의 가상화폐라도 거래소에 따라 가격에 다소 차이가 있다.비트코인은 뉴욕 증시 하락 영향에서 좀처럼 벗어나지 못하면서 약세장이 지속되고 있다. 특히 동조화 현상이 심화된 나스닥 지수가 5% 이상 급락하며 비트코인 시장에도 악영향을 미치고 있다.나스닥 지수는 전장보다 647.16포인트(4.99%) 급락한 12,317.69에 마감했다. 이는 지난 2020년 11월30일 이후 17개월여 만의 최저치다. 한때 나스닥 지수는 장중 12,183.56까지 떨어지기도 했다.실제 업비트 운영사 두나무가 제공하는 디지털자산지수에 따르면 같은시간 ‘공포-탐욕’ 지수는 39.93으로 공포 국면에 돌입했다. 암호화폐 투자심리를 나타내는 공포·탐욕지수는 0에 가까울수록 투자자들의 공포 심리가 높다는 뜻으로 통상 코인 시장이 위축됐다는 것을 의미한다.반대로 100에 가까울 경우 투자자들의 기대 심리가 반영돼 시장이 활기를 띤다는 것으로 탐욕 상태로 본다. 0~40은 공포, 40~59는 중립, 60~100은 탐욕으로 구분된다.한편 알트코인 대장주 이더리움은 업비트와 빗썸에서 각각 355만2000원, 354만5000원을 기록 중이다. 이는 전날 대비 0.7%, 2.7% 하락한 것이다.",105,https://n.news.naver.com/mnews/article/119/0002601517?sid=103
"트리니티소프트, 'ICT 중기보안솔루션 도입 지원사업' 공급기업에 선정",2022.05.06. 오전 10:31,"SW개발보안 전문기업 트리니티소프트(대표 김진수)는 과학기술정보통신부와 한국인터넷진흥원(KISA)이 주관하는 'ICT 중소기업 정보보호 지원사업'의 공급기업으로 선정됐다고 6일 밝혔다.이번 지원사업은 일정 규모의 ICT 인프라를 보유한 전국 중소기업 600개사 대상으로 정보보호 컨설팅 기반 보안솔루션 지원을 통해 기업 자체적인 정보보호 체계 구축과 투자 기반을 지원해준다. 업체 당 컨설팅 부문 최대 500만원, 보안솔루션 부문 최대 540만원까지 지원해준다.트리니티소프트는 SW개발보안 솔루션 '코드레이 엑스지(CODE-RAY XG)'를 중소기업에 제공한다. SW 개발공정(SDLC)단계에서 발생 가능한 소스코드 보안약점을 체계적으로 관리할 수 있는 차세대 소스코드 보안약점 분석도구이다.또, '코드레이 엑스지'는 CC인증과 GS인증, CSAP 인증, 전자정부표준프레임워크 호환성 확인서를 통해 제품의 우수성과 안정성을 인증 받았다. 대표적으로 SK C&C, 제주항공, 한국사회보장정보원, 한국지역난방공사, 호서대학교, 대림대학교, 애큐온저축은행, 사이버사령부 등 다수의 레퍼런스를 확보하고 있다.김진수 트리니티소프트 대표는 “이번 지원사업을 통해 정보보호 전문 서비스나 보안 솔루션에 투자할 여력이 부족했던 보안 사각지대에 있는 중소기업에 경제적 부담 해소와 사이버 침해 사고를 예방 등 도움을 줄 수 있는 좋은 기회가 될 것”이라고 전했다.'ICT 중소기업 정보보호 지원 사업' 신청 기간은 이달 2일부터 오는 10월 말까지 선착순 마감이다. 신청 방법과 자세한 내용은 KISA의 지역정보보호센터 누리집을 통해 확인할 수 있다.",105,https://n.news.naver.com/mnews/article/030/0003015086?sid=103
