title,date,main,section,url
아리랑 위성 부품 고장…대러 제재로 위성 교체도 미뤄져,2022.10.23. 오후 2:17,"핵심요약국회 과학기술정보통신위원회 소속 더불어민주당 박완주 의원이 과기정통부로부터 받은 자료에 따르면 현재 운용중인 아리랑 위성 3호와 3A호, 5호 위성 모두 일부 부품에서 오류가 발생해 대체 부품을 사용하고 있다.



다목적실용위성5호(아리랑5호). 연합뉴스현재 운용중인 아리랑 위성의 일부 부품이 고장나 대체 부품을 사용하고 있는 것으로 확인됐다.국회 과학기술정보통신위원회 소속 더불어민주당 박완주 의원이 과학기술정보통신부로부터 받은 '인공위성 에러 발생 현황'에 따르면 현재 운용중인 아리랑 위성 3호와 3A호, 5호 위성 모두 일부 부품에서 오류가 발생해 대체 부품을 사용하고 있다.3호는 X-Band(탑재체 데이터) 송신기, S-Band(관제) 수신기, 전력분배 장치의 주 부품이 고장나 대체 부품을 사용하고 있다.3A호는 S-Band(관제) 업 링크, 전력분배 장치 부품을 대체 부품으로 사용하고 있으며, S-Band 다운 링크 부품에서도 일부 오류가 나타나 모니터링 중이다.5호는 S-Band 수신기의 주 부품에서 오류가 발생해 역시 대체 부품을 사용하고 있다.아리랑 위성은 주 부품이 고장나도 대체 부품으로 전환할 수 있도록 이중화돼 있어 현재 기능 수행에는 문제가 없다.과기정통부는 ""다목적 실용위성은 고신뢰도 부품을 사용했고 주요 부품을 이중화해 제작했으며 운영 시에도 지속해서 모니터링하며 임무를 수행하고 있다""며 ""향후 고장으로 인한 관측 공백 등의 발생 가능성은 작다고 보고 있다""고 말했다.한편 박 의원은 러시아가 우크라이나 침공으로 국제적 제재를 받고 있어 아리랑 위성 6호 발사가 지연되면서 위성들의 교체시기도 미뤄지고 있다고 우려했다.아리랑 위성6호는 당초 올해 말에 러시아 플레세츠크 우주기지에서 발사될 예정이었지만 대러 제재로 발사가 연기됐고, 이에 따라 올해 아리랑 5호를 6호로 교체하려던 계획이 미뤄졌다.이밖에 당초 지난해 하반기에 발사하려던 아리랑7호 위성 부품 제작 결함과 코로나 사태 등으로 발사 시기가 내년 하반기로 미뤄지는 등 위성 교체 작업에 차질이 빚어지고 있다.※CBS노컷뉴스는 여러분의 제보로 함께 세상을 바꿉니다. 각종 비리와 부당대우, 사건사고와 미담 등 모든 얘깃거리를 알려주세요.이메일 : jebo@cbs.co.kr카카오톡 : @노컷뉴스사이트 : https://url.kr/b71afn",105,https://n.news.naver.com/mnews/article/079/0003698769?sid=103
"""2년간 목말랐다"" 첫 '가디언테일즈' 연주회, 팬들도 예상 못한 흥행",2022.10.23. 오전 8:50,"22일 열린 오케스트라 '심포니 테일즈'…게임 서사에 충실 구성



2층에서 내려다 본 공연 전경



공연 시작 전부터 관람객들이 굿즈를 사기 위해 줄을 서 있다. 이날 굿즈 및 CD 판매는 오후 3시부터 공연 시작 15분 전인 5시 45분까지 진행됐으나 대부분 그 전에 품절됐다.모바일 게임 '가디언 테일즈' 팬들이 '음악'으로 한자리에 모였다. 2020년 출시 이후 거리두기가 끝나고 열린 첫 대규모 현장 행사인 만큼 관람객들은 이날 내내 설렘을 드러냈다.지난 22일 '가디언 테일즈' 배경음악으로 구성한 오케스트라 공연 '심포니 테일즈'가 삼성동 코엑스 오디토리움에서 카카오게임즈와 콩스튜디오 주최로 열렸다. 연주는 게임음악 업체 '플래직'에서 맡았다.공연은 오후 6시 예정이었으나 4시간 전인 2시쯤부터 공연장 앞은 굿즈와 게임 OST CD를 사려는 줄로 가득했다. 앞서 이번 공연은 지난 11일 예매 개시 약 5분 만에 1천80석 규모 전 좌석이 매진된 바 있다.이날 만난 관람객들은 대부분 2년 이상 가디언 테일즈를 플레이한 장기 이용자였다. 출시 초기부터 꾸준히 게임을 지켜봐 온 만큼 애정도 남달랐지만, 이 정도의 반응까지는 예상치 못했다고 했다.굿즈 판매 시작 시각인 3시 전에 도착했지만 1시간 넘게 줄을 섰다는 한 방문객은 ""스테이지마다 탐험 배경에 맞춘 배경음이 무척 좋고 음악 퀄리티에 대해선 대부분이 공감할 것""이라면서도 ""이렇게 줄이 길 줄은 예상하지 못했다""고 말했다.다른 관람객은 ""새벽부터 굿즈를 사기 위해 줄 서는 '원신'처럼 익히 팬이 많은 게임이라면 몰라도, 솔직히 '얼마나 왔겠어'라고 생각했는데 보다시피 줄이 정말 길다""면서 ""비용을 따져보면 게임사가 수익을 내려는 행사는 아니고 이용자들을 위한 투자 차원이라고 생각하는데, 팬들을 위한 오프라인 이벤트를 적극적으로 하려는 시도는 좋은 것 같다""고 언급했다.그는 3시 반에 도착해 1시간을 기다렸지만 바로 앞에서 CD가 품절됐다며, 대신 '길드원'들에게 나눠줄 피규어를 구매했다고 덧붙였다.



공연 전경 ◆ 꽉 찬 '서사' 인상적, 과한 화려함은 아쉬워이날 공연은 게임 음악의 짧은 호흡으로도 쉴 틈 없이 120분을 꽉 채웠다. 초반 게임 효과음에, 연주단과 사회자가 정비하는 순간마다 '게임 로딩(Now Loading)' 화면으로 시선을 잡는 센스도 놓치지 않았다.가디언 테일즈의 강점은 꽉 찬 '스토리'다. 점령당한 왕국을 구하려는 가디언들의 판타지 모험 역할수행게임(RPG)이라는 콘셉트가 얼핏 밝고 단순해 보일 수 있지만, 게임이 진행될수록 입체적이고 서정적이며 때로는 비극적인 장면이 계속 등장한다.이번 공연 역시 기승전결이 있는 '서사'에 초점을 맞췄다. '모험의 시작', '순조로운 여정', '기록되지 않은 세계', '재회', '더 넓은 세계로' 등 5개 주제 순서에 맞는 연주들이 이어졌다.연주단 뒤 배경 화면에서도 서사에 맞춘 인게임 영상이 내내 펼쳐졌다. 초반 테마에서는 모험을 시작하는 초반 가디언이, 중간부터는 영웅들에 이어 선택지에 따른 갈등에 놓인 '공주'의 게임 화면 모습이 나타났다.다만 이러한 화면들이 너무 짧고 화려하게 전환되면서 연주 자체의 집중을 방해했다는 점은 아쉬웠다. 가령 '던전 킹덤(Dungeun Kingdom)'에서는 영웅 '크레이그'를 중심으로 어둡고 새빨간 화면을 발사하고, 바로 이어지는 다음 음악 '마운틴 시버링(Mt. Shivering)에서는 흰 설산으로 공연장 내부가 갑자기 밝아졌다. 무대 조명 역시 너무 세서 시각적 피로감이 없지 않았다.그럼에도 관람객들은 게임에서 즐겼던 요소를 웅장한 음악으로 직접 보고 들으며 감동을 느꼈다고 입을 모았다. 무대를 마치고 문을 나선 한 이용자는 ""성악가분이 노래 부를 때 나온 영상에서 게임 내 '세실(길거리 가수)'을 떠올렸다""면서 ""초반에 플레이했던, 내가 사랑하는 캐릭터들이 음악과 함께 나오니까 예전 기억이 되살아나 너무 즐거웠다""고 소감을 전했다.",105,https://n.news.naver.com/mnews/article/031/0000704884?sid=103
"ICT기업, 年44조 재난안전시장 뛰어든다",2022.10.23. 오후 5:54,"카카오·SPC 등 산재 잇따르자첨단기술 접목 재난예방 '주목'KT, HDC랩스와 건설현장 협업LGU+는 근로자에 IoT 장비 보급[서울경제] 카카오 먹통 사태부터 SPC 사망 사건 등 연이은 산업 재해에 정보통신기술(ICT) 기업들의 재난 예방 사업이 시장의 관심을 받고 있다. 중대재해처벌법 시행 등으로 기업의 재해 예방과 대응이 어느 때보다 중요해졌기 때문이다. ICT 기업들 역시 5세대 이동통신(5G)·사물인터넷(IoT)·메타버스 등의 첨단 기술을 접목하며 연간 44조원에 달하는 재난안전사업 시장 선점을 위해 발빠르게 나서고 있다.



23일 업계에 따르면 최근 행정안전부가 개최한 ‘2022 대한민국 안전산업박람회’에 SK텔레콤·KT·CJ올리브네트웍스·포스코ICT 등 통신사·시스템통합(SI) 기업이 대거 참여했다. 관련 시장의 디지털 전환(DX) 속도가 빨라지고 규모도 커지면서 ICT 기업들이 참여가 늘었다는 분석이다.행정안전부의 ‘2021년 재난안전산업 실태조사’를 보면 2020년 기준 국내 재난안전산업 총 매출은 43조7319억 원, 관련 사업체는 6만4141개에 달한다. ICT 업계는 44조 원에 달하는 이 시장의 디지털화에 나서고 있다.안전 분야의 디지털화는 저지연·초고속성을 지닌 5G가 기반이다. 산업 현장은 물론 작업자 개개인에 IoT 센서를 부착해 5G로 실시간 추적하고, 위험 상황을 빠르게 파악해 대응할 수 있도록 한다. 네트워크 기술력을 지닌 통신사들이 안전산업 진출에 적극적인 이유다.실제 ICT 기업들은 5G·IoT·메타버스 등을 안전 사업 전면에 내세우고 있다. SK텔레콤은 스마트워치와 센서를 활용한 선박 내 안전관리 솔루션을 선보였다. 저전력 블루투스 센서와 승조원 스마트워치를 연결해 화재·침수·익수자 발생 등 긴급 상황에 초동 조치가 가능하도록 돕고, 화재·온습도 센서로 선박을 실시간 감시하는 기술이다.KT는 최근 가상현실(VR)로 사고를 체험할 수 있는 안전체험교육관을 신설하고 HDC랩스 등과 건설현장 안전을 위한 협업에 나서기도 했다. LG유플러스도 '안전관리DX 서비스' 플랫폼을 운영 중이다. 최근 현대엘리베이터 현장 근로자 전원에게 IoT 안전장구를 보급했고, 구독형 스마트레이더로 안전 상황 감시도 제공한다. 카카오 사태 등 네트워크 재난상황에서 안정적인 망 운용을 위해 삼성전자·아마존웹서비스(AWS)와 백업망도 구성했다.CJ올리브네트웍스는 메타버스를 활용한 안전기술에 집중하고 있다. 스마트글래스·5G를 활용해 현장 작업자와 원격 협업하고, 3D 센서로 도로 위 보행자를 실시간 인식해 자율주행차에 데이터를 제공하는 기술 등이다. 본사가 대규모 산업 현장을 운영하고 있는 포스코ICT도 안전관리 기술 도입에 적극적이다. 포스코ICT는 인공지능(AI) 영상인식 기반 스마트CCTV, 밀폐공간 유해가스를 미리 확인할 수 있는 투척형 가스검지 센서 등을 선보였다. 포스코ICT는 이미 철강·건설·화학 등 120여 현장에 관련 기술을 도입했다.정부도 ICT 기업의 안전관리 사업 진출을 돕고 있다. 과학기술정보통신부는 최근 해군·한국전력·KT 등에 특화망인 이음 5G 허가를 내주며 스마트 안전관리의 제도적 기반을 만들어주기도 했다. ICT 업계 한 관계자는 “재난·재해를 예방하는 데 기술이 큰 도움을 줄 수 있어 관련 기술 개발에 적극적으로 나서고 있다”며 “카카오 먹통 사태로 데이터센터 재난 대응이 강화될 것으로 보이고, 중대재해법 시행으로 작업장 안전 강화 필요성도 높아져 관련 시장이 빠르게 커질 것으로 기대하고 있다”고 전했다.",105,https://n.news.naver.com/mnews/article/011/0004113421?sid=103
"국립과천과학관, 성인 대상 과학 아카데미 운영",2022.10.23. 오후 12:01,"내달 2일부터 한 달간



[이데일리 김국배 기자] 국립과천과학관은 다음 달 2일부터 한 달간 ‘지속가능한 과학적인 삶’을 주제로 ‘성인과학 아카데미’를 운영한다. 시민과학, 예술융합, 현장탐방 분야에서 총 7개 프로그램을 운영할 예정이며, 만 19세 이상 어른은 누구나 참여할 수 있다.시민과학 분야에서는 3주에 걸쳐 교외·도심에 서식하는 새와 그 주변 환경을 관찰하며 다양한 생물과의 공존 방법을 모색한다. 예술 융합 분야에서는 4~ 5주에 걸쳐 재활용(업사이클링) 공예 활동과 물감, 팔레트, 종이를 직접 만들어 그림까지 그려보는 친환경 미술 활동을 수행한다. 현장탐방 분야의 경우 특정 지역과 기관을 방문해 생태탐사, 지질화석탐사, 지속가능 미래탐사를 수행한다.이번 아카데미는 ‘청춘과학대학’, ‘학부모과학아카데미’ 등 기존 성인 교육 과정이 생애주기별 세대 구분에만 집중했던 점과 달리 개인의 취향대로 다양한 주제와 방식을 선택하도록 확대 편성했다. 동시에 과거에 비해 은퇴 후에도 활기찬 삶을 이어가는 신중년을 겨냥한 ‘꽃중년 생태탐사’, ‘꽃중년 지질화석탐사’를 추가 편성했다.이정모 국립과천과학관장은 “이번 성인과학 아카데미에서 준비한 다양한 교육을 통해 자신의 삶 가까이에서 과학을 즐기는 시민참여적 과학문화가 더욱 확대되길 기대한다”고 말했다.",105,https://n.news.naver.com/mnews/article/018/0005347848?sid=103
"""카카오가 뭐여""…디지털 소외 일상인 노인들",2022.10.23. 오전 8:12,"은행 가서 송금…택시 호출·영화 예매는 '언감생심'나이 들수록 불편 커져…""눈높이 맞는 교육 해야""



고령층 스마트폰 이용(PG)    (서울=연합뉴스) 오보람 기자 = ""카카오가 뭐여?""    서울 용산구에 사는 이옥연(83) 씨는 카카오 계열 서비스 먹통 사태로 불편한 점을 묻자 오히려 이렇게 되물었다. 온 국민이 불편을 겪었던 15∼16일에도 그는 평소와 다름없는 이틀을 보냈다. 스마트폰을 아예 쓸 줄 모르는 이씨에게는 카카오 없는 생활이 일상이기 때문이다.    이씨는 공과금을 납부하거나 월세가 입금됐는지 확인하려면 성치 않은 다리를 이끌고 동네 은행을 직접 찾아가야 한다. 매달 병원을 갈 때면 15분이 걸려 큰길까지 나가서야 택시를 잡을 수 있다. 젊은이들이라면 스마트폰으로 손쉽게 해결할 일들이다.    최근 벌어진 카카오 오류 사태로 노인들의 '디지털 소외' 현상이 재조명되고 있다. 젊은 세대가 단 며칠간 경험한 불편을 이들은 매일같이 겪는다는 사실을 돌아보게 했다.    김영수(84) 씨는 21일 오후 서울의 한 대학병원 앞에서 아내와 함께 하염없이 택시를 기다리고 있었다. 부부의 앞을 지나가는 택시는 모두 '예약' 등이 켜져 있거나 승객이 탄 상태였다.    김씨는 ""요즘은 콜택시도 잘 안 오고 병원 앞에 대기하는 택시도 잘 없어서 10분 넘게 노상에서 기다려야 한다""며 ""젊은이들이 척척 택시 잡는 것을 보면 부럽다는 생각도 들지만 (스마트폰이) 없거니와 쓸 줄도 모르니 어쩌겠느냐""고 했다.



카카오톡 장애[연합뉴스 자료 사진]    종로구 낙원상가 인근에서 만난 신영남(81) 씨 역시 스마트폰을 써본 적이 없다고 했다.    신씨는 ""평생 이렇게 살아와서 큰 불편은 없다""면서도 ""기차표를 예매할 때나 돈을 부쳐야 할 때 직접 역과 은행에 가야 하는데 나이가 들수록 힘이 들고 지친다""며 호소했다.    과학기술정보통신부의 '2021 디지털 정보격차 실태조사'에 따르면 70대 이상 고령층의 스마트기기 보유율은 63.2%로, 전체 국민 보유율(93.5%)보다 크게 낮았다.    스마트폰을 보유했더라도 제대로 사용할 줄 아는 노인은 매우 적었다.    70대 이상 고령층의 디지털 정보화 활용 수준은 100점 만점에 43.3점에 불과했고 역량 수준도 22.4점에 그쳤다. 각각 77.6점, 63.8점을 기록한 전체 조사 대상자 평균보다 현저히 떨어진다.    마포구에 사는 주부 김모(73) 씨도 스마트폰을 갖게 된 지 7년이 넘었지만, 카카오톡과 유튜브 정도만 쓰고 예약, 결제, 송금 등은 할 줄 몰라 불편하다고 털어놓았다.    김씨는 ""한번은 주말에 영화를 보러 갔는데 예매한 사람들이 많아 자리가 거의 없었다""며 ""결국 (보고 싶은 영화를 못 보고) 내용도 이름도 기억이 나지 않는 외국 영화를 보다가 나왔다""고 말했다.



[연합뉴스TV 제공]    전문가들은 이번 카카오 먹통 사태가 노인들의 디지털 소외 현상을 다른 이들이 간접 체험하게 했다며 디지털 격차를 좁히려는 노력이 필요하다고 입을 모은다.    허준수 숭실대 사회복지학부 교수는 ""우선 어르신들이 정확히 어떤 부분에서 어려움을 겪는지, 어떤 기능을 필요로 하는지 전국 단위의 조사가 선행돼야 한다""고 짚었다.    이어 ""각종 사회복지관에서 정보화 교육을 하고는 있지만, 소수의 어르신만 배우는 게 사실""이라며 ""이른바 '노노 케어'(노인이 다른 노인을 돕는 일)를 통해 눈높이에 맞는 일대일 교육이 필요하다""고 조언했다.    정재훈 서울여대 사회복지학과 교수는 ""교육이 필수 동반돼야 하지만, 우리 인식 자체도 바뀔 필요가 있다""며 ""무작정 노인 세대에게 '쫓아 오라'고 할 게 아니라 내게 쉬운 것도 상대에게 어려울 수 있다는 생각으로 도와주도록 공감 능력을 키워야 한다""고 말했다.    rambo@yna.co.kr",105,https://n.news.naver.com/mnews/article/001/0013523015?sid=103
과기정통부 산하 '디지털 위기관리본부' 만든다,2022.10.23. 오전 12:01,"카카오 사태 후속조치 촉각상시 조직…차관급 전망공정위, 플랫폼 기업 결합간이→일반심사 전환 추진



판교 데이터센터 합동 수사 진행 지난 15일 판교 데이터센터 화재로 인해 카카오의 주요 서비스에 장애가 발생한 가운데 이에 대한 경찰과 국립과학수사연구원, 소방당국, 전기안전공사 등 유관 기관의 합동수사가 진행됐다. 17일 경기 성남시 SK(주) C&C 데이터센터 화재 현장에서 관계자들이 합동 감식을 위해 이동하고 있다. 김민수기자 mskim@etnews.com과학기술정보통부에 통신망과 데이터센터 등 사고를 예방·관리하는 '디지털 위기관리본부(가칭)'를 설치해 디지털재난을 관리하는 컨트롤타워 임무가 부여될 것으로 전망된다. 공정거래위원회는 데이터센터 화재와 관련해 인수합병(M&A) 심사 기준 개선 등 플랫폼 경쟁 촉진 방안을 추진하면서 정책 전환을 예고했다.과기정통부는 카카오 장애 사태 후속 조치 중장기 계획으로 '디지털 위기관리 본부(가칭)'를 상시조직으로 설치한다. 이종호 장관의 대통령 보고 이후 행정안전부와 조직 구성 등에 대해 협의를 시작한다. 본부 신설은 카카오 장애, KT 아현 통신구 화재 사태와 같이 디지털서비스가 멈추면 사회경제가 마비될 정도로 큰 타격이 발생했다는 정부 공감대가 형성된 데 따른 조치다.본부는 상시조직이 유력하다. 사고 발생 때마다 조직을 꾸려서 대응하기보다는 디지털 인프라와 서비스 재난예방-훈련-대응-복구 등 전체 점검·관리 체계를 갖추기 위한 민간 분야 디지털재난 관리 '컨트롤타워' 임무를 과기정통부에 부여하기 위한 것이다. 범부처 디지털 안전을 관리하는 역할과 정부 직제를 고려하면 차관급 또는 실장이 맡게 될 것으로 전망된다. '2차관-2본부' 체제로 과기정통부 후속 조직의 변화가 예상되지만 행안부 협의와 국회 논의가 필요할 것으로 예상된다.공정위는 데이터센터 화재와 연계해 플랫폼 경쟁촉진 방안을 추진한다. 카카오 사태가 독점 플랫폼이 혁신 노력과 사회적 책임을 소홀히 한 것에서 기인했다고 보고 관련 제도를 개선한다. 핵심은 거대 플랫폼의 사업 확장을 위한 인수합병(M&A)을 차단하기 위해 기업결합 심사 기준을 개정하는 것이다. 이전까지 대부분 간이 심사로 처리된 플랫폼 기업의 이종 혼합형 기업결합을 일반심사로 전환하는 게 골자다. 간이 심사는 경쟁 제한성이 없는 것으로 추정되는 사안에 대해 사실관계 여부만 확인한다. 반면에 일반 심사는 시장 획정, 시장 집중도, 경제분석 등 경쟁제한성 중심으로 살펴본다.플랫폼 분야의 독점력 남용 행위를 규율하기 위한 심사 지침도 올해 말까지 제정한다. 플랫폼 독과점 심사 지침은 플랫폼 특성에 맞게 독과점 지위 판단 기준과 금지 행위 유형을 구체화한 해설서다. 1월 제정안이 행정예고됐지만 업계 의견 수렴 등을 이유로 아직 구체화되지 않았다. 심사 지침에서 공정위는 플랫폼 분야의 특성을 고려한 시장 획정, 시장지배력 평가 기준 등을 제시하는 게 유력하다. 공정위 일각에도 플랫폼 관련 규율을 전담할 부서가 필요하다는 주장이 제기되고 있다. 플랫폼 관련 사건은 공정위 시장감시국에서 맡고 있는데 이를 키워야 한다는 의견이 거론되면서 조직 변화로 이어질지 주목된다.",105,https://n.news.naver.com/mnews/article/030/0003053216?sid=103
