title,date,main,section,url
"""AI가 안부 전화…진료내역 대신 기록"" 네이버의 실험, 병원 현장도 바꾼다",2022.09.30. 오후 8:34,"[K-HOSPITAL FAIR 2022]나군호 네이버헬스케어연구소장, K-디지털헬스케어 서밋 특강'클로바케어콜' 서비스 도입 예고···병원내 AI 활용 가능성 제안



30일 ‘K-디지털헬스케어 서밋’ 특강을 맡은 나군호 네이버헬스케어연구소장이 '클로바 케어콜' 사례를 소개하고 있다. 안경진 기자[서울경제] ""선생님, 다리 허리 아프시다더니 좀 어떠세요? 아이고, 지난번에 자전거 타다 넘어지셨다고 하셨죠? 병원에는 다녀오셨어요? 바쁘시더라도 병원 꼭 가보세요. ""국제병원의료산업박람회(K-HOSPITAL FAIR 2022) 둘째날인 30일 ‘K-디지털헬스케어 서밋’에서 한통의 전화통화 내역이 공개되며 참관객들을 사로잡았다. 웬만한 자식보다 살뜰하게 어르신의 안부를 챙기는 목소리의 주인공은 다름 아닌 AI(인공지능)다. 네이버가 자체 구축한 초거대 AI '하이퍼클로바'를 활용해 개발했다. AI가 독거노인과 같이 돌봄이 필요한 1인 가구에 전화를 걸어 안부를 확인한다. 이날 특강을 맡은 나군호 네이버헬스케어연구소장은 ""해운대구 독거노인 100명에게 격주 간격으로 돌봄전화 서비스를 제공한 결과 사용자의 90%가 '전화 후 위로 받는 느낌'이라고 답했다""며 ""반응이 좋아 현재는 8000명까지 규모를 확대했다""고 소개했다. 네이버는 일명 '클로바 케어콜' 시범사업을 전방위적으로 확대하고 있다. 최근에는 원광대병원과 지역사회 정신건강 관리 향상을 위한 업무협약을 체결했다. 병원 내원객 중 정신건강 위기에 처한 이들에게 AI가 주기적으로 유·무선 전화를 걸어 안부, 건강상태, 식사 여부 등을 확인하고, 자연스러운 대화를 통해 정서적 지원에 나섬으로써 의료서비스의 수준을 한 단계 높일 것으로 기대된다. 나 소장은 ""AI가 과거 통화내역을 기억하는 수준까지 진화했다""며 ""동시에 100명, 1000명 이상에게 전화를 거는 것도 가능해 일선 병원들에 본격적으로 도입되면 업무 부담을 줄여주는 효과가 클 것""이라고 말했다. 진료예약은 물론 수술 후 경과를 묻는 해피콜, 임상시험 기본 데이터 수집 등 병원 현장 내 확장성이 무궁무진할 것이란 전망이다. 현재 네이버는 신사옥에 있는 사내 부속병원을 '테스트 베드' 삼아 AI부터 클라우드, 사물인터넷(IoT) 등을 결합한 의료서비스를 고도하고 있다. 대표적인 사례가 '스마트 서베이'(Smart Survey)다. 환자가 진료를 보기 전 신체 증상, 정신건강 상태 등을 설문조사 형태로 제공하면 AI가 의심 질환과 해당 진료과 정보를 제공해준다. AI가 문진·예진 역할을 대신하기 때문에 인건비 부담을 줄일 뿐 아니라 짧은 시간 내 효율적인 진료가 가능해졌다. '보이스 EMR'(Voice Electronic Medical Record)은 음성 인식을 통해 환자 상태와 진료 소견, 처치, 결과 등을 자동으로 작성해준다. 나 소장은 ""한글과 영어를 섞어쓰고 흘려 말해도 정확하게 인식할 뿐 아니라 의학용어로 변환해 기록해준다""며 ""간호사 간 인수인계도 비대면으로 이뤄질 수 있다""고 귀띔했다. 방대한 양의 과거 병력을 일목요연하게 정리해서 보여주고 이상 소견이 발견됐을 때 필요한 검사 등을 제안해주는 '페이션트 서머리’(Patient Summary)도 의사 출신인 나 소장이 유용성을 자부하는 서비스다. 나 소장은 ""과거 경험을 돌이켜보면서 어떻게 하면 의료진이 환자에게 집중할 수 있는 환경을 제공할 수 있을지 고민하고 있다""며 ""좋은 기술을 개발해 의료계에 소중하게 쓰일 수 있는 기술을 선보이도록 힘쓰겠다""고 강조했다.",105,https://n.news.naver.com/mnews/article/011/0004105322?sid=103
"알에프바이오, 코스메슈티컬 제품 2종 베트남 등록",2022.09.30. 오전 9:43,"알에프텍 자회사



알에프텍의 자회사 알에프바이오는 스킨부스터 제품 ‘샤르데냐 스킨부스터 엑소프라임’과 ‘샤르데냐 엑소프라임 마스크’ 등 2종에 대해 베트남 식약처(DAV)의 품목등록을 완료했다고 30일 밝혔다.회사는 지난해 7월 베트남 보건부로부터 히알루론산(HA) 필러 제품 ‘사르데냐 필러’ 3종에 대해 의료기기 수입 품목허가를 받았다. 이번 코스메슈티컬 제품의 품목등록에 성공하며 베트남 공략을 가속화한다는 방침이다.사르데냐 스킨부스터 엑소프라임은 식물성 엑소좀 2종과 철갑상어 및 연어의 폴리디옥시리보뉴클레오티드(PDRN)을 결합한 제품이다. 출시 전 만 19~60세 성인 여성을 대상으로 주 1회씩 4주간 검사를 진행해, 안전성과 효능에 대한 검증을 마쳤다고 했다.알에프바이오는 신제품을 추가 출시해 제품군을 다각화할 예정이다. 이와 함께 HA 필러 및 코스메슈티컬 제품에 대한 글로벌 허가를 확대해 해외 매출 비중을 극대화하겠다고 전했다. 회사 관계자는 “제품의 뛰어난 피부 개선효과를 기반으로 해외 진출을 위해 노력한 결과, 계획보다 빠르게 제품 등록을 완료했다”며 “앞서 베트남에 출시한 HA 필러의 시장 점유율 확대와 이번에 승인받은 스킨부스터 제품을 통해 매출 성장을 가속화할 것”이라고 말했다. 알에프바이오는 지난 22일 강원도 원주기업도시에 신공장 건설을 위한 331억원 규모의 공사계약을 체결했다. 신공장은 내달 착공에 들어가 내년 12월 완공될 예정이다.",105,https://n.news.naver.com/mnews/article/015/0004756402?sid=103
업그레이드 '폴스타2' 출시…후륜·1회 충전 주행 거리 445km,2023.10.26. 오전 9:09,"폴스타는 26일 업그레이드 폴스타 2를 출시한다고 밝혔다.(폴스타 제공)(서울=뉴스1) 윤다혜 기자 = 스웨덴 프리미엄 전기차 브랜드 폴스타는 26일 주행 성능과 디자인 등을 업그레이드한 2024년형 '업그레이드 폴스타 2'를 출시한다고 밝혔다.신형 폴스타2의 가장 큰 변화는 차세대 전기 모터 및 인버터를 탑재하고 후륜구동 방식으로의 변화를 통해 주행 성능을 극대화한 것에 있다. 폴스타 3의 패밀리룩을 계승한 디자인과 티맵 인포테인먼트 시스템을 탑재해 진화된 커넥티비티 및 엔터테이닝 경험을 제공한다.롱레인지 싱글모터 최대출력은 기존 모델 대비 68hp 증가한 299hp, 최대 토크는 16.3kg·m 증가한 50kg·m다. 정지 상태에서 시속 100km까지 걸리는 시간(제로백)은 6.2초다. 또 기존 모델과 동일한 용량의 78kWh 리튬·이온 배터리를 탑재했지만 1회 충전 주행거리는 449km로 기존 대비 32km 늘어났다. 롱레인지 듀얼모터의 경우 최대출력은 421hp, 최대 토크는 75.5kg·m다. 제로백은 4.5초이며, 1회 충전 시 최대 주행거리는 379km다.",105,https://n.news.naver.com/mnews/article/421/0007134319?sid=103
"DAXA, 거래지원심사 공통 가이드라인 도입…다음달 10일부터 시행",2022.09.30. 오후 2:25,"거래지원 심사 참여 외부전문가 최소 인원 결정



[디지털데일리 박세아 기자] 국내 5대 가상자산거래소 고팍스, 빗썸, 업비트, 코빗, 코인원으로 구성된 '가상자산거래소 공동협의체(DAXA)가 자문위원회 논의를 거쳐 '거래지원심사 공통 가이드라인' 등을 도입한다고 30일 밝혔다.    DAXA는 지난 6월 출범 이후 지금까지 논의를 거쳐 시행하고 있는 가상자산 사업자 공동 자율 개선방안 현황을 이날 공개했다.    DAXA는 거래지원, 시장감시, 준법감시, 교육 등 4개 분과를 운영하며 이를 통해 공동 자율 규제안을 수립하고 있다. 이 협의체는 거래지원심사 공통 가이드라인 초안을 협의한 이래 약 2개월간 보완점검을 거쳐 다음달 10일부터 본격 시행한다.    가이드라인은 내재적 위험성 평가, 기술적 위험성 평가, 사업 위험성 평가 등으로 이뤄진 세부 항목을 평가하도록 하고 있다. 5대 거래소는 신규 거래지원 심사 시 각 사 절차와 기준에 따라 거래지원을 자체적으로 결정하지만, 이 과정에서 공통 가이드라인에 따른 항목 평가를 필수적으로 이행해야 한다.    또한 DAXA는 가상자산 유형별로 위험성 지표와 모니터링 방식을 정하고 있는 것으로 알려졌다. 이중 루나 사태와 연관된 스테이블코인 및 해외 거래사업자가 발행한 코인에 대한 위험성 지표 선정과 모니터링 방식을 우선 협의했다. 현재 5개사는 지표 적용을 위한 개발 일정을 협의 중이다. 개발이 완료되면 협의된 위험지표가 모니터링 될 경우 일정 시간 내 유의종목 지정이나 거래지원 종료 결정 등 지표탐지 결과에 따른 공동 대응도 가능해진다.   DAXA는 거래지원 심사에 참여할 외부전문가 인원과 비율도 결정했다. 이날 즉시 시행되는 DAXA 외부전문가 참여 최소기준에 따르면 5개 거래소는 오는 10월 1일부터 신규 거래지원 심사 시 각사 거래지원 심사위원회에 외부전문가를 최소 2명 또는 최소 30% 이상을 포함해야 한다. 이미 5개 거래소 모두 외부전문가를 참여시키고 있지만, 외부전문가 참여를 공통 심사 요건으로 하고 최소 참여기준을 정한 것은 이번이 처음이다.   투자자 보호를 위한 시장감시 제도도 마련됐다. DAXA는 각 거래소별로 '가상자산 경보제 내부기준'을 만들어 가격 급등락, 거래량 급등, 입금량 급등 등이 발생할 때 투자자에게 안내하는 경보제를 도입한다. 현재 내부기준을 위한 모델을 수립한 상태로, 10월말까지 자문위원회 검토를 거쳐 기준값과 시행일에 대한 협의를 마친다.   또한 DAXA는 위기상황을 '시장 상황에 의한 단순 가격 등락 외의 특이사항 발생으로 투자자 주의가 촉구되는 경우'로 정의하기로 합의했다. 이들은 지난 5월 23일부터 회원사 간 핫라인을 가동해 위기상황 발생 시 투자자 유의 촉구, 유의/주의 종목 지정, 입금정지, 거래지원 종료 등 공동 대응 조치를 시행해 왔다.   또한 오는 11월 1일부터 DAXA 회원사가 진행하는 신규 광고와 이벤트 등에는 '가상자산은 고위험 상품으로서 투자금 전부 또는 일부 손실을 초래할 수 있습니다'라는 등 경고 문구가 삽입된다.   일반 투자자에 대한 투자위험성 및 범죄예방교육을 강화하기 위한 조치도 마련된다. DAXA는 이를 소재로 한 교육용 영상 콘텐츠를 제작하기로 확정했다. 내년 1월경부터 일반투자자가 시청할 수 있도록 보급할 계획이다. 이와 함께 투자자를 대상으로 하는 세미나와 컨퍼런스 등을 열어 가상자산을 알고 투자할 수 있는 환경을 만드는데 힘을 모을 예정이다.   DAXA 이석우 의장은 ""분과별 논의를 통해 이행 계획을 수립하고 빠르게 시행하기 위해 각 거래소가 최선을 다하고 있다""라며 ""투자자 보호를 위해 공동의 노력을 모아나갈 것""이라고 밝혔다.",105,https://n.news.naver.com/mnews/article/138/0002133727?sid=103
"“기술자료, 클라우드에 저장해도 처벌”… 지재위,  기술 유출 방지 가이드라인 발간",2022.09.30. 오후 1:19,"#국내 한 기업의 연구원 A씨는 경쟁 해외 기업 B사의 제안을 받고 영업비밀이자 산업기술인 기술 자료를 해외 기업에 유출한 후 이직을 했다. 결국 A씨는 부정경쟁방지법 및 산업기술보호법 위반으로 징역형을, B사는 같은 죄목으로 벌금형을 받았다. 해외 기업도 대한민국 법제가 적용될 수 있으며, 해외로 유출 시 가중 처벌 될 수 있다.이 밖에 근무하면서 알게된 정보가 일반적인 지식이 아니라면 영업비밀에 해당해 유출 또는 활용 시 처벌 받을 수 있다. 또 자료를 사용하지 않았지만 기술 자료를 이메일 전송이나 클라우드에 저장하는 행위도 기술유출 행위가 될 수 있다.대통령소속 국가지식재산위원회(지재위)는 연구자를 대상으로 기술의 해외유출과 탈취에 대한 인식과 경각심을 제고하고자 ‘기술의 해외유출과 탈취 방지를 위한 연구자 가이드라인’을 발간했다고 30일 밝혔다.



/자료=국가지식재산위원회        지재위는 연구자를 대상으로 기술유출 및 탈취 관련 사례 및 법률 등을 이해하기 쉽게 소개하고 기술유출 근절 및 방지를 유도함으로써, 우리기업의 기술보호에 도움이 되고자 가이드라인을 마련했다.가이드라인에는 보호 대상이 되는 기술의 종류, 기술유출의 유형 및 피해 사례, 주요 법령 및 묻고 답하기뿐만 아니라, 연구자가 활용할 수 있는 체크리스트까지 포함됐다.가이드라인은 관계부처, 정부 출연연구기관, 대학 산학협력단 및 분야별 연구학회 등에 배포되고 지재위 홈페이지에 게시된다.신준호 지식재산전략기획단장은 “가이드라인을 통해 연구자가 기술보호의 중요성을 인식하는 계기가 될 수 있다”며 “기술의 해외유출과 탈취 방지가 우리 경제 안보를 지키는 초석이 되길 바란다”고 했다.",105,https://n.news.naver.com/mnews/article/366/0000844396?sid=103
"LG히다찌, 22년도 행정·공공기관 클라우드 전환·통합 3차 사업 수주",2022.09.30. 오후 1:13,"[디지털데일리 이상일기자] LG히다찌(대표 이석희)는 지난 26일 한국지능정보사회진흥원(원장 문용식)이 발주한 ‘22년도 행정·공공기관 정보시스템 클라우드 전환∙통합사업’ 3차 사업을 수주하고 계약을 체결했다고 밝혔다.이번 사업은 행정·공공기관의 정보시스템 운영 환경을 클라우드로 전면 전환하는 사업으로, LG히다찌는 이번 계약을 통해 향후 6개월 간 13개 기관의 83개 온프레미스(on-premise) 업무시스템을 민간 클라우드로 전환하는 업무를 담당한다. LG히다찌는 2021년도 공공 클라우드 전환 2차 사업을 수행한 데 이어, 지난 7월에도 2022년도 공공 클라우드 전환 1차 사업을 수주한 실적을 갖고 있다. 이번 3차 사업까지 수주하면서 LG히다찌는 공공 분야 디지털전환 핵심 과제로 추진되는 클라우드 전환 사업에 3회 연속 참여하며 클라우드 사업을 더욱 확대해 나가고 있다.김현석 LG히다찌 공공사업본부장은 “선행 사업에서 축적된 노하우 및 전문 MSP와의 협력을 기반으로 공공 클라우드 전환 프로젝트를 성공적으로 완수하겠다”며 “2025년까지 진행되는 공공 클라우드 전환 사업에서 독보적인 경쟁력을 강화해 나가겠다“고 말했다.",105,https://n.news.naver.com/mnews/article/138/0002133718?sid=103
"메타, 조직개편 및 감원 공식화…“급성장 시대 끝”",2022.09.30. 오전 10:27,"- 2분기 매출 하락…인터넷 광고 사업, 2012년 이후 첫 감소   [디지털데일리 백승은 기자] 글로벌 빅테크 기업들이 경제 불확실성으로 비용 절감에 집중하고 있다. 메타 역시 직원 숫자를 줄이고 지출 축소에 나설 계획이다.    29일(현지시간) 블룸버그통신에 따르면 마크 저커버그 메타 최고경영자(CEO)는 최근 직원들과 함께한 질의응답 자리에서 “지금쯤이면 경제가 확실하게 안정되길 바랐지만 그렇지 않은 것 같다. 그렇기 때문에 다소 보수적으로 계획을 세우고 싶다”라고 언급했다.   지난 6월 저커버그 CEO는 고용 계획을 축소했다고 말했다. 메타는 매년 엔지니어 1만명 가량을 채용했지만 올해는 이보다 약 30% 줄어든 6000~7000명을 채용하는 데 그쳤다.    당시 저커버그 CEO는 “현실적으로 회사에 있어선 안 될 사람도 많을 것”이라면서 인력 감축을 예고하기도 했다. 이번에 감원 계획을 공식적으로 밝혔다.    메타의 지난 2분기 매출은 288억2200만달러(약 41조3365억원)으로 전년동기대비 1% 감소했다. 특히 전체 매출에서 98%를 차지하는 인터넷 광고 사업은 2012년 상장 이후 처음으로 감소했다.    이와 같은 상황에서 감원을 통해 비용을 줄이고 실적 완화에 집중할 전망이다. 저커버그 CEO는 “내년 말에는 올해보다 인력 규모가 작아질 것이다. 급속 성장의 시대는 끝났다”라고 강조했다. 지난 2분기 기준 메타의 직원 수는 약 8만3500명이다. 저커버크 CEO의 언급에 따라 직원 규모는 이보다 점차 줄어들 것으로 예측된다.",105,https://n.news.naver.com/mnews/article/138/0002133694?sid=103
,,,105,https://n.news.naver.com/mnews/article/236/0000227896?sid=103
[신간] 음악의 힘·음악과 과학,2022.09.30. 오전 10:26,"(서울=연합뉴스) 김용래 기자 = ▲ 음악의 힘 = 문소영 지음.    음악치료 분야의 권위자로 명지대 음악치료학과 교수로 재직 중인 저자가 음악의 치료와 심리적 효과에 초점을 맞춰 클래식 음악들을 소개한다.    부제는 '내 감정을 다스리는 클래식 수업'.     마비 증상을 겪던 사람이 몸을 움직이고, 치매 환자의 기억이 돌아오면서 인지 기능이 향상되는 등 임상 현장에서는 음악치료가 실제로 많은 사람들의 삶을 바꾸고 있다고 저자는 말한다.    저자의 연구와 실제 음악치료 과정에서 효과를 발휘했던 음악 35곡을 사랑·일·휴식·삶·죽음의 5가지 주제어로 엄선해 음악과 관련된 에피소드와 함께 음악으로 힘을 얻을 수 있는 감상 가이드를 제공한다. 소개된 음악들은 대부분이 클래식이지만, 비틀스의 '렛 잇 비', 우리 민요 '아리랑', 김희갑의 '향수' 등 이미 클래식의 반열에 오른 다른 장르의 음악들도 함께 다뤘다.    다산북스. 260쪽. 1만7천원.



    ▲ 음악과 과학 = 원준식 지음.    음악은 오랫동안 과학의 주요 탐구 영역 중 하나였다. 케플러, 하위헌스(호이겐스)와 같은 과학자들은 중요한 음악 논문을 썼고, 갈릴레오와 뉴턴은 과학적 주제를 논하는 자신의 저술에서 음악 문제들을 다루기도 했다. 음악은 심지어 과학혁명이 한창이던 17세기까지도 산술·기하·천문과 함께 과학의 한 분과로서 '4과'(qudrivium)에 속해 있었다.    학부에서 물리학을 전공한 뒤 미학으로 전공을 바꿔 대학에서 가르치는 저자가 고대부터 근대 과학혁명기까지 음악과 과학의 관계를 역사적 변화와 연관 지어 탐구했다.    책에 따르면 음악과 과학의 만남은 기원전 6세기 피타고라스 학파에서 시작됐다. 현악기의 현 길이와 음높이 사이의 관계에 관한 이들의 발견은 음악과 과학을 연관시킨 최초의 사례였다.    저자는 피타고라스를 출발점으로 삼아 그의 이론이 어떻게 형성됐고, 어떤 과정을 근대에 전해졌으며, 근대과학에 어떤 식으로 수용되고 또 분화했는지 음악사와 과학사의 측면에서 짚어나간다.    성균관대출판부. 408쪽. 2만6천원.           yonglae@yna.co.kr",105,https://n.news.naver.com/mnews/article/001/0013474278?sid=103
아이폰 14 시리즈 국내 사전예약 개시,2022.09.30. 오전 10:24,[서울=뉴시스] 김금보 기자 = 애플의 신제품 아이폰14 시리즈 국내 사전예약이 시작된 30일 오전 서울 중구 한 통신사 매장에서 직원이 홍보 포스터를 게시하고 있다. 2022.09.30. kgb@newsis.com[사진 영상 제보받습니다] 공감언론 뉴시스가 독자 여러분의 소중한 제보를 기다립니다. 뉴스 가치나 화제성이 있다고 판단되는 사진 또는 영상을 뉴시스 사진영상부(n-photo@newsis.com)로 보내주시면 적극 반영하겠습니다.,105,https://n.news.naver.com/mnews/article/003/0011450099?sid=103
"스틸리언, 2022 우수벤처기업 일자리 부문 선정",2022.09.30. 오후 4:02,"[디지털데일리 이종현기자] 사이버보안 기업 스틸리언은 벤처기업협회가 주관한 2022년 우수벤처기업 시상에서 일자리 부문 우수 기업으로 선정됐다고 30일 밝혔다.   올해로 7회째를 맞은 우수벤처기업 선정 사업은 비상장 벤처기업을 대상으로 최근 3년간의 경영 성과를 토대로 ▲혁신성 ▲성장성 ▲고용 창출 등을 종합적으로 심사한다. 부문별로 지속성장 33개사, 일자리 23개사, 글로벌 10개사, 연구개발 13개사, 지역우수벤처 13개사, 일·생활 균형 3개사가 선정됐다.   일자리 부문 선정기업의 평균 고용 규모는 68.6명, 평균 고용증가율은 62.3% 등 일자리 창출 성과를 보였다. 이번 선정에 앞서 스틸리언은 지난 2020년부터 고용노동부가 주관하는 청년친화강소기업에 3년 연속으로 선정된 바 있다.   스틸리언은 세계 최고 수준의 해커들로 구성된 사이버 보안 전문 기업이다. 국내외 해킹대회 우승 경력을 비롯해 구글, 애플 등 글로벌 기업의 보안 취약점을 발표한 인력 등으로 구성됐다.   주 사업은 모바일 보안 솔루션 ‘앱수트’, 보안 컨설팅, 해킹 및 보안 기술 연구개발(R&D), 교육·훈련을 위한 사이버 드릴 시스템(Cyber Drill System) 등이다. 주요 고객은 4대 시중은행(KB, 신한, 하나, 우리)을 포함해 국방부, 서울시, 대검찰청, 삼성전자 등 100여곳 이상이다.   박찬암 스틸리언 대표는 “코로나 장기화 속 침체된 고용 시장에서 일자리 창출 성과를 인정받아 기쁘다”며 “앞으로도 임직원과 함께 성장하는 기업이 되도록 노력하겠다”고 말했다.",105,https://n.news.naver.com/mnews/article/138/0002133739?sid=103
