title,date,main,section,url
"LG유플러스 개인정보 유출, 피해자는 보상받을 수 있을까?",2023.01.13. 오전 10:12,"[디지털데일리 이종현기자] LG유플러스의 개인정보 유출 사건이 일파만파 커지는 가운데 피해보상 여부에 관심이 모아지고 있다.   LG유플러스는 지난 10일 홈페이지를 통해 “일부 고객의 개인정보가 유출된 사실을 인지했다”며 “소중한 정보가 부적절하게 이용될 수 있으니 유의해주기 바란다”고 공지했다. 지난 3일 <디지털데일리>의 첫 단독 보도 LG유플러스 데이터 또 유출됐나… 해커 ""사용자 데이터 2000만건 판매"" (2023.01.03) 후 1주일 만의 공표다.   다만 유출 규모에는 의문점이 남는다. LG유플러스는 18만명의 개인정보가 유출됐다고 밝혔으나 이것이 전체 피해 규모인지는 확신하지 못하고 있다. 특히, 데이터를 훔쳐낸 해커는 <디지털데일리>와의 인터뷰에서 “3000만건의 LG 데이터를 갖고 있다”고 밝혔다. [단독] LGU+ 개인정보유출, 18만명?…해커, ""3000만건 데이터 보유"" (2023.01.10.) 이후 조사 및 경찰수사에 따라 피해 규모가 확산될 수 있다는 얘기다.   대규모 개인정보 유출 사건이 발생한 가운데 피해자들 사이에서는 LG유플러스가 피해자에게 보상을 해야 한다는 목소리도 나오는 중이다. 일각에서는 개인정보보호위원회(이하 개인정보위)에 분쟁조정 신청 및 소송을 준비하는 움직임도 나타나고 있다.   그렇다면 실제 피해자들이 보상을 받을 수 있을까. <디지털데일리>가 업계 관계자, 전문가들을 취재한 결과 ‘아직은 판단하기 어렵다’는 의견이 대부분이다. 정확한 피해 규모도, 원인도 밝혀지지 않은 상태인 만큼 향후 조사를 지켜봐야 한다는 것이다.   설령 보상이 이뤄진다고 하더라도 국민 눈높이에 맞는 보상이 이뤄지기는 힘들 것이라는 목소리도 나온다. LG유플러스가 개인정보를 지키기 위해 적절한 대응을 취했는가도 관건이다. 기술적·관리적 조치를 충실히 수행했느냐에 따라 배상 책임이나 그 범위에 차이가 있을 전망이다.   보상 금액에 대해서는 과거 판례를 통해 일정 부분 예측 가능하다. 2014년 KB국민카드, 농협카드, 롯데카드 등 카드3사에서 개인정보 1억건이 유출된 사건 당시 소송인측은 50만원의 배상을 요구했고 조정을 거쳐 10만원으로 확정됐다. 2016년 인터파크의 개인정보 2540만건 유출 사례에서도 소송인은 30만원의 배상을 요구했고 최종 확정된 것은 10만원가량이다.   다만 소송이 진행되더라도 보상을 받는 것은 소송에 참여한 이들에 한정된다. 카드3사의 공동소송에서는 2만여명이 참여한 것으로 알려졌다. 인터파크 사례 역시 소송에 참여한 것은 2400여명으로, 유출 피해자 중 실제 보상을 받은 것은 0.1% 남짓이다.   보상을 받기가 어려울 것이라는 비관론이 나오는 것은 최종 확정까지 오랜 시간이 걸린다는 점 때문이다. 2014년 시작됐던 카드3사 소송은 2019년 대법원 판결이 내려졌다. 2016년 인터파크 소송도 2021년 마무리됐는데, 두 사례 모두 소송 개시부터 판결까지 5년이 걸렸다. 들이는 품에 비해 보상액이 적은 탓에 참여가 미미하다는 것이 법조계 관계자의 설명이다.   피해 보상과 달리 법 위반에 따른 과징금·과태료는 피하기 어려울 것으로 보인다.   최근 개인정보 유·노출 관련 과징금·과태료를 강화하는 추세인데, 개인정보위는 2020년 개인정보 330만건을 오·남용했다는 이유로 메타(페이스북)에게 67억원의 과징금을 부과했다. 2022년에는 이용자 동의 없이 개인정보를 수집한 구글과 메타에게 각각 692억원, 308억원을 부과하기도 했다. 피해는 개인이 보고 보상은 정부가 챙긴다는 비판이 나올 수 있는 대목이다.   소송 절차 없이 개인정보위의 분쟁조정을 통해 보상을 받을 수도 있다. 개인정보 분쟁조정위원회가 조정안을 제시하고, 피해자과 기업 모두가 수락할 경우재판상 화해와 같은 법적 효력이 발생한다.   다만 분쟁조정의 경우 어느 한 측이라도 수락하지 않는다면 불성립된다. 실제 2020년 67억원의 과징금을 부과받은 메타의 경우 2021년 분쟁조정이 진행돼 신청인들에게 30만원을 지급하라는 조정안이 나왔으나 메타 측이 이를 거부해 소송으로 이어졌다. 개인정보 분쟁조정의 실효성이 떨어진다는 지적이 나오는 배경이다.",105,https://n.news.naver.com/mnews/article/138/0002140700?sid=103
"포시마크 창업자, “최수연 대표 앞에선 누구든 무장해제”",2023.01.15. 오후 4:19,"-포시마크 창업자 마니시 샨드라 대표, 네이버와 같은 ‘가치’ 확인  -“기술과 커뮤니케이션뿐 아니라 비전까지 공유, 드물고 특별한 관계”  



  [미국 레드우드시티=디지털데일리 최민지 기자] 최수연 대표가 네이버 역사상 ‘빅딜’로 꼽히는 포시마크 인수를 성사시키는 주역을 담당했다. 최 대표가 직접 포시마크(Poshmark) 창업자와 경영진을 수차례 만나 특유의 친화력과 비즈니스 마인드를 내보였다. 이를 통해 포시마크는 인수 결정에 핵심이었던 네이버와 같은 기업가치를 확인했다.    포시마크를 창업한 마니시 샨드라 대표는 지난 12일(현지시간) 미국 캘리포니아 레드우드시티에 위치한 포시마크 본사에서 열린 기자간담회를 통해 최근 최수연 네이버 대표와 만난 일화들을 꺼냈다.  앞서, 지난 9일 최 대표는 포시마크 본사에서 사내 설명회를 진행했다. 이때 전세계 포시마크 임직원 800여명이 온‧오프라인으로 참석했다. 포시마크 경영진 또한 한국을 찾아와 네이버를 직접 방문하기도 했다.    마니시 샨드라 대표는 최 대표를 회상하며 “굉장히 날카로운 비즈니스 마인드를 가졌다”며 “수치를 비롯한 사업의 모든 디테일을 정확하게 기억하는 점에 놀랐다”고 말했다.    1981년생 젊은 나이로 국내 대표 빅테크 기업인 네이버를 이끌고 있는 최 대표는 엘리트로 꼽힌다. 서울대학교 공과대학, 연세대학교 법학전문대학원을 졸업 후 하버드 로스쿨을 거쳐 뉴욕주 변호사 자격증까지 취득한 인물이다. 변호사 주요 경력은 인수합병(M&A), 자본시장, 기업 지배구조, 회사법 일반 분야다. 네이버에선 글로벌 사업 전반을 총괄‧조율하면서, 신임을 받아온 인물로 알려졌다.    이와 함께 마니시 샨드라 대표는 최 대표를 “상대방을 빠르게 무장해제시키는 인물”로 치켜세웠다.    최 대표는 포시마크 경영진과 대화를 나눌 때마다 상호 인간적 친밀감을 느낄 수 있도록 공통 주제를 잘 끌어내 관계를 개선시킨다는 설명이다. 최 대표는 포쉬마크 경영진 개개인이 관심을 두는 패션과 골프뿐 아니라, 본인이 워킹맘이기에 교육과 육아에 대해서도 공감 있게 이야기했다고 한다.    마니시 샨드라 대표는 “처음 최 대표를 만난 자리에 4명의 공동창립자와 커뮤니티 담당자 등이 참석했다”며 “최 대표는 다양한 방식으로 개인적 관계를 맺을 수 있는 사람이라는 것을 보여줬다. 이번 만남에서도 그런 점을 다시 상기시켜줬다”고 전했다.  



  이것이 중요한 이유는 포시마크 기업가치와 관련 있다. “공감, 존중, 신뢰를 쫓으면 돈이 따라오지만, 돈만 쫓다 보면 아무것도 이룰 수 없다.” 포시마크 내부에서 가장 많이 하는 말이다.   포시마크는 소셜과 커뮤니티 기능을 전면에 내세운 개인간거래(C2C) 커머스 플랫폼으로, 지역별 피드와 팔로잉을 구성 후 인플루언서‧셀러 피드를 보며 취향에 맞는 아이템과 게시글을 찾는다. 플랫폼 특성상 ‘사람’과 ‘관계’를 우선할 수밖에 없다. 포시마크는 판매와 구매에 집중하는 커머스 ‘중개’ 플랫폼에 만족하지 않고, 판매자와 구매자가 인간적으로 상호작용하고 관계를 맺도록 하는 이유다.    기업적으로도 마찬가지다. 창업 11년이 지난 현재까지 공동창립자 4명이 모두 포시마크에 모두 재직하고 있다. 포시마크는 기업가치는 ▲사람 간 연결에 집중 ▲다름과 이상함에 대한 포용 ▲커뮤니티‧셀러들과 동반성장 ▲공감‧존중‧신뢰 기반 리더십이다.    결론적으로, 네이버는 포시마크와 수차례 미팅 끝에 같은 가치를 추구하고 있다는 점을 증명했다. 네이버 또한 검색에서 시작했으나, 카페‧블로그‧밴드 등을 통해 성장하며 커뮤니티와 관계의 중요성을 우선하고 있다. 지난 방문에서 최 대표는“네이버는 스마트스토어를 비롯해 웹툰부터 블로그까지 수많은 창업자와 크리에이터들이 활동하는 생태계를 만들었고, 포시마크는 다양한 셀러들이 모여있는 플랫폼인 만큼, 다양성이라는 철학과 가치를 공유하고 있다”고 언급하기도 했다.  관련해 마니시 샨드라 대표는 “네이버를 봤을 때 상당히 비슷한 가치를 공유하는 회사라고 생각했다. 포시마크는 콘텐츠, 커뮤니티, 임파워먼트를 기반으로 하는 회사”라며 “인상 깊었던 점은 포시마크가 공유하는 가치와 공통분모를 지녔을 뿐 아니라, 네이버가 상당한 시간과 돈을 고객에게 투자한다는 점이다. 사실, 그런 회사가 많지는 않다”고 설명했다.    이어 “포시마크는 함께 성장하는 가치에 초점을 맞추고 조직 간 이동이 자유로운데, 네이버에서도 볼 수 있었던 부분”이라며 “양사는 상호 보완적이고, 기술과 커뮤니케이션뿐 아니라 비전까지 공유하고 있어 드물고 특별한 관계다. 향후 10년간 양사가 어떤 성장을 도모할 수 있을지 개인적으로 궁금하다”고 강조했다.    북미 커머스시장에서 생소한 한국기업인 네이버를 인수주체로 선택한 배경 중 하나다. 실제로, 마니시 샨드라 대표는 네이버를 단순히 한국 검색 소프트웨어 회사로만 알고 있었다고 한다. 얼마나 큰 회사인지, 어떤 사업과 기술을 보유하고 있는지, 어느정도로 커뮤니티에 열정이 있는 곳인지 몰랐다.   네이버는 낮은 인지도를 극복하기 위해 포시마크와 기술력을 연동할 수 있는 자료를 준비하면서, 온‧오프라인 미팅 ‘포시파티’와 라이브쇼핑 ‘포시쇼’를 다음 단계로 진화시킬 수 있는 아이디어들을 공유했다. 포시마크는 이 과정에서 양사가 함께할 수 있는 부분이 많다는 점에 흥미를 느꼈다.    마니시 샨드라 대표는 “포시마크에 대한 굉장히 깊은 이해를 보여줬다”며 “어떻게 네이버 기술을 잘 연동해야 라이브(쇼핑) 스트리밍 기술을 실현할 수 있을지에 대해 많은 생각을 해준 기업”이라고 덧붙였다.",105,https://n.news.naver.com/mnews/article/138/0002140775?sid=103
"SKT, 파트너사에 1100억 규모 대금 조기 지급",2023.01.15. 오전 11:31,"[디지털데일리 백지영기자] SK텔레콤은 SK브로드밴드, SK스토아 등 ICT패밀리와 함께 약 1100억 규모의 대금을 연휴 시작 전에 조기 지급할 계획이라고 15일 밝혔다. SKT와 SKB, SK스토아 등 ICT패밀리사는 네트워크 공사 및 유지보수, 서비스 용역 등을 담당하는 중소 비즈니스 파트너들이 성 명절을 앞두고 자금을 원활히 운영하는데 도움을 주기 위해 대금 조기 지급을 결정했다.현재 SKT는 중소 비즈니스 파트너사들과 함께 성장하기 위해 ▲동반성장펀드 ▲산업 혁신 컨설팅 ▲비즈니스 파트너사 온라인 채용관 운영 등 다양한 상생 프로그램을 지속 운영하고 있다.동반성장펀드는 SKT가 기금을 출연해 은행에 예치하면 예치금에 대한 이자를 활용해 비즈니스 파트너사의 대출 금리 인하와 긴급 자금 대출을 지원하는 방식으로 운영된다.최근 급격한 경기 하락과 금리인상 등으로 재무 부담이 커진 파트너사들의 재무 부담 경감에 도움을 주기 위해 우수협력사 대출 이자 지원 금리폭도 기존 보다 0.93%p 상향해 운영하고 있다.또,  비즈니스 파트너사에 ESG 경영진단과 개선 프로그램을 무상으로 제공하고, 중대재해 예방을 위한 실천 방안 등 경영 현안 해결에 도움을 줄 수 있는 컨설팅도 제공 중이라고 밝혔다.",105,https://n.news.naver.com/mnews/article/138/0002140761?sid=103
"SKC솔믹스, 'SK엔펄스'로 거듭난다…반도체 소재 부문 강화",2023.01.15. 오후 12:44,"- 오는 2월 SK텔레시스 합병 완료   [디지털데일리 김도현 기자] SKC솔믹스가 새로운 사명을 통해 ‘글로벌 반도체 ESG 솔루션 기업’으로 도약에 나선다.   15일 SKC(대표 박원철)는 반도체 소재사업 투자사 SKC솔믹스의 사명을 ‘SK엔펄스’로 변경한다고 밝혔다.   SK엔펄스는 ‘가능하게 하다’는 의미의 영어 접두사 엔(en)과 흐름과 파동을 뜻하는 펄스(pulse)를 결합해 만들어졌다. 역동적으로 성장하는 기업, 반도체 소재산업의 새로운 흐름을 만들겠다는 의지를 담고 있다.   SK엔펄스는 30년 이상 축적된 연구개발(R&D)을 통해 반도체 분야 파인 세라믹 소재 국산화를 견인했다. 2008년 SKC 자회사로 편입된 이후부터는 화학기계연마(CMP) 패드, 블랭크마스크 등 고부가 소재 부문에 진출하며 비즈니스모델(BM) 혁신을 실행하고 있다.   CMP 패드는 반도체 웨이퍼 표면을 평탄하게 만들어 반도체의 집적도를 높이는 데 쓰이는 제품이다. SK엔펄스는 글로벌 화학기업 듀폰이 80% 이상 독점하던 CMP 패드 시장에서 SK하이닉스, DB하이텍 등 주력 공급사로 거듭나면서 빠른 성장을 구가하고 있다.   블랭크마스크는 반도체 제조 공정 중 나노미터(nm) 단위 초정밀 회로를 그리는 노광 공정 캔버스 역할을 하는 소재다. SK엔펄스는 지난해 하반기 일본 기업들이 90% 이상 점유하고 있는 하이엔드급 블랭크마스크 국산화에 성공한 바 있다.   SK엔펄스는 올해 2월 SK텔레시스와 합병을 완료하고 성장을 가속화할 계획이다.   SK엔펄스 관계자는 “SKC의 반도체 소재사업 방향과 새로운 정체성에 맞춰 신규 사명을 도입하게 됐다”며 “오는 2025년 기업가치 1조5000억원을 달성하겠다”고 말했다.",105,https://n.news.naver.com/mnews/article/138/0002140764?sid=103
차세대 태양전지 수분 안전성 향상..2000시간 실험서 95% 효율 유지,2023.01.15. 오전 10:05,"박남규 성균관대 교수팀, 크리스탈 패싯 연구페로브스카이트 태양전지 수분 안정성 개선[이데일리 강민구 기자] 국내 연구진이 수분 안정성을 높인 차세대 태양전지 기술을 개발했다. 실험 결과, 2000시간 수분 노출 실험에서도 95% 이상 초기효율을 유지했다.성균관대는 박남규 화학공학과 석좌교수 연구팀이 페로브스카이트 크리스탈 패싯(원자 배열이 공간적으로 반복된 패턴을 가지는 결정에서 기하학 모양의 평평한 면)에 따른 수분 안정성 차이점을 발견하고, 수분에 가장 안정적인 패싯 위주 필름을 제작했다고 15일 밝혔다.



박남규 성균관대 교수 연구팀.(왼쪽부터)박남규 성균관대 교수, 권석준 성균관대 교수, 마이클 그랏첼 스위스 로잔공대 교수, 마춘칭 성균관대 박사.(사진=성균관대)페로브스카이트 태양전지는 유무기 하이브리드 페로브스카이트 광흡수 소재를 포함하는 태양전지 기술이다. 앞서 2012년 박남규 교수팀은 9.7% 효율의 고체 페로브스카이트 태양전지를 처음 개발해 ‘페로브스카이트 포토볼타익스’라는 새로운 학문분야를 개척했다.태양전지용 페로브스카이트 광흡수층은 간단한 용액공정을 이용해 150도 이하의 비교적 낮은 온도에서 제작할 수 있다. 연구팀은 지난해 11월 일반적으로 알려진 용액공정의 한계를 극복하기 위해 첨가제 공법을 이용해 100번 부위와 111번 부위 결정 패싯이 잘 발달한 페로브스카이트 필름을 만들고, 패싯에 따른 광전류 의존성을 밝혔다.이번 연구에서는 패싯이 잘 발달한 페로브스카이트 필름이 수분에 노출되면 수분 안정성이 패싯에 따라 달라진다는 것을 처음으로 발견했다. 100번 부위와 달리 111번 부위 패싯이 수분에 안정적이라는 점을 발견했다.이론계산 결과, 그 이유는 물의 젖음 에너지가 111번 부위 패싯에서 상대적으로 낮기 때문에 발생했다. 분광분석과 엑스선 회절을 이용한 분석결과에서도 100번 부위 패싯에서는 물과 강한 결합이 생겼고, 페로브스카이트 상전이가 일어나 광흡수 특성을 잃었다.따라서 페로브스카이트 태양전지의 수분 안정성을 개선하려면 111번 부위 패싯으로 구성된 필름을 제작해야 했다. 연구팀은 첨가제(사이클로헥실아민)를 이용해 111번 부위 패싯이 98% 차지하는 페로브스카이트 필름을 만들었다.시험 결과, 이 필름으로 만든 태양전지는 30~40% 상대습도 환경에서 약 2000시간 동안 초기효율의 95% 이상을 유지했다.연구 결과는 국제학술지 ‘사이언스’에 지난 13일자로 게재됐다.",105,https://n.news.naver.com/mnews/article/018/0005406253?sid=103
"네이버 합류한 포시마크 ""신기술 접목해 더 유니크해질 것""",2023.01.15. 오후 6:49,"샨드라 CEO 양사 시너지 강조세계 수 억명 이용자 확보 기대""亞시장서 성장, 韓 진출 가능성"" 



지난 12일(현지시간) 미국 캘리포니아주 레드우드시티에 위치한 포시마크 본사에서 열린 기자간담회에서 트레이시 선 포시마크 수석부사장, 창업자인 마니시 샨드라 최고경영자(CEO) , 스티븐 영 최고마케팅책임자(CMO·오른쪽부터)가 발언하고 있다 사진=홍창기 특파원 【파이낸셜뉴스 실리콘밸리(미국)=홍창기 특파원】 네이버에 인수된 북미 최대 개인간(C2C) 패션 플랫폼 포시마크가 양사간 시너지로 전 세계 수 억명의 이용자를 확보하겠다는 청사진을 내놨다. 이를 위해 포시마크는 아시아 등 한국 시장 진출 가능성도 내비쳤다. 네이버와의 협업을 통해 내년 흑자전환에 대한 자신감도 보였다.   ■포시렌즈 등 네이버와의 협업 기대   포시마크 창업자 겸 최고경영자(CEO)인 마니시 샨드라 대표는 12일(현지시간) 미국 캘리포니아 레드우드시티에 위치한 포시마크 본사에서 기자간담회를 갖고 포시마크의 향후 계획과 전략을 발표했다.   샨드라 대표는 ""우리의 경쟁자들에게 없는 기술을 도입하는 것에 많은 기대감이 있다""고 밝혔다. 그 예로 마니시 대표는 포시렌즈(Posh Lens)를 꼽았다. 네이버의 스마트렌즈 기술이 접목된 포시렌즈는 포시마크에 가장 먼저 적용된 네이버 기술이다. 포시마크 사용자가 원하는 상품을 촬영하면 비슷한 상품과 가격을 한 번에 볼 수 있다.   샨드라 대표는 ""지금은 포시렌즈 테스팅 초기 단계""라면서 ""테스팅을 진행하고 준비된 후에 구체적인 론칭 시기를 공유하겠다""고 전했다. 이어 ""네이버와 포시마크의 장점을 잘 연동해 '라이브 스트리밍'을 더 잘 실현할 수 있을 것""이라고 했다.   한국 진출 가능성도 언급했다. 샨드라 대표는 ""논의를 막 시작한 단계이기 때문에 공유할 수 있는 게 많지 않다""면서도 ""포시마크가 아시아를 비롯한 세계 시장에서 더 성장하고 싶은 방향을 생각했을 때 (한국 진출을) 고려해 볼 수 있다고 생각한다""고 말했다.   ■네이버 ""포시마크 더 유니크하게""   포시마크의 경쟁사 묻는 질문에는 구체적으로 꼽기 어렵다고 했다. SNS와 이커머스, 마켓플레이스를 모두 결합하는 곳은 포시마크가 유일하다는 이유에서다. 샨드라 대표는 ""세계적 상거래회사 아마존도 SNS 기능을 추가하려고 했고 인스타그램도 커머스를 추가하려고 했지만 결국은 성공시키지 못했다""면서 ""이 세가지를 모두 갖춘 포시마크가 독보적이고 특별한 이유""라고 설명했다.   샨드라 대표는 ""네이버의 존재는 알았지만 얼마나 큰 회사인지 얼마나 다양한 사업과 기술을 가지고 있는지는 몰랐다""면서 ""포시마크와 네이버가 공유하는 가치가 비슷해 네이버에 지분을 넘기게 됐다""고 부연했다. 이어 ""포시마크를 처음 창립했을 때 목표는 몇 억 명의 사용자를 포시마크로 끌어 모으는 것이었다""면서 ""네이버와 파트너가 됐으니 꿈을 더 크게 가져봐도 좋지 않을까 생각하고, 내년 흑자전환 목표도 변함이 없다""고 강조했다.",105,https://n.news.naver.com/mnews/article/014/0004955748?sid=103
"기아, ‘인도 올해의 차’ 2개 부문 석권… 현지 진출 뒤 첫 쾌거",2023.01.15. 오후 1:04,"[디지털데일리 양원모 기자] 기아가 인도 전략형 모델 ‘카렌스‘로 인도 진출 후 처음 정상에 올랐다.기아는 15일 카렌스가 인도 최고의 권위를 자랑하는 ‘2023 인도 올해의 차(Indian Car of the Year 2023, 이하 인도 올해의 차)’로 선정됐다고 밝혔다.이뿐만 아니라 전용 전기차 EV6도 그린카(Green Car) 부문에 선정되며 인도 올해의 차 사상 최초로 같은 해에 3개 부문 가운데 2관왕을 달성한 브랜드가 되는 영예도 안았다.이번 수상은 기아가 2019년 8월 셀토스를 출시하며 인도에 본격 진출한 지 약 3년 5개월 만에 달성한 성과다. 인도 올해의 차는 인도에서 자동차 부문 가장 권위있는 상으로 현지 소비자들의 신차 구매 결정에 중요한 역할을 하고 있다.18명의 자동차 전문 기자로 구성된 인도 올해의 차 평가단은 매년 출시된 신차를 대상으로 가격, 연비, 디자인, 기술적 혁신, 안전, 주행 성능, 실용성 등을 종합 평가해 선정한다.올해는 기아 카렌스가 ▲마힌드라 스콜피오 N(Scorpio N) ▲마루티 그랜드 비타라(Grand Vitara)를 제치며 인도 올해의 차를 차지했고, 기아 EV6는 ▲타타 티아고(Tiago) EV ▲마루티 그랜드 비타라 하이브리드를 꺾으며 그린카 부문 1위에 올랐다.기아 관계자는 “2023 인도 올해의 차에서 두 개의 상을 받아 영광”이라며 “이번 수상으로 인도 시장에서 브랜드의 기술력과 역량을 인정받아 기쁘며 앞으로도 고객에게 꾸준히 사랑받는 기업이 되기 위해 노력할 것”이라고 말했다.한편 기아는 지난해 인도 시장에서 25만대 이상의 판매 실적을 기록했다. 이 가운데 카렌스는 6만 2000대 이상 판매되며 현지 고객들에게 많은 사랑을 받고 있다.",105,https://n.news.naver.com/mnews/article/138/0002140766?sid=103
