title,date,main,section,url
"카톡 쇼핑하기, '톡스토어' 온라인 공개 강의 개최",2020.12.28. 오전 11:16,"[서울=뉴시스] 이진영 기자 = 카카오커머스에서 운영하는 카카오톡 쇼핑하기가 28일 '카카오톡 스토어'(톡스토어)에 입점한 파트너사들을 위해 ‘굿바이 2020’ 온라인 공개 강의를 개최한다고 밝혔다. 톡스토어는 카카오톡 쇼핑하기 내에 판매자들이 스토어를 만들고 상품을 판매하는 서비스를 말하며, 이름만 들으면 알 수 있는 유명 브랜드부터 오프라인 백화점, 중소기업, 기초자치단체 등 국내외 약 480개에 달하는 다양한 브랜드가 톡스토어에 입점해 있다.카카오커머스는 톡스토어를 현재 이용 중이거나 앞으로 이용 예정인 판매자들을 위해 이날 ‘굿바이 2020’ 온라인 공개 강의를 진행해 올 한 해 동안 톡스토어에서 일어난 변화와 성장 그리고 서비스 개선 작성 등에 대한 정보를 공유할 계획이다.특히 이번 교육에는 톡스토어 활용법 및 톡스토어/톡딜을 통해 매출 성장을 이끌어낸 업체들의 스토리를 이용한 인터뷰 교육도 진행한다. 해당 교육에는 톡스토어 공식 전문 강사 (주)노노스 송현숙 대표가 진행을 맡고 우수 스토어로 선정된 ‘미뉴잇’, ‘우신글로벌’이 참여할 예정이다.인터뷰 교육 시에는 카카오톡 오픈 채팅방과 카카오TV 채팅을 활용해 판매자들에게 교육 참여 파트너사들이 실시간으로 질의응답을 하는 방식으로 톡스토어를 통한 판매의 강점 그리고 카카오톡에 특화된 판매 방식과 경험 등을 소개한다.이처럼 카카오커머스가 온라인을 통해 톡스토어에 대한 공개 강의를 진행하는 것은 최근 코로나19의 확산으로 새롭게 톡스토어를 개설해 운영 중인 사업자들의 성장을 돕기 위함이다. 또한 오프라인 강의 등 교육을 위한 접점이 감소함에 따라 온라인을 통한 교육을 준비하게 됐다.한편 카카오커머스는 이번 굿바이 2020 외에도 다양한 교육 프로그램을 통해 파트너사들의 성장을 위한 노력을 기울이고 있다. 우선, 톡스토어는 지난 4월부터 온라인 비대면 교육 프로그램을 기획하고 매월 2회 이상의 정규 과정을 진행하고 있다.이러한 비대면 교육 프로그램을 통해 초기 창업자 및 파트너사들에게 톡스토어 개설/전시/운영 등 기초적인 정보부터 고급 활용 단계까지 다양한 교육을 제공하고 있으며, 이외에도 톡스토어 판매센터 블로그 등을 통해 다양한 톡스토어 관련 매뉴얼과 활용 팁을 선보이고 있다. 해당 블로그의 현재 누적된 방문자 수는 200만명으로, 약 1만2000명의 판매자가 해당 채널을 통해 톡스토어 관련 정보를 받아보고 있다.카카오커머스 관계자는 ""다양한 교육 과정을 통해 중소형 톡스토어 판매자들에게 보다 더 실질적이고 효과적인 성장 기회를 제공할 예정이다""며 ""톡스토어 판매자센터 블로그 및 채널 소식을 통해 판매자와의 접점을 늘려갈 계획이다""라고 말했다.☞공감언론 뉴시스 mint@newsis.com▶ 네이버에서 뉴시스 구독하기▶ K-Artpark, 미술품 구매의 즐거운 시작▶ 뉴시스 빅데이터 MSI 주가시세표 바로가기<ⓒ 공감언론 뉴시스통신사. 무단전재-재배포 금지>",105,https://n.news.naver.com/mnews/article/003/0010263875?sid=103
"롯데정보통신, ‘AWS 300 서티파이드’ 인증 획득",2020.12.28. 오후 1:15,"클라우드 전문 역량 기반으로 고객 DT 추진 적극 나서



롯데정보통신(대표 노준형)이 클라우드 전문인력을 대거 확충하고 관련 서비스 확장에 본격적으로 나선다. 롯데정보통신은 AWS(아마존웹서비스) 공인 자격증을 300개 이상 취득해, 'AWS 300 서티파이드(Certified)'를 획득했다고 28일 밝혔다.AWS는 자사 클라우드에 대한 전문 기술과 역량을 갖춘 인력과 기업을 평가해 공인 자격증을 부여한다. 롯데정보통신은 지난 3월 'AWS 200 서티파이드'를 획득한 데 이어 100개 이상의 자격증을 추가했다. 강화된 클라우드 전문 역량을 기반으로 더 많은 고객들을 지원할 수 있게 됐다.회사는 프라이빗 클라우드에 더해 퍼블릭 클라우드 역량을 강화함에 따라 수요가 높아지고 있는 하이브리드 클라우드 시장에서 경쟁력을 키울 수 있게 됐다. 김영철 롯데정보통신 클라우드부문장은 ""'클라우드 전문기업으로서 유통, 제조, 화학, 건설 등 전 산업분야에 걸쳐 고객 특성에 맞는 클라우드 서비스를 제공할 것""이라며 ""우수한 인적 역량을 기반으로 고객의 디지털 혁신을 선도해 나가겠다""고 밝혔다. 안경애기자 naturean@dt.co.kr 디지털타임스 채널 구독 / 뉴스스탠드 구독디지털타임스 홈페이지 바로가기",105,https://n.news.naver.com/mnews/article/029/0002645505?sid=103
"넥슨, 던파IP 기반 신작 3종 공개",2020.12.28. 오후 12:08,"넥슨(대표 이정헌)'던전앤파이터(이하 던파)'의 온라인 유저 축제 '던전앤파이터 유니버스 페스티벌'을 통해 던파 지식재산권(IP)기반 신작 게임을 공개했다. 평행세계 이론을 기반으로 새로운 공간과 가정에서 전개된다.'프로젝트BBQ'는 원작에서 죽음으로 그려졌던 폭룡왕 '바칼'이 생존해 있을 가능성을 제시하며 새로운 이야기가 전개될 것임을 암시했다. '던전앤파이터 모바일'은 동일한 사건을 새로운 시각에서 바라보는 이야기로 진행된다.네오플과 일본 아크시스템웍스가 공동 개발 중인 미공개 신작 'DNF Duel(가제, 던전앤파이터 듀얼)'도 최초로 공개했다. DNF Duel은 던파 캐릭터를 활용한 2D 대전격투 액션게임이다. '길티기어' 개발사로 알려진 아크시스템웍스와의 시너지로 최고 액션성을 구현한다는 계획이다.이현수기자 hsool@etnews.com▶ ""머천다이징 핵심전략 워크숍 2021"" 20일 개최▶ 네이버 홈에서 [전자신문] 구독하기 [Copyright ⓒ 전자신문 & 전자신문인터넷, 무단전재 및 재배포 금지]",105,https://n.news.naver.com/mnews/article/030/0002920558?sid=103
'코로나 수혜' K웹툰 대전의 승자는?…네이버·카카오 '격돌',2020.12.28. 오후 4:24,"네이버 웹툰 원작 스위트홈·경이로운 소문 넷플릭스 '인기'코로나에 비대면 문화 확산…콘텐츠 수요 급증



정보기술(IT)업계에 따르면 네이버웹툰은 제작 예정인 자사 인기 웹툰·웹소설 지적재산권(IP) 기반 영상화 계획을 28일 발표했다. 사진=한경DB국내 대표 포털 네이버와 카카오가 신종 코로나바이러스 감염증(코로나19) 시대 수혜 분야로 손꼽히는 콘텐츠 영역에서 뜨거운 경쟁을 벌이고 있다. 포털 내 서비스 중인 웹툰과 웹소설 등 1차 콘텐츠를 기반으로 영화·드라마 등을 선보이면서 주도권 싸움에 나선 모습이다.28일 정보기술(IT)업계에 따르면 네이버웹툰은 제작 예정인 자사 인기 웹툰·웹소설 지적재산권(IP) 기반 영상화 계획을 이날 발표했다. 인기 웹툰을 원작으로 한 드라마 '스위트홈'과 '여신강림' 등이 한국뿐 아니라 해외에서도 큰 호응을 얻자 내년부터 본격적으로 영화·드라마 등 2차 콘텐츠를 확대하고 있는 것이다.앞서 지난 18일 넷플릭스를 통해 선보인 스위트홈은 공개 하루 만에 국내 순위 1위를 기록했다. 태국·필리핀·싱가포르 등 적지 않은 해외 여러 국가에서도 단순에 1위에 올랐다. 스위트홈은 김칸비·황영찬 작가가 2017년 연재를 시작해 지난 7월 완결한 작품으로, 줄곧 네이버 금요웹툰 상위권에 올라 인기가 검증된 웹툰이다. 원작 웹툰은 영어·일본어·프랑스어·스페인어·중국어 등 여러 언어로 번역돼 글로벌 누적 조회 수 12억뷰를 돌파해 화제가 된바 있다.카카오도 앞서 인기 다음웹툰을 OCN 드라마 '경이로운 소문'으로 영상화하고 넷플릭스를 통해 선보인 바 있다. 해당 웹툰은 6400만 조회수를 기록할 만큼 호평을 받은 작품이다. 지난달 넷플릭스에서 독점 공개한 뒤 이달 16일 국내 넷플릭스 인기 차트 1위에 올랐다.앞서 카카오페이지에서 서비스한 웹툰 '이태원 클라쓰'는 JTBC 드라마로 제작돼 최고 시청률 16.5%를 기록하기도 했다. 최근 카카오페이지는 게임 '미르의 전설' 시리즈를 웹툰 '미르의 전설:금갑도룡'으로 제작하고 연재를 시작했다.이처럼 웹툰·웹소설 원작 드라마·영화가 흥행가도를 타면서 최근 네이버와 카카오는 콘텐츠 역량을 강화하고 공격적으로 IP 기반 영상화 사업에 진출하고 있다. 특히 웹툰 시장이 코로나19 여파에서 자유로운 모습을 보이면서 이 같은 경향이 가속화되고 있다.실제로 한국콘텐츠진흥원의 '2020년 만화·애니메이션·캐릭터·음악 이용자 실태조사' 보고서에 따르면 코로나19 여파로 웹툰 등 디지털 만화 이용이 증가했다는 응답자가 전체의 37.4%에 달했고, 감소했다는 비율은 8.9%에 불과했다. 당분간 코로나19 확산이 진정되지 않을 것으로 예상됨에 따라 내년에도 콘텐츠 소비 규모는 더욱 증가할 것으로 예상된다. 이에 따라 네이버는 내년에도 IP 기반 영상화 콘텐츠를 대거 선보일 전망이다.네이버웹툰에 따르면 회사 측은 내년 1월 네이버 시리즈 웹소설를 원작으로 한 JTBC 월화드라마 '선배, 그 립스틱 바르지 마요'를 선보인다. 또 상반기 중 네이버웹툰 '간 떨어지는 동거'를 tvN 드라마로 제작해 공개한다. 이 외에도 네이버 인기 웹툰·웹소설 '유미의 세포들', '연의 편지', '나노리스트'가 애니메이션으로, '용감한 시민', '전지적 독자 시점' 등이 영화로 공개된다.카카오도 카카오페이지를 통해 장기 프로젝트에 돌입한다. 2023년까지 웹툰 65작품을 드라마로 만든다. 카카오TV도 15편 안팎의 드라마를 공개할 계획이다. 네이버웹툰 관계자는 ""웹툰과 웹소설이 전 세계 독자들로부터 작품성을 인정받아 드라마·영화·애니 등의 원천 콘텐츠로 주목받고 있다""며 ""앞으로도 다양한 작품들을 영상화해 'K-콘텐츠' 산업 성장에 기여하겠다'고 말했다.조아라 한경닷컴 기자 rrang123@hankyung.com▶ 경제지 네이버 구독 첫 400만, 한국경제 받아보세요▶ 한경 고품격 뉴스레터, 원클릭으로 구독하세요▶ 한국경제신문과 WSJ, 모바일한경으로 보세요 ⓒ 한국경제 & hankyung.com, 무단전재 및 재배포 금지",105,https://n.news.naver.com/mnews/article/015/0004474384?sid=103
"팜한농, 안전관리 우수연구실 인증 획득…""농업 기업 최초""",2020.12.28. 오전 10:03,"팜한농 작물보호연구소[팜한농 제공. DB 및 재판매 금지]    (서울=연합뉴스) 김철선 기자 = LG화학의 농업 사업 자회사 팜한농은 자사 작물보호연구소와 육종연구소가 농업계 기업 최초로 과학기술정보통신부 '안전관리 우수연구실 인증'을 받았다고 28일 밝혔다.    인증을 획득한 연구실은 팜한농 작물보호연구소 안전성연구팀 기기분석실과 육종연구소 생명공학팀 실험실 등 2곳이다.    과거 농업 관련 공공기관 연구소가 인증을 취득한 사례도 있었지만, 민간 농업계 기업 산하 연구소의 인증 취득은 팜한농이 최초라고 설명했다.    이재하 팜한농 환경안전기획팀장은 ""이번 안전관리 우수연구실 인증은 연구원들이 쾌적한 환경에서 연구에 매진할 수 있도록 안전관리를 강화한 결과""라며 ""앞으로 쾌적하고 안전한 연구 환경을 조성할 수 있도록 노력하겠다""고 말했다.     kcs@yna.co.kr▶네이버에서도 뉴스는 연합뉴스[구독 클릭]▶[팩트체크]정차상태서 택시기사 폭행, 특가법?▶제보하기<저작권자(c) 연합뉴스(https://www.yna.co.kr/), 무단 전재-재배포 금지>",105,https://n.news.naver.com/mnews/article/001/0012104486?sid=103
"‘영업통’ 내부 출신 첫 수장 황현식, LGU+ 신사업 고삐",2020.12.28. 오후 11:22,"[통신3사 CEO] 황현식 LG유플러스 대표이사 사장   [디지털데일리 최민지기자] 현장과 영업에 정통한 통신 전문가, 6년만에 사장직을 부활시킨 주인공, 내부 출신 첫 LG유플러스 최고경영자(CEO) 타이틀을 획득한 인물. 이 모든 수식어가 가리키는 이는 LG유플러의 새로운 수장, 황현식 대표다. 그동안 황 대표는 본업인 통신사업을 진두지휘하며 최전선에 서 왔다면, 이제는 LG유플러스 미래를 책임질 신사업을 직접 챙기며 고삐를 잡는다.    지난달 LG유플러스는 황현식 컨슈머사업총괄 사장을 차기 CEO로 선임했다. LG유플러스에서 성장해 CEO가 된 최초의 역사를 기록한 그는 대표직을 이어받자마자 신성장동력 발굴에 대한 의지를 드러냈다.    앞서, LG유플러스는 유‧무선 성장세와 효율적인 비용통제를 통해 3분기 연속 어닝서프라이즈를 달성하며 역대급 실적을 보여줬다. 특히 본업에서 성장세는 3사 중 가장 강하다. 지난 3분기만 보더라도 LG유플러스 무선사업 매출은 전년동기대비 0~1%대 성장률을 보인 경쟁사들과 비교해 5.4%나 올랐으며, 무선 가입자당평균매출(ARPU)도 나홀로 전분기대비 0.7% 상승했다. 이와 동시에 미디어 사업도 꾸준히 약진하고 있으며, LG헬로비전 인수 후 유료방송 및 알뜰폰 사업에서도 경쟁력을 확보했다.    이제는 비통신분야에서 성장성을 보여줄 차례다. 황 대표 전문분야인 본업 통신사업은 기존대로 잘하면서, 기업의 미래를 책임질 다음 먹거리를 찾겠다는 것이다.    지난 3분기 실적을 살펴보면, LG유플러스 사업부문은 ▲컨슈머 모바일 ▲컨슈머 스마트홈‧전화 ▲기업 인프라로 구분된다. 유‧무선 및 미디어를 제외한 비통신분야 사업은 기업인프라로 볼 수 있다. 기업인프라는 인터넷데이터센터(IDC), 솔루션, 기업회선 등으로 이뤄져 있다. LG유플러스는 기업 신사업을 확대하기 위해 5G 자율주행 로봇 등 스마트팩토리 솔루션을 적용하고 스마트시티 및 자율주행 실증 확대에 나서고 있는 상황이다. 지난 3분기 기업인프라 매출은 클라우드 수요 확대와 솔루션 신사업 성장으로 전년동기대비 2.7% 늘었으나, 별도 기준 전체 매출의 3%에도 미치지 못한다.  



  이와 관련 황 대표는 조직개편을 단행, 신규사업추진부문을 신설하고 부문장을 직접 맡기로 했다. CEO가 신사업을 도맡아 성장속도에 드라이브를 걸겠다는 뜻이다. 신규사업추진부문은 ▲스마트 헬스 ▲보안 ▲교육 ▲광고 ▲콘텐츠 ▲데이터 사업 등 산재된 사업 조직을 모았으며, 기존 사업에서 독립해 전문성을 강화한 후 성장기회 발굴 및 수익창출을 도모하는 사업구조를 만드는 데 방점을 둔다. 기업부문에는 ‘기업신사업그룹’을 산하에 두고 5G 기업(B2B) 신규사업 성장을 끌어낸다.    동시에, 황 대표는 현재 공석인 컨슈머사업부문도 함께 챙긴다. 그동안 황 대표는 컨슈머사업총괄을 역임하며 모바일 사업 전문가로 두각을 드러내 왔다. 이에 인사가 날 때까지 무리 없이 공백을 채울 수 있다. 실제 황 대표는 LG텔레콤 시절부터 20여년간 통신사업 영업 최일선에서 뛰어왔으며, 모바일부터 인터넷TV(IPTV), 인터넷까지 총괄해 왔다.   한편, 황 대표는 1991년 LG 회장실에 입사 후 잠시 컨설팅기업 PW&C로 자리를 옮겼다, 1999년 LG텔레콤 사업개발팀 부장으로 돌아왔다. 이후 경북 사업부장, 강남사업부장, 영업지원담당, 영업전략담당, 영업전략실장을 지냈다. 가입자 유치 경쟁이 치열한 시절, 소비자(B2C) 영업분야에서 이름을 알렸다.    이후 2010년부터 2013년까지 ㈜LG에서 경영관리팀장으로도 근무해 그룹 사정에도 밝은 편이다. 당시 보좌조직을 강화한 고(故) 구본무 회장은 ㈜LG에서 계열사 경영을 관리하는 경영관리팀을 전자팀, 화학팀, 통신서비스팀으로 구분해 운영했다. 여기서 통신서비스팀을 황 대표가 맡았다.  



  LTE 경쟁이 치열하게 전개된 시절, 2013년 말 LG유플러스는 황 대표를 소환했다. 3G를 건너뛰고 LTE로 진입할 수밖에 없었던 주파수의 저주를 기회로 삼아, LTE 시장에서 역전을 꿈꾼 LG유플러스 포부와도 맞닿아 있는 결정이었다. 당시 이상철 전 대표는 1등 LTE를 외치며, 2013년 커버리지 확대를 빠르게 꾀하기 위해 화웨이 통신장비 도입을 확정했다. 아울러, 황 대표를 다시 불러들여, LTE 영업망을 강화해 고객 유치에 가속도를 붙였다. 2014년부터 황 대표는 MS본부장을 담당했다.    이 때 LG유플러스는 파격 행보를 이어갔다. 데이터 무제한 요금제를 출시한 데 이어 2014년 9월 아이폰 출시 7년만에 처음으로 ‘아이폰6’를 공급받기 시작했다. 중고폰 보장 프로그램인 ‘제로클럽’을 내세우기도 했다. 통신3사 경쟁에도 불이 붙으며 ‘아이폰6 대란’이 일어난 사건은 유명하다. 불법보조금 대신 투명한 유통시장을 조성하겠다며 정부는 ‘이동통신단말장치 유통구조 개선에 관한 법률(단통법)’을 시행하며, 통신시장은 급변기에 들어섰다.    2015년 12월 PS본부를 맡은 황 대표는 이듬해 KB국민은행과 손을 잡고 통신‧금융상품 출시를 예고했으며, 다단계 판매로 국정감사에서 곤욕을 치르기도 했다. 2018년 속도제한 없는 무제한 데이터 LTE 요금제를 처음 출시하며, 시장에 반향을 일으켰으며 2019년 5G 요금제를 첫 공개하며 5G 시장에서도 팔을 걷었다. 이때 LG유플러스는 PS부문을 사장급으로 격상했다. 2013년 신용삼 사장 이후 처음이다.    그리고 1년 후, 황 대표는 LG유플러스 CEO로 낙점됐다. 부회장 직급에서 대표이사 사장으로 낮아졌지만, 내부 출신 첫 CEO라는 점은 의미가 깊다. 지난 24일 황 대표는 온라인 송년회를 통해 임직원과 소통의 시간을 가졌다. 황 대표는 “자기 자신을 사랑하는 사람이 일을 사랑하고, 일을 사랑하는 사람이 회사도 사랑할 수 있다”며 “사랑을 키우고 성장시키려는 마음이 중요하고 건강도 잘 챙겨야 한다”는 송년메시지를 전한 것으로 알려졌다.    <최민지 기자>cmj@ddaily.co.kr▶ 네이버에서 디지털데일리 채널 구독하기▶ IT정보의 즐거운 업그레이드 [딜라이트닷넷]<저작권자 © 디지털데일리 무단전재-재배포금지>",105,https://n.news.naver.com/mnews/article/138/0002096763?sid=103
캠핑·혼술 상품 '불티'…코로나가 바꾼 소비생활,2020.12.28. 오후 12:43,"실내에서는 취미 활동, 야외에서는 소수 참여 가능한 캠핑 인기



사진=네이버 제공네이버는 지난 1월부터 11월까지 스마트스토어에서 팔린 상품들을 분석한 결과, 신종 코로나바이러스 감염증(코로나19) 여파로 구매자들의 소비 문화가 변화하고 있다고 28일 밝혔다.네이버에 따르면 코로나19 우려로 비대면 소비 문화가 확산되면서 전체 상품들의 판매량이 전년 대비 증가했다. 특히 외부 활동이 감소하고 일상생활 대부분을 집안에서 해결하다보니 다양한 의식주 상품 수요가 늘어나고 있는 것으로 나타났다. 사회적 거리두기 여파로 불특정 다수와 한 공간에 있는 것을 기피하면서 소수인원으로 즐길 수 있는 야외 활동 관련 용품들의 소비도 급증한 것으로 조사됐다.의식주 부문에서 코로나19 영향으로 실내 활동이 많아지면서 외출복보다는 잠옷·속옷, 홈웨어·트레이닝복 등 실내 의류 제품들이 전년 대비 크게 증가했다.잠옷·속옷은 전년 대비 62%, 같은 기간 홈웨어·트레이닝복은 71% 판매가 늘었다. 식품은 전년 대비 89%의 높은 성장률을 보이며 모든 상품 카테고리를 통틀어 전년 대비 가장 큰 폭으로 증가했다. 집에서 편하게 먹을 수 있는 간편식, 가공식품, 간편조리식품은 98%의 성장세를 보였으며, 혼술족이 늘어나면서 야식·홈술 관련 상품은 152%나 소비가 늘어났다. 이 외에도 아이들 간식거리인 제과나 유제품·아이스크림은 각각 102%, 131% 증가했다. 반면, 외식상품권이나 음료·베이커리 교환권은 작년 대비 성장이 감소한 것으로 나타났다.인테리어 소품과 수납가구 용품, 생활·주방 가전 및 컴퓨터 용품에서도 높은 성장을 보였다. 집에 머무르는 시간이 늘어나 자기만의 공간을 꾸미고 가전제품을 교체하고자 하는 수요가 급증한 영향으로 풀이된다. 인테리어 소품은 64%, 아동 가구는 100%, 주방 가전은 84%의 성장률을 기록했다. 특히, 재택근무 및 홈스쿨링이 장기화되면서 PC 용품은 110%나 늘어난 것으로 집계됐다.한편, 여가 생활 부문에서는 코로나19 장기화로 외출보다는 집에서 혼자 취미를 즐기려는 사람들이 늘어난 것으로 조사됐다.홈트레이닝 상품인 헬스, 요가, 필라테스 관련 용품과 실내 또는 단기로 즐길 수 있는 취미 관련 상품인 원데이클래스·자기계발·취미 레슨, 수예 용품 등의 구매가 전년 대비 큰 폭으로 늘어났다.홈트 용품은 전년 대비 88% 증가했고, 특히 요가·필라테스 용품 및 헬스 용품은 각각 103%, 83%의 성장률을 기록했다. 원데이클래스·취미 레슨은 전년 대비 400%를 웃도는 높은 성장세를 보였다.반면, 해외여행, 영화·공연, 레저이용권과 같은 상품들은 전년 대비 각각 57%, 64%, 83% 마이너스 성장률을 기록했다. 혼자 또는 소수 인원으로 즐길 수 있는 야외활동에 나서는 사람들이 늘어난 영향으로 분석된다.캠핑은 사회적 거리두기를 하면서 즐길 수 있는 야외활동으로 알려지면서 전년 대비 218%의 성장률을 기록했다. 소수 인원으로 즐길 수 있는 골프, 낚시도 사람들에게 각광을 받으며 각각 108%, 91%의 많은 판매를 보였다.조아라 한경닷컴 기자 rrang123@hankyung.com▶ 경제지 네이버 구독 첫 400만, 한국경제 받아보세요▶ 한경 고품격 뉴스레터, 원클릭으로 구독하세요▶ 한국경제신문과 WSJ, 모바일한경으로 보세요 ⓒ 한국경제 & hankyung.com, 무단전재 및 재배포 금지",105,https://n.news.naver.com/mnews/article/015/0004474178?sid=103
"“20대 조난·50대 실족 많아”…서울시, 데이터 기반 산악사고 대책",2023.10.15. 오전 11:42,"서울시가 등산객 산악 사고를 분석한 결과 조난 사고가 가장 많은 나이대는 20대, 실족·추락 사고가 많은 나이대는 50대로 나타났습니다. 서울시는 등산객이 늘어나는 가을철을 맞아 안전 대책을 추진하기 위해 산악 사고 데이터를 분석한 결과를 발표했습니다. 먼저 산악사고 건수는 2019년에 925건, 2020년 1천217건, 2021년 1천287건, 지난해 1천429 건으로, 매년 증가했습니다.  특히, 서울시는 연중에는 10월, 시간대로는 주말 오후 1∼3시 사이 출동이 가장 많다고 설명했습니다. 연령별로는 50대 구조대상자가 가장 많은 것으로 나타났습니다.  사고 원인별 분석해 보았을 때는 20대는 조난사고, 50대는 실족·추락 사고가 많은 것으로 조사됐습니다. 서울시는 이 같은 분석 결과를 바탕으로 사고다발지역 집중관리, 연령대별 맞춤형 사고 대처방안, 산악구조 훈련 등의 예방 대책을 마련한다는 계획입니다.■ 제보하기▷ 전화 : 02-781-1234, 4444▷ 이메일 : kbs1234@kbs.co.kr▷ 카카오톡 : 'KBS제보' 검색, 채널 추가▷ 네이버, 유튜브에서 KBS뉴스를 구독해주세요!",105,https://n.news.naver.com/mnews/article/056/0011582134?sid=103
