title,date,main,section,url
"간암 원인 C형간염, 국가검진 도입 연구만 되풀이…왜?",2022.09.20. 오후 3:30,"WHO·美, 적극 퇴치 기조 대조적 우리나라, 타당성 조사 세번째 반복·논의 제자리보건당국이 의뢰한 C형간염의 국가건강검진 도입 타당성 연구 세 번째 결과가 올해 하반기 발표될 예정인 가운데 향후 국가검진에 도입 여부 결정을 두고 관심이 쏠린다.C형간염은 혈액을 매개로 감염되는 감염병이다. 대부분 특별한 증상이 없기 때문에 환자 스스로도 감염 사실을 인지하기 어렵다. 때문에 자신도 모르는 사이 비위생적인 미용시술이나 손톱깎이, 면도기 등을 통해 일상에서 전파시킬 수 있다.문제는 한 번 감염되면 70% 이상이 만성 C형간염으로 진행된다는 점이다. 이 가운데 30%~40%는 간경변이나 간암 등으로 진행된다. 일단 간경변증으로 발전하게 되면 간이식이 요구되지만 공여자가 부족하고 이식 및 이식 이후 치료에도 상당한 비용이 든다.만약 간암으로 발전하면 5년 생존율은 40%에 불과하다. 현재 우리나라 40대~50대 암 사망률 1위는 간암이며, 치료비도 전체 암종 가운데 두 번째로 많이 든다.



C형간염 이후 간암까지의 발전 모습 (사진=존스홉킨스의대 유튜브 캡처)그렇지만 C형간염은 치료가 어려운 감염병이 아니다. 99%의 환자가 먹는 치료제를 통해 완치된다. 관건은 제때 진단이 이뤄지느냐다.과거 의원에서의 집단감염 사태가 발생하면서 사회적 논란과 함께 C형간염의 위험성이 알려지자 의료계에서는 C형간염을 이대로 방치해서는 안 되고 국가건강검진 항목으로 포함시켜 조기 발견 등의 체계적인 관리가 필요하다고 요구해왔다. C형간염 단계에서 치료가 이뤄지면 주 생산 활동 연령대의 간암 사망률을 낮출 수 있어 사회·경제적 비용 절감 효과가 있다는 것이다.이미 국제사회는 C형간염 퇴치에 전향적으로 나서고 있다. 세계보건기구(WHO)는 오는 2030년 C형간염 퇴치를 목표로 세우고 C형간염 검진과 치료지원 등의 정책을 펴고 있다. 미국도 ‘국가 간염 검사의 날’을 제정해 C형간염 퇴치에 노력을 기울이고 있다.때문에 과거 수차례 국회 보건복지위원회 국정감사에서 C형간염의 국가건강검진 항목 도입을 촉구하는 지적이 나왔지만, 제대로 된 대책은 나오지 못했다.관련해 최근 3년간 연평균 약 1만 명의 환자가 C형간염을 진단받았는데, 이 가운데 치료를 마친 환자는 불과 40%~60%였다. 이는 환자들이 제때 감염 여부를 확인할 진단 기회를 얻지 못하는 것과 연관이 깊다. 수치는 나중에 C형간염 감염 여부를 인지해도 치료기회를 놓치는 안타까운 상황이 발생하고 있음을 보여준다.윤석열 정부는 국정과제 가운데 하나인 ‘감염병 대응체계 고도화’에 따라, C형간염 국가검진 도입에 대한 국가검진위원회 논의와 더불어 환자 지원방안 체계화가 필요하다고 강조한 바 있다.이에 따라 보건복지부는 연구결과와 유병률, 비용효과성 등에 대한 전문가 검토를 거쳐 국가건강검진 원칙에 근거, 건강검진 항목 도입을 재검토할 계획이라는 입장을 밝혔다. 앞선 두 번의 타당성 조사와 함께 이번까지 총 세 번의 연구를 실시, 곧 결과를 발표할 예정이지만 국가검진위원회에서의 논의가 이뤄질지는 여전히 미지수다.김범경 연세대 세브란스병원 소화기내과 교수는 “국내 C형간염 환자 수는 약 30만 명으로 추산되지만 이 가운데 치료받은 환자는 약 20%에 불과하다”면서 “20만 명 이상의 환자가 자신이 C형간염 환자라는 사실을 모르고 있으며, 전파 위험까지 고려한다면 환자 수는 기하급수적으로 증가할 수 있다”고 우려했다.아울러 “C형간염은 예방 백신이 없어 조기 검진과 치료가 유일한 예방법”이라며 “감염의 고리를 차단하기 위해서 국가건강검진 도입을 통해 숨어있는 환자들을 찾아내야 한다”고 조언했다.",105,https://n.news.naver.com/mnews/article/092/0002268534?sid=103
"이종호 장관, 실리콘밸리 디지털 혁신기업 현장 방문",2022.09.20. 오전 11:33,(서울=연합뉴스) 이종호 과학기술정보통신부 장관(왼쪽)이 19일(현지시간) 미국 실리콘밸리 로블록스를 방문해 기념 촬영하고 있다. 2022.9.20 [과학기술정보통신부 제공. 재판매 및 DB 금지]    photo@yna.co.kr,105,https://n.news.naver.com/mnews/article/001/0013449356?sid=103
,,,105,https://n.news.naver.com/mnews/article/236/0000227614?sid=103
세계 3대 로봇 강국을 향해,2022.09.20. 오후 4:04,"정부가 '세계 3대 로봇 강국'을 국정과제로 삼은 가운데 관련 업계가 스마트팩토리 핵심 기술인 협동로봇·물류로봇 등의 기술력 고도화, 주요 부품 국산화에 박차를 가하고 있다. 20일 서울 성동구 뉴로메카에서 엔지니어가 협동로봇 '인디'를 점검하고 있다.",105,https://n.news.naver.com/mnews/article/030/0003045354?sid=103
"[테크코리아2022]신순우 피엔티 연구소장 ""전기차 배터리 전극 장비 라인업 강화""",2022.09.20. 오후 3:02,"신순우 피엔티 연구소장이 이차전지 시장동향 및 전극공정장비 기술개발 트렌드를 주제로 발표하고 있다.피엔티가 전기차 배터리 시장에서 전극 공정 장비 개발 역량을 강화한다. 기존 금형 노칭뿐 아니라 레이저 노칭 장비를 개발해 배터리 생산성을 올리면서 전기차 배터리 전극 시장을 선점할 계획이다.신순우 피엔티 연구소장이 20일 테크코리아 2022 주제 발표에서 전극 노칭 장비 개발 로드맵을 공개했다. 신 소장은 “피엔티가 개발한 금형 노칭 장비는 전기차 배터리용 570m 양극, 음극 극판을 분당 80m 자를 수 있다”며 “레이저 노칭 장비도 개발하고 배터리 생산 공정에 적용할 예정”이라고 밝혔다. 그는 “레이저 노칭 장비로 금형 노칭 보다 전기차 배터리 전극 생산성을 극대화할 수 있을 것”이라고 강조했다.피엔티는 국내 전기차 배터리 장비 업체다. 특히 국내 전극 공정 장비 시장을 주도하고 있다. LG에너지솔루션, 삼성SD, SK온에 전극 공정 장비를 납품하고 있다. 전극은 배터리 양극, 음극을 만드는 핵심 소재다. 양극, 음극, 분리막과 전해질과 함께 넣어 리튬이온 배터리를 생산한다. 신 소장은 “전극 시장은 전기차 배터리 수요에 올해 40억달러에서 2025년 70억달러로 2배 이상 커질 것”이라며 “2030년 90억달러까지 증가할 것으로 전망”고 말했다.피엔티는 국내뿐만 아니라 해외 고객사에 전극 장비 공급을 확대하고 있다. 유럽, 미국을 중심으로 전기차 배터리 수요가 빠르게 증가하고 있어서다. 전기차 배터리 시장 규모는 연평균 29% 성장하면서 2025년 1367기가와트시(GWh) 규모로 성장할 것으로 예상된다.신 소장은 “피엔티는 코터, 프레스, 슬리터 등 전극 장비 공급을 확대할 것”이라면서 “전극 제조 장비 기술에 인공지능(AI) 기반의 학습 알고리즘을 구축해 지능적으로 운영 제어할 수 있는 롤트롤 기반 전극 장비 개발을 강화하고 있다”고 설명했다. 피엔티는 전기차 배터리 에너지 밀도, 수명, 충전 속도 등 배터리 성능이 강화되는 기술 개발 트렌드에 맞춰 전극 장비 개발, 공급을 확대할 계획이다.",105,https://n.news.naver.com/mnews/article/030/0003045277?sid=103
美 제재 속 신시장 개척하는 화웨이…토털솔루션 기업으로 변신,2022.09.20. 오후 5:26,"미국 화웨이 제재 속에 스마트폰·통신장비 고전디지털 전환 수요 맞춰 엔터프라이즈 서비스 분야 키워후발주자지만 세계 5위 클라우드 점유율R&D투자 지속…파트너사 생태계 육성 의지도



[이데일리 김정훈 기자][태국 방콕 = 이데일리 정다슬 기자] 미중 패권전쟁의 직격탄을 맞은 화웨이가 기업의 디지털 혁신을 돕는 토탈 솔루션 기업으로 변신 중이다. 미국의 제재로 스마트폰과 통신장비 산업이 어려움을 겪고 있는 가운데 급증하고 있는 기업들의 디지털 전환 수요에 맞춰 인프라부터 데이터, 클라우드 서비스까지 제공하겠다는 것이다.19일부터 21일까지 사흘에 걸쳐 태국 방콕 QSCC에서 열리는 ‘화웨이 커넥트 2022’는 ‘디지털화 촉발’(Unlease Digital)이라는 주제로 진행됐다. 코로나19 팬데믹과 기후변화, 국제정세의 변화 등 불확실성이 커지며 세계경제의 침체 속에서도 기업들의 디지털 전환 수요는 늘어나고 있다. 세계 디지털 경제는 2021년 15.6% 성장하고 디지털 혁신 전략을 세운 기업 역시 2년 전보다 42% 증가했다. 이에 따라 디지털 혁신을 위한 기업의 직접투자 역시 2022년부터 2024년까지 매년 16.5% 성장할 것으로 예상된다.



라이언 딩 화웨이 EBG 총괄사장이 20일 태국 방콕에서 열린 화웨이 커넥트에서 ‘산업 역량 강화, 가치창출’이라는 주제로 기조연설을 하고 있다. 딩 사장은 산업역량을 위해서는 연결, 컴퓨팅, 클라우드라는 핵심 기술이 필요하며 화웨이는 이를 모두 제공할 수 있는 기업이라고 강조했다. (사진=화웨이)하드웨어 기술력에 솔루션까지 패키지로 제공화웨이는 이 시장을 공략하고 있다. 라이언 딩 엔터프라이즈사업그룹(EBG)총괄사장은 20일 기조연설에서 고객에게 혁신적인 솔루션을 제공하기 위한 세 가지 기술을 △연결 △컴퓨팅 △클라우드로 정의하고 “인프라를 구축한 후 파트너와 협력해 다양한 시나리오를 심층 분석해 고객을 위한 가치를 창출한다”고 강조했다. 글로벌 통신장비 1위 업체인 화웨이가 강점을 가진 하드웨어 인프라뿐만 아니라 솔루션까지 ‘패키지’로 전달한다는 뜻을 내포하고 있다.밥 첸 EBG 부사장은 ‘패키지 솔루션’의 한 사례로 스마트폴(smart pole)을 소개했다. 종전에는 폐쇄(CC)TV를 야외에 설치한다고 하면 CCTV에 에너지를 공급하기 위한 전원과 CCTV를 관리하기 위한 모듈, 전원과 CCTV를 잇는 전선 등이 필요했다. 이를 각각 서로 다른 업체가 담당해야 했기 때문에 설치에도 많은 시간이 걸렸고 시운전하는 시간도 필요했다. 또 문제가 발생했을 때 책임소재 역시 불분명했다. 그러나 화웨이는 마이크로웨이브, 와이파이 6 백홀, 그리고 광케이블을 활용한 이더넷전원장치(PoE) 등의 기술을 활용해 별도의 장치 없이 폴 하나만 세우면 되는 솔루션을 제공한다.



하웨이 커넥트가 열리는 태국 방콕의 QNCC에 마련된 화웨이 전시장. 사람들이 화웨이 제품들을 구경하고 있다. (사진=정다슬 기자)전시관 중앙에 마련된 ‘풀스택 데이터센터’는 화웨이의 기술력의 집합체였다. 안정적으로 서비스를 제공하기 위해 스토리지 내 컨트롤러를 8개로 나누고 디스크를 소형화·효율화시켜 단위상면당 더 높은 용량과 성능을 제공한 한편, 에너지 소비량도 줄였다. 김종렬 화웨이 상무는 “화웨이는 제품설계부터 칩셋까지 모두 자체적으로 개발하고 있기 때문에 다른 밴더보다 훨씬 높은 다양한 프로토콜의 성능을 제공할 수 있다”며 “네트워크 장비 쪽 성능 부분은 어느 밴더보다 훨씬 월등한 성능과 안정성을 제공한다고 자신할 수 있다”고 했다.여기에 화웨이는 파트너사와의 협력을 바탕으로 하드웨어뿐만 아니라 소프트웨어 부문 역량도 강화하고 있다. 화웨이는 행사를 계기로 CCE (Cloud Container Engine)터보, 팡구 웨이브 모델, 데이터 아트 레이크 포메이션, 가상 라이브, 코드 체크와 클라우드 서비스, 가상 라이브 등15개 새로운 서비스를 론칭했다. 클라우드를 통해 인공지능(AI) 개발과 데이터 거버넌스, 디지털 콘텐츠, 소프트웨어(SW) 개발 등을 할 수 있도록 지원하고 고객이 클라우드 기반 기술과 자원을 최대한 활용할 수 있도록 심층 컨설팅도 진행한다.올 상반기 엔터프라이즈 사업 전년비 27.6% 성장화웨이의 이같은 변신은 미중 패권 전쟁과도 무관치 않다. 4차 산업 주도권을 쥐려는 양국의 경쟁이 치열하게 진행되는 가운데, 세계 통신장비 1위 업체로서 5G 기술력을 자랑하는 화웨이는 미국의 블랙리스트에 올랐다. 화웨이에는 미국의 기술력이 들어간 반도체 등의 공급이 중단되고 구글의 운영체제(OS)인 ‘안드로이드’도 사용할 수 없게 됐다. 화웨이는 중저가 핸드셋 브랜드인 ‘아너’도 매각한 상태이다. 가장 큰 매출을 자랑하던 스마트폰을 포함한 컨슈머 사업 부문 매출은 2021년 기준 2434억 3100만위안(48조 3575억원)으로 2020년(4829억 1600만위안) 대비 절반 가까이 감소했다. 여기에 미국의 견제 속에 통신장비 등을 포함한 캐리어 부문 매출 역시 2021년 약 7% 역성장하는 등 부침을 겪고 있다.이 가운데서도 컴퓨팅, 클라우드, 서버, 스토리지 등 기업들을 대상으로 한 디지털 혁신 솔루션을 제공하는 엔터프라이즈 사업은 꾸준한 성장세를 그리고 있다. 딩 사장은 이날 행사에서 “여러분의 성원 덕분에 올해 상반기 엔터프라이즈 비즈니스 수익은 81억 7000만달러로 2021년보다 27.6% 증가했다”고 밝혔다. 2017년 시작된 화웨이 클라우드는 경쟁사 대비 느린 시작에도 가트너 기준 2021년 세계 클라우드 시장 점유율 5위를 차지했다.총 매출은 쪼그라들었지만, 화웨이는 R&D 투자는 줄이지 않고 있다. 2021년 기준 화웨이의 R&D 투자액은 1427억위안(28조원)이다. 삼성전자보다 20% 많다. 글로벌 파트너 투자에도 3년간 3억달러(4167억원)를 투자한다는 계획도 밝혔다. 미국의 견제 속 화웨이와 생태계를 꾸려갈 아군을 적극적으로 키워나가겠다는 것이다.3년만 오프라인서 개최된 이번 화웨이 커넥트에는 1만여명의 ICT관계자들이 참석했다. 태국뿐만 아니라 인도네시아, 방글라데시, 필리핀 등 아세안 주요 정치인들의 축사가 이어졌다. 화웨이커넥트는 태국 방콕 일정 이후 아랍에미리트 두바이와 프랑스 파리에서 개최된 뒤, 11월 화웨이 본사가 있는 중국 선전에서 마무리된다.",105,https://n.news.naver.com/mnews/article/018/0005321448?sid=103
"SKT-보령LNG터미널-퀀텀센싱, '양자가스센싱 실증' MOU",2022.09.20. 오전 9:18,"(서울=연합뉴스) 김동만 퀀텀센싱 대표이사(왼쪽부터), 하민용 SK텔레콤(SKT) 최고사업개발책임자, 김봉진 보령 LNG터미널 대표이사가 지난 19일 충청남도 보령에 위치한 LNG 저장탱크에 양자가스센싱 시스템을 설치·적용하기로 하는 업무협약(MOU)을 체결하고 기념 촬영하고 있다. 2022.9.20 [SK텔레콤 제공. 재판매 및 DB 금지]    photo@yna.co.kr",105,https://n.news.naver.com/mnews/article/001/0013448767?sid=103
"[르포] ""안내견이 더 오래삽니다""...삼성 안내견학교 가보니",2022.09.20. 오후 5:15,"시각장애인 삶의 동반자...일반 개보다 평균 수명 1~2년 길어삼성은 고(故) 이건희 삼성 회장의 뜻에 따라 시각장애인을 위한 안내견을 양성하는 삼성화재안내견학교를 1993년 9월 설립해 29년째 운영하고 있다. 이 곳에서는 1994년 국내 첫 안내견 '바다'를 시작으로 매년 12~15마리를 무상 분양하고 있다. 지금까지 분양한 안내견은 모두 267마리이며, 현재 70마리가 안내견으로 활약하고 있다.삼성화재안내견학교의 가장 큰 임무는 시각장애인이 안내견과 함께 삶을 누릴 수 있도록 교육하는 것이다. 하지만 안내견을 훈련시키는 과정에서 과한 스트레스를 주는 것은 아닌지, 안내견으로 활동할 때 과한 업무를 하는 것은 아닌지 등의 편견이 따른다.20일 경기도 용인에 위치한 삼성화재안내견학교를 찾아 안내견이 양성 과정을 체험하고 이야기를 들으면서 앞서 언급했던 걱정들이 모두 사라졌다.



20일 용인 삼성화재안내견학교에서 안내견이 훈련 받는 모습(사진=삼성)■ 안내견학교, 강아지 놀이터부터 수영장까지…시각장애인과 보행은 즐거운 산책안내견학교에 들어서자 8마리의 레브라도 리트리버 강아지들이 반겼다. 안내견으로 훈련받기에 앞서 태어난지 약 3개월이 지난 강아지들은 퍼피워킹 자원봉사 가정으로 입양돼 약 1년 동안 보살핌을 받는다. 일명 '사회화' 과정이라 부르는 기간 동안 예비 안내견은 지하철, 버스, 마트와 같은 장소에서 노인과 어린이 등 다양한 사람을 만나 일상 속 상황을 경험하고 사람과 사는 즐거움을 느끼고, 밝고 건강하게 성장하게 된다.퍼피워킹 가정의 조건은 아파트, 주택 모두 가능하다. 실제로 시각장애인들이 생활하는 공간 또한 평범한 가정집이기 때문이다. 단, 퍼피워킹의 신청 조건은 집에서 안내견과 많은 시간을 보낼 수 있는 가정집이어야 한다.삼성화재안내견학교 훈련사는 “1년 보육기간 퍼피워킹 가정에게 사료, 병원비 등의 각종 비용을 모두 지원하고, 주변 병원 등의 편의시설까지 알려주는 서비스까지 제공한다”며 “안내견을 사랑으로 보듬어 줄 수 있다면 개를 키운 경험이 없는 사람들도 신청할 수 있다”고 설명했다.한 가정에서 시작한 '퍼피워킹' 가정이 약 1천여 가정까지 늘었고, 현재 퍼피워킹을 하고자 신청한 대기 가정이 110여 가정에 달한다. 퍼피워킹 신청후 강아지를 입양 받기까지는 약 2년 이상을 대기해야 한다고 하니, 최근 사람들의 관심이 높아졌다는 것을 알 수 있었다.



46일된(2개월차) 강아지 8마리들이 퍼피워킹 입양을 앞두고 보살핌을 받고 있었다. (사진=지디넷코리아)현재 삼성화재안내견학교에는 46일된(2개월차) 강아지 8마리들이 퍼피워킹 입양을 앞두고 보살핌을 받고 있다. 강아지들의 놀이터에는 사람 아기들이 사용하는 미끄럼틀, 사운드 도어 등의 장난감들이 다양하게 구비돼 있어 마치 '강아지 전용 키즈카페'를 보는 듯 했다.유석종 삼성화재안내견학교 프로는 ""강아지들을 만져 주는 것 또한 사회화 훈련 중 하나이고, 태어난 직후부터 사람은 친구라는 인식을 심어주는 것이 중요하다""고 말하며 체험에 온 기자들에게 강아지와 개를 쓰다듬어 주는 것을 적극 권장하기도 했다.퍼피워킹 가정에서 1년을 보낸 안내견들은(14~18개월) 다시 삼성화재안내견학교로 돌아와 6개월간 훈련을 받게 된다. 모든 안내견들이 훈련을 받을 수 있는 것은 아니다. 훈련에 적합한지 테스트를 통과해야만 한다. 훈련 통과율은 35%다. 안내견이 되지 못한 개들은 일반 가정으로 분양된다. 현재 삼성화재안내견학교에는 16마리의 안내견이 훈련받고 있다.안내견이 생활하는 기숙사의 공간은 넓고 쾌적했다. 특히 기숙사의 모든 공간이 온돌 바닥이란 점에서 놀라웠다. 이는 훈련 후 시각장애인 가정과 은퇴견으로 생활할 때 대부분 집안 내에서 생활해야 하기 때문에 유사한 환경을 만들어 주기 위함이다. 또 기숙사에는 TV를 배치해 안내견들이 일상생활 소리에 적응하도록 했다.유석종 프로는 ""안내견들은 월요일부터 금요일까지 우리가 생활하는 상점, 도로, 인도 등으로 나가서 약 30~40분 훈련을 받고, 주말에는 쉰다. 사람들은 안내견들이 오랜 시간동안 훈련하는 것으로 생각하는데 그렇게 하면 효율성이 떨어진다""고 설명했다. 이어 ""외출은 개들이 즐거울 때 까지만 훈련해야 향후 시각장애인들과 생활할 때 걷는 즐거움을 느낄 수 있다""고 덧붙였다.기숙사 건물 밖을 나오자 넓은 잔디밭이 펼쳐져 있었다. 잔디밭에서는 안내견들이 자유롭게 뛰어놀고 있었다. 특히 어린이들이 사용하는 놀이터와 흡사한 놀이기구가 눈에 띈다. 개들 또한 높은 곳에 올라가서 멀리 바라보는 것을 좋아하기 때문에 이런 놀이터를 구성했다고 한다. 안내견학교에는 안내견 전용 수영장도 구축돼 있었다. 은퇴한 안내견도 언제든지 놀러 와서 놀이터와 수영장을 이용할 수 있다.



삼성화재안내견학교 놀이터에서 안내견들이 뛰어 노는 모습(사진=지디넷코리아)■ 안내견, 시각장애인 눈 역할...일반 개 보다 평균 수명 1~2년 길어안내견학교에서는 안내견을 시각장애인에게 분양하기 전에 약 한달간 안내견 파트너 교육을 실시한다. 첫 2주는 안내견 학교에 입소해 교육을 진행하고, 나머지 2주는 시각장애인의 거주지 근처에 숙소를 마련해 아침부터 잠들 때까지 모든 생활을 같이 하면서 교육을 진행하는 방식이다.



안내견이 계단을 발견하면 잠시 멈춰서 사람에게 알려준다.(사진=지디넷코리아)유 프로는 “시각장애인이 외출을 힘들어 하는 이유는 목적지를 모르는 것이 아니라 목적지까지 가는 길에 놓여있는 수많은 장애물을 피하는 것을 어려워 한다”라며 안내견과 장애물을 피하는 방법을 함께 연습하는 것”이라고 설명했다.이 날 시각장애인이 안내견과 훈련하는 방법을 체험해 볼 수 있었다. 안내견은 외출할 때 손잡이(하네스)가 달린 옷을 착용하고 나간다. 하네스에는 보건복지부에서 발급된 장애인 보조견 표지가 장착된다.



하네스에는 보건복지부에서 발급된 장애인 보조견 표지가 장착된다.(사진=지디넷코리아)사람은 안내견 오른편에 서서 왼손으로 손잡이(하네스)를 잡고 걷는다. 안내견이 장애물을 발견하면, 장애물을 왼편에 둔 방향으로 피해서 사람도 같이 피할 수 있도록 돕는다. 또 계단을 발견하면 잠시 멈춰서 사람에게 알려준다.이 날 기자 2명은 안대를 하고 안내견과 함께 걷는 체험을 했다. 유석종 프로는 “앞이 갑자기 안보이면, 걸음에 무섭고 안내견과 걷는 속도가 빠르게 느껴질 수 있다”고 설명했다. 체험을 한 기자는 “생각했던 것 보다 앞이 안보이니 무서웠다""고 소감을 전하기도 했다.안내견학교 한편에는 은퇴견 추모비가 있는 공원이 조성돼 있었다. 추모비 옆에 적힌 안내견 이름들을 보니 뭉클해졌다.안내견은 일반 강아지 보다 수명이 약 1~2년 더 길다고 한다.



은퇴견 추모비(사진=지디넷코리아)유 프로는 “안내견이 스트레스를 많이 받을 것으로 생각하지만 안내견은 적성에 잘 맞아야만 할 수 있고, 시각장애인분들과 함께 생활하면서 계속 관리를 받다 보니, 통계적으로 기대수명이 일반 개 보다 더 길다”고 설명했다.이어 “안내견에게는 주인이 시각장애인이냐 아니냐는 중요하지 않다”며 “일반주인과 외출하면 산책이라고 하고, 시각장애인과 외출하면 일이라고 얘기하는데, 사실상 안내견은 애정을 갖고 밖에서 집중력 있게 함께 걷는 것에 더 행복함을 느낄 것”이라고 말했다.",105,https://n.news.naver.com/mnews/article/092/0002268564?sid=103
