title,date,main,section,url
"KG모빌리티, SW업체 ‘에이투지’와 레벨3 자율주행차 협력 개발",2023.10.24. 오전 9:50,"KG모빌리티 권용일 기술연구소장(사진 왼쪽 네 번째)과 오토노머스에이투지 한지형 대표(사진 왼쪽 다섯 번째) 등이 자율주행 시스템 개발 협력을 위한 양해각서(MOU)를 체결하고 기념촬영을 하고 있다 [사진제공=KG모빌리티]KG모빌리티가 레벨3 자율주행 자동차와 레벨4 자율주행 플랫폼 개발을 위해 자율주행 소프트웨어사 ‘오토노머스에이투지(AUTONOMOUS a2z)’와 협력에 나선다.KG모빌리티는 지난 20일 대구 엑스코에서 열린 ‘2023 대한민국 미래모빌리티엑스포’에서 오토노머스에이투지(이하 에이투지)와 자율주행 시스템 개발 협력과 자율주행 차량 제조를 위한 양해각서(MOU)를 체결했다고 24일 밝혔다. 양사는 자율주행 핵심 역량을 토대로 미래 기술 경쟁력 확보는 물론 자율주행의 완성도를 높이는 데 협력하기로 했다.이번 MOU는 ▲자율주행 기술고도화 협력 ▲SAE 레벨2 운전자 주행 보조기능 고도화 공동개발 ▲SAE 레벨3(유인 자율주행시스템) 자율주행 차량 공동개발 ▲SAE 레벨4(무인 자율주행 시스템) 자율주행 플랫폼 공동개발 ▲운전자 주행보조 및 자율주행 시스템 사양 개발 협력 ▲자율주행 차량 양산화 목적 부품 공유 등 기술협력과 공동개발에 대한 내용을 담고 있다.



 오토노머스에이투지가 2023 DIFA에서 공개한 레벨4 단계 자율주행플랫폼 Project MS(Mind Shuttle)에 탑승하여 한지형 대표(사진 오른쪽 두 번째)가 KG모빌리티 권용일 기술연구소장(사진 오른쪽 첫 번째) 등에게 자율주행 시스템에 대해 설명하고 있다 [사진제공=KG모빌리티]KG모빌리티는 이번 협력을 기반으로 자사 ADAS(레벨2 운전자 주행보조) 브랜드인 ‘딥 컨트롤’ 기술 고도화와 함께 레벨3 자율주행 개발의 발판을 마련하게 됐다.특히 차량의 가·감속과 조향장치의 동시 제어를 지원하는 딥 컨트롤의 기술 고도화는 자율주행에 근접한 경험으로 운전자에게 차별화된 편의성과 안전성을 제공할 전망이다. 아울러 에이투지 레벨4 자율주행의 운영 노하우를 기반으로 향후 KG 모빌리티의 자율주행 서비스 모델의 확장을 기대할 수 있게 됐다.에이투지 역시 KG모빌리티와의 협력을 토대로 새로운 도약을 준비 중이다. 최근 340억원의 시리즈B 펀딩을 마무리 짓고 이번 미래모빌리티엑스포에서 자체 개발한 자율주행 소프트웨어를 탑재한 전용 전기차를 공개했다.권용일 KG모빌리티 기술연구소장은 “국내 최고 자율주행 소프트웨어 업체인 에이투지와의 기술협력과 공동개발은 KG모빌리티의 자율주행 경쟁력 확보는 물론, 기술의 외연 확장을 통해 변화와 혁신을 선도하는 기업으로 도약하는 중요한 변곡점이 될 것”이라고 강조했다.",105,https://n.news.naver.com/mnews/article/009/0005203796?sid=103
"KT ""인천 서구에서도 전화로 '콜체크인' 하세요""",2021.05.18. 오후 4:52,"인천 서구청과 콜체크인 서비스 운영지원을 위한 업무협약 체결



[아이뉴스24 송혜리 기자] 인천 서구가 KT 전화 출입기록 서비스 '콜체크인'을 도입한다.KT(대표 구현모)와 인천 서구청은 콜체크인 서비스 운영지원을 위한 업무협약을 체결하고, 콜체크인 서비스를 관내 소상공인 중점관리 업소에 제공할 예정이라고 18일 발표했다.이에 따라 인천 서구 내 콜체크인 서비스가 도입된 업소에 방문하면, 업소별로 부여된 고유 전화번호로 전화를 걸어 방문기록을 마칠 수 있다. 등록된 기록은 코로나19 확진환자 발생 시 경로 파악과 역학조사에만 활용되며, 4주 이후 자동 폐기된다.유용규 KT 강남·서부법인본부장(상무)는 ""코로나 극복을 위한 다양한 솔루션 도입을 위해 앞으로도 인천 서구청과 적극 협력하겠다""고 말했다./송혜리 기자(chewoo@inews24.com)▶네이버 채널에서 '아이뉴스24'를 구독해주세요.▶재밌는 아이뉴스TV 영상보기 ▶아이뉴스24 바로가기[ⓒ 아이뉴스24 무단전재 및 재배포 금지]",105,https://n.news.naver.com/mnews/article/031/0000599331?sid=103
"'몰테일', 아마존·이베이 등 72개 해외쇼핑몰 직구 확대",2021.05.18. 오후 1:13,"현지어 몰라도 구입~배송 가능한 '다해줌' 서비스파손 및 가품 걱정 없이 해외 명품 현지가 구입



[서울=뉴시스] 오동현 기자 = 언택트 이커머스 전문기업 코리아센터는 자사가 운영하는 해외직구 플랫폼 ‘몰테일’의 다해줌 서비스 가능 등록 상점이 72개로 확대됐다고 18일 밝혔다.다해줌은 현지 언어를 몰라도 아마존, 이베이, 타오바오 등 미국, 영국, 중국, 일본 4개 국가의 주요 쇼핑몰 72곳의 제품 구입부터 배송까지 진행 가능한 서비스다.특히 몰테일 아이디 하나면 72개 해외 쇼핑몰을 별도 회원가입 없이 이용 가능하고, 생활용품부터 가전제품까지 다양한 상품을 현지 가격으로 구매할 수 있으며, 구매금액 5만원 이상의 5파운드(약 2.3kg)이하 물건에 대해서는 무료배송까지 지원한다.또 다해줌 서비스 가능 상점 중 조마샵, 24S와 같은 명품 브랜드 전문점과도 제휴돼 있어 루이비통, 구찌, 발렌시아가, 돌체엔가바나 등의 브랜드 제품도 합리적인 가격에 구매 가능하다.몰테일은 미국, 영국, 독일 등 총 7개국 9개 물류센터와 이태리 MD사무소를 보유하고 있어 안정적인 배송은 물론 현지 물류센터 담당자가 직접 제품을 선별해서 구입, 상품에 대한 파손 또는 가품에 대한 걱정 없이 이용할 수 있다.몰테일 관계자는 “다해줌은 해외직구가 처음이거나 현지 언어의 불편함 등으로 어려움을 겪었던 이용자도 간편하게 쇼핑할 수 있는 서비스”라며 “앞으로도 제휴 상점을 지속적으로 늘려 다양한 국가의 브랜드 제품을 손쉽게 구매할 수 있도록 하겠다”고 말했다.☞공감언론 뉴시스 odong85@newsis.com▶ 네이버에서 뉴시스 구독하기▶ K-Artprice, 유명 미술작품 가격 공개▶ 뉴시스 빅데이터 MSI 주가시세표 바로가기<ⓒ 공감언론 뉴시스통신사. 무단전재-재배포 금지>",105,https://n.news.naver.com/mnews/article/003/0010504228?sid=103
"더존비즈온, 미래에셋캐피탈과 매출채권팩토링 사업 확대",2021.05.18. 오후 1:58,"첫해 3천 억 자금 지원…외부 자금공급자 참여로 사업 급물살[아이뉴스24 박진영 기자] 더존비즈온이 미래에셋캐피탈의 자금 지원으로  WEHAGO 플랫폼 기반 핀테크 서비스를 강화한다.



더존비즈온 매출채권팩토링 서비스 절차  [사진=더존비즈온]더존비즈온(대표 김용우)은 'WEHAGO 기반 매출채권팩토링 사업'에 미래에셋캐피탈(대표 이만희)이 연간 3천억 원 수준의 신규 자금공급자(팩터) 참여를 확정하면서 관련 계약을 체결했다고 18일 발표했다.매출채권팩토링은 기업 간 물품·용역 거래에서 발생한 세금계산서(매출채권)를 더존비즈온의 진성거래판별, AI신용평가모형을 통해 정밀 평가한 후 일정 할인율로 금융기관에서 매입해 주는 서비스다.이를 통해 판매기업은 채권관리 부담 없이 판매대금을 조기에 회수할 수 있고, 구매기업 역시 일정기간 구매대금 지급을 유예할 수 있어 양측 모두 자금 운용이 수월해지는 이점이 있다. 또한 대출이 아닌 보유 채권의 매각이므로 부채 증가가 없고 대출한도도 신경 쓸 필요 없어 신용등급이 개선되는 효과도 있다.실제 지난 4월 더존비즈온측에 팩토링을 신청했던 모 양계전문기업은 더존비즈온의 매출채권팩토링 서비스를 이용해 농장 운영이 한결 수월해졌으며 실적 개선 효과도 얻을 수 있었다. 이전까지는 대형마트에 달걀을 대량 납품하면서 판매대금은 늦게 받는 반면 양계용 사료는 현금 구매만 가능해 만성적인 운전자금 부족 문제를 겪어 왔었다.더존비즈온은 매출채권팩토링 서비스 출시 이후 시범사업을 통해 총 10만 건 이상의 상담을 진행하며 중소·중견기업으로부터 큰 호응을 얻고 있으며, 팩토링 가능여부를 판별하고 서비스하는 시스템도 고도화 안정화 단계에 접어들었다. 회사가 자체 준비한 초기 자금 100억 원을 투입해 서비스를 활발히 진행 중이며, 더 많은 기업이 이용할 수 있도록 자금 조기소진에 대비해 외부 자금공급자 영입 등 사업 확대를 준비해 왔었다.이 가운데 미래에셋캐피탈이 신규 자금공급자로 나서며 매출채권팩토링 사업이 본격적인 성장 국면에 진입할 것으로 예상된다. 미래에셋캐피탈은 자금공급자 참여 첫해인 올해 연간 취급금액 3천억 원 수준에서 매출채권을 매입할 예정이며, 매년 그 규모를 확대할 방침이다.미래에셋캐피탈의 이번 사업참여는 더존비즈온의 기업용 플랫폼 WEHAGO에 대한 미래성장성과 잠재적 가치를 높게 평가한 결과이다. 앞서 지난 2019년에는 네이버파이낸셜에 투자해 개인 부문 금융서비스를 강화한 바 있으며, 이러한 노하우를 매출채권팩토링에 접목하면 더존비즈온과 큰 시너지를 낼 것으로 기대하고 있다.더존비즈온 관계자는 ""혁신금융서비스 사업자로 지정된 이후 WEHAGO 플랫폼 이용 중소·중견기업을 대상으로 매출채권팩토링 서비스를 출시하는 등 핀테크 서비스를 강화해 왔다""라며, ""이제부터 WEHAGO 플랫폼 기반 위에 금융을 비롯한 다양한 서비스가 연계되는 본격적인 플랫폼 기업으로의 도약이 시작된 것""이라고 말했다./박진영 기자(sunlight@inews24.com)▶네이버 채널에서 '아이뉴스24'를 구독해주세요.▶재밌는 아이뉴스TV 영상보기 ▶아이뉴스24 바로가기[ⓒ 아이뉴스24 무단전재 및 재배포 금지]",105,https://n.news.naver.com/mnews/article/031/0000599267?sid=103
"삼성디스플레이 사장 ""자발광 디스플레이가 메타버스 시대 주도""",2021.05.18. 오전 9:25,"SID 2021서 강연…""자발광 디스플레이, 기술·폼팩터 진화 모두 갖춰""(서울=연합뉴스) 김영신 기자 = 삼성디스플레이는 최주선 사장이 세계정보디스플레이학회가 주최하는 'SID 디스플레이 위크 2021'에서 기조강연에 나선다고 18일 밝혔다.    최주선 사장은 올해 온라인으로 열리는 SID 2021에서 '메타버스와 디스플레이의 위대한 미래'를 주제로 한 강연을 통해 가상현실 세계인 메타버스 시대를 주도할 디스플레이 산업의 비전을 제시한다.



SID 2021서 기조 연설하는 최주선 삼성디스플레이 사장[삼성디스플레이 제공. 재판매 및 DB 금지]    삼성디스플레이에 따르면 최 사장은 ""세계 디스플레이 산업이 '메타버스'라는 중대한 변곡점을 맞이하고 있다""며 ""메타버스라고 하면 가상현실(VR)을 떠올리기 쉽지만, 온라인·디지털을 통한 모든 행동과 생활양식이 넓은 의미로 메타버스""라고 정의한다.    최 사장은 ""메타버스라는 큰 트렌드가 디스플레이 산업에 급격한 변화를 불러올 것""이라며 ""특히 원격 근무, 온라인 회의와 교육이 일상이 된 '뉴노멀' 사회가 이런 변화를 더욱 앞당길 것""이라고 전망한다.    최 사장은 삶의 모든 영역이 디지털·인터넷을 통해 하나로 연결되는 '디지털 전환' 시대에 접어들었다고 강조하면서 디스플레이 산업의 트렌드와 혁신 현황을 제시한다.    그는 ""전통적인 IT 기기의 경계가 무너지고 개인의 사용환경 등에 따라 맞춤화한 새로운 기기가 등장하고, 폴더블·롤러블·슬라이더블·풀스크린 등 다양한 폼팩터로 디지털 시대를 경험할 것""이라고 진단한다.    또한 기술 발전과 비대면 사회 트렌드가 맞물려 영상 화질이 더욱 중요한 요소로 부각되고, 모빌리티 혁명이 본격화하며 자동차용 디스플레이도 스마트폰, 노트북, TV 못지않게 발전할 것으로 전망한다.



삼성디스플레이, 'SID 2021'서 차세대 OLED 기술 공개(서울=연합뉴스) 삼성디스플레이가 17일부터 온라인으로 열리는 국제전시회 'SID 2021'에 참가한다.    사진은 삼성디스플레이가 선보이는 차세대 OLED 기술 'S폴더블'. 2021.5.17    [삼성디스플레이 제공. 재판매 및 DB 금지] photo@yna.co.kr    최 사장은 아울러 메타버스 트렌드에 몰입도를 극대화하고 현실을 증강하는 새로운 디스플레이 기술에 대한 요구가 점점 커질 것이라고 언급한다.    특히 최 사장은 이러한 변화 속에서 가장 중요한 기술이 화질과 폼팩터 우수성을 모두 갖춘 '자발광 디스플레이'라고 강조한다.    최 사장은 삼성디스플레이가 1인치부터 200인치까지 중소형과 대형을 아우르는 디스플레이 솔루션을 제공해 시장 성장을 주도하겠다면서, 자사의 차세대 17형 폴더블과 멀티플레이 제품 등을 시연한다.    최 사장은 ""삼성디스플레이는 2007년 세계 최초로 OLED(올레드·유기발광다이오드) 양산에 성공하며 자발광 시장을 개척하고 선도해왔다""며 ""앞으로 OLED를 비롯해 QD, LED 등 다양한 자발광 기술을 발전시켜 산업을 이끌어가겠다""고 밝혔다.    최 사장의 기조강연 영상은 18일 자정 온라인으로 공개된다. SID 2021에서는 최 사장을 비롯해 미리엄 다니엘 아마존 부사장, 스테파노 코라자 어도비 부사장, 애나 코랄레스 구글 최고운영책임자 등이 기조 강연을 한다.    shiny@yna.co.kr▶네이버에서도 뉴스는 연합뉴스[구독 클릭]▶[팩트체크] SNS 달군 백신가격 비교 글? ▶제보하기<저작권자(c) 연합뉴스(https://www.yna.co.kr/), 무단 전재-재배포 금지>",105,https://n.news.naver.com/mnews/article/001/0012400153?sid=103
"中 최대 콜택시 디디, '광치'와 로보택시 개발",2021.05.18. 오전 9:38,"기사없는 택시 상용화 맞손(지디넷코리아=유효정  중국 전문기자)중국 최대 콜택시앱 디디(Didi)가 중국 대형 자동차 기업과 무인 자율주행 '로보택시' 개발을 위해 손잡았다.18일 중국 언론 뎬둥처짜이셴에 따르면, 디디그룹의 자율주행 자회사인 디디오토노머스드라이빙과 중국 광치그룹의 전기차 회사인 광치아이온(GAC AION)과 협력키로 했다.기사없이 무인으로 운영되는 로보택시 개발을 위해 협력한다. 광치아이온이 전기차 기업인 만큼, 전기차로 된 로보택시 개발이 이뤄질 전망이다.디디는 이미 2016년부터 자율주행 연구개발을 시작했으며, 도시 등 택시 운영에서 쌓은 빅데이터를 기반으로 로보택시 상용화에 속도를 내고 있다.



디디오토노머스드라이빙과 광치의 협력 선언이 17일 이뤄졌다. (사진=디디)광치 자율주행 기술을 중국에서 일찍 확보했을 뿐 아니라 중국에서 유일하게 전기차(EV)와 내연기관차(ICV) 자체 개발 기술을 동시에 보유한 자동차 기업으로 꼽힌다. 이미 6000명 가량의 글로발 자체 연구개발 인력을 기반으로 자율주행 양산 기술을 내놓고 있다. 2017년 자체 개발한 2세대 자율주행 자동차 위트스타(WitStar)가 이미 L4, L5급 수준을 달성한 것으로 알려졌다.세계 첫 L3급 자율주행 자동차 양산 기업으로서 아디고(ADiGO) 3.0으로 명명된 스마트카 시스템도 보유했다. 광치는 최근 중국 화웨이와도 L4급 자율주행 차량 양산을 위해 협력을 선언한 바 있다.디디는 콜택시 운영의 60% 이상 원가가 기사에서 발생되는 것을 고려해, 무인 로보택시의 사업성에 기대를 걸고 있다.특히 중국에서 자율주행 자동차 시장은 5년 내 개화할 전망이다. 매킨지에 따르면 중국에서 2025년 자율주행 상용화가 시작되고 2030년 자율주행 자동차 총 판매액이 2300억 달러 규모가 될 것으로 예측됐다.유효정 중국 전문기자(hjyoo@zdnet.co.kr) ▶ 지디넷코리아 '홈페이지' ▶ 네이버 채널 구독하기© 메가뉴스 & ZDNET, A RED VENTURES COMPANY, 무단전재-재배포 금지",105,https://n.news.naver.com/mnews/article/092/0002222344?sid=103
"한미약품⋅제넥신, 국산 코로나 백신 위탁 생산 계약 체결",2021.05.18. 오후 12:10,"제넥신 개발한 코로나 백신 후보물질 ‘GX-19N’  공정개발, 위탁생산 계약 규모는 245억원



한미약품은 제넥신과 신종 코로나바이러스 감염증(코로나19) 백신 후보물질 'GX-19N'의 공정개발 및 위탁생산 계약을 체결했다고 18일 밝혔다. 성영철 제넥신 대표(왼쪽)와 권세창 한미약품 대표가 위탁생산 계약을 체결한 후 기념 촬영을 하고 있다. /한미약품 제공 한미약품(128940)은 제넥신(095700)이 개발하는 신종 코로나바이러스 감염증(코로나19) 백신 후보물질 ‘GX-19N’의 공정 개발 및 위탁 생산 계약을 체결했다고 18일 밝혔다. 계약 규모는 245억원이다.한미약품은 평택 바이오플랜트 제2공장에서 제넥신이 개발 중인 코로나19 백신의 상용화 생산 공정을 개발하고, 상용화 약물 시생산 등을 맡고, 향후 허가에 필요한 서류 작성 등도 수행하기로 했다.현재 제넥신의 코로나19 백신은 바이러스의 표면 항원 유전자(DNA)를 주입, 체내에서 표면 항원 단백질을 생성해 면역반응을 유도하는 방식의 DNA 백신 ‘GX-19N’을 개발하고 있다. 현재 식품의약품안전처로부터 임상 1·2a상 시험을 승인 받아 진행 중이며, 인도네시아 제약사인 칼베 파르마와 협력해 인도네시아 현지 임상 2·3상을 진행하고 있다.제넥신과 칼베 파르마는 지난달 인도네시아 식약처(BPOM)에 임상 2·3상을 위한 임상시험계획(IND)을 제출했다. 성영철 제넥신 대표는 “한미약품과 함께 DNA 백신을 안정적으로 대량생산할 수 있는 기반을 마련하게 됐다”고 했다. 권세창 한미약품 대표는 “이번 협력은 한국의 유전자 백신 기술 자립을 위한 중요한 이정표가 될 것”이라고 했다.[김명지 기자 maeng@chosunbiz.com] ▶네이버에서 '명품 경제뉴스' 조선비즈를 구독하세요▶아크앤북 시청점, 2년반만에 폐점▶전기요금 동결한 한전, 2분기 적자 전망	저작권자 ⓒ 조선비즈, 무단 전재 및 재배포 금지",105,https://n.news.naver.com/mnews/article/366/0000719103?sid=103
"[이슈] 엔씨소프트 '트릭스터M', 사전 다운로드 돌입",2021.05.18. 오후 5:01,"20일 0시 정식 서비스 시작, 모바일 양대 마켓과 '퍼플'서 사전 다운로드 가능공식 유튜브 채널 '드릴월드'서 8가지 직업 상세 정보 확인 가능



  엔씨소프트(대표 김택진, 이하 엔씨(NC))가 신작 모바일 MMORPG(다중접속역할수행게임) '트릭스터M' 사전 다운로드를 시작했다. 모든 이용자는 18일 정오부터 ▲구글 플레이 ▲애플 앱스토어 ▲엔씨(NC) 크로스 플레이 서비스 '퍼플(PURPLE)'에서 '트릭스터M'을 사전에 다운로드할 수 있다. 게임 플레이는 5월20일 0시부터 가능하다.엔씨(NC)는 공식 유튜브 채널 '드릴월드'에 '파고파도 컴퍼니 5화. 직업 선택 가이드편'을 공개했다. 이용자는 영상에서 '트릭스터M'의 8가지 직업(고고학자, 엔지니어, 자산가, 주술사 등)의 무기 타입, 스킬 정보 등을 확인할 수 있다.엔씨는 19일 '트릭스터M' 그랜드 오픈 전야제 이벤트를 연다. 오전 11시 '미리드릴어워드'를 진행한다. 사전예약 시작 후 달성한 각 기록(미니게임 최고 누적 포인트를 획득한 이용자, 컴퍼니 커뮤니티에 가장 많은 게시글을 쓴 컴퍼니 등)에 따라 다양한 선물(블루투스 스피커, 키보드, 구글 기프트카드 등)을 제공한다. '트릭스터M' 커뮤니티에 올라온 기습 퀴즈의 정답을 맞힌 이용자가 게임 아이템(상급 패션/펫 소환권, 드릴 럭키 박스 등)을 받을 수 있는 '게릴라 깜짝 퀴즈' 이벤트도 하루 동안 운영한다.엔씨(NC)는 '트릭스터M' 사전 예약을 17일 마감했다. 참여자는 '트릭스터M' 출시 후 다양한 아이템(비만 병아리, 포푸리 드릴, 까발리에 천만장자 꾸러미)을 받는다. 자세한 내용은 '트릭스터M' 브랜드 사이트에서 확인할 수 있다.이원희 기자 (cleanrap@dailygame.co.kr)▶ 웹에서 즐기는 캐쥬얼게임 50종▶ 유튜브 핫뉴스 & 화제 영상 보기▶ LCK & 카트리그 현장사진 보기",105,https://n.news.naver.com/mnews/article/347/0000153102?sid=103
"블라인드, 416억원 투자 유치…“나스닥 상장 앞당길 것”",2021.05.18. 오후 6:10,"직장인 익명 커뮤니티 블라인드를 운영하는 팀블라인드는 3천700만 달러(416억원) 규모의 시리즈C 투자를 유치했다고 오늘(18일) 밝혔습니다. 회사 측은 “투자금을 적극적으로 활용해 목표했던 2025년 미국 나스닥 상장을 더욱 앞당길 계획”이라고 밝혔습니다. 블라인드 사용자는 500만명 이상이며 한 명당 체류 시간은 하루 평균 40분으로, 한국 재직자 300인 이상 기업체 근로자의 85% 이상이 블라인드를 사용하고 있습니다. 이번 투자에는 미국 스톰벤처스·DCM벤처스 등 기존 투자사와 함께 메인스트리트 인베스트먼트·시스코 인베스트먼트·파빌리온 캐피탈 등이 새로 합류했습니다. 문성욱 팀블라인드 대표는 “설립 시점부터 글로벌 확장을 목표로 두고 미국 실리콘밸리에 본사를 세웠다”며 “미국에서의 확장은 물론 이미 많은 가입자를 확보한 캐나다·인도 등 주요 국가에 거점을 둔 글로벌 플랫폼으로 도약해갈 것”이라고 밝혔습니다.[사진 출처 : 연합뉴스]최건일 (gaegoo@kbs.co.kr)▶ 더 빠르고 정확한 소식을 원하시면 KBS뉴스 구독!▶코로나19 언제 어떤 백신을 누가 맞을까?▶ 제보는 KBS! 여러분이 뉴스를 만들어 갑니다",105,https://n.news.naver.com/mnews/article/056/0011046510?sid=103
