title,date,main,section,url
"[단독]산∼토끼 토끼야, 어디로 ‘갔’느냐",2023.01.06. 오전 3:02,"토종 멧토끼 수 20년새 15분의 1로㎢당 0.8마리 뿐… 멸종위기 될수도“생태 통로 단절-포식자 증가 영향”



동요 ‘산토끼’로 친숙한 토종 토끼인 멧토끼의 수가 20년 새 15분의 1로 줄어든 것으로 나타났다. 지금처럼 개체수가  감소한다면 산토끼가 멸종위기종이 될 가능성이 크다.  환경부 국립생물자원관이 ‘검은 토끼의 해(계묘년)’를 맞아 야생동물 전수조사 자료에서 멧토끼 개체수를 산출한 결과 서식 밀도가 2001년 ㎢당 12.3마리에서 2021년 0.8마리로 줄었다고 5일 밝혔다. ‘메’는 산을 뜻하는 우리말로 멧토끼는 곧 산토끼를 의미한다.  이번 조사에 따르면 멧토끼 서식 밀도는 2004년 ㎢당 8.0마리에서 2009년 4.1마리로 반 토막이 났다. 2015년 ㎢당 1.9마리로 평균 1마리대로 줄어들더니 2020년(㎢당 0.9마리)부터 서식 개체수가 0마리대로 떨어졌다. 1㎢ 면적의 자연 공간에서 멧토끼를 한 마리도 보기 어려워졌다는 뜻이다.  학명도 ‘한국토끼(Lepus Coreanus)’인 멧토끼는 대대로 한반도에서 서식해온 토종 토끼다. 과거 개체수가 많아 야생동물 보호·관리법상 사냥이 가능한 수렵동물로 분류됐지만 점차 감소하고 있다는 지적에 따라 2004년부터 수렵동물에서 제외됐다. 그러면서 2005년부터 개체수와 서식 밀도가 공식적으로 집계되지 않았다. 정부가 매년 국내 810개 지점에서 야생동물 전수조사를 하고 있는데 수렵동물, 환경지표동물, 멸종위기종에 한해서만 그 결과를 정리해 공개하기 때문이다.  멧토끼의 개체수 감소는 ‘로드킬’(야생동물 찻길 사망사고) 순위에서도 드러난다. 국토교통부의 로드킬 조사에서 2008년까지 멧토끼는 고라니, 너구리에 이어 세 번째로 많이 희생되는 동물이었지만 2021년 조사에서는 7위 안에도 들지 못했다. 그만큼 수가 줄었다는 뜻이다.  토끼는 번식력이 왕성해 서식 환경만 좋으면 개체수가 급증할 수 있다. 문제는 서식 환경도 악화되고 있다는 점이다. 박용수 국립생태원 멸종위기종 복원정보팀장은 “주 서식지인 풀밭 감소, 도로 증가로 인한 생태 통로 단절에 더해 최근 포식자인 유기견과 유기묘까지 급증하면서 토끼 개체수가 큰 타격을 받고 있다”며 “지금 추세대로 감소하면 멸종위기종 심사 대상에 오를 것”이라고 설명했다. 이미 광주시, 울산시 등 일부 지자체에서는 멧토끼를 보호야생동식물로 지정해 관리하고 있다.",105,https://n.news.naver.com/mnews/article/020/0003472314?sid=103
"네이버, 포시마크 인수 완료…""주요 매출원으로 C2C 키운다""",2023.01.06. 오후 12:13,"북미 최대 C2C 플랫폼, 네이버 계열사로 편입인수가격은 총 1.5조원한국·일본·유럽·북미 잇는 글로벌 C2C 포트폴리오 완성라이브커머스 등 네이버 기술 포시마크에 접목 예정최수연 ""C2C 주요 매출원으로 키울 것""[이데일리 임유경 기자] 네이버가 북미 최대 개인 간(C2C) 거래 플랫폼 포시마크 인수를 완료했다. 이번 인수를 통해 한국, 일본, 유럽에 이어 북미까지 잇는 글로벌 C2C 포트폴리오를 구축하고, 네이버의 주요 매출원으로 키우겠다는 계획이다.네이버는 이번 인수합병(M&A)를 위해 설립한 특수목적법인 ‘프로톤 패런트(Proton Parent)’를 통해 포시마크의 인수 절차를 미국 현지시간 5일 최종 완료했다고 밝혔다. 이보다 앞서 네이버는 지난해 11월 18일 미국내기업결합신고 승인과 이후 12월 27일 포시마크 주주총회 승인을 각각 획득했다.포시마크 총 인수가격은 기업가치 약 12억 달러(약 1.5조원)로 평가된다. 인수 종결 후 포시마크의 가용 현금에 대한 대가를 포함한 프론트 패런트의 주식 취득 대가는 13.1억 달러(약 1.67조원)다. 포시마크는 네이버 계열사로 편입됐고, 나스닥 상장을 철회했다.



최수연 네이버 CEO (사진=네이버)차세대 커머스 격전지 C2C…네이버 “주요 매출원으로 키울 것”네이버는 북미 1위 C2C 거래플랫폼을 품에 안으면서, 차세대 커머스 격전지로 떠오른 C2C 시장에서 영향력을 확대하게 됐다. C2C는 다양하고 희소한 제품이 지속적으로 생산·거래되는 차세대 커머스 플랙폼이다. 향후 온라인 패션 소매 시장의 성장을 견인할 것으로 주목받고 있다.네이버는 C2C 초기 단계부터 시장에 대한 이해도를 높이고, 향후 본격적인 경쟁에 대비하기 위해 크림(한국), 빈티지시티(일본) 등의 서비스를 시작했다. 또한, 왈라팝, 베스티에르 콜렉티브 등 유럽 시장에 대한 투자도 진행해왔다. 이번 포시마크 인수는 한국, 일본, 유럽, 북미까지 잇는 글로벌 C2C 포트폴리오를 완성했다는 점에서 의미가 크다. 네이버는 포시마크 인수 완료를 기점으로, 포시마크 구성원들과 PMI(인수 후 통합, 화학적결합)에 집중하고, 현재 테스트 중인 스마트렌즈, 라이브커머스 등의 자사 기술을 포시마크에 근시일 내에 우선적으로 적용해 서비스 품질을 향상할 계획이다. 향후 더욱 다양한 기술과 사업 노하우를 접목시켜 나가며 포시마크 서비스 경쟁력을 강화해나갈 계획이다.최수연 네이버 CEO는 “네이버는 중소상공인(SME) 중심으로 다양한 상품들의 롱테일 거래를 지원하던 ‘네이버의 커머스’ 사업 방식이 수많은 사용자간 자유로운 거래가 이뤄지는 C2C 서비스 방식과 유사하다고 판단해, C2C 시장 태동기부터 주목해왔다”며 ”이번 포시마크 인수로 북미시장까지 포트폴리오를 확대하며 본격적인 글로벌 경쟁에 진출함으로써 C2C가 주요 매출원으로 성장할 수 있는 토대를 마련했다”고 강조했다.샨드라 마니시 포시마크 CEO는 “C2C 기업들은 성장 잠재력이 높으나, 아직 초기단계의 사업으로 주로 스타트업들이 뛰어든만큼, 기존 인터넷 기업 대비 기술적 역량에 대한 목마름이 큰 상황”이라며, “이제 팀 네이버의 일원이 된 포시마크는 네이버의 기술, 사업적 역량을 포시마크에 더해 혁신적인 C2C에 특화된 기술을 개발, 접목하는 등 C2C 서비스 모델의 다음 페이지를 제시해나갈 수 있도록 노력할 것”이라고 했다.",105,https://n.news.naver.com/mnews/article/018/0005401477?sid=103
[CES2023 포토]삼성 전시관 찾은 최재원 수석부회장,2023.01.06. 오후 7:39,최재원 SK그룹 수석부회장이 세계 최대 가전·IT(정보기술) 박람회 CES 2023 개막일인 5일(현지시간) 미국 네바다주 라스베이거스 컨벤션센터 센트럴홀의 삼성전자 전시관을 방문해 전시물을 둘러보고 있다.,105,https://n.news.naver.com/mnews/article/030/0003071000?sid=103
"[오~컬쳐]'쿠로미'로 추진력?…넷마블, '머지 쿵야' 저력 보여줄까",2023.01.06. 오후 6:51,"넷마블이 '머지 쿵야 아일랜드'의 첫 콜라보레이션(이하 콜라보) 브랜드로 '산리오'를 선택했다. 자체 IP인 '쿵야' 캐릭터의 활용도를 최대한 높여 서비스를 이끌어 나가겠다는 넷마블의 자구책으로 풀이된다. '작은 게임도 맵다'…대형 게임 속 인기넷마블은 6일 머지 쿵야 아일랜드에 '산리오코리아' 콜라보 업데이트를 진행했다. 이번 업데이트는 지난해 12월 8일 시작한 1차 콜라보에 이어 두 번째다. 1차 콜라보에서 산리오 캐릭터 '헬로티', '시나모롤', '폼폼푸린' 인형이 추가된 데 이어 2차에서는 '마이멜로디'와 '쿠로미' 인형이 신규 캐릭터로 등장했다. 



'머지 쿵야 아일랜드' 산리오 콜라보레이션 이미지. (사진=넷마블)또 2차 콜라보에서는 건물 자원인 '마이멜로디 마카롱 가게', '쿠로미 까눌레 가게' 등이 추가됐다. 1차 콜라보 때와 같이 섬을 꾸밀 수 있는 장식과 타일도 '마이멜로디'와 '쿠로미' 콘셉트로 제작됐다. 산리오 캐릭터는 국내 기업들에게는 콜라보 단골 손님으로 꼽힌다. 그만큼 산리오의 캐릭터 인지가 높아 탄탄한 마니아층을 보유하고 있는데, '번개장터', '콜리' 등 굿즈를 사고 파는 플랫폼에서도 산리오 캐릭터 상품을 쉽게 찾을 수 있을 정도다. 실제로 지난 6개월 간 산리오는 △롯데칠성음료 델몬트 굿즈 △롯데시네마 △텐바이텐 △생활용품 브랜드 등 유통업계와 브랜드 협업을 이어갔다. 넷마블의 산리오 콜라보 차별점은 '쿵야'를 활용한다는 점이다. 단순히 산리오 캐릭터를 제품(게임)에 얹는 데 그치지 않고 캐릭터를 3개 이상 합치면 다음 단계 캐릭터로 성장하는 '머지 쿵야'의 특성을 활용한 것이 특징이다. 머지 쿵야에서는 '룽'을 시작으로 이후 5~6단계로 쿵야가 성장하는데 산리오 캐릭터인 시나모롤, 폼폼푸린, 마이멜로디, 쿠로미 역시 각각 5단계로 업그레이드할 수 있다. 유저는 이를 통해 각 캐릭터당 총 6개의 버전으로 그려진 산리오 쿵야를 즐길 수 있다. 머지 쿵야 아일랜드는 지난해 대한민국게임대상에서 본상인 우수상을 깜짝 수상하며 저력을 발휘한 바 있어 이번 산리오 콜라보레이션을 통해 다수의 복귀, 신규 이용자들도 기대할 수 있을 것으로 보인다. 그래서 '만렙' 업데이트는 언제?다만 머지 쿵야 아일랜드의 인기만큼 이용자들의 불만도 이어지고 있다. 만렙(최고 레벨) 업데이트 지연에 따른 불만 사항이 잇따르고 있는 것이다. 이용자들은 게임 속도에 비해 업데이트 속도가 현저히 느리다며 레벨 업데이트를 요구하고 있다. 현재 머지 쿵야 아일랜드의 최고 레벨은 200레벨로, 지난 5일 진행한 업데이트에서도 레벨 업데이트는 포함되지 않았다. 자칫 머지 쿵야 아일랜드 이용자들은 소외감을 느낄 수 있는 부분이다. 



6일 진행된 '머지 쿵야 아일랜드' 업데이트 내용. (사진=머지 쿵야 아일랜드 공지사항 화면 갈무리)일부 이용자들은 ""최고 레벨 업데이트가 계속 연기되면 서비스 종료까지 생각하게 된다""며 ""앞서 모아둔 보상 정리를 위해서라도 레벨 업데이트에 대한 입장을 달라""고 요구하고 있다.  일각에서는 넷마블의 대형 게임 속 머지 쿵야 아일랜드가 겪을 수밖에 없는 규모의 문제라는 시선도 있다. 넷마블 게임의 매출 성과에서도 규모 차이는 드러난다. 넷마블에 따르면 지난해 3분기 넷마블의 주요 게임별 매출 비중은 △마블 콘테스트 오브 챔피언스 △캐시프렌지 △제2의나라: 크로스월드 △잭팟월드 △랏차 슬롯 △일곱개의 대죄: 그랜드 크로스 순이다. 기존 게임 외 지난해 인수한 스핀엑스의 게임(매시프렌지, 랏차 슬롯)도 다수 포함됐지만 힐링 캐주얼 게임인 머지 쿵야 아일랜드는 기타 항목에 포함된 게임에 그쳤다. 머지 쿵야 아일랜드의 개발사 넷마블엔투는 '모두의 마블: 메타월드', '하이프스쿼드', '신의 탑: 새로운 세계', 'RF프로젝트'를 등 신작 개발에 분주한 상황으로 이용자들의 불안감은 커지고 있다. 이에 넷마블 관계자는 5일 업데이트 전 <블로터>에 ""업데이트 내용에 대해 협의 중""이라며 ""아직 최고 레벨 업데이트에 대한 결정이 나지는 않았다""고 전했다. 다만 넷마블이 머지 쿵야 아일랜드에 첫 콜라보레이션을 진행하며 서비스를 업데이트하고 있는 만큼, 최고 레벨 업데이트 역시 기대할 만하다.",105,https://n.news.naver.com/mnews/article/293/0000042059?sid=103
"위메이드, 중국 훈풍에 미르 IP 'NFT' 승부수… 주가 탄력받나",2023.01.06. 오전 5:10,"위메이드가 자사 대표 지식재산권(IP) '미르의 전설2'를 활용한 대체 불가능한 토큰(NFT) 상품을 제작, 중국 시장에 선보일 예정이다. 최근 중국 당국의 달라진 기류를 감안해 인기 IP를 내세워 시장을 선제적으로 공략하겠다는 의도다. /사진=위메이드 위메이드가 차츰 열리는 중국 시장을 향해 질주를 시작했다. 최근 중국 당국의 한국 게임 판호(게임 서비스 허가권) 발급을 계기로 한한령(중국 내 한류 금지령) 해제 분위기가 무르익자 인기 지식재산권(IP) '미르의 전설2'를 활용해 대체 불가능한 토큰(NFT) 사업을 꺼내 들었다. 미르의 전설2가 중국서 국민 게임 반열에 오른 만큼 시장의 이목이 쏠린다. 위메이드는 중국 중전열중문화발전과 미르의 전설2 NFT 상품 제휴를 맺었다고 지난 4일 밝혔다. 미르의 전설2 NFT 상품을 만들어 중국 문화미디어 신문창 NFT 플랫폼에서 판매할 계획이다. 앞으로 판매 채널을 확대하기 위한 협력을 이어간다.신문창 NFT 플랫폼은 중전열중문화발전에서 운영 중인 디지털 자산 거래소로 지난해 6월부터 서비스 중이다. 중전열중문화발전은 중국 문화관광부 직속 중국문화미디어 그룹의 자회사다. 이러한 소식이 알려지자 위메이드 주가는 상승 곡선을 그렸다. 위메이드는 지난 3일 3만2050원으로 거래를 마쳤지만 4일 3만2850원, 다음날엔 3만3100원으로 올랐다. 위메이드가 중국에서 NFT 상품화를 추진하는 이유는 중국 당국의 기조가 최근 달라졌기 때문이다. 중국은 지난해 12월 한국 게임에 대한 판호를 대거 발급했는데 이는 지난 2017년 3월 국내에 사드(THAAD·고고도미사일방어체계) 배치로 한·중 외교 관계가 경색된 이후 5년 만이다. 위메이드는 중국서 선풍적인 인기를 끈 미르 IP를 보유해 중국 판호 발급의 차기 기대주로 꼽히고 있다. 특히 미르의 전설2는 2001년 중국에 진출해 2005년 세계 최초로 중국 동시접속자 수 80만명을 기록, 기네스북에 올랐다. 삼국지, 서유기에 버금가는 3대 경전으로 꼽힐 정도로 현지에서 많은 사랑을 받고 있다.근래 들어 국영 최초 디지털 수집품 거래소 '중국 디지털 자산 거래 플랫폼'이 출범하는 등 중국에서 NFT 사업이 떠오르고 있다는 점도 위메이드에겐 호재다. 이 플랫폼은 기관 및 개인 사용자에게 신뢰할 수 있는 디지털 자산 등록과 저작권 보호 서비스 등을 제공해 과도한 투기를 방지하고 거래 활성화를 도모할 예정이다. '2022 대한민국 게임백서'에 따르면 2021년 기준 중국의 글로벌 게임 시장 점유율은 20.4%로, 미국(22%) 다음이다. 세계 4분의 1을 차지하는 중국 시장은 침체된 회사 실적을 반등시킬 기회다.  이에 위메이드는 올해 중국에서 게임 서비스와 IP 사업에 속도를 낼 계획이다. 위메이드 관계자는 ""최근 여러 한국 게임들이 판호를 획득하며 중국 진출에 대한 새로운 계기가 마련되고 있다""며 ""현지 퍼블리셔들과 '미르4', '미르M' 서비스 계약을 협의하며 중국 시장 공략을 준비 중이다""고 말했다.",105,https://n.news.naver.com/mnews/article/417/0000884400?sid=103
"넥슨, 한국백혈병소아암협회에 사내이벤트로 6600만원 기부",2023.01.06. 오전 9:33,"소아암 환아 수술비 및 재활치료비 지원을 위해 사용 예정



  [사진=넥슨]넥슨(대표 이정헌)이 기부금 6천600만원을 소아암 환아 치료지원을 위해 한국백혈병소아암협회(협회장 이중명)에 기부했다고 6일 발표했다. 지난해 12월 사내 기부 이벤트 '제3회 더블유WEEK'를 통해 모금된 금액이다.더블유WEEK는 넥슨이 직원과 회사가 함께하는 사내 나눔 문화를 조성하고자 정기 개최하고 있는 사원증 태깅 방식의 모금형 사내 기부 이벤트로, 회사가 직원들의 모금액과 넥슨 구성원 개인 혹은 조직이 마련한 별도 기부금을 합산 뒤 매칭해 두 배로 기부하는 형식이다.넥슨은 지난해 12월 5일부터 9일까지 사내 이벤트를 통해 모금된 직원 기부금과 '2022 가명정보 활용 우수사례 경진대회' 우수상 상금을 포함한 총 3천300만원에 동일한 금액을 더해 한국백혈병소아암협회에 전달했다. 기부금은 소아암 환아 수술비 및 장기간 항암 치료가 필요한 어린이들의 재활 치료비 지원을 위해 사용될 예정이다.앞서 넥슨은 총 2차례 더블유WEEK를 진행해 국내 첫 독립형 어린이 완화의료센터인 '서울대학교병원 넥슨어린이완화의료센터' 건립과 장애 어린이 의료지원을 위해 각각 기부금을 서울대학교병원과 푸르메재단에 전달했다. 3회까지 더블유WEEK 누적 기부금은 총 2억2천100만원이다.한편 넥슨과 넥슨재단은 우리 사회의 손길이 미치지 못하는 어린이와 청소년을 위한 의료 시설 확충, 교육 저변 확대 등 사회공헌 활동을 펼치고 있다.",105,https://n.news.naver.com/mnews/article/031/0000721195?sid=103
미국 라스베이거스 CES에 '광주공동브랜드 홍보관' 개관,2023.01.06. 오후 5:23,"(광주=뉴스1) 박준배 기자 = 강기정 광주시장이 5일(현지시간) 미국 라스베이거스에서 열린 세계 최대 가전‧IT 전시회인 CES 2023의 '광주 공동브랜드 홍보관' 개관식에 참석해 정무창 광주시의회 의장과 시의원, 박상철 호남대 초장, 이민숙 동강대 총장 등과 기념 촬영을 하고 있다. (광주시 제공) 2023.1.6/뉴스1",105,https://n.news.naver.com/mnews/article/421/0006563055?sid=103
[인사] 과학기술정보통신부,2023.01.06. 오후 3:17,과장급 전보    ▲ 공공에너지조정과장 김동준 ▲ 성장동력기획과장 윤미란    (서울=연합뉴스),105,https://n.news.naver.com/mnews/article/001/0013686161?sid=103
"한글과컴퓨터, 한국중부발전에 개방형 OS '한컴구름' 공급",2023.01.06. 오전 9:00,"노트북 1대로 업무망과 인터넷망 모두 사용 가능한글과컴퓨터(대표 변성준, 김연수)가 한국중부발전(사장 김호빈)의 업무용 노트북에 개방형 운영체제(OS)인 '한컴구름'을 적용했다고 5일 발표했다.



한글과컴퓨터 CI [사진=한글과컴퓨터]이번 사업은 정보통신산업진흥원(NIPA)에서 지원하는 '2022년 개방형 OS 확산 지원사업'의 일환으로 '한컴구름' 기반의 VPN(가상 사설망) 선행인증 시스템을 활용해 1대의 노트북으로 업무망과 인터넷망을 모두 사용할 수 있다.한국중부발전은 사무실 외에 어디서나 자유롭게 업무시스템 접속이 가능한 원격 근무 환경을 구축해 업무의 효율성을 높이고, 예산 절감 효과를 기대할 수 있다.또한, 한컴구름의 중앙관리서버 솔루션을 제공해 사용자의 프로그램 설치 및 사용 권한, 데이터 접근 권한 등을 관리할 수 있도록 지원해 효율적인 운영관리를 돕는다.한컴구름의 시스템 구축은 오투원즈, 조은기술, 이액티브가 함께 참여했으며, 안랩의 VPN(가상사설망) 장비(TrusGuard)와 휴네시온의 망연계 솔루션(i-oneNet)을 활용해 보안성을 더욱 높였다.최근 행정안전부가 2025년까지 공공기관 전체에 구름 OS를 탑재한 노트북 ‘온북’ 도입을 시작으로, 공기업과 금융기관에서도 ‘한컴구름‘에 대한 문의가 증가함에 따라 한컴은 지난해 구축한 ’한컴구름‘ 협력사들과 함께 고객 맞춤형 컨설팅을 제공하고, 기술지원 체계를 마련했다.한컴 관계자는 ""행정안전부의 온북 시범 사업을 통해 보안성과 안정성을 검증받은 ‘한컴구름’을 한국중부발전의 기존 업무시스템과 연동하여 구축을 완료했다""며, ""정부의 클라우드 전환 전략에 맞춰 ’한컴구름’ 도입이 더욱 빠르게 확산할 수 있도록 협력관계를 공고히 강화해 나가겠다""고 말했다.",105,https://n.news.naver.com/mnews/article/031/0000721181?sid=103
"네이버 엑스퍼트, 새해 '갓생' 돕는 상담 클래스 선보인다",2023.01.06. 오전 9:35,"운세·어학공부·재테크 등새해 관심 많은 주제 엄선[서울경제] 네이버는 온라인 상담 플랫폼 ‘네이버 엑스퍼트’가 이용자들이 새해에 높은 관심을 보이는 분야 관련 전문가 상담 클래스를 선별해 제안한다고 6일 밝혔다.



이번 엑스퍼트 이벤트는 심리 상담, 학업 계획, 재테크 등 분야에서 선호도 높은 전문가 상담 클래스를 제공해 이용자들이 각자 수립한 계획을 효과적으로 실천할 수 있도록 돕는다. 세부적으로 △2023년 사주 운세 △어학, 입시 학습 등 학업 컨설팅 △재테크, 세무 관련 재무 상담 등 다양한 주제의 클래스로 구성됐다.이번 이벤트를 오는 2월 말일까지 진행 예정이다. 해당 기간 동안 이벤트 페이지에 구성된 상담 클래스 중 일부 콘텐츠에는 별도 할인율이 적용되는 쿠폰도 지급된다.강춘식 네이버 엑스퍼트 리더는 “네이버 엑스퍼트 사용자들이 새해를 맞아 많은 관심을 보이고 계획을 세우는 분야에 대해 전문가들의 조언과 함께 계획 대비 목표를 효과적으로 성취할 있도록 지원하기 위한 취지”라며 “지난해 많은 사용자들이 엑스퍼트를 활용한 만큼, 올해도 다양한 상담 영역을 확대하고 전문가들에게도 새로운 기회를 발굴할 수 있는 서비스가 될 수 있도록 고도화할 것이다”고 말했다.한편, 네이버 엑스퍼트는 지난 2019년 11월 출시 이후 3년 만에 전문가와 사용자를 누적 200만 건 연결했다. 현재 96개 상담 분야를 운영하고 있으며, 특히 운세, 세무, 심리상담 주제가 높은 인기를 얻고 있다고 사측은 전했다.",105,https://n.news.naver.com/mnews/article/011/0004141981?sid=103
"[CES 2023] LG 씽큐, HCA 연결로 '스마트홈' 기능 진화",2023.01.06. 오전 7:53,"G 씽큐-타사 제품, LG 가전-타사 플랫폼과 연동 시연[라스베이거스(미국)=이나리 기자] LG전자 스마트홈 플랫폼 'LG 씽큐'가 연결성을 확대하고 맞춤형 업그레이드를 강화해 만능 스마트홈 플랫폼으로 진화한다.LG전자는 5일(현지시간) 세계 최대 가전·IT 전시회 ‘CES 2023’에서 스마트홈 플랫폼 LG 씽큐를 이용해 타사 가전을 제어하고, 타사 스마트홈 플랫폼을 통해 LG 가전이 제어되는 모습을 시연한다.



LG전자가 ‘CES 2023’에서 스마트홈 플랫폼 LG 씽큐를 이용해 타사 가전을 제어하고, 타사 스마트홈 플랫폼을 통해 LG 가전이 제어되는 모습을 시연한다. LG 씽큐 사용자는 LG전자가 아닌 타사 제품을 앱에 등록해 제어할 수 있고, 타사 스마트홈 플랫폼 사용자는 무드업 냉장고를 앱에 등록해 냉장고 온도를 확인할 수 있다.(사진=LG전자)이번 시연은 LG전자가 지난 8월 다양한 가전 및 공조업체의 자체 스마트홈 플랫폼들을 연동하기 위한 협의체 ‘HCA(Home Connectivity Alliance)’에 의장사로 참여한 이후 공개하는 첫 성과다. LG전자는 앞선 스마트 가전 기술력을 바탕으로 회원사들과 적극 협업해 단기간에 연동 시험 준비를 완료했다.LG전자는 CES 2023 전시장 내 마련된 HCA 부스에 무드업 냉장고, 워시타워, 에어로타워, 벽걸이 에어컨 등 4개 제품을 전시한다. 관람객은 이 제품들을 포함한 HCA 회원사의 제품을 제조사가 아닌 회사의 스마트홈 플랫폼에 등록하고 제어하는 것을 직접 체험할 수 있다.예를 들어 타사 플랫폼에 무드업 냉장고를 등록해 냉장고 온도를 확인하거나 에어로타워를 등록해 제품을 켜고 끌 수 있다. 또 LG 씽큐 앱에 타사 세탁기를 등록해 남은 세탁 시간을 확인하거나, 스마트 온도조절계를 등록해 공조장치의 온도를 조절할 수 있다.LG 씽큐는 이처럼 다양한 제조사와 협력해 가전 연결성을 확대해 나갈 계획이다. 더 나아가 LG전자만의 차별화된 고객경험을 제공하는 방향으로 진화하고 있다.단, 사용자가 LG 씽큐 앱으로 무드업 냉장고의 도어 색상을 변경하거나 제품에 새로운 기능을 추가하는 기능은 오직 LG 씽큐에서만 가능하다.류재철 LG전자 H&A사업본부장 사장은 ""HCA 의장사로서 회원사와 적극적인 협업 및 오픈 이노베이션을 추진해 고객이 더욱 편리한 삶을 누릴 수 있도록 솔루션을 제시할 것""이라고 말했다.",105,https://n.news.naver.com/mnews/article/092/0002278835?sid=103
