title,date,main,section,url
여름에 발견된 장수하늘소 애벌레 넉달 만에 ‘어른’으로 탈바꿈,2019.12.15. 오후 12:02,"지난 8월 강원도 춘천지역서 발견번데기로 바뀐 지 한달 만에 성충“내년 1월까지 짝짓기·산란 유도”



지난 8월 발견된 장수하늘소 애벌레가 번데기 과정을 거쳐 성충으로 탈바꿈했다. 사진은 암컷 장수하늘소. 국립과천과학관과학기술정보통신부 국립과천과학관(관장 배재웅)은 15일 “지난 여름 강원도 춘천 일대에서 발견한 천연기념물 제218호 장수하늘소 애벌레가 그동안 번데기 과정을 거쳐 지난달 말과 이달 초에 각각 암‧수 한 쌍의 장수하늘소 성충으로 탈바꿈했다”고 밝혔다.(▶관련기사‘천연기념물’ 장수하늘소 유충, 50년 만에 광릉숲 이외 지역서 발견) 암컷 장수하늘소 애벌레의 경우 11월4일 번데기로 바뀐 지 26일 만인 지난 11월29일 허물을 벗고 성충이 됐으며, 수컷 애벌레도 약 23일의 번데기 과정을 거쳐 지난 6일 탈바꿈을 했다. 몸길이는 현재 각각 81㎜와 85㎜이다.



지난 8월 발견된 장수하늘소 애벌레가 번데기 과정을 거쳐 성충으로 탈바꿈했다. 사진은 수컷 장수하늘소. 국립과천과학관 제공장수하늘소는 생애의 대부분을 애벌레 형태로 보내며, 마지막 단계인 성충으로서의 생존기간은 성장 환경에 따라 달라지지만 보통 1~2개월 정도로 짧은 것으로 알려져 있다.과천과학관은 “성충 두 마리 모두 건강한 상태여서 내년 1월까지 짝짓기와 산란을 유도해 다량으로 채란할 수 있을 것으로 기대하고 있다”고 밝혔다. 장수하늘소는 보통 한번에 50여개의 알을 낳는다. 과학관은 이들 알의 생존율을 80~90% 이상으로 높인다는 계획이다.이근영 선임기자 kylee@hani.co.kr▶페북에서 한겨레와 만나요~▶신문 보는 당신은 핵인싸!▶7분이면 뉴스 끝! 7분컷[ⓒ한겨레신문 : 무단전재 및 재배포 금지]",105,https://n.news.naver.com/mnews/article/028/0002478273?sid=103
"알뜰폰 분리매각 피한 LGU+, 5G·LTE 도매대가 인하해야",2019.12.15. 오후 12:03,"[디지털데일리 권하영기자] LG유플러스가 CJ헬로를 인수한다. 최대 쟁점이던 알뜰폰 분리매각은 피했다. 대신 알뜰폰 시장 활성화를 위한 책무를 짊어졌다. 저렴한 5G 알뜰폰 출시 길을 열어주고, 알뜰폰이 내는 망 도매대가도 상당 수준 인하하는 것이 골자다.   15일 과학기술정보통신부(과기정통부)는 LG유플러스가 신청한 CJ헬로 주식취득 인가와 최다액출자자 변경승인 건에 대해 조건부 인가 및 변경승인을 했다고 발표했다. 이로써 LG유플러스는 케이블TV와 알뜰폰 시장에서 각각 1위 사업자인 CJ헬로를 최종 인수하게 됐다.   알뜰폰사업 인수와 관련해 쟁점으로 떠오른 분리매각 조건은 없었다. 이로써 하나의 이동통신사업자(MNO)는 하나의 알뜰폰사업자(MVNO)만 둘 수 있다는 ‘1사 1알뜰폰’ 원칙은 깨졌다. LG유플러스는 CJ헬로 인수를 통해 자회사 미디어로그와 함께 2개의 알뜰폰을 운영하게 된다.   대신 다른 인가 조건이 붙었다. 과기정통부는 기간통신사업 경쟁에 미치는 영향, 이용자 보호, 재정·기술적 능력 등을 고려한 핵심적인 조건들을 부과했다. 요약하면 알뜰폰 도매제공 의무사업자인 SK텔레콤보다도 도매조건을 상당 수준 완화해야 한다. 결코, 쉬운 조건은 아니다.    ◆도매대가 인하, 5G까지 확대=먼저, 시장 경쟁 측면에서 LG유플러스는 자사 망을 사용하는 알뜰폰에 ▲도매제공 대상 확대 및 도매대가 인하 ▲데이터 선구매 할인 제공 ▲다회선 할인 및 결합상품 동등제공 ▲5G 단말기·유심 구매조건 동등제공 등 조건을 지켜야 한다.   과기정통부는 CJ헬로가 통신3사와의 도매대가 협상을 주도해온 실질적 알뜰폰 1위 사업자인 만큼 이러한 조건이 필요하다고 판단했다. CJ헬로가 인수되면 알뜰폰 1~4위 사업자가 모두 이동통신 자회사가 되어 통신사의 알뜰폰 시장 영향력이 커질 수 있어서다. 협상 구심점이 사라져 경쟁이 위축되고, 가계통신비 면에서 이용자 불이익이 생기는 것을 막자는 취지다.   우선, 도매제공 대상을 늘리고 가격을 인하하도록 했다. LG유플러스는 출시 또는 출시 예정인 주요 5G·LTE 요금제를 모두 도매 제공해야 한다. 5G 도매대가는 66%로 낮춘다. 업계에 따르면 기존 5G 도매대가는 75% 안팎 수준으로 논의돼 왔다. 이를 감안하면 파격적인 수준이다. 이에 따라 알뜰폰은 LG유플러스 월 5만5000원 5G 요금제(기본데이터 9MB, 소진 후 1Mbps)를 3만6300원에 내놓을 수 있다. 단, 완전 무제한 요금제는 제외다.   LTE 요금제와 종량 요금제도 도매제공 의무사업자보다 더 크게 인하해야 한다. 100GB 이상 대용량 LTE 요금제의 경우 LG유플러스의 도매대가는 SK텔레콤(62.5%)보다 최대 4%포인트 내려간 58.5%가 된다. 종량제 역시 SK텔레콤보다 평균 3.2% 인하해야 한다. SK텔레콤은 1MB당 2.95원인데, LG유플러스는 이보다 저렴한 2.85원이 된다. 음성은 SK텔레콤이 1분당 18.43원, LG유플러스는 17.87원이다.   알뜰폰이 종량제 데이터를 대용량으로 사전 구매하는 경우에는 데이터 선 구매제 할인을 도입하도록 했다. 향후 LG유플러스는 알뜰폰이 구매할 데이터양에 따라 최소 3.2%에서 최대 13%까지 할인을 제공할 예정이다. 예를 들어 5TB는 3.2%, 10TB는 4.4%, 20TB는 8.2%, 40TB는 9.9%, 100TB는 13% 할인된다.   다회선 할인과 결합상품도 LG유플러스와 동등한 조건으로 제공하도록 했다. 이동전화 다회선이나 인터넷·유료방송 등을 보유하지 못해 마케팅 측면에서 열위에 있던 알뜰폰 사업자가 동등 결합상품 등을 통해 경쟁력을 회복할 수 있도록 한 조치다. 아울러 알뜰폰이 5G 단말기나 유심 구매를 요청하면 LG유플러스가 동등한 조건으로 구매를 대행토록 했다.   ◆CJ헬로 가입자 부당 유인 차단=이용자 보호 측면에서는 경쟁사(SKT·KT)망을 사용하고 있는 CJ헬로 이동전화 가입자에 대해 LG유플러스로 부당하게 전환하지 못하도록 조건을 달았다.   LG유플러스는 CJ헬로 가입자에게 LGU+로의 전환을 부당하게 강요하거나 지원금을 차별 지급해 이를 유도해선 안 된다. CJ헬로 이동통신 대리점·판매점에 대해서도 수수료를 차별 지급하거나 CJ헬로 이용자 정보를 영업활동에 부당하게 유용할 수 없다.   아울러 CJ헬로의 통신 재난 대응력도 키우는 조건도 부과됐다. 양사는 주요 인프라를 공동 활용할 수 있으므로 통신 재난관리 계획을 보완해 통신망·전력망 이원화를 조기 구축할 필요가 있다는 판단이다. 이에 따라 당초 CJ헬로의 통신망 이원화 기한은 5년 내였으나, LG유플러스와 동일한 3년 내로 좁혀졌다. 출입제한 및 보안 조치도 1년 내 완료해야 한다.   이 밖에 LG유플러스는 농·어촌 등 초고속인터넷 음영지역에 광대역통합정보통신망을 구축하는 해야 한다. 과기정통부는 LG유플러스가 이익잉여금 1조8000억원, 기술인력 약 300명을 보유해 재정적, 기술적 능력이 적정한 반면, 음영 지역 축소 등 구체적인 투자계획은 미흡하다고 지적했다. 이에 따라 CJ헬로 권역을 포함한 LG유플러스의 농·어촌 등 음영 지역에 2022년까지 100Mbps~광대역 가입자망(BcN)을 구축해야 하는 조건을 달았다. 향후 구축계획을 제출받아 승인할 예정이다.   <권하영 기자>kwonhy@ddaily.co.kr[제15회] 2020년 전망, 금융IT 컨퍼런스 개최!뉴스채널 설정 - 네이버 메인에서 디지털데일리 뉴스를 볼 수 있어요.IT정보의 즐거운 업그레이드[딜라이트닷넷]<저작권자 © 디지털데일리 무단전재-재배포금지>",105,https://n.news.naver.com/mnews/article/138/0002080652?sid=103
Samsung Selected as 4G LTE-A & 5G Network Solution Provider by Videotron in Canada,2019.12.15. 오전 9:02,"- Samsung’s first entry into the Canadian market via Videotron   By Yun Sang-ho   crow@ddaily.co.kr   [Digital Daily]   Seoul, Korea, December 14, 2019- Samsung Electronics today announced that it will provide 4G LTE-Advanced (LTE-A) and 5G radio access networks solutions to Videotron, a Canadian telecommunications operator. This is the first time Samsung is delivering network solutions in Canada.   After many successful decades in the cable television and internet access business, Videotron deployed its wireless operation in 2010 and has been the fastest growing new operator since then. Currently providing 4G LTE service, Videotron plans to launch commercial LTE-A and 5G services in late 2020.   Starting in early 2020, Samsung will deliver 4G LTE-A solutions across Quebec and Ottawa in which the solutions from Samsung include Massive MIMO and Dual-band base stations, supporting the operator’s 4G LTE frequencies, and 5G solutions for both 3.5GHz and 28GHz spectrum.    Providing commercially proven 4G LTE-A solutions and combined with 5G commercial solutions from global markets, Samsung will increase efficiency in accelerating expansion of 5G service coverage to match pace with Canada’s 5G commercial launch, which is expected to take place in late 2020.    ""We have been all over the world to find the best supplier suited to meet the evolving needs of our customers. This partnership will allow us to deliver the most advanced telecommunications solutions to Quebecers. While 4G technology has profoundly transformed telecommunications in the world, LTE Advanced and 5G will undoubtedly revolutionize the way we interact with our loved ones and the environment around us,” said Jean François Pruneau, President and Chief Executive Officer of Videotron. “We want to be with our customers through these major changes and the choice of Samsung as a supplier is not a coincidence, we are convinced that they represent the best option to achieve this objective. Videotron has always been at the forefront of major technological changes and the arrival of 5G is no exception. Today's announcement is a very proud moment for us.""     “Signing a contract with Videotron to provide 4G LTE-A and 5G network solutions will be marked as a significant milestone for Samsung, and Samsung will be the part of evolving next generation of mobile communication technologies in Canada by delivering advanced technologies,” said Paul Kyungwhoon Cheun, Executive Vice President and Head of Networks Business at Samsung Electronics. “Leveraging the global experience of 5G commercialization from leading 5G markets like Korea and the U.S., Samsung will increase its position in 4G LTE and 5G vendor market.”[제15회] 2020년 전망, 금융IT 컨퍼런스 개최!뉴스채널 설정 - 네이버 메인에서 디지털데일리 뉴스를 볼 수 있어요.IT정보의 즐거운 업그레이드[딜라이트닷넷]<저작권자 © 디지털데일리 무단전재-재배포금지>",105,https://n.news.naver.com/mnews/article/138/0002080645?sid=103
영화 ‘아이언맨’ 속 핵융합에너지 가능할까...‘토크 콘서트’ 개최,2019.12.15. 오전 10:27,"국가핵융합연구소는 지난 14일 국립광주과학관에서 핵융합에너지를 쉽고 재미있게 알리기 위한 '핵융합 토크 콘서트'를 열었다.'아이언맨의 아크 리엑터 정말 가능할까'를 주제로 열린 이 행사에는 고원하, 김성국 핵융합연 박사가 강연자로 나서 초·중학생 등과 함께 영화 '아이언맨'에 등장하는 핵융합에너지와 플라즈마 기술에 대해 이야기를 나눴다.강연에 앞서 참가 학생들은 핵융합 체험교실에서 미니 번개 만들기, 인공태양 띄우기, 자기장 실험 등 다양한 체험형 프로그램을 통해 핵융합에너지 원리를 이해하는 시간을 가졌다.권은희 핵융합연 커뮤니케이션팀장은 ""안전하고 깨끗한 미래 에너지원인 핵융합에너지에 대한 국민들의 이해와 관심을 높이기 위해 국립과학관, 지자체 등과 다양한 과학문화행사와 교육기부 프로그램을 지속적으로 운영할 계획""이라고 말했다.이준기기자 bongchu@dt.co.kr



핵융합 토크콘서트를 진행하고 있는 고원하 박사, 김성국 박사_1     핫 섹션 : [ ♨ HOT 포 토 ] / [ 육감적 영상창작소 ditta ]네이버 채널에서 '디지털타임스'를 구독해주세요.",105,https://n.news.naver.com/mnews/article/029/0002574402?sid=103
[일문일답]'OTT 공룡' 대응 위해 인수 승인…알뜰폰 분리매각 고심 컸다,2019.12.15. 오후 12:00,"""알뜰폰, 분리 매각보다 행태 조건 부과가 이용자 이익에 낫다고 판단""



이태희 과기정통부 네트워크정책실장이 13일 서울 정부종합청사에서 LG유플러스의 CJ헬로 인수 조건부 인가에 대한브리핑을 진행하고 있다. 2019.12.14. /뉴스1 © News1 김정현 기자(서울=뉴스1) 김정현 기자 = 과학기술정보통신부가 알뜰폰 활성화·방송 지역성 및 공공성 강화 등의 조건을 달고 LG유플러스의 CJ헬로 인수를 조건부 승인했다.과기정통부는 지난 13일 서울 종로구 정부종합청사에서 열린 브리핑에서 ""LG유플러스가 신청한 CJ헬로 주식 취득 인가와 최다액 출자자 변경 승인건에 대해 조건을 부과해 인가 및 변경승인했다""고 밝혔다.이날 이태희 과기정통부 네트워크정책실장은 ""온라인동영상서비스(OTT) 등 미디어 제공환경 변화에 대응해 정체된 방송통신시장의 활력을 부여했다""며 ""심사과정에서 제기된 알뜰폰 등 기존 시장의 경쟁저해 문제를 치유하고 가계통신비 절감 및 이용자 피해를 예방하기 위해 필요한 조치를 취했다""고 강조했다.다음은 이 실장과의 일문일답.-CJ헬로라는 알뜰폰 1위 기업이 이동통신사에 넘어가는건데, 알뜰폰의 통신사 의존이 더 커지는 게 아니냐는 지적에 대해서는 어떻게 받아들이나▶자문위원단과 과기정통부의 가치 판단으로는 (분리매각보다) '행태 조건'을 붙이는게 알뜰폰 활성화와 이용자 이익에 더 도움된다고 판단한 것이다. 분리 매각에 대해서도 굉장히 고심했었고, 그래서 결론이 늦어진 부분도 있다.-기존 이동통신사와 알뜰폰 간에 유지되던 '1사 1알뜰폰(MVNO)' 원칙은 깨졌다고 보면 되나? ▶단답으로 말씀드리자면, 깨졌다고 보시면 된다. 기존에는 '1사 1MVNO'를 원칙으로 두고 관리해왔다면, 이제는 소비자에게 더 이익이 되는 측면을 보는 쪽으로 기준을 두고 관리하겠다는 것. 자문위원단도 알뜰폰 시장 활성화하고 좀더 다양한 요금제 활성화되는게 소비자에게 도움이 되는 측면이 있다고 판단했다. 다만 기존 알뜰폰 시장점유율 50% 제한 조건은 유효하다.-이번에 알뜰폰 조건에는 알뜰폰 업계가 요구한 조건이 대부분 들어있어. 유플러스에만 부과되면 3위 사업자에 부담이 너무 클 것 같은데▶관점에 따라 다르다고 본다. 실제로 SK텔레콤은 오히려 이런 조건이 유플러스에 적용되면 이에 맞는 조건과 관련있는 이용자가 늘어 LG유플러스에 유리하게 작용해 이동통신시장 지배력 높아질 거라고 이야기하기도 했다.-그럼 알뜰폰 업체들도 요구가 많은데, SKT나 KT에도 비슷한 조건을 제시하는 등 환경을 만들 생각은 없나?▶이번에 LG유플러스에서 선제적으로 조건을 제안했었고, 이를 받아들이면서 관련 조건을 부과하게 된 것. 알뜰폰 업계에서 요청은 있지만 이는 이동통신사들에 강제할 사항은 아니라고 본다.-알뜰폰 관련 논의에서 LG유플러스가 제안한 내용을 받아들이면서 타 사업자들의 이야기는 청취했는지?▶앞서 7월에 이해관계자 공개토론회를 개최하고 거기서 사업자들의 의견을 청취한 바 있다. SK텔레콤이나 KT가 제시한 조건은 (알뜰폰) 분할 매각이었다. 유플러스가 제안한 조건에 대해서는 타 이동통신사에 묻지는 않았다.-이번 도매대가 인하로 알뜰폰에서 3만~4만원대 5G 요금제가 나오면 기존 과기정통부가 이통사를 상대로 요구했던 저가 5G요금제 요구는 상쇄되나.  ▶알뜰폰에서 3만~4만원대 저가요금제 출시가 되는 것은 기존 이통사 요구사항과 별개다. 과기정통부의 기본 방침은 이통3사도 저가요금제를 내야한다는 것.-방송의 지역성과 공공성에 대해 CJ헬로와 LG유플러스의 책임이 전과 같은 수준인가, 높아진 수준인가? ▶더 높은 수준이라고 말씀드릴 수는 없지만, 지역성과 공공성에서 진전이 있도록 조건을 부과한 것. 일례로 8VSB 기본상품에 지역채널 포함이 의무가 아닌 경우도 있는데 의무화했고, 지역채널심의위원회 운영도 다른 곳은 의무가 아니지만 의무화 했다. -공정경쟁을 위해 8VSB에 대한 조건 외에 가격 인상 등을 금지하는 조건은?▶앞서 공정위 측에서 부과한 사항이라, 가격인상 금지는 이번에 별도로 부과하지는 않았다. -CJ헬로 협력 업체 등에서 LG유플러스의 직고용 요구도 있는데, 정부 생각은?▶해당 사안에 대한 심사위 토론이 있었는데, 기본적으로는 LG유플러스가 CJ헬로의 협력업체를 직고용하는 것은 법적으로 안된다는 이야기가 있었다. 하지만 해당 사안이 사회적 이슈기도 하고, 일자리 문제에는 중요한 가치가 있다보니 3년간 협력업체와의 기존 계약 유지하도록 했다. 또 협력업체 상생방안 만들어 승인을 받도록 했고, LG유플러스 측에서도 살펴보겠다고 했다.-SK브로드밴드와 티브로드 간 심사 일정은 어떻게 되나? 다음주 심사위원회 합숙 시작하나?▶현재 SK브로드밴드·티브로드 합병 사안에 대해 검토 진행 중이다. 빠른 시일 내에 시작하려 하지만, 해당 사안은 방송통신위원회의 사전동의가 필요해 연내에는 어려울 것으로 본다.Kris@news1.kr▶ [ 크립토허브 ] ▶ [ 해피펫 ]▶ 네이버 메인에서 [뉴스1] 구독하기![© 뉴스1코리아(news1.kr), 무단 전재 및 재배포 금지]",105,https://n.news.naver.com/mnews/article/421/0004358167?sid=103
SKT 광고에 청각장애 학생 등장한 이유는?,2019.12.15. 오전 10:00,"무료 통화연결음 ‘손누리링’ 광고 “기술 근간은 사람” 강조



SK텔레콤이 청각장애 가입자를 위해 운영 중인 무료 통화연결음 서비스 ‘손누리링’을 소개하는 광고의 주요 장면. SK텔레콤 제공SK텔레콤이 청각장애 고객의 통신생활을 돕는 서비스 ‘손누리링’을 소개하는 광고를 15일 공개했다. 손누리링은 지난 10월 출시된 서비스다. 손누리링이란 이름은 ‘손으로 세상을 그리다’라는 의미를 가지고 있다. 청각장애 고객을 위한 무료 통화연결음 서비스로 이 서비스를 이용하는 청각장애 고객에게 전화를 건 발신자는 “이 전화는 듣는 것이 불편하신 고객님의 휴대전화입니다. 문자로 연락주세요. 감사합니다”라는 음성 안내를 받게 된다.SK텔레콤은 국립서울농학교와 전국청각장애인협회의 의견을 청취해 손누리링을 개발했다. 청각장애 고객들은 택배, 은행, 관공서 등 실생활에 꼭 필요한 연락을 문자를 받을 수 있게 돼 편리하다는 반응을 보이고 있다.이번 광고에서는 실제 청각장애를 가진 국립서울농학교 2학년 박세현 양이 모델로 출연했다. 뮤지컬 배우가 꿈인 박세현 양은 일상생활에서 손누리링을 실제로 이용하고 있다. 광고에서 박세현 양은 전화가 울리자 통화종료를 누르지만 곧 이어 오디션에 합격했다는 문자를 확인하는 장면으로 손누리링이 창출하는 사회적 가치를 표현했다.예희강 SK텔레콤 브랜드마케팅그룹장은 “SK텔레콤은 ‘통신 기술의 근간은 사람’이라는 마음을 늘 잃지 않고 실천하려 노력하고 있다”며 “이번 광고에서도 사람을 향하는 기술을 전달하고자 했다”고 말했다.맹하경 기자 hkm07@hankookilbo.com ▶네이버에서 한국일보 뉴스를 받아보세요 ▶뉴'잼을 보면 뉴스가 재밌다 [뉴스레터 구독하기] ▶한국일보닷컴 바로가기",105,https://n.news.naver.com/mnews/article/469/0000448696?sid=103
"[이슈분석]LG유플러스-CJ헬로, 9개월 만에 인수",2019.12.15. 오후 2:47,"LG유플러스의 CJ헬로 인수는 274일 만에 이뤄졌다. 인수 결정부터 정부 인가 결정까지 9개월가량 소요됐다.LG유플러스는 2월 14일 CJ헬로 지분 50%+1주를 인수하기로 결정하고 3월 15일 과학기술정보통신부, 공정거래위원회에 인허가 신청서를 제출했다.11월 8일 공정위가 기업결합 승인을 발표했고, 12월 13일 과기정통부가 CJ헬로 최다액출자자 변경 승인, 주식취득 인가를 발표하며 주요 절차가 마무리됐다.CJ헬로는 24일 주주총회를 열고 LG헬로비전으로 사명변경과 사내이사 선임 등의 절차를 마무리할 예정이다.LG헬로비전 초대 대표에는 CJ헬로인수추진단장을 맡은 송구영 LG유플러스 홈·미디어 부문장이 내정됐다.송구영 내정자는 “CJ헬로에서 LG유플러스로 가입자 전환을 우려하는 목소리가 많지만 신규 가입자 유치가 양사에 모두 유리하다”면서 “공정경쟁을 통해 방송·통신 시장에 새바람을 불러오겠다”고 각오를 밝혔다.LG유플러스의 CJ헬로 인수는 전례없는 통신사와 케이블TV 간 결합이라는 특수성을 감안하더라도, 심사 기간이 예상보다 길었다는 지적이다.2008년 SK텔레콤-하나로텔레콤 인수, 2009년 KT-KTF 합병, 2009년 LG텔레콤·LG데이콤·LG파워콤 3사 합병 등은 모두 60일 내외에 일단락됐다.LG유플러스의 CJ헬로 지분 인수 절차와 달리 SK브로드밴드와 티브로드 합병은 방송통신위원회 사전동의 절차가 필요해 심사기간이 상당기간 소요될 것으로 예상된다.SK텔레콤은 과기정통부와 방통위 심사가 예상보다 늦어져 SK브로드밴드·티브로드 합병 기일을 당초 2020년 1월에서 3월로 미룬 데 이어 한 달 더 미룬 4월 1일로 연기했다.김용주기자 kyj@etnews.com▶ 네이버 모바일에서 [전자신문] 채널 구독하기▶ 전자신문 바로가기 [Copyright ⓒ 전자신문 & 전자신문인터넷, 무단전재 및 재배포 금지]",105,https://n.news.naver.com/mnews/article/030/0002857268?sid=103
