title,date,main,section,url
"네이버클라우드, NIPA 클라우드 품질·성능 검증 확인서 획득",2023.01.31. 오후 6:50,"네이버클라우드는 자사 공공기관용 클라우드 플랫폼이 NIPA(정보통신산업진흥원)의 클라우드컴퓨팅서비스 품질·성능 검증을 통과했다고 31일 밝혔다.                                클라우드컴퓨팅서비스 품질·성능 검증은 클라우드 서비스의 품질 및 성능에 대한 기준 고시 및 수준 향상을 위해 NIPA가 주관하는 사업이다. 한국클라우드산업협회와 TTA(한국정보통신기술협회)가 공동으로 클라우드 서비스의 △가용성 △응답성 △확장성 △신뢰성 △서비스 지속성 △서비스 지원 △고객 대응 등 총 7가지 기준에 대한 관리체계를 점검하고 품질·성능 시험을 진행해 이를 모두 충족하면 확인서를 발급한다.네이버클라우드는 공공기관용 IaaS(서비스형 인프라) 부문에 대한 검증을 완료, 공공 분야 클라우드 운용에 있어 필수적인 품질 안정성과 확장성 등을 다시 한 번 객관적으로 입증했다고 강조했다.박선영 네이버클라우드 품질관리총괄 이사는 ""공공 분야 클라우드 플랫폼 강자로서 검증된 역량을 바탕으로 정부 및 공공기관의 믿을 수 있는 파트너로 디지털 전환에 적극 앞장서겠다""라고 말했다.",105,https://n.news.naver.com/mnews/article/029/0002781471?sid=103
목표 드론만 격추 가능…협대역 전자기파로 안티 드론 기술 개발,2023.01.31. 오전 10:47,"사진=연합뉴스도심에 침투한 드론의 회로만 원격에서 전자기파를 쏴 무력화 시킬 수 있는 ‘협대역 전자기파 안티드론기술’이 국내 연구진에 의해 개발됐다. KAIST는 김용대 전기전자공학부 교수 연구팀이 이러한 기술을 개발해 세계적인 보안학회 NDSS 2023에서 발표했다고 31일 밝혔다.안티드론 기술은 드론의 보안 취약점을 이용해 추락시키거나 원하는 방향으로 제어하는 기술이다. 기존에 사용되는 광대역 전자기파를 이용한 안티드론 기술은 주변 전자 전기 장치에도 피해를 일으켜 도심 사용이 어려웠다. 김 교수 연구팀은 드론 제조사의 제어 유닛 보드 전자파 민감도가 다르다는 것을 발견했다.각 제조사별 제어 유닛 보드 전자파 민감도를 극대화 하는 주파수를 분석했다.이를 이용해 매우 좁은 대역인 ‘협대역전자파’로 원격에서 드론 무력화 가능하다는 사실 입증했다.실내 전자파 차폐 시설을 이용해 10m 거리에서 호버링 비행 중인 드론을 즉각적으로 추락시킬 수 있음을 확인했다.공격 거리와 요구 전력 간의 관계를 도출했다. 10m 이상의 거리에 대해선 시뮬레이션을 통해 가능함을 확인했다.주변 전자 장치에 미치는 영향을 최소화 해 도심에서도 적용이 가능할 뿐 아니라, 아군의 드론이 적군 드론과 엉켜 있는 상황에서도 사용할 수 있을 것으로 기대된다.KAIST 관계자는 “A기종을 사용하는 100개의 적 드론과 B기종을 사용하는 100개의 아군 드론이 동시에 비행하고 있을 때 아군 드론은 전혀 영향을 받지 않으면서 100개의 적 드론을 모두 격추시킬 수 있는 기술”이라고 설명했다.장준하 연구원은 “자폭 드론, 집단 드론 공격 등으로부터 국민을 보호하는 기술로 활용할 수 있을 것”이라고 했다.김진원 기자 jin1@hankyung.com",105,https://n.news.naver.com/mnews/article/015/0004804948?sid=103
고진 디지털플랫폼위원장 “국민이 서류를 내지 않는 정부 꿈꿔”,2023.01.31. 오후 7:34,"“디지털플랫폼정부위원회가 꿈꾸는 것은 국민이 더이상 (정부에) 서류를 내지 않는 것입니다.”     대통령 직속 디지털플랫폼정부위원회 고진 위원장이 31일 서울 중구 프레스센터에서 기자간담회를 갖고 ‘디지털플랫폼 정부’ 추진 구상을 밝혔다. 디지털플랫폼 정부는 윤석열정부의 공약이다.  



   고진 디지털플랫폼정부위원회 위원장이 31일 오후 서울 중구 한국프레스센터에서 열린 '디지털플랫폼정부위원회 기자단 오찬 간담회'에서 위원회 출범 후 활동 성과와 계획에 대해 발표하고 있다. 뉴시스    디지털플랫폼위는 지난해 9월 공식 출범했다. 이후 각 부처는 물론 민간 기업 전문가와 함께 수십번의 회의를 통해 디지털플랫폼 정부를 만들기 위한 아이디어를 모았다. 이렇게 도출한 최종 로드맵을 오는 3월 발표한다. 고 위원장은 “올해는 저희가 로드맵을 갖고 첫발을 내딛는 중요한 해”라며 “지난 20년 전자정부 발전을 뛰어넘어 새로운 20년을 이끄는 정부가 될 수 있도록 관심을 가져달라”고 당부했다.      디지털플랫폼 정부는 국민이 인터넷·모바일로 더 편하게 행정 서비스를 이용할 수 있도록 하려 한다. 정부 데이터를 민간에 개방해 관련 산업 생태계를 키우고, 정부의 일하는 방식에 정보통신 기술을 더 도입하며, 정부 정책도 데이터를 바탕으로 결정하려 한다.      고 위원장은 “(행정 서비스를 이용하려면) 국민이 정부, 민간기업에서 (일일이) 서류를 발급받아 제출해야 하는데 이 정보들은 (사실) 국민이 아니라 정부·기관이 가지고 있다”며 “그들끼리 주고 받으면 될 정보를 국민더라 발급받으라고 하는 건 잘못됐다”고 말했다. 이어 “될 수 있으면 국민이 정부에 한번 입력만 하면 입력 내용이 여러 부처·기관에 공유될 수 있는 ‘하나의 정부’를 만들겠다”고 약속했다.      예를 들어 현재 개인이 부동산 등기를 하려면 시군구청과 등기소 등에서 각종 서류를 갖춰 내야 한다. 디지털플랫폼위는 이처럼 번거로운 행정 서비스를 디지털플랫폼에서 간편하게 이용할 수 있도록 할 계획이다. 고 위원장은 “제 기억에 부동산 등기를 위해 4개 사이트에 접속해서 17종의 서류를 충족해야 하고 그 사이 4번의 결제가 일어난다”며 “이를 최소한으로 줄일 것”이라고 설명했다.     디지털플랫폼위는 앞서 지난해 12월 제2차 전체회의에서 대통령직인수위에서 선정한 디지털플랫폼정부 1차 선도과제 20개의 추진 방안을 확정했다. 고 위원장은 “이 선도과제들은 국민이 한번의 접속, 한번의 입력, 한번의 결제로 (민원을) 끝낼 수 있도록 하자가 목표”라고 전했다.      민간 클라우드 이용도 활성화한다. 그는 “우리 위원회의 우선순위는 민간 클라우드 위에 정부시스템을 구축하는 것”이라며 “현재 기술 동향을 반영해 시스템을 최신으로 유지하면서 적시에 서비스를 개발하려면 민간 클라우드 위에 만들어진 생태계가 필요하다고 느꼈다”고 말했다. 그러면서 “민간 클라우드 안에 데이터레이크, 초거대 인공지능(AI), 응용프로그램 인터페이스(API) 허브 등이 구축될 것”이라고 전했다.     그는 “우리나라 전자정부의 성공은 역설적으로 부처 간 칸막이를 높이고 시스템과 데이터의 연계를 어렵게 했다”며 “디지털 혁신기술을 활용해 국정운영 시스템의 근본적 재설계와 민관 역할 재정립이 지금 반드시 필요하다”고 강조했다. 고 위원장은 이런 부처간 벽을 허물어 데이터를 공유·융합하는 ‘하나의 정부’를 만들겠다고 했다.      다만 데이터 개방은 개인정보 보호와 충돌할 가능성이 있다. 고 위원장은 “가장 큰 문제는 비밀보장으로, (부처·기관마다) 공개하면 안 되는 데이터를 밖으로 공개했을 때 패널티 조항이 있다”며 “관련 법을 확인해보니 벌금이 세서 나같아도 (데이터의) 문을 걸어잠그고 일단 위험을 배제하겠다 생각했다”고 전했다. 그는 “이런 법제도 문제를 개선하는 게 우선”이라며 “감사원에서도 전향적으로 디지털플랫폼 정부를 위해 개선해줄 것으로 믿는다”고 말했다.",105,https://n.news.naver.com/mnews/article/022/0003779028?sid=103
"스마일게이트그룹, 다양성·포용 위원회 발족…12명 위촉",2023.01.31. 오후 2:31,"[디지털데일리 왕진화 기자] 스마일게이트가 그룹 내 구성원에게 다양성과 포용을 전파하기 위한 위원회를 꾸렸다.   스마일게이트그룹은 지난 30일 서울 강남구 테헤란로에 위치한 오렌지플래닛에서 D&I 위원회 발족식을 갖고 1기 위원을 임명했다고 31일 밝혔다.   이번 발족식에는 백민정 다양성&포용 최고책임자(Chief Diversity&Inclusion Officer, 이하 CDIO)와 1기 D&I 위원회 위원으로 선출된 임원 및 실무 책임자 12명이 참석했다.   스마일게이트그룹 D&I실은 각자 업무 영역에서 다양성과 포용의 가치를 실현하고, 구성원들에게 전파하는 D&I 위원회 위원들을 ‘D&I 챔피언’으로 명명했다. 게임과 플랫폼 개발 및 서비스, 인사, 총무, 전략, 홍보(PR) 등 다양한 부서 리더들이 선출됐다.   스마일게이트 그룹은 D&I 위원회 출범과 D&I 챔피언 활동으로 그룹 내 ‘포용적 창작 서비스 운영 생태계’(Inclusive Creation Ecosystem, 이하 ICE)가 조성될 것으로 기대하고 있다. ICE는 스마일게이트가 앞으로 선보일 콘텐츠의 기획 및 제작 토대가 될 전망이다.   백민정 CDIO는 “D&I 위원회 발족은 D&I 전담 조직만이 아닌 스마일게이트그룹 전체가 비즈니스와 조직 운영에 있어 다양성과 포용의 가치를 실천하기 위한 구체적인 노력을 함께 하겠다는 중요한 의미를 담고 있다”고 말했다.    이어 “스마일게이트가 선보일 다양한 콘텐츠를 더 많은 사람들이 향유할 수 있도록 발전해 나가는 여정에 챔피언들의 활약이 기대된다”며 “이러한 노력들이 모여 궁극적으로 세계인으로부터 존경받는 글로벌 지식재산권(IP) 기업이 될 수 있을 것”이라고 덧붙였다.",105,https://n.news.naver.com/mnews/article/138/0002141610?sid=103
"LG유플러스, 알뜰폰 전문매장 전국 확대",2023.01.31. 오후 5:16,"'알뜰폰+', 합정 1호점 이어 신규오픈



LG유플러스가 알뜰폰 전문매장인 '알뜰폰+'를 전국으로 확대한다. 지난해 문을 연 합정1호점에 이어 오는 2월부터 7개 매장을 추가로 개점한다./이미지=LG유플러스 제공LG유플러스는 알뜰폰 전문매장인'알뜰폰+(플러스)'를 전국으로 확대한다고 31일 밝혔다.알뜰폰+는 LG유플러스가 중소 알뜰폰 사업자와 상생을 위해 마련한 알뜰폰 전문 오프라인 매장이다. 온라인 외에 고객접점이 없는 중소사업자를 위해 요금제·부가서비스·상담서비스 등을 제공한다.LG유플러스는 지난해 1월 서울 마포구 홈플러스 합정점에 1호점을 오픈한데 이어 오는 2월부터 매장 7개를 추가로 연다. 합정점의 경우 월평균 180명 이상의 고객이 상담을 받아 U+알뜰폰 상품에 가입하는 등 높은 호응을 얻었다.새롭게 문을 여는 알뜰폰+는 △인천작전점(인천 계양구) △야탑점(경기 성남시) △동대문점(서울 동대문구) △대구상인점(대구 달서구) △서부산점(부산 사상구) △대전문화점(대전 중구) △동광주점(광주 북구) 등 전국 홈플러스 매장에 마련된다. 임대료 등 입점 관련 비용은 LG유플러스가 전액 지원한다.LG유플러스는 2019년부터 'U+알뜰폰 파트너스' 프로그램을 운영하는 등 중소 알뜰폰 사업자 지원에 적극 나서고 있다. 지난해부터는 고객들이 전국 어디서나 편리하게 알뜰폰에 가입할 수 있도록 온라인 비대면 셀프개통 서비스를 확대 적용하고, U+알뜰폰 공용 유심 '원칩'을 공급하고 있다.유호성 LG유플러스 MVNO사업담당은 ""지난해 합정점 운영을 통해 이동통신사와 중소 알뜰폰 사업자가 동반 성장하는 성과를 이끌어낼 수 있었다""며, “중소 알뜰폰 사업자와 시너지를 강화하기 위해 추가 오픈을 결정했고 앞으로도 상생 방안을 확대해 나가겠다""고 말했다.",105,https://n.news.naver.com/mnews/article/648/0000013445?sid=103
"정부, 제4이통사 파격 지원…“이통 3사 독과점 깬다”",2023.01.31. 오후 5:51,"할당 취소된 28㎓ 주파수로 신규사업자 유치주파수 독점 사용·상호접속·통신망 공유 지원



홍진배 과학기술정보통신부 네트워크정책실장이 31일 오후 서울 종로구 정부서울청사에서 5G(28GHz) 신규사업자 진입 지원 방안을 발표하고 있다. 연합뉴스정부가 ‘제4 이동통신사’를 유치해, ‘이동통신 3사’(에스케이텔레콤(SKT)·케이티(KT)·엘지유플러스(LGU+)) 고착 구조를 깨겠다는 의지를 내비쳤다. 신호 제어 및 과금용 주파수(앵커주파수) 공급, 통신망 투자에 대한 세액 공제, 상호접속료 인하 같은 지원책을 내걸고 올해 안에 신규 이동통신사를 선정하겠다고 밝혔다. 과학기술정보통신부는 31일 이런 내용을 담은 ‘5G 28㎓ 신규사업자 진입 지원방안’을 발표했다. 이는 기존 사업자들에게 할당했다가 투자 소홀을 이유로 지난해 12월 할당 취소한 28㎓ 2개 대역 중 1개 대역에 대한 신규 사업자 진입을 추진하기 위한 것이다. 앞서 과기정통부는 이동통신 3사에 5세대(5G) 이동통신 서비스용으로 28㎓ 대역 주파수를 할당했다가 망 구축 의무를 이행하지 않았다는 이유로 케이티와 엘지유플러스는 망 할당 취소를, 에스케이텔레콤은 이용 기간 단축 처분을 내린 바 있다. 정부는 우선 할당 취소된 28㎓ 대역 중 800㎒ 폭을 신규 사업자가 3년간 독점 사용할 수 있게 제공하기로 했다. 불확실한 투자 여건을 고려해 충분한 시간을 주는 방식으로 제4 이동통신사 출범을 지원한다는 의도다. 5세대 이동통신용 28㎓ 대역 주파수는 전국망으로 활용되는 3.5㎓ 대역 주파수와 달리 직진성이 강해 기지국 커버리지는 좁지만, 지하철·공연장 등 이용자가 밀집된 환경에서 트래픽 분산을 통해 빠른 전송속도를 안정적으로 제공할 수 있는 특징이 있다. 향후 메타버스와 가상현실 등 초고속·저지연 서비스를 제공하는데 안성맞춤이다.주파수 할당 대가는 전파법 제11조에 따라 주파수의 경제적 가치를 고려하되, 시장 불확실성 등을 고려해 할인을 적용한다는 방침이다. 할당 즉시 대가총액의 4분의 1을 납부하게 하던 기존 할당대가 납부방식도 사업이 안정화된 뒤 점차 올려 낼 수 있도록 완화한다. 이와 함께 망 구축 투자에 대해 세액공제와 신규 사업자가 기존 통신사의 광케이블 등 구축 설비를 활용하기 위한 고시개정, 산업은행 등과 연계한 낮은 이자 대출 방안 등도 추진된다.과기정통부는 향후 주파수 할당 연구반을 운영해 2분기 중 주파수 할당 방안을 공고하고, 올해 4분기 안에 신규사업자 선정을 추진한다는 계획이다. 하지만 업계에선 과거 정부가 수차례 제4 이통사 선정을 추진했지만 엄청난 초기 투자비 등의 문제로 사업자가 등장하지 못했던 전례를 들어 “이동통신 3사 독과점 구조가 깨지기 어려울 것”이란 반응도 나온다.박윤규 과기정통부 2차관은 “통신시장이 이동통신 3사 독과점 구도로 굳어지며 사업자 간 품질·요금 등 경쟁이 정체된 상황”이라며 “신규 사업자 진입이 우리 통신시장에서 차별화된 5G 서비스를 선보이고, 경쟁을 활성화시키는 계기가 되길 기대한다”고 말했다.",105,https://n.news.naver.com/mnews/article/028/0002625430?sid=103
"삼성전자, 보릿고개에 올해 반도체 투자 19% 줄인다",2023.01.31. 오전 6:01,"올해 설비투자 32조원 수준 전망 “지난해 4분기 예정된 설비투자 줄줄이 연기”D램·낸드 웨이퍼 투입도 감소…사실상의 감산역대급 불황…D램 3강 영업손실 6조원 넘길 듯



삼성전자의 2022년 4분기 잠정실적이 발표된 지난 6일 서울 서초구 삼성전자 서초사옥 앞 게양대에서 삼성 깃발이 바람에 나부끼고 있다. /뉴스1        삼성전자가 올해 반도체 설비투자(CAPEX)를 전년 320억달러(약 39조원) 수준에서 올해는 260억달러(약 32조원) 수준으로 낮출 것이라는 전망이 제기됐다. 특히 지난해 4분기 예정된 투자 일부를 올해로 미룬 삼성의 4분기 투자 규모도 예상을 크게 밑돈 것으로 분석된다.31일 조선비즈가 입수한 시장조사업체 가트너의 자료에 따르면 삼성전자는 올해 설비투자 규모를 전년보다 19% 줄인 32조원 수준으로 집행할 것으로 예상됐다. 이미 지난해 4분기 예정된 설비투자 일부를 올해로 미뤘으며, 올해 역시 시장 상황 악화에 따른 적자규모 확대 우려에 따라 투자 시기를 조절하고 있는 것으로 관측된다. 삼성전자의 반도체 설비투자 규모는 2021년 381억달러(약 47조원)에서 2년 연속으로 축소되는 추세다.지난해 하반기부터 시작된 메모리반도체 업황 부진으로 이미 SK하이닉스, 마이크론 등은 감산과 투자 축소를 발표했다. 하지만 삼성전자는 지난해 3분기 컨퍼런스콜에서 “인위적인 감산은 없다”는 공식 견해를 밝힌 이후 최근까지도 이 태도를 유지하고 있다. 삼성전자 관계자는 “(입장에) 변화는 없다”고 말했다.다만 공정 전환, 생산라인 재배치에 따른 자연적인 생산량 손실은 있을 수 있다. 또 일부 설비투자가 지난해 4분기부터 미뤄지면서 자연스럽게 신규 생산능력 증설이 미뤄지고 있는 것으로 알려졌다. 시장조사업체 옴디아에 따르면 지난해 4분기부터는 D램, 낸드플래시 투입량도 일부 줄어든 것으로 나타났다.삼성전자의 생산능력 감산 여부가 주목받는 이유는 반도체는 업다운(Updown)이 주기적으로 반복되는 사이클 산업이기 때문이다. 통상 반도체 기업들은 수요가 부진하면 공급량을 조절하는 식으로 대응했다. 세계 메모리 반도체 시장점유율 1위인 삼성전자가 공급량 조절에 나설 경우 전 세계 수요공급에 직접적인 영향을 미치기도 한다.



삼성전자 화성캠퍼스 전경. /삼성전자 제공        현재 세계 반도체 기업들은 기하급수적으로 증가한 재고 문제로 골머리를 앓고 있다. 메모리 수요의 중요 지표인 재고가 3배 이상 증가해 역대 최대인 3∼4개월 치 공급량 수준에 달하고 있는 것으로 알려졌다. 삼성전자, SK하이닉스 등 메모리 기업은 이미 반도체를 생산할 때마다 손실이 발생하고 있어 올해 3사 합계 영업손실이 역대 최대인 50억달러(약 6조1000억원)에 달할 것이라는 추산도 나온다.특히 지금까지 반도체 단기 시황에 대해 언급하지 않았던 삼성전자가 이번 실적발표 때 앞으로 생산량과 관련해 어떤 계획을 내놓을지에 시장의 관심이 쏠리고 있다. 삼성전자는 통상 경기침체에도 투자를 지속해 회복세로 전환됐을 때 시장을 선점해왔으나, 이번에는 공급을 축소할 것이 불가피한 것으로 가트너는 관측했다.반도체업계 관계자는 “지난해 3분기 삼성전자가 인위적인 감산에 선을 그으며 정상적인 투자 활동을 하겠다고 밝힌 시장 상황과 현재는 명백히 다르다”라며 “현재 삼성전자의 D램 재고치와 손실 규모를 보면 애초 삼성의 전망보다 수요가 부진했고, 특히 서버용 D램 분야에서 기대에 못 미치는 출하량을 기록했다”고 설명했다. 그는 “대외적으로 감산을 선언하진 않더라도 공급량 조절은 피할 수 없는 수순이다”라고 강조했다.",105,https://n.news.naver.com/mnews/article/366/0000873358?sid=103
"환경부, 3월까지 온실가스 감축 이행 로드맵 마련",2023.01.31. 오후 3:48,"올해 전기차·수소차 등 무공해차 70만대 시대 구축환경부가 ‘2030년 국가 온실가스 감축목표'(NDC) 이행을 위한 세부 이행계획을 3월까지 마련하고 기후위기에 대응하는 탄소중립의 종합적인 대책을 마련했다.환경부는 31일 이같은 내용을 담은 기후탄소정책실의 추진과제를 발표했다.환경부는 ▲기후위기에 대응하는 탄소중립의 실행력 강화 ▲녹색산업·기술 혁신을 토대로 저탄소 녹색사회로의 전환 ▲깨끗한 공기와 무공해차 중심의 수송체계 구축 등 3대 핵심 과제를 골자로 종합적인 환경 기후 환경대책을 추진한다.우선 2030년 국가 온실가스 감축목표(NDC)의 세부적인 이행계획(로드맵)을 포함한 국가 탄소중립·녹색성장 기본계획을 3월까지 마련하고, 매년 국가 탄소중립·녹색성장 기본계획의 추진상황도 점검한다.



금한승 환경부 기후탄소정책실장이 31일 세종시 정부세종청사에서 2023년 환경부 기후탄소정책실의 3대 핵심과제를 발표한 뒤 탄소중립 이행과 녹색산업 육성, 국가 도약의 기회로 활용하는 주요 내용을 설명하고 있다. (사진=뉴스1)‘2030년 국가 온실가스 감축목표 이행계획(로드맵)’을 바탕으로 제4차 온실가스 배출권거래제 기본계획을 조기에 수립해 온실가스 감축이 가속화되는 중장기 정책변화에 기업들이 대비할 수 있게 지원한다.아울러 유럽연합(EU)의 탄소국경조정제도(CBAM)에 도입에 따른 피해를 방지하기 위한 노력도 계속키로 했다.또 심화되는 기후위기 피해를 방지하기 위해 지난 2020년 수립한 제3차 국가 기후위기 적응대책을 이행가능한 실행계획으로 보강하는 제3.5차 국가 기후위기 적응대책을 수립한다.또한, 기후위기 적응대책 수립의무가 신설된 공공기관(62개 기관)의 대책수립을 지원하고, 정부-산업계 간 업종별 적응협의체를 확대하여 산업계의 기후위기 적응역량을 높인다.올해부터 한국형 녹색분류체계가 시행됨에 따라 녹색금융 활성화를 위한 다양한 지원사업들도 새롭게 추진된다. ▲약 3조원 규모의 녹색채권 발행을 위한 이자비용 지원 ▲중소·중견기업 100개사 '환경·사회·투명 경영(ESG)' 진단 ▲스마트 생태공장 지원사업 확대 등이다.



(자료=환경부)예비·초기창업자 맞춤형 지원 등 유망 녹색산업 지원을 강화해 신성장동력으로 육성한다. 민관 협력체계 구축 등을 통해 녹색산업 해외진출 본격화하고 올해 20조원의 수주를 추진한다. 환경 기술개발 혁신위원회도 신설해 연계를 강화한다.대기오염물질을 감축하기 위해 제3차 대기환경개선 종합계획의 목표와 세계보건기구(WHO)의 대기질 권고기준 강화 등을 반영해 초미세먼지 연평균 농도 등 대기환경기준을 강화할 계획이다.무공해차는 올해 누적 70만대 시대를 연다. 이를 위해 보조금 지원을 확대하고 전기충전기를 지난해 20만기에서 올해 28만기로, 수소충전소도 지난해 229기에서 올해 320기로 확충한다.



정부세종청사 환경부 전경내연기관차의 감축을 위해 조기폐차 지원사업은 기존 5등급 차량에서 4등급 차량으로 확대한다. 이해 관계자 의견수렴을 거쳐 소형차의 평균 온실가스 기준도 강화한다.환경성 표시·광고 위반 경중에 따라 적절한 행정처분이 가능하도록 과태료 규정을 신설해 처분기준도 합리화한다. 올해 3월부터 초·중학교 환경교육이 의무화됨에 따라 학교별 환경교육을 내실화하고 교사의 역량을 강화하기 위한 다양한 지원사업들도 추진한다.국민이 주도하는 탄소중립 실현을 목표로 '탄생' 국민실천 운동도 추진한다. 일회용품 없는 대학가 조성, 다회용기 보급 확산 등이 추진된다. 탄소중립포인트 지급 항목과 예산 확대 등을 추진하고 참여업체별 앱 설치, 가입 없이 태그만으로 포인트 적립이 가능하도록 편의성도 개선한다.금한승 환경부 기후탄소정책실장은 ""탄소중립을 이행하기 위한 노력을 강화하고 이러한 과정에서 축적한 경험과 기술을 바탕으로 우리 녹색산업을 성장시키겠다""며 ""이와 더불어 녹색산업의 해외진출도 지원해 우리나라의 새로운 성장동력으로 활용하겠다""라고 말했다．",105,https://n.news.naver.com/mnews/article/092/0002281190?sid=103
