title,date,main,section,url
"파나진, 유한양행과 `렉라자` 오리지널 동반진단 공동 개발",2022.09.20. 오전 10:45,"유전자 진단 전문기업 파나진은 유한양행의 폐암 치료제 '렉라자'와 파나진의 폐암 진단 제품 '파나뮤타이퍼 R EGFR'의 오리지널 동반진단(Original CDx)을 공동 개발한다고 20일 밝혔다.유한양행의 '렉라자'는 상피세포성장인자 수용체(EGFR) T790M 변이에 높은 선택성을 갖는 경구형 3세대 EGFR 티로신 인산화효소 억제제다. 뇌혈관장벽 투과도가 높아 뇌전이가 발생한 비소세포폐암 환자를 대상으로도 효능을 나타내는 약제로, 렉라자 처방 전 T790M의 변이 여부를 검사해 약제의 치료효과를 높이고 부작용도 줄이기 위한 동반진단 의료기기의 허가가 반드시 필요하다.표적 항암제 처방을 위한 필수 요소인 동반진단은 미량의 표적 유전자 변이를 정확히 검출해야만 하는 높은 기술적 난이도로 인해 전 세계적으로도 소수의 대형 글로벌 진단 기업만이 경쟁에 참여하고 있다.파나진 관계자는 ""이번 유한양행과의 협업은 국내 제약 기업에서 개발한 신약과 국내 진단 기업이 오리지널 동반진단을 개발하는 최초의 사례이기에 더 큰 의미가 있다""며 ""당사는 플랫폼 기술과 제품을 지속적으로 개발해 국내 동반진단 선두 기업의 위상을 확고히 하고, 전 세계 동반진단 시장을 선도할 수 있도록 성장하겠다""고 말했다.유한양행 관계자는 ""국내 동반진단의 선두 주자인 파나진과 함께 '렉라자'의 오리지널 동반진단으로 '파나뮤타이퍼 R EGFR'의 임상과 허가를 추진하기로 한 것은 우리나라 동반진단 발전의 새로운 이정표가 될 것""이라고 전했다.",105,https://n.news.naver.com/mnews/article/029/0002754806?sid=103
"""겨울왕국 디즈니랜드에 녹색 피크트램까지""…홍콩, 관광객 유치 속도",2023.10.28. 오전 7:01,"개인 체험 중심의 '헬로 홍콩 2.0' 캠페인 시작



11월 20일 개장하는 디즈니랜드의 겨울왕국 테마랜드 ‘겨울왕국 세상'. 사진 제공=디즈니랜드[서울경제] “작년에 디즈니랜드가 캐슬을 대대적으로 확장 보수했어요. 레이저 불꽃쇼가 더 화려해졌습니다. 홍콩 피크트램도 빨간색으로 청록색으로 바뀌었고 탑승 정원이 늘어나 대기시간이 70% 줄었어요.”(이주승 홍콩관광청 이사)전 세계 50만 장의 홍콩행 무료 항공권을 뿌리며 홍콩 관광을 알렸던 홍콩관광청이 이번에는 홍콩을 직접 체험하도록 유인하는 ‘헬로 홍콩 2.0’ 캠페인을 시작한다. 홍콩의 다양한 매력을 직접 발견하고 체험하도록 해외 관광객을 유인하겠는 취지다.28일 업계에 따르면 홍콩관광청은 지난 26일 서울 중구에서 기자간담회를 열고 이같이 밝혔다. 데인 청 홍콩관광청장은 “올해 9개월까지 관광객 2300만 명 이상이 홍콩을 방문했다”며 “홍콩은 방문객에게 모두 몰입하고 잊을 수 없는 경험을 줄 것”이라고 자신했다.앞서 홍콩은 올해 초 엔데믹에 대한 여행 제한이 해제된 데 따라 ‘헬로 홍콩 1.0’ 캠페인을 펼쳤다. 전 세계를 대상으로 50만 장의 홍콩행 무료 항공권을 배포하는 ‘월드 오브 위너스’ 행사가 핵심이었다. 한국에서도 무료 항공권 2만4000여 장이 배포됐다. 이같은 캠페인 덕에 홍콩은 빠른 속도로 외국인 관광객 규모를 회복했다. 올해 8월 기준 홍콩을 방문한 외래 관광객은 2017~2019년 평균의 84% 수준이었다.



김윤호 홍콩관광청 한국지사장이 지난 26일 서울 중구에서 기자간담회를 열고 '헬로 홍콩 2.0' 캠페인을 설명하고 있다. 사진 제공=홍콩관광청홍콩관광청은 헬로 홍콩 2.0 캠페인을 통해 외국인 관광객 유치의 속도를 높이겠다는 전략이다. 이번 캠페인의 핵심은 관광객이 홍콩에서 경험할 수 있는 매력을 알리는 데 있다. 이 이사는 “단순히 관광지를 소개하는 게 아니라 직접 홍콩 도시에 스며들어서 체험하고 오감으로 느끼는 형태로 캠페인을 진행한다”며 “홍콩 전역의 분위기, 개개인의 여정을 응원하는 경험 중심의 캠페인으로 전개될 예정”이라고 설명했다.홍콩의 새로운 즐길 거리로는 오는 11월 20일 개장하는 디즈니랜드의 겨울왕국 테마랜드 ‘겨울왕국 세상’이 대표적이다. 세계 최초이자 최대 규모다. 관광객들은 홍콩에 본사를 둔 클룩을 통해 개장 전 사전 답사권, 개장 한 시간 전 입장 가능한 얼리버드 입장권 등을 구매할 수 있다. 이 외에 펭차우섬, 라마 섬 등 그간 국내에 잘 알려지지 않았던 섬에서 각종 아웃도어 활동을 할 수 있는 점도 홍콩의 새로운 즐길 거리로 손꼽힌다.김윤호 홍콩관광청 한국지사장은 “한국-홍콩 항공편이 60%로 회복됐다”며 “항공 공급이 얼마나 빨리 회복되느냐가 관광객 회복에 중요한 영향 미칠 것”이라고 설명했다.",105,https://n.news.naver.com/mnews/article/011/0004254615?sid=103
"이상헌 의원 ""망 이용료..콘텐츠 업계 관점에서 바라봐야""",2022.09.20. 오후 6:33,"국회 'K-콘텐츠 산업과 바람직한 망 이용 정책 방향' 토론회  [파이낸셜뉴스] 콘텐츠제공사업자(CP)에 대한 망 이용료 부과 법제화에 신중해야 된다는 의견이 나왔다. 망 이용료 관련 법안이 국내 콘텐츠 기업에 대한 규제로 이어질 수 있다는 우려다.   20일 국회에서 열린 'K-콘텐츠 산업과 바람직한 망 이용 정책 방향' 토론회에서는 전기통신사업법 개정안(망 이용료 법안)이 통과될 경우 국내 인터넷 생태계에 미칠 영향 등에 대한 논의가 이뤄졌다.    



'K-콘텐츠 산업과 바람직한 망 이용 정책 방향 토론회'. 이상헌 의원실 제공 토론회를 주최한 이상헌 더불어민주당 의원은 ""소위 말하는 '망 이용료' 관련 논의에서 국내 이동통신사 목소리가 대세를 이뤄왔지만, 콘텐츠 업계 관점에서 생각을 해봐야 한다""며 ""망 이용료 관련 법안이 해외 뿐 아니라 국내 콘텐츠 기업에 대한 규제로도 돌아올 수 있는 상황에서 K-콘텐츠 동력이 상실되지 않는 정책을 펼쳐야 한다""고 했다.   이필성 샌드박스네트워크 대표도 ""콘텐츠 생태계에 악영향을 미치고 창작자들 성장을 저해할 수 있는 법안이 창작자들과 충분한 논의 없이 성급하게 진행되고 있다""며 ""특정 기업군에게만 이익이 되는 법안이 아니라 창작자들과 사용자를 포함한 인터넷 콘텐츠 생태계가 함께 발전할 수 있는 정책에 힘을 실어달라""고 강조했다.   이와 관련 유튜브 코리아도 공식 블로그를 통해 의견을 표명했다. 유튜브 코리아 측은 ""망 이용료는 콘텐츠 플랫폼과 국내 창작자들에게 불이익을 주면서 인터넷서비스제공사업자(ISP)만 이익을 챙길 수 있도록 해준다는 점에서 공정하지 않다""고 지적했다.   그러면서 ""플랫폼 기업들에게 '통행료'를 내게 하는 것은 자동차 제조사들에게 한국 고속도로를 건설하고 유지하는 건설업체에 돈을 내도록 강요하는 것과 마찬가지다""라고 덧붙였다.   아울러 글로벌 CP는 한국 시청자들이 사는 지역에 위치한 ISP 네트워크로 콘텐츠를 가져오기 위해 상당한 비용을 이미 부담하고 있다는 입장도 전했다. 일례로 구글은 지난 10년간 아시아 태평양 전역 네트워크 인프라에 22억 달러(한화 약 3조 537억 원)를 투자했다. #구글 #넷플릭스 #망중립 #이상헌 의원",105,https://n.news.naver.com/mnews/article/014/0004901617?sid=103
"네이버, 소상공인 대상 쇼핑라이브 '숏클립 화법스쿨' 진행",2022.09.20. 오전 9:45,"기사내용 요약숏클립 콘텐츠 기획 제작 등 교육 지원SME 120명 대상 3개월 간 실시



[서울=뉴시스] 네이버와 소상공인시장진흥공단(소진공)은 라이브커머스 환경에서 중소상공인(SME)들이 자체적인 경쟁력을 갖출 수 있도록 네이버 쇼핑라이브 '숏클립 화법스쿨’을 실시한다고 20일 밝혔다.(사진=네이버 제공).2022.09.20 *재판매 및 DB 금지[서울=뉴시스]최은수 기자 = 네이버와 소상공인시장진흥공단(소진공)은 라이브커머스 환경에서 중소상공인(SME)들이 자체적인 경쟁력을 갖출 수 있도록 네이버 쇼핑라이브 '숏클립 화법스쿨’을 실시한다고 20일 밝혔다.이번 프로그램은 네이버와 소상공인시장진흥공단이 함께 추진하는 최초 민관 협업 교육 사업이다. 최근 라이브커머스에서 새롭게 떠오르는 10분 내외의 짧은 숏클립 콘텐츠를 SME들도 직접 기획, 제작할 수 있도록 교육 지원을 통해 관련 역량을 키우는 것이 목표다.네이버는 라이브커머스 교육 콘텐츠와 제작 인력, 장비 및 공간 등 네이버가 자체 보유한 교육 역량과 인프라를 다양하게 지원한다. 9월 중순부터 12월까지 약 세 달 간 진행되며, 사전 교육 참가 모집을 통해 신청한 스마트스토어 사업자 120명이 이번 과정에 참여한다.이번 과정은 라이브커머스 전문 강사인 김효석 쇼호스트, 이원석 쇼호스트가 대표로 참여한 멘토링 군단의 다양한 온오프라인 실습 교육으로 진행되며, 라이브 제작 및 진행역량을 강화하는 소통화법과 라이브 실습을 통한 1:1 코칭 및 소그룹 트레이닝 등 체계적인 교육 과정이 준비됐다.아울러 이번 교육을 통해 쇼핑라이브 및 스마트스토어 운영에 도움이 되도록 다양한 바우처와 상금도 함께 지급한다. 네이버 검색 광고집행 등 다양한 마케팅에 활용할 수 있는 ‘네이버 비즈머니’ 쿠폰을 교육 성과 등급에 따라 1인당 최대 250만원까지 제공하고, 연말에 진행될 성과공유대회에서 전문 평가위원이 선정한 우수 SME에게는 최대 1000만원 상금도 수여할 예정이다.황미애 소상공인시장진흥공단 소상공인본부장은 “이번 교육은 소진공이 추진하는 첫 민관 협력 사업으로, 전국 온라인 사업자들이 쇼핑라이브 화법스쿨 교육 프로그램을 통해 자신있게 쇼핑라이브를 진행하고 매출 증대로 이어지길 희망한다""고 말했다.이인희 네이버 교육센터 책임리더는 ""네이버 쇼핑라이브는 SME의 온라인 사업 매출 증대 및 단골 고객 확보에 도움이 되는 툴로써, 더 많은 SME들이 변화하는 이커머스 환경에 대응할 수 있도록 실습형 중심의 교육을 준비했다""며 ""앞으로도 SME들이 더 쉽고 자신있게 네이버 서비스를 활용해 디지털 전환을 이룰 수 있도록 다양한 교육 프로그램을 네이버비즈니스스쿨을 통해 제공하겠다""고 말했다.",105,https://n.news.naver.com/mnews/article/003/0011427937?sid=103
"LG전자, ‘디오스 오브제컬렉션 김치냉장고’ 출시",2022.09.20. 오후 5:02,"LG전자 모델들이 ‘디오스 오브제컬렉션 김치냉장고’ 신제품을 소개하고 있다LG전자 제공LG전자는 19일 다양한 라인업으로 주방 공간 인테리어를 완성하는 ‘LG 디오스 오브제컬렉션 김치냉장고’ 신제품 9종을 이날부터 순차 출시한다고 밝혔다.LG전자는 냉장고와 김치냉장고를 함께 구매하는 고객의 증가 추세에 따라 이번 신제품에 공간 인테리어 가전 ‘오브제컬렉션’ 라인업을 강화했다. 오브제컬렉션 인기 모델인 기존 491L 제품에 이어 새롭게 402L 스탠드식부터 128L 뚜껑식까지 확대 적용했다.특히 스탠드식 신제품(대표 모델명 Z402MEE151)은 평평하고 깔끔한 도어 디자인에 전문가가 엄선한 컬러가 더해져 오브제컬렉션 냉장고와 함께 설치하면 하나의 제품처럼 일체감을 주면서 주방 인테리어와도 조화를 이룬다.이 제품은 LG 업가전의 첫 번째 김치냉장고다. LG 씽큐 앱의 ‘업가전 센터’를 통해 구입 후에도 새로운 기능을 업그레이드로 추가할 수 있다.또 이 제품은 위쪽칸에서 좌우 공간 온도를 따로 설정하고 다양한 식재료를 구분해 보관하는 ‘다용도 분리벽’과 입체냉각·쿨링케어·냉기지킴가드 등 ‘3단계 냉기케어 시스템’, 김치맛을 살려주는 유산균을 최대 57배까지 늘려주는 ‘뉴 유산균김치+’, LG 씽큐 앱으로 포장김치 바코드를 찍고 제조일자를 입력하면 최적의 온도·시간으로 맛있게 익혀주는 ‘인공지능 맞춤보관’ 등 디오스 김치냉장고의 차별화된 성능과 편의성을 그대로 계승했다. 에너지소비효율은 1등급이다.LG 디오스 오브제컬렉션 김치냉장고 신제품은 용량에 따라 스탠드식 7종, 뚜껑식 2종 등 모두 9종이다. 스탠드식의 출하가는 120만~417만 5000원, 뚜껑식은 62만~124만 원이다.한편 LG전자는 고객이 보관 목적과 취향에 따라 원하는 대로 조합할 수 있는 1도어 김치・냉장・냉동 전용 ‘컨버터블 패키지 오브제컬렉션’ 신제품도 이달 말부터 순차 출시한다.이 제품은 고객이 도어 전면을 터치하면 냉장고가 자동으로 문을 열어줘 편리하다. 도어 핸들을 없앤 심리스하고 감각적인 디자인으로 가구장처럼 연출할 수 있다. 문 여는 방향을 고객이 원하는 대로 좌우로 바꿀 수 있는 점도 장점이다.LG 컨버터블 패키지 오브제컬렉션 신제품은 김치・냉장・냉동 전용 모델의 용량이 각각 324L, 386L, 324L이며, 가격도 각각 185만, 165만, 175만 원이다.",105,https://n.news.naver.com/mnews/article/082/0001175153?sid=103
"화웨이 ""DX 핵심은 '데이터'…파트너에 3억 달러 투자""",2022.09.20. 오후 1:00,"연례 ICT 회의 '화웨이 커넥트 2022' 2일차 행사""풀스택 제품·지능형 클라우드로 데이터 처리 지원""



라이언 딩 화웨이 엔터프라이즈 비즈니스 그룹 사장(화웨이 제공)(서울=뉴스1) 오현주 기자 = 화웨이가 디지털 전환(DX)의 주요 과제로 체계적인 '데이터 관리'를 꼽으며 자사 인프라 솔루션이 이러한 과제를 해결할 수 있다고 밝혔다.화웨이는 20일(현지시간) 태국 방콕에서 연례 정보통신기술(ICT) 회의인 '화웨이 커넥트 2022'을 열고 이같이 말했다. '화웨이 커넥트 2022'는 오는 21일까지 열리는 것으로, 올해가 7회째다. 화웨이는 이날 '디지털화의 촉발'(Unleash Digital)이란 행사 주제에 맞춰 DX의 가치를 언급했다. 라이언 딩 화웨이 엔터프라이즈 비즈니스 그룹 사장은 ""한층 심화된 디지털 전환은 기업이 계속적으로 변하는 세상에 잘 적응하도록 도움을 준다""며 ""화웨이는 파트너와 긴밀히 협력해 올바른 시나리오에 적합한 기술을 찾고, 고객의 디지털 전환을 지원한다""고 했다. 나아가 DX에는 '데이터'가 중요한 역할을 하고 화웨이의 기술이 큰 힘이 된다고 강조했다.밥 첸 화웨이 엔터프라이즈 비즈니스 그룹 부사장은 ""데이터는 디지털 전환의 핵심이며, 데이터 수집·전송·저장·분석은 아주 중요한 단계""라며 ""화웨이는 '엔드 투 엔드' 데이터 처리를 위한 풀 스택 제품 포트폴리오를 제공해 기업의 디지털 혁신을 가속화한다""고 말했다.또 화웨이는 지능형 클라우드 네트워크 솔루션인 △클라우드 패브릭 △클라우드 광대역 네트워크 △클라우드 캠퍼스가 개선돼 빠른 데이터 연결을 돕는다고 강조했다.원활한 데이터 전송을 위해 다양한 산업에 5세대(5G) 유선네트워크(F5G)를 적용했고 △전광 베어링 솔루션 △네트워크 △캠퍼스 등을 위한 새 솔루션도 출시했다고 회사 측은 설명했다. 화웨이는 이날 행사에서 글로벌 파트너 지원 계획인 '화웨이 임파워 프로그램'에 3억 달러를 투자하겠다고 발표하기도 했다. 자사의 기술을 전세계 고객사 서비스에도 적용해 디지털 생태계 강화하기 위해서다.구체적으로 화웨이는 △디지털 전환 컨설팅·플래닝 △제품·포트폴리오 전문성 △솔루션 개발을 지원한다. 또 화웨이 ICT 아카데미·화웨이 공인 학습 파트너를 통해 인재 풀도 구축할 예정이다.",105,https://n.news.naver.com/mnews/article/421/0006344303?sid=103
기후변화 대응 나서는 통신사들…재해·재난 예측해 통신망 강화한다,2022.09.20. 오후 4:04,"제11호 태풍 힌남노가 한반도에 상륙한지난 6일 오전 경남 거제 장승포항 방파제에 거센 파도가 몰아치고 있다. 문재원 기자지난 6일 한반도를 할퀴고 지나간 11호 태풍 ‘힌남노’로 통신·유료방송 30만여회선에 장애가 발생했다. 힌남노는 2002~2003년 연달아 발생한 태풍 루사와 매미와는 달리 고위도 해상에서 발생한 뒤 급격히 방향을 꺾으며 북상한 ‘이례적’ 태풍이었다. 과학자들은 기후변화로 예측을 벗어난 태풍은 물론 산불, 산사태, 폭염, 폭설, 폭우와 같은 이상기후가 잦아질 것으로 보고 있다. 재해재난 상황에서 통신망 장애는 더 큰 국가적 재난으로 이어질 수 있어서 이동통신 3사는 재해·재난에 대비해 통신망 강화에 나섰다.SK텔레콤은 기후 변화로 인해 통신 장비가 손실될 위험을 사전에 예측해 대응하는 체계를 마련했다고 20일 밝혔다. 고려대학교 오정리질리언스 연구원과 함께 2050년까지 이상 기후 발생 확률을 예측하고, 이에 따른 통신 인프라의 피해 위험을 사전에 분석하는 ‘미래 기후 변화 위험 평가’를 진행한 것이다.연구팀은 전국 모든 통신 장비를 대상으로 산불, 산사태, 폭염, 폭설, 폭우 다섯 가지 이상 기후로 인한 물리적 피해를 2021년부터 2050년까지 10년 단위로 분석했다. 그 결과 폭설을 제외한 이상기후 발생 확률은 2050년까지 증가 추세를 보일 것으로 예측됐다. 특정 지역은 이상기후 발생 확률이 높아 장비 피해 위험이 복합적으로 증가한 것으로 나타났다.



SK 텔레콤 관계자가 고려대학교 오정리질리언스 연구원과 함께 미래의 기후변화가 통신 인프라에 끼칠 영향을 분석하고 있다.  SK텔레콤 제공SK텔레콤은 현재 집중호우나 태풍에 대비해 침수가 예상되는 통신 시설은 사전에 점검해 전력 시스템을 보강하고 있으며, 산불 피해를 최소화하기 위해 산불에 취약한 지역의 기지국은 이동 설치하는 등 비상상황에 대비한 유무선 통신 대응 체계를 갖추고 있다고 설명했다. 여기에 이번 평가 결과를 기반으로 지도 상에 이상기후 발생 시나리오를 시각적으로 표시한 ‘기후변화 물리적 리스크 지도’를 구축한 뒤, 통신장비에 대한 기후 영향도를 지속적으로 분석, 업데이트해 나갈 예정이다.LG유플러스도 지진, 화재 등 재해·재난에 대비해 5세대(G) 이동통신망 관리를 강화하고 있다. LG유플러스는 아마존웹서비스(AWS), 삼성전자와 함께 재난상황시 안정적으로 5G망 운용이 가능한 백업망을 AWS 클라우드에 구성하는 데 성공했다고 20일 밝혔다.트래픽 제어에 사용하는 클라우드 네이티브 소프트웨어를 AWS 클라우드에 구축·적용하면 다양한 서비스별 요구 사항에 따라 기반시설 자원을 자유롭게 변경·배치할 수 있다. LG유플러스는 “재난 상황이나 트래픽 증가로 인한 통신 장애가 발생하더라도 안정적으로 망을 운용해 이용자 불편을 줄일 수 있다”고 설명했다.



KT가 지난 6일 힌남노 영향을 받은 울산광역시 울주 지역에 전기차를 활용한 이동기지국을 설치해 서비스 커버리지를 넓히고 있다.  KT제공KT는 휴대폰 기지국 신호 빅데이터를 활용해 주요 지역(POI)의 인구 수를 바로 확인할 수 있는 ‘실시간 인구 데이터’를 지난 1일 개발했다. 이를 통해 폭우, 폭설, 지진 등 재해재난 상황에서 실시간 정보와 지점별 인구 혼잡도 정보를 종합해 대처할 수 있다.또 KT가 설치한 광케이블과 센서로 노후 시설물 붕괴위험의 실시간 감시·관제를 제공하는 시설안전·재난대응 솔루션인 ‘KT 기가세이프 SOC 솔루션’를 지난 2020년 개발해 운용하고 있다. KT는 무선 서비스 불가 지역에 전기차로 폴대형 이동 기지국을 설치할 수 있는 솔루션도 개발해 통신 서비스 복구에 활용하고 있다.통신업계 관계자는 “기후변화에 따른 재해재난 연구를 통해 통신사들은 장비 위험도를 미리 예측해 효율적으로 관리할 수 있다”면서 “또 전국에 깔린 인프라를 활용해 지진 등 재난을 미리 감지할 수 있는 시스템을 개발하는 등 통신을 넘어선 사회적 가치도 실현하고 있다”고 설명했다.",105,https://n.news.naver.com/mnews/article/032/0003174177?sid=103
