title,date,main,section,url
CES 2023 방문한 이영 중기부 장관,2023.01.07. 오후 1:00,[서울=뉴시스] 김선웅 기자 = 이영 중소벤처기업부 장관이 6일(현지시간) 미국 라스베이거스에서 열린 CES 2023에서 SK 전시장을 둘러보고 있다. (사진=중소벤처기업부 제공) 2023.01.07. photo@newsis.com *재판매 및 DB 금지[사진 영상 제보받습니다] 공감언론 뉴시스가 독자 여러분의 소중한 제보를 기다립니다. 뉴스 가치나 화제성이 있다고 판단되는 사진 또는 영상을 뉴시스 사진영상부(n-photo@newsis.com)로 보내주시면 적극 반영하겠습니다.,105,https://n.news.naver.com/mnews/article/003/0011631302?sid=103
메르세데스 벤츠 EQS,2023.01.07. 오후 12:27,(라스베이거스=연합뉴스) 홍해인 기자 = 세계 최대 가전·IT(정보기술) 박람회 CES 2023 개막 이틀째인 6일(현지시간) 미국 네바다주 라스베이거스 컨벤션 센터(LVCC) 웨스트 홀메르세데스 벤츠 전시관에 EQS와 전기 충전기기가 전시돼 있다. 2023.1.7    hihong@yna.co.kr,105,https://n.news.naver.com/mnews/article/001/0013687096?sid=103
"'임시 허가증' 받고 운영되던 카톡 고지서, '임시'자 뗄까",2023.01.06. 오전 6:30,"기사내용 요약박성중 국민의힘 의원, 정보통신망 이용촉진 관련 법률 개정안 3일 대표 발의규제 샌드박스로 운영되던 '주민번호-연계변호 일괄변환' 법적 근거 마련해카카오페이·네이버 등 운영 중인 모바일 전자고지 서비스 연속성 확보 전망



[서울=뉴시스] 전진환 기자 = 20일 서울 여의도 국회에서 열린 과학기술정보방송통신위원회에서 여당 신임 간사로 선임된 박성중 국민의힘 의원이 발언하고 있다. (공동취재사진) 2022.09.20.  photo@newsis.com[서울=뉴시스]윤정민 기자 = 카카오톡이나 네이버 알림함으로 받는 전기·수도요금 모바일 청구서, 속도위반 과태료 전자고지서 등 '모바일 전자고지'. 그동안 기업이 정부의 임시 허가(규제 샌드박스)로 운영한 서비스다. 그러나 앞으로는 모바일 청구 서비스 관련 기업들이 정부의 임시 허가가 아닌 정식 사업을 할 수 있도록 법적 기반이 마련된다.국회 과학기술정보방송통신위원회 박성중 국민의힘 의원은 '정보통신망 이용촉진 및 정보보호 등에 관한 법률 일부개정법률안'을 지난 3일 대표 발의했다.개정안에 따르면 본인확인기관과 정보통신서비스 제공자가 방송통신위원회 승인만 받으면 모바일 전자고시 서비스에 필요한 '주민등록번호-연계정보(CI, Connecting Information) 일괄 변환'을 진행할 수 있다.'연계정보'는 주민등록번호를 1대1로 연결해 개인에게 부여하는 암호화된 고유번호로 사실상 '온라인용 주민등록번호'다. 주민등록번호 남용·유출 문제가 심각해지자 방송통신위원회와 한국인터넷진흥원이 지난 2010년 도입한 새 식별번호다.그동안 정보통신망법에는 행정·공공기관이 지닌 주민등록번호를 본인확인기관이 연계정보로 일괄 변환하는 법적 근거가 없었다. 모바일 전자고지 서비스를 하려면 사업자가 개인에게 일일이 주민등록번호 등 개인정보 제공 동의를 받아야 했다.정부는 본인확인기관이 개인의 정보 제공 동의 없이도 연계정보로 일괄 변환할 수 있도록 임시 허가하는 제도를 2019년 시작했다. 전자문서통합지원센터에 따르면 지난해 12월 기준 카카오페이, KT 등 기업 9곳이 정부 부처 8곳, 지자체 287곳, 공공기관·분야 49곳, 민간 153곳 등 총 497곳의 모바일 전자고지 서비스를 중계하고 있다.국민들은 이 서비스를 긍정적으로 평가하고 있다. 한국인터넷진흥원에 따르면, 모바일 전자고지 서비스로 연간 338억원의 우편발송 비용 절감과 3380톤의 탄소절감 효과를 거두고 있는 것으로 나타났다. 종이로 된 고지·청구서들을 스마트폰으로 직접 받아볼 수 있게 되면서 출력물 수와 발송·부대비용이 줄었기 때문이다.또 청구 마감 기간 전에 공인전자문서중계자가 마감 알림도 전해 오배송·분실 및 미인지로 인한 벌금·과태료를 무는 피해도 줄 수 있게 됐다.하지만 현재 임시 허가 기간은 최대 4년이다. 방통위에 따르면 2019년에 승인받은 카카오페이, KT의 허가 기간은 오는 2월까지다.방통위는 해당 개정안 심사·통과 기간을 감안해 허가 기간 만료를 막기 위해 고시 개정을 추진하겠다는 방침이다. 방통위 한 관계자는 ""카카오페이, KT 등이 서비스를 유지하도록 관련 고시 개정을 추진하고 있다""면서도 ""서비스를 유지할 수 있는 최소 범위 내에서만 고시할 수 있다는 한계가 있어 해당 서비스가 유지되려면 법 개정이 완비돼야 한다""고 말했다.이번 개정안에는 본인확인기관 등의 연계정보 안전조치 의무도 포함됐다. 연계정보 처리 과정에서 주민등록번호 분실·도난·유출이 발생할 수 있기 때문이다. 개정안에 따르면 본인확인기관 또는 기관으로부터 연계정보를 받은 제3자가 안전조치 의무를 위반한 경우 3000만원 이하의 과태료가 부과된다．",105,https://n.news.naver.com/mnews/article/003/0011629574?sid=103
여의도 면적 25배 … 롯데 메타버스 온다,2023.01.06. 오후 5:44,"초실감형 서비스 연내 출시롯데그룹이 올해 말까지 서울 여의도 면적 25배에 달하는 가상 공간인 '롯데 메타버스'(가칭)를 선보인다. 유통과 엔터테인먼트 부문 강자인 롯데그룹이 메타버스 세계에서도 선두주자가 될 수 있을지 관심이 집중된다.5일(현지시간) 롯데그룹의 정보기술(IT) 서비스 계열사인 롯데정보통신의 노준형 대표는 미국 라스베이거스에서 열린 CES 2023 기자간담회에서 ""현재까지 메이저 플랫폼 업체들은 메타버스를 커뮤니티와 게임, 마케팅에 활용할 뿐 유통이나 엔터테인먼트 같은 실생활에 도움이 되는 영역으로는 구현하지 않고 있다""며 ""'초실감형'이라는 차원 높은 메타버스 서비스를 올해 말까지 선보여 시장에 폭발적인 반응을 일으킬 것""이라고 밝혔다.실제로 롯데정보통신은 올해 CES에서 현실과 거의 구분되지 않는 초실감형 가상세계를 구현했다. 여의도 크기의 가상 공간을 만들고 이곳에 가상 쇼핑 공간과 K팝을 즐길 수 있는 가상 무대 등을 선보인 것이다.이번에 공개된 가상 쇼핑 공간 '롯데면세'에는 MCM, 아크메드라비, 록시땅, 메이크업포에버 등 루이비통모에헤네시(LVMH) 코스메틱이 참여했다. 정교하게 묘사된 디지털 트윈을 통해 오프라인 매장을 가지 않고도 상품의 질감과 색조 등 상세한 정보를 얻을 수 있다.향후 롯데 메타버스가 상용화될 경우 사용자가 가상 쇼핑 공간을 통해 상품을 구매하면 '디지털 트윈'으로 아바타가 이를 소유하고, 실제 상품도 받아볼 수 있다. 가상 무대에는 JYP엔터테인먼트의 아이돌 그룹 엔믹스(NMIXX)와 글로벌 순위 4위의 세계적 DJ Alok이 출연한다. 6만5000명 이상의 아바타 관객과 함께 실감 나는 공연을 즐길 수 있다.",105,https://n.news.naver.com/mnews/article/009/0005071261?sid=103
"“AI 대필 멈춰”…美뉴욕시, 공립학교서 ‘챗GPT’ 차단",2023.01.07. 오후 12:42,"[디지털데일리 오병훈 기자] 미국 뉴욕시가 공립학교에서 인공지능(AI) 챗봇인 ‘챗GPT(chatGPT)’ 사용을 금지하기로 했다. 챗GPT를 활용한 과제 대필 행위가 성행하면, 학생 교육에 부정적인 영향을 끼칠 것이란 우려에서다.   6일(현지시간) CNN에 따르면 미국 뉴욕시는 공립학교 내 기기 네트워크에서 챗GPT 접근을 차단한다. 챗GPT는 AI 연구개발 기업인 오픈AI가 개발한 자연언어처리 기반 AI챗봇이다.   챗GPT는 이용자 질문에 따라 에세이 작성, 시험 문제 풀이 등 작업도 수행할 수 있는 것으로 알려졌다. 예를 들어 이용자가 “셰익스피어 삶에 대한 에세이를 4개 써 달라”는 요청을 하면, 실제로 온라인상 데이터를 조합해 새로운 에세이를 작성해주는 식이다.   이에 따라 미국 뉴욕시 교육부는 이러한 챗GPT 기능이 학생 교육 환경에 부정적인 영향을 미칠 것이라 판단했다. 학생들의 비판적 사고나 학문적 정직성을 저해하고, 부정확한 정보에 무방비로 노출시킬 수 있다는 우려다. 단, AI 기술 관련 교육을 목적으로 챗GPT를 사용하는 것은 허용할 방침이다.   제나 라일 뉴욕시 교육부 대변인은 “챗GPT는 이용자 질문에 대한 빠르고 쉬운 답변을 제공할 수 있지만 학업과 비판적 사고 및 문제 해결 기술을 가르쳐주지는 않는다”며 “학생 학습에 대한 부정적인 영향에 대한 우려와 콘텐츠 안전 및 정확성에 대한 우려로 인해 뉴욕시 공립학교 네트워크 및 장치에서 챗GPT 접근을 제한한다”고 전했다.   이와 관련해 챗GPT 개발사인 오픈AI는 교육부 우려를 해소하기 위해 협력하겠다는 입장을 밝혔다. 오픈AI는 “챗GPT가 학교에서 오해의 소지가 있는 목적으로 사용되는 것을 원하지 않기 때문에, 누구나 텍스트가 챗GPT에서 생성됐음을 식별할 수 있도록 하는 기술을 개발하고 있다”고 말했다.",105,https://n.news.naver.com/mnews/article/138/0002140353?sid=103
[CES2023 포토]SKT UAM 시뮬레이터 인기 만점,2023.01.07. 오후 7:54,세계 최대 가전·IT(정보기술) 박람회 CES 2023 개막 이틀째인 6일(현지시간) 미국 네바다주 라스베이거스 컨벤션센터(LVCC) 센트럴홀에 마련된 SK그룹 부스에서 참관객이 SK텔레콤의 도심항공교통(UAM) 시뮬레이터 체험을 위해 줄지어 기다리고 있다.,105,https://n.news.naver.com/mnews/article/030/0003071080?sid=103
"""6300일 함께 했는데 꼭 중단해야 하나요""…대작 게임 종료에 게이머들 '울컥'",2023.01.07. 오전 9:00,"조재윤 니트로스튜디오 디렉터가 5일 온라인 특별 생방송 '디어 카트라이더'에서 카트라이더 서비스 종료에 관해 설명하고 있다. /사진='디어 카트라이더' 유튜브 영상 갈무리게임업계가 겨울을 맞으면서 오래 서비스를 유지했던 대표작들을 속속 정리하고 있다. 지난해 게임업계 업황이 좋지 않았던데다, 올해 반등을 위해 신작을 대거 발표하면서 선택과 집중을 택한 게임사들이 늘고 있는 것이다. 특히 넥슨의 카트라이더 같이 장기 리그까지 운영하는 게임도 서비스를 종료하면서 유저들은 하나둘씩 사라지는 추억에 아쉬움과 함께 반감까지 내비치고 있다. ━아직 e스포츠 리그도 잘 되는데…IP 효율 운영 위해 원작 접는 PC 카트라이더 ━6일 게임업계에 따르면 카트라이더는 지난 5일 온라인 특별 생방송 '디어 카트라이더'에서 오는 3월31일 서비스를 종료한다고 밝혔다. 서비스 시작 약 18년 만이다. 조재윤 니트로스튜디오 디렉터는 ""카트라이더 IP(지식재산권) 논의 과정에서 PC 카트라이더의 노후화, 신규 이용자와 기존 이용자 간 격차 문제 등이 지적됐다""며 서비스 종료 배경을 설명했다. 카트라이더는 이날부터 결제 서비스를 종료하고 다음 달 1일 환불 신청 페이지를 오픈한다. 2004년 서비스를 시작한 넥슨의 PC 게임 '크레이지레이싱 : 카트라이더'는 2020년 모바일 버전인 카트라이더 러쉬플러시 출시 전까지 전 세계에서 4억명에 가까운 이용자 규모를 보유한 인기 게임이었다. 특히나 2019년 출시 15년 차에도 PC방 점유율 상위 5등 안에 이름을 올리며 매출을 3배 이상 끌어올리기도 했으며, 국내에서 유일하게 10년 넘게 e스포츠 리그를 운영 중이다. 한 이용자는 카트라이더 자유게시판에 2015년 10월 14일부터 6292일 동안 함께했다고 밝히며, 유치원 시절부터 학부 졸업할 나이가 될 때까지 곁에 있었다. 조재윤 디렉터님 우실 때 저도 순간 울컥했다. 서비스 첫해인 2004년부터 카트라이더를 한 유저를 찾는 글에 댓글이 10명 넘게 달리기도 했다. 조 디렉터에게 쓰는 편지도 찾아볼 수 있었다.  조 디렉터는 '카트라이더'가 끝나는(End) 것이 아니라 카트라이더 : 드리프트(And)로 이어진다고 설명했다. PC·콘솔뿐만 아니라 모바일크로스 플레이까지 지원하는 카트라이더 : 드리프트는 오는 12월 글로벌 서비스를 시작한다. 카트라이더 e스포츠 리그도 카트라이더 : 드리프트 리그로 확대한다. 인기 있었던 트랙과 일부 협의 가능한 콜라보레이션 카트 등은 카트라이더 : 드리프트에서도 이용할 수 있을 전망이다.그러나 카트라이더 종료 소식에 많은 유저가 반발했다. 카트라이더 : 드리프트 흥행에 걸림돌이 될까봐 잘 운영 중인 게임을 죽이려 한다는 이유에서다. 이 때문에 일부 유저들은 트럭시위까지 진행하기도 했다. 일부 유저는 실제 카트라이더보다 이용자 수가 적지만 20년 넘게 운영되는 바람의 나라 등은 아직 서비스를 유지하고 있다는 점을 지적했다. 업계도 카트라이더 IP의 자기잠식을 우려해 서비스를 종료한 것이라고 분석하고 있다. 메이플스토리2나 서든어택2 등 후속작 흥행 부진 사례를 반복하지 않겠다는 의지로 풀이된다. 업계 관계자는 ""카트라이더 자체의 수익성 문제보다, 거액을 투입한 카트라이더 : 드리프트의 흥행에 초점이 맞춰져 있다""며 ""어려운 시기에 나오는 신작이니만큼 성적에 그만큼 신경 쓰는 것이 아니겠는가""고 설명했다. ━내 추억도 사라질까…서비스 종료 게임 속속 등장━카트라이더 외에도 몇몇 대형 게임이 서비스 종료를 앞두고 있다. 크래프톤의 전신인 블루홀스튜디오의 첫 작품이라는 상징을 지닌 PC MMORPG(다중접속역할수행게임) '테라'는 지난해 4월 서비스 시작 11년 만에 문을 닫았다. 큰 기대를 얻으며 서비스를 시작했던 크래프톤의 '엘리온'도 서비스 2년 만인 오는 3월 2일 문을 닫는다. 일부 유저들은 엘리온 게임 커뮤니티에서 ""테라를 종료했으면 다른 PC MMORPG인 엘리온이라도 오래 할 것이라고 생각했다""거나 ""이렇게 빨리 서비스 종료가 된다니 앞으로 크래프톤 PC MMORPG에는 소량만 과금하게 될 것 같다""는 의견을 올렸다. 넥슨의 '천애명월도'도 오는 19일 서비스 종료를 앞두고 있다. 5년 만에 서비스를 종료하는 이 게임에 대해서도 아쉬워하는 목소리가 들린다. 몇 남지 않은 PC 무협풍 MMORPG여서 대체할 게임을 찾기 힘들다는 것이다. 게임업계가 부진한 게임부터 대표작까지 속속 정리에 나서자 유저들 사이에서 '내 게임도?'라며 우려한다. 특히 최근 서비스를 종료한 게임 다수가 PC 게임인 것도 PC 게임 유저들의 걱정을 키운다.  11년 넘게 서비스 중인 한 PC MMORPG 유저는 ""아직까지 기존 헤비 유저들이 먹여 살리는 중이지만, 그분들이 사라지는 순간 위태로워 보인다""고 말했다.",105,https://n.news.naver.com/mnews/article/008/0004837671?sid=103
"[라AI프] 패션강자 무신사vs에이블리, 개인화 추천 결과 비교하니",2023.10.19. 오전 11:15,"공상과학 영화에서나 볼 수 있던 인공지능(AI) 기술은 어느덧 우리 일상생활에 자연스럽게 녹아들었습니다. 전통 IT 산업부터 반도체, 유통, 금융 등 오히려 AI가 접목되지 않는 분야를 찾기 어려워졌습니다. 여전히 AI가 낯설고 어렵게만 느껴지나요? 생활 속 AI를 체감하고 싶다면 디지털데일리 '라AI프'를 참조하세요. <편집자 주>



에이블리 메인 화면(좌)과 무신사 앱 메인화면 [사진=각사 앱 갈무리][디지털데일리 이안나 기자] 이커머스 업계에서 인공지능(AI) 기반 개인화 추천 서비스는 없어서는 안 될 필수 요소로 자리 잡았다. 오프라인과 달리 온라인에서만 누릴 수 있는 차별점인 동시에, 점차 취향이 세분화되는 ‘N극화’ 시대엔 그 중요도가 더욱 높아졌다. 개인화 추천 서비스는 쇼핑 편의성과도 직결돼 앱 사용률, 체류시간 등 플랫폼 성장에 중요한 지표를 가르는 요인이 되고 있다.무신사와 에이블리는 연간 조 단위 거래액을 내는 패션 플랫폼으로, 각각 대표적인 남성·여성 패션 플랫폼으로 통한다. 지난해 흑자를 기록한 무신사에 이어 에이블리도 올해 첫 연간 흑자를 바라보며 패션 플랫폼 톱2로서 입지를 노리고 있다. 무신사와 에이블리가 젊은층 이용자들에게 호응이 높은 비결은 개인화 추천을 통한 ‘검색 결과’에 있다.에이블리는 아마존 추천 기술(AWS)을 활용하는 타사와 달리, 앱 출시 초기부터 자체 개발 인공지능(AI) 개인화 추천 기술을 도입했다. 무신사도 앱 메인 화면에 ‘AI 스타일리스트 추천’ 코너를 배치해 개인화 추천 서비스를 제공 중인데, 여기에 직관적인 큐레이션도 같이 적용해 조율한다. 두 플랫폼은 앱 메인 화면부터 검색 결과까지 AI 기반 추천 기술이 적용됐다는 점은 같았지만 세부적인 면은 달랐다.◆ 다른 유형 인기 검색어…‘품목 위주’ 무신사 vs ‘특정 상황’ 포함 에이블리패션앱에서 빼놓을 수 없는 기능이 ‘검색’ 기능이다. 무신사와 에이블리에서 사용자들이 주로 검색하는 ‘인기 검색어’를 살펴본 결과 키워드 성향부터 다른 점이 나타났다. 무신사에서 사용자들이 검색하는 단어는 ‘후드티’, ‘패딩’ 등 단순 상품, 품목 위주가 다수였지만 에이블리에선 ‘카드지갑’, ‘핸드폰 케이스’ 등 패션잡화부터 ‘할로윈’ 등 특정 상황과 연계된 검색어도 눈에 띄었다.이처럼 ‘개강룩’, ‘체육대회’, ‘콘서트룩’ 등 특정 상황과 연계된 키워드 검색 시, 무신사와 에이블리에서 검색 결과는 차이가 훨씬 컸다.각 플랫폼에 ‘체육대회’ 키워드 검색 결과, 에이블리는 머리핀, 스포츠 헤어밴드 등 체육대회에 활용하기 좋은 상품을 추천했다. 연관 키워드론 ‘체육대회 반티’, ‘체육대회 소품’ 등 연관 검색 키워드와 참고할 수 있는 코디 콘텐츠 및 관련 기획전까지 제안했다. 반면 무신사에선 체육대회 검색 시 판매 중 상품은 제시되지 않았고, 체육대회 코디 상품 1장이 뜨는데 그쳤다.



‘체육대회’ 검색 시 에이블리 검색 결과(좌)와 무신사 검색 결과‘개강룩’을 검색했을 때 추천 상품 수만 보면 에이블리가 압도적이었다. 개강 시즌에 입기 좋은 1만개 이상 상품과 함께 보기 좋은 기획전을 추천했다. 에이블리 입점 마켓은 5만개로 업계 최대 규모인 만큼, 사용자 취향에 따라 상품을 고를 수 있는 범위가 넓다는 것을 한 눈에 보여줬다.반면 무신사에선 개강룩 관련 상품 수는 6개 불과했다. 하지만 ‘체육대회’ 검색 결과와는 다르게 ‘개강룩’ 검색 시 코디·스냅·매거진 탭에서 전신 코디가 깔끔하게 진열돼 참고할 수 있도록 만들었다. 원하는 코디 이미지를 클릭하면 코디에 사용된 상품과 다른 코디를 살펴볼 수 있다. 에이블리가 여성 코디 상품들만 보여준다면, 무신사는 남녀 상품을 모두 추천한다는 점도 차이점이다.



‘개강룩’ 검색 시 에이블리 검색 결과(좌)와 무신사 검색 결과.◆ 체류시간 늘리는 법…‘상품 특화’ 에이블리 vs ‘콘텐츠 강화’ 무신사에이블리와 무신사는 둘다 패션 플랫폼으로 언급되지만 다양한 카테고리로 확장하고 있다. 에이블리는 주얼리·패션소품·핸드폰 케이스 등을 판매하고. 무신사는 여기 더해 도서·음반, 티켓. 아트 카테고리까지 제공하고 있다. 이에 따라 같은 키워드라도 각 플랫폼에서 제공하는 상품 종류 역시 차이가 났다.10월 초 기준 ‘페스티벌’ 검색 시 에이블리에선 페스티벌에서 주로 입는 크롭탑이나 화려함을 강조하는 속눈썹 등 패션·뷰티 상품을 제안했고, 무신사에선 의류·가방 상품과 함께 공연 티켓 상품까지 추천 결과에 노출됐다. ‘전시’를 검색했을 때 에이블리는 진열장·소품 등 집에서 자신의 취향으로 꾸밀 수 있는 상품들이 결과로 나타났고, 무신사는 현재 판매 중인 전시 티켓 상품들을 가장 상단에 제시했다.에이블리는 패션·뷰티 등 카테고리별 스타일 상품 중심 추천을, 무신사는 패션을 넘어 ‘컬처’까지 보다 넓은 범위 카테고리 상품을 추천한 것이다. 에이블리에 따르면 ‘AI 추천 알고리즘’은 단순 동일 상품에 대한 가격 비교를 넘어, 유사한 취향을 지니 다른 사용자 데이터를 활용해 교차 추천 서비스도 제공한다.예를 들어 꽃무니 원피스 상품을 클릭하거나 ‘찜’한 사용자에겐 유사한 디자인 꽃무늬 원피스만 추천하는 게 아니라, 꽃무늬 원피스를 좋아하는 또 다른 사용자가 선호하는 트위드 원피스·블라우스 등 스타일을 추천하기도 한다. 뷰티·라이프 등 카테고리 간 교차 추천 서비스도 제공한다. 추천 기술을 통해 쇼핑 편의성이 높아지면 사용자 앱 사용률 및 체류시간이 늘어나고, 마켓 매출 증대 등 ‘선순환 구조’ 구축에 집중하는 모습이다.



‘페스티벌’ 검색 시 에이블리 검색 결과(좌)와 무신사 검색 결과무신사는 상품 수량 보단 전체 코디를 보여주는 콘텐츠들이 차별점이다. 무신사에서 제공하는 ‘룩북’과 사용자들이 자신의 착장을 올린 ‘스냅’ 기능에서 전신 코디를 참조할만한 콘텐츠가 풍부하게 나왔다. 패션 브랜드에서 제작한 유튜브 콘텐츠들도 무신사 앱에서 볼 수 있다.무신사는 앱에 들어오는 사용자들이 상품을 검색해 구매만 하지 않고 스타일 콘텐츠를 보고, 커뮤니티에서 서로 의견을 교환하는 공간으로 만들려는 취지다. 대표적인 예로 무신사는 올 초 인앱 서비스 ‘패션톡’을 선보였다. 패션톡은 사용자들끼리 패션 주제로 자유롭게 의견을 나누는 커뮤니티다. 비슷한 예로 ‘무신사 스냅’은 자신의 패션을 사진으로 찍어 다른 사용자들에게 보여준다.이용자 체류시간을 늘리기 위해 에이블리는 AI를 적극 활용한 개인화 추천을 고도화 한다. 반면 무신사는 콘텐츠를 내세우는 모습이다. 물론 이 과정에서 개발자들이 데이터 활용성과 효율화를 높이기 위한 연구도 지속 중이다. 그 결과 에이블리는 철저히 다양한 ‘상품’ 위주 결과, 무신사는 검색어에 따른 다양한 콘텐츠로 다른 모습 결과를 보여주고 있다.",105,https://n.news.naver.com/mnews/article/138/0002158979?sid=103
CES 2023 참관하는 홍준표 대구시장,2023.01.07. 오전 11:18,(라스베이거스=연합뉴스) 홍해인 기자 = 홍준표 대구시장이 6일(현지시간) 미국 네바다주 라스베이거스 컨벤션센터(LVCC)에서 열린 세계 최대 가전·IT(정보기술) 박람회 'CES 2023'을 참관하고 있다. 2023.1.7     hihong@yna.co.kr,105,https://n.news.naver.com/mnews/article/001/0013686964?sid=103
