title,date,main,section,url
"LG전자, CES서 허리근력 보조용 '클로이 수트봇' 공개",2018.12.27. 오전 11:08,"LG전자는 내년 1월 미국 라스베이거스에서 열리는 세계 최대 가전전시회 'CES 2019'에서 산업현장과 상업, 물류 공간에서 사용자의 허리근력을 보조하는 'LG 클로이 수트봇(CLOi SuitBot)'을 공개한다고 27일 밝혔다. 올해 8월 공개한 하체근력 지원용 로봇에 이어 두 번째로 선보이는 클로이 수트봇이다.



LG전자 모델이 클로이 수트봇을 착용하고 물건을 들고 있다. /LG전자 제공이번 클로이 수트봇은 사용자가 일정 각도 이상으로 허리를 굽히면 이를 감지해 로봇이 준비상태에 들어가고, 사용자가 허리를 펼 때 로봇이 사용자 허리에 가해지는 힘을 보조하는 식으로 로봇이 작동한다. 반복되는 작업에서 사용자의 허리에 가해지는 부담을 줄여준다.기존 웨어러블 로봇의 약점인 불편한 착용감을 대폭 개선해 사용자가 간편하게 입고 벗을 수 있다. 웨어러블 로봇은 무거운 물건을 들고 내리는 작업자들의 부상을 예방할 수 있어 산업현장의 수요가 빠르게 늘고 있다. 글로벌 시장조사업체 BIS리서치는 세계 웨어러블 로봇 시장이 2016년 1000억원 규모에서 2026년 5조원 규모로 성장할 것으로 전망했다.LG전자는 사업 포트폴리오를 확대해 로봇솔루션 분야를 선도해 나간다는 계획이다. 노진서 LG전자 로봇사업센터장(전무)은 ""고객들이 일상생활에서 경험하게 될 LG 클로이만의 차별화된 고객가치와 사용자 경험을 높일 수 있도록 사업 포트폴리오를 지속 강화하겠다""고 말했다.[심민관 기자 bluedragon@chosunbiz.com]chosunbiz.com",105,https://n.news.naver.com/mnews/article/366/0000423225?sid=103
과기정통부-중미경제통합은행 MOU 체결,2018.12.27. 오후 7:09,"민원기 과학기술정보통신부 제2차관이 27일 경기도 정부과천청사에서 열린 중미경제통합은행(CABEI)과의 정보통신분야 상호협력과 공동투자를 위한 MOU 체결식'에서 단테 모씨(Dante Mossi) 중미경제통합은행 총재와 협약서를 들어보이고 있다. (과학기술정보통신부 제공) 2018.12.27/뉴스1photo@news1.kr▶ [ 크립토허브 ]  [ 터닝포인트 2019 ] ▶ 에어팟&스타벅스 커피 경품(~1/25)[© 뉴스1코리아(news1.kr), 무단 전재 및 재배포 금지]",105,https://n.news.naver.com/mnews/article/421/0003759168?sid=103
격려사하는 정승일 산업부 1차관,2018.12.27. 오후 5:28,(서울=연합뉴스) 류효림 기자 = 정승일 산업통상자원부 1차관이 27일 서울 서초구 반포동 JW메리어트 호텔에서 열린 제8회 원자력 안전 및 진흥의 날 행사에서 격려사를 하고 있다. 2018.12.27    ryousanta@yna.co.kr▶뭐 하고 놀까? #흥  ▶쇼미더뉴스! 오늘 많이 본 뉴스영상 ▶네이버 홈에서 [연합뉴스] 채널 구독하기,105,https://n.news.naver.com/mnews/article/001/0010548686?sid=103
"문자 대신 '채팅' 하세요...KT, RCS기반 문자 메세지 서비스 시작",2018.12.27. 오후 2:40,"KT가 삼성전자와 손잡고 차세대 메시지 서비스(RCS, Rich Communication Suite)기반 문자 메세지 서비스 '채팅(Chatting)'을 선보인다.RCS는 글로벌 이동통시가 주축이 돼 개발한 통합 커뮤니케이션 서비스다. 데이터 기반의 메신저형 서비스로, 기존 단문 메시지(SMS)와 멀티미디어메시징 서비스(MMS)에 그룹채팅 등의 기능을 더한게 특징이다. 카카오톡과 라인이 지원하는 메신저 서비스를 문자 메세지에서도 할 수 있다고 보면 된다.삼성전자는 지난 9월 글로벌 RCS 메시지 활성화를 위해 구글과 협력하겠다고 밝힌 바 있다. 당시 삼성전자는 풍부한 스마트폰 메시징 사용자 경험을 제공하기 위해 RCS 협업 파트너십을 맺었다고 밝혔다.



국내에서는 협업 결과물이 KT를 통해 먼저 나왔다. KT는 사용자에게 편리하고 다양한 가치를 제공할 수 있는 모바일 환경을 제공하기 위해 삼성전자와 함께 서비스 출시를 준비했다.KT는 12월28일부터 삼성전자의 프리미엄 플래그십 스마트폰 갤럭시 노트9 에 서비스를 우선 적용하고 2019년 1월 갤럭시 S9과 갤럭시 S9+ 등으로 확대해 나간다는 계획이다. SK텔레콤과 LG유플러스는 개발 일정에 따라 조만간 이 서비스를 내놓을 예정이다.KT는 물론 국내 이동통신 3사는 지난 2012년 RCS 기반으로 ‘조인’이라는 메신저 서비스를 출시했다. 그러나 당시 사용자 관심을 끌지 못했고, 결국 조인 서비스는 사라졌다.실패에서 얻은 교훈일까. KT가 이번에 새롭게 선보이는 채팅은 조인 앱처럼 별도로 내려 받지 않고 스마트폰에서 바로 이용할 수 있다. 스마트폰 메시지 앱에서 채팅 서비스 사용에 동의하면 이용 가능하다. 채팅 서비스는 문자메시지와 달리 별도의 요금이 부과되지 않으며 이용 중인 요금제에 따라 데이터가 차감된다.채팅은 최대 100명과 동시에 그룹채팅을 할 수 있으며 최대 100MB에 이르는 대용량 파일을 전송할 수 있는 것이 강점이다. 기존 MMS는 1MB 크기로 데이터 전송이 제한되었지만 채팅 서비스는 화질 저하 없이 사진과 영상을 원본 그대로 공유할 수 있다. 그 뿐만 아니라 대화 상대방의 채팅 서비스 이용 여부에 따라 채팅 또는 기존의 문자 메시지로 자동 전환되어 메시지를 전송한다. 상대방의 메시지 수신 여부도 알 수 있다.KT의 채팅 서비스는 챗봇이 가능하다. 기업들이 제공하는 챗봇서비스를 통해 일대일 상담을 할 수 있고 상품정보를 문의할 수 있다. 향후 채팅서비스 내에서 상품 주문, 결제까지 가능하도록 업그레이드 할 예정이다.KT 마케팅부문 5G사업본부장 박현진 상무는 ""5G 시대를 맞아 고객에게 새로운 가치와 경험을 제공할 수 있는 차세대 메시지 서비스 채팅을 출시했다""라며 ""5G형 메시지 서비스인 RCS 서비스에 이어 5G형 영상 커뮤니케이션 서비스를 통해 진화된 서비스를 계속 선보일 계획""이라고 말했다.한편, KT는 27일부터 2019년 6월30일까지 데이터 차감 없이 무료로 채팅 서비스를 이용할 수 있는 프로모션을 진행한다.이지영 기자(izziene@bloter.net)[저작권자 (주)블로터앤미디어, 저작권자를 명기하고 내용을 변경하지 않으며, 비상업적으로 이용하는 조건아래 재배포 가능합니다.]",105,https://n.news.naver.com/mnews/article/293/0000023343?sid=103
[2018결산] '리니지M' 독주와 '로스트아크' 흥행! 2018년 10대 뉴스(上),2018.12.27. 오후 5:08,"2018년에도 한국 게임 산업에는 다양한 이슈가 있었습니다. 올 한해를 마무리하는 시점에서 게임업계 크고 작은 이슈들을 모아서 정리해봤습니다.<편집자주>1. 모바일게임 매출 1위 장기 독주한 엔씨소프트 '리니지M'



엔씨소프트의 모바일 MMORPG '리니지M'이 2018년 올 한 해에도 호성적을 이어갔습니다. PC 온라인 게임 '리니지'의 IP를 이용해 모바일로 제작된 '리니지M'은 지난해 6월 21일 출시되며 1년 넘게 서비스가 진행중이지만 꾸준히 높은 매출 순위를 기록하고 있습니다. 올 한 해 동안 구글 플레이스토어 최고 매출 1위를 단 한번도 놓치지 않는 놀라운 기록을 세운 것인데요. 높은 인기 덕에 출시 1년만에 1조 5000억 원에 이르는 매출을 기록했으며, 단인 모바일게임으로 가장 많은 매출기록을 달성했죠.'리니지M'은 '리니지'의 핵심 요소와 운영 방식, 시스템을 모바일로 옮긴 게임으로 엔씨소프트가 직접 개발하고 서비스중인 게임입니다. 세계관과 시스템은 원작과 유사하지만 제작이 아닌 공성전을 통해서 얻을 수 있는 아이템과 일일 던전 등 원작과 차별화를 꾀했습니다. 최근 신규 직업 총사와 투사가 추가됐으며 꾸준히 업데이트가 진행되며 꾸준히 인기를 이어가고 있습니다. 내년에도 '리니지M'의 인기 지속 여부에 게입업계의 관심이 집중될 것입니다.2. 중단된 중국 판호 발급, 재개되나



중국은 사드(THAAD) 문제로 인해 한국 정부와 마찰을 빚으며 한국 게임에 대한 판호를 발급하지 않았습니다. 이어 지난 3월 중국 정부 조직 개편으로 인해 판호 발급 업무가 국가신문출판광전총국에서 중앙선전부로 이관되면서 중국을 막론하고 모든 판호가 일제히 중단되며 우려를 낳았죠. 하지만 시간이 흐르면서 한한령(限韓令: 중국 내 한류금지)이 완화되고, 자연스럽게 판호 재개에 대한 기대가 생기기도 했습니다.막연히 언제인가는 재개될 것이라는 희망으로 버텼지만, 최근 판호 재개에 대한 소식이 들려왔습니다. 중국 매체들은 최근 게임 판호 발급을 담당하는 중국 공산당 중앙선전부 풍사신(冯士新) 부국장이 하이난에서 열린 '2018 중국 게임산업 컨퍼런스' 연설에서 판호 발급을 곧 재개한다고 언급했습니다. 보도에 따르면 풍 부국장은 ""현재 일부 게임들의 판호 심사가 끝났고, 새 판호 발급을 위한 절차도 준비 중이다""라며 ""많은 게임들을 검토해야 해서 시간이 필요하니 참을성을 가지고 기다려 주길 바란다""고 전했습니다. 내년에는 확실히 판호가 안정적으로 재개될 것이라는 희망을 품어도 될 것 같습니다.3. 게임장애 질병화 하려는 WHO



세계보건기구(WHO)가 게임장애를 질병으로 등록하려는 움직임을 보여 게임업계에 충격을 안겼습니다. 지난해부터 게임장애를 국제질병분류 11차 개정안(ICD-11)에 등재하는 것을 추진했던 WHO는 지난 6월 최신 개정판을 공개하며, 게임장애를 중독성 행동장애로 분류하려는 굳은 의지를 보여줬습니다. 많은 사람들이 게임장애를 질병으로 분류하기에는 객관적인 연구가 부족하고 게임에 몰입한 사람이 존재하지만 게임이 원인인지도 불분명하다는 지적을 하기도 했습니다. 게임장애가 국제질병분류 등재 여부도 중요하지만, 등재가 확정되더라도 한국표준질병사인분류(KCD) 반영까지는 많은 시간이 필요해 국내 산업계에 미칠 영향은 적다는 반응도 있습니다. 4. 확률형 아이템 규제 움직임 이어져국내에서도 확률형 아이템에 대한 논쟁이 뜨겁지만 해외에서도 비슷한 상황입니다. 지난 3월 게임업계는 문화체육관광부와 업무협약을 체결하고 확률형 아이템 자율규제를 확대하며 정착시켜 나가고 있습니다. 자율규제가 허울뿐이라는 지적도 있지만 게임사들은 확률형 아이템의 확률을 공개하며 기존과는 다른 모습을 보이고 있죠.외국의 경우 확률형 아이템이 발빠른 모습을 보이고 있습니다. 지난 9월 확률형 아이템을 방지하기 위해 영국을 필두로 미국과 유럽 등 총 16개국이 뜻을 모아 '도박규제 기관 선언'에 공동 서명을 했습니다. 특히 벨기에의 경우에는 강력한 조취를 취하고 있는데요. 랜덤박스를 판매 금지시키는 등 검찰에서는 게임사가 도박 법을 준수하지 않았다는 이유로 특정 게임사에 대한 수사에 착수하기도 했습니다.5. PC 온라인게임 흥행 신호탄 쏘아 올린 '로스트아크'



겨울잠을 자던 PC 온라인게임이 다시 날갯짓을 하려고 하고 있습니다. 바로 스마일게이트의 PC 핵앤슬래시 MMORPG '로스트아크' 덕분입니다. 지난 11월 7일 오픈베타서비스(OBT)를 시작한 '로스트아크'는 첫 날 동시접속자 25만 명을 기록했고 이후 1주일여만에 35만 명을 경신하며 PC 시장에 대한 재 흥행 신호탄을 쏘아 올렸습니다. 실제로 '로스트아크'는 PC방 점유율 순위 3위를 유지하며 높은 인기를 누리고 있습니다.'로스트아크'의 경쟁력은 국내시장에만 국한되지 않았습니다. 정식 서비스가 시작 되지도 않았지만 외국인들은 '로스트아크'를 플레이하며 인터넷 방송을 진행하기도 했습니다. 심지어 중국에서는 '로스트아크'를 해보기 위해 개인정보를 불법으로 거래하고 중국어 패치 버전이 담긴 클라이언트를 판매하기도 했었습니다. 특히 최근 스마일게이트는 러시아 대표 포털 서비스 기업 'Mail.RU'와 퍼블리싱 계약을 체결하며 글로벌 시장에서도 '로스트아크'가 경쟁력이 있다는 것을 증명하기도 했습니다.오경택 기자 (ogt8211@dailygame.co.kr)",105,https://n.news.naver.com/mnews/article/347/0000125827?sid=103
‘마비노기’ 신규 메인스트림 G23 팬아트 공모전,2018.12.27. 오후 7:15,"넥슨(대표 이정헌)은 PC온라인게임 ‘마비노기’의 ‘G23 팬아트 공모전’을 개최하고 내년 1월 24일까지 신청접수한다.이번 공모전은 이번 겨울 업데이트된 신규 메인 스트림 ‘G23 템페스트’를 주제로 팬아트를 자유롭게 제작해 공모하는 행사다. 넥슨은 오는 1월 24일까지 ‘마비노기’ 공식 홈페이지 ‘팬아트’ 게시판을 통해 작품을 접수한다. 



 ‘마비노기’ 이용자라면 누구나 계정당 1회 참여 가능하며 게시판에 [공모전] 말머리를 기재하고 이미지를 업로드하면 된다.수상작은 내부 심사 과정을 거쳐 오는 2월 7일 홈페이지를 통해 발표될 예정이다. 넥슨은 1등에게는 고급 태블릿(와콤 신티크 프로 16), 2등에게는 최신 휴대폰(갤럭시 노트 9 128GB), 3등에게는 태블릿PC(아이패드 9.7 2018년형 128GB) 등을 선물한다.또 우수상 수상자에게는 넥슨 캐시 10만 원, 추첨을 통해 선정된 이용자들에게는 참가상으로 넥슨 캐시 2만 원을 지급한다.이 밖에도 팬아트 게시글에 응원 댓글을 남기는 이용자 중 추첨을 통해 넥슨 캐시를 추가 제공한다.한편 지난 13일 업데이트 된 ‘G23’은 에린에 닥친 두 번째 혼돈 ‘대홍수’를 주제로 ‘마비노기’의 메인 시나리오를 이어가는 신규 콘텐츠다.[임영택기자 ytlim@mkinternet.com]▶매경 뉴스레터 '매콤달콤'을 지금 구독하세요▶뉴스 이상의 무궁무진한 프리미엄 읽을거리[ⓒ 매일경제 & mk.co.kr, 무단전재 및 재배포 금지]",105,https://n.news.naver.com/mnews/article/009/0004278978?sid=103
"퓨전데이타, 패션기업 ‘에스엔케이글로벌’ 인수…왜?",2018.12.27. 오후 12:10,"[디지털데일리 백지영기자] 퓨전데이타(대표 박두진)가 패션브랜드 전문업체 '에스엔케이글로벌'을 인수한다고 27일 공시했다. 에스엔케이글로벌의 지분 66.7%를 40억원에 인수하며 실질적 경영권을 확보했다는 설명이다. 인수 목적은 사업 다각화를 통한 외형 확장이다. 앞서 퓨전데이타는 지난 23일, 1년 전 인수한 마이크로소프트(MS)의 최대 라이선스 솔루션 파트너(LSP)인 테크데이타글로벌은 강원도 속초시 소재 SW개발업체 울바홀딩스에 180억원에 매각한 바 있다. 테크데이타글로벌 매각으로 유동자금 70억원을 확보, 전문영역인 SI·가상화·클라우드 등 주력 사업에 더욱 집중한다고 밝힌 바 있다. 하지만 이번 인수는 퓨전데이타가 주력하는 IT와는 그다지 상관없는 패션분야다. 이번에 인수한 에스엔케이글로벌은 2011년 설립돼 의류와 잡화, 액세서리 등 국내외 패션브랜드를 유통하는 기업이다. 20여개국에 매장을 보유하고 있는 영국 패션브랜드 '폴스부띠끄(Pauls Boutique)'의 한국과 중국, 일본 독점 유통권을 보유하고 있다. 지난해에는 가방 브랜드 '이네스(IINES)'를 론칭했다. 그동안 국내 IT업체의 창업자들이 지분 매각을 통한 투자회수(exit) 이후 주인이 바뀌고 IT와는 상관없는 분야로 사업 다각화에 나선 경우는 많았다. 그러나 성공사례가 많지 않았고 대부분 실패로 귀결됐다는 점에서 부정적인 시각이 존재하는 것도 사실이다.퓨전데이타는 최근 대주주가 삼성금거래소홀딩스로 바뀌면서 신임 수장으로 롯데정보통신 출신의 박두진 대표를 맞이했다. 대주주의 기존 사업 영역인 ▲금·은 보석류 제조 및 판매업 ▲금·은 보석류 세공 및 장신구 일체 판매업 ▲해외 자원 투자 및 개발 사업 ▲동 제련·정련 및 합금 제조업 등 사업목적을 추가했다. 한편 퓨전데이타에 따르면 에스엔케이글로벌이 운영하는 폴스부띠끄는 현재 백화점 60곳과 대리점 3곳, 온라인 20곳 등에 유통채널을 확보하고 있다. 내년에는 중국과 일본, 동남아시아를 중심으로 해외 유통 거점을 확보하고 글로벌 사업 확장에 나설 방침이다. 에스엔케이글로벌은 지난해 매출 284억원, 영업이익 8억원을 달성했다.이번 인수를 통해 퓨전데이타는 자사가 보유한 개인정보 보안 기술과 CRM(고객관계관리) 사업의 확장성을 에스엔케이글로벌의 온라인과 오프라인 채널에 적용해 시너지를 창출한다는 구상이다. 회사 관계자는 “에스엔케이글로벌 인수로 안정적인 성장 동력을 확보할 수 있게 됐다”며 “지속적으로 수익 극대화 방안을 모색해 회사가 한층 더 발전할 수 있도록 노력할 것”이라고 전했다.<백지영 기자>jyp@ddaily.co.krIT언론의 새로운 대안[디지털데일리]IT정보의 즐거운 업그레이드[딜라이트닷넷]뉴스채널 설정 - 네이버 메인에서 디지털데일리 뉴스를 볼 수 있어요.백지영(jyp@ddaily.co.kr)<저작권자 © 디지털데일리 무단전재-재배포금지>",105,https://n.news.naver.com/mnews/article/138/0002068781?sid=103
"펜타시큐리티 암호모듈, 공공분야 납품 필수인증 획득",2018.12.27. 오전 9:54,"[이데일리 이재운 기자] 정보보안 업체 펜타시큐리티는 소프트웨어 방식의 암호 모듈 디아모(D’Amo) CIS-CC가 암호모듈검증(KCMVP)을 획득했다고 27일 밝혔다. KCMVP는 공공 분야 납품을 위해 반드시 받아야 하는 절차다.최근 사물인터넷(IoT) 시장이 급속도로 확대됨에 따라 안전한 IoT 보안제품에 대한 관심이 높아지고 있다. 이에 따라 각종 IoT기기에 탑재되는 KCMVP 인증 획득 암호모듈의 수요도 높아지고 있다.디아모 CIS-CC는 소프트웨어 형태로 스마트 팩토리, 지능형 검침 인프라(AMI) 등 다양한 IoT 운영체제에 빠르고 간편하게 도입할 수 있다는 점이 특징이다. 또 ARIA, SEED 등 대칭 블록암호 알고리즘과 CBC, CTR, CCM, GCM 등 블록암호 운영모드뿐 아니라 공개키 암호, 해시 함수, 메시지 인증 코드, 전자서명, 난수 발생기 등 다양한 기능을 지원한다.남경문 펜타시큐리티 기획실장은 “IoT 환경에서의 보안은 네트워크에 연결하기 전에 보안을 적용하는 것(Secure First, Then Connect)이 필수”라며 “KCMVP 인증을 받은 D’Amo CIS-CC는 다양한 IoT 기기에 적용 가능한 암호모듈로 안전한 IoT 환경을 구축하는 데 최적화된 솔루션”이라고 말했다.이재운 (jwlee@edaily.co.kr)네이버에서 이데일리 [구독하기▶]빡침해소! 청춘뉘우스~ [스냅타임▶]＜ⓒ종합 경제정보 미디어 이데일리 - 무단전재 & 재배포 금지＞",105,https://n.news.naver.com/mnews/article/018/0004280485?sid=103
애플뮤직 음악 청취 습관 알려주는 앱 등장,2018.12.27. 오전 10:20,"스포티파이엔 이미 관련 기능 탑재(지디넷코리아=김민선 기자)애플 뮤직 이용자가 지난 1년간 재생한 음악에 대한 데이터를 분석, 이용자의 청취 습관에 대한 연례 보고서를 만들어주는 앱이 등장했다.26일(현지시간) 미국 IT 매체 테크크런치는 개발사 노이즈허브가 만든 '리뷰로 보는 올해의 음악(Music Year in Review)' 앱에 대해 소개했다.미국 내 1위 음악 스트리밍 서비스 스포티파이에는 한 해 청취 패턴을 알 수 있는 '랩드(Wrapped) 프로그램이 탑재된 반면 애플은 관련 기능을 제공하지 않는다.



외신에 따르면 해당 앱은 스포티파이의 랩드만큼의 체계성은 갖추지 못했으나, 기본적인 항목을 재밌게 구성해 보여준다.좋아하는 가수의 음악을 듣는데 얼마나 많은 시간을 소요했는지, 가장 좋아하는 상위 5개 음악과 가수는 누구인지, 카테고리별 총괄 보고서 등을 제공한다.애플 앱스토어 상 이 앱은 올해 개발된 것으로 확인된다.해당 앱을 사용하기 위해선 애플 앱스토어에서 먼저 앱을 다운로드 한 후, 앱 시작 시 애플 뮤직과 연동하기 위해 이메일 주소를 입력하면 된다.김민선 기자(yoyoma@zdnet.co.kr)  ▶ 네이버 채널에서 ‘지디넷코리아’를 구독해주세요",105,https://n.news.naver.com/mnews/article/092/0002153310?sid=103
"중국 바이두백과, 문재인 대통령 ‘민족 표시’ 항목 삭제",2018.12.27. 오후 2:59,"중국 검색 포털사이트 바이두가 운영하는 ‘바이두백과’가 문재인 대통령에 관한 정보 중 ‘민족 : 조선(朝鮮)’ 항목을 삭제했다고 27일 사이버 외교 사절단 반크가 밝혔다.반크는 지난 15일 바이두백과 측에 문 대통령에 관한 민족 설명 정보가 잘못돼 있음을 지적하고 민족을 ‘한국인’으로 바꿔 달라고 요청했는데 바이두백과 측은 ‘민족’ 항목 자체를 없애버린 것이다.바이두백과 측은 또 노태우 전 대통령을 ‘조선족’, 박정희·이명박 전 대통령을 ‘한민족’으로 각각 표기했던 부분도 삭제했다



문재인 대통령에 대한 설명에 오류를 범한 바이두 사이트.이승만·최규하·전두환·김영삼·김대중·노무현·박근혜 전 대통령은 처음부터 ‘민족’ 항목이 없었다.박기태 반크 단장은 “바이두는 방문자 기준으로 세계 5대 웹사이트라는 점에서 부적절한 대통령 정보가 전 세계에 확산하면 문제가 될 수 있다고 판단해 바로 잡기에 적극 나섰었다”고 언론에 밝혔다.반크는 미국 온라인 백과사전 위키피디아가 안중근, 윤봉길, 이봉창 의사를 ‘암살자’로 표기한 것을 ‘무장투쟁 지도자’로 바꾸는 성과를 올린 바 있다.반크는 세계 유명 포털과 백과사전에서 한국역사 관련 오류를 바로잡는 캠페인을 전개하고 있다. 오류 제보는 ‘21세기 이순신 사이트’에서 할 수 있다.손봉석 기자 paulsohn@kyunghyang.com▶ [스포츠경향 인기 무료만화 보기]▶ [지금 옆사람이 보고있는 뉴스]©스포츠경향(sports.khan.co.kr), 무단전재 및 재배포 금지",105,https://n.news.naver.com/mnews/article/144/0000588911?sid=103
