title,date,main,section,url
"KT, 베트남판 '지니뮤직' 만든다",2021.04.09. 오전 10:08,"베트남 최대 국영 VTV케이블과 음원 스트리밍 사업 추진[아이뉴스24 심지혜 기자] KT가 국내 기업 최초로 베트남 음원 스트리밍 사업을 추진한다.KT(대표 구현모)는 베트남 정부 중앙방송 ‘베트남 텔레비전(VTV)' 자회사 ‘베트남 텔레비전 케이블(VTV케이블)'과 ‘음원 스트리밍 사업 추진을 위한 양해각서(MOU)’를 체결했다고 9일 발표했다.양사는 이번 MOU를 계기로 KT 그룹사인 지니뮤직의 플랫폼 사업 모델을 현지 고객의 음원 소비 수요에 최적화하고, K-POP 음원을 유통하기 위한 전략을 수립한다.



KT가 베트남 최대 국영 VTV케이블과 음원 스트리밍 사업을 추진한다. KT 글로벌사업본부 문성욱(오른쪽) 본부장과 VTV케이블 브이 후이 남(왼쪽) 대표가 비대면으로 기념 사진을 촬영하고 있다. [사진=KT]우선 베트남판 지니뮤직 서비스 추진을 위해 특별전담TF를 구성한다. 세부적인 협력 내용은 ▲GTM(Go-To-Market) 음원 스트리밍 사업 모델 및 연계 서비스 기획 ▲플랫폼 설계 및 운영 시스템 구축 ▲K-POP 음원 유통 및 지적재산권(IP) 관리 등이다.특히 KT는 지니뮤직의 ABC(AI・BigData・Cloud)에 기반을 둔 음원 스트리밍 사업 노하우를 전수한다. KT는 ▲AI 기술을 통한 음원 플랫폼 개인화 ▲고객 빅데이터 기반 사용자경험(UX) 적용 ▲음악 메타 데이터베이스(DB) 구축 ▲음원 유통 및 IP 관리를 위한 시스템 운영 등을 지원한다.양사는 플랫폼 구축 사업을 추진하며 인터넷TV(IPTV), 온라인동영상서비스(OTT) 등 미디어 콘텐츠 사업으로 협력 범위를 확대할 예정이다.이번 업무 협약은 문성욱 KT 글로벌사업본부장과 브이 후이 남(Bui Huy Nam) VTV케이블 대표가 각 사가 마련한 화상회의실에서 온택트 방식으로 진행했다.문성욱 KT 글로벌사업본부장은 ""이번 MOU 체결을 계기로 KT의 디지털 플랫폼(Digico) 경쟁력을 글로벌 미디어 콘텐츠 시장에서 입증했다""고 말했다.조훈 지니뮤직 대표는 ""베트남 정부 방송과 다양한 플랫폼 사업 협력을 추진해 K-POP 콘텐츠 플랫폼의 가치를 세계에 알리고 신한류를 확산하겠다""고 강조했다.브이 후이 남 VTV케이블 대표는 “KT의 우수한 DX 역량과 양질의 K-콘텐츠 IP가 공급된 획기적인 음원 스트리밍 서비스를 기대한다”고 전했다./심지혜 기자(sjh@inews24.com)▶네이버 채널에서 '아이뉴스24'를 구독해주세요.▶재밌는 아이뉴스TV 영상보기 ▶아이뉴스24 바로가기[ⓒ 아이뉴스24 무단전재 및 재배포 금지]",105,https://n.news.naver.com/mnews/article/031/0000592442?sid=103
"OTT 왓챠, 케이블TV 예능프로 '노는브로' 제작한다",2021.04.09. 오전 11:00,"티캐스트와 공동 제작 투자 협약...예능 노는언니 후속작(지디넷코리아=김민선  기자)왓챠가 티캐스트와 함께 예능 프로그램 '노는브로'를 공동 제작한다고 9일 밝혔다.왓챠가 TV 예능 프로그램에 제작 투자를 하는 것은 처음이다. 양사는 최근 노는브로 공동 제작을 위한 계약 체결을 마쳤다.노는브로는 지난해 많은 시청자들의 관심을 받았던 '노는언니'의 스핀오프 버전이다. 노는언니가 박세리, 남현희, 곽민정 등 여성 스포츠 선수들의 이야기를 담았다면, 노는브로는 운동 밖에 몰랐던 남성 스포츠 선수들의 첫 번째 하프타임을 그릴 예정이다. 출연진으로는 박용택, 전태풍, 김요한, 조준호, 구본길, 김형규 등 다양한 종목의 선수들이 확정됐다.



노는브로왓챠는 이미 유튜브 콘텐츠 '가짜사나이2' 등을 통해 플랫폼의 경계를 허문 투자를 진행한 바 있다. 현재 입소문을 타며 인기몰이 중인 화제작  역시 왓챠가 제작비 전액을 투자한 콘텐츠다.박태훈 왓챠 대표는 “이번 공동제작을 통해 OTT 왓챠와 방송사 티캐스트가 긍정적인 시너지를 낼 것으로 기대한다”며 “이용자들이 만족할 수 있는 좋은 콘텐츠를 제공하기 위해 플랫폼의 경계를 넘는 협력을 지속적으로 강화해나갈 것”이라고 밝혔다.노는브로는 5월 중 티캐스트 E채널에서 방송될 예정이며, 왓챠에서 독점으로 서비스 된다.김민선 기자(yoyoma@zdnet.co.kr) ▶ 지디넷코리아 '홈페이지' ▶ 네이버 채널 구독하기© 메가뉴스 & ZDNET, A RED VENTURES COMPANY, 무단전재-재배포 금지",105,https://n.news.naver.com/mnews/article/092/0002218719?sid=103
"1분기 랜섬웨어 공격 15만5천건 차단…이스트시큐리티 ""2년간 감소 추세""",2021.04.09. 오후 4:20,"무료 백신 '알약' 기반 통계…일평균 1천720건 차단[아이뉴스24 최은정 기자] 이스트시큐리티(대표 정상원)가 백신 프로그램 '알약'을 통해 지난 1분기 총 15만4천887건의 랜섬웨어 공격을 차단했다고 발표했다. 일평균 약 1천720건의 랜섬웨어 공격을 차단한 셈이다.이번 통계는 개인 사용자를 대상으로 무료 제공하는 공개용 알약의 '랜섬웨어 행위기반 사전 차단 기능'을 통해 차단된 공격만을 집계한 결과다. 패턴 기반 공격까지 포함하면 전체 사이버 공격은 더욱 많을 것으로 회사 측은 추정했다.다만 1분기 총 랜섬웨어 공격수는 지난해 4분기 대비 감소한 것으로 집계됐다. 또 랜섬웨어가 기승을 부리기 시작한 2019년부터 현재까지 약 2년 간의 공격 추이도 전반적으로 감소하는 추세를 보였다는 설명이다.



 [사진=이스트시큐리티]이스트시큐리티 대응센터(ESRC)에 따르면, 1분기에는 이메일 내 입사 지원서, 이력서, 포트폴리오 등으로 위장한 첨부파일로 유포되는 마콥(Makop) 랜섬웨어 위협이 지속됐다. 새롭게 등장한 공격 유형에는 랜섬머니 지불을 강요하기 위한 목적의 디도스(DDoS), 언론인 및 피해자의 사업 파트너에게 음성 전화를 시도하는 등 새로운 전략을 세운 소디노키비 랜섬웨어 등이 꼽혔다.이와 더불어 ESRC는 1분기 주목할 만한 보안 위협으로, 3월 등장한 디어크라이, 블랙킹덤 랜섬웨어를 선정했다. 이 랜섬웨어는 3월 초부터 이슈가 된 마이크로소프트(MS) 익스체인지 서버의 '프록시로그온(ProxyLogon)' 취약점(CVE-2021-26855)을 악용해 미국·캐나다·영국·독일·호주 등 다양한 국가를 타깃으로 공격을 감행하고 있다.이 외에도 도플페이머 랜섬웨어 그룹의 현대기아자동차의 기업 내부 자료 다크웹 공개 사건, 비너스락커 조직의 서비스형 랜섬웨어(RaaS) 형태의 '마콥' 공격 지속, 국제 수사 기관 공조 성과에 따른 '지기' 랜섬웨어 운영자의 운영 중단 선언 등도 주요 이슈로 뽑았다. 기업용 랜섬웨어인 '바북 라커'의 등장, 웜 기능을 갖춘 '류크' 랜섬웨어 변종 발견 등도 포함됐다.문종현 ESRC 센터장(이사)은 ""랜섬웨어 공격 양상이 기존의 공격 방식에서 새로운 기능을 추가하거나 여러 공격 기법을 결합한 형태로 점점 진화하고 있다""며 ""기업과 개인들은 주기적인 백업과 안전한 보안 시스템 구축으로 미리 대비하는 자세가 필요하다""고 말했다./최은정 기자(ejc@inews24.com)▶네이버 채널에서 '아이뉴스24'를 구독해주세요.▶재밌는 아이뉴스TV 영상보기 ▶아이뉴스24 바로가기[ⓒ 아이뉴스24 무단전재 및 재배포 금지]",105,https://n.news.naver.com/mnews/article/031/0000592518?sid=103
손정의에게 1800억 투자받은 韓 창업가…영어 번역하다 OTT 인기에 글로벌로,2021.04.09. 오전 9:59,"韓서 설립, 英에 본사 둔 번역 기업 아이유노이현무 대표, 소뱅 비전펀드2서 1800억 유치34개국, 67개 지사서 80개국 언어 처리하는글로벌 1위 콘텐츠 현지화 전문기업 일궈내



2002년 한국에서 아이유노를 창업해 글로벌 무대에서 성과를 일군 이현무 대표.        넷플릭스 같은 글로벌 주요 온라인 동영상 서비스(OTT)에 번역, 자막, 더빙 서비스를 제공하는 글로벌 업계 1위 아이유노미디어그룹이 9일 손정의 소프트뱅크 회장이 이끄는 비전펀드2로부터 우리 돈 약 1800억원(1억6000만달러)을 투자받았다고 밝혔다.지난 2018년 소프트뱅크그룹에서 초기·성장 단계의 스타트업에 주로 투자하는 소프트뱅크벤처스로부터 240억원의 투자를 받은 데 이어 후기 투자에 집중하는 소프트뱅크 비전펀드로부터 후속 투자 유치에 성공한 것이다. 주인공은 2002년 한국에서 회사를 창업한 이현무 대표다. 그는 ""한국에서 시작한 스타트업도 글로벌 기업으로 성장할 수 있다는 하나의 사례를 만들어 낸 것 같아 기쁘다""라고 소감을 밝혔다.이 대표는 외국어를 한국어로 번역하는 서비스로 국내에서 첫발을 뗐다. 그러다 다국어 서비스를 하기 위해 다국적 방송사가 몰려있던 2011년 싱가포르로 본사를 이전해 ‘현지 맞춤형’ 번역 서비스로 사세를 확장했다. 인공지능(AI) 자동번역 같은 기술 도입도 한몫했다.아이유노는 방송사 번역 수주에서 한발 더 나아가 유료방송에서 OTT로 시청자가 넘어가는 이른바 ‘코드커팅’ 현상에 주목해 2019년 영국으로 본사를 옮겨 이들이 주 무대로 활동하고 있는 영미권 공략을 본격화했다. 같은 해 아이유노는 유럽 1위 BTI스튜디오를 합병한 데 이어 최근에는 미국 1위 SDI미디어 인수 작업도 완료하며 명실상부 글로벌 1위 콘텐츠 현지화 전문기업으로 발돋움했다.현재 아이유노는 한국을 비롯한 34개국 67개 지사에 2000여명의 직원을 두고 80개국 이상의 언어를 처리하는 기술, 노하우, 인력을 갖추고 있다. 지난해 기준 아이유노-SDI의 매출 합산은 4억달러(약 4456억원)다.아이유노는 이번 투자금을 AI 기술 고도화에 투입할 예정이다. 이현무 아이유노 대표는 ""비전펀드 투자금을 AI를 활용한 자동 번역과 프로세스 자동화, 더빙에서의 목소리 클로닝(복제) 기술을 더욱 확대하되 이를 통해 인간 고유의 영역인 크리에이티브에 더 집중할 수 있도록 할 것""이라고 말했다.[장우정 기자 woo@chosunbiz.com] ▶네이버에서 '명품 경제뉴스' 조선비즈를 구독하세요▶관광객 2배 늘어난 이곳, 車 렌트 '하늘의 별따기'▶광안리서 상어 낚시를?… '이 고글'만 쓰면 된다	저작권자 ⓒ 조선비즈, 무단 전재 및 재배포 금지",105,https://n.news.naver.com/mnews/article/366/0000698697?sid=103
"[이슈] 썸에이지 기대작 '데카론M', 4월15일 사전 출시 확정",2021.04.09. 오후 1:05,"4월15일 구글 플레이와 원스토어 출시순조로운 사전 예약으로 정식 오픈 전까지 100만 달성 예상, 기대작으로 급부상정교한 CG 트레일러 영상 공개, 오는 12일 추가 인게임 영상 발표 예정



  코스닥 등록기업 썸에이지(코스닥 208640, 대표 박홍서)는 자사가 서비스 예정인 신작 MMORPG '데카론M'의 사전 출시일을 4월15일로 확정했다고 9일 밝혔다. '데카론M'은 구글 플레이와 원스토어를 통해 오는 15일 선출시될 예정이며, 곧 애플 앱스토어에서도 정식 서비스될 계획이다.썸에이지는 출시일 확정과 함께 신규 트레일러를 공개했으며, 영상에서는 트리에스테에 두 개의 달이 밤하늘을 비출 때 여신 '비나엘르 파라이'가 인간을 배신하고 이계의 봉인을 풀어 자신의 남편 칼리지오 밧슈를 구하러 가는 내용을 담았다.특히 2005년 공개됐던 원작 PC게임 '데카론'의 영상을 현 트랜드에 맞게 감각적으로 재구성해 향수를 자극하고 있으며 CG로 캐릭터의 머리카락은 물론 피부결까지 정교하게 구현, 게임에 대한 기대감을 높였다.특히 대군주 가리온과 데카론 실레노스가 치열하게 전투를 펼치는 장면은 블록버스터 영화를 방불케 하고 있어 게임 세계관에 대한 궁금증을 증폭시킨다.썸에이지 정재목 이사는 ""현재 사전예약은 매우 순조로운 상황이다""면서 ""정식 오픈 전까지 사전예약자 100만 명을 예상하고 있다""고 전했다.아울러 썸에이지는 오는 12일 추가적으로 게임 플레이 영상을 공개할 예정이다.게임에 대해 보다 자세한 내용은 공식 카페와 공식 브랜드 페이지를 통해 확인할 수 있다.이원희 기자 (cleanrap@dailygame.co.kr)▶ 웹에서 즐기는 캐쥬얼게임 50종▶ 유튜브 핫뉴스 & 화제 영상 보기▶ LCK & 카트리그 현장사진 보기",105,https://n.news.naver.com/mnews/article/347/0000152243?sid=103
"BNK부산은행, CJ CGV와 비대면 사업 활성화 협약",2021.04.09. 오후 5:12,"제휴 적금 개발하고 공동마케팅 추진(지디넷코리아=차재서  기자)BNK부산은행이 CJ CGV와 '비대면 제휴사업' 활성화를 위한 전략적 업무협약을 체결했다고 9일 밝혔다.협약에 따라 부산은행은 ▲CGV 혜택 기반 제휴적금 개발 ▲CGV온라인 채널과 모바일 웹뱅킹 연계 ▲CGV콘텐츠 제휴마케팅 등 다양한 사업을 추진한다.또 양사는 보유한 온·오프라인 광고 매체를 공유하고, 영화 마니아를 위한 신규 비즈니스 모델도 발굴하기로 했다.



(사진=BNK부산은행)부산은행 이주형 디지털금융본부장은 ""이종산업간 소비자 니즈를 결합하는 비즈니스 개발을 가속화할 예정""이라며 ""CGV는 물론 부산은행 소비자를 대상으로 편리하고 친근한 서비스를 제공해 금융에 대한 접근성을 높일 것""이라고 말했다.차재서 기자(sia0413@zdnet.co.kr) ▶ 지디넷코리아 '홈페이지' ▶ 네이버 채널 구독하기© 메가뉴스 & ZDNET, A RED VENTURES COMPANY, 무단전재-재배포 금지",105,https://n.news.naver.com/mnews/article/092/0002218751?sid=103
"배틀그라운드 모바일 신작, 170개국 사전예약 1000만 돌파",2021.04.09. 오후 6:21,"크래프톤이 펍지 스튜디오의 모바일 신작 ‘배틀그라운드: NEW STATE’가 글로벌 사전예약자 수 1000만을 돌파했다고 9일 밝혔다.배틀그라운드: NEW STATE는 배틀그라운드 제작사 펍지 스튜디오가 개발한 게임이다. 배틀그라운드의 오리지널 배틀로열 경험을 계승하고 심화한 모바일 게임이다. 게임사에 따르면 이 게임은 배틀그라운드만의 정교하고 현실감 있는 건플레이와 함께 펍지 스튜디오의 기술력과 개발 역량을 기반으로 한 최첨단 렌더링 기술이 담겼다.



이 게임의 사전예약 1000만 돌파는 구글 플레이 단일 마켓에서 중국, 인도, 베트남을 제외하고 43일 동안 진행해 달성한 기록이다. 이 게임은 지난 2월25일 티저 영상 공개를 시작으로, 별도의 마케팅 활동 없이 일주일 만에 예약자 수 500만을 넘겼다.사전예약에는 전 세계 170여 개국에서 참여했다. 권역별로 살펴보면 동남아시아(22.6%)의 비중이 가장 높았다. 이어 아메리카(19.3%), 중동(15.1%), 유럽(15%), 동아시아(13.2%) 등에서 사전예약에 참여했다. ‘배틀그라운드’ IP(지식재산권)의 지역 편중 없는 세계적 인기를 확인할 수 있는 대목이다.펍지 스튜디오는 2분기 내 알파테스트를 실시할 예정이다.이다니엘 기자 dne@kmib.co.kr▶ 네이버에서 국민일보를 구독하세요(클릭)▶ 국민일보 홈페이지 바로가기GoodNews paper ⓒ 국민일보(www.kmib.co.kr), 무단전재 및 수집, 재배포금지",105,https://n.news.naver.com/mnews/article/005/0001429287?sid=103
"웹젠PC방, 슈팅 게임 블랙스쿼드 제공",2021.04.09. 오후 3:05,"(지디넷코리아=이도원  기자)웹젠(대표 김태영)은 ‘웹젠 PC방’에 PC 온라인 전략 일인칭슈팅(FPS) 게임 '블랙스쿼드'의 PC방 서비스를 시작했다고 9일 밝혔다.'블랙스쿼드'는 게임 플랫폼 '스팀'에서 글로벌 서비스가 진행되고 있다. 국내의 게임 이용자들은 '웹젠 PC방' 서비스를 통해 국내에서도 '웹젠 PC방' 가맹 매장이라면 어디서든 손쉽게 '블랙스쿼드'를 즐길 수 있다.'웹젠 PC방'에 가입된 PC방에서 '블랙스쿼드'를 즐길 경우, 경험치 100% 추가 획득과 골드 100% 추가 획득 버프가 적용되며, PC방에서만 이용할 수 있는 PC방 전용 미션이 제공된다.



블랙스쿼드.또한 유료 캐릭터 2종, 주무기 3종, 보조무기 1종을 무료로 사용할 수 있으며, 매일 유료 랜덤박스 1종도 무료로 획득할 수 있다. 여기에 추가 재화 획득 기회가 열려 있어 빠른 성장과 쾌적한 게임 이용이 가능하다.‘블랙스쿼드’는 고증된 총기와 다양한 부대기능, 균형 잡힌 게임 내 캐릭터와 아이템을 통해 각종 병과를 통해 다양한 교전 스킬을 사용할 수 있는 차별적인 모드가 제공되며, 클래식한 FPS 모드와 다양하고 독특한 전략적 전투 모드를 여러가지 방식으로 즐길 수 있다.웹젠은 '웹젠 PC방' 서비스에 '블랙스쿼드'를 추가하면서, 총 36개의 게임을 서비스 중이다.이도원 기자(leespot@zdnet.co.kr) ▶ 지디넷코리아 '홈페이지' ▶ 네이버 채널 구독하기© 메가뉴스 & ZDNET, A RED VENTURES COMPANY, 무단전재-재배포 금지",105,https://n.news.naver.com/mnews/article/092/0002218738?sid=103
화성 하늘에 뜨는 인류 첫 비행체 '인저뉴이티'...탐사 새 역사 쓴다,2021.04.09. 오후 12:15,"화성 첫 무인 헬기 인저뉴이티가 비행 준비를 위해 화성 표면에 내려앉은 모습을 탐사 로버 퍼시비어런스가 촬영했다. NASA 제공.   11일(미국 동부시간) 지구에서 5600만km 떨어진 화성 하늘에서 인류가 만든 헬기가 사상 최초로 날아오른다. 이날 비행에 성공하면 1903년 라이트 형제가 글라이더 ‘플라이어’호를 타고 12초간 동력 비행을 한지 118년 만에 다른 행성에서 이뤄진 첫 동력 비행으로 기록될 전망이다.   미항공우주국(NASA) 제트추진연구소(JPL)는 ""무인 화성 탐사 로버 ‘퍼시비어런스’에 실린 소형 무인 헬리콥터 ‘인저뉴이티’가 비행 준비를 끝냈다""고 밝혔다. 인저뉴이티는 돌발 상황이 발생하지 않는한 이달 11일 역사적인 첫 비행에 나선다. 앞서 퍼시비어런스는 한국 시간으로 지난 2월 19일 오전 5시 55분 화성 착륙에 성공했다.   ● 화성의 극저온, 희박한 대기밀도 환경 이겨낸다  



   화성의 대기 환경은 지구와 다르다. 우선 화성의 연평균 기온은 약 영하 63도다. 한낮에도 적도 부근을 제외하면 영하권이며 밤에는 최저 영하 90도까지 떨어진다. 실제로 지난 6일(현지시간) 퍼시비어런스가 보내온 데이터를 분석한 NASA 연구진은 퍼시비어런스가 착륙한 지점인 ‘예저로 분화구’의 낮 최고기온은 영하 22도, 최저 기온은 영하 83도라고 밝혔다.   인저뉴이티 비행 성공의 첫 단계는 화성의 혹독한 밤을 견뎌내는 것이다. 인저뉴이티는 지난 3일 퍼시비어런스에서 화성 표면으로 떨어져 나와 비행을 준비하기 시작했다. 내부 충전식 배터리로 전자장비 등을 따뜻하게 보호하며 화성의 혹독한 밤을 견뎌냈다.   첫 비행까지 살아남은 인저뉴이티의 다음 도전 대상은 화성의 희박한 대기 밀도다. 화성의 중력은 지구의 3분의 1 수준이며 대기 밀도는 지구의 100분의 1이 채 안된다. 공기가 희박하면 비행체는 뜨는 힘인 ‘양력’을 생성하기 어렵다.   NASA 연구진들은 가볍고 내구성이 강한 탄소섬유로 만든 2개의 로터블레이드(날개)를 장착했다. 인저뉴이티의 로터블레이드는 지구에서 하늘을 나는 헬리콥터의 로터블레이드보다 약 10배 빠른 분당 최대 2537회 회전해 희박한 대기밀도에도 불구하고 비행에 필요한 충분한 양력을 확보하도록 설계됐다. 최기혁 한국항공우주연구원 책임연구원은 “화성 대기 밀도는 지구상에서 고도 약 30km 지점과 유사한 수준으로 가벼운 소재로 만든 로터블레이드를 빠르게 회전시키면 양력을 충분히 생성할 수 있다”고 설명했다.   NASA 연구진은 2014년부터 8500만달러(약 960억원)의 예산을 투입해 5년간 인저뉴이티를 개발했다. 로터블레이드를 비롯해 비행에 필요한 동력을 만들기 위한 태양광 패널과 카메라, 레이저 고도계, 통신장비를 실은 인지뉴이티의 무게를 불과 1.8kg으로 줄였다. 이밖에도 인저뉴이티에는 지구가 아닌 행성에서의 첫 동력비행이라는 점을 기려 라이트 형제의 '플라이어'호 날개로 사용된 천조각 일부도 함께 실려있다. 



퍼시비어런스와 인저뉴이티 상상도. NASA 제공.  ● 첫 비행 후 화성일 30일간 4차례 비행  인저뉴이티는 비행 준비가 완료되면 2개의 로터블레이드(회전익)를 분당 2537회 회전하며 초당 1m 속도로 떠오른다. 화성 지표면 3m 고도에서 최대 30초 간 제자리를 유지하는 ‘호버링’을 진행한 뒤 하강하고 착륙할 예정이다.   비행 과정은 모두 인저뉴이티가 스스로 결정한다. 지구와 화성과의 무선통신은 두 행성의 거리에 따라 최소 8분에서 최대 48분이 소요된다. 지구에서 드론을 띄우는 것처럼 NASA의 JPL 연구진이 실시간으로 인저뉴이티를 조종하는 것을 불가능하다. JPL이 비행 명령 신호를 보내면 인저뉴이티는 이 신호를 수신해 스스로 비행하는 지점을 결정하고 시스템을 보호하며 비행한다.   첫 비행을 마치면 인저뉴이티에 실린 카메라가 촬영한 영상과 비행 데이터가 지구로 전송될 예정이다. NASA는 12일(현지시간) 인저뉴이티의 첫 비행 데이터를 공개할 예정이다. 첫 비행에 성공하면 인저뉴이티는 최대 화성 30일(지구에서는 31일)간 총 4차례 각기 다른 비행 테스트를 진행할 예정이다. 각 비행 테스트는 고도 5m 내에서 90m 범위에서 이뤄진다.  인저뉴이티는 화성 대기 환경에서 비행하는 데 필요한 기술과 데이터를 입증하는 게 목표다. 이를 토대로 향후 화성에서 비행하는 다른 비행체를 설계할 수 있다. 특히 기존의 화성 궤도선이나 지면의 탐사 로버가 보내오는 데이터와는 다른 탐사 데이터를 확보할 수 있게 된다. 로버가 도달하기 어려운 지형 탐사, 공중에서 바라보는 고화질 이미지 확보 등이다.  최기혁 항우연 책임연구원은 “지표면에서 탐사하는 로버는 하루에 보통 수십미터밖에 움직이지 못하기 때문에 탐사에 제약이 많다”며 “인지뉴이티는 태양계 행성 탐사에서 처음으로 항공기를 이용하는 것으로 기존 로버에 비해 광범위한 지역을 빠르게 탐사할 수 있기 때문에 행성 탐사의 패러다임 전환이 일어날 것”이라고 말했다. [김민수 기자 reborn@donga.com]▶2021년 과학뉴스와 시작하세요 구독 콕!▶코로나 백신 치료제 개발의 최전선▶더불어 사는 미래를 향한 지혜의 창 '동아사이언스' 가기ⓒ 동아사이언스 콘텐츠 무단 전재 및 재배포 금지",105,https://n.news.naver.com/mnews/article/584/0000013678?sid=103
