title,date,main,section,url
"삼성電, 올해 공격적 시설투자·기술 초격차로 불황 극복",2023.01.31. 오후 5:12,"DDR5 비중 확대·파운드리 3나노 2세대 박차...프리미엄 스마트폰·가전 주력삼성전자가 올해 글로벌 IT 수요 부진과 반도체 시황 약세가 지속된다는 전망에도 공격적인 시설투자를 통해 기술 초격차에 더욱 박차를 가한다는 전략을 내놨다.특히 고용량 메모리, 파운드리 3나노 2세대 개발, QD-OLED 확대, 프리미엄 스마트폰 및 가전 등에 주력해 기술을 선점하고 수익성을 확보하겠다는 방침이다.



삼성전자■ 반도체 시황 악화에도 ""감산 없다""…시설투자 전년과 유사삼성전자는 컨퍼런스콜에서 시설투자(CAPEX)를 전년과 비슷한 수준으로 단행하겠다고 밝혔다. 올해 반도체 시황 약세에도 미래 성장을 위한 준비 차원에서 시설투자를 유지한다는 전략이다.삼성전자는 지난해 시설투자에 총 53조1천억원을 집행했으며, 그 중 반도체에 47조9천억원을 투자한 바 있다. 이는 역대 최대 규모의 반도체 시설투자였다.삼성전자는 ""중장기 수요 대응을 위한 인프라 투자를 지속해 필수 클린룸을 확보하고자 한다""며 ""최고의 품질과 라인 운영 최적화를 위해 생산라인 유지보수 강화와 설비 재배치 등을 진행하고 미래 선단 노드로의 전환을 효율적으로 추진 중이다""고 말했다. 이어 ""공정 기술 경쟁력 강화와 조기 안정화를 위해서 엔지니어링 비중을 확대 중이며 이에 따라 시설투자 내에서 R&D 항목 비중도 이전 대비 증가할 것으로 예상된다""고 덧붙였다.메모리는 DDR5, LPDDR5x, GAA(Gate-All-Around) 등 첨단 공정과 제품 비중을 확대하면서 서버·모바일용 고용량 제품을 중심으로 수요 성장세에 적기 대응할 계획이다. 파운드리는 차세대 GAA 공정 경쟁력을 바탕으로 3나노 2세대 공정의 신규 고객 수주를 확대하고, 2나노 1세대 개발에 집중해 기술 경쟁력을 강화할 계획이다. 오토모티브 공정은 5나노에 이어 4나노 개발에 착수했다. 현재 건설 중인 미국 테일러 팹에서는 내년 하반기부터 4나노 반도체를 생산할 예정이다.삼성전자는 ""3나노 2세대 공정은 내년 예정대로 양산할 계획이고, 수주와 관련해 다수의 모바일, 고성능컴퓨팅(HPC) 고객들이 관심 보인다""며 ""2세대 공정은 1세대 대비 면적, 성능, 전력 효율이 개선됐다""고 덧붙였다.이어 ""시스템LSI는 중저가 모바일용 SoC(시스템온칩) 대량판매 제품을 확대하고 이미지센서는 차별화 제품인 2억 화소 라인업을 확대할 예정이다""고 말했다. 더불어 차량용 SoC는 유럽 프리미엄 OEM 업체 자율주행용 제품에 대한 추가 수주를 통해 미래 성장 모멘텀을 이어갈 계획이다.■ 1분기 수요 침체 계속… 프리미엄 스마트폰·TV로 승부수



갤럭시S23, S23+ 예상 이미지(사진=윈퓨처)삼성전자는 올 1분기에도 거시경제 불확실성이 지속되면서 스마트폰 실적이 전년보다 감소할 것으로 전망했다. 1분기 TV 시장은 계절적 비수기 진입과 더불어 글로벌 경기 불황 영향이 지속되며 전 분기 및 전년 동기 대비 수요 감소를 예상했다.이에 삼성전자는 플래그십 제품 경쟁력 강화를 위해 폴더블 제품 고성장과 갤럭시S23 시리즈 판매 확대를 추진할 방침이다. 또 중저가 시장에서 5G 스마트폰 판매를 확대해 시장 역성장을 극복하고, 프리미엄 태블릿 라인업과 웨어러블 제품 경쟁력을 강화해 판매를 확대한다는 목표다.삼성전자는 갤럭시 스마트폰에 최적화된 애플리케이션 프로세서(AP)를 개발하기 위해 작년 12월 MX사업부 내에 'AP 솔루션 개발팀'을 신설했다고 밝혔다. 이를 통해 제품 경쟁력뿐만 아니라 갤럭시만의 차별화된 고객 경험을 지속 강화한다는 방침이다.생활가전은 비스포크 인피니트 라인 등 신제품을 출시해 프리미엄 제품 판매를 확대하고 비용 효율화를 통한 수익성 확보에 주력할 계획이다. TV를 담당하는 VD는 네오 QLED를 중심으로 프리미엄 중심 판매 전략을 유지하면서 마이크로 LED와 OLED 라인업을 강화한다고 밝혔다.그 밖에 네트워크는 주요 해외 사업 확대에 적기 대응해 매출 성장세를 유지하고, 5G 핵심칩과 vRAN(가상화 기지국) 등 기술 리더십을 지속 강화할 예정이다.■ 디스플레이, QD-OLED 수요 증가에 대응



삼성전자가 CES 2023에서 77형 QD-OLED TV를 공개했다.(사진=지디넷코리아)디스플레이 사업에서는 주요 고객 플래그십 제품 출시에 적극적으로 대응해 지속적인 실적 우위를 이어 나간다는 방침이다. 대형은 초대형 TV와 대형 모니터 신제품 라인업 도입으로 QD-OLED 수요 대응과 수익성 개선에 중점을 둘 예정이다.삼성전자는 ""1분기에는 비수기 효과 외에도 주요 지역의 경기 둔화 영향으로 전년 대비 역성장이 예상되지만, 상대적으로 견조한 하이엔드 스마트폰 시장에서 기술 성능 격차 우위를 활용해 시장 지배력을 강화할 계획이다""고 전했다.한편, 삼성전자는 작년 연매출은 302조2천314억원으로 역대 최대치를 기록했다. 첫 300조원대 매출 달성이다. 이는 반도체 업황이 악화되기 이전인 작년 상반기 코로나19 특수로 인한 메모리 매출 증가가 전체 실적을 올린 덕분이다. 작년 연간 영업이익은 43조3천800억원으로 전년보다 16% 줄었다.4분기 영업이익은 4조3천100억원으로 전년(13조8천700억원) 대비 68.9% 줄면서 3분의 1 토막이 났다. 삼성전자 분기 영업이익이 4조원대를 기록한 것은 지난 2014년 3분기 이후 처음이다. 4분기 매출은 70조4천600억원으로 기록하며 전년 대비 7.9% 감소했다.",105,https://n.news.naver.com/mnews/article/092/0002281211?sid=103
"페이코인 서비스 연장?…FIU ""이미 불수리 처리된 건""",2023.01.31. 오후 7:01,"지난 30일 열린 민정당 간담회에서 다날 측이 의견을 성토하고 있다.[디지털데일리 박세아 기자] 페이코인(PCI) 발행사 페이프로토콜이 금융당국에 서비스 종료 기한 연장을 요청한 가운데 금융당국은 불가능하다는 입장을 밝혔다.   31일 금융정보분석원(FIU) 관계자는 ""페이프로토콜이 실명계좌 발급을 받지 못했기 때문에 이미 지난 6일 가상자산 사업자 신고 불수리 처분 결정을 했다""라며 ""원칙대로라면 불수리 처분 결정 직후인 7일부터 서비스 종료를 해야하지만, 해당 서비스 이용자 보호를 위해 한 달 여 간 사태를 정리할 시간을 더 줬던 상황""이라고 언급했다.    페이프로토콜은 전자지급결제대행서비스(PG) 사업자인 다날 자회사다. 페이코인은 페이프로토콜에서 발행하는 실물결제가 가능한 코인이다.    앞서 FIU는 페이프로토콜에 은행 실명확인 입출금 계정을 마련하도록 지시했다. 페이코인 활용 간편결제 서비스를 지속 제공하기 위해 실명계좌 확보를 필수조건으로 삼으면서다.    지난 30일 다날 안영세 전략지원실 상무는 디지털자산위원회 민당정 간담회 자리에서 ""페이코인 실명계좌 발급은 막바지 단계를 밟고 있다""라며 ""정확한 시점을 말하기는 어렵지만 확실한 것은 발급이 가능하다는 것""이라고 강조했다.    그동안 페이프로토콜은 은행권으로부터 실명계좌를 발급받기 위한 협상에 임했다. 하지만, 지난해 가상자산 시장이 크게 위축되면서 애초 금융당국에서 제시했던 기한인 12월 30일을 맞추는 데 실패했다. 이에 오는 5일 서비스 종료를 앞두고 있다.    또 FIU측은 5일까지 시일을 준 것도 실명계좌 발급이 되면 서비스를 재개해주겠다는 의미가 아니라고 전했다. FIU 관계자는 ""지금 시점에서 페이프로토콜 측에서 요구하는 게 사업자 신고 불수리를 철회하라는 것인지, 현재 영업이 불법이 된 상황에서 형사고발을 늦춰달라는 것인지도 명확히 파악하기 어렵다""라고 언급했다.   



◆페이코인 서비스 철수시 나타날 상황은?   페이코인이 가상자산 결제 시장에서 완전 철수하면, 모회사 다날의 미래 수익도 축소되는 결과로 이어질 수밖에 없다.    다날은 가상자산 결제업을 통해 기존 영위했던 사업 체질을 근본적으로 개선하려고 했다. 가상자산을 이용하면 결제 시 거래 과정에 참여하는 카드사를 제외할 수 있고, 이는 수수료 비용이 축소되면서 순이익이 증가하는 결과로 나타나기 때문이다.    다트 전자공시시스템에 따르면 연결기준 다날 사업 부문은 ▲커머스 ▲디지털콘텐츠 ▲프랜차이즈 ▲렌탈부문으로 구성된다. 이 중 2021년 기준 다날의 유무선 결제시스템 사업을 포함하는 커머스 부문이 전체 매출의 83.87%를 차지한다. 디지털콘텐츠 부문 매출은 2019년부터 꾸준히 증가하고 있지만, 6.8% 정도다.    이렇듯 커머스에 매출 대부분을 의존하고 있는 상황에서 다날은 카드사에 수수료를 내지 않고, 결제대금의 더 많은 부분을 회수할 수 있는 가상자산 결제 시스템에 눈을 돌렸다.    실제 페이프로토콜의 2021년 매출액은 56억6500만원 가량으로 페이코인이 처음으로 출시된 2019년 4000만원, 2020년 5640만원 가량에서 기하급수적으로 성장했다. 이미 탄탄한 다날의 가맹점 인프라를 활용할 수 있다는 점에서 실제 일상생활에서 사용 가능한 가상자산 결제 지형을 조성됐기에 가능한 성장세였다.    하지만, 이번 사업이 철수되면 강력한 PG 사업자 지위로 기존 사업을 영위하는 데는 문제가 없겠지만, 바랬던 근본적인 결제시스템 체질 개선은 어려워진다. 자연스럽게 영업이익도 축소된다.    다날 관계자는 ""만일 서비스 기한이 연장되지 않는다면, 그 이후 대비책 관련 공식입장이 별도로 나올 것""이라며 ""일단 회사차원에서는 실명계좌 발급에 최선을 다하고 있다""라고 설명했다.",105,https://n.news.naver.com/mnews/article/138/0002141654?sid=103
"폴더블 아이패드 나올까…애플 전문 분석가 ""내년 출시 전망""",2023.01.31. 오전 11:31,"애플 아이패드 10세대. 사진=애플 홈페이지 캡처.아이폰 제조업체 애플이 내년 중으로 폴더블 아이패드를 출시할 것이라는 전망이 나왔다.애플 분석 전문가 궈밍치 TF증권 애널리스트는 30일(현지시간) 자신의 트위터에 “올해 아이패드 출하량은 전년 대비 10~15% 줄어들 것”이라면서 “그럼에도 내년 폴더블 아이패드에 대해 긍정적”이라고 전망했다.올해는 아이패드 출하 속도를 조절하는 한편 내년에는 폴더블 아이패드를 출시하고 새로운 모델의 출하량을 늘려 제품 믹스를 개선한다는 것이 궈 애널리스트의 전망이다.궈 애널리스트는 지난 2021년 폴더블 아이폰이 2024년 출시할 것이라고 예상했다. 이번 전망은 출시 시기는 같지만 폴더블이 적용되는 제품을 아이폰에서 아이패드로 바꿨다.특히 이번 궈 애널리스트의 전망은 시장분석기관 CSS 인사이트의 보고서와도 일치해 폴더블 아이패드 출시에 기대감이 쏠리고 있다. CSS 인사이트는 지난해 10월 낸 보고서에서 애플이 2024년 폴더블 아이폰보다 폴더블 아이패드를 먼저 출시할 가능성이 크다고 전망한 바 있다.



레노버 폴더블 태블릿 X1 폴드 상세 페이지. 사진=레노버 홈페이지 캡처.경쟁사인 삼성전자가 다양한 형태의 폴더블 스마트폰을 출시하고 있음에도 애플의 아이폰은 출시 이래 단 한번도 기본 형태에서 벗어난 적이 없다. 궈 애널리스트는 “이러한 추세에서 애플이 폴더블 아이폰을 출시하는 것은 말이 되지 않는다”며 “애플은 트렌드를 피하고 아이패드로 먼저 폴더블에 발을 담글 것”이라고 예상했다.궈 애널리스트는 또한 중국 부품 제조업체인 ‘안지테크놀로지(Anjie Technology)’가 폴더블 아이패드의 탄소 섬유 킥스탠드를 생산할 것으로 예측했다.",105,https://n.news.naver.com/mnews/article/030/0003075468?sid=103
"롯데하이마트, 신학기 가전 할인 행사 진행",2023.01.31. 오전 9:33,"2~3월 주요 브랜드 노트북·모바일 특가 판매롯데하이마트는 2월 한 달간 인기 IT가전을 저렴하게 구매할 수 있는 ‘2023 신상품 가장 빠르게 비교하고 사자’ 행사를 진행한다고 31일 밝혔다. 노트북과 모바일을 구매하는 대학생들의 수요를 고려해 주요 브랜드의 노트북과 모바일을 특별 할인가로 준비했다.‘삼성과 LG 신모델, 글로벌 PC 기획전’에서는 오는 28일까지 LG전자 노트북을 구매하면 모델에 따라 최대 30만 캐시백 혜택을 제공한다. 또한 주말에 애플, 마이크로소프트, 레노버 등 해외 브랜드의 노트북을 최대 20% 할인 한다.‘갤럭시S23 사전 예약’ 행사에서도 오는 13일까지 갤럭시S23을 사전 예약하면, 모델에 따라 최대 20만 캐시백 혜택을 제공한다. 오는 7일부터 14일까지 행사 카드로 아이폰14를 구매하는 소비자에게는 최대 8만 캐시백 혜택을 제공하고, 구매 후 이벤트 응모한 선착순 1천명에게 롯데하이마트 모바일 상품권 2만원권을 증정한다.



롯데하이마트는 2월 한 달간 인기 IT가전을 저렴하게 구매할 수 있는 ‘2023 신상품 가장 빠르게 비교하고 사자’ 행사를 진행한다. 서울 강남구 소재 롯데하이마트 대치점에서 모델이 행사를 소개하고 있다. (사진=롯데하이마트)‘IT 트렌드 상품 기획전’에서도 오는 20일까지 주말에 애플 에어팟 프로2, 애플워치 SE2, 갤럭시 버즈2 프로, 갤럭시 워치5 중 같은 모델 2대를 구매하면, 선착순 500명에게 최대 5만원 롯데하이마트 모바일 상품권을 증정한다.김은정 롯데하이마트 마케팅부문장은 “새 학기, 새 출근을 앞두고 있는 대학생, 직장인분들이 필요한 IT가전을 보다 저렴한 가격에 구매할 수 있도록 이번 행사를 준비했다”며 “다양한 할인 이벤트 등 풍성한 혜택과 함께 즐거운 쇼핑 되시기를 희망한다”고 말했다.롯데하이마트는 이밖에도 다양한 2월 할인 행사를 준비했다. ‘새출발, 새가전’ 행사에서는 전기밥솥, 에어프라이어, 헤어 용품 등 13개 품목을 최대 30% 할인하고, 행사 품목 중 3개 품목 이상을 동시에 구매하면 최대 15만 롯데하이마트 모바일 상품권을 준다.‘클린 가전 기획전’에서는 건조기와 의류관리기 행사 모델을 최대 20% 할인하고, ‘청정 가전 기획전’에서는 청소기, 공기청정기 등 행사 모델을 최대 30% 할인한다. 롯데하이마트온라인쇼핑몰에서는 오는 13일까지 행사 모델에 따라 최대 10% 캐시백 혜택을 제공한다. 지난 1월 16일부터 24일까지 총 1만582명을 대상으로 진행한 사전 투표 결과에서 상위를 차지한 6개 품목별 인기상품을 특가로 마련했다.",105,https://n.news.naver.com/mnews/article/092/0002281112?sid=103
지재권소송 전문성제고 특위 출범…관할집중제도 확대 등 논의,2023.01.31. 오후 3:30,"국가지식재산위원회[국가지식재산위원회 제공](서울=연합뉴스) 조승한 기자 = 관할집중제도 확대를 비롯한 지식재산권 관련 소송 제도의 개선안을 논의할 조직이 정식 출범했다.    대통령소속 지식재산위원회는 31일 서울 강남구 한국과학기술회관에서 '지식재산권 관련 소송 전문성 제고 특별전문위원회' 발족식을 열었다고 밝혔다.    관할집중제도는 소송 전문성과 신뢰성을 향상하고자 일반 민사소송과 달리 일부 지식재산권 관련 민사소송은 1심은 고등법원이 소재한 6개 지방법원에서, 2심은 특허법원에서만 심리토록 하는 것으로 2016년 시행됐다.    현재 특허권, 실용신안권, 상표권, 디자인권, 신품종보호권 등 5개 지식재산권과 관련한 민사소송에 적용되고 있다.    하지만 영업비밀과 부정경쟁행위 등 다른 지식재산 소송과 가처분소송·형사소송이 관할집중 대상에서 제외돼 관할집중 대상 확대가 필요하다는 의견이 제기돼 왔다고 지재위는 설명했다.    이에 지재위는 지난해 5월 열린 본회의에서 관할집중제도 범위 확대 등을 논의할 특위의 구성·운영 계획안을 의결했다.    특위에는 학계·법조계·산업계 민간전문가 15인과 국조실, 법무부, 문체부, 특허청, 지재위 관계자 5인이 참여한다. 위원장은 신성철 전 한국과학기술원(KAIST) 총장이 맡았다.    특위는 앞으로 1년간 민사소송 검토 소위와 형사소송 검토 소위 등 2개 분과위원회를 구성해 지식재산권 소송제도에 대해 논의하고 구체적 법령 개정안을 마련해 관계기관에 제안하기로 했다.    백만기 국가지식재산위원회 위원장은 ""지재권의 침해 여부를 정확하게 판단하고 적정 손해배상액을 산정하는 소송 제도는 지재권 보호 수단의 핵심""이라며 ""소송 관할집중 확대를 통한 판결의 전문성과 신뢰성을 제고하고, 침해손해배상액의 현실화에 기여할 수 있도록 지재위가 적극적으로 지원하겠다""고 말했다.    shjo@yna.co.kr",105,https://n.news.naver.com/mnews/article/001/0013728889?sid=103
"[과학게시판] 과기정통부, 2023년 연구개발특구 신년인사회 개최 外",2023.01.31. 오전 8:43,"이종호 과학기술정보통신부 장관이 30일 대전 유성구 대전컨벤션센터에서 열린 '2023년 연구개발특구 신년인사회' 에서 인사말을 하고 있다. 과기정통부 제공   ■ 과학기술정보통신부가 주최하고 연구개발특구진흥재단이 주관하는 '2023년 연구개발특구 신년인사회'가 30일 열렸다. 올해 50주년을 맞는 연구개발특구의 지난 50년간 성과를 되돌아보고 향후 50년 새로운 도약을 다짐하는 자리다. 연구개발특구는 공공연구기관의 연구개발(R&D) 기반 신기술 창출, 성과 확산, 사업화 촉진을 위해 조성된 지구다. 대던연구개발특구를 비롯해 광주, 대구, 부산, 전북 등 5개 광역 특구와 14개 강소특구가 지정돼 있다. 행사에서는 곽재식 숭실사이버대 교수가 탄소중립, 기후변화의 중요성을 강조하는 특별강연을 진행했다. 이종호 과기정통부 장관은 ""연구개발특구가 1973년 대덕연구학원 도시를 모태로 출발한지 50주년을 맞는 뜻깊은 해""라며 ""지역주도 혁신성장의 거점이자 미래성장동력과 기술이 싹트는 요람으로 자리매김할 수 있도록 도전과 노력을 부탁한다""고 당부했다.   ■ 한국과학기술단체총연합회는 내달 2일 제4회 청년과학기술인포럼을 개최해 '미래 청년과학기술인을 위한 정책과 지원방향'을 논의한다고 30일 밝혔다. 행사는 서울 강남구 한국과학기술회관에서 열린다. 김경학 한양대 교수가 '과학기술 도약의 중심, 청년과학기술인의 정책제언'을 주제로 발표한다. 이종호 과기정통부 장관과 박사과정 연구원들과 대화하는 자리도 마련돼 있다. 분과별 토론도 진행된다. 금나나 동국대 교수가 좌장을 맡아 홍익대, 울산과학기술원(UNIST), 한양대, KAIST 연구원들과의 토론도 진행한다. 포럼은 오후 3시부터 '한국과총' 유튜브 채널을 통해 생중계될 예정이다.",105,https://n.news.naver.com/mnews/article/584/0000021746?sid=103
"연이은 법원의 P2E 철퇴에…업계 ""기댈 곳은 게임법 개정안뿐""",2023.01.31. 오후 5:22,"스카이피플 이어 나트리스도 패소…사실상 현행법서 승소 가능성 없어



서울행정법원 [사진=박예진 기자]법원이 연이어 불허 판결을 내리면서 국내 P2E 게임 허용은 불투명하다는 전망이 나온다. 관련 업계는 결국 게임산업진흥에 관한 법률(이하 게임법) 개정안을 주목하는 분위기다.31일 법조계에 따르면 서울행정법원 행정8부(부장판사 이정희)는 이날 나트리스가 게임물관리위원회를 상대로 낸 등급분류취소처분 취소 청구 소송을 기각했다.앞서 2021년 12월 24일 게임위는 구글플레이에 P2E 게임 '무한돌파삼국지 리버스' 등급분류결정 취소처분을 내리자 개발사인 나트리스는 이틀 뒤 게임위를 상대로 소송을 제기한 바 있다.이번 판결은 P2E 게임을 불허한 두 번째 사례다. 이달 13일에도 법원은 스카이피플이 게임위를 상대로 P2E 게임 '파이브스타즈 포 클레이튼'에 대해 제기한 등급분류취소처분 취소의 소를 기각했다.두 소송에서 법원은 게임 관련 대체불가능토큰(NFT)와 가상토큰에 대해 모두 게임법 제28조 제3호가 금지하고 있는 '경품'에 해당하고 게임에서 경품을 제공하는 것은 그 자체로 사행성을 조장하는 행위라고 판단했다. 두 사례 모두 게임법 제32조 제1항 제7호에서 규정하는 환전금지조항에도 위배된다.사실상 현행 게임법 하에서 블록체인 기반의 P2E 게임 국내 서비스는 불가능하다는 해석이 나온다. 게임사의 항소 역시 실익이 없다는 견해가 다수다.변수는 개정 가능성이 있는 게임법이다. 가령 하태경 의원이 지난 27일 대표발의한 게임법 개정안의 경우 사행성 콘텐츠와 게임을 분리하되 정보통신망이용게임제공업자, 일반게임시설제공업자, 인터넷컴퓨터게임시설제공업자(성인게임시설제공업자는 제외)가 이용자 유치·홍보 등을 위해 경품을 제공할 수 있다고 규정했다.이상헌 의원 역시 2020년 대표발의한 게임법 개정안에서 경품을 제공할 수 있다는 내용을 담았다. 다만 두 안 모두 청소년에게 유해한 경품과 대통령령으로 정하는 경품은 불가하다고 제한했다.개정되는 게임법에서도 경품에 대한 해석이 엄격할 경우 P2E 게임 허용은 여전히 불투명할 것으로 보인다. 사행행위 등 규제 및 처벌 특례법에서 '판돈', '우연성', '보상'을 사행성 기준으로 제시하고 있는데 이용자가 게임 초기 구입하는 토큰 등을 판돈으로 규정할 경우 단순 경품으로 인정받기 어려울 수 있기 때문이다.법원 역시 앞선 판결에서 스카이피플의 게임이 '우연적 방법으로 결과가 결정되고 그 결과로 재산상의 이익 또는 재산상의 손실을 초래하는 성질'이라는 사행성의 요건에 충족된다고 봤다.하태경 의원실은 ""업계에서도 불가능한 주장이라고 생각하지 않을까 싶다""면서 ""만약 정말 법안을 통해 해결할 수 있다고 판단했으면 저희에게 법안을 이런 방향으로 바꿔달라고 제안했을 텐데 한 번도 그런 사례는 없었다""고 말했다.",105,https://n.news.naver.com/mnews/article/031/0000725597?sid=103
