title,date,main,section,url
세계1위 슈퍼컴 후카쿠는 어떻게 사회에 기여할까,2021.10.19. 오후 5:33,"지속가능발전(SDG) 강조한 후지쯔··· 포럼서 회사 비전 및 기술 선봬



[디지털데일리 이종현기자] “코로나19 이후 우리의 삶은 크게 변했습니다. 팬데믹은 세상을 분리하고 가치와 생활방식을 급격히 변화시켰는데, 기후변화 등 우리가 직면한 문제는 보다 심각해졌습니다. 세계적인 문제를 해결하기 위해 기업, 학계, 국가 등이 협력해야 하는데, 후지쯔는 더 나은 미래를 위해 회사의 전 역량을 쏟고 있습니다.”(토키타 타카히토 후지쯔 CEO)   후지쯔는 지난 12일 매년 일본과 독일서 개최한 글로벌 행사 ‘후지쯔 포럼’을 온라인으로 개최했다. ‘지속가능발전(SDG)’에 초점을 두고, 후지쯔가 보유한 기술이 어떻게 사회 발전에 기여할 수 있는지에 대해 설명했다.   토키타 타카히토 후지쯔 대표는 “지난 1년 반 동안 우리 삶은 크게 변했다. 사람들이 직접 만나지 못하는 동안 세상은 점차 온라인으로 이동하며 보다 많은 사람과 연결되는 기회를 제공했다”며 “이는 뉴노멀 시대의 긍정적인 변화 중 하나”라고 말했다.   그는 “상상하던 기술이 하나하나 실용화돼 그 혜택을 누리고 있다. 미래를 위협하는 문제는 그 규모가 예상보다 더욱 커지는 중이고, 이를 극복하기 위해서는 현상 유지만으로는 부족하다”며 지속가능한 미래를 위한 기술을 강조했다.   후지쯔가 자랑하는 기술 중 하나는 슈퍼컴퓨터 ‘후카쿠’다. 2020년 6월부터 11월, 올해 6월까지 3연속으로 세계 슈퍼컴퓨터 1위를 차지한 후카쿠는 한국서 가장 높은 순위를 차지한 슈퍼컴퓨터 ‘누리온(NURION)’대비 실측성능(PF) 31배 이상 높다. 후지쯔는 후카쿠를 통해 암 유전과 관련된 의학 연구 지원이나 인공지능(AI)을 이용한 쓰나미 예측 등을 수행하고 있다.   신뢰(Trust)도 후지쯔가 중점을 두는 분야 중 하나다. 후지쯔는 스마트 리테일 환경에서 안전한 매장 운영 및 결제 환경 구축 등을 위한 인공지능(AI), 생체인증 기술을 제공한다.   후지쯔의 영상 속 사람의 행동을 인식하는 AI 기술은 일본 최대 쇼핑몰 ‘이온 레이크’ 및 편의점 체인 ‘미니스톱’을 보유한 유통기업 이온(AEON) 리테일에서 쓰이고 있다. 이용, 매장 내 고객의 행동을 분석해 필요로 할 때 직원이 접객을 돕도록 하는 시스템을 구축했다. 해당 기술은 도난이나 폭력 등 안전 영역에도 활용 가능하다.   일본 편의점 프랜차이즈 로손(LAWSON)은 후지쯔의 멀티 생체인증 기술을 바탕으로 점원이 아예 없는 무인매장을 구현했다. 본인이 인식하지 않더라도 얼굴과 정맥 등을 통해 사람을 식별한다. 마스크를 착용한 상태에서도 본인을 인증할 수 있다. 높은 보안이 요구되는 시설에도 유용하게 쓰인다. 토키타 CEO는 “세계는 이미 2030년 이후의 미래를 보고 대비하기 시작했다. 후지쯔가 단독으로 여러 사회적 문제를 해결하는 데는 한계가 있다. 다양한 능력으로 사람과 기술을 연결시켜 나가겠다”고 피력했다.   한편 후지쯔는 포럼에서 모든(Universal) 사물을 지속 가능한 방향으로 전진(Advance)시켜 나가겠다겠다는 의미의 신규 비즈니스 브랜드, 후지쯔 유밴스(Uvance)를 공개했다.",105,https://n.news.naver.com/mnews/article/138/0002111908?sid=103
폴더블폰 인기에 폴더블 OLED 출하량도 5년간 연평균 60%대 성장 전망,2021.10.19. 오전 6:01,"옴디아 ""2028년에는 출하량 1억개…OLED 패널 시장 점유율 30%"" 예상삼성디스플레이, 3분기 출하량 370만개로 시장 점유율 100% 달성



갤럭시 Z 폴드3·Z 플립3, 국내 100만대 판매 돌파(서울=연합뉴스) 삼성전자가 3세대 폴더블폰 '갤럭시 Z 폴드3'와 '갤럭시 Z 플립3'의 국내 판매량이 출시 39일만인 지난 4일 기준 100만대를 돌파했다고 6일 밝혔다. 사진은 갤럭시 Z 폴드3(왼쪽), Z 플립3. 2021.10.6     [삼성전자 제공. 재판매 및 DB 금지] photo@yna.co.kr(서울=연합뉴스) 조재영 기자 = 폴더블폰 인기에 힘입어 핵심 부품인 폴더블 유기발광다이오드(OLED)도 향후 5년간 연평균 60%대 고성장을 할 것이라는 전망이 나왔다.    이에 따라 사실상 이 시장을 장악하고 있는 삼성디스플레이가 중소형 OLED 시장에서 중국 경쟁사들의 추격을 따돌리고 초격차를 유지할지 주목된다.    시장조사업체 옴디아는 19일 폴더블 OLED 출하량이 올해 1천만개에서 2025년 6천600만개로 가파르게 증가해 향후 5년간 연평균 61%의 성장률을 기록할 것으로 전망했다.    매출 역시 올해 16억1천만달러(약 1조9천억원)에서 2025년 82억6천만달러(약 9조7천700억원)로 증가해 연평균 성장률이 50%에 이를 것으로 관측했다.    특히 2028년에는 출하량이 1억개를 돌파해 OLED 스마트폰 10대 중 1대에 폴더블이 적용될 것으로 내다봤다.    폴더블 OLED는 삼성전자의 갤럭시Z폴드, Z플립에 이어 샤오미, 오포, 비보 등 중국 3대 스마트폰 브랜드와 구글이 연말 이후 폴더블폰 출시를 준비하면서 내년부터 본격적인 확대가 예상된다.    삼성전자의 갤럭시Z폴드, Z플립은 출시 39일 만에 국내 판매 100만대를 돌파하며 폴더블폰의 성장 가능성을 입증했다.



갤럭시 Z 폴드3·Z 플립3, 국내 100만대 판매 돌파(서울=연합뉴스) 삼성전자가 3세대 폴더블폰 '갤럭시 Z 폴드3'와 '갤럭시 Z 플립3'의 국내 판매량이 출시 39일만인 지난 4일 기준 100만대를 돌파했다고 6일 밝혔다. 사진은 갤럭시 Z 폴드3(왼쪽), Z 플립3. 2021.10.6     [삼성전자 제공. 재판매 및 DB 금지] photo@yna.co.kr현재 폴더블 OLED는 삼성디스플레이가 전량 공급하고 있다.    옴디아에 따르면 갤럭시Z 시리즈 공급이 본격화된 올 3분기 삼성디스플레이는 폴더블 OLED 370만개를 출하했다. 이는 시장점유율 100%에 해당하는 수치로 4분기에는 출하량이 450만개로 늘어날 전망이다.    중국의 CSOT와 BOE도 양산을 준비 중인 것으로 알려졌으나 의미 있는 수준의 규모로는 보기 어려워 삼성디스플레이의 폴더블 지배력은 한동안 유지될 것이라는 게 업계의 관측이다.    폴더블 OLED의 급성장은 정체된 패널 시장에도 새로운 성장의 기회가 될 전망이다.    옴디아는 기존 바(Bar)타입 스마트폰용 OLED 시장은 향후 5년간 매출 기준 평균 3% 역성장하는 반면 폴더블 OLED 시장은 50% 고속 성장할 것으로 예상했다. 즉, 폴더블 기술력 확보가 패널 업체 간 기술경쟁의 핵심이 될 것이라는 관측이다.    업계 관계자는 ""폴더블 OLED는 향후 중소형 OLED 시장의 승패를 가를 핵심 기술로 삼성디스플레이를 중심으로 하는 국내 패널사들의 과감한 투자와 집중적인 연구개발로 중국 패널사와 기술 격차를 만드는 기회로 삼아야 한다""고 강조했다.    fusionjc@yna.co.kr",105,https://n.news.naver.com/mnews/article/001/0012730608?sid=103
재시동 거는 MWC...기업 참여 눈치싸움,2021.10.19. 오후 4:36,"위드코로나 확산 분위기와 동종업계 동향 주시세계 최대 모바일 전시회인 MWC를 주관하고 있는 GSMA가 내년 2월 바르셀로나 행사 개최를 위한 준비에 본격 나섰다.MWC 행사는 지난 해 코로나19 감염 우려로 전격 취소된 데 이어 올해는 뒤늦게 온오프라인 병행 행사로 진행됐다. GSMA는 내년에는 예년대로 정상 개최한다는 목표로 바쁘게 움직이고 있다.올해까지는 온오프라인 병행 개최에도 코로나19 상황 때문에 각국 정부와 기업들이 참여를 주저했다. 이에 따라 위드코로나 분위기가 확산될 내년 행사에는 어느 정도 참여할 지 관심이 쏠린다.19일 관련업계에 따르면 GSMA는 내년 2월28일부터 나흘간 스페인 바르셀로나에서 MWC를 개막하기 위해 컨퍼런스 연사와 전시기업, 스폰서, 파트너 프로그램 참여 기업의 모집을 시작했다.지난 6월 온오프라인 병행으로 연기 개막한 뒤 내년에는 예년 일정에 따라 정상 개최하겠다는 뜻을 밝힌 이후 실제 준비에 나섰다는 것이다.MWC 단골 참여 기업들은 이달 말에 미국에서 열리는 MWC로스앤젤레스가 끝난 뒤 GSMA의 개최 준비 행보가 더욱 빨라질 것으로 보고 있다.



사진 = MWC 바르셀로나 홈페이지주요 기업에 이미 MWC 참여를 위한 러브콜이 오가고 있다. 외신들은 삼성전자가 갤럭시S22 시리즈를 내년 MWC 개막 직전에 현지에서 공개할 것이란 관측을 내놓고 있다.삼성전자는 런던과 뉴욕, 샌프란시스코 등에서 전략 스마트폰 발표 행사를 갖기도 했지만 주로 MWC 개막 전날 상반기 전략 단말을 공개한 뒤 현장을 찾은 세계 각국 이동통신사 거래선과 단말 공급 영업을 진행해왔다.GSMA는 이달 22일까지 컨퍼런스 연사 1차 모집 계획을 밝혔다. 주요 기조연사와 스폰서 기업 참여에 대해서는 물밑 작업이 이뤄질 것으로 보인다.해외 기업은 물론 국내 기업 가운데 기존 MWC에 참여했던 회사들도 내부적으로 참여 가능성을 고민하는 분위기다. 다만 내부적인 참여 결정을 내리기까진 시간이 더욱 걸릴 것으로 보인다.통신업계 한 관계자는 “정상적으로 개최되고 해외 기업과 각국의 주요 정책 결정자들이 모인다면 MWC는 충분히 매력적인 행사다”면서도 “코로나 상황과 내년 비용 집행을 고려해야하기 때문에 당장 결정을 내릴 수 없지만 업계 동향을 면밀히 살피는 분위기다”고 말했다.다른 관계자는 “컨퍼런스 참여와 달리 전시 참여는 보다 이른 시간에 결정을 내려야 하는 문제가 있다”면서 “참여 여부 의사결정 시기를 가능한 늦추면서 다른 회사와 글로벌 기업들의 움직임을 주시하고 있다”고 말했다.",105,https://n.news.naver.com/mnews/article/092/0002236551?sid=103
"넷마블에프앤씨, 나인엠인터렉티브 흡수합병…메타버스 기술 활용",2021.10.19. 오전 11:34,"[이데일리 이대호 기자] 넷마블(251270)은 개발 자회사 넷마블에프앤씨(공동대표 서우원, 정철호)가 실사형 스포츠게임 전문 개발사 나인엠인터렉티브(대표 김성훈)를 100% 흡수합병한다고 19일 공시했다.나인엠인터렉티브는 EA스포츠 출신의 핵심 인력이 주축이 돼 2014년 설립한 개발사다. 모바일게임 ‘얼티밋 테니스’와 ‘익스트림 풋볼’, ‘9M 프로야구’, ‘CPBL 프로베이스볼’을 선보이며 국내외 이용자들로부터 꾸준히 사랑을 받고 있다.두 회사 모두 주권비상장법인으로 넷마블에프앤씨가 존속회사, 나인엠인터랙티브는 소멸회사가 되며 합병기일은 12월 3일이다.서우원 넷마블에프앤씨 공동대표는 “실사형 스포츠게임에서 탁월한 역량을 가진 나인엠인터렉티브는 딥러닝을 활용한 메타휴먼 생성 기술은 물론 모션캡쳐와 네트워크 기술력을 보유하고 있어 성장성이 기대된다”며 “넷마블에프앤씨는 양 사가 보유한 기술 및 인적 자원을 메타버스 게임 및 플랫폼 개발에 적극 활용할 것”이라고 밝혔다.한편 넷마블에프앤씨는 최근 지분 100%를 출자해 자회사 메타버스엔터테인먼트를 설립, 가상현실 플랫폼 개발과 가상(버츄얼) 아이돌 매니지먼트 등 게임과 연계된 메타버스 콘텐츠 제작과 서비스 사업 계획을 밝힌 바 있다.",105,https://n.news.naver.com/mnews/article/018/0005063684?sid=103
"두산디지털이노베이션, 사이버리즌·IBM시큐리티와 'ISEC 2021' 공동 참가",2021.10.19. 오후 5:23,"""사이버 보안 체계 강화 솔루션 제시""두산디지털이노베이션(DDI)는 글로벌 사이버 보안업체 사이버리즌, IBM시큐리티와 함께 '제15회 국제 보안 컨퍼런스(ISEC 2021)'에 공동으로 참가한다고 19일 밝혔다.ISEC 2021은 오는 21일부터 이틀간 서울 삼성동 코엑스에서 열리는 아시아 최대 규모의 보안 컨퍼런스다. 과학기술정보통신부, 행정안전부 등이 후원하고 한국인터넷진흥원, 한국정보보호책임자협의회 등이 주관하는 행사다.DDI는 이번 행사에서 키노트, 트랙 등 두 가지 세션을 선보인다. 키노트 세션에선 에릭 나겔 사이버리즌 APAC 총괄이 '랜섬웨어에 대한 사전 예방 전략)을 주제로 최근 확산되고 있는 랜섬웨어에 대한 예방 방법과 기술적 방어 방법을 공유할 예정이다.회사 관계자는 ""랜섬웨어는 전세계 모든 기업이 직면한 큰 위험 요소다. 배경지식이 많지 않은 사람도 랜섬웨어 공격을 손쉽게 수행할 수 있는 서비스형 랜섬웨어(RaaS) 등 랜섬웨어 형태도 계속 진화를 거듭하며 비즈니스 운영에 막대한 영향을 끼치고 있다""며 ""이 세션을 통해 다층의 랜섬웨어 방지 역량이 중요해진 이유와 보안 리더가 사이버 보안 공격으로부터 조직을 보호할 수 있는 방안을 공개할 예정""이라고 소개했다.트랙 세션은  IBM 시큐리티와 함께 ‘글로벌 기업의 차세대 보안 강화 전략’을 주제로 개최된다. 양사는 갈수록 지능화되고 있는 외부 공격에 기업이 미래를 대비하는 전략을 공유하고 기업의 보안 강화 방안 등이 공유될 예정이다.오명환 DDI 부사장은 ""최근 랜섬웨어 공격이 급격하게 증가함에 따라 기업의 사이버 보안에 대한 투자 및 경쟁력이 더욱 중요해졌다""며 ""이번 컨퍼런스에서 사이버리즌, IBM시큐리티와 함께 글로벌 수준의 사이버 보안 체계 강화 방안을 공개하고 보안 시장 내의 경쟁력을 확고히 할 예정""이라고 말했다.한편 DDI는 랜섬웨어 등의 사이버 보안 위협이 증가함에 따라 전 그룹사의 글로벌 보안 강화를 디지털 트렌스포메이션의 중장기 과제로 진행하고 있다. 엔드포인트 탐지·대응(EDR) 솔루션에서 두각을 드러내고 있는 사이버리즌과 보안업체 IBM 시큐리티와의 협력을 통해 국내 최고 수준의 보안 체계를 구축하겠다는 목표다.",105,https://n.news.naver.com/mnews/article/015/0004618036?sid=103
"과기정통부, ‘지능형사물인터넷 진흥주간’ 20일 개막",2021.10.19. 오후 12:01,"[이데일리 이대호 기자] 과학기술정보통신부(장관 임혜숙, 과기정통부)는 오는 20일부터 22일까지 사물인터넷(IoT) 활성화와 경쟁력 제고를 위한 ‘2021 AIoT 진흥주간(AIoT Week Korea)’을 개최한다고 19일 밝혔다.사물인터넷과 인공지능(AI)이 결합한 지능형사물인터넷(AIoT)은 최근 들어 사물의 기하급수적 연결촉진과 인공지능의 고도화를 배경으로 기존의 상황인지, 단순제어, 미래예측뿐만 아니라, ‘자율판단’과 ‘자율제어’까지도 가능해지는 자율형 단계로 도약하고 있다.AIoT 진흥주간은 이러한 AIoT의 현재와 미래를 제시하고, 사물인터넷에 대한 관심 제고와 관련 기술과 산업 발전방향을 모색하는 자리이다.올해 AIoT 진흥주간은 ’지능형 사물인터넷, 삶과 미래를 잇다‘를 주제로 국제전시회, 컨퍼런스, IoT 쇼케이스 등 8개의 다양한 행사가 온오프라인으로 개최된다.△AIoT 국제전시회(20~22일 코엑스)와 함께 컨퍼런스, 비즈니스미팅이 마련된다. △AIoT 컨퍼런스 △IoT Showcase △IoT 보안인증제도 설명회 △AIoT 제품·솔루션 발표회 △지능융합기반 인공지능(AI) 기술 및 사업화 세미나 △OCEAN Summit 2021 △AIoT 수요·공급기업 비즈니스 네트워킹을 예정했다. 조경식 과기정통부 제2차관은 “최근 사물인터넷과 AI가 결합된 지능형 사물인터넷은 가정, 지역사회, 에너지, 물류・유통, 제조 등 다양한 영역에 뿌리내린 네트워크 인프라로서 역할이 커지고 있다”라며 “이번 진흥주간을 통해 산학연이 함께 발전방향을 모색함으로써, 사물인터넷이 생산성을 높이고, 나아가 삶을 풍요롭게 하는 미래 주춧돌이 되는 계기가 될 것을 기대한다”라고 밝혔다.",105,https://n.news.naver.com/mnews/article/018/0005063699?sid=103
"“상위 1% 아이들의 독서법”…LGU+, ‘키스 스콜레’ 독점 제공",2021.10.19. 오후 5:48,"LG유플러스 모델들이 U+아이들나라를 통해 키즈 스콜레 콘텐츠를 이용하는 모습.  제공 | LG유플러스[스포츠서울 | 김민규기자]“상위 1% 아이들의 독서법을 알려 드립니다.” LG유플러스가 자사의 영유아 전용 플랫폼 ‘U+아이들나라’에서 독서 육아법으로 유명한 프리미엄 도서브랜드 ‘키즈 스콜레’ 콘텐츠를 독점 출시한다고 19일 밝혔다.‘키즈 스콜레’는 ‘1% 학부모들만 알고 있는 교육 노하우를 99% 학부모들이 누릴 수 있도록 하자’는 슬로건 아래 학부모들 사이에서 ‘1% 독서법’으로 호응을 얻고 있는 도서 전집 콘텐츠다. 지난 2017년 출시 이후 영유아 교육 시장에서 가장 가파른 성장세를 나타내고 있다.U+아이들나라에선 ‘키즈 스콜레’를 ‘책 읽어주는 TV’를 통해 서비스한다. ‘책 읽어주는 TV’는 아이들이 책과 친해질 수 있도록 다양한 인기도서 작품들을 구연동화 선생님과 읽을 수 있도록 한 서비스다. ‘키즈 스콜레’ 콘텐츠는 오는 20일 73편 공개를 시작으로 총 6개 전집, 294편의 콘텐츠가 매월 순차적으로 제공된다.해당 콘텐츠로는 ▲1% 과학영재의 비법 ‘사이언스 메이커’ ▲국내 최초 그림책 테라피 프로그램 ‘STEPS’ ▲좋아하는 것으로 미래를 만들어 가는 ‘메이크 마이 스토리’ ▲천천히 읽고 생각이 쑥쑥! ‘발밤발밤 옛이야기’ ▲자연을 커넥츠하다! ‘야호, 자연아!’ ▲엄마, 아빠가 읽어주는 행복 ‘마마파파 세계명작’ 등이다.이로써 고객들은 ‘책 읽어주는 TV’에서 총 1700여 편의 도서를 이용할 수 있게 된다. ‘키즈 스콜레’ 뿐만 아니라 백희나 작가의 동화책 ‘알사탕’과 같은 그림책 콘텐츠도 이용할 수 있다. LG유플러스 관계자는 “지난해부터 이어진 홈스쿨링 열풍으로 U+아이들나라에서도 교육 콘텐츠 이용률이 크게 높아지고 있다. 특히 책 읽어주는 TV는 올 상반기 콘텐츠 이용 건수가 지난해 같은 기간과 비교해 3배 가량 증가했다”고 설명했다.이와 함께 LG유플러스는 ‘키즈 스콜레’ 출시를 맞아 오는 22일부터 아이들의 독서습관 향상을 위한 캠페인을 전개한다. 100일 동안 100권의 책 읽어주는 TV 콘텐츠를 시청하고 워크북 활동을 하는 ‘백백 프로젝트’다. 참가자들은 총 100편의 ‘키즈 스콜레’ 워크북을 제공받으며, 아이와 하루 한 편의 콘텐츠 감상 및 독후 활동을 진행하게 된다. 또 매주 활동 인증을 남긴 고객에겐 ‘키즈 스콜레’ 소전집 세트 등의 경품도 받을 수 있다. ‘키즈 스콜레’ 워크북은 오는 11월부터 전국 LG유플러스 매장에서 U+아이들나라를 체험한 고객들에게도 제공된다. 문현일 LG유플러스 아이들나라사업담당은 “U+아이들나라와 학부모 선호도가 가장 높은 브랜드 키즈 스콜레가 만나 상호 시너지를 도모할 수 있게 됐다. 향후 콘텐츠 협업을 넘어 놀이펜 연동이나 상호작용이 가능한 콘텐츠 제작 등 아이들의 체험형 학습을 돕기 위한 다채로운 방안을 컴토해 나갈 것”이라고 말했다.kmg@sportsseoul.com",105,https://n.news.naver.com/mnews/article/468/0000795138?sid=103
자율운항선박 성능실증센터 기공식,2021.10.19. 오후 5:23,"(울산=연합뉴스) 19일 오후 울산 동구 고늘지구에서 열린 자율운항선박 성능실증센터 건립 기공식에서 송철호 울산시장, 김부기 선박해양플랜트연구소 소장 등 내빈들이 기공식을 축하하며 손뼉 치고 있다. 2021.10.19 [울산시 제공. 재판매 및 DB 금지]    hkm@yna.co.kr",105,https://n.news.naver.com/mnews/article/001/0012732839?sid=103
"현대차, 사우디 국부펀드와 자동차 조립공장 만든다",2023.10.23. 오전 8:51,"사우디아라비아 킹 압둘라 경제도시에 연산 5만대 규모 중동 첫 생산 거점 추진2026년 양산 목표…5억 달러 이상 공동 투자



[리야드=뉴시스] 전신 기자 = 사우디아라비아를 국빈 방문 중인 윤석열 대통령이 22일(현지시간) 리야드 한 호텔에서 열린 현대차·PIF 자동차 생산 합작투자 계약에서 기념촬영을 하며 박수치고 있다. 왼쪽부터 정의선 현대차그룹 회장, 추경호 부총리 겸 기획재정부 장관, 방문규 산업통상자원부 장관, 장재훈 현대차 사장, 윤 대통령, 야지드 알후미에드 사우디 국부펀드(PIF) 부총재. 2023.10.23. photo1006@newsis.com[서울=뉴시스]안경무 기자 = 현대자동차가 사우디아라비아에 자동차 조립 합작 공장을 건설하며 중동 지역 내 첫 생산 거점 확보에 나선다.현대차는 22일(현지시간) 사우디아라비아 리야드 페어몬트호텔에서 사우디아라비아 국부펀드(PIF)와 CKD(반제품조립·Complete Knock Down) 공장 설립을 위한 합작투자 계약을 체결했다고 23일 밝혔다.한-사우디 투자 포럼에서 진행된 계약 체결식에는 정의선 현대자동차그룹 회장, 장재훈 현대차 사장, 야시르 오스만 알루마이얀 PIF 총재, 야지드 알후미에드 PIF 부총재 등이 참석했다.현대차와 PIF는 이번 계약에 따라 사우디아라비아 킹 압둘라 경제도시(KAEC)에 연간 5만대를 생산할 수 있는 CKD 합작 공장을 짓는다.이 합작 공장은 2024년 상반기 착공해 2026년 상반기 양산 개시를 목표로 전기차와 내연기관차를 모두 생산하는 등 다양한 차종을 생산하는 설비를 갖춘다. 현대차와 PIF는 합작공장 건설에 5억 달러 이상을 공동 투자할 계획이다. 공장 지분은 현대차가 30%, PIF가 70% 보유하기로 했다.공장이 들어서는 KAEC는 사우디아라비아 서부 지역에 들어선 계획도시다. 사우디 제2의 도시이자 최대 무역항이 위치한 제다(Jeddah)로부터 약 100㎞ 거리에 있다. 최근 전기차 업계의 투자가 잇따르고 자동차 부품업체들이 입주하는 등 중동 자동차 산업 중심지로 떠오르는 곳이다. 사우디아라비아는 석유 산업에 대한 의존도를 낮추고 다양한 산업 동력을 키운다는 목표로 국가 발전 프로젝트인 ‘사우디아라비아 비전 2030’을 진행하고 있다. 이 프로젝트 일환으로 자동차 산업의 발전도 적극 추진 중이다.현대차는 사우디아라비아 합작공장에 고도의 자동화 공정 및 지역 맞춤형 설비를 적용한다. 생산 제품의 라인업도 단계적으로 확대해 중동 및 북아프리카 지역의 중심 생산 거점으로 육성한다.장재훈 현대차 사장은 ""전기차 기술에 대한 현대차와 PIF의 협력이 혁신과 환경친화적 기회를 창출할 것으로 기대한다""고 말했다. 야지드 알후미에드 PIF 부총재는 ""우리의 합작투자는 사우디아라비아 자동차 및 모빌리티 산업의 가치 사슬을 폭넓게 확장하는 중대한 계기가 될 것""이라고 말했다.",105,https://n.news.naver.com/mnews/article/003/0012161820?sid=103
