title,date,main,section,url
[단독] 이해진 회사 ‘지음’ 대표번호는 네이버 고객센터…네이버와 연관 없다더니,2021.09.17. 오후 3:17,"지음은 이해진이 지분 100% 보유한 회사네이버 “지음과 네이버 사업적 연관성 없다” 주장전문가 “같은 대표번호 쓸 경우 차명 회사로 볼 수도”



네이버 창업주 이해진 글로벌투자책임자(GIO)가 지분 100%를 보유한 개인회사 지음의 전화번호와 네이버 고객센터 전화번호가 같은 것으로 확인됐다. /금융감독원 전자공시시스템 및 네이버        네이버 창업자 이해진 글로벌투자책임자(GIO)가 100% 지분을 보유한 개인자산관리회사 ‘지음’의 대표 전화번호가 네이버 고객센터로 게재된 것으로 확인됐다. 이는 최근 미공개 정보를 활용해 수백억원대 차익을 챙긴 의혹을 받은 이해진 GIO의 개인회사 지음과 사업적 연관성이 없다고 밝힌 네이버의 주장과 대치된다는 지적이 나온다.17일 금융감독원 전자공시시스템에 따르면 지음의 기업개황정보 내 표기된 대표 전화번호가 네이버 고객센터인 것으로 파악됐다. 해당 전화번호는 네이버 포털에서 게재된 대표 전화번호와 일치한다.앞서 네이버가 지음과는 어떠한 연관성이 없다고 주장했던 것과 대치된다. 네이버는 지난 9월 3일 이해진 GIO 소유 회사인 지음이 미공개 정보로 수백억원의 평가이익을 얻었다는 의혹에 대해 “지음은 네이버와 그 어떠한 사업적 연관성이 없으며 각각의 사업적 판단에 따라 별개로 운영되고 있다”고 설명했다.지음은 이해진 GIO가 지난 2011년 사재를 출연해 설립한 투자회사다. 실체는 2017년 공정거래위원회가 이 GIO를 네이버 동일인(총수)으로 지정하며 드러났다.대표이사는 친동생인 이해영씨가 맡고 있다. 설립 당시 1000만원이었던 자본금은 5차례 유상증자를 거쳐 140억원으로 늘었다. 네이버 사옥 근처에 사업장을 두고 이 GIO가 수차례 증자를 한 개인회사라는 점에서 공정위가 주목하고 있는 것으로 알려졌다.김진욱 법무법인 주원 변호사는 “같은 대표번호를 쓰고 있는 경우 차명 회사로 볼 수 있는 여지도 있다”고 말했다.네이버 관계자는 “2017년 준대기업집단으로 지정되며 전화번호가 동일하게 게재됐을 수 있다”면서도 “개인회사다 보니 운영 경험이 적어 오기가 있을 수도 있다”고 했다. 지음 지분 100%를 보유한 이해진 GIO는 네이버 창업자다.",105,https://n.news.naver.com/mnews/article/366/0000761802?sid=103
"[언택트 추석] ‘집콕’ 즐길거리, 네이버·카카오에 다 있다",2021.09.18. 오전 8:52,"[디지털데일리 권하영 기자] 오는 22일까지 추석 연휴가 이어진다. 정부의 사회적 거리두기 방침 강화로 이번 명절에도 집에서 가족끼리 휴일을 보내거나 혼자 추석을 지내는 ‘집콕족’들이 많을 것으로 보인다.   이에 대표 인터넷 서비스 네이버와 카카오가 풍성한 명절 이벤트를 마련했다. 웹툰·웹소설과 영화 추천 등은 물론 카페 커뮤니티·소셜미디어(SNS) 등을 통한 비대면 모임 이벤트까지 각종 정보와 즐길거리를 모아봤다.   ◆ 추석 연휴, 웹툰·웹소설 정주행 어때요?   네이버웹툰에서는 ‘고수’ ‘입시명문사립정글고’ 등 과거 인기작들이 추천 완결 라인업에 추가돼 하루 한 편 무료 감상할 수 있다. 또 16일부터 24일까지 웹툰 ‘유미의세포들’과 ‘유미의세포들 외전 : 프로 직장인’을 관심웹툰으로 등록하고 각 3화 이상 열람 시 추첨으로 유미 굿즈 패키지(100명)가 지급된다. 16일부터 22일까지 매일 1개 웹툰 작품을 골라 10화 이상 열람했을 때도 추첨 1000명에게 쿠키 10개가 주어진다.  ​   네이버 시리즈에서는 연휴 기간 인기 웹소설을 정주행할 수 있는 이벤트를 진행한다. ‘나 혼자 만렙 뉴비’ ‘광마회귀’ 등 판타지·현대판타지·무협 장르의 인기 작품 7종 중 매일 1작품씩 하루 100화를 무료로 감상할 수 있다. 또 18일부터 24일까지 ‘황후를 훔친 이는 누구인가’를 포함한 19종의 로맨스 인기 작품 700화를 무료로 감상할 수 있으며, 감상 회차에 따라 최대 10개 쿠키가 지급된다.   카카오엔터테인먼트는 웹툰 입문자들을 위해 준비한 맞춤형 웹툰 가이드 ‘이땐이툰!’(이럴 땐 이 웹툰)을 통해 오랜 시간 독자에게 사랑받은 자타공인 ‘명작’ 웹툰들을 소개한다. 카카오웹툰에서 ‘흡혈고딩 피만두’부터 ‘이미테이션’ ‘트레이스’까지 긴 추석 연휴를 풍성하게 채울 ‘정주행’ 필수 스테디셀러 작품들을 볼 수 있다.  



  ◆ 시리즈온에서 영화도 보고 캐시도 받고   네이버 시리즈온에서는 추석 연휴를 맞아 ‘삼진그룹 영어토익반’ ‘워 위드 그랜파’ ‘트루먼쇼’ 등 온 가족이 함께 보기 좋은 국내외 영화 13편을 무료로 제공한다. ‘캐시 트럭’ ‘조제’ ‘펜트하우스2’ ‘골때리는 그녀들’ 등 인기 영화와 방송 프로그램을 최대 50% 할인하는 이벤트도 있다.    16일부터 22일까지 영화 2편 이상 구매 혹은 방송 2회 차 이상 구매 이용자 중 각각 500명씩 총 1000명을 추첨해 ‘1000캐시’ 쿠폰을 증정하는 ’추석맞이 할인혜택 더하기 1000명에게 캐시선물!‘ 이벤트도 눈 여겨 볼 만하다. 그 외에 18일부터 22일까지 최대 1만 캐시를 받을 수 있는 ‘추석맞이 캐시선물 룰렛 이벤트’도 열린다.   추석에 어떤 영화를 불지 고민된다면 네이버 검색창에 ‘영화 추천’'을 검색해보자. 네이버 지식베이스에서 그동안 내가 참여한 ‘좋아요’ 정보를 바탕으로 내가 좋아하는 장르의 영화를 추천해준다. 만약 네이버 영화 서비스가 처음이라면, 내가 지금까지 봤던 영화 중 재미있었던 작품을 3개 이상 선택하면 된다. 더 구체적인 추천을 받고 싶다면, 장르 및 관람등급 필터를 조절해 취향에 꼭 맞는 다양한 영화들을 볼 수 있다.   ◆ ‘오디오’만 있어도 좋아…비대면 모임 해볼까   네이버 바이브는 음악과 함께 즐거운 추석 연휴를 보낼 수 있는 다양한 이벤트를 준비했다. 바이브가 지난달 도입한 새로운 소셜 오디오 서비스 ‘파티룸’에서 주어진 미션을 수행하면 네이버페이 포인트가 지급된다. 파티룸은 뮤직 스트리밍과 인터넷 음성통화(VoIP)를 결합한 서비스로, 가족·친구·연인 등과 실시간으로 음성 대화를 나누며 음악을 들을 수 있는 기능이다.   파티룸에서 수행해야 할 미션은 ‘파티룸 출석하기’, ‘파티룸에 친구 초대하기’, ‘파티룸을 직접 만들어 친구들과 함께 음악 듣기’ 세 가지다. 26일까지 각 미션의 인증샷을 찍어 이벤트 페이지의 네이버 폼으로 제출하면, 선착순 1만명에게 네이버페이 포인트 최대 3000원이 지급된다. 또 이벤트 기간 가장 많은 파티룸 참여자를 모은 호스트 1명에게는 소니 SRS-HG10 스피커를 선물할 예정이다.  



  카카오의 오디오 기반 소셜미디어(SNS) ‘음(mm)’에서는 강수진, 강희선, 남도형, 박지윤, 전태열, 정미숙 등 인기 성우 6명과 함께 추석 특집 라이브 방송 ‘성우 어벤져스 - 한가위 보름달을 지켜라’를 진행한다. 성우 6인이 영화 ‘어벤저스: 인피니트 워’를 패러디한 오디오 드라마를 진행할 예정이다. 이 밖에 참여자들도 직접 함께 할 수 있는 프로그램이 준비되어 있다는 후문이다.   멜론 역시 오리지널 오디오 콘텐츠 서비스 ‘멜론 스테이션’에서 오는 20일부터 22일까지 하루 두 편씩 새로운 방송을 공개한다. 20일 오전 10시 박선영 아나운서의 영화음악 프로그램 ‘영화& 박선영입니다’를 비롯해, 20일 오후 2시 인기 캐릭터 DJ뽀로로가 진행하는 ‘뽀로로의 뽈륨을 높여요’, 21일 오후 6시 NCT127이 출연하는 SM엔터테인먼트 아티스트 전용 프로그램 ‘SMing’ 등을 각각 들어볼 수 있다.   ◆ 네이버 엑스퍼트로 취미 클래스 도전   일대일 상담·강의 서비스를 제공하는 네이버 엑스퍼트는 코로나 여파로 올 추석에도 집에 머무르는 시간이 많을 이용자들을 위해 캔들과 샴푸바 등 향기 소품을 직접 만드는 취미 클래스 할인 이벤트를 선보인다. VOD를 통해 초보자도 쉽게 따라할 수 있으며, 클래스에 필요한 재료도 별도 준비할 필요 없이 원하는 장소로 받아볼 수 있다. 10월3일까지 클래스 페이지에서 수강료 할인 쿠폰을 내려받으면 된다.   이 밖에도 네이버 엑스퍼트는 ‘'2021 랜선 추석 tip’ 스페셜 페이지를 운영한다. 집콕 요리, 운동, 취미, 정리·수납, 재테크 등 추석 연휴기간 유용하게 수강할 수 있는 5개 주제별 VOD 클래스 기획전도 제공할 예정이다.",105,https://n.news.naver.com/mnews/article/138/0002110561?sid=103
[보안 따라잡기]추석 스미싱 주의보…“택배·국민지원금 사칭 조심”,2021.09.18. 오전 10:14,"택배사칭 가장 흔해…첨부 URL 함부로 누르지 말아야국민 재난지원금·모바일 상품권도 사칭…실제 발송여부 확인자녀 가장해 `안부 문자`공격도 기승…의심되면 118에 신고



(자료=이스트시큐리티 제공)[이데일리 이후섭 기자] 추석 연휴기간 택배 확인, 국민지원금을 사칭한 스미싱 등의 스마트폰 보안 위협이 증가할 것으로 예상돼 사용자들의 각별한 주의가 요구된다.보안 전문기업 이스트시큐리티는 대표적인 스미싱 공격 유형과 예방법을 공개했다. 스미싱(smishing)은 `문자메시지(SMS)`와 `피싱(Phishing)`의 합성어로, 악성 앱 주소가 포함된 휴대폰 문자를 대량 전송 후 이용자가 악성 앱을 설치하거나 전화를 하도록 유도해 금융정보, 개인정보 등을 탈취하는 수법이다. 이는 보이스피싱, 전자상거래 사기, 기타 다양한 사기에 광범위하게 이용되고 있다.과학기술정보통신부에 따르면 올 들어 지난 8월까지 스미싱 신고(접수)·차단 건수는 18만4002건으로 전년동기(70만783건) 대비 74% 감소했으나, 추석 명절기간 선물 배송 등에 악용될 수 있는 택배 사칭 스미싱 유형이 93%를 차지하고 있다. 이스트시큐리티 시큐리티대응센터(ESRC)에서 모바일 백신 `알약M`을 통해 지난 8월까지 집계된 스미싱 공격도 14만건을 웃돌았다.



(자료=과학기술정보통신부 제공)`택배 사칭` 스미싱은 가장 흔하게 발견되는 스미싱 위협 중 하나로, 일반적으로 택배 반송, 주소지 불명 등을 안내하기 위해 발송된 것으로 사칭해 택배 상태 조회를 위해 첨부된 인터넷주소(URL)을 클릭하도록 유도한다. 첨부된 URL에 접속할 경우 택배 기업 앱으로 위장한 악성 앱이 다운로드되고, 로그인을 위해 계정 정보를 입력하면 공격자에게 정보가 탈취된다.`국민 재난지원금` 사칭 스미싱도 증가하고 있다. 공격자는 최근 금융사 등 여러 기관에서 5차 국민 재난지원금 대상 여부 확인 등을 안내하기 위해 전 국민에게 문자 메시지를 발송하는 것을 틈타, 악성 URL이 첨부된 가짜 안내 스미싱 SMS를 발송하고 있다.이 외에도 추석 선물을 가장한 `모바일 상품권` 사칭 스미싱 공격도 다수 발견되고 있다. 추석 기간 여러 기관이나 기업에서 명절 기념 모바일 상품권을 `경품` 목적으로 발송하거나, 코로나로 인해 고향에 방문하지 못하는 많은 국민이 모바일 상품권과 기프티콘 등을 통해 선물을 주고받는 경우가 많아지는 점을 악용하고 있다.문자메시지로 상품권이나 기프티콘을 선물 받았을 경우 첨부된 URL을 클릭하기 전 선물을 발송한 대상에게 실제 선물 발송 여부를 확인해 악성 URL 클릭을 예방하는 습관을 가져야 한다.노년층의 경우 스마트폰 사용이 익숙하지 않은 경우가 많은 점을 노리고, 부모님 전화번호로 자녀를 가장한 스미싱 SMS를 발송하는 `비대면 추석 안부 문자` 사칭 공격도 기승을 부리고 있다. 지인의 이름으로 발송된 안부 문자에 첨부된 URL을 눌러보지 않도록, 자녀나 친인척 등이 고령의 부모님 주의를 사전에 환기할 필요가 있다.이 같은 스미싱 피해를 최소화하기 위해 정부는 스미싱 모니터링 및 사이버 범죄 단속 강화 등을 중점적으로 실시한다. 과기정통부와 KISA는 추석 연휴기간 동안 스미싱 유포 등에 신속하게 대응할 수 있도록 24시간 모니터링을 실시하고, 신고·접수된 스미싱 정보를 분석해 악성앱 유포지 차단 등의 조치를 취할 계획이다.경찰청은 경찰청 홈페이지와 모바일 앱인 `사이버캅`을 통해 예방 수칙·피해 경보 등을 제공하고, 추석 연휴기간 전후로 발생하는 스미싱, 직거래 사기 등의 사이버범죄에 대해 단속을 강화할 계획이다. 연휴 중 스미싱 의심 문자를 수신했거나 악성앱 감염 등이 의심되는 경우 국번없이 118 상담센터에 신고하면 24시간 무료로 상담 받을 수 있다.",105,https://n.news.naver.com/mnews/article/018/0005040653?sid=103
"이종호 장관 ""항우연·천문연, 우주항공청 직속기관 법제화 동의""",2023.10.27. 오후 12:34,"과기정통부 장관, 국감장서 우주항공청 대안 발의 동의해과기노조 등이 요구했던 우주항공청 직속기관화 수용



[서울=뉴시스] 국회 과학기술정보통신위원회가 27일 과학기술정보통신부에 대한 종합감사를 실시했다. 이종호 장관(가운데), 조성경 1차관(오른쪽), 박윤규 2차관(왼쪽 두번째), 주영창 과학기술혁신본부장(왼쪽)이 기관장 증인으로 참석했다. (사진=심지혜 기자) [서울=뉴시스]윤정민 윤현성 기자 = 이종호 과학기술정보통신부 장관은 국회가 한국항공우주연구원과 한국천문연구원을 우주항공청 직속기관으로 법제화하는 데 동의한다고 말했다.이 장관은 27일 오전 국회에서 열린 과학기술정보방송통신위원회 국정감사에서 장제원, 박성중 국민의힘 의원 질의에 이같이 밝혔다.장제원 의원은 항우연, 천문연의 우주항공청 직속화를 위해서는 출연연 관련 법률과 우주항공청 특별법을 과방위 대안으로 발의할 수 있다고 말했다.이를 정부가 수용할 수 있냐는 장 의원 질문에 이 장관은 ""법제화 부분도 수용하고 논의해 주는 대로 따라가겠다""고 밝혔다.박성중 의원도 ""우리는 부칙으로 생각하고 있었는데 출연연법이나 우주항공청법을 동시에 바꿔서 하는 방법도 있다. 이견이 없다고 보는 데 동의하는가""라고 묻자 이 장관은 법제화를 동의한다고 재차 강조했다.앞서 지난 24일 대전 한국전자통신연구원(ETRI)에서 열린 국가과학기술연구회(NST) 산하 정부출연연구기관정부 국정감사에서 조성경 과기정통부 1차관과 이재형 우주항공청설립추진단장은 우주항공청 출범 시 항우연과 천문연을 우주항공청으로 이관하는 방안을 최우선으로 검토하겠다고 밝힌 바 있다.우주항공청 특별법(우주항공청 설치 및 운영에 관한 특별법)은 그동안 연구개발(R&D) 범위를 어디까지 둘 것인지에 대해 국회 양당 간 대립이 있어 입법이 지연돼 왔다.국회 우주항공청 특별법 안건조정위원회에서도 야당(더불어민주당)은 우주항공청의 직접 연구 기능을 반대한 가운데 여당(국민의힘)은 우주항공청이 개념 설계 연구라도 해야 한다는 의견을 내세웠다.이 가운데 이상률 항우연 원장은 국감장에서 우주항공청의 연구 기능을 인정한다며 ""모든 (항우연) 직원이 우주항공청 설립을 원한다. 지금까지 연구를 진행해 온 항우연과 우주항공청이 한 울타리에 들어가면 좋겠다""고 말했다.이후 더불어민주당과 전국과학기술노동조합은 항우연과 천문연을 우주항공청 직속으로 두는 안을 법제화해달라고 요구했다. 양 기관의 우주항공청 직속화를 특별법에 명시해달라는 주장이다.이날 이 장관이 직속기관 법제화에 동의하면서 우주항공청 특별법 입법도 속도를 낼 수 있을 전망이다.",105,https://n.news.naver.com/mnews/article/003/0012172832?sid=103
“가족 모이는 연휴에 ‘청불’ 드라마?” 넷플 신작 흥행 성공할까,2021.09.18. 오후 4:42,"[헤럴드경제=김민지 기자] “재미있을 것 같긴 한데…가족들 다 모이는 연휴에 ‘19금’ 드라마는 안 볼 거 같아.”(넷플릭스 이용자)넷플릭스가 추석 연휴 전날인 17일 오리지널 드라마 ‘오징어게임’을 공개했다. 통상적으로 이용자가 증가하는 5일 간의 연휴를 겨냥해 공개 날짜를 정한 것으로 분석된다.그러나 높은 수위가 흥행에 발목을 잡을 거란 목소리가 나온다. 폭력성과 선정성이 높아 가족이 모이는 명절에는 보지 않을 것 같다는 반응이 많다. 단순 ‘집콕족’만으로 초반 흥행에 성공할 수 있을지 관심이 주목된다.



넷플릭스 드라마 오징어게임 [넷플릭스 제공]넷플릭스는 17일 국내 제작 오리지널 드라마 ‘오징어게임’을 공개했다. 456억원의 상금이 걸린 의문의 서바이벌에 참가한 사람들이 최후의 승자가 되기 위해 목숨을 걸고 극한의 게임에 도전하는 이야기를 담았다. 이정재, 박해수, 정호연 등이 출연해 제작 단계부터 화제를 모았다.특히, 넷플릭스는 평소보다 사용량이 증가하는 연휴 바로 전날 신작을 공개해 ‘몰아보기족’을 노렸다.아이지에이웍스 모바일인덱스에 따르면, 지난해 추석 연휴가 포함된 9월 마지막주(28일~10월 4일)에 넷플릭스 주간사용자수는 546만명으로, 전주(495만명) 대비 50만명 이상 늘었다. 주간 사용시간도 1930만 시간으로, 전주(1714만 시간) 대비 약 12% 이상 증가했다.



'오징어게임' 심의 결과표 [넷플릭스]하지만 이같은 전략에도 ‘오징어게임’의 흥행은 미지수다. 공개 다음날인 18일 ‘오징어게임’은 넷플릭스 국내 콘텐츠 톱10에 들지 못했다. 공개 직후 대부분 톱10에 진입하던 지금까지의 오리지널 시리즈와 다른 모습이다.‘청소년 관람불가’로 설정된 높은 수위 때문에 가족 전부가 모이는 연휴 기간에 시청하기에는 적절하지 않기 때문이란 반응이 나온다.앞서 공개된 심의 결과표에 따르면 ‘오징어게임’은 주제, 선정성, 폭력성, 대사 분야에서 청소년 관람 불가 등급을 받았다. 이용자들 사이에서는 넷플릭스 오리지널 콘텐츠 중 ‘역대급 수위’라는 평가가 나왔다.폭력성, 잔인함 뿐 아니라 선정성까지 높아 혼자 연휴를 즐기는 성인 ‘집콕족’만을 겨냥할 수밖에 없다.현재 넷플릭스는 연말까지 이용자수 유지를 위한 ‘한방’ 작품이 필요한 상황이다. 11월 막강한 글로벌 OTT 강자 ‘디즈니플러스’가 국내 상륙을 공식화하면서 발등에 불이 떨어졌다. 지난달 공개된 오리지널 드라마 ‘D.P’도 입소문으로 흥행에 성공했지만, ‘소(小)박’에 그쳤다는 평가를 받고 있다.",105,https://n.news.naver.com/mnews/article/016/0001889563?sid=103
