title,date,main,section,url
[수면과 AI] ⑤ 수면 습관도 측정이 가능한가요?···나만의 최적 수면 패턴 만들기,2021.10.08. 오전 8:57,"윤인영 분당서울대병원 정신의학과 교수이동헌 에이슬립 대표



윤인영 분당서울대병원 정신의학과 교수[서울경제] 윤인영 분당서울대병원 정신의학과 교수여러분은 자신의 수면 습관을 얼마나 잘 알고 있나요? 잠자는 동안 코를 심하게 고는지, 자다가 자주 깨는 편인지, 자면서 나도 모르게 몸을 움직이는 건 아닌지 등 수면 도중의 다양한 습관을 혼자서 파악하기란 사실 쉽지가 않죠. 하지만 낮 동안 쾌적한 몸 상태를 유지하기 위해선 수면 패턴을 파악하고 그에 맞는 생활 습관을 길들일 필요가 있습니다. 물론 불면증이나 렘수면 운동 장애, 수면무호흡증 등의 수면 질환으로 숙면을 취하지 못하는 분들은 정밀한 검사가 필요하고요.정확한 진단을 위해 병원에선 수면다원검사를 진행합니다. 하지만 이 검사는 시간과 비용이 만만치 않게 들죠. 잠자는 동안 이뤄지는 검사이다 보니 검사 장비를 온몸에 부착하는 시간을 포함, 보통 밤 8시부터 다음 날 아침 7시 정도까지 소요됩니다. 검사 대기 시간도 상당합니다. 환자분들이 많이 몰릴 때는 대기 시간이 6개월이 넘게 걸린 적도 있죠. 검사 비용도 보험이 적용된 이후 환자 부담이 줄어들긴 했지만, 여전히 10만 원 후반대로 적지 않습니다. 게다가 수면다원검사는 수면무호흡증 환자에 한정해 보험이 적용되기에 불면증이나 렘수면운동장애로 검사를 받을 땐 보험 혜택을 받을 수 없죠.



일러스트 제공=에이슬립단순히 수면 습관이 궁금하거나 질환을 예방하고 싶은 분이라면 굳이 수면다원검사를 받지 않아도 될 겁니다. 하지만 수면 활동을 자체적으로 측정할 수 있는 기기가 마땅치 않은 게 사실입니다. 물론 시중에도 핏빗이나 애플워치 같은 웨어러블 기기들이 있지만, 이런 기기가 제공하는 정보는 정확도가 떨어집니다. 즉, 수면다원검사 결과와 상관성이 높지 않죠. 수면다원검사는 뇌파와 안구 움직임, 근전도, 심박 정보, 호흡 등 다양한 정보를 종합적으로 측정해 진단하는 반면, 이 기기는 심박 정보만을 기반으로 삼고 있기도 하고요. 게다가 기존 웨어러블 기기는 손목에 늘 착용하고 있어야 한다는 단점도 있습니다.



이동헌 에이슬립 대표이동헌 에이슬립 대표수면 습관을 측정하기 위해선 장시간 데이터를 축적해야 하는데, 잘 때마다 매일 기기를 착용한다는 건 번거로운 일입니다. 수면테크 기업 에이슬립은 기존 웨어러블 기기들의 이러한 불편함과 낮은 정확도를 보완하고자 그간 분당서울대학병원 내 유수의 수면 전문 의료진과 다양한 임상연구를 진행해왔습니다. 그 결과 비접촉 호흡 측정 기술을 고도화시킨 것은 물론, 호흡음 및 복부, 흉부의 움직임 정보에 인공지능(AI)을 도입함으로써 기존 수면 모니터링 기기들보다 높은 정확도를 확보하며 수면을 분석?측정할 수 있는 환경을 구축하고 있습니다.실제 호흡 측정을 통해 알 수 있는 정보는 다양합니다. 수면 도중의 호흡을 파악할 수 있다면 코골이, 수면무호흡증과 같은 수면 질환 관련 증상도 어느 정도 미리 파악할 수 있습니다. 코를 골거나 깊은 수면에 들지 못할 땐 호흡에 변화가 오거나 엉키게 되기 때문이죠. 에이슬립의 AI 기술은 수면 도중의 호흡음, 즉 들숨 날숨의 소리를 스마트폰이나 AI 스피커의 마이크로 녹음하고, 해당 음성을 통해 사용자의 수면 습관을 추정할 수 있습니다. 와이파이(Wi-fi) 무선신호를 기반으로 사용자의 복부와 흉부의 움직임도 잡아냅니다. 관련 정보들을 얻기 위해 수면다원검사에선 흉부, 복부에 검사 장비를 부착해야 하지만, 에이슬립 기술을 활용한다면 집에서도 비접촉으로 측정이 가능해지는 것이죠.



일러스트 제공=에이슬립무엇보다도 에이슬립은 AI 기술을 활용해 측정과 분석의 정확도를 눈에 띄게 끌어올렸습니다. 이는 실제 수면다원검사가 진행될 때 에이슬립 AI 기기를 옆에 두고 수면 단계별로 달라지는 미세한 차이들을 정교하게 학습시킨 결과입니다. 실제 에이슬립이 보유한 기술은 수면다원검사 결과와 74퍼센트에 가까운 일치도를 보이고 있습니다. 이는 학계에서 웨어러블 수면분석 기능을 탑재한 디바이스 중 가장 정확하다고 여겨지는 핏빗과 비교하더라도 높은 수준의 정확도입니다. 심지어 착용하지 않아도 됩니다.앞서 말씀드렸듯이 수면 습관 개선을 위해선 지속적인 수면 모니터링이 필요합니다. 수면 질환을 진단받은 이후에도 꾸준한 관리가 필수이고요. 에이슬립은 긴 수면 시간 동안 비접촉 방식으로 쉽고 편하게, 하지만 정확하게 측정할 수 있는 수단을 제공하는 데 앞장서고자 합니다. 체중계에 올라가 몸무게를 점검하듯, 수면 활동을 수시로 점검할 수 있는 가정용 수면 기기가 널리 사용될 수 있는 날이 오길 기대해봅니다.",105,https://n.news.naver.com/mnews/article/011/0003970877?sid=103
"툴젠, 세계 최대 CMT 환우재단과 치료제 개발 협력",2021.10.08. 오전 9:20,"내년 임상시험 신청 계획



툴젠은 샤르코-마리-투스병(CMT) 관련 세계 최대 비영리 지원 재단인 CMTA와 치료제 개발을 위한 협력관계(파트너십)을 구축했다고 8일 밝혔다. 양 기관은 CMT의 대표적인 아형인 'CMT1A' 질병을 일으키는 'PMP22' 유전자의 과발현을 제어하는 유전자교정 치료제를 개발할 계획이다. CMT1A 치료제 프로그램(TGT-001)과 관련해 과학 및 개발 자문단과의 협업, 미국 내 임상시험 준비 등에 협력한다.CMTA는 전문가로 구성된 자문단 'STAR'를 통해 툴젠의 TGT-001 개발에 있어 자문 및 협력 연구를 진행한다.CMT은 유전성 말초신경병증이다. 유전질환 중 발생빈도가 높은 희귀질환이지만 아직 치료제가 없다. 현재까지 규명된 CMT의 원인 유전자는 90여종이다. CMT 환자의 약 50%는 PMP22 유전자의 중복 돌연변이에 기인한다. 한국에 약 9000명, 세계에 150만명의 환자가 있는 것으로 추산된다. CMTA의 최고경영자(CEO)인 아미 그레이는 ""툴젠과 같은 기업과 협력을 통해 CMT 치료제를 최대한 빠르게 환우들이 사용할 수 있도록 하는 것이 CMTA의 중요한 목적""이라며 ""12년 전 STAR 자문 네트워크의 시작 이래 40개에 가까운 제약기업, 바이오텍 및 선도 연구진과 협력을 확대하고 있다""고 말했다. 툴젠의 치료제개발파트장인 이재영 박사는 ""CMTA와의 협력을 통해 TGT-001이 동물모델들에서 시험될 수 있는 기회를 가질 수 있다""며 ""임상시험에 더 가까워지는 기회로 만들겠다""고 했다.  툴젠은 내년 TGT-001의 임상시험을 신청할 계획이다. 한민수 기자",105,https://n.news.naver.com/mnews/article/015/0004613934?sid=103
웨이브에서 프랑스 인기 드라마 본다… '프랑스 드라마 페스티벌' 개최,2021.10.08. 오후 12:04,"필립 르포르 대사 웨이브 방문…이태현 대표와 교류방안 논의이달 웨이브에서 '프랑스 드라마 페스티벌'이 열린다.



 이태현 대표(오른쪽)와 필립 르포르 대사가 기념촬영하고 있다.  [사진=웨이브]콘텐츠웨이브(대표 이태현)는 필립 르포르 주한 프랑스 대사가 7일 오후 여의도 웨이브 사옥을 방문, 이태현 대표와 만났다고 8일 발표했다.이태현 대표와 필립 르포르 대사는 양국 미디어 산업 현황에 대해 의견을 교환하고 영상콘텐츠 분야 문화교류에 적극 협력키로 했다.양측은 특히 세계적으로 급성장하고 있는 온라인 플랫폼이 팬데믹 시대 문화교류의 중심 역할을 수행하고 있는 점에 대해 의견을 같이하며 OTT를 통한 교류 협력 방안을 지속 논의해 가기로 했다.이와 관련 웨이브는 프랑스 대사관과 협력해 이달 중순 '프랑스 드라마 페스티벌(Fede)'을 온라인으로 진행하기로 했다. 프랑스에서 반향을 일으킨 주요 작품 ▲ 아무튼 ▲ 셰엔과 롤라 ▲ 엘리트 스파이 등을 웨이브 이용자들에게 한달 간 무료제공 할 예정이다.이태현 대표는 ""전통적 문화강국 프랑스와 세계 문화예술계에 새로운 바람을 일으키고 있는 대한민국이 온라인 플랫폼을 통해 더 활발한 교류를 이어갈 수 있도록 지원할 것""이라고 말했다.필립 르포르 대사는 ""문화 교류는 우방국 간 이해를 증진시킬 수 있는 가장 좋은 수단""이라며 ""한국의 대표 OTT 플랫폼 웨이브와 함께하면서 훌륭한 교류 성과를 기대하고 있다""고 말했다.",105,https://n.news.naver.com/mnews/article/031/0000627910?sid=103
"프로토콘 메인넷, 크립토 전문펀드 전략적 투자 유치",2021.10.08. 오후 2:19,"프로토콘은 크립토펀드 블록워터 매니지먼트로부터 전략적 투자를 유치했다고 8일 밝혔다. 프로토콘은 국내 기술진이 자체 개발한 블록체인 메인넷으로, 사용 수수료를 탈중앙화 형태로 지급하는 것이 특징이다.메인넷은 블록체인 프로젝트를 출시해 실제 운영하는 독립 네트워크 플랫폼이다. 이더리움, 카르다노 등을 포함한 블록체인 프로젝트 상위 30위 중 14개가 메인넷 프로젝트일 정도로 글로벌 기술 경쟁이 치열한 상황이다. 프로토콘은 메인넷의 사용 수수료 납부 방식에 탈중앙화 금융(디파이) 방식인 ‘피파이(FeeFi)’를 도입해 사용성을 개선했다. 프로토콘은 최근 마인크래프트 기반 게임 ‘블록시티’, 분산 신원인증 서비스 ‘프로토콘 DID’도 개발 중이다. 이를 기반으로 메타버스, 분산 신원인증, NFT 관련 업체들과 프로토콘 생태계 구축에 집중한다는 계획이다.투자를 진행한 블록워터 매니지먼트는 지난 2018년 출범한 크립토 전문 헤지펀드다. 이오스(EOS) 프로젝트에 초기 투자를 단행했던 곳으로, 이후 팬텀 등 블록체인 프로젝트 30여 개를 이끈 바 있다. 슈퍼트리의 플레이댑(PLA) 토큰 세일을 자문하기도 했다.이이삭 블록워터 이사는 “프로토콘은 블록체인 원천기술을 직접 개발한 프로젝트로, 글로벌 메인넷 시장에서 충분한 경쟁력을 보유한 상태”라고 전했다.전명산 프로토콘 리더는 “블록체인 전문 투자자로부터의 자금 유치는 기술 검증 측면에서 의미 있는 일”이라며 “프로토콘을 글로벌 프로젝트로 성장시키겠다”고 밝혔다.이시은 기자",105,https://n.news.naver.com/mnews/article/015/0004614068?sid=103
"야놀자, 대전 고객센터 신규 오픈…""지역 일자리 창출""",2021.10.08. 오후 2:12,"기사내용 요약""지역 상생 선순환 구조 구축 기대""



[서울=뉴시스] 오동현 기자 = 글로벌 여가 플랫폼 기업 야놀자가 지역 일자리 창출을 위해 대전 고객센터를 신규 오픈했다고 8일 밝혔다. 야놀자는 코로나19 사태 장기화로 인해 침체된 지역과의 상생을 위해 비수도권에 고객센터를 선보이고 있다. 지난 춘천센터 개관 이후 인력·인프라 등을 고려해 대전광역시에 두 번째 지역 거점센터를 마련했다. 야놀자는 총 80석 규모의 대전센터를 통해 청년·경력단절여성 등 대전지역 내 고용취약층을 위한 신규 일자리를 창출하고 지역경제 발전에 기여한다는 계획이다.야놀자는 ESG(환경·사회·지배구조) 경영의 일환으로, 지역의 코로나19 위기 극복을 지원하고 있다. 특히 여행업계와 경제 회복을 위해 강원도, 부산, 경상도 등과의 민관협력 프로젝트를 다수 진행 중이다. 천경훈 야놀자 비즈니스그룹장은 “연이은 지역 거점 고객센터 오픈을 통해 신규 일자리를 창출하고 경제활동을 촉진하는 등 지속가능한 지역 상생 구조를 다지고자 한다”면서 “앞으로도 야놀자만의 전문성과 인프라를 활용한 다양한 상생 방안을 모색해 침체된 경제에 활력을 불어넣을 계획”이라고 말했다.",105,https://n.news.naver.com/mnews/article/003/0010759490?sid=103
아이폰13 9분만에 예약마감…구매자 10명중 8명 MZ세대,2021.10.08. 오후 12:43,"이동통신 3사가 8일 애플 아이폰 13을 정식 출시하고 판매를 시작했다. 이통사는 최대 45만원(KT)의 공시지원금과 함께 다양한 혜택과 이벤트를 내걸며 고객 유치전에 나섰다.      ━   SKT, 에어팟 프로ᆞ충전기 무료 제공      



SK텔레콤은 8일 T월드 매장과 공식 온라인몰 T다이렉트샵에서 아이폰 13 시리즈를 판매한다.            SK텔레콤은 지난 1일부터 일주일간 예약 판매를 진행한 결과 자사 온라인몰인 T다이렉트샵에서 1차 예약 판매 물량이 9분 만에 마감됐다고 밝혔다. 전작인 아이폰12의 경우 1차 예약 마감에 3시간 30분이 소요됐다. SK텔레콤은 1차 예약 고객을 상대로 새벽 배송·당일 택배를 시행해 8일에 바로 단말을 받을 수 있도록 했다.       SKT는 일정 요금제 이상 가입 고객을 대상으로 에어팟 프로ᆞ맥세이프 듀오 충전기를 무료로 제공한다. 또 추첨을 통해 아이맥ᆞ맥북에어ᆞ아이패드 프로 등의 제품과 아이폰 정품 액세서리 할인권 등을 제공한다. SK텔레콤은 15일 가수 아도이(ADOY)를 초청해 랜선 미니콘서트를 열 예정이다.      ━   KT, 1000명 대상 8일 0시 제품 배송       



KT는 공식 온라인몰 KT샵을 통해 선착순 1000명을 대상으로 8일 0~1시사이에 아이폰 13을 배송해주는 ‘미드나잇배송’을 운영했다. [사진 KT]           KT는 온라인몰 KT 샵에서 선착순 1000명 한정으로 예약을 진행한 ‘미드나잇 배송’이 30분 만에 마감되며 소비자의 관심을 끌었다. 미드나잇배송은 공식 출시일 8일 0시부터 1시간 이내에 배송해주는 서비스다.       이와 함께 KT는 에어팟 프로를 무료로 제공하는 ‘에어팟 초이스’ , 1년 뒤 새 아이폰으로 부담 없이 교체할 수 있는 ‘아이폰 13 구독’ , 아이폰은 물론 아이패드·애플워치·에어팟 등 주변 기기까지 보상해 주는 ‘아이 투게더’ 보험 등을 출시했다. 특히 KT에서 아이폰을 4회 이상 구매한 고객 중 1300명을 추첨해 당일 배송 서비스와 함께 맥세이프 충전기, 고속 충전 어댑터 등 8만원 상당의 애플 정품 액세서리를 제공한다.      ━   LG유플, 에어팟팩·구독콕 서비스        



LG유플러스의 아이폰 13 론칭 행사에 참여한 '방구석리뷰룸', '에디터H', '샘바이펜' 등이 제품을 공개하고 있다. [사진 LG유플러스]            LG유플러스는 7일 오후 11시 30분부터 한 시간 동안 ‘아이폰 13 레벨업 페스타’ 론칭 행사를 비대면으로 진행했다. 정보기술(IT) 크리에이터인 ‘방구석 리뷰룸’과 ‘에디터H(디에디트)’, 팝아트 작가 ‘샘바이펜’을 초청해 아이폰 13 제품과 혜택을 소개했다. 행사 중 추첨을 통해 1000명 이상 고객에게 아이폰 13 프로, 아이패드 에어 6, 애플 워치 SE 등 경품을 증정했다.       LG유플러스는 이와 함께‘에어팟팩’과 ‘구독콕’ 을 선보였다. 에어팟팩은 일정 금액 이상 요금제 가입 고객을 대상으로 에어팟 유선 충전 모델을 부담 없는 가격으로 제공한다. 구독콕은 멤버십 VIP 등급 이상 고객을 대상으로 ‘네이버플러스 멤버십’ 또는 ‘밀리의 서재’를 무료로 이용할 수 있는 서비스다.       한편 이통사가 1일부터 일주일간 사전 예약을 받은 결과 모델 중에선 아이폰 13 프로 제품이 가장 큰 인기를 끌었고, 색상 중에선 시에라 블루가 가장 인기가 높은 것으로 나타났다. KT 공식 온라인몰인 KT샵에 따르면 예약 신청자의 절반(50.8%)이 아이폰13 프로 모델을 선택했고, 연령대는 MZ세대(80년대 이후 출생한 젊은층)로 불리는 20·30세대가 81%를 차지했다.",105,https://n.news.naver.com/mnews/article/025/0003140976?sid=103
"KT-한국건강증진개발원, 디지털 헬스케어 환경 조성 협약",2021.10.08. 오전 10:47,"송재호 KT AI/DX융합사업부문장(앞줄 왼쪽)과 조현장 한국건강증진개발원장(앞줄 오른쪽)KT가 한국건강증진개발원과 '디지털 헬스케어 환경 조성을 위한 업무협약'을 체결했다.양 기관은 △어르신 전용 '오늘건강' 앱과 사물인터넷(IoT) 디바이스의 연동 지원 △건강관리를 위한 디지털 헬스케어 프로그램 공동 개발 및 확산 △어르신 대상 '오늘건강' 앱 및 KT 케어로봇 사용법 교육 등을 추진할 예정이다.KT는 인공지능(AI) 기술과 로봇, IT 역량을 한국건강증진원이 추진하는 건강증진 사업에 적용하고, 디지털 전환에 협력하기로 했다.한국건강증진개발원은 KT 기술지원 및 교육 활동을 통해 기존에 추진하던 'AI·IoT 기반 어르신 건강관리 시범사업'과 '오늘건강' 앱 서비스를 안정화시키고, 이를 전국 보건소들로 확산 및 안착시킨다는 계획이다.한국건강증진개발원의 'AI·IoT 기반 어르신 건강관리 시범사업'은 보건소에서 가정방문을 통해 진행하던 기존의 건강관리 업무를 디지털 기반으로 전환시키는 것이다.송재호 KT AI/DX융합사업부문장(부사장)은 “국민건강증진 개선과 소외된 계층을 위해 KT 디지털 기술을 적극적으로 공유하겠다”고 말했다.",105,https://n.news.naver.com/mnews/article/030/0002974190?sid=103
숙취해소제 효과 있나…음용자 3명 중 2명 효과 못 느껴,2021.10.08. 오후 1:46,"음주자 절반 이상이 숙취해소제 음용 경험…과학적 근거 없으면 퇴출숙취해소제를 마신 3명 중 2명은 숙취가 해소에 도움 받지 못한 것으로 조사됐다.



(사진=한국건강증진개발원)보건복지부와 한국건강증진개발원은 지난 7월 실시한 ‘2021년 대국민 음주실태조사’ 결과에 따르면, 성인 55.7%가 숙취해소제를 마셔본 경험이 있는 것으로 나타났다.하지만 실제 숙취해소에 도움이 되었는지에 대해서는 ‘그렇지 않은 편’(16.3%), ‘보통이다’(48.9%)로 절반 이상(65.2%)이 효과를 체감하지 못한 것으로 조사됐다.숙취해소제 음용으로 인한 음주량 변화에 응답자의 82.7%는 ‘변화가 없다’고 답했으나, 12.6%는 ‘음주량이 증가했다’고 응답했다. 숙취해소제의 음용 형태는 음주 후 54.7%, 음주 전 41.8%였으며, 3.5%는 음주 중에 음용한다고 답했다.성별로는 여성(40.7%)보다 남성(59.3%)이 숙취해소제 음용 경험이 더 높은 것으로 나타났다.조현장 한국건강증진개발원 원장은 “국민들이 숙취해소제를 쉽게 접할 수 있는 만큼 체감하는 효과와 관계없이 많이 이용하고 있다”며 “숙취해소제에 대한 공격적 마케팅이 늘고, 일부 음주자에게는 음주량 증가에 영향을 미치는 것으로 나타난 만큼 주류 관련 마케팅에 대한 모니터링을 강화하고, 올바른 건강정보를 제공해 음주조장환경을 개선해 나가겠다”고 밝혔다.



(사진=한국건강증진개발원)한편 식품의약품안전처 역시 숙취해소제의 효능에 대한 임상적 근거 미약을 근거로 지난해 12월 ‘일반식품 기능성 표시제’ 시행 및 규제 강화를 발표한 바 있다.숙취해소제가 음주로 인해 생기는 증상을 일시적으로 완화시킬 수는 있으나, 주장하는 효능에 대한 과학적 근거가 미흡하고, ‘일반식품’으로 분류된 숙취해소제가 건강기능식품이나 의약품으로 오인될 소지가 있어 2024년까지 과학적인 근거를 입증하지 못할 경우 ‘숙취해소’ 등의 표현을 쓸 수 없도록 규정한다는 내용이다.",105,https://n.news.naver.com/mnews/article/092/0002235667?sid=103
"SK넥실리스, 정읍서 청년 창업자 공간 ‘공유가게’ 오픈",2021.10.08. 오전 11:59,"[디지털데일리 김도현 기자] SK넥실리스가 지역사회 공헌에 나선다.   8일 SK넥실리스는 생산시설이 있는 전북 정읍에 청년 창업자 공간 ‘공유가게’를 오픈했다고 밝혔다.    SK넥실리스는 지난 7일 정읍시와 지역 내 전통시장 인근 조성한 공유가게에서 1·2호점 개소식을 열었다. 양 기관이 추진 중인 지역 재발견 프로젝트 ‘조인 정읍’의 첫 번째 결실이다. 행사에는 김영태 SK넥실리스 대표와 유진섭 정읍시장, 김정현 언더독스 대표 등이 참석했다.   공유가게는 청년 창업자들의 판로를 열기 위한 공간이다. 1·2호점은 샘고을 시장 인근 빈 점포를 리모델링해 만들었다. 1호점에 입점한 정희진 푸드디렉터의 ‘레스토랑 22’는 지역 특산물 한우, 귀리 등으로 파인 다이닝을 선보인다. 2호점에선 군산의 라이프스타일 기업 ‘모어앤모어’가 내장산 등 정읍 명소를 모티브로 삼은 조향 제품 등을 판매하는 편집샵을 운영한다.   김영태 대표는 “SK넥실리스는 지역사회 일원으로서 많은 사람들이 정읍을 방문해 즐길 수 있는 콘텐츠를 만들어내고 이를 통해 지역경제 활성화에 기여하는 등 사회적 가치를 늘려가겠다”고 말했다.",105,https://n.news.naver.com/mnews/article/138/0002111377?sid=103
"휴메딕스, 초저분자 히알루론산 원료의약품 등록",2021.10.08. 오전 10:42,"점안제 시장 공략 '속도'휴메딕스는 식품의약품안전처에 독자 개발한 초저분자 히알루론산나트륨(히알루론산)의 원료의약품(DMF) 등록을 완료했다고 8일 밝혔다.초저분자 히알루론산은 주로 0.2% 이상의 고농도 점안제에 사용되는 원료란 설명이다. 히알루론산의 특성에서 오는 단점을 보완, 수분유지능은 높이는 반면 점도를 낮춰 사용감을 개선했다.점안제에서 히알루론산 농도가 증가하면 수분유지능이 증진되는 장점이 있다. 그러나 고분자인 물질적 특성 때문에 점도도 같이 증가해 안구에 자극을 주거나 눈을 깜빡일 때 끈적함, 뻑뻑한 느낌 등을 동반한다. 휴메딕스는 초저분자 히알루론산을 활용해 점안제 위탁생산(CMO) 사업의 경쟁력을 높일 계획이다. 나아가 안과수술보조제 관절주사제 필러 등 활용 범위를 넓힐 방침이다. 특히 기존의 고분자 및 저분자 히알루론산과 복합해 미용성형용 필러 개발도 추진한다.김진환 휴메딕스 대표는 ""기술 난이도가 높은 초저분자 히알루론산까지 확보해, 휴메딕스의 히알루론산 제조·생산 기술력을 다시금 입증했다""며 ""점안제뿐 아니라 필러 사업에 탄력이 붙을 것으로 기대한다""고 말했다. 한민수 기자",105,https://n.news.naver.com/mnews/article/015/0004613981?sid=103
