title,date,main,section,url
"소송으로 흥한 애플 소송으로 망할 판?…애플 vs 퀄컴 특허소송, 퀄컴 승기",2018.12.21. 오전 11:50,"- 중국 이어 독일 애플 아이폰 판매금지…애플 vs 퀄컴, 특허사용료 분쟁   [디지털데일리 윤상호기자] 소송으로 재미를 봤던 애플이 소송 탓에 망할 판이다. 제조사와 소송전은 우세를 점했지만 부품업체와 소송전은 열세에 빠졌다. 애플과 퀄컴의 분쟁이 퀄컴에게 유리한 방향으로 흐르고 있다.   21일 업계에 따르면 독일 뮌헨 지방법원은 지난 20일(현지시각) 애플이 퀄컴 특허를 침해했다며 애플 스마트폰 일부 제품 판매금지를 명령했다. ▲아이폰7·7플러스 ▲아이폰8·8플러스 ▲아이폰X(10) 등이다. 애플이 현재 판매하고 주요 제품이다. 애플은 이에 앞서 중국에서도 판매금지 판결을 받았다.   애플과 퀄컴은 특허 소송 중이다. 애플은 퀄컴의 애플리케이션 프로세서(AP)가 너무 비싸다며 2017년 소송을 냈다. 퀄컴 통신칩 구매를 끊었다. 인텔 통신칩을 사용했다. 퀄컴은 특허침해로 애플에게 맞소송을 제기했다. 애플의 공세는 퀄컴이 각국 정부에게 과도한 기술사용료를 받는다는 조사를 받은 것과 연관 있다. 한국 공정거래위원회와도 다투고 있다. 애플은 정부 조사에 적극 협력했다. 양사 소송은 세계로 확산했다.   애플의 전략은 삼성전자와 대결에서는 재미를 봤다. 삼성전자와 소송도 애플이 먼저 제기했다. 2011년 시작했다. 맞소송은 전 세계로 확대했다. 판매금지 승패를 주고받았다. 애플은 삼성전자 부품 사용을 줄였다. 소송은 2018년 양사 합의로 끝났다. 미국 배심원단의 손이 애플로 기운 것이 컸다. 논란이 있었지만 판결을 뒤집을 수는 없었다. 삼성전자는 애플에게 6억7000만달러(약 7500억원)의 배상금을 지급했다.   하지만 애플과 퀄컴은 모두 미국 회사다. 삼성전자와 애플 때처럼 무게추가 한 쪽으로 기울 우려가 없다.   애플은 판매부진을 겪고 있다. 올해 내놓은 ▲아이폰XS ▲아이폰XS맥스 ▲아이폰XR 3종이 기대치에 미치지 못하고 있다. 애플은 신제품을 선보이면 기존 제품은 가격을 내려 중저가를 공략한다. 신제품은 안 팔리고 중저가는 못 파는 상황에 놓였다. 퀄컴과 거래를 끊으면서 5세대(5G) 이동통신 스마트폰 진입도 늦었다. 인텔 5G 통신칩은 2019년 말에 나올 예정이다. 제품화를 고려하면 2020년 5G폰을 내놓을 수 있다는 뜻이다. 스마트폰 점유율은 지난 2분기부터 3위로 한 계단 내려왔다. 악재의 연속이다.   한편 양사 소송도 삼성전자 애플 소송처럼 합의로 끝날 전망이다. 누가 누구에게 돈을 주고 끝날지가 관전 포인트다. 현재로썬 애플이 퀄컴에 돈을 줘야 할 가능성이 높다.   <윤상호 기자>crow@ddaily.co.krIT언론의 새로운 대안[디지털데일리]IT정보의 즐거운 업그레이드[딜라이트닷넷]뉴스채널 설정 - 네이버 메인에서 디지털데일리 뉴스를 볼 수 있어요.윤상호(crow@ddaily.co.kr)<저작권자 © 디지털데일리 무단전재-재배포금지>",105,https://n.news.naver.com/mnews/article/138/0002068641?sid=103
"SK텔레콤, 'T괌·사이판패스' 본격 시행",2018.12.21. 오전 10:06,(서울=연합뉴스) SK텔레콤이 'T괌·사이판패스' 본격 시행에 맞춰 괌·사이판 전용 요금제 2종을 선보이며 고객 선택권 확대는 물론 고객 혜택도 강화한다고 21일 전했다. 2018.12.21 [SK텔레콤 제공]    photo@yna.co.kr▶뭐 하고 놀까? #흥  ▶쇼미더뉴스! 오늘 많이 본 뉴스영상 ▶네이버 홈에서 [연합뉴스] 채널 구독하기,105,https://n.news.naver.com/mnews/article/001/0010539258?sid=103
"네오위즈플레이스튜디오, 블록체인 게임 ‘솔리테어 듀얼’ 출시",2018.12.21. 오후 5:13,"이오스 기반으로 게임의 전 과정을 블록체인에 기록, 공개 투명성 높여네오위즈플레이스튜디오(대표 오은석)는 자사가 개발한 블록체인 기반 게임 ‘솔리테어 듀얼 온 이오스(Solitaire Duel on EOS, 이하 솔리테어 듀얼)’을 글로벌 출시한다고 21일 밝혔다.솔리테어 듀얼은 자사가 서비스 중인 모바일 게임 ‘월드 오브 솔리테어(World of Solitaire)’에 블록체인 기술을 접목해 새롭게 출시한 1:1 대전 게임이다. 윈도우 기본 게임으로 유명한 카드게임 ‘솔리테어’의 게임 룰을 그대로 사용한다. 이용자는 일정 금액의 암호화폐인 이오스(EOS)를 사용해 대전에 참가할 수 있으며 이는 승자에게 상금으로 지급된다. 현재는 1:1 모드만 가능하나 이후 토너먼트 방식도 가능하도록 업데이트할 예정이다.솔리테어 듀얼은 게임 진행 시 필요한 재화를 암호화폐로 사용하는 것뿐만 아니라, 게임 참여, 사용자 매칭, 게임 결과 및 상금 지급 등 게임의 모든 과정을 블록체인에 투명하게 기록, 공개해 신뢰성을 높였다.HTML5 기반으로 별도의 앱 설치 없이 PC와 모바일에서 웹브라우저를 통해 쉽고 간단하게 게임을 즐길 수 있다. 단, 국내에서는 접속이 불가하다.한편, 네오위즈플레이스튜디오는 블록체인 관련 조직 ‘NEOWIZ PLAY STUDIO BLOCKCHAIN LAB(NBLAB)’을 신설, 해당 프로젝트를 진행 중이다. NBLAB은 게임 개발, 운영 경험을 살려 출시 게임의 서비스 고도화 작업과 함께 블록체인 기반 대전형 게임 라인업을 지속 확장해 나갈 계획이다. 이 외에도 NBLAB은 공식 홈페이지를 통해 블록체인 관련 연구 결과물을 공유해 나가고 있다. 전자신문인터넷 소성렬 기자 hisabisa@etnews.com▶ 네이버 모바일에서 [전자신문] 채널 구독하기▶ 전자신문 바로가기 [Copyright ⓒ 전자신문 & 전자신문인터넷, 무단전재 및 재배포 금지]",105,https://n.news.naver.com/mnews/article/030/0002770124?sid=103
"SKB '살아있는 동화', 2018년 핀업 디자인 어워드 최고상",2018.12.21. 오후 5:33,"아이들의 눈높이에 맞춘 디자인과 사용편의성 인정B tv 홈화면 ‘UI 5.0’과 신규 리모컨 ‘보이스틱’은 어워드 본상 수상[이데일리 김현아 기자]



]SK브로드밴드 핀업 디자인 어워드 수상모습SK브로드밴드(사장 : 박정호)가 자사의 키즈서비스인 ‘살아있는 동화’가 ‘2018년 핀업 디자인 어워드’에서 최고상인 Best of Best를 수상했다고 21일 밝혔다. B tv 홈화면 ‘UI 5.0’과 신규 리모컨 ‘보이스틱’은 각각 ‘Finalist’상과 ‘핀업 Best 100’에 선정됐다.올해로 22회째를 맞는 핀업 디자인 어워드는 한국산업디자인협회가 주최하고 산업통산부가 후원하는 산업 디자인 공모전으로, 국내 3대 디자인상으로 꼽힌다.‘아이가 스스로 해보는 TV, 살아있는 동화’ 서비스는 아이의 눈높이에 맞춘 디자인과 쉽게 사용 할 수 있는 UI/UX로 아이들에게 흥미와 높은 몰입도를 제공하고 있는 점이 좋은 평가를 받았다. 이외 ‘UI 5.0’은 B tv 고객별 맞춤 콘텐츠 서비스와 풍성한 정보를 세련된 디자인으로 표현한 점, ‘19년 상반기 출시 예정인 음성인식 리모컨 ’보이스틱’은 삼각형 스탠드 형태의 작고 부드러운 곡면 디자인으로 누구나 쉽게 잡고 사용할 수 있다는 점이 이번 수상의 사유로 꼽힌다.



신규리모컨 보이스틱김현아 (chaos@edaily.co.kr)네이버에서 이데일리 [구독하기▶]빡침해소! 청춘뉘우스~ [스냅타임▶]＜ⓒ종합 경제정보 미디어 이데일리 - 무단전재 & 재배포 금지＞",105,https://n.news.naver.com/mnews/article/018/0004277894?sid=103
"한컴MDS, 국립중앙박물관에 큐레이팅봇 개시",2018.12.21. 오후 1:49,"음성인식, 통·번역, 자율주행 기술 등 적용(지디넷코리아=황정빈 기자)한컴MDS(대표 장명섭)는 한국문화정보원과 함께 국내 최초 지능형 문화정보 큐레이팅봇 ‘큐아이’ 서비스를 개시한다고 21일 밝혔다.‘큐아이’는 자율주행 및 추종기능을 통해 박물관의 다양한 공간을 이동하면서 관람객에게 전시품에 대한 상세한 안내 서비스를 제공한다. 관람객이 궁금한 점을 질문하면 이에 대한 답변도 제공한다.또 통·번역 서비스를 통해 외국인 관광객들과의 의사소통 문제를 해결하고, 최신 ICT 기술이 적용된 문화와 로봇의 융복합 체험 기회를 제공할 예정이다.한컴MDS는 ‘큐아이’에 자사가 인수한 한컴로보틱스의 자율주행 로봇 제어 기술, 한컴그룹 계열사 한컴인터프리의 음성인식 기술과 다국어 통·번역 기술, 아이브릭스의 차별화된 자연어 처리기술 등이 적용됐다고 설명했다.



한컴MDS(대표 장명섭)는 한국문화정보원과 함께 국내 최초 지능형 문화정보 큐레이팅봇 ‘큐아이’ 서비스를 개시한다고 21일 밝혔다. (사진=한컴MDS)우준석 한컴MDS 부사장은 “문화(도슨트), 인공지능(SW), 로봇(HW)이 결합된 국내 최초의 지능형 문화정보 큐레이팅봇을 성공적으로 개발, 공급한 것을 계기로 다른 박물관 및 미술관, 도서관 등에도 확대 적용할 수 있도록 최선을 다하겠다”고 말했다.한편, 지능형 문화정보 큐레이팅봇 사업은 과학기술정보통신부에서 추진하는 ‘2018년 ICT기반 공공서비스 촉진사업’과제 중 하나로 한국문화정보원이 주관하고, 한컴MDS와 아이브릭스가 개발에 참여했다.현재 ‘큐아이’ 서비스는 국립중앙박물관과 국립나주박물관에서 만나볼 수 있다.황정빈 기자(jungvinh@zdnet.co.kr)  ▶ 네이버 채널에서 ‘지디넷코리아’를 구독해주세요",105,https://n.news.naver.com/mnews/article/092/0002153074?sid=103
[양종구의 100세 시대 건강법]운동 아무리 좋아도 본인이 안하면…결국 ‘의지’의 문제,2018.12.22. 오후 2:05,"‘말을 냇가로 끌고 가도 물을 먹일 수는 없다’는 말이 있는 것처럼 운동이 아무리 좋아도 본인이 직접 하지 않으면 무용지물이다.  과거 미국 체력스포츠 대통령 자문위원회는 “만약 운동을 알약처럼 포장할 수만 있다면 가장 많이 처방되고 가장 좋은 효과를 거두는 약이 될 것이다”고 밝힐 정도로 운동이 인간에게 다양한 혜택을 가져다주고 있다고 분석하고 있다. 최근 다양한 연구 결과도 나오고 있고 건강 관련 온갖 매체에서도 보도하고 있다. 그런데 사람들은 왜 이렇게 좋은 운동을 하지 않는 걸까.  결국 심리적인 문제다. 의지의 문제라는 것이다. 하고 싶은 마음이 있느냐 없느냐가 가장 중요하다. 운동을 즐기는 사람은 운동을 하고 싶은 이유가 있다. ‘살을 빼겠다’ ‘건강을 지키겠다’ ‘멋진 몸매를 만들어 보겠다’ 등등. 운동을 하지 않는 사람도 역시 이유가 있다. ‘운동을 하려고 해도 시간이 없다’ ‘운동하느니 잠이라도 한숨 더 자자’ 등등.  운동을 하는 사람과 하지 않은 사람의 차이는 단 하나다. 의지의 문제다.  운동이 좋다는 것을 알고도 하지 않는 것을 ‘토마토 효과’(Tomato Effect)라고 한다. 토마토 효과란 어떤 요법이 효과가 있음에도 불구하고 사람들이 외면하는 현상을 말한다. 토마토는 유럽에서 이미 1500년대부터 식품으로 이용됐지만 북미에서는 많이 먹으면 죽는다는 믿음 때문에 1800년대까지 금기 식품이었다. 이처럼 토마토의 뛰어난 영양 가치에도 불구하고 특별한 이유 없이 외면당한 현상에서 나온 용어다. 운동도 그 효과가 뛰어남에도 불구하고 실천하는 사람이 많지 않은 것이 사실이다. 운동실천율이 낮은 것도 토마토효과로 설명할 수 있다.   자 여기서 자기신체평가(PSDQ=Physical Self Description Questionnaire)서를 작성해보자. 운동을 하지 않고 있는 자신의 신체가 얼마나 형편없는지를 느껴 보고 다짐을 하는 시간이다.   PSDQ는 ①스포츠를 얼마나 잘하나 ②날씬한 정도(체지방율) ③외모 ④ 건강 ⑤신체활동 ⑥자기존중감 ⑦유연성 ⑧지구력 ⑨근력 ⑩신체전반 등에 대해 평가하는 것으로, 자신의 신체능력과 신체상태를 자체적으로 평가할 수 있는 질문지다. 말 그대로 신체의 능력과 상태를 간편하게 측정할 수 있어 운동 필요성과 동기유발에 매우 효과적인 방법으로 통한다. 질문수가 많아 컴퓨터를 통해 분석해야 하지만 여기서는 간단하게 자신의 신체 상태를 체크해보자.▶PSDQ를 활용한 자기신체평가  위 문항을 참고해서 점수를 부여한다. (R)이란 표시는 점수를 거꾸로 매기면 된다. 만약 전혀 그렇지 않을 경우 매우 그렇다로 표시하면 된다. 그리고 다음 표에 비슷한 항목을 참고해 체크를 해보자. 자신의 그래프가 클수록 좋다. 또 울퉁불퉁하기 보다는 고른 모양일수록 좋다. 낮은 요인은 중점적으로 향상시킬 필요가 있다. 



PSDQ를 활용한 자기신체평가 결과 예시.양종구 기자 yjongk@donga.com▶ 네이버에서 [동아일보] 채널 구독하기▶ 증발에 운다…그렇게 부모가 되지 못했다▶ “말이 안 통해”… 극과 극이 만난다면?ⓒ 동아일보 & donga.com, 무단 전재 및 재배포 금지",105,https://n.news.naver.com/mnews/article/020/0003188913?sid=103
로봇세상에서 돋보인 '엣지컴퓨팅',2018.12.22. 오전 7:00,"[아시아경제 황준호 기자] 다재다능한 로봇이 눈에 들지 않았다. 20일 SK텔레콤의 5G 스마트팩토리 솔루션을 발표 현장에서 가장 눈에 띈 것은 5G 모바일엣지컴퓨팅(MEC)이었다. 역설적이었다. MEC는 네트워크 기기들이 가득한 검은 철제 박스에 불과했다. 그런데 사람을 피해 물건을 나르는 로봇이나 3D비전을 통해 맥주를 따라주는 로봇, 불량을 잡아내는 로봇보다 돋보였다.MEC의 가치가 빛났다. MEC는 기지국에 구축한 클라우드 컴퓨팅 시스템이다. 현재 일반적인 스마트폰 데이터는 기지국을 거쳐 데이터센터를 거쳐 다시 폰으로 돌아온다. MEC는 이 같은 정보처리 과정을 '스마트폰-기지국'으로 줄였다. 기지국 내 컴퓨팅 기능을 넣으면서 데이터센터를 거치지 않아도 된다.이는 즉각적인 응답을 얻을 수 있게 한다. 반응속도를 획기적으로 올릴 수 있는 것이다. 5G MEC의 반응속도는 1밀리 세컨드(1ms=1/1000초)다. 유선망 만큼이나 안정적인 무선망 구축이 가능한 것이다.



사실 기존 공장들이 스마트공장을 주저한 것은 망의 안정성 때문이었다. 무선망을 쓸 수가 없었다. 공장 내 통신망이 스마트폰 화면 내 와이파이나 LTE 막대가 오르고 내리는 듯이 불안정하다면 제품의 품질과 수익에 악영향을 줄 수 밖에 없다. 망 안정성 하나만으로 '스마트팩토리'는 현실이 될 수 있다. 무선망으로 로봇이나 조립라인을 움직이게 하고, 전선 없는 공장이나 양자암호가 적용된 공장의 출현이 가능하다.거창한 아이템들이 섞이지 않아도 된다. 전선만 없앤다고 해도 공장은 '스마트'해진다. 전선은 생산성 향상의 저해 요소다. 조립라인의 비효율적 배치를 유발한다. 회선 비용도 든다. 특히 MEC는 기지국 내에서 클라우드 환경을 제공한다. 인터넷 없이 전용 클라우드처럼 쓸 수 있다. 아마존웹서비스(AWS), 마이크로소프트(MS) 등 중앙 직접화 된 클라우드를 쓰지 않아도 된다. 비용이 줄어드는 반면, 보안성은 강해진다.



이날 센터에서 SK텔레콤은 5G 1호 고객인 명화공업의 베어링 불량 판별 로봇 시스템에 MEC를 적용했다. 공장 내 로봇이 사진을 찍어 5G 기지국을 통해 사진을 보내면 MEC 내 5G-인공지능(AI) 머신비전이 불량품을 판별한다. 장홍성 SK텔레콤 IoTㆍData 사업단장은 ""육안으로 불량품을 잡아내던 작업을 '5G-AI 머신비전'으로 대체하면서 1인당 생산성이 두 배 가량 높아졌다""고 설명했다. 두 사람의 일 중 한사람 몫을 로봇이 할 수 있게 된다는 것이다. SK텔레콤은 B2C 사업의 경우 게임이나 가상현실(VR) 등 대용량 콘텐츠를 MEC를 통해 구현할 예정이다. 5G 단말기를 통해 끊김 없이 대용량 서비스를 제공받을 수 있게 되는 것이다.이는 기초적인 활용 단계다. MEC의 출현과 상용화는 자율주행을 가능하게 한다. 도로 위의 자율주행차들의 통신을 끊김없이 주고 받게 하기 위해서는 MEC가 필수적이다. 자율주행차 한 대가 주고받는 데이터의 양은 약 4000GB에 달한다고 한다. 데이터가 끊기기라도 하면 대참사가 날 수도 있다. MEC는 SK텔레콤만의 것은 아니다. 5G 망을 구축 중인 KT와 LG유플러스도 준비하고 있다. 하현회 LG유플러스 부회장은 5G B2B 사업 육성을 위해 초저지연 영상 처리 기술, MEC(모바일 엣지 컴퓨팅), AI/빅데이터 인식 기술을 확보하겠다고 했다. KT도 클라우드에 이어, 엣지 클라우드를 활성화하기 위한 방안을 마련하고 있다. 다만 MEC의 상용화는 아직 멀어 보인다. SK텔레콤 측은 ""현재 구축 중인 3.5GHz 대역 기지국의 전국망 상용화가 끝나고, 28GHz 대역 기지국의 상용화가 이뤄질 때나 정식 MEC 서비스가 이뤄질 수 있을 것""이라고 전망했다.   



황준호 기자 rephwang@asiae.co.kr▶ 네이버 홈에서 '아시아경제' 뉴스 확인하기▶ 재미와 신기 '과학을읽다' ▶ 놀라운 '군사이야기'<ⓒ경제를 보는 눈, 세계를 보는 창 아시아경제 무단전재 배포금지>",105,https://n.news.naver.com/mnews/article/277/0004381016?sid=103
