title,date,main,section,url
"개인정보위, 분쟁조정위원장에 이인호 중앙대 교수 위촉",2022.11.25. 오전 11:01,"김진환·박광배 변호사와 조소용 교수 신규 위원 선임개인정보보호위원회는 개인정보 분쟁조정위원회 위원장에 이인호 중앙대 법학전문대학원 교수를 신규 위촉했다고 25일 발표했다.



신임 개인정보 분쟁조정위원장으로 위촉된 이인호 중앙대 법학전문대학원 교수. [사진=개인정보위]이 신임 분쟁조정위원장은 현재 한국인터넷자율정책기구 이사회 의장과 개인정보규제심사위원회 민간위원장도 맡고 있다. 개인정보위는 ""이 신임 위원장은 평소 개인정보위 역할과 법‧제도 개선방향에 대해 꾸준한 정책 제언 활동을 전개해 왔다""고 전했다.분쟁조정위는 학계와 법조계 등 분야별 전문가 20명의 위원으로 구성된 기관이다. 개인정보 보호법 제40조에 따라 개인정보 침해로 인한 분쟁이 발생할 경우 소송 대신 조정을 통해 신속한 해결을 지원한다.분쟁조정신청 건수는 지난해말 기준 870건으로 2020년 대비 2배 증가한 것으로 나타났다.개인정보위는 ▲김진환 웨일앤썬 변호사 ▲박광배 법무법인 광장 변호사 ▲조소영 부산대 법학전문대학원 교수도 신규 위원으로 위촉했다.개인정보위 관계자는 ""데이터 경제의 급속한 진전에 따라 개인정보에 대한 국민의 인식이 높아진 상황""이라며 ""위원들의 다양한 전문성과 경험을 바탕으로 국민의 개인정보 보호와 권익구제에 앞장서 나갈 예정""이라고 말했다.",105,https://n.news.naver.com/mnews/article/031/0000712886?sid=103
,,,105,https://n.news.naver.com/mnews/article/236/0000229354?sid=103
ICT 전문 취업 박람회 '2022 BDIA 잡페어'…12월 8~9일,2022.11.26. 오전 6:00,"기사내용 요약해운대구 벡스코 제2전시장서 부산디지털혁신아카데미 일환



[부산=뉴시스] 2022 부산디지털혁신카데미 잡페어 포스터. (사진=부산정보산업진흥원 제공) *재판매 및 DB 금지[부산=뉴시스]권태완 기자 = 부산정보산업진흥원은 다음달 8일부터 9일까지 양일간 해운대구 벡스코 제2전시장에서 정보통신기술(ICT) 전문 취업 박람회인 '2022 부산디지털혁신아카데미 잡페어(BDIA 잡페어)'를 개최한다고 26일 밝혔다.부산시와 부산정보산업진흥원이 운영하는 '부산디지털혁신아카데미' 사업의 일환으로 열리는 이번 행사는 지역 ICT 기업과 취업준비생 간의 교류와 채용을 지원하는 전문 취업 박람회다.올해 처음 마련된 이번 취업 박람회는 ICT분야 취업지원을 위한 '인재 매칭 프로그램'과 취업 성공과 경험, 기술 트렌드를 공유하는 '취업·테크 콘퍼런스'로 구성됐다.특히 롯데정보통신, BNK시스템즈, 솔리데오스 시스템즈, 알서포트, 글로벌리어 등 40여 개의 주요 ICT 기업이 참가한다. 인재 매칭 프로그램은 사전 참가 신청을 통해 모집된 기업과 취업준비생이 온라인 플랫폼 미팅 후 현장에서 만나 기업문화에 걸맞은 인재인지 확인하는 등 다양한 면접이 이루어질 예정이다.취업·테크 콘퍼런스는 ICT기업의 인사담당자, 취업 컨설팅 전문강사 등이 취업 노하우를 공유하는 '취업함께' 프로그램과 유니티 테크놀로지 코리아와 함께하는 '유니티 데이' 프로그램을 선보일 예정이다. 또 메타버스, 디지털 트윈 등에서 활용되고 있는 유니티 엔진에 대한 소개와 유니티를 시작해볼 수 있는 기초 강연 등이 마련돼 있다.아울러 사전참가자를 대상으로 27만원 상당의 '유니티 자격증 시험'을 무료로 응시할 수 있는 참가권이 주어진다.이 외에도 ▲코딩테스트 대회 ▲면접·자기소개서 코칭 ▲프로필 사진 촬영 등 다양한 부대행사가 열릴 계획이다.",105,https://n.news.naver.com/mnews/article/003/0011558939?sid=103
"SK쉴더스, 더존비즈온과 맞손…""랜섬웨어 대응 지원""",2022.11.25. 오전 9:48,"SK쉴더스, 더존비즈온과 업무협약 체결 (SK쉴더스 제공)(서울=뉴스1) 오현주 기자 = 보안기업 SK쉴더스는 기업용 솔루션 기업 더존비즈온과 지난 24일 안전한 업무 환경 구축을 위한 업무협약을 맺었다고 25일 밝혔다. 디지털 전환(DX) 시대를 맞아 급격히 늘어난 기업 대상 랜섬웨어(금품요구 악성 프로그램) 공격을 막고 편리한 비즈니스 환경을 함께 만들기 위해서다. 이번 협약을 통해 SK쉴더스는 더존비즈온의 전사적 자원 관리(ERP) 고객을 대상으로 자사의 랜섬웨어 대응 서비스를 선보인다. 이 서비스는 △사고 접수 △대응 △복구 △대책까지 통합적으로 지원한다. 두 기업은 '더존 ERP' 제품과 'SK 쉴더스 랜섬웨어 대응 서비스'를 묶은 패키지 상품으로 선보일 예정이다. 또 SK쉴더스 출입‧근태 관리 솔루션과 더존비즈온의 차세대 ERP인 'ERP 10'과 올인원 비즈니스 플랫폼 '아마란스 텐'의 데이터도 연동한다. 근태 데이터 가공의 번거로움을 최소화하고 데이터의 투명성을 높일 수 있어 효율적인 인사정보 관리가 가능하다고 SK쉴더스 측은 설명했다.박진효 SK쉴더스 대표는 ""더존비즈온과의 사업 협력을 통해 기업과 고객 모두 업무 효율은 높이면서 안전한 비즈니스 환경을 구축할 수 있도록 서비스 혁신에 나설 것""이라며 ""향후에도 SK쉴더스의 역량을 펼칠 수 있는 사업 기회를 지속해서 만들어갈 수 있도록 노력하겠다""고 말했다.",105,https://n.news.naver.com/mnews/article/421/0006481420?sid=103
대기업 연구소도 6%만 '해외 브레인' 보유…그마저도 '겨우 1명뿐',2022.11.25. 오후 5:46,"■기업연구소 '박사급 인력 수급' 비상美 과학·공학 종사자 30%가 외국인···글로벌 인재 싹쓸이韓 대기업도 보수·처우 높여 '인재 붙잡기' 안간힘 쓰지만""외국인 연구원 韓 징검다리 여겨···美·유럽 이직 우선순위""[서울경제] “국내 연구원들보다 많은 보수와 좋은 처우를 제시하며 힘들게 박사급 외국인 연구원을 데려왔지만 본국에 더 나은 자리가 생기자 반 년 만에 뒤도 안 돌아보고 떠나버렸습니다. 대기업이라도 해외 고급 인재 유치는 하늘의 별 따기보다 더 어렵습니다”



첨단산업 분야의 경쟁이 치열해지면서 고급 인재에 대한 수요가 높아지고 있지만 우리 기업 경쟁력의 핵심인 기업연구소에는 박사급 해외 고급 인재가 전무한 것으로 나타났다. 상대적으로 좋은 처우를 제공하는 대기업마저 해외 고급 인력 유치에 애를 먹고 있는 가운데 국내 기업연구소의 대부분을 차지하는 중견·중소기업은 상황이 더욱 심각한 것으로 조사됐다. 국내 인력이 부족한 와중에 해외 인재 유치까지 막히면서 자칫 첨단 기술 경쟁에서 우리나라가 뒤처질 수 있다는 우려의 목소리도 나온다.25일 한국산업기술진흥협회가 국내 기업연구소 7만 7871곳을 대상으로 외국인 연구원 현황을 조사한 결과를 보면 박사 이상의 외국인 연구원을 1명 이상 보유한 기업은 단 490곳에 불과했다. 비율로 보면 0.6%로 기업연구소 100곳 중 99곳의 박사급 외국인 연구원이 0명이라는 뜻이다.산기협 관계자는 “최근 인공지능(AI), 반도체 등 첨단산업 분야를 중심으로 고급 연구개발(R&D) 인재 부족 현상이 심화되는 가운데 향후 10년 내 국내 고급 과학 인력이 약 1만 명 부족할 것으로 전망되고 있다”며 “이런 상황에서 외국인 석·박사 연구 인력이 대안으로 떠오르고 있지만 현실은 외국인 인재 유치에 상당히 어려움을 겪고 있는 실정”이라고 지적했다기업 규모별로 보면 대기업이 57곳(6.2%), 중견기업 50곳(2.9%), 중소기업 383곳(0.5%)으로 나타났다. 중견·중소기업의 상황이 더 좋지 않은 것으로 조사됐지만 대기업 역시 총 914곳 중 857곳에 박사급 외국인 연구원이 1명도 없었다.박사 이상 외국인 연구원 보유 현황을 봐도 외국인 연구원이 있는 대기업 57곳 중 31곳은 단 1명만 보유하고 있었다. 박사 이상 외국인 연구원을 보유한 대기업의 절반 이상이 겨우 1명만 유치한 것이다.정보기술(IT) 업종 관련 대기업 관계자는 “외국인 고급 인력을 유치하는 데 있어 대기업은 보수와 처우 등에서 중소기업 대비 여력이 있지만 그들에게는 경력 차원에서 미국과 유럽 등이 우선순위라 조금만 좋은 조건이 나오면 바로 이직을 한다”며 “그들에게는 국내 굴지의 대기업이라 해도 미국 등 선진국에서 일하기 위한 징검다리 수준밖에 되지 않는다”고 토로했다.범위를 석사 이상 외국인 연구 인력까지 확대해봐도 전체의 1.4%(1108곳)에 그쳤다. 대기업은 전체 기업연구소 중 10.9%를 보유했고 중소기업은 1.2%로 상대적으로 저조했다.한 지방 중소기업 인사 담당자는 “학사급 국내 연구 인력들도 지방 중소기업에 오기를 꺼려하는데 외국인, 그것도 박사급 이상 고급 인재를 유치하는 것은 거의 불가능한 일”이라며 “중소기업 연구소에 있는 박사급 외국인 연구원은 상대적으로 접근성과 인재에 대한 정보 파악이 쉬운 같은 지역 대학 출신들이 그나마 가능성이 높지만 이마저도 여의치 않다”고 말했다.실제 외국인 박사 인력을 보유한 수도권 외 지방 기업 연구소 129개에는 총 168명의 외국인 박사 인력이 있다. 이들의 상당수는 화학·생명공학 등의 전공자로 바이오 중소벤처기업 등에 재직하고 있다. 하지만 이 중 3분의 1 이상은 지방 국립대 등 지방 대학 학위자다. 기업들이 지리적으로 가깝고 접촉을 자주할 수 있는 인근 대학 유학생들을 대상으로 대학 재학 시절부터 관심을 가지고 공을 들여야만 겨우 유치할 수 있다는 말이다.이한진 한국연구재단 수석연구위원은 “미국은 과학·공학 분야 종사자의 30%가 외국 출생 연구자로 구성돼 있다”며 “특히 석·박사 등 학위가 높아질수록 외국 출생 연구자 비율이 높아지고 있고 컴퓨터 등의 첨단 분야에 이러한 현상이 더욱 두드러지는 등 국내 상황과는 대조적”이라고 말했다.외국인 고급 인재 유치에 기업들이 어려움을 겪으면서 자칫 국가 경쟁력에도 부정적 영향이 있을 수 있다는 우려의 목소리가 나오고 있다.IT 업계 관계자는 “우수한 외국인 연구 인력의 성공적 확보와 활용은 기업의 기술 개발은 물론 기업 경쟁력을 높이는 데 기여할 수 있으며, 특히 저출산과 고령화로 야기되는 인력 부족 등의 해결책이 될 수 있다”면서 “하지만 이공계 외국인 대학원생의 학위 취득 후 국내 과학기술 인력 편입마저 저조해지는 등 외국 고급 인력 확보가 더욱 힘들어지면서 기업 경쟁력은 물론 글로벌 국가들이 벌이는 기술 패권 경쟁에서 한국이 도태될 수도 있다”고 경고했다.",105,https://n.news.naver.com/mnews/article/011/0004126622?sid=103
“손목 꺾거나 비튼 채 힘 주는 동작 반복하면 탈납니다”,2022.11.26. 오전 3:02,"[베스트 닥터의 베스트 건강팁]손목 통증 왜 생길까척골충돌증후군손목터널증후군통증 대처법



이재성 중앙대병원 정형외과 교수는 스포츠 레저 인구가 늘면서 손목 통증을 유발하는 척골충돌증후군이 허리 디스크만큼 흔해졌다며  주의를 당부했다. 이 교수는 예방을 위해서는 평소 손목 스트레칭을 자주 하고 근력 운동을 해야 한다고 강조했다. 중앙대병원 제공40대 초반의 전직 운동선수 A 씨는 얼마 전 만성적인 손목 통증 때문에 병원을 찾았다. 통증은 현역 선수 시절에 시작됐다. 통증이 나타나면 주사를 맞았고, 그러면 사라지는 듯했다. 그래서 이를 대수롭지 않게 생각했고, 그렇게 10년 이상 시간이 흘렀다.  결국 손목을 움직일 수 없을 정도로 통증이 심해졌다. 이재성 중앙대병원 정형외과 교수가 보니 손목의 연골 조직이 거의 닳아 있었다. 이른바 척골충돌증후군이 꽤 심각한 상황으로 악화된 것이다. A 씨는 나사못으로 관절을 완전히 고정하는 수술을 받았다. 수술은 잘됐지만 이후 손목을 50% 정도밖에 움직이지 못하게 됐다. 이 교수는 “A 씨가 초기 단계에 왔더라면 관절을 살릴 수 있었고, 손목도 제대로 쓸 수 있었을 것”이라며 안타까워했다.  이처럼 손목 통증을 오래 방치했다가 낭패를 보는 사례가 적지 않다. 이 교수는 “최근에는 손목 통증 환자의 80% 정도가 척골충돌증후군과 관련이 있을 만큼 환자가 늘었다”고 말했다. ○ 척골충돌증후군 환자 급증아래팔뼈는 크게 요골(노뼈)과 척골(자뼈)로 구분된다. 엄지손가락 쪽의 굵은 뼈가 요골, 새끼손가락 쪽의 팔목에 툭 튀어나온 뼈가 척골이다.  이 중 척골은 인대와 연골 조직 등이 삼각형 모양으로 얽혀 있는 ‘삼각섬유연골 복합체’와 닿아 있다. 이 복합체가 완충 작용을 하는 덕분에 척골은 인접한 손목뼈와 충돌하지 않는다. 하지만 손목을 비트는 동작이 많아지면 척골이 복합체 조직을 뚫고 손목뼈와 충돌한다. 이때 통증이 발생하는데, 이게 척골충돌증후군이다.  병명이 생소할 수 있지만 손목 질환 분야에서는 허리 디스크만큼이나 흔하다. 골프, 테니스, 탁구, 요가, 필라테스 등을 즐기는 인구가 늘면서 환자도 증가하고 있다. 손목을 꺾은 채 힘을 주거나 손목을 비튼 채로 바닥을 짚는 동작이 많기 때문이다. 빨래를 쥐어짜는 모양새의 동작도 좋지 않다. 오랜 기간 이런 동작이 반복되면서 척골충돌증후군으로 악화된다. 일종의 퇴행성관절염으로 볼 수 있다.  척골충돌증후군은 자가 진단으로 알 수 있다. 대체로 손목을 많이 쓴 후 척골 주변에 통증이 나타난다. 새끼손가락 쪽 손목의 오목한 부분을 눌렀을 때 아프다면 이 증후군일 가능성이 높다. 또한 손목을 안에서 바깥으로 비틀 때 통증이 더 심해진다. 통증은 한두 번으로 그치지 않고 반복적으로 나타난다.  이 교수는 “대수롭지 않게 여기다 병을 악화시키는 사례가 의외로 많다”며 상태를 체크할 것을 당부했다. 보통 초기에는 약물이나 재활요법으로 치료한다. 심해지면 척골의 일부를 잘라내야 할 수도 있다. ○손이 저리면 손목터널증후군 의심손목 통증이 생기는 또 다른 이유로는 ‘과(過)사용증후군’을 들 수 있다. 잘못된 자세로 손목을 지나치게 많이 사용하기 때문에 발생하는 경우다. 연령과 관계없이 스마트폰이나 컴퓨터 키보드를 많이 사용하는 사람들에게서 많이 나타난다. 이 경우 손목뿐 아니라 팔꿈치나 손에서도 통증이 나타날 수 있다.  보통 손목터널증후군이라 부르는 수근관증후군도 일종의 과사용증후군으로 볼 수 있다. 수근관(손목터널)은 손과 팔을 잇는 통로다. 이 통로를 통해 팔에서 손으로 신경이 뻗어 있다. 수근관이 좁아지거나 신경을 누르면서 증세가 나타난다.  증세의 양상은 척골충돌증후군과는 약간 다르다. 찌릿찌릿 저리고 감각이 떨어지는 느낌이 강하다. 손을 쓰지 않았는데도 증세가 나타날 수 있다. 모든 손가락에 증세가 생길 수 있지만 대체로 새끼손가락에서는 증세가 나타나지 않는다. 특히 밤에 증세가 심해진다. 중년기 주부 중에서는 이런 증세 때문에 잠에서 종종 깨곤 한다.  주로 손목을 덜 사용하거나 보조기구를 함께 쓰면서 약물 치료를 병행한다. 이 방법으로 효과를 보지 못한다면 손목터널을 넓혀주는 수술을 해야 할 수도 있다. ○“무턱대고 진통소염제 복용 삼가야”



이 외에도 손목 통증의 원인은 다양하다. 관절 부위가 붓고 열이 나는 것 같다면 염증성 질환, 넘어진 후 손목에 통증이 나타나고 붓거나 변형이 생기면 요골 골절 가능성이 있다. 이 경우 통증이 무척 심해 대부분 곧바로 병원에 가다 보니 후유증은 적다.  반면 삼각섬유연골복합체가 손상될 경우에는 통증이 2, 3일 후 저절로 가라앉을 때가 많다. 일상생활에 지장이 생기지 않으니 무심코 넘어간다는 것이다. 이 경우 관절염으로 악화될 수 있다. 마사지나 찜질은 증세 완화에 어느 정도 도움이 된다. 다만 냉찜질과 온찜질을 구분해야 한다. 열이 나고 부은 상태라면 염증세포를 억제하고 미세혈관을 수축시키기 위해 냉찜질을 해야 한다. 이 시기가 지나면 통증을 완화하고 관절을 이완시키며 혈액 순환을 돕기 위해 온찜질을 하는 게 좋다.  다만 소염진통제를 남용하는 것은 옳지 않다. 이 교수에 따르면 의외로 많은 사람이 손목이 삐었다고 생각하며 소염진통제만 먹는다. 통증만 잠재우는 식인데, 근본 원인은 그대로 뒀으니 질병이 악화될 가능성이 있다. 원래 상태를 회복하지 못할 정도로 관절이 망가지거나 손목을 제대로 움직이지 못하는 지경에 이르기도 한다. A 씨가 대표적 사례다.  이 교수는 “무턱대고 소염제만 복용하는 것은 좋지 않다”며 “정확한 원인을 알아내야 치료할 수 있다”고 말했다. 퇴행성,  끝마디에 생기고 손을 쓴후 통증…     류머티즘, 여러 부위로 번지고 오전에 증세 손가락 관절염 자가진단법  손가락에도 종종 통증이 발생한다. 때로는 손가락 통증이 번져서 손등과 팔목 전체가 아플 때도 있다. 원인은 다양하지만 관절염을 일단 의심해 볼 필요가 있다. 이재성 교수는 “퇴행성이냐 류머티즘성이냐에 따라 세부 양상이 다르다”며 “어느 쪽이냐에 따라 치료법도 다르기 때문에 자가 진단을 해 보는 게 좋다”고 말했다.  퇴행성관절염은 아픈 부위만 계속 아프다. 다른 부위로 확산하지 않는다는 뜻이다. 주로 손가락의 끝마디에 발생한다. 관절 부위의 뼈가 커지기 때문에 자세히 관찰하면 손가락 끝마디가 살짝 부풀어 있음을 확인할 수 있다.  반면 류머티즘성관절염이라면 손가락의 중간 마디에서 가장 먼저 발생하는 경향이 있다. 아픈 부위가 한 곳에 그치지 않고 여러 곳으로 번지기도 한다. 또한 시간이 지나면서 변형이 일어나는 특징이 있다. 악화되면 손가락이 갈고리처럼 굽을 수도 있다.  통증은 두 관절염 모두에서 나타난다. 퇴행성관절염일 때는 손을 사용한 후에 주로 증세가 나타나기 때문에 저녁에 많이 아픈 편이다. 이때 열이 느껴지지는 않는다. 증세도 대부분 30분 이내에 사라진다. 반면 류머티즘성관절염일 때는 손을 사용하지 않을 때 더 뻣뻣하고 아픈 느낌이 강하다. 증세는 주로 오전에 나타나며 손을 사용하면 약해진다. 아픈 증세는 한 시간 이상 지속될 때가 많고, 붓거나 열이 발생할 때도 있다.  퇴행성관절염은 오래 사용했기 때문에 발생한다. 따라서 손을 많이 사용하는 주부나 직장인, 고령층에서 주로 발견된다. 반면 류머티즘성관절염은 일종의 자가면역 질환으로 나이나 직업과는 큰 상관이 없다. 요즘에는 젊은층에서도 많이 발견된다.  소염제를 먹으면 증세가 개선될까. 류머티즘성관절염의 경우 소염제가 잘 듣는 편이다. 반면 퇴행성관절염은 소염제를 먹어도 증세가 호전되지 않는다. 따라서 무턱대고 약을 먹기보다는 의사에게 정확한 진단과 그에 맞는 처방을 받는 게 바람직하다.",105,https://n.news.naver.com/mnews/article/020/0003464577?sid=103
