title,date,main,section,url
"[이슈] 게임빌, 동명아동복지센터에 교육기금 전달",2020.12.28. 오후 4:14,"게임빌(대표 송병준)이 사회공헌 활동의 일환으로 동명아동복지센터(원장 김광빈)를 후원했다고 28일 밝혔다. 게임빌은 지난 23일, 서울시 관악구에 위치한 동명아동복지센터를 방문해 교육 기금을 전달했다. 이번에 후원한 교육 기금은 동명아동복지센터에서 생활하고 있는 초, 중, 고 학생들의 학습 환경과 교육 기회 향상을 위한 재원으로 활용될 예정이다.1950년 설립된 동명아동복지센터는 보호가 필요한 아이들을 돕고 있는 아동복지 생활시설로 양육과 자립지원 프로그램을 진행하고 있다. 게임빌은 동명아동복지센터와 지난 2004년 인연을 맺은 이래 17년에 걸쳐 '사랑의 장학금', '베이비박스 아동 연계 프로그램', '재건축 기금' 등 다양한 후원 활동을 진행하며 아름다운 관계를 이어오고 있다.한편, 게임빌은 문화 예술 및 지역 사회 발전 등 다방면으로 기업의 사회적 책임을 실천하고 있다. '문화예술 전시회 관람기회 나눔', 'Everywhere 캠페인', '안양천 환경 개선 작업' 등 다양한 사회공헌 활동을 지속해 왔다. 앞으로도 게임빌은 도움의 손길이 필요한 곳을 적극적으로 발굴해 온정을 나눈다는 계획이다.이원희 기자 (cleanrap@dailygame.co.kr)▶ 웹에서 즐기는 캐쥬얼게임 50종▶ 유튜브 핫뉴스 & 화제 영상 보기▶ LCK & 카트리그 현장사진 보기",105,https://n.news.naver.com/mnews/article/347/0000149902?sid=103
애플이 충전기 빼니 샤오미도 뺐다…삼성도 따라갈까,2020.12.28. 오전 11:24,"샤오미, 신제품 미11 패키지에 충전기 제외…삼성도 갤S21서 제외 전망(지디넷코리아=황정빈  기자)



샤오미 미11 패키지는 충전기를 제외해 이전보다 더욱 얇아진 모습이다. (사진=샤오미)애플이 스마트폰 구성품에서 충전기를 빼자 다른 제조사들이 잇따라 같은 움직임을 보이고 있다.샤오미 최고경영자(CEO) 레이쥔은 지난 26일(현지시간) 자신의 웨이보에 신제품 샤오미 미11 패키지에서 충전기를 제외했다고 밝혔다.레이쥔 CEO는 ""샤오미 11 새로운 포장이 얇고 가벼워졌다""며 ""오늘날 많은 사람들은 유휴 충전기를 가지고 있으며, 이는 환경의 부담이 된다""며 충전기 제외 소식을 전했다.



애플은 앞으로 판매하는 모든 제품에서 충전기와 라이트닝 방식 유선 이어폰을 기본 제공하지 않을 것이라고 밝혔다.(사진=애플)앞서 애플은 환경 보호를 이유로 아이폰12 구성품에서 충전기와 유선 이어폰을 제외하며, 앞으로 출시하는 모든 아이폰 구성품에서 이를 포함하지 않을 것이라고 밝혔다.애플은 ""지금까지 20억 개가 넘는 아이폰 충전기가 유통됐다""며 ""아이폰 패키지에서 전원 어댑터와 이어팟을 제외해 탄소 배출을 줄일 수 있다""고 설명했다. 애플은 아이폰12 구성품에 USB-C to 라이트닝 케이블만 제공한다.샤오미는 애플의 이 같은 소식에 당시 SNS에 ""걱정말라""며 ""우리는 미10T 프로 상자에 아무것도 빼지 않았다""고 애플을 조롱한 바 있다. 하지만 해당 SNS를 올린 지 불과 두 달 만에 애플의 행보를 따라가게 됐다.



삼성전자도 마찬가지다. 삼성전자는 아이폰12 발표 다음 날, SNS에 충전기 사진을 올리며 ""갤럭시는 가장 기본적인 충전기부터 최고의 카메라, 배터리 등을 제공한다""고 밝혔다.



그러나 최근 업계에 따르면 삼성전자는 내년에 출시할 플래그십 스마트폰 갤럭시S21(가칭) 구성품에 충전기를 제외할 것으로 전망된다.이처럼 애플이 새로운 결정을 내리면, 글로벌 스마트폰 제조사들은 처음엔 이를 조롱하며 네거티브 마케팅을 보이다 향후에는 이를 따라가는 행보를 보이고 있다.삼성전자는 2016년에도 애플이 아이폰7에서 3.5mm 이어폰 단자를 제외하자 이를 조롱했지만, 이후 2019년 출시한 갤럭시노트10에서 이어폰 단자를 제외했다.한편, 업계에서는 애플의 이 같은 행보를 두고 환경 보호를 목적으로 내세우지만, 결국엔 무선 충전기와 무선 이어폰을 더 많이 판매하기 위함이 아니냐는 지적도 나온다.황정빈 기자(jungvinh@zdnet.co.kr) ▶ 지디넷코리아 '홈페이지' ▶ 네이버 채널 구독하기© 메가뉴스 & ZDNET, A RED VENTURES COMPANY, 무단전재-재배포 금지",105,https://n.news.naver.com/mnews/article/092/0002209139?sid=103
[김상무 & 이부장] SK C&C 직원들이 즐겨찾는 분당 정자역 앞 맛집,2020.12.28. 오후 5:20,"우리 회사 맛집'우아한 해장' 쏘렐라의 뚝배기 파스타추운 날엔 '혼밥 가능' 모랑해물솥밥SK그룹의 정보기술(IT) 서비스를 담당하는 SK C&C는 맛집이 즐비한 경기 성남시 정자역 바로 앞에 자리 잡고 있다. 근처에 네이버, KT 등 대기업도 있어 직장인을 겨냥한 상권이 형성됐다. SK C&C 직원들이 자주 가는 맛집은 어떤 곳일까.



‘소문난 닭갈비’는 요즘처럼 쌀쌀한 날에 많이 찾는 곳이다. 대표 메뉴는 부드러운 육질의 뼈없는 닭갈비지만 김치찌개와 제육볶음, 주꾸미 볶음도 인기 메뉴다. 이 집 닭갈비에는 라면사리보다 우동사리를 곁들이는 게 단골들의 팁이다.‘식미단’은 아담한 크기의 일본 가정식 전문점이다. 메뉴가 특이하고 음식이 깔끔해 지인이 회사 근처에 놀러왔을 때 자주 가는 곳이란 설명이다. 고등어 덮밥과 스테이크 덮밥, 명란크림 우동 등이 인기다.‘쏘렐라’는 이탈리안 레스토랑이지만 해장을 목적으로 방문하는 사람도 많다. 게, 홍합 등 다양한 해산물과 토마토 소스로 만든 뚝배기 파스타 때문이다. 함께 제공되는 밥까지 말아 먹으면 숙취가 풀린다고 한다. 큼지막한 새우로 풍미를 살린 크림파스타 감베로니도 추천 메뉴다. 식전빵과 함께 나오는 감자, 고구마도 이 집의 매력이다.‘스시오마카세’에서 점심에만 여덟 그릇 한정 판매하는 알탕도 주당들 사이에서 유명한 해장 음식이다. 당일 들어온 생선뼈를 우려낸 국물과 신선한 생선알이 일품이라고 한다.든든하게 고기를 먹고 싶을 때는 ‘한소헌’을 찾는다. 숯불에 구운 돼지갈비와 된장찌개, 물·비빔냉면 등을 함께 먹을 수 있는 양념갈비 정식을 먹는 사람이 많다. 부드러운 고기와 삼삼한 국물이 어우러진 갈비탕도 겨울철에 많이 찾는 메뉴다.김이 모락모락 올라오는 밥이 생각날 때는 ‘모랑해물솥밥’에 간다. 해물솥밥, 간장새우버터밥, 낙지불고기솥밥 등 10가지 이상의 다양한 솥밥을 먹을 수 있다. 젓갈과 국, 김 등이 개인별로 나온다. ‘혼밥’도 가능하다. 여럿이 함께 갔다면 육전, 부추전 등 곁들임 메뉴도 시켜볼 만하다.이승우 기자 leeswoo@hankyung.com▶ 경제지 네이버 구독 첫 400만, 한국경제 받아보세요▶ 한경 고품격 뉴스레터, 원클릭으로 구독하세요▶ 한국경제신문과 WSJ, 모바일한경으로 보세요 ⓒ 한국경제 & hankyung.com, 무단전재 및 재배포 금지",105,https://n.news.naver.com/mnews/article/015/0004474421?sid=103
소행성 땅속 표본 첫 공개…“숯덩이를 닮았네”,2020.12.28. 오후 12:59,"류구 캡슐 내 보관실 3곳 모두 개봉 땅속 물질 가져온 건 처음...최대 1cm



  3억km 거리에서 날아온 소행성 류구의 캡슐 내 표본 보관실 세 곳이 모두 개봉됐다.일본 우주항공연구개발기구(작사)는 지난 14일 A 보관실을 개봉한 데 이어 21일 B와 C 보관실도 개봉했다고 밝혔다. A 보관실엔 표면 물질이, C 보관실엔 땅속 물질이 들어 있으며, B 보관실은 이물질이 섞였는지 가려내기 위해 비워 놓은 보관실이다. 류구는 탄소질 성분이 주를 이루는 소행성이어서 구성 물질들이 검은색을 띠고 있다.작사가 공개한 C 보관실 내용물 사진을 보면 땅속에서 수집한 표본은 표면 물질에 비해 훨씬 크다. 작은 숯덩이들이 가득 담겨 있는 것같은 모습이다. 작사는 땅속 표본 중 가장 큰 것은 약 1cm나 된다고 밝혔다. 땅속에 있던 물질은 우주방사선 등 외부 환경의 영향을 받지 않아 태양계 형성기의 상태가 더 잘 보존돼 있을 것으로 기대된다. 일본의 하야부사 1호는 2010년 또다른 소행성 이토카와에서 극미량의 표면물질 입자 1500여개를 가져온 바 있지만, 소행성의 땅속 물질을 가져온 것은 이번이 처음이다. 



 _______인공물은 수집장치의 알루미늄 조각인 듯 작사가 공개한 C 보관실의 표본 사진을 보면, 용기 안에 은색으로 빛나는 인공물이 포함돼 있다. 작사는 ""아직 정확히 확인하지는 못했지만, 이는 발사체를 이용해 표본을 수집하는 과정에서 사용한 수집장치 '샘플러 혼'(Sampler Horn)에서 떨어져 나온 알루미늄 조각일 가능성이 있다""고 밝혔다.A 보관실의 표면 물질은 지난해 2월, C 보관실의 땅속 물질은 지난해 7월에 각각 수집한 것이다. 작사는 현재 A와 C 보관실의 내용물을 별도의 수집 용기로 옮기고, 분류 작업을 벌이고 있다.앞서 작사는 가나가와현 사가미하라 우주과학연구소에 보관중인 소행성 표본 캡슐의 중량을 측정한 결과, 애초 수집 목표치인 0.1g의 50배가 넘는 5.4g의 표본이 들어 있는 것으로 나타났다고 발표한 바 있다. 캡슐 용기 겉면에 묻어서 온 표본까지 포함하면 총 표본량은 이보다 더 많을 것으로 보인다.곽노필 선임기자 nopil@hani.co.kr, ▶곽노필의 미래창 바로가기",105,https://n.news.naver.com/mnews/article/028/0002526081?sid=103
"獨 DH ""우아한형제들과 합작사 설립"" 공시",2020.12.28. 오후 5:44,"딜리버리히어로 홈페이지 캡처[파이낸셜뉴스] 독일 딜리버리히어로는 우아한형제들의 주식 매입 및 합작사 설립을 28일 공식 발표했다.   이날 공시를 통해 DH는 ""DH의 100% 자회사이며 요기요 운영사인 딜리버리히어로코리아(DHK)를 조건에 따라 6개월 이내에 매각할 것이며 특정 상황에서 최대 6개월까지 매각 기간 연장을 요청할 수 있다""고 설명했다.   또 DHK 매각 완료까지 요기요의 현상 유지 명령에 대해서도 고지했다.   △DH 및 우아한형제들의 다른 딜리버리 앱과 별도로 요기요 운영 △식당에 적용되는 실제 수수료율 변경 금지 △전년도 같은 달에 사용한 프로모션 금액 이상을 월간 사용 및 차별 금지 △딜리버리 앱 접속/연결 속도, 사용자 인터페이스, 제공 정보의 변경 금지 △제휴 딜리버리 앱으로의 강제 전환 금지 △요기요 근로 조건에 불리한 변경 금지 및 우아한형제들에 대한 권유 금지 △데이터 전송 및 공유 금지 등이다.    true@fnnews.com 김아름 기자   ▶ 헉! 소리나는 스!토리 뉴스 [헉스]▶ '아는 척'하고 싶은 당신을 위한 [두유노우]▶ 날로먹고 구워먹는 금융이슈 [파인애플]  ※ 저작권자 ⓒ 파이낸셜뉴스. 무단 전재-재배포 금지",105,https://n.news.naver.com/mnews/article/014/0004554843?sid=103
"애플카, 여전히 개발초기 단계…2025년에 출시",2020.12.28. 오후 1:03,"2028년까지 지연될 수도… 새로운 플랫폼 장악시 매출 성장 가속화[아이뉴스24 안희권 기자] 애플카 출시가 당초 예상보다 더 늦은 2025년이나 2027년에야 가능할 전망이다 .맥루머스는 애플의 정통한 밍치 궈 TF인터내셔널 증권 애널리스트의 말을 인용해 애플이 애플카를 빨라야 2025년 또는 늦으면 2027년에 내놓을 것으로 봤다.지난주 제기된 애플카 개발 소식은 애플이 2024년 자율주행전기차 생산을 시작하고 이 차량에 차세대 배터리 기술을 탑재할 예정이다.다만 그는 애플카 개발이 끝나지 않아 상용화 시점이 2028년까지 지연될 수 있다고 경고했다. 밍치 궈 애널리스트는 애플카가 시장에서 높은 완성도와 광범위한 서비스 생태계의 이점으로 경쟁사보다 우위를 확보할 것으로 전망했다.



애플카 출시가 당초예상보다 훨씬 늦어진 2028년에 나올 것으로 전망됐다 [테슬라]물론 애플이 신규 사업에서 실패하기도 했다. 스마트 스피커가 그것이다.홈팟 스피커는 비싸며 출시 시점도 너무 늦어 소비자로부터 외면을 받았다.다만 업체간 경쟁은 자율주행전기차 시장이 스마트 스피커 시장보다 한층 더 치열할 것으로 예상되고 있다.밍치 궈 애널리스트는 애플이 이 시장에서 성공하려면 기존과 달리 하드웨어가 아닌 빅데이터와 인공지능(AI) 부분의 기술력으로 승부해야 한다고 조언했다.그는 애플카가 나오면 5년내 시장을 주도할 수 있을 것으로 봤다. 애플이 개발중인        배터리 디자인이 주행 성능을 향상시켜 애플카의 구매력을 높일 것으로 예상했다.애플카가 자율주행차 시장을 장악하면 새로운 플랫폼 시장에서 영향력 확대로 애플의 매출이 급증하며 주가 급등으로 시가총액도 3조달러를 넘어설 것으로 예측된다.안희권기자 argon@inews24.com▶네이버 채널에서 '아이뉴스24'를 구독해주세요.▶재밌는 아이뉴스TV 영상보기 ▶아이뉴스24 바로가기[ⓒ 아이뉴스24 무단전재 및 재배포 금지]",105,https://n.news.naver.com/mnews/article/031/0000576271?sid=103
"AR 전문 기업 '시어스랩', 전 삼성전자 S급 인재 영입",2020.12.28. 오전 9:49,"[파이낸셜뉴스] 증강현실(AR) 전문 기업인 시어스랩이 이진욱 삼성전자 디지털 가전 사업부 인공지능(AI) 랩 연구소장(  사진)을 시어스랩 신임 최고기술책임자(CTO)로 영입한다고 28일 밝혔다.   신임 이진욱 CTO는 2005년 삼성전자 입사 이후, 삼성전자 미래 기술 리서치 및 소프트웨어 개발 센터 등을 거쳐 2017년 삼성전자 러시아 연구소의 소장으로 취임하면서 모스크바 AI 센터 설립을 주도했으며 삼성전자에서 S/W 플랫폼 및 비전 AI 분야의 전문가로 활동해왔다.   특히 러시아 연구소 소장 재직 시, 개발을 주도하였던 ‘딥페이크’ 기술은 세계적인 명화, 영화 등에 등장하는 유명인들의 한 장의 이미지로 실제와 같은 생동감 있게 움직이는 영상 추출이 바로 가능하여 시장에서 큰 화제를 불러일으키기도 했다.   이진욱 CTO는 2013년부터 삼성전자의 미래 기술을 발굴하는 연구임원으로서 삼성전자 내 모바일 및 TV 등의 가전은 물론이고, 웨어러블, 사물인터넷(IoT), 자동차 등 분야에서 굵직한 미래 연구 프로젝트를 발굴 및 수 많은 상용화 경험을 보유한 차세대 기술 상용화 전문가이기도 하다.   정진욱 시어스랩 대표는 “이진욱 CTO의 그 동안의 다양한 S/W 상용화 및 비전 AI연구 경험과 시어스랩의 독보적인 증강현실 전문성과 상용화 경험간의 시너지 창출이 가능해 차세대 혁신적인 비전 AI 기술을 보유한 글로벌 전문 기업으로 한 단계 도약할 것으로 믿고 있다”고 말했다.    true@fnnews.com 김아름 기자   ▶ 헉! 소리나는 스!토리 뉴스 [헉스]▶ '아는 척'하고 싶은 당신을 위한 [두유노우]▶ 날로먹고 구워먹는 금융이슈 [파인애플]  ※ 저작권자 ⓒ 파이낸셜뉴스. 무단 전재-재배포 금지",105,https://n.news.naver.com/mnews/article/014/0004554401?sid=103
"'요기요 매각' 배민 인수 조건에 벤처업계도, 점주들도 불만(종합)",2020.12.28. 오후 3:30,"코스포 ""디지털경제 역동성 외면…우리 스타트업 글로벌 진출 저해""가맹점주협 ""아예 불허했어야…자영업자 피해없도록 상생 협의해야""



[연합뉴스TV 제공]    (서울=연합뉴스) 이효석 기자 = 공정거래위원회가 독일 딜리버리히어로(DH)에 ""배달의민족(배민)을 인수하려면 요기요를 매각하라""고 명령하자 벤처업계는 ""우리나라 스타트업에 악영향을 끼칠 결정""이라고 비판했다.    스타트업단체 코리아스타트업포럼(코스포)은 28일 입장문을 내고 ""공정위가 산업계와 많은 전문가의 반대 의견에도 이런 결정을 내린 데 대해 깊은 유감을 표한다""고 밝혔다.    코스포는 배민 운영사인 우아한형제들을 창업한 김봉진 의장이 주도해 만든 스타트업단체다. 김 의장은 2016∼2019년 코스포 초대 의장을 지냈다.    이날 코스포는 ""공정위는 플랫폼 사업자가 네트워크 효과를 바탕으로 얼마든지 음식 배달 시장에 진출할 수 있는 상황을 외면했다""고 지적했다.    오픈커머스 사업자가 음식 배달 시장이나 온라인동영상서비스(OTT)에 진출하고, OTT 사업자가 라이브 커머스 시장에 진출하고, 유통업자가 물류업에 진출하는 등 산업 간의 경계 없이 플랫폼을 넓히는 게 디지털 경제의 역동성이라는 주장이다.    이들은 ""공정위 결정은 우리나라 스타트업의 글로벌 가치 평가에 악영향을 끼치고 글로벌 진출에 막대한 손실을 초래할 것""이라며 ""디지털 경제와 스타트업 생태계 전반에 부정적 영향을 끼치고 혁신 성장을 저해할 것""이라고 우려했다.



공정위, 배달앱 사업자 간 기업결합 조건부 승인(세종=연합뉴스) 김주형 기자 = 조성욱 공정거래위원장이 28일 오전 세종시 정부세종청사에서 배달의 민족-요기요 배달앱 사용자 간 기업결합 조건부 승인과 관련해 브리핑하고 있다. 2020.12.28 kjhpress@yna.co.kr    반면 가맹점주단체·소비자단체 등은 공정위가 DH의 배민 인수를 아예 불허했어야 한다고 아쉬움을 토로했다.    전국가맹점주협의회·참여연대·민생경제연구소 등은 공정위 전원회의가 열렸던 23일 공동성명을 내고 ""DH와 배민의 기업 결합을 불허하라""고 요구한 바 있다.    이들은 성명에서 ""올해 8월 수도권 지자체들이 발표한 실태조사 결과를 보면, 배달 앱 가맹점 10곳 중 8곳이 광고비·수수료가 과도하게 높다고 지적하면서도 점주 52%가 배달 앱을 사용하지 않으면 영업이 어렵다고 밝힌 바 있다""고 지적했다.    DH가 배달 앱 시장을 독점하면 점주들과 상생할 노력보다는 사업 확장에 몰두할 가능성이 크고, 일방적인 계약 조건 변경이나 검색 노출 알고리즘 비공개 등 불공정 경쟁 행위가 늘어날 우려가 있다는 지적이다.    조건부 승인 결정이 내려진 이날 김종민 전국가맹점주협의회 사무국장은 ""불허했어야 한다. 환영할 입장은 아니다""라며 ""매각이 분명히 이뤄지도록 후속 조치가 이뤄져야 할 테지만, 그래도 (DH의) 독점적 지위가 바뀌는 건 아니다""라고 말했다.    그는 ""배민이 정보 독점이나 수수료 문제를 논의할 상생 협의에 다시 나서는 계기가 됐으면 한다""며 ""요기요 매각이 이뤄지게 되면 가맹점주들 입장에서는 협의할 대상만 늘어나는 모양새일 수 있다. 당국에서 자영업자 피해가 없도록 협의의 장을 마련해야 한다""고 촉구했다.    이날 공정위는 DH가 배민을 인수하려면 6개월 안에 딜리버리히어로코리아(DHK·요기요 운영사)를 매각하라고 명령했다.    DH가 배민을 인수하면 요기요·배달통·푸드플라이까지 모두 합쳐 총 99.2%의 시장 점유율을 차지하게 된다는 게 공정위 지적이다.



[그래픽] '배달앱' 시장 점유율 현황(서울=연합뉴스) 이재윤 기자 = 공정거래위원회가 독일 딜리버리히어로(DH)에 배달의민족(배민)을 인수하려면 요기요를 매각하라고 명령했다.    우아한형제들이 운영하는 배민과 DH의 한국 자회사 딜리버리히어로코리아(DHK)가 운영하는 요기요는 각각 국내 1위, 2위 배달앱이다.     yoon2@yna.co.kr    트위터 @yonhap_graphics  페이스북 tuney.kr/LeYN1    hyo@yna.co.kr▶네이버에서도 뉴스는 연합뉴스[구독 클릭]▶[팩트체크]정차상태서 택시기사 폭행, 특가법?▶제보하기<저작권자(c) 연합뉴스(https://www.yna.co.kr/), 무단 전재-재배포 금지>",105,https://n.news.naver.com/mnews/article/001/0012105685?sid=103
