title,date,main,section,url
[IPO점검-①] 네이버웹툰 대 카카오엔터 ‘수퍼IP 격전’…美 상장 가능할까,2021.05.18. 오후 1:00,"미국 상장으로 단숨에 시총 100조원 기업에 오른 ‘쿠팡 신화’를 기점으로 국내 주요 플랫폼 기업들의 기업공개(IPO)에 대한 기대감이 커지고 있다. 네이버와 카카오 등 국내 양대 인터넷 기업을 비롯해 전자상거래 기업과 게임업체에 이르기까지 증시 진출을 앞두고 기업 가치 높이기에 한창이다. 이에 ‘디지털데일리’는 주요 IPO 후보들의 상장 전략을 비교 분석하고 향후 전망을 살펴본다.<편집자주> 



  [디지털데일리 권하영기자] 글로벌 지식재산권(IP) 선점을 위해 북미 웹툰·웹소설 시장에 진출한 네이버와 카카오가 미국 상장 가능성을 내비치고 있다. 양사 모두 스토리텔링 콘텐츠 분야에서 공격적인 투자로 글로벌 보폭을 넓히겠다는 야심을 드러낸 상황이다. 앞선 쿠팡의 뉴욕 증시 상장 성공을 발판 삼아 국내 기업이 글로벌 경쟁력을 입증받는 또 다른 사례가 나올 수 있을지 주목된다.   17일 정보기술(IT) 업계에 따르면 네이버와 카카오는 최근 잇따라 북미 기반 웹툰·웹소설 플랫폼 인수를 추진하면서 미국내 기업공개(IPO) 기대감이 커지고 있다.   네이버는 이달 초 세계 최대 웹소설 플랫폼 왓패드 인수 절차를 마무리했다. 인수 규모는 약 6억달러로, 한화로 치면 6500억원이다. 카카오 또한  북미 웹툰 플랫폼인 타파스와 웹소설 플랫폼 래디쉬 인수를 공식화했다. 이번에 타파스와 래디쉬가 인정받은 기업가치는 각각 5억1000만달러(약 6000억원)과 4억4000만달러(약 5000억원)다. 양사 모두 미국 상장 가능성이 점쳐지는 만큼, 공격적인 인수합병(M&A) 투자로 북미 시장 영향력을 넓히려는 시도로 해석된다.    앞서 이진수 카카오엔터테인먼트 대표는 블룸버그와의 인터뷰에서 특별히 쿠팡 상장을 언급하며 “한국 기업들이 이전보다 나은 평가를 받을 수 있다는 희망을 줬다”며 “앞으로 1년 뒤 IPO를 할 계획”이라고 말한 바 있다. 카카오엔터테인먼트 관계자는 “현 시점에서 구체적인 미국 상장 계획이 있는 것은 아니다”라고 말했지만, 업계에서는 사실상 미국 상장 가능성이 높은 것으로 보고 있다. 이 대표는 상장 시 회사의 기업가치는 현재의 두배 수준인 20조원에 달할 것으로 내다봤다.    네이버웹툰은 미국 상장 검토를 공식화했다. 박상진 네이버 최고재무책임자(CFO) 역시 블룸버그와의 인터뷰를 통해 “성장하기 위해서는 세계로 가는 것이 불가피하다”며 “이를 위해 달러화 채권의 추가 발행을 고려하고 있으며, 네이버웹툰의 미국 증시 IPO 가능성도 보고 있다”고 전했다. 한성숙 네이버 대표는 지난달 21일 북미 테크 컨퍼런스 ‘콜리전 컨퍼런스’에서 해외 시장 확장성을 강조했다. 한 대표는 “네이버웹툰과 왓패드는 전 세계에서 가장 많은 스토리텔링 창작자와 사용자가 모인다”며 “수많은 작가들의 작품들이 다양한 나라의 독자들과 만나고 있다”고 강조했다.   ◆ ‘수퍼 IP’ 잠재력 큰 북미 시장 선점이 관건   두 회사의 상장 계획과 관련해 시장에서는 긍정적인 전망이 나온다. 웹툰과 웹소설 시장 규모가 빠르게 커지고 있는 데다, 다양한 영화·드라마, 나아가 캐릭터·상품 등 2·3차 창작물 제작의 중심이 되는 ‘수퍼 IP’로서 중요성이 부각되고 있어서다. 네이버웹툰을 원작으로 한 넷플릭스 오리지널 ‘스위트홈’은 세계적인 흥행을 일으켰고, 카카오페이지 웹툰을 기반으로 제작된 영화 ‘승리호’도 넷플릭스 영화 순위 1위를 차지하며 영상화 시너지를 냈다.   이상헌 하이투자증권 연구원은 “소수만 즐기던 서브컬처였던 웹툰 콘텐츠들을 원소스 멀티유즈 방식을 통해 대중문화로 확장시켰고, 인기 웹툰의 경우 스토리와 재미를 검증받아 안정성이 보장된다는 장점이 있다”고 분석했다. 김현용 현대차증권 연구원 역시 “웹툰·웹소설은 드라마·영화 제작 시장에 중요한 스토리 소스로 기능하고, 웹툰 플랫폼은 세계적으로 확장하기에 좋은 플랫폼으로 시장 선점 수요가 있다”고 봤다.   북미 지역은 스토리텔링 시장을 선점하기도 좋은 곳이다. 한국콘텐츠진흥원의 ‘2020 해외 콘텐츠 시장 분석’ 보고서에 따르면 미국 만화시장은 전년대비 10.6% 증가한 11억6000만 달러로 추정되는데, 디지털 만화 시장의 경우 2018년 반등한 이후 2019년 다소 감소했다. 이는 현지 플랫폼들이 차별화된 서비스를 보여주지 못했기 때문으로 풀이된다. 그럼에도 밀레니얼 세대를 중심으로 수요는 계속되는 상황이다.    ◆ ‘퓨어 플레이어’ 네이버, ‘콘텐츠 시너지’ 카카오   하지만 이는 그만큼 웹툰·웹소설 시장에 대한 현지 업계의 이해도가 떨어진다는 얘기기도 하다. 업계 한 관계자는 “북미 시장에서 웹툰과 웹소설 소비자는 주로 젊은 층이어서 한국처럼 대중화되었다고 말하기 어렵다”면서 “오히려 투자업계에는 잘 알려지지 않은 산업”이라고 말했다. 스토리텔링과 관련해 확고한 비즈니스 모델이 서지 않는 한 네이버와 카카오가 이 시장을 선점하는 것도 쉬운 일은 아니라는 지적이다.   또 회사별로 실제 상장 효과가 어떨지는 미지수다. 네이버웹툰은 왓패드 인수를 기점으로 웹툰과 웹소설에만 주력하는 ‘퓨어 플레이어’지만, 카카오엔터테인먼트는 웹툰·웹소설 사업 비중이 절반에 못 미치고 그 외 음원 유통과 콘텐츠 제작 사업을 병행하고 있다. 사내독립기업(CIC) 형태로 웹툰·웹소설을 맡는 페이지컴퍼니와 콘텐츠 제작·유통을 맡는 M컴퍼니로 분리된 카카오엔터테인먼트의 독특한 구조 때문이다.   이러한 각사 특징은 글로벌 상장 계획에 있어 장점이자 단점으로 작용할 수 있다. 단순히 웹툰·웹소설 시장의 성장 가치만 놓고 보면 퓨어 플레이어인 네이버가 카카오엔터테인먼트에 비해 높은 기업가치를 평가받을 수 있다. 반대로 카카오엔터테인먼트는 상장 시 웹툰, 케이팝(음원), 드라마 등을 모두 보유한 독립법인이 돼 높은 시너지를 기대할 수 있다. 카카오엔터테인먼트가 내부적으로 시너지센터를 신설해 페이지컴퍼니와 M컴퍼니간 사업 연계에 신경을 쓰는 것도 그래서다.   업계 관계자는 “네이버와 카카오가 상장을 앞두고 기업가치를 높게 평가받기 위해 발빠르게 투자와 협업 대상을 찾고 있다”면서 “아무도 가지 않은 길에서 성장 가능성을 얼마나 인정받느냐가 관건”이라고 말했다.   <권하영 기자>kwonhy@ddaily.co.kr▶ 네이버에서 디지털데일리 채널 구독하기▶ IT정보의 즐거운 업그레이드 [딜라이트닷넷]<저작권자 © 디지털데일리 무단전재-재배포금지>",105,https://n.news.naver.com/mnews/article/138/0002103574?sid=103
"오토노머스에이투지, KG모빌리티와 자율주행차 공동 개발 MOU",2023.10.24. 오전 9:01,"KG모빌리티(쌍용차)와 자율주행 설루션 개발기업 오토노머스에이투지(오토노머스a2z)가 자율주행차 공동 개발에 나선다.오토노머스에이투지는 지난 19일 대구광역시 엑스코에서 열린 ‘대한민국 미래모빌리티 엑스포(DIFA)’에서 KG모빌리티와 ‘자율주행 시스템 및 차량 공동 개발 협력’ 양해각서(MOU)를 체결했다고 24일 밝혔다.



한지형(왼쪽 다섯 번째) 오토노머스에이투지 대표와 권용일(왼쪽 네 번째) KG모빌리티 연구소장이 지난 19일 대구광역시 엑스코에서 MOU를 체결하고 기념촬영을 하고 있다. /오토노머스에이투지 제공        이번 체결식에는 한지형 오토노머스에이투지 대표와 권용일 KG모빌리티 연구소장 등 양사 관계자들이 참석했다.양사는 KG모빌리티의 레벨2·레벨3·레벨4 자율주행 양산차 개발과 오토노머스에이투지의 레벨4 자율주행차 제작에 협력하기로 했다.KG모빌리티는 오토노머스에이투지의 국내 최대 자율주행 실증이력, 자율주행 시스템 개발 역량 등을 활용해 자율주행 시스템 고도화에 나서겠다는 구상이다. KG모빌리티는 2030년까지 레벨4 플러스(+) 수준으로 자율주행 기술을 확보한다는 계획을 갖고 있다.오토노머스에이투지는 KG모빌리티와의 협력을 통해 연간 1000여대 생산에 필요한 기반 작업과 노하우를 전수 받는다. 오토노머스에이투지는 내년에 레벨4 자율주행 소프트웨어를 탑재한 전기차의 시제품을 공개하고, 2025년부터 본격적인 판매를 시작할 계획이다.한 대표는 “이번 협력을 통해 KG모빌리티의 자율주행 시스템 고도화를 지원하고, 당사의 자동차 생산 역량도 높일 수 있을 것으로 기대한다”며 “전 세계 자율주행 시장에 큰 여파를 미칠 수 있는 협력으로 만들어 나가겠다”고 밝혔다.오토노머스에이투지는 올해 DIFA에서 자체 개발한 양산형 완전 무인 모빌리티 ‘프로젝트 MS(Project MS)’와 ‘프로젝트 SD(Project SD)’를 국내 최초로 공개했다. 프로젝트 MS는 최대 12인승 무인 셔틀, 프로젝트 SD는 300㎏ 이상 적재가 가능한 무인 배송 차종이다. 운전자가 탑승하지 않은 완전 무인 형태로 일반 공공 도로에서 최고 속도 60㎞/h로 달린다. 센서 고장이나 오작동에 대비한 다중화 센서, 자체 개발한 자율주행 제어기 등을 장착했다.오토노머스에이투지는 2030년까지 외주 생산으로 초기 양산 물량을 제조할 계획이다. 이후 시장의 확장성 등을 고려해 자체 생산이나 완성차 기업과의 헙력 생산 등을 도모하기로 했다.",105,https://n.news.naver.com/mnews/article/366/0000941735?sid=103
KT 주가 연초 대비 35% 급등...콘텐츠 기업 '호평',2021.05.18. 오후 4:19,"주가는 연초 2만4000원에 시작해 3만2300원으로 



구현모 KT 대표가 3월 서울 종로구 광화문 KT스퀘어에서 KT 그룹 미디어콘텐츠 사업 전략 발표를 하고 있다. 사진=뉴스1 [파이낸셜뉴스]KT의 콘텐츠 강화를 위한 움직임이 본격 궤도에 올랐다. 올초 KT스튜디오 지니를 설립한 데 이어 온라인 동영상 서비스(OTT) 플랫폼 시즌을 별도 법인으로 분사하며 본격적인 콘텐츠 전문기업으로 거듭나기 위한 행보를 이어가는 모습이다. 이에 연초 2만4000원에 시작한 주가도 3만2300원으로 35%나 급등해 주식 시장도 이같은 변화에 긍정적 평가를 내리고 있다.   18일 통신업계에 따르면 지니뮤직은 최대 주주인 KT가 보유한 주식을 전량 현물로 출자해 'KT 시즌'을 설립하는 현물출자 계약을 체결했다. 시즌 법인 설립을 위한 현물출자 목적물 중 지니뮤직의 주식은 보통주 2090만4514주로 KT가 소유하고 있던 지니뮤직 전체 주식의 35.97%가 KT 시즌으로 옮겨진다. 1주당 가격은 7572원으로 양수대금은 1582억8898만원이다.   이에 따라 지니뮤직의 최대 주주는 KT 시즌으로 변경되며 지배구조도 KT→KT 시즌→지니뮤직 순으로 변하게 된다. KT가 KT 시즌의 지분 100%를 보유하며 자회사로 두고 지니뮤직은 KT의 손자회사가 되는 것이다.   KT 시즌은 내달 말이나 7월 초 설립될 것으로 예상되고 있으며 정보통신사업과 인터넷(IP)TV방송사업, PP(방송채널) 사업, 뉴미디어 사업 등을 진행하게 된다.   앞서 KT는 올해 1월 KT 스튜디오지니를 설립하고 지난해에는 스토리위즈를 분사하는 등 미디어·콘텐츠 분야 구조 개편을 통해 디지털 플랫폼 기업(디지코)으로 전환을 모색해 왔다. KT 스튜디오지니는 지난 3월 기자간담회를 통해 국내외 제작사 및 플랫폼 사업자들과 파트너십을 통해 새로운 'With KT' 콘텐츠 생태계를 만들겠다는 청사진을 제시한 바 있다.   그 첫번째 성과물도 곧 선보이게 된다.   KT 스튜디오지니와 신세계 그룹의 미디어 콘텐츠 사업 법인 마인드마크는 동명의 스릴러 웹툰을 원작으로 한 드라마 '크라임 퍼즐'의 공동 기획 및 제작을 위해 협업 중이다. KT 스튜디오지니가 마인드마크와의 첫 협력 프로젝트로 선보이게 될 '크라임 퍼즐'은 유력 정치인을 살해한 혐의로 교도소에 수감된 범죄 심리학자와 그에 의해 아버지를 여읜 프로파일러가 교도소에서 일어난 살인 사건에 대해 인터뷰하며 펼쳐지는 이야기를 그린다.   KT 스튜디오지니 윤용필 대표는 ""전 세계적으로 점차 치열해지는 콘텐츠 시장과 제작 현실에서 KT 스튜디오지니와 마인드마크의 협력은 양질의 콘텐츠를 위한 보다 과감한 투자의 출발점이 될 것""이라고 밝혔다.    true@fnnews.com 김아름 기자   ▶ 날로먹고 구워먹는 금융이슈 [파인애플]▶ 모(毛)아 모아 [모아시스]▶ 헉! 소리나는 스!토리 뉴스 [헉스]  ※ 저작권자 ⓒ 파이낸셜뉴스. 무단 전재-재배포 금지",105,https://n.news.naver.com/mnews/article/014/0004641223?sid=103
"'그랜드체이스', 열번째 월드 마계-드레드포레스트 추가",2021.05.18. 오후 2:44,"카카오게임즈는 모바일 RPG '그랜드체이스'에 열번째 월드 마계–드레드포레스트를 업데이트했다.  마계-드레드포레스트에서는 마계로 무대를 옮겨 힘의 균형을 무너뜨릴 수 있는 존재를 두고 경쟁전이 펼쳐진다.카카오게임즈는 월드 업데이트를 기념해 마계의 전리품 이벤트를 진행, 오는 25일까지 모험 던전 클리어 시 마계의 전리품 상자를 지급한다. 상자 속에는 샤이니, 샤이니 결정 등 보상이 담겼다. 또, 전리품 포인트를 모아 게임 내에서 사용 가능한 채팅 이모티콘을 획득할 수 있다.또, 19일 석가탄신일 당일 게임에 접속하면 기력 1000개가 제공되며 모험 던전 클리어 시 영웅 경험치와 골드 2배 버프가 주어진다.  한편, 카카오게임즈는 오는 25일 '그랜드체이스'에 SS 수호형 영웅인 진의 영혼 각인 업데이트를 진행할 예정이다. 최종배 기자 jovia@fomos.co.kr[게임&게이머, 문화를 전합니다. 포모스게임│무단 전재 및 재배포 금지]포모스",105,https://n.news.naver.com/mnews/article/236/0000212703?sid=103
"방통위, 본인확인기관 추가 지정 추진…재수한 네이버·카카오·토스 통과할까",2021.05.18. 오후 2:00,"[서울=뉴시스] 이진영 기자 = 방송통신위원회는 2021년도 본인확인기관 지정 심사 계획을 18일 발표했다. 본인확인기관은 주민등록번호를 사용하지 않고 휴대폰·신용카드·생체인증 등 대체 인증 수단으로 본인인증을 하는 기관을 뜻한다. 국내에선 총 19개 사업자가 본인확인기관으로 지정돼 있다. 패스(PASS) 앱을 제공하는 이동통신 3사가 점유율 98%를 차지하고 있다. 네이버, 카카오, 토스는 공인인증서 폐지를 앞두고 지난해 9월 방통위에 본인확인기관 지정 심사를 신청했으나 탈락한 바 있다. 이들은 이번에 재도전할 것으로 예상된다. 방통위는 본인확인기관 지정을 희망하는 법인들은 오는 20일부터 24일 닷새간 수요 조사서를 제출해야 하며, 수요조사서를 제출한 법인들을 중심으로 25일 설명회가 개최될 예정이라고 설명했다. 지정심사 신청은 내달 7일부터 9일까지 방통위에 방문해 제출하면 된다. 또 심사결과는 신청을 받은 날부터 90일(30일 연장 가능) 안에 통지될 예정이다. 심사는 물리적·기술적·관리적 조치계획, 기술적 능력, 재정적 능력, 설비규모의 적정성 등 총 92개 항목에 대해 실시해 본인확인업무를 안전하고 신뢰성 있게 수행할 능력이 있는지를 판단하기로 했다고 방통위는 전했다. 



(출처: 방송통신위원회)아울러 방통위는 본인확인기관 지정·관리 전반을 개선하기 위한 고시 개정 검토도 병행할 방침이다.92개 전체 심사항목에 대해 모두 '적합' 판정을 받아야 하는 현 심사방식을 재검토해, 핵심적인 심사항목 위주로 보다 엄격하게 심사하는 방안을 마련한다는 계획이다. 아울러 기술 발전을 반영해 심사기준을 현행화하고, 조건부 지정, 사업계획서 변경 등 사후관리 절차 규정도 정비할 방침이다. 한상혁 방통위원장은 ""기술발전과 다양한 서비스의 등장으로 본인확인업무의 중요성이 강조되고 있는 상황""이라며 ""국민들께서 안심하고 편리하게 다양한 본인확인 수단을 이용할 수 있도록, 본인확인기관에 대한 심사와 점검을 철저히 하고 제도개선도 함께 추진하겠다""고 말했다.☞공감언론 뉴시스 mint@newsis.com▶ 네이버에서 뉴시스 구독하기▶ K-Artprice, 유명 미술작품 가격 공개▶ 뉴시스 빅데이터 MSI 주가시세표 바로가기<ⓒ 공감언론 뉴시스통신사. 무단전재-재배포 금지>",105,https://n.news.naver.com/mnews/article/003/0010504332?sid=103
"9년후 지구 초근접 소행성, 국내 개발 탐사선으로 직접 관측한다",2021.05.18. 오후 7:07,"9년 후 지구에 초근접 하는 소행성 '아포피스' 관측을 위해 한국천문연구원이 탐사선을 띄우는 계획을 추진합니다. 한국과학기술원(KAIST)은 국내 최초 인공위성인 '우리별 1호' 귀환 임무에 나서고, 한국항공우주연구원은 한국형 발사체를 이용한 달 탐사 프로젝트를 수행합니다. KAIST와 항공우주연구원, 한국천문연구원은 오늘(18일) 대전 KAIST에서 '심우주 탐사 전문가 간담회'를 열고 이 같은 내용을 담은 중장기적 심우주 탐사 계획을 밝혔습니다. 우선 천문연은 지구 충돌 가능성이 꾸준히 제기돼 온 천체인 소행성 아포피스 탐사를 추진합니다. 2004년 처음 발견된 아포피스는 서울 63시티(249m), N 서울타워(233m) 등과 크기가 비슷합니다.   2029년 4월 13일 지구 정지궤도까지 근접해 지나갈 것으로 예상되는데, 이때 지구와의 거리는 3만7천㎞로, 이는 천리안·무궁화 등 정지위성보다도 4천㎞ 더 가까운 거리입니다. 아포피스 크기의 소행성이 이처럼 지구에 가까이 접근할 확률은 1천년에 한 번꼴로 매우 희박합니다. 천문연은 2029년 동행 비행(랑데뷰·궤도를 수평으로 함께 도는 것) 방식으로 아포피스 소행성을 직접 탐사하는 것을 목표로 탐사 임무 연구를 진행하고 있습니다. 올해 예비타당성 조사를 준비해 내년 통과되면 2027∼2028년께 탐사선을 발사할 계획입니다. KAIST는 30년 전 발사된 우리별 1호 귀환 프로젝트를 추진합니다. 우리별 1호는 국내 최초의 인공위성으로, 1992년 8월11일 오전 8시8분 남미 기아나의 쿠루우주기지에서 발사됐습니다. KAIST는 40년 만인 2032년 우리별 1호 귀환을 목표로 랑데뷰·근접 비행을 실증한다는 방침입니다. 위성 포획을 위해 한국형 발사체를 활용할 계획입니다.  장태성 KAIST 인공위성연구소 박사는 ""뉴 스페이스 시대 통신위성과 초소형 위성이 급증하면서 지구 궤도 우주 쓰레기 위협이 문제가 되고 있다""며 ""위성 귀환 임무를 성공적으로 수행한다면 심우주 탐사용 플랫폼 기술로 활용할 수 있을 것""이라고 말했습니다. 항공우주연구원도 2030년 한국형 발사체를 이용한 달 착륙선 개발을 목표로 영상항법기술, 달 탐사 로버, 착륙장치, 통신중계 기술 개발 등을 추진합니다. 용홍택 과학기술정보통신부 1차관은 ""오는 10월 누리호 발사 이후에는 국내 우주개발 역량을 더 높이기 위해 우주탐사 계획 수립 등 우주개발 고도화 준비를 해야 할 것""이라며 ""오늘 논의된 내용을 올해 하반기 수립 예정인 '국가 우주탐사 로드맵'에 반영하겠다""고 말했습니다.[사진 출처 : 연합뉴스 / NASA·JPL=Calthch 제공]최건일 (gaegoo@kbs.co.kr)▶ 더 빠르고 정확한 소식을 원하시면 KBS뉴스 구독!▶코로나19 언제 어떤 백신을 누가 맞을까?▶ 제보는 KBS! 여러분이 뉴스를 만들어 갑니다",105,https://n.news.naver.com/mnews/article/056/0011046530?sid=103
