title,date,main,section,url
지스타 신작 1등…넥슨의 종합선물세트 [지스타 다녀왔습니다②],2022.11.25. 오후 3:38,"소문난 잔치에 먹을 것 없다는 말은 누가 했을까요? 올해 지스타 게임 잔치에는 상다리가 부러질 정도로 맛있는 게임 신작들이 가득했습니다.그 중에서도 `넥슨`은 지스타의 주인공 중 하나였는데요. 4년 만에 지스타 행사에 귀환한 넥슨은 총 9종의 신작과 함께 가장 큰 규모의 부스를 차리며 관람객들을 맞이했습니다. 그런 만큼 현장에는 정말 많은 인파가 몰리기도 했죠.[정말 다들 집중해서 열심히 게임을 즐기고 있습니다. 저도 한 번 게임을 해보고 싶은데 워낙 줄이 길어서 오늘은 게임을 못해볼 것 같을 정도입니다.]넥슨이 올해 지스타에서 공개한 신작의 특징 중 하나는 익숙한 이름이 많이 보인다는 점입니다. 마비노기, 카트라이더 등 모두 이미 팬층이 두텁게 형성된 IP를 기반으로 하는 신작이 대거 출시됐는데요. 프로젝트 AK와 프로젝트 오버킬 역시 ‘던전앤파이터’ 세계관을 담은 신작입니다.이렇게 기존 IP가 있는 신작들은 장점이 명확합니다. 게임 팬 입장에선 익숙하고 재미있게 즐겼던 게임이 업그레이드 되어 돌아오니 좋고, 회사 입장에선 이미 검증된 IP인 만큼, 실패확률이 적은 시도라는 점이죠.[최성욱 / 넥슨코리아 퍼블리싱라이브 본부장 : 4년 넘게 많이 준비한 게임들이 이번 시즌을 준비하고 있기 때문에 꼭 한번 플레이 해보셨으면 좋겠고요 출시했을 때도 많은 사랑을 부탁드리겠습니다.]`마비노기 모바일`은 오랜 기간 서비스해온 PC 게임 `마비노기`를 모바일로 이식한 게임입니다. 게임은 원작의 개발사인 데브캣이 개발을 진행하며, 내년 중 출시될 예정인데요. 넥슨은 원작의 높은 자유도와 생활 콘텐츠를 제공하면서도, 전투의 액션과 타격감에도 공을 들였다고 설명했습니다.카트라이더 드리프트는 두 말하면 입 아픈 `국민 레이싱 게임`이죠. 이번 신작은 카트라이더 시리즈의 정식 후속작으로, 2023년 1월 12일 글로벌 프리시즌을 개막합니다.4K UHD 그래픽과 HDR 기술, 돌비 애트모스 사운드 등을 탑재하며 하드웨어적으로 체급을 훌쩍 키우며, 게임의 몰입감과 보는 재미는 더욱 커졌고요. 실제로 현장에서 넥슨 부스를 방문한 관람객들은 호평을 늘어놓았습니다.[조성준 / 경남 진해시 : 오늘 카트라이더 드리프트도 해보고 이제 마비노기 모바일해보러 갈 거예요. 지금까지 카트라이더 드리프트 해봤는데, 아 게임 잘 만들었습니다.][배소윤 / 부산 금정구 : 오늘 와서 폴가이즈랑 카트라이더 해봤어요. 자주 했던 게임이라 재밌었어요. 쉽게 할 수 있고 많은 분들이 할 수 있어서 재밌었습니다.]던전앤파이터 세계관을 이어가는 프로젝트 AK와 프로젝트 오버킬은 네오플이 개발 중인 신작으로, 출시일은 정해지지 않았습니다. 때문에 올해 지스타에서도 영상으로만 공개됐는데요.프로젝트 오버킬은 기존 횡스크롤 방식이었던 원작 던파와 달리, 8방향 액션을 도입하며 보다 입체적인 전투를 즐길 수 있을 전망이고요. 프로젝트 AK는 ‘소울라이크’ 장르로 개발 중이며, 액션의 끝을 보여주겠다는 만큼 게임에 거는 기대감도 상당합니다.[이정헌 / 넥슨코리아 대표 : (프로젝트AK는) 소울라이크 형태로 컨트롤과 액션성을 극한까지 끌어올려보자. 내부적으로는 네오플 개발팀에서 한번 올해의 게임(GOTY·Game Of The Year) 한 번 받아보자는 목표로 딱 설계된 플레이 안에서 극강의 액션을 구현해보자고 만들고 있습니다.]한 달에 1억 명 넘게 방문하는 게임플랫폼인 `스팀`에서 인기순위 1위를 기록한 신작도 있습니다. 넥슨의 개발자회사 `민트로켓`이 개발 중인 `데이브 더 다이버`는 지난 10월부터 스팀에서 앞서 해보기(얼리억세스·Early Access)로 출시된 이후 ‘압도적 긍정’ 평가를 받으며 순항 중인데요.게이머는 게임 속에서 낮에는 다이버가 되어 물고기를 잡고, 저녁엔 초밥집을 운영하게 되는데요. 장인 정신이 담긴 도트 그래픽으로 바닷속 풍경을 유려하게 표현했고, 탄탄한 스토리 라인에 유쾌한 컷씬들도 재미를 더했습니다.올해 지스타 넥슨 부스에서 또 하나 특이한 점은 ‘콘솔’ 게임을 즐길 수 있는 부스가 마련됐다는 겁니다. ‘데이브 더 다이버’는 닌텐도로 시연했고, 이제부터 소개해 드릴 ‘퍼스트 디센던트’도 플레이스테이션5에서 직접 즐겨볼 수 있었는데요.이렇게 넥슨이 멀티 플랫폼을 강조하는 이유는 글로벌 시장을 공략하기 위해서입니다. 서구권 게임 시장의 콘솔게임 비중이 40%에 달하는 만큼, 이 시장을 공략하려면 콘솔 게임 개발은 선택이 아닌 필수인 것이죠.[최성욱 / 넥슨 퍼블리싱라이브 본부장 : 예년과 다르게 PC와 모바일 그리고 콘솔 플랫폼까지 다양하게 준비를 하고 있습니다. 넥슨에서 글로벌 플랫폼뿐만 아니라 국내 시장, 글로벌 시장 모두 다 유저분들께 재밌는 게임을 많이 보여드리려고 노력을 많이 하고 있습니다.]이 같은 맥락에서 지스타에서 선보인 넥슨의 기대작이 ‘퍼스트 디센던트’입니다. 이 게임은 넥슨게임즈에서 개발 중인 AAA급 신작으로, 내년 출시 예정 신작인데요.퍼스트 디센던트는 3인칭 슈팅 전투와 RPG 장르를 결합한 ‘루트슈터’ 장르의 게임입니다. 게임을 진행하며 아이템도 얻고 무기도 업그레이드할 수 있는 요소가 추가되며 RPG의 맛을 더한겁니다.전투는 물론이고 캐릭터 그래픽도 유려하게 구현됐습니다.언리얼 엔진 5로 실사에 가까운 그래픽을 구현한데다가, 캐릭터별로 다양한 스킨도 마련됐고, 커스텀 요소들도 충분한 만큼, 원하는 대로 캐릭터를 커스텀할 수 있었습니다.2019년 `선택과 집중`을 표방한 이후, 4년 만에 모습을 드러낸 넥슨의 신작들. 오랜 기간 공들인 만큼 평단과 게임 이용자 모두의 호평을 이끌어낼 수 있을지 주목됩니다.",105,https://n.news.naver.com/mnews/article/215/0001067929?sid=103
,,,105,https://n.news.naver.com/mnews/article/347/0000168254?sid=103
"美 법원, 삼성전자 前 임원 특허소송 참여자격 박탈",2022.11.25. 오후 3:33,"안승호 전 IP담당 부사장, 美 법원에 특허소송...삼성, 반소 제기삼성전자 지식재산권(IP) 부사장 출신인 안승호 시너지IP 대표가 친정인 삼성전자를 상대로 낸 기술 특허 침해소송에서 참여 자격을 박탈 당했다.25일 삼성전자에 따르면 미국 텍사스 법원은 지난주 안승호 시너지IP 대표가 소송 참여 제한을 박탈했다. 이와 함께 시너지IP 상무인 삼성전자 IP센터 전 사내변호사 출신 조 모씨 또한 소송 참여 자격을 상실했다. 이는 삼성전자가 지난 9월 안 대표에 대해 소송 자격 박탈 요청에 따른 법원의 결정이다. 결과적으로 안 전 부사장과 조 전 변호사는 향후 재판에 참여할 수 없다.텍사스 법원은 ""안 전 부사장이 삼성전자의 주요 IP 관련 대응전략을 알고 있었던 내부자임이 인정되며, 재직 당시 취득한 정보를 재판에 이용할 가능성이 있기 때문""이라고 판결 취지를 설명했다.



삼성전자 서초사옥안승호 전 삼성전자 IP센터장(부사장)은 자신이 설립한 특허 업체 시너지IP를 통해 지난해 11월 미국 텍사스 동부지방법원에 삼성전자가 10건의 특허를 침해했다며 소송을 제기했다.이번 소송의 공동 원고는 미국 이어폰·음향기기 업체 스테이턴 테키야 LLC이다. 시너지IP는 지난해 6월 설립된 특허법인이며, 소송과 관련된 권한을 스테이턴 테키야로부터 위임받았다.안 전 부사장이 무단 침해를 주장하고 있는 특허는 무선이어폰과 음성 인식 관련 '올웨이즈온 헤드웨어 레코딩 시스템' 등 10여건이다. 이 기술은 스마트폰 갤럭시S20 시리즈와 갤럭시버즈 등에 탑재돼 왔다.이에 따라 삼성전자는 안 전 부사장 등에게 영업비밀 도용, 신의성실 의무 위반 등을 주장하는 반소를 제기한 상태다. 또 지난 9월 추가로 소송관여 금지를 신청했다.안승호 전 부사장은 엔지니어 출신 미국 특허변호사이며, 1997년부터 삼성전자 특허 업무를 맡았다. 그는 2010년 IP센터장으로 선임돼 2019년 퇴임 전까지 전사 IP업무를 담당했다. 삼성전자 재직 당시 2011년 애플과 삼상전자의 소송전을 총괄했고, 구글과 크로스 라이선스 계약을 주도한 것으로 알려져 있다. 그러나 안 전 부사장의 업무는 특허 소송에만 주력했을 뿐, 해당 기술 개발을 담당한 것은 아닌 것으로 알려졌다.",105,https://n.news.naver.com/mnews/article/092/0002274805?sid=103
"앱마켓, '아동, 청소년 온라인 보호' 자체 단속",2022.11.25. 오전 9:47,"갤럭시스토어, 14세 미만 미성년자 보호자 동의 재인증원스토어도 아동·청소년 개인정보 입력 프로모션 중단개보위, '아동·청소년 개인정보 보호 가이드라인' 법제화 논의



삼성 갤럭시스토어. 사진=삼성전자 홈페이지 디지털 시대 온라인상의 아동·청소년 개인정보 보호 필요성이 커지면서 국내 애플리케이션(앱)마켓 사업자들이 자체 단속에 나서고 있다. 미성년자의 경우 보호자 동의를 포함한 재인증 절차를 거치도록 하고 개인정보 수집을 금지한다.25일 업계에 따르면, 삼성 갤럭시스토어에서는 11월 30일까지 만 14세 미만 미성년자를 선별해 사용자 재인증 절차를 진행한다. 대상자는 보호자 동의를 받아야만 이후에도 갤럭시스토어를 정상적으로 이용할 수 있다. 재인증을 거치지 않을 경우 관련 개인정보와 기존 앱 사용 정보, 콘텐츠 다운로드 이력 등은 삭제된다. 이는 갤럭시테마 앱에서도 동일하게 진행된다. 다만 유료 앱의 경우 보호자의 동의가 필수이기 때문에 예외 조처될 전망이다.원스토어에서는 이에 앞서 자체 단속 고삐를 죈 바 있다. 원스토어는 아동·청소년 대한 개인정보보호 정책을 시행하면서 현금이나 아이템 등의 지급을 조건으로 개인정보를 입력하는 프로모션은 시행하지 않도록 자체 점검 중이다. 아동·청소년의 행태정보 수집은 원칙적으로 금지해 맞춤형 광고를 차단했고, 14세 미만 아동의 개인정보 수집에 대해서는 법정대리인의 동의를 포함해왔다.플레이스토어를 운영하는 구글 등 해외 앱마켓 사업자들도 기존 정책에 이런 방침을 일부 포함해왔다. 구글은 '어린이와 가족을 위한 앱 설계' 정책을 통해 앱이 아동 또는 연령을 알 수 없는 사용자에게 광고를 표시할 경우 구글 플레이 인증 광고만 사용하도록 제한하고 있다. 아동의 민감한 정보와 개인정보 수집 시 수집 사실도 미리 공개하도록 조치하고 있다.디지털 사회로의 급격한 전환과 함께 아동·청소년이 온라인 활동에 참여하는 시기가 점점 빨라지고 온라인 서비스 이용 과정에서 제공한 정보가 장기간 축적되면서 개인정보 침해에 대한 우려가 커졌다.이에 지난 7월 개인정보보호위원회는 아동·청소년 개인정보 보호 가이드라인을 제정, 발표했다. 가이드라인 주요 준수사항에는 개인정보 보호 중심 설계 원칙에 따른 서비스 기획, 만 14세 미만 아동의 개인정보 수집 동의 시 법정대리인 동의, 수집한 아동·청소년 개인정보의 안전한 이용과 보관, 명확한 개인정보 관련 사항 안내고지, 개인정보 정정·삭제권 등 권리 행사 적극 지원 방안 등이 포함됐다.개보위는 학계·산업계·시민단체 등 전문가, 아동·청소년, 학부모와의 소통을 통해 가이드라인을 보강할 계획이다. IT기업들이 포함된 한국인터넷기업협회나 코리아스타트업포럼 등 관련 사업자들도 포함됐다. 내년에는 가이드라인 수준의 규제를 법제화하기 위한 노력도 병행한다는 방침이다.개보위 관계자는 ""가이드라인에 명시된 내용이기 때문에 강제성을 띠지는 않지만, 일부 사업자들이 이에 맞춰 정책 변경에 나선 것으로 안다""며 ""정책협의체를 구성해 소통을 지속하면서 이행관리 체계를 구축하고 자율 규제를 확산하려고 한다""고 말했다.",105,https://n.news.naver.com/mnews/article/277/0005182837?sid=103
"컴투스, ‘크로니클’ 출시 100일 기념 사회공헌 캠페인",2022.11.25. 오전 11:15,"[이데일리 김정유 기자] 컴투스(078340)는 소환형 MMORPG ‘서머너즈 워: 크로니클’(이하 크로니클) 출시 100일을 맞아 사회공헌 캠페인을 실시한다고 25일 밝혔다.지난 8월 국내 서비스를 시작한 ‘크로니클’은 ‘서머너즈 워’ 지식재산(IP)을 기반으로 제작된 최초의 MMORPG다. 개성 있는 3명의 소환사와 350여종의 소환수를 활용한 전략 전투, 풍부한 콘텐츠 등으로 인기를 얻고 있다. 구글과 애플 양대 앱 마켓 인기 게임 1위·매출 상위 10위권 진입에 성공했고, ‘2022 대한민국 게임대상’에서 우수상을 수상하기도 했다.컴투스는 ‘크로니클’ 출시 100일을 기념해 기부에 동참하고 아이템도 받을 수 있는 이벤트를 다음달 6일까지 마련한다. 다음달 6일까지 매일 ‘크로니클’에 접속하거나 성장의 길, 아레나 완료 등 미션을 완수해 1포인트씩 적립할 수 있으며, 각 미션의 일정 포인트를 획득할 때마다 최대 100만 골드, 데빌몬, 전설의 소환서 등 다양한 아이템을 받을 수 있다.공동 목표인 전체 누적 포인트 합산이 목표치를 달성하면, 컴투스가 조성한 기부금을 ‘국제아동권리 NGO 세이브더칠드런’에 전달해 사회공헌 활동을 전개한다. 기부금은 취약계층 아동들의 겨울철 방한 및 난방 용품 지원을 위해 사용될 예정이다.",105,https://n.news.naver.com/mnews/article/018/0005374776?sid=103
"기술거래사회, 산업별 협·단체와 업무협약 체결…사업 지원을 위한 네트워크 구축",2022.11.25. 오후 3:44,"한국기술거래사회는 6개 산업별 협 단체와 업무협약을 체결했다(사진 왼쪽부터 조남권 의료기기공업협동조합 전무, 이창한 한국반도체산업협회 상근부회장, 남인석 한국기술거래사회장, 이의현 한국금속공업협동조합 이사장, 여재천 한국신약개발연구조합 상근이사, 이상진 한국디스플레이산업협회 상무이사).한국기술거래사회(회장 남인석)는 한국전자정보통신산업진흥회, 한국반도체산업협회, 한국디스플레이산업협회, 한국신약개발연구조합, 한국의료기기공업협동조합, 한국금속공업협동조합 등 6개 기관과 기업 기술이전·사업화 촉진을 위한 산업별 단체 협약식을 지난 25일 체결했다.업무협약 주요 골자는 △기술이전·사업화 확산을 위한 협의회 구성·운영 △기술수요·공급 발굴 협력과 연구개발 연계 △협약기관 회원 기업이 보유한 기술 이전·사업화을 위한 컨설팅 지원 등이다.이들 기관은 이를 통해 개별 기업과 산업별 협회·단체, 기업지원 유관기관, 기술거래사 등 민간 차원 기술거래전문가 네트워크를 구축해 우수기술의 기술이전·사업화를 촉진하기로 했다.남인석 한국기술거래사회장은 “디지털 전환시대를 맞이해 산업간 경계가 무너지고, 경쟁양상이 기존 개별 기업 경쟁에서 시스템 경쟁으로 변화하고 있다”면서 “실무협의회 구성을 통해 수요기업이 '필요로 하는 기술의 적시 공급'을 통한 기술이전·사업화를 성공적으로 지원하겠다”고 말했다.",105,https://n.news.naver.com/mnews/article/030/0003061811?sid=103
"영국, 안보 위협 ‘중국 CCTV’ 퇴출…세계 엑소더스 ‘신호탄’?",2022.11.25. 오전 10:44,"- 영국 정부, 주요 시설 中 CCTV 배제…기존 장비도 교체   [디지털데일리 윤상호 기자] 영국이 통신장비에 이어 폐쇄회로(CC)TV 분야 중국 기업 퇴출에 나섰다. 영국 정부는 중요 건물에 중국 업체 CCTV 설치 중단을 지시했다. 기존 제품은 순차 교체키로 했다.   24일(현지시각) 영국 로이터에 따르면 영국 정부는 각 부처에 이날 중국 업체가 제조한 CCTV를 배제하라고 전달했다.   영국의 결정은 중국 CCTV업체가 중국 정부에게 협력할 경우 안보 위험이 발생할 수 있다는 우려 때문이다. 영국은 같은 이유로 5세대(5G) 이동통신 등에서 중국 통신장비 사용을 금지했다. 미국 등 서방 국가 대부분도 영국과 같은 생각이다.   로이터는 “영국은 현재와 미래에 발생할 수 있는 위험을 검토 후 내린 결정”이라며 “기존 장비는 네트워크 분리 및 교체 권고 등도 포함했다”라고 보도했다.   중국 CCTV업계는 세계 CCTV 시장을 주도하고 있다. 중국 하이크비전은 세계 CCTV 점유율 1위다. 중국 정부 주도로 안면인식 등 인공지능(AI) 솔루션을 고도화했다. 소수민족 탄압 등 중국 인권 문제에 이들 업체 이름이 오르내리는 이유다. 하이크비전은 이 문제로 미국 상무부 산업안보국(BIS) 수출통제명단(Entity List)에 들어갔다.   한편 영국의 결정이 세계에 미칠 영향에 관심이 모아진다. 미국 등도 중국 CCTV 금지를 추진하고 있지만 비용 등의 문제로 속도를 내지 못하고 있다.",105,https://n.news.naver.com/mnews/article/138/0002137556?sid=103
"""-1억"" 위믹스 투자자들 충격·분노·절망…일부는 ""끝까지 믿는다""",2022.11.25. 오후 3:50,"[상장 폐지 공지 이후 위믹스 가격 3분의 1토막엇갈린 투자자 반응…대규모 피해에 집단소송 암시도]



 25일 장현국 위메이드 대표가 국내 5대 가상자산 거래소에서 위믹스의 거래 정지 결정에 대해 거래종료 과정과 결정이 부당하게 이뤄졌다며 지적했다. 또 ""위믹스 이외의 가상화폐 발행 계획은 없다""라고 기자간담회를 통해 밝혔다.  사진은 이날 경기도 성남시 위메이드 본사 모습. /사진=뉴스1 위메이드의 가상화폐 위믹스가 상장 폐지 결정으로 하룻밤새 70% 이상 폭락한 가운데 투자자들은 충격에서 헤어나오지 못하고 있다. 회사를 믿고 투자했는데 큰돈을 잃었다며 분통을 터뜨리거나, 집단소송까지 불사하겠다는 목소리가 터져나온다. 반면, 장현국 위메이드 대표의 간담회를 보고 끝까지 믿고 함께하겠다는 투자자도 적지않다. 25일 가상화폐 정보사이트 코인마켓캡에 따르면 이날 오후 3시 위믹스 가격은 약 519원으로 하루 전인 지난 24일 오후 3시(약 2050원)보다 75% 이상 떨어졌다. 시가총액도 하루 만에 3800억원가량 증발했다. 대다수 투자자들은 위메이드와 장현국 대표를 향한 분노를 표출하고 있다. 지난주 국내 최대 게임쇼 지스타에서 위믹스가 상장 폐지될 일이 없다고 호언장담한 장 대표의 말을 믿고 투자했는데, 상당액을 날렸다는 이유에서다.  이날 위믹스 투자자들이 모인 텔레그램에서는 ""저 7000만원 날아갔습니다"", ""1억 이상 잃은 사람은 많다"", ""내 돈 1억 어쩌나"" 등 투자손실에대한 절망감과 분노를 토로했다. 위메이드를 상대로 집단소송을 제기할 것이라는 투자자도 있었다. 위믹스 상장폐지가 업비트의 불공정 행위라는 장현국 대표의 주장에 ""해외 거래소에서도 상장 폐지 이야기가 나오는데도 업비트의 갑질이라고 할 텐가""라며 비꼬는 이도 있었다. 실제 이날 오후 해외 거래소 바이비트는 ""토큰 관리 규정에 부합하지 않는다""며 위믹스 거래 관련 경고문을 게시했다. 위믹스 상장폐지 가능성을 시사한 것이다.반면, 이날 오전 장현국 대표의 간담회를 보고 끝까지 믿어보겠다는 투자자들도 있었다. 위믹스 투자자 카페에는 ""끝까지 책임지려는 모습, (장 대표의) 뜨거운 눈물을 보니 마음이 굳건해진다""며 ""떨어지면 매수하고 장 대표님의 꿈에 투자하겠다""는 글들이 올라왔다. 또 다른 투자자는 ""장 대표가 감히 업비트에 형사 고발까지 얘기 꺼내는 것 보고 이건 혁명 같다는 생각마저 들었다""며 ""위믹스와 운명을 함께하겠다""고 썼다. 이 글에는 ""저도 같이 갑니다"", ""끝까지 함께 가요"" 등의 댓글이 달렸다. 이들은 ""위믹스가 상장폐지면 다른 코인도 상장 폐지 대상""이라며 거래소를 대상으로 집단 소송에 나서자는 의견도 내놨다.",105,https://n.news.naver.com/mnews/article/008/0004822344?sid=103
,,,105,https://n.news.naver.com/mnews/article/236/0000229338?sid=103
