title,date,main,section,url
"“전직군 뽑아요”…당근마켓, 100명 이상 대규모 채용",2021.12.06. 오후 4:48,"[디지털데일리 이안나 기자] 당근마켓이 100명 대규모 인재 영입에 나선다.   지역생활 커뮤니티 당근마켓(대표 김용현 김재현)은 5주간 100명 이상 전직군 채용 캠페인 ‘+100멤버스(members)’를 실시한다고 6일 밝혔다.   이번 채용 캠페인은 일주일 단위로 특정 포지션을 집중 채용한다. 매주 정해진 직군에 따라 서류 접수를 순차 마감하는 방식이다.    1주 차엔 ▲경영지원 ▲데이터분석 ▲마케팅 ▲세일즈·운영 ▲콘텐츠 직무 집중 채용이 이루어진다. 이어 2주 차에는 ▲프론트엔드 ▲모바일앱(안드로이드·iOS) 개발자, 3주 차엔 ▲PM(프로덕트 매니저) ▲디자인 직군 채용이 진행된다.    4주 차에는 ▲백엔드 서버 개발 ▲SRE(사이트 신뢰성 엔지니어링) ▲보안 직군에 집중할 계획이며, 5주 차에는 ▲검색 ▲머신러닝 ▲데이터 엔지니어링 직군 서류접수를 진행한다.   당근마켓은 이번 대규모 인재 영입으로 서비스 고도화와 사업 확장에 필요한 각 분야 전문 인력들을 대거 흡수한다는 계획이다. 현재 임직원 수 250여명 규모 당근마켓은 이번 집중 채용을 통해 350명 규모로 확대된다.    김용현 당근마켓 공동 대표는 “당근마켓 구성원들이 업무에 몰입하고 개인 성장도 도모할 수 있는 최적의 업무환경을 만들기 위해 노력하고 있다”며 “당근마켓과 함께 세상에 선한 영향력을 전파하는 로컬 커뮤니티 서비스를 만들고 싶은 분들, 성장에 대한 열정과 역량을 가진 인재분들의 많은 지원을 부탁드린다”고 전했다.",105,https://n.news.naver.com/mnews/article/138/0002114785?sid=103
"LG전자, 상생결제·일감개방 모범 사례로 뽑혔다",2021.12.06. 오후 2:31,"작년 상생결제 낙수율 7.4%, 올해 두 자릿수 넘을 전망LG전자가 협력사와 상생결제를 확대하며 건전한 기업 생태계 구축에 앞장서고 있다고 평가 받았다.공정거래위원회, 중소벤처기업부, 고용노동부 등 5개 관계부처는 6일 정부서울청사 별관에서 '공정경제 성과 보고대회'를 열고 상생결제, 일감개방, 기술지원 등에서 우수한 성과를 보인 기업들을 소개했다. 이날 LG전자는 상생결제를 통해 협력사의 자금유동성을 높이는 데 기여하고 2차 협력사까지 상생결제를 확산한 모범사례로 선정됐다.



LG전자 트윈타워LG전자는 행사에서 2차 협력사까지 결제환경을 개선한 사례를 발표했다. 이어 LG전자 2차 협력사 태양에스씨알은 1차 협력사로부터 물품 대금을 상생결제로 지급받아 자금유동성을 확보하고 경영 안정성을 높인 사례를 소개했다.지난해 LG전자는 1차 협력사에 상생결제 방식으로 7조1천484억원의 대금을 지급했다. 이 중에서 5천314억원이 2차 협력사에 지급되며 상생결제를 통한 낙수율이 국내 대기업 가운데 가장 높은 7.4%를 기록했다.낙수율은 대기업이 1차 협력사에 지급한 물품 대금이 2차 이하 협력사까지 전달되는 비율을 의미한다. LG전자는 올해 상생결제 확대에 따라 상생결제 낙수율이 두 자릿수를 넘을 것으로 전망하고 있다.LG전자는 2015년 도입한 상생결제를 통해 2차 이하 협력사도 직접적인 도움을 받을 수 있도록 1차 협력사의 참여를 독려하고 있다. 상생결제에 참여한 협력사에는 정기평가에서 가점을 부여해 다양한 혜택을 주고 있다. 또 협력사가 LG전자 상생협력펀드에 가입하기 위한 조건에 상생결제 실적을 반영하고 있다. 협력사는 자금이 필요할 때 상생협력펀드를 통해 저금리로 대출받을 수 있다.상생결제는 대기업이 1차 협력사에 지급한 물품 대금이 2차 이하 협력사까지 이어지도록 지원하는 것이 목적이다. 대기업이 금융기관의 전용 계좌에 물품 대금을 예치하면 결제일에 맞춰 2차 이하 협력사에 대금이 지급된다. 이 제도는 협력사가 결제일에 현금을 지급받을 수 있도록 보장하며 2차 이하 협력사는 결제일 이전에 대기업 신용을 바탕으로 물품 대금을 조기에 현금화할 수 있어 유용하다.앞서 LG전자는 올해 초에도 상생결제를 2차 협력사까지 확산시킨 공로를 인정받아 대·중소기업·농어업협력재단으로부터 '상생결제 우수기업'으로 선정된 바 있다.왕철민 LG전자 구매·SCM경영센터장 전무는 ""상생의 온기가 2차 이하 협력사까지 전달될 수 있도록 협력사와 함께 노력해 나갈 것""이라고 전했다.LG전자는 상생을 위해 경쟁력 강화, 차세대 기술 개발, 자금 지원, 교육 지원, 인프라 개선 등 5대 추진과제를 기반으로 다양한 협력사 지원정책을 펼쳐오고 있다.",105,https://n.news.naver.com/mnews/article/092/0002241245?sid=103
"당근마켓, 전 직군 100명 이상 신규 채용…직원수 350명까지 늘린다",2021.12.06. 오전 9:12,"각 직군별 1주일씩 집중 서류 접수 기간…5주간 서류 접수당근마켓(공동대표 김용현, 김재현)은 100명 이상의 전직군 대규모 채용 캠페인 '+100 멤버스(members)'를 5주간 실시한다고 6일 발표했다.일주일 단위로 특정 포지션을 집중적으로 채용하는 '+100 members'는 매주 정해진 직군에 따라 서류 접수를 순차 마감하는 형식으로 진행된다.



[사진=당근마켓]12월 6일부터 12일까지 1주차에는 ▲경영지원 ▲데이터분석 ▲마케팅 ▲세일즈·운영 ▲콘텐츠 직무의 집중 채용이 이뤄진다. 2주차에는 ▲프론트엔드 ▲모바일앱(Android, iOS) 개발자, 3주차에는 ▲PM(프로덕트 매니저) ▲디자인 직군 채용이 진행된다. 4주차에는 ▲백엔드 서버 개발 ▲SRE(사이트 신뢰성 엔지니어링) ▲보안 직군에 집중할 계획이며, 5주차에 마지막으로 ▲검색 ▲머신러닝 ▲데이터 엔지니어링 직군 서류접수가 진행된다.당근마켓은 현재 임직원 수 250여명 규모인데, 이번 채용으로 350명까지 확대한다는 방침이다. 최근 3년간 연평균 채용 규모가 2.7배씩 증가하고 있다.김용현 당근마켓 공동대표는 ""하이퍼로컬 혁신의 중심에 있는 당근마켓 구성원들이 업무에 몰입하고 개인의 성장도 도모할 수 있는 최적의 업무환경을 만들기 위해 노력하고 있다""라며 ""당근마켓과 함께 세상에 선한 영향력을 전파하는 로컬 커뮤니티 서비스를 만들고 싶은 분들, 성장에 대한 열정과 역량을 가진 인재 분들의 많은 지원을 부탁드린다""라고 말했다.",105,https://n.news.naver.com/mnews/article/031/0000640535?sid=103
"지니뮤직, ‘3000만불 수출의 탑’ 수상",2021.12.06. 오후 1:40,"[이데일리 이대호 기자] 지니뮤직(043610)이 제58회 무역의 날 시상식에서 ‘3000만불 수출의 탑’을 수상했다고 6일 밝혔다. 지난 2019년 ‘300만불 수출의 탑’ 수상을 시작으로 지난해 ‘2000만불 수출의 탑’ 수상했고, 글로벌 네트워크를 기반으로 가파른 성장세를 기록하며 올해 ‘3000만불 수출의 탑’을 받아 3년 연속 수상하는 쾌거를 달성했다.올해는 미국 타이달(TIDAL), 중국 화웨이뮤직(HUAWEI), 중동 앙가미(Anghami) 등과 음원 유통 직계약을 체결하며 보다 공격적인 행보로 글로벌 시장 공급을 확대했다. 이제 지니뮤직이 해외 시장에 공급하는 서비스 국가는 95개국, 음원 플랫폼은 50여개사로 늘어났다.지니뮤직은 앞으로도 음원 콘텐츠 유통 역량과 네트워크 인프라를 기반으로 글로벌 진출을 지속 확장해 나간다는 방침이다. 지난 2010년부터 해외 플랫폼에 음원을 공급하며 글로벌 진출로의 교두보를 마련한 데 이어 2018년에는 CJ 디지털뮤직과 합병함으로써 케이팝 유통 경쟁력을 강화했다. 지난 10월 출시한 양방향 소통 라이브 플랫폼 ‘STAYG(스테이지)’를 통해 글로벌 팬과 아티스트의 소통 기회를 넓히며 새로운 가치를 만들어갈 계획이다.지니뮤직 이해일 콘텐츠1본부장은 “당사는 앞으로도 케이팝의 가치를 글로벌 시장에 널리 알리는 데 적극적인 노력을 계속할 것”이라고 말했다.",105,https://n.news.naver.com/mnews/article/018/0005100983?sid=103
"방심위, ‘아이돌학교’에 과징금 철퇴…‘김어준의 뉴스공장’은 권고",2021.12.06. 오후 5:35,"방송통신심의위원회 전체회의 전경. 방심위 제공[이데일리 노재웅 기자] 방송통신심의위원회는 6일 서울 목동 방송회관에서 전체회의를 열고, 엠넷 ‘아이돌학교’ 등 총 12개 프로그램에 대해 심의하고 제재조치 등을 의결했다.방심위는 이날 회의에서 걸그룹 멤버 선발 과정의 시청자 투표결과를 조작해 합격자와 탈락자가 바뀌는 내용을 방송한 혐의로 아이돌학교에 대해 과징금 3000만원을 부과했다.생활정보 프로그램에서 허위 사례자, 전문가 등이 출연해 사실과 다른 내용을 방송한 SBS Biz ‘생생경제 정보톡톡’에 대해서는 과징금 1000만원을 부과했다.남녀 아이돌 그룹 멤버를 선발하는 오디션 프로그램에서 참가자의 사전 온라인 점수를 잘못 입력해 3명의 멤버를 투표결과와 다르게 선발한 KBS-2TV ‘아이돌 리부팅 프로젝트 더 유닛’은 ‘주의’ 조치를 내렸다.정경심 교수의 2심 판결과 관련해서 진행자와 출연자들이 대담하는 내용을 방송한 TBS-FM ‘김어준의 뉴스공장’에 대해서는 ‘권고’로 최종 의결했다.",105,https://n.news.naver.com/mnews/article/018/0005101229?sid=103
"임혜숙 과기장관, OECD 컨퍼런스서 포용적 기술전환 방안 제시",2021.12.06. 오후 7:50,"기사내용 요약과기장관, 'OECD 과학기술정책위원회 컨퍼런스' 온라인 참석""미래 예측을 통한 국가·사회 문제해결 강조""



[서울=뉴시스] 이진영 기자 = 과학기술정보통신부는 임혜숙 장관이 6일 화상으로 포용적 기술 전환을 주제로 개최된 경제협력개발기구(OECD) 과학기술정책위원회(CSTP) 컨퍼런스 고위급 회담에 참가했다고 발표했다. 포용적 기술 전환이란 신생 기술이 에너지, 식량, 보건, 교통 등 우리 삶과 밀접히 관련이 있는 영역에서 포용적이고 지속가능한 방식으로 활용될 수 있도록 하는 정책 지향점을 의미한다. 해당 고위급회담에는 임혜숙 장관을 포함해 이탈리아, 포르투갈, 영국, 유럽연합(EU) 장·차관급 인사와 연구·산업·노동계 대표들이 참석해 기술과 사회가 함께 갈 방안에 대해 의견을 나눴다. 임 장관은 이 자리에서 우리나라의 제5차 과학기술기본계획(2023~2027년) 수립 방향을 소개하며, 포용적 기술 전환을 위한 핵심 정책 방향으로 미래 예측을 통한 국가·사회 문제해결을 강조했다. 또 사회 전 영역에서 복잡성, 다양성, 불확실성이 높아지는 상황에서 과학기술 기반의 미래예측이 필수적이라는 점을 들며 이를 제5차 과학기술기본계획에도 적용할 예정이라고 밝혔다.아울러 ""바람직한 정책 성과목표 설정, 정책수단의 다양화, 폭넓은 주체의 참여 보장이 중요하다""고 언급했다. 끝으로 임 장관은 OECD 회원국들이 직면한 도전과제가 상호 연계돼 있는 만큼 지속적으로 소통하고 협력하자고 제언했다.",105,https://n.news.naver.com/mnews/article/003/0010874107?sid=103
"참여연대, 공정거래 가로막는 플랫폼 기업 항의 기자회견",2021.12.06. 오후 2:36,(서울=연합뉴스) 류효림 기자 = 참여연대 관계자들이 6일 서울 강남구 삼성동 한국인터넷기업협회 앞에서 열린 공정거래 가로막는 플랫폼 기업 항의 기자회견에서 온라인플랫폼법 제정을 촉구하고 있다. 2021.12.6    ryousanta@yna.co.kr,105,https://n.news.naver.com/mnews/article/001/0012865176?sid=103
"네이버웹툰 ‘지옥’, 넷플릭스 효과 톡톡...조회수 22배↑",2021.12.06. 오전 8:41,"주간 평균 결제자수 14배 증가넷플릭스 시리즈 '지옥'의 인기가 네이버웹툰 원작에도 이어지고 있다.네이버웹툰은 넷플릭스 시리즈 '지옥' 공개된 이후 원작 웹툰의 주간 평균 조회수가 약 22배, 주간 평균 결제자수가 약 14배 증가했다고 6일 밝혔다. 이는 넷플릭스 시리즈 공개 전 3개월 주간 평균 대비 공개 후 2주간 평균값을 비교 분석한 결과다.이와 함께 웹툰 '지옥'(글 연상호/그림 최규석)의 해외 연재도 활발하게 진행 중이다. 넷플릭스 시리즈 공개를 앞두고 원작 웹툰에 대한 해외 독자들의 관심이 증가해, 현재 웹툰 지옥은 네이버웹툰 글로벌 서비스를 통해 영어, 일본어, 태국어, 스페인어 등 총 10개의 언어로 제공되고 있다. 글로벌 연재 이후 ""넷플릭스 시리즈의 원작을 보러 왔다"", ""웹툰과 드라마 모두 강렬하다"", ""넷플릭스 시리즈의 감독이 웹툰 원작자라는 사실이 놀랍다"" 등 해외 독자들의 긍정적인 반응이 이어지고 있다.



네이버웹툰 '지옥'지난달 19일에 공개된 넷플릭스 시리즈 지옥은 웹툰 원작자인 연상호 감독과 최규석 작가가 연출과 극본에 직접 참여했다. 시리즈 공개 후 3일 동안 4천348만 시청 시간을 기록하며 넷플릭스 글로벌 톱10(비영어) 부문 1위를 차지해 전 세계적인 흥행에 성공했다.웹툰 지옥은 예고 없이 등장한 지옥의 사자들에게 사람들이 지옥행 선고를 받는 초자연적 현상이 발생하고, 이 혼란을 틈타 부흥한 종교단체인 새진리회와 사건의 실체를 밝히려는 이들이 얽히면서 벌어지는 이야기다. 2019년 8월 '프롤로그' 편을 시작으로 네이버웹툰에서 처음 공개됐으며 지난해 9월 완결됐다.",105,https://n.news.naver.com/mnews/article/092/0002241187?sid=103
"""더 크기 전에 잡아라""…AI 반도체社에 뭉칫돈",2021.12.06. 오후 5:37,"인공지능(AI)의 두뇌라 불리는 AI 반도체 기업들로 뭉칫돈이 몰리고 있다. 사물인터넷(IoT), 자율자동차 등 관련 산업에서 AI 기술에 대한 수요가 폭발하면서다.AI 반도체 스타트업 퓨리오사AI는 지난 6월 800억원의 시리즈B 투자 유치를 완료했다. 네이버 D2SF, DSC인베스트먼트, 산업은행 등이 투자에 참여했다. 퓨리오사AI는 데이터센터와 기업용 서버에서 AI 성능을 극대화할 수 있는 반도체를 개발하고 있다. 학습된 모델로부터 결과를 추론하는 데 최적화된 AI 칩을 설계한다는 평가를 받고 있다.딥엑스도 5월 210억원 규모 시리즈B 투자 라운드를 마감했다. 캡스톤파트너스, 신한캐피탈, 산업은행 등이 투자자로 나섰다. 딥엑스는 이번 투자 유치로 누적 투자금액 266억원을 달성했다. 딥엑스는 무거운 딥러닝 연산처리를 돕는 AI 반도체를 양산하는 기술을 개발하는 데 주력하고 있다. 리벨리온도 7월 145억원 프리A 시리즈를 마무리했다. 카카오벤처스, 서울대학교기술지주 등이 투자했다. 총 누적 투자금액은 205억원이다.시장조사기관 가트너의 분석에 따르면 세계 AI 반도체 시장은 향후 10년간 6배 성장해 2030년 총 1179억달러 규모로 커질 전망이다. 10년 뒤 전체 시스템 반도체 시장의 30%를 AI 반도체가 차지할 것으로 예상된다. 그럼에도 아직까지 AI 반도체 시장에 독보적인 점유율과 기술력을 보유한 업체는 없다. 정보기술(IT) 업계 관계자는 “반도체를 만들던 기존 대기업도 뚜렷한 기술력이 없는 뉴 마켓”이라며 “시장 선점을 위한 공격적 투자에 불이 붙고 있다”고 말했다.",105,https://n.news.naver.com/mnews/article/015/0004637290?sid=103
KT 희망나눔인상 1호 수상자는 `강동야학`,2021.12.06. 오전 10:57,"KT희망나눔인상을 수상한 '강동야학'의 입학식 모습. KT 제공    kt그룹희망나눔재단은 올 한해 나눔 활동으로 지속가능한 사회를 만드는 데 기여한 5명을 '희망나눔인'으로 선정해 'KT희망나눔인상'을 수여했다고 6일 밝혔다.'KT희망나눔인상'은 나눔으로 아름다운 사회 가치를 만드는데 기여한 사람들의 활동을 격려하고 나눔의 가치를 전파하고자 kt그룹희망나눔재단이 제정한 상이다. 지난 7월 21일부터 10월 30일까지 홈페이지를 통해 후보자 추천을 받았으며, 심사 및 인터뷰 과정을 거쳐 선정했다.1호 수상자는 교육 기회를 놓친 어르신 대상으로 초·중·고등 과정을 무료로 지도하는 교육학교 '강동야학'이 선정됐다.강동야학은 1989년 개교 이후 뜻있는 후원과 교사들의 자발적 무료 봉사로 운영되고 있으며, 매년 20~25명의 교사들이 활동하고 40여명의 학생들이 고등학교 검정고시를 목표로 교육을 받고 있다. 40여명의 학생 중 95% 이상이 50~70대로 구성돼 있으며, 매년 5~6명씩 지금까지 총 300여명의 고등학교 검정고시 합격생을 배출했다.강동야학 교사들은 ""코로나19로 후원금이 줄어 부족한 재정이지만 단 1명이라도 교육생이 남아있는 한 야학을 계속할 것이며, 자긍심을 가지고 야학을 운영해 나갈 수 있도록 이번 'KT희망나눔인상'을 수상하게 돼 감사하다""고 소감을 밝혔다.kt그룹희망나눔재단은 강동야학 외에도 어려운 이웃을 위해 1000원의 식사를 제공하는 '해뜨는 식당'의 김윤경(47) 씨, 장애인의 이동 편의를 위한 지도를 제작하는 협동조합 '무의'의 홍윤희(46) 씨, 17년간 어르신들께 무료 안경 나눔을 하는 강상구(53) 씨, 청소년들과 함께 지역사회 문제 해결을 위한 봉사단을 만들어 활동하고 있는 광양하이텍고등학교 김성태(44) 교사에게 KT희망나눔인상'을 수여했다. kt그룹희망나눔재단은 ""앞으로도 나눔의 실천을 전파하고 더불어 사는 사회를 만들기 위해 우리 사회 곳곳에서 묵묵히 활동하는 희망나눔인을 지속 발굴해 나갈 것""이라고 말했다.",105,https://n.news.naver.com/mnews/article/029/0002709593?sid=103
