title,date,main,section,url
"'포켓몬고'의 국내 첫 사파리존, 포켓몬빵으로 본 흥행 방정식",2022.09.11. 오전 9:00,"포켓몬고의 개발사 나이언틱은 올해 국내에서 화제가 된 '포켓몬빵' 열풍을 눈여겨본 것일까. 나이언틱은 이달 고양시 일산 호수공원에서 '포켓몬고'의 야외 이벤트 '사파리존'을 개최하기로 했다. 한국에서 진행되는 첫 사파리존 행사라는 데 의미가 큰데, 특히 이번 '포켓몬고 사파리존: 고양'에는 지난 상반기 한국에서 큰 인기를 끌었던 '포켓몬빵'의 흥행 공식도 담겨있어 주목할 만하다.한국, 포켓몬에 진심인 나라나이언틱은 오는 23일부터 25일까지 모바일 증강현실(AR) 게임 '포켓몬고'의 오프라인 라이브 이벤트 '사파리존'을 경기도 고양시 일산 호수공원에서 개최한다. 사파리존은 포켓몬고 이용자가 특정 지역에 모여 포켓몬을 잡으며 교류하는 이벤트로, 지난해 영국 리버풀과 올해 스페인 세비야에서 진행돼 호응을 얻은 바 있다. 



오는 23~25일 경기도 고양시 일산 호수공원에서 개최되는 '포켓몬고 사파리존: 고양'. (사진=나이언틱)나이언틱은 한국에서 사파리존을 진행하는 이유로 포켓몬고 출시 이후 진행한 국내 기업과의 협업 활동이나 '스포트라이트' 등 지난 이벤트의 성공적인 경험 등을 꼽았다. 하지만 그보다도 나이언틱이 한국에 대해 포켓몬고에 대한 관심이 높은 지역, 더 나아가 '포켓몬에 진심인 나라'로 인식하고 있다는 것이 가장 큰 이유로 보여진다. 지난 6일 나이언틱이 한국 미디어를 대상으로 진행한 '포켓몬고 사파리존: 고양' 온라인 간담회에서 ""한국은 굉장히 중요한 시장""이라고 이미 강조했다. 2017년 1월 포켓몬고의 한국 서비스가 시작됐던 당시 국내 포켓몬고의 인기는 상당했다. 지도 반출 논란으로 타 글로벌 지역(2016년 7월)보다 출시 일정이 늦었음에도, 2016년 여름 정식 서비스가 시작되기도 전 이용자들이 포켓몬고 플레이가 가능했던 속초 지역으로 대거 몰렸던 '포켓몬 붐'이 한 예다. 나이언틱으로서는 한국을 포켓몬고 흥행 시장으로 여기는 것은 어쩌면 당연하다. 눈여겨볼 만한 부분은 나이언틱 측에서 '포켓몬빵'에 대해 언급한 점이다. 이날 나이언틱 관계자는 ""2017년 1월 한국 론칭 후 SKT, 세븐일레븐 등 현지 기업들과 파트너십을 맺고 당시 '포켓몬고 시티 스포트라이트', '포켓몬스터 빵' 등 활발한 협업 활동을 진행했다""고 언급했다.국내 포켓몬스터 인기를 충분히 인식하고 있다는 이야기인데, 나이언틱 역시 지금이 한국에서 포켓몬고 사파리존을 개최할 최적의 타이밍이라고 내다본 것으로 풀이된다. 또 포켓몬고는 이달부터 포켓몬빵 콜라보레이션을 선보이고 있다. 포켓몬빵 띠부띠부씰 뒷면 프로모션 코드를 포켓몬고에 입력해 게임 아이템을 획득할 수 있도록 하며 이번 '사파리존: 고양'의 인기를 끌어올릴 준비를 마쳤다. 나이언틱 관계자는 ""지금이야말로 한국에서 (사파리존과 같은)대규모 이벤트를 진행할 적기라고 생각한다""고 말했다. ""희귀 포켓몬 잡자""…기꺼이 고양시로 모일 이용자들나이언틱은 한국 포켓몬고 이용자를 고양 일산 호수공원으로 끌어모으기 위해 '특별한' 포켓몬을 등장시킨다고 예고했다. 지난 포켓몬빵 열풍에 대입하자면, 지난 2월 재출시 당시 포켓몬빵 품절 대란까지 견인한 주인공인 한정 수량 '뮤', '뮤츠' 띠부띠부씰과 비교 가능하다. 



'포켓몬고 사파리존: 고양'에 출현할 예정인 '특별한 포켓몬'들. (사진=포켓몬고 홈페이지 갈무리)나이언틱은 호수공원이라는 지역적 특성 상 나타날 수 있는 포켓몬을 다수 출현시키는 것 뿐만 아니라 한국 지역에서 보기 어려운 포켓몬 '무스틈니', '파랑 플라베베'를 등장시킬 계획이다. 색이 다른 '슈쁘'라든가 5가지 '안농'도 발견할 수 있으며, 안농의 경우 샤이니 타입까지 등장할 예정이다. 수집 욕구를 자극하는 희귀 포켓몬을 고양시 사파리존에 등장시킴으로써 한국 포켓몬고 이용자들의 관심을 최대치로 끌어올릴 수 있을 것이란 전략이다. 2016년 여름 증강현실 포켓몬을 찾아 이용자들이 대거 속초로 모였고, 소비자들이 올해 포켓몬 띠부띠부씰을 찾아 온 동네를 돌아다녔던 것을 고려하면 나이언틱이 꺼내든 '특별 포켓몬' 카드가 통할 지 주목된다.  나가노 고 나이언틱 라이브 이벤트 매니저는 ""한국에서 개최되는 최초의 '사파리존'에 대한 기대가 크다""며 ""특별 포켓몬으로 한국에서 잘 등장하지 않는 무스틈니, 파랑 플라베베 등도 만나볼 수 있을 것""이라고 강조했다. 인기에 뒤따르는 경제적 효과나이언틱은 한국 시장의 포켓몬 인기가 경제적 효과로도 연결될 수 있을 것이라 기대하고 있다. 나이언틱에 따르면 포켓몬고 사파리존은 이미 수익 창출 효과를 증명했다. 코로나19 대유행 이전인 2019년 진행된 사파리존은 2억4900만달러(한화 약 3453억원)의 경제적 효과를 이끌었다.



지난달 진행된 '포켓몬고 페스트 2022' 현장. (사진=포켓몬고 홈페이지 갈무리) 코로나19 상황에서도 수익 창출은 이어졌다. 지난해 영국 리버풀에서 열린 사파리존 행사에서는 1620만달러(한화 약 225억원), 올해 초 스페인 세비야에서 진행된 사파리존에서는 2240만달러(한화 약 310억원) 가량의 경제 효과를 창출했다. 띠부띠부씰로 한국 소비자의 마음을 사로잡은 포켓몬빵도 물론 수익 창출로 이어졌다. 지난달 말 포켓몬빵의 기준 누적 판매량은 8100만봉 이상이다. 포켓몬빵이 흥행하자 유통업계 등에서 포켓몬 관련 제품 출시 및 협업 또한 활발하게 진행되고 있다. 포켓몬빵을 제조하는 SPC삼립 역시 떡 브랜드 빚은, 배스킨라빈스, 던킨도너츠 등을 통해 포켓몬스터 상품을 출시하고 있다. 나이언틱은 코로나19 팬데믹 기간, 상황에 맞게 이용자들이 서로 만나지 않더라도 경험을 공유할 수 있는 '선택적(혼합형)' 라이브 이벤트를 고안했다. 하지만 코로나19 '엔데믹' 분위기에 다시 오프라인 행사에 대한 기대감을 높이고 있는 모습이다. 국내에서는 처음으로 포켓몬고 사파리존을 개최하는 고양시도 행사로 인한 수익 창출 효과에 상기된 분위기다. 코로나19 대유행 이후 처음으로 진행되는 대규모 행사인 만큼 포켓몬고 사파리존을 찾는 이용자들을 통한 경제 효과를 기대하고 있다. 온라인 간담회에 참석한 이상열 고양 컨벤션뷰로 총괄 사무국장은 ""일산 호수공원에서 이 정도의 민간 대규모 이벤트가 개최되는 것은 처음""이라며 ""네트워크 환경 등 트레이너(게임 이용자)들이 포켓몬고를 즐길 수 있는 최상의 상태를 만들도록 준비하고 있다. 고양시에 있는 주변 모든 것들을 잘 활용해 달라""고 말했다.",105,https://n.news.naver.com/mnews/article/293/0000040613?sid=103
"애플, '아이폰14' 공개…韓 부품사, 누가 웃고 누가 울었나",2022.09.11. 오전 10:41,"- LG이노텍·삼성디스플레이·비에이치 기대감↑   [디지털데일리 김도현 기자] 7일(현지시각) 애플이 신규 스마트폰 ‘아이폰14’ 시리즈를 공개했다. ▲아이폰14(6.1인치) ▲아이폰14플러스(6.7인치) ▲아이폰14프로(6.1인치) ▲아이폰14프로맥스(6.7인치) 등 4종으로 된다. 하위 2개 모델은 5인치대 미니 대신 화면이 큰 플러스가 추가된 것이 눈에 띄는 변화다. 상위 2개 모델은 카메라와 디스플레이 등이 개선됐다.   우선 카메라는 지난 2015년 ‘아이폰6S’ 출시 이후 7년 만에 화소수가 높아졌다. 프로와 프로맥스의 메인 카메라에 처음으로 4800만화소를 적용했다. 전작대비 4배 늘어난 수치다.    아이폰 카메라 최대 협력사인 LG이노텍에 호재다. 일본 샤프 경쟁력이 떨어지고 중국 오필름이 공급망에서 제외되면서 LG이노텍 점유율은 70% 내외까지 올라간 상태다. 여기에 화소 증가에 따라 카메라 모듈 평균판매가격(ASP)가 향상되기도 했다.   아이폰13 최상위 모델에 도입된 비행시간거리(ToF) 3차원(3D) 센싱 모듈이 모든 기종으로 확장된 부분도 긍정적이다. 카메라 모듈 검사장비를 제공하는 하이비젼시스템도 같은 이유로 수혜가 예상된다.   장기적인 전망도 밝다. 애플은 내년 출시할 ‘아이폰15’ 시리즈부터 잠망경 형태 폴디드줌 카메라 모듈을 적용할 것으로 추정된다. LG이노텍은 자화전자와 손잡고 준비 중인 것으로 파악된다. 이로 인해 ASP는 더 올라갈 가능성이 크다.    삼성전자의 하반기 전략 스마트폰 변화로 카메라 모듈 사업이 위축된 삼성전기와 대비된다. 갤럭시노트에서 접는(폴더블) 제품인 갤럭시Z 시리즈로 바뀌면서 카메라 성능이 하향됐고 관련 부품 ASP도 하락했다. 갤럭시Z폴드·플립이 상승세이기는 하나 판매 대수 역시 갤럭시노트보다는 아직이다.   프로와 프로맥스 디스플레이는 노치에서 원통형 모양 펀치홀로 달라졌다. 박막트랜지스터(TFT)는 전작과 마찬가지로 저온다결정산화물(LTPO) 기술을 활용했다. TFT는 디스플레이 기본 단위 레드·그린·블루(RGB) 픽셀을 제어해 빛의 밝기를 조절하는 전기적 스위치 역할을 한다. LTPO는 기존 저온다결정실리콘(LTPS)와 옥사이드 TFT 장점을 결합한 것으로 전력효율을 대폭 높여준다.   아이폰13 상위 2개 모델에서는 LTPO 기반 유기발광다이오드(OLED)를 삼성디스플레이가 독점했다. 아이폰14 시리즈에서는 프로맥스 일부를 LG디스플레이가 맡는 것으로 알려졌다. 문제는 홀디스플레이 및 LTPO 경험이 적다는 점. 삼성디스플레이는 이미 삼성전자 제품과 아이폰13을 통해 기술력과 수율(완성품 중 양품 비율)을 높여왔다.  LG디스플레이는 예상보다 수율이 떨어진다는 후문이다. 삼성디스플레이 물량 확대가 점쳐진다. 업계에서는 삼성디스플레이의 아이폰14용 OLED 출하량이 최대 2000만대까지 늘어날 수 있다고 분석한다. 같은 맥락에서 최근 삼성디스플레이의 OLED 후공정 투자가 활발한 상태다.   이는 OLED용 경연성인쇄회로기판(RFPCB) 공급업계에 영향이 불가피하다. 삼성디스플레이와 LG디스플레이는 각각 비에이치, 영풍전자가 주요 거래선이다. 고객사 상황에 따라 비에이치 역시 수주 물량이 늘어난다는 의미다. 이미 삼성전기가 RFPCB 사업을 철수한 기회를 잡은 비에이치의 아이폰 내 점유율은 더 상승할 전망이다.",105,https://n.news.naver.com/mnews/article/138/0002132396?sid=103
"안랩, 임직원 대상 '기후위기와 탄소중립' 특강 진행",2022.09.08. 오전 10:54,"홍진규 연세대 대기과학과 교수 초청안랩은 임직원 ESG(환경‧사회‧지배구조) 교육의 일환으로 홍진규 연세대학교 대기과학과 교수를 초청해 기후위기 특강을 개최했다고 8일 발표했다.



홍진규 연세대 대기과학과 교수가 안랩 본사에서 기후위기 특강을 진행하고 있다. [사진=안랩]이번 특강은 '왜 위기를 말하는가? 인류세와 탄소중립'이라는 주제로 진행됐다. 홍 교수는 ""탄소 배출 등 인류가 생태계를 변화시킬 만큼 지구에 큰 영향을 끼치고 있어 현시대를 '인류세'라는 새로운 지질 세대로 이야기할 정도""라며 ""이번 강연이 기후위기의 심각성을 인지하고 고민하는 계기가 되기를 바란다""고 말했다.안랩은 매월 환경과 인권, 반부패 중 한 가지를 주제로 30분 ESG 특강을 실시하고 있다. 주제의 중요성을 고려해 다음 달에도 기후위기 특강을 연이어 진행할 계획이다.",105,https://n.news.naver.com/mnews/article/031/0000696405?sid=103
"""무료 주차장은 어디?"" 네카오, 추석 연휴 서비스 제공",2022.09.10. 오후 5:55,"네이버-카카오, 추석 연휴 기간 서비스 네이버 '추석 교통정보톡' 서비스 진행 카카오맵서 추석무료 주차장 확인 가능 



네이버 '추석 교통정보톡' 관련 이미지. 네이버 제공 [파이낸셜뉴스] 네이버와 카카오가 추석 명절을 맞아 다양한 서비스를 선보이고 있다.   10일 관련 업계에 따르면 네이버는 '추석 기념일' 페이지를 운영하고 있다. 해당 페이지에서는 △추석 생활 정보 △추석 요리·차례 정보 △임시선별진료소·무료 개방 주차장 등 연휴 기간 동안 유용하게 활용할 수 있는 정보를 모아 제공한다.   네이버는 지난 8일 오후부터 '추석 교통정보톡' 서비스를 진행했다. 추석 교통정보톡에서는 이용자들이 교통 관련 정보 및 실시간 상황을 공유하며 소통할 수 있는 서비스가 마련됐다. 실제 톡(TALK)에서는 ""남양주에서 대구까지 얼마나 걸릴까요?"", ""당진에서 경기 가는데 거의 주차장이다"" 등 제보 및 대화가 이뤄지고 있다.   네이버 플레이스에서는 추석 연휴 기간 영업하는 음식점과 진료하는 병·의원 정보 등을 확인할 수 있다. 또 행정안전부에서 제공하는 '추석 무료개방 공공주차장' 정보를 연동해 오는 12일까지 무료로 개방되는 전국 주차장 정보도 제공한다.   카카오 또한 카카오맵에서 추석 연휴 무료 개방 공공주차장 정보 등을 제공한다.   오는 12일까지 카카오맵 첫 화면에 ‘추석 무료 주차장’ 검색 바로가기를 제공해 주변 무료 주차장을 간편하게 확인할 수 있도록 지원한다. '추석 연휴 무료 주차장', '명절 무료 주차장' 등 키워드를 검색해도 무료 주차장 확인이 가능하다.   카카오맵에서 추석 연휴 기간 선별진료소와 임시선별검사소 운영 정보도 안내한다. 각 지자체가 코로나19 확산 방지를 위해 연휴에 선별진료소와 임시선별검사소를 운영키로 한 가운데 카카오는 시민들이 신속하게 코로나 검사를 받을 수 있도록 운영시간 및 휴무일 등의 상세 정보를 제공한다는 방침이다. #카카오 #네이버 # #임시선별진료소 #무료개방주차장",105,https://n.news.naver.com/mnews/article/014/0004896723?sid=103
‘2022 명량대첩축제’에 최첨단 ICT기술 활용,2022.09.11. 오후 9:49,[KBS 광주],105,https://n.news.naver.com/mnews/article/056/0011336706?sid=103
"울프스피드, 노스캐롤라이나에 SiC 웨이퍼 공장 짓는다",2022.09.11. 오후 12:24,"미국 반도체 기업 울프스피드(옛 크리)가 노스캐롤라이나주 채텀 카운티에 대규모 실리콘카바이드(SiC) 웨이퍼 생산 시설을 짓는다. 기존 대비 생산 능력이 10배 이상 증가할 것으로 전망된다.울프스피드는 13억달러를 투자, 2024년 1단계 건설 완료를 목표로 8인치 SiC 웨이퍼 공장을 설립한다. 1단계 건설 이후 향후 10년간 생산 능력 추가 확보에 나선다. 최종 건설 계획은 약 180만㎡ 부지에 생산 시설은 9만2000㎡ 크기로 SiC 웨이퍼 생산 기지 중 세계 최대 수준이다. 채텀 공장이 가동하면 울프스피드는 기존 더럼 SiC 소재 공장 생산능력보다 10배 많은 웨이퍼를 생산할 수 있다. 8인치 SiC 웨이퍼는 기존 대세였던 6인치 대비 웨이퍼 당 칩 생산 능력이 확대된다.채텀 공장에서 생산된 SiC 웨이퍼는 울프스피드 뉴욕 모호크밸리 SiC 반도체 공장에 주로 공급될 예정이다. 울프스피드는 모호크밸리 SiC 반도체 공장 문을 열었다. 울프스피드 SiC 핵심 생산 거점으로 삼고 공격적으로 시장을 공략하고 있다.",105,https://n.news.naver.com/mnews/article/030/0003042829?sid=103
