title,date,main,section,url
"카카오, 5년간 신고한 M&A 10건중 9건은 간이심사만 거쳤다",2022.10.23. 오전 6:10,"김상훈 의원 ""지난 정부, 플랫폼 기업에 '문어발 프리패스' 준 것""공정위, 플랫폼 기업 특성 고려해 간이심사→일반심사 전환 추진



카카오 '먹통' 사태(CG)[연합뉴스TV 제공]    (세종=연합뉴스) 차지연 곽민서 기자 = 지난 5년간 카카오가 공정거래위원회에 신고한 인수·합병(M&A) 중 신고 내용의 사실 여부만 따지는 간이심사만 거친 사례가 10건 중 9건꼴인 것으로 나타났다.     23일 국회 기획재정위원회 소속 국민의힘 김상훈 의원이 공정위에서 받은 '카카오·네이버 기업결합 현황' 자료에 따르면 2017년 8월부터 2022년 10월까지 카카오가 신고한 기업결합 62건 중 85.4%인 53건은 간이심사로 결합이 승인됐다.     공정위는 독과점 형성을 막기 위해 기업결합 신고를 받아 시장집중도, 경쟁 제한 효과 등을 심사하고 결과에 따라 가격 인상 제한 등 시정조치를 내린다.     대한항공과 아시아나항공의 기업결합을 승인하면서 뉴욕, 파리, 제주 등 일부 노선의 슬롯(시간당 가능한 비행기 이착륙 횟수)과 운수권(정부가 항공사에 배분한 운항 권리)을 다른 항공사에 이전하고 운임 인상은 제한해야 한다는 조건을 걸었던 것이 그 사례다.     그러나 신고된 기업결합 건에 대해 검토 초기 단계에서 경쟁 제한 우려가 없다고 판단되면 신고내용의 사실 여부만 따지는 간이심사를 진행한다.     '문어발 확장'으로 논란을 빚은 카카오의 경우, 기업결합이 대부분 간이심사로 승인됐다.     현재 공정위는 기업결합을 심사할 때 개별 상품·서비스 시장을 중심으로 경쟁 제한성을 판단하기에, 서로 다른 업종의 기업과 결합하는 경우가 많은 플랫폼에 대해서는 간이심사를 주로 진행하고 있다.     카카오의 기업결합은 2017년 2건, 2018년 12건이 모두 간이심사만 거쳤다. 2019∼2020년 기업결합 12건 중에는 10건이 간이심사를 받았다.     2021년에는 21건 중 14건이 간이심사를 받아 간이심사 비율이 다소 줄었지만, 올해는 15건이 전부 간이심사만 거쳐 승인됐다.     카카오가 5년여간 진행한 기업결합 62건을 통해 카카오와 지배관계가 형성된 기업은 91.9%인 57개였다.     그러나 카카오가 경쟁제한 완화 등을 위해 공정위로부터 시정조치를 받은 적은 없었다. 



[그래픽] 카카오 기업결합 건수 추이(서울=연합뉴스) 김민지 기자    minfo@yna.co.kr    트위터 @yonhap_graphics  페이스북 tuney.kr/LeYN1    같은 기간 네이버도 22건의 기업결합을 신고했으나 이 중 18건이 간이심사였고 경쟁 제한성을 따지는 일반심사는 4건에 그쳤다.     이렇게 결합한 22개 기업 중 18개는 지배관계가 형성됐으나, 경쟁제한 시정조치도 전혀 받지 않았다.    김상훈 의원은 ""자유시장 경제의 생산성을 저해하는 가장 큰 요인은 독과점 기업의 등장""이라며 ""지난 정부는 간이심사를 통해 플랫폼 기업에 '문어발 프리패스'를 열어줬다""고 지적했다.     이어 ""윤석열 정부는 경쟁 회복과 국민 후생 증진을 위한 제도 개선에 나서야 한다""고 강조했다.     공정위는 이런 의견을 고려해 지금껏 대부분 간이심사로 처리해온 플랫폼 기업의 이종(異種) 혼합형 기업결합 심사를 원칙적으로 일반심사로 전환하는 내용의 기업결합 심사기준 개정을 추진하고 있다.     또 서로 다른 여러 서비스를 연계해 복합적 지배력을 키우는 플랫폼 고유의 특성도 앞으로는 경쟁 제한성 판단의 고려 요소로 볼 계획이다. 



김상훈 의원[연합뉴스 자료사진]    charge@yna.co.kr",105,https://n.news.naver.com/mnews/article/001/0013522944?sid=103
"LG화학, 대학생들의 지속가능한 혁신 아이디어 발굴",2022.10.23. 오후 4:56,"대상에 수소생산 최적 공정으로 탄소저감 제안한 부산대 화학공학과 팀 선정LG화학은 지난 21일, 여의도 LG트윈타워에서 ‘제2회 LG화학-한국화학공학회 석유화학 올림피아드’ 시상식을 열고 부산대학교 한지웅, 김정현, 조소연 학생의 카본카본따블본드팀에 대상을 수여했다고 23일 밝혔다.대상팀은 미래 핵심 에너지로 주목받는 ▲그레이 ▲블루 ▲그린 등 다양한 수소 생산방식의 경제성을 분석해 탄소배출을 효과적으로 저감하고 경쟁력 있게 수소를 생산할 수 있는 최적의 공정을 제안했다.심사위원단은 “수소 생산을 위한 다양한 생산방식을 비교 분석하여, 논리적인 계산 설계 등이 고려된 점에 높은 평가를 줬다”며, “미래에너지 수소 제조 시 경쟁력 있는 생산 공정이 적용될 것” 이라 평가했다.



제2회 석유화학 올림피아드 대상 수상팀(부산대)이 LG화학 관계자들과 기념 촬영을 하고 있다.대상을 받은 한지웅 학생은 “화학공학부 학부생을 위한 공모전을 준비해준 LG화학에 감사하며, 석유화학 진로에 확신을 갖게 됐다” 고 말했다.LG화학은 대상을 받은 팀에 인당 500만원의 장학금과 정규직 전환형 인턴쉽 기회를 제공한다. 각 부문별 금상, 은상, 동상 팀에는 인당 300만원, 200만원, 100만원의 장학금을 수여하고 LG화학 입사 지원 시 서류전형 면제 등 우대조건이 적용된다.LG화학 노국래 석유화학 사업본부장은 “올림피아드 공모전을 통해서 지속가능한 혁신기술로 미래 사업을 선도할 인재들을 지속 발굴하고 육성해 나갈 것”이라고 밝혔다.",105,https://n.news.naver.com/mnews/article/092/0002271498?sid=103
[오라클 클라우드월드 2022]“데이터·애플리케이션·인프라 동시 제공해 가치창출 돕겠다”,2022.10.23. 오후 12:01,"“시대가 달라져도 데이터 기반 인사이트 확보 중요성은 변하지 않는 진리입니다. 오라클은 이를 위한 데이터와 애플리케이선, 인프라를 모두 제공할 수 있는 유일한 기업으로, 고객 인사이트 확보를 지원할 것입니다.”가렛 일그 오라클 아태지역 사장은 '오라클 클라우드월드 2022'에서 오라클 클라우드 사업 차별성, 아태지역에서 사업 성과를 소개했다.일그 사장은 “데이터가 없으면 인공지능(AI), 머신러닝, 애플리케이션 활용이 불가능하며 데이터가 있어야 새로운 기회가 생긴다”며 “오라클은 44년 이상 데이터를 여러 방법으로 관리해 가치를 창출하도록 돕고 있으며, 이는 다른 회사에 없는 오라클의 강점”이라고 말했다.그는 “오라클은 데이터뿐만 아니라 애플리케이션, 인프라를 통합 제공해 고객 의사결정을 돕는다”며 “특히 고객 가까운 곳에서 클라우드 서비스를 제공할 수 있도록 함으로써 고객 데이터 주권 확보를 지원한다”고 강조했다.일그 사장은 오라클이 하이브리드 클라우드 서비스 제공을 위한 가장 완벽한 전략을 갖췄다고 설명했다.일그 사장은 “오라클이 제공하는 퍼블릭과 프라이빗 클라우드, VM웨어 솔루션, 엑사데이터 클라우드 앳 커스터머, 로빙 엣지 인프라스트럭처 등을 통해 고객은 어디에 있든 저비용으로 원하는 형태의 클라우드 서비스를 이용할 수 있다”고 밝혔다 .멀티 클라우드를 통한 고객 선택권 확대의 중요성도 역설했다.일그 사장은 “멀티 클라우드 시대가 열리면서 오라클은 고객이 여러 기업 클라우드를 이용할 수 있어야 한다고 강조한다”며 “오라클은 멀티 클라우드 전략을 강조하며 여러 채널로 기술을 제공하는 기업”이라고 밝혔다.일그 사장은 그동안 오라클이 아태지역에서 9만개 이상 고객사를 확보했으며 5만명 이상 임직원을 고용하고 있다고 설명했다.오라클은 아태지역 22개 시장에 사무실을 두고 8000개 이상 파트너와 협력한다. 5개 클라우드 솔루션 허브, 9개 클라우드 리전, 9개 제품개발센터를 운영한다. 마이크로소프트(MS) 윈도 애저와 연계하는 '애저 인터커넥트 리전'은 3곳이다.일그 사장은 “고객은 데이터를 기반으로 새로운 기회를 찾고 있다”며 “고객의 자산인 데이터가 혁신의 도구가 되고 가치를 창출할 수 있도록 도울 것”이라고 밝혔다.라스베이거스(미국)=",105,https://n.news.naver.com/mnews/article/030/0003053259?sid=103
20년 걸린 고국 무대 데뷔… '월클 테너' 이용훈의 '네순 도르마',2023.10.23. 오후 5:14,"26~29일 서울시오페라단 '투란도트' 출연연극·마당놀이 연출한 손진책 첫 오페라 연출도 화제



서울시오페라단의 오페라 '투란도트'의 칼라프 역을 맡은 테너 이용훈이 19일 세종문화회관에서 공연의 한 장면을 시연하고 있다. 세종문화회관 제공푸치니의 오페라 '투란도트'는 동양적 색채가 강하고, 칼라프가 부르는 '네순 도르마(Nessun Dorma·아무도 잠들지 말라)'가  널리 알려져 오페라 초심자도 부담 없이 볼 수 있다. 반면 다양한 레퍼토리를 접한 오페라 애호가에게는 자칫 진부하게 전달될 수도 있다. 하지만 세계 유수의 극장에서 이 역을 120번 가까이 맡았던 테너 이용훈(50)이 부르는 '네순 도르마'라면 초심자부터 애호가까지 누구나 즐겁게 감상할 수 있다. 26~29일 세종문화회관에서 공연되는 서울시오페라단의 '투란도트'에 대한 기대감이 큰 이유다. '투란도트'의 칼라프로 한국 오페라 무대에 데뷔하는 이용훈은 19일 세종문화회관에서 열린 기자간담회에서 ""꿈같은 일이 현실화됐다""며 감격에 겨워했다.이용훈은 서정적 음색과 힘 있는 목소리를 지닌 '리리코 스핀토' 테너로, 영국 로열 오페라 하우스, 이탈리아 스칼라 극장 등 세계적으로 손꼽히는 무대에 서 왔다. 그는 서울대 성악과와 미국 매네스 음대를 졸업하고 메트로폴리탄 콩쿠르 등 국제 성악 콩쿠르에서 잇따라 입상했다. 이후 2007년 칠레 산티아고와 2010년 뉴욕 메트로폴리탄 오페라의 '돈 카를로'를 기점으로 본격적으로 국제 오페라 무대로 활동 영역을 넓혀 왔다. 그는 ""프로로 데뷔한 지 20년쯤 됐는데 한국에서 오페라 데뷔를 못 했다""며 ""기적처럼 이 자리에 앉아 있는 게 놀랍다""고 말했다.



서울시오페라단의 오페라 '투란도트'의 칼라프 역을 맡은 테너 이용훈이 19일 세종문화회관에서 열린 기자간담회에서 기자들의 질문에 답하고 있다. 세종문화회관 제공1926년 초연된 '투란도트'는 고대 중국을 배경으로 수수께끼를 풀지 못하면 구혼자를 죽이는 투란도트 공주와 결국 수수께끼를 해결하고 사랑을 쟁취하는 칼라프 왕자의 이야기다. 이용훈은 테너 신상근, 박지응과 번갈아 칼라프를 맡는다. 그는 2021-2022 시즌 호주오페라 공연과 뉴욕 메트로폴리탄오페라 공연, 2022-2023 시즌 영국 로열오페라 코벤트가든 공연, 최근 독일 드레스덴 젬퍼오페라 공연까지 꾸준히 칼라프로 '투란도트' 무대에 서 왔다. 내년 5월 미국 워싱턴 국립오페라단 공연도 예정돼 있다. 그는 ""지금까지 '투란도트'에 110~120회 정도 출연했다""고 말했다. 이용훈은 당초 내년 8월 예술의전당이 기획한 오페라 '오텔로'로 국내 첫 무대를 예고했다. 때마침 일정이 비게 된 시기에 서울시오페라단과 연이 닿아 10개월가량 한국 데뷔를 앞당기게 됐다. 그는 ""보통 연주자는 향후 3~5년간의 일정을 확정해 놓고 활동하는데 안타깝게도 한국은 짧으면 공연 한 달 전, 길어도 1년 전쯤에나 출연 제안을 한다""며 ""일정이 이미 다 차 있어서 미뤄진 시간이 20년이 됐다""고 말했다. 그러면서 ""이번에도 독일 드레스덴 공연 중 주어진 2주 휴식기에 가족을 보려고 계획했다가 서울시오페라단장님이 놀랍게 일을 추진하셨다""고 공연 성사 뒷이야기를 전했다. 



서울시오페라단 '투란도트'의 출연진과 창작진. 왼쪽부터 류 역의 서선영, 투란도트 역 이윤정, 칼라프 역 이용훈, 박혜진 서울시오페라단 단장, 손진책 연출, 티무르 역 양희준, 정인혁 지휘자, 이래이 협력연출. 세종문화회관 제공이번 '투란도트'는 연극계 거장인 손진책 연출가의 첫 오페라 연출작이기도 하다. 배경의 중국풍을 지우고, 칼라프를 위해 목숨을 바친 시녀 캐릭터 류의 헌신에 초점을 맞춘 현대적 재창작으로 선보인다는 계획이다.",105,https://n.news.naver.com/mnews/article/469/0000766451?sid=103
"위메이드, 스테이블코인 '위믹스달러' 발행",2022.10.23. 오전 10:24,"최초 발행량 1100만, '위믹스파이' 서비스도 시작



[이데일리 김국배 기자] 위메이드(112040)가 스테이블코인 ‘위믹스달러’를 발행했다.23일 회사 측에 따르면 위믹스달러는 위메이드의 블록체인 메인넷 ‘위믹스 3.0’ 생태계에서 활용하는 암호화폐다. 게임 토큰, 대체불가토큰(NFT), 디파이(탈중앙화금융) 등 모든 거래에 사용된다. 위메이드는 1100만 위믹스달러를 최초 발행했다.이후 위메이드는 실질 수요에 따라 발행량을 조절하며 가격을 안정시키는 ‘디오스 프로토콜’에 따라 위믹스달러를 운용할 계획이다. 안정성을 유지하기 위해 위믹스달러를 발행하는 만큼 스테이블코인 ‘USDC’를 100% 담보로 한다. 1위믹스달러는 1USDC, 1달러다. 위메이드가 발행한 위믹스달러와 담보한 USDC 규모는 위믹스 3.0 메인넷 온체인상에서 실시간으로 확인할 수 있다.회사 측은 “위믹스달러는 최초 발행 이후 생태계 확장과 축소에 따라 스스로 발행량을 늘리거나 소각하는 자율적 확장성을 자랑한다”며 “디오스의 프로토콜이 위믹스달러를 추가 발행하거나 소각해 위믹스달러의 가치를 보존하고 지속가능한 생태계를 만들어간다”고 설명했다.위메이드는 전날 디파이 서비스 ‘위믹스파이’를 오픈했다. 같은 날 출시한 ‘위믹스월렛’을 연결해 이용할 수 있다. 장현국 위메이드 대표는 “위믹스달러는 가장 혁신적인 스테이블코인”이라며 “스테이블코인 위믹스달러와 네이티브 코인 위믹스를 글로벌 디지털 이코노미의 기축 통화로 만들 것”이라고 말했다.",105,https://n.news.naver.com/mnews/article/018/0005347794?sid=103
[먹통 경종! 디지털 복지] ② 범 디지털 서비스 사회적 책무…민·관 '디지털 기금' 시급,2022.10.23. 오전 9:01,"디지털 접근권 보장을 위한 실현 방안디지털 기술에 의해 기업의 비즈니스 방식뿐만 아니라, 사회 경제 구조 전반이 급격히 변화하는 디지털 대전환시대가 도래했다. 모든 활용이 디지털로 이뤄지며 사회 경제 활동 참여를 위해 필요한 디지털 역량 활용 수준이 고도화됨에 따라 계층간 디지털 격차가 새로운 형태로 대두됐다.



폴바셋 삼성강남타운점 키오스크1 [사진=CJ올리브네트웍스]2020년 실태조사 결과에 따르면 접근 측면의 디지털 격차는 상당히 해소됐으나, 디지털 이용 역량과 활용 측면에서의 계층 간 격차는 여전했다. 디지털 접근 수준은 일반 국민의 93.7%이나 디지털 역량과 활용 수준은 일반 국민의 60.3~74.8%에 불과하다.하지만 이같은 디지털 역차별을 막기 위한 디지털 서비스 범위는 기간통신서비스에만 국한돼 있다. 현재 취약계층 요금 감면은 기간통신서비스에 한정됐다.취약계층에 대한 기간통신서비스 요금감면 제도의 경우 지난 2000년 시행된 이래 감면대상자, 감면내역 등이 지속적으로 확대되면서 기간통신사업자가 부담하는 요금감면액은 지속 증가하는 추세다.2020년 저소득층·장애인·어르신·유공자 등 698만명 대상 총 9천655억원의 통신서비스 요금을 감면함으로써, 취약계층의 통신서비스 접근 제고됐다.이에 따라 디지털 서비스 소비 측면에서는 디지털 콘텐츠 등 새로운 디지털 서비스에 대한 국민들의 소비 욕구가 커져가는 상황임을 감안할 때  실질적인 접근권 보장은 기간통신서비스에 국한하는 제한된 디지털 복지가 아니라 디지털 대전환 시대의 생활밀착형 디지털 서비스를 실제 향유할 수 있게 하는 제도적 설계가 뒷받침돼야 한다는 주장이 따른다.제도적 설계 측면에서 국민이 누려야 할 기본적 사회복지의 마련 및 제공에 있어서는 국가와 디지털 생태계에서 중심이 되어 가고 있는 부가통신사업자의 역할을 빼놓고 생각하기 어렵다는 지적이다.‘디지털 접근권’은 헌법 제18조 통신의 자유와  헌법 제21조에 근거한 알 권리의 실질적인 보장을 위해서도 필요한 권리다. 또한 국가는 헌법 제34조 제1항에 따라 국민들의 인간다운 생활을 할 권리를 보장할 의무를 지는바, 결국 디지털 접근권의 보장은 국가가 부담하여야 할 책무 중 하나다.하지만 현재 거의 대부분 공공서비스 영역에서 취약계층에 대한 필수적 서비스 제공에 소요되는 비용은 국가·지자체·공기업이 부담 중이다.◆디지털 복지 실현…해외는 지금 주요 국가의 기간통신사업자는 요금감면 등 보편적서비스를 비롯한 정책 기금에서 특정한 분담기준 및 징수율에 따라 디지털 복지를 위한 공적 책임을 담당하고 있다.주요 국가에서는 방송사업자들도 해당 국가별 특수성에 따라 특정한 분담기준 및 징수율에 따라 디지털 복지를 위한 공적책임을 담당하고 있다 .최근 들어서, 미국, EU를 비롯한 다수의 국가에서 OTT 사업자에 대해서도 공적 의무를 부담시키고자 하는 정책적 논의가 진행 중이다.  영국, 프랑스 등 EU 국가를 중심으로 제도적 정비 완료됐다고 알려졌다.이와 더불어 범국가 차원에서 일정 규모 이상의 플랫폼사업자인 부가통신사업자에 대해서는 국가별 영역을 넘어서 디지털세를 부과하고자 하는 논의도 OECD 최종 합의에 따라 오는 2023년부터 시행을 앞두고 있다.아울러, 디지털 접근권 확대를 위한 노력에 있어 미국, 싱가포르 등 주요 다른 국가들에서는 정부의 기금 내지 예산을 통하여 이뤄지고 있다.미국은 지난해 32억달러의 정부예산으로 저소득층의 유‧무선 인터넷 요금, 기기 구입비를 일회성으로 지원했다. 올해는 100% 정부예산 142억달러로 기금을 조성해 저소득층 지속 지원하고 있다.가포르는 디지털 포용 정책의 일환으로 ’14년부터 저소득층에 대한 유선 초고속인터넷 요금감면 프로그램인 홈 접속과 지난 2019년부터 저소득 어르신 전용 이동통신 요금제를 제공하는 프로그램인 ‘모바일 액세스 포 시니어’를 시행 중이다. 정부기금 내지 예산을 통하여 재원을 마련 중이다.업계 관계자는 “현재 온라인 플랫폼등 대형 부가통신사업자들은 기간통신사업자들의 설비를 통하여 구축된 디지털 생태계에서 막대한 수익을 창출하고 있다”라며, “이용자를 기반으로 관련 시장을 장악하고, 비대면 확산에 편승하여 디지털 서비스 전반에서 독점적 지위를 강화하고 있으나 사회적 책무는 외면 중이다”라고 지적했다.이같은 지적은 수익, 시장 장악력, 생태계에 대한 영향력 등 측면을 고려할 때 사회적 책무 분담에 있어 기간통신사업자와 부가통신사업자를 달리 취급해야 할 본질적 차이가 존재한다고 보기는 어렵다고 분석된다. 당위성 및 형평성 측면에서 적어도 대형 부가통신사업자 역시 수익과 영향력 등에 상응하는 수준에서 정부 및 기간통신사업자와 함께 사회적 책무를 분담하여야 할 필요성이 제기된다는 것.미국 및 EU에서는 취약계층에 대한 디지털 접근권 보장을 위하여 부가통신사업자에 대한 의무 부과가 필요하다는 논의가 활발히 이루어지고 있다.미국은 빅테크 기업에 대해 취약계층 요금 감면을 포함한 보편적 서비스 기금 부과를 논의 중이며, 관련 법안을 발의했다. 지난해 7월 상원에서 FCC에게 온라인 콘텐츠‧서비스 사업자에 대한 보편적 서비스 기금 부과의 적절성을 검토하게 하는 법안(FAIR Contribution Act) 및 하원에서 일정 규모 이상의 온라인 플랫폼에 대해 보편적 서비스 기금을 부과시키는 법안이 발의됐다.EU는 지난 2018년 제정한 EECC(유럽전자통신규범)에서 OTT를 전기통신서비스로 포함하고 보편적 서비스 기금을 부과할 수 있도록 하였으며, ITU‧월드뱅크 등 주요 국제기구도 부가통신사업자에 대한 보편적 서비스 기금 부과 필요성을 언급하고 있다.◆ 정부·기간통신·부가통신 함께 '디지털 기금' 조성 우리나라 국회에서도 디지털 접근권 확대를 위해 정부와 부가통신사업자에 대한 책무를 부과하기 위한 법안들이 여야 막론하고 발의돼 있다.이용빈 의원(더불어민주당), 정희용 의원(국민의힘), 양정숙 의원(무소속)이 각각 해당 법안을 발의했다. 대체적으로 대형 부가통신사업자의 방발기금 분담 및 방발기금을 재원으로 하는 통신복지권 도입, 부가통신사업자에 대한 보편적 역무 제공 의무 면제 규정 폐지, 정진기금 용도에 보편 손실비용 지원 추가 및 정부의 보편 손실비용 일부 지원 등을 담고 있다.디지털 복지 실현을 위해서 무엇보다 생태계에 참여하고 있는 주체들이 디지털 복지에 어느 정도 기여하고 있는지 파악해야 한다. 해외에서는 디지털 대전환에 따른 디지털 복지를 구현하기 위해 ICT 생태계에 참여하는 주체인 정부와 기간통신, 부가통신, 방송사업자 간 적정 수준의 기금분담에 대한 제도적인 논의가 가속화되고 있다.국내 기간통신사업자는 요금감면과 기금의무 등을 통해 적극적으로 사회적 기여에 참여하고 있으며 2020년 기준 이통3사의 사회적 기여는 매출의 11.6%에 해당하는 2조7천억원 수준이다. 방송사업자의 경우에도 방발기금 분담의무를 통해 복지에 기여하고 있다. 지난 2020년 기준 유료방송사업자는 연평균 1천억원의 기금을 납부하고 있다.하지만 국내 부가통신사업자는 현행법상 비규제 산업으로 분류한다. 보편기금이나 정진기금, 방발기금 등에 대한 의무는 면제돼 있다.업계 관계자는 “이같은 문제점을 인식하고 상생을 위해 ICT 생태계 주체들이 적정 수준의 공적 부담에 대한 논의를 전개하고 있다”라며, “만약 협력이 완만하게 진행된다면 현재 이통사에 준하는 기금 확대를 통해 역차별 방지에 보다 효과적으로 나설 수 있을 것”이라고 분석했다.또 다른 업계 관계자는 “정부와 디지털 생태계 참여기업이 분담하는 디지털 기금을 조성해야 한다""라며, “취약계층의 원활한 디지털 서비스 이용을 위해, 통신 요금, 디지털 서비스 이용료, 디지털기기 구입비를 매월 디지털 바우처로 지원하는 방안도 고려될 수 있다”고 제안했다.",105,https://n.news.naver.com/mnews/article/031/0000704885?sid=103
