title,date,main,section,url
"[뉴겜] “짜릿해, 늘 새로워!”…‘오버워치2’ 시즌패스 도입한 이유",2022.09.20. 오전 8:28,"새로운 게임, ‘NEW GAME(뉴겜)’에 접속하시겠습니까? [뉴겜]은 게이머를 설레게 할 ‘신작 게임’에 대한 모든 정보를 담습니다. 현재 개발 중이거나 출시를 앞둔 게임, 이제 막 세상에 공개된 신작 게임 소식, 궁금하지 않나요? 그렇다면, <디지털데일리> 뉴겜을 클릭하세요. 숨겨진 보석처럼 반짝이는 신작의 모든 정보, 이제부터 펼치겠습니다.  



[디지털데일리 왕진화 기자] 다음달 신작 빅 이벤트는 결국 ‘오버워치2’로 통일된다.    블리자드는 오버워치 IP(지식재산권)이 프랜차이즈의 새 시대를 열게 될 것이라 강조한다. 더 많은 게임 콘텐츠를 보다 정기적으로 제공함과 동시에, 그 어느 때보다 많은 플레이어가 오버워치 IP 세계관을 경험하게 한다는 목표를 갖고 다양한 변화를 오버워치2에 도입했기 때문이다.   블리자드엔터테인먼트는 다음달 5일 PC 팀 기반 슈팅 게임 ‘오버워치2(Overwatch 2)’를 얼리 액세스(앞서 해보기)로 글로벌 출시한다. 이는 약 3년 전, 지난 2019년 11월 블리즈컨에서 이미 공개됐던 타이틀이다. 누구나 무료로 플레이 가능하다.   오버워치2는 9주마다 시즌 모델을 선보인다. 이를 통해 게임에 새로운 콘텐츠를 제공할 계획이다. 각 시즌에는 새로운 경험과 플레이 방법 등 탐험할 콘텐츠가 즐비하다.    블리자드에 따르면 오버워치2에는 일반적으로 시즌마다 번갈아가며 새로운 영웅 및 지도가 등장한다. 새로운 경쟁전과 기여도 파악 시스템에 더해, ▲신화 스킨 ▲PvE(몬스터 전투) 게임 플레이 등 시즌 콘텐츠도 순차적으로 공개될 예정이다.   특히 오버워치2에는 매 시즌마다 고유한 테마와 최대 80개 이상의 잠금 해제 가능한 치장품 티어가 있는 새로운 ‘배틀 패스’가 있다. 블리자드는 이용자들이 모든 것을 항상 신선하게 느껴지도록 각 시즌 시작을 사용해 영웅 밸런스 변경 사항을 최대한 활용할 계획이다.   오픈워치2에선 전리품 상자가 사라진다. 대신, 이용자는 새로운 게임 내 상점에서 새로운 가상 화폐인 오버워치(Overwatch) 코인으로 원하는 것을 정확히 구매할 수 있다. 상점은 매주 모든 플레이어에게 주요 치장 아이템을 제공하며, 시즌 1에서는 치장 아이템 다수가 사이버펑크 테마다.  



시즌 1에서 플레이하기 위해 로그인하는 모든 사람은 신규 및 복귀 이용자 상관없이, 정커퀸(Junker Queen)과 소전(Sojourn)을 자동으로 받게 된다.    오리지널 오버워치를 소유한 플레이어는 파운더스 팩을 통해 키리코를 받게 되며, 시즌 2가 끝나기 전에 로그인해 교환해야 한다. 시즌 1의 배틀 패스는 총 80개 이상의 티어에 걸쳐 20개 티어에서 무료 보상을 제공한다.    시즌 1에는 소전(Sojourn), 정커퀸 외에도 아직 공개되지 않은 신규 지원 영웅이 동시에 출격한다. 이와 함께, 한층 새로워진 경쟁전 경험도 영웅 리워크, 신규 전장, 모드 등과 함께 시즌 1을 통해 선보이기 시작한다.    새로운 5대 5 멀티 플레이어 방식으로 전환됨에 따라 각각의 플레이어가 경기에서 발휘하는 영향력이 늘어나며, 이에 경기별 기여도를 파악하는 시스템도 추가된다. 이어, 시즌 2에는 새로운 돌격 영웅, 전장 외에도 신화 스킨을 포함한 각종 스킨이 출시된다.    내년에는 새로운 몬스터 전투(PvE) 게임플레이를 선보이며 오버워치 스토리를 계속해서 전개할 예정이다. PvE는 내년 중 신규 영웅, 전장 및 게임 모드와 함께 시즌별 콘텐츠로 선보일 예정이다.   개발팀이 공개한 오버워치2 로드맵에 대한 보다 자세한 내용은 관련 블로그 포스트에서 추가로 확인 가능하다. 또한, 최초 공개된 신규 단편 애니메이션 ‘심판’과 정커퀸 배경 이야기는 지금 오버워치 공식 유튜브 채널에서 각각 확인 가능하다.",105,https://n.news.naver.com/mnews/article/138/0002132886?sid=103
1.5%만 수출한다는 와인…스위스 발레를 꼭 가야하는 이유,2023.10.28. 오전 7:05,"스위스 남부 미식여행 ② 발레와인·치즈 먹고 포도밭 걷기만 해도 힐링



'시에르~잘게쉬' 와인 트레일ⓒ News1 윤슬빈 기자(발레=뉴스1) 윤슬빈 여행전문기자 = 스위스 꼭 맛봐야 하는 것이 있다면 '와인'이 빠질 수 없다. 세계적 와인 산지이자 국경을 맞닿고 있는 프랑스, 이탈리아 못지 않은 맛과 종류의 와인을 자랑하는 곳이 스위스다. 다만 생산량 자체가 워낙 적은데다 거의 전량이 내수에서 소비되기 때문에 스위스 와인을 맛보려면 스위스를 가야한다. 단 1.5% 정도만이 수출된다스위스 면적은 한국의 40%밖에 되지 않은 작은 나라지만 다양하고 색다른 토양이 있다. 250여 종의 포도 품종이 재배되고 있다.  흔히 재배되는 레드 품종은 피노 누아(27%), 가메이(8%), 메를로(8%)이고, 화이트 품종은 샤슬라(25%), 뮐러-투르가우(3%), 실바네르(2%)다.   



발레 지도ⓒ News1 김초희 디자이너 스위스 와인은 그럼 어디서 먹어야 할까. 와인의 3분의 1정도가 스위스 남부 발레주(州) 포도밭에서 생산된다. 포도밭은 론느(Rhône) 강을 따라 해발고도 270m에서 1100m 사이에 자리해 100km가량 뻗어나 있다. 다시 말해 스위스 와인 생산에 있어 가장 중요한 포도밭 다수가 론느강 상류지역을 따라 형성된 언덕에서 찾아볼 수 있다는 것이다. 약 600곳의 생산지가 발레에 있다.매년 발레 지역에서 생산하는 와인의 양은 750㎖ 기준 5600만병이다.여기에 더해 발레는 와인과 뗄레야 뗄 수 없는 '치즈'로도 이름난 곳이다. 치즈를 녹여 감자, 피클과 함께 먹는 '라클렛'의 발생지다. 기록에 의하면 기원전 4세기 발레에서 추운 날 치즈를 장작불에 데워서 먹었는데 그 방식이 지금의 '라클렛'의 탄생 배경이다.



16세기 지어진 성을 와인 체험 공간으로 탈바꿈한 샤토 드 빌라ⓒ News1◇ 와인, 라클렛 원없이 맛보기…시에르 '샤토 드 빌라'발레 와인을 다채롭게 경험할 수 있는 지역으로 꼽히는 곳이 '시에르'다. 와인 박물관, 누구나 걷기 쉬운 포도밭 트레일(트레킹 코스), 다양한 와인 셀러, 와인 테마의 성(城)도 있다.  시에르에서 '짧고 굵게' 발레주 와인과 라클렛을 섭렵하고 싶다면 '샤토 드 빌라'(valais château de villa)를 가면 된다.언덕 위, 포도밭을 배경으로 16세기에 지어진 성이자 저택으로 와인 시음과 구매를 할 수 있는 '와인 도서관'과 발레 전통 요리를 선보이는 '레스토랑'을 갖춘 곳이다.  성에 들어서면 가장 먼저 고풍스러운 건물과 주변을 둘러싸는 울타리를 덮은 포도 나무 덩쿨이 한 눈에 들어온다.



지하에 자리한 와인 박물관ⓒ News1



이곳에선 20종의 발레 와인을 시음할 수 있다ⓒ News1



다양한 발레주 와인ⓒ News1'와인 도서관'은 지하에 있는 데 마치 '비밀 공간'처럼 만들어 졌다. 계단을 타고 안으로 들어가면 이름에 걸맞게 책장에 책처럼 수많은 와인이 선반에 빼곡히 들어서 있다. 이곳에서 시음하거나 구매할 수 있는 와인 종류는 약 780종으로 발레의 소규모 생산자부터 협동조합까지 약 110여 개의 와이너리의 와인을 한자리에 모았다. 시음(테이스팅)은 도서관에서 엄선한 20종에 한해서 100㎖l당 4.9스위스프랑(약 7000원)에 즐길 수 있다.  도서관 안에는 '동굴'(Cave de Garde du Villa)이 있는데 110개의 와이너리에서 자랑하는 빈티지 와인만 모아 보관하고 홍보하는 공간이다. 각 와이너리마다 최대 5개의 와인을 맡긴다. 



치즈를 녹인 요리인 라클렛ⓒ News1



보통 라클렛은 갓 녹인 치즈와 삶은 감자, 식초에 절인 피클과 양파(샬롯)와 함께 먹는다 ⓒ News1



이 레스토랑에서 총 25가지 치즈를 선보인다ⓒ News1와인 시음 후엔 와인 도서관을 나와 1층 레스토랑에서 식사를 하는 것이 '샤토 드 빌라'의 필수 코스다. 약 70년 된 레스토랑으로 다양한 발레 전통 요리를 맛볼 수 있다. 다양한 요리 중에서도 손꼽히는 것은 '라클렛'이다. 발레의 총 25개 지역에서 생산한 치즈를 시기, 계절에 따라 5가지를 엄선해 코스로 맛볼 수 있다. 코스 가격은 36스위스프랑(약 5만4000원)으로 치즈와 함께 곁들여 먹을 수 있는 빵과 삶은 감자, 절인 채소, 피클을 제공한다.



와인 트레일 중에 볼 수 있는 포도ⓒ News1◇ 포도밭만 걸어도 힐링 샤토 드 빌라에서 와인과 라클렛으로 배가 두둑히 채워졌다면 걸어보는 것은 어떨가. 주변에 걷지 않고서는 못 베길 포도밭 하이킹 코스가 있다. 시에르에서 발레의 가장 유명한 와인 생산 마을 중 하나인 '잘게쉬'까지 이어지는 '와인 트레일'(Sentier viticole)이다. 총 7.5km 길이로 목적지인 '와인 박물관'까지 여유 있게 2시간 30분 정도 걸린다. 난이도는 쉬운 편이다. 



방대한 포도밭을 보며 걸으면 절로 힐링된다ⓒ News1



포도밭을 걷다보면 자연이 만들어 낸 협곡도 만나게 된다ⓒ News1조용한 길을 따라 걷다보면 방대한 와인밭이 나오고 이어서 와인 제조 마을, 야생의 '라스필레' 협곡을 만날 수 있다.길을 잃을 걱정은 안 해도 된다. 레일을 따라 간격을 두고 80개의 안내판이 설치돼 있다. 안내판엔 각 포인트마다 갖춘 풍경의 특징, 포도나무 종류, 와인 재배 기술 및 역사를 소개한다. 



알레취 현지에서 맛볼 수 있는 와인ⓒ News1◇ 알프스 보며 '전통' 와인·치즈 맛보기 스위스에서 빠질 수 없는 '알프스'의 경관을 바라보며 전통 와인과 치즈를 맛보려면 '알레취 아레나'로 가면 된다. 알레취 아레나는 유럽에서 가장 길고 알프스에서 최대 규모의 빙하인 '알레취' 주변 지역을 부르는 명칭이다. 알레취 아레나엔 4000m 알프스 봉우리에 둘러싸인 산장 리조트들이 많은데 저마다 현지에서만 나고 자란 식자재를 이용해 만든 요리를 내놓는다. 



알파인 뮤지엄에서 체험객을 위해 직접 만든 치즈와 버터를 내어주는 현지인 가이드ⓒ News1



전통 방식으로 만들어 내 버터는 빵에 발라 먹기만 하도 맛이 좋다ⓒ News1그중에서도 전통적인 발레식 치즈와 와인을 맛볼 수 있는 곳을 꼽으면 '알파인 뮤지엄'이 있다. 400년 전 만들어진 산장을 체험 공간을 탈바꿈한 곳으로 과거 스위스 고산 지역의 사람들이 어떻게 농업을 해왔고 치즈와 버터를 만들었는지 생생하게 볼 수 있다.체험의 하이라이트는 시음 시간. 현지인이 직접 만든 진한 향의 오래된 치즈와 싱싱한 버터, 빵과 함께 알레취에서 생산한 와인을 곁들여 맛볼 수 있다.",105,https://n.news.naver.com/mnews/article/421/0007138948?sid=103
"SKT, 보이는 인공지능 스피커 누구 네모 Ⅱ 출시",2022.09.20. 오전 11:59,"누구 네모 Ⅱ[SK텔레콤 제공. 재판매 및 DB 금지]    (서울=연합뉴스) 오규진 기자 = SK텔레콤은 디스플레이 탑재형 인공지능(AI) 스피커 '누구 네모 Ⅱ'를 선보인다고 20일 밝혔다.    이 스피커는 2019년 출시된 '누구 네모'의 후속 모델이다.    전작보다 커진 10인치 화면을 장착했고, 화면 자동 전환 기능을 갖췄다.    자체 개발한 음성인식전처리·통화전처리기술로 기기 성능도 높였다.    SKT는 누구 네모 Ⅱ를 보건복지부가 주관하는 인공지능·사물인터넷(IoT) 기반 어르신 건강관리 시범사업에 먼저 도입할 예정이다.    오픈마켓 11번가에서도 제품을 구매할 수 있으며 가격은 35만9천 원이다.    acdc@yna.co.kr",105,https://n.news.naver.com/mnews/article/001/0013449441?sid=103
R&D 현장에 AI·디지털트윈 적용... 과기정통부 5년간 2000억 투입,2022.09.20. 오후 6:10,"9개 사업 데이터 공유체계 고도화 



 과학기술정보통신부가 과학기술 연구개발(R&D)의 효율성과 속도를 획기적으로 끌어올리기 위해 R&D 현장을 디지털 트윈과 인공지능(AI)으로 무장시킨다. 디지털 트윈 등 스마트랩 모델을 80개 개발하고 2027년까지 2000억원을 투입해 디지털로 전환된 9개 R&D 사업을 진행키로 했다.   20일 과기정통부 'R&D 디지털화 촉진방안'에 따르면 AI, 연구 빅데이터 등을 바이오와 소재, 기계시스템 등 R&D 전반에 도입하는 융합연구를 활성화한다. 이를 위해 2027년까지 2000억원을 투입해서 디지털 융합연구를 통한 난치 질환 진단과 신소재 개발, 우주변화 예측 등 9개 R&D 사업을 추진한다. 또 AI 로봇 소재연구실과 바이오파운드리 등 첨단 스마트랩을 개발하고 활용폭을 넓히기로 했다.   이와함께 R&D 디지털화의 핵심인 연구데이터의 수집과 공유, 활용체계를 고도화한다. 2027년까지 단백질 데이터 분석을 통한 항체 설계 및 질병 진단, 소재 데이터 기반 합성 가능성 예측 등 연구데이터 분석모델을 40개 이상 개발·확보할 계획이다. 또 원격 실험이 가능한 디지털 트윈 가상 실험환경도 양자역학 등 10개 연구분야에 대해 구축키로 했다.   디지털 역량을 겸비한 핵심 연구인력도 2028년까지 8000명을 양성한다. 이를위해 매년 1000여명의 연구자를 대상으로 AI 역량강화를 위한 데이터 사이언스 교육을 확대키로 했다.   오태석 과기정통부 제1차관은 ""기존 연구방식의 한계를 극복하고 혁신적인 성과를 창출하기 위해 디지털 기법을 접목한 R&D의 중요성이 갈수록 커지고 있다""고 말했다.",105,https://n.news.naver.com/mnews/article/014/0004901578?sid=103
"KT, 공동주택 디지털전환 앞장",2022.09.20. 오전 10:04,"전국아파트입주자대표회의연합회와 업무 협약 체결KT가 전국아파트입주자대표회의연합회(이하 전아연)와 협력해 공동주택 관리와 운영에 IT 인프라를 접목하고 디지털 기술 기반 생활 편의 서비스를 강화한다.KT는 전아연과 20일 오전 KT북대구빌딩에서 ‘공동주택 통신 인프라 확장과 디지털 전환’을 위한 업무협약을 체결했다.협약에 따라 양 기관은 ▲공동주택 초연결 인프라 구축 환경 조성 ▲공동주택관리 분야 디지털 전환 지원 ▲입주민 생활 편의 서비스 확대 ▲ESG 활동 공동 실시 등에 협력하고 상호간 시너지를 극대화할 예정이다.특히 KT는 전아연과 긴밀하게 협력하여 아파트 세대까지 광케이블을 설치하고 AI, IoT 등 미래통신 서비스 구현이 가능하도록 공동주택 네트워크 품질 고도화 추진에 집중한다는 계획이다.아울러 공동현관 자동 출입, 엘리베이터 미디어 플랫폼, 스마트 통합 보안 등 변화하는 주거환경과 주거 공간 트렌드에 맞춘 디지털 융합 솔루션으로 입주민 생활 편의를 극대화한다.전아연의 김원일 회장은 “우리 연합회는 우리나라 대표 IT기업인 KT와 4차 산업혁명 시대 든든한 동반자로서 지속적인 협력관계로 발전해 나가기를 희망한다”고 말했다.최성욱 KT 대구경북고객본부장은 “이번 업무협약을 통해 공동주택의 통신네트워크를 고도화하고 디지털전환 시대에 맞는 차별화된 서비스로 안전하고 쾌적한 주거 문화를 갖춘 아파트를 만드는 데 기여하겠다”고 말했다.",105,https://n.news.naver.com/mnews/article/092/0002268477?sid=103
"아비바-부산시, 조선해양 산업 혁신 위해 맞손",2022.09.20. 오후 6:21,"왼쪽부터 박형준 부산시장, 캐스퍼 허즈버그 아비바 COO[디지털데일리 이종현기자] 엔지니어링 및 산업용 소프트웨어(SW) 기업 아비바는 부산광역시와 함께 부산 내 조선해양기술 연구센터(이하 MCoE) 설립에 관한 양해각서를 체결했다고 20일 밝혔다.    아비바는 이번 MCoE 건립을 바탕으로 지역 내 조선해양산업 고객사와의 관계를 공고히 한다는 계획이다. 탄소배출 감소 및 운영효율성 향상을 통해 조선해양산업의 지속가능한 성장을 위한 디지털화 촉진을 목표로 삼았다.    아비바의 MCoE는 선박 설계 및 설계 SW 개발 부문 역량을 보유한 기술 전문가들로 구성된다. 해당 전문가들은 단기적으로는 조선 산업에 특화된 아비바의 차세대 설계 SW ‘아비바 E3D 디자인’을 더 향상시키는 데 집중할 계획이다.     아비바는 “이번 양해각서에는 전세계 조선해양산업을 주도하기 위한 한국의 의지가 반영됐다”고 전했다. 2030 부산 세계 엑스포를 유치하기 위한 노력의 일환이라는 설명이다.   캐스퍼 허즈버그(Caspar Herzberg) 아비바 최고운영책임자(COO)는 “이번 양해각서 체결을 통해 아비바는 조선해양 부문 고객과의 관계를 더욱 돈독히 하는 동시에 지역 내 존재감과 유대를 더욱 강화하고 있다”고 말했다.   이어서 “MCoE 설립을 통해 아비바는 최대규모 선박 설계사들로부터 신규 선박 설계시의 어려움과 기대점들을 직접 듣고 더욱 깊이 이해할 수 있게 됐으며 이를 최첨단 아비바 E3D 디자인 소프트웨어 개발에 결합할 수 있게 됐다. 이러한 노력은 추후 우리 고객에게 시간절약, 비용절감, 설계기술 향상이라는 결과를 안겨다 줄 것”이라고 말했다.   부산광역시 박형준 시장은 “부산광역시는 MCoE 설립을 위해 아비바와 협력하게 돼 매우 기쁘다. 부산시는 조선해양산업에서 오랜 역사와 역동적인 지역사회 공동체를 보유하고 있으며, 이는 기술 센터를 위한 최상의 요건이라고 할 수 있겠다. 아비바와의 파트너십이 향후에도 더 나은 지속가능한 미래를 만들기 위한 방향으로 함께 나아갈 수 있기를 기대한다”고 전했다.",105,https://n.news.naver.com/mnews/article/138/0002132964?sid=103
[첫 소행성 충돌실험] 영화가 제시한 소행성과 혜성 충돌 해결책은?,2022.09.20. 오후 4:01,"영화 '돈룩업'에서 천문학 교수(리어나도 디캐프리오 분, 오른쪽에서 두번째)와 대학원생(제니퍼 로렌스, 맨 오른쪽)은 토크쇼에 나와 지구로 혜성이 다가오고 있다고 밝혔지만 연예인 가십 뉴스에 묻힌다./Netflix        오는 27일 다트(DART) 우주선이 소행성 디모르포스와 충돌한다. 미 항공우주국(NASA·나사)은 이번 충돌 실험으로 지구에 피해를 줄 수 있는 소행성이나 혜성이 다가오면 우주선으로 부딪혀 궤도를 바꿀 수 있는지 알아보려고 한다. 다트 충돌을 계기로 과거 과학(SF) 영화에서 소행성과 혜성이 지구를 위협할 때 어떤 방식으로 대응했는지 다시 관심이 주목된다. 영화의 상상력은 어떤 해결책을 제시했을까.◇핵무기로 혜성 충돌 막아, 돈 룩 업가장 최근에 지구와 천체의 충돌을 다룬 영화는 지난해 개봉한 ‘돈 룩 업(Don’t Look Up)’이다. 영화는 에베레스트산 크기의 혜성(彗星)이 지구로 돌진하는 상황을 그렸다. 혜성은 소행성(小行星)과 마찬가지로 태양 주변을 긴 타원 궤도를 따라 도는 작은 천체이지만, 꼬리가 있다는 점이 다르다.영화에서 과학자들은 핵무기로 혜성을 폭파하면 지구 충돌을 막을 수 있다고 제안했다. 하지만 핵무기를 실은 우주선들이 발사 도중 서로 부딪히고 추락하면서 이런 시도는 물거품이 됐다. 영화는 그 후 사람들이 지구 종말을 대하는 모습을 풍자했다.과학자들은 영화의 상상력이 실현 가능하다고 본다. 미국 산타 바버라 캘리포니아대의 필립 루빈 교수는 지난 1월 25일(현지 시각) 논문 사전 출판 사이트인 아카이브(arXiv)에 “지구와 충돌하기까지 몇 년이 남았다면 근접 천체의 궤도를 바꾸겠지만 그 정도 크기 소행성이나 혜성을 단 6개월 안에 멈춰야 한다면 핵무기로 분해해야 한다”라고 밝혔다.



1998년 작 영화 아마겟돈에서 민간 시추 전문가들이 소행성에 핵무기를 장착하는 모습./월트 디즈니        루빈 교수는 일단 혜성을 파괴하는 데 필요한 파괴력은 현재 강대국들이 보유하고 있는 핵무기의 10%도 안 된다고 계산했다. 핵무기를 옮길 수단은 나사가 2025년 우주인의 달 착륙에 대비해 개발한 발사체인 ‘스페이스 론치 시스템(SLS)’과 우주 기업 스페이스X의 달 착륙선 ‘스타십’ 중 하나가 될 수 있다. 둘 다 올해 시험 발사가 예정돼 있다.로켓 발사는 혜성이나 소행성 충돌 5개월 전에는 이뤄져야 한다. 핵무기를 실은 관통기는 지구 충돌 한 달 전에 혜성이나 소행성의 가장자리에서 터져 폭발력이 중심으로 향해 동심원으로 퍼진다. 이러면 혜성이 작은 조각으로 흩어져 대부분 지구를 비켜갈 수 있다고 루빈 교수는 밝혔다.◇같은 듯 다른 ‘딥 임팩트’와 ‘아마겟돈’1998년 작 영화 ‘딥 임팩트(Deep Ompact)’도 혜성이 지구와 충돌하는 이야기를 담았다. 나사는 유인 우주선을 보내 혜성에 핵폭탄을 발사했다. 핵폭발은 혜성을 부쉈다. 기쁨도 잠시, 거대한 혜성 파편들이 지구로 충돌하고 거대한 해일이 육지를 덮친다.나사는 영화에서 영감을 얻어 2005년 발사한 템펠 혜성 탐사선을 딥 임팩트로 명명했다. 딥 임팩트는 100㎏ 무게의 구리 덩어리를 템펠 1에 충돌 시켰다. 과학자들은 충돌 때 뿜어져 나온 혜성의 구성 물질을 분석했다.



혜성 충돌 다룬 딥 임팩트의 포스터. 핵무기로 혜성을 폭발시켰지만 파편이 지구를 덥펴 엄청난 해일을 유발했다./파라마운트 픽처스        딥 임팩트와 같은 해 개봉한 ‘아마겟돈(Armageddon)’은 같은 듯 다른 내용을 담았다. 딥 임팩트가 혜성 충돌을 다뤘다면 아마겟돈에는 소행성이 지구로 다가온다. 우주로 핵무기를 가져가는 사람은 딥 임팩트에서 훈련 받은 정식 우주인이지만 아마겟돈은 민간 시추 전문가들이었다.아마겟돈에서 민간 시추 전문가들은 어렵사리 핵폭탄을 소행성에 장착했다. 하지만 원격 조종 스위치가 고장 나는 바람에 누군가 남아 직접 스위치를 눌러야 했다. 팀 리더인 브루스 윌리스는 홀로 남아 스위치를 누르고 소행성을 폭발 시켰다. 그의 희생 덕분에 지구는 무사했다.아마겟돈처럼 직접 소행성에 착륙한 우주선도 있다. 나사의 무인 탐사선 ‘오시리스-렉스(OSIRIS-REx)’는 2020년 10월 소행성 베누의 표면에 로봇 팔을 갖다 대고 자갈과 먼지를 채취했다. 오시리스-렉스는 현재 지구로 귀환 중이며, 내년 9월 24일 지구에 소행성 시료가 담긴 용기를 전달할 예정이다.일본 우주항공연구개발기구(JAXA)는 2003년 하야부사 무인 탐사선으로 소행성 이토카와의 시료를 채취하고 2010년 귀환했다. 2014년에는 하야부사2가 발사됐다. 하야부사2는 2019년 2월과 7월 두 차례에 걸쳐 토양 시료 5.4g을 채집하는 데 성공했다. 특히 두 번째 채집 때는 구리로 만든 2㎏의 탄환을 투하해 14.5m 크기의 구덩이를 만들어 표면 아래의 토양을 얻었다. 하야부사2는 2020년 12월 소행성 시료가 담긴 캡슐을 호주 사막에 떨어뜨렸다.



소행성 탐사선 ‘오시리스-렉스’가 로봇 발을 소행성 ‘베누’의 표면에 갖다 대고 토양을 채취하는 모습. 사진은 실제 임무 전 사전 연습 장면이다./NASA",105,https://n.news.naver.com/mnews/article/366/0000841796?sid=103
