title,date,main,section,url
"LG화학, UNIST와 차세대 성장동력 원천기술 개발 나선다",2021.10.31. 오전 11:04,"유지영 LG화학 CTO 부사장(왼쪽 두 번째)과 이용훈 UNIST 총장(왼쪽 세 번째)이 29일 울산 UNIST 본관에서 업무협약 체결 후 기념촬영을 하고 있다.<사진=LG화학>LG화학이 울산과학기술원(UNIST)과 차세대 성장동력 원천기술 확보와 상용화에 나선다.LG화학과 UNIST는 31일 탄소중립, 바이오매스 등 지속가능성 분야와 전지소재, 인공지능(AI) 분야 공동연구 개발을 위한 업무협약을 체결했다고 밝혔다.양측은 △이산화탄소(CO₂) 탄화수소 전환에 따른 촉매 기술 △미생물 활용 바이오 플라스틱 생산 △고성능 양극재 개발 △가공·분석 자동화 및 실험 설계 최적화 등 인공지능(AI) 기반 무인 실험실 구축 분야에서 공동연구를 추진한다.UNIST는 신소재, 바이오, 에너지를 연구하는 과학기술특성화대학이다. AI대학원 및 이차전지 연구센터를 보유하고 있다. 또 수소, 태양전지, 탄소포집·활용(CCU) 등 탄소중립 실현을 위해 내년 탄소중립융합원을 세우고 관련 교육과 연구를 선도할 계획이다.LG화학은 2025년까지 10조원을 투자해 차세대 소재, 전지, 바이오 등을 성장동력으로 육성 중이다. LG화학과 UNIST는 관련 기술 실증과 상용화를 추진하면서 시너지가 기대된다.유지영 LG화학 부사장은 “LG화학은 환경·사회·지배구조(ESG) 기반 차세대 에너지와 첨단 신소재 관련 연구에 강점을 갖고 있다”며 “탄소중립융합원을 기반으로 우수 인재 확보를 위해 UNIST와 긴밀히 협력해 나갈 것”이라고 말했다.이용훈 UNIST 총장은 “우리가 당면한 탄소중립 과제를 해결하기 위해 대학과 기업의 적극 협력이 필요하다”며 “이번 협력은 친환경 미래 기술의 확보와 상용화를 위한 든든한 발판이 될 것”이라고 전했다.",105,https://n.news.naver.com/mnews/article/030/0002978663?sid=103
"'지스타 2021', 11월 3일부터 관람 티켓 판매",2021.10.31. 오전 10:57,"지스타조직위원회가 국제 게임 전시회 '지스타 2021'에서 일반 관람객 입장을 하루에 6000명으로 제한한다.조직위는 11월 3일 오전 10시부터 지스타 공식 홈페이지를 통해 18일부터 21일까지 나흘간 부산 벡스코에서 진행되는 지스타 퍼블릭 데이 티켓 예매를 진행한다. 1일부터 '위드 코로나' 체계가 시작되지만 기존에 세운 거리두기 4단계 방역수칙을 적용, 안전을 최우선으로 하는 정책이라고 조직위는 설명했다.따라서 모든 티켓은 현장 구매 없이 모두 사전 예매로만 진행되며, 하루 판매 수량은 6000장이다. 혼잡도를 낮추기 위해 오전 10시(3500장)와 오후 1시(2500장) 입장 티켓으로 구분되며, 일자별로 1인 1매만 예매할 수 있다. 이에 따라 16일까지 진행되는 티켓 판매는 조기 종료될 가능성이 높다. 또 일반 관람객 중 성인(만 18세 이상)의 경우 백신접종 완료(14일 경과) 또는 방문일 기준 3일 이내의 PCR 음성 확인자만 입장할 수 있다.현장을 찾기 어려운 팬들을 위해 아프리카TV와 트위치, 유튜브 등에 개설된 '지스타TV' 채널을 통해 17~21일 5일간 전시회를 생방송 한다. 특히 참가사와 협력해 현장 부스에서 진행되는 주요 이벤트와 발표를 방송으로 담을 예정이다. 이밖에 참가사의 사전 녹화 콘텐츠, 지스타에서 직접 운영하는 부스 투어 라이브 방송, 현장 무대를 활용한 지스타 특집 방송과 e스포츠 대회, 게임 코스프레 어워즈(11일까지 참가 접수) 등이 추가적으로 구성된다. 이에 앞서 사전 홍보 예능 프로그램인 '스트릿 투게더 지스타'를 개막 전일까지 매주 화요일과 금요일 총 6편을 방송한다.남정석 기자 bluesky@sportschosun.com▶재테크 잘하려면? 무료로 보는 금전 사주- Copyrightsⓒ 스포츠조선(http://sports.chosun.com/), 무단 전재 및 재배포 금지",105,https://n.news.naver.com/mnews/article/076/0003795652?sid=103
[IT돋보기] IT서비스 일감개방 추진…업계 대외사업 '사활',2021.10.31. 오후 12:01,"삼성SDS·LG CNS·SK C&C, 클라우드·물류 등 사업 확대공정거래위원회가 그간 내부거래가 많았던 정보기술(IT) 서비스 분야 일감개방을 적극 추진하고 있는 가운데 대기업 IT서비스 계열사들(삼성SDS·LG CNS·SK C&C)은 수익 다각화를 통해 살길을 모색하고 있다.이들은 클라우드·물류 등 디지털전환(DT) 시대 떠오르는 분야를 중점으로 대외사업을 확대하는 모양새다.



삼성SDS·LG CNS·SK(주) C&C가 클라우드·물류 등 디지털전환(DT) 시대 떠오르는 분야를 중점으로 대외사업을 확대하고 있다.삼성 SDS는 지난 27일 열린 3분기 실적발표 컨퍼런스콜에서 클라우드·물류 등에서 대외사업을 확대하는 것이 회사의 성장전략이라고 밝혔다. 삼성 그룹사가 아닌 외부 기업고객 유치를 확대하기 위한 근본적인 사업 변화의 필요성을 강조했다.안정태 경영지원실장(부사장)은 ""정부의 일감몰아주기 규제 등에서 자유롭지 않은 상황일 뿐더러 시스템통합(SI) 관련 사업의 70~80%가 경쟁입찰로 이뤄지고 있기 때문에 예전처럼 사업할 수 없다""면서, ""고객의 선택을 받기 위해서 본연의 경쟁력을 높이는 것이 중요해졌다""고 밝혔다.삼성SDS는 IT서비스 부문에서 클라우드와 차세대 ERP(전사적자원관리) 사업을 중심으로 대외 고객을 확대한다. 특히 클라우드 사업에서는 AWS, MS 등 기존 글로벌 업체와 경쟁하는 것이 아니라 이들과 협력을 통해 고객 맞춤형 솔루션을 제공하겠다는 계획이다.삼성SDS 관계자는 ""오랜 기간 쌓은 IT서비스 노하우를 바탕으로 AWS, MS 등 여러 퍼블릭 클라우드를 종합해 고객이 원하는 멀티 클라우드를 제공할 수 있다""면서, ""이와 함께 고성능·고보안의 자체 프라이빗 클라우드 서비스가 삼성SDS만의 차별점""이라고 말했다.또 최근 중소·중견기업 대상으로 디지털 물류 플랫폼 '첼로 스퀘어(Cello Square) 4.0'을 공개하는 등 물류 고객 확보에 나섰다. 수출기업은 첼로 스퀘어를 통해 견적·계약·운송·트래킹·정산 등 물류 전과정을 단일 시스템으로 직접 관리할 수 있다는 강점이 있다. 향후 IT 서비스를 지속적으로 적용해 디지털 포워딩 사업을 확대해 나갈 예정이다.LG CNS 역시 클라우드와 스마트물류에서 대외사업을 확장하고 있다. 이와 함께 마이데이터 등 신사업을 통한 수익 다각화도 모색한다.LG CNS는 최근 대한항공 IT시스템을 AWS 퍼블릭 클라우드로 100% 전환하면서 매니지드서비스(MSP) 역량을 입증했다. 앞서 회사는 인프라·응용시스템·보안 등을 아우르는 클라우드 통합운영서비스 '클라우드엑스퍼 프로옵스'를 출시하고, 클라우드 사업을 강화했다. 이를 통해 고객 특화 하이브리드·멀티 클라우드, AI·빅데이터 등 IT신기술 적용, 클라우드 비용 최적화 등을 제공한다.또 회사는 지난해 국내 물류 자동화 시장에서 30% 점유율로 1위를 차지하면서 올해 스마트물류 사업을 더욱 확대한다. 인공지능(AI)·빅데이터 등 자사가 보유한 IT 신기술을 기반으로 물류 자동화 솔루션 고도화를 추진한다. 특히 AI 기반 도심형 물류센터 구축 등 사업 다각화를 계획하고 있다.아울러 올해 초 '마이데이터 사업추진단'을 신설하고, 플랫폼·서비스 개발, 기업 간 제휴 등 마이데이터 사업을 위한 역량을 키워왔다. 최근 마이데이터 사업자 본허가를 획득하고, 비금융 데이터 수집, 외부 기업과 제휴 등 관련 사업을 본격화했다.SK C&C도 클라우드 기반 디지털 플랫폼 전략을 확대한다. 글로벌 기업과 협력을 통한 디지털 전환 사업을 강화하겠다는 전략이다.글로벌 컨설팅 기업 커니코리아와 고객의 디지털 전환 수준을 진단하는 솔루션을 개발하는 한편, 기업의 디지털 전환을 위한 아키텍처 설계, 플랫폼∙솔루션 도입까지 한 번에 지원한다는 계획이다. 또 글로벌 데이터 클라우드 기업 스노우플레이크와 손잡고 국내에 기업 맞춤형 데이터 플랫폼을 제공한다.SK C&C는 AI·데이터·블록체인 등 인텔리전트 클라우드 플랫폼 전략으로 차별화를 꾀한다. 이는 AWS, MS 애저 등과 같이 기존의 인프라 클라우드 위에 인텔리전트 클라우드를 올려 사용하는 것으로, 데이터, AI, 블록체인 영역도 인프라 클라우드처럼 활용할 수 있도록 인텔리전트 클라우드를 포함한 통합 플랫폼 서비스를 지향한다.회사는 인텔리전트 클라우드 플랫폼 사업을 본격화했다. 최근 NH투자증권 '빅데이터 플랫폼 고도화 사업'을 수주하면서, '금융 특화 SaaS(서비스형 소프트웨어)형 빅데이터 분석플랫폼'을 선보인 것. 이를 기반으로 디지털 사업의 근간이 될 클라우드 데이터 레이크 사업 발굴에도 속도를 높이겠다는 계획이다.",105,https://n.news.naver.com/mnews/article/031/0000632004?sid=103
배민 이야기 담은 '우아콘2021' 11월 개최,2021.10.30. 오후 6:30,"11월 17일부터 사흘간사전등록 진행 중온라인 채용 부스도 마련김범준 대표 라이브 콘서트 연사  [파이낸셜뉴스] 배달의민족(배민) 운영사 우아한형제들이 배민의 성공 노하우·시행착오 공유, 채용 상담 등의 콘텐츠를 담은 콘서트를 다음달 개최한다.   30일 관련 업계에 따르면, 우아한형제들은 푸드테크 기업으로서의 기술적 성장을 공유하는 '우아한테크콘서트(우아콘) 2021'의 사전 등록을 진행 중이다. 우아콘 2021은 오는 11월 17일부터 19일까지 사흘간 진행되며, 사전 등록을 마친 누구나 참여할 수 있다.    



'우아한테크콘서트 2021'이 오는 11월 17일부터 19일까지 진행된다. 우아한형제들 제공.우아한형제들은 이번 컨퍼런스에 총 22개의 발표 세션을 준비했다. △배민 서비스를 위한 크고 작은 노력과 시도를 소개하는 '배민 비하인드' △신규 사업과 글로벌 진출, 기술 개발 스토리를 공유하는 '새로운 여정' 등의 내용이 소개될 예정이다. 해당 세션에서는 우아한형제들 실무자들이 직접 정보를 전달할 예정이다.   행사 기간 중 매일 오전 10시부터 오후 12시까지는 우아한형제들의 기술 개발과 노하우에 대해 이야기하는 라이브 콘서트도 진행된다.   김범준 대표, 송재하 최고기술책임자(CTO)가 키노트 연사로 나선다. 각 사업부별 리더가 패널로 출연해 참여자 질의에 실시간으로 응답할 계획이다.   아울러 우아콘 2021은 취업준비생들을 위해 1:1 커리어 상담이 가능한 온라인 채용 부스를 마련한다. 회사의 테크 리크루터(기술직 모집자)와 줌을 통해 상담이 가능하다.   또한 온라인 채용 부스에서는 국내에서 근무하면 우아한형제들의 베트남 서비스인 'BAEMIN'을 운영할 수 있는 직무도 소개된다. 이 행사는 우아콘 2021 홈페이지 내 사전 신청을 통해 참여할 수 있다.   다양한 이벤트도 마련됐다. 특별 배포하는 콘서트장 객석 가상화면을 배경으로 한줄 기대평과 해시태그를 담아 SNS에 인증사진을 올리면 추첨을 통해 배민 쿠폰을 증정한다. 발표 세션 영상을 시청한 개수에 따라 참여자에게 배민 쿠폰을 선착순으로 제공하는 이벤트조 준비됐다.    



'우아한테크콘서트 2021' 전체 일정표. 우아한형제들 제공.송재하 우아한형제들 CTO는 ""우아콘 2021은 우아한형제들이 푸드테크 선도 기업으로 성장하는 과정에서 쌓아온 경험과 노하우, 시행작오 등을 외부와 적극 공유하는 뜻깊은 시간이 될 것""이라며 ""풍성한 이야기 속에서 많은 참여자 분들이 새로운 인사이트를 얻어 가시길 바란다""고 했다. #배달의민족 #우아한형제들 #배민 #우아콘",105,https://n.news.naver.com/mnews/article/014/0004731402?sid=103
"지스타 2021, 11월3일부터 일반 참관객 티켓 예매 시작",2021.10.31. 오전 9:21,"지스타조직위원회가 11월3일 오전 10시부터 공식 홈페이지에서 퍼블릭 데이(11월 18~21일·오전 10시~오후 6시 운영) 티켓 예매를 진행한다고 31일 밝혔다.정부와 방역 당국에서 검토 중인 위드 코로나 체계와 무관하게 기존에 세운 거리두기 4단계의 방역수칙 적용을 유지한다는 계획이며 방역과 안전 최우선 정책을 티켓 예매에도 반영했다.모든 참관 티켓은 사전 예매로만 진행하며 1일 판매 수량도 6000장으로 제한한다. 입장 혼잡도를 낮추고자 티켓은 10시(3500장)와 13시(2500장)로 구분했으며 일자 별로 1인 1매만 예매 가능하다. 판매 마감인 16일 오후 6시 이전에라도 모든 티켓의 판매가 완료되면 예매는 조기 마감될 수 있다.일반 참관객 중 성인(만18세 이상)의 경우 백신 접종 완료(14일 경과) 또는 방문일 기준 3일 이내의 PCR 음성 확인자(문자 인증 불인정)만 참관할 수 있다. 조직위 관계자는 ""이는 현재 전시회에 적용된 의무 방역 수칙이 아니지만 백신 접종 이전의 미성년자 보호 역시 중요 방역 수칙으로 판단하고 결정했다""고 설명했다.사전에 예매를 하지 못하거나 방문이 어려운 팬들을 위해 11월17일부터 21일까지 현장 중심의 온라인 방송을 아프리카TV와 트위치TV '지스타TV' 채널에서 생방송한다.이 밖에도 참가사의 사전 녹화 콘텐츠, 지스타에서 직접 운영하는 부스 투어 라이브 방송, 현장 무대를 활용한 지스타 특집 방송과 e스포츠 대회, 지스타 2021 게임 코스프레 어워즈 등을 추가적으로 구성했으며 11월 둘째 주 중 방송 편성표를 공개할 예정이다.",105,https://n.news.naver.com/mnews/article/029/0002703572?sid=103
"LG전자, SBTi 온실가스 감축 목표 검증 통과",2021.10.31. 오전 10:32,- 탄소중립 2030 달성 ‘잰걸음’   [디지털데일리 윤상호 기자] LG전자가 ‘탄소중립 2030’에 속도를 내고 있다.   LG전자(대표 권봉석 배두용)는 과학 기반 감축 목표 이니셔티브(SBTi)로부터 온실가스 감축 목표를 검증을 통과했다고 31일 밝혔다.   SBTi는 ▲탄소정보공개프로젝트(CDP) ▲유엔글로벌콤팩트(UNGC) ▲세계자원연구소(WRI) ▲세계자연기금(WWF) 등이 공동 설립한 연합기구다. 온실가스 감축 목표를 검증한다. LG전자는 국내 가전회사 중 처음 SBTi 검증을 획득했다.   LG전자는 제품 생산단계 직접 온실가스 배출(스코프1)과 간접 온실가스 배출(스코프2) 총량을 2030년까지 2017년 대비 54% 줄일 예정이다. 제품 사용단계 온실가스 배출(스코프3)은 2030년까지 2020년 대비 20% 줄인다.   또 올해부터 2030년까지 총 60만톤 재활용 플라스틱을 사용한다. 2006년부터 2030년까지 회수 폐전자제품 목표를 800만톤으로 정했다.   LG전자 품질경영센터 김준호 부사장은 “이번 검증은 LG전자가 진정성 있게 환경에 기여하며 사회적 책임을 실천하고 있다는 것을 보여줬다”며 “혁신적인 기술과 축적해온 경험을 활용해 품질뿐만 아니라 탄소중립과 순환경제에 기여하는 제품을 지속 선보일 계획”이라고 말했다.,105,https://n.news.naver.com/mnews/article/138/0002112623?sid=103
[단독] “골목상권 침해하면 기업 쪼갠다”···與 '이재명표 온플법' 추진,2021.10.31. 오후 6:06,"‘중개자 겸 판매자’ 이중적 지위 금지플랫폼 기업 '문어발 확장' 막겠다지만IT혁신 저해·소비자 피해 양산 우려국내 환경과 맞지 않고 미국서도 논란



이재명 경기도지사가 20일 경기도청에서 열린 국회 국토위의 경기도청에 대한 국정감사에서 업무 보고하고 있다. /국회사진기자단[서울경제] 더불어민주당이 이재명 대선 후보의 정책으로 ‘온라인 플랫폼 공정화에 관한 법률안(온플법)’을 발의한다. 해당 법안에는 온라인 플랫폼 기업이 사업을 확장해 골목 상권을 침해할 경우 해당 사업을 분할할 수 있다는 급진적인 내용까지 담긴다. 전문가들은 미국의 ‘플랫폼 독점 종식 법률(Ending Platform Monopolies Act)’을 본뜬 이 법안이 국내 온라인 플랫폼 환경과는 맞지 않아 정보기술(IT) 혁신을 저해할 수 있다는 우려를 제기한다.31일 여권에 따르면 민주당은 공정거래위원회와 여야 의원들이 기존에 발의한 내용과 차별화된 새로운 온플법 발의를 준비하고 있다. 거대 플랫폼 기업으로부터 골목 상권을 보호한다는 이 후보의 정책 의지에 따라 대선 정국에서 해당 법안을 ‘이재명표’ 정책으로 추진한다는 계획이다. 앞서 이 후보는 “수수료, 광고료, 부가 서비스 등을 강요하는 플랫폼의 횡포에 소상공인은 속수무책으로 당하고만 있다”며 “플랫폼 중개 사업자가 골목 시장 영역까지 문어발 식으로 확장하는 것을 방지해 상생과 협력의 질서를 만들고 시장 독과점을 막겠다”고 밝힌 바 있다.



이 법안은 플랫폼 기업의 ‘이중적 지위 금지’와 ‘기업분할명령제도’를 핵심으로 한다. 이중적 지위는 플랫폼 기업이 단순히 거래를 중개하는 역할을 넘어서 판매자 역할까지 수행하는 것을 말한다. 국내에서 이러한 이중적 지위를 누리는 대표적 플랫폼 기업으로는 ‘쿠팡’과 ‘야놀자’ 등이 있다. 쿠팡은 자체브랜드(PB) 상품을 판매하고 야놀자 역시 전국에서 237개 숙박 업체를 운영 중인데 법안은 이러한 행위를 금지하겠다는 것이다.기업분할명령제도는 플랫폼 기업의 ‘문어발 확장’을 막는 강력한 수단이다. 플랫폼 기업이 새로운 사업에 진출해 이해 상충을 일으킬 경우 사업을 구조적으로 분리하도록 하기 때문이다. 플랫폼 기업이 본 플랫폼 사업 외에 다른 사업을 소유·지배하면서 자사 상품을 우대하거나 경쟁사 상품을 불리하게 만드는 경우가 이해 상충에 해당한다. 카카오(035720)가 모빌리티 사업에 진출하면서 가맹 택시에 ‘콜(승객호출) 몰아주기’를 했다는 의혹은 이해 상충 논란을 불러일으키기도 했다.



문제는 여당이 추진하는 이른바 ‘이재명표 온플법’이 미국과 다른 국내 플랫폼 환경을 고려하지 않았다는 점이다. 한국개발연구원(KDI)에 따르면 구글·애플·페이스북·아마존 등 일명 ‘GAFA’로 불리는 미국 글로벌 빅테크 기업의 시가총액 합은 미국 국내총생산(GDP)의 28%에 달하는 반면 국내 거대 플랫폼인 네이버·카카오의 시가총액 합은 아직 우리나라 GDP 대비 약 7%에 그치고 있다. 더욱이 네이버·카카오는 유통, 배달 음식, 지도 및 내비게이션 등 각종 분야에서 다양한 플랫폼 기업들과 경쟁하고 있다.특히 기업분할명령제도는 미국에서조차 급진적인 제도로 논란을 빚고 있다. 이호영 한양대 법학전문대학원 교수는 “우리나라의 경우 이제까지 단 한 차례도 기업분할 명령을 내린 적이 없는 상황에서 이런 입법이 가능할지 의구심이 든다”며 “온라인 플랫폼이 혁신 경제의 중추로서 활약해야 한다는 점에서 바람직한지도 의문”이라고 지적했다.인위적인 사업 분할이 오히려 소비자 후생을 저해할 수 있다는 관측도 있다. 양용현 KDI 연구위원은 “무료로 음악을 듣는 대신 광고를 보는 경우 이용자들은 돈이 아닌 자기 관심을 지불하고 음악을 소비하지만 플랫폼의 음악 스트리밍 사업과 광고 사업을 분리하면 이것이 불가능해진다”면서 “결국 소득이 낮은(가격 탄력성이 큰) 소비자일수록 더 큰 피해를 입을 우려가 있다”고 말했다.민주당은 플랫폼 규제와 관련해 공정위와 방송통신위원회의 갈등을 먼저 조율한 뒤 새로운 온플법과 기존 법안을 병합해 통과시킬 것으로 보인다. 오는 11월 4일 열리는 비공개 당정회의는 공정위의 온플법안과 방통위의 온라인플랫폼 이용자 보호에 관한 법안 간 중복 규제를 조정하기 위한 것이다. 민주당 관계자는 “두 법안이 워낙 오래 계류돼 있었던데다 심사 완료까지 상당한 시간이 소요될 것”이라며 “나중에 병합하더라도 우선은 조정이 필요한 상황”이라고 설명했다.",105,https://n.news.naver.com/mnews/article/011/0003979676?sid=103
