title,date,main,section,url
임혜숙 장관 “尹 정부서 과기부 역할 중요…현장 중심 정책 마련해야”,2022.05.09. 오후 4:17,"임혜숙 과학기술정보통신부 장관이 9일 오후 세종시 과기정통부 청사에서 열린 퇴임식에 참석했다. /과학기술정보통신부        임혜숙 장관이 새 정부에서 과학기술정보통신부의 역할이 더 중요해질 것이라며 현장 중심의 정책 마련을 당부했다. 1년 동안 임기를 마무리하는 퇴임식에서다.임 장관은 9일 오후 세종시 과기정통부 청사에서 열린 퇴임식에서 이임사를 통해 “새 정부에서 우리부 역할은 더욱 커지고 중요해질 것으로 예상된다”라며 “현장 중심의 정책을 강화하고, 국민 입장에서 한 번 더 고민해달라”고 말했다.임 장관은 지난해 5월 14일 첫 여성 과기정통부 장관으로 취임해 이날 1년간 임기를 마치고 퇴임한다.



임혜숙 과학기술정보통신부 장관이 9일 오후 세종시 과기정통부 청사에서 열린 퇴임식에서 이임사를 하고 있다. /과학기술정보통신부        그는 “길지 않은 기간이었지만 쉽게 경험할 수 없는 특별한 경험의 시간이었고, 제 인생에서 가장 도전적이면서도 보람찬 한 해가 아니었나 싶다”라며 “신종 코로나바이러스 감염증(코로나19)이라는 국가적 위기 속에서 과학기술과 정보통신기술이 우리 국민들의 어려움을 조금이라도 덜어 드리고 나아가 미래에 대한 희망을 보여 드릴 수 있도록 많이 고민하고, 또 열심히 노력해 왔던 시간이었다고 자부한다”라고 강조했다.아울러 임 장관은 “취임 때부터 현장과의 소통을 강화하겠다는 약속에 따라 현장 공감 행사를 정례화하며 느낀 점은 역시 ‘모든 문제의 답은 현장에 있다’라는 것이었다”라며 “연구 현장 속으로, 기업 속으로, 직접 들어가 고민과 아이디어를 함께 나누다 보면 더 넓은 시야에서 더 좋은 정책이 나오곤 했다”라고 회상했다.끝으로 그는 “서로 화합하고 즐겁게 일할 수 있는 조직문화를 계속 발전시켜 나가 주시기를 부탁드린다”라며 “다양한 배경을 가진 구성원들이 서로에 대한 편견 없이, 활발하게 소통하고 협력하는 좋은 조직문화가 조직의 발전을 이끌고, 더 좋은 성과를 내며, 구성원 한 사람, 한 사람의 보람과 행복을 이끌어낸다고 믿는다”라고 당부했다.



임혜숙 과학기술정보통신부 장관이 9일 오후 세종시 과기정통부 청사에서 열린 퇴임식에 참석했다. /과학기술정보통신부        다음은 임혜숙 과학기술정보통신부 장관 이임사 전문사랑하는 과학기술정보통신 가족 여러분!저는 오늘 과학기술정보통신부 장관으로서의 소임을 마치고 떠납니다.작년 5월 14일 취임식 이후 지난 1년을 돌아보면, 첫 여성 장관으로서 큰 부담감과 막중한 책임감, 사명감을 갖고 참 숨 가쁘게 달려온 것 같습니다.너무나 다양한 기술 분야에 대한 현안을 이해하여 핵심을 뽑아내야 하고, 언론인터뷰나 방송출연을 통하여 정책에 대해 설명해야 하고, 현장의 의견을 잘 듣고, 반영하여 정책으로 연결시켜야 하고, 중요한 의사결정을 내려야 하고, 다양한 이해관계를 조정해야 하고, 민간의 협조와 협력을 이끌어내야 하고, 외국 대표들과 만나 국제협력을 논의해야 하고, 시험을 앞둔 학생의 심정으로 준비하던 국정감사까지.이 모든 일, 어느 것 하나, 쉬운 것도 익숙한 것도 없었습니다만, 열심히 설명하여 이해시켜주시고, 또 때로는 참을성 있게 설득하여 주신 여러분들 덕분에 여기까지 왔습니다.이 모든 과정에서 수고하고 함께 고생해주신 한분 한분께 이루 말할 수 없이 진심으로 감사한 마음입니다.길지 않은 기간이었지만 쉽게 경험할 수 없는 특별한 경험의 시간들이었고, 제 인생에서 가장 도전적이면서도 보람찬 한해가 아니었나 싶습니다.여러분들과 함께 머리를 맞댄 채 과학기술정보통신 정책을 수립하고 실행할 수 있었던 경험은 저에게 큰 행운이자 영광이었습니다.코로나19라는 국가적 위기 속에서 과학기술과 정보통신기술이 우리 국민들의 어려움을 조금이라도 덜어 드리고 나아가 미래에 대한 희망을 보여 드릴 수 있도록 많이 고민하고, 또 열심히 노력해 왔던 시간이었다고 자부합니다.이임식을 하는 지금 여러분과 함께 한 순간순간들이 주마등처럼 스쳐 지나갑니다.먼저 순수 우리 기술로 개발한 누리호가 우주를 향해 힘차게 날아오르던 감동의 순간이 있었습니다.올해 6월로 예정된 2차 발사에서는 기존의 한계점을 보완해 마지막 임무까지 완수하는 모습을 꼭 볼 수 있기를 기원합니다.디지털 뉴딜의 바통을 이어받아 4차 산업혁명 대응의 기틀을 마련한 것도 잊지 못할 것입니다.정부의 마중물 역할에 민간의 혁신이 더해지며 최근에는 가시적인 성과들이 하나둘씩 나타나고 있습니다.크고 작은 모든 성과들은 여러분들이 있어서 가능했고, 모두 여러분들의 덕분입니다.함께 수고해주신 모든 분들께 진심으로 감사합니다.앞으로 디지털 선도국가를 넘어 글로벌 디지털 강국, 디지털의 혜택을 사회 구성원 모두가 함께 누리는 디지털 포용사회로 더욱 발전해 나갈 수 있도록 계속 노력해 주시기 바랍니다.작년 연말부터는 미중 반도체 갈등에서 시작된 글로벌 기술패권 경쟁에 위기의식을 느껴, 반도체·우주·인공지능 등의 10대 국가필수전략기술을 선정하고 육성에 온 힘을 기울여 오고 있습니다.기술패권 경쟁은 여전히 현재진행형이고 또한 앞으로도 계속될 것입니다.국가 연구개발의 주무 부처로서 민관의 역량을 결집해 한층 더 적극적으로 대응해 주시기를 다시 한번 부탁드립니다.무엇보다도 디지털 대전환 시대의 주인공인 우리 청년들을 위한 지원 정책을 마련하고 추진한 것이 저에게는 큰 보람이었습니다.아무쪼록 우리 청년들이 더 큰 꿈을 가지고, 더 많이 도전하여, 더 크게 성장하고, 더 넓은 세계로 도약할 수 있도록 촘촘한 지원이 꾸준히 이어지기를 희망합니다.사랑하는 과학기술정보통신 가족 여러분!저는 오늘 떠나가지만, 여러분들이야말로 과기정통부의 주인입니다.새로운 정부에서 우리부의 역할은 더욱 커지고 중요해질 것으로 예상됩니다.훌륭하신 새로운 장관님과 여러분들이 힘을 합쳐 한 단계 더 발전하는 우리부와 대한민국의 모습을 믿어 의심치 않지만, 마지막으로 그동안의 경험을 바탕으로 몇 가지 당부말씀을 드리겠습니다.먼저 우리부는 미래를 준비하고 선도해야 하는 사명을 가진 부처입니다.그래서 여러분들에게도 항상 기존의 틀을 깨고 변화와 혁신을 주도해 나갈 것이 요청됩니다.산업과 산업, 기술과 기술의 경계가 모호해지는 빅블러 시대에 있어, 과학기술과 디지털의 융합은 최고의 혁신 방안입니다.그동안 기술 융합을 통해 우리부는 미래 기술 확보와 신산업 창출에 있어 소기의 성과를 거둘 수 있었습니다.여러분 모두 적극성과 전문성을 갖춘 융합과 혁신의 주역이 될 수 있도록 끊임없이 정진해 주실 것을 당부드립니다.이를 바탕으로 우리부가 부처 간 협업을 이끌고 민간과도 긴밀하게 협력하는 주도적인 조정자의 역할을 잘 수행해주기를 기대합니다.둘째, 현장 중심의 정책을 계속 강화해 주시기를 바랍니다.취임 때부터 현장과의 소통을 강화하겠다는 약속에 따라 현장 공감 행사를 정례화하며 느낀 점은 역시 ‘모든 문제의 답은 현장에 있다’라는 것이었습니다.연구 현장 속으로, 기업 속으로, 직접 들어가 고민과 아이디어를 함께 나누다 보면 더 넓은 시야에서 더 좋은 정책이 나오곤 했습니다.아울러 항상 정책을 수립할 때 최종 고객인 국민들의 입장에서 한 번 더 고민해 주시기를 바랍니다.마지막으로, 서로 화합하고 즐겁게 일할 수 있는 조직문화를 계속 발전시켜 나가 주시기를 부탁드립니다. 다양한 배경을 가진 구성원들이 서로에 대한 편견없이, 활발하게 소통하고 협력하는 좋은 조직문화가 조직의 발전을 이끌고, 더 좋은 성과를 내며, 구성원 한사람, 한사람의 보람과 행복을 이끌어낸다고 믿습니다.앞으로도 존중과 배려를 기본으로 서로 이끌고 도와주며 더욱 더 하나 된 과기정통부의 모습을 기대해 봅니다.이제 저는 그동안의 모든 추억을 가슴에 안고 떠납니다.이제는 밤에 알람을 맞추지 않고 잠자리에 들어도 되고, 이른 아침 당일 일정을 살피며 부담스러운 마음으로 하루를 시작하지 않아도 되고, 출근길에 언론 동향을 세세히 살피지 않아도 됩니다만, 과학기술정보통신부에 대한 관심과 애정만은 멈추지 않겠습니다.밤낮을 가리지 않고 맡은 바 책임을 다해주신 여러분들의 헌신과 노고도 결코 잊지 않겠습니다.그간 여러분들과 함께 일할 수 있어서 참 행복했습니다. 과기정통부에서 맺은 새로운 인연을 소중히 잘 간직하고, 국민의 한 사람으로 언제 어디서나 항상 우리 과학기술정보통신부를 응원할 것입니다.여러분들의 앞날에 건강과 행복이 늘 함께하기를 기원합니다.감사합니다!",105,https://n.news.naver.com/mnews/article/366/0000812154?sid=103
2031년 달 착륙 꿈 앞당긴다...차세대 발사체 사업 예타 진행 중,2022.05.09. 오후 12:01,"과기정통부, 재사용 기반 기술 적용한 발사체 기업과 함께 개발누리호를 이을 차세대 발사체 개발 사업이 예비타당성조사 대상으로 선정되어 조사가 진행 중이라고 과학기술정보통신부가 9일 밝혔다.한국형 발사체 누리호 후속 사업으로 추진하는 차세대 발사체 개발 사업에는 2023년부터 2031년까지 1조 9천 330억원이 투입된다. 달 착륙선 발사나 대형 위성 자력 발사가 가능하도록 수송 능력을 높이고, 재사용발사체 전환과 성능 확장 등에 대비해 고체부스터 기술 개발 등을 병행한다.



한국형 발사체와 차세대 발사체 비교 (자료=과기정통부)차세대 발사체는 액체산소-케로신 기반 2단형 발사체로 개발된다. 1단 엔진은 100톤급 다단연소사이클 방식 액체엔진 5기가 클러스터링 되며, 재점화와 추력조절 등 재사용발사체 기반 기술이 적용된다. 2단 엔진은 10톤급 다단연소사이클 방식 액체엔진 2기로 구성되고 다회 점화와 추력 조절 등의 기술이 적용된다.차세대 발사체가 개발되면 우리나라는 지구궤도 위성뿐 아니라 달이나 화성 등에 대한 독자 우주탐사 능력도 확보하게 된다. 정부는 2030년 달 착륙 검증선을 발사해 성능을 확인한 후, 2031년 본격적인 첫 임무로서 달착륙선을 발사할 계획이다.설계부터 최종 발사에 이르는 전 과정을 향후 선정될 체계종합기업이 한국항공우주연구원과 공동 수행하고, 산업체를 중심으로 민간 주도 선행기술 연구도 추진한다. 이를 통해 우주강국 진입에 기여할 우주기업을 육성한다는 목표다.권현준 과기정통부 거대공공연구정책관은 ""차세대 발사체 개발을 통해서 우리나라가 본격적인 우주탐사 능력을 확보하게 된다는데 의의가 있다. 또한 설계 단계부터 민간이 참여하는 첫 발사체 개발 사업으로 민간의 발사체 개발 역량을 제고하는데 본 사업이 큰 역할을 할 것으로 기대한다""라며 ""차세대 발사체 개발 사업이 예비타당성조사를 통과할 수 있도록 정부도 최선을 다하겠다""라고 밝혔다.",105,https://n.news.naver.com/mnews/article/092/0002256172?sid=103
"이원욱 ""우주청 논의 사천 정해놓고 시작 유감…과학자 배제돼""",2022.05.09. 오전 10:17,"기사내용 요약페북에 문홍규 천문연 그룹장 응원 글 올려""과학기술비서관 과학기술 중심국가 만들기엔 부족""



[서울=뉴시스] 전신 기자 = 9일 서울 여의도 국회에서 열린 과학기술정보방송통신위원회 전체회의에서 이원욱 위원장이 발언하고 있다. (공동취재사진) 2021.09.09. photo@newsis.com[서울=뉴시스] 이진영 기자 = 이원욱 국회 과학기술정보방송통신위원회 위원장(더불어민주당 소속)이 최근 ""윤석열 당선인은 경제, 안보, 미래 등 이 모든 가치는 제외한 채 지역만 경남 사천이라고 박아 놓고 우주청 신설을 시작하고 있다. 과학자는 배제된 논의""라고 비판했다. 9일 정치권에 따르면 이 위원장은 지난 6일 페이스북에 '매일 인수위로 편지를 보내는 한 천문과학자를 응원합니다'라는 제목의 글을 올려 ""문홍규 한국천문연구원 우주탐사그룹장이 민주당·국민의힘 모두의 대선 공약이었던 우주청 신설 논의가 지역 문제로 옮겨지면서 윤 당선인과 안철수 위원장에게 매일 편지를 쓰고 있다""고 소개하며 이같이 날을 세웠다.  문 그룹장은 편지를 통해 항공우주청 설립 지역으로 대전 지역이 적절하며, 윤 당선인이 정한 사천은 산업 인프라 대부분이 항공산업 위주로 치우쳐 있다고 의견을 피력하고 있다. 이 위원장은 ""정치가 먼저인 우주청 신설 논의에는 저 역시 유감""이라면서 ""과학기술을 중심에 놓지 않고 우주정책을 추진하는 당선인이 참으로 걱정""이라고 지적했다. 우주과학자, 우주산업계의 제대로 된 의견 수렴없이 사천 지역만 못박고 논의를 시작한 것에 대해 문제가 있다고 짚은 것이다. 항공우주청 설립의 기준은 우주산업의 발전에 무엇이 도움되는가가 먼저인데 지역간 갈등을 유발하는 당선인의 태도는 문제가 있다는 시각이다.



(출처: 이원욱 위원장 페이스북 글 캡처)또 이 위원장은 ""윤 당선인 측이 발표한 과학기술비서관을 보니 우주청 논의가 더 산으로 가겠다""면서 ""에너지 분야라고 하기에도 민망한 인사에게 중책을 맡기고 과학기술 중심 국가를 만들 수 있을지 걱정된다. 원전정책을, 에너지 전환정책을 수행하기 위한 인사로만 보인다""고 풀이했다.앞서 윤 당선인은 지난 5일 과학기술비서관에 조성경 명지대 방목기초교육대 교수를 임명했다. 조 교수는 원자력안전위원회 비상임위원, 사용후핵연료공론화위원회 대변인 등을 거쳤던 원전 분야 인물로 꼽힌다. 이어 이 위원장은 ""이명박·박근혜 정부 때 계획했던 전력기본계획에 따라 신규 원전 26개(문재인 정부 때인 20년, 17개로 낮춤)로 회귀시키겠다는 의지로만 보인다""라고 역설했다. 아울러 그는 추가 글을 통해 ""매일 편지를 쓰는 과학자의 마음과 공감해야 한다""며 ""부디 대통령이라는 직이 국민 위가 아닌 ‘국민 곁’, ‘국민 속’ 임을 명심하십시오""라고 촉구했다．",105,https://n.news.naver.com/mnews/article/003/0011170914?sid=103
"BMW 일부 차량, 안드로이드 오토·카플레이 지원 안돼",2022.05.09. 오후 2:27,"반도체 공급난 영향…""6월말까지 소프트웨어 업데이트 예정""자동차업체 BMW도 반도체 공급난의 직격탄을 맞았다.BMW가 일부 차량에 안드로이드 오토나 애플 카플레이 지원 기능을 탑재하지 못한 채 출고하고 있다고 엔가젯을 비롯한 외신들이 8일(현지시간) 보도했다.보도에 따르면 BMW는 반도체 공급업체를 교체하면서 안드로이드 오토나 애플 카플레이를 지원하지 않는 칩을 사용했다.대상 제품은 올초부터 4월말까지 생산된 것들 중 최종 출하 목적지가 미국, 프랑스, 이탈리아, 스페인, 영국으로 돼 있는 차량들이다.



안드로이드 오토가 실행되고 있는 BMW 차량 모습 (사진=BMW 코리아)이 때문에 최근 출고된 일부 차량에서 해당 기능을 사용하지 못하고 있다고 외신들이 전했다.BMW는 “늦어도 6월말까지는 소프트웨어 업데이트를 제공할 계획이다”고 밝혔다.안드로이드 오토나 애플 카플레이 지원 여부를 확인하기 위해선 차량 구매 코드에 ‘6PI’가 있는지 확인해보면 된다고 나인투파이브 구글이 전했다.",105,https://n.news.naver.com/mnews/article/092/0002256182?sid=103
어떤 항아리길래? 34억에 낙찰된 조선 '달항아리'…국내 경매 최고가 경신,2023.10.25. 오전 11:02,"담백한 유백색으로 높은 평가백자대호는 왕실 행사에서 주로 사용'달항아리'로 불리는 조선 시대 백자대호가 경매에서 34억원에 낙찰됐다. 해당 달항아리는 18세기 전반에 만들어진 것으로 추정됐다.25일 서울옥션에 따르면 전날 서울 강남구 신사동 강남센터에서 진행된 175회 미술품 경매에서 백자대호가 34억원에 낙찰됐다. 이는 국내에서 경매된 백자대호 중 최고가 기록이다. 이전 국내에서 경매된 백자대호 중 최고가는 2019년 6월 서울옥션 경매 때 낙찰된 31억원이다.



서울옥션 경매에서 34억원에 낙찰된 백자대호. [이미지제공=서울옥션]해당 백자대호는 47.5㎝ 높이로, 완전한 원형에 가까운 형태다. 담백한 유백색의 색채 등으로 희소성을 높이 평가받았다. 서울옥션 측은 이 백자대호를 두고 '국보급'이라고 소개하며 ""높이 40㎝ 이상 백자대호는 왕실 행사에서 주로 사용됐다""고 했다. 실제 40㎝ 이상 크기의 백자대호 중 국보로 지정된 작품은 3점, 보물까지 포함해도 20여점에 불과한 것으로 알려졌다.최근 달항아리는 경매에서 많은 관심을 받고 있다. 지난 3월 미국 뉴욕 크리스티 경매와 9월 뉴욕 소더비 경매에서 이번 출품작과 비슷한 시기에 제작된 달항아리가 각각 약 60억원, 47억원에 낙찰된 바 있다.한편 이번 경매에서는 백자대호 외에도 '청자기린형향로', '백자청화수복문대접'과 같은 도자류, '전라군현도첩', '한경전도' 같은 고지도, 추사 김정희의 '간찰' 등 고미술품에 대한 관심도 이어졌다.",105,https://n.news.naver.com/mnews/article/277/0005331053?sid=103
"KT, KMI 검진 데이터 '클라우드'로 안전 관리",2022.05.09. 오전 9:29,"기사내용 요약차세대 검진 시스템 구축…전용회선·장비 호스팅 등 인프라 지원KT DS, 지능형 건강 검진 시스템 7개 센터에 적용



[서울=뉴시스] KT, KT DS가 KMI한국의학연구소에 차세대 검진 시스템을 도입했다. (사진=KT 제공) 2022.5.9 *재판매 및 DB 금지【서울=뉴시스】심지혜 기자 = KT가 클라우드, 인터넷데이터센터(IDC) 등 정보통신(ICT) 기술을 KMI한국의학연구소 건강 검진 시스템에 적용한다. KT는 KT DS와 KMI한국의학연구소에 차세대 검진 시스템을 도입했다고 9일 밝혔다.KMI 고객의 개인 정보와 데이터는 KT 클라우드로 보관하고 IDC 코로케이션 서비스로 서버를 위탁 관리한다. 전용 회선, 장비 호스팅과 보안 솔루션을 통합 제공하는 KT ‘기가오피스’, ‘기업인터넷전화’를 통해 검진 업무에 필요한 환경도 마련한다.양사는 네트워크 분야에서도 협력한다. KT는 KMI 헬스케어센터 서울 통합 사무소와 재단본부 및 지방사무소, 제주검진센터 등 다수 사업장의 네트워크 환경을 점진적으로 구성해나갈 예정이다. 특히 네트워크 보안에 집중한다. KT DS는 지난해 스마트 검진시스템인 ‘KICS(킥스)’를 KMI 7개 센터에 구축했다. 킥스는 ‘KMI한국의학연구소 지능형 건강 검진 시스템’으로, 종이 차트를 없애고 검진에 필요한 과정을 통합해 고객들의 대기 및 결과 확인 시간을 줄여주는 첨단 시스템이다. 국내에서 킥스를 전면 도입한 곳은 KMI가 최초로 지난해 4월부터 KMI 7개 센터(광화문, 여의도, 강남, 수원, 대구, 부산, 광주)에서 서비스 중이다.박장혁 KT DS 엔터프라이즈사업본부장은 ""최근 KT DS가 출시한 케이-쉽(K-SHIP) 역시 국내에서 처음 시도하는 스마트 헬스 통합 서비스 플랫폼인 만큼, 스마트 헬스 기술의 발전과 시장 활성화에 기여할 것""이라고 포부를 밝혔다.유창규 KT 강북/강원법인고객본부장(상무)은 “KT의 강점인 AI, 로봇 등의 다양한 분야에서 파트너십을 강화해 나가겠다""고 말했다.",105,https://n.news.naver.com/mnews/article/003/0011170707?sid=103
