title,date,main,section,url
코딩도 '문송'합니다? …IT업계 불황에 취업문 닫힌 '문과생 개발자',2022.09.11. 오전 10:00,"부트캠프, 단기 프로그래밍 학원 등에서 개발 직무 능력을 학습한 이른바 '문과 출신 개발 지망생'의 취업이 힘들어지고 있다. / 사진=송현도 아시아경제 인턴기자#인문대학 졸업 예정자 A씨(26)는 요즘 취업 문제로 근심이 가득하다. '문사철(문학·역사학·철학)' 전공자인 그는 최근 8주짜리 단기 코딩 교육 프로그램도 수강했다. 조금이라도 일자리 시장에서 우위를 점해 보려는 노력이다. 그러나 한 번 '문과생' 꼬리표가 붙은 그에게 IT 개발직 취업은 여전히 요원하다. A씨는 ""먼저 IT 회사에 취직한 친구 말을 들어보니 요즘 회사들은 문과 출신을 그리 반기지 않는다더라""며 ""졸업이 코앞인데 어떻게 먹고 살아야 할지 막막하다""라고 토로했다.글로벌 경기 둔화로 인해 IT 공룡, 테크 스타트업들이 고용을 줄이면서, 이른바 '문과 출신 개발자 지망생'의 취업 문이 좁아지고 있다. 기업들이 속성 강의로 프로그래밍을 학습한 초보 개발자보다 능력과 경험이 검증된 베테랑을 훨씬 선호하는 탓이다. 이미 예전부터 이과 출신에 비해 극심한 취업난을 겪던 문과 출신 구직자의 고통이 가중되고 있다는 우려가 나온다.'문과생 꼬리표' 때문에 전전긍긍하는 취업준비생 사례는 A씨 뿐만이 아니다. 또 다른 문과 출신 구직자 B씨(27)는 ""예전에는 문과 직업으로 여겨졌던 은행, 홍보, 영업 분야도 요즘엔 코딩을 요구한다""라며 ""부랴부랴 부트캠프나 속성 학원에서 프로그래밍을 배워봤자 대학 4년 내내 관련 지식을 쌓은 사람들과 비교가 되겠나. 문과 대학을 나오면 아예 취업을 포기해야 하는 건가""라고 분통을 터뜨렸다.



이른바 '부트캠프'라고 불리는 단기 코딩 학원이 밀집된 서울 강남구 한 학원가. 사진은 기사 중 특정 표현과 관련 없음. / 사진=임주형 skepped@문과생의 취업난은 이전부터 고질적인 문제였다. 한국노동연구원이 지난 2019년 발간한 '월간 노동리뷰' 보고서를 보면, 인문계열 전공자의 취업률은 56.0%로 모든 전공 중 가장 낮았으며, 월평균 초임은 220만원으로 평균(250만원)에조차 미치지 못했다.이런 가운데 문과생들이 '돌파구'로 삼은 게 속성 코딩 학원이었다. 일명 '코딩 부트캠프'로, 3~6개월, 빠르면 6~8주 동안 비전공자에게 기초적인 개발 직무에 필요한 기술을 숙달시켜 IT 회사에 노동력을 공급하는 업체를 이르는 말이다. 최근에는 온라인 강좌로만 진행하는 부트캠프도 다수 열리고 있으며, '국민내일배움카드' 등 정부 지원을 받아 저렴한 가격에 교육 코스를 제공하는 곳도 있다.코로나19 유행 이후 화두에 오른 '디지털 전환' 및 ICT 호황 또한 문과 출신 개발자'의 탄생을 부추겼다. 새로운 IT 시스템을 개발하기 위해 IT 기업들은 개발자를 대거 채용했고, 이 중에는 단순한 프로그래밍 기술을 가진 초보 개발자도 포함됐기 때문이다.하지만 올해 러시아·우크라이나 전쟁으로 인한 에너지 가격 급등, 국제 물가 위기 등 경제적인 악재가 겹치면서 IT 기업들도 타격을 받자, 이들 초보 개발자들이 가장 먼저 피해를 보는 모양새다. 



경기 성남 판교 테크노밸리 / 사진=연합뉴스한국 소프트웨어정책연구소가 올해 상반기에 발간한 IT 업계 고용 동향 자료에 따르면, IT 기업들의 올해 신입 개발자 채용 공고는 약 5700명으로 전년(6600명) 대비 900명 감소했다. 반면 경력직 채용 공고는 같은 기간 약 1만600명으로, 지난해(8900명)보다 1600명가량 늘었다. 불황을 대비 중인 IT 기업들이 초보 개발자보다는 이미 검증된 능력을 갖춘 베테랑 엔지니어 쪽으로 관심을 돌렸다는 뜻이다.일부 코딩 학원이 비전공자 개발 지망생에 지나치게 부실한 교육 커리큘럼을 제공하는 바람에 IT 기업들의 '선입견'이 강화됐다는 지적도 있다. 판교의 한 IT 기업에서 보안 관련 개발을 맡은 엔지니어 C씨(32)는 ""개발은 수개월 벼락치기 공부를 한다고 숙련될 수 있는 직무가 아니다. 아래에서부터 차근차근 배우면서 올라와야 하는데, 일부 학원들은 겉핥기식 프로그래밍만 가르치고 있다. 그러니 비싼 돈을 주고 개발자를 채용했는데 막상 할 줄 아는 게 없어 기업이 손해 보는 일이 많아진 것""이라고 말했다.전문가는 일부 코딩 학원의 허술한 학습 커리큘럼에 문제가 있다고 진단한다. 실무와 동떨어진 이론 중심의 코딩 교육으로는 기업에 적합한 프로그래머를 양성할 수 없다는 지적이다. 김현철 고려대 컴퓨터학과 교수는 ""프로그래밍을 이론 학습과 실제 기업에서 코드를 짜 소프트웨어를 만드는 작업 사이에는 상당한 갭이 있다. 기업 실무자들은 '프로젝트'를 중심으로 팀 단위로 활동하고 효율적으로 코드를 짜는 노하우를 알고 있는데, 이론만 배워서는 이런 기술을 학습할 수 없기 때문""이라고 지적했다.이어 ""네이버, 카카오 등 대기업이 자체적으로 운영하는 부트캠프, 탄탄한 정부 지원을 받는 교육 기관은 숙련된 실무자가 수강생에게 코딩 지식을 전수하는 교육 방식이 자리 잡아 비전공자도 훌륭한 프로그래머로 성장할 수 있다""라며 ""이런 도제 교육 과정을 생략하고 이론만 가르치는 일부 사설 학원의 강습으로는 한계가 있다""라고 말했다.",105,https://n.news.naver.com/mnews/article/277/0005145751?sid=103
거리두기 해제된 추석 연휴··· 에스원 “절도범죄 주의하세요!”,2022.09.09. 오전 7:31,"[디지털데일리 이종현기자] 3년 만에 사회적 거리두기가 해제된 추석 연휴가 시작되는 가운데, 상점을 노리는 절도 범죄가 크게 늘어날 것으로 우려된다.   9일 에스원 범죄예방연구소는 85만 고객처 빅데이터를 분석해 침입범죄 동향을 분석한 결과 작년 줄어든 추석 연휴 절도 범죄가 올해 다시 증가할 것으로 예상된다고 밝혔다. 주택보다는 빈 상점이 주요 타깃이 될 전망이다.   경찰에 따르면 작년 추석 연휴 절도 범죄는 하루 평균 26.2건이다. 전년 22.5건 대비 약 14% 줄었다. 사회적 거리두기의 영향으로 고향 방문 대신 집에 머무르는 사람이 많은 데다 명절 연휴에도 영업을 하는 점주들이 많았기 때문이라는 것이 에스원 측 설명이다.   이번 연휴는 3년 만에 거리두기가 해제되고 고속도로 통행료도 면제되는 등 고향 방문이나 여행이 크게 늘 것으로 점쳐진다. 빈 집과 상점을 대상으로 한 절도 범죄가 급증할 수 있는 환경이다.   경찰도 가족·사적 모임이 많아지면서 유동인구가 늘어 절도범죄가 증가할 것으로 전망해 예방 활동에 주력하겠다고 발표한 바 있다.   에스원 범죄예방연구소에 따르면 작년 주택 침입 범죄는 전년대비 72% 이상 감소했다. 반면 상점 대상 절도 범죄는 증가했다. 절도 범죄의 주요 타깃이 주택에서 상점으로 옮겨갔다는 분석이다. 실제 작년 발생한 절도 범죄의 약 79%는 상점을 노린 범죄였다. 같은 기간 무인매장 대상 범죄는 86% 늘었다. 



  에스원은 “주로 현금이 많거나 현금화가 쉬운 물건이 많은 업종이 범죄의 타깃이 되기 쉽다. 최근 무인매장 범죄가 계속해서 증가하고 있는 것도 그 이유”라며 “추석 연휴기간 무인매장을 비롯해 상점 절도 범죄 예방법에 대한 숙지와 실질적인 대비가 필요하다”고 강조했다.    침입 시도는 주로 심야 시간대인 0~6시에 집중됐다. 0~6시 발생률은 전체 건수의 약 80%를 차지했다. 특히 어둡고 인적이 드문 새벽 3~4시에 침입범죄 시도가 집중되는 것으로 조사됐다. 이어 18~24시(9.0%), 6~12시(9.0%), 12~18시(2.2%)순으로 나타났다.    에스원은 “이번 추석 연휴 장기간 외출 시에는 출입문, 창문을 잠그고 집에 가급적 현금을 보관하지 않아야 침입범죄 피해를 줄일 수 있다”며 “절도범죄의 주요 대상인 매장과 주택 모두 보안업체의 무료 보안 컨설팅을 받아보는 것도 좋은 방법”이라고 조언했다.   또 홈 사물인터넷(IoT) 애플리케이션(앱)을 통해 외부에서 TV나 에어컨 등을 작동시켜 계량기의 수치를 변동시키는 등의 범죄 예방 팁도 전했다.    에스원 관계자는 “과거에는 범죄예방을 위한 전문적인 대응방법을 접할 기회가 많지 않아 범죄피해 예방에 어려움을 겪었다. 하지만 최근에는 전문가들이 분석한 데이터를 쉽게 접할 수 있기 때문에 이를 적극적으로 활용한다면 교묘해진 범죄수법에 현명하게 대처해 나갈 수 있을 것”이라고 말했다.",105,https://n.news.naver.com/mnews/article/138/0002132367?sid=103
남태평양 섬나라 파푸아뉴기니서 규모 7.6 강진,2022.09.11. 오전 11:47,"쓰나미 경보 해제..환태평양 조산대 '불의 고리'에 속해[이데일리 강민구 기자] 남태평양 섬나라 파푸아뉴기니 동쪽 지역에서 규모 7.6의 강진이 발생해 쓰나미 경보가 발령됐다가 해제됐다.호주 북동부에 있는 파푸아뉴기니는 화산이나 지진 등의 활동이 잦은 환태평양 조산대 ‘불의 고리’에 속한다. 파푸아뉴기니 라에로부터 78km 떨어진 지역에서 11일 오전 8시 46분께 강진이 발생했다.이날 미국 지질조사국(USGS)에 따르면 카이난투로부터 북동쪽으로 66km 떨어진 지역에서 규모 7.6의 강진이 발생했다. 진원의 깊이는 90㎞로 발표했다. 미국쓰나미경고센터도 해당 지역에서 규모 7.7의 강진이 발생했다고 발표했다.이번 지진 때문에 발생한 인명·재산 피해는 아직 공식적으로 알려지지 않았다. 현지 주민은 균열이 생긴 도로나 건물, 부서진 자동차 등을 찍어 소셜미디어(SNS)에 올렸다.한편, 파푸아뉴기니처럼 ‘불의 고리’에 속한 인도네시아에서 지난 2004년 12월 규모 9.1의 지진에 따른 쓰나미가 발생해 총 22만명이 숨졌다.



파푸아뉴기니섬 부근에서 규모 7.6의 지진이 발생했다.(자료=미국쓰나미경고센터 홈페이지 갈무리)",105,https://n.news.naver.com/mnews/article/018/0005314334?sid=103
"KT, 건사협과 지하 통신시설 보호 위해 맞손",2022.09.10. 오전 10:43,"KT 충남/충북NW운용본부장 김성일 상무(왼쪽 3번째), 건사협 이주성 회장(왼쪽 4번째)을 비롯한 양 기관 임직원이 기념 촬영을 하고 있다.    KT가 지하 통신시설 보호를 위해 ‘건설기계개별연명사업자협의회(이하 건사협)’와 손잡았다.   KT에 따르면 지난 7일 대전 동구 선샤인호텔에서 사단법인 ‘건사협’과 건설기계 공사 중 발생되는 통신 시설 피해를 최소화하기 위해 ‘공동 안전관리 업무협약’을 체결 했다고 밝혔다.   건설 현장 케이블 매설 지역 부근 지하굴착 작업중인 중장비가 실수로 지하 통신 케이블을 파손하는 사고가 종종 발생되고 있다. 통신 광케이블에는 수십만 가입자가 연결돼 있어 파손될 경우 인근 지역 유무선 서비스가 중단될 수 있으며, 중장비 사업자는 통신시설 피해 배상에 따른 금전적 손실이 발생하게 된다.   양 기관은 이러한 사고를 막고자 공동 안전관리와 예방을 위한 기술 개발과 시범 적용에 상호 협력하기로 이번 협약을 통해 약속했다.   KT는 우선적으로 건사협 회원이 지하 통신시설 매설 정보 확인을 위한 직통 채널을 공유하고, 협약 이후 건사협의 중장비 주변 KT 지하 통신시설 여부 확인을 위한 시스템 구축에 협업할 계획이다.   아울러 KT와 건사협은 이번 협약 자리에서 한층 더 강화된 유기적인 소통과 협업으로 지하 통신시설 보호와 공사 피해 사전 예방에 최선을 다하겠다고 다짐했다.   KT 네트워크운용본부장 서영수 상무는 “KT는 건사협과 상호 협력을 통해 지하 중요 통신 시설물을 보호하고 안정적으로 통신 인프라를 운용해 KT가 디지털 플랫폼 기업으로 성장하는데 기여하겠다”고 말했다.   건사협 이주성 회장은 “우리 건사협은 건설기계개별연명사업자를 대변하는 단체로서 사회적 책무를 이행하는데 있어 이번 KT와의 협약은 건설기계 업계에 새로운 도약의 계기가 된다고 생각한다”고 덧붙였다.",105,https://n.news.naver.com/mnews/article/396/0000623756?sid=103
"알트코인, 증권형 토큰으로 포함되면 어쩌나…가상자산거래소 수익원 축소 우려",2022.09.11. 오전 10:44,"""알트코인, 증권형 토큰 포함여부 판단 쉽지는 않아""



[디지털데일리 박세아 기자]  증권형 토큰 제도권 편입이 본격화한 가운데 가상자산거래소 입장에서는 가상자산거래소의 미래 수익처가 축소될 수 있다는 관측이 나온다.    11일 블록체인 업계에 따르면 금융당국의 증권형 토큰 정의여부에 따라 가상자산거래소들의 수수료 이익이 축소될 수 있다. 국내는 아직까지 증권형, 비증권형 코인에 대한 명확한 가이드라인이 없다.    지난 6일 '증권형 토큰 발행 유통 규율체계 정비 방향' 세미나에서 금융위원회 김소영 부위원장이 증권형 토큰 규율체계 초안을 공개했다. 즉 올해 안에 증권형 토큰에 대한 가이드라인을 발표하겠다고 공언한 것이다. 가이드라인은 증권형 토큰 성격과 발행, 유통 규율 체계 등이 포함된다.   금융당국의 증권형 토큰 정의에 따라 상당수 토큰이 기존 가상자산거래소가 아닌 한국거래소가 운영하는 '디지털증권시장'으로 이관될 수 있다. 한국거래소는 증권시장을 증권 및 파생상품 매매와 상장, 공시, 감리 등 역할을 수행하고 있다.    증권형 토큰은 블록체인 기술을 활용해 토큰 형태로 발행한 증권을 의미한다. 토큰 투자자는 이와 연동된 자산의 수익을 배당받는다. 예컨대 최근 건물 조각 투자로 알려진 '카사'나 '펀블'처럼 부동산과 같은 실물자산과 연동된 수익증권을 토큰화한 것이 포함된다.     금융당국이 증권형 토큰을 어떻게 정의하냐에 따라 알트코인 상당수가 증권형 토큰으로 분류될 가능성을 배제할 수 없다. 앞서 미국 증권거래위원회(SEC) 제이 클레이튼 전 위원장은 비트코인(BTC)과 이더리움(ETH)을 뺀 나머지 가상자산은 증권 성격을 띤다고 밝힌 바 있다.   이런 관점을 가지고 SEC는 가상자산 프로젝트 리플과 증권법 위반 혐의로 소송을 진행하고 있기도 하다. 이 역시 리플(XRP)이 증권에 포함되느냐 여부를 두고 2년 가까이 긴 법정공방을 이어가고 있다. 즉 이미 SEC 입장에서는 XRP를 증권 기준에 부합함에도 SEC에 등록하지 않은 미등록 증권을 발행했다고 문제 삼았다.    국내에 증권형 토큰 가이드라인이 없는 상태에서 SEC와 소송 결과 여부는 국내 가이드라인에도 상당한 영향을 미칠 수 있다. 빠른 경우 SEC과 리플 소송 결과는 올해 연말에서 오는 2023년 초 최종 재판 결과가 나올 수 있다.    금융당국 입장에서는 개괄적인 가이드라인을 올해 연말까지 만든다해도, 현재 코인마켓캡에 있는 2만개 코인을 모두 증권형 여부를 두고 개별 판단하는데 상당한 시간이 소요될 수 있다.     ◆업계 관계자들 ""상당수 알트코인 증권형 판명되면 당연히 수익원은 축소""   한 업계 관계자는 ""초기 단계라 지켜봐야 하는 부분이 있지만, 코인 시장 위축으로 거래량이 줄어 수익이 대폭 축소한 거래소 입장에서는 긍정적이지는 않은 상황""이라고 말했다.    다른 관계자는 ""거래소 입장에서 극단적으로 BTC와 ETH만 거래를 중개할 수 있다면 상황이 많이 힘들어진다. 어디까지 증권형 토큰을 적용할지가 관건""이라며 ""만일 상당수 알트코인이 증권형 토큰으로 정의된다면 각 거래소 특색이 사라지게 돼 점유율 변동이 큰 폭으로 나타날 것""이라고 설명했다. 알트코인 거래량이 많은 거래소의 경우 점유율이 대폭 축소될 수 있다는 의미다.    이 가운데 금융시장이 코인 시장에 뛰어든다면 오히려 장기적 관점에서 가상자산에 대한 인식이 확대되고 제도권에 편입된다는 점에서 긍정적으로 볼 수 있다는 시각도 존재한다. 알트코인이 갑자기 한국거래소 관리 및 감독으로 넘어가는 게 쉽지는 않은 상황이라는 판단이다.   업계 다른 관계자는 ""일각 우려대로 알트코인이 한국거래소로 넘어가는 것은 시장 상황이나 기술적인 측면을 고려했을 때 당장 쉬운 일은 아니다""라며 ""일반적인 트레이딩보다는 거래소에서 하지 못하는 파생상품을 다루는 것으로 시작될 것으로 보인다""라고 언급했다.",105,https://n.news.naver.com/mnews/article/138/0002132397?sid=103
"김원이 의원 ""코로나19 특별대응단, 한 달째 위원 구성도 못해""",2022.09.11. 오전 9:16,"""정기석 교수 중대본 회의참석·브리핑 외 기존과 달라진 것 없어""‘코로나19 특별대응단’이 출범 한 달이 넘도록 대응단 위원 구성은 커녕 단 한차례 회의도 개최하지 않은 것으로 알려졌다.김원이 더불어민주당 의원에 따르면, 지난달 3일 정부는 코로나19 특별대응단장으로 정기석 한림대 교수를 임명했다. 정 교수는 윤석열 정부 출범 이후 국가감염병 위기대응 자문위원장도 맡고 있었다.



사진=김원이 더불어민주당 의원김원이 의원실이 보건복지부로부터 제출받은 자료에 따르면, 코로나19 특별대응단장은 재난 및 안전관리 기본법 시행령을 근거로 위촉됐다. 역할은 중대본 회의에 매회 참석하여 의견 개진하고, 국민의 이해도를 돕기 위한 대국민 소통(브리핑)을 실시하는 것이라고 설명했다. 또한 특별대응단장은 방역대책의 결정 권한은 없다.김 의원은 정 교수 임명 이후 한 달 이상의 시간이 지났지만, 대응단 구성은커녕 관련 회의조차 열지 않는 등 별다른 성과가 없다고 주장했다. 복지부에 따르면, 현재 코로나19 특별대응단은 정기석 단장이 유일한 구성원이다. 단 한차례 회의 개최도 없었지만, 정 위원장이 지금까지 총 11회의 브리핑을 진행한 것으로 나타났다.김원이 의원은 “이미 민간전문가 21명으로 구성된 독립된 자문기구인 국가감염병 위기대응 자문위원회가 존재하고 있음에도 불구하고 새로운 대응단 구성은 ‘옥상옥’”이라며 “코로나19 특별대응단은 과학방역에 대한 국민의 질타가 잇따르자 급조한 ‘보여주기식’ 방역”이라고 비판했다.이어 “윤석열 정부가 과학방역의 근거로 민간전문가 역할을 강조하지만, 결국 문재인 정부와 윤석열 정부 모두 민간위원이 자문을 맡고 의사결정 권한은 없다는 점에서 차별성을 찾기 힘들다”며 “국무총리와 민간전문가가 공동위원장을 맡았던 문재인 정부 시절이 의사결정에 있어 더 합리적”이라고 지적했다.",105,https://n.news.naver.com/mnews/article/092/0002267774?sid=103
인도네시아 'KOREA 360' 살펴보는 박보균 장관,2022.09.11. 오후 2:02,"박보균 문화체육관광부 장관이 11일 G20 문화장관회의 참석차 인도네시아를 방문해 오는 12월 개관 예정인 자카르타 롯데쇼핑 애비뉴 내 K-브랜드 해외홍보관 'KOREA 360' 조성 현장을 둘러보고 있다.







문화체육관광부 제공",105,https://n.news.naver.com/mnews/article/030/0003042833?sid=103
[주간IT템] 아이폰14 프로 라인업 혁신.. 카카오엔터 북미 확장,2022.09.10. 오후 6:56,"‘빛의 속도’로 전개되는 한 주간 테크 분야 이슈를 한 눈에  [파이낸셜뉴스]  <편집자주> 파이낸셜뉴스(fn) 산업IT부 테크 취재기자들이 매주 토요일에 전하는 주간 이슈(날짜순) 브리핑입니다. 독자 여러분의 소중한 의견(기사 댓글은 순공감순)도 함께 담았습니다.   



카카오엔터   타파스엔터 출범..카카오엔터 북미 확장  카카오엔터테인먼트(카카오엔터)는 미국 자회사 타파스미디어와 래디쉬미디어가 전략적 합병을 완료하고 타파스엔터테인먼트(타파스엔터)로 새롭게 출범한다고 밝혔습니다. 김창원 전 타파스 미디어 대표와 박종철 카카오엔터 글로벌사업부문 대표가 타파스엔터 공동대표를 맡았습니다. 타파스엔터는 북미 기반 웹툰 플랫폼 ‘타파스’, 웹소설 플랫폼 ‘래디쉬’, 아시아 판타지 웹소설 서비스 ‘우시아월드’가 보유한 지식재산권(IP) 간 시너지를 극대화한다는 목표입니다.    



라인 넥스트   네이버-라인 넥스트, NFT 희소성 승부  네이버가 라인 넥스트와 함께 K-팝 팬이 참여하는 대체불가토큰(NFT) 생태계를 열었습니다. 네이버 라이브 엔터테인먼트 플랫폼 ‘NOW.(나우)’ 지식재산권(IP) 기반 NFT 서비스인 ‘나우드롭스’를 시작했습니다. 나우드롭스는 네이버와 라인 넥스트가 글로벌 NFT 플랫폼 ‘도시(DOSI)’에서 선보이는 합작 NFT 서비스입니다. 네이버 나우는 NFT 콘텐츠 파트너로서 멤버 및 카메라별 퍼포먼스 영상과 백스테이지 현장 등 미공개 콘텐츠를 독점으로 제공합니다.    



KT-현대차그룹 CI. 각사 제공   현대차-KT, 7500억원 ‘모빌리티 혈맹’  현대차그룹과 KT가 7500억원 규모 지분교환을 단행했습니다. 미래 모빌리티 시장을 주도하기 위해 ‘모빌리티 혈맹’을 맺고 전략적 파트너십을 확대한 것입니다. 현대차와 KT는 커넥티비티(Connectivity) 분야에서 차량기술 고도화를 추진하는 데 중점적으로 협력하기로 했습니다. 또 양사는 미래 신사업과 선행연구 활성화를 위해 ‘사업협력위원회’(가칭)를 구성하여 운영할 계획입니다.    



아이폰14 프로 라인업에 적용된 '다이내믹 아일랜드'.   노치가 사라졌다..아이폰14 프로 혁신  애플이 코로나 팬데믹(세계적 대유행) 이후 3년 만에 미국 캘리포니아 본사에서 ‘아이폰14’를 비롯한 신규 디바이스 라인업을 발표했습니다. 이른바 ‘M자 탈모’로 불렸던 스마트폰 전면 윗부분의 움푹 파인 ‘노치’는 사라지고, 차세대 칩과 배터리 성능 등은 대폭 강화했습니다. 가장 큰 변화는 아이폰14 프로 라인업에 적용된 ‘다이내믹 아일랜드’입니다. 다이내믹 아일랜드는 사용자가 이용하는 소프트웨어(SW)에 따라 유기적으로 변형되는 디스플레이입니다.     @swba**** “샘숭이 열등감을 느끼는 시간인가 ㅋㅋㅋㅋㅋㅋ”   



네이버   네이버, 부동산 확인매물 정보보호 정당   네이버는 검찰이 부동산 매물 정보 관련 의혹으로 불구속 기소한 건에 대해 “네이버의 권리에 대한 타업체 무임승차를 방지하기 위한 최소한의 정당한 방어조치였다”고 반박했습니다. 앞서 서울중앙지검 공정거래조사부는 시장지배적사업자 지위남용으로 인한 독점규제 및 공정거래에 관한 법률 위반 혐의로 네이버를 불구속 기소했습니다. 하지만 네이버는 부동산 허위매물로 인한 소비자 피해를 막기 위해 2009년 6월부터 수백억을 들여 확인매물 정보 서비스를 구축했다는 점을 강조했습니다. 경쟁사업자에게 확인매물 정보 제공을 허용하지 않은 것은 네이버 권리에 대한 최소한의 정당한 방어조치였다는 설명입니다.     @vaio**** “검찰은 네이버가 공공기관인줄 아나보네”  #아이폰 #엔터 #NFT",105,https://n.news.naver.com/mnews/article/014/0004896730?sid=103
,,,105,https://n.news.naver.com/mnews/article/236/0000227442?sid=103
