title,date,main,section,url
"네이버D2SF, 캠퍼스 기술창업 공모전 개최",2022.09.16. 오후 1:09,"11월 4일까지 접수…단계별 인큐베이팅 제공네이버 D2SF가 11번째 캠퍼스 기술창업 공모전을 진행, 학생 창업팀 발굴과 투자에 나선다. 공모전은 잠재력 있는 학생 창업팀을 극초기 단계에 발굴해 성장을 돕고 투자, 협력 기회 제공을 목표로 마련된 프로그램이다.2016년부터 학기마다 정기적으로 진행해왔으며, 유망한 학생 기술 창업팀의 대표적인 성장 프로그램으로 자리매김했다. 공모전엔 기술을 활용한 문제 해결 계획을 갖고 있는 대학(원)생 창업팀이라면 누구나 지원할 수 있다.특히 법인 설립 여부나 기술 개발 단계에 관계없이 지원할 수 있어, 시장에서 가치를 입증하는 데 오랜 시간이 필요한 기술 스타트업의 초기 성장 가능성을 탐색할 수 있는 기회가 될 것으로 기대된다.



(사진=네이버D2SF)네이버 D2SF는 최종 선정된 팀에 인큐베이팅 프로그램을 3개월간 제공한다. 먼저 기술 개발에 몰입할 수 있도록 ▲자금 ▲클라우드 인프라 ▲강남 입주 공간 등과 기술 성장을 위해 ▲네이버 기술 리더 피드백 ▲네이버 사옥 내 입주 공간 등 혜택을 준다.그간 네이버 D2SF는 캠퍼스 기술창업 공모전을 통해 학생 창업팀 성장을 이끌어왔다. 지금까지 최종 선정된 49팀 중 22팀은 법인 설립, 투자 유치에 성공했다. ▲모빌리티 스타트업 모빌테크 ▲인공지능 애니메이팅 자동화 솔루션을 개발한 플라스크는 인큐베이팅 후 네이버 D2SF 투자로 이어진 대표적인 사례다.비디오 인공지능(AI) 기술을 개발한 비닷두는 네이버 D2SF 기술창업 공모전과 투자를 거쳐 네이버웹툰에 인수됐다. 재작년 상반기 인큐베이팅을 거쳐 같은해 7월 네이버 D2SF로부터 투자를 유치한 플라스크 이준호 대표는 “공모전을 통해 기술 개발, 팀 빌딩에만 온전히 몰입해 빠르게 성장할 수 있었다”고 말했다.양상환 네이버 D2SF 리더는 “학생 기술 창업팀이 잘 성장하려면, 기술창업에 최적화한 인큐베이팅 프로그램이 필요하다”며 “이번 공모전에서도 유망한 팀을 발굴해 이들이 시장 기회를 발견하고 성장해나갈 수 있도록 적극적으로 지원하겠다”고 말했다.공모전 참가 접수 기간은 11월4일까지로, D2SF 홈페이지에서 접수할 수 있다.",105,https://n.news.naver.com/mnews/article/092/0002268239?sid=103
"박윤규 차관, ICT 규제샌드박스 심의위원회",2022.09.16. 오전 11:51,(서울=뉴스1) = 박윤규 과학기술정보통신부 제2차관이 16일 오전 서울 중구 서울중앙우체국 스카이홀에서 열린 '제23차 ICT 규제샌드박스 심의위원회'를 주재하고 있다. (과학기술정보통신부 제공) 2022.9.16/뉴스1,105,https://n.news.naver.com/mnews/article/421/0006337413?sid=103
장현국 “중동·북아프리카 블록체인 존재감 키운다”,2022.09.16. 오후 3:33,"UAE 두바이서 포브스 중동과 인터뷰 진행“중동의 강력한 커뮤니티 목표, 역량 집중”위메이드, 중동 블록체인 사업 드라이브



장현국 위메이드 대표가 포브스 중동과 인터뷰를 진행하고 있다. (사진=유튜브 캡쳐)[이데일리 김정유 기자] 장현국 위메이드(112040) 대표가 “중동의 강력한 커뮤니티를 목표로, 중동과 북아프리카 투자를 강화하고 역량을 집중하겠다”고 밝혔다.장 대표는 최근 아랍에미리트(UAE) 두바이에서 글로벌 경제지 포브스 중동과의 인터뷰를 통해 “현재 중동의 블록체인 기술 시장은 시작단계이지만, 중동과 아시아가 블록체인 기술과 산업의 중심지가 될 수 있다고 믿고 있다”고 강조했다.위메이드는 지난 5월 국내 게임사 최초로 두바이에 지사를 설립한 바 있다. 중동 지역 블록체인 사업 확장의 일환이다. 중동의 탄탄한 커뮤니티를 겨냥, 블록체인 게임 플랫폼으로의 존재감을 높이겠다는 계획이다. 두바이는 역시 최근 ‘친(親) 블록체인’을 내세우며 블록체인 기술 기업을 적극 유치하고 있다. 블록체인 기술을 기반으로 한 비즈니스 생태계와 가상자산 서비스에도 과감한 정책을 펼치고 있는 만큼 향후 크립토 분야에서의 강력한 발전 가능성이 기대된다.장 대표는 이번 인터뷰에서 “위믹스는 게이머와 개발자 모두가 선택하는 플랫폼이 될 것”이라며 “올해 말까지 위믹스 플랫폼에서 100개의 블록체인 기반 게임을 출시할 계획”이라고 강조했다.이어 “향후 3년 안에 모든 게임이 블록체인 게임이 전환되고, 블록체인 기반의 위믹스 3.0은 게임 토큰과 대체불가능토큰(NFT)을 바탕으로 이용자들의 게임 통화 거래 방식을 변화시킬 것”이라고 덧붙였다.",105,https://n.news.naver.com/mnews/article/018/0005318130?sid=103
넷마블 블록체인 신작 '킹 오브 파이터즈 아레나' TGS서 윤곽,2022.09.16. 오후 6:18,"'킹 오브 파이터즈 아레나' 대표 이미지 /넷마블 제공넷마블은 블록체인 전문 자회사 마브렉스가 블록체인 기반 대전 격투 게임 '킹 오브 파이터즈 아레나'를 도쿄 게임쇼 2022(TGS 2022)에 출품하고 세부 정보를 공개했다고 16일 밝혔다.'킹 오브 파이터즈 아레나'는 넷마블과 일본 SNK의 두 번째 협업 작품이다. 전작 '킹 오브 파이터 올스타' 서비스를 통해 다양한 노하우를 쌓아온 넷마블네오에서 개발을 맡았다. 출시는 올해 하반기로 예정됐다. 이 게임은 '킹 오브 파이터즈 시리즈'에 등장하는 캐릭터 중 하나를 선택해 실시간 PvP(이용자 간 대결)에 참여할 수 있는 것이 특징이다. 캐릭터 NFT(대체불가토큰)와 게임 토큰 등 블록체인 시스템이 적용됐다.마브렉스는 이번 도쿄 게임쇼 2022에서 실시간 1대 1 대전이 가능한 '킹 오브 파이터즈 아레나' 최신 빌드를 선보이고 별도 발표를 통해 게임이 추구하는 핵심 재미 요소와 토큰 이코노미 설계 등을 공개했다.마브렉스 관계자는 ""기존 킹 오브 파이터즈 시리즈 팬뿐만 아니라 NFT 홀더, 크립토 이용자 등이 모두 참여할 수 있는 범용적인 블록체인 기반 대전 격투 게임을 표방하고 있다""고 말했다.발로 뛰는 더팩트는 24시간 여러분의 제보를 기다립니다.▶카카오톡: '더팩트제보' 검색▶이메일: jebo@tf.co.kr▶뉴스 홈페이지: http://talk.tf.co.kr/bbs/report/write",105,https://n.news.naver.com/mnews/article/629/0000172916?sid=103
"일동제약, 코로나藥 국내 허가 및 정부 판매 위한 권리 확보",2022.09.16. 오후 4:25,"국내 생산에 필요한 기술이전 포함일동제약은 핑안시오노기홍콩과 코로나19 치료제 후보물질 ‘S-217622’의 국내 허가를 추진하기 위한 1차 계약을 체결했다고 16일 밝혔다. 핑안시오노기홍콩은 홍콩 시오노기와 중국 핑안보험 자회사인 투툼재팬헬스케어가 2020년 설립한 합작회사다. 원개발사인 시오노기제약으로부터 S-217622의 한국 판매권리를 도입해 보유하고 있다. 일동제약은 국내에서 사용 승인을 추진하기 위한 권리와 판매를 위해 정부와 교섭할 수 있는 권리를 보유하게 됐다. 계약금은 약 450만달러(약 63억원)이다. 국내 정부를 대상으로 S-217622를 판매할 경우 핑안시오노기홍콩에 일정 금액을 지불해야 한다. 이번 계약에는 S-217622의 국내 생산에 필요한 기술이전 등에 관한 권리도 내용에 포함됐다.향후 정부가 아닌 상대방에 추가 판매를 하기 위해서는 2차 계약이 필요하다. 이에 대한 내용은 계약 체결 시 공시할 예정이다. S-217622는 1일 1회 5일간 복용하는 경구용 항바이러스제다. ‘3CL-프로테아제’를 선택적으로 억제해 코로나19를 유발하는 코로나19 바이러스의 증식을 막는다. 국내 및 일본을 포함한 아시아 임상 2·3상 중 2b상 2차 종점에서 투약 및 경과를 관찰한 결과 기침 인후통 콧물 코막힘 호흡곤란 등의 호흡기 증상이 유의미하게 개선됐다. 같은 임상에 대한 사후 분석 결과, 오미크론 변이 바이러스 감염 시의 증상인 발열 기침 인후통 콧물 코막힘 호흡곤란에 있어서도 유사한 수준의 효과가 확인됐다. 일동제약은 지난해 11월 시오노기제약과 S-217622에 대한 공동 개발 계약을 체결하고 한국 내 임상 등 개발 활동을 수행해왔다. S-217622의 아시아 2·3상 임상은 마무리 단계를 진행 중이다.",105,https://n.news.naver.com/mnews/article/015/0004750527?sid=103
8월 스마트폰 완제품 수출 '35%' 폭락,2022.09.16. 오전 11:47,"과기정통부 8월 ICT 수출입 집계 발표무역수지 58억달러 1년새 30억달러↓휴대폰 수출 2.6억달러로 크게 후퇴[서울경제] 글로벌 경기 둔화와 지속되는 생산 차질로 8월 휴대전화 완제품 수출이 지난해 같은 기간보다 30% 이상, 컴퓨터 등 IT 기기 수출은 25% 이상 대폭 줄었다. 8월 말 갤럭시Z 폴드4·플립4가 출시됐음에도 스마트폰 수출이 크게 줄며 삼성전자 실적 악화에 대한 우려도 이어진다.



월별 ICT 수출 증감율. 사진제공=과기정통부16일 과학기술정보통신부는 8월 정보통신기술(ICT) 수출이 193억1000만 달러, 수입은 135억2000만 달러를 기록했다고 밝혔다. 지난해 같은 기간보다 수출은 4.6% 줄고 수입은 18.7% 늘어, 이 기간 무역수지는 88억5000만 달러에서 57억9000만 달러로 감소했다.반도체(6.8%), 디스플레이(5.3%), 휴대전화(3.3%), 컴퓨터(25.3%) 등 전 분야 수출이 줄었지만 가장 큰 타격을 받은 분야는 휴대전화와 컴퓨터였다. 컴퓨터와 주변기기 수출은 7월 21.9% 줄어든 데 이어 2달 연속 20% 이상 감소세를 보여 12억6000만 달러로 쪼그라들었다.휴대전화는 카메라모듈 등 부품 수출이 8억8000만 달러로 전년 대비 12.3% 늘어 14개월 연속 증가세를 보였지만 완제품 수출은 전년 동기보다 34.7% 크게 감소한 2억6000만 달러에 불과했다. 완제품과 부품을 더한 전체 휴대전화 수출도 7월 6.1%에 이어 2달 연속 감소세다. 과기정통부 관계자는 “글로벌 경기 둔화 영향으로 스마트폰을 비롯한 IT 기기 수요가 감소하고 있다”고 설명했다.8월 삼성전자 전략 제품인 갤럭시Z 폴드4·플립4가 출시됐음에도 휴대전화 수출이 줄어든 점이 뼈아프다. 특히 중저가 시장에서 한국과 경쟁하고 있는 중국의 8월 휴대전화 수출은 부품 분야 성장에 힘입어 6억6000억달러로 전년 동기 대비 43.3% 늘었다. 중국이 빠르게 성장하는 와중 한국은 후퇴 일변도인 셈이다. 업계 한 관계자는 “급속히 나빠진 경기와 프리미엄 제품을 선호하는 국내 소비자 취향이 맞물려 스마트폰 시장이 얼어붙고 있다”며 “폴더블 폰의 본격적인 판매가 이뤄지는 9월에도 수출이 줄어든다면 올해 업황 반전이 힘들다”고 했다.",105,https://n.news.naver.com/mnews/article/011/0004099571?sid=103
"생각대로, KFC·고용노동부와 라이더 안전운전 민관 합동 캠페인 진행",2022.09.16. 오전 11:10,"수도권 KFC 매장에 캠페인 스티커 10만장 배포생각대로가 KFC, 고용노동부와 손잡고 라이더 안전운전을 위한 민관 합동 캠페인을 진행한다고 16일 밝혔다. 회사는 KFC, 고용노동부와 함께 제작한 캠페인 스티커 10만장을 오는 21일 수도권 KFC 매장에 배포할 예정이다.스티커는 민관이 협력해 라이더 안전운전을 독려하고자 특별 제작한 홍보물로, 내달 20일까지 1개월 간 수도권 KFC 매장 포장백에 부착된다. KFC에선 지역 담당자를 통해 원활한 캠페인 진행을 위한 교육 및 관리를 지원할 예정이다.부착된 스티커는 음식을 제공하는 매장에서 배송을 수행하는 라이더에게, 또 라이더에게서 소비자에게 중복 노출되며 외식 업계와 배달대행 종사자, 그리고 일반 소비자까지 안전운전에 대한 메시지를 전할 것으로 기대된다.



(사진=생각대로)생각대로 관계자는 “글로벌 브랜드 KFC와 고용노동부와 함께 캠페인을 진행하게 돼 외식업계 전반과 라이더들에게 큰 파급효과를 가져올 것”이라며 “캠페인을 통해 배달 시장에 성숙한 안전운전 문화가 자리 잡고, 업계와 소비자에게 독촉을 지양하는 문화가 형성되길 바란다”고 말했다.",105,https://n.news.naver.com/mnews/article/092/0002268227?sid=103
"네이버 '바이브', 오리지널 오디오 콘텐츠 라인업 공개",2022.09.16. 오전 10:43,"기사내용 요약오리지널 오디오 콘텐츠 출시 예정작 6편 공개""뮤직 플랫폼에서 오디오 전반 품는 플랫폼으로 확장""



[서울=뉴시스]바이브는 올해 선보일 오리지널 콘텐츠의 라인업을 16일 공개했다고 밝혔다. (사진=바이브 제공).2022.09.16 *재판매 및 DB 금지[서울=뉴시스]최은수 기자 = 네이버 음원 플랫폼 바이브는 올해 선보일 오리지널 오디오 콘텐츠의 라인업을 16일 공개했다고 밝혔다. 공개된 콘텐츠는 총 6편으로 ▲’친구’, ‘극비수사’ 등 곽경택 감독이 제작한 오디오 무비 ‘극동’ ▲정신과 전문의와 함께하는 마음진단 콘텐츠 ‘하지현 박사의 마음하트’ ▲배우 이선빈, 이준혁 주연의 스릴러 오디오 무비 ‘리버스’ ▲음악과 함께하는 홈 트레이닝 ‘UV와 따라와, 홈사이클’ ▲가수 조권과 배우 나인우가 각각 참여한 슬립가이드 두 편이다.바이브는 지난해 12월 출시된 ‘오디오 탭’에서 콘텐츠를 선보일 예정이다. 오디오 탭은 소리를 중심으로 자막과 컴퓨터그래픽(CG)등 비주얼 효과가 결합된 오디오 무비, 수면을 유도하는 슬립가이드 등 다채로운 형식의 오디오 콘텐츠가 제공된다. 바이브 뮤직 구독권을 구입하지 않고도 누구나 콘텐츠를 즐길 수 있다. 오디오 탭을 통해 바이브는 오디오 콘텐츠 전반을 품는 플랫폼으로 거듭나고 있다. 오디오 무비 ‘층’은 지난해 12월 27일 공개된 후 450만회 청취 됐고, 오디오 탭이 신설된 후 바이브 애플리케이션 설치율은 33% 증가했다. 바이브의 사용자 중 약 40%는 음악청취 뿐만 아니라 오디오 탭에서 제공되는 콘텐츠를 즐기고 있다.반경자 네이버 오디오서비스 리더는 “오디오 콘텐츠는 일상의 모든 순간 즐길 수 있는 유일한 콘텐츠 형식으로서 빠르게 성장 중인 분야”라며 “바이브는 연내 6편의 오리지널 콘텐츠를 선보이는데 그치지 않고, 기부마라톤 클럽과 함께하는 러닝메이트 오디오 등 다양한 시도를 이어가며 독보적인 플랫폼 경쟁력을 확보할 것”이라고 말했다.",105,https://n.news.naver.com/mnews/article/003/0011422417?sid=103
"카카오, 오픈채팅방 광고 시작… 메타버스 수익화 ‘첫 발’",2022.09.16. 오전 9:55,"(왼쪽) 드라마 '이상한 변호사 우영우' 오픈채팅방에 광고 배너가 걸린 모습. (오른쪽) 같은 드라마 다음 검색 결과에 오픈채팅 바로가기 기능이 추가된 모습. /카카오톡 다음 캡처        카카오가 드라마 관련 이벤트성 오픈채팅방에 광고 노출을 시작했다. 카카오가 추진 중인 텍스트 기반의 메타버스 전략이 처음으로 수익화 모델을 입은 것이다.16일 카카오에 따르면 카카오는 현재 드라마 ‘이상한 변호사 우영우’ ‘빅마우스’ ‘환혼’의 오픈채팅방 상단에 광고 배너를 붙이고 있다. 카카오는 이를 위해 지난 7월 다음 검색 결과에 오픈채팅 바로가기 기능을 추가한 바 있다.카카오 관계자는 “이용자 활성화와 관련된 다양한 지표를 종합적으로 고려해 광고 적용 오픈채팅방을 선정, 운영하고 있다”며 “오픈채팅 바로가기 적용 대상은 새로 방영하는 드라마나 스포츠, 연예 등 더욱 폭넓은 분야와 주제의 검색 결과로 확대해나갈 예정이다”라고 밝혔다. 이날 기준 카카오는 총 23개 드라마 검색 결과에 오픈채팅 바로가기를 제공 중이다.남궁훈 카카오 각자대표는 앞서 지난달 4일 2분기 실적발표 컨퍼런스콜에서 “오픈채팅은 별도의 프로모션 없이도 일간 활성 이용자 수 900만명을 확보하는 등 강력한 서비스로 성장하고 있다”며 “카카오톡과 멜론, 카카오페이지 등 카카오 생태계 안팎에 오픈채팅으로의 접근을 용이하게 만드는 영역을 마련하고 광고 모델을 적용할 것”이라고 말했었다.",105,https://n.news.naver.com/mnews/article/366/0000840931?sid=103
[날씨] 오전까지 짙은 안개...큰 일교차 유의,2023.10.28. 오전 6:48,"이른 아침 집을 나서는 분들은안개 주의하시기 바랍니다.현재 곳곳에서 200미터 앞도 내다보기 힘든데요.차 간 간격 넉넉히 두시고안전 운전 해주시기 바랍니다.오늘도 일교차가 큽니다.현재 서울 기온 9.9도, 대구 7.6도로 다소 쌀쌀하지만 낮에는 20도까지 올라 선선하겠습니다.오늘 하늘도 맑아서 단풍 놀이 가기 참 좋은데요.동해안을 중심으로 한때 비가 조금 내릴 것으로 보입니다.현재 기온 살펴봅니다.현재 춘천이 8.4도, 안동은 7.4도고요.낮기온은 춘천이 19도, 부산이 21도까지 오를 것으로 보입니다.당분간 맑고 일교차 큰 전형적인 가을 날씨가 이어질 전망입니다.날씨였습니다.※ '당신의 제보가 뉴스가 됩니다'[카카오톡] YTN 검색해 채널 추가[전화] 02-398-8585[메일] social@ytn.co.kr",105,https://n.news.naver.com/mnews/article/052/0001952695?sid=103
"LG엔솔-GM 배터리 JV 얼티엄셀즈, 美 공장 가동 '속도'…IRA 대응 '잰걸음'",2022.09.16. 오후 3:44,"얼티엄셀즈 3공장 공사현장  - 1~3공장 순차 가동·4공장 검토   [디지털데일리 김도현 기자] LG에너지솔루션과 미국 제너럴모터스(GM) 배터리 합작사(JV) 얼티엄셀즈가 생산라인 설립에 한창이다. 1공장에 이어 2~3공장도 공사 속도가 붙었다.   16일 얼티엄셀즈는 미국 미시간주 랜싱 3공장 철골 공사를 시작했다고 밝혔다. 내년 상반기까지 관련 작업을 마치고 2024년 하반기 가동 목표다.   3공장은 26억달러(약 3조6200억원)를 투입되며 완공 시 50기가와트시(GWh) 생산능력을 갖추게 된다.   은기 얼티엄셀즈 사장은 “건설이 예정대로 진행되고 있어 기쁘다”며 “최대 효율성으로 품질과 안전을 제공하는데 집중하고 있다”고 설명했다.   업계에서는 3공장 장비 발주가 내년 2분기부터 이뤄질 것으로 보고 있다. 2023년 하반기부터 설비가 투입되고 시생산 등 과정을 거쳐 이듬해 본격 가동에 돌입할 전망이다.



얼티엄셀즈 3공장 조감도    미국 오하이오주 로즈타운에 들어선 1공장은 이달부터 배터리 시제품 제작을 시작했다. 당초 예상보다는 일정이 밀리고 있으나 연내 정상 가동하겠다는 목표다.   미국 테네시주 스프링힐에 짓고 있는 2공장은 내년 4분기 생산 목표로 절차를 밟아가고 있다. 올해 상반기부터 주요 장비 구매가 이뤄지고 있는 가운데 최근 들어 해당 공장 근무 인력도 채용 중이다.   얼티엄셀즈는 미국 내 4공장 구축도 검토 중인 것으로 전해진다. 앞서 로이터 등은 인디애나주 뉴칼리슬을 후보지로 꼽았다.   미국에서 인플레이션 감축법(IRA)이 발효되면서 얼티엄셀즈는 생산라인 마련을 가속화하는 분위기다. IRA에 따르면 북미에서 생산된 배터리를 탑재된 전기차가 보조금 지원 대상이다.   한편 LG에너지솔루션은 미국 애리조나주에 신설한 원통형 배터리 공장을 예정대로 추진하는 것을 논의 중이다. 지난 6월 LG에너지솔루션은 “경제 환경 악화에 따른 투자비 급등으로 시점과 규모, 내역 등을 면밀하게 재검토하고 있다”고 언급한 바 있다.",105,https://n.news.naver.com/mnews/article/138/0002132746?sid=103
"화성 탐사 로봇, 유기물 성분 포함 암석 채취… 생명체 흔적 찾을까",2022.09.16. 오전 11:42,나사의 화성 탐사 로봇 퍼서비어런스./나사										미국의 화성 탐사 로버 ‘퍼서비어런스’가 생명체의 흔적일 가능성이 큰 유기물을 수집했다.미국 항공우주국(NASA·나사)는 15일 퍼서비어런스가 약 35억년 전 호수로 강물이 흘러든 곳에 형성된 고대 삼각주를 탐사하는 과정에서 퇴적암을 찾아냈다고 밝혔다. 버클리 캘리포니아대학의 데이비드 슈스터 교수는 “화성 탐사 임무를 하며 수집할 가장 중요한 시료”라고 말했다.이 암석은 수십억 년 전 진흙과 작은 모래가 섞이고 짠물이 증발하면서 형성된 것으로 추정된다. 퍼서비어런스는 시료를 채취해 로봇 팔의 장비를 통해 암석에 유기물이 포함됨을 확인했다.유기물은 탄소를 중심으로 수소와 산소 등 다양한 원자가 결합해 형성된다. 주로 생명체에서 만들어져 생명체의 흔적으로 과학자들은 추정한다. 다만 생명체와 관련되지 않은 화학 과정을 통해서도 만들어질 수는 있어 과학계는 이번 발견이 생명체의 흔적이라고 단정 지을 수는 없다고 보고 있다. 암석을 지구로 회수해 정밀 분석해야 생명체의 흔적인지를 판단할 수 있는 것이다.지난해 2월 화성의 고대 호수로 추정되는 예제로 크레이터에 착륙한 퍼서비어런스는 충돌구 바닥으로 추정되는 지역에 대한 1차 과학탐사를 마친 뒤 고대 삼각주로 추정되는 곳으로 이동해 지난 7월 7일부터 2차 과학탐사를 진행 중이다. 화성에서 채취한 샘플을 지구로 가져오기 위한 임무는 2028년 시작돼 2033년이면 지구에 도착할 예정이다.,105,https://n.news.naver.com/mnews/article/023/0003716302?sid=103
"현대차,  울산 전기차 공장도 속도낸다… 2025년 완공 목표",2022.09.16. 오전 11:31,"안현호 현대차 지부장(왼쪽), 김두겸 울산시장(가운데), 이동석 현대차 대표(오른쪽)가 15일 현대자동차 울산공장 홍보관에서 열린 '현대자동차 전기차 전용 울산공장 신설 업무협약'에 서명한 뒤 기념촬영 <사진>현대차그룹현대자동차가 내년부터 2조원을 들여 울산공장 내 주행시험장 28만㎡(8만5000평) 부지에 전기차 전용 신공장을 착공하고, 오는 2025년 준공할 예정이다.  관련하여 울산시와 현대자동차 노사가 15일 현대차 울산공장 홍보관에서 ‘전기차 전용 신공장’ 건립을 위한 양해각서(MOU)를 체결했다. 현대차그룹의 입장에선 최근 미국의 '인플레이션 감축법'(IRA)에 따라, 미국 현지 중심의 전기차 생산시설 조기 완공에 총력을 기울여여할 상황이지만 노조와의 약속대로 국내 전기차 생산 시설도 기존 방침대로 동시에 추진하겠다는 의지로 읽혀진다.  전기차 공장의 해외 추진으로 도시 공동화를 우려했던 울산시는 이번 울산공장 내 전기차 전용공장 건립과 관련, 신속하게 공사가 진행할 수 있도록 직원 파견과 각종 인허가 컨설팅, 기업 투자 확대를 위한 규제 완화, 각종 보조금 등 행정·재정 지원에 적극적으로 나서기로 했다.또 현대차 노사도 전기차 전용 공장 신설에 상호 협력하기로 했다. 한편 울산시는 전기차 전용 신공장 일대를 첨단투자지구로 지정해 줄 것을 산업통상자원부에 요청했다.",105,https://n.news.naver.com/mnews/article/138/0002132724?sid=103
