title,date,main,section,url
"녹내장 환자, 술 끊으면 실명 위험 37% 줄어",2023.10.23. 오전 10:05,"[건강이 최고] 서울대병원 연구팀, 음주 녹내장 환자 1만3,643명 분석 결과



녹내장이 생기면 시야가 점점 좁아지면서 결국에 시력을 잃게 된다. 녹내장으로 진행되면서 시야가 좁아지는 장면. 한국일보 자료사진녹내장(綠內障·glaucoma) 환자가 술을 마시지 않으면 실명할 위험이 크게 낮아진다는 연구 결과가 나왔다. 녹내장은 ‘나이 관련 황반변성’ ‘당뇨병성 망막병증’과 함께 성인 실명의 3대 원인으로 꼽힌다.김영국 서울대병원 안과 교수(정윤 임상강사)·윤형진 서울대 의대 의공학과 교수(김수환 연구원)·하아늘 제주대병원 교수 공동 연구팀이 국민건강보험공단 데이터를 기반으로 2010~2011년 녹내장을 처음 진단받은 음주자 1만3,643명의 음주 습관 변화 여부에 따른 실명 위험도를 2020년까지 추적 분석한 결과다.녹내장은 서서히 진행하는 퇴행성 시신경병증으로 주요 실명 원인 중 하나다. 현재 완치할 수 있는 방법은 없으며, 안압강하제를 눈에 넣어 질병이 나빠지는 속도를 늦추는 수준이다. 따라서 안압강하제 투여 외의 치료법에 대한 고민은 지속적으로 이어져왔다.하지만 환자들이 생활 속에서 바로 실천에 옮길 수 있는 금주나 금연, 운동 중단 또는 증량이 녹내장 경과에 미치는 영향에 대해서는 거의 연구된 바가 없었다.연구팀은 이에 1인 연평균 알코올 섭취량이 8.3L(출처: 한국보건사회연구원)에 달하는 상당한 알코올 소비 국가인 우리나라에서 음주 습관의 변화가 녹내장 관리에 어떤 영향을 미치는지에 주목했다.연구팀은 2010년 1월부터 2011년 12월까지 녹내장을 처음 진단받은 음주자 1만3,643명을 대상으로 녹내장 진단 후 알코올 섭취 여부에 따라 지속적인 음주자 및 금주자 그룹으로 분류했다.이어 음주량에 따라 △소량 음주자와 △과량 음주자, 주당 음주 빈도에 따라 △저빈도 음주자 △고빈도 음주자로 추가 분류했다. 이후 음주 습관의 변화와 녹내장 환자의 실명 위험도의 연관성을 분석했다.연구 결과, 녹내장을 처음 진단받은 1만3,643명의 음주자 중 2,866명은 녹내장 진단 후 술을 끊은 것으로 나타났다. 이처럼 금주를 결심한 환자는 녹내장 진단 후 음주를 지속한 환자보다 실명 발생 위험도가 37%(조정된 위험비 0.63) 낮았다.또한 녹내장 진단 후에는 과량 음주뿐만 아니라 소량의 음주도 실명 위험을 유의하게 높이는 것으로 나타났다.녹내장 진단 후 술을 끊은 환자와 비교했을 때 과량 음주자(주 105g 이상 음주)는 실명 위험이 1.78배 증가했으며, 소량 음주자도 1.52배 증가했다.특히 실명 위험은 알코올 섭취량뿐만 아니라 섭취 빈도와 관련이 있었다. 금주자와 비교했을 때, 고빈도 음주자(주 4일 이상 음주)의 경우 실명 발생 위험이 2.5배 높았다.김영국 교수는 “녹내장을 새롭게 진단받은 환자들에게 술을 줄이거나 끊도록 하는 생활 습관 개선 권고는 녹내장 관리에서 중요한 부분”이라며 “포괄적인 의료 접근이 중요한 시기에 이번 연구 결과는 생활습관 교정이 만성질환을 극복하는 데 효과가 있음을 증명해 의미가 있다”고 했다.하아늘 교수는 “이번 연구 결과로 녹내장을 처음 진단받는 환자에게 음주 습관이 있는 경우 금주를 권고할 수 있는 근거가 마련됐다”고 했다.이번 연구 결과는 미국의사협회가 발행하는 국제 학술지 ‘JAMA Network Open (IF=13.8)’ 최근 호에 실렸다.



녹내장 진단 후 음주 습관 변화에 따른 실명 위험도 변화. 서울대병원 제공",105,https://n.news.naver.com/mnews/article/469/0000766348?sid=103
[현장+]코오롱FnC '래코드'가 모은 25개 업사이클링의 현재,2022.10.23. 오후 8:00,"지난 22일부터 개최한 코오롱FnC의 업사이클링 브랜드 '래코드' 10주년 전시 '레;콜렉티브: 25개의 방'. 프렌즈존 건물 외형.(사진=안신혜 기자)코오롱인더스트리FnC부문(이하 코오롱FnC)의 업사이클링 기반 패션 브랜드 '래코드(RE;CODE)'가 론칭 10주년을 맞아 '지속가능성'을 위해 활동하는 아티스트, 브랜드, 디자이너들을 한 데 모았다. 래코드가 다음달 10일까지 서울 신사하우스에서 진행하는 '레;콜렉티브: 25개의 방(Re’;collective: 25 guest rooms)' 전시는 론칭 10년을 맞아 지속가능 패션에 대한 연대 강화에 나서기 위한 취지에서 마련됐다. ""지구에 '풀'이 났어요"" 10년 간의 발자취업사이클링(Upcycling)이란 옷이나 의류 소재에 디자인과 활용성을 더하여 재활용하는 것을 의미한다. 특히 이 과정에서 가치를 높이면서 시즌마다 대량 발생하는 의류·섬유폐기물로 인한 환경 오염에 대해 알리고 있다.



지난 22일부터 개최한 코오롱FnC의 업사이클링 브랜드 '래코드' 10주년 전시 '레;콜렉티브: 25개의 방'. 래코드존에 전시된 7번방 '라코스테'(위), 폐기되는 자동차 에어백 시리즈 5번방(아래). (사진=안신혜 기자)코오롱FnC는 친환경 패션을 위해 실천하고 있는 기업이다. 올해 10주년을 맞은 래코드가 대표적으로, 지난 7월에는 소셜 벤처기업 케이오에이(KOA)를 인수하고 올 하반기 더 적극적인 ESG(환경·사회·지배구조) 경영을 위해 나섰다. 이번 전시는 코오롱FnC의 지난 역사 뿐만 아니라 업사이클링 브랜드 래코드와 케이오에이 등 친환경 패션 기업 시너지를 낼 앞으로의 행보를 엿볼 수 있는 자리이기도 하다. 코오롱FnC는 래코드가 지난 10년 간 재고 업사이클링 솔루션에 집중했다면 앞으로의 10년은 '프렌즈'와 함께 '패션이 더 이상 기호의 문제가 아니다'라는 메시지를 전한다는 계획이다.



지난 22일부터 개최한 코오롱FnC의 업사이클링 브랜드 '래코드' 10주년 전시 '레;콜렉티브: 25개의 방'. '하이브 인사이트'와 협업해 방탄소년단이 입었던 의상을 활용해 만든 굿즈 작품. 의상을 조각으로 잘라 가방 등 굿즈 장식품으로 활용했다. (사진=안신혜 기자)한경애 코오롱FnC 전무(CSO)는 <블로터>에 ""래코드는 10년 전부터 업사이클링에 가치를 둔 브랜드로서, 국내 뿐만 아니라 해외에서도 주목하고 있다""고 전했다. 그는 또 전시 인사말을 통해 ""끝내 판매되지 못하고 소각될 재고를 해체하고 재조합해 새로운 옷으로 되살렸다""며 ""헛된 도전은 아니었다. 래코드의 진심이 주목받고 있다. 하지만 그 길을 혼자 걸어오지는 않았다. 올해도 10주년을 맞은 해코드는 또 한 번 '가치 있는 같이'로 미래를 꿈꾼다""며 연대의 의미를 강조했다. 지난 21일 오전 찾은 전시장 '신사하우스'는 다세대 원룸 빌라였던 곳을 전시장으로 개조한 공간이다. 전시장 외벽에는 푸른색의 불처럼 보이는 형상으로 꾸며졌다. 불 대신 풀이나는 집과 지구의 모습을 형상화한 것으로, 그림은 그레타 툰베리가 2019년 스위스 다보스 세계경제포럼에서 ""우리들의 집에 불이 났어요. 우리의 미래를 빼앗지 말라""며 기후 위기에 관한 메시지를 전한 연설에서 착안된 것이다. 업사이클링 패션의 '과거-현재-미래'전시는 총 25개의 방으로 꾸려졌다. 이 중 14개의 방은 '라코스테' 또는 방탄소년단의 무대 의상을 활용한 '하이브 인사이트' 등 래코드와 협업해 온 브랜드를 모은 '래코드 존'이며, 11개의 방은 '카르텔', '데이비드 드 로스차일드' 등 지속가능성에 가치를 두고 있는 디자이너 및 브랜드의 작품을 전시한 '프렌즈 존'이다. 



지난 22일부터 개최한 코오롱FnC의 업사이클링 브랜드 '래코드' 10주년 전시 '레;콜렉티브: 25개의 방'. 래코드존 가장 윗층에 전시된 '데이비드 드 로스차일드 X 현대자동차'의 그리너리방(위쪽)과 래코드존 15번째 방 '아워레이보'(아래). (사진=안신혜 기자)래코드존 14개 방에는 지난 10년 간 래코드의 발자취가 담겨있었다. 래코드존은 △2016년 아름지기 재단과 함께 한복을 현대적으로 해석해 업사이클링한 작품(3번방) △2018년 발달장애 아티스트 지원단체 '로사이드' 김현우 작가와의 협업 프로젝트(4번방) △래코드 '2023 뉴 콜렉션'(6번방) △브랜드 '라코스테'의 재고를 활용한 해체 디자인 작품(7번방) △'하이브 인사이트'와의 협업으로 방탄소년단이 활동 시 직접 착용했던 의상을 활용해 제작한 굿즈 작품(10번방) △래코드의 커스터마이징 서비스 '리컬렉션'(12번방) 등이 전시돼 있다. 



지난 22일부터 개최한 코오롱FnC의 업사이클링 브랜드 '래코드' 10주년 전시 '레;콜렉티브: 25개의 방'. 연진영 작가가 판매 3년이 지난 쿠스 다운 재킷을 활용해 만든 '바닷가재' 작품(위)과 디자이너 문승지가 산업 폐기물을 최소화해 제작한 가구 작품(아래). (사진=안신혜 기자)래코드의 친환경 자연분해 봉투를 책 커버로 재활용해 사용하고 있는 기자는 이번 전시회에서 체험적 요소도 관심있게 지켜봤다. 전시에는 업사이클링의 가치를 전달하는 전시인 만큼 관람객들이 직접 참여할 수 있는 11번 '리테이블'방도 마련됐다. 네이버 예약자들에 한해 네임택 등을 만들어보는 활동이 진행된다. 또 래코드의 수선 및 리폼 서비스 '박스 아뜰리에(13번방)'는 서울 스타필드 코엑스에서 운영 중이기도 하다. 전시를 둘러본 관람객들이 일상에서 업사이클링 요소를 찾는 데 도움을 받을 수 있을 것 같았다. 



기자는 래코드의 친환경 자연분해 가방을 잘라 북 커버로 활용하고 있다. (사진=안신혜 기자)래코드존에서 나와 옆 건물에 마련된 프렌즈존에는 각자의 위치에서 업사이클링을 실천하고 있는 디자이너, 브랜드의 작품 11개가 전시됐다. △20세기 이탈리아에서 플라스틱 디자인 가구 창시자이자 장기 사용 가능한 내구성있는 플라스틱 소재 개발·사용하고 있는 '카르텔'(18번방) △다양한 내장 기관들의 기능과 형태에서 모티브를 얻은 패브릭 자투리 조각천을 모아 가방을 만드는 '우한나'(17번방) △디자이너 연진영이 구스·라쿤·캐시미어 등 동물 이슈와 노동 착취, 지구 온난화에 따른 이상 기후 현상 등 다수 이슈가 연결된 구스 다운 재킷을 활용해 방을 가득채운 거대한 바닷가재 작품(18번방) △세계 금융 재벌 로스차일드 가문 일원이자 생태학자, 환경운동가인 데이비드 드 로스차일드가 현대자동차와 협업한 작품도 제일 윗층에 마련됐다. 프렌즈 존에서도 관객 참여형 전시는 이어졌다. 프렌즈존의 첫 번째 방인 '아워레이보'방에서는 '우리의 죄'라는 주제로 우리가 지구와 환경에 지은 죄를 '회개'할 수 있는 기회를 주는 공간이 마련됐다. 교회식 의자에 앉아 아워레이보에 속한 다양한 창작자들의 죄를 둘러보고, 자신의 죄를 써볼 수 있다. 또 17번째 방(우한나)에서는 2019년부터 시작된 'Bag with you' 두 번째 시리즈인 자투리 패브릭 가방을 매고 사진을 찍어볼 수 있다. 



지난 22일부터 개최한 코오롱FnC의 업사이클링 브랜드 '래코드' 10주년 전시 '레;콜렉티브: 25개의 방'. 2016년 아름지기 재단과 함께 한복을 현대적으로 해석해 업사이클링한 작품(왼쪽, 오른쪽 위)과 예약 관람객이 점퍼를 활용한 네임택을 만들 수 있는 리테이블방(오른쪽 아래). (사진=안신혜 기자)이날 전시를 찾은 송길영 바이브컴퍼니 부사장은 '어떤 관점으로 전시를 둘러봤나'라는 <블로터>의 질문에 ""코오롱FnC는 10년 넘에 이 분야에서 잘 해왔는데, 오늘 전시를 보고 '역시 또 잘했다'고 생각했다""고 전했다. 그는 또 ""특히 프렌즈 존 옥상에 전시된 '그리너리(정원·데이비드 드 로스차일드 X 현대자동차)'는 밖이 안으로 들어오고 안이 밖으로 나간 '비욘드(beyond)'를 잘 표현한 것""이라며 ""이 전시 공간이 바로 '미디어'라고 느꼈다. 새로운 미디어로서의 역할을 어떻게 수행할지, 감동과 표현을 응축한 작업이라고 봤다""고 덧붙였다.



프렌즈존 옥상에 마련된 '데이비드 드 로스차일드 X 현대자동차'가 자동차 부품과 자연을 결합해 만든 작품. (사진=안신혜 기자)",105,https://n.news.naver.com/mnews/article/293/0000041145?sid=103
"같은 애플 공급사인데 너무 다른 실적… 삼성D ‘훨훨’, LGD ‘먹구름’",2022.10.23. 오전 6:01,"LGD, 3분기 영업손실 5000억 예상삼성D, 올해 영업이익 6.5조 전망삼성D, 중소형 OLED 지배적 지위LGD 과반 매출인 LCD는 팔수록 손해 “LGD, 시장 대응 늦었다” 평가 지배적        글로벌 경기가 침체기에 접어들면서 국내 양대 디스플레이 업체인 LG디스플레이와 삼성디스플레이의 성적표가 엇갈렸다. 두 회사 모두 애플 제품에 쓰이는 패널 중 절반 이상을 납품하고 있으나 실적은 딴판이다. 두 회사가 주력으로 하는 제품군이 달라 격차가 더 벌어지고 있다는 분석이 나온다.23일 금융정보업체 에프앤가이드에 따르면 LG디스플레이의 3분기 영업손실은 5000억원을 넘어 2분기 연속 적자를 낼 전망이다. 업계에서는 적어도 내년 상반기까지 이 같은 부진이 이어질 것으로 보고 있다. 반대로 삼성디스플레이는 경제 위기 속에서도 호실적이 예측된다. 증권가는 삼성디스플레이가 올해 6조5000억원에 달하는 영업이익을 기록해 역대 최대 실적을 낼 것으로 내다봤다.희비를 가른 건 주력 제품의 차이다. 두 곳 모두 업계 ‘큰손’ 애플 납품 비중이 높다. LG디스플레이는 액정표시장치(LCD) 패널을 애플 PC 모니터(아이맥)와 노트북(맥북), 태블릿PC(아이패드)에 공급 중이다. 현재 애플은 모든 노트북에 LCD 패널을 쓰는데, 시장조사업체 옴디아에 따르면 이 중 LG디스플레이 점유율은 55%에 달한다. 아이패드도 LG디스플레이가 공급하는 LCD 비중이 약 38%에 이르는 것으로 추정된다. 삼성디스플레이는 아이폰용 유기발광다이오드(OLED) 물량이 압도적이다. 최근 출시된 아이폰14 시리즈에 삼성디스플레이 OLED 패널이 장착된 물량은 82%에 달하며, 고급형인 프로 모델은 대부분 삼성디스플레이 패널이다. 즉 같은 애플이라도 LG디스플레이는 LCD에, 삼성디스플레이는 OLED에 집중하는 셈이다.현재 LG디스플레이 전체 매출의 65%가 LCD에서 나오는데, 수익성에 큰 영향을 미치는 LCD 가격이 코로나19 특수가 종료된 시점에서 중국발(發) 저가공세와 공급과잉이 맞물려 크게 떨어졌다. 시장조사업체 디스플레이서플라이체인컨설턴트(DSCC)는 “LCD TV 패널 가격이 지난 8월 최저점을 찍었다”며 “대부분 LCD 패널 가격은 원가보다 낮아졌고, 4분기에도 L자형 침체가 이어질 것이다”라고 분석했다. 시장에 풀린 LCD는 많은데, 소비는 둔화하다 보니 현재 LCD 패널은 팔면 팔수록 손해를 입는다. LG디스플레이는 애플 공급망에서는 시장 지배적인 지위를 갖고 있지만, 워낙 판매가격이 낮은 탓에 수익성을 올리기에는 한계가 있는 상황이다. 반면 지난 6월 LCD 사업에서 완전히 철수한 삼성디스플레이는 LCD 시장 변화에서 100% 자유로운 상태다.삼성디스플레이는 중소형 OLED에 집중하고 있다. 2000년부터 모바일용 OLED를 준비한 삼성디스플레이는 세계에서 프리미엄 스마트폰을 가장 많이 판매하는 삼성전자와 애플을 모두 고객사로 두고 있다. 특히 애플의 경우 현재 모든 스마트폰(아이폰)의 디스플레이를 OLED로 전환한 상태다. LG디스플레이도 애플에 애플워치와 아이폰용 OLED를 공급 중이나, 삼성디스플레이의 입지가 워낙 크다.LG디스플레이는 TV용 대형 OLED 패널에서 강세를 보인다. 특히 전 세계 TV용 OLED 패널의 90% 이상을 도맡고 있다. 다만 TV용 대형 OLED는 모바일용 중소형 OLED에 비해 시장 채용률이 낮다. 전 세계 스마트폰 패널 중 OLED 비율은 50% 안팎인 반면 전체 TV 출하량에서 OLED TV가 차지하는 비중은 4%대에 불과하다. LG디스플레이에서 패널을 공급받는 TV 제조사는 LG전자와 소니를 비롯해 약 20개에 달하지만, 전체 시장 규모가 크지 않다 보니 투자 대비 수익이 충분하지 않다.



LG디스플레이 파주 공장 LCD 생산라인에서 직원들이 유리기판을 검사하고 있다. /LG디스플레이 제공         업계는 TV용 OLED 시장이 크려면 더 많은 제조사를 비롯해 1위 사업자인 삼성전자가 뛰어들어야 한다고 본다. 그러나 삼성전자는 현재 OLED TV에 큰 매력을 느끼지 못하는 상태다. 패널 가격이 LCD에 비해 지나치게 비싼 탓이다. 삼성디스플레이가 TV용 대형 퀀텀닷(QD)-OLED 패널을 생산해 삼성전자와 일본 소니에 공급 중이지만, 수량이 제한적이어서 삼성전자의 연간 목표를 맞춰주지 못한다. 삼성전자는 OLED 패널 수급을 위해 LG디스플레이와도 협상을 벌였으나 공급 가격에서 이견이 커 협상은 중단된 상태다. LG디스플레이로서는 수익성을 단번에 높일 기회를 놓친 셈이다. 설상가상으로 여기에 TV 수요까지 둔화했다. 시장조사업체 트렌드포스는 올해 OLED TV 판매량이 2013년 최초 출시 이후 처음으로 뒷걸음질 칠 것으로 예상했다.업계 관계자는 “전체 디스플레이 시장이 점차 LCD에서 OLED로 무게중심을 바꿔 가는 과정에서 상대적으로 크기가 작은 OLED는 전환이 빠른 편이다”라며 “소형 OLED를 10여년 전부터 공략한 삼성은 실적이 좋은 반면, 이 흐름을 타지 못한 LG디스플레이는 여전히 LCD 업황에 영향을 크게 받을 수밖에 없는 구조다”라고 했다. 그는 “LG디스플레이가 늦게나마 중소형 OLED 개발에 박차를 가하고 있지만 기술력과 노하우 등에서 삼성디스플레이를 따라가기는 사실상 역부족인 상황이다”라고 했다.LG디스플레이는 TV용 LCD 패널 사업을 내년까지 축소하고 모니터, 노트북 등 정보기술(IT)용 LCD와 OLED 제품 개발에 집중할 계획이다. 다만 업계는 분기 연속 적자를 내는 상황에서 대규모 투자를 단행할 수 있을지 의문을 보이고 있다. 남대종 이베스트투자증권 연구원은 “LCD 패널 가격 하락에 이어 TV용 OLED 디스플레이 판매가 기대치를 밑돌고 있는데, 이 기조가 급격하게 변화하기는 어려울 것으로 보인다”며 “LG디스플레이의 재무 상태에 유의할 필요가 있다”고 했다.",105,https://n.news.naver.com/mnews/article/366/0000849317?sid=103
`이차원 박막 반도체` 빛으로 땜질하듯 가공,2022.10.23. 오후 1:45,"한국화학연구원은 얇은 원자층으로 이뤄진 이차원 박막 반도체를 빛으로 땜질해 가공하는 반도체 가공기술을 개발했다.         화학연 제공    차세대 반도체 소자로 각광받는 '이차원 박막 반도체'를 빛으로 땜질하듯 가공할 수 있는 기술이 개발됐다. 이 기술을 이용하면 고용량 반도체 메모리, 투명 유연 디스플레이, 웨어러블 바이오 센서 등을 더 쉽게 제조할 수 있을 전망이다.한국화학연구원은 김현우 박사 연구팀이 신채호 한국표준과학연구원 박사, 김태완 전북대 교수 연구팀과 함께 이차원 박막 반도체 위에 레이저 빛을 쏴 납땜질하듯 패터닝하는 반도체 가공기술을 개발했다고 23일 밝혔다.이차원 박막 반도체는 그래핀처럼 두께가 얇고 투명하면서 유연한 특성을 지니면서 반도체 성질을 띠고 있어  2010년 첫 발견 이후 차세대 디스플레이, 광센서 소자, 반도체 소자 등으로 주목받고 있다. 이를 반도체 소자 등으로 활용하려면 표면에 패턴이나 회로를 만드는 실시간 패터닝 가공 기술이 필요하다. 하지만, 두께가 원자층 정도로 매우 얇아 쉽게 손상이 생긴다는 문제가 있다. 아울러, 기존 반도체 가공기술인 열가공, 이온 주입, 플라즈마 등은 박막 표면이 손상될 위험이 있고, 원하는 위치에 패터닝하기 위해선 추가 비용과 공정이 필요해 생산성이 떨어지는 단점도 있다.연구팀은 이차원 박막 반도체 밑에 인듐나노입자를 깔고 특정 세기의 빛을 쏘면 인듐나노입자가 녹아 그 위의 반도체 물질을 끌어 당겨 함께 붙으면서 패턴이 형성되는 기술을 개발했다. 이 기술을 이용하면 박막 반도체 손상 없이 수초 내에 실시간으로 원하는 곳에 패터닝할 수 있다. 특히 빛의 위치나 세기, 조사 시간 등에 의해 표면 구조가 달라져 원하는 성질로 다양하게 가공할 수 있어 차세대 광전소자나 바이오 센서 등에 활용할 수 있다고 연구팀은 설명했다.김현우 화학연 박사는 ""광땜질 기술은 입사광을 조절해 패터닝과 물질 특성을 정밀하게 가공하고, 수초 이내에 실시간 가공할 수 있어 응용 가능성이 매우 높다""며 ""앞으로 광땜질 기술을 이용해 유연 투명 디스플레이, 고감도 바이오 센싱 기술 등을 개발할 계획""이라고 말했다.이 연구결과는 광과학·재료분야 국제 학술지 '어드밴스드 옵티컬 머터리얼스(지난 9월)'에 실렸다.",105,https://n.news.naver.com/mnews/article/029/0002761073?sid=103
