title,date,main,section,url
"""인간이 셀프 유전자 편집…5년내 암 정복, 영생의 시대 온다""",2021.05.28. 오전 11:59,"'울산1만명 게놈 프로젝트' 완성""3년 내 10만명 게놈 해독 목표""해독한 정보 토대로 RNA 조절늙은 세포 젊어지게 유도 가능게놈은 바이오산업의 반도체5년 내 암, 2042년 노화 극복할 것  



 박종화 교수가 울산과학기술원(UNIST) 게놈연구소에 마련돼 있는 중국 생명공학 회사 MGI의 게놈해독기 T7 앞에 섰다. 가격이 대당 13억원에 달하는 이 해독기는 세계시장의 70%를 차지하는 미국 일루미나와 경쟁하는 대표적 게놈 장비다. [사진 UNIST]       최준호의 첨단의 끝을 찾아서- 게놈 연구 권위자 박종화 교수      “인간 유전체 지도는 인류가 생산해낸 가장 중요하고 경이로운 지도다. 오늘 우리는 신이 인간의 생명을 창조하면서 사용한 언어를 배우기 시작했다.”     2000년 6월 26일 빌 클린턴 당시 미국 대통령이 백악관에서 인간 유전체 지도 초안 완성을 선언하면서 한 말이다.        1990년 시작한 인간게놈 프로젝트는 인간 세포에 들어있는 DNA의 염기 서열 전체를 풀어내는 것을 목표로 했다. 프로젝트가 완성되면 질병에 관련된 유전자와 그 유전자가 생산하는 단백질을 밝혀내는 방법으로 암과 치매 등 각종 질병을 효과적으로 치료할 수 있는 길이 열릴 것이라고 전망됐다. 혁명적인 신약 출현에 대한 기대로 세계 주요 제약업체와 관련 벤처기업들의 주가가 치솟았다.      



DNA 이중 나선구조를 그린 이미지. [로이터=연합뉴스]       아직 유토피아는 오지 않았다      인간게놈 프로젝트가 공식 완료된 것은 2003년. 이후 강산이 두 번 변하는 세월이 흘렀지만 애초 기대만큼의 유토피아는 오지 않았다. 하지만, 인류는 게놈 해독에 대한 이해를 바탕으로 의료기기와 신약개발, 난치병 치료, 예방의학 등에 한발씩 한발씩 다가서고 있다. 지난해 초부터 전 세계를 휩쓸고 있는 신종 코로나바이러스 감염증(코로나19)에 대한 인류의 대응 또한 게놈 연구의 산물이다. 코로나19 유행 초기부터 맹활약한 진단키트, 개발 시작 10개월 만에 나온 백신 또한  바이러스의 게놈 분석과 편집을 통해서 할 수 있었다.      이제 영국·미국·중국 등  세계 주요국들이 ‘100만 게놈 프로젝트’를 향해 달리고 있다. 자국민 100만 명의 유전체 빅데이터를 분석해 예방 및 정밀의학의 바탕으로 삼겠다는 취지다. 한국도 예외가 아니다. 정부는 2019년 ‘최대 100만 명 규모의 국가 바이오 빅데이터 구축’계획을 발표한 바 있다. 게놈 연구의 현주소는 물론, 미래가 궁금했다. 지난달 26일 ‘울산 만명 게놈 프로젝트’를 완성한 국내 게놈 연구의 권위자인 박종화(54) 울산과학기술원(UNIST) 생명과학부 교수를 지난 21일 만났다.        



지난달 26일 오후 울산과학기술원(UNIST)에서 열린 '한국인 만명 게놈 해독 완료 선언식'에서 송철호 울산시장, 이용훈 UNIST 총장, 게놈 기증자 대표 등이 사업 완료를 기념하는 핸드프린팅을 하고 기념촬영을 하고 있다. [사진 UNIST]       한국인 변이체 표준데이터를 만들어라    Q : 이제 무슨 연구를 하나   A : 지난달 해독을 끝낸 한국인 인간게놈 1만 명 빅데이터를 바탕으로 한국인 고유의 변이체 표준데이터를 만드는 작업을 시작했다. 내년 이맘때쯤 기초 표준 데이터를 공개하는 것이 나의 목표다. 이 표준 데이터를 질병군과 비교·분석하면 한국인이 가지고 있는 질병의 진단뿐 아니라 치료와 예방까지 할 수 있다. 특정 개인의 게놈을 비교해보면 자신의 건강에 어떤 문제가 있는지, 어디가  취약한지, 건강을 지키려면 어떻게 해야 하는지를 알 수 있다. 구체적으로 향후 3년 안에 스트레스 우울증에 대한 치료와 예방을 1차 목표로 하고 있다. 게놈은 바이오산업의 반도체와 같은 거다.    (여기서 ‘해독’(解讀)은 게놈의 염기서열을 읽어들였다는 뜻으로, 의미를 알아내는‘분석’과 차이가 있다.)    왜 1만 명인가.  A : 1만 명은 한국 국민을 대표할 수 있는 최소 단위다. 앞으로 3년 안에 한국인 10만 명 게놈을 해독하는 것이 다음 목표다.  희망하기로는 향후 7년 안에 100만 명 게놈 시대가 열리면 좋겠다.  여기서부터는 국가 차원에서 해야 할 일이다. 더 나아가 10년 내 1000만 명, 15년 뒤엔 5000만 명, 즉 전 국민이 자신의 게놈을 해독하는 시대가 열릴  수 있다.  Q : 연구가 꽤 지연됐다던데, 어려움이 뭔가. A : 현재 1명 게놈 해독에 100만원의 비용이 든다.  펀딩이 쉽지 않다. 게놈 해독을 위한 참여자를 찾는 일도 쉽지 않다. 피를 뽑아야 하고, 자신의 게놈 정보를 연구 데이터로 공개해야 하기 때문에 거부감을 가질 수 있다. 울산 1만명 게놈 프로젝트는 건강검진과 게놈 분석 리포트를 제공하는 등의 방법으로 참여자들을 모았다. 애초 2019년에 마친다는 게 목표였는데, 2년 정도 지연됐다.    



.      인간게놈 빅데이터 확보에 사활 건 경쟁    Q : 서구 선진국들의 연구개발 동향이 궁금하다. A : 세계 주요국들이 사활을 걸고 있는데, 영국과 미국이 선두에서 달려가고 있다. 영국은 2018년 희귀질환 중심의 10만 명 게놈 데이터 구축을 이미 마쳤고, 이제 500만 명을 목표로 확대 시행 중이다. 미국은 2016년부터 100만 명 게놈 코호트를 구축 중인데, 2019년 7월 기준 23만 명 정도 확보했다고 한다. 미국은 게놈 프로젝트를 통한 민간 바이오산업 육성에 더 큰 방점을 찍고 있는 반면, 영국은 공공의료 복지에 중점을 두고 있다. 미국 일루미나의 게놈 해독기는 세계 유전체 분석 장비 시장의 74%를 차지할 정도다. 중국도 게놈 확보뿐 아니라 관련 장비 개발을 위해 빠르게 움직이고 있다. 누가 더 많은 인간 게놈 빅데이터를 확보하느냐가 곧 그 나라, 기업 생명과학 산업의 열쇠다.   Q : 우리나라는 어떤가.  A : 다소 늦긴 했지만 우리도 세계의 움직임에 동참하고 있다. 2019년 5월 충북 오송에서 열린 ‘바이오헬스 비전 선포식’에서 문재인 대통령이 ‘최대 100만 명 규모의 국가 바이오 빅데이터 구축’계획을 발표한 바 있다. 이후 생명공학연구원 등이 시범사업을 거쳐 10년 기한의 바이오 데이터 프로젝트를 준비하고 있는 것으로 안다. 이와 별도로 마크로젠과 테라젠 등 국내 유전공학 관련 기업들도 개별적으로 게놈 확보 경쟁을 벌이고 있다. 하지만 우리나라는 아직도 지정한 특정 유전자만 검사를 허용하는 등 선진국들과 비교해 걷어 내야할 관련 규제가 너무 많다.   Q : 개인적으로 앞으로의 연구방향, 계획은 뭔가.   A : 게놈 분석을 통한 암 정복과 ‘극(克) 노화’가 연구의 주된 방향이다. 극노화, 즉 노화 극복이란 ‘늙는 것을 막아낸다’는 뜻의 ‘항(抗)노화’뿐 아니라 젊어진다는 뜻의 ‘역(逆)노화’를 합친 말이라 할 수 있다. 자신의 게놈 정보를 분석하고 진단해 몸에 맞게 생활습관을 바로 잡고, 운동을 하고 영양제를 보충하면 노화를 막을 수 있다. 역노화는 무슨 공상과학(SF) 같은 얘기냐고 하겠지만, 유전자 편집을 통해 늙은 세포가 젊어지도록 유도하고, 너무 늙은 세포는 없애줄 수 있다. 모더나의 mRNA 백신도 같은 원리로 만들어내는 거다. 내 계산으론 2042년쯤 되면 노화를 멈출 수 있을 것이다. 암 정복 역시 mRNA를 이용해 면역 항암 치료제를 만들어내면 가능하다. 앞으로 5년 안에 인류는 암을 극복할 수 있을 것이라고 장담한다.   



2019년 5월 문재인 대통령이 충북 청주시 오송 CV센터에서 열린 '바이오헬스 국가비전 선포식'에 참석해 인사말을 하고 있다. [중앙포토]      유전공학 발달로 죽지 않는 세상 오나     Q : 더 먼 미래, 2050년쯤 되면 어떤 세상이 될까. A : 유전공학의 발달로 사고만 안 나면 죽지 않는 세상을 선택할 수 있는 영생의 세상이 열릴 것이다. 이런 세상이 오면 헬스산업뿐 아니라 ‘자살산업’ 같은 것도 생겨날 수 있을 것이다. 인간세포의 재생 횟수는 평균 70회다. 줄기세포는 재생이 계속되는데 나이가 들면 이 줄기세포가 고갈이 된다. 돌아가신 분을 부검해보면 줄기세포가 거의 남아있지 않은 것을 확인할 수 있다. 유전공학을 통해 줄기세포가 계속 기능을 할 수 있도록, 우리 몸의 세포가 재생할 수 있도록 해주면 된다. 여기서 걸리는 게 암이다. 노화와 암은 동전의 양면이다. 세포가 재생하다가 돌연변이를 일으키면 그게 암이 된다. 극노화 연구의 가장 큰 장애물은 규제다. 각자 자기에 맞는 면역 치료제를 신속하게 개발할 수 있도록 해줘야 한다. 인류는 지금 게놈 1.0 시대를 지나 2.0시대로 들어가고 있다. 게놈을 해독해 DNA 돌연변이를 잡아내고, 진단과 치료를 하는 게 1.0이라면, DNA를 넘어서 RNA, epiDNA, 단백질까지 조절하는 게 2.0이다. 노화 극복의 열쇠가 여기에 있다.  Q : 믿기 힘든 얘기다. A : 클린턴이 ‘오늘 우리는 신이 인간의 생명을 창조하면서 사용한 언어를 배우기 시작했다’고 한 말이 인간게놈 해독의 의미를 극명하게 드러내 준 표현이다. 인간이 게놈을 해독한 것은 인류와 우주의 기원을 전과 후로 나눌 수 있는 엄청난 성과다. 20세기까지는 자연의 선택으로 우주 속 생명체가 살아왔다. 이게 우주 진화의 역사다. 이제 인간이 자신의 게놈을 해독하고, 편집해 원하는 대로 스스로 코딩할 수 있는 세상이 열린 것이다. 그 다음은 이런 특이점에 이른 과학기술을 어떻게 사용할 것인가, 즉 윤리·철학의 문제가 남는다. 나는 현대 과학기술의 발전 단계를  IT(정보기술)-NT(나노기술)-BT(바이오기술)-MT(의료기술)-PT(철학기술)로 정의한다.    울산=최준호 과학·미래 전문기자, 논설위원 joonho@joongang.co.kr       박종화 1967년생. 고교시절부터 DNA 연구에 푹 빠졌다. 서울대를 중퇴하고 영국으로 건너가 스코틀랜드 애버딘대학에서 생화학 학사를, 케임브리지대학에서 생정보학으로 박사학위를 받았다. 세계 게놈 연구의 본산, 생어연구소의 총 책임자 팀 허버드 교수가 그의 지도교수다. 이후 세계 게놈 관련 연구개발의 대부라 불리는 조지 처치 하버드 의대 교수 아래서 박사후연구원을 지냈다. 케임브리지대와 KAIST 교수를 거쳐 한국생명공학연구원 국가생명정보센터장과 유전공학 기업 테라젠의 사장을 지냈다. UNIST에는 2014년 생명과학부 교수로 부임했다.  ▶ 그가 들려주는 이야기, 이상언의 '더 모닝'▶ 건강한 주식 맛집, 앤츠랩이 차린 메뉴▶ '실검'이 사라졌다, 이슈는 어디서 봐?ⓒ중앙일보(https://joongang.co.kr), 무단 전재 및 재배포 금지",105,https://n.news.naver.com/mnews/article/025/0003105224?sid=103
"""카러플에서 치킨이닭""…, 넥슨, '배그 모바일'과 콜라보 이벤트",2021.05.28. 오전 10:18,"넥슨이 자사 모바일 레이싱게임 '카트라이더 러쉬플러스'에서 크래프톤 펍지 스튜디오의 ‘플레이어언노운스 배틀그라운드 모바일과 컬래버레이션 업데이트를 진행한다고 28일 밝혔다. /사진제공=넥슨넥슨이 자사 모바일 레이싱게임 '카트라이더 러쉬플러스'(이하 '카러플')에서 크래프톤 펍지 스튜디오의 ‘플레이어언노운스 배틀그라운드(이하 배틀그라운드) 모바일과 컬래버레이션 업데이트를 진행한다고 28일 밝혔다. 우선 업데이트를 통해 28일 레전드 아이템 카트 ‘3레벨 헬멧’과 ‘클래식 수트(남)’, ‘3레벨 배낭’, ‘프라이팬 핸드봉’, ‘3레벨 헬멧 장식’ 등을 출시했다. 각 아이템들은 상점에서 구매 또는 서프라이즈 포인트 및 랭킹 코인으로 교환 가능하다.내달 5일에는 레어 스피드 카트인 ‘프라이팬’을 추가하고 18일까지 출석 이벤트 참여자를 대상으로 기간제 또는 영구 아이템으로 지급한다. 이어 6월12일에는 마이룸 아이템으로 ‘에어 드랍 건축물’을 업데이트한다.넥슨은 이번 제휴 콘텐츠와 함께 즐길 수 있는 다양한 이벤트도 마련했다. 6월11일까지 멀티 대전에 참여하고 이벤트 조각을 모으면 ‘에어 드랍 플라잉 펫(영구)’, ‘고급 카트 페인트 10개’, ‘펫밀크 500개’ 등 보상을 획득할 수 있는 기회를 제공한다.6월5일까지 일일 퀘스트로 ‘카러플’과 ‘모바일 배그’ 중 원하는 팀에 ‘응원’을 보내고 특정 미션을 달성하면 누적 응원 횟수와 팀 목표 달성에 따라 ‘총알구멍 스티커 3개 + 500K코인’, ‘에어 드랍 밴드(영구)’ 등을 지급한다. 6월4일까지는 접속 데일리 보상으로 ‘에어 드랍 풍선 10개’를 제공한다.‘카러플’ 게임에 대한 자세한 내용은 게임 공식 사이트 및 커뮤니티에서 확인할 수 있다.강소현 기자 kang4201@mt.co.kr▶뜨거운 증시, 오늘의 특징주는?  ▶여론확인 '머니S설문' ▶머니S, 네이버 메인에서 보세요 <저작권자 ⓒ '성공을 꿈꾸는 사람들의 경제 뉴스' 머니S, 무단전재 및 재배포 금지>",105,https://n.news.naver.com/mnews/article/417/0000698473?sid=103
"'오줌 칭따오'는 국내에 수입 안 되는 생산처…""등록 안 됐다""",2023.10.21. 오후 10:38,"식약처 ""해당 제조업소 생산 제품, 국내 수입 안 돼""



최근 중국 칭다오 맥주공장에서 한 남성이 원료 보관장소에 들어가 소변을 누는 영상이 퍼져 논란이 됐다.해당 영상은 지난 19일 소셜 네트워크 서비스 '웨이보'에 공개됐다. 영상을 보면 칭다오 3공장에서 한 남성이 맥아 보관장소에 들어가 소변을 눈다.이를 본 사람들이 '내가 마신 칭따오도 혹시 오염된 원료로 만든 게 아니냐'는 의문을 표시했다.식품의약품안전처는 이에 주칭다오 대한민국 총영사관에 파견된 식약관을 통해 확인한 결과 ""해당 제조업소는 칭다오맥주주식유한공사 제3공장(핑두시 소재)으로 확인되었다""며 ""해당 제조업소에서 제조·생산된 맥주는 국내에 수입되지 않았다""고 밝혔다.식약처 관계자는 ""해당 공장은 산둥성 핑두시에 위치한 곳""이라며 ""식약처는 국내 수입신고 전 해외제조업소를 등록하도록 의무화하고 있고, 이를 검토하는데 핑두시 공장은 해외제조업소로 등록되지 않아 국내에 들어올 수 없다""고 말했다.한편, 국내로 수입되는 칭다오 맥주는 칭다오맥주주식유한공사(스베이구 소재), 칭다오맥주주식유한공사 제2공장(리창구 소재), 칭다오맥주주식유한공사 제5공장(라오산구 소재) 등 3곳에서 생산되고 있다.",105,https://n.news.naver.com/mnews/article/215/0001130315?sid=103
"승차권 구매도 생체인증으로…라온시큐어, '원패스' SRT 앱 적용",2021.05.27. 오후 12:12,"파이도 기반 인증 플랫폼 '원패스'…OTP 등 2차 인증도 제공[아이뉴스24 최은정 기자] 라온시큐어(대표 이순형)는 파이도(FIDO) 기반 다채널 인증 플랫폼 '원패스'가 620만 회원을 보유한 SRT 고속철도 애플리케이션에 적용됐다고 27일 발표했다.



 [사진=라온시큐어]회사 측에 따르면 SRT 운영사 SR은 원패스를 기반으로 생체정보 인증 로그인 서비스를 새롭게 구축했다. SRT 앱 이용자들이 지문·페이스 아이디 등 개인 단말기에 저장된 생체 정보를 앱에 등록하면, 생체인증을 통해 빠르고 간편하게 승차권 예매·확인 등의 서비스를 이용할 수 있다. 아이디와 패스워드를 입력할 필요가 없어진다.원패스는 FIDO 방식으로 이용자의 생체인증 정보를 개인의 스마트폰에 저장, 서버 해킹을 통한 정보 유출을 방지할 수 있다는 게 회사 측 설명이다. 또 모바일 일회용 비밀번호(OTP), PC OTP, 보안 개인식별 번호(PIN) 등 2차 인증 수단을 통해 높은 보안 수준을 유지할 수 있다.이순형 라온시큐어 대표는 ""신종 코로나바이러스 감염증(코로나19)으로 사회 전반에서 비대면 서비스가 확대되면서 다양한 산업 분야에서 FIDO 생체인증에 대한 수요가 높아지고 있다""며 ""원패스를 중심으로 인증 생태계를 지속 발전시켜 나갈 것""이라고 말했다./최은정 기자(ejc@inews24.com)▶네이버 채널에서 '아이뉴스24'를 구독해주세요.▶재밌는 아이뉴스TV 영상보기 ▶아이뉴스24 바로가기[ⓒ 아이뉴스24 무단전재 및 재배포 금지]",105,https://n.news.naver.com/mnews/article/031/0000600897?sid=103
