title,date,main,section,url
주한미군에 우주군사령부 만든다…'北ICBM 위협'에 서둘러,2022.11.26. 오전 11:08,"연내 편제 갖출듯…美본토 밖 인도태평양사령부 이은 두번째미 우주군-인태우주군-주한미우주군, C4I 연결해 실시간 정보교환



작년 6월 미 우주군 케이프커내버럴 기지에서 팰컨9 로켓을 발사하는 모습[미 우주군 제공]    (서울=연합뉴스) 하채림 기자 = 주한미군에 우주군 부대가 창설된다.     핵탄두 탑재가 가능한 북한의 대륙간탄도미사일(ICBM)이 미국 본토까지 타격할 수준에 이른 것으로 평가됨에 따라 주한미군도 외기권으로 날아가는 비행체를 탐지 감시할 수 있도록 하겠다는 방침으로 풀이된다.    26일 복수의 정부 고위 소식통에 따르면 미국 국방부는 주한미군(USFK)에 우주군 구성군사령부(component command)를 설치할 계획이다. 주한미우주군(USSF)은 연말까지 편제를 갖출 것으로 알려졌다.    소식통은 ""최근 미국이 인도태평양사령부 예하로 우주군구성군사령부를 창설한 것처럼 주한미군에도 우주군 구성군사령부가 들어서게 된다""면서 ""주한미해군, 주한미공군이 있듯이 주한미우주군이 생기는 것""이라고 설명했다.    군 관계자는 ""주한미우주군은 일단 주한미군에만 소속되는 구조로 출범하는 것으로 안다""고 말했다.    미국은 주한미군 외에 중동지역을 담당하는 중부사령부에도 연말까지 우주군 구성군사령부를 창설할 것으로 전해졌다.    주한미우주군은 미 본토 밖의 두 번째 우주군 조직이 될 전망이다.    미군은 최근 발표한 국가안보전략(NSS) 등 전략문서에서 전영역(All-Domain) 통합억제를 구현하기 위해 인태사뿐 아니라 전투사령부에 우주군을 설치하는 계획을 추진하고 있다.     소식통은 ""미국의 지역통합전투사령부 가운데 위협이 가장 크다고 평가되는 인태사에 먼저 우주군이 설치됐다""면서 ""조직·예산을 한꺼번에 확충할 수 없으므로 위협과 작전 우선순위에 따라 추진되는 것으로 안다""고 전했다.     주한미우주군은 신설 조직인만큼 일단 소규모로 출범할 것으로 보인다.    이달 창설된 인태우주군구성군사령부의 인원이 20여 명인 것을 고려하면 주한미우주군 규모는 그 이하가 될 것이라고 정부 소식통은 전망했다.      주한미군에 우주군 조직을 조기에 신설하는 것은 미국이 북한의 핵·미사일 위협을 심각하게 인식하고 있기 때문이다.     류성엽 21세기군사연구소 전문연구위원은 ""주한미군과 중부사 우주군은 각각 북한과 이란의 우주 위협을 염두에 둔 것""이라며 ""미우주군이 두 나라의 미사일을 심각하게 인식하고 우선순위를 둔 것으로 해석할 수 있다""고 말했다.     신종우 한국국방안보포럼 사무국장은 ""미국이 북한의 화성 계열 ICBM 기술 발전에 그만큼 우려하고 있다는 방증""이라고 해석했다.    일부 전문가들은 중국과 러시아의 위협도 고려한 것 아니냐는 지적도 제기한다.



북한이 18일에 발사한 화성-17형이라며 19일 공개한 사진(평양 조선중앙통신=연합뉴스) 북한이 지난 18일 김정은 국무위원장의 지도 아래 신형의 대륙간탄도미사일 화성-17형을 시험 발사했다.     조선중앙통신은 19일 ""초강력적이고 절대적인 핵억제력을 끊임없이 제고함에 관한 우리 당과 공화국 정부의 최우선 국방건설 전략이 엄격히 실행되고 있는 가운데 18일 조선민주주의인민공화국 전략 무력의 신형대륙간탄도미사일 시험발사가 진행되었다""고 밝혔다. 2022.11.19     [국내에서만 사용가능. 재배포 금지. For Use Only in the Republic of Korea. No Redistribution]  nkphoto@yna.co.kr    주한미우주군은 미국 우주군과 인태우주군구성군사령부와 C4I체계로 연결해 북한의 ICBM 등 핵·미사일 정보를 실시간으로 공유할 것으로 보인다.    군 관계자는 ""주한미우주군이 만들어진다고 해도 미국과 일본이 추진하는 미사일방어(MD)체계와는 무관하다""고 강조했다.    그러나 주한미군 우주군 조직이 앞으로 점점 커지고 외기권의 물체를 타격할 수 있는 레이저요격체계 등을 갖추게 되면 자연스럽게 MD체계와 연동될 수밖에 없을 것이란 관측도 나온다.    미 우주군은 미국이 우주공간에서 우위를 유지하기 위해 2019년 12월 창설한 군대로 위성 등 우주 자산 통제, 미사일방어를 위한 탐지, 폐위성과 운석 대응 등 우주 감시 임무를 주로 수행한다.     창설된 지 3년밖에 지나지 않아 미 본토 밖 우주군사령부는 이달 22일(하와이 현지시간) 신설된 인태사 우주군 구성군사령부가 유일하다.     tree@yna.co.kr",105,https://n.news.naver.com/mnews/article/001/0013603326?sid=103
"위메이드 ""다음주 닥사 공정위 제소..가처분 신청과 '투트랙' 대응""",2022.11.26. 오후 3:53,"[서울=뉴시스]위메이드 장현국 대표. (사진=위메이드 제공) *재판매 및 DB 금지 /사진=뉴시스  [파이낸셜뉴스] 위메이드가 위믹스 거래지원 종료(상장폐지)를 결정한 한국 디지털자산거래소 공동협의체(DAXA·닥사)를 다음주 공정거래위원회에 제소하기로 했다. 거래지원 종료가 결정된 4개 가상자산 거래소(업비트, 빗썸, 코인원, 코빗)에 대해서도 다음주 초 가처분 신청을 낼 계획이다. 12월 8일 거래지원 종료 전에 공정위 제소와 가처분 신청이란 투트랙을 활용해 강경 대응한다는 방침이다.   26일 업계에 따르면 위메이드는 위믹스 상장폐지를 결정한 닥사를 다음주 공정위에 제소할 방침이다.   위메이드 측은 ""시장의 거의 100%를 점유하는 사업자들이 담합해 어떤 가상자산을 상장할지 말지 결정하는 것은 불법이라고 알고 있다""며 ""(위믹스 상장폐지 결정 관련) 닥사 내에서도 의견이 일치하지 않았던 것으로 알려졌는데 이를 하나의 의견으로 모아서 행동하기로 한 것은 명백한 담합행위로 불법""이라고 말했다.   위메이드는 4개 가상자산 거래소에 대해서도 다음주 초 가처분 신청을 낼 방침이다.   위메이드 관계자는 ""공정위 제소와 가처분 신청이라는 투트랙으로 진행하려고 한다""며 ""12월 8일 전에는 결과가 나와야 해서 최대한 빨리 준비하는 중""이라고 밝혔다.   앞서 닥사는 지난 24일 위믹스의 상장폐지를 결정했다. 현재 위믹스가 상장된 거래소는 빗썸, 코인원, 업비트, 코빗 등 4곳이다. 이에 따라 이들 거래소에서 위믹스 거래는 오는 12월8일 오후 3시 종료된다. 출금지원 종료는 내년 1월5일 오후 3시다.   위메이드는 이같은 닥사 결정이 비합리적이고 불공정하다고 반발하고 있다.   장현국 위메이드 대표는 지난 25일 온라인 긴급 기자간담회에서 이번 사태가 업비트의 '슈퍼 갑질'이라고 강하게 비판하기도 했다. 위메이드가 유일하게 유통량을 제출한 업비트가 소명 과정에서 공정한 기준과 가이드라인, 피드백 등을 제대로 주지 않는 등 불공정한 절차로 이번 결정이 이뤄졌다는 이유에서다.   업계에서도 이번 결정의 공정성을 문제 삼는 목소리가 나오고 있다.   이건호 전 KB국민은행장은 26일 페이스북에 ""보다 심각한 것은 닥사의 결정이 매우 불합리할 뿐 아니라 자신들의 책임회피에 급급해 상당한 불법의 소지가 있다는 데 있다""고 비판했다.   그는 ""닥사 회원사들은 '거래소'라는 거창한 간판을 내세우지만 실제로는 영리 목적으로 가상자산의 매매를 중개하는 민간 사업자에 불과하다""라며 ""그들이 특정 가상자산의 거래를 지원한다는 것은 대형 백화점이 특정 브랜드를 입점시키는 것과 같은 정도의 의미다. 닥사나 그 회원사는 한국거래소(KRX)와 같이 공적기능을 수행하는 시장기구가 아니다""라고 주장했다.   그러면서 ""닥사 회원사들이 집단적으로 위믹스의 거래 지원을 중단하기로 결정한 것은 '명백한 담합'""이라며 ""특히 현재 국내 가상자산 거래에 관련된 규제로 인해 닥사 회원사를 제외하면 투자자들의 위믹스 원화거래를 지원할 수 있는 중개업자가 존재하지 않는다""고 꼬집었다.   아울러 ""혹시라도 닥사 회원사 및 임직원 중에 위믹스 코인을 보유한 자가 있었고 이번 결정이 이루어지는 과정에서 이를 매각한 사례가 있었다면 이는 내부자 거래에 해당한다""며 ""향후 이런 사태가 발생하지 않도록 정부 차원의 규제와 선제적 감시를 수행할 수 있는 기구가 설립돼야 한다”고 강조했다.   위믹스 팀은 이날 이건호 전 국민은행장의 글이 발췌된 기사를 공유하면서 ""위믹스 팀은 결코 굴하지 않고 플랫폼 기반의 서비스 지향의 위믹스 생태계의 중심인 위믹스가 정상적인 거래가 지원될 수 있도록 모든 조치와 노력을 진행하겠다""라고 밝혔다.",105,https://n.news.naver.com/mnews/article/014/0004933916?sid=103
"리콜, 리콜, 리콜... 테슬라, 이번엔 中서 전기차 8만여대 리콜",2022.11.26. 오전 8:33,"[디지털데일리 양원모 기자] 테슬라가 안전띠, 소프트웨어 결함으로 중국에서 총 8만여대의 차량을 리콜한다. 25일(현지 시각) 신랑망(新浪網), 재신망(財新網) 등 현지 매체에 따르면 중국 국가시장감독관리 총국은 이날 테슬라가 2013년 9월 25일부터 2020년 11월 21일 사이 중국에 수입된 모델S와 모델X6만7698대에 대한 리콜을 신고했다고 밝혔다. 테슬라는 리콜한 차량의 소프트웨어를 업그레이드할 계획이다.테슬라는 이 밖에도 2019년 1∼11월 사이 제조돼 중국에 수입된 모델3 2736대와 중국 현지 공장에서 2019년 10월 14일부터 올해 9월 26일 사이에 생산된 모델3 1만127대를 안전띠 문제로 리콜하고 있다.테슬라는 해당 차량의 안전띠가 잘못 설치돼있을 수 있어 점검 후 재설치할 계획이다.테슬라의 중국 시장 내 차량 리콜은 이번이 처음은 아니다. 지난 4월에는 충돌 사고로 이어질 수 있는 반도체 부품 결함 가능성을 이유로 모델3 12만 7785대를 리콜했다. 지난 주에는 미 전국고속도로교통안전위원회를 통해 후미등 결함을 이유로 미국 내 전기차 30만여대의 리콜 계획을 공표하기도 했다.",105,https://n.news.naver.com/mnews/article/138/0002137592?sid=103
"위메이드 장현국 ""코베·바낸 상장 논의…오늘도 위믹스 매입""",2022.11.25. 오후 2:25,"기사내용 요약""위믹스 사업은 글로벌로 진행…사업 영향 매우 제한적""""글로벌 거래소 코인베이스·바이낸스와 상장 논의 중""""내년 1분기까지 100개 게임 온보딩 위해 열심히 일해""""그만두기 전까지 위믹스-위메이드 주식 하나도 안 팔 것""



[서울=뉴시스] 오동현 기자 = 위메이드 장현국 대표가 국내 가상자산 거래소들의 '위믹스' 상장 폐지 결정으로 인한 ""사업적 영향은 매우 제한적""이라고 단언했다.전날 디지털자산 거래소공협의체(닥사, DAXA)는 위믹스 거래지원종료(상장폐지)를 결정했다. 현재 위믹스가 상장된 국내 거래소는 빗썸, 코인원, 업비트, 코빗 등 4곳이다.장 대표는 25일 온라인 기자간담회를 열고 ""위믹스 블록체인 사업은 글로벌로 진행되고 있기 때문에 이번 일로 인한 저희의 사업이나 영업이 큰 영향을 받진 않을 것""이라고 말했다. 또 ""위메이드가 한국회사이고, 상장사니까 많은 주목을 받고 있지만 사업과 운영은 이미 글로벌로 축이 옮긴 지 오래됐다""며 ""(위믹스가) 거래가 되냐 안되냐가 사업과 운영에 미치는 영향이 매우 제한적""이라고 밝혔다.위믹스가 국내 거래소에서 상장 폐지되더라도 해외 거래소인 엠엑스씨, 게이트아이오, 후오비 글로벌, 크립토닷컴, 엘뱅크, 쿠코인, 바이비트, 비트겟, 오케이엑스 등에선 거래 가능하다. 나아가 위메이드는 글로벌 대형 거래소인 코인베이스와 바이낸스 등에 대한 추가 상장 가능성을 시사했다. 장 대표는 ""점점 더 글로벌 거래소가 중요해지고 있다""며 ""코인 베이스와 바이낸스에 상장을 논의 진행 중이다. 언제라고는 확답 못 드리지만 논의가 상당 진전되고 있다. 조만간 확정되는 대로 시장에 적절하게 공유할 것""이라고 전했다.이어 ""위믹스 블록체인 플랫폼의 게임 온보딩 계획도 전혀 문제가 없다. 현재까지 온보딩한 게임은 현재 20개다. 올해 말까지 하기로 한 30~40개의 온보딩은 계획대로 될 것""이라며 ""내년 1분기까지 100개 게임의 온보딩을 달성하기 위해 직원들이 열심히 일하고 있다""고 전했다.또 ""위메이드는 12월 3일 '미르M' 비공개베타테스트(CBT)를 시작하고, 위메이드플레이가 준비하고 있는 소셜카지노 게임도 12월 정상적으로 론칭할 것""이라고 말했다. 장 대표는 ""다음달이면 위믹스 달러를 기축통화로 바꾼다. 이에 각각의 게임에 미치는 성패나 영향은 크지 않아, 각 게임이 받을 영향은 없다""고 강조했다.그러면서 위믹스 토큰의 가치와 미래사업  비전에 대한 변함없는 자신감을 보였다. 장 대표는 ""금일 오전에도 위믹스 토큰을 매수했다. 약속했던 대로 제가 회사를 그만두기 전까지 위믹스나 위메이드 주식을 단 한 개도 팔지 않을 것""이라고 말했다. 다만, 이번 사태로 인해 피해를 입은 투자자들에겐 사과했다. 장 대표는 ""우리가 이런 일을 의도한 것은 아니지만, 결과적으로 이런 일이 벌어져 진심으로 사과드린다""면서도 ""국내 많은 투자자들이 위믹스 투자하고 거래했는데, 이런 일이 벌어진 것에 대해서 매우 부당하다""고 위믹스 상장 폐지를 결정한 업비트를 비롯한 가상자산 거래소들을 저격했다.",105,https://n.news.naver.com/mnews/article/003/0011558085?sid=103
,,,105,https://n.news.naver.com/mnews/article/015/0004779931?sid=103
‘잘 싸운 한국’…편의점 월드컵 특수 기대감 상승,2022.11.26. 오후 2:00,"광화문 인근 CU 점포. (사진=BGF리테일)대한민국 축구대표팀이 2022 카타르월드컵 조별리그 H조 1차전에서 우루과이를 상대로 좋은 경기력을 선보이며 편의점 업계의 월드컵 특수 기대감도 커지고 있다. 1차전 경기가 치러진 지난 24일 편의점 업체들의 주요 제품 매출이 크게 늘어난 것으로 나타났다. CU는 광화문과 시청광장 인근 점포의 전주 대비 주요 상품매출신장률을 분석한 결과 맥주 판매량이 1030% 증가했다고 밝혔다. 그 다음으로는 스낵류 680%, 안주류 570%, 물 490% 순으로 주요 제품의 수요가 폭발적으로 증가했다. 거리 응원을 나온 시민들의 수요 덕분이다. CU는 대한민국 축구대표팀이 16강 진출 희망이 커진 데 따라 28일 자체 응원전도 준비하고 있다.포켓CU와 CU SNS에서 댓글 이벤트를 진행해 선정된 고객들을 서울, 부산, 광주 CGV 상영관으로 초대해 응원할 예정이다. BGF리테일 관계자는 “남은 월드컵 예선 경기에도 전국 각지에서 응원전이 예정되어 만큼 구매 데이터를 면밀히 분석해 고객 편의를 위한 스마트한 영업 전개를 펼칠 것”이라고 했다.



GS25에서 모델이 포즈를 취하고 있다.(사진=GS리테일)GS25의 매출은 전주 같은 요일인 11월 17일 대비 19.5% 증가한 것으로 집계됐다. 맥주 186.4%, 치킨 146.9%, 안주류 125.0%, 냉동간편식 113.7%, 스낵 98.2% 등이 월드컵 수혜를 본 주요 품목들이다. GS25는 맥주 번들 할인 등 월드컵 중점 행사를 벌인다는 계획이다. 편의점의 배달과 픽업 주문도 많아졌다. 전주 동요일 대비 배달∙픽업 매출은 158.9% 증가했다. 카테고리별로는 맥주 1078.5%, 치킨 528.2%, 스낵 58.7%, 안주류 84.0% 등이다.세븐일레븐은 전주 동요일 대비 매출이 20% 증가했다고 밝혔다. 특히 경기 시작 전인 18시부터 매출이 눈에 띄게 늘어났다. 전주대비 즉석치킨 150%, 오징어 130%, 육포 100%, 맥주 200% 등 다른 편의점 업체와 비슷한 품목의 매출이 증가한 것으로 나타났다.",105,https://n.news.naver.com/mnews/article/293/0000041581?sid=103
"로이터 ""블프에도 美소비자들, 아이폰14 살 수 없어""",2022.11.26. 오전 6:55,"캘리포니아주 글렌데일에 있는 애플 매장. 소비자들이 아이폰을 살펴보고 있다. ⓒ 로이터=뉴스1 ⓒ News1 박형기 기자(서울=뉴스1) 박형기 기자 = 애플의 최신 휴대폰을 찾는 많은 쇼핑객들이 이번 ‘블랙 프라이데이’(추수감사절 다음 날 금요일로, 1년 중 가장 큰 폭의 세일이 시작되는 날)에 애플 매장에서 빈손으로 돌아왔다고 로이터통신이 25일(현지시간) 보도했다. 샐리 캐논과 아들 마이클은 이날 메릴랜드 주 베데스타에 있는 애플 매장을 방문했으나 아이폰14 재고가 없어 발길을 돌려야 했다. 아비샤 루이텔도 조카에게 아이폰14를 선물하기 위해 애플 매장을 방문했지만 재고가 없어 이전 버전인 아이폰12를 구입했다. 베데스다 쇼핑몰에 있는 애플 매장 직원은 ""아이폰14 시리즈의 재고가 거의 없다""고 말했다. 노스캐롤라이나 주 롤리에 있는 매장의 또 다른 직원도 ""아이폰14 플러스는 완전히 품절됐다""고 밝혔다. 이에 따라 샐리 캐논은 아이폰14를 온라인으로 주문할 계획이다. 그러나 온라인으로 주문해도 한 달 이후에나 받을 전망이다. 아이폰 매장 직원은 ""지금 온라인으로 주문하면 한 달 이후에나 받을 수 있을 것""이라고 말했다. 그는 ""온라인 쇼핑의 경우, 아이폰14 프로의 대기시간은 최대 40일이며, 애플 매장에서 아이폰14 시리즈가 품절됨에 따라 더 많은 소비자들이 온라인으로 아이폰을 주문하고 있어 대기시간이 더 늘어날 것""이라고 설명했다.증권사 웨드부시의 IT 분석가 댄 아이브스는 ""아이폰 부족 현상이 가속화되고 있으며, 블랙 프라이데이 아침에 많은 소비자들이 좌절하고 있다""고 말했다. 그는 ""현재 많은 애플 매장에서 아이폰14 시리즈 재고가 평소보다 25%-30% 부족한 것으로 추산된다""고 덧붙였다.앞서 애플은 지난 7일 성명에서 아이폰14 시리즈의 출하량이 당초 예상보다 적을 것이라고 밝혔었다. 이는 세계 아이폰 제조의 메카인 중국 정저우 폭스콘 공장이 개점휴업 상태에 들어갔기 때문이다. 



23일 세계 최대 규모 아이폰 생산지인 중국 정저우의 폭스콘 공장에서 근로자들이 임금 체불과 코로나19 방역에 항의하는 시위를 벌이며 보안요원과 충돌을 하고 있다. ⓒ 로이터=뉴스1 ⓒ News1 우동명 기자노사분규로 정저우 폭스콘 공장에서 노동자 2만 명 이상이 떠났으며, 이에 따라 11월 말까지 정상가동이 힘들 전망이라고 로이터통신은 전일 보도했다. 한편 이같은 소식으로 이날 뉴욕증시에서 애플의 주가는 전거래일보다 1.96% 하락한 148.11달러를 기록했다.



애플 일일 주가추이 - 야후 파이낸스 갈무리",105,https://n.news.naver.com/mnews/article/421/0006483218?sid=103
소니 무선이어폰 링크버즈S 업사이클링 버전,2022.11.26. 오전 10:02,"[보통아재의 일차원리뷰]생수통 재활용 소재 색깔 예쁘네지하철서 착용하니 소음 사라락걸을 땐 소음 들리고 멈추면 노캔귀 모양 찍어서 최적화 음질 글쎄막귀에겐 음질, 통화 신세계인터넷가 10만원대...사볼 만40대 초반 아재, 게임은 ‘발컨’이고 귀는 ‘막귀’다. 어려운 용어 잘 모르고 신기술이 적용된 제품이래도 사실 잘 못 느낀다. 하지만 우리도 제품을 골라 쓸 권리는 있다. 우리 같은 사람들을 위해 무작정 써 보고 솔직히 쓴다. 살지 말지는 독자의 마음이다.



버려진 생수병을 재활용한 소재를 그대로 사용했고 그 과정에 생긴 무늬를 살렸다고 한다.김민석 기자이달 새로 출시된 소니의 무선이어폰 링크버즈S 업사이클링 버전 ‘어스블루’는 포장부터 업사이클링 제품을 사용했다. 종이로 된 상자 곳곳엔 ‘플라스틱 포장재 : 사용하지 않음’, ‘코팅 및 접착 재료 : 사용하지 않음’이라고 적혀 있다. 종이로 된 포장재를 조심스럽게 열어 보니, 정말 생수통 색깔이다. 버려진 생수통을 재활용한 재생 플라스틱을 사용했다고 한다.이 제품 소재와 포장재를 제외하면 지난 5월 출시된 링크버즈S와 똑같다. 하지만 현재 앤커의 ‘사운드코어’ 저가형을 쓰고 있는 기자에게는 이 버전이 첫 링크버즈S이기에, 모든 게 새롭고 신기했다.



포장재도 플라스틱과 접착제를 사용하지 않았다고 한다. 종이로만 만들면 친환경인지는 모르겠다.김민석 기자제품을 처음 사용한 것은 지하철 안에서였다. 뚜껑을 열고 왼쪽 기기부터 귀에 꽂으니, 약 2초 뒤 지하철 소음이 ‘사라락’ 하고 줄어드는 게 들렸다. 그럼에도 안내 방송 음성은 잘 들렸다. 이게 그 ‘노이즈 캔슬’ 기능이란 거였다.소니 링크버즈S 노이즈 캔슬은 내 활동에 따라 외부 소리를 제어한다. 예를 들어 지하철로 이동할 때는 외부 소음을 차단하고, 걸을 때는 (안전 문제 때문인지) 들리게 한다. 걷다가 횡단보도에 멈춰 서면 다시 외부 소음이 차단된다. 물론 내 동작에 따라 즉각즉각 작동하진 않고 몇 초의 시간이 걸린다.더 흥미로운 건 ‘360 리얼리티 오디오’다. 세팅 중에 샘플을 들어봤는데 보통 음향에서 왼쪽, 오른쪽, 가운데만 느껴지던 소리의 방향이 360 리얼리티 오디오로 들으니 아주 구체적으로 느껴졌다. 그리고 각각의 악기와의 거리감도 다 다르게 느껴졌다. 하지만 이런 360 리얼리티 오디오를 들으려면 특정 음악 앱을 설치해서 일부 유료 결제도 해야 하는 것으로 안내한다. 패스.360 리얼리티 오디오를 위해 앱을 설치한 뒤 사용자 귀 모양을 촬영하기도 한다. 귀를 촬영해서 사용자의 귀 모양에 따라 최적화된 음장을 제공한다고 한다.



360 리얼리티 오디오로 귀 모양에 따른 최적의 음장 효과를 제공한다기에 양쪽 귀를 촬영한 모습. 지하철에서 촬영하는 것은 너무 창피해서 집에서 찍었다.소니가 음질의 명가라는데, 음질도 들어 봤다. 많은 리뷰어들이 기기 음질을 파악하기 위해 특정 앱을 통해 특정 음악을 듣곤 하는데, 기자는 어차피 잘 모르므로 그냥 평소에 쓰던 앱으로 즐겨 듣던 노래들을 찾아 들었다.확실히 노캔 기능도 없는 저가형을 쓰던 귀엔 음질이 하늘과 땅 차이로 느껴진다. 전에 들리지 않던 음도 들리고 보컬과 각 악기, 객석의 환호성도 또렷하게 구분돼 들렸다. 하기야 노캔이 없으면 이 정도 음질을 구현한다 한들 외부 소음의 방해로 제대로 즐길 수도 없겠다.통화 기능도 아주 만족스러웠다. 직업 특성 상 이동 중에 전화 받는 경우가 많은데, 쓰던 기기로는 지하철에서 전화가 오면 사실상 통화가 불가능해 전화가 오면 블루투스를 끄고 받았다. 하지만 링크버즈S로 지하철에서 통화해 본 결과 아주 쾌적하게 통화가 가능했다. 신세계. 다만 어머니는 목소리가 이상하게 들린다며 잠시 아들이 아닌 줄 알았다고.구글 인공지능(AI) 비서와 연동도 긴밀하게 되는 것 같다. 사용 중에 메시지가 오면 길게 터치해서 비서에게 읽게 할 수 있다.정가는 24만 9000원. 친환경 어스블루라고 해서 더 비싸지 않다는 점이 마음에 든다. 인터넷에 잘 찾아 보면 10만원대에도 살 수 있다. 기자 같은 사람에겐 비싼 가격이고 오디오에 ‘진심’인 사람에겐 싼 가격이다. 기자라면 앤커 사운드코어 저가형 가격의 약 4배를 주고 이 제품을 살 만한가? YES. 아내가 허락만 해 준다면.",105,https://n.news.naver.com/mnews/article/081/0003320234?sid=103
