title,date,main,section,url
"프로비트, 고객확인제도 개편…신분증 확인절차 도입",2021.10.08. 오후 6:26,"프로비트 로고.ⓒ프로비트[데일리안 = 이건엄 기자] 암호화폐 거래소 프로비트는 고객확인제도(Know Your Customer·KYC)를 개편해 신분증 확인절차를 도입한다고 8일 밝혔다.이를 위해 프로비트는 이용자의 신분증을 스마트폰 카메라로 자동 인식할 수 있는 솔루션을 연내 도입할 예정이다. 앞으로 개편된 고객확인을 거치지 않은 회원은 프로비트를 통한 가상자산 매매와 입출금 서비스가 제한된다.이번 KYC 강화 정책은 특정금융거래정보법 개정안(이하 특금법) 시행에 따라 추진됐다. 프로비트는 가상자산거래 서비스가 자금세탁 등 금융범죄에 악용되는 것을 방지하고자 고객의 신원, 거래 목적과 자금 출처 및 실소유자 등을 파악할 예정이다.또 프로비트는 국제자금세탁방지기구(FATF)에서 지정한 위험국가 회원의 거래 금지를 강화하기 위해 해당 국가에서의 접속을 원천 차단하는 조치도 시행한다. FATF 지정 위험 국가는 이란, 필리핀, 캄보디아, 자메이카 등 총 24개국이다.도현수 프로비트 대표는 “은행권 수준의 강도 높은 고객확인 절차는 건전한 가상자산거래 생태계 조성을 위해 반드시 필요한 과정이라고 생각한다”며 “프로비트는 대내외적으로 급변하는 가상자산거래 환경에 발 빠르게 대응하여 앞으로도 고객들이 안심하고 거래할 수 있는 플랫폼을 유지해나갈 것”이라고 전했다.",105,https://n.news.naver.com/mnews/article/119/0002536699?sid=103
[DD 퇴근길] “갤Z플립3보다 짜다 짜”…아이폰13 공시지원금 최대 24만원,2021.10.08. 오후 5:10,"디지털데일리가 퇴근 즈음해서 읽을 수 있는 [DD퇴근길] 코너를 마련했습니다. 혹시 오늘 디지털데일리 기사를 놓치지는 않으셨나요? 퇴근 앞두고 저희가 요약 정리한 주요 기사를 가벼운 마음으로 읽어주시기 바랍니다. 전체 기사는 ‘디지털데일리 기사 하단의 관련뉴스(아웃링크)’에서 확인할 수 있습니다.   



  애플 아이폰13 시리즈가 8일 국내 정식 출시된 가운데 통신3사가 공시지원금을 확정했습니다. SK텔레콤·KT·LG유플러스는 이날부터 전국 대리점과 공식 온라인몰 아이폰13 시리즈 공식 판매를 시작했는데요. 공시지원금은 통신사별로 SK텔레콤 5만3000원~13만8000원, KT 8만6000원~24만원, LG유플러스 8만4000원~22만9000원으로 책정됐습니다. 예년 그대로 아이폰의 공시지원금은 ‘짠물’ 수준이네요.   사실 애플은 삼성전자와 달리 공시지원금에 재원을 쏟지 않는 것으로 알려져 있습니다. 국내 단말 제조사의 경우 통신사들과 함께 공시지원금 재원을 마련하지만, 애플 아이폰은 통신사 재원으로만 충당됩니다. 앞서 출시된 삼성전자 갤럭시Z플립3와 비교하면 아이폰13의 공시지원금은 절반 정도에 그칩니다. 물론 갤럭시Z폴드3·플립3의 경우 폴더블폰 대중화를 위해 공시지원금이 공격적으로 책정된 면도 있습니다. 어쨌든 이번 아이폰은 공시지원금 대신 선택약정을 선택하거나 자급제와 알뜰폰 조합을 고려하시는 게 좋겠습니다.



  ‘오징어게임’ 봤다면 이제 토종 OTT 오리지널을 볼 차례   ‘오징어게임’으로 전세계 열풍을 불러일으키고 있는 넷플릭스, 그리고 조만간 국내에 상륙하는 디즈니플러스 등 외산 OTT 서비스에 맞서 토종 OTT 기업들이 오리지널 콘텐츠 제작을 강화느라 분주한 모습입니다. 최근 웨이브, 티빙, 시즌 등 국내 대표 OTT 서비스들은 자체 콘텐츠 제공에 여념이 없는데요. 우선 SK텔레콤과 지상파 방송3사가 운영하는 웨이브는 현재 방영 중인 오리지널 시리즈 ‘검은태양’과 ‘원더우먼’ 등이 크게 흥행하면서 유료 가입자도 늘고 있다는 설명입니다. 웨이브는 오리지널 콘텐츠 확보를 위해 2025년까지 1조원을 투자합니다.   CJ ENM 계열의 티빙도 오리지널 콘텐츠 제공에 공을 들이고 있는데요. 올해 들어서만 들어 ‘환승연애’ 등 13여편의 오리지널 콘텐츠를 선보인 티빙은 최근 ‘유미의 세포들’ 등 웹툰 기반 드라마에도 본격 뛰어들었습니다. 티빙 역시 콘텐츠 강화를 위해 5년 간 5조원을 투입하고 2023년까지 100여편 오리지널 콘텐츠를 제작할 계획이라고 하네요. KT 시즌 역시 2023년까지 4000억원을 투자해 100여개 오리지널 드라마를 확보할 계획입니다. 넷플릭스 중심의 콘텐츠 제작 쏠림 현상이 심화되면서 국내 OTT들은 생존 전략에 더욱 고심하는 모습이네요.



  삼성전자, 분기 첫 매출 70조원 돌파…반도체·스마트폰 ‘쌍끌이’   삼성전자가 2021년 3분기 잠정 실적을 공개했는데요. 한국채택국제회계기준(K-IFRS) 연결기준 잠정 매출액 73조원 영업이익 15조8000억원으로 집계됐습니다. 매출액은 전기대비 14.7% 전년동기대비 9.0% 증가했고 영업이익은 전기대비 25.7% 전년동기대비 27.9% 상승했습니다. 분기 매출액이 70조원을 넘어선 건 이번이 처음입니다. 영업이익은 지난 2018년 3분기(17조5700억원) 이후 최대죠.   업계에 따르면 이번 분기 실적 호조는 ▲반도체 ▲디스플레이 ▲스마트폰 ▲TV·생활가전 모든 사업부가 고르게 기여한 것으로 파악됩니다. 매출액은 완제품 영업이익은 부품 비중이 높을 것으로 보이며 환율은 긍정적인 영향을 미쳤습니다.   구체적으로는 반도체 수탁생산(파운드리) 사업 수익성이 향상했습니다. 메모리에서는 D램은 2019년 3월 이후, 낸드는 2018년 9월 이후 최고가로 나타났습니다. 완제품의 경우 코로나19 보복 소비(펜트업) 수요가 지속했습니다. 3세대 접는(폴더블) 스마트폰은 국내 판매량만 100만대를 초과했습니다. TV와 생활가전 인기도 여전합니다. 삼성디플레이는 3분기에 스마트폰 유기발광다이오드(OLED) 공급이 본격화했습니다.



  게임사 시총 1위 크래프톤 ‘배틀그라운드: 뉴스테이트’ 흥행 여부 주목   배틀그라운드 지식재산(IP)이 활용된 신작이 연내 출시될 예정입니다. 8일 게임업계에 따르면 크래프톤(대표 김창한)의 펍지 스튜디오는 신작 모바일 서바이벌 슈팅 게임 ‘배틀그라운드: NEW STATE(배틀그라운드: 뉴스테이트)’ 정식 출시 일자를 이달 중 발표할 예정인데요. 전 세계 배틀로얄 게임 팬들 사이 기대감도 고조되는 분위기입니다. 지난 9월 중순 기준 글로벌 사전 예약자 수 4000만을 돌파하기도 했습니다.    ‘배틀그라운드 모바일’은 한국, 일본, 인도를 제외한 대부분 국가에서 텐센트가 퍼블리싱하고 있기 때문에 텐센트와 크래프톤이 이익을 배분하는 구조입니다. 중국 내 게임 관련 규제가 확대될 때마다 텐센트에 드리워지는 그림자를 크래프톤 또한 피할 수 없었지요. 그러나 배틀그라운드: 뉴스테이트는 크래프톤이 중국, 베트남 지역을 제외한 글로벌 국가에 직접 서비스할 예정입니다. 이 때문에 신작이 흥행할 경우 크래프톤 약점으로 꼽혀왔던 ‘차이나 리스크’가 어느 정도 해소될 것이란 업계 전망이 나옵니다. 특히 배틀그라운드 IP는 인도 게이머들의 열화와 같은 사랑을 받고 있는데요. 게임사 시가총액 1위인 크래프톤이 이번 신작을 통해 대장주 자존심을 지킬 수 있을지 관심이 쏠립니다.



토스, ‘타다’ 인수한다…핀테크 기업이 모빌리티 택한 배경은?   토스가 모빌리티 스타트업 ‘타다’를 인수합니다. 혁신 이미지를 쌓아온 두 기업이 결합하면서 관련 업계도 이번 인수를 크게 주목하고 있습니다. 토스 운영사 비바리퍼블리카는 쏘카가 보유한 타다 운영사 브이씨엔씨의 지분 60%를 인수하게 됩니다. 타다가 신주를 발행하고, 이를 토스가 인수하는 방식이고요. 주식인수계약은 이르면 10월 중 마무리될 예정입니다.   이번 인수로 토스가 목표하는 건 단순히 모빌리티 사업 진출이 아니라 결제사업의 확장입니다. 국내 택시시장 규모는 매출액 기준 연간 12조원에 달하는데요. 사실상 카카오가 독점하고 있는 상태죠. 이 시장에 토스가 뛰어든다면 유의미한 결제처를 확보할 수 있습니다. 타다가 투자금을 통해 차량 대수를 늘리면, 토스가 요금 결제에 간편결제 서비스를 접목할 것으로 보입니다.    또한 토스는 최근 인터넷전문은행 토스뱅크를 출범시켰는데요. 타다의 결제 데이터를 토스뱅크 신용평가모형의 비금융데이터로 활용할 가능성도 제기됩니다. 토스가 타다 인수를 통해 핀테크 기업으로서 외연을 확장할 수 있을지 귀추가 주목됩니다.",105,https://n.news.naver.com/mnews/article/138/0002111391?sid=103
"페이스북, 5일만에 또 접속 장애… ""일부 접근 어려워, 빨리 정상화""",2021.10.09. 오전 7:44,"로이터 연합뉴스    지난 4일 5시간 넘게 동시다발적 대규모 접속장애를 일으켰던 세계 최대 소셜미디어 페이스북이 8일(현지시간)에도 다시 접속 장애를 일으키고 있다고 AFP 통신이 보도했다.페이스북 대변인은 ""일부 이용자와 기업체가 페이스북 제품들에 접근하는 데 어려움을 겪고 있다는 것을 알고 있다""고 말하고 ""우리는 가능한 한 빨리 사태를 정상화하기 위해 작업하고 있으며 불편에 대해 사과한다""고 덧붙였다.페이스북은 페이스북 애플리케이션(응용프로그램) 외에도 사진·동영상 중심의 소셜미디어 인스타그램, 메신저 왓츠앱, 페이스북 메신저 등의 서비스를 제공하고 있다.페이스북은 지난 4일에도 여러 앱이 대규모 접속 장애를 일으켜 이 플랫폼 이용자와 사업자들이 불편을 겪었다.",105,https://n.news.naver.com/mnews/article/029/0002700130?sid=103
"‘오징어게임, 아기상어, 아자르’...K엔터, 장르 불문 폭발적 인기",2021.10.09. 오전 11:31,"넷플릭스 제공.[OSEN=고용준 기자] K팝과 드라마가 아시아권을 넘어 미국, 유럽, 중동, 남미 등까지 전세계적인 인기를 얻게 된 것은 이미 오래다. 최근에는 플랫폼과 애니메이션, 게임 등 한국의 다양한 엔터테인먼트가 해외에서 연이어 폭발적인 반응을 얻고 있다. ‘K 엔터테인먼트’의 세계적인 인기에는 증강현실(AR) 및 인공지능(AI), 막힘 없는 라이브 스트리밍 등의 IT 기술 발전과 국경없이 빠르게 상호 연결될 수 있는 온라인 시장의 성장과 함께 팬데믹으로 인한 디지털 미디어의 소비가 증가한 것이 크게 작용했다. 이처럼 장르를 불문한 폭넓은 K엔터테인먼트가 단순히 해외 진출을 넘어 큰 성과를 거두면서 다양한 서비스 및 콘텐츠가 글로벌 시장 공략에 더욱 박차를 가하며 그 경쟁력을 입증하고 있다.▲ 한국 문화와 해외 인기 장르의 접목으로 신드롬 몰고 온 ‘오징어게임’무궁화 꽃이 피었습니다, 달고나, 줄다리기, 구슬치기 등 한국의 전통놀이가 등장하는 넷플릭스 오리지널 시리즈 ‘오징어게임’이 이달 2일 기준으로 넷플릭스가 서비스 중인 83개국에서 1위를 기록했다. 전 세계적인 인기와 함께 녹색 트레이닝복, 가면 등 오징어게임 속 의상은 벌써부터 할로윈 데이 코스튬으로 각광받고 있으며, SNS에서는 달고나 만들기 챌린지가 이어지고 있다.비영어권 프로그램임에도 불구하고 오징어게임이 미국, 유럽, 중동, 남미 등에서 흥행하고 있는 비결로는 해외에서 인기가 있는 ‘데스 게임’ 장르에 한국 문화를 잘 녹여낸 점이 꼽히고 있다. 영국 일간지 가디언은 오징어게임이 영화 ‘기생충’처럼 완전히 분리된 두 계층을 통해 현대 자본주의 사회의 불평등을 다루고 있다는 점을 흥행 비결로 분석하기도 했다.▲ 어디서나 전세계인과 소통할 수 있는 K 플랫폼, ‘아자르’글로벌 모바일 영상 메신저 아자르는 페이스북, 인스타그램, 트위터 등 빅테크 기업 중심의 글로벌 소셜 시장에서 출시 6년만에 누적 5억 다운로드를 돌파한 소셜 서비스다. 전 세계의 새로운 사람들과 만난다는 ‘소셜디스커버리(Social Discovery)’ 개념을 구현하며 출시와 동시에 선풍적인 인기를 끈 아자르는 현재 20개 언어로 서비스되고 있으며, 누적 매치 수는 1100억 건을 넘어섰다. 모바일 데이터 및 분석 플랫폼 앱애니가 9월 8일 공개한 ‘소셜 미디어 앱의 진화’ 보고서에 따르면 아자르는 국내 뿐만 아니라 프랑스, 독일, 영국, 인도, 호주 등 해외에서도 출시 직후부터 수년간 소비자 지출 기준 상위 10위를 유지하고 있다.



  하이퍼커넥트 제공.K소셜 플랫폼 가운데 유일무이한 기록을 세우고 있는 아자르의 성공 비결로는 기술력과 현지화 전략이 꼽힌다. 하이퍼커넥트는 웹RTC(Real Time Communication) 기술을 활용해 다양한 통신 환경에서도 안정적으로 고화질 영상 서비스를 제공하는 것은 물론, 인공지능(AI) 기술 개발에 지속 투자해 가이드라인을 위반하는 콘텐츠를 최대 0.006초 내 사전 차단 및 필터링하는 실시간 영상 AI 모니터링 시스템을 구축했다. 최근에는 영상 및 증강현실(AR) 기술이 집약된 ‘AR 아바타’ 기능을 새롭게 도입하며 이용자들에게 색다른 경험을 선사하고 있다. 또한 하이퍼커넥트는 20개국 출신의 외국인을 채용함으로써 각 국가의 문화를 반영한 서비스와 마케팅을 제공하고 있다.▲ 동요에 K팝 요소와 쉽게 따라할 수 있는 체조로 전세계 사로잡은 ‘핑크퐁 아기상어’K콘텐츠 인기는 애니메이션도 예외가 아니다. 스마트스터디의 ‘핑크퐁 아기상어’는 해외 각국에 진출했다. 현재까지 5,000여 편이 넘는 동요·동화 영상 콘텐츠를 영어, 중국, 스페인어, 러시아어, 태국어 등 20개 언어로 선보였으며, 세계 최대 키즈 엔터테인먼트 채널 니켈로디언과 협업해 애니메이션 시리즈 ‘베이비샤크 빅 쇼’를 제작하며 미국 TV 시장에도 진출했다. 스마트스터디의 영어 유튜브 채널은 현재 약 5230만명의 구독자를 보유하고 있다.스마트스터디는 핑크퐁 아기상어의 글로벌 성공 비결에 대해 강한 동물과 고채도 색상, 빠른 비트의 음악을 통해 기존 아동 콘텐츠와 차별화한 점, 아빠, 엄마, 할아버지, 할머니 등 아이들이 보는 모든 가족 구성원이 등장하는 점 등을 꼽았다. 뿐만 아니라 북미 동요에 K팝적 요소를 접목하고, 누구나 쉽게 따라할 수 있는 아기상어 체조가 자발적인 캠페인을 유발한 것도 주효했다.



  데브시스터즈 제공.▲ 급성장하는 게임 시장, 일본과 미국 향해 달리는 ‘쿠키런’글로벌 시장조사업체 '뉴주'는 2020년 해외 게임 시장 규모가 1749억 달러(한화 206조원)에 달했다고 발표했다. 이처럼 글로벌 게임 시장이 지속적으로 성장함에 따라 국내 게임업체도 해외 시장에 진출하며 뜨거운 반응을 얻고 있다.데브시스터즈는 쿠키들이 마녀의 오븐에서 탈출하는 러닝 액션게임 ‘쿠키런: 오븐브레이크’에 이어 쿠키 왕국을 건설하고 전투를 벌이는 RPG 게임 ‘쿠키런: 킹덤’을 올해 초 새롭게 출시했다. 출시 초기부터 국내 애플 앱스토어와 구글플레이에서 매출 상위권을 기록한 쿠키런 킹덤은 지난 9월 일본 애플 앱스토어 인기 게임 2위를 기록했으며, 미국에서는 본격적인 현지 마케팅을 펼치기 전부터 애플 앱스토어 게임 매출 6위에 오르는 등 해외에서도 인기를 이어가고 있다. 데브시스터즈는 현지 유명 인플루언서를 성우로 기용하는 등 다양한 현지 홍보 활동을 통해 신규 이용자를 지속적으로 확보할 계획이다. 게임 업계에서는 쿠키런 킹덤의 경우 영미권 전래동화인 '진저브레드맨'을 주인공으로 하고 있어 글로벌 이용자들이 친숙하게 다가갈 수 있으며, 귀여우면서도 개성 있는 캐릭터들로 1020세대 여성 이용자 유입에도 성공한 것을 차별화된 경쟁력으로 꼽았다. / scrapper@osen.co.kr",105,https://n.news.naver.com/mnews/article/109/0004488516?sid=103
"[코인뉴스] 비트코인, 살아난 투자 심리에 거래량 반등…본격 상승 반전?",2021.10.08. 오후 3:20,"폭발적 반등에 탐욕 국면 지속…시장 활기 회복“저항선 부딪힐 경우 급락 올 수 있어 주의 필요”



비트코인 관련 이미지.ⓒ픽사베이[데일리안 = 이건엄 기자] 비트코인이 잠시 숨고르기에 돌입한 가운데 거래량도 늘면서 추가 반등에 대한 기대감이 높아지고 있다. 특히 암호화폐 시장 전반에 활기가 돌면서 투자자들의 매수심리에도 긍정적 영향을 미칠 것으로 보인다.8일 암호화폐 분석 플랫폼 크립토컴페어에 따르면 글로벌 비트코인 일 거래량은 7일(현지시간) 기준 119억 달러로 전날 (108억 달러) 대비 10.2% 늘었다. 이더리움 거래량도 같은 기간 58억 달러에서 61억달러로 5.2% 증가했다.이처럼 주요 암호화폐 거래량이 늘어난 것은 잇따른 호재에 투자자들의 기대감이 높아진 것이 유효했던 것으로 분석된다.실제 비트코인의 경우 지난 1일 미국 증권거래위원회(SEC)의 비트코인 상장지수펀드(ETF) 승인 가능성이 점쳐지면서 상승 물꼬를 텄다. 여기에 미국 주요 금융기관들이 암호화폐 거래를 중지하지 않겠다며 불확실성을 해소시켜 주면서 투자자들의 매수심리를 자극시켰다.이같은 기대감이 시장에 반영되면서 시장 분위기도 ‘탐욕’ 상태를 유지하고 있다. 업비트 운영사 두나무가 제공하는 디지털자산 심리지수에 따르면 이날 오후 2시 기준 ‘공포-탐욕 지수’는 69.83으로 일주일 이상 탐욕 상태가 지속되고 있다.비트코인 투자심리를 나타내는 공포·탐욕지수는 0에 가까울수록 투자자들의 공포 심리가 높다는 뜻으로 통상 코인 시장이 위축됐다는 것을 의미한다. 반대로 100에 가까울 경우 투자자들의 기대 심리가 반영돼 시장이 활기를 띤다는 것으로 탐욕 상태로 본다. 0~40은 공포, 40~59는 중립, 60~100은 탐욕으로 구분된다.다만 가파른 상승세를 보이고 있는 만큼 갑작스런 충격이 올 수 있다는 전망도 나온다. 폭발적인 반등을 이룬 만큼 하락폭 역시 클 수 있다는 진단이다.김재학 다인인베스트 연구소 애널리스트는 “비트코인이 바닥 지지 테스트를 거치지 않고 빠르게 급등했기 때문에 저항선에 부딪힐 경우 조정 하락이 올 수 있어 주의할 필요가 있다”고 지적했다.한편 암호화폐 거래소 업비트에 따르면 이날 오후 3시 기준 1비트코인은 6525만원에 거래되고 있다. 이는 24시간 전보다 0.4% 하락한 수준이다. 같은 시각 빗썸에서도 6533만원에, 이더리움은 432만9000원에 각각 거래되고 있다.",105,https://n.news.naver.com/mnews/article/119/0002536605?sid=103
[지디의 네웹소설] 판타지 소설이 현실로...‘전지적 독자 시점’,2021.10.09. 오전 8:31,"누적 조회수 1억5천만 돌파...동명 웹툰도 인기네이버 시리즈 웹소설 '전지적 독자 시점'(글 싱숑)은 약 1억5천만 누적 조회수를 돌파하며 인기몰인 중인 현대 판타지 작품이다. 어느 날 자신이 읽은 장편 소설 내용대로 세상에 바뀌면서 벌어지는 일을 담고 있다.작품은 주인공 '김독자'가 10년 동안 연재된 3천149편에 달하는 장편 판타지 소설 '멸망한 세계에서 살아남는 세 가지 방법(이하 '멸살법')'을 완결까지 읽는 모습으로 시작한다. 그에게 멸살법은 중학교 3학년 때부터 대기업 계열사의 계약직으로 일하는 지금까지 꾸준히 봤을 정도로 최고의 소설이었다.완결에 대한 충만감과 벅찬 감동을 느끼며 추천 게시판에 멸살법을 추천하는 글을 썼지만, 평균 조회수 1.9회에 불과한 작품에 대한 추천 글은 비난만 듣게 된다. 이런 상황에 씁쓸해하던 독자에게 멸살법 작가의 아이디인 'tls123'이 쪽지를 보내온다. 쪽지는 독자 덕분에 완결까지 연재할 수 있었고 어떤 특별한 공모전에 입상할 수 있었다는 내용이었다. 그리고 감사의 표시로 특별한 선물을 보내겠다는 말을 끝으로 연락을 끊는다.



전지적 독자 시점다음 날, 독자는 또 다른 소설을 읽으며 퇴근을 하던 중 지하철에서 같은 회사 직원 '유상아'를 만나게 된다. 그녀와 어색한 대화를 이어가던 중 오후 6시 55분에 작가에게서 선물과 함께 오후 7시부터 유료화가 진행된다는 메일을 받는다. 그리고 5분 뒤, 갑자기 멈춰선 지하철이 정전이 되면서 멸살법에서 '도깨비'라 불렸던 작은 뿔과 보송한 솜털이 돋은 괴생명체가 눈앞에 등장한다.도깨비는 자신에게 항의하는 사람들, 비명을 지르며 난동을 부리는 사람들, 소란을 피우는 사람들을 죽여버린다. 또 '하나 이상의 생명체를 죽이라는' 클리어 조건이 달린 첫 번째 시나리오의 시작을 알리고는 사라져 버린다. 독자는 멸살법 속 묘사들이 실제로 일어나고 있는 것임을 깨닫고, 이 세계에서 살아남으려면 어떻게 해야 할지 생각한다.네이버 시리즈 웹소설 전지적 독자 시점은 독자가 바뀐 세계에서 살아남기 위해 고군분투하는 과정을 탄탄한 세계관을 기반으로 흥미롭게 전개하고 있는 작품이다. 소설을 모두 읽은 덕분에 이 세계의 결말까지 알고 있는 독자가 멸망한 세계에서 살아남아 원하는 결말을 볼 수 있을지 독자들의 궁금증이 높아지고 있다.특히 전지적 독자 시점은 웹소설의 폭발적인 인기에 힘입어 동명의 웹툰으로도 제작됐다. 매주 수요일 연재되고 있는 네이버웹툰 전지적 독자 시점은 방대한 스케일을 자랑하는 원작 소설을 섬세한 묘사가 돋보이는 작화와 역동적인 연출로 구현해 높은 몰입도를 선사한다는 호평을 얻으며 큰 인기를 얻고 있다.미국, 일본, 프랑스, 태국 등 해외에서도 인기를 얻고 있는 웹소설 전지적 독자 시점은 네이버 시리즈 앱과 모바일 웹, PC 홈페이지 등을 통해 감상할 수 있다.",105,https://n.news.naver.com/mnews/article/092/0002235711?sid=103
[그래픽] 디지털세 도입 향후 일정,2021.10.09. 오전 9:23,"(서울=연합뉴스) 이재윤 기자 = 경제협력개발기구(OECD)/주요 20개국(G20) 포괄적 이행체계(IF)는 8일(현지시간) 제13차 총회를 화상으로 개최, 구글, 페이스북 등 글로벌 정보기술(IT) 대기업들을 겨냥해 '구글세'로도 불리는 디지털세가 136개국의 지지를 받아 2023년부터 본격 도입된다고 밝혔다.    yoon2@yna.co.kr    트위터 @yonhap_graphics  페이스북 tuney.kr/LeYN1",105,https://n.news.naver.com/mnews/article/001/0012678740?sid=103
