title,date,main,section,url
"전병극 1차관, 韓디지털 문화정책 유네스코 193국과 공유",2022.09.30. 오전 11:49,"전병극 문화체육관광부 제1차관(왼쪽 세번째)이 29일(현지시간) 멕시코 멕시코시티 대통령 가택 지구에서 열린 유네스코 세계문화장관회의에 한국정부 대표로 참석해 기조연설을 하고 있다.전병극 문화체육관광부 제1차관이 멕시코 멕시코시티에서 28일~30일(현지시간) 열리는 '유네스코 세계문화장관회의'에 한국정부 대표로 참석해 우리나라 디지털 문화정책을 소개하고 '2030 부산세계박람회' 유치 홍보 활동을 펼쳤다.멕시코 정부와 유네스코 공동 주최로 열린 회의로 양측은 문체부를 공식 초청했다. 알레한드라 프라우스토 게레로 멕시코 문화부 장관과 에르네스토 오토네 라미레즈 유네스코 문화사무총장보는 5월 각각 방한해 우리 정부 참석을 건의했다.올해 회의에서는 △디지털 전환·코로나19 대응 등 사회경제 변화와 관련된 '각국 신규·강화된 문화정책' △기후 위기, 도시개발 속 정책 수단을 점검하는 '지속 가능한 발전을 위한 문화' △문화유산 불법 반·출입, 언어 다양성, 원주민 보호 등을 논의하는 '위기에 처한 유산과 문화다양성' △지속 가능한 문화관광·종사자 교육 등을 다루는 '창의경제의 미래'를 의제로 정했다.전 차관은 29일 멕시코 대통령 가택 지구에서 열린 본회의에서 첫 의제 '각국 신규·강화된 문화정책' 기조 발언자로 나서 한국 디지털 문화기술 발전상과 콘텐츠·주요 문화정책을 193개 유네스코 회원국에 공유했다.이용자 접근성 강화, 온라인상에서 저작권 보호·인공지능(AI) 활용, 이해관계자 디지털 교육을 제시하며 한국정부의 관련 주요 정책과 사례를 소개했다.전 차관은 “첨단기술이 예술적 상상력과 결합해 탈중앙화된 공간에서 이용자에게 더욱 큰 자유와 권한, 새로운 경험을 제공하고 있다”며 “대한민국은 시대적 변화가 열어주는 기회를 놓치지 않기 위해 첨단기술을 활용한 창작이 활성화될 수 있도록 지원할 것”이라고 말했다.



전병극 차관(왼쪽)이 멕시코시티에서 벨리슬라브 미네코프 불가리아 문화부 장관(오른쪽)과 면담을 하고 있다.또 멕시코시티에서 벨리슬라브 미네코프 불가리아 문화부 장관을 만나 2030 부산세계박람회 유치 지지를 요청하고 양국 문화교류 협력 활성화 방안을 논의했다. 크로아티아, 포르투갈, 도미니카공화국 등 회의 참석국 문화부 대표 대상 '2030 부산세계박람회' 유치 홍보활동을 펼쳤다.전 차관은 귀국길에도 미국 현지 방송·영화 관계자를 만나 북미지역에서 한류 지속 확산 방안을 논의한다. 30일 미국 로스앤젤레스(LA)에서 드라마 '굿닥터' '파친코' 수석 연출가 이동훈 엔터미디어 대표, 전재경 CJ ENM 미주법인 최고재무책임자(CFO), 조지스 챔첨 아시안월드영화제 집행위원장 등과 간담회를 개최할 예정이다.",105,https://n.news.naver.com/mnews/article/030/0003048061?sid=103
'오딘' 개발사 라이온하트 상장예비심사 통과,2022.09.30. 오전 11:04,"29일 한국거래소 승인 마쳐…코스닥 본격 입성 준비



김재영 라이온하트스튜디오 대표 [사진=라이온하트스튜디오 ]'오딘: 발할라 라이징'의 개발사 라이온하트스튜디오가 코스닥 시장 상장예비심사에서 승인받으며 본격적인 상장 절차에 돌입한다.30일 한국거래소에 따르면 라이온하트스튜디오(대표 김재영)는 지난 7월 22일 청구한 상장예비심사 결과 29일 심사승인을 받았다.라이온하트스튜디오는 '블레이드 포 카카오'로 2014 대한민국 게임대상을 수상한 김재영 대표가 2018년 5월 설립한 게임 개발사다. 앞서 카카오게임즈가 추가 지분을 확보하는 과정에서 책정된 기업가치는 4조원에 육박한다.이 회사는 지난해 6월 카카오게임즈를 통해 출시한 '오딘: 발할라 라이징'이 지난해 매출 2천326억원, 영업이익은 2천153억원을 기록하면서, 영업이익률 93%를 달성한 바 있다.한국거래소 규정상 상장예비심사를 받으면 6개월 이내에 상장을 완료해야 한다. 심사승인을 마친 라이온하트스튜디오는 이후 본격적인 기업공개(IPO)를 위해 증권신고서 제출 및 기업설명회 개최, 수요예측, 공모가 확정, 청약, 주금 납입 등의 절차를 거치게 된다.",105,https://n.news.naver.com/mnews/article/031/0000700615?sid=103
"인구·가구통계와 통신사 자료 합쳤더니, 1인가구 정책 '뚝딱'",2022.09.30. 오전 11:46,"[개인정보위 '제2회 가명정보 활용 우수사례 경진대회'서 우수사례 발표]



/사진=개인정보보호위원회#사례지방자치단체와 통계청, 통신사가 손을 맞잡았더니 1인가구 맞춤형 정책이 만들어졌다. 서울특별시와 통계청, SK텔레콤의 얘기다. 지자체와 통계청은 개별 가구 현황과 소득, 주택정보 등 정보를 가지고 있고 통신사는 해당지역 거주자의 방문지역과 이동거리, 지역 체류시간 등 정보를 보유 중이다. 서울시, 통계청, SK텔레콤은 자신들이 가지고 있는 정보를 가명처리한 후 결합했다. 이를 통해 1인 가구의 주거 및 생활패턴을 상당 부분 구체화시킬 수 있었다는 평가다. 서울시는 이같은 분석을 기반으로 지역별 1인 가구에 대한 해결과제를 발굴, 1인가구 복지정책을 개발하는 데 사용할 예정이다.민간과 공공이 보유한 각종 데이터를 가명 형태로 가공·결합해 사업이나 정책의 효율성을 높이는 주요 사례들이 한 번에 소개되는 자리가 열렸다.개인정보보호위원회는 30일 과학기술정보통신부, 보건복지부, 금융위원회, 국세청 등 관계 부처와 함께 서울 명동 포스트타워에서 '제2회 가명정보 활용 우수사례 및 아이디어 경진대회'를 열었다.가명정보란 개인정보의 활용 가능성을 최대한 유지하면서 개인정보 일부의 삭제 및 대체를 통해 추가 정보 없이는 특정 개인을 알아볼 수 없도록 처리한 정보를 일컫는다.'개인정보보호의 날'은 2011년 9월30일 개인정보보호법 제정·시행 10주년이었던 지난해에 1회 행사가 시작돼 올해로 두 번째를 맞는다. 개인정보위는 기념식과 함께 가명정보 경진대회를 지난해에 이어 올해도 개최했다.가명정보 활용 중요성에 대한 인식이 높아지며 수상작도 지난해 14점에서 올해 20점으로 늘었다. 올해 총 접수건수는 활용사례 24건, 활용 아이디어 45건 등 총 69건에 달했다. 부처별 추천을 받은 전문가 심사단이 서류 및 발표 심사를 통해 대상 6점과 우수상 14점을 선정했다.가명정보 활용 우수사례 부문에서는 '가명데이터 활용, 서울시 1인가구 정책 실효성 높인다'는 주제로 1인가구 삶의 질 지표 개발을 시도한 '1인가구 분석팀'(서울시·통계청·SK텔레콤) 팀을 비롯해 △친환경차 충전 인프라 수요예측 및 최적입지 선정을 시도한 우결우팀(SK(주) C&C, 성남시, 티맵모빌리티) △지역가입자의 주택금융부채 공제를 위한 신용정보 결합을 했던 'NHIS BIG DATA팀'(국민건강보험공단) △비금융정보를 활용한 대안 신용평가 모형 개발에 나선 카카오뱅크 신용리스크모델링팀 △맞춤형 가명정보로 철도협력 여행사에 대한 코로나 극복지원을 시도한 한국철도공사 빅데이터팀 등 5개 팀이 대상 수상팀으로 선정됐다.이외에 △공무원연금공단 △국립암센터 자궁난소암센터 △한화생명 데이터 애널리틱스팀 △신한카드 데이터비즈챕터 △국가보훈처 △NICE지니데이타 △넥슨코리아 △중소기업중앙회, NICE평가정보 △한국도로공사 등이 활용사례 부문 우수상 수상팀으로 선정됐다.가명정보 활용 아이디어 부문의 대상에는 알코올 중독자의 진료정보 결합을 통한 질병형태 분석을 주제로 알코올 중독 원인 규명 및 사전경보 체계 개발을 제안한 '강한 연구팀'(강원연구원·한림대)이 선정됐다. 또 △삼성카드 △신한은행 △서울연구원 △통계청, 제주관광공사, SK텔레콤 △서울대 보건대학원 등이 아이디어 부문 우수상을 받았다.이번 수상작으로 선정된 우수 사례와 아이디어는 '2022 가명정보 활용 우수사례집'으로 제작·배포된다. 우수 아이디어 부문 수상작은 가명정보 활용 컨설팅을 통해 사업화 등을 지원한다. 개인정보위가 KISA(한국인터넷진흥원)이 컨설팅을 주관한다.윤종인 개인정보위 위원장은 ""제도 도입 3년차를 맞이한 가명정보 제도는 주요 데이터 보유기관을 중심으로 그 수요가 늘고 있고 성과도 가시화되는 등 점차 확산하는 단계""라며 ""앞으로 가명정보 제도가 국민들이 실제 삶을 개선시키고 기업의 데이터 혁신을 이끌며 디지털플랫폼정부의 데이터 기반 행정을 뒷받침할 수 있도록 힘쓸 것""이라고 했다.",105,https://n.news.naver.com/mnews/article/008/0004800917?sid=103
"퓨쳐켐 ""전립선암 치료제, 치료목적사용 추가 승인""",2022.09.30. 오전 10:09,"지난 6월 이어 2건 추가퓨쳐켐은 전립선암 치료제 후보물질인 ‘FC705’가 국내 식품의약품안전처로부터 2건의 치료목적 사용승인을 추가로 받았다고 30일 밝혔다. 치료목적 사용승인은 중증 환자 등의 치료를 위해 임상용 의약품을 사용할 수 있도록 하는 제도다. FC705는 호르몬 및 항암 치료가 듣지 않는 거세 저항성 전립선암(mCRPC) 환자를 대상으로 지난 6월부터 총 3건의 치료목적 사용승인을 받았다. FC705는 전립선특이막항원(PSMA)을표적하는 전립선암 치료제 후보물질이다. 퓨쳐켐은 경쟁약물 대비 적은 용량으로도 부작용이 적고 항암 효과가 높을 것으로 기대하고 있다.FC705의 경쟁약물인 노바티스의 ‘플루빅토’는 지난 3월 미국에서 승인됐다. 200mCi(밀리퀴리) 용량을 6주 간격으로 6회 투여한다. FC705는 임상 2상에서 100mCi, 8주 간격으로 6회 투여한다. 플루빅토 200mCi를 6회 반복 투여했을 때 ORR(객관적반응률)은 52%였다. FC705는 임상 1상에서 100mCi를 1회 투여했을 때 ORR 66.7%를 기록했다. 유효 용량인 100~150mCi 투여군에서 100%의 질병통제율이 나타났다. 퓨쳐켐 관계자는 “지난 5월  미국과 국내에서 임상 2상을 승인받았다”며 “2상에서 반복투여가 진행되는 만큼 더욱 개선된 유효성 지표가 기대된다”고 말했다.",105,https://n.news.naver.com/mnews/article/015/0004756416?sid=103
"안랩, 개발자 컨퍼런스 개최…”R&D 인력 역량 강화한다”",2022.09.30. 오후 4:10,"안랩 개발자 컨퍼런스에서 발언하고 있는 강석균 안랩 대표./ 안랩 제공        안랩이 사내 연구개발 인력의 역량 강화를 위해 개최한 ‘안랩 개발자 컨퍼런스’를 성료했다고 30일 밝혔다.안랩에 따르면 이번 행사는 안랩 연구개발 인력의 개발역량 강화와 지식 확장을 위해 기획됐다. 안랩은 지난 26일~29일까지 나흘간 안랩 사옥과 경기창조경제혁신센터, 온라인에서 강석균 안랩 대표와 전성학 연구소장의 키노트, 외부 전문가 세션, 내부 기술공유 세션 등 총 20개의 세션을 진행했다.첫번째 키노트를 맡은 강 대표는 연구개발 역량 강화의 중요성을 강조하며 전문가 양성을 위한 성과관리 및 역량체계 시스템을 소개했다. 강대표는 “이번 컨퍼런스는 그간 코로나19로 어려웠던 연구개발 부문 임직원 간 소통의 장을 마련하고 전문가로서 성장을 도모하기 위해 마련됐다”라며 “앞으로도 다양한 교육 프로그램 및 성과 체계를 바탕으로 구성원과 회사의 동반성장 기회를 마련할 것이다”라고 했다.이어 전성학 연구소장은 두번째 키노트에서 ‘꿈이 있는 개발자’라는 주제로 연구개발자가 성장을 위해 갖춰야 할 자세와 안랩의 연구개발 방향성을 공유했다. 전 연구소장은 “’코더(Coder)’를 넘어 전문적인 ‘개발자(Developer)’로 성장하기 위해선 자신만의 꿈을 가지고 구체적인 목표를 수립해야 한다”라며 “이번 컨퍼런스가 안랩의 일원으로서 어떤 성과를 이루고 싶고, 어떤 개발자가 되고 싶은지 생각해보는 기회가 되길 바란다”라고 했다.안랩은 이번 행사에서 다양한 분야의 정보기술(IT) 전문가를 초청했다. 먼저 김지현 IT칼럼니스트가 ‘DT시대 반드시 알아야 할 기술트렌드’를 주제로 개발자가 알아야 할 디지털 기술 트렌드를 소개했다. 셋째날에는 ‘개발자를 위한 글쓰기 가이드’ 저자인 유영경 테크니컬 라이팅 코치가 개발자가 소통과 문서작성을 위해 주의해야 할 내용을 알려주는 ‘개발자 글쓰기 가이드’ 강연을 진행했다.안랩의 연구개발 전문가들이 직접 나서 자신의 전문 분야 및 기술에 대한 지식을 공유하는 ‘내부 기술공유 세션’도 마련됐다. 내부 기술공유 세션에서는 보안과 솔루션에 대한 이해를 높이는 ‘More Security’, 클라우드와 딥러닝 등 주목받는 기술 활용 방안을 소개하는 ‘Move Forward’, 연구개발 노하우부터 심화기술까지 개발 역량 업그레이드를 위한 ‘Deep dive into R&D’ 등 개발자를 위한 다양한 강연이 이어졌다.이번 컨퍼런스에 참여한 김동주 안랩 EPS개발팀 책임연구원은 “이번 컨퍼런스로 최근 주목받는 기술과 트렌드를 실무적 관점에서 배울 수 있었다”라며 “또 다양한 내외부 전문가의 지식과 노하우를 공유 받으면서 개발자로서 성장 의지와 열정을 되살릴 수 있는 기회였다”라고 했다.",105,https://n.news.naver.com/mnews/article/366/0000844461?sid=103
연내 메타버스 보안 가이드라인 나온다,2022.09.29. 오후 8:54,"기사내용 요약백종현 KISA 팀장 '2022 국방보안컨퍼런스'서 주제발표메타버스, 금융·엔터·스포츠 등으로 확장…덩달아 보안위협 요소도 늘어최근 메타버스서 가상자산 탈취·성범죄 등 발생…KISA, 안전한 환경 구축 착수KISA “세부 내용은 현재 개발 중”…메타버스 사업자·이용자 대상



백종현 KISA 융합보안정책팀 팀장은 29일 국방부가 서울 공군호텔에서 주최한 ‘2022 국방보안컨퍼런스’에 참석해 ‘메타버스 보안모델’ 를 주제로 발표했다. (사진=송종호 기자) *재판매 및 DB 금지[서울=뉴시스]송종호 기자 = 정부의 메타버스 보안 가이드라인이 연내 마련될 전망이다. 메타버스가 금융, 의료, 엔터테인먼트, 스포츠 등으로 영역이 확장되면서 보안 위협 요소도 늘고 있어서다.  백종현 한국인터넷진흥원(KISA) 융합보안정책팀 팀장은 29일 국방부가 서울 공군호텔에서 주최한 ‘2022 국방보안컨퍼런스’에 ‘메타버스 보안모델’ 주제 발표자로 나서 이같이 밝혔다. 백 팀장은 이 날 “메타버스를 겨냥한 가상생태계, 플랫폼, 인프라의 보안위협과 이에 대한 완화방안에 따른 것”이라며 “메타버스 서비스를 제공하는 사업자와 이용자의 안전한 이용환경을 위해 연내 가이드 라인을 마련할 것”이라고 말했다.이어 “현재 가이드라인에 포함되는 세부 내용을 구체화하고 있다”고 덧붙였다. KISA가 메타버스 보안 가이드라인에 나선 것은 가상자산 탈취, 개인정보 유출 등 여러 불법행위가 메타버스 시스템에서 발생했고, 앞으로그 사사례가크게 늘어날 것으로 우려되기 때문이다.백 팀장은 “메타버스 관련 실제 침해사고는 기존 정보시스템 취약점을 활용한 사례부터 최근 메타버스와 연계된 대체불가토큰(NFT) 탈취사고, 아바타 성범죄 등”이라며 “그 규모가 계속해서 증가하고 있다”라고 지적했다. 실제로 지난해 12월 메타버스 서비스인 호라이즌 월드에서 한 여성 이용자의 아바타가 남성 아바타들에 둘려싸여 성폭행 당하는 사건이 발생했다. 당시 이 메타버스 성범죄에 가담한 것으로 확인된 남성 아바타는 34명이었다. 특히 아동·청소년의 메타버스 이용 비중이 급증하고 있어, 메타버스 내 보안 환경 강화가 시급한 실정이다. 사이버 보안 전문가들의 우려도 커지고 있다. 이들이 메타버스에서 우려는 보안위협은 ▲광범위한 개인정보 수입에 따른 해킹공격 가능성 증가 ▲개인신상정보 활용에 따른 사생활 침해 가능성 ▲이용기기와 주고받는 정보에 대한 보안기능 미흡 ▲메타버스를 매개로 한 아동·청소년 성착취 우려 ▲아바타·계정정보의 도용·모방 행위 등이다. 한 정보보안 전문가는 “메타버스를 도입하는 기업들이 늘고 있지만 제대로 된 보안 수칙이나 시스템이 없는 것이 문제”라며 “메타버스가 올바르게 성장하기 위해서는 서둘러 보안 환경을 정비할 필요성이 있다”라고 강조했다.이 같은 우려에 대해 KISA는 강력한 보안 정책을 적용해 안전한 메타버스 구축에 힘 쏟는다는 계획이다. 백 팀장은 “메타버스 내 여러 사고 사례와 전문가 의견을 수렴해 메타버스 내에서 발생할 수 있는 위협 요소에 선제 대응할 것”이라며 “메타버스 내 구성요소를 분석해 안전한 환경 구축에 최선을 다할 것”이라고 밝혔다.백 팀장은 메타버스 사업자와 이용자의 보안인식 제고도 필요하다고 강조했다. 그는 “메타버스를 개발하고 운영하는 사업자는 보안위협 완화를 위한 노력이 필요하다”라며 “이용자 역시 개인정보, 금융정보 보호 등의 주의가 필요하다”고 말했다.",105,https://n.news.naver.com/mnews/article/003/0011449433?sid=103
CJ ENM 오펜 출신 '덕구 이즈 백' APAN 단편드라마상,2022.09.30. 오전 11:48,"CJ ENM 오펜 공모전을 통해 영상화된 '덕구 이즈 백'이 '2022 아시아태평양 스타어워즈(APAN)' 단편드라마상을 수상했다.2022 APAN은 한국연예매니지먼트협회와 스튜디오엠원 공동 주관으로 29일 열렸다. 대한민국 모든 드라마 콘텐츠를 대상으로 진행되며 올해는 OTT 수상 부문도 신설됐다.지난해 tvN에서 방영된 단막극 프로그램 '드라마 스테이지 2021' 중 하나인 '덕구 이즈 백'은 실종된 지 5년만에 살아 돌아온 '덕구(양경원 분)'와 보험금 때문에 덕구가 죽은 사람인 척 살기 원하는 가족이 벌이는 우당탕탕 현실가족 와해드라마다.CJ ENM은 2017년부터 신인 창작자 발굴·육성을 위해 오펜 공모전을 진행, 당선작 10편 영상화를 스튜디오드래곤과 함께 기획·개발해 tvN '드라마 스테이지'에서 방영했다. 올해는 단막극에서 시리즈물까지 범위를 확장하며 '오프닝'으로 이름을 바꿨다. 오펜으로 영상화된 작품은 단막극 48편과 시리즈물 2편까지 총 50편이다.연출을 맡은 허석원 스튜디오드래곤 감독은 “가족 구성원 이해관계와 감정변화를 극의 흐름과 함께 자연스럽게 쌓아올리는 데 주안점을 두고 작업했다”며 “작지만 의미 있는 메시지를 전달할 수 있어 좋았고 수상까지 이어져 더욱 기쁘다”고 말했다.남궁종 CJ ENM 오펜사업국장은 “오펜으로 영상화된 여러 작품이 국내외 시상식에서 좋은 결과를 내고 있어 뿌듯하다”며 “앞으로도 잠재력을 가진 신인 창작자를 발굴하고 육성하는 데 노력을 아끼지 않을 것”이라고 밝혔다.오펜은 드라마·영화 창작 생태계 활성화와 신인 작가의 데뷔를 지원하는 CJ ENM 신인 창작자 발굴·육성 프로젝트다.",105,https://n.news.naver.com/mnews/article/030/0003048060?sid=103
“네이버 검색으로 ‘관세사’ 찾아볼까”…인물정보 제공 협약,2022.09.30. 오후 7:34,"[디지털데일리 오병훈 기자] 네이버 검색을 통해 국내 관세사 정보를 쉽게 확인할 수 있게 됐다.    네이버(대표 최수연)는 한국관세사회와 인물정보 제공 업무협약을 체결했다고 30일 밝혔다. 양 기관은 다양한 전문 분야 관세사 정보가 네이버 인물정보에 정확하게 등록될 수 있도록 지원한다.   네이버는 정확한 전문가 인물정보 제공을 위해 각 분야 기관과 협력 관계를 구축하고 있다. 최근에는 한국건축가협회와 업무협약을 체결하고, 연말부터 소속 건축가 정보를 네이버 검색으로 제공한다. 한국손해사정사회, 인터파크, 대한법무사협회 등과도 제휴를 맺고 관련 인물정보를 선보인다. 삼성서울병원, 서울대학교병원, 연세의료원, 순천향대병원 등 의료 기관과도 협력 관계를 맺고 소속 의료인 정보를 제공한다.   산업 트렌드 변화와 이용자 직업 수요에 맞춰 인물정보 서비스 직업 분류 체계와 등재 기준도  정비한다. 네이버는 한국인터넷자율정책기구(KISO) 검토 및 자문을 거쳐 최근 1년 동안 인물정보 서비스에 댄서, 래퍼, 그림책작가 등 22개 신규 직업을 추가했다.   유봉석 네이버 서비스운영총괄은 “양기관 협력으로 이용자가 더 많은 관세사 인물정보를 네이버에서 정확하게 확인할 수 있기를 기대한다”라며 “네이버는 다양한 분야에서 활동하고 있는 전문가에 대한 정확한 프로필 정보를 제공하기 위해 앞으로도 여러 업계와 활발하게 협력 및 소통하겠다”고 말했다.",105,https://n.news.naver.com/mnews/article/138/0002133767?sid=103
,,,105,https://n.news.naver.com/mnews/article/236/0000227890?sid=103
"롯데하이마트, 10월 '위대한 세일' 진행",2022.09.30. 오전 10:16,"김치냉장고 할인 페스타, 월클 가전 베스트 등 기획전 할인판매롯데하이마트가 10월 한 달간 '위대한 세일'을 진행한다. 하반기 대형 스포츠 이벤트를 앞두고 우리(We)의 '위'와 대한민국의 '대한'을 따서 행사명을 지었다.롯데하이마트는 김장철을 맞아 김치냉장고 기획전, '월클(월드클래스)' 가전 베스트 기획전 등 다양한 부대 행사를 운영한다. 전국 410여개 롯데하이마트 매장에서 1억 2천만원 상당 경품 이벤트도 운영한다.롯데하이마트는 김장을 시작하는 10월부터는 김치냉장고 수요가 증가하는 점을 고려해 이번 할인 행사를 기획했다. 최근 5년간(2017년 1월~2021년 12월) 롯데하이마트에서 10월부터 12월까지 3개월 동안 판매된 김치냉장고 매출액은 연간 매출액의 45%를 차지했다.



롯데하이마트가 10월 한 달간 위대한 세일을 진행한다. 롯데하이마트 대치점에서 모델들이 위대한 세일 행사를 소개하고 있다. (사진=롯데하이마트)롯데하이마트는 김치냉장고 성수기를 맞아 '알뜰한 집밥생활: 김치냉장고 할인 페스타' 기획전을 진행한다. 주말을 전후로(금~월) 위니아, 삼성전자 김치냉장고 행사 상품을 구매하면 구매 금액대에 따라 최대 15만원 엘포인트 또는 롯데모바일상품권을 제공한다.'월클 가전 베스트' 기획전에서는 매주 주말을 전후로(금~월) 냉장고, 세탁기, 전기레인지 등 주차별 판매 우수 상품을 선정해 최대 30% 할인 판매한다. 전국 410여개 롯데하이마트 매장에서 10만원 이상 제품을 구매하고 응모한 고객을 대상으로 1억 2천만원 상당 경품 이벤트도 진행한다.김은정 롯데하이마트 마케팅부문장은 ""김치냉장고, TV 등 성수기 시즌을 맞아 어느 때보다도 풍성한 혜택을 준비했다""며 ""롯데하이마트에서 즐거운 쇼핑도 경험하고, 다가오는 스포츠 이벤트를 재미있게 즐기시길 바란다""고 말했다.",105,https://n.news.naver.com/mnews/article/092/0002269580?sid=103
