title,date,main,section,url
"한올바이오파마, 불면증 치료제 `멜라원` 출시",2023.01.15. 오전 10:20,"의존성·내성으로 인한 반동 불면증 및 금단현상 부작용 최소화



한올바이오파마 멜라원. 한올바이오파마 제공.    한올바이오파마는 불면증 치료제 '멜라원서방정2㎎'(이하 멜라원)을 출시했다고 지난 12일 밝혔다.멜라원은 수면을 유도하는 체내 생성 호르몬 '멜라토닌'과 화학적으로 동일한 합성 의약품으로, 수면의 질이 저하된 55세 이상의 불면증 환자의 단기치료에 사용되는 치료제다. 체내에서 분비되는 멜라토닌과 유사하게 수면시간 전체에 걸쳐 지속 방출되는 서방형 제제이기 때문에 생체 리듬에 맞춰 수면-각성주기를 재조정해 수면의 질을 개선하는 것이 특징이다.또한 멜라원은 의존성과 내성이 없는 비향정신성 의약품으로 치료를 중단하더라도 불면증이 더 심해지는 반동 불면증이나 금단현상 등의 부작용이 적어 13주까지 장기 처방 가능하다. 환자는 1일 1회 1정을 식사 후 취침 1~2시간 전에 씹거나 부수지 않고 통째로 경구 투여하면 된다.정승원 한올바이오파마 대표는 ""불면증은 국내에만 68만명의 많은 환자가 있는 것으로 알려졌을 만큼 현대인들에서 가장 흔하게 나타나는 질환 중 하나""라며 ""멜라원은 환자들의 수면의 질 향상에 도움을 주는 것은 물론 오리지널 대비 합리적인 약가로 환자들의 경제적인 부담을 완화시킬 것으로 기대된다""고 전했다.한편, 시장조사 기관 IMS에 따르면 국내 멜라토닌 시장은 2018년 약 55억원에서 2021년 약 100억원 규모로 연평균 18% 이상의 빠른 증가세를 보였다.",105,https://n.news.naver.com/mnews/article/029/0002778595?sid=103
네이버가 인수한 ‘포시마크’…“글로벌 시장에 새로운 트렌드 제시할 것”,2023.01.15. 오후 4:13,"기자간담회서 네이버 기술 접목한 ‘포시 렌즈’ 공개라이브 커머스 등 적용 분야 확대해 서비스 고도화



마니시 샨드라 포시마크 최고경영자(CEO) [사진 네이버][이코노미스트 선모은 기자] 네이버는 포시마크가 미국 캘리포니아 레드우드시티에 있는 본사에서 기자간담회를 열고 네이버 계열사 편입 이후 사업 방향을 공개했다고 15일 밝혔다.포시마크는 미국 내 최대 규모의 개인 간 거래(C2C) 패션 플랫폼이다. 2011년 설립된 후 커뮤니티를 기반으로 8000만명의 이용자를 확보했다. 포시마크에 따르면 이 회사의 지난해 연간 거래액은 18억 달러(약 2조2278억원), 매출은 3억3000만 달러(약 4084억원)에 달한다.앞서 네이버는 포시마크의 가용 현금을 포함해 13억1000만 달러(약 1조62134억원)로 이 회사를 인수했다. 마니시 샨드라 포시마크 최고경영자(CEO)는 이번 기자간담회에서 “포시마크가 ‘팀네이버’의 일원이 된 만큼 네이버의 강력한 기술을 활용해 마케팅과 검색, 커뮤니티 등 서비스 전반을 구매자와 판매자 모두의 입장에서 개선해나가겠다”며 “세계 시장에서 새로운 C2C 트렌드를 제시할 것”이라고 했다.



(왼쪽부터)스티븐 영 포시마크 최고마케팅책임자(CMO), 마니시 샨드라 최고경영자(CEO), 트레이시 선 수석부사장(SVP) [사진 네이버]이날 포시마크는 네이버의 스마트렌즈 기술이 접목된 ‘포시 렌즈’의 시험 버전을 처음으로 공개했다. 포시 렌즈는 포시마크 사용자가 원하는 상품을 촬영하면 비슷한 상품과 가격을 보여주는 서비스다. 포시마크에 가장 먼저 적용된 네이버의 기술이기도 하다. 포시마크는 라이브 커머스인 ‘포시 쇼’도 소개했다. 판매자가 실시간으로 방송을 켜고 구매자에게 상품을 설명할 수 있는 기능이다. 회사는 포시 쇼에 네이버의 라이브 커머스 기술을 접목해 서비스를 고도화할 계획이다.미국 밀레니엄 세대 여성 90%가 포시마크 가입포시마크에 따르면 미국의 밀레니엄 세대 여성의 대다수인 90%가 포시마크 커뮤니티에 가입해있다. 샨드라 CEO는 “인도에서 자라며 상인들이 생동감 있게 소통하고 물건을 거래하는 모습을 봤다”며 “일찌감치 커뮤니티가 가진 가치를 경험한 것”이라고 말했다.포시마크는 사용자들이 오프라인에서 만날 수 있는 행사 ‘포시 페스트’와 온·오프라인 미팅인 ‘포시 파티’ 등 커뮤니티를 활성화하기 위해 다양한 노력을 기울일 계획이다. 스티븐 영 포시마크 최고마케팅책임자(CMO)는 “포시마크를 통해 추가 수익을 창출하거나, 새로운 사업을 시작한 사람들이 많다”며 “자체 상품을 가진 브랜드들도 포시마크를 통해 성장하고 있다”고 덧붙였다.",105,https://n.news.naver.com/mnews/article/243/0000038119?sid=103
"SKT, 설 앞두고 파트너사에1100억원 규모 대금 조기 지급",2023.01.15. 오전 10:42,"SK텔레콤은 설을 앞두고 비즈니스 파트너사들의 재정 부담 경감에 도움을 주기 위해 SK브로드밴드, SK스토아 등 ICT패밀리와 함께 약 1천100억 규모의 대금을 연휴 시작 전에 조기 지급할 계획이라고 15일 밝혔다.SK텔레콤, SK브로드밴드, SK스토아 등 ICT 패밀리사는 코로나19와 급변하는 대내외 환경에서 서비스 품질 유지에 만전을 기해온 네트워크 공사 및 유지보수, 서비스 용역 등을 담당하는 중소 비즈니스 파트너들이 명절을 앞두고 자금을 원활히 운영하는데 도움을 주기 위해 대금 조기 지급을 결정했다.이를 통해 중소 비즈니스 파트너사들이 겪고 있는 재정 부담이 줄어들고, 국내 경제 활성화에 기여할 것으로 기대된다.SK텔레콤은 중소 비즈니스 파트너사들과 함께 성장하기 위해 ▲동반성장펀드 ▲산업 혁신 컨설팅 ▲비즈니스 파트너사 온라인 채용관 운영 등 다양한 상생 프로그램을 지속 운영하고 있다.



동반성장펀드는 SK텔레콤이 기금을 출연해 은행에 예치하면 예치금에 대한 이자를 활용해 비즈니스 파트너사의 대출 금리 인하와 긴급 자금 대출을 지원하는 방식으로 운영된다.특히 SK텔레콤은 최근 급격한 경기 하락과 금리인상 등으로 재무 부담이 커진 파트너사들의 재무 부담 경감에 도움을 주기 위해 우수협력사 대출 이자 지원 금리폭도 기존 보다 0.93%p 상향해 운영하고 있다.또한 SK텔레콤은 비즈니스 파트너사와 지속적으로 함께 성장하기 위해 ESG 경영진단과 개선 프로그램을 무상으로 제공하고, 중대재해 예방을 위한 실천 방안 등 경영 현안 해결에 도움을 줄 수 있는 컨설팅도 제공하고 있다.김진원 SK텔레콤 CFO는 “급변하는 경영 환경에서 최고의 서비스를 제공하기 위해 노력하는 비즈니스 파트너사들에게 실질적인 도움을 주기 위해 명절을 앞두고 대금 조기 지급을 결정했다""며 ""앞으로도 함께 성장할 수 있는 생태계를 만드는데 앞장서겠다”고 말했다.",105,https://n.news.naver.com/mnews/article/092/0002279680?sid=103
"""자살예방게임 투자부터 홍보까지 도왔죠""...스마일게이트가 인디게임 키우는 이유는",2023.01.15. 오전 9:01,"스마일게이트, 자회사 세워 인디게임 지원자살예방게임 '30일' 대한민국 게임대상에서 수상""돈 안 돼도 개발자 창의성·사회적 가치 중시""



스마일게이트 스토브의 인디게임 지원 제도로 탄생한 더브릭스의 자살예방게임 '30일' 플레이 장면. 30일 캡처#. 지난해 11월 부산 벡스코(BEXCO)에서 열린 대한민국 게임대상에는 자살예방게임 '30일'을 만든 더브릭스의 이혜린 대표가 수상대에 올랐다. 게임을 전공한 이 대표는 대형 게임사 입사 대신 사회적 가치를 지닌 게임을 만들겠다는 생각으로 창업을 했다. 꼬박 2년이 걸려 2021년 자살예방게임을 세상에 내놨고, 대한민국 게임대상 굿게임상을 받았다.#. 한국에서 알아주는 대형 게임사에 다녔던 양성현 캣도어즈 대표. 지금은 '귀여움'과 '호기심'이라는 키워드로 게임을 만드는 인디게임 개발사 대표다. 높은 연봉을 뒤로한 채 대형 게임사를 박차고 나온 이유는 단 하나. ""내가 개발하고 싶은 게임을 만들고 싶다""는 열정 때문이다. 캣도어즈의 작품 블랙 아카데미는 글로벌 1위 플랫폼 스팀을 통해 공급되며 세계 시장에 도전장을 냈다.지난달 29일 만난 두 사람의 이야기는 언뜻 보기엔 젊은 게임 개발자들의 열정이 돋보이는 도전기처럼 들렸다.  하지만 이들에겐 또 다른 공통점이 있다. 국내 대형 게임사 스마일게이트의 도움 속에 성장한 '인디게임 회사'라는 점이다. 인디게임은 당장의 상업성은 떨어져도 게임의 사회적 의미와 개발자의 창의성이 크다는 특징을 지닌다. 제대로 된 시장 규모를 평가하기에도 미비한 수준이다. 2021년 사상 첫 1조 원대 매출액에 진입한 스마일게이트는 2016년부터 자회사 '스토브'를 설립해 인디게임 육성에 나섰다. 또 국내 게임사로는 유일하게 인디게임 전용 유통 플랫폼인 '스토브인디'도 운영하고 있다. 스마일게이트는 왜 당장 돈도 안 되는 인디게임 키우기에 나선 걸까.""인디게임 키우는 것이 미래에 대한 투자""



한영운 스마일게이트 스토브 대표는 인디게임 육성 이유로 게임업계 상생과 미래 먹거리 확보를 강조했다. 스마일게이트 제공한영운 스토브 대표는 인디게임을 키우는 이유를 두고 ①게임업계 상생과 ②미래 가치에 대한 투자라고 설명했다. 대형 게임사로서의 사회적 역할은 물론, 스마일게이트의 파트너로 인디게임을 발굴·육성한다는 설명이다. 게임사로 보내는 예산 규모는 기간과 작품 규모에 따라 다양하지만, 기본적으로 투자 유치부터 게임 제작, 유통, 홍보까지 스토브가 든든하게 버팀목 역할을 한다.한 대표는 ""과거 스마일게이트도 작은 벤처 게임사에서 시작했다""면서 ""게임을 만드는 각각의 단계에서 어떤 지원이 필요한지 잘 알고 있어 효과적으로 인디게임을 지원할 수 있다""고 강조했다. 그는 또 ""게임 개발자의 창의성을 살리고 유망한 게임사와 함께 생존하는 것이 스마일게이트의 미래 성장 동력이 될 수 있다""고 설명했다. 초기 투자와 유통을 도운 인디게임이 성공하면 스마일게이트의 발전에 도움이 된다는 뜻이다. 인디게임에 담긴 사회적 의미에도 주목하고 있다. 더브릭스의 '30일'은 고시원 총무가 자살하려는 사람들의 신호를 읽고 그 죽음을 막아내는 스토리다. 이용자가 어떤 선택을 하느냐에 따라 결론은 달라진다. 캣도어즈 게임 '블랙 아카데미'는 과도한 야근, 직장 내 사적 심부름 등 캐릭터가 겪는 다양한 고충을 게임 속에서 해결한다. 한 대표는 ""인디게임은 단순한 오락이 아니라 사회적 메시지를 던질 수 있다는 점이 중요하다""고 말했다.""자금 유치·게임 유통 도움 받아""



이혜린 더브릭스 대표는 게임을 통해 자살예방이라는 사회적 메시지를 던졌다. 인디게임은 개발자의 창의성과 사회적 가치를 중시하는 게임이다. 스마일게이트 제공스마일게이트의 인디게임 육성 정책은 인디게임 저변이 넓어지는 데 있어 성과를 내고 있다. 이혜린 대표는 ""자살 사망자의 92%는 미리 신호를 보낸다""면서 ""게임으로 자살 징후를 배우면 사회 문제 해결에 보탬이 된다고 생각했다""고 말했다. 그러면서 ""아이디어는 자신 있었지만 자금을 구하는 게 어려웠다""며 ""스토브의 인디게임 지원책으로 활로를 뚫고 게임 개발을 마칠 수 있었다""고 덧붙였다. 이 대표는 환경보호를 테마로 한 또 다른 인디게임을 준비하고 있다.양성현 대표는 ""스토브를 통해 게임의 완성도를 높였다""고 평가했다. 그는 ""개발 과정에서 작은 개발사의 힘으로는 하기 어려운 여러 테스트를 지원받아 많은 오류를 잡아냈다""며 ""게임이 나온 뒤엔 이벤트 페이지도 만들어 주고 각종 심의에 필요한 비용도 지원해 줬다""고 전했다. 한 대표는 ""게임의 성공은 개발자들의 창의성이 얼마나 뒷받침받느냐에 달려 있다""며 ""겉보기식 지원이 아니라 꼭 필요한 도움을 주려고 노력한다""고 강조했다. ""인디게임사와 함께 세계시장 진출 추진""



양성현(왼쪽) 캣도어즈 대표와 김현석 더블에이게임즈 대표. 두 사람은 스마일게이트의 인디게임 육성제도가 개발자의 창의성을 구현하는 데 도움이 된다고 말했다. 사진=송주용 기자스토브는 게임 유통 플랫폼 스토브의 글로벌 진출도 준비하고 있다. 스토브 안에 인디게임 전용관이 들어 있는 만큼, 스토브가 글로벌에서 성과를 내면 세계무대에서 국내 인디게임의 경쟁력도 높아질 수 있다. 한 대표는 ""스토브 글로벌 도전을 염두에 두고 인재 영입과 서비스 개발을 진행 중""이라고 밝혔다.물론 이때도 인디게임과의 상생은 핵심 키워드다. 세계 게임 플랫폼 시장을 장악하고 있는 스팀과 경쟁하기 위한 생존 전략이기도 하다. 한 차례 게임사를 운영하다 실패했지만 재기했다는 김현석 더블에이게임즈 대표는 ""스토브는 스팀보다 수수료가 절반 정도밖에 안 될 정도로 저렴하다""며 ""한글화 작업이나 영업 부분에서도 스토브가 신경을 많이 쓴다""고 평가했다. 한 대표는 ""좋은 지식재산권(IP)을 보유한 국내 인디게임사들이 더 넓은 곳에서 활약할 수 있게 역할을 하겠다""고 다짐했다.",105,https://n.news.naver.com/mnews/article/469/0000718357?sid=103
"카카오, 경영 정상화 박차",2023.01.15. 오후 4:30,"카톡 업데이트·기능 다양화카카오엔터도 IP사업 속도카카오가 지난해 10월 발생한 서비스 장애 사태의 수습을 마무리하고 경영 정상화에 나섰다. 올해 초 비상대책위원회를 해산한 뒤 조직 재정비와 서비스 개편 작업에 속도를 내고 있다. 계열사인 카카오엔터테인먼트는 대규모 해외 투자 유치에 성공하면서 국내를 넘어 글로벌 시장에서 사업 외연을 확장할 채비를 마쳤다.우선 '카톡 먹통' 사태의 진원지인 카카오톡 서비스를 업데이트하며 다양한 기능을 선보였다.지난 11일 '톡 메시지 통합 검색'과 '쇼핑 검색' 등을 추가해 검색 기능을 강화했다. 또 13일엔 카카오톡 앱을 실행한 상태에서 휴대전화를 두 번 흔들면 '선물함'에 바로 접속할 수 있는 기능도 선보였다.카카오의 해외 시장 진출 전략의 선봉에 있는 핵심 계열사 카카오엔터테인먼트는 최근 '빈살만 펀드'로 알려진 사우디아라비아 국부펀드(PIF)와 싱가포르투자청으로부터 1조2000억원 규모의 투자를 받았다. 조 단위의 대규모 해외투자 유치는 국내 엔터테인먼트 업계에서 이번이 처음으로, 유치한 투자금의 절반을 글로벌 사업을 강화하는 데 투입한다는 방침이다.카카오는 지난 2일 서비스 장애 사태 대응을 위해 운영해 온 비대위를 해체했다. 비대위 출범 79일 만이다. 지난해 12월 사고 원인과 재발 방지 대책을 발표하고, 피해 보상안까지 내놓으면서 비대위가 역할을 다했다고 판단했기 때문이다. 경영 정상화에 본격적으로 나서겠다는 의미다.카카오는 비대위 해산과 동시에 조직 재정비에 나섰다. 서비스 장애 재발 방지와 이용자 신뢰 회복을 위해서다. 이를 위해 카카오는 인프라 운영을 담당하던 인프라실을 '인프라 부문'으로 격상하고 대표이사(CEO) 직속 조직으로 편성했다. 초대 인프라 부문장으로 고우찬 카카오엔터프라이즈 최고클라우드책임자(COO)가 선임됐다.",105,https://n.news.naver.com/mnews/article/009/0005074811?sid=103
P2E 게임 제동 건 법원... NFT도 '경품'으로 해석,2023.01.15. 오후 12:46,"스카이피플 파이브스타즈게임을 즐기며 돈을 버는 '플레이투언(P2E)' 게임 국내 서비스가 결국 법원으로부터 제동이 걸렸다. 게임물관리위원회의 등급분류 거부 처분이 합당하다는 판결이 나옴에 따라 한시적 유예를 받은 게임물도 서비스를 곧 종료할 것으로 예상된다. 글로벌 진출을 선택한 국내 개발사의 주요 P2E 신작 역시 국내 시장 출시는 사실상 물건너갔다는 분석이다.서울행정법원 행정4부(김정중 부장판사)는 스카이피플이 게임물관리위원회를 상대로 낸 등급분류 거부 처분 취소 청구 소송을 기각했다. 소송비용도 원고인 스카이피플이 부담하도록 했다.이번 소송은 P2E 게임 국내 허용 여부를 판단한 첫 법원 판결로 주목을 받았다. 김앤장 법률사무소가 원고 스카이피플 소송대리를 맡았다.스카이피플은 모바일 역할수행게임(RPG) '파이브스타즈' 이용자가 게임 플레이로 지급받은 대체불가능토큰(NFT)을 오픈씨 등 외부 거래 플랫폼에서 거래하는 것이 다른 게임의 아이템 현금거래와 다를 바 없다는 요지의 주장을 거듭했다. 게임 운영상 직접적으로 사행성을 조장하지 않는다는 의미다.



오픈씨에서 거래되고 있는 파이브스타즈 NFT반면에 게임위는 파이브스타즈 속 NFT가 게임산업진흥에 관한 법률에서 금지하는 점수보관증과 유사한 경품이라는 점을 지목했다. NFT가 코인으로 유통·거래돼 현금화될 수 있는만큼 확률형 캐릭터 뽑기나 자동사냥 기능 등에 존재하는 우연성이 결합해 사행성을 조장할 수 있어 그 유통을 막는 것이 적법하다는 논지다.게임위 소송 대리를 맡은 이철우 변호사는 “파이브스타즈는 '미네랄 코인'이라는 가상자산 프로젝트의 일환으로 개발된 게임”이라면서 “게임에서 나오는 NFT가 미네랄 코인으로 유통되도록 게임사가 적극 유도해온 부분을 법원에서 고려한 것으로 보인다”고 말했다.게임 내용을 넘어 NFT가 코인 생태계 일부로 기능한 부분이 게임산업법 제28조 제2의2호에서 금지하는 '게임물의 내용구현과 밀접한 관련이 있는 운영방식을 통해 사행성을 조장하는 행위'로 보았을 가능성이 높다는 분석이다.스카이피플은 차후 판결물을 송달받은 이후 항소 여부 등 추가 대응을 논의할 방침이다. 다만 현재 구글플레이와 애플 앱스토어에서 유통 중인 파이브스타즈 국내 서비스 종료는 불가피하다. 파이브스타즈는 국내 소송 여부와 별개로 상반기 중 글로벌 출시 예정이다.스카이피플 관계자는 “웹3.0 시대에 사용자의 데이터 주권은 보장받아야 하는 권리인데 이번 판결로 인해 다른 국가에 비해 시발점이 상당히 늦춰지게 돼 안타깝다”면서 “판결문이 나온 이후 추가 대응을 준비하고, 국내 이용자 보호를 위해 힘쓸 것”이라고 말했다.",105,https://n.news.naver.com/mnews/article/030/0003072651?sid=103
"SKT, 설 앞두고 '상생 경영'…협력사에 1100억 대금 조기지급",2023.01.15. 오후 1:00,"SK텔레콤은 설날 연휴 시작 전 정보통신기술(ICT) 사업 협력사에 약 1100억원 규모 대금을 조기 지급한다고 15일 밝혔다. 중소 협력사들이 겪는 재정 부담을 줄이고, 이를 통해 경제 활성화에 기여한다는 목적이다. SK텔레콤으로부터 자금을 받는 중소 협력사는 SK브로드밴드와 SK스토아 등 ICT 패밀리기업이 될 전망이다.SK텔레콤은 그간 중소 협력사들과 함께 성장하기 위해 동반성장펀드를 운용해오고 있다. 이 펀드는 SK텔레콤이 기금을 출연해 은행에 예치하면, 예치금에 대한 이자를 활용해 중소 협력사들의 대출 금리 인하 등을 지원하는데 쓰인다.이와 함께 SK텔레콤은 협력사에 ESG(환경·사회·지배구조) 경영진단과 개선 프로그램을 무상 제공하고 있다. 동반 성장을 위해 인재 채용에 어려움을 겪는 협력사를 위해 온라인 채용도 돕는 중이다. 채용 사이트 내 'SKT 비즈 파트너 채용관'을 열어 채용 과정에 필요한 정보 제공은 물론 일부 비용을 지원하고 있다.김진원 SK텔레콤 최고재무책임자(CFO)는 ""급변하는 경영 환경에서 최고의 서비스를 제공하기 위해 노력하는 협력사들에 실질적인 도움을 주기 위해 대금 조기 지급을 결정했다""며 ""앞으로도 함께 성장할 수 있는 생태계를 만드는 데 앞장서겠다""고 밝혔다.",105,https://n.news.naver.com/mnews/article/008/0004840372?sid=103
