title,date,main,section,url
"[추석에 뭐 보지] ⓛ 케이블, 맛깔나게 차려낸 지역 콘텐츠 한 상",2021.09.18. 오전 10:01,"실시간 우리 지역 교통상황 부터 SF 대작까지…'볼거리 풍성'추석에도 계속되는 '거리두기'로 인해 무료한 집콕족을 위해 케이블TV가 다양한 특집 프로그램을 마련했다.한국케이블TV방송협회(회장 이래운)는 추석 연휴를 맞아 전통시장 먹거리, 지역민 노래자랑, 예능 등 온가족이 한 곳에 둘러 앉아 즐길 수 있는 다채로운 프로그램을 준비했다고 발표했다.이래운 케이블TV방송협회장은 ""고향을 찾지 못하는 시청자에게는 고향의 추억을 끄집어 낼 수 있고, 고향을 찾은 가족들에게는 가슴 따뜻하고 건강한 웃음을 줄 수 있는 추석 특집 프로그램을 준비했다""며 ""거리두기를 지키고 케이블TV와 함께 즐거운 명절이 되시길 기원한다""고 말했다.



케이블이 추석을 맞아 특집 프로그램을 편성한다.  [사진=케이블협회]◆ LG헬로비전 지역 특산물로 차려내는 풍성한 특집LG헬로비전 (대표 송구영)은 지역 특산물 한 끼 밥상부터 오리지널 예능까지 시청자의 오감을 만족 시킬 특집 프로그램을 선보인다.전국 각지의 특산물로 다채로운 요리를 선보이는 '팔도밥상 플러스'는 전라남도 진도를 찾는다. 팔도밥상 원정대는 '보배섬' 진도에서 명절에 가족들이 함께 즐길 수 있는 특별한 밥상 레시피를 공개한다. 이원일, 오세득 셰프는 진도 한우를 활용해 해물찜, 파스타 등 다양한 요리를 선보인다.남은 명절 음식으로 만드는 이색 요리를 통해 시청자들에게 소소한 요리 꿀팁도 제공한다. 추석 특집 '팔도밥상 플러스'는 21일 오후 5시, 9시에 시청자를 찾아간다.추석 집콕족을 위한 인기 프로그램 몰아보기도 마련했다. 지역 메이크오버 프로그램 '우리동네 클라쓰' 이색 캠핑 버라이어티 '호동’s 캠핑존-골라자봐' 노래 실력자 발굴 프로젝트 '장윤정의 도장깨기' 몰아보기 스페셜을 방송한다. LG헬로비전 지역채널의 오리지널프로그램 정주행은 20일 부터 22일 까지 매일 오전 10시부터 오후 3시에 방송한다.



LG헬로비전 팔도밥상 플러스 [사진=케이블협회]◆ SKB 도로 교통상황·선별검사소 등 실시간 지역 뉴스SK브로드밴드 (대표 최진환)은 연휴 기간 필요한 정보, 지역별 볼거리와 먹거리를 전하는 추석 특집을 선보인다. 명절 분위기를 한껏 고취시키는 '스페셜 추석' 스테이션 ID 영상도 22일까지 편성한다.먼저 Btv 케이블 지역채널 뉴스를 통해 ▲ 도로 교통상황 ▲ 코로나 선별검사소 운영계획 ▲ 빅데이터로 본 언택트 관광지 ▲ 추석 연휴에 가볼만한 내 고향 문화체험 ▲ 재래시장 재난지원금 사용법 등 전국 연휴 풍경을 생생하게 전달한다.우리동네 B tv 전 권역에서는 온 가족이 둘러앉아 볼 수 있는 즐거운 프로그램들이 찾아간다. 경기 권역은 한국 신화를 소개하는 '우리 신 이야기'를 20일 오후 5시에 편성한다. 세종 권역은 세종 전통시장인과 함께 특별한 전을 만드는 '시장한끼'를 26일 오후 7시 30분에 방송한다. 부산 권역은 한식 명인의 부산향토음식 요리과정을 소개하며 한식 문화를 조명하는 '명인의 향신료'를 20일 오후 1시에 편성한다.지역 경제 활성화를 위한 프로그램도 특집 편성한다. 경기 권역은 경기 지역의 전통시장과 동네상가 점포를 셀프 홍보하는 '동네마켓 어서오세요'를 12일 정오에 편성한다. 전주 권역은 남부시장의 콩나물국밥과 순대국밥 기행을 통해 뚝배기 한 그릇에 담긴 재래시장의 맛과 정을 알리는 '전라도 밥상'을 20일 오전 11시에 편성한다.



SKB 시장한끼 [사진=케이블협회]◆ 딜라이브OTT방송 지역 주민 잔치 '청춘노래자랑' '하춘화 BIG SHOW'딜라이브OTT방송(대표 전용주)은 지역 주민들의 노래 실력 뽐내기를 통해 시청자도 함께 따라 부르며 다 같이 즐기는 음악 한마당을 준비했다.딜라이브는 중장년층 시청자들을 위한 자체제작 주민 참여형 음악 프로그램 '착한콘서트' '청춘노래자랑 연말결선' '청춘스튜디오' '청춘음악회 하춘화 BIG SHOW'를 방송한다. 특히 시청률이 높은 회차 위주로 온 가족이 함께 시청할 수 있는 오후 시간대와 저녁시간대인 오후1시 30분, 3시 30분, 9시 30분에 특집 편성한다.SF 대작 드라마 '프로젝트 블루북2'도 특집 편성한다. 미 공군의 지원 하에 천재 물리학자 박사와 미공군 대위가 함께 UFO가 발견된 곳으로 직접 찾아가 과학적인 시각으로 현상의 진위 여부를 조사하게 되는 이야기다. 18일부터 22일까지 매일 2회분이 22시에 연속 방송된다.



딜라이브 청춘스튜디오 [사진=케이블협회]◆ CMB 올림픽 영웅과의 대담부터 사람 냄새 물씬 나는 동네열전까지CMB(대표 이한담)은 도쿄 올림픽 펜싱 여자 에페 단체전 은메달리스트 강영미 선수와의 대담부터 지역 각계각층 대표 인사들의 추석 인사 나눔까지 사람 냄새 물씬 풍기는 특집 프로그램을 준비했다.CMB 대전·세종·충청방송은 17일부터 아파트 입주자 대표 등 우리 지역의 각계각층을 대표하는 인사들이 지역민들에게 전하는 추석 인사 나눔의 장을 마련한다.CMB 광주·전남방송은 18일 '추석특집 牛리 먹거리'를 특집 편성해 전라남도의 명물 전남한우를 홍보하고, 한우 농가의 고충과 우리 먹거리의 소중함을 시청자들에게 전달한다. 22일에는 '주정민의 스페셜토크'를 통해 광주 출신의 2020 도쿄올림픽 펜싱 은메달리스트 강영미 선수를 초청해 올림픽 비하인드 스토리를 들을 시간을 가질 계획이다.CMB 대구방송은 18일 오전 8시 30분부터 '미식탐방대' '열전 동네방네' '차 향기 좋은날'을 추석 특집으로 편성해 코로나 19로 침체된 분위기 속에서도 추석 연휴를 맞이한 지역민에게 잠시간의 여유와 힐링의 시간을 제공한다.



CMB 주정민의 스페셜토크 [사진=케이블협회]◆ 현대HCN 시사 특집 편성 '우리 지역 현안 제대로 알기'현대HCN(대표 류성택)은 대규모 모임 대신 가정에서 명절을 보내는 지역민들을 위해 기존 예능 특집보다는 시사 특집 편성에 집중해 우리 지역의 현안들을 짚어보고 고민해보는 시간을 준비했다.현대HCN경북방송의 간판 시사프로그램 '장효수의 파워인터뷰'는 '경북동해안 이슈돋보기'를 특집으로 방송한다. 집중호우와 재래시장 화재 등 최근, 잇따라 발생한 재난상황을 지역 취재 기자들이 심층 취재하고 남은 과제들을 조명하는 등 의미 있는 시간을 마련한다.현대HCN금호방송과 세로넷방송은 지역민들에게 노래를 배울 수 있는 기회와 실력을 뽐낼 무대를 제공하는 '보컬의 탄생'을 방송한다. 한가위를 맞아 출연자들이 한국 전통 민요인 '진도아리랑'을 배우고, 한가위 3행시, 댄스, 개인기 대결 등을 하면서 온 가족이 함께 즐길 수 있는 코너를 마련한다.6070 세대의 인생을 들여다보며 세월의 희로애락과 감성을 느끼는 '청춘캠프'는 대구북구노인복지관을 찾는다. 복지관 노인들과 제기차기, 투호던지기 등 전통놀이와 각종 전통음식을 즐기며 추석과 관련된 이야기를 나누는 시간을 갖는다.



헌대HCN 청춘캠프 [사진=케이블협회]◆ 서경방송 진주의 역사와 예술 다시 보기서경방송(대표 윤철지)은 연휴 첫날인 18일부터 23일까지 SCS문화초대석 '진주검무- 무검편증미인'을 방송한다. 진주의 영혼이 담긴 검무를 통해 진주역사의 다양한 스토리를 보여주고 고향의 예술혼을 느끼보는 시간을 마련한다.이밖에도 SCS 열린광장을 통해 최근 지자체별로 유치에 한창인 유엔기후변화협약 당사국총회인 COP28 지역유치를 위한 필요성에 대해 특집토론도 펼친다.



서경방송 SCS문화초대석 [사진=케이블협회]◆ JCN울산방송 전통시장 한 바퀴 '울산을 만나다'JCN울산방송(대표 구자형)은 가수 겸 MC인 이경이 진행하는 '로드기행 울산을 만나다'를 18일 오전 10시 30분에 방영한다. 방송분은 추석을 맞아 전통시장 및 상가를 돌아보고 지난 회차 하이라이트 편을 엮은 특집편이다. 20일에는 토크쇼 '밥 한끼 합시다'가 방영된다. 경쟁과 대립을 상생과 협의로 이끌어내는 토크쇼로 각 분야별 지역 인사와 소상공인 음식점이 주 무대가 돼 맛있는 토크 한판을 이끌어 낸다.



JCN울산방송 로드기행_울산을 만나다 [사진=케이블협회]",105,https://n.news.naver.com/mnews/article/031/0000624995?sid=103
미래 달에선 'AI 광부 로봇'들이 떼지어 자원을 캔다?,2021.09.18. 오후 3:18,"[경향신문] 



미래 달 광산 상상도. 인공지능(AI)을 지닌 자율 로봇들이 광물을 캐거나 옮기며 분주히 움직이고 있다. 미국 애리조나대 제공미래의 달 표면에서는 로봇이 떼지어 광산에서 자원을 캐는 모습을 볼 수 있을 가능성이 커졌다. 미국 과학계가 스스로 생각해 움직이는 인공지능(AI) 로봇을 달 자원 채굴에 집단적으로 투입하기 위한 연구에 나섰다.이달 중순 인셉티브 마인드 등 외신은 스스로 생각해 움직이는 자율 로봇 여러 대를 개발하려는 미국 애리조나대 과학자들에게 미국항공우주국(NASA)이 초기 연구비 50만달러(약 5억9000만원)를 지원했다고 전했다.애리조나대의 연구는 현재 미국이 주도해 한국 등 12개국이 참여하는 ‘아르테미스 계획’과 깊이 연관돼 있다. 아르테미스 계획은 2024년까지 사람을 달에 다시 보내고, 2028년부터는 사람이 항상 머무는 상주 기지를 운영하는 것이 목표다. 상주 기지를 지으려는 가장 큰 이유는 달에 오랜 기간을 두고 캐낼 가치 있는 자원이 많기 때문이다. 달 표면에는 핵융합 발전의 원료로 쓸 수 있는 물질인 ‘헬륨3’가 다량 존재한다. 헬륨3 1g은 무려 석탄 40t과 비슷한 에너지를 내는데, 달에 묻혀 있을 것으로 추정되는 헬륨3는 무려 100만t에 이른다.달에는 ‘희토류’도 풍부하다. 희토류는 네오디뮴 등 17개 원소를 지칭한다. 태양광 발전장비나 고강도 합금, 첨단 전자기기 등을 만들려면 반드시 필요한 산업계의 ‘비타민’ 같은 물질인데, 지구에선 중국이 세계 공급망을 장악하고 있다. 이외에도 티타늄이나 백금 등 귀한 금속이 달에는 많다. 달에서 광산을 개척하는 일은 기존의 자원 공급 체계를 완전히 재편할 ‘사건’인 것이다.   자원을 캐기 위해 상주 기지를 만들려면 달 표면에 건설 자재를 갖다 놔야 한다. 하지만 고도 수백㎞에 불과한 지구 저궤도에 물체를 올리는 데에도 1㎏당 로켓 발사 비용이 보통 수천만원씩 들어간다. 달까지 건설 자재를 운송하는 데에는 더 많은 비용을 써야 한다. 달 표면에서 콘크리트와 유사한 성질을 지닌 물질을 캐낸 뒤 기지 건설에 바로 쓰는 게 효율적이라는 뜻이다.애리조나대 연구진은 달에서 자원을 캐내는 것은 물론 건설 자재가 될 만한 물질을 발굴해 기지 건설 작업도 병행하는 로봇을 만들겠다는 계획을 세웠다. 특히 이런 로봇을 한두대가 아닌 떼지어 운영할 수 있을 정도로 많이 만들 예정이다. 연구진은 사람 통제 없이 알아서 움직일 수 있도록 로봇들에 자율 운동 기능을 부여하는 것이 궁극적인 목표라고 밝혔다.자율 운동 능력을 로봇들에게 주기 위한 핵심 기술은 AI이다. AI를 통해서 로봇들이 인간과 함께 채굴이나 건설 작업에 참여하고, 로봇들 간에 협업 능력도 향상시킬 수 있을 것으로 연구진은 기대했다. 다만 현실적인 기술 수준을 감안할 때 로봇의 형태는 사람의 외모를 닮은 이족보행형 ‘안드로이드’보다는 바퀴를 굴려 움직이는 자동차와 비슷할 것으로 보인다. 연구진을 이끄는 제칸 산가 애리조나대 교수는 “로봇 떼가 더럽고, 위험한 일을 하는 동안 우주비행사들은 더 흥미롭고 의미 있는 일에 몰두할 수 있을 것”이라고 말했다.",105,https://n.news.naver.com/mnews/article/032/0003099057?sid=103
"A형 간염환자, 전년 동기간 대비 2배 이상 증가",2021.09.18. 오전 5:01,"30~40대 환자 많고, 수도권 및 충청지역 발생 높아…조개류 등 음식 익혀 섭취해야A형 간염환자가 전년 동기간 대비 2배 이상 증가한 것으로 나타나 주의가 필요하다.질병관리청에 따르면 2021년 11주(3.7~3.13) 이후 주당 100명 이상의 환자가 지속적으로 신고되면서 2020년 동기간과 비교해 2배 이상의 환자가 신고 됐다. 특히 30주(7.18~7.24.) 이후부터는 2019년 대규모 유행을 제외하고는 2011년 이후 가장 많은 환자가 보고되고 있다.



′21년 연령별 A형간염 신고 현황(그래픽=질병관리청)올해 상반기에 경기‧서울‧인천 등 수도권(경기 1천868명, 서울 1천44명, 인천 416명)의 발생이 많았던 반면, 최근엔 충남(326명)과 충북(175명) 등 충청지역에서 환자 발생이 증가하고 있다. 인구 10만 명당 신고건수는 충남(15.3명), 경기(14.2명), 인천(14.1명), 제주(13.5명), 충북(10.9명), 서울(10.7명) 순이다.올해 신고된 환자는 30~49세에 집중돼 있다. 이는 1970년 이후 태어난 사람들은  위생상태 개선으로 어린 시절 A형간염 바이러스 노출 기회가 적었고, 예방접종도 받지 않아 A형간염에 대한 면역이 없기 때문으로 추정된다.



연령별 A형간염 항체 양성률(그래픽=질병관리청)연령별로 보면 40대 1천834명(39.1%), 30대 1천375명(29.3%), 50대 670명(14.3%), 20대 457명(9.7%), 기타 연령 354명(7.5%) 순이었다.A형 간염은 오염된 물이나 식품으로 전파되는 감염병으로, 예방을 위해서는 음식은 충분한 온도에서 조리하여 익혀먹고, 위생적인 조리과정을 준수하며, 채소‧과일은 깨끗이 씻거나 껍질을 벗겨먹는 등 위생수칙을 준수해야한다.



a형 간엽(사진=질병관리청 인포그래픽)2질병관리청은 익히지 않은 조개류의 섭취는 A형 간염 감염의 위험성이 있어 예방을 위해 조개류는 반드시 90℃ 이상에서 4분 이상 충분히 익혀 섭취할 것을 권고했다. 바지락과 같은 껍데기가 두개인 조개류(이매패류(二枚貝類))의 소화기관 (중장선(中腸腺))에는 A형간염 바이러스가 농축될 수 있다.또 A형 간염은 백신접종으로 예방 가능해 특히 항체보유율이 낮은 20~40대는 예방접종을 받을 것을 권고했다.질병관리청 정은경 청장은 “올해 A형간염 환자가 지속적으로 발생하고 있어 조개류는 반드시 익혀먹고, 20-40대는 예방접종을 받는 등 A형간염 예방수칙을 잘 지켜줄 것”을 당부했다.< A형간염 예방수칙 >  조개류 익혀먹기 안전한 물 마시기 요리 전, 식사 전, 용변 후 비누로 30초 이상 손씻기 채소나 과일은 깨끗이 씻어 껍질 벗겨 먹기 20~40대는 예방접종 받기 최근 2주 이내에 A형간염 환자와 접촉한 사람은 예방접종 받기",105,https://n.news.naver.com/mnews/article/092/0002234126?sid=103
"[언택트 추석] 집콕족, 콘텐츠 파티할래?…IPTV·OTT 한 상 가득",2021.09.18. 오전 8:05,"[디지털데일리 박세아 기자] 민족대명절 추석이 18일부터 22일까지 5일간 이어진다. 코로나19가 발생하고 1년6개월간 시간을 보내는 동안 맞이한 2번째 추석이다. 여전히 주요 도시가 사회적 거리두기 4단계를 유지하고 있는 상황에서 이번 연휴에도 어쩌면 귀성길에 오르는 사람들보단 집콕족들이 많을 예정이다. 이런 상황에서 통신3사와 동영상스트리밍서비스(OTT) 업체는 풍성한 볼거리를 한 상 차려냈다.    KT는 인터넷TV(올레tv) 추석 이벤트를 진행한다. 이번 추석에는 특별히 특선 영화나 예능을 더해 올레 tv에서 제공하는 게임 포털 뷰플레이, 음악 서비스 뮤즈 등도 함께 마련했다. 뷰플레이를 통해 1인 미디어 게임 콘텐츠를 총 망라해 인터넷TV(IPTV)에서 보는 게임을 즐길 수 있다. 뮤즈에서는 인기 뮤직비디오와 비대면 공연 등 각종 콘서트 실황을 감상할 수 있는 뮤즈 콘서트 전용관을 열어 기념 이벤트를 진행한다. 17일부터 23일까지 한가위 특집관에서는 씽크홀 랑종 등 최신 영화 20여편을 감상할 수 있다. 이외에도 올레tv 디즈니 특집관에서 블랙위도우 루카 등 소장용 영화 90여편을 제공한다. 핑크퐁 뽀로로 등 8종 인기 캐릭터 콘텐츠 총 830여편도 무료 제공한다.     KT OTT 시즌(seezn)은 화제작 랑종과 셔터를 OTT중 가장 먼저 단독 제공한다. 시즌 베이직 월정액 고객은 앱과 웹에서 무료로 이용 가능하다. 복면가왕 슈퍼맨이 돌아왔다 등 예능 프로그램 추석 특집 파일럿 방송과 명작 드라마, 인기 중국 드라마 등을 편성해 제공할 예정이다.   



LG유플러스는 추석 연휴를 맞이해 U+모바일tv에서 트로트 콘텐츠를 전국민에게 무상 개방한다. 고객들은 오는 17일부터 앱 마켓에서 U+모바일tv를 내려 받으면 누구나 통신사 관계없이 내일은 미스터 트롯 Top6와 내일은 미스 트롯 우승자 송가인 무대를 볼 수 있다. 올해 개봉작 더스파이를 비롯해 다양한 최신 영화도 무료로 시청할 수 있도록 할 예정이다. 경품이벤트도 빼놓을수 없다. 기간 내 U+모바일tv에서 추석 특선 무료 콘텐츠를 포함해 일반 VOD를 시청하는 고객은 추첨을 통해 한정판 운동화, 캠핑 용품 등을 받을 수 있다.    지상파 통합OTT 웨이브는 추석 맞이 영화 시청 이벤트를 진행한다. 27일까지 웨이브가 추천하는 영화를 시청한 이용자에게 아이패드 에어4, 신세계상품권 등을 비롯해 경품을 증정한다. 웨이브 가입자가 추천 영화를 1편만 봐도 자동 응모되고, 영화 시청이 많을수록 당첨 확률이 높아진다. 웨이브는 8월 공개한 첫번째 오리지널 드라마 ▲유 레이즈 미 업을 비롯해 ▲가족의 탄생 ▲내 아내의 모든 ▲것 우리는 형제입니다 등을 추천작에 포함시켰다.    CJ ENM 티빙은 씨네마 띵작 릴레이를 통해 20일부터 명작을 시청자에게 선사한다. 이번 릴레이를 통해 공개되는 007 시리즈는 007 살인번호(1965) 부터 007 스펙터(2015)까지 총 25편이다.  또 반지의 제왕 시리즈, 크리스토퍼 놀란 감독 작품 시리즈까지 포함시켰다. 인기 웹툰을 드라마화한 작품 유미의 세포들도 17일 시청자를 사로잡는다.",105,https://n.news.naver.com/mnews/article/138/0002110559?sid=103
중년에 벌써...'조기 발병 알츠하이머' 진단길 열렸다,2023.10.27. 오전 10:27,"강남세브란스병원



조한나 강남세브란스병원 신경과 교수. 병원 제공.   기억력이 감퇴하는 ‘알츠하이머병’은 대체로 65세 이후 증상이 나타난다. 예외적으로 50대에 증상이 시작되는 경우가 있는데, 이를 ‘조기 발병 알츠하이머병’이라고 한다. 이를 초기에 진단할 수 있는 가능성이 열렸다.    강남세브란스병원은 조한나 신경과 교수 연구팀이 미국 샌프란시스코캘리포니아대 연구진과 공동 연구를 통해 진단 정확성을 높이는 방법을 찾았다고 27일 밝혔다.    알츠하이머병은 대부분 노년기에 증상이 시작되지만, 약 10%의 환자는 이보다 일찍 증상이 나타난다. 사회활동이 활발한 50대에 조기 발병 알츠하이머병을 앓게 되면 직업 등에 영향을 미치고 가족 및 사회의 부담이 커진다.    하지만 일반 알츠하이머 대비 조기 발병 알츠하이머는 환자 수가 적고, 비전형적인 증상을 보이는 사례가 많아 초기 진단이 복잡하다. 대규모 임상시험이나 연구 진행에도 어려움이 있다.    연구팀은 이러한 한계를 극복하기 위해 여러 나라의 기관들이 협력해 조기 발병 알츠하이머를 연구하는 ‘LEADS(Longitudinal Early-onset Alzheimer's Disease Study) 프로젝트’를 통해 이 질환의 원인과 진단 향상 방안을 연구했다.    연구팀은 2018~2022년 LEADS 프로젝트에 등록된 321명의 조기 발병 알츠하이머 환자와 87명의 정상인 뇌를 대상으로 아밀로이드와 타우 단백질의 분포 및 농도를 PET 영상으로 조사했다.    그 결과, 조기 발병 알츠하이머 환자는 일반 알츠하이머 환자보다 많은 양의 타우 단백질이 뇌의 광범위한 영역에 분포하고 있다는 점이 확인됐다. 이는 조기 발병 알츠하이머가 임상적으로 더 많은 기능 손상을 유발한다는 의미다.    조 교수는 “이번 연구로 아밀로이드와 타우 PET 영상 검사가 조기 발병 알츠하이머를 초기에 진단하는 데 큰 도움을 줄 수 있다는 사실을 밝혔다”며 “그동안 많은 연구에서 소외되었던 조기 발병 알츠하이머 환자들에게 앞으로 보다 정확한 진단과 치료 전략 및 방향을 제시할 수 있을 것으로 기대한다”고 말했다. 연구 결과는 국제학술지 ‘알츠하이머 & 치매’에 실렸다.",105,https://n.news.naver.com/mnews/article/584/0000024728?sid=103
