title,date,main,section,url
"[종목현미경] ""많이 쉬었다"" 네이버 관심 커지는 이유는?",2021.12.25. 오전 7:05,"9월 당국 규제 이후 박스권…외국인도 '팔자'""내년 강력한 글로벌 모멘텀…관심 필요할때""



사진은 22일 경기도 성남시 네이버 본사 그린팩토리 모습. 2021.7.22/뉴스1 © News1 민경석 기자(서울=뉴스1) 정은지 기자 = 증권가가 최근 박스권에 갇힌 네이버에 대해 커머스, 콘텐츠, 핀테크를 비롯해 글로벌 사업에서 강력한 모멘텀이 발생할 것이라며 긍정적인 시각을 유지했다. 25일 한국거래소에 따르면 12월들어 네이버 주가는 0.7% 상승하는 데 그치며 벤치마크인 코스피 상승률(6.1%)를 크게 밑돌았다. 지난 7월26일 기록한 최고가 46만5000원 대비 17.4% 빠진 수준이다. 네이버 주가는 지난 9월 플랫폼 기업에 대한 당국의 규제 강화 이후 박스권에서 횡보하고 있다. 외국인의 매도세가 네이버 주가를 누르고 있다. 12월들어 전체 종목 중 두번째로 많은 1745억원을 팔았다. 외국인은 '성장주' 대신 삼성전자(2조6125억원), SK하이닉스(6236억원) 등 대형 반도체주를 집중적으로 사들였다.증권가는 주가 조정을 거치고 있는 네이버에 대해 관심을 가질 때라고 조언한다. 커머스와 콘텐츠의 매출 증가세가 지속되는 가운데 글로벌 사업에서의 모멘텀이 발생할 것으로 기대되기 때문이다. 네이버가 제페토 등을 통해 메타버스 생태계를 확장하고 있는 것도 매력적인 요인이다.  이승훈 IBK투자증권 연구원은 ""네이버는 일본 이커머스 시장을 본격적으로 공략하기 위해 4분기부터 일본에서 마이스마트스토어 베타 서비스를 진행중으로 내년 1분기 중에 정식 서비스가 시작될 것""이라며 ""지분법 대상인 Z홀딩스 아래 야후재팬과 라인이 함께 있기 때문에 검색 서비스와 마이스마트스토어와의 시너지가 기대된다""고 밝혔다. 또 ""북미 시장에서 네이버 웹툰과 왓패드의 월간 이용자수가 각각 1400만명과 9400만명을 확보했기 때문에 두 플랫폼 사이의 강력한 시너지가 기대돼 글로벌 확장을 가속화할 것""이라고 덧붙였다.금융정보제공업체인 에프앤가이드에 따르면 올해 4분기 네이버 매출액은 전년 동기 대비 25.6% 증가한 1조9007억원, 영업이익은 21.5% 늘어난 3932억원으로 추정된다. 커머스 매출액 증가는 물론이고 글로벌 시장에서의 웹툰 소비 증가로 콘텐츠 부문이 높은 성장세를 나타낼 것으로 전망된다.이동륜 KB증권 연구원은 ""매출에서 가장 큰 비중을 차지하는 서치플랫폼의 안정적인 성장이 예상된다""며 ""커머스와 핀테크 부문에서는 외부 가맹점과 오프라인 매출 증가가 결제금액 성장을 견인하고 있다""고 설명했다. 네이버 목표주가를 제시한 증권사의 평균 목표주가는 54만7000원이다. 현재 주가(38만4000원) 대비 약 30%의 상승 여력이 있는 수준이다. 3분기 기준 2021원에 그쳤던 주당순이익(EPS)는 4분기 2545원, 내년 1분기 2464원, 내년 2분기 2738원으로 증가할 것으로 예상된다. 정호윤 한국투자증권 연구원은 ""주가는 9월 이후 규제 및 모멘텀 부재 등의 이유로 꾸준히 조정을 받았으나 네이버의 성장성과 메타버스 등 신사업이 순조롭게 커지고 있는 점 등을 감안한다면 조금씩 매수 시기와 가격 등에 대한 고민이 필요하다고 판단한다""며 ""조금씩 관심이 필요할 때""라고 말했다.",105,https://n.news.naver.com/mnews/article/421/0005804850?sid=103
"[김현아의 IT세상읽기] 강남언니, 로톡 쓰는 이유는 품질보다 '편리함'",2021.12.25. 오후 5:11,"전문직역 플랫폼 필요한 이유 1위는 편리함자격자가 전부 제공 안해서 드는 걱정은 기우특정 플랫폼 금지는 잘못된 전략플랫폼화는 대세..독점 보장된 전문가들, IT기업과 협업하길[이데일리 김현아 기자]



 올해 디지털 플랫폼의 화두는 소위 ‘전문직역 플랫폼’을 둘러싼 갈등입니다. 지난해 택시업계와 ‘타다’ 분쟁이 세상을 달궜다면, 올해는 의료, 법률, 세무, 부동산 분야에서 전문직 이해관계자들과 ‘강남언니’, ‘로톡’, ‘삼쩜삼’, ‘직방’ 사이의 갈등이 전면화됐죠.성형 정보를 공개하는 ‘강남언니’는 의료광고 심의 기준 위반 논란에, 중개 수수료 없이 변호사 정보를 안내하는 ‘로톡’은 불법 사무장 논란에 휩싸였습니다. 종합소득세 환급 신고와 세금 환급 정보를 제공하는 ‘삼쩜삼’은 무자격자 세무대리 행위라는 비판을, 비대면으로 부동산을 사고팔 수 있는 ‘직방’은 거대 플랫폼의 골목상권 침해라는 논란에 섰습니다.전문직 협회들 “서비스 접어라” 압박이들에게 서비스를 접으라고 목소리를 높이는 쪽은 대한의사협회, 대한변호사협회, 한국세무사회, 한국공인중개사협회 같은 이해관계자들입니다. 이들은 전문직 시장에는 아예 플랫폼이 들어올 수 없게 해야 한다며 법안을 내기도 합니다. 하지만, 지난해 초 ‘타다금지법’ 처럼 기사와 차량을 함께 빌려주는 특정한 서비스 유형(렌터카 기반 택시호출)을 모빌리티 시장에서 전면 금지시키고 나니 걱정했던 일들이 사라졌을까요?국토부가 밀어붙인 타다금지법의 결과는 어떠했습니까? 국내 모빌리티 시장에서 경쟁은 실종됐고 결국 카카오모빌리티만 남아 독과점을 부추겼다는 기억을 떠올리게 됩니다. 당시 택시업계는 타다 앞에서 시위를 했지만 이후에는 카카오모빌리티로 달려갔죠. 비판 대상이 바뀌었을 뿐입니다.전문직역 플랫폼 필요한 이유 1위는 편리함지난 22일 열린 ‘2021 열린혁신정책플랫폼 성과공유 컨퍼런스’에서는 상당히 의미 있는 연구결과가 발표됐습니다.정보통신정책연구원(KISDI) 박유리 연구위원이 진행한 인터뷰 결과가 공개됐죠. 각 분야에서 일반 이용자 설문조사(1009명) 및 전문직 FGI(포커스그룹 인터뷰)를 진행했는데, 응답자의 74.9%(필요한 편이다 59.9%, 매우 필요하다 15.0%)가 ‘전문직도 플랫폼화가 필요하다’라고 답했습니다.설문 결과, 이용자들이 전문직역 플랫폼이 필요하다고 생각한 이유는 ▲쉽게 이용할 수 있고(44.9%)▲다양한 정보가 공개돼 있다(26.8%)는 점 때문이었습니다. 서비스 가격이 낮아질 것 같아서(15.5%)나 서비스 품질이 향상될 것 같아서(7.5%), 정보의 투명성이 높아질 것 같아서(5.2%)는 후 순위였죠.전문직 서비스 플랫폼이 필요하지 않다고 생각하는 이유 역시 마찬가지였습니다. 쓰지 않는 이유로 ▲현재도 불편하지 않아서(56.1%)▲ 전문직 서비스가 플랫폼에 종속될 것 같아서(14.6%) 순이었죠. 품질이 낮아질 것 같아서(12.2%), 능숙하지 못한 사람은 이용하지 못할 것 같아서(9.8%), 허위 과장 정보 유통이 증가할 것 같아서(7.3%) 등이 뒤를 이었습니다.자격자가 전부 제공 안해서 드는 걱정은 기우되새겨 보면, 법으로 정해진 자격자가 직접 서비스 전부를 제공하는 게 아니어서 불안한 서비스가 될 것이라거나, 플랫폼 간 과당 경쟁으로 가격이 하락해 시장이 파괴될 것이라는 걱정은 플랫폼 이용자들이 체감하는 것과는 사뭇 다르다는 걸 알 수 있습니다. ‘강남언니’, ‘로톡’, ‘삼쩜삼’, ‘직방’ 등을 쓰는 최대 이유는 편리함 때문이고 안 쓰는 이유 역시 현재 불편하지 않아서이지, 협회들 걱정처럼 품질이나 가격 하락은 주요 고려 사항이 아니었습니다.이는 ‘전문직역 플랫폼’의 속성과 관련됩니다. 택시 운전보다 전문적인 의료 행위나 법률 대리인 업무와 관련된 플랫폼이다 보니, 디지털 플랫폼화 돼도 전문직에 대한 의존이 클 수밖에 없죠. ‘로톡’ 서비스의 품질은 편리한 UI(사용자환경)외에도 좋은 변호사들이 광고해야(모여있어야) 좋아집니다.플랫폼화는 거스르기 어려워문득 이런 생각이 듭니다. 전문직역 플랫폼을 쓰지 않는 이유 중 첫 번째가 ‘현재도 불편하지 않아서’라면 디지털 전환이 확산할수록, 디지털에 익숙한 2030 세대가 경제의 중심에 설수록, 전문직역 플랫폼은 대세가 될 수밖에 없지 않을까 하는 점입니다.  그렇다면, 반대하는 협회들은 어떻게 해야 할까요? 연구를 진행한 박유리 연구위원은 “특정 플랫폼을 금지하기 보다는 우려 사항을 보완할 수 있는 합리적인 규제를 마련해야 한다. 서로 협업해 혁신을 촉진해야 한다“고 말했습니다.동의합니다. ‘법으로 독점 시장을 보장받았으니 아무도 들어오면 안 돼’라는 시각보다는 ‘나의 전문성이 고객들에게 더 편리하게 다가갈 수 있도록 IT 기업과 협업하겠다’는 자세를 가진다면 좋겠습니다.그리하면 의료나 법률, 세무, 부동산 서비스의 품질은 더욱 좋아질 것이고, 사회 전체로 보면 좋은 일자리를 더 많이 만들어낼 수 있기 때문입니다.",105,https://n.news.naver.com/mnews/article/018/0005113714?sid=103
전국에 한파…호남·제주에 눈,2021.12.25. 오전 5:01,"성탄절인 오늘은 전국 대부분 지역에 한파특보가 내려진 가운데 강추위가 이어지겠습니다. 낮 최고 기온은 서울 영하 7도, 부산 영상 1도 등 전국이 영하 8도에서 영상 2도로 어제보다 10도에서 14도 정도 낮겠습니다.  오늘은 전국이 대체로 맑겠지만 강원 영동에는 오전까지 최고 30cm의 눈이 내리겠습니다. 호남 서해안에는 오전에 눈이 내리기 시작해 오후에는 호남 내륙으로 확대되겠습니다. 예상 적설량은 호남 서해안이 5에서 15cm, 호남 내륙과 제주도가 3에서 8cm입니다. 충남과 호남 서해안, 영남 해안, 제주도에는 순간최대풍속 초속 20m 이상의 강한 바람이 부는 곳이 있겠습니다. 바다의 물결은 모든 해상에서 2에서 최고 6미터로 높게 일겠고 동해안에는 너울성 파도가 밀려 오는 곳이 있겠습니다. 내일은 전국 대부분 지역의 아침 기온이 영하 15도 이하로 떨어지겠고 충남 서해안과 호남,제주도에는 눈이 내리겠습니다.[사진 출처 : 연합뉴스]",105,https://n.news.naver.com/mnews/article/056/0011182495?sid=103
“AI성우 170개 됐다”…누구나 쓸 수 있는 ‘AI 연기자’ 제공,2021.12.25. 오후 3:11,"김태수 네오사피엔스 대표지난 21일 '2021 타입캐스트 어워즈' 개최가입자수 93만명 돌파..가상 연기자 캐릭터도 170개로 늘어음성 연기자뿐 아니라 비디오 캐릭터도 제공[이데일리 김현아 기자]



김태수 네오사피엔스 대표가 지난 12월 21일 저녁 용산 드래곤시티에서 열린 ‘2021 타입캐스트 어워즈’ 식전 행사에서 기타를 열정적으로 연주하고 있다. (사진=이데일리 김현아 기자)











김태수 네오사피엔스 대표가 2020년 7월 23일 오후 서울 중구 통일로 KG타워에서 열린 ‘AI 코리아대상 2020’에서 과학기술정보통신부 장관상을 받은 뒤 사례발표를 하고 있다.(사진=방인권 기자)



김태수 네오사피엔스 대표가 회사의 올해 성과와 비전에 대해 발표하고 있다. (사진=김현아 기자)“제가 어렸을 때 공부 안 하고 기타 치러 다녔어요.” (웃음)김태수 네오사피엔스 대표가 지난 12월 21일 저녁 용산 서울드래곤시티에서 열린 ‘2021 타입캐스트 어워즈’ 식전 행사에서 기타를 밴드와 함께 열정적으로 연주한 뒤 내뱉은 말이다. 그는 인공지능(AI) 음성합성 스타트업(초기벤처)네오사피엔스의 대표다.그는 ‘텍스트를 입력하면 성우의 음성으로 변환해주는’ 플랫폼 ‘타입캐스트’를 운영하고 있다. 타입캐스트는 많은 유튜버와 콘텐츠 크리에이터들이 사용 중인데, 밀리의 서재와 함께 AI 성우를 이용한 내가 만드는 오디오북을 진행중이기도 하다.또, 하이브 에듀와 함께 BTS의 한국어 학습 패키지인 ‘Learn!KOREAN with TinyTAN’에서 방탄소년단의 목소리를 AI 로 제작하기도 했다. 팬들이 한국어 공부를 하면서 본인이 원하는 멤버의 목소리로 응원을 한다든지 이름을 부른다든지 하는 게 가능한 프로젝트다.이날 타입캐스트 어워즈는 타입캐스트 플랫폼을 이용해 창의적인 영상을 만든 크리에이터들에게 시상이 이뤄졌다. 네오사피엔스는 2020년 이데일리가 주최한 ‘AI코리아 대상’에서 타입캐스트로 과기정통부 장관상을 받기도 했다.



그로부터 1년 반, 얼마나 성장했을까?김태수 대표는 먼저 오디오 비디오 콘텐츠 시장은 계속 발전하고 있다고 했다. 그는 “우리나라의 유튜브 채널은 10만 개가 아직 안 된다”면서 “하지만 네이버 블로그 등 텍스트 기반 채널은 2000만 개 가까이 있다”고 말했다. 그러면서 “텍스트 기반에 비해 오디오나 비디오는 굉장히 만들기 어렵지 않을 까라고 생각할 수 있지만, ‘타입캐스트’를 이용하면 수월하다. 덕분에 2018년 이후 현재 가입자 수가 93만 명을 넘어섰다”고 말했다.또 “다운로드 콘텐츠 시간도 7800시간에서 올해 들어 3만 8000시간으로 5배 정도 성장했고, 가상 연기자 캐릭터도 올초 63개(영어가능 5개)에서 170개(한국어 128개, 가상인간 2종 포함)로 늘었다”고 부연했다.네오사피엔스는 처음에는 AI를 활용해 음성 연기자를 제공했는데, 최근에는 비디오 캐릭터도 출시하고 있다. 그는 “누구나 (아이디어만 있으면) 오디오와 비디오로 고품질의 콘텐츠를 만들 수 있도록 AI 기반 가상 연기자를 제공하도록 하겠다”고 강조했다.한편 네오사피엔스는 텍스트-음성 합성방법 등에 관한 국내 특허 9건, 미국 특허 4건 등을 기반으로 AI 음성 모델링 서비스, 음성 복원 서비스 등을 제공한다. 한편 이날 행사에는 애니메이션 명탐정 코난의 유명한 탐정, 브루스 윌리스 역 외화 더빙으로 유명한 한국 성우계의 원로 이정구 성우와 외화 엑스파일 멀더 역의 이규화 성우도 참석해 자리를 빛냈다.",105,https://n.news.naver.com/mnews/article/018/0005113688?sid=103
"적응증 확대의 대명사, 면역항암제 ‘키트루다’[블록버스터 톺아보기]",2021.12.25. 오전 10:01,"미국 제약사 머크의 3세대 면역항암제 키트루다2020년 매출 약 17조원으로 전체 의약품중 매출 2위16개 암종에서 30개 적응증으로 사용 범위 늘려현재도 30여 개 적응증에 대해 1000여 개 임상 진행 중제넥신, 대웅제약 등도 면역항암제 개발에 도전셀트리온, 2028년경 면역항암제 바이오시밀러 출...[이데일리 김진호 기자]자신이나 가족의 질환 또는 투자 등 목적은 다를 수 있다. 제약바이오에 관심있는 사람이라면 들어봤을 법한 전 세계 블록버스터 약물을 2020년 기준 매출이 높은 순으로 소개한다. 약의 탄생과정부터 그 특징, 비슷한 계열의 경쟁 약물까지 두루 살펴본다.두 번째 주인공은 2020년 기준 143억8000만 달러(당시 한화 약 16조9684억원)의 매출액을 기록한 미국 제약사 머크(MSD) 면역항암제 ‘키트루다(MK-3475, 성분명 펨브롤리주맙)’다. 2014년 미국식품의약국(FDA)으로부터 흑색종 치료제로 승인받은 뒤 새로운 질환으로 적응증을 꾸준히 확대해 온 결과 현재 폐암, 위암, 신세포암 등 16개 암종에서 발생하는 30여 개 적응증에 두루 쓰이고 있다. 



머크의 면역항암제 키트루다로 2020년 기준 매출액이 143억8000만달러(한화 약 17조원)으로 전체 의약품 중 2위에 올랐다.왼쪽은 키트루다의 성분인 펨브롤리주맙을 3차원으로 형상화한 모습이다. (제공=머크, Fvasconcellos)머크의 키트루다는 2010년대 초반에 등장한 3세대 면역항암제 기술로 탄생한 약물 중 하나다. 2013년 국제학술지 사이언스에서 ‘올해의 연구’를 수상한 면역항암제 분야는 2018년 관련 연구자가 노벨생리의학상을 수상하며 그 파급력을 보여줬다. 혼조 다스쿠 일본 교토대 의과대학 명예교수와 제임스 앨리슨 미국 텍사스 MD앤더슨암센터 교수 등이 그 주인공이었다. 이들은 차례로 인체 내 면역세포 중 암세포를 공격하는 T세포 표면에 존재하는 막단백질인  ‘PD-1(1992년·혼조 교수)’과 ‘CTLA-4(1996년 앨리슨 교수)’를 발견했고, 두 단백질과 암세포와의 상호작용까지 설명했다. 이 막단백질들을 타깃하는 항체를 만들면 면역세포가 암세포를 더 높은 확률로 공격하게 만들 수 있다는 것이었다. 면역에 관계하는 단백질을 표적으로 삼기 때문에 이 기전을 바탕으로 생산된 약물에는 면역항암제 또는 면역관문억제제라는 별칭이 붙었다.혼조 교수와 앨리슨 교수의 발견으로부터 20여 년이 지난 2010년대부터 면역항암제라는 이름이 대중에게 알려지기 시작한다. 미국 제약사 브리스톨마이어스스큅(BMS)과 일본 오노약품공업이 공동 개발한 ‘여보이(성분명 이필리무맙)’가 2011년 미국식품의약국(FDA)으로부터 최초로 승인받았다. 이어 2014년 BMS의 ‘옵디보(성분명 니볼루맙)’와 머크의 키트루다가 연달아 승인됐다. 이듬해 지미 카터 전 미국 대통령처럼 이전 치료제로 효과가 없던 환자가 면역항암제를 통해 완치 판정을 받으면서 유명세를 탔다.여러 면역항암제 중 키트루다가 매출 선두의 자리를 차지한 것은 적응증을 꾸준히 확대한 결과로 평가된다. 키트루다의 판매를 개시한 2015년 매출액은 400만 달러 수준이었다. 이후 폐암, 두경부암, 호지킨림프종, 위암, 신장암 등 모두 16개 암종에서 관찰되는 30여 개 적응증으로 사용 범위가 확대되면서 매출이 기하급수적으로 폭증했다. 2020년 기준 키트루다의 매출액은 같은 시기에 출시된 옵디보(79억2000만 달러)보다 80% 가량 많다. 키트루다는 국내에서도 2015년 흑색종 2차 치료제로 식품의약품안전처(식약처)의 첫 허가를 받은 뒤 신세포암, 방광암 등 11개 암종으로 적응증을 늘렸다. 머크는 키트루다의 적응증을 더 확대하기 위해 지금도 30개 이상의 암종에 대해 1000건 이상의 임상을 전 세계에서 진행하고 있는 것으로 알려졌다. 업계에서는 암세포의 면역 회피 기작은 여러 암에서 공통으로 나타나기 때문에 키트루다와 같은 면역항암제가 적응증 확대하기 유리한 것으로 분석한다. 이를 바탕으로 2025년경 키트루다의 매출액은 225억 달러로, 전체 의약품 중 1위 자리에 오를 것이란 전망이 나온다.국내 제약바이오 기업도 이같은 면역항암제 개발에 도전하는 중이다. 식약처가 지난달 제넥신(095700)이 악성 뇌종양인 교모세포종 치료용 면역항암제로 개발 중인 ‘인터류킨-7(개발명 GX-I7)’을 스위스 제약사 로슈의 표적항암제 ‘아바스틴(성분명 베바시주맙)’과 함께 투여하는 병용요법에 대한 임상 2상 시험계획을 승인했다. 또 대웅제약(069620)도 지난 23일 바이오벤처인 넥스아이와 면역항암제 후모물질 ‘NXI-101’ 등을 개발하기로 결정했다. 셀트리온(068270)은 키트루다와 옵티보의 특허가 만료되는 2028년경 상용화하는 것을 염두에 두고 글로벌 면역항암제의 바이오시밀러를 개발하고 있다.한편 3세대 면역항암제 등장 이전인 1960~70년대에는 1세대 세포독성항암제가, 2000년대 초반에는 2세대 분자표적항암제가 주로 개발됐다. 먼저 전통적인 방식의 세포독성항암제는 빠르게 증식하는 암세포를 직접 죽이는 약물이었다. 하지만 혈구세포나 생식세포처럼 빠르게 분열하는 특징을 가진 일부 정상세포까지 공격한다는 부작용이 있었다. 대표적인 부작용이 일시적인 골수 기능 저하에 따른 백혈구 감소증이다. 또 2세대 분자표적항암제는 암세포의 성장이나 증식에 관여하는 특정 단백질을 줄이거나 없애는 방식으로 작용하는 약물이었다. 3세대 면역항암제도 면역 관련 단백질을 표적으로 삼기 때문에 넓은 의미에서는 분자표적항암제에 포함된다고 볼 수 있다.",105,https://n.news.naver.com/mnews/article/018/0005113620?sid=103
"한수원, 원전 작업로봇 시뮬레이션 경진대회 성료",2021.12.25. 오전 5:20,"대상 부산대 대학원생 ARAI팀…1000만원 등 상금 수여한국수력원자력(대표 정재훈)은 지난 10월 12일부터 11월 30일까지 진행한 ‘2021 KHNP 원전 작업로봇 시뮬레이션 경진대회’를 마무리하고, 24일 서울 대한상공회의소에서 시상식을 진행했다.



정재훈 한국수력원자력 사장(왼쪽 다섯 번째)과 ‘2021 KHNP 원전 작업로봇 시뮬레이션 경진대회’ 수상자들이 기념사진을 찍고 있다.이번 경진대회는 인공지능(AI) 로봇에 관심이 있는 고등학생, 대학(원)생, 중소벤처 등 23개 팀(개인 9팀, 단체 14팀) 총 53명이 참가해 중력가속도, 충돌 등을 묘사하는 물리 엔진이 적용된 가상환경에서 로봇제어 능력을 경연했다. 가상의 원전 내부 환경에서 참가팀들은 한수원이 개발 중인 생체모방형 4족 로봇 모델을 활용해 장애물 통과 및 임무 수행을 위한 AI 로봇제어 기술을 컴퓨터 시뮬레이션으로 구현했다.경연 결과 부산대학교 대학원생으로 구성된 ARAI팀이 자체 개발한 4족 보행 알고리즘으로 굴절 복도, 경사도 극복, 계단 등반 등의 임무를 성공적으로 수행해 상금 1천만원과 함께 우승의 영예를 안았다. 준우승은 포항공대 박사과정 김주환 씨가 차지했다.이번 대회는 원전과 같은 특수 환경에서 작업할 수 있는 AI 로봇 기술개발 활성화를 위한 기술 교류의 장이 됐다. 한수원은 이번 대회를 일회성 이벤트에 그치지 않고, 내년에는 국제적인 로봇대회로 발전시킨다는 계획이다.수상팀 임무 수행 시뮬레이션 영상은 대회 공식 홈페이지와 유튜브로 확인할 수 있다.",105,https://n.news.naver.com/mnews/article/092/0002243219?sid=103
"[코인뉴스] 비트코인, 크리스마스 앞두고 6200만 돌파…산타의 선물?",2021.12.24. 오후 2:23,"일부 투자자 산타랠리 기대감 고조



시민들이 크리스마스를 하루 앞둔 24일 성탄절 용품을 고르고 있다.(자료사진)ⓒ데일리안 홍금표 기자[데일리안 = 이건엄 기자] 비트코인이 크리스마스를 하루 앞두고 반등에 성공하며 6200만원 고지를 넘어섰다. 이에 따라 일각에서는 산타랠리에 대한 기대감이 다시금 고조되고 있는 상황이다.24일 암호화폐 거래소 업비트에 따르면 이날 오후 2시 기준 1비트코인은 6203만4000원에 거래되고 있다. 이는 24시간 전보다 0.9% 상승한 수준이다. 같은 시각 빗썸에서는 6196만4000원에 거래 중이다.암호화폐는 주식과 달리 거래소 단위로 거래 가격이 매겨지기 때문에 같은 종류의 암호화폐라도 거래소에 따라 가격에 다소 차이가 있다.비트코인은 전날까지만 하더라도 5800만~5900만원대에 머물며 지지부진한 모습을 보였지만 이날 저가 매수 영향으로 단번에 6200만원대까지 반등하는데 성공했다. 일부 투자자들은 크리스마스를 앞둔 만큼 올해도 산타랠리가 가능할 것이란 낙관적 전망도 내놓고 있다.알트코인 대장주 이더리움도 상승세다. 전날 470만원대까지 떨어졌던 이더리움은 현재 업비트에서 498만1000원에 거래 중이다. 빗썸에서도 497만원에 거래되고 있다.",105,https://n.news.naver.com/mnews/article/119/0002560599?sid=103
