title,date,main,section,url
"""갤노트 닮았다?""…삼성 '갤S22 울트라' 이렇게 생겼다 [배성수의 다다IT선]",2021.10.09. 오후 1:01,"갤럭시S22 울트라 예상 렌더링 이미지  /사진=와카르 칸 캡처삼성전자의 3세대 폴더블 스마트폰(갤럭시Z폴드3, 갤럭시Z플립3)이 글로벌 흥행을 거두고 있는 가운데, 삼성전자의 차세대 스마트폰 '갤럭시S22' 시리즈에 대해서도 관심이 쏠리고 있습니다.9일 그래픽 디자이너 와카르 칸이 최근 제작한 3차원(3D) 예상 이미지를 보면 갤럭시S22의 최상위 모델인 갤럭시S22 울트라의 외형은 마치 '갤럭시 노트'를 연상케 합니다. 노트 시리즈의 가장 큰 특징인 S펜 내장 슬롯이 있기 때문입니다.S펜 슬롯은 삼성전자의 타 스마트폰 라인업과 차별화되는 갤럭시 노트 시리즈만의 특징입니다. 삼성전자는 올 초 출시한 '갤럭시S21 울트라'와, 하반기 선보인 '갤럭시Z폴드3'에 S펜을 지원토록 했지만 두 모델 모두 S펜을 내장하는 방식은 아니었습니다.삼성전자는 매년 하반기 선보였던 갤럭시 노트 시리즈 신제품은 올해는 선보이지 않았습니다. 올해 갤럭시 S시리즈와 Z 시리즈에서 S펜 경험을 확대했다는 게 가장 큰 이유였습니다. 다만 칸 디자이너의 예상대로 갤럭시S22 울트라가 S펜 슬롯까지 탑재한다면 갤럭시 노트 시리즈의 정체성은 더욱 크게 흔들릴 수밖에 없어 보입니다.칸이 공개한 이미지를 보면 갤럭시S22 울트라가 전작 대비 모서리 형태가 평평해진 점도 갤럭시 노트 시리즈의 특징을 이어간 것으로 보입니다. 카메라 모듈은 4개의 카메라, 레이저 자동초점 시스템, LED 플래시가 P자형으로 자리 잡고 있는 것이 특징입니다. 다만 칸의 이미지는 임의로 제작한 임의적 이미지기 때문에, 실제 출시되는 제품과는 차이가 있을 수 있다는 설명입니다.



갤럭시S22 예상 렌더링 이미지  /사진=샘모바일 캡처한편 갤럭시S22 시리즈는 내년 2월 공개될 것으로 전망됩니다. 올해 1월 공개됐던 전작 갤럭시S21과 달리 출시 일정을 서두르지 않는 것이죠. 스마트폰 반도체를 비롯한 부품 부족 현상이 글로벌적으로 지속되고 있는 가운데 최근 출시한 3세대 폴더블폰도 흥행을 이어가고 있기 때문입니다.통신업계 관계자는 ""갤럭시Z폴드3, 갤럭시Z플립3가 판매 호조를 이어가고 있는 상황에서 삼성전자가 굳이 갤럭시S22 시리즈를 출시 시기를 앞당길 필요가 없어 보인다""고 말했습니다. 삼성전자에 따르면 3세대 폴더블폰은 출시 39일 만에 국내에서만 100만 대의 판매량을 올렸습니다. 이는 갤럭시 제품 중 세 번째로 빠른 판매 속도입니다.갤럭시S22 시리즈는 전작 대비 성능이 상당 부분 개선될 것으로 관측됩니다. 특히 모바일 게임 경험이 향상될 것으로 전망됩니다. 삼성전자는 최근 중국 소셜네트워크서비스(SNS) 웨이보 공식 계정을 통해 AMD 그래픽처리장치(GPU) 기반 차세대 칩셋 '엑시노스 2200'에 '레이 트레이싱' 기술을 적용할 것이라고 밝혔습니다. 엑시노스 2200은 갤럭시S22에 탑재될 AP입니다.레이 트레이싱은 뛰어난 게이밍 그래픽 구현이 특징으로 게이밍 PC, 콘솔용 GPU 등에 적용되는데요, 빛의 위치를 계산해 반사, 굴절, 투과, 그림자 등의 효과를 사실적으로 표현하는 기술입니다. AMD는 앞서 지난 6월 ' 열린 '컴퓨텍스 2021'에서 성전자의 차세대 엑시노스 시스템온칩(SoC)에 커스텀 AMD RDNA2 아키텍처 기반 그래픽스 IP를 탑재할 것이라고 전했습니다.다만 삼성전자는 갤럭시S22의 생산 계획을 전작 대비 줄인 것으로 관측됩니다. IT 매체 폰아레나에 따르면 갤럭시S22 시리즈의 생산량은 총 2000만 대 수준입니다. 이는 전작 대비 30% 가량 줄어든 규모인데요, 반도체 품귀 현상이 지속되는 가운데 점차 축소되고 있는 프리미엄 스마트폰 판매량을 감안한 전략으로 풀이됩니다.",105,https://n.news.naver.com/mnews/article/015/0004614329?sid=103
[날씨] 밤까지 서해안 중심 비…내륙 중심 짙은 안개,2023.10.24. 오후 5:41,"오늘(24일)은 서리가 내린다는 절기상 상강입니다.가을의 마지막 절기이기도 한데요.오늘 밤까지는 서해안을 중심으로 비가 내리는 곳이 있겠습니다.양은 5mm 미만으로 아주 적겠고요, 서울 등 그 밖의 수도권과 충북 북부에도 빗방울이 떨어질 수 있겠습니다.오늘 전국 하늘에 구름이 이렇게 많이 지나고 있는 모습인데요.내일은 구름이 차츰 걷히면서 낮부터는 맑은 하늘이 함께하겠습니다.다만 오늘 밤사이 다시 안개가 짙어지겠습니다.특히 내륙을 중심으로는 안개가 짙어지면서 가시거리가 좁혀지겠는데요.특히 강이나 호수 주변, 터널 출입구에서는 급격히 가시거리가 짧아질 수 있어서 교통안전에 각별한 주의가 필요하겠습니다.또 그 밖에도 수도권은 내일 오전과 밤 한때 대기가 정체되면서 일시적으로 대기들이 탁해질 수 있겠고요, 낮 동안에는 대기질 무난하겠습니다.강원 동해안 지역에서는 나흘째 건조주의보가 이어지고 있어서 단풍 절정기를 맞아 산행 계획하신 분들은 불씨 관리 잘해 주셔야겠습니다.내일 자세한 기온 보겠습니다.서울이 13도, 대구 10도, 창원 12도로 오늘보다 2~3도가량 높게 출발하겠고요, 낮 기온도 오늘보다 높겠습니다.서울이 22도, 대구와 부산 23도로 평년 수준을 크게 웃돌면서 포근하겠습니다.목요일인 모레는 오후에 중서부 지역에 또 비 소식이 있습니다.다소 요란하게 오는 곳이 있겠고요, 금요일에는 서해안과 영동지방에 비가 내릴 전망입니다.(남유진 기상캐스터)",105,https://n.news.naver.com/mnews/article/055/0001100050?sid=103
"[써보니] '윈도11', 감성 터치하는 UI가 무기",2021.10.10. 오후 4:08,"시작 메뉴·기기 설정 등 개편 눈길…MS 서비스 전진 배치마이크로소프트(MS)가 지난 5일 공식 출시한 최신 운영체제(OS) '윈도11'를 며칠간 사용해본 결과, 사용자인터페이스(UI) 상의 변화가 가장 눈에 띄었다.OS 새 버전의 주요 특징으로 꼽기에는 어쩌면 사소해보일 수도 있으나, 사용자를 배려하기 위해 전반적으로 손봤다는 느낌을 받았다.UI가 바뀐 기능 중에는 곧바로 적응하긴 어려운 것도 있었다. 그런 점을 감안하더라도 윈도10보다 세련되게 바뀐 모습에 사용하면서 만족감이 생겼다.



■MS 홈페이지서 윈도11 사양 확인&설치MS는 윈도10 사용자에게 윈도11 업그레이드를 무료 지원하고 있다. 다만 윈도11을 사용하려면 일정 수준 이상의 하드웨어 요건을 충족해야 한다. TPM 2.0 지원, RAM 4GB 이상, 저장매체 64GB 이상, CPU 2코어 1GHz 이상 64비트 프로세서, 다이렉트X 12(WDDM 2.0 드라이버 포함) 이상과 호환 등이 요건이다.MS 홈페이지에서는 현재 사용 중인 PC의 윈도11 실행 가능 여부를 확인할 수 있도록 PC 상태 검사 앱을 제공한다. 하드웨어 요건을 확인한 뒤, 윈도11을 다운로드했다. 몇 단계를 거쳐 설치를 최종적으로 마무리하기까지 약 한 시간 가량이 소요됐다.



윈도11 설치 화면■새단장한 '시작 메뉴', 어색하지만 예쁘네설치를 마치고 나니 시작 메뉴의 변신이 가장 먼저 눈에 들어왔다. 항상 화면 왼쪽 아래에 위치했던 시작 메뉴가 가운데로 자리를 옮겼다. 사용자가 원하는 콘텐츠나 앱에 더 빠르게 접근할 수 있게 하기 위한 것이라는 게 MS 설명이다. 원하는 아이콘을 클릭하기 위해 마우스 커서를 옮겨야 하는 거리를 보다 짧아지게 한 것이다.다만 이제 막 윈도11을 사용한 입장에서 그런 효과를 바로 누리긴 어려웠다. 무의식적으로 시작 메뉴에 들어가기 위해 왼쪽 구석으로 마우스 커서를 갖다대는 자신을 발견할 수 있었다.



윈도11 시작 메뉴가 가운데 하단으로 자리를 옮겼다.윈도10을 사용할 때에는 시작 메뉴가 있는 작업표시줄을 화면 오른쪽으로 세워 썼다. 윈도11에서는 이같은 위치 변경이 불가능했다.시작 메뉴는 상단엔 고정된 애플리케이션들을, 하단엔 최근 사용한 파일들을 보여준다. 여기에 나타나지 않는 애플리케이션에 접근하려면 검색창을 사용하는 식이다. 이전 윈도처럼, 스크롤바를 내려가면서 설치된 애플리케이션 전체 내역을 살펴보려면 '모든 앱' 메뉴를 선택하면 된다. 그 외 윈도10에서 볼 수 있었던 타일이 사라지는 등 보다 간단한 구성으로 바뀌었다.바탕화면에 아이콘을 배치하거나 작업표시줄에 고정 아이콘을 추가하는 건 다소 번거로워졌다. 시작 메뉴를 열었을 때, 상단 고정 애플리케이션을 바탕화면에 끌어 바로가기 아이콘을 배치할 수 없다. 하단에 나타나는 최근 사용한 파일들도 마찬가지다. 아이콘을 배치하려면 모든 앱 메뉴에 들어가 해당 앱을 찾아야 한다.바탕화면의 바로가기 아이콘도 작업표시줄에 끌어 고정 단추로 등록할 수 없다. 이를 위해서는 해당 애플리케이션을 연 뒤 작업표시줄에 나타난 아이콘을 통해 설정해야 한다. 개인적으로는 수시로 하던 행동들이라, 단계가 복잡해져 귀찮았다.이처럼 자주 쓰던 사용 방식에 제약이 생긴 점은 아쉬웠지만, 디자인 측면에서 메뉴의 위치 및 구성이 바뀐 점은 윈도10보다 낫다고 느꼈다.■둥글어진 윈도11…기기 제어 편의성 ↑시작 메뉴 외 여러 곳에서도 UI가 바뀐 것을 확인할 수 있었다. 창 모서리가 둥글게 바뀐 것도 그렇다. 윈도11이 처음 공개된 뒤 이목을 끌었던 부분 중 하나이기도 하다. 기능적인 측면으로 따져보면 새로울 게 없지만, 부드러운 느낌의 디자인이 더 나은 인상을 줬다.단 사용하는 애플리케이션에 따라 적용 여부가 차이가 난다. 기자가 사용하는 서비스 중에서는 네이버 '웨일', '카카오톡'에서 적용이 되지 않는 것을 확인했다. 윈도11이 막 출시된 만큼, 아직 이런 변화를 지원하지 않는 경우도 있는 듯했다.



각종 기기 설정을 제어하는 메뉴도 디자인이 더 깔끔하게 바뀌고, 여러 기능을 통합해 조회할 수 있도록 바뀌었다. 네트워크 및 블루투스 연결 상태, 기기 모드, 화면 밝기나 소리 크기 등이 나타났다. 현재 기기 상태를 보다 알기 쉬워졌고, 제어도 간편해졌다.



윈도11 기기 설정 제어그 외 열린 창을 최소화하거나, 작업표시줄에 메뉴를 추가하는 등 각종 행동 시에 나타나는 애니메이션 효과가 윈도10보다 부드럽게 개선된 점도 확인할 수 있었다. 경고를 주는 듯한 느낌이었던 알림 소리도 보다 거슬리지 않는 느낌으로 바뀌어 좋았다.■'팀즈'와의 불편한 동거윈도11 작업표시줄에는 기본적으로 MS 협업툴 '팀즈'가 자리잡고 있다. 평소 팀즈를 사용할 일이 없는 기자로선 이를 없애고 싶었다. 그러고 싶었으나, 그러지 못했다는 뜻이다.팀즈 앱을 제거하더라도 작업표시줄 상에서의 팀즈 아이콘은 없어지지 않는다. 앱을 제거한 상태로 아이콘을 클릭하면 이처럼 '시작하기' 버튼이 나타난다. 심지어 작업표시줄 내에서 위치도 바꿀 수 없다. 기자는 작업표시줄에 자주 사용하는 애플리케이션 여러 개를 고정해두기 때문에 해당 공간을 가능한 한 간결하게 정리하고 싶어하는데, 사용하지도 않는 기능이 떡하니 가운데 위치해 있는 게 거슬렸다.



MS 팀즈팀즈처럼 삭제가 불가능한 것은 아니나, 윈도11을 설치하고 나면 MS 게임 서비스 '엑스박스'도 PC를 켤 때마다 나타났다.■손님 맞을 준비한 'MS 스토어'…안드 앱 수급은 아직MS는 지난 6월 윈도11을 공개하면서, 윈도용 앱 마켓 'MS 스토어'의 대대적인 개편 계획도 알린 바 있다. 안드로이드 앱을 비롯한 모든 종류의 앱을 등록할 수 있도록 지원하고, 최근 앱 마켓을 두고 화제가 됐던 인앱 결제 강제도 하지 않겠다고 밝히기도 했다.이렇게 예고한 것처럼, MS 스토어도 새단장을 했다. 인기 앱·게임 및 기능별 추천 앱들이 나타나는 등, 이전처럼 방치돼 있다는 느낌은 확실히 없어졌다.MS 스토어에서 앱을 클릭하면 앱에 대한 설명 및 평점과 리뷰를 볼 수 있으며, 시스템 요구사항도 살펴볼 수 있다.



MS 스토어 내 앱 소개 화면다만 윈도11 출시 한 달 전 MS가 안드로이드 앱 지원 기능은 빠진 상태로 출시된다고 밝혔던 만큼, 아직까지 안드로이드 앱을 윈도11에서 쓸 수는 없다.■총평결론적으로 기자는 윈도11로 업그레이드하기를 추천한다. 며칠 사용하는 동안 어떤 애플리케이션을 사용할 수 없다거나, 시스템 오류가 발생하는 등의 일은 없었던 만큼 사용성에 큰 문제를 느끼지 못했다. 바뀐 UI에서 일부 불편함을 느끼기도 했으나, 이는 사용 경험이 축적되면 오히려 이전보다 편리하게 느낄 것으로 기대되는 경우가 대부분이었다. 무엇보다 UI 디자인이 세련돼졌기 때문에 PC를 사용하는 동안 소소하게 기분이 좋아지는 효과도 상당했다.",105,https://n.news.naver.com/mnews/article/092/0002235722?sid=103
[잇써보니]잘 키운 AI 부캐 하나로 인플루언서 되자··· 메타버스 SNS '오픈타운',2021.10.09. 오전 8:01,"[서울경제] 



아무리 사람을 많이 만나는 기자라 할지라도 ‘코로나 블루’를 비껴갈 순 없었다. 공적인 만남 이외에 새로운 만남이 사실상 끊긴 지 어언 2년. 공허한 마음에 인스타그램을 뒤적이다 우연히 ‘오픈타운’ 애플리케이션(앱)을 광고로 접하게 됐다. 나만의 인공지능(AI) 부캐를 만들어 다른 부캐들과 소통하고, 팔로워도 모을 수 있는 메타버스 사회관계망서비스(SNS)라는 설명이었다. 정확히 이해는 되지 않았지만 데이팅 앱과 챗봇 서비스를 합쳐놓은 것 같은 기묘한 조합에 끌려 우선 앱을 다운받아 봤다.



오픈타운에 들어서면 우선 가장 먼저 나만의 부캐를 생성하게 된다. 방법은 간단하다. 원하는 컨셉을 정하고 난 다음 프로필 소개를 통해 컨셉을 어필하면 된다. 창의력이 부족한 기자는 ‘음악과 커피를 사랑합니다’라는 재미없는 소개글과 함께 ‘#일상 #맛집 #음악’이라는 진부한 해시태그를 달았지만, 앱을 살펴보니 이성친구 컨셉은 물론 미친 과학자, 교주, 게임 속 캐릭터 등 개성 넘치는 부캐들이 많았다.



앱의 가장 재밌는 점은 내가 앱에 접속해 있지 않아도 부캐가 알아서 다른 부캐들한테 말을 건다는 것이다. 이는 부캐가 일종의 AI 챗봇으로서 기본적인 대화 능력을 장착하고 있기 때문이다. 물론 대화 능력을 고도화시키기 위해선 지속적인 ‘수작업’이 필요하다. AI 캐릭터에게 특정 질문에 대한 적절한 답변을 훈련시킬 수 있는 ‘트레이닝’ 기능을 이용하면 된다. AI 능력이 고도화될수록 AI가 센스있는 답변을 하며 팔로워를 늘릴 가능성도 높아진다. 실제로 앱 출시가 2달 가량밖에 되지 않아 이용자가 많지 않음에도 불구하고 1,000명 가까운 팔로워를 보유한 부캐들도 간간이 볼 수 있었다. 물론 이용자가 앱에 접속해 있을 경우에는 AI 자동응답 기능을 잠시 꺼두고 직접 답변을 건넬 수도 있다.



기존의 챗봇 서비스는 사람과 AI 챗봇간 대화에 초점을 맞췄다. 이 앱은 여기서 한발 더 나아가 내 AI 부캐가 스스로 다른 AI들과 대화하며 성장하는 모습도 볼 수 있다. 마치 내 캐릭터가 알아서 자동사냥을 하며 레벨업하는 모습을 보는 방치형 역할수행게임(RPG)과 비슷한 재미가 있는 것이다. 외로움을 틈타 사이버 공간을 찾았지만 데이팅 앱은 이상한 사람을 만날까봐 싫고, 똑같은 챗봇과 계속 대화하기는 지겹다면 오픈타운에서 색다른 재미를 즐길 수 있다.



다만 아직 초기 단계인 만큼 여러가지 결점들이 눈에 띄었다. 우선 아무리 열심히 훈련을 시켜도 AI가 엉뚱한 답을 하는 경우가 여전히 꽤 많아 재미가 반감됐다. 사람이 직접 쓴 답과 AI가 자동으로 보낸 답을 앱에서 알아서 구분해 주지 않는 것도 단점이다. 실제로 상당수의 부캐들이 프로필 소개에 “AI가 엉뚱한 소리를 하는 경우가 많다”며 “앞에 특정 부호를 붙이면 사람이 보낸 것”이라고 명시해 놓는 경우가 많았다.",105,https://n.news.naver.com/mnews/article/011/0003971276?sid=103
[부고] 이상택(뉴데일리경제 경제정책부장)씨 모친상,2021.10.10. 오후 12:54,"▲ 방희석씨 별세, 이성희·이선영·이상택(뉴데일리경제 경제정책부장 겸 건설부동산부장)씨 모친상, 한승희·박성배씨 장모상= 10일 오전 6시56분, 중앙대병원 장례식장 8호실, 발인 12일 오전 11시, 장지 서울추모공원. ☎ 02-860-3508 (서울=연합뉴스)",105,https://n.news.naver.com/mnews/article/001/0012655827?sid=103
"LGU+ ""취향 맞춤 '폰 배경 이미지' 무료로 받아가세요""",2021.10.10. 오전 9:01,"물렁이 사원·장우주·정쓰·햄깅·재연·리페 등과 협업…일러스트 10종 제작LG유플러스가 물렁이 사원, 장우주, 정쓰 등의 디지털 일러스트를 무료로 제공한다.



ㅣLG유플러스가 인기 작가의 일러스트 이미지를 무료로 제공하는 이벤트를 진행한다.  [사진=LG유플러스]LG유플러스(대표 황현식)는 이달 31일까지 인기 작가들이 수작업으로 그린 일러스트 이미지를 무료로 제공한다고 10일 발표했다.회사는 물렁이 사원, 장우주, 정쓰, 햄깅, 재연, 리페 등과 협업해 제작한 일러스트 10종을 무료로 제공한다. 일러스트는 스마트폰 배경·잠금화면 또는 메신저 프로필 사진으로 이용할 수 있다.일러스트는 이벤트 페이지에서 간단한 설문조사를 통해 파악된 취향에 따라 10종 중 1종을 추천받는다. 모든 일러스트에는 말풍선이 함께 제공되며 나만의 문구를 입력하면 해당 문구가 새겨진 이미지가 다운로드된다.",105,https://n.news.naver.com/mnews/article/031/0000628043?sid=103
대안공간 메타버스 인기…강의·기업홍보 등 활용 범위 확대,2021.10.10. 오전 9:35,"영산대 패션디자인과 수업, 남부발전 재생에너지테마맵 조성DRB동일 창립 기념 사진전 등…다양한 소통방식 자리매김 



패션디자인학과 메타버스로 강의[영산대 제공]    (부산=연합뉴스) 조정호 기자 = 언택트 시대 화두로 떠오른 메타버스(3차원 가상세계)가 대학 비대면 강의나 기업 홍보 행사 등 활용 범위를 넓히고 있다.    각종 대면 모임이 신종 코로나바이러스 감염증(코로나19) 사태 이후 온라인·비대면 방식으로 변화하면서 메타버스가 만남의 대안 공간이 되고 있다.    10일 영산대학교에 따르면 패션디자인학과 김지형 교수는 전공강의(SW융합교과 쇼핑몰앱스토어)를 메타버스로 하고 있다.    학생은 가상공간 플랫폼 '이프랜드(if-land)'에서 만나 쌍방향으로 소통한다.    SK텔레콤이 출시한 이프랜드는 최대 131명과 대형 스크린으로 원하는 자료를 공유할 수 있는 차세대 오픈 메타버스 플랫폼이다.    김 교수는 대형 스크린에 디지털 트랜스포메이션과 패션산업에 관한 자료를 전달했고, 학생은 각자 캐릭터로 강의 반응을 남기고 음성으로 의견을 교환하며 높은 강의 집중도를 보였다.     김규한 학생은 ""이번 강의에서 메타버스를 처음 경험했다""며 ""가상공간에서 수업을 듣고 친구들을 만날 수 있는 완전히 새로운 경험이었다""고 말했다.     김 교수는 ""패션산업에서도 4차 산업혁명으로 인한 디지털 전환이 빠르게 진행되고 있다""며 ""학생이 메타버스, 빅데이터, 3D 프린팅 등 최신 기술을 접하고 친숙해져야 한다고 생각해 강의에 접목했다""고 설명했다.



재생에너지테마맵[남부발전 제공]    한국남부발전은 최근 네이버 메타버스 플랫폼 '제페토(ZEPETO)'에 제주도 한경풍력단지를 본뜬 'KOSPO 재생에너지테마맵'을 조성했다.    이용자들은 메타버스에서 자동차를 타고 한경풍력단지 해안도로를 달리고 태양광발전, ESS(에너지저장장치)도 볼 수 있다.    남부발전은 ""풍력, 태양광에 대한 국민 인식을 개선하고 디지털 환경에 익숙한 MZ세대가 쉽게 재생에너지를 이해할 수 있도록 메타버스 플랫폼을 활용했다""고 설명했다. 



DRB동일 창립 기념 사진전[DRB동일 제공]    DRB동일과 동일고무벨트는 오는 24일까지 메타버스에서 창립 76주년 기념 사진전을 한다.    이 회사는 메타버스 소셜 플랫폼 제페토에 회사의 역사적 변화를 담은 사진을 전시했다.    1관(꿈과 희망의 여정)에는 지역사회와 동반 성장해 온 이야기를, 2관(변화와 혁신의 여정)에는 시대 흐름에 따라 변화와 혁신을 거듭해 온 이야기를 각각 담았다.     전시공간 이외에도 야외에 페스티벌 존, 드라이빙 존, 벚꽃 존 등 다양한 체험공간을 조성했다.     DRB동일 기업문화팀 관계자는 ""코로나19로 부족해진 현실 세계에서 만남을 가상세계에서 실현하는 등 다양한 소통 방식을 시도하고 있다""고 말했다.     ccho@yna.co.kr",105,https://n.news.naver.com/mnews/article/001/0012649163?sid=103
