title,date,main,section,url
유명인 운영 '쇼핑몰 채용공고' 어떻기에?…온라인서 '뭇매' [e라이프],2023.01.06. 오전 11:19,"[디지털데일리 양원모 기자] '열정페이'란 하는 일에 비해서 급여 수준이 지나치게 인색한 경우를 말한다. 물론 최저시급이나 근무시간 등에 있어 근로기준법을 위반하는 것이 아니기 때문에 법적으로는 문제가 없으나 일반인들의 눈높이에선 거부감이 들 수 있다.유명 연예인인 다비치 강민경(32)씨가 운영하는 쇼핑몰이 최근 열정페이 논란에 휩싸였다. 대졸 1~3년 차 경력직 채용 공고를 내면서 최저 임금 수준의 연봉을 제시했기때문이다. 강씨는 소셜 미디어를(SNS)를 통해 ""비전공자 신입 연봉을 잘못 올린 것""이라며 수습에 나섰지만 아직 온라인 민심은 싸늘하다. 6일 에펨코리아 등 온라인 커뮤니티에서는 강씨가 론칭한 패션 브랜드 쇼핑몰 '아비에 무아'가 취업 플랫폼에 올린 채용 공고가 논란이 됐다. 경력 3~7년 차 CS(고객 응대) 담당자를 뽑는다는 내용이었는데, 연봉으로 최저 임금 수준인 2500만원을 적어놓은 것이다. 요구되는 업무 내용도 녹록치 않았다. 전반적 고객 응대를 비롯해 ▲전화·게시판·메신저·이메일을 통한 상담 ▲주문서 수집 및 출고·반품 관련 물류센터와 소통 ▲고객 문의 분석을 통한 운영 정책 기획 수집 ▲해외 고객 이메일 영어 응대 등이었다. 여기에 영어가 가능하고, 엑셀 등도 중급 이상으로 다룰 줄 알아야 했다. 네티즌들은 업무에 비해 비교적 낮게 책정된 연봉에 '열정페이' 의혹을 제기했다. 한 네티즌은 ""하루 종일 지게차만 타도 저 연봉보다는 많이 받을 것""이라며 ""과장급 인재를 원하면서 연봉을 후려친 것""이라고 비판했다. 강씨는 논란이 커지자 6일 인스타그램에 글을 올리고 ""담당자 착오였다""며 해명에 나섰다. 강씨는 ""무경력·학력 무관·비전공자 신입의 연봉으로 잘못 기재된 CS 경력자 채용 공고를 올렸다. 이 공고는 기재 실수를 확인한 즉시 수정됐다""며 ""경력직의 경우, 반드시 직전 연봉을 기반으로 협상을 진행하고 있다. 공고는 기재 실수를 확인한 즉시 수정됐다""고 밝혔다. 이어 ""아비에무아는 아직 성장하고 있는 브랜드로서, 신입 지원자분들께 더 많은 연봉을 협의하지 못하는 것에 대해서 부단히 노력하겠다는 말밖에는 드릴 말씀이 없어 마음이 무겁다""며 ""앞으로도 회사가 성장함에 따라 직원들과 성과를 지속해서 공유하며 더 나은 환경을 만들기 위해 노력하겠다""고 덧붙였다.그러나 네티즌들은 연봉처럼 중요한 정보를 강씨가 확인하지 않고 채용 공고를 올렸다는 점에서 여전히 아쉽다는 반응을 보이고 있다.",105,https://n.news.naver.com/mnews/article/138/0002140311?sid=103
TCL 대화면 웨어러블 글래스 체험,2023.01.06. 오후 4:52,(라스베이거스=연합뉴스) 홍해인 기자 = 세계 최대 가전·IT(정보기술) 박람회 'CES 2023' 개막일인 5일(현지시간) 미국 네바다주 라스베이거스 컨벤션센터(LVCC) 중앙홀의 중국 업체 TCL에서 관람객들이 착용만으로 130인치 크기의 대형 화면이 펼쳐지는 웨어러블 글래스 NXTWEAR S를 체험해 보고 있다. 2023.1.6    hihong@yna.co.kr,105,https://n.news.naver.com/mnews/article/001/0013686433?sid=103
"[이주의 전자뉴스] 세계인 발걸음 몰린 CES 2023, 온라인으로 보는 방법은?",2023.01.06. 오후 4:19,"<출처=롯데하이마트>[디지털데일리 백승은 기자] 이주(2일~6일)에는 미국 현지시간으로 지난 5일 'CES 2023'의 막이 화려하게 올랐다. 세계인의 발걸음이 라스베이거스로 몰렸다. 글로벌 빅테크 기업을 비롯해 다양한 아시아 기업도 등장해 관람객의 눈길을 사로잡았다.국내 중견기업들도 참가해 최신 기술을 뽐냈다. 온라인을 통해 CES 2023 출품작을 만나볼 수 있는 체험 공간도 등장했다.   한편 이 기간 국내에서는 증강현실(AR) 글래스, 기능을 높인 로봇 청소기 등 신기술을 접목해 편리함을 높인 혁신 상품이 소비자를 찾았다.    ◆CES 2023서 선보인 ‘VR스토어’, 롯데하이마트 온라인쇼핑몰에서 만나보세요=롯데하이마트(대표 남창희)가 5일부터 15일까지 온라인쇼핑몰에서 가상 매장인 ‘VR 스토어 체험전’을 진행한다. 세계 최대 가전·IT 박람회 ‘CES 2023’에서 공개된 ‘롯데하이마트 VR 스토어’를 일반 소비자들에게도 널리 알리고자 기획했다.    VR 스토어에 선보인 자체브랜드(PB) 하이메이드 32개 제품을 한정수량 최대 30% 할인 판매한다. 70만원대 470리터(L) 용량 4도어 냉장고를 50만원대에, 90만원대 65인치 UHD TV를 60만원대에 구매할 수 있다.   하얀 벽체와 자연친화적인 우드 인테리어, 높은 층고가 특징이다. 내부는 대형가전, 주방가전, 생활가전, IT, 레저 총 5개 구역으로 조성했다. 바다, 오로라 등 자연 이미지가 연출된 공간에 세탁기, TV 등 대형가전을 만나볼 수 있다. 이밖에도 거실 공간에 여러 디자이너와 협업한 청소기, 헤어드라이어 등을 비치한 생활가전관, 자연 속 하이메이드 캠핑 시리즈를 배치한 레저관 등 제품별 특징에 맞춰 공간을 구현했다.    각 구역별 소개 영상은 ‘VR 스토어 체험전’ 이벤트 페이지에서도 확인할 수 있다. 개별 제품을 클릭하면 상세 설명을 담은 화면도 볼 수 있다. 일부 제품은 가상 가전 상담원이 상담도 해주는 등 특별한 쇼핑 경험을 제공한다. 이번 ‘CES 2023’에서 공개된 버전은 데모 버전으로, 올해 말 정식 서비스 오픈을 목표로 하고 있다.   ◆바디프랜드, CES 2023서 헬스케어 집약 제품 선봬=바디프랜드가 ‘CES 2023’에 참가하여 홈 헬스케어의 미래상을 제시했다.    먼저 미국 현지시간으로 3일에는 의료기기 ‘팬텀 메디컬 케어’를 공개했다. 팬텀 메디컬 케어는 지난 해 FDA등록으로 미국 시장에 진출했다.    본 행사에서 바디프랜드는 두 다리 마사지부가 독립적으로 움직이는 마사지 기술 ‘로보 워킹 테크놀로지(Rovo Walking Technology)’를 적용한 신제품들을 대거 공개했다.   또 바디프랜드는 이번 CES2023에 그간의 연구개발의 성과가 담긴 차별화된 헬스케어 제품을 다수 출품했다. ▲퀀텀 로보 ▲퀀텀 로보 라이트케어 ▲퀀텀 로보 O2 ▲퀀텀 로보 B&O 등 신제품 총 10종을 선보였다.   ◆레노버, ‘CES 2023’서 사용자 경험 향상 위한 혁신 기술 및 제품 공개=레노버가 CES 2023에서 '사용자 경험 향상'에 중점을 둔 최신 디바이스 및 솔루션 라인업을 공개했다    행사를 통해 공개한 제품은 첨단 기능이 탑재된 '요가북 9i'이다. '요가 슬림 7i 카본'의 리프레시 버전도 공개했다. 최대 13세대 인텔 코어 프로세서를 탑재해 더욱 인상적인 성능 구현과 활용성과 생산성을 개선한 제품이다. 함께 공개된 '요가 6' 리프레시 버전 역시 최신형 AMD 라이젠 7000 시리즈 프로세서를 탑재해 성능 개선을 이뤘다.   '씽크북 플러스' 제품군의 새 혁신 모델을 발표했다. 한 면에는 유기발광다이오드(OLED) 패널과 다른 한 면에는 컬러 전자잉크 스크린의 회전식 듀얼 디스플레이를 탑재한 씽크북 플러스는 회전식 폼팩터로 새롭게 공개됐다.    게이밍 라인업인 '리전'의 2023년형도 모습을 드러냈다. 특히 2023년 출시 예정인 '레노버 LA AI 칩'은 세계 최초의 게이밍 노트북 전용 AI 칩으로, 레노버 리전 프로 7 및 7i 노트북과 레노버 리전 프로 5 및 5i(Lenovo Legion Pro 5/ 5i ) 노트북에 장착됐다. 레노버가 CES 2023에서 발표한 신제품에 대한 자세한 정보는 레노버 스토리허브를 통해 확인할 수 있다.   ◆‘사람을 움직이게 하다’…소니, ‘CES 2023’에서 엔터테인먼트 혁신 기술 공개=소니는 CES 2023에서 ‘사람을 움직이게 하다(Moving People Forward)’를 주제로 미래 엔터테인먼트의 가능성 확장을 위한 소니의 최신 기술을 공개했다.부스에서는 소니의 플래그쉽 시네마 라인 캠코더인 '베니스 2' 풀프레임 미러리스 카메라 알파 시리즈, 브이로그 카메라 시리즈부터 프로페셔널 무인항공기(드론) '에어피크' 소니의 스마트폰 '엑스페리아' 등도 만나볼 수 있다.  이번 전시에서는 어느 장소에서나 낮은 지연 속도로 사람, 물체 및 공간을 3D로 수집하고 배포할 수 있는 새로운 시스템의 프로토타입을 선보인다. 이 시스템은 단 7개의 센서만으로 어디서나 빠르게 설치가 가능해 실시간 3D 영상 송출 수요를 충족시킬 수 있다. 부스에서 방문객들은 태블릿과 소니의 공간 현실(Spatial Reality) 디스플레이를 통해 3D 메타버스 공간에서 맨체스터 시티 선수들과 관객들을 360도 뷰로 둘러보는 체험이 가능하다.◆엔리얼, AR글래스 '엔리얼 에어' 쿠팡 로켓배송 선보인다=중국 스타트업 엔리얼이 지난 9월 국내에 선보인 AR 글래스 '엔리얼 에어'를 쿠팡 로켓배송으로 선보인다.    엔리얼 에어는 201인치 영상을 볼 수 있다. 약79g의 가벼운 무게와 3개의 코받침이 제공되고 3단 레이크 조절 시스템을 갖췄다. 여정민 엔리얼코리아 대표는 “이번 쿠팡 로켓배송을 통해 국내 소비자들이 보다 빠르고 편리하게 AR 경험을 즐길 수 있도록 접근성을 높였다”라고 말했다.   ◆앳홈, 로봇청소기 ‘클리엔T24’ 와디즈에 론칭=앳홈이 로봇청소기 신제품 '클리엔T24'을 크라우드 펀딩 플랫폼 와디즈에서 론칭을 마쳤다.    펀딩 기간은 오는 1월 26일까지이며, 화이트 컬러 단독으로 진행된다. 슈퍼 얼리버드는 선착순 200명, 얼리버드는 250명, 세트 구성(본품+6개월 구성품)은 300명 한정이다. 각각 정가에서 63%, 61%, 63% 할인된 금액에 구매 가능하다.   클리엔은 지난 2년간 대기업 및 로봇청소기 전문 브랜드 사이에서 단일 제품으로 누적 판매량 5만대, 매출 200억 이상을 올린 제품이다. 클리엔T24는 전작 대비 흡입, 물걸레 청소가 훨씬 더 강력해졌다.    ▲360도 회전하는 Autonomy LiDAR 센서를 포함 총 43개의 센서 ▲순간 흡입력 4000파스칼(Pa)로 먼지 한 톨까지 놓치지 않고 흡입한다. 또, ▲ 99.9% 살균된 전해수 ▲분당 480회 진동물걸레를 차용했다.    한쪽은 불어주고 한쪽은 흡입하는 ▲듀얼 터보 스테이션으로 청소기 내부 먼지가 완벽히 비워지며, 더스트백도 2.5L 대용량으로 한 달에 한 번만 비워줘도 충분하다. ▲무상 A/S도 2년 동안 보장한다. 클리엔T24 전용 앱에서 물 분사 속도 및 흡입력 등 청소 모드와 예약 청소도 원하는 대로 설정할 수 있으며, 고장 시 자동 알림도 발송된다.   ◆캐논코리아, 대형 잉크젯 프린터 ‘TC-20’ 출시=캐논코리아가 캐논의 첫 A1 사이즈 대응력을 갖춘 데스크탑 대형 잉크젯 프린터 ‘TC-20’을 출시한다.   엔데믹 시대의 도래로 대면 근무 외에도 스마트 오피스, 리모트 근무와 같은 유연한 업무 형태가 자리잡으며, 자택, 작업실 등의 개인 공간에서도 건설, 설계, 측량용 도면을 출력할 수 있는 대형 프린터에 대한 수요가 늘어나고 있다. 캐논코리아의 ‘TC-20’은 이런 수요에 발맞춰 콤팩트한 디자인으로 책상이나 선반위에 두고 쓸 수 있는 대형 잉크젯 프린터를 내놨다.    TC-20 책상 위나 선반 위에 둘 수 있어 공간 효율성을 갖췄다. 기존 대형 프린터에서 롤 용지 거치를 위해 필요했던 샤프트를 제거하고 새로운 형태의 롤 홀더를 채택해 좁은 공간에서도 용지 교환이 가능하며, 누구나 쉽게 롤 용지를 교체할 수 있도록 했다. 본체 전면부에 배치된 버튼을 통해 용지 교체, 잉크 보충 등 모든 기능을 손쉽게 조작할 수 있도록 설계해 조작 편의성을 높였다   ‘TC-20’은 동작 시 약 28W, 대기 시 약 1.8W 이하의 저전력 소비, 재생플라스틱 약 5％ 이상 사용 등 환경 친화적인 특징을 갖춰 캐논 대형 잉크젯 프린터 최초로 미국의 전자제품 환경 평가 시스템인 EPEAT에서 최고 등급인 ‘골드‘ 등급을 획득했다.   ◆코웨이 환경기술연구소, 글로벌 시험인증기관 '티유브이 슈드'서 지정 시험소 자격 획득=코웨이 환경기술연구소가 미생물 및 유해물질 분석 전문성을 인정받아 글로벌 시험인증기관 TÜV SÜD(티유브이 슈드)로부터 지정 시험소 자격을 획득했다.   티유브이 슈드는 전자제품 및 화학, 의료기기 등 다양한 산업 분야에서 시험·검사·인증·평가를 제공하는 국제 공인 시험인증기관다. 평가 기준에 따라 시험소의 분석 능력을 평가해 티유브이 슈드 지정 시험소 자격을 부여한다.    코웨이 환경기술연구소가 티유브이 슈드로부터 지정 시험소로 인정받은 분야는 미생물 시험소와 환경 유해물질 시험소 두 곳이다. 해당 시험소는 정수기, 청정기, 비데 등 주요 환경가전 제품을 대상으로 박테리아 및 곰팡이 항균 성능 평가와 매트리스 제품에서 발생되는 유기화합물에 대한 평가 분석을 담당하는 시험 기관이다.  코웨이는 이번 지정 시험소 인정을 통해 국제적 기준에 부합하는 설비 환경과 시험 분석 능력을 인정받은 동시에, 환경가전 및 매트리스 등 전 제품군의 위생 품질 검증에 대한 전문성과 대외 공신력을 확보했다.   ◆니콘이미징코리아, 중망원 단초점 렌즈·광각 단초점 렌즈 개발 발표=니콘이미징코리아가 새해의 시작과 함께 니콘 Z 마운트 시스템을 채택한 풀프레임(FX 포맷) 미러리스 카메라용 중망원 단초점 렌즈 ‘NIKKOR Z 85mm f/1.2 S’와 광각 단초점 렌즈 ‘NIKKOR Z 26mm f/2.8’를 개발한다고 발표했다.   먼저 NIKKOR Z 85mm f/1.2 S는 NIKKOR Z 렌즈 시리즈의 S 라인 중 하나로, 높은 수준의 설계 원칙과 품질 관리를 준수하며 뛰어난 광학 성능을 자랑하는 고급형 렌즈이다. 이 렌즈는 뛰어난 해상도와 아름답고 부드러운 배경 흐림 효과(보케)를 구현하는 중망원 단초점 렌즈로 결혼식이나 패션 사진 분야에서 활용도가 높을 것으로 보인다.   또한 함께 발표한 신제품 NIKKOR Z 26mm f/2.8은 초슬림∙초경량은 물론 탁월한 묘사성능으로 고화질 표현이 가능해 일반인은 물론 아마추어 작가들에게도 이상적인 렌즈다.    니콘이미징코리아 마케팅부 채윤석 부장은 “니콘은 앞으로도 소비자들의 니즈를 충족시키는 동시에 새로운 차원의 광학 성능을 추구할 것”이라며 “또한 영상 및 이미지 표현의 가능성 확대를 목표로 영상 문화 발전에 지속적으로 기여할 예정”이라고 전했다.   ◆한국엡손, 씨라이프 부산 아쿠아리움서 친환경 히트프리 캠페인 이벤트=한국엡손(이하 엡손)이 1월 3일부터 24일까지 22일간 SEALIFE 부산 아쿠아리움(이하 씨라이프 부산)과 협업하여 친환경 히트프리 캠페인 이벤트를 론칭한다.   엡손은 지난 12월 27일 씨라이프 부산과 친환경 캠페인 추진을 위한 업무협약(MOU)를 맺고 이번 프로젝트를 준비했다. 엡손은 씨라이프 부산과 함께 해양동물 보호를 위한 생활 속 실천의 중요성과 자사의 친환경 프린팅 솔루션인 ‘히트프리(Heat-Free)’ 기술에 대해 알릴 예정이다.또한 친환경 프로젝터를 활용해 아이들이 즐겁게 즐길 수 있는 인터랙티브 투사 콘텐츠도 준비했다. 귀여운 해양동물을 모델로 한 히트프리 스티커를 선보이며, 포토월에서 인증샷을 촬영 후 SNS에 업로드하면 엡손 포토프린터로 인쇄한 즉석 사진을 증정한다.",105,https://n.news.naver.com/mnews/article/138/0002140334?sid=103
2023 원자력계 신년인사회에서 기념촬영하는 참석자들,2023.01.06. 오전 9:13,(서울=연합뉴스) 신현우 기자 = 6일 오전 서울 강남구 노보텔 앰배서더에서 열린 원자력계 신년인사회에서 참석자들이 기념촬영하고 있다. 2023.1.6    nowwego@yna.co.kr,105,https://n.news.naver.com/mnews/article/001/0013685041?sid=103
"주정차 단속 알림앱 휘슬, 경남 거창군서 서비스",2023.01.06. 오전 9:55,"경기·경남·경북 등 총 41개 지역에서 통합 서비스[이데일리 임유경 기자] 지역 통합 주정차 단속 사전 알림 앱 휘슬은 경남 거창군으로 서비스를 확대 시행한다고 6일 밝혔다.휘슬은 120만 운전자가 사용하는 지역 통합 주정차 단속 알림 서비스다. 경기, 경남, 경북, 부산, 충남, 강원, 제주의 총 41개 지역에서 통합 서비스를 제공하고 있다. 휘슬 이용자는 한 번만 회원으로 가입하면 휘슬이 서비스하는 모든 지역의 주정차 단속 알림을 받을 수 있다. 기존 주정차 단속 알림서비스는 지자체별로 운영하고 있어 이용하려는 지역마다 개별적으로 가입해야 하는 불편이 있었다.



주정차 단속 알림앱 휘슬이 경남 거창군에 서비스를 오픈했다.(이미지=휘슬)휘슬은 주정차 단속 알림 서비스 외에 과태료 조회 및 납부, 차 번호로 대화하는 휘슬채팅, 교통법률 상담 서비스, 테슬라 자체 급속 충전소 ‘슈퍼차저’ 정보 공유, 주변 주차장 검색 등 운전자와 관련된 다양한 편의 서비스를 무료로 제공하고 있다.이번 거창군의 휘슬 서비스 도입으로 신규로 회원에 가입하는 경남 거창군 주민들을 비롯 기존 휘슬 회원들은 거창 내의 주정차 단속 지역에 차를 세우면 단속 알림과 인근 주차장 정보 등을 함께 받아볼 수 있다. 휘슬 관계자는 “휘슬은 거창군뿐 아니라 인접한 경북 김천시에서도 서비스되고 있어 두 지역을 자주 이동하는 운전자에게 더욱 유용할 것“이라며 ”지속적인 서비스 지역 확대 및 앱 편의성 개선을 통해 운전자 필수 앱으로 거듭날 것”이라고 말했다.",105,https://n.news.naver.com/mnews/article/018/0005401341?sid=103
"[CES2023 포토]'날 따라 해봐요, 이렇게'",2023.01.06. 오후 7:28,세계 최대 가전·IT(정보기술) 박람회 CES 2023 개막일인 5일(현지시간) 미국 네바다주 라스베이거스 컨벤션 센터(LVCC) 노스홀에서 프랑스 3D익스피리언스 기업인 다쏘시스템(Dassault Systemes)이 '가상 쌍둥이(Virtual Twin)' 모델로 임상 치료를 받을 수 있는 기술을 선보이고 있다. 전시관에 설치된 카메라 앞에 서면 몇 초 후 실제보다 큰 가상 모델이 나타난다. 그리고 자신의 심장과 뇌도 볼 수 있다.,105,https://n.news.naver.com/mnews/article/030/0003070968?sid=103
"유니버설 맥켄 코리아, 캠페인 선정 ‘2022 올해의 광고회사’ 2관왕",2023.01.06. 오후 8:07,"미디어 에이전시 부문 7년 연속 수상유니버설 맥켄 코리아(UM 코리아)가 2022년 12월 글로벌 광고 권위지 ‘캠페인 아시아 퍼시픽’이 선정하는 ‘올해의 광고회사(Agency of the Year 2022)’의 ‘미디어 에이전시’·‘디지털 에이전시’ 두 부문에서 금상을 수상해 2관왕에 올랐다고 6일 밝혔다. 특히 미디어 에이전시 부문에서는 7년 연속 수상이라는 영예를 안았다.캠페인 아시아 퍼시픽이 주관하는 올해의 광고 회사는 아시아 태평양 지역의 광고 PR 커뮤니케이션 기업의 연간 성과를 평가하는 시상식이다. ‘미디어’, ‘디지털’, ‘크리에이티브’, ‘PR’, ‘B2B 마케팅‘, ‘퍼포먼스 마케팅’ 등의 부문으로 나뉘어 한 해 동안 부문별 가장 높은 성과를 기록한 광고회사에 올해의 광고회사 상을 수여한다.유니버설 맥켄 코리아는 ‘올해의 한국 미디어 에이전시’ 금상을 수상하며, 네 번째 금상이자 7년 연속 올해의 미디어 에이전시 상을 수상하는 성과를 이뤘다.



유니버설 맥켄 코리아뿐만 아니라 ‘올해의 한국 디지털 에이전시’ 부문에서는 2020년 은상 수상에 이어 2022년 금상 수상을 했다.유니버설 맥켄 코리아는 캠페인지 올해의 광고회사 외에도 세계적인 미디어 에이전시 산업 평가기관인 ‘레크마’의 Quali-score 평가에서도 2022년 국내 1위를 차지한 바 있다.",105,https://n.news.naver.com/mnews/article/092/0002278948?sid=103
"위메이드 ""중국 법원서 '미르의전설2' IP 소송 1심 승소""",2023.01.06. 오후 1:41,"경기 성남시의 위메이드 사옥[촬영 김주환]    (서울=연합뉴스) 김주환 기자 = 위메이드는 액토즈소프트 측이 중국 법원에 제기한 '미르의 전설2' 지식재산(IP) 관련 소송 1심에서 승소했다고 6일 밝혔다.    위메이드에 따르면 중국 장시(江西)성 난창(南昌)시 중급인민법원은 이날 액토즈소프트가 위메이드를 상대로 낸 각색권 수권행위 금지 소송 청구를 모두 기각하고, 위메이드가 '미르의 전설2' 게임 IP를 각색할 권리를 행사할 수 있다고 판시했다.    위메이드는 2000년 액토즈소프트에서 분사한 기업으로, 두 회사는 '미르의 전설2' 저작권을 공동 보유하고 있다.    액토즈소프트 측은 2019년 위메이드를 상대로 '미르의 전설2' IP 기반 모바일 게임 개발을 중단하라며 현지 법원에 소송을 제기한 바 있다.    위메이드 관계자는 ""이번 소송을 통해 '미르의 전설2' IP 라이선스 사업에 문제가 없음을 다시 한번 확인받았다""며 ""IP 소유자로서 당연한 권리를 행사하기 위해 계속해서 노력하고, 중국 파트너사들과 긴밀하게 협업해 라이선스 사업에도 박차를 가할 계획""이라고 말했다.    jujuk@yna.co.kr",105,https://n.news.naver.com/mnews/article/001/0013685859?sid=103
