title,date,main,section,url
디지털 세대 ‘잘파(Zα)’를 잡아라… 게임 마케팅 강화한 삼성·LG,2022.09.11. 오전 6:01,"스마트폰 대중화 이후 태어난 Z세대유비쿼터스 영향 직접 받은 α세대유년기부터 경험한 게임을 소통 창구로 사용이들 잡기 위한 게임 마케팅 돌입한 삼성·LG



LG전자 42인치 벤더블 올레드 TV 플렉스. /LG전자 제공        ‘잘파(Zα)세대’가 가전 트렌드를 바꾸고 있다. 1990년대 중반에서 2000년대 초반에 태어난 Z세대와 2010년 이후 출생한 α(알파)세대는 완전한 디지털 세대다. 이들은 기존 문법으로는 이해하기 어려운 소비행태와 생활양식을 가지고 있어 Zα세대를 사로잡을 제품이 필요하다는 것이다. Zα세대의 마음을 빼앗을 여러 노력 중 두드러진 변화를 보이고 있는 건 게임 분야다. 유럽 최대 가전 전시회 IFA 2022에도 이런 경향이 나타났다.미국이나 영국, 한국 등 각국 기준에 따르면 Z세대는 스마트폰의 대중화로 완전한 디지털 세상을 경험한 첫 세대다. 문화적으로 개방됐고, 자기 개성을 표현하는 일에 능숙하다. 또 관심사나 소비활동, 가치관 등을 공유하고자 하는 성향이 있다. 이 세대가 가장 좋아하는 소셜미디어(SNS)가 짧은 동영상을 올리는 ‘틱톡’이라는 사실이 이를 보여준다.α세대는 Z세대보다 더 디지털화가 된 세대다. ‘선천적 디지털 세대’라고도 불린다. 스마트폰 대중화는 물론이고, 언제 어디서나 원하는 정보에 쉽게 접근하는 유비쿼터스 사회의 직접적인 영향을 받은 최초의 세대다. 특히 2013년 이후 출생자는 성장이 시작되는 영유아 시기부터 디지털 기기에 익숙하다. 스마트폰이나 모바일, 인공지능(AI)에 대한 이해도 높다. Z세대는 어린 시절 유튜브를 본 적이 없으나, α세대는 태어났을 때부터 유튜브를 경험했다는 차이가 있다. 그만큼 디지털 문화에 익숙하다는 뜻이다.



전시장에서 아빠와 10대 딸이 닌텐도 스위치 게임을 즐기고 있는 모습. /베를린(독일)=박진우 기자        이들은 유년기부터 경험한 게임을 소통의 창구로 삼는다. 에픽게임즈가 개발한 3인칭 슈팅게임 ‘포트나이트’는 게임보다 커뮤니티가 더 유명해져 메타버스 플랫폼으로 발전했다. 모장 스튜디오가 개발한 샌드박스(특별한 목표 없이 자유롭게 무언가를 할 수 있는 게임 장르) 게임 ‘마인크래프트’ 또한 소통의 창구로 이용된다. 현재 많은 메타버스 플랫폼이 게임 형식을 빌리고 있는 것도 이 때문이다. 네이버 메타버스 플랫폼 제페토는 전 세계 3억명의 가입자를 보유하고 있을 정도로 커졌다.Zα세대는 다양한 게임 관련 동영상을 시청하는 ‘트위치’ 등의 사용에도 거부감이 없다. 스트리밍 게임이나 콘솔, PC, 모바일 등 특정 기기를 가리지 않고 게임 콘텐츠를 소비한다.미래 소비 세력인 이들이 떠오르면서 가전 회사들도 이들을 잡기 위한 새 제품을 속속 선보이고 있다. 삼성전자가 최근 세계 3대 게임쇼인 독일 게임스컴에서 최초로 선보인 오디세이 아크도 Zα세대를 공략하기 위한 가전 중 하나다.



삼성전자 게이밍 모니터 오디세이 아크. /베를린(독일)=박진우 기자        오디세이 아크는 1000R(반지름이 1000㎜인 원이 굽은 정도) 곡률을 가진 55인치 스크린이다. 165㎐ 주사율(1초에 디스플레이에 표시되는 화면의 숫자)을 가지고, 그레이to그레이(10% 음영 회색에서 90% 음영 회색으로 변하는 데 걸리는 시간, 주로 액정표시장치 모니터의 반응속도를 측정하는 단위로 사용된다) 1㎳(밀리초·0.001초)의 응답속도를 지원한다. 오디세이 아크는 높낮이 조절과, 상하 각도 조절, 가로세로 전환이 가능한 최초의 게임 모니터다. 가로 화면을 볼 수 있고, 원할 경우 세로 화면으로도 전환이 가능하다. 동시에 여러 화면을 볼 수 있는 멀티뷰를 지원, 게임과 라이브 스트리밍 중계를 한 번에 볼 수 있다. 특정 게임을 하면서 해당 게임에 관련된 유튜브나 트위치 중계를 볼 수 있다는 뜻이다.오디세이 아크는 삼성전자의 스트리밍 게임 플랫폼 ‘삼성 게이밍 허브’를 기본 채용하고 있다. 콘솔이나 PC 없이도 게임을 즐길 수 있다는 얘기다. 한국의 경우 엑스박스 게임패스와 엔비디아 지포스 나우를 서비스한다. 미니발광다이오드(LED)를 채용했고, AI 기반 신경망과 1만6384단계로 밝기와 명암비를 제어하는 ‘콘스라트스 캠핑’ 기술이 더해졌다. 60W 2.2.2채널의 돌비 애트모스를 지원하며, 사운드 돔 테크라는 신기술이 쓰였다. 빛 반사를 최소화한 매트 디스플레이를 장착한 점도 특징이다.



삼성전자 게이밍 모니터 오디세이 아크. /베를린(독일)=박진우 기자        장강일 삼성전자 영상디스플레이사업부 상무는 “게이머의 요구가 다양해지고, ‘크로스 플랫폼’이 보편적 트렌드가 돼 가고 있는 만큼 어떤 상황에도 잘 대응할 수 있는 제품을 만드는 게 핵심이다”라며 “사용자 요구가 가장 폭발적인 분야가 게임이기 때문에 계속 고민하고 (제품을 선보이는 일에) 노력할 것이다”라고 했다.LG전자는 화면을 구부렸다 펴는 벤더블 게이밍 TV ‘플렉스’를 최근 소개했다. 42인치 크기의 유기발광다이오드(OLED) TV다. 화면을 콘텐츠에 맞게 구부렸다 펼 수 있어서 활용도가 높다. 빛을 쏴주는 백라이트가 없어 이런 폼팩터(제품 구조)가 가능했다는 게 LG전자 설명이다. 플렉스라는 제품명에는 ‘유연한’이라는 뜻을 가진 영어단어 ‘플렉서블(flexible)’과 ‘뽐내고 자랑하다’는 의미의 신조어 ‘플렉스(flex)’가 동시에 담겼다.



LG전자 게이밍 TV 플렉스로 추억의 게임을 즐기고 있는 전시회 10대 관람객들. /베를린(독일)=박진우 기자        LG전자 플렉스는 최대 900R 곡률까지 20단계로 휜 정도를 조절할 수 있다. 영화나 동영상 감상 등 일반 콘텐츠를 볼 때는 평평한 화면으로, 몰입이 필요한 게임을 할 때는 화면을 휘게 하는 것이다. 화면의 변환은 버튼 하나로 간단하다. 오디세이 아크가 손으로 직접 가로와 세로 화면을 바꾸는 것과 차이가 있다.플렉스는 화면을 위아래로 최대 15° 기울일 수 있는 틸트 기능과 최대 14㎝내에서 높낮이 조절이 가능하다. 1인칭 슈팅게임(FPS), 역할수행게임(RPG) 등 게임 장르에 맞춰 모니터 설정을 미리 최적화한 프리셋을 지원한다. 내장 마이크 탑재로 함께 게임을 즐기는 이용자와 대화할 수 있으며, USB 스위칭 허브 기능으로 TV와 PC를 번갈아 사용할 수 있다.



LG전자 42인치 게이밍 올레드 TV 플렉스. /베를린(독일)=박진우 기자        0.1㎳ 응답속도, 그래픽 호환 기능, 돌비비전 게이밍, 4K 해상도, 주사율 120㎐ 등으로 완전 게임 전용 스크린은 아니지만, TV 시장과 게임 시장을 동시에 공략하겠다는 게 LG전자 설명이다. 40W 전면지향 스피커를 넣고, 돌비 애트모스를 지원해 입체 음향 환경을 만드는 점도 특징이다. 5세대 인공지능 알파9 프로세서로 화질을 높이고, SRS(슈퍼안티리플렉션) 패널로 빛 반사를 줄인 부분도 눈에 띈다.백선필 LG전자 TV CX(고객경험) 담당 상무는 “플렉스는 LG전자가 실제 게이머들과 함께 개발한 TV다”라며 “TV가 가진 장점을 바탕으로 게임시장도 흡수하겠다”고 했다.",105,https://n.news.naver.com/mnews/article/366/0000839885?sid=103
"라이언 달, '오라클' 자바스크립트 상표 공개 전환 요구",2022.09.11. 오후 3:15,"노드JS 개발자인 라이언 달이 자바스크립트 상표의 공개 도메인 전환을 요구하는 서한을 오라클에 발송했다.3일(현지시간) 라이언 달은 상업적 가치가 없는 자바스크립트 상표를 공개 도메인으로 전환해 개발자가 안심하고 사용할 수 있도록 지원하고, 오라클의 브랜드 가치를 높일 것을 공식 홈페이지를 통해 제안했다.자바스크립트는 넷스케이프 네비게이터 2.0의 스크립트 언어로 사용하기 위해 브랜든 아이크가 개발했다. 현재 전 세계에서 가장 많이 쓰이는 프로그래밍 언어다.



노드JS, 디노 개발자 라이언 달(이미지=공식 블로그)오라클은 2010년 썬을 인수하며 자바스크립트 상표를 확보했다. 하지만 해당 상표를 활용해 오라클이 얻는 것이 없으며, 오히려 상표권 침해를 피하려는 개발자의 불편만 증가하고 있다는 것이 라이언 달의 지적이다.오라클은 현재 자바스크립트 확장 툴킷 외에 해당 상표를 사용하는 제품을 제공하고 있지 않으며, 추후 관련 제품을 선보일 계획도 공개하고 있지 않다.또한 라이언 달은 V8, 자바스크립트코어, 스파이더몽키 등 자바스크립트 엔진 개발에도 오라클이 참여하지 않고 있다고 밝혔다.그는 “자바스크립트 상표는 세계에서 가장 인기 있는 프로그래밍 언어 위에 드리워진 어두운 구름”이라며 “주의 깊게 법률을 준수하는 엔지니어는 사용을 피하기 위해 ECMA스크립트 같은 혼란스러운 용어를 만들고 있다”고 설명했다.이어서 “오라클이 상표를 통해 얻을 수 있는 최고의 가치는 공개 도메인으로 전환하는 것”이라며 “이를 시행하기 위해선 매우 진취적인 사고와 높은 수준의 능력이 요구되겠지만 브랜드 마케팅과 영업권을 위해 무가치한 상표를 교환하는 것은 분명히 올바른 조치다”라고 강조했다.",105,https://n.news.naver.com/mnews/article/092/0002267785?sid=103
"손흥민 손잡을 어린이는…KT, 플레이어 에스코트 선발",2022.09.11. 오후 12:18,"국가대표 훈련장서 ‘키즈랜드 축구 캠핑’도 진행



대한민국 축구 국가대표팀과 플레이어 에스코트 어린이들.ⓒKT[데일리안 = 남궁경 기자] KT 영·유아동 전용 인터넷(IP)TV 서비스 ‘올레 tv 키즈랜드(키즈랜드)’에서 9월 ‘축구 국가대표팀 친선경기(A매치)’플레이어 에스코트 어린이를 뽑는다.11일 KT에 따르면, 선발된 플레이어 에스코트는 오는 23일 코스타리카 경기와 27일 카메룬 경기에서 선수들과 손을 잡고 입장하게 된다. 선발 대상은 KT 이용 고객 자녀 중 만 6세~만 10세 사이의 어린이로 각 경기당 22명씩 총 44명을 선발한다.신청은 KT 공식 인스타그램, 페이스북, 네이버 포스트에서 가능하다. 접수 기간은 오는 15일 오후 6시까지다. 당첨자에는 19일 이후 개별 연락한다.KT는 A매치를 기념해 27일부터 28일까지 1박 2일 동안 축구 국가대표팀 훈련장 파주 NFC에서 키즈랜드 축구 캠핑도 진행한다. 축구 캠핑을 통해 KT 고객은 그동안 공개되지 않았던 국가대표팀의 훈련장 투어 외에도 레전드 국가대표 선수와 함께 축구 레크리에이션 세션이 열린다.대한민국과 카메룬의 경기가 진행되는 27일은 키즈랜드 축구 캠핑에 참여하는 가족과 단체 응원도 진행한다.총 70가구를 선정하는 키즈랜드 축구 캠핑은 만 12세 이하 자녀 동반이 가능한 KT 고객이라면 누구나 가능하다. 키즈랜드 캠핑 홈페이지에서 오는 19일 오후 6시까지 응모 가능하며 20일 당첨자에 개별 연락 한다.구강본 KT 커스토머사업본부장 상무는 “대한민국 축구 국가대표팀 파트너사인 KT가 키즈랜드 고객을 위해 잊지못할 추억과 긍정적인 경험을 제공하고자 이번 프로모션을 기획했다”라며 “앞으로도 키즈랜드와 함께하는 다양한 참여형 고객 혜택을 확대해 나가겠다” 라고 말했다.한편, 올레 tv 키즈랜드는 현재 국내 IPTV 중 가장 많은 7만여편의 키즈 콘텐츠를 보유하고 있다. 키즈랜드는 2018년 5월 출시 이후 3년 6개월만에 누적 이용 600만 가구를 기록했고, 4년 연속 ‘대한민국 브랜드 명예의 전당’ 키즈 콘텐츠 부문에서 수상한 바 있다.",105,https://n.news.naver.com/mnews/article/119/0002638186?sid=103
"[공시분석]'CB 발행' 디엑스앤브이엑스, '자금 조달·신뢰회복' 일거양득",2022.09.11. 오전 11:00,"알아두면 도움이 될 의미있는 공시를 소개·분석합니다.



디엑스앤브이엑스 홈페이지 화면. (사진=디엑스앤브이엑스)공시요약오늘 소개할 공시는 디엑스앤브이엑스(디엑스)가 지난 7일 공시한 '주요사항보고서(전환사채발행결정)'입니다. 공시명은 따분하지만 내용은 재밌습니다. 디엑스는 디에이제일차 주식회사를 상대로 178억원 규모의 전환사채(CB) 발행을 결정했습니다. 전환사채는 회사가 투자자로부터 돈을 빌리고 발행하는 채권입니다. 향후 주식으로 '전환'할 수 있는 권리를 부여합니다. 이 때문에 '전환'사채인 거죠. 발행 관련 구체적 내용을 보면, 청약일과 납입일 모두 8일입니다. 사채 만기일은 3년 뒤인 2025년 9월8일입니다. 표면이자율과 만기이자율은 모두 0% 입니다. 거래정지 스토리디엑스는 2001년 설립된 회사입니다. 유전자 진단과 항암치료제 개발이 주력 사업입니다. 2015년 코스닥 시장에 상장했습니다. 올해 6월 말 기준 자산 규모는 417억원 정도이고요. 바이오벤처 기업으로 분류됩니다. 디엑스 CB 발행 결정 공시가 눈에 띄는 건 회사가 처한 상황 때문입니다. 디엑스는 2019년 3월부터 코스닥 시장에서 거래가 정지된 기업입니다. 기존 사명은 '캔서롭' 이었는데요. 지난해 말 임시주주총회에서 현재 사명으로 변경했습니다.디엑스 외부감사인이던 '안진회계법인'은 디엑스가 제출한 2018 사업연도 감사보고서에 '의견 거절'을 냈습니다. 당시 감사보고서를 보면 안진회계법인의 의견 거절 사유를 확인할 수 있는데요. 안진회계법인은 디엑스의 해외 소재 기업 회계처리 관련 충분한 감사 증거를 입수하지 못했다고 밝혔습니다. 디엑스는 이에 반발하고, 한국거래소에 이의신청했습니다. 대표이사도 교체하며 거래 지속 의지를 드러냈습니다. 결국 의견거절 사유를 해소했고, 2020년 4월 '적정' 의견을 받아냈습니다. 다만 이게 끝이 아니었는데요. 2019년 사업연도에도 '비적정' 의견을 받았습니다. 투자주의 환기종목으로 지정돼 상장적격성 실질심사 사유가 추가됐죠. 이후 '개선계획 제출과 거래소의 심의 절차'가 이어졌는데요. 상장 폐지라는 최악은 피했지만 거래는 계속해서 정지된 상태입니다. 디엑스 주주 입장에선 우울한 나날이었습니다. 디엑스 입장에서도 불명예스러운 나날이고요. 디엑스는 지난해부터 명예 회복에 나섰습니다. 한미약품 오너 2세 임종윤 한미사이언스 사장이 최대주주에 오른 게 시작이었습니다. 



임종윤 한미사이언스 사장의 지분 인수 관련 내용. (자료=디엑스앤브이엑스 반기보고서)임 사장은 지난해 8월 본인이 보유했던 한미사이언스 지분 200억원 규모의 구주를 디엑스 신주와 바꿨습니다. 올해 6월 말 기준 임 사장의 디엑스 지분율은 19.6%입니다. 임 사장은 최대주주에 올라선 뒤 사명을 변경(캔서롭→디엑스앤브이엑스)하고 이사진에 최측근을 배치, 경영에도 적극적인 영향력을 행사하고 있습니다. 반기보고서에 따르면 현재 4인의 사내이사가 있는데요. 임 사장의 개인 회사 '코리컴퍼니'에서 근무한 임원들입니다. '이자율 0%' CB 발행...거래재개 신호탄?디엑스는 확 달라졌습니다. 흑자 전환까지 이뤄냈습니다. 올해 상반기 매출은 131억원, 영업이익은 11억원을 기록했습니다. '바이오벤처=적자' 공식을 깬 거죠. 임 사장이 최대주주에 올라선 뒤 공들이는 '바이오·헬스케어' 사업 부문은 상반기 55억원의 매출을 기록, 흑자로 돌아서는데 결정적 역할을 했습니다. 자체 개발한 산모와 영유아 관련 제품의 수출이 주된 사업 내용인데요. 중국을 중심으로 시장을 넓혀갈 계획입니다. 



매출 발생 구조. (자료=디엑스앤브이엑스 반기보고서)개선된 상황 속 CB 발행이 의미하는 바는 뚜렷합니다. 보통 거래정지 상황에서는 외부 자금조달이 쉽지 않습니다. 그런데 디엑스는 이를 해냈습니다. 기업 이미지 개선과 미래 성장 동력 확보에 속도를 높일 수 있게 된 거죠. 디엑스 관계자는 ""금리인상 등 시장의 분위기가 좋지 않은 상황에서 거래정지 중인 기업이 이례적으로 외부 투자유치에 성공했다""며 ""임종윤 최대주주가 보여준 책임경영 의지와 경영 체질 개선을 통해 거듭나고 있는 디엑스앤의 성장 가치를 기관투자자들이 긍정적으로 평가한 것으로 볼 수 있다""고 말했습니다. 시장에서도 디엑스의 자신감에 힘을 더해주는 모습입니다. 이번 CB는 표면이자율과 만기이자율 모두 0%입니다. 채권자가 이자보다 디엑스 주식전환을 목적으로 회사에 돈을 빌려줬다고 봐야겠죠. 주식 전환으로만 이익을 실현할 수 있다고 평가한 겁니다. 디엑스 입장에선 지분 희석 부담은 있지만, 이자비용을 내지 않고 100억원대 자금을 활용할 수 있게 됐습니다. 최근 금리인상 기조를 고려하면 회사 측에 상당히 유리한 조건입니다. 이 때문에 일각에선 CB 발행 결정을 거래재개 신호탄으로 평가합니다. 디엑스는 오는 11월 한국거래소의 개선 기간 종료를 앞두고 있습니다. 아직은 개선 여부가 정해지지 않았는데요. 만약 시장에서 디엑스의 거래재개가 어렵다고 판단했다면, 투자 유치도 불가능했을 것이라는 게 업계 관계자들의 설명입니다. 디엑스도 거래재개를 자신하고 있습니다. 박상태 디엑스 대표는 지난 3월 정기주주총회에서 ""새로운 경영진이 합류한 이후 전반적인 체질 개선 작업이 순항 중""이라면서 ""실적을 기반으로 거래재개도 조기에 이뤄지도록 노력하겠다""고 강조했습니다.지표로 본 디엑스앤브이엑스",105,https://n.news.naver.com/mnews/article/293/0000040614?sid=103
[날씨] 온화한 오후‥일교차 여전,2023.10.29. 오후 8:31,"[뉴스데스크]거리마다 가을 정취가 가득한 가운데 날도 온화한 휴일이었죠.내일도 한낮에는 서울의 기온이 21도, 남부 지방은 부산이 22도까지 올라 예년 기온을 크게 웃돌겠습니다. 그래도 아침 저녁으로는 썰렁하니까 일교차에 대비한 옷차림은 필수겠고요.  이른 시간에는 또다시 짙어지는 안개를 주의하셔야겠습니다.  내일 오전까지 내륙 지방을 중심으로 가시거리가 800m에서 최소 50m까지도 좁혀질 수 있으니까요. 앞차와의 간격 넉넉히 두시고 안전 운전하셔야겠고요.  공기 질은 대체로 무난하겠지만 수도권과 충남 지방의 경우 대기 정체로 내일 오전까지 미세먼지 농도가 높게 나타날 수 있겠습니다. 안개와 먼지는 내일 오후부터 차츰 거치겠고요. 내일 전국의 하늘에는 가끔 구름만 많이 지나겠습니다.내일 아침 기온 보시면 서울을 비롯한 전국이 10도 안팎의 분포로 예년 기온을 웃돌겠고요. 춘천과 안동은 6도에서 시작하겠습니다. 낮 기온도 보시면 서울과 대전 21도, 광주와 대구 22도까지 오르겠습니다. 달력의 그림이 바뀌는 다음 주 수요일에는 수도권과 영서 지방에 비가 내리겠고요. 그다음  주에는  수도권  지방을 중심으로 미세먼지가 유입될 가능성이  있습니다.  날씨였습니다.MBC 뉴스는 24시간 여러분의 제보를 기다립니다. ▷ 전화 02-784-4000▷ 이메일 mbcjebo@mbc.co.kr▷ 카카오톡 @mbc제보",105,https://n.news.naver.com/mnews/article/214/0001308342?sid=103
