title,date,main,section,url
"KT, 올해 첫 골드번호 5000개 추첨…1인당 3개 번호 응모 가능",2022.05.26. 오전 10:26,"골드번호 추첨 포스터. KT 제공    KT는 6월 8일까지 2022년 상반기 골드번호 추첨행사를 연다고 26일 밝혔다. 골드번호란 휴대전화 뒤 4자리로 식별이 용이해 선호도가 높은 번호로, 정부 시책에 따라 매년 2차례 추첨을 통해 제공한다. 추첨행사를 통해 응모할 수 있는 전화번호의 유형은 AAAA, 000A, A000, AA00, 00AA, ABAB, ABCD, ABCD-ABCD, 특정의미(1004, 7942 등)형으로 총 5000개다.   전국 KT대리점 또는 KT플라자에 방문하거나 KT홈페이지, 모바일 고객센터 앱을 통해 1인당 최대 3개의 번호까지 응모할 수 있다. KT 이용자를 비롯해 MVNO(알뜰폰) 이용자, 타 통신사 이용자도 응모 가능하다.골드번호 추첨에는 과학기술정보통신부, 한국통신사업자연합회(KTOA) 등 관계자가 행사에 참여해 투명하게 진행된다. 골드번호는 타인에게 양도할 수 없으며, 골드번호를 사용 중이거나 1년 이내 골드번호 당첨 이력이 있는 고객은 응모에 제한된다.당첨 결과는 6월 13일에 KT홈페이지와 KT 모바일 고객센터 앱으로 발표된다. 당첨고객은 6월 13일부터 7월 3일까지 당첨된 번호를 등록해 사용할 수 있다. 골드 번호 추첨에 관련한 자세한 내용은 KT홈페이지 공지사항을 통해 확인할 수 있다.",105,https://n.news.naver.com/mnews/article/029/0002736219?sid=103
"정신건강과 IT기술이 만나면…복지부, 정신건강 R&D 공개토론회",2022.05.26. 오후 4:12,"정신건강 클리닉<<연합뉴스TV 캡처>>(서울=연합뉴스) 조민정 기자 = 보건복지부는 26일 한국보건산업진흥원과 공동으로 '대전환기 융합기술의 미래, 정신건강과 연구개발' 공개토론회를 개최했다.    이날 오후 서울 서초구 엘타워에서 열린 이번 포럼은 전 사회적으로 디지털 전환이 가속화하는 상황에서 정신건강 분야의 연구개발 방향을 모색하고자 기획됐다.    정신건강 문제는 객관적 수치화가 어려워 주로 증상 관찰을 통해 접근해왔고, 이에 따라 기술개발과 융합에 한계가 있다는 인식이 많았으나 최근 정신건강을 지표화할 수 있는 기술에 대한 관심이 높아지며 대전환기를 맞고 있다.    특히 코로나19 사태를 겪으면서 고립감을 느끼는 개인을 위한 비대면 심리상담 서비스나 정신건강 관리 어플리케이션 등이 눈길을 끈다.     이번 토론회에서는 정두영 울산과학기술원(UNIST) 바이오메디컬공학과 교수가 '정신건강 위기와 디지털 전환', 황희 카카오헬스케어 대표가 '모두의 디지털 헬스케어: 정신건강 접목'을 주제로 발표했다.    또 이헌정 고대안암교수와 강성지 ㈜웰트 대표는 정신건강 치료 기술개발 동향과 산업동향 사례를 소개했다.    정은영 복지부 정신건강정책관은 ""오늘 토론회 등록자가 350여명에 이를 정도로 정신건강 연구개발(R&D)에 대한 각계각층의 관심이 높다""며 ""정신건강은 최근의 기술융합 경향에 가장 부합하는 분야로, 우리나라가 전세계 디지털-건강 융합을 이끌 수 있도록 R&D를 적극 추진하겠다""고 말했다.    chomj@yna.co.kr",105,https://n.news.naver.com/mnews/article/001/0013207351?sid=103
"코렌텍, DMT 코팅 적용 인공관절 세계 최초 미국 FDA 승인",2022.05.26. 오후 2:55,"코렌텍, 자회사 인스텍과 공동 연구개발해엉덩이 관절 대체하는 인공비구컵 제품...FDA 승인인공발목관절, 인공무릎관절도 추가 개발 중[이데일리 김진호 기자]코렌텍이 인공고관절 인공비구컵 제품 ‘BENCOX Mirabo Z Cup Cortinium’에 대한 미국 식품의약국(FDA)의 승인을 획득했다고 26일 밝혔다.



(제공=코렌텍)이번에 FDA로부터 승인받은 코렌텍의 인공비구컵은 고에너지적층(DED) 방식의 생체금속 3차원(3D) 프린팅 코팅 기술이 세계 최초로 적용됐다. 퇴행성 병변, 골절, 종양 등의 적응증에 의해 손상된 엉덩이 관절의 비구부를 대체할 수 있는 제품이다.인공비구컵 표면은 뼈가 자라 들어가 견고하게 고정될 수 있도록 미세한 공극이 형성된 다공성 코팅이 필수적이다. 현재 전 세계적으로 ‘티타늄 플라즈마(TPS)’ 코팅이 가장 많이 사용되고 있지만, 인공관절과 완전히 융합되지 않아 재수술을 유발하는 문제가 있다. 환코렌텍은 자회사인 금속 3D프린터 전문기업 ‘인스텍’과 협력해 DED 방식의 일종인 ‘직접금속성형기술(DMT)’ 기술을 활용해 인공비구컵에 다공성 코팅을 형성하는 기술을 세계 최초로 개발하는데 성공했다. DMT는 인공관절의 표면에 레이저를 조사함과 동시에 의료용 티타늄 분말을 용융시켜 뼈와 유사한 형태의 다공성 구조를 만들어 내는 기술이다. 코렌텍은 인공비구컵의 미국 시장 진출을 본격화할 예정이며, 인공발목관절과 인공무릎관절도 각각 2023년과 2024년에 출시하는 것을 목표로 연구개발하는 중이다.선두훈 코렌텍 대표는 “10년 이상 시행착오 끝에 혁신적인 생체코팅 기술이 적용된 제품을 완성했다. 기존 티타늄 플라즈마 코팅 제품을 대체할 수 있을 것”이라며 “인공비구컵 등 미국 시장에서 판매할 고가의 인공관절제품을 늘수록 회사의 매출 성장, 수익 개선이 동시에 이뤄질 것으로 기대한다”라고 설명했다.",105,https://n.news.naver.com/mnews/article/018/0005226066?sid=103
"그라비티, 닌텐도 스위치용 어드벤처 게임 2종 정식 출시",2022.05.26. 오후 3:02,"[디지털데일리 왕진화 기자] 그라비티가 닌텐도 스위치용 어드벤처 게임 2종을 내놨다.   그라비티(대표 박현철)는 일본 지사인 그라비티 게임 어라이즈 (Gravity Game Arise, GGA)를 통해 닌텐도 스위치용 어드벤처 게임 ‘소녀와 우주 이야기(영문명 Milkmaid of the Milkyway)’와 ‘에릭 할아버지의 신비한 팔찌(영문명 EMBRACELET)’를 아시아 지역에 정식 출시했다고 26일 밝혔다.   소녀와 우주 이야기는 지난 2017년 여러 게임 어워드에서 다수 노미네이트된 미스터리 탈출 어드벤처 게임이다. 이용자는 1920년대 노르웨이를 주 무대로, 조사를 통해 얻은 아이템과 정보를 적합한 장소에서 사용해 이야기를 진행시킬 수 있다.   에릭 할아버지의 신비한 팔찌는 노르웨이 북부에 사는 17세 소년 제스퍼가 할아버지 에릭의 유품인 이상한 팔찌에 얽힌 수수께끼를 풀어나가는 3차원(3D) 어드벤처 게임이다.할아버지가 살던 작은 섬의 숨겨진 과거와 그곳에서 만나는 동료들과의 잔잔한 모험 등을 제스퍼 시점으로 체험 가능하다. 멀티 엔딩 시스템을 통해 다양한 게임 결말을 만들 수 있다.   이번 타이틀 2종은 한국어, 일본어, 중국어 번체, 중국어 간체 등 총 4가지 언어가 지원된다.    그라비티 게임 어라이즈(GGA)는 닌텐도 스위치 타이틀 2종 출시에 맞춰 오늘(26일) 오후 7시(일본 표준시 기준)부터 유튜브 라이브 방송을 진행한다. 라이브 방송에서는 타이틀 2종의 아시아 버전 제작 비하인드 소개와 함께 게임 플레이를 중계한다. 출시 기념 이벤트를 통해 다양한 상품도 증정할 예정이다.   그라비티 게임 어라이즈(GGA)는 “이번에 출시한 닌텐도 스위치용 타이틀 2종은 친근한 그래픽, 평화로운 배경음악(BGM) 등 이용자들이 편안한 분위기 속에서 플레이할 수 있는 게임”이라며 “이용자들이 게임을 즐기면서 지친 일상 속에서 잠깐의 여유를 느끼실 수 있길 바란다”고 전했다.",105,https://n.news.naver.com/mnews/article/138/0002125464?sid=103
"대한상의 ""일자리·저출산문제 해결 시급...경제 구조적 문제는 답보상태""",2022.05.26. 오후 3:18,"우리나라 경제 체질 개선을 위해 '일자리 문제'와 '저출산' 극복이 시급하다는 조사 결과가 나왔다. 대한상공회의소는 국민 300명을 대상으로 실시한 '한국 경제의 구조적 문제에 대한 국민인식 조사' 시행 결과를 26일 밝혔다.



한국경제 구조적 문제 우선순위 (출처 대한상의)가장 시급하게 해결해야 할 구조적 문제를 묻는 질문에 국민은 '청년실업 등 일자리 문제'(83.7%)와 '저출산·고령화'(81.7%)를 가장 많이 꼽았다. 이어 '환경과 탄소중립 대응(77.0%)' '성장잠재력 저하(76.7%)' 순으로 나타났다.한국경제 구조적문제들이 얼마나 해결되고 있는지 묻는 질문에 국민 87.7%는 '답보 상태'에 있거나 '오히려 악화'되고 있다고 답했다. '개선되고 있다'는 답변은 12.3%였다.



구조적 문제 개선 정도 (출처 대한상의)문제해결이 부진한 이유에 대해 국민은 '정책디테일 부족 등 제대로된 해법 부족'(54.8%)과 '정책실행 뒷밤침할 여건 미흡'(36.1%)이라고 느꼈다.구조적 문제 해결을 위한 바람직한 접근 방법에 대해서는 89%의 국민이 '단기성과에 치중하지 않은 장기적 관점읠 일관된 정책'을 주문했다. '인센티브시스템을 통한 민간부문 적극 참여'(78.7%)와 '민간 아이디어 적극 활용'(71.7%)도 해법으로 뽑혔다.한국경제 구조적 문제 개선을 위한 기업의 역할은 '과감한 연구개발 투자'(88.0%) '소통강화를 통한 문제해결 동참'(86.7%) '환경·사회·지배구조(ESG)경영, 사회적 약자 지원 등 사회적 가치 창출'(85.3%) 등이 필요하다고 답했다.김현수 대한상의 경제정책실장은 “한국경제 구조적 문제를 바라보는 국민 시선과 민간 중심 새정부 정책기조가 일맥상통하는 만큼 향후 국정운영과 세부 정책 수립과정에 반영되길 바란다”고 말했다.",105,https://n.news.naver.com/mnews/article/030/0003019568?sid=103
"SKT, 여행·마트로 ‘T우주’ 제휴처 확대",2022.05.26. 오전 10:16,"[디지털데일리 백지영기자] SK텔레콤은 자사 구독 서비스 ‘T우주’의 선택권 확대를 위해 하나투어와 홈플러스, 프레시코드, 한국맥널티 4곳을 우주패스 올(all)의 제휴처로 추가했다고 26일 밝혔다.이에 따라 우주패스 올 제휴처는 총 48곳으로 늘었다. 하나투어를 선택하는 고객은 매월 1만 마일리지(1마일리지=1원)를 받는다. 여기에 하나투어를 통해 여행을 예약할 경우 기본 1% 적립에 1%의 추가 적립 혜택도 받을 수 있다.홈플러스의 경우 5만원 이상 구매 시 사용 가능한 5000원 할인쿠폰 3장과 2만원 이상 구매 시 사용 가능한 3000원 할인쿠폰 2장 등 총 2.1만원 상당 혜택을 매달 받게 된다.윤재웅 구독마케팅 담당은 “본격적인 여름 휴가철 돌입에 앞서 고객들이 누릴 수 있는 혜택을 늘리는 차원에서 제휴처 4곳을 새롭게 추가했다”며 “앞으로도 제휴처 확대와 11번가 아마존 글로벌 스토어 상품의 확대를 위해 앞으로도 노력할 것”이라고 밝혔다.",105,https://n.news.naver.com/mnews/article/138/0002125432?sid=103
"플라즈맵, 독일 임플란트 품질평가기관과 협력방안 논의",2022.05.26. 오후 3:10,"하반기 코스닥 입성 예정



플라즈맵은 독일의 임플란트 품질평가 기관인 클린임플란트재단이 회사를 방문했다고 26일 밝혔다. 양 기관의 대표는 임플란트의 품질관리에 대해 협의했다.클린임플란트는 비영리 재단이다. 임플란트 표면의 불순물 제어 등 임플란트의 품질을 정기적으로 평가하고 있다는 설명이다. 평가를 통과한 소수의 임플란트에 인증을 부여한다. 환자들이 보다 안전한 수술을 받을 수 있도록 품질평가 정보를 제공하는 것을 목적으로 설립됐다. 플라즈맵은 진공 플라즈마를 이용해 임플란트 표면의 불순물을 효과적으로 제거하는 솔루션을 개발했다. 세계에서 유일하게 유럽 의료기기 허가(CE MDR)를 획득했다고 전했다. 이 기술은 클린임플란트의 평가를 통과해 최초로 표면처리 기술 인증을 획득했다. 치과용 임플란트뿐 아니라 정형외과 임플란트 및 인체 생체조직으로 적용 범위를 확대하고 있다.플라즈맵은 이달 27일부터 29일까지 서울 코엑스에서 진행되는 'SIDEX 2022'에 참가한다. SIDEX는 치과 분야 전시회다. 더크 더덱 클린임플란트 대표는 SIDEX에서 임플란트의 식립 실패를 주제로 임플란트 표면 품질관리의 중요성을 설명할 예정이다.회사 관계자는 ""플라즈맵의 바이오 플라즈마 기술에 유럽의 임플란트 평가기관에서 보여준 관심에 대해 기쁘게 생각한다""며 ""이번 SIDEX 기간 중 보다 구체적인 협력 방안을 협의할 계획이며, 궁극적으로 환자들이 보다 안전하고 효과적인 수술을 받는 데 기여할 수 있기를 기대한다""고 말했다.플라즈맵은 기술특례를 통해 올 하반기 코스닥 시장에 입성할 예정이다. 상장 주관사는 미래에셋증권이다.",105,https://n.news.naver.com/mnews/article/015/0004704063?sid=103
"증가하는 우주쓰레기, 잠재적 위험 대처 위한 현 주소는...KIRD, 과학자 소통 포럼 개최",2022.05.26. 오후 12:40,"제2회 과학자 소통 포럼에 참석한 (왼쪽 두번째부터)최은정 한국천문연구원 우주위험연구실 실장, 이성문 우주로테크 대표, 이주진 전 한국항공우주연구원장, 이규수 전 한국항공우주연구원 홍보협력부장이 우주개발 관련 토의를 진행했다. 사진=국가과학기술인력개발원상업적·군사적 목적을 위한 우주공간 개발이 활발해짐과 동시에 이로 인한 인공위성 등 우주물체 간 충돌로 우주쓰레기 추락위험이 증가하면서 우리나라를 비롯한 전 세계가 감시 및 수거 기술개발에 주목하고 있다.국가과학기술인력개발원(KIRD·원장 박귀찬)은 지난 25일 제2회 과학자 소통 포럼을 열고 우주물체 위험과 위협 대응을 위한 우주감시 기술 확대 방안을 모색했다.이날 최은정 한국천문연구원 우주위험연구실 실장은 '우주쓰레기의 위험과 위협에 대응하는 우주감시기술'을 주제로 발제자로 나섰다.최 실장은 “현재 지구 주변 지름 10㎝ 이상 물체는 약 2만5000여개다. 이 중 20%만이 운용 중인 인공위성으로 위성을 계속 쏘아 올리는 추세에 따라 이는 더 늘어날 것”이라며 우주물체 지상 추락 및 피해 발생 가능성 증대 현실을 강조했다.그는 이에 대응하기 위한 미국과 유럽 등 주요국의 우주 위험 상시 감시기술을 소개하면서 관련 혁신기술 개발을 통해 세계시장 선점 기회를 확보하려는 움직임이 가속화되고 있는 점에 주목했다.최 실장은 “우리나라 또한 제1차 우주 위험대비 기본계획 제정, 우주 환경감시기관 지정 등 우주감시 기술 발전과 국가 우주 위험대비 역량이 발전해 왔다”며 “잠재적 위험 증가 및 이와 관련한 국제협력 지위 확보를 위해 앞으로 독자적 우주물체 감시 추적 기술개발이 활성화돼야 할 것”이라고 말했다.발제 이후엔 이주진 전 한국항공우주연구원장, 이규수 전 한국항공우주연구원 홍보협력부장, 이성문 우주로테크 대표 등 전문가 패널과 참석자 간 질의응답을 통한 토론이 진행됐다.이 자리에서 우주 위험 감시 대응을 위한 산·학·연 역할과 협력 방안, 우주 분야 내 우리나라 국제협력 및 외교 역량을 높이기 위한 노력 등에 대해 논의가 이뤄졌다.한편 KIRD는 내달 29일 예정된 양자컴퓨터(박성수 한국전자통신연구원 양자기술연구단장)를 비롯해 7월 27일 사이버보안(김용대 카이스트 전기 및 전자공학부 교수), 8월 10일 융합연구(김현우 한국과학기술연구원 융합연구정책센터 소장)를 주제로 과학자 소통 포럼을 이어갈 예정이다.",105,https://n.news.naver.com/mnews/article/030/0003019482?sid=103
"카페24, 대만 ‘라인쇼핑’ 입점부터 마케팅까지 지원",2022.05.26. 오전 8:36,"EC페이, 패밀리마트 등 현지 결제·물류서비스 연동까지글로벌 전자상거래 플랫폼 카페24(대표 이재석)는 차별화된 경쟁력을 갖춘 한국 기업이 대만 온라인 쇼핑 시장에서 한층 더 쉽게 상품 판매가 가능하도록 '라인쇼핑 대만 패키지'를 출시했다고 26일 밝혔다.이번 서비스 강화의 주요 내용은 대만 라인쇼핑 입점부터 효과적인 상품 전시와 현지에 최적화된 마케팅, 배송, 회계 등의 서비스를 폭넓게 지원하는 것이다. 카페24 마켓플러스 서비스와 대만 라인쇼핑 연동을 기반으로 자사 브랜드의 상품과 주문 정보를 손쉽게 연동할 수 있으며, 카페24의 전문 인력이 각 기업의 상황에 적합한 1:1 맞춤 컨설팅 서비스를 제공해 온라인 사업자의 해외 진출이 원활해질 수 있도록 돕는다.특히 온라인 결제서비스 'EC페이'와 대만 '패밀리마트 택배' 등 현지 소비자가 주로 사용하는 서비스를 연동한 것도 특징이다. 이에 온라인 사업자는 소비자가 지정한 편의점에서 택배를 수령하는 대만의 현장 현금 결제(COD) 환경에 손쉽게 대응할 수 있다. 패밀리마트는 대만 전역에 점포 4천개, 온라인 앱 회원 수 1천500만 명 이상을 보유한 편의점이다. EC페이는 대만 4대 편의점을 포함한 20만여 기업에 서비스를 제공 중이다.



카페24, K브랜드 대만 진출 지원 강화여성의류 브랜드 '모코블링'을 운영하는 권아람 모코블링아이앤씨 대표는 ""현지에 대한 정보가 부족한 상태에서 상점 초기 세팅 설정 같은 세세한 부분부터 운영 전반에 대한 전문 노하우를 얻을 수 있어 해외진출이 한층 쉬웠다""며 ""라인에서 들어온 주문·CS를 카페24와 연동하는 방식으로 자사 브랜드과 통합 관리할 수 있어 운영 효율성까지 높다""고 말했다.카페24는 이번 대만 진출 지원 서비스 강화로 한류 인기가 높은 대만에 진출하고 싶지만 전문 인력이나 현지 정보가 부족해 고민하는 기업에 도움이 될 것으로 기대한다.이재석 카페24 대표는 ""대만은 한류 인기와 온라인 쇼핑 수요가 함께 급증세인 중요한 시장""이라며 ""앞으로도 대만은 물론 미국과 일본, 동남아 등 글로벌 각지에 한국 기업이 쉽게 진출하도록 서비스를 다각화할 것""이라고 말했다.대만에서 라인의 월간활성이용자(MAU)는 인구의 80% 이상인 2천200만여 명에 달한다. 라인이 운영하는 마켓플레이스인 '라인쇼핑'에 입점하면 라인 앱 내에서 우수 한국 상품을 소개해 상품 판매량과 매출을 빠르게 늘릴 수 있다. 이달 현재 D2C(Direct to Consumer, 소비자 직접 판매) 쇼핑몰이 대만 라인쇼핑과 직접 연동할 수 있도록 지원하는 플랫폼은 카페24가 유일하다.",105,https://n.news.naver.com/mnews/article/092/0002257912?sid=103
유전자 살짝 손봐 발암물질 줄인 밀… 영국 식탁 오른다 [사이언스카페],2022.05.26. 오전 7:37,"영국 정부 ’유전자 교정 농작물’ 허용안 상정... 의회 통과될 듯



영국 하트퍼드셔주에서 로탐스테드 연구소가 재배 중인 유전자 교정 밀. 연구소는 발암물질을 줄이고 낟알 크기를 키운 밀을 개발했다./로탐스테드 연구소										영국 정부가 25일 유전자 교정 농작물을 유전자 변형 농작물(GMO) 규제 대상에서 제외하는 법안을 의회에 상정했다. 집권당인 보수당이 의회 다수당인 점을 고려하면 법안은 거의 수정 없이 통과될 것으로 보인다. 이에 따라 유전자를 교정해 발암물질을 줄인 밀과 비타민 D가 크게 늘어난 토마토가 영국인의 식단에 오를 길이 열렸다.◇영국 “유전자 교정은 GMO 아니다” 판단유전자 교정(gene editing)은 효소 단백질인 크리스퍼 유전자 가위로 동식물의 유전정보가 담긴 DNA에서 특정 부위를 잘라내 원하는 특성을 구현하는 방법이다. 영국 정부가 상정한 ‘유전공학(정밀 교배) 법안’은 유전자 교정 작물을 개발하고 재배, 판매하는 것을 허용하는 내용이다.이번 법안은 영국이 유럽연합(EU)에서 탈퇴한 브렉시트(Brexit)의 결과물이다. EU는 유전자 교정 농작물도 GMO로 규정해 엄격하게 규제하고 있다. 반면 영국 정부는 유전자 교정과 GMO는 엄연히 다른 기술이라고 판단했다.과학자들은 유전자 교정은 교배가 가능한 같은 종 안에서 유전자를 수선한다는 점에서 다른 종의 유전자를 삽입하는 GMO와 다르다고 본다. 결국 유전자 교정은 수년씩 걸리는 전통적인 육종을 수개월로 단축했을 뿐이란 것이다.영국은 이를 근거로 지난해 유전자 교정 연구 관련 규제를 해제한 데 이어 이제 재배, 시판 규제도 없앤 것이다. 이제 유전자 교정 농작물로 만든 식품은 별도의 표시 없이 자유롭게 판매할 수 있다.



										◇과학계 “농업 경쟁력 강화에 도움” 기대영국 정부는 유전자 교정을 통해 가뭄과 병충해에 강하고 건강에 좋은 농작물을 만들 수 있어 농업 경쟁력 강화에 큰 도움이 될 것이라고 기대했다. 환경식품농무부의 수석자문과학자인 기드온 헨더슨 박사는 과학매체 뉴사이언티스트에 “유전자 교정은 자연적인 교배를 모방한 것”이라며 “유전자 교정은 영국의 경제성장을 촉진하고 환경에 도움을 줄 잠재력이 크다”고 밝혔다.실제로 영국은 유전자 교정 분야에서 세계적 성과를 내고 있다. 로탐스테드 연구소는 최근 건강에 좋은 유전자 교정 밀을 처음 파종했다. 밀에 아스파라긴이라는 아미노산이 많으면 이 밀가루로 구운 빵에 발암물질인 아크릴아마이드가 많이 생긴다. 로탐스테드 연구진은 크리스퍼 유전자 가위로 밀에서 아스파라긴 합성 유전자를 차단했다. 유전자 교정으로 낟알 크기를 키운 밀도 개발했다.존 인스 센터는 지난 24일 하루 두 알이면 비타민 D 결핍을 해결할 토마토를 개발했다고 국제 학술지 ‘네이처 식물’에 발표했다. 역시 유전자 교정으로 비타민 D를 다른 물질로 바꾸는 유전자 기능을 차단했다. 연구진은 이번 토마토 1개에 들어있는 비타민D 양은 계란 두 개나 참치 28g에 맞먹는다고 밝혔다. 유전자 교정은 가뭄과 병충해에 강한 농작물을 구현해 기후변화에 더 잘 대응할 수도 있다.농민들도 찬성 입장을 보였다. 전국농민연합의 데이비드 엑스우스 부회장은 BBC방송에 “과학기반의 수정 법안은 영국의 식품 생산과 환경에 많은 이익을 제공하고 농민들에게 인구증가와 기후변화 문제를 극복할 또 다른 도구를 제공할 것”이라고 반겼다.



비타민 D 생산량 늘린 유전자 교정 토마토와 일반 토마토. 외형으로는 구분이 되지 않는다./존 인스 센터										◇소비자 반응은 여전히 미온적반면 GMO에 반대해온 단체들은 이번 법안에 반발했다. 영국 유기농산물 단체인 토양 협회의 조 루이스 정책소장은 BBC방송에 “정부가 건강에 나쁜 식단과 농작물의 다양성 부족, 가축 과밀화, 이로운 곤충의 감소 같은 실질적인 문제에 집중하지 않고 인기가 없는 기술을 우선시 한 데 크게 실망했다”고 밝혔다소비자들도 유전자 교정 농작물에 대해 완전히 마음을 열지 않고 있다. 영국 BBC 방송은 농무부 자체 설문조사에서 응답자의 57%가 유전자 교정 농작물을 받아들일 수 있다고 답했지만 32%는 부정적인 입장을 보였다고 전했다. 뉴사이언티스트지는 영국의 주요 수퍼마켓들에 문의했더니 유전자 교정 식품을 판매할 수 있다고 답했지만 실제로 판매 준비를 하고 있는 업체는 한 곳도 없었다고 전했다.전문가들은 유전자 교정 농작물이 건강과 환경에 이롭다는 점을 알려 소비자 호응을 유도해야 한다고 본다. 실제로 영국 농무부 설문 조사에서 유전자 교정 농작물이 제초제나 살충제를 덜 쓰게 하는 등 환경에 도움이 되는 특성을 가진다면 받아들일 수 있다는 응답이 70%까지 올라갔다.",105,https://n.news.naver.com/mnews/article/023/0003693822?sid=103
,,,105,https://n.news.naver.com/mnews/article/236/0000224106?sid=103
