title,date,main,section,url
"中 화성정복 도전하고 日은 소행성 탐사...韓, 추격 여전히 먼길",2021.10.19. 오후 6:01,"[한국형발사체 '누리호' 21일 발사...한중일 '우주 삼국지']韓, 위성은 7대 강국 평가되지만우주발사체는 이제서야 홀로서기2027년까지 4회 추가 발사 예정컨트롤타워 부재로 정권따라 부침차기정권 우주전담기구 만들어야



[서울경제] ‘달과 화성 정복에 나서고 지구궤도의 우주정거장을 구축 중인 중국, 지구에서 3억 ㎞나 떨어진 소행성 시료를 채취해오는 일본···.’우주발사체의 자립을 위한 변곡점에 선 한국에 비해 까마득히 앞서가는 중국과 일본의 모습이다. 우리나라가 21일 오후 4시 고흥 나로우주센터에서 한국형 발사체(누리호)를 쏘아 올리는 역사적인 순간을 맞이하지만 여전히 갈 길이 먼 것이다. 하지만 우주발사체 개발을 위해 나선 지 30여 년 만에 홀로서기의 계기를 마련한 것은 평가할 만하다. 지난 1991년 말 소련 해체 이후 러시아에 견학 수준을 조금 뛰어넘는 정도의 기술 연수에 나섰던 때에 비하면 격세지감이다. 우리는 그동안 미국 주도의 미사일 기술 통제 체제(MTCR)와 국방 관련 수출입 규제(ITAR)로 인해 우여곡절이 많았다.전문가들은 역대 정권마다 우주개발 계획이 춤을 춘 것은 범부처와 연구계·산업계를 아우르는 우주 컨트롤타워가 없었던 이유가 크다며 차기 정권에서 우주 전담 기구의 필요성을 거론하고 있다.△우주발사체 홀로서기 본격화=우리나라는 이번에 1.5톤 더미(모사체 위성)를 실은 누리호를 남쪽으로 발사해 지상 600~800㎞ 저궤도 상공에 띄운다. 내년 5월에는 1.3톤 더미에 200㎏ 위성을 싣고 2차 발사를 한다. 이후 누리호의 성능을 높이기 위해 오는 2027년까지 네 차례 더 발사한다. 우리나라는 위성은 세계 7대 강국으로 평가되지만 우주발사체는 우주강국들에 비해 상당히 뒤처져 있다. 앞서 러시아(1957년), 미국(1958년), 유럽(1965년), 중국·일본(1970년), 인도(1980년), 이스라엘(1988년), 이란(2009년), 북한(2012년)은 우주발사체 자립에 성공했다. 이 중 이스라엘·이란·북한은 상대적으로 위성 발사 능력이 소형에 그친다. 이상률 한국항공우주연구원장은 “누리호가 성공하면 세계 일곱 번째로 중대형 액체 로켓엔진을 개발한 국가가 된다”며 “설계, 제작, 시험, 발사 운용 등 모든 과정을 우리 기술로 진행했다”고 뿌듯해했다. 누리호 개발 사업은 2010년 3월부터 2022년 10월까지 1조 9,572억 원이 투입된다.△고난이도 과학기술=높이 47.2m, 중량 200톤(연료 56.5톤·산화제 126톤)인 누리호는 75톤 추력을 내는 로켓엔진 4개를 클러스터링해 핵심인 1단부(대기권 돌파)로 사용하고 2단부(우주공간 이동)와 3단부(저궤도 위성 진입용)는 75톤 추력 엔진과 7톤 추력 엔진을 1개씩 쓴다. 부품이 37만 개에 달한다. 누리호 개발에는 한국항공우주산업(KAI)이 전체 조립, 한화에어로스페이스가 엔진 설계, 현대중공업이 발사대 구축에 나섰으나 제조·설계·조립·용접 등에 300여 개의 중소기업이 참여했다. 똑같이 추진력을 내야 하는 1단부 엔진들을 연료와 산화제를 담는 추진제 탱크(높이 10m·직경 3.5m)에 연결해야 한다. 연료 점화를 위한 액체산소의 온도가 영하 183도이고 엔진 화염이 무려 3,300도에 달한다. 이때 초당 1,000㎏의 추진제를 안정적으로 연소시키는 게 관건이다. 세계적으로 첫 발사에서의 성공 사례가 30% 정도밖에 되지 않는 것도 이 때문이다. 허환일 충남대 항공우주공학과 교수는 “2013년 발사한 나로호는 핵심인 1단은 러시아제였고 100kg급 위성을 300㎞ 상공에 쏘아 올리는 수준이었다”며 “누리호는 우주강국으로 도약하는 힘찬 시발점이 될 것”이라고 기대했다.△위성 발사 대행 서비스는=정부와 항우연은 누리호를 내년 2차 발사 후 2027년까지 4회에 걸쳐 추가 발사하며 상용화를 모색하기로 했다. 정부는 누리호 이외 소형 발사체를 개발해 오는 2025~2030년에 500㎏ 이하의 소형 위성을 저궤도에 발사한다는 복안도 있다. 나아가 2030~2040년에는 우리 발사체로 저궤도에 대형 위성을 보내고 3만 6,000㎞ 상공의 정지궤도 위성까지 띄운다는 목표다. 현재 국방부와 과학기술정보통신부는 2024년 75톤급 고체연료 엔진을 쓴 2단 우주발사체로 소형 위성이나 다수의 초소형 위성을 저궤도에 쏘아 올릴 계획이다. 이창진 건국대 항공우주공학과 교수는 “올해 5월 한미 정상회담에서 미사일 개발 족쇄가 해제되고 아르테미스 협정(미국 주도 달 탐사 프로젝트)에 가입했다”며 “우리나라는 앞으로 10년간 100개가량의 다양한 위성을 쏘아 올릴 계획인데 예산이 소요되더라도 자체 발사 능력을 키워야 한다”고 강조했다.△중국의 우주굴기=미국과 패권을 다투고 있는 중국은 2050년 연 10조 달러의 우주 경제권을 만든다는 ‘우주굴기 2050’ 계획을 2019년 세우기도 했다. 이달 16일에는 독자 우주정거장(톈궁) 건설을 위한 두 번째 유인 우주선을 발사하는 데 성공했다. 3명의 우주비행사들은 6개월간 우주에 머물며 기술 시험과 장비 설치에 나선다. 중국은 2018년 39회, 2019년 34회, 2020년 39회, 올해 38회의 우주발사체를 쏘아 올리며 4년째 최다 발사국으로 부상했다. 중국은 2019년 초 세계 최초로 달 뒷면 착륙에 성공한 데 이어 올해 초 화성에 직접 착륙선을 보내 탐사를 진행하고 있다. 우주 스타트업 생태계 구축에도 적극적이다.△일본, 소행성 탐사 선두=일본이 우주발사체 자립에 성공할 때는 자체 기술은 물론 미국의 도움이 컸다. 일본은 지난해 말 지구에서 3억 ㎞나 떨어진 소행성인 ‘류구’의 토양 시료 100㎎을 지구로 가져올 정도의 기술력을 갖췄다. 지금도 다른 소행성 탐사를 진행하고 있다. 소행성 탐사만큼은 미국에 맞먹거나 오히려 앞설 정도다. 요시카와 마코토 일본우주항공연구개발기구(JAXA) 하야부사2 프로젝트 미션 매니저는 “소행성은 미래의 우주자원으로 활용할 수 있다. 지구와 충돌할 때 입게 될 큰 피해를 막기 위해서도 탐사가 필요하다”며 소행성 탐사의 이유를 밝혔다. 일본은 1990년 달 탐사선을 처음 보냈고 2003년 소행성 탐사선, 2006년 태양 탐사선, 2010년에는 금성과 태양 반대편 탐사선을 보냈다. 위성 정보 활용 등 우주 스타트업 생태계도 꽤 갖춰져 있다.",105,https://n.news.naver.com/mnews/article/011/0003975060?sid=103
[인사]대전시설관리공단,2021.10.19. 오후 5:49,◆대전시설관리공단 △경영본부장 왕우현,105,https://n.news.naver.com/mnews/article/030/0002976438?sid=103
"국립중앙과학관, 누리호 발사 장면 생중계",2021.10.19. 오후 12:00,"21일 오후3시부터 유튜브 채널 통해



국립중앙과학관은 21일 한국형 우주발사체 '누리호'의 발사에 맞춰 성공적 발사와 독자적 우주 수송 능력을 갖춘 7대 우주 강국 도약을 기원하는 '높이 높이 날아라! 누리의 꿈!' 생방송 행사를 개최한다발사 예정 시각 1시간전부터 과학관 유튜브 채널 ‘과학관 TV’를 통해 진행한다. 과학관에 전시 중인 신기전, 과학기술로켓, 나로호, 누리호 2단부 실물 엔진 등 전시품을 활용해 과거의 로켓기술, 우주과학 기술발전 세계사, 누리호 성공 기원 물로켓 제작 및 발사, 대한민국의 로켓기술 및 발사체 개발역사 등을 소개한다. 사전 제작된 관람객들의 성공 기원 응원 메시지를 통해 누리호 발사 성공에 대한 국민들의 염원을 보여준다.또 누리호 발사를 직접 볼 수 있는 장소를 찾아가 방송을 통해 현장 분위기와 국민들의 기대감을 생생하게 중계하고, 발사장면을 원거리에서 촬영해 누리호 발사 순간을 시청자들과 함께할 예정이다.한편 중앙과학관은 현재 사진전 ‘우리 손으로 여는 우주의 꿈, 누리호’를 개최 중이다. 한국형 발사체 개발 연구진들의 노력을 엿볼 수 있는 사진과 75톤급 엔진 실물을 전시 중이다.",105,https://n.news.naver.com/mnews/article/277/0004985447?sid=103
"[누리호 발사]③우주 향하는 누리호, 미사일 무기와 어떻게 다를까",2021.10.19. 오전 7:15,"기본원리는 같아…목적에 따라 세부적인 개발과 설계 방향 달라누리호는 액체 연료 발사체…'비군사적' 목적에 적합



전남 고흥 나로우주센터에서 누리호 인증모델이 신규 구축된 제2발사대의 인증시험을 위해 발사대에 기립하고 있다. 2020.6.1/뉴스1 © News1 성동훈 기자(서울=뉴스1) 김승준 기자 = 발사체 기술의 활용처는 크게 무기와 우주 개발로 나뉜다. 무기로서의 발사체와 우주 진출을 위한 발사체 기술은 비슷하면서도 다르다. 발사체는 '작용-반작용 법칙'을 바탕으로 추진제를 연소시켜 분출되는 기체로 추진력을 얻는다는 기본원리는 같지만, 그 목적에 따라 세부적인 개발과 설계에서 추구하는 방향이 다르다. 무기는 신속성·기동성이 상대적으로 중요하다면, 21일 발사 예정인 누리호와 같은 우주 발사체는 효율성에 초점이 맞춰져 있다. 우주 발사체의 주요 목표는 같은 양의 연료로 최대한 많은 무게를 실어 나르거나 멀리 나가는 데 필요한 추력을 발생시키는 것이다. 따라서 로켓 자체의 무게는 최대한 가벼워야 한다. 우주 발사체는 돌발 상황에 긴급하게 대응해야 하는 무기용에 비해 여유롭게 발사 시기를 정할 수 있다. 무기용 발사체는 어느 정도의 정확도와 탄도 및 무기 수송능력이 확보되면, 긴급 상황에서의 대응력이나 이동하면서 발사가 가능한 기동성이 중요해진다. ◇연료 충전 시간이 필요한 액체 연료 발사체…효율이 강점통상적으로 액체 연료 발사체는 군사적 목적보다는 비군사적 목적에 적합하다고 여겨진다. 누리호는 액체 연료를 이용한다. 액체 연료 발사체는 고체 발사체에 비해 추진제 무게당 발생하는 추력(비추력)이 커 효율이 좋은 대신, 연료 충전 시간·설비가 필요해 기동성과 신속성이 떨어진다. 설인효 한국국방연구원 정책개발실 연구위원은 2020년 7월 국방일보 기고문에 ""액체 연료의 경우 미리 주입해 둘 수 없고 발사 전 수십 분의 시간 동안 주입하는 과정이 필요하다""며 ""실시간 정찰 감시와 정밀 타격이 가능한 현대의 전장에서는 치명적인 취약성을 갖는다""고 설명했다. 액체 발사체에 연료 충전 시간이 필요한 이유는 연료 보관 문제 때문이다.액체 발사체는 액체 상태의 연료와 산화제가 연소하며 발생하는 가스를 이용해 추진력을 얻는 구조다. 연소에는 타는 물질(연료)과 산소가 필요한데, 산화제는 산소를 공급하는 역할을 한다. 이때 효율적인 연소를 위해서는 연료와 산소 외의 불순물이 최소화되어야한다. 지구 대기에는 산소가 21% 포함됐다.누리호의 경우에는 한정된 공간에 최대한의 산소를 주입하기 위해, 기체가 아닌 액체 상태의 산소를 사용한다. 문제는 대기압에서 산소를 액체로 만들기 위해서는 적어도 영하 183도(℃) 이하로 냉각해야한다. 액체 산소는 단열을 잘해도 쉽게 기화되어 크게 팽창하므로 미리 로켓에 채워 놓고 보관하기가 힘들다. 만약 액체 산소를 보관하기 위한 장치를 발사체에 부착할 경우, 발사체의 무게가 늘어나 추진 효율이 떨어진다. 극저온 액체 보관 문제 외에도 추진제의 부식성으로 인한 탱크 손상, 연료의 폭발 및 화재 위험성 등의 문제가 있어 연료를 발사체와 별도 보관하고, 발사 전 충전하는 방식이 활용된다. 군사적 목적으로 개발된 액체 발사체의 경우에는 발사체에 장기간 연료 보관이 용이하도록 추가 처리한 탱크나 연료를 사용하거나, 지하 발사 설비를 구축하는 추가적 개발이 들어간다.반면에 고체 연료 발사체는 상대적으로 안정적인 고체 상태의 연료를 활용하기 때문에 장기 보관이 용이하다. 연료 충전을 건너뛸 수 있기 때문에 유사시 단시간 발사 및 이동식 발사에 유리하다. 



한화는 오는 19일부터 23일까지 경기도 성남시 서울공항에서 열리는 ' 서울 ADEX 2021' 전시회에서 누리호의 심장 ‘75톤 액체로켓 엔진’ 실물을 전시한다고 18일 전했다. 75톤 액체로켓 엔진은 한국항공우주연구원 주도로 지난 2010년부터 우리나라가 독자 개발한 누리호의 핵심 장치다. 발사체가 중력을 극복하고 우주궤도에 도달하는 동안 고온, 고압, 극저온 등 극한 조건을 모두 견뎌 낼 수 있도록 제작한 최첨단 기술의 집약체다. 한화에어로스페이스가 사업 초기 단계부터 엔진, 터보펌프, 시험설비 구축 등에 참여했다. (한화 제공) 2021.10.18/뉴스1◇섬세한 조절이 쉽게 가능한 액체 발사체 vs 저렴한 고체 발사체액체 발사체는 산화제와 추진제를 밸브로 조절 가능한 구조로 만들어진다. 연료의 연소가 시작된 후에도 밸브만 잠그면, 연소를 멈추고 필요할 때 다시 추진할 수 있다. 또 연속적인 속도 조절도 가능해 발사체의 자세 제어나 궤도 제어를 섬세하게 할 수 있다. 고체 발사체는 추력을 연료의 모양과 배열로 조절하는 경우가 많다. 특정 시점에 연료가 많이 타도록 설계해 어느 정도 가속 조절이 가능하지만, 액체 발사체에 비해 섬세한 조작이 어렵다. 이러한 구조적 차이 때문에 액체 발사체에는 더 많은 부품이 들어가고, 조립도 정교하게 이뤄져야해서 개발 및 생산비용이 일반적으로 높다. 누리호의 경우에는 30만개 이상의 부품으로 구성됐다. 고체 발사체는 상대적으로 저렴하고 개발이 쉬워, 군사 발사체로 활용되거나 액체 발사체의 보조수단(부스터, 킥모터 등)으로 활용되는 경우가 많다. 또 스타트업이 민간 우주 산업에 뛰어드는 경우, 상대적으로 개발이 용이한 고체 발사체를 중심으로 서비스 연구·개발·서비스 기획을 하는 경우도 늘어나고 있다. 비용 대비 효율성도 용도를 가르는 기준이 되기도 한다. 신범철 경제사회연구원 외교안보센터장은 ""누리호와 같은 발사체는 재래식 탄두를 실었을 때, (무기로 활용하기에는) 비용대비 효과가 떨어진다""며 ""북한의 광명성 발사가 우주 개발이라고 주장했지만 문제가 된 것은 핵 개발을 했기 때문""이라고 설명했다.",105,https://n.news.naver.com/mnews/article/421/0005665143?sid=103
"나이벡, 다이이찌산쿄와 신약개발 공동연구 계약 체결",2021.10.19. 오후 2:44,"약 1년 소요나이벡은 회사의 약물전달시스템를 신약 개발에 적용하기 위해 글로벌 제약사인 다이이찌산쿄와 공동연구 계약을 체결했다고 19일 밝혔다.이번 계약은 나이벡의 'NIPEP-TPP' 기반 약물전달시스템에 다이이찌산쿄의 후보물질을 접목해 신약 개발을 진행하는 것이 골자란 설명이다. 나이벡이 시험관 실험(in-vitro) 단계의 검증을 진행하며, 다이이찌산쿄는 생체실험(in-vivo) 단계의 검증을 진행한다고 했다. 공동연구는 1년 가량 소요될 예정이다. 추가 검증이 필요한 경우 6개월 내외로 공동연구 기간이 연장될 수 있다. 연구가 성공적으로 완료되면 나이벡은 다이이찌산쿄와 기술이전 우선권(옵션)이 부여된 공동개발 계약 또는 기술이전 계약을 체결할 예정이다. 나이벡 관계자는 ""연초 JP모건 헬스케어 컨퍼런스에서 다이이찌산쿄와 NIPEP-TPP에 대한 회의를 진행한 후, 기전 검증과 관련한 회의를 지속해 왔다""며 ""공동연구를 성공적으로 마무리해 NIPEP-TPP 시스템이 다양한 치료제 개발에 적용될 수 있도록 할 것""이라고 말했다. 한민수 기자",105,https://n.news.naver.com/mnews/article/015/0004617884?sid=103
"ETRI, 지능형 IoT 27개 기술 공개",2021.10.19. 오전 11:50,"20일부터 사흘간 코엑스서 AIoT 국제전시회 참가국내 연구진이 디지털 탈바꿈을 통한 지능화 사회에 한 걸음 더 다가가기 위해 최신 지능형 사물인터넷(AIoT)기술을 일반에 공개한다.



ETRI 연구진이 복제 불가능한 생체인식 기술을 시연하고 있다 [사진=ETRI]한국전자통신연구원(ETRI)은 20일부터 사흘간 서울 코엑스에서 개최되는 ‘2021 AIoT 국제전시회’에 참가, 연구개발 중인 최신 사물인터넷(IoT) 기술을 선보인다고 19일 발표했다.이번 전시회서 ETRI는 4차 산업혁명의 근간이 될 IoT 기반기술 11개와 국가 지능화를 위한 IoT 응용기술 16개 등 최신기술 27개를 전시한다.IoT 기반기술은 주로 사물인터넷과 관련된 기기, 네트워크, 센서, 보안, 자율사물 등과 관련된 기술이다. 아울러 응용기술로는 에너지, 환경, 농축산 IoT와 지식융합과 관련된 기술들이다.IoT 기반기술 분야에서 ▲경량형 IoT 디바이스 소프트웨어 오픈소스 ▲비면허대역 저지연, 대규모, 시민감 고정밀 무선 시민감 IoT 네트워크 기술 ▲현장진단 및 생체인식 센서 기술 ▲하드웨어기반 DNA 보안, 침해확산 방지 기술 ▲자율제조 협동로봇 프레임워크, 행동지능 강화학습, 이동 객체 스켈레톤 추출 기술 등을 전시한다.IoT 응용기술 분야에서 ▲에너지 거래, 공유, 중개시장, 관리, 최적화 서비스 기술 ▲USV 기반 녹조 모니터링 서비스 기술 ▲나무 생장관리, 가축 이상징후 조기감지, 구제역 현장진단, 스마트 안전축사, 바이오 시큐리티 통합 시스템 기술 ▲자가학습형 지식 융합 브레인(KSB), 자율분산 에너지 관리, 딥러닝 미세누출 진단, 고령자 건강 모니터링 시스템 등을 선뵌다.특히, ETRI 지능화융합연구소가 국가 지능화 추진 및 국민 생활문제 해결에 주력하는 IoT 기반기술, 인공지능(AI) 기술이 내장된 응용기술, 그리고 국가과학기술연구회 KSB융합연구단과 SDF융합연구단의 현장 적용 기술에서 지능형·자율형 사물인터넷에 이르는 기술 등을 살펴볼 수 있다.연구원은 이번 전시회를 통해 기술 공유와 협력의 장도 마련함으로써 우리나라 IoT 기술 발전에 기여한다는 계획이다. ETRI 김형준 지능화융합연구소장은 “전 산업의 디지털·비대면 전환이 현실화되고 있는 이때 IoT는 모든 분야에 핵심이 되고 있다. 연구진은 AI가 융합된 IoT 핵심기술들이 공공 국민생활 전반에 걸친 문제들을 해결하는 기술로 상용화하기 위해 노력 중이다”라고 말했다.",105,https://n.news.naver.com/mnews/article/031/0000629583?sid=103
인앱결제법 보완...타사 결제수단 이용 불이익 막는다,2021.10.19. 오후 1:44,"개정 전기통신사업법 하위법령 초안 공개, 특정결제수단 강요행위 구체화방송통신위원회가 인앱결제 강제 방지법을 보완하기 위해 앱마켓 사업자의 금지행위 유형을 구체화하는 하위법령 초안을 마련했다. 구글, 애플이 타사 결제수단을 이용할 경우 불이익을 주는 유형을 명확히 구분하는 식이다.이를 통해 인앱결제법에 도입된 신설 금지행위에 대해 규제의 명확성과 예측 가능성을 높인다는 목표다.방통위와 인앱결제법 제도정비 연구반은 19일 서울 강남역 인근에서 코리아스타트업포럼, 게임산업협회, 디지털기업협회, 모바일게임협회, 모바일산업협회, 인터넷기업협회와 간담회를 열고 인앱결제법 주요 하위법령의 초안을 공개했다.인앱결제법이 국회 본회의를 통과한 이후 방통위에서 마련하고 있는 관련 하위법령은 앱마켓 사업자의 금지행위에 대한 시행령, 이용자 보호 조치에 대한 시행령, 앱마켓 실태조사를 위한 시행령, 위법성 판단기준을 제시하는 고시 등이다.이날 공개된 시행령과 고시 초안 가운데 가장 눈길을 끄는 부분은 특정한 결제방식을 강제하기 위해 다른 결제 방식을 사용하는 경우 불이익을 제공하는 유형을 구체화한 부분이다.



사진=이미지투데이개정 전기통신사업법에서 특정 결제수단만 강요할 수 없다는 문구 외에 하위 법령으로 타사 결제수단도 허용하지만 차별을 두는 행위를 막겠다는 뜻이다.타사 결제수단을 이용하는 모바일 앱의 등록, 갱신, 점검을 거부, 지연, 제한하는 경우와 앱마켓 이용을 정지, 제한하는 행위를 금지행위로 삼는다는 내용이 시행령에 담기는 세부유형에 포함됐다.또 수수료나 앱마켓에서 노출 등에 불합리하거나 차별적인 조건과 제한을 부과하는 행위도 금지행위에 담겼다.앱 이용자가 다른 결제수단을 이용할 때 어려운 방식으로 구성하는 점도 금지행위에 해당한다.구글이나 애플의 결제수단 외에 다른 결제수단을 이용하려는 앱 개발사를 보호하는 장치를 마련하는 식이다.



왼쪽부터 장봉진 통신시장조사과장, 김재철 이용자정책국장, 김현수 KISDI 통신전파연구본부장과징금 부과 상한액 기준은 특정 결제수단 강요에 대해서는 관련 매출액의 2%, 콘텐츠 심사 지연이나 삭제 등은 1% 안이 논의되고 있다.고시로 마련되는 금지행위를 심사하는 기준은 ▲전기통신사업법과 정보통신망법 등을 고려하고 앱마켓의 특수성을 반영한 ‘거래상의 지위’ ▲다른 결제방식의 선택이 실질적으로 자유로운지에 대한 ‘강제성’ ▲이용자 이익과 공정경쟁 저해성과 이용자 편익 증대 효과 등을 다루게 된다.방통위는 하위법령 제정 이전에도 앱마켓 사업자의 법 위반 행위가 일어날 경우 사실조사 착수를 예고했다. 방통위에서 예고한 사실조사는 법 위반 여부를 검토하는 단계를 넘어 제재를 전제하고 있다.김재철 이용자정책국장은 이날 간담회에 앞서 “앱마켓 사업자들이 제출한 법 준수 이행계획은 구체성이 결여됐거나 입법취지에 부합하지 않다 자료의 재제출을 요구할 계획”이라며 “다시 제출한 이행계획에서도 가시적인 내용이 확인되지 않으면 하위법령 제정 이전에 가능한 범위에서 사실조사에 착수해 불법 행위에 적극 대응하겠다”고 밝혔다.",105,https://n.news.naver.com/mnews/article/092/0002236525?sid=103
