title,date,main,section,url
"[안녕? 자연] ‘녹은 얼음 탓’에 길 잃은 북극곰, 캐나다서 총살 당해",2022.05.04. 오후 5:27,"[서울신문 나우뉴스]



캐나다 퀘백주의 한 마을에 나타난 북극곰의 마지막 모습. 당초 북극곰을 원래의 서식지로 되돌려 보내는 방안이 검토됐으나, 이동 과정이 북극곰에게 안전하지 않다는 판단하에 결국 사살됐다. 캐나다 경찰이 퀘벡의 마을을 배회하는 북극곰을 발견한 뒤 총으로 쏴 죽였다. 당시 북극곰은 북극의 녹아내린 얼음 때문에 생긴 낯선 길에서 방향을 잃고 멀리 이동한 것으로 추측된다.영국 일간지 가디언 등 해외 언론의 3일 보도에 따르면 지난달 30일(이하 현지시간) 오후 1시 경, 캐나다 북동부 가스페 제도 경찰들은 마을 안에서 어슬렁거리는 북극곰이 있어 외출이 어렵다는 주민들의 신고를 받았다.현지 주민이자 최초 신고자인 소피 보네빌은 “함께 산책을 나온 반려견이 갑자기 짖었고, 이후 집 근처에서 북극곰을 발견했다”면서 “북극곰은 멀리서 우리 가족을 지켜보다 숲 쪽으로 몸을 돌렸다. 이후 곧장 야생동물 관리소에 신고했다”고 말했다.



현지 주민이 촬영한 북극곰 발자국 또 다른 주민인 진 버거론은 눈 위에 선명하게 남아있는 곰의 발자국을 포착하기도 했다. 현지의 야생동물 관리국은 주민들에게 북극곰의 위치가 파악될 때까지 외출을 자제하라고 권고했다.해당 북극곰은 이튿날인 지난 1일 오전, 경찰과 야생동물 전문가들이 드론과 헬리콥터로 공중 수색을 하던 중 확인됐다. 당초 북극곰을 원래의 서식지로 되돌려 보내는 방안이 검토됐으나, 이동 과정이 북극곰에게 안전하지 않다는 판단하에 결국 사살됐다.전문가들은 가스페 제도에서 발견된 북극곰이 원래의 서식지인 동부 래브라도를 떠나 강을 헤엄쳐 마을로 들어왔다고 추측했다. 원래의 서식지와 발견된 장소의 거리는 322㎞에 달한다.도미니크 베르토 퀘백대학 교수에 따르면 래브라도에 서식하는 북극곰은 얼음이 녹는 계절이 오면 서서히 북쪽으로 이동하지만, 기후변화로 얼음이 녹아내리면서 원래 이동 방향인 북쪽이 아닌 남쪽에도 바닷길이 열렸다.베르토 교수는 “북극곰이 바닷길을 이동하는 과정에서 방향을 잃고 엉뚱한 지역으로 흘러든 것으로 보인다”면서 “기후변화로 녹아내리는 얼음의 양이 늘면서, 서식지 이외의 지역에서 북극곰을 마주하는 일은 더 잦아질 것으로 보인다”고 밝혔다.캐나다 현지 언론인 CBC 방송은 “최근 몇 주 동안 정상 이동 범위에서 멀리 떨어져 있는 몇몇 북극곰의 모습이 포착돼 왔다”고 전했다.기후변화로 길 잃고 먹이 잃고...남은 북극곰 고작 2만 5000마리 한편 기후변화로 길을 잃거나 먹잇감을 찾다가 사람이 사는 마을로 들어선 북극곰이 사살되는 사례는 꾸준히 나오고 있다.지난해 8월 AFP통신에 따르면 그린란드에서는 이상기후로 먹이를 잃은 북극곰이 민가를 습격하는 일이 발생했다. 당시 전문가들은 북극곰이 사냥터인 빙하가 줄어들자 먹이를 찾아 육지로 더 멀리 이동하게 됐다고 지적했다.현재 지구상에 남아있는 북극곰은 약 2만 5000마리로 추정되며, 2100년에는 멸종 위기에 처할 수 있다는 경고가 나온 바 있다.",105,https://n.news.naver.com/mnews/article/081/0003270702?sid=103
"카카오, 너마저…시장 눈높이 못 맞춘 올해 1분기 ‘성적표’",2022.05.04. 오후 10:58,"[경향신문] 1분기 매출 1조6517억 발표영업이익도 예상치 밑돌아콘텐츠·게임 등 해외 매출“올해 40% 이상 성장할 것”



카카오가 올해 1분기에 시장 기대치를 밑도는 실적을 올렸다. 코로나19로 인한 특수가 끝나가고 전 세계적으로 경기가 나빠지면서 카카오도 영향을 받았다. 카카오 주가는 이날 한때 9만1900원까지 올랐다가 전일 종가보다 500원(0.56%) 많은 8만9000원에 거래를 마감했다. 카카오 주가가 15만원이 될 때까지 ‘최저임금만 받겠다’고 공언한 남궁훈 카카오 대표는 “카카오톡의 서비스 개편과 글로벌 확장의 가능성이 보이기 시작한다면 기업가치 회복이 가능하다고 믿고 있다”면서 “목표 달성을 위해 최선을 다하겠다”고 말했다.카카오는 올해 1분기 매출이 전년 동기 대비 31% 늘어난 1조6517억원을 기록했다고 4일 밝혔다. 계절적 요인으로 전 분기보다는 8% 줄었다. 영업이익은 전년 동기 대비 1%, 전 분기 대비로는 49% 증가한 1587억원으로 나타났다. 금융정보 업체 에프앤가이드에 따르면 당초 증권가가 예상한 카카오의 1분기 매출과 영업이익의 전년 동기 대비 성장률은 38.34%, 2.58%였다. 부문별 매출을 보면 플랫폼 부문은 전년 동기 대비 27% 증가한 8860억원으로 집계됐다. 톡비즈 매출은 23% 증가한 4610억원을 기록했다. 이 중 비즈보드, 카카오톡 채널 등 광고형 매출은 전 분기 대비 감소했으나 전년 동기 대비로는 32% 증가했다. 포털비즈 매출은 전년 동기 대비 3% 감소한 1140억원이다. 플랫폼 기타 부문 매출은 카카오모빌리티와 카카오페이의 수익 확대에 따라 전년 동기 대비 52% 증가한 3110억원을 기록했다.콘텐츠 부문 매출은 전년 동기 대비 36% 증가한 7657억원으로 집계됐다. 스토리 매출은 국내, 북미에서 카카오페이지 원작 드라마 <사내맞선>을 필두로 한 플랫폼 거래액 상승과 일본 픽코마의 신규 라인업 확대로 역대 최고 분기매출을 갱신하며 전년 동기 대비 38% 성장한 2405억원을 기록했다. 뮤직 매출은 전년 동기 대비 11% 증가한 2044억원, 미디어 매출은 3% 증가한 750억원이다. 게임 매출도 2458억원으로 89% 증가했다. 모바일 게임 ‘오딘’의 대만 출시 효과는 올해 2분기 매출에 반영될 것으로 예상된다.실적발표에 이어 진행된 콘퍼런스콜에서 배재현 카카오 투자거버넌스총괄 부사장은 “1분기는 계절적 비수기 영향과 금리 인상, 전쟁 장기화 등 시장의 불확실성 확대로 광고 경기가 위축된 시기였다”면서도 “카카오의 플랫폼과 콘텐츠 사업이 고르게 성장하고 있고 콘텐츠 사업이 세계로 진출하면서 올해 해외 매출이 전년 대비 40% 이상 성장할 것으로 예상된다”고 밝혔다.남궁훈 카카오 대표는 ‘연간 거래액 10조원’ 목표를 제시하면서 카카오톡을 조금 더 가볍게 즐길 수 있는 서비스로 만들겠다고 밝혔다. 그는 “프로필탭 등에 가벼운 인터랙션(쌍방향) 요소를 추가해 여유롭게 카카오톡을 즐기도록 하겠다”며 “공통된 관심사를 가진 (지인이 아닌) 비지인 사용자들이 모이는 놀이터 같은 ‘오픈채팅’ 커뮤니티로 확장하겠다”고 덧붙였다.",105,https://n.news.naver.com/mnews/article/032/0003144929?sid=103
"SKT 잼, 가정의 달 프로모션…워커힐·에버랜드 이용권 준다",2022.05.04. 오전 9:55,"이번달 31일까지 진행…잼 앱에서 자녀 신규 등록한 이용자 대상SK텔레콤은 가정의 달을 맞아 잼(ZEM) 서비스에서 '우리 아이 꿀잼 선물 A to 잼' 프로모션을 오는 31일까지 진행한다고 밝혔다.이번달 중 공개 예정인 새로운 잼 서비스 ▲습관 만들기 ▲약속모드 세분화 ▲앱 사용 리포트 제공 중 가장 기대되는 서비스를 고르면 프로모션에 참여할 수 있다.참여 가능 대상은 프로모션 기간 내 잼 앱에서 자녀 신규 등록을 완료한 이용자다. 추첨을 통해 ▲워커힐 호텔 1박 이용권(3명) ▲가족사진 촬영권(10명) ▲에버랜드 이용권 4매(50명) ▲아웃백 식사권(100명) ▲파리바게뜨 이용권(1천명) 등을 제공한다.



(사진=SK텔레콤)새로운 잼은 기존 서비스의 사용모드를 약속모드, 집중모드, 자유모드 등으로 세분화해 제공한다. 약속모드의 경우 자녀와 부모가 어떤 앱을 몇 시간이나 사용할지 미리 상의해서 이용 시간을 설정할 수 있다.김지형 SK텔레콤 통합마케팅전략담당은 ""가정의 달과 어린이날을 기념해 부모와 아이들이 더욱 활발히 소통하는 계기가 될 수 있도록 이번 잼 서비스 개편과 프로모션을 준비했다""며 ""SK텔레콤은 앞으로도 아이의 스마트폰 과몰입 방지를 위한 서비스를 지속적으로 고도화하며 사회적 가치를 높이는 ESG 활동에 앞장설 것""이라고 밝혔다.",105,https://n.news.naver.com/mnews/article/092/0002255848?sid=103
"복지부, 올해 신약연구개발 등에 8777억 투입",2022.05.04. 오후 5:02,"제약산업 육성·지원 시행계획 확정보건복지부가 올해 제약산업을 육성하기 위해 8777억원을 투입한다.4일 복지부는 2022년 제1회 제약산업 육성·지원위원회를 열고 올해 제약산업 육성·지원 시행계획을 심의해 확정했다.복지부는 기획재정부, 과학기술정보통신부, 산업통상자원부, 식품의약품안전처 등 관계부처와 함께 5년마다 제약산업 육성지원 종합계획을 수립한다. 올해는 제2차 종합계획(2017∼2022년)의 마지막 해다.복지부는 신약 연구개발(R&D), 인력 양성, 수출지원, 제도개선 등 4개 정책 분야의 152개 세부과제를 추진할 게획이다. 세계적인 신약을 개발할 수 있도록 지난해 451억원 규모였던 국가 신약개발 사업 지원을 올해 1342억원 규모로 확대하고 재생의료 원천기술 개발 지원 규모도 지난해 128억원에서 올해 381억원으로 늘렸다. 코로나19 등 감염병 치료제·백신 개발에도 올해 973억원을 투자한다. 인력 양성을 위해서는 바이오 생산·공정 전문인력 양성센터 구축과 한국형 나이버트(K-NIBRT) 교육 프로그램 운영에 125억원을 쓰기로 했다. 또 인공지능과 빅데이터를 활용한 정보기술(IT)-생명공학기술(BT) 융합형 인재 275명을 양성하고, 의사 과학 학부과정을 지원하는 데 각각 10억원, 90억원을 지원한다.  이밖에 수출 지원 체계를 강화하기 위해 미국 보스턴 바이오클러스터에 공유 사무실을 세우고 해외 제약전문가와 컨설팅 기관 등을 통해 단계별 컨설팅을 지원한다. 또 혁신적인 신약과 백신을 개발하는 기업에 적극 투자할 수 있도록 5000억원 규모 펀드 조성도 추진할 방침이다. 이를 위해 올해 500억원을 투입한다.",105,https://n.news.naver.com/mnews/article/009/0004959425?sid=103
[그래픽] 기업 인건비 비율 현황,2022.05.04. 오전 11:37,(서울=연합뉴스) 김영은 기자 = 카카오의 매출 대비 인건비 비율이 1년 새 약 8%p(포인트) 상승하는 등 국내 정보기술(IT) 기업들의 인건비 부담이 가중되고 있는 것으로 나타났다.    기업분석전문 한국CXO연구소는 이런 내용을 담은 '2019∼2021년 국내 주요 대기업 110곳의 매출 대비 인건비 비율 변동 분석' 결과를 4일 발표했다.     0eun@yna.co.kr    트위터 @yonhap_graphics  페이스북 tuney.kr/LeYN1,105,https://n.news.naver.com/mnews/article/001/0013156944?sid=103
"바이브컴퍼니, 메타버스 플랫폼 듀플래닛서 반려동물 O2O 서비스 선보인다",2022.05.04. 오후 2:19,"(왼쪽부터) 바이브컴퍼니 이재용 대표, 펫미 백영호 대표바이브컴퍼니가 자체 메타버스 플랫폼인 듀플래닛에서 반려인과 반려동물 뷰티숍을 연결해주는 '펫미(PETME)' 서비스를 선보인다.바이브는 지난 5월 3일 서울시 한남동에 위치한 본사에서 (주)펫미와 듀플래닛 내 펫미 서비스 구현을 위한 업무협약을 체결했다고 밝혔다.펫미는 반려인 1,500만 시대에 발맞춰 2020년 출시된 반려동물 뷰티 예약 O2O 서비스로, 사용자가 주변의 반려동물 전문숍을 검색해 시설, 상품, 스타일, 서비스 등 자세한 정보 확인과 더불어 실시간 예약 및 결제가 가능하다.해당 서비스는 현재 1천여 개의 고객사를 보유하고 있으며 현재 빅데이터 기반 O2O 예약·주문 플랫폼으로 확대 재편을 추진 중이다.우선 펫미는 3개 지점을 대상으로 파일럿 서비스를 구축하기로 하고, 듀플래닛 가상 공간의 본사 및 3개 가맹점 위치에 가상 토지 분양 신청도 완료했다.바이브와 펫미는 이들 지역에 3차원 매장 체험이 가능한 가상의 반려동물 전문숍을 짓고 기존의 O2O 플랫폼을 메타버스 영역까지 확대한다는 계획이다.또한 바이브가 올초 업무 협약을 체결한 스파이더아이앤씨의 주문 배달 중개 플랫폼도 연동될 예정으로, 이렇게 되면 반려인들은 듀플래닛 내의 가상 매장을 방문해 매장을 체험하는 것은 물론 서비스 예약이나 반려동물 용품 주문 배달 서비스까지 이용할 수 있게 된다.아울러 펫미는 반려동물의 순간포착, 반려동물 가족사진, 반려동물 소리 동영상 등을 NFT 콘텐츠로 발행하는 신규 서비스도 기획 중이다.이번 펫미 서비스는 듀플래닛의 전체 서비스가 출시되는 8월 중 선보일 예정이다.바이브 이재용 대표는 ""이번 펫미와의 협력을 통해 실제 오프라인과 같은 반려동물 전문숍에서의 경험을 가상 공간과 연결, 새로운 메타버스 커머스의 성공사례를 창출할 수 있게 됐다""며 ""앞으로도 듀플래닛에서 다양한 산업군이 자유롭게 비즈니스를 진행해 가상 경제 생태계가 만들어질 수 있도록 노력할 것""이라고 말했다.",105,https://n.news.naver.com/mnews/article/215/0001029648?sid=103
"성장세 주춤 카카오, 카카오톡 '대전환' 승부수 띄운다(종합)",2022.05.04. 오후 2:31,"비목적성 강화해 관심사 기반 서비스로 탈바꿈매출 전년비 31% 성장했지만 전분기 대비 8% 줄어



남궁훈 카카오 대표.ⓒ카카오[데일리안 = 최은수 기자] 카카오가 올 1분기 매출이 두 자릿수 성장률을 기록한 가운데 영업이익은 1% 성장에 그쳐 시장 전망치를 소폭 하회하는 실적을 기록했다. 특히 전분기 대비로는 매출이 역성장하며 성장세가 주춤했다.이에 남궁훈 카카오 대표는 올해 카카오 핵심 서비스인 ‘카카오톡’을 비지인 기반의 글로벌 메신저로 확장시켜 새로운 성장동력으로 발굴한다는 새로운 방향성을 제시했다.남궁훈 카카오 대표는 4일 올 1분기 실적발표 후 진행된 컨퍼런스 콜에서“카카오톡의 프로필, 친구, 대화 영역에서 가벼운 교감을 나눌 수 있는 서비스들을 기획하고 하나씩 적용해나갈 것”이라며 ""이용자들이 보다 편한 마음으로 카카오톡을 접할 수 있다면 비목적성 인터랙션(상호작용) 서비스로 확장할 수 있을 것”이라고 말했다.그는 “카카오톡의 장점이자 한계는 강력한 지인 기반이라는 점”이라며""더 큰 확장을 위해서는 비지인 영역으로 확대할 필요가 있어, 오픈 채팅을 관심사 기반으로 서비스 재정의하고 활성화하려고 한다”고 덧붙였다.카카오톡을 단순히 메세지 수신, 발신을 위한 지인 기반 메신저가 아닌, 관심사 기반으로 자유롭게 상호 작용하는 서비스로 영역을 확장하겠단 설명이다.남 대표는 더 나아가 카카오톡의 ‘오픈채팅’을 활용해 텍스트 기반의 메타버스 서비스로 확장하겠다는 구상이다.그는 ""카카오톡은 텍스트라는 형태소 요소를 갖고 있기 때문에 3차원(3D) 캐릭터보다 중요한 요소를 갖췄다고 생각한다""며 ""곧 오픈채팅이 보다 확장된 공간으로 발전돼 문화적, 경제적 활동을 돕는 역할을 할 수 있다. 오픈채팅 방장이 (채팅을) 유료화로 전환할 수도 있다는 얘기다""라고 말했다.



카카오 방향성.ⓒ카카오 IR자료이같은 결정은 최근 카카오톡 내 쇼핑, 뷰 탭의 성과가 부진한 점도 영향을 미친 것으로 보인다. 남 대표는 “올해 임원들의 주요 워크샵 과제가 카카오톡 뷰, 쇼핑 탭을 어떻게 발전시켜나갈지에 대한 것이었다”며 ”트래픽이 기대보다 높지 않았던 이유는 이용자의 특성이 ‘목적성 커뮤니케이션’에 있기 때문”이라고 말했다.그동안 카카오가 코로나19로 비대면 수혜를 입고 매출이 매분기 성장했지만 올 1분기에는 다소 둔화되는 양상이다. 카카오는 올 1분기 매출 1조6517억원, 영업이익 1587억원을 기록했다. 매출은 전년 동기 대비 31% 늘었고, 전분기 대비로는 8% 감소했다. 영업이익은 전년 동기 대비 1%, 전분기 대비 49% 각각 증가했다. 영업이익률은 9.6%로 전년 동기 대비 2.9%포인트 하락했고 전분기 대비로는 3.6%포인트 상승했다.플랫폼 부문 매출은 계절적 비수기의 영향으로 전년 동기 대비 27% 증가한 8860억원이다. 다만 전분기 대비로는 12% 감소했다. 이 중 가장 큰 비중을 차지하는 '톡비즈' 매출은 비즈보드, 톡채널을 중심으로 한 견조한 광고 성장과 커머스 거래액 증가로 전년 동기 대비 23% 증가했지만, 전분기 대비로는 3% 줄었다.콘텐츠 부문 매출은 전년 동기 대비 36% 증가, 전분기 대비 2% 감소한 7657억원을 기록했다. 특히 스토리 매출은 전분기 대비 13%, 전년 동기 대비 38% 성장한 2405억원을 기록했다. 국내, 북미에서 카카오페이지 원작 드라마 '사내맞선'을 필두로 한 플랫폼 거래액 상승과 더불어 일본 픽코마의 신규 라인업 확대로 역대 최고 분기매출을 갱신했다.배재현 카카오 최고투자책임자(CIO)는 “글로벌 금리 인상, 전쟁 등으로 인해 광고 사업이 위축됐고, 2분기 리오프닝 국면 접어들며 패션,뷰티, 여행 업종 중심으로 마케팅 수요 점차 회복되고 있지만 연초 사업계획 수립 대비 비우호적인 사업 환경 조성된 것은 사실”이라고 설명했다.그는 이어 “단기적인 외부 환경 변수가 사업 성장성을 둔화시킬 수 있으나 카카오 전반적인 사업 본연의 경쟁력은 지속적으로 강화되고 있어 견조한 성장이 가능할 것”이라며 ""콘텐츠 사업의 적극적인 글로벌 확장으로 해외 매출 전년 대비 40% 이상 성장할 것”이라고 자신했다.남궁훈 대표는 취임 시 목표로 내세운 주가 15만원 달성 목표에 대한 자신감도 드러냈다. 그는 “카카오의 글로벌 성장 가능성이 보여진다면 충분히 주가는 15만원 이상으로 회복할 수 있을 것”이라며 ”빠른 시일 내에 주가가 회복될 수 있도록 최선의 노력을 다하겠다”고 말했다.한편, 남 대표는 최근 대통령직인수위원회가 발표한 플랫폼 자율 규제와 국회에서 계류된 온라인플랫폼법안 등 플랫폼 규제에 대해서는 말을 아꼈다. 그는 “정책 동향은 유심히 살펴보고 있으며 카카오 공동체의 사회적 역할과 책임이 커지고 있다는 것을 인지하고 있다”며 ”아웃링크 등 포털 뉴스 관련 정책에 대해서는 아직 확정된 사항은 없다”고 말했다.



카카오 1분기 실적 요약.ⓒ카카오",105,https://n.news.naver.com/mnews/article/119/0002601008?sid=103
"아톤, 가정의 달 맞아 저연차 직원 부모님·아동복지시설에 선물 전달",2022.05.04. 오후 3:42,[디지털데일리 이종현기자] 보안기업 아톤은 5월 가정의 달을 맞아 저연차 직원 부모와 아동복지시설에 선물을 전달하는 이벤트를 마련했다고 4일 밝혔다.   5월 8일 어버이날을 기념해 저연차 직원의 부모에게 카드와 함께 홍삼선물세트를 전달한다. 주니어 인재 양성의 일환으로 직원 부모에게 선물을 보내는 복지 이벤트는 2013년부터 이어져 왔다는 설명이다.   또 작년 자매결연을 체결한 마포구 소재 아동복지시설 삼동소년촌 아동 60여명에게도 어린이날 기념 선물을 제공한다.    아톤 관계자는 “아톤은 사내 주니어 인재의 양성뿐만 아니라 지역사회 아동복지시설과의 나눔을 통해 미래인재육성에 아낌없는 지원을 이어갈 것”이라며 “지난 2월 신입사원 공채를 통한 주니어 직원 채용을 통해 회사와 함께 성장해 나아가는 미래 성장동력 발굴에 적극 나서겠다”고 말했다.,105,https://n.news.naver.com/mnews/article/138/0002124089?sid=103
