title,date,main,section,url
"네이버클라우드, 인텔과 국내 SaaS 기업 육성한다",2020.12.28. 오전 10:37,"[머니투데이 백지수 기자] 



지난 23일 비대면 방식으로 진행된 네이버클라우드 SaaS 육성 프로그램 웨비나에서 박기은 네이버클라우드 기술총괄(CTO)의 발표를 선정 기업 관계자들이 시청하고 있다. /사진=네이버클라우드네이버클라우드가 인텔과 함께 국내 18개 기업을 클라우드 기반 서비스형 소프트웨어(SaaS·Software as a Service) 기업으로 육성한다고 28일 밝혔다.네이버클라우드는 최근 자사의 'SaaS 기업 육성프로그램' 대상 기업을 최종 선정을 마쳤고 내년 1월부터 본격적으로 프로그램을 시작한다고 밝혔다. △날리지큐브 △넷퍼넬 △데일리블록체인 △세일즈인사이트 △스페이스리버 △심플랫폼 △아이디어콘서트 △아이알엠 △엑셈 △오픈서베이 △유씨웨어 △이벤터스 △인베트 △카택스 △코리아리서치 △티그리스 △퓨처메인 △HM솔루션 등 기업이 선정됐다.SaaS 기업 육성 프로그램은 클라우드 기반 전문 SaaS 기업으로 전환하기를 원하는 솔루션 기업이나 자사 SaaS 서비스를 고도화하려는 기업에 대해 온·오프라인 교육과 인프라 기술 컨설팅, 마케팅 지원, 클라우드 인프라 할인 크레딧 등을 제공하는 네이버클라우드 SaaS 파트너 발굴 프로그램이다.네이버클라우드는 선정된 기업에 500만원의 네이버클라우드 플랫폼 크레딧을 일괄 지급하고 크레딧 사용 현황에 따라 등급을 구분해 추가 크레딧을 차등 지급한다고 설명했다. 네이버클라우드는 매 분기 최고 등급을 유지하는 기업에는 연 최대 2000만원의 크레딧을 발급한다는 계획이다.SaaS 기업 육성 프로그램 대상 기업에는 네이버클라우드와 인텔이 제공하는 온·오프라인 클라우드 교육 프로그램과 네이버 클라우드 플랫폼 활용을 위한 기술 컨설팅도 정기적으로 제공된다.네이버는 인텔과 이들 기업을 위한 단독 기술 워크숍과 글로벌 진출 전략을 주제로 한 세미나 등의 행사도 기획한다고 밝혔다. 또 내년 6월에는 '네이버클라우드 SaaS데이(NAVER Cloud SaaS Day·가칭)'도 개최해 네이버클라우드 플랫폼 기반 솔루션을 위한 대규모 네트워크의 장도 만들겠다고 밝혔다.박기은 네이버클라우드 기술총괄(CTO)은 ""본 육성 프로그램이 협력사에게는 성공적인 SaaS 전문 기업으로 성장할 수 있는 기회가 되고, 네이버 클라우드 플랫폼 사용자에게는 더욱 다양한 클라우드 기반의 솔루션을 제공받을 수 있는 계기가 되어 결국 모두에게 유익한 프로그램이 될 것으로 기대한다""고 말했다.백남기 인텔 전무는 ""코로나19를 겪으면서 주요 업계의 공통적인 고민 사항은 비지니스의 연속성을 어떻게 관리할 것인지, 그리고 포스트 코로나 시대에 어떻게 성장할 것인지에 대한 것""이라며 ""더 빠르고 안전하게 데이터를 전송하고, 저장하고, 처리하고자 하는 글로벌 고객들의 요구에 부응할 수 있도록 네이버 클라우드 플랫폼 기반의 차별화된 서비스 런칭을 지원하겠다""고 말했다.백지수 기자 100jsb@mt.co.kr▶부동산 투자는 [부릿지]▶조 변호사의 가정상담소▶줄리아 투자노트 <저작권자 ⓒ '돈이 보이는 리얼타임 뉴스' 머니투데이, 무단전재 및 재배포 금지>",105,https://n.news.naver.com/mnews/article/008/0004520197?sid=103
"정보보호 공시, 신규 참여사 달랑 8곳…의무화 '가닥'",2020.12.27. 오후 3:11,"게티이미지뱅크올해 정보보호 공시에 신규 참여한 기업 및 단체가 8곳에 그친 것으로 나타났다. 민간 자율에 맡기는 것이 아니라 의무화하는 방안이 새해에 추진된다. 한국인터넷진흥원(KISA)에 따르면 올해 정보보호 공시제도에 처음 참여한 기업은 △한국중부발전 △백패커 △한국신용데이터 △CJ ENM(오쇼핑 부문) △퀴즈톡 △숙명여대 △경희대 △에스알 등 8곳으로 집계됐다. 지난해 정보보호 공시에 참여한 기업을 합하면 총 29곳이다.정보보호 공시제도는 기업 정보보호 현황을 공시하도록 해서 국민 알 권리를 보장하고 기업에는 정보보호 투자를 유도하기 위해 마련됐다. 이상우 KISA 보안산업진흥팀 선임연구원은 27일 “정보보호 공시제도는 이용자 정보보호와 알 권리 강화, 기업 정보보호 투자와 인식 확대 등 여러 이점이 있다”면서 “정보보호 제고 효과는 산업 진흥으로 연결될 수 있다”고 설명했다.제도가 시행된 지 5년째지만 참여율은 낮다. 정보보호 공시 기업은 △2016년 2개사 △2017년 10개사 △2018년 20개사 △2019년 30개사 등 매년 소폭 증가에 그쳤다. 이마저도 전년도 참여사를 제외한 신규 참여사로 보면 매년 10곳 안팎 증가에 불과하다.KISA는 정보보호 공시 활성화를 위해 컨설팅 등 여러 사업을 추진했다. 올해 1억5000만원 규모의 정보보호 공시 컨설팅 지원 사업을 통해 기업 8곳이 공시에 참여하도록 이끌었다. 과학기술정보통신부는 정보보호 공시제도 활성화에 기여한 기업과 기관에 올해 처음으로 산업발전 유공 표창을 마련, 수여하기도 했다.정부는 참여율을 높이기 위해 공시 의무화 방안을 추진한다. 과거 20대 국회에서 통과하지 못한 정보보호 공시제도 관련 법안의 한계를 보완했다. 당시 법안은 일부 기업이 아닌 전체 기업 대상으로 공시를 의무화해야 한다고 규정, 실제 적용에 무리가 있다는 평가를 받았다. 김상희 국회 부의장(국회 과학기술정보방송통신위원회)은 제도의 실효성 제고를 위해 지난 10월 정보보호산업의 진흥에 관한 법률 일부개정안을 대표발의했다. 이 법안은 일정 규모 이상 기업에 정보보호 공시를 의무화하도록 규정하고, 공시 미이행 시 1000만원 이하의 과태료를 부과하도록 근거 규정을 마련했다.김 부의장은 “개인정보 유출 문제가 심각한데도 이용자 개인정보 수집이 웹사이트 등에서 무차별적으로 이뤄지는 상황”이라면서 “이용자가 기업에 정보를 제공하는 대신 보호받을 권리가 마땅히 보장돼야 한다”고 말했다. 김 부의장은 “모든 기업이 아니라 일정 규모 이상의 정보통신기술(ICT) 기업에 한정해 정보보호 공시를 의무화하자는 것”이라면서 “정보보호 공시제도를 국정 과제로 추진하고 있는 과기정통부에서도 큰 이견이 없는 만큼 이번 국회에서 법안이 통과되도록 노력하겠다”고 말했다.오다인기자 ohdain@etnews.com▶ ""머천다이징 핵심전략 워크숍 2021"" 20일 개최▶ 네이버 홈에서 [전자신문] 구독하기 [Copyright ⓒ 전자신문 & 전자신문인터넷, 무단전재 및 재배포 금지]",105,https://n.news.naver.com/mnews/article/030/0002920452?sid=103
"기업은행-금융결제원, 데이터 기반 중기 지원 모델 구축 협약",2020.12.28. 오후 4:38,"기업데이터와 결제데이터로 중소기업 성장성 예측(지디넷코리아=차재서  기자)기업은행이 금융결제원과 금융데이터 기반 중소기업 지원 확대 모델 발굴을 위한 업무협약을 체결했다고 28일 밝혔다.협약에 따라 두 기관은 금융결제데이터를 기반으로 중소기업 분석모델·지표를 개발하는 등 중소기업 맞춤 지원을 위한 공동연구를 진행하기로 했다.특히 기업은행의 중소기업 데이터와 금융결제원의 결제데이터를 공유한다. 업종·지역별 중소기업의 경기 동향, 개별 중소기업의 매출 성장성·안정성 등을 예측할 수 있는 지표를 개발한다.



기업은행 관계자는 ""이번 협약으로 여신심사, 기업분석을 더욱 고도화할 수 있을 것으로 기대한다""며 ""빅데이터를 활용해 중소기업 맞춤 상품‧서비스를 개발하고 중기 금융 분야의 데이터산업을 선도해 나갈 것""이라고 말했다.차재서 기자(sia0413@zdnet.co.kr) ▶ 지디넷코리아 '홈페이지' ▶ 네이버 채널 구독하기© 메가뉴스 & ZDNET, A RED VENTURES COMPANY, 무단전재-재배포 금지",105,https://n.news.naver.com/mnews/article/092/0002209187?sid=103
"LG전자, 내달 디자인·위생 강화한 인스타뷰 냉장고 신제품 공개",2020.12.28. 오전 11:00,"[일간스포츠 정길준]   



LG 인스타뷰 냉장고 제품 사진. LG전자 제공    LG전자는 다음 달 온라인 개막하는 CES 2021 전시회에서 디자인과 위생을 강화한 LG 인스타뷰(국내명: 노크온 매직스페이스) 냉장고 신제품을 공개한다고 28일 밝혔다.    LG전자는 심리스 인스타뷰(국내명: 풀 글라스 노크온) 디자인을 2021년형 인스타뷰 냉장고에도 확대 적용한다. 이 디자인은 LG전자가 지난 10월 출시한 공간 인테리어 가전 LG 오브제컬렉션을 통해 처음 선보였다.    신제품은 노크온 기능이 있는 오른쪽 상단 도어 전체를 글라스로 마감했다. 도어를 노크하면 안쪽 조명이 켜져 보관 중인 음식물의 종류와 양을 쉽게 확인할 수 있다. 문을 여닫는 횟수를 줄여 냉장고의 냉기 유출을 줄인다. 노크온 화면은 이전 모델 대비 20% 이상 키웠다.    회사는 상냉장 하냉동 제품에 이어 양문형 냉장고인 신제품에도 UV나노 기능을 탑재했다. 자외선 LED로 물이 나오는 출수구에 있을 수 있는 세균을 최대 99.99% 없앤다. 고객이 언제든지 직접 버튼을 눌러 추가로 살균할 수도 있다. 이 기능은 글로벌 시험인증기관인 TUV 라인란드가 시험한 결과 대장균, 황색포도상구균, 녹농균을 99.99% 제거한다.    이 제품은 왼쪽 냉동칸의 가장 위쪽 선반에서는 지름 약 5㎝의 구형 얼음인 크래프트 아이스를, 왼쪽 도어 전면에 있는 디스펜서에서는 각얼음과 조각얼음을 이용할 수 있다.    신제품은 음성인식 기능을 갖췄다. 사용자가 냉장고 앞에서 '하이 엘지'라고 부른 후 '냉장고 문 열어줘'라고 말하면 자동으로 냉장고 문이 열린다. 양손에 식품이나 그릇 등을 들고 있는 경우에 유용하다.    LG전자 H&A사업본부 키친어플라이언스사업부장 윤경석 부사장은 ""차별화된 디자인과 위생 기능을 더한 LG 인스타뷰 냉장고를 앞세워 해외 프리미엄 냉장고 시장을 지속 선도할 것""이라고 말했다.    정길준 기자 jeong.kiljhun@joongang.co.kr  ▶ [오늘의 운세 바로가기] [만화 바로가기]▶ [큐라프록스 골든디스크 인기투표]     ⓒ일간스포츠(https://isplus.joins.com) 무단 전재 및 재배포 금지""",105,https://n.news.naver.com/mnews/article/241/0003080624?sid=103
"""미니 LED 아이패드 프로, 내년 1분기 출시”",2020.12.28. 오후 4:04,"대만 디지타임스 전망…기존 애플 전문가 예상과 비슷(지디넷코리아=이정현  기자)미니 LED 디스플레이를 갖춘 12.9인치 아이패드 프로가 내년 1분기 출시될 예정이라고 대만 매체 디지타임스가 28일 보도했다.



애플 아이패드 프로 (사진=애플)이 같은 전망은 그 동안의 예상을 좀 더 구체화한 것으로 풀이된다. 애플 전문 분석가 밍치궈 애널리스트를 포함한 일부 분석가들은 2021년 상반기 중 미니 LED 아이패드 프로가 출시될 것으로 전망했다.미니 LED는 LCD나 OLED에 비해 ‘번인’ 우려가 적은 데다 명암대비가 더 선명한 강점을 갖고 있다. 밍치 궈 분석가는 애플이 미니 LED 제품 전략을 강하게 밀어부칠 경우 경쟁사들도 유사한 제품 출시 압박을 받을 것이라고 전망했다.이렇게 될 경우 미니 LED 시장 성장이 가속화될 것이라는 게 밍치궈의 예상이었다.



BOE 로고디지타임스는 또한 중국 최대 디스플레이 업체 BOE가 마침내 아이폰12용 OLED 패널 공급 승인을 얻었다고 전했다. BOE는 그 동안 애플에 OLED 패널을 공급하기 위해 협상을 벌여왔으나, 번번히 품질 테스트를 넘지 못했으나 최근 애플로부터 승인을 받은 것으로 알려졌다.대만 터치스크린 제조업체 GIS도 아이폰과 곧 출시될 아이패드 프로용 터치 패널을 공급할 예정이라고 해당 매체는 전했다. GIS는 아이폰 외에도 2021년 1분기에 출시될 12.9인치 아이패드 프로의 미니 LED 백릿(backlit) 패널용 통합 터치 모듈을 생산할 것이라고 소식통은 밝혔다.애플이 미니LED 아이패드 프로 외에도 OLED 패널 탑재를 계획하고 있다는 보고서가 나온 적이 있다. 하지만, 영국 투자은행 바클레이즈 분석가들은 최근 보고서를 통해 OLED 디스플레이 탑재 아이패드가 2022년까지 출시될 가능성이 낮다고 전망했다.이정현 기자(jh7253@zdnet.co.kr) ▶ 지디넷코리아 '홈페이지' ▶ 네이버 채널 구독하기© 메가뉴스 & ZDNET, A RED VENTURES COMPANY, 무단전재-재배포 금지",105,https://n.news.naver.com/mnews/article/092/0002209182?sid=103
일리아스바이오 “내년 엑소좀 치료제 임상 본격화”,2020.12.28. 오후 2:37,"2020 대한민국 바이오 투자 콘퍼런스



“일리아스바이오로직스의 핵심 플랫폼 기술 ‘EXPLOR’는 가장 발전한 4세대 엑소좀 기반 치료제 개발 기술입니다.”함태진 일리아스바이오로직스 대표는 28일 열린 ’2020 대한민국 바이오 투자 콘퍼런스(KBIC)’에서 “플랫폼 기술 EXPLOR를 완성했으며 미국과 한국에서 특허 등록을 마쳤다”며 “지난 4월 논문 게재를 통해 EXPLOR의 실용적 활용 가능성을 검증받고 기술 자체의 가능성을 인정받았다”고 말했다.그는 “현재 집중하고 있는 것은 염증성 질환에 쓸 수 있는 단백질을 탑재한 엑소좀이며 급성 염증성 질환, 만성 염증성 질환, 더 나아가 암 치료에도 엑소좀을 적용하고자 하는 시도를 하고 있다”고 했다.이어 “내년은 글로벌 회사로 기술이전과 함께 연구개발(R&D)에 집중하고, 회사 자체 파이프라인의 임상을 본격적으로 진행하는 것이 목표”며 “내년 하반기 미국 혹은 해외 임상 1상을 진행할 것”이라고 말했다. 김예나 기자 yena@hankyung.com▶ 경제지 네이버 구독 첫 400만, 한국경제 받아보세요▶ 한경 고품격 뉴스레터, 원클릭으로 구독하세요▶ 한국경제신문과 WSJ, 모바일한경으로 보세요 ⓒ 한국경제 & hankyung.com, 무단전재 및 재배포 금지",105,https://n.news.naver.com/mnews/article/015/0004474268?sid=103
[부음]이택기(동화약품 이사)씨 장인상,2020.12.28. 오후 1:31,"▲이철주씨 별세, 이택기(동화약품 이사)씨 장인상=27일, 예산종합병원 장례식장 목련실, 발인 29일 오전 10시. (041)331-4444▶ ""머천다이징 핵심전략 워크숍 2021"" 20일 개최▶ 네이버 홈에서 [전자신문] 구독하기 [Copyright ⓒ 전자신문 & 전자신문인터넷, 무단전재 및 재배포 금지]",105,https://n.news.naver.com/mnews/article/030/0002920587?sid=103
시어스랩 CTO에 이진욱…삼성 출신 AI전문가 영입,2020.12.28. 오후 5:53,"증강현실(AR) 스타트업 시어스랩이 이진욱 전 삼성전자 디지털가전사업부 인공지능(AI)연구소장(사진)을 최고기술책임자(CTO)로 영입했다고 28일 발표했다.이 CTO는 2005년 삼성전자 입사 후 미래기술리서치, 소프트웨어(SW)개발센터 등을 거쳤다. 2017년 삼성전자 러시아연구소장으로 취임해 모스크바 AI센터 설립을 주도했다. 이곳에서 딥페이크 등 비전 AI 기술 개발을 이끌었다.시어스랩은 통신사들의 5세대(5G) 이동통신 AR 서비스 상용화에 참여한 기업이다. 독자 AR 엔진 ‘AR 기어’를 국내외 시장에서 판매하고 있다. 정진욱 시어스랩 대표는 “이 CTO의 경험과 시어스랩의 기술력을 결합해 혁신적인 비전 AI 기술을 보유한 글로벌 AR 기업으로 도약하겠다”고 말했다.최한종 기자 onebell@hankyung.com▶ 경제지 네이버 구독 첫 400만, 한국경제 받아보세요▶ 한경 고품격 뉴스레터, 원클릭으로 구독하세요▶ 한국경제신문과 WSJ, 모바일한경으로 보세요 ⓒ 한국경제 & hankyung.com, 무단전재 및 재배포 금지",105,https://n.news.naver.com/mnews/article/015/0004474540?sid=103
"네이버클라우드, ‘SaaS 육성 프로그램’ 기업 선정…최대 2천만원 지원",2020.12.28. 오전 9:54,"1월부터 지원 프로그램 가동…파트너 발굴



박기은 네이버클라우드 CTO가 지난 23일 비대면 방식으로 진행된 네이버클라우드 SaaS 육성 프로그램 웨비나에서 발표하고 있다.ⓒ네이버클라우드네이버클라우드는 자사 ‘서비스형 소프트웨어(SaaS) 기업 육성 프로그램’에 선정된 18개 기업을 최종 발표하고 오는 1월부터 본격적인 지원 프로그램 가동을 시작한다고 28일 밝혔다.이 프로그램은 클라우드 기반의 전문 SaaS 기업으로 전환하길 원하는 솔루션 기업이나, 자사의 SaaS 서비스를 고도화하고자 하는 기업을 대상으로 온·오프라인 교육, 인프라 기술 컨설팅, 마케팅 지원, 클라우드 인프라 할인 크레딧 등을 제공하는 등 함께 성장할 파트너를 발굴하기 위해 마련됐다.지난 10월 모집 공고 후 100여 곳이 넘는 기업의 신청이 접수됐고 18개의 기업이 최종 선정됐다. 선정 기업은 ▲날리지큐브 ▲넷퍼넬 ▲데일리블록체인 ▲세일즈인사이트 ▲스페이스리버 ▲심플랫폼 ▲아이디어콘서트 ▲아이알엠 ▲엑셈 ▲오픈서베이 ▲유씨웨어 ▲이벤터스 ▲인베트 ▲카택스 ▲코리아리서치 ▲티그리스 ▲퓨처메인 ▲HM솔루션 등이다.선정된 모든 기업에게는 500만원의 네이버 클라우드 플랫폼 크레딧이 일괄 지급된다. 크레딧 사용 현황에 따라 기업별로 등급을 구분해 매 분기 초 추가 크레딧을 차등 지급한다. 매 분기 최고 등급을 유지하는 기업에게는 연 최대 2000만 원 상당의 크레딧이 발급된다.네이버클라우드와 인텔에서 제공하는 온·오프라인 클라우드 교육 프로그램과 네이버 클라우드 플랫폼 활용 관련 기술 컨설팅도 정기적으로 제공된다. 기업에서 기술 컨설팅을 통해 해결하고자 하는 이슈를 전달하면, 네이버클라우드에서 기술 지원이 가능한 각 분야별 담당자를 배정해 컨설팅을 제공하는 ‘오피스아워’를 진행할 예정이다.내년 6월에는 ‘네이버 클라우드 SaaS 데이(가칭)’ 개최를 통해 네이버 클라우드 플랫폼 기반의 솔루션들을 위한 대규모 네트워크 장도 펼칠 계획이다.박기은 네이버클라우드 최고기술책임자(CTO)는 “협력사에게는 성공적인 SaaS 전문 기업으로 성장할 수 있는 기회가 되고, 네이버 클라우드 플랫폼 사용자에게는 더욱 다양한 클라우드 기반 솔루션을 제공받을 수 있는 계기가 될 것으로 기대한다”며 “SaaS 협력사들의 성장과 성공에 필요한 제반 사항을 아낌없이 지원하겠다”고 말했다.데일리안 김은경 기자 (ek@dailian.co.kr)▶ 데일리안 네이버 구독하기▶ 제보하기ⓒ (주)데일리안 - 무단전재, 변형, 무단배포 금지",105,https://n.news.naver.com/mnews/article/119/0002455608?sid=103
"과학기술전문사관들, 아이디어 활용해 군사기술 뽐내",2020.12.28. 오후 12:01,"과기부 '제1회 밀리테크 챌린지' 개최우수 3개팀 선정···멀티로터형 유도체계 개발 등 수행[이데일리 강민구 기자] 과학기술전문사관 후보생들이 과학기술 아이디어를 접목한 국방 기술 연구를 선보였다.과학기술정보통신부는 ‘제1회 밀리테크 챌린지’를 지난 22일 열고, 28일 평가결과를 발표했다.과학기술전문사관 제도는 우수 과학기술인재가 국방과학연구소 등 국방 분야 연구기관에서 3년 간 연구개발장교로 복무하는 제도이다. 대학 졸업 후 장교로 임관하기 전까지 학부 재학 중 2년 간 후보생 신분으로 다양한 양성과정을 거쳐야 한다.



‘제1회 밀리테크 챌린지’ 수상자.(자료=과학기술정보통신부)올해부터 과학기술전문사관 후보생들은 국방 연구개발 수행 역량을 강화하기 위해 ‘밀리테크 연구 지원 프로그램’을 수행해야 한다.이번 밀리테크 연구는 연구과제별로 총 5개의 연구팀을 구성해 진행됐다. 팀별로 한국과학기술원(KAIST) 교원과 대학원생이 각각 지도교수와 연구멘토가 되어 약 7개월 동안 연구 활동을 지원했다.관련 성과를 평가하기 위해 개최한 ‘제1회 밀리테크 챌린지’에서는 국방과학연구소 연구원을 중심으로 1차 서면평가를 진행하고, 국방 분야 전문가를 중심으로 2차 발표평가를 거쳐 최우수상 1개팀과 우수상 2개팀을 선정했다.‘2020-5 연구팀’은 영상 기반의 유도형 멀티로터 시스템과 관련해 실시간 목표물을 선정하고, 추적 알고리즘과 종말 유도제어 방법을 제시해 추적 성능을 확인하는 연구를 진행해 최우수상을 받았다.연구팀의 대표 장원대 제5기 후보생은 “코로나19로 제한된 상황에서도 온라인으로 연구 활동을 이어갔고, 관련 학회에도 참여해 팀원들과 값진 경험을 얻었다”며 “앞으로 국방과학연구소에서도 창의적 아이디어를 바탕으로 문제를 해결하도록 최선을 다하겠다”고 소감을 전했다.한편, 과기부는 지난 14일에 선발된 7기 과학기술전문사관 후보생부터 밀리테크 연구 지원 프로그램 참여를 의무화할 예정이다. 7기 후보생은 대학 3, 4학년 재학 기간 중 국방과학교육, 창업전문교육, 국방과학연구소 현장 실습 교육, 밀리테크 연구 참여, 사회봉사활동 등 후보생 양성과정을 의무적으로 이수해야 한다.강상욱 과기부 미래인재정책국장은 “과학기술전문사관 제도는 이공계 우수 인재가 현역 복무를 통해 국방 연구개발 분야에 기여하는 제도”라며 “과학기술전문사관이 국방 분야에 실질적으로 기여하고, 각 분야를 이끌어갈 리더로 성장하도록 지원하겠다”고 했다.강민구 (science1@edaily.co.kr)▶ #24시간 빠른 #미리보는 뉴스 #eNews+▶ 네이버에서 '이데일리 뉴스'를 만나보세요▶ 빡침해소, 청춘뉘우스 '스냅타임'＜ⓒ종합 경제정보 미디어 이데일리 - 무단전재 & 재배포 금지＞",105,https://n.news.naver.com/mnews/article/018/0004816100?sid=103
"코스모신소재, MLCC 이형필름 생산라인 증설…배터리 양극재 '투트랙'",2020.12.28. 오후 2:46,"코스모신소재 충주 공장 전경.코스모신소재는 전장과 IT기기용 적층세라믹콘덴서(MLCC) 제조에 사용되는 이형필름 생산라인 증설에 250억원을 투자한다고 28일 밝혔다.코스모신소재는 이번 투자와 관련해 “니켈·코발트·망간(NCM) 전기차 배터리용 양극재와 또다른 주력 제품인 전장용 MLCC 이형필름은 수요 증가로 하반기부터 24시간 풀가동 체제를 유지하고 있다”며 “지속 확대하는 수요를 감안해 설비 증설에 나섰다”고 설명했다.전기차 등 배터리·전자제품 수요 증가에 따라 MLCC용 이형필름 수요도 매년 급격히 확대될 전망이다.코스모신소재는 앞서 배터리 양극재도 리튬산화코발트(LCO)계열에서 전기차·에너지저장장치(ESS) 배터리에 주로 쓰이는 하이니켈로 품목 교체를 완료했다. 지난 11월에는 1560억원 규모 배터리 양극재 공급계약도 체결했다. 이는 최근 매출의 63.98%에 달하는 수준이다.김지웅기자 jw0316@etnews.com▶ ""머천다이징 핵심전략 워크숍 2021"" 20일 개최▶ 네이버 홈에서 [전자신문] 구독하기 [Copyright ⓒ 전자신문 & 전자신문인터넷, 무단전재 및 재배포 금지]",105,https://n.news.naver.com/mnews/article/030/0002920620?sid=103
