title,date,main,section,url
투란도트도 자결? 갸우뚱한 결말,2023.10.29. 오후 5:45,"투란도트푸치니의 4대 오페라 중 미완성 유작손진책 연출의 첫 오페라 데뷔 원작선 사랑을 완성시킨 '류의 죽음'공주 자살과 민중 해방으로 비틀어



지난 26일 서울 세종문화회관에서 개막한 오페라 '투란도트' 마지막 장. 소프라노 이윤정(투란도트)과 서선영(류)이 칼라프의 이름이 사랑이라고 밝히는 노래를 부르고 있다.  서울시오페라단 제공지난주 서울은 ‘오페라 위크’였다. 국내 양대 오페라 공연장인 예술의전당 오페라극장과 세종문화회관 대극장은 26~29일 각각 벨리니의 ‘노르마’(연출 알렉스 오예)와 푸치니의 ‘투란도트’(연출 손진책)를 자체 기획·제작으로 무대에 올렸다. 이 공연들은 현대 오페라 연출의 주요 트렌드인 ‘레지테아터’(연출가 중심의 극)가 원작을 얼마나 새롭게 조명할 수 있는지 보여줬다. 레지테아터는 오페라 대본(리브레토)과 음악은 그대로 살리면서 시·공간적 배경을 연출가의 해석과 의도에 따라 원작과 달리하는 것을 말한다. 두 공연 모두 현대적인 연출과 접근이 신선했다. 단, 퍼포먼스와 내용이 원작과 동떨어진 대목이 많아 오페라 애호가 사이에서 평가가 엇갈린 무대였다.현대 오페라 공연의 새로운 트렌드인 ‘레지테아터’는 국내 무대에서도 심심찮게 찾아볼 수 있다. 서울시오페라단만 해도 지난해 구노 오페라 ‘로미오와 줄리엣’(연출 이혜영)을 공연할 때 극의 배경을 1940년대 미국 뉴욕으로 바꿨고, 베르디 오페라 ‘리골레토’(연출 장서문)는 지금의 서울을 연상시키는 현대적인 무대와 의상 연출로 공연했다.지난 26일 서울시오페라단이 세종문화회관 대극장 무대에 올린 푸치니의 미완성 유작 ‘투란도트’는 한발 더 나아갔다. 이번 오페라 연출은 연극계 거장인 손진책(76)이 맡았다. 손 연출가는 마당놀이 등 연희극과 창극을 비롯한 음악극을 연출한 경험은 풍부하지만 투란도트 같은 클래식한 오페라를 무대에 올린 적은 없었다.



투란도트 역의 소프라노 이윤정(왼쪽)과 칼라프 역의 테너 이용훈이 이중창을 부르고 있다.  서울시오페라단 제공‘라 보엠’ ‘토스카’ ‘나비부인’과 함께 푸치니의 4대 오페라 중 하나인 투란도트는 국내외 무대에 자주 오르는 인기 오페라다. 중국 베이징 거대한 제국의 공주 투란도트는 자신에게 청혼하러 온 외국 왕자들에게 수수께끼를 낸 뒤 맞히지 못하면 죽여 버린다. 전쟁으로 나라를 잃은 칼라프 왕자는 투란도트에게 반해 청혼하고 공주가 낸 수수께끼 세 개를 다 맞힌다. 그의 용기는 칼라프를 짝사랑하던 시종 류의 죽음을 담보로 한 것이다. 푸치니는 이 작품의 마지막인 3막 1장 ‘류의 죽음’까지 작곡하고 투란도트와 칼라프의 이중창, 왕궁의 피날레 송이 이어지는 마지막 장면을 완성하지 못한 채 세상을 떠났다. 투란도트와 칼라프의 이중창, 피날레 송이 흐르는 마지막 장은 푸치니의 후배 프랑코 알피노가 완성했다.손 연출가는 이 작품의 리브레토(대본)와 음악을 그대로 살리면서 고대 중국 베이징인 배경을 ‘시대가 불분명한 디스토피아적 지하 세계’로 바꿨다. 막이 열리면 거대한 콘크리트 기둥과 구조물, 계단으로 이뤄진 무대 세트가 보인다.연출가는 시공간적 배경뿐 아니라 결말도 바꿨다. 투란도트가 칼라프와 ‘밀당’의 이중창을 부른 뒤 아버지인 황제가 있는 곳으로 향하는 것이 아니라 류처럼 권총으로 자결한다. 무대에서 직접적으로 죽음을 보여주진 않는다. 총소리와 핏빛 어린 조명만으로 짐작하게 한다. 이어 투란도트는 원작처럼 황제 앞에서가 아니라 이미 세상을 떠난 류와 함께 손을 잡고 나타나 칼라프의 이름이 ‘사랑’이라고 노래한다. 피날레에서는 투란도트의 압제에서 벗어난 군중이 내내 입고 있던 검은 옷이 아니라 흰옷을 입고 밝은 미래를 기원하는 노래를 부른다.류의 희생, 죽음이 칼라프와 투란도트의 결합으로 이어진 원작과는 달리 공주의 자살과 민중의 해방을 불러온 것이다. 이 부분은 좀처럼 공감하기 힘들다. 원작의 마무리가 이해가 안 돼 다른 이야기를 상상해봤다는 연출가의 설명을 들어도 마찬가지다. 동시대적 감성으로도 수긍하기 어려운 결말이다.첫날(26일) 공연은 뉴욕과 영국 런던에서 칼라프 역을 100회 이상 맡은 세계적인 테너 이용훈(50)의 국내 데뷔 무대였다. 그는 1막 아리아 ‘울지마라 류’ 등에서 특유의 서정적인 음색에 강력하게 밀어붙이는 힘을 더한 리리코 스핀토 테너로서의 기량을 유감없이 보여줬다. 다만 3막 ‘아무도 잠들지 마라(Nessun dorma)’에선 강약 조절이 원활하지 않았다. 이날 타이틀 롤을 맡은 소프라노 이윤정과 류 역의 서선영, 칼라프의 아버지 티무르 역의 바리톤 양희준 등은 좋은 가창과 연기를 보여줬다.",105,https://n.news.naver.com/mnews/article/015/0004907834?sid=103
,,,105,https://n.news.naver.com/mnews/article/016/0001819505?sid=103
"그라비티, '라그나로크: 라비린스' 첫 업데이트",2021.04.09. 오후 3:38,"이용자 건의 사항 적극 반영…기념 이벤트도 실시



[아이뉴스24 문영수 기자] 그라비티는 모바일 게임 '라그나로크: 라비린스'의 첫 번째 업데이트를 9일 진행했다.라그나로크: 라비린스는 라그나로크 IP에 미로 콘셉트를 접목시킨 역할수행게임(RPG)이다. 미로로 이뤄진 다양한 맵들을 탐험하면서 라그나로크 평행 세계 속에서 펼쳐지는 스토리를 체험할 수 있다.첫 업데이트는 신규 챕터 추가, 거래소 오픈, 직업 레벨 확장 등 콘텐츠 업데이트와 함께 이용자가 공식 커뮤니티를 통해 남긴 요청사항을 반영했다.먼저 신규 챕터는 코코모 해변, 서쪽 동굴 카루, 베인스 필드가 추가된다. 이번에 추가된 맵들은 100레벨 이상의 고레벨 유저들이 성장하기에 적합한 맵이다. 또한 거래소가 오픈돼 사냥, 던전 등에서 획득한 필요 없는 아이템을 판매할 수 있다. 캐릭터 성장 속도에 맞춰 직업 레벨도 125까지 확장했다서상원 라그나로크: 라비린스 PM은 ""이용자분들의 관심과 성원에 감사드리며 첫 번째 업데이트에도 많은 참여 바란다""며 ""앞으로도 다양한 콘텐츠와 이벤트를 준비할 테니 기대해주시길 바란다""고 말했다./문영수 기자(mj@inews24.com)▶네이버 채널에서 '아이뉴스24'를 구독해주세요.▶재밌는 아이뉴스TV 영상보기 ▶아이뉴스24 바로가기[ⓒ 아이뉴스24 무단전재 및 재배포 금지]",105,https://n.news.naver.com/mnews/article/031/0000592506?sid=103
"카카오, ‘환경 경영 국제표준 인증’ 획득…국내 IT업계 최초",2021.04.09. 오후 2:27,"‘ISO 14001’ 인증 취득…ESG 경영 강화



카카오 로고.ⓒ카카오카카오는 국내 정보기술(IT)업계 최초로 환경 경영 국제표준 인증을 획득했다고 9일 밝혔다.카카오는 이날 경기도 성남 카카오 판교오피스에서 한국경영인증원(KMR)으로부터 환경 경영 시스템 국제표준 'ISO 14001'을 받았다.수여식에는 황은주 KMR 원장과 카카오 환경·사회·지배구조(ESG) 태스크포스(TF) 김유진 부사장 등이 참석했다.KMR에 따르면 국내 포털·인터넷 업체가 이 표준을 받는 것은 처음이다.ISO 14001은 국제표준화기구(ISO)가 제정한 인증으로 기업이 환경 경영을 기업의 중요한 기준으로 삼고 이를 관리할 체계를 갖췄는지 평가해 인증하는 국제 규격이다.카카오는 업무 체계에서 친환경 경영을 중요한 기준으로 삼고 있고 관련 법규·지침에 따라 구체적인 목표를 수립하고 계획을 체계적으로 추진하는 점을 인정받았다고 강조했다.카카오는 저탄소 경제 전환에 기여하기 위해 2023년 준공을 목표로 친환경 데이터센터를 건립 중이며 산업계·학계와 협력하는 자문단을 구성할 예정이다.김유진 카카오 부사장은 “카카오는 환경과 관련해 적극적인 문제의식을 가지고 있으며 탄소중립 실현, 에너지 재사용 등에 동참할 뿐만 아니라 더 나은 세상을 만들기 위한 카카오만의 지속 가능한 환경 경영 체계를 구축하기 위해 노력하겠다“고 말했다.데일리안 김은경 기자 (ek@dailian.co.kr)▶ 데일리안 네이버 구독하기▶ 데일리안 만평보기▶ 제보하기ⓒ (주)데일리안 - 무단전재, 변형, 무단배포 금지",105,https://n.news.naver.com/mnews/article/119/0002483616?sid=103
"삼성, '갤럭시 Fan 클래스' 운영…""다양한 프로그램 제공""",2021.04.09. 오전 9:00,"삼성전자가 스마트폰의 활용법부터 주제별 다양한 맞춤 클래스를 제공하는 '갤럭시 Fan 클래스'를 운영한다고 밝혔다. © 뉴스1(서울=뉴스1) 이창규 기자 = 삼성전자가 '갤럭시S21'과 '갤럭시Z폴드2' 등 최신 제품 활용법부터 고객의 라이프스타일을 반영한 주제별 맞춤 교육까지 다양한 프로그램을 제공하는 '갤럭시 Fan 클래스'를 운영한다고 9일 밝혔다. 갤럭시 Fan 클래스는 매장을 기존의 단순한 제품 구매 공간이라는 개념에서 한 차원 더 나아가 고객들과 지속적으로 소통하며 다양한 브랜드 경험을 선사하는 공간으로 진화시키자는 취지에서 기획됐다.갤럭시 Fan 클래스는 지난달 말부터 삼성 디지털프라자 등에 마련된 전국 62개 갤럭시 스튜디오에서 진행되고 있다. 삼성전자는 갤럭시S21과 갤럭시Z폴드2, 갤럭시Z플립 등 최신 제품의 혁신 기능을 배울 수 있는 '갤럭시 찐 활용법'도 Δ공신들의 공부 환경 만들기 Δ셀프 웨딩 기록법 Δ댕냥이 인생샷 비법 Δ내 멋대로 폰 커스텀 등 특화 프로그램이 운영 초기부터 인기라고 설명했다. 삼성 디지털프라자 연수송도점에서 댕냥이 인생샷 비법 클래스를 수강한 고객은 ""강아지가 활발한 편이라 사진이 항상 흔들렸는데 갤럭시 Fan 클래스에서 모션 포토나 싱글테이크 등 순간 포착에 유용한 기능들을 배워서 정말 유익했다""며 ""삼성 디지털프라자는 제품을 구입할 때만 방문했는데 앞으로 자주 들려서 더 다양한 활용법들을 알아가고 싶다""는 수강 소감을 남기기도 했다.삼성전자 관계자는 ""앞으로도 구매 이후 일상 속에서 제품의 가치와 효용을 지속적으로 체감할 수 있도록 고객 취향과 눈높이에 맞춘 다양한 교육 프로그램을 제공할 예정""이라며 ""갤럭시 Fan 클래스에서 함께 소통하고 즐겁게 배우며 나만의 새로운 가능성을 발견해 보길 바란다""고 말했다.yellowapollo@news1.kr▶ 네이버 메인에서 [뉴스1] 구독하기!▶  뉴스1&BBC 한글 뉴스 ▶  터닝포인트 2021 © 뉴스1코리아(news1.kr), 무단 전재 및 재배포 금지",105,https://n.news.naver.com/mnews/article/421/0005278180?sid=103
500억 규모 'C-ITS 격전지' 강릉…이통 3사 '촉각',2021.04.09. 오후 4:22,"전국 최대 사업 사전규격 공개…13일 이후 본 사업 공고



 [인포그래픽=아이뉴스24][아이뉴스24 송혜리 기자] 올해 차세대 지능형 교통 시스템(C-ITS) 사업 최대 격전지인 강릉시 사전규격 공개에 따라 관련 업계 전운이 감돈다.총 490억원이 투입되는 강릉시 사업은 지난해 국토교통부가 선정한 '2021년 지자체 지능형교통체계(ITS) 및 차세대 지능형교통체계(C-ITS) 국고 보조사업' 중 최대 규모다.이에 따라 지난 C-ITS 실증 사업에서 매번 격돌해 온 이동통신 3사는 촉각을 세운다. SK텔레콤은 서울시 C-ITS 실증사업 주관 사업자로 참여 중이고, KT는 제주, 광주, 울산 사업을 수주해 올해 제주 실증사업을 완료했다. LG유플러스는 지난 '2020 한·세계화상 비즈니스 위크'에서 C-ITS를 선보인 바 있다.9일 강릉시에 따르면 시는 지난 8일 '강릉시 지능형교통체계(ITS) 기반구축사업' 사전규격을 시 홈페이지와 조달청 나라장터를 통해 공개했다.이번 사업은 국토교통부 '2021년 지자체 ITS 및 C-ITS 국고 보조사업'일환이다. 국토부는 지난해 해당 사업을 지원할 지자체 44곳을 선정하고, 올해 총 1천390억원을 투입한다고 발표했다.사전규격 공개로 본격화된 '강릉시 ITS 기반구축사업'은 강릉시 도시정보 통합센터, 주차 정보시스템, 스마트 신호제어 등 첨단교통정보 시스템을 구축하고 이를 기반으로 공공과 민간 교통정보를 활용한 선순환 구조를 마련하기 위해 추진한다.분리발주가 아닌 통합사업으로 진행되며, 사전규격상 공개된 예산은 450억원, 총 예산은 확보된 국비 294억원과 지방비 196억원 포함 490억원이다. 강릉시는 필요한 행정절차를 조기에 마치고 상반기에 착공할 계획이다.강릉시 교통과 관계자는 ""사전규격에 대한 법령, 업체 의견 수렴 기간은 다음 주 화요일인 13일까지로, 이후 해당 의견 반영 여부를 검토해 본 입찰 공고할 예정""이라고 말했다.특히, 강릉시가 국토부 사업 선정으로 확보한 국비 294억원은 서울·부산 등 광역시 포함 사업 대상 지자체 중 최대 규모다.아울러 이번 사업을 수주한다면, 강릉시가 역점 추진 중인 '2026년 ITS 세계총회' 유치 시, 세계 각국에 C-ITS 기술을 선보일 기회가 될 것으로 보인다. 강릉시는 올림픽파크 일원의 자율주행차 시범지구 지정, 도심 항공교통(UAM) 실증단지 조성도 추진하고 있다.한편으로, 강원도는 원주시와 강릉시를 거점으로 교통 수요 변화에 탄력적으로 대응하는 첨단도시형 교통체계 인프라를 구축할 예정이다.이에 따라 강릉시와 마찬가지로 국토부 ITS 사업 대상 지자체인 원주시는 총 40억원 규모로 올해 ITS 기반사업 분리 발주를 시작한 상태다.원주시 교통과 관계자는 ""사업 설계는 80% 완료된 상태로, 이중 순차적으로 발주가 되고 있다""며 ""늦어도 이번달 말, 다음달 쯤이면 발주를 완료할 예정""이라고 말했다.◆ 이통 3사 재격돌 예상…'최대 수주' KT 또 웃을까올해 C-ITS 사업 최대 격전지인 강릉시 사전규격 공개에 이통 3사 상황도 주목된다.SK텔레콤, KT, LG유플러스 통신 3사는 그간 서울특별시·광주광역시·울산광역시 C-ITS 사업에 나란히 입찰하며 격돌해왔다.우선, 이통 3사 중 가장 수주 타율이 높았던 KT는 올해 제주도 C-ITS 사업 마무리한 성과를 바탕으로 'KT C-ITS' 전국 확산에 자신감을 내비친다.KT는 국토부가 지난 2018년 이후 발주한 전국 4곳의 C-ITS 사업 중 제주, 광주, 울산 3곳을 수주했다. 또 세종에서는 자율주행 실증사업, 대구 수성알파시티에서는 기가 코리아 사업 일환으로 자율주행 관련 기술을 선보였다.SK텔레콤은 서울시 C-ITS 실증사업을 수행 중이다. 해당 사업으로 SK텔레콤은 고도 자율협력 주행 테스트베드 조성,  첨단도로인프라 조성·차량사물통신(V2X) 기반 커넥티드 카 서비스 실현, 미래교통 공유 플랫폼 및 딥러닝 분석체계 정립 등을 추진 중이다.아울러 LG유플러스는 '2020 한·세계화상 비즈니스 위크'에서 C-ITS를 선보였고, 세종시 '자율주행 빅데이터 관제센터 및 플랫폼 구축' 사업자로 선정된 바 있다./송혜리 기자(chewoo@inews24.com)▶네이버 채널에서 '아이뉴스24'를 구독해주세요.▶재밌는 아이뉴스TV 영상보기 ▶아이뉴스24 바로가기[ⓒ 아이뉴스24 무단전재 및 재배포 금지]",105,https://n.news.naver.com/mnews/article/031/0000592521?sid=103
"강남세브란스·카이스트·웨이센, 의료 빅데이터 연구 '맞손'",2021.04.09. 오후 2:36,"인공지능 기반 의료 빅데이터 활용 연구로 미래 의료기술 선점 목표(서울=연합뉴스) 김잔디 기자 = 강남세브란스병원은 카이스트(KAIST) 유전자동의보감사업단, 의료 인공지능(AI) 전문기업 웨이센과 'AI 기반 의료 빅데이터 활용기술 공동연구'를 위한 업무협약(MOU)을 체결했다고 9일 밝혔다.     협약에 따라 세 기관은 의료 빅데이터를 활용해 차세대 진단법과 새로운 치료물질 개발 등에 협력하기로 했다.     강남세브란스병원은 그동안 축적해온 질환 관련 유전 및 임상 정보 등 의료 빅데이터를 분석할 수 있는 플랫폼을 제공하기로 했다.     카이스트 유전자동의보감사업단은 가상인체 기술을 활용해 복잡한 인체 생리현상을 컴퓨터로 예측하는 실험을 시행한다.    웨이센은 두 기관의 산출물을 기반으로 하는 의료 AI 연구를 맡기로 했다.     이번 협약은 의료, 바이오 및 뇌공학, AI 등 각 분야 전문가 그룹이 정밀의료 분야의 기초 연구부터 응용 분야까지 전 분야에서 협력한다는 데 의미가 있다고 강남세브란스병원은 밝혔다.     송영구 강남세브란스병원 병원장은 ""국내 최고 기술력을 지닌 세 기관의 협력은 의료 AI, 가상 인체 실험 등 미래 의료 판도를 변화시킬 핵심 가치의 발전을 촉진할 것""이라며 ""병원의 연구 역량을 극대화할 것으로 기대한다""고 말했다.



(서울=연합뉴스) 웨이센 김경남 대표(왼쪽부터), 강남세브란스병원 송영구 병원장, KAIST 유전자동의보감사업단 이도헌 단장이 9일 강남세브란스병원에서 AI 기반 의료빅데이터 활용기술 공동연구 협약을 맺고 기념촬영을 하고 있다. 2021.04.09. [강남세브란스병원 제공. 재판매 및 DB 금지]    jandi@yna.co.kr▶네이버에서도 뉴스는 연합뉴스[구독 클릭]▶[팩트체크]'올해의 의학자상'수상자가 밝힌 백신 무용론?▶제보하기<저작권자(c) 연합뉴스(https://www.yna.co.kr/), 무단 전재-재배포 금지>",105,https://n.news.naver.com/mnews/article/001/0012318521?sid=103
T맵 “카카오 비켜”… 4000억원 투자금 유치하며 경쟁 시동,2021.04.09. 오후 4:44,"티맵모빌리티, 우버 이어 사모펀드서도 4천억원 유치제3자 배정 방식 유상증자 통해발행가 8만7418원…기업가치 1조4천억원으로



티맵모빌리티 제공지난해 12월 에스케이텔레콤(SKT)에서 분사된 티맵모빌리티가 우버로부터 5천만달러(591억원)를 투자받은데 이어 국내외 사모펀드로부터도 4천억원을 추가 유치했다. 티맵모빌리티는 투자받은 자금을 바탕으로 우수인력 충원과 신규 사업 진출 등을 본격화한다.티맵모빌리티는 이사회를 열어 4천억원 규모의 제3자 배정 보통주 유상증자를 결의했다고 9일 밝혔다. 457만5718주를 발행하며 발행가는 8만7418원이다. 사모펀드인 어펄마캐피탈과 이스트브릿지파트너스가 배정받아 각각 14%와 28%의 지분을 보유하게 된다. 티맵모빌리티는 “성장성이 높게 평가받은 결과이다. 앞서 우버로부터 투자를 받을 때는 기업가치가 1조원으로 책정됐는데, 이번에 추가로 투자 유치에 성공하면서 투자 후 기업가치(포스트밸류)가 1조4천억원으로 늘어나게 됐다”고 설명했다.티맵모빌리티는 내비게이션 ‘티(T)맵’을 기반으로 이용자들의 편의성과 안전성에 초점을 맞춘 다양한 서비스를 출시할 예정이다. △플랫폼(주차·광고·UBI) △T맵 오토(차량 인포테인먼트·결제) △모빌리티 온디맨드(택시호출·대리운전) △올인원 Maas(Mobility as a service) 등을 4대 핵심 사업으로 꼽고 있다. 렌터카, 차량공유, 단거리 이동수단, 주차 등을 모두 묶어 할인 혜택을 제공하는 구독형 요금제도 선보일 예정이다.티맵모빌리티는 이를 통해 2025년까지 연매출 6천억원, 기업가치 4조5천억원을 달성한다는 목표이다. 이종호 티맵모빌리티 대표는 “기존 사업 고도화는 물론 시장 규모를 키울 수 있는 신규 사업에도 보다 공격적으로 진출할 것”이라며 “‘이동의 혁신을 통해 세상을 바꾼다’는 목표로 사용자들의 경험이 행복으로 연결될 수 있도록 고민해 나가겠다”고 말했다.한편 이번 투자에 나선 이스트브릿지파트너스는 2011년 임정강 대표가 스틱인베스트먼트에서 나와 설립한 사모펀드로 첨단 산업과 소비재 등의 분야에 투자를 이어가고 있다. 어펄마캐피탈은 2019년 스탠다드차타드프라이빗에쿼티(SC PE)에서 독립해 동남아시아·아프리카·인도·중국·중동 등에서 활동 중인 사모펀드다.김재섭 선임기자 jskim@hani.co.kr▶더불어 행복한 세상을 만드는 언론, 한겨레 구독하세요!▶esc 기사 보기▶4.7 재·보궐선거 기사 보기[ⓒ한겨레신문 : 무단전재 및 재배포 금지]",105,https://n.news.naver.com/mnews/article/028/0002539827?sid=103
