title,date,main,section,url
"애플, 아이폰14 프로에 USB-C 첫 탑재할까",2021.11.19. 오후 2:04,"애플이 내년에 출시할 아이폰14 프로 모델에 아이폰 최초로 USB-C 포트를 탑재할 것이라는 소식이 나왔다.IT매체 폰아레나는 18일(현지시간) 미국 아이드랍뉴스를 인용해 이 같은 소식을 전했다.



유럽연합은 최근 모바일 기기 충전방식을 USB-C로 통일하겠다고 밝혔다.  (사진=씨넷)해당 매체는 익명의 소식통을 인용해 애플이 내년 아이폰14 프로, 아이폰14 프로 맥스 모델부터 기존라이트닝 케이블을 USB-C 포트로 전환하는 것을 고려하고 있다고 보도했다.소식통은 애플이 USB-C로 전환하는 이유를 첫째는 더 빠른 전송 속도, 둘째는 최근 유럽연합(EU)의 법 제정, 마지막으로는 환경 보호로 꼽았다.애플은 올해 아이폰13 프로에 고성능 영상 촬영 및 편집 기능인 프로레스(ProRes) 기능을 도입했고 이 기능을 내년 아이폰14 프로에도 적용할 예정이다. 프로레스 기능은 최대 4K 영상을 30프레임으로 녹화·편집할 수 있지만, 용량이 커서 영상을 PC로 전송할 경우 많은 시간이 소요된다.



라이트닝과 USB-C 커넥터.(사진=씨넷)현재 2시간 가량의 약 720GB 4K 동영상 파일을 기존 라이트닝 케이블로 PC로 옮기려면 약 3시간 45분이 걸리지만, USB-C를 통해 옮기면 2분 38초이면 된다.또, 최근 유럽연합(EU)은 전자 폐기물과 소비자 불편을 줄이기 위해 모바일 기기 충전을 USB-C 케이블로 통일하는 법안을 만들어 2024년부터 본격 적용할 예정이다. 애플이 프로 모델에 USB-C를 적용하고, 타 모델에 라이트닝 케이블을 유지해도 어느 정도 벌금을 면할 수 있다고 생각하고 있다고 소식통은 전했다.마지막으로, 현재 애플을 비롯한 많은 회사들이 환경 보호를 이유로 충전기를 기본 구성품에서 제외해 별도 판매하고 있다. 아이폰이 USB-C로 전환하면 환경 보호에도 도움이 될 것이라고 해당 매체는 전했다.",105,https://n.news.naver.com/mnews/article/092/0002239689?sid=103
"‘신고 수리’ 빗썸, 업비트 추격 힘 얻나…""가상자산거래소 본 게임 이제 시작""",2021.11.19. 오후 7:07,"사업자 신고 불확실성 해소…신뢰성 회복에 긍정적 영향NFT 등 신사업 추진에도 긍정적…비덴트와 시너지 기대



빗썸 로고.ⓒ빗썸[데일리안 = 이건엄 기자] 빗썸이 가상자산 사업자 신고를 마치면서 가상자산 거래소 업계 판도가 바뀔지 관심이 모아진다. 트래블룰(Travel rule) 시스템 구축과 신사업 추진 등에 적극 나서며 업비트에 대한 추격의 고삐를 죌 것이란 전망이다.금융위원회 산하 금융정보분석원(FIU)은 19일 빗썸에 대한 가상자산 사업자 신고 수리를 결정했다. 이로써 국내에서 원화 거래를 할 수 있는 거래소는 4곳으로 늘었다.빗썸은 “금융권 수준의 자금세탁방지 시스템을 갖추기 위해 고객확인제도와 준법감시체제 강화에 전사적 노력을 기울였다”며 “금융당국 기준에 따라 내년 3월 이전까지 트래블룰 시스템을 구축할 수 있도록 만반의 준비를 다하고 있다”고 설명했다.빗썸은 그동안 신고 수리가 지연되면서 3, 4위 업체 코인원과 코빗에게는 쫒기고 1위 업비트와는 경쟁에서 밀리는 양상을 보여왔다. 신고 수리라는 불확실성이 해소되지 않아 신뢰성 측면에서 불리하게 작용했기 때문이다.하지만 가상자산 사업자로 등록을 마치면서 추격의 고삐를 더욱 죌 것으로 전망된다. 특히 최근 빗썸의 이용자 폭이 크게 늘었다는 점에서도 향후 영향력 확대에 긍정적 요인이 될 것으로 분석된다.실제 빅데이터 분석 솔루션업체 모바일인덱스에 따르면 빗썸의 이용자는 지난 10월 15일부터 지난 16일 사이 61만9677명에서 68만1528명으로 10% 증가했다. 반면 업비트의 경우 같은기간 276만6192명에서 285만8035명으로 3.3% 증가하는데 그쳤다.



서울 강남구 암호화폐 거래소 빗썸 강남 고객센터 전광판에 비트코인 등 암호화폐 시세가 표시되고 있다.ⓒ뉴시스또 신고 수리로 그 동안 차질을 빚었던 트래블룰 시스템 구축과 과세 모델 도입 등에도 속도가 붙을 것으로 보인다. 그 동안 빗썸은 신고 수리 지연 여파로 자금세탁 방지 등에 제 때 나서지 못하며 경쟁에서 뒤쳐졌다는 평가를 받아왔다.현재 빗썸은 고객확인제도(KYC)와 트래블룰, 과세 시스템 도입을 위한 사전 준비는 마쳤지만 신고 수리 지연으로 실제 시스템에는 적용하지 못하고 있다.특히 대체불가능한토큰(NFT)과 같은 신사업 추진도 보다 수월해질 전망이다. 이미 대주주인 비덴트가 NFT의 핵심인 콘텐츠 경쟁력 강화에 나서면서 상당한 시너지가 날 것으로 기대되고 있다. 실제 비덴트는 타법인 증권 취득자금을 목적으로 400억원 규모의 유상증자를 결정했다.이번 유상증자에 참여한 초록뱀컴퍼니는 콘텐츠 전문기업 초록뱀미디어 지분을 30.1% 보유한 최대주주다. 초록뱀미디어가 올해 펜트하우스, 오케이광자매로 공중파 드라마 흥행을 주도하며 독보적 기획력을 증명해 초록뱀컴퍼니 역시 긍정적 평가가 따르고 있다.업계 관계자는 “그 동안 빗썸이 가상자산 사업자 신고 지연으로 많은 부분에서 제약이 따랐다”며 “이 때문에 업계 1위 업비트와의 경쟁에서 많은 어려움을 겪었다”고 설명했다.이어 “늦었지만 빗썸도 사업자 신고 수리 다음 단계를 밟아 나갈 수 있게 됐다”며 “대주주 비덴트와의 시너지도 기대된다”고 덧붙였다.",105,https://n.news.naver.com/mnews/article/119/0002549816?sid=103
“티켓 2장에 10만원” 입장 제한에 10배 웃돈 붙은 지스타 입장권,2021.11.19. 오후 3:29,"무료 초대권 중고거래앱에서 판매, 5~10배 폭리관람객 제한 탓에 입장권 경쟁 치열해진 탓조직위 “사전대응 어려워, 사후 적발 시 입장 제한”



국내 최대 게임 전시회 지스타 2021가 2년 만에 현장 개최했다. 코로나19 유행 상황을 고려해 관람객은 예년의 10분의 1 수준으로 제한됐다. 사진은 지스타 현장. /연합뉴스        “초대권 2장 팝니다. 10만원.”신종 코로나 바이러스 감염증(코로나19) 방역조치로 하루 관람객이 6000명으로 제한된 지스타에 ‘웃돈’ 붙은 입장권이 등장했다. 애초에 시중에 풀린 입장권이 제한적인 데다가 2022년도 대학수학능력시험을 막 끝낸 게임 이용자들이 지스타에 대거 몰린 탓이다. “입장권 얻기가 하늘에 별따기”라는 말이 나올 정도다.19일 국내 최대 게임 전시회 ‘지스타 2021′현장인 부산 해운대구 벡스코(BEXCO) 인근에서 모바일 중고거래 애플리케이션(앱)을 실행한 뒤, ‘지스타’를 검색하면 조금이라도 저렴하게 입장권을 구하려는 사람과 조금이라도 비싸게 팔려는 사람의 게시글이 여럿 뜬다. 이 중에는 거래가 완료된 것도 있는데, 대부분 4~5만원 선에서 거래되고 있는 것을 확인할 수 있다.지스타 2021의 입장권 가격이 성인 1만원, 청소년 5000원이라는 점을 고려하면 적게는 5배, 많게는 10배나 되는 돈을 써야 지스타에 입장할 수 있다는 의미다. 더욱이 중고거래 앱에서 거래되고 있는 입장권은 조직위 측이 정상적인 유통으로 배포한 ‘정식 티켓’이 아닌 지스타 참가 기업이나, 관련 정부 및 민간기관 등에 무료로 풀린 ‘초대권’ 형태다. 결국 무료 초대권이 버젓이 웃돈까지 붙여져 거래되는 것인데, 이는 곧 ‘암표’에 해당한다. 암표 거래는 경범죄처벌법과 형법 등에 의거, 불법으로 규정돼 있다.



중고거래 앱에서는 지스타 초대권이 '암표'로 버젓이 거래되고 있다. 정상 입장권의 5~10배의 폭리를 취하고 있다. /당근마켓 캡처        지스타에 매년 참가해 온 한 게임 업체 관계자는 “예전에도 초대권이 암암리에 거래되는 일이 있었지만, 이렇게 비싼 가격이 매겨진 건 처음 본다”라고 했다. 일부 관람객들도 “왜 5만원씩이나 주고 정식 입장권도 아닌 초대권을 사야 하는지 모르겠다”는 반응을 내놓고 있다.지스타 입장권이 ‘품귀’를 넘어 ‘웃돈 거래’까지 이뤄지는 가장 큰 이유는 오전 3500명, 오후 2500명 등 총 6000명으로 하루 입장 인원을 제한하는 탓이 크다. 지난 2019년 지스타에는 행사가 이뤄진 4일간 24만명이 전시 현장을 찾았는데, 하루 6만명 꼴이다.현재 관람 인원은 2019년 당시의 하루 평균 입장객의 10분의 1 수준으로, 지스타를 운영하는 사무국에서는 관람 인원을 제한하기 위한 소량의 입장권만을 발부했고, 이에 따라 입장권을 차지하기 위한 경쟁이 치열하게 펼쳐졌다. 여기에 지난해 코로나19로 지스타 현장 전시가 이뤄지지 않은 탓에 올해 현장 전시에 대한 기대감이 커진 것도 영향을 미쳤다.가장 많은 관람객이 모이는 주말 입장권은 지난주 매진된 상태다. 입장권은 전량 온라인 판매가 이뤄져, 현장 판매는 없는 것으로 파악되고 있다. 중고거래 앱에서 초대권을 4만원에 구입했다는 한 관람객은 “이미 사전예약 티켓은 모두 동이 났고, 이렇게(웃돈거래)라도 하지 않으면 지스타에 올 수 없을 것 같아 불법인 것을 알면서도 중고로 초대권을 샀다”고 했다.지스타조직위원회 측은 “초대권은 참가사에 제공한 것이다”라며 “웃돈이 붙은 티켓 문제는 과거에도 있었는데, 사전 대응을 전부 다 할 수는 없고 사후 대응을 할 수 있도록 모니터링과 추적 시스템을 갖추고 있어 적발되면 곧바로 입장을 제한하고 있다”고 했다.지난 17일 개막한 지스타는 온라인 참가를 포함해 40개국 672개사가 1393개 부스를 운영하며 오는 21일 막을 내린다. 사회적 거리두기 4단계 수준의 방역 조치를 적용해 백신 접종 완료자와 PCR 검사 음성확인서를 보유한 사람만 행사장에 입장할 수 있다.",105,https://n.news.naver.com/mnews/article/366/0000775080?sid=103
"“혼자 고집 부리더니” 아이폰, 결국 범용 충전기로 바꾼다?",2021.11.20. 오후 8:45,"[123rf 제공][헤럴드경제=박혜림 기자] “그렇게 고집 부리더니… 애플, 결국 충전기 바꾼다?”애플이 내년에 출시할 아이폰14 프로 이상 모델에 아이폰 시리즈 최초로 ‘USB-C 케이블 포트’를 탑재할 가능성 제기됐다. 최근 미국의 한 경매 사이트에 올라온 세계 최초 USB-C 타입 아이폰X 모델이 1억원이 넘는 가격에 최종 낙찰되는 등 USB-C 아이폰 시리즈에 대한 관심이 적지 않은 가운데 애플 마니아들의 기대감이 커지고 있다.20일 업계에 따르면 애플은 내년에 출시할 아이폰14 프로 및 프로맥스 모델에 USB-C 케이블 포트를 적용하는 방안을 고려 중이다.애플은 지난 2012년 출시한 아이폰5부터 라이트닝 케이블이란 독자 충전 규격 단자 사용해오고 있다. 30핀 케이블 대체용으로 등장한 8핀 라이트닝 케이블은 기존 케이블 대비 크기를 대폭 줄여 주목받았다.하지만 애플 아이폰 독자 케이블인만큼 타 제품과의 호환이 불가능해 환경오염 등을 야기한다는 지적이 적지 않았다. 이에 대해 애플은 충전기를 단일화할 시 ▷다양한 혁신 시도가 저하될 것 ▷갑작스런 케이블 교체로 오히려 더 큰 환경오염을 낳을 것이라고 반박했다.



최근 1억원에 낙찰된 USB-C 케이블 포트를 적용한 세계 최초 아이폰X. [이베이 캡처]이런 가운데 유럽연합집행위원회(EC)가 최근 USB-C를 스마트폰 충전 케이블 표준 방식으로 정하는 것을 골자로 하는 법안을 제안했다. 내년 중 관련 법안을 확정한 뒤 1년 간의 유예 기간을 거쳐 2024년 본격 적용한다는 방침이다.업계에선 이러한 이유로 애플이 내년 출시할 아이폰 시리즈부터 순차적으로 USB-C 케이블을 적용할 것으로 보고 있다. 애플로선 유럽 시장을 포기할 수 없기 때문이다.이미 애플은 스마트폰을 제외한 아이패드, 노트북 등 다른 IT기기에 USB-C 케이블을 적용해오고 있다. 올해에도 신형 아이패드 미니를 출시하며 미니 시리즈 최초로 라이트닝 단자 대신 아이패드 프로와 같은 USB-C 케이블을 탑재했다.이외에도 USB-C 케이블의 충전 속도가 라이트닝 케이블 대비 더 빠른 점도 애플이 케이블 포트 전환을 고려하는 이유로 꼽힌다.한편 최근 온라인 경매 사이트엔 USB-C 케이블 포트를 지원하는 아이폰에 대한 시장의 니즈를 엿볼 수 있는 튜닝 아이폰이 등장하기도 했다. 스위스 로잔공과대 로봇공학 석사 과정을 밟고 있는 켄 필로넬이 개조한 아이폰X로 세계 최초의 USB-C케이블 포트 지원 모델이다. 최종 낙찰가가 8만 6001달러(약 1억 143억원)를 기록했다.",105,https://n.news.naver.com/mnews/article/016/0001915040?sid=103
"[퇴근길 날씨] 주말, 올가을 첫 추위…내일 아침 서울 5도",2023.10.20. 오후 5:27,"낮에도 바람이 서늘합니다. 북서쪽에서 찬 공기가 내려와  주말에 아침 기온이 뚝 떨어지겠습니다. 내일 아침 서울 5도까지 내려갈텐데요. 올가을 첫 추위가 예상됩니다. 따뜻한 옷 입으셔야겠습니다. 바람도 강하게 불겠습니다. 서해안과 제주는 강풍주의보도 내려졌습니다. 내일 오전까지 초속 20m 이상의 강한 돌풍이 예상됩니다. 찬바람에  체감온도는 더욱 낮겠습니다. 기온이 크게 떨어지면서  서리가 내리고  높은 산지에는 얼음이 어는 곳이 있겠습니다. 하늘은 맑게 드러납니다. 내일 아침 대전 5도, 전주 7도로 춥겠습니다. 한낮에 서울 16도, 대구 18도로 오늘과 비슷해 서늘하겠습니다. 바다의 물결은 먼바다에서 최고 4m로  거세게 일겠습니다. 주말까지 동해안은 높은 너울이 일겠습니다. 당분간 하늘은 맑게 드러납니다. 날씨 전해드렸습니다. 김규리 기상캐스터/그래픽:강채희■ 제보하기▷ 전화 : 02-781-1234, 4444▷ 이메일 : kbs1234@kbs.co.kr▷ 카카오톡 : 'KBS제보' 검색, 채널 추가▷ 네이버, 유튜브에서 KBS뉴스를 구독해주세요!",105,https://n.news.naver.com/mnews/article/056/0011586074?sid=103
"동남아 스마트폰 시장도 반도체 공급난 '유탄'…3분기 인도네시아 시장, 전년비 6% ↓",2021.11.19. 오후 3:04,"- 기존 예상과 달리 하락세 …코로나19 재유행 영향도  - 삼성전자, 전년동기 4위에서 이번 분기 2위 달성   [디지털데일리 백승은 기자] 전 세계 반도체 공급난이 동남아시아 스마트폰 시장에도 덮쳤다. 동남아시아 시장 중 가장 큰 인도네시아 역시 출하량이 전년동기대비 감소했다. 한편 삼성전자는 하반기 신제품 출시에 힘입어 점유율 2위에 올랐다.   18일(현지시간) 시장조사업체 카운터포인트리서치는 올해 3분기 인도네시아 스마트폰 시장 동향을 공개했다. 인도네시아 스마트폰 시장 출하량은 전년동기대비 6% 줄었다. 코로나19 재유행과 세계적으로 지속된 반도체 공급난이 부정적인 영향을 미쳤다.   기존 카운터포인트리서치는 3분기 동안 주요 4개 국가의 스마트폰 출하량이 20% 이상 증가할 거라고 전망했지만 예상은 빗나갈 가능성이 커졌다. 동남아시아 스마트폰 시장에서 가장 주요 4개국은 인도네시아·태국·필리핀·베트남이다. 이중 인도네시아가 가장 규모가 크다.   점유율 상위 5개 기업 중 삼성전자를 제외하고는 4개 모두 중국 스마트폰 제조사다. 1위는 오포로 올 3분기 점유율 22%를 차지했다. 전년동기 20%에서 2%포인트 올랐다.   2위는 삼성전자로 점유율 19%다. 전년동기 16%에서 3%포인트 상승했다.   인도네시아 시장은 ‘압도적 1위’ 없이 수시로 제조사 간 시장점유율 순위가 바뀌는 구조다. 삼성전자 역시 1년 사이에 순위 변동을 겪었다. 작년 3분기에는 5개 기업 중 4위였지만 이번 3분기 2위에 올랐다. 카운터포인트리서치는 삼성전자가 지난 8월 출시한 ‘갤럭시Z시리즈’가 인도네시아에서 좋은 반응을 얻으며 실적이 향상됐다고 분석했다.",105,https://n.news.naver.com/mnews/article/138/0002113885?sid=103
"라이엇 포지, 룬테라 세계관 활용 신작 게임 2종 출시",2021.11.20. 오전 11:27,"몰락한 왕: 리그오브레전드 이야기와 마법공학 아수라장 콘솔과 PC로 선보여라이엇게임즈의 퍼블리싱 레이블 라이엇포지가 지난 17일 ‘몰락한 왕: 리그오브레전드 이야기(몰락한 왕)’와 ‘마법공학 아수라장: 리그오브레전드 이야기(마법공학 아수라장) 등 2종의 신작 게임을 출시했다.라이엇포지는 몰락한 왕을 닌텐도스위치, 엑스박스 원, 플레이스테이션4와 더불어 스팀, GOG.com, 에픽게임즈 스토어를 통해 PC로 출시했다. 또한 플레이스테이션5와 엑스박스 시리즈 X 및 S로도 출시될 예정이다.마법공학 아수라장은 닌텐도 스위치와 더불어 스팀, GOG.com, 에픽게임즈 스토어를 통해 PC로 출시됐다. 조만간 넷플릭스 모바일 앱으로도 만나볼 수 있다.



두 게임 모두 리그오브레전드의 배경인 룬테라 세계관을 바탕으로 하는 게임이다. 룬테라 세계관은 다양한 스토리에 기반한 음악, 뮤직비디오, 시네마틱, 애니메이션 등 미디어 콘텐츠로 호평받기도 했다.라이엇포지는 경험과 역량이 풍부한 전 세계 개발사와 협력해 룬테라 세계관을 활용한 새로운 게임을 퍼블리싱한다. 라이엇 포지에서 처음으로 선보이는 몰락한 왕은 코믹 북 아티스트 조 매더레어라가 공동 설립한 에어십 신디케이트에서 개발했다. 마법공학 아수라장은 비트 트립 시리즈를 만든 초이스 프로비전에서 개발했다.라이엇포지의 턴제 RPG 몰락한 왕은 ‘빌지워터’와 ‘그림자 군도’ 지역을 배경으로 한다. 이용자는 여섯 명의 챔피언과 함께 팀을 이뤄 그림자 군도의 검은 안개로부터 빌지워터를 지키는 과정을 경험한다. 빌지워터와 그림자 군도에 얽힌 이야기는 앞서 공개한 바 없던 이야기로 룬테라 세계관 팬과 플레이어의 호기심을 자극한다. 몰락한 왕을 통해, 해당 지역의 새로운 스토리, 인물, 캐릭터를 만나볼 수 있다.이용자는 룬테라 세계관 속 높은 인기를 구사하고 있는 캐릭터인 미스포츈, 일라오이, 브라움, 파이크, 아리, 야스오와 팀을 이룬다. 게임을 플레이하며 여섯 명의 챔피언이 빌지워터로 모이게 된 계기를 알 수 있다. 또한 2020년 공개된 시네마틱 영상 ‘영혼의 꽃’의 뒷이야기 또한 몰락한 왕에서 확인할 수 있는 것도 특징이다.



마법공학 아수라장은 필트오버 지역을 배경으로 폭발학부 명예회장 직스와 필트오버의 뒷골목을 달리며, 리듬에 맞춰 장애물을 뛰어넘고 적을 피하며 박자에 맞춰 폭탄을 터뜨리는 게임이다.음악의 박자에 맞춰 게임을 플레이하면 ‘프리스타일 아수라장 시스템’이 작동한다. 그와 동시에 아름다운 폭발이 연달아 일어나며 필트오버를 불꽃으로 수놓는다. 화려한 비주얼, 그래픽, 그리고 효과가 환상의 3박자를 이뤄 길을 끈다.라이엇포지는 앞으로 선보일 게임을 통해 룬테라 세계관의 외연을 확장할 계획이다. 오는 2022년에는 데마시아 지역을 배경으로 한 게임 또한 출시될 예정이다. 이와 더불어, 룬테라 세계관 속 챔피언 개개인을 조망하는 풍부한 스토리가 계속해서 공개된다.",105,https://n.news.naver.com/mnews/article/092/0002239741?sid=103
