title,date,main,section,url
"네이버클라우드, P2P기업 온투법 인증 심사 10개사 지원",2021.11.19. 오전 11:43,"CSAP, MTCS 등 보안인증 다수 획득​​ 네이버클라우드(대표 박원기)가 P2P(온라인투자연계) 기업을 대상으로 한 온라인투자연계금융업법(이하 온투법) 심사 준비 지원을 통해 올해 총 10개 기업이 온투법 기업 인증을 완료했다고 19일 발표했다.



네이버클라우드 온투법 프로모션 10개 기업 온투법 심사 완료 [사진=네이버클라우드]금융당국은 P2P금융을 제도화하고 P2P금융 이용자를 보호하기 위해 작년 8월부터 P2P기업을 대상으로 보안 규정, 인프라 구성, 자기자본금 등의 심사 요건을 담은 온투법을 시행했다.이에 네이버클라우드는 지난해 말 자사 금융 클라우드 인프라 및 온투법 대응 경험을 바탕으로 '온투법 프로모션'을 시작했다.해당 프로모션은 온투법 프로그램 참여 확정 기업을 대상으로 네이버 클라우드 플랫폼 솔루션을 사용할 수 있는 500만원 상당의 크레딧 지급을 포함해 인프라 컨설팅 및 초기 구축 혜택, 온투법 대응 컨설팅 등이 포함됐다.이를 통해 올해 총 10개 기업(와이펀드, 비에프펀드, 레드로켓, 펀딩119, 리딩플러스, 오아시스펀딩, 론포인트, 브이펀딩, 프로핏, 에프엠펀딩)이 온투법 기업 인증을 완료했다.P2P 기업이 금융 분야 인프라 구축 시 CSP를 통한 퍼블릭 클라우드를 활용하면 프라이빗 인프라 대비, 초기 인프라 구축에 들어가는 비용을 절감하고 사업 역량 개발에 더욱 집중할 수 있다.또한 공공기관과 금융기관의 클라우드 서비스 제공에 필요한 클라우드 서비스 보안인증제(CSAP) 뿐만 아니라, 국내 최초로 싱가포르 클라우드 보안 인증인 MTCS를 획득하며 글로벌 클라우드 시장에서 경쟁력을 강화하고 있다이유강 와이펀드 대표는 ""와이펀드가 제도권 금융사로 자리매김함에 있어 네이버클라우드의 물적 보안설비가 큰 역할을 할 것으로 기대된다""면서, ""네이버클라우드의 금융 클라우드 인프라가 온투업 업계 전반의 신뢰성 제고에 큰 역할을 할 것으로 보인다""고 말했다.김현준 비에프펀드 전무는 ""온투업 등록 과정에서 전산 물적시설 설비 관련 자료 작성에 필요한 모든 인프라정보 제공 및 구축을 스피드있게 네이버클라우드가  지원해준 덕분에 성공적인 등록을 할 수 있었다""고 말했다.이화영 네이버클라우드 커머셜 세일즈 이사는 ""P2P 기업 및 전자금융업, 소액송금업 등 다양한 핀테크 기업들이 네이버클라우드 탄탄한 인프라를 바탕으로 비즈니스 역량을 적극 개발할 수 있도록 지원을 아끼지 않겠다""고 밝혔다.",105,https://n.news.naver.com/mnews/article/031/0000637519?sid=103
"게놈 지도, 가상 가구까지···‘이색 NFT’가 뜬다",2021.11.20. 오전 8:04,"[서울경제] 실적 발표에서 잠깐 언급만 나왔다 하면 주가를 들썩이는 화제의 주인공 ‘대체불가능한토큰(NFT)’이 게임, 예술 외 전분야로 확산하고 있다. 색다른 NFT들을 선보여 후끈 달아오른 대중들의 관심을 더욱 사로잡기 위한 행보다. 



이미지투데이21일 업계에 따르면 음성인식 솔루션 기업 ‘셀바스 AI’는 최근 메타버스랩을 신설해 메타버스와 NFT 사업에 대한 본격적인 연구개발에 착수했다. 또 NFT 거래 플랫폼 기업들과의 업무협력도 준비 중이다. 이 회사 관계자는 “게임, 영화, 스포츠, 가상 아이돌, 유명인 등 가상세계 속 다양한 콘텐츠에 적용 가능한 목소리 생성 및 목소리 재현 등의 음성 기술을 준비 중”이라며 “추후 인기 콘텐츠의 음성 자체를 NFT로 만드는 방안도 검토할 수 있겠다”고 말했다.블록체인 게임 ‘미르4’ 글로벌 흥행으로 연일 주가 상승세를 이어가고 있는 위메이드(112040)도 위믹스 NFT 옥션을 통해 뉴스 등 이색 NFT를 선보이고 있다. 위믹스 NFT 옥션은 한글날 MBC 아나운서들의 훈민정음 해례본 낭독 한정판을 판매한데 이어 오는 30일까지는 민영통신사 뉴시스의 포토뉴스를 NFT로 한정 판매한다.국내에서 NFT는 아직 디지털 아트 거래나, 게임 아이템에 국한해 생각하는 경우가 대다수다. 하지만 블록체인 주소 삽입만 가능하다면 형태를 가리지 않고 NFT로 만들 수 있다.이 때문에 블록체인 게임 ‘엑시인피니티’, ‘크립토키티’ 등으로 NFT가 비교적 일찍 대중화된 해외에선 이색 NFT 거래가 이미 활발히 이뤄지고 있다. 올해 4월에는 유명 과학자 조지 처치가 본인의 게놈을 NFT로 만들어 팔기도 했다. 조지 처치는 게놈 시퀀싱 방법을 세계 최초로 개발한 사람이다. 아르헨티나 디자이너 안드레 리지너는 메타버스에 배치할 수 있는 가상 가구 열 조각을 NFT로 만들어 팔았다. 이 중 가장 높은 가격에 낙찰된 가구는 7만 달러(한화 약 8,330만 원)에 팔렸다. 



Jammb 홈페이지 캡처이색 NFT들을 전문적으로 취급하는 거래소들도 생기고 있다. 요리 레시피 NFT 거래소 ‘Gourmet NFT’, 코미디언들의 개그를 NFT로 만들어 파는 ’Jambb’, 실제 존재하는 나무에 연동된 NFT를 파는 ‘NFTree’ 등이 대표적이다.",105,https://n.news.naver.com/mnews/article/011/0003987465?sid=103
테슬라 3.71% 급등해 다시 '천백슬라' 됐다,2021.11.20. 오전 8:41,"테슬라 일일 주가추이 - 야후 파이낸스 갈무리(서울=뉴스1) 박형기 기자 = 미국의 대표적인 전기차 업체인 테슬라의 주가가 3% 이상 급등하며 다시 '천백슬라'가 됐다.19일(현지시간) 테슬라의 주가는 전거래일보다 3.71% 급등한 1137.06 달러를 기록했다. 이로써 테슬라는 지난 일주일간 10% 정도 급등했다.테슬라가 이날 급등한 이유는 전세계 투자자들이 전기차에 대해 ‘묻지마 투자’를 하기 때문으로 보인다.사실 전일 미국의 소비자 전문매체 컨슈머리포트는 28개 자동차 브랜드를 대상으로 실시한 신뢰도 조사에서 렉서스가 1위, 테슬라는 27위를 기록했다고 발표했다. 또 JP모간이 주식 사기 혐의로 테슬라를 고발하는 등 테슬라는 악재가 많았다.그러나 전기차에 대한 묻지마 투자로 주가가 상승한 것으로 풀이된다.전문가들은 어차피 전기차가 대세이기 때문에 테슬라 주가가 향후 상승할 여력이 충분하다고 보고 있다. 한국에서 '돈나무 언니'로 불리는 캐시 우드 아크투자운용 대표는 투자전문 매체 배런스와 인터뷰에서 “5년 내 미국 자동차 시장의 20%~25%는 전기차가 차지할 것”이라며 “전기차가 대세”라고 말했다.",105,https://n.news.naver.com/mnews/article/421/0005736621?sid=103
"캡스텍, 디지털리얼티 '데이터센터' 시설관리 서비스",2021.11.19. 오후 7:18,"AI·데이터 분석 등 기술 활용SK쉴더스(대표 박진효)는 계열사 캡스텍이 서울 상암미디어시티에 위치한 디지털리얼티의 국내 첫 데이터센터 ‘ICN10’에 ICT 기반 종합 시설관리 서비스 제공 계약을 체결했다고 19일 밝혔다.캡스텍은 ICN10에 전문적인 데이터센터 관리 서비스와 하자 점검, 설계 단계부터 공사완료에 이르기까지 전 과정에 걸쳐 모든 시스템의 계획, 설계, 시공, 성능시험 등을 확인하고 운전성능 유지 여부를 검증하고 문서화하는 '커미셔닝' 등을 도입해 신축건물의 운영을 안정화한다. 데이터센터 공간을 임대해 고객 서버를 입주시키고 위탁 관리를 맡기는 '코로케이션' 서비스로 전산랙 망 운용 등도 제공한다.



센터 내 신기술을 집약한 ▲원격시설물 감시시스템 서비스 ▲데이터 분석 기반 데이터센터 운영 관리 ▲열화상 체온 측정, 스마트체크기 등 전문 방역 서비스 ▲사고를 사전 인지·대응할 수 있는 인공지능(AI) 카메라 등을 완비해 무장애·무사고 구현에도 힘쓴다.이외에도 비인가자의 통제구역 접근을 막는 솔루션 등 데이터센터의 안전을 위한 다양한 솔루션을 다각화할 계획이다.박세영 캡스텍 대표는 “데이터센터는 건물의 특성상 안정적 유지관리가 필수적인 만큼, 시설관리 서비스에 있어서도 높은 기술력과 신뢰도가 요구된다”며 “이번 디지털리얼티와의 계약을 계기로 캡스텍은 보안·방역 서비스 중심의 기존 비즈니스 구조에서 영역을 확장해 이번 데이터센터 사례를 비롯, 다양한 건축물에 종합 시설관리 서비스를 제공해 나갈 계획”이라고 밝혔다.",105,https://n.news.naver.com/mnews/article/092/0002239729?sid=103
밤하늘에서 관측된 부분월식,2021.11.19. 오후 9:36,(울산=연합뉴스) 김용태 기자 = 밤하늘에서 부분월식이 관측된 19일 오후 울산 상공에서 달이 지구 그림자에 가려졌다가 점차 제 모습을 찾고 있다. 왼쪽 위부터 부분월식 과정. 2021.11.19    yongtae@yna.co.kr,105,https://n.news.naver.com/mnews/article/001/0012887403?sid=103
"미국 10대 ‘인싸’들, 인스타그램보다 틱톡 더 많이 쓴다",2021.11.19. 오후 6:02,"Z세대 청소년 최다 이용 소셜미디어 앱은 ‘유튜브’



틱톡 로고.ⓒ틱톡[데일리안 = 김은경 기자] 올해 미국 10대 청소년들이 자국의 소셜미디어인 인스타그램보다 중국의 동영상 공유 플랫폼 틱톡(TikTok)을 더 많이 사용한다는 조사 결과가 나왔다.CNBC 방송은 18일(현지시간) 이날 시장조사업체 포레스터가 발표한 조사 결과를 인용해 올해 미국의 12~17세 청소년 63％가 매주 틱톡을 사용하는 것으로 나타났다고 보도했다.이는 같은 연령대 청소년의 인스타그램 이용률(57%)보다 높았다.지난해에는 미국 청소년들이 틱톡(50％)보다 인스타그램(61%)을 더 많이 사용한 것으로 조사됐는데 올해엔 틱톡의 인기가 인스타그램을 앞지른 것이다.최근 들어 틱톡이 젊은 층 사이에서 인기를 끌고 있는 반면 인스타그램은 고전을 면하지 못하고 있다.모회사인 메타(옛 페이스북)가 인스타그램이 10대 청소년과 어린 소녀들에게 유해한 영향을 미친다는 내부 연구 결과를 알면서도 별다른 조처를 하지 않았다는 내부 고발이 나오면서 상황이 더욱 악화되고 있다.한편 이번 조사에서 미국 Z세대 청소년들이 가장 많이 사용하는 소셜미디어 앱은 구글의 유튜브로, 청소년 72％가 매주 이를 사용하는 것으로 조사됐다.",105,https://n.news.naver.com/mnews/article/119/0002549800?sid=103
[DD's톡] 주가 상향 추세 탄 엠로··· 최근 10거래일간 주가 24.8%↑,2021.11.20. 오전 10:03,"[디지털데일리 이종현기자] 소프트웨어(SW) 기업 엠로의 주가가 지난 10거래일 동안 24.8% 상승했다. 전 산업의 디지털화가 진행되는 가운데 주력 제품인 공급망관리(SCM, Supply Chain Management) 솔루션을 중심으로 한 실적 상승에 따른 결과로 풀이된다.   엠로는 2021년 3분기 별도 기준 매출액 111억원, 영업이익 19억원을 기록했다. 1~3분기 누적 매출액 307억원, 영업이익 40억원으로 각각 전년동기대비 10.9%, 42.3% 증가했다.   연결 기준 매출액, 영업이익 상승폭은 3.4%, 7.8%에 그친다. 자회사였던 에이아이더, 레이컴의 지분 관계를 정리함에 따라 2개 기업의 실적이 빠진 영향이라는 것이 회사 측 설명이다.   엠로는 국내 구매 SCM 솔루션 분야서 점유율 1위를 달리고 있다. 삼성, LG, 포스코, 현대자동차 등 국내 대기업을 비롯해 서울의료원, 한국전력공사, 한국도로공사 등 공기업도 엠로의 고객사다.    매출 58%은 시스템 구축 및 용역에서 발생한다. 라이선스 15%, 기술지원 18%, 클라우드 사용료 7% 등으로 구성됐다.    이중 클라우드 사업은 가파르게 상승 중이다. 2019년 11억원, 2020년 15억원에 이어 올해 1~3분기 동안 20억원의 클라우드 매출을 달성했다. LG디스플레이, 하이브(구 빅히트 엔터테인먼트), 코웨이 등이 서비스형 소프트웨어(SaaS)인 ‘엠로 클라우드’를 도입한 것으로 전해진다.   최근 공을 들이고 있는 인공지능(AI) 기반 신사업에서도 성과를 보인 것으로 알려졌다. 엠로는 전자서명·계약 클라우드 서비스 ‘애니사인’을 비롯해 ‘품목 기준 정보 관리’, ‘비용 자동 분류’, ‘지능형 수요예측 등 AI 기반의 서비스를 내놓으며 사업을 확장하고 있다.   엠로의 3분기 분기보고서에 따르면 올해 4분기 및 내년까지 사업들을 수주한 상태다. 올해 수주한 금액은 총 418억원 규모로 이중 180억원만 납품됐다. 내년까지 238억원의 매출 발생이 예고된 상태다. 



8월 13일 상장 이후 엠로의 주가 차트  순조로운 실적 상승에 힘입어 기업 주가는 상승세를 탔다. 엠로는 11월 8일 시가 3만1800원에서 19일 종가 3만9700원으로, 10거래일 만에 24.8% 올랐다. 18일 장중 4만2000원으로 최고가를 달성한 뒤 19일 다소 하락했다.   엠로는 지난 8월 13일 코넥스에서 코스닥으로 이전 상장했다. 공모가는 2만2600원이다. 상장 이후 거래일 3개월여 만에 75.6%나 오른 상태다.    엠로 관계자는 “공급망관리 클라우드 서비스 확산과 AI 기반 디지털 혁신 SW의 성장이 큰 역할을 했다”며 “전체 매출에서 수익성이 좋은 기술 기반 매출이 차지하는 비율이 높아짐에 따라 영업이익률도 상승할 것이라 전망한다”고 말했다.",105,https://n.news.naver.com/mnews/article/138/0002113906?sid=103
"[날씨] 찬 공기 남하, 기온 뚝↓‥오전까지 남부·제주 비",2023.10.20. 오전 7:42,"[뉴스투데이]어제는 종일 우중충했는데요.오늘은 중부 지방이 차츰 맑은 하늘이 드러나겠습니다.다만 남부 지방은 약한 비가 지금도 이어지고 있습니다.오늘 오전까지 남부와 제주를 중심으로는 산발적인 비가 더 내리겠습니다. 비구름 뒤로 찬 공기가 내려오면서 기온이 급격하게 추워졌습니다.현재 서울의 기온이 10.5도, 대관령은 6.1도로 어제보다 3도에서 최고 8도가량 낮은 기온을 보이고 있고요. 주말인 내일 아침은 대관령이 영하2도, 서울은 5도로 올가을 들어 가장 춥겠습니다.또 찬 바람도 강하게 불면서 체감온도는 더 낮을 것으로 보입니다. 건강관리 잘해 주셔야겠습니다. 오늘은 중부 지방부터 차츰 맑아지겠고요. 서해안과 영동, 제주를 중심으로는 바람이 매우 강하게 불면서 강풍특보가 발효가 되겠습니다. 또 동해안 지역에서는 너울성 파도가 밀려오겠고요. 강원 내륙과 산지는 아침까지 도로 살얼음이 끼는 곳이 있겠습니다.현재 기온을 보시면 서울이 10.5도, 광주 11.6도, 대구 12.7도까지 떨어져 있고요. 낮 기온은 서울이 14도, 광주와 대구 17도로 어제보다 3도에서 최고 8도가량 낮겠습니다. 이번 주말에는 대체로 맑은 날씨가 이어질 것으로 보이고요. 때 이른 추위는 오래가지 않겠습니다.일요일 낮부터는 추위가 차츰 풀리면서 예년 기온 회복하겠습니다. 날씨였습니다.MBC 뉴스는 24시간 여러분의 제보를 기다립니다. ▷ 전화 02-784-4000▷ 이메일 mbcjebo@mbc.co.kr▷ 카카오톡 @mbc제보",105,https://n.news.naver.com/mnews/article/214/0001306462?sid=103
EUV가 뭐길래..미중 반도체 패권전쟁 격화에 유탄 맞은 SK하이닉스 [MK위클리반도체],2021.11.20. 오전 11:02,"[MK위클리반도체] 이주 국내 반도체 업계의 화두는 극자외선(EUV) 장비였습니다. 반도체 관련주에 투자 중이거나 관련 뉴스를 챙겨보고 있다면 한번씩은 들어본 용어일 텐데요. 미국의 반대로 SK하이닉스의 중국 공장에 EUV 장비를 반입하려는 계획이 무산될 것이라는 보도의 의미가 무엇일까요? 그리고 그 실현 가능성은 얼마나 될까요?먼저 EUV 장비를 독점 공급하고 있는 반도체 장비업체 ASML에 대해 알아보겠습니다. 마침 ASML의 피터 베닝크 회장이 지난 16일 한국을 방문하기도 했는데요. 네덜란드에 본사가 있는 ASML은 삼성전자와 SK하이닉스 등 국내 업체뿐 아니라 미국의 인텔, 대만의 TSMC 등 글로벌 반도체 제조업체들을 고객으로 두고 있습니다. 연간 40대가량의 EUV 장비를 생산하고 있지만 공급이 수요를 쫓아가지 못해 반도체 업체들 간 장비 확보 경쟁이 벌어지고 있는 상황입니다. 그래서 ASML은 반도체 업계의 '슈퍼 을'로도 불리고 있습니다. 최근에는 SK하이닉스와 마이크론, 난야 등의 업체들도 앞다투어 EUV 장비 확보에 나서면서 경쟁이 더욱 심해지는 상황입니다.대체 EUV 장비가 무엇이기에 내로라하는 글로벌 반도체 제조사들이 확보에 열을 올리는 것일까요. 반도체를 제조할 때 웨이퍼에 회로를 그려 넣는 과정을 '포토공정'이라 합니다. 더 미세하게 얇은 선폭의 회로를 그릴수록 반도체의 성능도 높아져 가장 중요한 공정 중 하나로 꼽히는 과정입니다. 반도체 공장이 멈추지 않고 24시간 가동되는 이유도 이러한 포토공정에 사용되는 장비를 멈췄다 재가동하면 렌즈 안정화에 많은 시간이 걸리고 재생산을 위한 검증 등에 막대한 비용이 발생하기 때문입니다.　이러한 포토 공정에 극자외선 파장의 광원을 사용할 수 있도록 하는 것이 EUV 장비입니다. 극자외선 파장의 광원은 기존 불화아르곤(ArF) 광원보다 파장의 길이가 10분의 1 미만으로 짧아 더 미세한 회로를 그릴 수 있습니다. 그래서 10㎚(나노미터·㎚는 10억분의 1m)급 미만 반도체를 생산하기 위해서는 EUV 노광장비가 필수적인 것이지요. 



ASML EUV 노광장비. /사진제공=ASML 자연스럽게 반도체 패권경쟁을 벌이고 있는 미국과 중국 사이에서도 이 EUV 장비가 민감한 주제로 떠올랐습니다. 이미 일찌감치 미국의 조 바이든 행정부는 이전부터 중국에 EUV 장비가 반입되는 것을 주시하겠다는 입장을 취하고 있었습니다. 반도체 업계에서는 언젠가는 EUV를 두고 양국의 긴장이 심해질 것이라는 우려가 나오고 있었는데요. 이러한 전망이 한 매체의 보도로 인해 다시 한 번 수면 위로 떠올랐습니다.로이터통신은 지난 18일 미국 백악관 관계자 등 복수의 소식통을 인용해 ""중국 장쑤성 우시의 SK하이닉스 D램 반도체 공장에 네덜란드 ASML이 독점 생산하는 EUV 노광장비 반입이 어려울 것""이라고 보도했습니다. 중국이 자국 군사력 증대를 목적으로 첨단 반도체 장비를 활용하려 하고 있고, 미국 정부는 이를 막기 위해 동맹국의 핵심 기술이 중국으로 흘러들어가는 것을 막고 있다는 것입니다.물론 아직 미국 정부가 이러한 입장을 명확하게 밝힌 것은 아닙니다. 그러나 로이터통신의 보도에 따르면 미 백악관 고위 당국자는 SK하이닉스의 EUV 장비 반입을 허용할 것인지 묻는 말에는 언급을 거부했다고 합니다. 또 다른 당국자는 조 바이든 행정부가 중국군 현대화에 쓰일 수 있는 최첨단 반도체 개발에 미국과 동맹국의 기술을 활용하는 것을 막는다는 입장에는 변함이 없다고 말했다는데요.이에 따라 미국과 중국 사이의 갈등으로 SK하이닉스만 피해를 볼 것이란 전망도 나왔습니다. SK하이닉스는 한국과 중국 양쪽에 D램 반도체 공장을 두고 있습니다. 그리고 지난 2월 ASML과 2025년까지 4조7500억원 규모(약 20대)의 EUV 장비를 들여오기로 계약한 상황인데요. 이미 SK하이닉스의 최첨단 공장인 경기도 이천의 M16에서는 해당 장비가 가동 중입니다. 중국으로의 EUV 장비 도입이 늦어진다면 중국 공장의 공정 개선이 지연될 수 있다는 우려가 나오는 이유입니다. 다만 이에 대해 SK하이닉스 측은 ""EUV 장비는 국내 도입도 아직 초기이며, 중국 우시 도입까지는 시간이 많이 남아 있다""면서 ""국제 규범을 준수하며 중국 우시 공장을 운영하는 데 문제없도록 노력하겠다""고 밝힌 상태입니다. 국내 공장에 비해 상대적으로 공정 수준이 낮은 중국 공장에 EUV 장비를 도입할 때까지는 시간적인 여유가 있어 당장 생산에 차질이 발생하지는 않을 것이란 입장입니다.그러나 반도체 업계에서는 미국의 이런 방식의 제재가 장기화하면 SK하이닉스가 중국 우시에 운영하고 있는 공장의 공정 개선에 큰 걸림돌로 작용할 것으로 보고 있습니다. 우시 공장은 SK하이닉스 D램 생산량의 30% 이상을 생산하고 있으며 이는 전 세계 D램 생산량의 10%를 넘어서는 양입니다. 반도체 공정은 그 특성상 끊임없이 첨단 장비와 공정을 적용해 제품을 개량하고 생산 효율을 높이는 것이 필수적인데요. 나노 단위 경쟁이 펼쳐지는 초미세공정에서는 투자 시기가 조금만 늦어져도 세계 경쟁력에서 크게 밀려날 수 있기 때문입니다. 결국 SK하이닉스 중국 우시 공장이 경쟁사인 삼성전자나 미국의 마이크론처럼 적기에 EUV 장비로 공정을 개선하지 않는다면 비용 절감과 생산 속도 개선이라는 목표를 달성할 수 없어 경쟁에서 뒤처질 수밖에 없다는 것입니다. 지난해 업계 최초로 D램 생산에 EUV 공정을 적용한 삼성전자는 최근 업계 최선단인 14나노미터 D램 양산에 돌입한 바 있습니다.다행히 중국 시안에 낸드플래시 공장을 운영하는 삼성전자의 사정은 다소 나은 편입니다. EUV 장비는 D램과 파운드리(반도체 위탁생산) 공정에 집중적으로 사용되고 있기 때문인데요. 다만 EUV 장비를 시작으로 반도체 장비 전반에 대해 미국 측 제재가 강화된다면 삼성전자 또한 공정 개선에 어려움을 겪을 수밖에 없다는 분석도 나옵니다.앞서 조 바이든 미국 행정부는 국가안보상 위협을 우려해 자국 주요 반도체 기업인 인텔의 중국 내 생산시설 확대에 제동을 걸기도 했습니다. 인텔은 반도체 공급 부족 사태를 해소하기 위해 최근 중국 청두 공장에서 핵심 재료인 실리콘 웨이퍼 생산을 늘리려고 했다가 정부의 반대로 계획을 철회했습니다.업계에서는 이번 사태가 SK하이닉스의 인텔 낸드사업부 인수에도 영향을 미칠지 촉각을 곤두세우는 분위기입니다. 인텔 낸드사업부 인수는 경쟁 당국의 기업결합 승인 심사 대상 8개국 가운데 중국의 승인만 남아 있는 상태인데요. 당초 연내에 승인이 예상됐지만 미국 측 행보에 불만을 품은 중국 정부가 애꿎은 하이닉스에 화풀이할 수 있다는 우려도 나오는 실정입니다.박재근 한양대 융합전자공학부 교수는 매일경제와의 통화에서 ""사실상 미국 정부가 중국 내에서 EUV 장비를 활용한 반도체 생산을 허락하지 않겠다는 뜻을 밝힌 것""이라며 ""미국 상무부에 삼성전자와 SK하이닉스 등 국내 업체들이 영업 비밀까지 제출한 상태에서 중국으로의 생산장비 반입까지 막는 것은 과도한 조치""라고 말했습니다. 이어 ""국내 반도체 업체들의 생존을 위해 이미 미국 내 반도체 부족 현상 완화를 위해 이들 업체들이 적극적으로 협력하고 있다는 것을 강조해야 할 필요가 있다""고 덧붙였습니다.",105,https://n.news.naver.com/mnews/article/009/0004881921?sid=103
