title,date,main,section,url
"마소, Xbox 게임 ‘장애인 접근성’ 높인다",2022.05.26. 오후 2:19,"수화 지원 트위치 채널 개설 등 프로젝트 공개



Xbox 운영사인 마이크로소프트(MS)가 장애인 게이머의 접근성 향상에 팔을 걷어붙였다.MS는 ‘세계 접근성 인식의 날’을 맞아 디지털 접근성 제고를 취지로 한 업데이트 내용을 26일 발표했다. 접근성 기능 태그(Accessibility Feature Tag) 업데이트, Xbox 미국 수화(ASL) 트위치 채널 개설, 접근성 테마의 마인크래프트 월드 론칭 등이 주된 내용이다.Xbox는 작년 가을 장애인 커뮤니티의 피드백을 받아 20가지의 접근성 기능 태그를 Xbox 스토어 내 게임에 추가한 바 있다. MS는 이번에 태그 종류별 필터링이 가능하도록 해당 기능을 업데이트해 이용자가 자신에게 맞는 게임을 더욱 쉽고 편리하게 검색할 수 있게 됐다고 설명했다. 현재 스토어에는 400개가 넘는 게임에 태그가 설정되어 있다.또한 ‘마인크래프트’에 접근성 테마의 새로운 월드 ‘빌더빌리티(BuildAbility)’를 론칭했다. 캐나다의 필 교육청과 협력 제작한 이 게임에서는 장애인이 사회에서 마주하는 장벽에 대한 소개와 함께 공감과 사회정서 학습 내용을 담고 있다.이 외에도 Xbox는 청력 장애를 가진 게이머들을 위해 매주 25시간 가량의 라이브 스트리밍에 대한 통역 서비스를 제공된다. MS측은 “Xbox의 접근성 지침 역시 이번에 개정되었으며, 장애인 커뮤니티와 개발자의 피드백을 바탕으로 멀미, 온스크린 텍스트 판독성, 대비 및 인풋 가이드라인은 물론 정신 건강 관련 가이드라인이 새롭게 업데이트됐다”고 밝혔다.",105,https://n.news.naver.com/mnews/article/005/0001528835?sid=103
"이글루코퍼레이션 SOAR, GS인증 1등급 획득",2022.05.26. 오후 4:42,"이글루코퍼레이션은 보안 오케스트레이션·자동화·대응(SOAR) 솔루션인 '스파이더 쏘아'가 한국정보통신기술협회(TTA)의 굿소프트웨어(GS) 인증 1등급을 획득했다고 26일 밝혔다.GS 인증은 소프트웨어의 기능, 성능, 사용 편의성, 신뢰성 등을 인증하는 제도다.



이글루코퍼레이션 스파이더 쏘아가 GS 인증 1등급을 획득했다.스파이더 쏘아는 보안 위협 유형별 대응 방안을 매뉴얼화한 플레이북에 기반한다. 국내 보안관제센터에서 운영 중인 이기종 보안 솔루션과 연동해, 자동화된 침해 대응 프로세스를 구현할 수 있다.이득춘 이글루코퍼레이션 대표는 ""디지털 전환에 가속도가 붙으면서, 보안 위협 탐지에서 대응에 이르는 과정을 실질적으로 단축시키기 위한 SOAR의 중요성은 더 높아질 전망이다. 뛰어난 기술성과 효율성을 검증받은 스파이더 쏘아 도입을 통해, 보안관제의 효율성을 극대화하였으면 한다""라고 밝혔다.",105,https://n.news.naver.com/mnews/article/092/0002258016?sid=103
"""졸업하면 현대차 모빌리티 인재로 채용""… 고려대-현대차, 계약학과 개설",2022.05.26. 오후 4:00,"[디지털데일리 변재영 기자] 현대자동차가 고려대학교와 함께 수소, 로보틱스 등 미래 모빌리티 산업을 선도할 핵심 인재 양성을 위해 국내 최초로 채용조건형 학·석사 통합 과정의 계약학과를 설립한다고 26일 밝혔다.   계약학과는 ‘산업교육진흥 및 산학협력촉진에 관한 법률(산학협력법)’ 제8조에 근거해 산업체의 요구에 따라 맞춤형 직업 교육 체계를 대학의 교육과정에 도입한 제도를 의미한다. 이는 창의적 융합 역량을 갖춘 세계적 수준의 공학 리더를 양성함으로써 미래 모빌리티 산업을 둘러싼 글로벌 기술 패권 경쟁에서 우위를 선점하기 위한 차원이다.   국내 최초 채용조건형 학·석사 통합 과정으로 운영될 예정인 스마트모빌리티 학부는 현대차 미래 모빌리티 사업의 핵심인 수소, 로보틱스 2개 분야의 특화 인재 육성에 중점을 둔다.   입학생들은 학사, 석사과정 수업 연한을 각각 1학기씩 단축해 5년 만에(학사 3.5년+석사 1.5년) 석사학위까지 취득할 수 있다. 또한 2023년도 첫 입학생을 시작으로 향후 5년 동안 매년 50명의 우수 인재를 선발한다.   스마트ㅍ모빌리티 학부는 현대차 맞춤형 교수 및 학습 시스템을 적용한 수요자 중심의 특성화 교육 과정으로 운영된다.   커리큘럼은 졸업 후 별도의 직무 연수 없이도 일선 연구개발 현장에 즉시 투입이 가능한 실무형 인재 육성을 목표로 현대차와 고려대가 공동 개발했으며, 현대차 소속 현업 연구원이 겸임교수로 참여해 현업 밀착형 강의로 진행된다.   또한 해당 직무 관련 전문적 기술 역량은 물론 창의적 종합 사고 역량을 갖춘 차세대 공학 리더로 성장할 수 있도록 인문 사회 및 기술·소통 등 기초역량, 수소·로봇·소프트웨어 등 전공역량 함양에 중점을 두고, 유연하고 다양한 학기제와 온·오프라인 강의 및 모듈형 과목이 개설·운영될 예정이다.   특히 화학공학, 기계공학, 전기전자, 컴퓨터와 같은 공학 계열뿐만 아니라 인문학, 심리학, 경영학 등 소양 교육을 접목한 학제적 융합 교육 프로그램도 계획하고 있다.   입학생에게는 학업 성취도 제고를 위한 다양한 혜택도 제공된다. 통합 과정 5년 동안 전액 장학금을 지원받게 되며 산학과제 참여, 학회 발표, 해외연구소 견학, 현업멘토링 등의 기회도 주어진다.",105,https://n.news.naver.com/mnews/article/138/0002125478?sid=103
"카카오모빌리티, 이용자 중심 경영 선포…전담 조직 신설",2022.05.26. 오전 9:15,"""지속가능한 서비스 시스템으로 이용자 권익 보호 나선다""카카오모빌리티가 환경·사회·지배구조(ESG) 경영 강화에 나선다.



카카오모빌리티가 이용자 중심 경영을 선포했다. 사진은 이용자 중심 경영 선포식 전경.  [사진=카카오모빌리티]26일 카카오모빌리티는 이용자 권익 인식 제고 및 서비스 경쟁력 강화를 위해 '이용자 중심 경영' 선포식을 개최했다고 발표했다.이번 선포식은 CEO 직속 전담조직 신설과 최고고객책임자(CCO) 임명 등을 알리고, 카카오모빌리티의 이용자 중심 경영에 대한 의지를 표명하기 위해 마련됐다. 선포식을 기점으로 카카오모빌리티는 카카오 T, 카카오내비, 카카오 T 픽커 등 플랫폼 생태계 내 모든 이용자들을 중심으로 전체 서비스를 개편해 이용자 권익 보호에 앞장설 계획이다.우선 카카오모빌리티는 이용자 중심 경영 헌장을 발표하고, 임직원들이 해당 헌장을 준수할 수 있도록 전직원 대상으로 관련 교육을 진행한다.또한 ▲이용자 권익 보호 ▲ESG 경영을 위한 사회적 책임 강화 ▲서비스 이용 정보의 명확성과 투명성 제고 ▲적극적인 이용자 의견 수렴 ▲분쟁에 대한 공정하고 신속한 처리 등을 목표로 한 세부 액션 플랜을 마련해 나간다.이를 위해 활동의 독립성 보장을 위한 CEO 산하 직속 기구인 '이용자 보호 전담 조직'을 설치하고, 카카오모빌리티의 첫번째 CCO로 현 CEM실 이수연 상무를 임명했다. 신임 이수연 CCO는 지난 5년 간 카카오모빌리티의 고객경험관리 전담조직인 CEM실을 총괄해왔으며, 주요 IT 기업에서 약 20년 이상 고객 경험 관리 업무를 두루 경험해왔다.새롭게 신설된 '이용자 보호 전담 조직'은 고객경험관리 뿐만 아니라 개인정보보호, 플랫폼 서비스 기획, 파트너성장지원 등 각 직무별 전문가들로 구성해 운영된다.해당 조직은 이용자 중심의 서비스 영역 재구성, 관련 법규 준수 기반 마련을 위한 이용자 권익 보호 절차 수립, 이용자 상담 시스템 고도화 통한 플랫폼 내 실질적인 이용자 보호 프로세스 구축 등의 업무를 수행한다.먼저, 모빌리티 플랫폼 공급자들을 위한 방안으로 ▲최신 콜센터 운영시스템(IPCC)을 도입하고 ▲중형 일반∙가맹∙대형∙고급택시 등 유형별 특성을 고려해 각 서비스별 기사에게 특화된 맞춤 상담 센터를 구축할 예정이다. 이용자와의 소통 편의성 강화를 위해서는 ▲챗봇 기능 고도화 통한 신속 상담 시스템 개편도 올해 안에 선보인다는 계획이다.카카오모빌리티는 그동안 플랫폼 생태계 내 이해관계자들을 위해 택시 서비스 모니터링 시스템 도입, 112 자동신고 기능 제공, 사고 피해 발생시 법률 및 심리 상담 채널 운영 등 이용자∙공급자 모두를 위한 서비스 품질 개선 노력을 지속해 왔다.또한, 올해 초에는 CEO 직속의 ‘모빌리티 투명성 위원회’ 및 ‘상생 자문 위원회’를 구축해 플랫폼에 대한 투명성을 진단받고 지난 3월에는 국내 최고 수준의 개인정보 관리체계 인증인 ISMS-P 를 획득해 이용자들의 개인정보 보호 및 관리 역량을 입증하기도 했다.류긍선 카카오모빌리티 대표는 ""카카오모빌리티는 이번 선포식에서 발표한 이용자 중심 경영 헌장의 정신을 기반으로 플랫폼 생태계 내 이용자들의 니즈에 집중해 서비스 전반을 검토하고 개편해 나가고자 한다""라며 ""앞으로도 이용자 권익 보호를 최우선 가치로 두고 ESG 경영 방안을 강화해 실천해 나가는데 앞장서겠다""고 말했다.",105,https://n.news.naver.com/mnews/article/031/0000674870?sid=103
"델 테크놀로지스, 하이브리드 업무 환경 지원 비즈니스노트북·워크스테이션 출시",2022.05.26. 오후 3:14,"델 래티튜드 9330델 테크놀로지스는 비즈니스용 노트북 '델 래티튜드 9330'과 워크스테이션 '델 프리시전' 7000 시리즈 신제품을 26일 공개했다.델 래티튜드 9330은 '협업 터치패드' 기능을 최초 탑재한 13.3인치형 노트북이다. 사용자는 줌 미팅시 터치패드로 마이크 음소거, 비디오 온·오프, 화면 공유와 채팅 기능 등에 빠르게 접근할 수 있다. 회의가 끝나면 협업 아이콘이 사라지고 전체 트랙패드가 복원된다.16:10 화면비의 인피니티 엣지디스플레이를 적용해 래티튜드 제품군 중 가장 얇은 노트북이다. 12세대 인텔 코어 프로세서를 장착해 인텔 와이파이 6E, 4G LTE 또는 5G 포함 최신 연결 옵션을 지원한다.친환경 노트북으로 키보드와 키 캡에 각각 44%, 75% 재활용 소재를 사용했다. 해양으로 유입된 플라스틱을 재활용해 만든 팬 하우징도 탑재했다. 6월 하순 국내 출시 예정이다.델 프리시전 워크스테이션 출시 25주년 기념, 모바일 워크스테이션 신제품 2종도 선보였다. 델 프리시전 7670은 델이 모바일 워크스테이션 제품군에서 처음 발표한 16인치형 폼 팩터다. 제품은 프로세서와 그래픽 부품, 확장 메모리, 터치 패널을 지원하는 새로운 유기발광다이오드(OLED) UHD플러스 스크린 등의 화면 옵션, 스토리지 옵션 등을 자유롭게 선택해 커스터마이징할 수 있다. 델 프리시전 7770은 델 워크스테이션 데스크톱 PC와 동일한 성능을 제공하는 17인치형 모바일 워크스테이션이다.두 제품은 인텔 브이프로 기술이 적용된 12세대 인텔 코어 i9 프로세서를 선택할 수 있다. 최대 16GB 엔비디아 RTX A5500 그래픽스와 128GB급 DDR5 메모리가 장착됐다. 새 프리시전 모델은 DDR5 메모리를 기반으로 특허 받은 델의 새로운 CAMM 모듈이 적용된 첫 워크스테이션이다. CAMM은 초슬림 노트북용 메모리 모듈로 동일 용량의 SO-DIMM보다 두께를 57% 줄일 수 있다.신제품 라인업 모두 인공지능(AI) 최적화 SW '델 옵티마이저'를 탑재했다. 물리적으로 웹캠을 차단하는 '세이프 셔터'를 장착해 누군가 스크린을 엿보는 경우, 사용자 민감 정보를 자동으로 숨긴다. 사용자가 화면에서 눈을 떼면 화면이 자동으로 어두워져 전력 사용을 줄이고 데이터를 안전하게 보호한다.김경진 한국 델 테크놀로지스 총괄사장은 “장소에 상관없이 업무를 수행해야 하는 오늘날 하이브리드 업무 환경을 위해 더 얇고 컴팩트한 바디에 강력한 성능과 지능적인 소프트웨어, 향상된 보안 기능까지 겸비한 디바이스를 선보이고 있다”고 말했다.",105,https://n.news.naver.com/mnews/article/030/0003019566?sid=103
논란 많던 복지부 장관에 김승희 전 의원 내정되자…의약단체 반응 엇갈려,2022.05.26. 오후 5:33,"식약처장·복지위 소속 의원 활동 경력은 무난하다는 중론약사단체 ""조제약 배송 등 정책 추진에 유리한 기조 펼치길"" 기대감정호영 전 후보자 지지하던 의료계, '약사' 출신 내정에 불편감[서울경제] 



김승희 보건복지부 장관 내정자. 사진 제공=대통령실 제공정호영 후보자 사퇴로 공석이 된 보건복지부 장관에 김승희(69) 전 국회의원이 26일 지명되자 의약단체의 반응은 엇갈렸다. 김 내정자는 서울대학교 약학대학을 졸업하고 동대학원에서 약학(약리학) 석사 학위를 받은 뒤 미국 노트르담대학에서 화학(생화학) 박사 학위를 받은 인물이다. 식품의약품안전평가원장과 식품의약품안전처장을 차례로 역임하고 20대 국회에서 국민의힘 비례대표 의원으로 활동했다. 국회 보건복지위원회 소속으로 활동하며 코로나19 특별위원회 간사 등을 역임한 이력도 갖췄다. 이날 발표에 의약계 모두 '의외의 인사'라는 공통된 반응을 나타냈다. 약사 또는 약학 연구자 출신들은 복지부 장관보다는 식약처장 쪽으로 빠지는 경우가 많았기 때문이다. 최근 조제약 배송 입법화에 결사 반대하고 있는 약사단체에서는 '약사' 출신 후보자 내정을 내심 환영하는 분위기다. 서울대약대 출신인 오유경 식품의약품안전처장과 함께 약업계에 유리한 정책을 펼치는 데 힘을 보탤 것이란 기대감도 묻어난다. 대한약사회 관계자는 이날 서울경제와의 통화에서 ""인준 전이라 공식 입장을 밝힐 단계는 아니다""라면서도 ""약사사회에 대한 이해도가 높은 인사가 복지부와 식약처 수장으로 임명되는 데 대해서는 환영할 만 하다""고 말했다. 또다른 약사회 관계자는 ""조제약 배송 입법화와 더불어 규제 샌드박스를 통해 화상투약기를 도입하려는 논의가 이뤄지는 민감한 시기인 만큼 주무부처인 복지부 인사에 관심이 높은 상황""이라며 ""의약품 안전성 측면에 관한 목소리를 낼 가능성이 커진 것으로 보인다""고 전했다. 반면 의료계 내부에서는 표정이 썩 밝지 않다. 정호영 전 후보자 지명 이후 '아빠 찬스' 등 논란이 컸기에 인사청문회를 통과하기에 무난한 인사를 골랐다는 중론이지만 드물게 약사 출신 복지부 장관 후보자를 내정한 점은 의아하다는 반응이다. 특히 대구·경북의사회를 필두로 서울, 대전, 충북, 충남, 제주 등 지역 의사회들이 대거 정호영 전 후보자 지지 성명서를 냈던 터라 쓸쓸하다는 반응도 나온다. 한 의료계 관계자는 ""오랜 공직생활을 거쳤다고는 하나 (식약처장 재직 당시) 일을 잘 했던 기억은 없다""며 ""코로나19 사태 직후 책임이 막중한 시기에 식약처장으로서 무능하고 무책임하다고 평가받았던 약사 출신 인사를 구태여 복지부 장관 내정한 이유를 알 수 없다""고 말했다. 과거 의료인 출신으로 복지부 장관에 임명되는 경우는 대부분 의사 또는 간호사 출신이었다. 약사 출신 복지부 장관을 지낸 인사로는 노태우 정부 시절 김정수(83) 25대 보건사회부 장관이 유일하다. 부산대학교 약학대학을 졸업하고 부산에서 개국약사로 근무하던 김 전 장관은 1981년 제 11대 국회의원(부산 3선거구·민권당)으로 정계에 발을 들인 뒤 장관직에 올랐다. 김 후보자가 임명되면 식약처장 출신 첫 복지부 장관인 동시에 약사 출신 두 번째 복지부 장관이 된다. 대한의사협회 관계자는 ""복지부 장관은 특정 직역을 대변하기 보단 정부의 방향성에 따라 정책을 펴는 자리이기 때문에 공식 입장을 밝히질 않을 생각""이라며 ""의료 대응 역량이 중요한 시기인 만큼 현장전문가들의 의견을 잘 반영하는 정책이 펼쳐지길 기대한다""고 말했다.",105,https://n.news.naver.com/mnews/article/011/0004058594?sid=103
제21회 아마추어무선 방향탐지(KARDF) 전국대회 개최,2022.05.26. 오후 12:01,"전파방향탐지로 ‘숨은 여우를 찾아라’과학기술정보통신부 중앙전파관리소(소장 이상훈)와 (사)한국아마추어무선연맹(이사장 홍순도)은 제21회 아마추어무선 방향탐지(KARD) 전국대회를 오는 6월 11일 북내체육공원에서 개최한다고 26일 발표했다.



과기정통부 현판 [사진=과기정통부]아마추어무선 방향탐지(KARDF) 전국대회는 국내 아마추어 무선통신의 기술향상, 대중화 및 건전한 전파이용 활성화를 위해 2000년부터 매년 개최하고 있으며 올해로 21회째를 맞는다.대회 경기는 정해진 지역 내에 무선 송신기를 숨겨놓고, 수신기·나침반·경기용 지도를 이용하여 발신 전파의 방향을 탐지, 무선 송신기가 숨겨진 장소를 찾아가는 방식으로 진행되며 개인전과 단체전으로 구성된다.경기에 필요한 수신장치(대여가능), 나침반, 필기도구는 개인별로 준비하여야 하고, 경기용 지도는 연맹 측에서 제공한다. 참가희망자는 6월 3일까지다. 한국아마추어무선연맹 사무국에 문의·신청하면 된다.",105,https://n.news.naver.com/mnews/article/031/0000674970?sid=103
반도체 패키징 소재도 공급 부족…가격 인상 지속,2022.05.26. 오후 2:50,"[디지털데일리 정혜원 기자] 반도체 집적회로(IC) 포장재 수요가 지속 증가할 것으로 관측된다.    25일(현지시간) 대만 IT전문매체 디지타임스는 업계 관계자의 말을 인용해 자동차와 산업용 애플리케이션이 늘어나면서 리드프레임 등 IC 패키징 수요가 증가했다고 보도했다.    마이크로컨트롤러유닛(MCU)을 비롯한 자동차용 반도체와 전원 모듈 등의 수요가 증가하면서 여기에 쓰이는 납프레임에 대한 수요도 증가했다. 산업용 전원모듈과 절연게이트 양극성 트랜지스터(IGBT) 등은 공급이 부족한 것으로 알려졌다.   자동차 반도체에 가장 많이 사용되는 쿼드플랫패키지(QFP)의 경우 가전에 쓰이는 플랫노리드(QFN) 가격을 웃도는 수준으로 가격이 오른 상태다. QFN과 aQFN(advanced QFN)은 네트워킹 기기에 사용되는데 안정적 수요를 유지하고 있다. QFP와 QFN 모두 리드프레임에 속한다. 리드프레임은 반도체 칩과 외부 회로를 연결시켜 주는 전선이자 버팀대 역할을 하는 반도체 패키징 재료를 말한다.   이 때문에 여러 종합반도체회사(IDM)과 반도체 후공정 처리업체(OSAT)들은 자동차용과 산업용 반도체에 더 큰 비중을 두는 대신 가전제품 비중을 줄이는 방향으로 시장 전략을 수정하고 있다.    일례로 인피니온과 ST마이크로일렉트로닉스, 온세미, 로옴을 포함한 전력 반도체 공급업체들이 모듈러 제품 생산을 늘리고 있어 이에 맞는 맞춤형 리드프레임 수요가 증가하고 있다.   이에 대만에 본사를 둔 리드프레임 제조업체인 SDI와 지린테크놀로지는 올해 매출의 40% 이상이 자동차용 제품에서 발생할 것으로 보고 있다.   또 다른 리드프레임 주요 공급업체인 CWTC는 1분기 매출 가운데 자동차 애플리케이션과 산업 제어 장치에서 발생한 매출이 각각 35%, 18%를 차지한다고 밝혔다.   다만 코로나19의 확산으로 상하이가 봉쇄된 이후 여전히 많은 기업들이 영향을 받고 있다.    ASE 그룹의 계열사인 SPIL(Siliconware Precision Industries)은 생산에 필요한 많은 재료들이 인근 상하이 세관에 묶여 있다고 언급했다. 이들은 문제를 완화할 대안을 모색하고 있지만 생산 일정이 늦춰졌다고 인정했다.   CWTC의 황치앙 회장은 중국의 봉쇄정책이 자재 물류의 불확실성을 크게 높였다고 지적했다. 이에 따라 CWTC는 최근 인플레이션과 물류 비용 상등 등을 반영해 2분기 안에 공급가격을 올릴 계획이다.   그럼에도 황치앙 회장은 자동차 전동화와 와이파이6, 3세대 반도체, 미니발광다이오드(LED) 등의 성장세를 고려하면 납프레임과 에폭시수지, 기판 등 포장재에 대한 수요는 앞으로 회복될 것이라고 봤다.   이에 CWTC는 2025년까지 리드프레임의 한 종류인 플랫노리드(QFN)를 해마다 1억3000만프레임 생산한다는 목표를 세웠다. 신규 공장을 오는 3분기에 착공하고 4분기에는 도장 생산라인을 늘린다.",105,https://n.news.naver.com/mnews/article/138/0002125461?sid=103
"U+모바일tv, 2022 지방선거 맞춤 콘텐츠 선보인다",2022.05.26. 오전 10:08,"[디지털데일리 권하영 기자] LG유플러스(대표 황현식)는 오는 6월1일 전국 지방선거를 앞두고 모바일 영상 플랫폼인 U+모바일tv에서 지역 밀착형 선거 방송을 중계한다고 26일 밝혔다.   이번 방송을 위해 LG유플러스는 지역 기반 미디어 서비스를 제공하는 LG헬로비전의 콘텐츠를 수급했다. U+모바일tv 이용 고객이라면 누구나 LG헬로비전이 제작한 지역별 선거 방송과 개표 방송을 모바일로 편하게 시청할 수 있다.   고객은 U+모바일tv에 접속해 새롭게 추가된 ‘지방선거’ 카테고리를 선택한 뒤, LG헬로비전이 제작한 선거 방송 콘텐츠를 시청할 수 있다.    U+모바일tv가 제공하는 지역 밀착형 선거 콘텐츠는 ▲앵커와 각 지역 후보자 대담을 통해 공약을 보다 상세하게 소개하는 ‘선거레이더’ ▲각 지역별 선거구와 경쟁 구도 등을 분석하는 ‘기획 리포트’ 등이다.   LG유플러스는 지역별 8개 채널의 선거 개표 방송도 실시간으로 제공한다. U+모바일tv 이용 고객은 선거 당일 실시간 채널 메뉴에서 수도권, 부산, 강원, 대구·경북, 경남, 전남, 전북, 충남 등 지역을 선택한 뒤 원하는 지역의 개표 방송을 실시간 스트리밍으로 시청할 수 있다. 실시간 개표 방송은 개표 종료 시까지 제공된다.",105,https://n.news.naver.com/mnews/article/138/0002125426?sid=103
