title,date,main,section,url
"맥 못추는 삼성폰, 매출액 1위 애플과 격차 더 커져",2023.01.06. 오후 3:40,"2022년 3분기 판매액 기준 18.3% 점유...애플과 격차 18.6%p→23.7%p삼성전자가 전 세계 프리미엄 폰 시장에서는 애플의 벽을 넘지 못하고 있다.글로벌 시장조사업체 카운터포인트리서치는 6일 지난해 3분기 전 세계 스마트폰 시장 매출액 기준 점유율을 발표했다.



전 세계 스마트폰 시장 매출액 기준 점유율 (사진=카운터포인트리서치)조사 결과에 따르면 애플은 42% 점유율을 차지하며 1위를 차지했다. 삼성전자는 18.3%로 2위를 유지했다. 전년 동기 대비 애플은 4.9%p 증가했지만, 삼성은 0.2%p 줄었다.양사의 매출액 기준 점유율 격차는 2021년 3분기 18.6%p에서 23.7%p로 더 커졌다.하밋 싱 왈리아 시니어 애널리스트는 ""애플은 2022년 3분기에 전년 동기 대비 10% 매출액이 증가했고, 평균판매가격(ASP)도 7% 증가하면서 전 세계 스마트폰 시장의 평균판매가격(ASP)를 끌어 올렸다""며 ""이는 아이폰 14시리즈 및 프로 모델 또 이전 시리즈의 판매호조로 인한 것으로 보인다""고 분석했다.앞서 시장조사업체 트렌드포스는 지난해 3분기 출하량 기준으로 전 세계 스마트폰 시장 점유율을 발표했다. 조사 겨로가 삼성전자가 22.2%로 1위, 애플이 17.6%로 2위였다.출하량과 판매액 점유율이 다른것은 삼성전자가 애플보다 더 많은 스마트폰을 판매하고 있지만 중저가 스마트폰 판매 비중이 높기 때문이다. 출고가가 높은 프리미엄 폰 시장에서는 삼성전자가 애플에 밀리고 있는 셈이다.스마트폰 업계 등에 다르면 지난해 전 세계 스마트폰 시장에서 가장 많이 출하된 모델은 갤럭시A12였다. 출하량 상위권 10개 모델 중 삼성전자의 기종은 갤럭시A12와 갤럭시 A02(1830만대)에 그쳤다.",105,https://n.news.naver.com/mnews/article/092/0002278921?sid=103
CES K-스타트업관 찾은 이영 장관,2023.01.07. 오후 1:00,[서울=뉴시스] 김선웅 기자 = 이영 중소벤처기업부 장관이 6일(현지시간) 미국 라스베이거스에서 열린 CES 2023에서 K-스타트업관 참여기업들을 방문해 격려하고있다. (사진=중소벤처기업부 제공) 2023.01.07. photo@newsis.com *재판매 및 DB 금지[사진 영상 제보받습니다] 공감언론 뉴시스가 독자 여러분의 소중한 제보를 기다립니다. 뉴스 가치나 화제성이 있다고 판단되는 사진 또는 영상을 뉴시스 사진영상부(n-photo@newsis.com)로 보내주시면 적극 반영하겠습니다.,105,https://n.news.naver.com/mnews/article/003/0011631304?sid=103
"이스트소프트 ""AI 기술 필요한 기업 모이세요""",2023.01.06. 오전 9:30,"기사내용 요약'2023년 AI 바우처 지원사업' 공급기업 선정버추얼 휴먼, 가상 피팅 등 AI 솔루션 수요 기업 모집



이스트소프트 AI 바우처 지원사업 공고 이미지 *재판매 및 DB 금지【서울=뉴시스】송혜리 기자 = 이스트소프트는 정보통신산업진흥원(NIPA)이 주관하는 '인공지능(AI) 바우처 지원사업'에 공급기업으로 선정돼, AI 솔루션을 필요로 하는 수요기업을 모집한다고 6일 밝혔다. 'AI 바우처 지원사업'은 AI 기술이 필요한 수요처를 대상으로 AI 솔루션을 구매·활용할 수 있는 바우처를 지원함으로써 AI 기업 육성 및 산업 디지털 전환 촉진을 위해 마련됐다.이스트소프트는 2020년부터 시작된 AI 바우처 지원사업에 공급기업으로 선정돼 활동해 왔으며, 지난해에는 실질적인 사업적 성과를 거둬 우수기업으로 선정되기도 했다. 올해에는 최대 3억원 규모 AI 솔루션을 수요기업에게 제공할 예정이다. AI 기술을 활용한 버추얼 휴먼을 중심으로 가상 피팅, 이미지 검색 및 추천 등 자사에서 상용화한 다양한 AI 솔루션을 제공한다. 대상 기업은 국내 중소·중견 기업에 한하며, 오는 30일 15시까지 이스트소프트에 문의 및 상담 후 접수할 수 있다. 정상원 이스트소프트 대표는 ""산업 현장에서 검증된 이스트소프트의 AI 솔루션은 이미 다양한 분야에서 성공적으로 서비스되고 있다""며 ""더 많은 국내 중소·중견 기업이 AI 도입으로 사업 성과를 높일 수 있도록 이번 AI 바우처 지원사업을 통해 적극적으로 지원하겠다""고 전했다.",105,https://n.news.naver.com/mnews/article/003/0011629798?sid=103
8개만 먹어도 하루 비타민C 충분… 우리가 몰랐던 ‘이것’의 효능,2023.01.07. 오후 8:09,"ⓒ게티이미지뱅크달콤하고 향긋한 딸기가 1월 제철을 맞았다. 기온이 낮아지면 당도가 높아지는 딸기는 겨울이 연중 맛이 가장 좋을 때다. 영양학적으로도 뛰어나다. 80~90%가 수분으로 이뤄진 딸기는 단백질과 칼슘, 철 등이 고루 들어있다. 특히 비타민C가 풍부하다. 딸기는 100g당 70~80㎎의 비타민C를 함유하고 있다. 하루에 6~8개만 먹어도 비타민C 일일 권장량인 100㎎을 모두 섭취하는 셈이다. 비타민C는 체내에서 세포의 노화를 막고 콜라겐 합성을 돕는다. 딸기가 염증성 장 질환을 치료하는 데 도움이 된다는 연구 결과도 있다. 미국 매사추세츠대 식품과학과 연구팀은 염증성 장 질환이 있는 쥐를 대상으로 실험을 진행했다. 그 결과, 딸기 가루를 섭취한 쥐에게서 체중 감소와 피가 섞인 설사가 나오는 증상이 현저하게 줄어든 것으로 나타났다. 대장 조직에서 염증 반응도 감소했다.  심혈관질환 위험을 낮추는 데에도 효과적이다. 딸기의 붉은색을 띠게 하는 안토시아닌은 항산화 작용을 통해 혈중 콜레스테롤을 떨어뜨리고 심장질환 위험을 감소시킨다. 실제로 핀란드 쿠오피오대 연구팀에 따르면 딸기를 섭취한 그룹은 그렇지 않은 그룹에 비해 고밀도 콜레스테롤(HDL) 수치가 상승했고 혈압과 혈소판 기능은 개선됐다.딸기는 열을 가하거나 믹서에 갈아 먹으면 영양소가 쉽게 파괴된다. 또 설탕이나 연유에 찍어먹으면 체내 대사 과정에서 딸기의 비타민 B1이 소모되기 때문에 피하는 것이 좋겠다.",105,https://n.news.naver.com/mnews/article/020/0003472565?sid=103
"선박회사 브런스윅, 자율운항 선박",2023.01.07. 오후 5:06,(라스베이거스=연합뉴스) 홍해인 기자 = 세계 최대 가전·IT(정보기술) 박람회 'CES 2023' 이틀째인 6일(현지시간) 미국 네바다주 라스베이거스 컨벤션센터(LVCC) 웨스트홀의 미국 선박 회사 브런스윅 전시관에서 관람객들이 자율운항 선박을 구경하고 있다. 2023.1.7    hihong@yna.co.kr,105,https://n.news.naver.com/mnews/article/001/0013687249?sid=103
"홍준표 대구시장, CES 2023 참관",2023.01.07. 오전 11:18,(라스베이거스=연합뉴스) 홍해인 기자 = 홍준표 대구시장이 6일(현지시간) 미국 네바다주 라스베이거스 컨벤션센터(LVCC)에서 열린 세계 최대 가전·IT(정보기술) 박람회 'CES 2023'을 참관하고 있다. 2023.1.7 [공동취재]    hihong@yna.co.kr,105,https://n.news.naver.com/mnews/article/001/0013686966?sid=103
"SK, CES 2023 지속가능식품 푸드트럭 운영",2023.01.07. 오전 11:13,"(라스베이거스=연합뉴스) 홍해인 기자 = 세계 최대 가전·IT(정보기술) 박람회 'CES 2023' 이틀째인 6일(현지시간) 미국 네바다주 라스베이거스 컨벤션센터(LVCC) 중앙 광장의 SK(주) 지속가능식품 푸드트럭에서 관람객들이 대체유단백질로 만든 빙수, 크림치즈와 아이스크림 등을 시식하기 위해 차례를 기다리고 있다.     SK-빙수는 SK㈜가 투자한 퍼펙트데이의 대체유단백질을 활용해 만든 디저트다. 우유가 아닌 대체유단백질을 얼려 얼음처럼 갈아 빙수를 만들었다. 2023.1.7    hihong@yna.co.kr",105,https://n.news.naver.com/mnews/article/001/0013686960?sid=103
[날씨] 전국 곳곳 가끔 비…일부 돌풍·벼락 주의,2023.10.19. 오전 6:46,"오늘(19일)은 전국 곳곳에 가끔 가을비가 내리겠습니다.현재, 레이더 영상을 보면 서울과 인천, 경기 북부와 강원 북부에는 비가 내리기 시작했는데요.오늘 서울을 포함한 일부 수도권은 오전까지 비가 내리다가 그치겠고요.낮부터는 강원 남부와 충청에도 비가 내리겠고 그 밖에 오후부터 밤사이에는 남부지방으로도 비구름이 확대되겠습니다.이번 비는 내일 새벽이면 대부분 그치겠고요.제주도는 내일 오전까지 비가 내리는 곳이 있겠습니다.자세한 비의 양을 보시면 적게는 5에서 많게는 40mm 정도가 되겠고요.일부 지역에서는 돌풍과 벼락을 동반해서 안전 사고 각별히 주의하셔야겠습니다.자세한 현재 기온을 보시면 서울 17도로 어제 같은 시각보다는 쌀쌀함이 덜한데요.낮 기온은 서울과 대전 19도에 그치면서 어제보다 낮겠습니다.다가오는 주말에는 올가을 들어 가장 쌀쌀한 추위가 나타날 전망입니다.(임은진 기상캐스터)",105,https://n.news.naver.com/mnews/article/055/0001098532?sid=103
수원 경기아트센터 등 9곳서 '기회소득 예술인 페스티벌',2023.10.19. 오전 9:39,"(수원=연합뉴스) 최찬흥 기자 = 경기도는 21~31일 수원 경기아트센터 등 9개 행사장에서 '기회소득 예술인 페스티벌'을 연다고 19일 밝혔다.



기회소득 예술인 페스티벌[경기도 제공. 재판매 및 DB 금지]    지난 7~8월 기회소득을 처음 받은 10개 시군 예술인 2천여명을 대상으로 신청받아 전시 78명, 공연 71팀, 체험 22팀을 전시·공연자로 선정했다.    행사장은 수원 경기아트센터 외에 경기도청 신청사, 의정부 미술도서관·음악도서관, 가평 음악역1939, 광주 남한산성, 평택 공간 '미학', 파주 아시아출판문화정보센터, 인천공항 등이다.    경기아트센터와 파주 아시아출판문화정보센터의 경우 전시와 공연, 예술 체험, 플리마켓 프로그램이 함께 진행된다.    예술인 기회소득은 도에 거주하는 예술활동증명유효자 중 개인소득이 중위소득 120% 이하인 예술인을 대상으로 연 150만원을 지급하며, 도와 시·군이 사업비를 50%씩 분담한다.    올해는 재정 여건 등의 이유로 불참한 수원·용인·고양·성남 등 4개 시를 제외한 27개 시군이 참여하며, 대상자는 9천50명가량이다.     chan@yna.co.kr",105,https://n.news.naver.com/mnews/article/001/0014272635?sid=103
앱마켓 '인기 1위'… 카카오게임즈 신작 '에버소울' 출발 쾌조,2023.01.07. 오전 5:30,"카카오게임즈의 신작 '에버소울'은 출시 당일 국내 양대 앱 마켓에서 인기 순위 1위에 올랐다. /사진제공=카카오게임즈 카카오게임즈의 신작 '에버소울'이 출시 당일 국내 양대 앱 마켓에서 인기 순위 1위에 올랐다.7일 업계에 따르면 '에버소울' 출시일인 지난 5일 구글 플레이, 애플 앱스토어 등 국내 양대 앱 마켓에서 인기 순위 1위를 기록했다.싱가포르에서도 양대 앱 마켓에서 각각 1위를 차지했다. 대만·홍콩·태국 등에서는 앱스토어에서 인기 1위에 랭크됐다.판타지 세계관의 모바일 역할수행게임(RPG) '에버소울'은 이용자가 정령의 부름을 받은 '구원자'가 돼 정령술사로서 다양한 정령들을 지휘, 강력한 적을 무찌르고 세계를 구한다는 스토리를 담았다. 고퀄리티 3D 애니메이션 그래픽, 독보적 세계관, 전략적인 전투 시스템, 정령과 교감하며 즐기는 인연 시스템 등이 특징이다. 카카오게임즈 관계자는 ""양대 앱 마켓 1위를 기념, 게임의 모든 접속자들에게 '일반 소환권 10장'을 지급한다""고 말했다.",105,https://n.news.naver.com/mnews/article/417/0000884743?sid=103
BMW i 비전 '디'(Dee) 콘셉트카,2023.01.07. 오전 11:46,(라스베이거스=연합뉴스) 홍해인 기자 = 세계 최대 가전·IT(정보기술) 박람회 'CES 2023' 이틀째인 6일(현지시간) 미국 네바다주 라스베이거스 컨벤션센터(LVCC) 사우스 홀 인근에 마련된 BMW 전시관에 시시각각 색이 바뀌는 미래형 중형 세단인 BMW i 비전 '디'(Dee) 콘셉트카가 전시돼 있다. 2023.1.7    hihong@yna.co.kr,105,https://n.news.naver.com/mnews/article/001/0013687019?sid=103
"[CES 2023] ""삼성 '더프레임'과 똑같네?"" 中 업체, 이번엔 액자형 TV 베꼈나",2023.01.07. 오후 2:24,"TCL·하이센스, 라이프스타일 TV 강화...회전·이동형 TV도 유사[라스베이거스(미국)=이나리 기자] 중국 TV 가전 브랜드 하이센스와 TCL이 정보기술(IT)·가전 전시회 'CES 2023'에서 삼성전자와 LG전자의 라이프스타일 TV와 유사한 제품을 공개해 주목된다.TCL과 하이센스는 삼성전자와 LG전자의 디자인과 컨셉을 모방하고 있다는 평가를 받아 왔다. 그럴만한 것이 양사는 앞서 삼성전자와 LG전자가 CES에서 공개했던 제품과 유사한 신제품을 몇년 뒤 CES에서 종종 공개해 왔기 때문이다. 이들 회사는 작년 CES에서 삼성전자의 회전형 TV '더세로'와 동일한 TV를 주력 제품으로 공개한 바 있다. '더세로'는 화면을 가로, 세로로 회전시킬 수 있는 TV다.



하이센스 액자형 TV ‘M1 시리즈’ (사진=지디넷코리아)삼성전자는 2017년 처음으로 라이프스타일 TV '더프레임'을 출시하며 액자형 TV 시장을 개척했다. 액자형 TV는 시청하지 않을 때 미술 작품이나 사진을 스크린에 띄워 액자처럼 활용할 수 있다는 점이 특징이다. 베젤 색상도 다양하게 출시돼 공간 인테리어와 어울리는 베젤을 선택할 수 있다. 액자형 TV는 패널을 얇게 구현하고 벽에 완벽하게 밀착시키는 기술이 핵심이다.하이센스가 이번 CES에서 처음으로 공개한 액자형 TV 'M1 시리즈'는 삼성전자의 '더 프레임'과 유사하다. 하이센스는 M1 시리즈를 액자처럼 활용할 수 있다는 점을 강조하기 위해 주변에 여러가지 그림들을 전시해 놓았다.



삼성전자 '더 프레임' TV (사진=삼성전자)TCL도 아트(ART) TV’ 존을 별도로 마련해 액자형 TV를 선보였다. TCL의 아트 TV 또한 베젤을 3가지 색상으로 출시해 소비자가 선택하도록 했다. 미술관의 작품처럼 비스듬하게 누워서 배치된 TCL의 아트 TV는 LG전자의 올레드 오브제 컬렉션 '이젤'과 비슷하다.TCL은 LG전자의 이동형 TV '스탠바이미'를 떠올리게 하는 TV도 전시했다. 스탠바이미는 화면을 좌우로 조정 및 회전시키거나, 위아래로 기울일 수 있다. 또 바퀴가 달려 집안에서 이동시켜 사용할 수 있다는 점도 특징이다. LG전자는 2021년 7월 스탠바이미를 출시했으며, 당시 새로운 폼팩터의 TV로 주목받은 바 있다.



TCL의 액자형 TV '아트 TV '(사진=지디넷코리아)



TCL의 아트 TV의 3가지 베젤 색상(사진=지디넷코리아)이번 전시회에 참관한 가전 업계 관계자는 ""중국 제조업체가 국내 가전의 디자인을 베끼는 것이 어제 오늘 일이 아니기에 놀랍지 않다""는 반응이다.TCL과 하이센스의 액자형 TV는 아직 가격이 알려지지 않았지만, 후발주자인 만큼 저렴한 가격을 앞세울 것으로 보인다. TCL은 2019년 삼성전자의 ‘더 세로’를 모방한 세로형 TV ‘제스’를 출시했을 당시, 삼성전자 제품 보다 절반 가량 저렴한 가격으로 공급하며 가격 경쟁력을 앞세웠다.



TCL은 화면을 좌우로 조정 및 회전시키거나, 위아래로 기울이고, 이동할 수 있는 TV를 선보였다. (사진=지디넷코리아)",105,https://n.news.naver.com/mnews/article/092/0002278956?sid=103
[위클리콘] 웹툰으로 보는 요기요의 스토리텔링…'간 떨어지는 출근',2023.01.07. 오전 7:01,"브랜드 웹툰 연재 시작… 오는 2월 9일까지 6부작 매일같이 쏟아지는 콘텐츠 소식. 영화부터 드라마, 다큐멘터리, 게임, 심지어 정부 홍보 영상까지 콘텐츠라면 장르를 가리지 않고 소개합니다. 주말에 만나는 위클리콘! 지금 시작합니다.  [편집자주]



배달앱 요기요 브랜드웹툰 '간 떨어지는 출근' [사진=위대한상상]배달앱 요기요 운영사 위대한상상 회사 생활을 소재로 한 웹툰 '간 떨어지는 출근'이 네이버웹툰에서 연재를 시작했다.'간 떨어지는 출근'은 마케팅팀 신입사원 '요조이'와 인턴 '이담'이 다양한 마케팅 프로젝트를 진행하며 성장하는 회사 생활 이야기를 그린다. 네이버웹툰에서 매주 목요일 새로운 에피소드(회차)를 공개, 앞으로 6주간 오는 2월 9일까지 연재할 예정이다.'간 떨어지는 출근'은 드라마로도 제작, 방영됐던 웹툰 원작 '간 떨어지는 동거'의 '나' 작가가 그린다. 원작에서 대학생이었던 주인공 '이담'이 새로운 웹툰에서 인턴으로 등장하며 독자에게 친근함을 준다.'간 떨어지는 출근'의 주인공이자 신입사원 '요조이'는 위대한상상(요기요)이 구축한 가상 세계관인 '요기요나라'의 주인공이다. 시즌1에선 '요조이'가 맛의 즐거움을 되찾기 위해 모험을 떠나는 이야기를 보여줬다. 지난해 초부터 시작한 시즌2에선 신입사원과 직장인 등 일상에서 누구나 쉽게 접할 수 있는 소재를 바탕으로 이용자 접점을 늘려 왔다고 위대한상상 측은 설명했다.가상의 세계관 속 가상 인물이지만 '요조이'는 '요기요나라' 공식 SNS를 통해 자신의 일상생활을 다른 사람(팔로워)들과 공유하는 방식으로 소통해 왔다. 이 '요조이'를 웹툰 주인공으로도 등장시키며 세계관을 넓힌다. 네이버웹툰 연재 종료 후엔 '요기요나라' 공식 SNS에 연재를 이어가며 스토리 연속성을 강화한단 계획이다.콘텐츠, 특히 웹툰을 활용해 각 기업(브랜드) 이야기를 전달하려는 시도는 꾸준히 있어 왔다. 2021년 5월말부터 7월 중순까지 연재됐던 유진투자증권 브랜드 웹툰 '신입일기'(자까) 등 사례가 있다. 위대한상상(요기요)도 브랜드 웹툰을 통해 콘텐츠 소비에 익숙한 2030세대 등 젊은 이용자를 공략한단 전략이다. 첫 화에서 사내 카페, '님' 호칭 문화 등을 녹여내고 있다.위대한상상(요기요) 측은 ""사내 문화와 브랜드 가치를 더 많은 이들에게 알리고 싶어 브랜드 웹툰을 선보이게 됐다""며 ""전통적인 마케팅 문법에서 벗어나 이용자(고객) 접점을 새롭게 강화한 웹툰에 많은 관심 바란다""고 전했다.",105,https://n.news.naver.com/mnews/article/031/0000721378?sid=103
부산역서 ‘붕’하고 이륙하더니 “와~”…4분만에 동백섬이네,2023.01.07. 오후 8:25,"[2023 CES] SKT ‘K-UAM’ 가상체험 해보니인공지능 반도체·가상발전소 사용“도심 교통체증 줄여 탄소배출 감소”



시이에스(CES) 관람객들이 에스케이텔레콤 ‘한국형 도심항공교통 가상체험 프로그램’을 체험해보고 있다. 에스케이텔레콤 제공



‘붕’하고 부산역을 이륙하더니 금세 부산 앞바다였다. 다시 부산 영도다리 아래, 또 대형 선박 사이, 빌딩 사이 등을 비행하자 “와~” 하는 함성이 절로 나왔다. 4분 만에 부산역에서 동백섬에 도착하는 가상 비행은 실감나는 화면으로 재미를 선사하는 동시에 도심 교통 체증을 해결할 수 있는 대안처럼 느껴졌다. 에스케이텔레콤(SKT)이 미국 라스베이거스에서 열리는 세계 최대 가전·정보기술(IT) 전시회 ‘시이에스(CES) 2023’에 전시한 한국형 도심항공교통(K-UAM) 가상체험 프로그램이다. 6일(현지시간) 실물 크기 전기수직이착륙기(eVTOL)에 올라 가상현실(VR) 헤드셋을 쓰고 가상 비행을 체험했다. 비행 동안 옆자리 승객들은 아슬아슬하게 곡예 비행을 할 때면 “무서워”를 연발하다 끝난 뒤엔 “금세 도착했네”라고 아쉬움을 표시했다.김정훈 에스케이텔레콤 과장은 “가상 비행은 재미를 가미하려고 곡예비행을 한 측면이 있지만, 실제로는 안에서 통화하거나 서류를 살펴볼 수 있는 등 평이할 것”이라고 설명했다.에스케이텔레콤은 ‘넷 제로 기술’을 주제로 꾸려진 에스케이 계열사 공동 전시관에서 도심항공교통 체험 프로그램을 선보였다. 친환경 에너지로 도심을 가로질러 순식간에 이동할 수 있는 것은 물론이고, 도심 교통 체증을 줄여 탄소배출 감소에 기여할 수 있는 점을 내세웠다.에스케이텔레콤은 도심항공교통 분야 선두기업 조비 에비에이션(Joby Aviation)과 손잡고 이 프로그램을 준비했다. 전기수직이착륙기는 조비 에비에이션이 만들고, 에스케이텔레콤은 이를 운용하는 플랫폼을 제공했다. 인공지능(AI) 반도체 사피온과 가상발전소(Virtual Power Plant) 기술이 사용됐다. 가성발전소는 가전기수직이착륙기 충전기다.김정훈 과장은 “비행기는 보잉이 만들고 델타가 운항한다면, 도심항공교통은 조비 에비에이션이 전기수직이착륙기를 만들고 에스케이텔레콤이 운영하는 꼴”이라고 설명했다.",105,https://n.news.naver.com/mnews/article/028/0002622499?sid=103
"국회 산자중기위, CES 2023 참관",2023.01.07. 오후 12:57,(라스베이거스=연합뉴스) 홍해인 기자 = 세계 최대 가전·IT(정보기술) 박람회 CES 2023 개막 이틀째인 6일(현지시간) 미국 네바다주 라스베이거스 컨벤션 센터(LVCC) 웨스트 홀램 레볼루션(RAM REVOLUTION) 전시관에서 윤관석 위원장을 비롯한 국회 산업통상자원중소벤처기업위원회 소속 여야 의원들이 전시를 참관하고 있다. 2023.1.7    hihong@yna.co.kr,105,https://n.news.naver.com/mnews/article/001/0013687119?sid=103
[날씨] 전국 곳곳 요란한 비…내일부터 강한 찬바람,2023.10.19. 오전 7:25,"[앵커]오늘은 전국 대부분 지역에 요란한 비가 내리겠습니다.비가 그치고 내일부터는 한층 더 추워지겠는데요.자세한 날씨 기상캐스터 연결해 알아보겠습니다.김민지 캐스터.[캐스터]오늘은 전국 대부분 지역에 가을비가 내리겠습니다.현재 수도권 북부와 강원 북부 지역에 비가 내리고 있고요.경기 북부 일부 지역에 시간당 20mm 안팎으로 세차게 비가 오고 있습니다.이 비구름은 오늘 전국을 훑고 지나가겠습니다.비가 길게 이어지지는 않겠습니다.서울 등 수도권은 오전까지, 경기 남부와 강원 북부는 낮까지 비가 내리다가 그치겠고요.오후부터는 호남과 경북 북부, 밤부터는 그 외 남부지방에 비가 내리겠습니다.비는 내일 아침이면 대부분 그치겠습니다.그사이 충청과 경북 서부 내륙에 최고 40mm의 비가 오겠고요.그 외 지역은 적게는 5mm, 많게는 30mm가 되겠습니다.또 곳곳으로 돌풍이 불고 벼락이 치면서 요란하게 오겠습니다.비구름이 물러가고 그 뒤로 찬 공기가 유입되면서 추워지겠습니다.내일부터 찬 바람이 강하게 불겠고요.주말 서울의 아침 기온 5도 안팎까지 내려가면서 올가을 들어서 가장 쌀쌀하겠습니다.특히 기온이 영하권으로 떨어지는 강원 일부 지역은 도로 살얼음이 생기겠습니다.교통안전에 유의해 주시기 바랍니다.하루 사이 기온이 크게 떨어지는 만큼 건강 잘 챙겨주셔야겠습니다.지금까지 날씨 전해 드렸습니다.(김민지 기상캐스터)#가을비 #요란한비 #가을추위연합뉴스TV 기사문의 및 제보 : 카톡/라인 jebo23",105,https://n.news.naver.com/mnews/article/422/0000624673?sid=103
베트남 빈패스트 전기차 VF8,2023.01.07. 오후 12:14,(라스베이거스=연합뉴스) 홍해인 기자 = 세계 최대 가전·IT(정보기술) 박람회 'CES 2023' 이틀째인 6일(현지시간) 미국 네바다주 라스베이거스 컨벤션센터(LVCC) 웨스트홀 베트남 자동차업체 빈패스트 전시관에 전기차 ‘VF8’이 전시돼 있다. 2023.1.7    hihong@yna.co.kr,105,https://n.news.naver.com/mnews/article/001/0013687077?sid=103
