title,date,main,section,url
“사람이 필요없어요”…중국 물류업체가 무인기술에 올인한 이유는?,2018.12.17. 오후 9:11,"세계에서 가장 많은 사람이 사는 중국에 ‘무인화(無人化)’ 바람이 일고 있다. 진원지는 중국에만 3억여 고객을 가진 현지 최대 온라인 쇼핑업체 징둥닷컴(JD.com). 1998년 베이징의 전자기기 점포로 시작해 20년 만에 ‘중국판 아마존’으로 성장한 이 회사는 3년 전부터 무인 기술을 연구하는 ‘X사업부’를 두고 스마트 물류 및 로봇 자동화 기술을 개발해왔다. 중국과 미국 실리콘밸리에 인공지능(AI), 드론, 로봇 등을 연구하는 엔지니어만 1만2000명이 넘는다. 인건비 부담이 덜한 중국의 물류업체가 무인기술에 올인한 이유는 뭘까.  ● 무인 레스토랑 만든 중국 1위 리테일기업 



징둥닷컴이 지난달 중국 톈진시에 오픈한 무인식당 ‘X레스토랑’을 찾은 손님들이 로봇이 테이블로 서빙해온 음식을 옮기고 있다. 서빙로봇에 적용된 초정밀 지도와 자율주행 기술은 모두 징둥닷컴이 자체 개발했다. 징둥닷컴 제공  12일 점심 중국 텐진 시의 ‘JD X레스토랑’. 100석이 마련된 300㎡(약 90평) 규모의 홀이 손님으로 가득 찼지만 주문을 받거나 음식을 나르는 종업원은 보이지 않았다. 손님이 스마트폰으로 테이블 QR코드를 스캔해 메뉴를 주문하면 자율주행 로봇이 주방과 테이블을 오가며 음식을 서빙했다. 인간 종업원은 빈 그릇을 치우거나 재료를 다듬을 때만 거들뿐이었다.   지난달 오픈한 이 식당은 주문부터 서빙, 조리까지 기계가 하는 ‘무인 레스토랑’이다. 매일 약 400~500인분을 팔지만 전체 직원은 10명도 안된다. 비슷한 매출(2만~3만 위안)을 올리는 식당들이 최소 20명 넘는 인력을 쓰는 것을 감안하면 인건비가 절반도 안 드는 셈이다. 주방에는 43가지 레시피가 입력된 조리 로봇이 시간당 20그릇의 요리를 만들어낸다.   X레스토랑 아이디어를 낸 탕쓰위 본부장(32)은 “인간과 기계가 공존하는 시대에 협업의 황금비율을 찾는 것이 제1의 목적”이라며 “1년 정도면 투자액 회수도 가능하다”고 말했다.   X레스토랑 옆에는 QR코드 스캔과 얼굴 인증만 하면 상품결제가 자동으로 이뤄지는 무인편의점 X마트가 있었다. 지난해 10월 론칭한 X마트는 1년간 중국 내 20여점과 해외 점포(인도네시아)까지 열었다. 매장 내 AI 카메라가 고객 행동과 소비 성향을 분석하고, 모은 데이터는 상품 진열과 맞춤 광고에 활용한다. 온라인으로 주문하면 자율주행 무인로봇이 집이나 사무실 앞까지 물건을 배달해주는데 현재 대학가와 텐진시에서 시범 운행 중이다.● 무인 플랫폼 기술 독자개발 



징둥닷컴 상하이 물류창고에서 무인 운반로봇이 주문상품을 배송지별로 분류하고 있다. 이곳에서는 제품 선별부터 포장까지 모든 과정을 로봇이 수행한다. 징둥닷컴 제공  14일 징둥닷컴이 상하이에서 운영하는 무인창고를 찾았다. 이곳은 사람이 하던 픽킹(제품 선별)과 팩킹(포장) 작업까지 로봇에 맡겨 상품 보관부터 포장, 배송까지 전 과정을 기계가 한다. 시간당 3600개의 제품을 집을 수 있는 픽킹로봇을 비롯해 AI, 운반로봇, 무인픽업 등 혁신기술로 전통 창고보다 작업효율이 10배 더 높아졌다. 징둥닷컴은 무인자동화와 드론 기술을 접목해 대도시에 국한됐던 ‘211 배송’(오전 11시 주문하면 당일 배송, 밤 열한시 주문하면 익일 오후 3시까지 배송) 범위를 교외로 확대하고 있다.  놀라운 점은 드론과 자율주행 로봇 모두 징둥닷컴 독자적으로 개발한다는 점이다. 지난해부터 강소성 산시성 등에서 상용화한 소형 드론(30kg 이하 적재)은 현재까지 1000번 이상 이륙했고 30만km 이상 운항했다. 45분간 반경 320km까지 배송이 가능하다. 지난달 첫 비행에 성공한 대형 드론은 최대 800kg 물건을 싣고 1000km 운항이 가능하다. 내년 상용화를 위해 당국과 항로 문제를 논의 중이다.   샤오쥔 X사업부 총괄(33·부사장)은 “대형 드론을 활용하면 창고의 배송반경이 120km에서 600~800km까지 늘어난다”며 “자율주행, 드론, 창고 무인화 기술을 시스템화해서 플랫폼 형태로 수출할 계획”이라고 말했다. 베이징,상해,텐진=신동진 기자 shine@donga.com▶ 동아일보 단독 / 우아한 : 우리 아이들의 & 아름다운 한반도▶ 네이버 홈에서 [동아일보] 채널 구독하기ⓒ 동아일보 & donga.com, 무단 전재 및 재배포 금지",105,https://n.news.naver.com/mnews/article/020/0003187676?sid=103
이경민 교수가 말하는 뇌,2018.12.17. 오후 5:26,(서울=연합뉴스) 진연수 기자 = 이경민 서울대학교 인지과학연구소장이 17일 오후 서울 강남구 삼성동 라마다호텔에서 열린 '제1회 태그톡(T.A.G talk) - 게임은 뇌 친구'에서 개회사를 하고 있다. 2018.12.17    jin90@yna.co.kr▶뭐 하고 놀까? #흥  ▶쇼미더뉴스! 오늘 많이 본 뉴스영상 ▶네이버 홈에서 [연합뉴스] 채널 구독하기,105,https://n.news.naver.com/mnews/article/001/0010531002?sid=103
"비트코인 디앱 템코, 블록노드커뮤니케이션즈 투자 유치",2018.12.17. 오후 2:54,"(지디넷코리아=임유경 기자)비트코인 블록체인 기반 서플라이체인 데이터 플랫폼 템코(대표 윤재섭)는 블록노드커뮤니케이션즈에서 투자를 유치했다고 17일 밝혔다.블록노드커뮤니케이션즈는 블록체인 비즈니스 종합 솔루션을 제공하고 있는 국내 액셀러레이터다. 템코에 투자 유치와 함께 전략적인 파트너 협약을 맺었다. 향후 마케팅 솔루션도 지원받을 예정이다.템코는 비트코인 네트워크 (RSK)를 기반으로 한 서플라이체인 데이터 플랫폼을 제공하는 블록체인 스타트업이다. 단절된 공급망을 하나로 연결해 데이터를 블록체인에 업로딩하고 이 데이터를 좀 더 효율적으로 활용할 수 있도록 돕는 비즈니스인텔리전스(BI) 툴을 기업들에게 제공한다. 또, 유통 과정을 투명하게 볼 수 있도록 소비자를 위한 전용 애플리케이션도 개발하고 있다.



템코가 국내 블록체인 액셀러레이터 블록노드커뮤니케이션즈에서 투자를 유치했다.투자 배경에 대해 블록노드의 강상준 대표는 “템코의 경우 검증된 유즈케이스를 이미 갖고 있기고 내년 목표가 뚜렷한 프로젝트라고 판단했다""며 ""블록노드가 추구하는 생태계를 조성하는 데 크게 일조할 것 같아 투자하게 됐다”고 말했다.템코의 공동창업자인 이근일 최고기술경영자(CTO)는 “금번에 유치한 투자금으로 내년 상반기 출시 예정인 럭셔리 마켓플랫폼 개발에 박차를 가할 것”이라며 “하루 빨리 개발을 완료하여 템코의 첫 마켓플랫폼을 성공적으로 내놓고 싶다”고 말했다.임유경 기자(lyk@zdnet.co.kr)  ▶ 네이버 채널에서 ‘지디넷코리아’를 구독해주세요",105,https://n.news.naver.com/mnews/article/092/0002152673?sid=103
"부광약품, 당뇨병신약 후기 2상 임상 종료",2018.12.17. 오후 5:04,"부광약품의 당뇨병신약인 MLR-1023의 후기 2상 임상시험이 종료됐다고 17일 밝혔다.미국 시간으로 지난 14일 완료된 이번 임상은 미국 40개 사이트, 한국 21개 사이트 등 총 61개 사이트에서 400명의 제2형 당뇨병 환자를 대상으로 진행됐다.부광약품은 임상의 주요 지표 결과를 이르면 내년 1월 중 확인할 수 있을 것으로 예상하고 있다. 2019년 6월 미국당뇨병학회를 통해 전체적인 결과를 발표할 예정이다. 부광약품 관계자는 ""MLR-1023의 후기 2상 임상이 종료돼 한 달 후면 결과를 확인 할 수 있는 단계에 이르렀다""며 ""신약 물질의 가치가 한 단계 업그레이드 돼, 여러 비즈니스 미팅에서 높은 관심을 받을 것으로 기대된다""고 말했다.김수연기자 newsnews@dt.co.kr 디지털타임스 홈페이지 바로가기 / 디지털타임스 뉴스 더보기네이버 채널에서 '디지털타임스'를 구독해주세요.",105,https://n.news.naver.com/mnews/article/029/0002498359?sid=103
"경남제약, ""상장폐지 결정에 유감""",2018.12.17. 오후 4:10,"추가 유상증자 유치·전문경영인 체제 구축 노력 인정받지 못해



[서울경제] 경남제약이 한국거래소 기업심사위원회가 상장폐지를 결정한 것에 대해 유감을 표시했다.경남제약은 17일 홈페이지에 ‘경남제약 주주 여러분께 드리는 글’을 게재하고 “재무 건전성 확보를 위한 추가 유상증자를 유치하고 전문경영인 체제를 구축했음에도 기심위가 상장폐지 (심의) 결정을 내린 것은 안타까운 일이며, 심히 유감스럽다”고 밝혔다.이어 “상장폐지 여부를 결정하는 코스닥시장위원회의 최종 심사에 앞서 회사의 경영 개선 노력과 성과들에 대해 더 적극적으로 소명하고, 필요한 준비를 하겠다”며 “상장유지와 거래재개 결정이 내려질 수 있도록 혼신의 노력을 다하겠다”고 전했다.또 지난 2월 회계처리 위반으로 상장 적격성 실질심사 대상으로 결정된 이후 거래재개를 위해 최선을 다해 왔다는 점도 호소했다. 경남제약은 “재무 건전성 확보를 위해 지속해서 차입금을 상환해 전년 말 기준 약 111억원의 차입금을 현재 약 55억원 수준으로 줄였다”며 “영업 분야에서는 대표상품인 레모나의 중국시장 진출 등 전년 대비 5% 내외의 매출 증가가 예상된다”고 설명했다.이어 “소액주주연대와 함께 신기술사업조합이 운영하는 투자조합을 전략적 투자자로 유치해 최대주주를 변경하기도 했다”고 덧붙였다.한국거래소 코스닥시장본부는 지난 14일 기업심사위원회 심의 결과 경남제약의 주권 상장폐지를 결정했다. 경남제약은 지난 3월 증권선물위원회의 감리 결과 매출 채권 허위 계상 등 회계처리 위반 사항이 적발돼 과징금 4,000만원, 감사인 지정 3년, 검찰 고발 등 제재를 받았다. 이에 따라 상장 적격성 실질심사 대상에 올랐다.코스닥시장위원회는 경남제약의 상장폐지 여부, 개선 기간 부여 여부 등을 최종 심의·의결할 예정이다. 경남제약은 지난 1957년 설립된 일반의약품 전문 제약회사로, 비타민C ‘레모나’, 무좀약 ‘피엠’ 등으로 유명하다./우영탁기자 tak@sedaily.com[서울경제 바로가기]프리미엄 미디어 Signal이 투자의 바른 길을 안내합니다 [바로가기▶]블록체인의 모든 것, 서울경제 Decenter [바로가기▶]저작권자 ⓒ 서울경제, 무단 전재 및 재배포 금지",105,https://n.news.naver.com/mnews/article/011/0003466891?sid=103
"SKT·금감원, 손잡고 보이스피싱 막는 AI 개발",2018.12.17. 오후 1:53,"17일 서울 을지로 SK텔레콤 사옥에서 장유성 SK텔레콤 AI/모빌리티 사업단장과 김수헌 금융감독원 불법금융대응단 국장이 보이스피싱 피해예방을 위한 인공지능(AI) 기술 개발 및 도입 업무협약을 체결한 후 관계자들과 기념촬영을 하고 있다.보이스피싱 사기범으로부터 전화가 오면, 스마트폰에 설치된 애플리케이션이 자동으로 실행된다. 발신자 목소리와 사기범 DB를 인공지능이 스스로 비교 분석하고, 일치 여부를 판단해 이용자에게 경고하는 방식이다. (SK텔레콤 제공) 2018.12.17/뉴스1photo@news1.kr▶ [ 크립토허브 ]  [ 터닝포인트 2019 ] ▶ 에어팟&스타벅스 커피 경품(~12/25)[© 뉴스1코리아(news1.kr), 무단 전재 및 재배포 금지]",105,https://n.news.naver.com/mnews/article/421/0003743471?sid=103
"모바일 RPG '게이트식스', 5일간의 테스트 시작",2018.12.17. 오후 4:33,"플레로게임즈는 젤리오아시스가 개발한 모바일 RPG '게이트식스'의 CBT를 오는 21일 18시까지 진행한다.이번 테스트는 안드로이드 이용자라면 누구나 CBT 페이지와 공식카페, 구글 플레이 검색 등을 통해 참여할 수 있다.'게이트식스'는 가상현실과 일상의 경계가 허물어진 근미래를 배경으로 한 수집형 모바일 RPG다.  회사측은 이번 테스트를 통해 게이머가 '게이트식스'의 세계관에 깊게 몰입할 수 있도록 메인 시나리오를 6챕터까지 공개했으며 같은 스테이지 내에서도 차원이 다른 재미를 경험할 수 있게 모든 난이도를 공개했다.또, 각자의 매력이 살아있는 캐릭터들과 성장 시스템, 실시간 배틀이 가능한 PVP 랭킹전과 간이 대전 모드 챌린지, 성장 아이템을 획득할 수 있는 보스 배틀 모드 감시자의 전당과 7인의 집행자, 전용 장비 획득이 가능한 파티 레이드 데이터 포식자 등의 서브모드도 함께 선보였다.김상민 플레로게임즈 이사는 ""안정성 체크와 함께 게임의 전반적인 재미 검증이 이번 테스트의 주된 목적""이라며 ""게이머의 소중한 의견은 게임에 적극 반영할 계획""이라고 말했다. 최종배 기자 jovia@fomos.co.kr[게임&게이머, 문화를 전합니다. 포모스게임│무단 전재 및 재배포 금지]포모스",105,https://n.news.naver.com/mnews/article/236/0000182027?sid=103
"애플 서드파티 앱스토어, 시디아 문 닫는다",2018.12.17. 오전 11:01,"설립자 “신규 앱 판매 중단, 기존 구매 앱 다운로드만 가능”(지디넷코리아=권봉석 기자)애플 앱스토어보다 한 발 앞서 외부 앱 설치 기능을 구현했던 시디아가 서비스 개시 10년만에 문을 닫는다. 시디아 개발자인 제이 프리먼이 14일(미국 현지시간) 레딧을 통해 이와 같이 밝혔다.2007년 출시된 아이폰 최초 모델은 설치 가능한 앱 대신 웹 앱을 이용하는 방식으로 작동했다. 인터넷 접속이 불가능한 환경에서는 외부 앱 실행이 불가능했다.



애플 서드파티 앱스토어인 시디아가 문을 닫는다. (그림=시디아)시디아는 아이폰 탈옥이 성공한 이후인 2008년 2월 외부 앱을 설치 가능한 앱 장터로 등장했다. 애플이 공식 앱스토어를 연 2008년 7월 이후에는 아이폰과 아이패드를 탈옥한 이용자들이 애플의 심사를 통과할 수 없는 앱이나 아이폰 기능을 확장하는 앱을 구매하는 데 이용했다.제이 프리먼에 따르면 2011년 4월 기준 시디아는 연간 1천만 달러(약 100억원)의 수익을 올렸고 주간 이용자는 450만 명 이상, 순수익은 25만 달러(약 3억원)였다.그러나 시디아는 아이폰5 출시 이후 애플이 하드웨어·소프트웨어 보안을 강화하며 침체되기 시작했다. 시디아를 이용하려면 탈옥이 반드시 필요한데 이것이 점점 어려워졌기 때문이다. 여기에 탈옥으로 구현되었던 여러 기능이 iOS에 포함되면서 탈옥 필요성도 크게 낮아졌다.제이 프리먼은 레딧에 올린 글을 통해 “시디아의 수익 저하로 그동안 개인 돈을 투입해 서비스를 운영해 왔지만 연말까지 시디아 스토어를 닫을 것”이라며 “그동안 올라온 앱을 유지하는 데 쓰이는 매달 수 TB의 트래픽과 이를 감당하기 위한 회선 비용은 새로 구한 일자리를 통해 충당할 것”이라고 설명했다.이에 따라 시디아를 통한 신규 앱 구매는 불가능하며 기존 앱 구매자들의 다운로드만 가능하다. 단 다운로드 서비스가 언제까지 제공될지는 미지수다.권봉석 기자(bskwon@zdnet.co.kr)  ▶ 네이버 채널에서 ‘지디넷코리아’를 구독해주세요",105,https://n.news.naver.com/mnews/article/092/0002152655?sid=103
100년 만에 옛 모습 찾은 광화문…월대와 새 현판 공개,2023.10.15. 오후 9:22,"[앵커]한국의 상징적인 장소이자, 경복궁의 정문인 광화문 앞이 새 단장을 마치고 오늘(15일) 공개됐습니다.일제 때 크게 훼손됐던 월대와, 논란이 이어졌던 광화문 현판이 원래 모습으로 복원됐는데요.백년 만에 옛 모습을 찾게 된 광화문에 김우준 기자가 다녀왔습니다. [리포트] 미래의 희망을 품은 새빛이, 광화문에 깃듭니다. 조선시대 과거시험을 보거나 사신을 맞이했던 공간으로 임금이 백성과 마주하는 '소통의 장'이었던 광화문 앞 월대. 100년 만에 다시 찾은 그 길 위를 함께 걸어봅니다. [이한나/월대 공개 행사 참가 시민 : ""첫 번째로 걸어봐서 너무 좋고요. 마치 조선시대의 왕, 왕비가 된 것 같습니다.""] 1960년대 도로 아래로 아예 자취를 감췄던 월대 발굴은 지난해부터 시작됐습니다. 일제 때 깔렸던 전차 선로를 걷어내고, 난간석 석재를 경기도 구리 동구릉에서 확인해 복원했습니다. 월대를 지킨 상서로운 동물 서수상을 고 이건희 삼성그룹 회장 유족으로부터 기증받기까지. 원형 복원을 바랐던 간절함들이 그 위용을 되찾게 했습니다. [신희권/서울시립대 교수 : ""(월대는) 중국이나 일본에는 없는 우리나라 궁궐의 특징입니다. 광화문의 원래 모습을 회복했다는 의미가…""] 검은 바탕에 금빛 글씨로 쓴 광화문 현판도 새로 공개됐습니다. 과거 40년 넘게 내걸렸던 박정희 전 대통령 친필 현판이 2010년에 교체됐지만, 균열이 생기면서 부실 복원 논란이 일었습니다. 원래 모습을 찾기 위해 또 다시 제작한 현판. 훈민정음체로 바꾸자는 주장도 있었지만, 미국 스미스소니언 박물관이 소장한 사진과 이후 일본에서 찾아낸 경복궁 중건 공사 기록 등을 근거로, 당시 현판을 쓴 훈련대장 임태영의 글씨를 복원해 새겨넣었습니다.""왕의 덕이 온 나라를 비춘다"" 라는 뜻을 갖고 있는 광화문. 우여곡절 끝에 제모습을 찾은 금빛 현판 아래, 새로운 역사의 길이  100년 만에 다시 열렸습니다. KBS 뉴스 김우준입니다. 촬영기자:문아미 김성현/영상편집:김기곤/화면제공:문화재청■ 제보하기▷ 전화 : 02-781-1234, 4444▷ 이메일 : kbs1234@kbs.co.kr▷ 카카오톡 : 'KBS제보' 검색, 채널 추가▷ 네이버, 유튜브에서 KBS뉴스를 구독해주세요!",105,https://n.news.naver.com/mnews/article/056/0011582217?sid=103
“보이스톡 대신 T전화 쓰세요”..무료 로밍 선언한 SK텔레콤,2018.12.17. 오후 2:50,"- 박정호 사장,  인터넷전화(VoIP) 언급..인터넷과 정면 승부- 가격 무료에 품질까지 우수- 인터넷 회사 되는 SK텔레콤..T전화 해외로 간다- 인터넷전화 활용한 로밍 무료, 다른 이통사로 파급될까[이데일리 김현아 기자]SK텔레콤이 해외 음성로밍 통화 무료시대를 열었다. 통신사들이 로밍 가격을 내리고 있지만 여전히 고객 부담이 만만찮은 상황에서 ‘T전화(SK텔레콤의 통화플랫폼)로밍 무료 통화 시대’를 연 것이다.특히 T전화 로밍은 △상대방이 T전화를 안 써도 나만 쓰면 168개 국가에서 국내 유·무선 통신사 이용자와 통화가 무료이고 △모바일인터넷전화(mVoIP)이지만, 다른 앱과 달리 데이터가 차감되지 않으며 △별도 알고리즘 적용으로 연결시간이 평균 1초에 불과해 기존 음성로밍이나 보이스톡보다 품질이 우수하다.보이스톡은 상대방이 같은 앱을 깔아야 하고, 수신자와 발신자 모두 데이터가 차감되며, 연결 시간이나 통화 품질도 다소 떨어진다.



박정호 SK텔레콤 사장◇박정호 사장,  인터넷전화(VoIP) 언급..인터넷과 정면 승부통신사가 해외 음성로밍을 전부 무료로 제공하는 것은 이번이 처음이다. 하지만 사실 지난 2월 박정호 SK텔레콤 사장은 이미 로밍에 인터넷프로토콜을 쓰겠다는 방침은 밝힌 바 있다.당시 박 사장은 ‘모바일 월드 콩그레스(MWC)’가 열린 스페인 바르셀로나에서 “통신사들이 제공하는 로밍 통화 수준은 인터넷 플레이어보다 못한 측면이 있다”며 “로밍에 인터넷 프로토콜 쓰자는 얘기를 했다. 회사 일각에선 수천 억원의 매출 손실을 예상하나, 미움을 받으면 존재하지 못할 수 있다.고객이 싫어하는 걸 고치는데 돈을 쓰겠다”고 말했다.이후 탄생한 게 T전화 해외 음성로밍 통화 무료다.



◇가격 무료에 품질까지 우수이번에 출시된 T전화 음성로밍은 로밍에 필요한 네트워크를 해외 음성망 대신 데이터망과 연동한다. 예전에는 해외 구간과 국제망 구간이 모두 음성망(서킷망)이었지만, T전화 로밍은 데이터망(패킷망)으로 T전화 서버로 연결했다. 또, 고품질의 음성 코덱과 최적의 알고리즘을 적용해 통화품질도 기존 로밍보다 평균 20% 향상시켰다. 해외 통화에 인터넷전화(VoIP)기술을 적용한 것은 스카이프나 카카오보다 늦었지만 품질은 더 높인 것이다.SK텔레콤 관계자는 “사실 VoIP 기술이 발전하면서 데이터 통신망에서 차지하는 량이 줄어 무료인 보이스톡이 오히려 외국 통신사 망(음성망)을 타는 기존음성로밍보다 품질이 좋다는 애기까지 나왔다”며 “하지만 T전화 로밍은 콜라(callar, T전화 영상통화 브랜드)에 적용된 자체 mVoIP 엔진을 써서 훨씬 품질이 좋다”고 설명했다.



◇인터넷 회사 되는 SK텔레콤..T전화 해외로 간다T전화 무료 음성 로밍은 별도로 가입하지 않아도 T전화 앱을 다운받거나 업그레이드하면 쓸 수 있다. 데이터 통신이기에, SK텔레콤의 데이터 로밍 요금제에는 가입해야 한다.SK텔레콤이 T전화 무료 음성 로밍을 내놓은 것은 고객이 체감할 수 있는 서비스 혁신을 이룬다는 차원도 있지만, T전화의 미래와도 관련있다. T전화는 2014년 출시돼 1200만 명이 쓸 정도로 인기다. 위치기반 검색, 스팸 전화 수신 거절 기능 등이 있는데 국내 서비스라는 한계가 있었다.하지만 T전화 해외 로밍이 대중화되기 시작하면 글로벌 현지에서 개인화된 POI(Point of Interest)와 위치기반 서비스를 상품화하는 기반이 될 수 있다.최정호 MNO플랫폼그룹 팀장은 “T전화는 로컬 서비스로 진행됐는데 음성로밍 무료가 글로벌 서비스로 확장되는 기반이 될 수 있다”고 말했다.



◇인터넷전화 활용한 로밍 무료, 다른 이통사로 파급될까세계이동통신사업자연합회(GSMA)이사회 멤버인 박정호 SK텔레콤 사장은 그간 GSMA 이사회에서 통신업의 혁신을 주장해 왔다. LTE를 넘어 5G가 상용화되는 와중에, 다른 나라 통신사들도 로밍을 위한 해외·국제 구간을 모두 데이터망으로 연결한다면 어찌될까.이론적으로 전세계 음성 로밍 통화는 전부 무료가 되고, 통신사들이 직접 관리하기에 스카이프 같은 인터넷전화 앱 회사들보다 품질도 우수할 수 있다.통신사 관계자는 “우리나라와 달리 다른 나라 통신사들은 3G 음성망을 쓰는 곳이 많고 아직 VoIP를 활용한 로밍 무료에 적극적이진 않다”면서도 “문자메시지 매출을 지키려다 카카오톡에게 메신저 시장을 내줬고, mVoIP를 차단하려다 다 풀어준 일 등을 보면 누가 먼저 고객만 보고 혁신하느냐의 문제”라고 말했다.



김현아 (chaos@edaily.co.kr)＜ⓒ종합 경제정보 미디어 이데일리 - 무단전재 & 재배포 금지＞",105,https://n.news.naver.com/mnews/article/018/0004274141?sid=103
