title,date,main,section,url
[DD 인사이트] KT 장애 사태가 일깨운 경각심... 클라우드는 안전한가,2021.10.30. 오전 10:31,"[디지털데일리 박기록 논설실장] 거의 모든 소통을 온라인으로 하는 사람들에게 1시간이 넘는 네트워크 단절은 매우 큰 고통이다. 지난 25일, 발생한 KT의 네트워크 장애는 그런 단면을 그대로 보여줬다. 점심 시간과 맞물려 결제를 못한 식당 등 자영업자들은 곧바로 직접적인 피해를 입었고, 주식 거래를 못한 투자자들은 매도, 매수 타이밍을 놓쳤다. KT 인터넷과 연결된 거의 모든 서비스는 어떤 형태로든 차질을 빚었다.     구현모 KT 대표가 고객들에게 머리를 숙일 수 밖에 없었다. 물론 지켜봐야겠지만 KT가 할 수 있는 것은 어쩌면 그것이 거의 전부 일지도 모른다. 과거 국내외 전산 장애로 인한 배상 사례들을 봤을때, 실제 피해액 산정은 피해자들이 체감하는 수준과는 상당한 괴리가 있었기 때문이다. 



5년전과 비교해 ICT기반의 비대면 거래가 폭증했지만 전산 장애로 인한 피해액을 산정할 마땅한 메뉴얼이 없는 것이 현실이다. 한편으론 이번 KT 네트워크 장애 사태는 잠시 잊고 지냈던 기본적인 경각심을 일깨웠다. 아무리 통신 네트워크가 발달했어도 중대하고 치명적인 사고는 언제든지 일어 날 수 있다는 것과, 또 기업들은 사고 피해를 최소화하기위한 비상대응계획(BCP) 체계를 갖추고 있느냐는 것, 두가지다. 물론 현실에 맞는 피해 구제를 위한 법과 제도적인 보완 역시 시급하지만 가장 실익이 큰 것은 역시 기업 스스로가 리스크를 최소화하는 것이다.     이런 점에서 기업들이 현실적으로 심각하게 고민해봐야 할 문제가 ‘클라우드(Cloud)발 전산 대란(大亂)’ 가능성이다. 이번 KT의 1시간 네트워크 장애와 비교해 훨씬 심각한 사례들이 이미 글로벌 클라우드 기업들이 운영하는 서비스에서 여러차레 발생했기 때문이다.   ◆기업들에게 보다 현실적인 공포, ‘클라우드 장애’‘디지털 전환’ 광풍으로, 국내에선 자체적으로 운영해왔던 IT인프라를 외부 IT업체에 맡기는 클라우드 전환이 가속화되고 있다. IT를 사용한 만큼만 지불하기 때문에 IT비용을 최소화할 수 있고, 또한 IT서비스 품질도 최소한 보장된다고 믿는다.그런데 동시에 리스크도 커지고 있다는 것이 문제다. 이는 ‘클라우드 서비스 사업자들을 과연 완전히 신뢰할 수 있느냐’는 기초적인 의문에서 출발한다. 특히 완전히 IT인프라를 외부에 맡기는 ‘퍼블릭’(Public) 방식은 클라우드 서비스 제공 기업의 신뢰가 절대적으로 중요하다. 그러나 현실은 아마존웹서비스(AWS)와 같은 세계 1위의 대형 클라우드 서비스기업 마저도 어떤 형태로든 사고가 발생하고 있다는 점이다.  올해 1월, ‘리그오브레전드(롤)’, ‘쿠키런 킹덤’ 등 인기 게임에서 동시에 장애가 발생했다. 이들 게임은 AWS의 클라우드를 활용중이었는데, 장애에서 복구까지 무려 20시간에 가까이 서비스가 중단됐다. 당시 국내가 아닌 일본 도쿄의 AWS 리전에서 냉각시스템의 오류에 따른 전산 장애가 원인으로 추정됐다. 



이처럼 클라우드 서비스는 글로벌 IT인프라 자원을 최적 배분해서 운용되는 본질적인 특성상 그 자체로 복잡한 구조를 가진다. 사고 형태에 따라서는 클라우드 방식이 과거 토털 IT아웃소싱 방식보다 훨씬 더 치명적인 결과를 낳을 수도 있다는 의미다.  이같은 우려때문에 은행 등 국내 주요 금융회사들은 이같은 클라우드가 가진 내재적 위험성을 고려해, 핵심 업무는 자체 관리하는 온프레미스(On-premise)방식으로 운영하고, 비핵심업무는 ‘퍼블릭’ 클라우드로 전환하는 ‘하이브리드’(Hybrid) 방식을 혼용하고 있다. 또한 금융회사들은 1개의 특정 기업에게만 위탁하지 않고 여러 클라우드 사업자들과 서비스 계약을 맺음으로써, 특정 클라우드 기업에게 끌려다니지 않으려는 ‘멀티(Multi)’ 클라우드 계약 방식이 현재까지는 일반적이다.   ◆복잡한 클라우드 서비스 체계, ‘제3자 리스크’ 대응 전략은? 그러나 이같은 촘촘한 안전장치 마저도 한편으론 또 다른 리스크가 된다는 점이 기업들에겐 골칫거리다. 다름아닌 ‘하이브리드 – 멀티’ 클라우드 방식이 가지는 ‘계약 관계의 복잡성’이 또 다른 위험이기 때문이다. 다양한 시스템들을 클라우드로 관리하고, 또 여기에 복수의 클라우드 서비스 기업들과 계약을 맺을 경우, 지금부터는 관리의 문제가 현안이 된다. 만약 '하이브리드-멀티' 방식의 클라우드를 적용했을때, 전산 사고가 발생하게되면 책임 소재를 따지는 것부터가 쉽지않은 것이 현실이다. 또한 책임 소재를 가리더라도 클라우드 기업으로부터 그 손해에 비례하는 충분한 배상 등 법적인 구제를 받아낼 수 있는 내부 역량도 부족하다.   이처럼 복잡해진 클라우드 계약과 서비스 체계로 인해 기업이 새롭게 직면한 위험요소가 바로 ‘제3자 리스크’이다. 과거 ‘토털 IT아웃소싱’ 방식으로, 단일 사업자에게 IT 운영을 위탁 운영했던 시절에는 크게 부각되지 않았던 사안들이다. 



◆금융권의 '제3자 리스크' 대응 사례… '클라우드 통합관리서비스' 전략 강화지난 2019년 1월부터 금융 클라우드가 사실상 전면 허용됐다. 이후, 금융 감독 당국은 이같은 ‘제3자 리스크’를 매우 중요한 위험 인자로 인식하고 금융권에 철저한 대응을 주문해왔다.이 때문에 실제로 올해 금융권에선 KB금융, 농협은행 등을 중심으로 ‘클라우드 서비스 통합 관리’ 역량을 강화하는 모습이 나타나고 있는데 이는 긍정적으로 평가된다.올해 KB금융그룹은 국민은행 등 전체 계열사들의 공동 클라우드 운용 플랫폼인 ‘KB 원(One) 클라우드’를 역점 사업으로 추진했다. 이와함께 기존 ‘퍼블릭 및 프라이빗’ 클라우드 관리체계를 보다 효율적으로 정비하기위해 올해 6월 이를 위한 사업자로 KB데이타시스템을 선정한 바 있다. ‘제3자 리스크’ 대응 차원이다. NH농협은행도 올해 6월 ‘NH퍼블릭 클라우드 표준사업자’를 선정해 이같은 제3차 리스크 대응에 나섰다. 농협은행의 경우, 업무의 중요도를 고려해 '중요 업무'와 '비중요 업무'로 구분하고 네이버클라우드와 AWS 2개 사업자가 중요업무 표준 클라우드 사업자로, 오라클은 나머지 업무를 수행하는 사업자로 각각 선정됐다.  이제 금융권 뿐만 아니라 다른 산업군에서도 이같은 ‘클라우드 통합관리서비스’ 를 강화하기위한 노력이 필요해졌다.  그동안 기업들은 클라우드의 혁신성만 강조해왔을뿐 상대적으로 그 위험성에 대한 지적은 적었던 것이 사실이다. 하지만 클라우드에 대한 의존도가 급격하게 커지고 있는 만큼 ‘클라우드 통합관리서비스’와 같은 새로운 대응을 동시에 강화해야할 시점이고, 사회적 공감대도 커져야 한다. 이번 KT 네트워크 장애 사태를 통해 반드시 우리가 얻어야할 교훈이다.",105,https://n.news.naver.com/mnews/article/138/0002112612?sid=103
"“새벽에 하기 싫어서 낮에 작업”…KT 장애, 총체적 ‘인재’였다(종합)",2021.10.29. 오후 5:18,"[디지털데일리 권하영 기자] 지난 25일 발생한 KT 유·무선 통신장애가 결국은 총체적 인재(人災)였던 것으로 드러났다. 라우팅 설정 입력어 과정에서 ‘exit’ 명령어를 누락한 단순 실수가 전국적인 재앙이 됐다. 정부와 KT는 재발 방지를 약속했지만, ‘소 잃고 외양간 고치기’라는 비난은 피할 수 없게 됐다.   더욱 문제인 것은 재발을 방지할 수 있는 제도조차 공백이라는 점이다. 이번 KT 장애 사고의 경우 전국적 규모의 피해가 예상됨에도 기업 측에 법적 책임을 물을 수 있는 근거가 없는 것으로 확인됐다. 현실에 맞지 않는 현행 약관 및 법상 피해보상 기준도 제대로 손을 봐야 한다는 지적이 나온다. 정부와 기업의 할 일이 태산이다.   ◆ “새벽에 하기 싫어서 낮에”…허술했던 KT 관리체계   29일 과학기술정보통신부(장관 임혜숙, 이하 과기정통부)는 지난 10월25일 발생한 KT 네트워크 장애 사고와 관련해 정보보호·네트워크 전문가들로 구성된 사고조사반(이하 조사반)과 함께 원인을 조사·분석한 결과를 발표했다.   결론적으로, 디도스 공격은 확인되지 않았다. 당초 KT는 사고 원인에 대해 디도스 공격으로 추정된다고 밝혔다가 이후 라우팅(경로설정) 오류로 정정한 바 있다.    사고 로그기록을 분석한 결과, 부산국사에서 통상 야간에 진행해야 할 기업 망 라우터 교체 작업을 주간에 진행하던 중 협력업체 작업자가 잘못된 설정 명령을 입력한 것으로 확인됐다. 라우팅 설정명령어 입력과정에서 ‘exit’ 명령어를 누락한 것이다. 이후 라우팅 오류로 인해 전국적인 네트워크 장애가 발생했다.   홍진배 과기정통부 정보보호네트워크정책관<사진>은 “낮에 작업을 진행한 것은 KT의 작업 원칙에도 맞지 않는 일이었지만, 작업자들과 관리자들이 원칙을 어기고 진행했다”면서 “사실 야간 작업을 좋아하는 사람은 없기 때문에, 주간 작업을 선호했던 듯 하다”고 밝혔다. 사실상 KT의 허술한 관리체계가 근본 원인이었던 셈이다.   애당초 중요관리시설을 협력업체에 맡긴 것도 문제로 지목된다. 이번 장애 진원지는 정부가 관리하는 A급의 중요 통신시설(부산)인 것으로 알려졌다. 교체 대상 라우터가 있던 곳은 C급 국사였지만, 이를 A급 시설에서 원격으로 작업하다 장애가 발생한 것. 중요관리시설의 경우 통신사가 직접 관리하도록 제도개선이 필요한 대목이다.   ◆ 전국적 피해규모에도…KT에 법적 책임 묻기 어렵다   이번 장애 사고와 관련해 KT 측에 법적 책임을 물을 수 있는 제도적 근거도 없는 상황이다. 홍진배 국장은 “이용자에게 고지를 제대로 하지 않거나 정해진 기준대로 보상을 하지 않거나 정부에 신고를 제때 하지 않았다면 제재가 가능하지만, 단순히 장애를 일으킨 데 대해서는 법적 제재 근거가 없다”고 설명했다.   현행 전기통신사업법 시행령상 KT와 같은 기간통신사업자의 경우 ▲통신국사 등 중요통신설비 장애로 인해 역무제공이 중단된 경우 지체 없이 ‘역무제공이 중단된 사실 및 그 원인’ ‘대응조치 현황’ ‘상담접수 연락처’ 등을 이용자에게 알려야 한다. 또한 ▲중요통신설비 이외의 기타 설비의 장애·오류 또는 트래픽 초과 등으로 역무제공이 2시간 이상 중단된 경우에도 위 사항을 고지해야 한다.   이번 사태는 ‘중요통신설비 장애’로 인한 것이므로 KT는 당시 현황을 이용자에게 ‘지체 없이’ 알려야 했다. KT는 그러나 오전 11시20분경부터 시작된 장애 사고에 대한 현황 고지를 오후 3시께 홈페이지를 통해서만 한 것으로 나타났다. 하지만 정부는 KT가 현행 규정상 의무는 다한 것으로 판단하고 있다. KT의 경우 다만 약관이나 현행법과 무관하게 피해 보상에 최선을 다하겠다고 밝힌 상황이다.



  통신사들의 약관상 장애발생 피해보상 기준도 강화해야 한다는 지적이 나온다. 현재 통신3사는 유선·5G 등 각 서비스별 약관에 ‘연속 3시간 이상 서비스를 제공받지 못하거나 월 누적 시간이 6시간을 초과할 경우’ 손해배상을 하도록 규정하고 있다. 이번 KT 통신장애는 약 85분이 경과한 끝에 복구됐기 때문에 약관상으로는 엄밀히 말해 보상 의무가 없는 셈이다.   ◆ 정부, ‘네트워크 안정성 확보방안’ 마련 착수   과기정통부는 이번 조사결과를 바탕으로, 주요통신사업자 네트워크의 생존성·기술적·구조적인 대책이 담긴 ‘네트워크 안정성 확보방안’을 마련할 계획이다.   단기 대책으로 ▲주요통신사업자의 네트워크 관리체계를 점검하고 ▲주요통신사업자가 네트워크 작업으로 인한 오류여부를 사전에 진단할 수 있는 시뮬레이션 시스템을 도입한다. 또 ▲주요통신사업자가 승인된 작업계획서의 내용·절차가 준수되는지에 대해 네트워크관제센터에서 기술적 점검 체계를 구축하고 ▲라우팅 설정오류로 인한 피해를 최소화하기 위해, 주요통신사업자가 라우팅 작업을 할 때 한 번에 업데이트되는 경로정보 개수를 일정 수준 이하로 제한하는 방안 등이 검토될 계획이다.   중장기 대책으로는, 주요통신사업자의 통신장애 대응 모니터링 체계 강화, 네트워크 안정성과 복원력을 높이는 기술개발, 안정적인 망 구조 등 네트워크의 생존성 확보를 위한 구조적 대책 마련 등도 추진할 예정이다.   KT는 이용자 피해현황 조사 및 피해구제 방안 마련을 추진한다. 방통위는 이용자 피해구제 방안 이행여부를 점검하는 한편, 통신장애 발생시 실효성 있는 피해구제를 위한 법령 및 이용약관 등 개선방안 마련을 검토할 계획이다.",105,https://n.news.naver.com/mnews/article/138/0002112592?sid=103
"'재수 장관' 유인촌, 지방 다니며 현장 행보 본격화",2023.10.21. 오전 8:02,"20일 ACC서 '옛 전남도청 복원지킴이' 만나남원 국립민속국악원 방문해 추모""지자체 문화 사업 컨설팅까지 섬세하게""



12년만에 문화체육관광부로 다시 돌아온 유인촌 문체부 장관이 지방 현장을 연달아 다니며 본격적인 현안 챙기기에 나섰다. 장관 취임 후 처음으로 광주, 남원 등 지역 공공·소속기관을 찾아 이전 재임(2008~2011년) 시절 추진한 사업의 경과를 직접 점검했다. 유 장관은 지난 20일 광주 광산동 국립아시아문화전당(ACC)을 방문했다. ACC는 광주를 문화 수도로 만들겠다는 고(故) 노무현 전 대통령 공약 사업으로 추진됐다. 옛 전남도청 부지에 조성돼 지상에는 옛 도청 건물을 복원하고, 지하에 공연장 및 전시장 등을 조성하는 사업이다. 앞서 2008년 유 장관 재임 시절 첫 삽을 떠 공연장과 전시장 등은 2015년 개관했다. 유 장관은 이곳 첫 일정으로 '옛 전남도청 복원지킴이 어머니' 11명을 만났다. 복원지킴이 어머니는 5·18민주화운동 당시 희생자와 부상자들의 가족으로 이뤄져 최후 항쟁지인 옛 전남도청의 원형복원을 추진하는 단체다.



 이 단체 소속 추혜성 씨는 이날 유 장관과의 간담회에서 ""과거 유 장관 재임 시절 도청 별관을 지키기 위해 농성을 했을 때 장관이 직접 다가와 이야기를 들어준 기억이 있어 고마움을 느끼고 있다""며 ""복원 사업을 잘 마무리할 수 있도록 끝까지 관심을 가져주길 바란다""고 말했다. 이에 유 장관은 ""10여년 전에 만났는데도 어머니들의 얼굴을 보니 다 기억이 난다""며 ""복원 사업이 실수 없이 잘 마무리되고 그 안에 5·18의 역사가 잘 남겨질 수 있도록 지속적으로 관심을 갖겠다""고 답했다. 이어 유 장관은 ACC 문화정보원, 문화창조원, 예술극장, 아시아문화광장, 창·제작 스튜디오 등 ACC 주요 시설을 살펴보고, 복합전시 6관에서 열리고 있는 '일상첨화' 전시를 관람했다. 이날 ACC에는 강기정 광주시장도 방문했다.



 유 장관은 이날 광주 방문에 앞서 전북 남원에 있는 국립민속국악원도 찾았다. 앞서 2010년 남아공·나이지리아·튀르키예·이집트에서 열린 한국문화페스티벌 공연에 참여한 뒤 말라리아로 사망한 고(故) 김수연·고은주 무용단원을 추모하기 위해서다. 당시 문체부 장관으로 재직 중이던 유 장관은 국립국악원장(葬)으로 치러진 순직 단원 영결식에 참석해 고인에게 대통령 표창을 추서한 바 있다. 유 장관은 당시 재발 방지를 위해 '공무국외출장 관련 위기관리 요령'을 마련해 소속기관 및 산하 공공기관에 배포했다. 국립민속국악원은 유가족과 협의해 국악전시관 내에 추모공간을 설치·운영 중이다. 13년만에 이곳을 찾은 유 장관은 ""두 사람을 기억하고 기릴 수 있는 공간이 이곳에 있어 의미 있게 생각한다""며 ""앞으로 단원 여러분께서는 해외 공연 시 더욱 안전에 유의하고, 지역 공연을 확대해 국내외에 우리 문화 가치와 매력을 알리는 데 힘써주길 바란다""고 강조했다.



 한편 유 장관은 현장에서 기자들과 만나 ""지역은 지속적으로 다닐 것""이라며 ""과거에는 지자체 문화 사업을 중앙에서 보조금을 주는 형식으로 지원하고 나머지는 자율에 맡겼다면, 이번 임기 동안에는 컨설팅을 하는 등 (지역균형발전을 위해) 과정과 결과까지 좀더 섬세하게 챙길 계획""이라고 밝혔다.",105,https://n.news.naver.com/mnews/article/015/0004904947?sid=103
"권리자·OTT, 음악사용료 유권해석안에 부정적",2021.10.29. 오후 7:02,"ⓒ게티이미지뱅크문화체육관광부가 음악사용료 갈등 해소를 위한 유권해석 권고안을 들고 권리자단체, 온라인동영상서비스(OTT) 업계와 논의를 시작했다. 유권해석은 문체부가 꺼내들 수 있는 사실상의 마지막 카드지만 양측은 이마저도 부정적인 입장이어서 진통이 예상된다.문체부에 따르면 OTT 상생협의체 공익위원(고정민 홍익대 교수, 황승흠 국민대 교수)이 '음악저작물 사용료 징수규정'에 대한 유권해석 권고안을 내놓았다. 문체부는 지난 10월 22일 이를 각 권리자단체와 OTT 업체에 전달하고 29일 양측을 만나 협의했다. 이보다 앞서 세 차례 열린 OTT 상생협의체에서는 음악 사용료 정산에 필요한 매출액과 가입자 수에 대한 새로운 해석, 영화 제작 등 사전 단계에서 저작권료를 지불한 '권리처리' 이슈가 집중 논의됐다.공익위원은 양측이 주장한 의견을 바탕으로 △매출액 △가입자 수 △권리처리 △과거 사용료 정산 △전송+실시간을 비롯한 혼합서비스 등 5개 분야에 대한 유권해석 권고안을 도출했다. 매출의 경우 인앱결제 수수료는 제외하고 산정하며, 매출·가입자에 따라 산출된 사용료에 20% 이상 차이가 발생할 경우 양측이 협의해서 정산할 필요가 있다는 해석이 나왔다. 매출과 가입자 가운데 더 많은 수익이 발생하는 쪽을 택한다는 현 규정에 조건을 단 것이다.권리처리에 대해서는 관련 전송권에 대한 권리처리가 된 경우 해당 음악 사용을 제외하고 사용료를 산정해야 한다고 판단했다. 단 영화의 경우 전송에 대한 권리처리가 완료됐다고 보기 어려우며, 음악 저작물 이용을 명시적으로 약정한 경우 권리처리가 완료된 것으로 간주할 수 있다고 해석했다. 김현준 문체부 저작권산업과장은 31일 “유권해석이어서 기존 징수규정의 틀을 벗어나긴 어려웠다”면서 “매출액 등 기존 해석이 불분명했던 것에 대해 최대한 합리적 제안을 담았다”고 설명했다.권리자단체와 OTT 업계는 모두 부정적 입장을 보였다. 한국음악저작권협회는 이미 지난해 말 개정 승인된 징수규정 자체가 OTT 업계 입장이 많이 반영됐는데 권리자들이 또다시 양보하기는 어렵다는 입장이다.박수호 음저협 팀장은 “이번에 나온 유권해석 권고안에는 신탁단체들이 현재 전송 서비스(OTT)와 정산 중심 업무 흐름이나 용어의 정의들과도 배치되는 부분이 많다”며 수용이 어렵다고 말했다. OTT 업계는 유권해석이 음저협 징수규정에 국한됐다고 지적했다. 음저협 징수규정상 OTT 관련 조항 개정이 불합리하다는 문제 제기가 여러 차례 이뤄진 만큼 건설적 대안이 필요하다는 입장이다.문체부는 유권 해석안을 한국저작권위원회로 넘겨 약 2개월 동안 심의를 받는다. 심의 기간에도 권리자단체와 OTT 업계의 의견 수렴이 이어진다. 올해 안에 유권해석을 채택해서 음악저작물 사용료 징수규정에 반영하는 게 목표다. 양측이 이를 수용하면 현재 진행되고 있는 문체부-OTT 업체 간 소송도 마무리될 수 있다. 받아들이지 않는다면 문체부로서도 유권해석을 강제하기는 어려울 것으로 전망된다. 결국 1~2년 동안 법정 공방을 지켜봐야 할 수도 있다.〈표〉최근 OTT 음악 저작권료 갈등 일지",105,https://n.news.naver.com/mnews/article/030/0002978563?sid=103
"`exit` 명령어 빠뜨려 전국망 마비…KT ""프로세스 강화할 것""",2021.10.29. 오후 8:40,"서울 종로구 KT 광화문 사옥 모습. 연합뉴스    KT가 지난 25일 전국적으로 발생한 유·무선 통신 장애에 대해 ""앞으로 이런 사례가 재발되지 않도록 프로세스를 강화하겠다""고 밝혔다. KT는 29일 입장 자료를 내고 ""다시 한번 장애로 불편을 드린 점 머리 숙여 사과 드린다""며 이 같이 밝혔다. 앞서 과학기술정보통신부는 KT 네트워크 통신 장애와 관련, 원인을 분석한 결과를 밝혔다. 이에 따르면, 부산 국사 협력업체 작업자가 라우터(네트워크 경로설정 장비)의 프로토콜 명령어를 마무리하면서 'exit' 명령어를 빠뜨린 것으로 조사됐다. 이후 라우팅 오류로 전국적 네트워크 장애가 발생했다.   KT는 이에 대해 ""일반적으로 KT 네트워크 장비와 관련된 작업은 야간에 진행하는 것이 원칙이며, 작업계획서를 제출 및 승인 이후 KT직원의 입회 하에 진행된다""며 ""이번 장애의 경우 야간작업으로 승인을 받았음에도 불구하고 이를 위반해 주간에 작업이 이뤄졌으며 KT 직원도 이를 양해하고 관리 감독을 소홀히 했다""고 인정했다. KT 측은 ""일탈이 이뤄진 예외적인 사례이며 앞으로 이런 사례가 재발되지 않도록 프로세스를 강화하겠다""고 밝혔다. 재발방지책으로 제시한 테스트베드 운영과 관련해서는 ""현재 우면동 KT 연구개발센터에서 테스트베드를 운영하고 있으며, 해당 테스트베드는 실제 환경과 동일하게 적용된 모델실로, 연동 사전에 네트워크 작업의 안정성을 확인할 수 있는 기능을 가지고 있다""며 ""해당 테스트베드는 현장까지 확산되지 않았으나, 이번 일을 계기로 전국단위로 적용해 이와 같은 장애가 재발하지 않도록 만전을 다하겠다""고 강조했다. 라우팅 오류 확산 방지와 관련해 전국적 장애를 야기한 엣지망 단위 라우팅 오류도 국지적으로 차단할 수 있도록 엣지망에도 적용하겠다는 방침이다.KT는 재발방지대책을 면밀히 수립하고, 피해보상방안도 최종 결정되는 대로 발표할 예정이다.",105,https://n.news.naver.com/mnews/article/029/0002703529?sid=103
